A1: 8/1/2022 Huntington, West Virginia
C2: General Effect | F2: Visual | J2: Music
C3: 1 | D3: 2 | F3: Proficiency | G3: Analysis | H3: Color Guard | J3: Brass | K3: Analysis | L3: Percussion | N3: Sub | P3: Total
C4: J. Howell | D4: G. Miller | E4: Total | F4: M. Tarr | G4: B. Mascaro | H4: H. Nguyen | I4: Total ÷2 | J4: R. Greenwell | K4: D. Carbone | L4: J. Brooks | M4: Total ÷2 | N4: Total | O4: Pen | P4: Score
A5: DCI World Class | C5: 20 | D5: 20 | E5: 40 | F5: 20 | G5: 20 | H5: 20 | I5: 30 | J5: 20 | K5: 20 | L5: 20 | M5: 30 | N5: 100 | P5: 100
A6: Phantom | B6: 4 | C6: 17.80 | D6: 17.60 | E6: 35.40 | F6: 17.70 | G6: 17.50 | H6: 17.00 | I6: 26.10 | J6: 17.80 | K6: 17.20 | L6: 16.40 | M6: 25.70 | N6: 87.20 | O6: 0.0 | P6: 87.20
A7: Regiment | C7: =RANK(C6,(C$6,C$8,C$10,C$12,C$15,C$17,C$19,C$21,C$23,C$25,C$27,C$29,C$31,C$33,C$35,C$37,C$39,C$41,C$43,C$45,C$47,C$49,C$51,C$53,C$55,C$57,C$59,C$61,C$63,C$65,C$67,C$69,C$71,C$73,C$75,C$77,C$79,C$81,C$83,C$85,C$87,C$89,C$91,C$93,C$95,C$97,C$99,C$101,C$103,C$105,C$107,C$109,C$111,C$113,C$115,C$117,C$119,C$121,C$123,C$125)) -> 5 | D7: =RANK(D6,(D$6,D$8,D$10,D$12,D$15,D$17,D$19,D$21,D$23,D$25,D$27,D$29,D$31,D$33,D$35,D$37,D$39,D$41,D$43,D$45,D$47,D$49,D$51,D$53,D$55,D$57,D$59,D$61,D$63,D$65,D$67,D$69,D$71,D$73,D$75,D$77,D$79,D$81,D$83,D$85,D$87,D$89,D$91,D$93,D$95,D$97,D$99,D$101,D$103,D$105,D$107,D$109,D$111,D$113,D$115,D$117,D$119,D$121,D$123,D$125)) -> 5 | E7: =RANK(E6,(E$6,E$8,E$10,E$12,E$15,E$17,E$19,E$21,E$23,E$25,E$27,E$29,E$31,E$33,E$35,E$37,E$39,E$41,E$43,E$45,E$47,E$49,E$51,E$53,E$55,E$57,E$59,E$61,E$63,E$65,E$67,E$69,E$71,E$73,E$75,E$77,E$79,E$81,E$83,E$85,E$87,E$89,E$91,E$93,E$95,E$97,E$99,E$101,E$103,E$105,E$107,E$109,E$111,E$113,E$115,E$117,E$119,E$121,E$123,E$125)) -> 5 | F7: =RANK(F6,(F$6,F$8,F$10,F$12,F$15,F$17,F$19,F$21,F$23,F$25,F$27,F$29,F$31,F$33,F$35,F$37,F$39,F$41,F$43,F$45,F$47,F$49,F$51,F$53,F$55,F$57,F$59,F$61,F$63,F$65,F$67,F$69,F$71,F$73,F$75,F$77,F$79,F$81,F$83,F$85,F$87,F$89,F$91,F$93,F$95,F$97,F$99,F$101,F$103,F$105,F$107,F$109,F$111,F$113,F$115,F$117,F$119,F$121,F$123,F$125)) -> 5 | G7: =RANK(G6,(G$6,G$8,G$10,G$12,G$15,G$17,G$19,G$21,G$23,G$25,G$27,G$29,G$31,G$33,G$35,G$37,G$39,G$41,G$43,G$45,G$47,G$49,G$51,G$53,G$55,G$57,G$59,G$61,G$63,G$65,G$67,G$69,G$71,G$73,G$75,G$77,G$79,G$81,G$83,G$85,G$87,G$89,G$91,G$93,G$95,G$97,G$99,G$101,G$103,G$105,G$107,G$109,G$111,G$113,G$115,G$117,G$119,G$121,G$123,G$125)) -> 5 | H7: =RANK(H6,(H$6,H$8,H$10,H$12,H$15,H$17,H$19,H$21,H$23,H$25,H$27,H$29,H$31,H$33,H$35,H$37,H$39,H$41,H$43,H$45,H$47,H$49,H$51,H$53,H$55,H$57,H$59,H$61,H$63,H$65,H$67,H$69,H$71,H$73,H$75,H$77,H$79,H$81,H$83,H$85,H$87,H$89,H$91,H$93,H$95,H$97,H$99,H$101,H$103,H$105,H$107,H$109,H$111,H$113,H$115,H$117,H$119,H$121,H$123,H$125)) -> 5 | I7: =RANK(I6,(I$6,I$8,I$10,I$12,I$15,I$17,I$19,I$21,I$23,I$25,I$27,I$29,I$31,I$33,I$35,I$37,I$39,I$41,I$43,I$45,I$47,I$49,I$51,I$53,I$55,I$57,I$59,I$61,I$63,I$65,I$67,I$69,I$71,I$73,I$75,I$77,I$79,I$81,I$83,I$85,I$87,I$89,I$91,I$93,I$95,I$97,I$99,I$101,I$103,I$105,I$107,I$109,I$111,I$113,I$115,I$117,I$119,I$121,I$123,I$125)) -> 5 | J7: =RANK(J6,(J$6,J$8,J$10,J$12,J$15,J$17,J$19,J$21,J$23,J$25,J$27,J$29,J$31,J$33,J$35,J$37,J$39,J$41,J$43,J$45,J$47,J$49,J$51,J$53,J$55,J$57,J$59,J$61,J$63,J$65,J$67,J$69,J$71,J$73,J$75,J$77,J$79,J$81,J$83,J$85,J$87,J$89,J$91,J$93,J$95,J$97,J$99,J$101,J$103,J$105,J$107,J$109,J$111,J$113,J$115,J$117,J$119,J$121,J$123,J$125)) -> 5 | K7: =RANK(K6,(K$6,K$8,K$10,K$12,K$15,K$17,K$19,K$21,K$23,K$25,K$27,K$29,K$31,K$33,K$35,K$37,K$39,K$41,K$43,K$45,K$47,K$49,K$51,K$53,K$55,K$57,K$59,K$61,K$63,K$65,K$67,K$69,K$71,K$73,K$75,K$77,K$79,K$81,K$83,K$85,K$87,K$89,K$91,K$93,K$95,K$97,K$99,K$101,K$103,K$105,K$107,K$109,K$111,K$113,K$115,K$117,K$119,K$121,K$123,K$125)) -> 5 | L7: =RANK(L6,(L$6,L$8,L$10,L$12,L$15,L$17,L$19,L$21,L$23,L$25,L$27,L$29,L$31,L$33,L$35,L$37,L$39,L$41,L$43,L$45,L$47,L$49,L$51,L$53,L$55,L$57,L$59,L$61,L$63,L$65,L$67,L$69,L$71,L$73,L$75,L$77,L$79,L$81,L$83,L$85,L$87,L$89,L$91,L$93,L$95,L$97,L$99,L$101,L$103,L$105,L$107,L$109,L$111,L$113,L$115,L$117,L$119,L$121,L$123,L$125)) -> 9 | M7: =RANK(M6,(M$6,M$8,M$10,M$12,M$15,M$17,M$19,M$21,M$23,M$25,M$27,M$29,M$31,M$33,M$35,M$37,M$39,M$41,M$43,M$45,M$47,M$49,M$51,M$53,M$55,M$57,M$59,M$61,M$63,M$65,M$67,M$69,M$71,M$73,M$75,M$77,M$79,M$81,M$83,M$85,M$87,M$89,M$91,M$93,M$95,M$97,M$99,M$101,M$103,M$105,M$107,M$109,M$111,M$113,M$115,M$117,M$119,M$121,M$123,M$125)) -> 5 | N7: =RANK(N6,(N$6,N$8,N$10,N$12,N$15,N$17,N$19,N$21,N$23,N$25,N$27,N$29,N$31,N$33,N$35,N$37,N$39,N$41,N$43,N$45,N$47,N$49,N$51,N$53,N$55,N$57,N$59,N$61,N$63,N$65,N$67,N$69,N$71,N$73,N$75,N$77,N$79,N$81,N$83,N$85,N$87,N$89,N$91,N$93,N$95,N$97,N$99,N$101,N$103,N$105,N$107,N$109,N$111,N$113,N$115,N$117,N$119,N$121,N$123,N$125)) -> 5 | P7: =RANK(P6,(P$6,P$8,P$10,P$12,P$15,P$17,P$19,P$21,P$23,P$25,P$27,P$29,P$31,P$33,P$35,P$37,P$39,P$41,P$43,P$45,P$47,P$49,P$51,P$53,P$55,P$57,P$59,P$61,P$63,P$65,P$67,P$69,P$71,P$73,P$75,P$77,P$79,P$81,P$83,P$85,P$87,P$89,P$91,P$93,P$95,P$97,P$99,P$101,P$103,P$105,P$107,P$109,P$111,P$113,P$115,P$117,P$119,P$121,P$123,P$125)) -> 5
A8: Colts | B8: 3 | C8: 17.00 | D8: 17.40 | E8: 34.40 | F8: 17.10 | G8: 16.70 | H8: 16.80 | I8: 25.30 | J8: 17.10 | K8: 16.70 | L8: 17.10 | M8: 25.45 | N8: 85.15 | O8: 0.0 | P8: 85.15
C9: =RANK(C8,(C$6,C$8,C$10,C$12,C$15,C$17,C$19,C$21,C$23,C$25,C$27,C$29,C$31,C$33,C$35,C$37,C$39,C$41,C$43,C$45,C$47,C$49,C$51,C$53,C$55,C$57,C$59,C$61,C$63,C$65,C$67,C$69,C$71,C$73,C$75,C$77,C$79,C$81,C$83,C$85,C$87,C$89,C$91,C$93,C$95,C$97,C$99,C$101,C$103,C$105,C$107,C$109,C$111,C$113,C$115,C$117,C$119,C$121,C$123,C$125)) -> 6 | D9: =RANK(D8,(D$6,D$8,D$10,D$12,D$15,D$17,D$19,D$21,D$23,D$25,D$27,D$29,D$31,D$33,D$35,D$37,D$39,D$41,D$43,D$45,D$47,D$49,D$51,D$53,D$55,D$57,D$59,D$61,D$63,D$65,D$67,D$69,D$71,D$73,D$75,D$77,D$79,D$81,D$83,D$85,D$87,D$89,D$91,D$93,D$95,D$97,D$99,D$101,D$103,D$105,D$107,D$109,D$111,D$113,D$115,D$117,D$119,D$121,D$123,D$125)) -> 6 | E9: =RANK(E8,(E$6,E$8,E$10,E$12,E$15,E$17,E$19,E$21,E$23,E$25,E$27,E$29,E$31,E$33,E$35,E$37,E$39,E$41,E$43,E$45,E$47,E$49,E$51,E$53,E$55,E$57,E$59,E$61,E$63,E$65,E$67,E$69,E$71,E$73,E$75,E$77,E$79,E$81,E$83,E$85,E$87,E$89,E$91,E$93,E$95,E$97,E$99,E$101,E$103,E$105,E$107,E$109,E$111,E$113,E$115,E$117,E$119,E$121,E$123,E$125)) -> 6 | F9: =RANK(F8,(F$6,F$8,F$10,F$12,F$15,F$17,F$19,F$21,F$23,F$25,F$27,F$29,F$31,F$33,F$35,F$37,F$39,F$41,F$43,F$45,F$47,F$49,F$51,F$53,F$55,F$57,F$59,F$61,F$63,F$65,F$67,F$69,F$71,F$73,F$75,F$77,F$79,F$81,F$83,F$85,F$87,F$89,F$91,F$93,F$95,F$97,F$99,F$101,F$103,F$105,F$107,F$109,F$111,F$113,F$115,F$117,F$119,F$121,F$123,F$125)) -> 7 | G9: =RANK(G8,(G$6,G$8,G$10,G$12,G$15,G$17,G$19,G$21,G$23,G$25,G$27,G$29,G$31,G$33,G$35,G$37,G$39,G$41,G$43,G$45,G$47,G$49,G$51,G$53,G$55,G$57,G$59,G$61,G$63,G$65,G$67,G$69,G$71,G$73,G$75,G$77,G$79,G$81,G$83,G$85,G$87,G$89,G$91,G$93,G$95,G$97,G$99,G$101,G$103,G$105,G$107,G$109,G$111,G$113,G$115,G$117,G$119,G$121,G$123,G$125)) -> 6 | H9: =RANK(H8,(H$6,H$8,H$10,H$12,H$15,H$17,H$19,H$21,H$23,H$25,H$27,H$29,H$31,H$33,H$35,H$37,H$39,H$41,H$43,H$45,H$47,H$49,H$51,H$53,H$55,H$57,H$59,H$61,H$63,H$65,H$67,H$69,H$71,H$73,H$75,H$77,H$79,H$81,H$83,H$85,H$87,H$89,H$91,H$93,H$95,H$97,H$99,H$101,H$103,H$105,H$107,H$109,H$111,H$113,H$115,H$117,H$119,H$121,H$123,H$125)) -> 6 | I9: =RANK(I8,(I$6,I$8,I$10,I$12,I$15,I$17,I$19,I$21,I$23,I$25,I$27,I$29,I$31,I$33,I$35,I$37,I$39,I$41,I$43,I$45,I$47,I$49,I$51,I$53,I$55,I$57,I$59,I$61,I$63,I$65,I$67,I$69,I$71,I$73,I$75,I$77,I$79,I$81,I$83,I$85,I$87,I$89,I$91,I$93,I$95,I$97,I$99,I$101,I$103,I$105,I$107,I$109,I$111,I$113,I$115,I$117,I$119,I$121,I$123,I$125)) -> 6 | J9: =RANK(J8,(J$6,J$8,J$10,J$12,J$15,J$17,J$19,J$21,J$23,J$25,J$27,J$29,J$31,J$33,J$35,J$37,J$39,J$41,J$43,J$45,J$47,J$49,J$51,J$53,J$55,J$57,J$59,J$61,J$63,J$65,J$67,J$69,J$71,J$73,J$75,J$77,J$79,J$81,J$83,J$85,J$87,J$89,J$91,J$93,J$95,J$97,J$99,J$101,J$103,J$105,J$107,J$109,J$111,J$113,J$115,J$117,J$119,J$121,J$123,J$125)) -> 6 | K9: =RANK(K8,(K$6,K$8,K$10,K$12,K$15,K$17,K$19,K$21,K$23,K$25,K$27,K$29,K$31,K$33,K$35,K$37,K$39,K$41,K$43,K$45,K$47,K$49,K$51,K$53,K$55,K$57,K$59,K$61,K$63,K$65,K$67,K$69,K$71,K$73,K$75,K$77,K$79,K$81,K$83,K$85,K$87,K$89,K$91,K$93,K$95,K$97,K$99,K$101,K$103,K$105,K$107,K$109,K$111,K$113,K$115,K$117,K$119,K$121,K$123,K$125)) -> 6 | L9: =RANK(L8,(L$6,L$8,L$10,L$12,L$15,L$17,L$19,L$21,L$23,L$25,L$27,L$29,L$31,L$33,L$35,L$37,L$39,L$41,L$43,L$45,L$47,L$49,L$51,L$53,L$55,L$57,L$59,L$61,L$63,L$65,L$67,L$69,L$71,L$73,L$75,L$77,L$79,L$81,L$83,L$85,L$87,L$89,L$91,L$93,L$95,L$97,L$99,L$101,L$103,L$105,L$107,L$109,L$111,L$113,L$115,L$117,L$119,L$121,L$123,L$125)) -> 6 | M9: =RANK(M8,(M$6,M$8,M$10,M$12,M$15,M$17,M$19,M$21,M$23,M$25,M$27,M$29,M$31,M$33,M$35,M$37,M$39,M$41,M$43,M$45,M$47,M$49,M$51,M$53,M$55,M$57,M$59,M$61,M$63,M$65,M$67,M$69,M$71,M$73,M$75,M$77,M$79,M$81,M$83,M$85,M$87,M$89,M$91,M$93,M$95,M$97,M$99,M$101,M$103,M$105,M$107,M$109,M$111,M$113,M$115,M$117,M$119,M$121,M$123,M$125)) -> 6 | N9: =RANK(N8,(N$6,N$8,N$10,N$12,N$15,N$17,N$19,N$21,N$23,N$25,N$27,N$29,N$31,N$33,N$35,N$37,N$39,N$41,N$43,N$45,N$47,N$49,N$51,N$53,N$55,N$57,N$59,N$61,N$63,N$65,N$67,N$69,N$71,N$73,N$75,N$77,N$79,N$81,N$83,N$85,N$87,N$89,N$91,N$93,N$95,N$97,N$99,N$101,N$103,N$105,N$107,N$109,N$111,N$113,N$115,N$117,N$119,N$121,N$123,N$125)) -> 6 | P9: =RANK(P8,(P$6,P$8,P$10,P$12,P$15,P$17,P$19,P$21,P$23,P$25,P$27,P$29,P$31,P$33,P$35,P$37,P$39,P$41,P$43,P$45,P$47,P$49,P$51,P$53,P$55,P$57,P$59,P$61,P$63,P$65,P$67,P$69,P$71,P$73,P$75,P$77,P$79,P$81,P$83,P$85,P$87,P$89,P$91,P$93,P$95,P$97,P$99,P$101,P$103,P$105,P$107,P$109,P$111,P$113,P$115,P$117,P$119,P$121,P$123,P$125)) -> 6
A10: Blue | B10: 2 | C10: 16.60 | D10: 16.60 | E10: 33.20 | F10: 16.50 | G10: 16.60 | H10: 16.10 | I10: 24.60 | J10: 16.40 | K10: 16.60 | L10: 16.60 | M10: 24.80 | N10: 82.60 | O10: 0.0 | P10: 82.60
A11: Knights | C11: =RANK(C10,(C$6,C$8,C$10,C$12,C$15,C$17,C$19,C$21,C$23,C$25,C$27,C$29,C$31,C$33,C$35,C$37,C$39,C$41,C$43,C$45,C$47,C$49,C$51,C$53,C$55,C$57,C$59,C$61,C$63,C$65,C$67,C$69,C$71,C$73,C$75,C$77,C$79,C$81,C$83,C$85,C$87,C$89,C$91,C$93,C$95,C$97,C$99,C$101,C$103,C$105,C$107,C$109,C$111,C$113,C$115,C$117,C$119,C$121,C$123,C$125)) -> 7 | D11: =RANK(D10,(D$6,D$8,D$10,D$12,D$15,D$17,D$19,D$21,D$23,D$25,D$27,D$29,D$31,D$33,D$35,D$37,D$39,D$41,D$43,D$45,D$47,D$49,D$51,D$53,D$55,D$57,D$59,D$61,D$63,D$65,D$67,D$69,D$71,D$73,D$75,D$77,D$79,D$81,D$83,D$85,D$87,D$89,D$91,D$93,D$95,D$97,D$99,D$101,D$103,D$105,D$107,D$109,D$111,D$113,D$115,D$117,D$119,D$121,D$123,D$125)) -> 8 | E11: =RANK(E10,(E$6,E$8,E$10,E$12,E$15,E$17,E$19,E$21,E$23,E$25,E$27,E$29,E$31,E$33,E$35,E$37,E$39,E$41,E$43,E$45,E$47,E$49,E$51,E$53,E$55,E$57,E$59,E$61,E$63,E$65,E$67,E$69,E$71,E$73,E$75,E$77,E$79,E$81,E$83,E$85,E$87,E$89,E$91,E$93,E$95,E$97,E$99,E$101,E$103,E$105,E$107,E$109,E$111,E$113,E$115,E$117,E$119,E$121,E$123,E$125)) -> 7 | F11: =RANK(F10,(F$6,F$8,F$10,F$12,F$15,F$17,F$19,F$21,F$23,F$25,F$27,F$29,F$31,F$33,F$35,F$37,F$39,F$41,F$43,F$45,F$47,F$49,F$51,F$53,F$55,F$57,F$59,F$61,F$63,F$65,F$67,F$69,F$71,F$73,F$75,F$77,F$79,F$81,F$83,F$85,F$87,F$89,F$91,F$93,F$95,F$97,F$99,F$101,F$103,F$105,F$107,F$109,F$111,F$113,F$115,F$117,F$119,F$121,F$123,F$125)) -> 8 | G11: =RANK(G10,(G$6,G$8,G$10,G$12,G$15,G$17,G$19,G$21,G$23,G$25,G$27,G$29,G$31,G$33,G$35,G$37,G$39,G$41,G$43,G$45,G$47,G$49,G$51,G$53,G$55,G$57,G$59,G$61,G$63,G$65,G$67,G$69,G$71,G$73,G$75,G$77,G$79,G$81,G$83,G$85,G$87,G$89,G$91,G$93,G$95,G$97,G$99,G$101,G$103,G$105,G$107,G$109,G$111,G$113,G$115,G$117,G$119,G$121,G$123,G$125)) -> 8 | H11: =RANK(H10,(H$6,H$8,H$10,H$12,H$15,H$17,H$19,H$21,H$23,H$25,H$27,H$29,H$31,H$33,H$35,H$37,H$39,H$41,H$43,H$45,H$47,H$49,H$51,H$53,H$55,H$57,H$59,H$61,H$63,H$65,H$67,H$69,H$71,H$73,H$75,H$77,H$79,H$81,H$83,H$85,H$87,H$89,H$91,H$93,H$95,H$97,H$99,H$101,H$103,H$105,H$107,H$109,H$111,H$113,H$115,H$117,H$119,H$121,H$123,H$125)) -> 8 | I11: =RANK(I10,(I$6,I$8,I$10,I$12,I$15,I$17,I$19,I$21,I$23,I$25,I$27,I$29,I$31,I$33,I$35,I$37,I$39,I$41,I$43,I$45,I$47,I$49,I$51,I$53,I$55,I$57,I$59,I$61,I$63,I$65,I$67,I$69,I$71,I$73,I$75,I$77,I$79,I$81,I$83,I$85,I$87,I$89,I$91,I$93,I$95,I$97,I$99,I$101,I$103,I$105,I$107,I$109,I$111,I$113,I$115,I$117,I$119,I$121,I$123,I$125)) -> 8 | J11: =RANK(J10,(J$6,J$8,J$10,J$12,J$15,J$17,J$19,J$21,J$23,J$25,J$27,J$29,J$31,J$33,J$35,J$37,J$39,J$41,J$43,J$45,J$47,J$49,J$51,J$53,J$55,J$57,J$59,J$61,J$63,J$65,J$67,J$69,J$71,J$73,J$75,J$77,J$79,J$81,J$83,J$85,J$87,J$89,J$91,J$93,J$95,J$97,J$99,J$101,J$103,J$105,J$107,J$109,J$111,J$113,J$115,J$117,J$119,J$121,J$123,J$125)) -> 7 | K11: =RANK(K10,(K$6,K$8,K$10,K$12,K$15,K$17,K$19,K$21,K$23,K$25,K$27,K$29,K$31,K$33,K$35,K$37,K$39,K$41,K$43,K$45,K$47,K$49,K$51,K$53,K$55,K$57,K$59,K$61,K$63,K$65,K$67,K$69,K$71,K$73,K$75,K$77,K$79,K$81,K$83,K$85,K$87,K$89,K$91,K$93,K$95,K$97,K$99,K$101,K$103,K$105,K$107,K$109,K$111,K$113,K$115,K$117,K$119,K$121,K$123,K$125)) -> 7 | L11: =RANK(L10,(L$6,L$8,L$10,L$12,L$15,L$17,L$19,L$21,L$23,L$25,L$27,L$29,L$31,L$33,L$35,L$37,L$39,L$41,L$43,L$45,L$47,L$49,L$51,L$53,L$55,L$57,L$59,L$61,L$63,L$65,L$67,L$69,L$71,L$73,L$75,L$77,L$79,L$81,L$83,L$85,L$87,L$89,L$91,L$93,L$95,L$97,L$99,L$101,L$103,L$105,L$107,L$109,L$111,L$113,L$115,L$117,L$119,L$121,L$123,L$125)) -> 8 | M11: =RANK(M10,(M$6,M$8,M$10,M$12,M$15,M$17,M$19,M$21,M$23,M$25,M$27,M$29,M$31,M$33,M$35,M$37,M$39,M$41,M$43,M$45,M$47,M$49,M$51,M$53,M$55,M$57,M$59,M$61,M$63,M$65,M$67,M$69,M$71,M$73,M$75,M$77,M$79,M$81,M$83,M$85,M$87,M$89,M$91,M$93,M$95,M$97,M$99,M$101,M$103,M$105,M$107,M$109,M$111,M$113,M$115,M$117,M$119,M$121,M$123,M$125)) -> 8 | N11: =RANK(N10,(N$6,N$8,N$10,N$12,N$15,N$17,N$19,N$21,N$23,N$25,N$27,N$29,N$31,N$33,N$35,N$37,N$39,N$41,N$43,N$45,N$47,N$49,N$51,N$53,N$55,N$57,N$59,N$61,N$63,N$65,N$67,N$69,N$71,N$73,N$75,N$77,N$79,N$81,N$83,N$85,N$87,N$89,N$91,N$93,N$95,N$97,N$99,N$101,N$103,N$105,N$107,N$109,N$111,N$113,N$115,N$117,N$119,N$121,N$123,N$125)) -> 8 | P11: =RANK(P10,(P$6,P$8,P$10,P$12,P$15,P$17,P$19,P$21,P$23,P$25,P$27,P$29,P$31,P$33,P$35,P$37,P$39,P$41,P$43,P$45,P$47,P$49,P$51,P$53,P$55,P$57,P$59,P$61,P$63,P$65,P$67,P$69,P$71,P$73,P$75,P$77,P$79,P$81,P$83,P$85,P$87,P$89,P$91,P$93,P$95,P$97,P$99,P$101,P$103,P$105,P$107,P$109,P$111,P$113,P$115,P$117,P$119,P$121,P$123,P$125)) -> 8
A12: Pacific | B12: 1 | C12: 14.80 | D12: 14.70 | E12: 29.50 | F12: 14.70 | G12: 14.30 | H12: 14.80 | I12: 21.90 | J12: 15.00 | K12: 14.90 | L12: 15.20 | M12: 22.55 | N12: 73.95 | O12: 0.0 | P12: 73.95
A13: Crest | C13: =RANK(C12,(C$6,C$8,C$10,C$12,C$15,C$17,C$19,C$21,C$23,C$25,C$27,C$29,C$31,C$33,C$35,C$37,C$39,C$41,C$43,C$45,C$47,C$49,C$51,C$53,C$55,C$57,C$59,C$61,C$63,C$65,C$67,C$69,C$71,C$73,C$75,C$77,C$79,C$81,C$83,C$85,C$87,C$89,C$91,C$93,C$95,C$97,C$99,C$101,C$103,C$105,C$107,C$109,C$111,C$113,C$115,C$117,C$119,C$121,C$123,C$125)) -> 11 | D13: =RANK(D12,(D$6,D$8,D$10,D$12,D$15,D$17,D$19,D$21,D$23,D$25,D$27,D$29,D$31,D$33,D$35,D$37,D$39,D$41,D$43,D$45,D$47,D$49,D$51,D$53,D$55,D$57,D$59,D$61,D$63,D$65,D$67,D$69,D$71,D$73,D$75,D$77,D$79,D$81,D$83,D$85,D$87,D$89,D$91,D$93,D$95,D$97,D$99,D$101,D$103,D$105,D$107,D$109,D$111,D$113,D$115,D$117,D$119,D$121,D$123,D$125)) -> 12 | E13: =RANK(E12,(E$6,E$8,E$10,E$12,E$15,E$17,E$19,E$21,E$23,E$25,E$27,E$29,E$31,E$33,E$35,E$37,E$39,E$41,E$43,E$45,E$47,E$49,E$51,E$53,E$55,E$57,E$59,E$61,E$63,E$65,E$67,E$69,E$71,E$73,E$75,E$77,E$79,E$81,E$83,E$85,E$87,E$89,E$91,E$93,E$95,E$97,E$99,E$101,E$103,E$105,E$107,E$109,E$111,E$113,E$115,E$117,E$119,E$121,E$123,E$125)) -> 12 | F13: =RANK(F12,(F$6,F$8,F$10,F$12,F$15,F$17,F$19,F$21,F$23,F$25,F$27,F$29,F$31,F$33,F$35,F$37,F$39,F$41,F$43,F$45,F$47,F$49,F$51,F$53,F$55,F$57,F$59,F$61,F$63,F$65,F$67,F$69,F$71,F$73,F$75,F$77,F$79,F$81,F$83,F$85,F$87,F$89,F$91,F$93,F$95,F$97,F$99,F$101,F$103,F$105,F$107,F$109,F$111,F$113,F$115,F$117,F$119,F$121,F$123,F$125)) -> 12 | G13: =RANK(G12,(G$6,G$8,G$10,G$12,G$15,G$17,G$19,G$21,G$23,G$25,G$27,G$29,G$31,G$33,G$35,G$37,G$39,G$41,G$43,G$45,G$47,G$49,G$51,G$53,G$55,G$57,G$59,G$61,G$63,G$65,G$67,G$69,G$71,G$73,G$75,G$77,G$79,G$81,G$83,G$85,G$87,G$89,G$91,G$93,G$95,G$97,G$99,G$101,G$103,G$105,G$107,G$109,G$111,G$113,G$115,G$117,G$119,G$121,G$123,G$125)) -> 12 | H13: =RANK(H12,(H$6,H$8,H$10,H$12,H$15,H$17,H$19,H$21,H$23,H$25,H$27,H$29,H$31,H$33,H$35,H$37,H$39,H$41,H$43,H$45,H$47,H$49,H$51,H$53,H$55,H$57,H$59,H$61,H$63,H$65,H$67,H$69,H$71,H$73,H$75,H$77,H$79,H$81,H$83,H$85,H$87,H$89,H$91,H$93,H$95,H$97,H$99,H$101,H$103,H$105,H$107,H$109,H$111,H$113,H$115,H$117,H$119,H$121,H$123,H$125)) -> 10 | I13: =RANK(I12,(I$6,I$8,I$10,I$12,I$15,I$17,I$19,I$21,I$23,I$25,I$27,I$29,I$31,I$33,I$35,I$37,I$39,I$41,I$43,I$45,I$47,I$49,I$51,I$53,I$55,I$57,I$59,I$61,I$63,I$65,I$67,I$69,I$71,I$73,I$75,I$77,I$79,I$81,I$83,I$85,I$87,I$89,I$91,I$93,I$95,I$97,I$99,I$101,I$103,I$105,I$107,I$109,I$111,I$113,I$115,I$117,I$119,I$121,I$123,I$125)) -> 12 | J13: =RANK(J12,(J$6,J$8,J$10,J$12,J$15,J$17,J$19,J$21,J$23,J$25,J$27,J$29,J$31,J$33,J$35,J$37,J$39,J$41,J$43,J$45,J$47,J$49,J$51,J$53,J$55,J$57,J$59,J$61,J$63,J$65,J$67,J$69,J$71,J$73,J$75,J$77,J$79,J$81,J$83,J$85,J$87,J$89,J$91,J$93,J$95,J$97,J$99,J$101,J$103,J$105,J$107,J$109,J$111,J$113,J$115,J$117,J$119,J$121,J$123,J$125)) -> 11 | K13: =RANK(K12,(K$6,K$8,K$10,K$12,K$15,K$17,K$19,K$21,K$23,K$25,K$27,K$29,K$31,K$33,K$35,K$37,K$39,K$41,K$43,K$45,K$47,K$49,K$51,K$53,K$55,K$57,K$59,K$61,K$63,K$65,K$67,K$69,K$71,K$73,K$75,K$77,K$79,K$81,K$83,K$85,K$87,K$89,K$91,K$93,K$95,K$97,K$99,K$101,K$103,K$105,K$107,K$109,K$111,K$113,K$115,K$117,K$119,K$121,K$123,K$125)) -> 11 | L13: =RANK(L12,(L$6,L$8,L$10,L$12,L$15,L$17,L$19,L$21,L$23,L$25,L$27,L$29,L$31,L$33,L$35,L$37,L$39,L$41,L$43,L$45,L$47,L$49,L$51,L$53,L$55,L$57,L$59,L$61,L$63,L$65,L$67,L$69,L$71,L$73,L$75,L$77,L$79,L$81,L$83,L$85,L$87,L$89,L$91,L$93,L$95,L$97,L$99,L$101,L$103,L$105,L$107,L$109,L$111,L$113,L$115,L$117,L$119,L$121,L$123,L$125)) -> 10 | M13: =RANK(M12,(M$6,M$8,M$10,M$12,M$15,M$17,M$19,M$21,M$23,M$25,M$27,M$29,M$31,M$33,M$35,M$37,M$39,M$41,M$43,M$45,M$47,M$49,M$51,M$53,M$55,M$57,M$59,M$61,M$63,M$65,M$67,M$69,M$71,M$73,M$75,M$77,M$79,M$81,M$83,M$85,M$87,M$89,M$91,M$93,M$95,M$97,M$99,M$101,M$103,M$105,M$107,M$109,M$111,M$113,M$115,M$117,M$119,M$121,M$123,M$125)) -> 11 | N13: =RANK(N12,(N$6,N$8,N$10,N$12,N$15,N$17,N$19,N$21,N$23,N$25,N$27,N$29,N$31,N$33,N$35,N$37,N$39,N$41,N$43,N$45,N$47,N$49,N$51,N$53,N$55,N$57,N$59,N$61,N$63,N$65,N$67,N$69,N$71,N$73,N$75,N$77,N$79,N$81,N$83,N$85,N$87,N$89,N$91,N$93,N$95,N$97,N$99,N$101,N$103,N$105,N$107,N$109,N$111,N$113,N$115,N$117,N$119,N$121,N$123,N$125)) -> 11 | P13: =RANK(P12,(P$6,P$8,P$10,P$12,P$15,P$17,P$19,P$21,P$23,P$25,P$27,P$29,P$31,P$33,P$35,P$37,P$39,P$41,P$43,P$45,P$47,P$49,P$51,P$53,P$55,P$57,P$59,P$61,P$63,P$65,P$67,P$69,P$71,P$73,P$75,P$77,P$79,P$81,P$83,P$85,P$87,P$89,P$91,P$93,P$95,P$97,P$99,P$101,P$103,P$105,P$107,P$109,P$111,P$113,P$115,P$117,P$119,P$121,P$123,P$125)) -> 11
A14: DCI Open Class
A15: Legends | B15: 2 | C15: 14.10 | D15: 14.30 | E15: 28.40 | F15: 14.50 | G15: 13.70 | H15: 13.70 | I15: 20.95 | J15: 14.40 | K15: 14.30 | L15: 12.60 | M15: 20.65 | N15: 70.00 | O15: 0.0 | P15: 70.00
C16: 1 | D16: 1 | E16: 1 | F16: 1 | G16: 2 | H16: 2 | I16: 1 | J16: 1 | K16: 1 | L16: 2 | M16: 1 | N16: 1 | P16: 1
A17: Gold | B17: 1 | C17: 13.40 | D17: 13.20 | E17: 26.60 | F17: 13.50 | G17: 14.20 | H17: 14.00 | I17: 20.85 | J17: 13.80 | K17: 13.50 | L17: 13.30 | M17: 20.30 | N17: 67.75 | O17: 0.0 | P17: 67.75
C18: 2 | D18: 2 | E18: 2 | F18: 2 | G18: 1 | H18: 1 | I18: 2 | J18: 2 | K18: 2 | L18: 1 | M18: 2 | N18: 2 | P18: 2
A21: 8/1/2022 Sun Prairie, Wisconsin
C22: General Effect | F22: Visual | J22: Music
C23: 1 | D23: 2 | F23: Proficiency | G23: Analysis | H23: Color Guard | J23: Brass | K23: Analysis | L23: Percussion | N23: Sub | P23: Total
C24: C. Quamme | D24: J. Denton | E24: Total | F24: A. Combites | G24: J. Tate | H24: M. Czapinski | I24: Total ÷2 | J24: S. Halquist | K24: C. Armbruster | L24: T. Hall | M24: Total ÷2 | N24: Total | O24: Pen | P24: Score
A25: DCI Open Class | C25: 20 | D25: 20 | E25: 40 | F25: 20 | G25: 20 | H25: 20 | I25: 30 | J25: 20 | K25: 20 | L25: 20 | M25: 30 | N25: 100 | P25: 100
A26: Spartans | B26: 7 | C26: 14.50 | D26: 15.10 | E26: 29.60 | F26: 14.40 | G26: 14.80 | H26: 14.30 | I26: 21.75 | J26: 15.10 | K26: 14.80 | L26: 15.50 | M26: 22.70 | N26: 74.05 | O26: 0.0 | P26: 74.05
C27: 2 | D27: 1 | E27: 1 | F27: 1 | G27: 1 | H27: 1 | I27: 1 | J27: 1 | K27: 1 | L27: 1 | M27: 1 | N27: 1 | P27: 1
A28: Guardians | B28: 5 | C28: 14.80 | D28: 14.40 | E28: 29.20 | F28: 14.20 | G28: 14.70 | H28: 13.40 | I28: 21.15 | J28: 14.30 | K28: 14.40 | L28: 15.20 | M28: 21.95 | N28: 72.30 | O28: 0.0 | P28: 72.30
C29: 1 | D29: 2 | E29: 2 | F29: 2 | G29: 2 | H29: 4 | I29: 2 | J29: 2 | K29: 2 | L29: 2 | M29: 2 | N29: 2 | P29: 2
A30: River City | B30: 4 | C30: 13.60 | D30: 13.70 | E30: 27.30 | F30: 13.10 | G30: 14.10 | H30: 14.00 | I30: 20.60 | J30: 13.50 | K30: 13.60 | L30: 14.20 | M30: 20.65 | N30: 68.55 | O30: 0.0 | P30: 68.55
A31: Rhythm | C31: 4 | D31: 4 | E31: 4 | F31: 3 | G31: 3 | H31: 2 | I31: 3 | J31: 5 | K31: 4 | L31: 3 | M31: 3 | N31: 3 | P31: 3
A32: Battalion | B32: 1 | C32: 13.70 | D32: 14.00 | E32: 27.70 | F32: 12.60 | G32: 13.60 | H32: 13.60 | I32: 19.90 | J32: 13.90 | K32: 13.90 | L32: 13.50 | M32: 20.65 | N32: 68.25 | O32: 0.0 | P32: 68.25
C33: 3 | D33: 3 | E33: 3 | F33: 5 | G33: 4 | H33: 3 | I33: 4 | J33: 3 | K33: 3 | L33: 5 | M33: 3 | N33: 4 | P33: 4
A34: Louisiana | B34: 6 | C34: 13.20 | D34: 13.20 | E34: 26.40 | F34: 12.90 | G34: 13.30 | H34: 13.00 | I34: 19.60 | J34: 13.70 | K34: 13.40 | L34: 13.90 | M34: 20.50 | N34: 66.50 | O34: 0.0 | P34: 66.50
A35: Stars | C35: 5 | D35: 5 | E35: 5 | F35: 4 | G35: 5 | H35: 5 | I35: 5 | J35: 4 | K35: 5 | L35: 4 | M35: 5 | N35: 5 | P35: 5
A36: Colt | B36: 3 | C36: 12.50 | D36: 12.30 | E36: 24.80 | F36: 12.50 | G36: 12.50 | H36: 11.40 | I36: 18.20 | J36: 12.60 | K36: 12.30 | L36: 13.20 | M36: 19.05 | N36: 62.05 | O36: 0.0 | P36: 62.05
A37: Cadets | C37: 7 | D37: 7 | E37: 7 | F37: 6 | G37: 7 | H37: 7 | I37: 6 | J37: 7 | K37: 7 | L37: 6 | M37: 6 | N37: 6 | P37: 6
A38: Les | B38: 2 | C38: 12.60 | D38: 12.70 | E38: 25.30 | F38: 11.10 | G38: 12.70 | H38: 12.60 | I38: 18.20 | J38: 12.80 | K38: 12.40 | L38: 10.20 | M38: 17.70 | N38: 61.20 | O38: 0.0 | P38: 61.20
A39: Stentors | C39: 6 | D39: 6 | E39: 6 | F39: 7 | G39: 6 | H39: 6 | I39: 6 | J39: 6 | K39: 6 | L39: 7 | M39: 7 | N39: 7 | P39: 7
A42: 8/2/2022 Annapolis, Maryland
C43: General Effect | F43: Visual | J43: Music
C44: 1 | D44: 2 | F44: Proficiency | G44: Analysis | H44: Color Guard | J44: Brass | K44: Analysis | L44: Percussion | N44: Sub | P44: Total
C45: S. Adamo | D45: G. Miller | E45: Total | F45: J. Howell | G45: M. Tarr | H45: H. Nguyen | I45: Total ÷2 | J45: A. Lo | K45: D. Carbone | L45: J. Brooks | M45: Total ÷2 | N45: Total | O45: Pen | P45: Score
A46: DCI World Class | C46: 20 | D46: 20 | E46: 40 | F46: 20 | G46: 20 | H46: 20 | I46: 30 | J46: 20 | K46: 20 | L46: 20 | M46: 30 | N46: 100 | P46: 100
A47: Blue | B47: 8 | C47: 19.30 | D47: 18.80 | E47: 38.10 | F47: 19.10 | G47: 19.20 | H47: 18.90 | I47: 28.60 | J47: 18.60 | K47: 19.05 | L47: 18.90 | M47: 28.274999999999999 | N47: 94.974999999999994 | O47: 0.0 | P47: 94.974999999999994
A48: Devils | C48: =RANK(C47,(C$6,C$8,C$10,C$12,C$14,C$16,C$18,C$20,C$22,C$24,C$26,C$28,C$30,C$32,C$34,C$36,C$38,C$40,C$42,C$44,C$46,C$48,C$50,C$52,C$54,C$56,C$58,C$60,C$62,C$64,C$66,C$68,C$70,C$72,C$74,C$76,C$78,C$80,C$82,C$84,C$86,C$88,C$90,C$92,C$94,C$96,C$98,C$100,C$102,C$104,C$106,C$108,C$110,C$112,C$114,C$116,C$118,C$120,C$122,C$124)) -> 1 | D48: =RANK(D47,(D$6,D$8,D$10,D$12,D$14,D$16,D$18,D$20,D$22,D$24,D$26,D$28,D$30,D$32,D$34,D$36,D$38,D$40,D$42,D$44,D$46,D$48,D$50,D$52,D$54,D$56,D$58,D$60,D$62,D$64,D$66,D$68,D$70,D$72,D$74,D$76,D$78,D$80,D$82,D$84,D$86,D$88,D$90,D$92,D$94,D$96,D$98,D$100,D$102,D$104,D$106,D$108,D$110,D$112,D$114,D$116,D$118,D$120,D$122,D$124)) -> 1 | E48: =RANK(E47,(E$6,E$8,E$10,E$12,E$14,E$16,E$18,E$20,E$22,E$24,E$26,E$28,E$30,E$32,E$34,E$36,E$38,E$40,E$42,E$44,E$46,E$48,E$50,E$52,E$54,E$56,E$58,E$60,E$62,E$64,E$66,E$68,E$70,E$72,E$74,E$76,E$78,E$80,E$82,E$84,E$86,E$88,E$90,E$92,E$94,E$96,E$98,E$100,E$102,E$104,E$106,E$108,E$110,E$112,E$114,E$116,E$118,E$120,E$122,E$124)) -> 1 | F48: =RANK(F47,(F$6,F$8,F$10,F$12,F$14,F$16,F$18,F$20,F$22,F$24,F$26,F$28,F$30,F$32,F$34,F$36,F$38,F$40,F$42,F$44,F$46,F$48,F$50,F$52,F$54,F$56,F$58,F$60,F$62,F$64,F$66,F$68,F$70,F$72,F$74,F$76,F$78,F$80,F$82,F$84,F$86,F$88,F$90,F$92,F$94,F$96,F$98,F$100,F$102,F$104,F$106,F$108,F$110,F$112,F$114,F$116,F$118,F$120,F$122,F$124)) -> 1 | G48: =RANK(G47,(G$6,G$8,G$10,G$12,G$14,G$16,G$18,G$20,G$22,G$24,G$26,G$28,G$30,G$32,G$34,G$36,G$38,G$40,G$42,G$44,G$46,G$48,G$50,G$52,G$54,G$56,G$58,G$60,G$62,G$64,G$66,G$68,G$70,G$72,G$74,G$76,G$78,G$80,G$82,G$84,G$86,G$88,G$90,G$92,G$94,G$96,G$98,G$100,G$102,G$104,G$106,G$108,G$110,G$112,G$114,G$116,G$118,G$120,G$122,G$124)) -> 1 | H48: =RANK(H47,(H$6,H$8,H$10,H$12,H$14,H$16,H$18,H$20,H$22,H$24,H$26,H$28,H$30,H$32,H$34,H$36,H$38,H$40,H$42,H$44,H$46,H$48,H$50,H$52,H$54,H$56,H$58,H$60,H$62,H$64,H$66,H$68,H$70,H$72,H$74,H$76,H$78,H$80,H$82,H$84,H$86,H$88,H$90,H$92,H$94,H$96,H$98,H$100,H$102,H$104,H$106,H$108,H$110,H$112,H$114,H$116,H$118,H$120,H$122,H$124)) -> 1 | I48: =RANK(I47,(I$6,I$8,I$10,I$12,I$14,I$16,I$18,I$20,I$22,I$24,I$26,I$28,I$30,I$32,I$34,I$36,I$38,I$40,I$42,I$44,I$46,I$48,I$50,I$52,I$54,I$56,I$58,I$60,I$62,I$64,I$66,I$68,I$70,I$72,I$74,I$76,I$78,I$80,I$82,I$84,I$86,I$88,I$90,I$92,I$94,I$96,I$98,I$100,I$102,I$104,I$106,I$108,I$110,I$112,I$114,I$116,I$118,I$120,I$122,I$124)) -> 1 | J48: =RANK(J47,(J$6,J$8,J$10,J$12,J$14,J$16,J$18,J$20,J$22,J$24,J$26,J$28,J$30,J$32,J$34,J$36,J$38,J$40,J$42,J$44,J$46,J$48,J$50,J$52,J$54,J$56,J$58,J$60,J$62,J$64,J$66,J$68,J$70,J$72,J$74,J$76,J$78,J$80,J$82,J$84,J$86,J$88,J$90,J$92,J$94,J$96,J$98,J$100,J$102,J$104,J$106,J$108,J$110,J$112,J$114,J$116,J$118,J$120,J$122,J$124)) -> 1 | K48: =RANK(K47,(K$6,K$8,K$10,K$12,K$14,K$16,K$18,K$20,K$22,K$24,K$26,K$28,K$30,K$32,K$34,K$36,K$38,K$40,K$42,K$44,K$46,K$48,K$50,K$52,K$54,K$56,K$58,K$60,K$62,K$64,K$66,K$68,K$70,K$72,K$74,K$76,K$78,K$80,K$82,K$84,K$86,K$88,K$90,K$92,K$94,K$96,K$98,K$100,K$102,K$104,K$106,K$108,K$110,K$112,K$114,K$116,K$118,K$120,K$122,K$124)) -> 1 | L48: =RANK(L47,(L$6,L$8,L$10,L$12,L$14,L$16,L$18,L$20,L$22,L$24,L$26,L$28,L$30,L$32,L$34,L$36,L$38,L$40,L$42,L$44,L$46,L$48,L$50,L$52,L$54,L$56,L$58,L$60,L$62,L$64,L$66,L$68,L$70,L$72,L$74,L$76,L$78,L$80,L$82,L$84,L$86,L$88,L$90,L$92,L$94,L$96,L$98,L$100,L$102,L$104,L$106,L$108,L$110,L$112,L$114,L$116,L$118,L$120,L$122,L$124)) -> 1 | M48: =RANK(M47,(M$6,M$8,M$10,M$12,M$14,M$16,M$18,M$20,M$22,M$24,M$26,M$28,M$30,M$32,M$34,M$36,M$38,M$40,M$42,M$44,M$46,M$48,M$50,M$52,M$54,M$56,M$58,M$60,M$62,M$64,M$66,M$68,M$70,M$72,M$74,M$76,M$78,M$80,M$82,M$84,M$86,M$88,M$90,M$92,M$94,M$96,M$98,M$100,M$102,M$104,M$106,M$108,M$110,M$112,M$114,M$116,M$118,M$120,M$122,M$124)) -> 1 | N48: =RANK(N47,(N$6,N$8,N$10,N$12,N$14,N$16,N$18,N$20,N$22,N$24,N$26,N$28,N$30,N$32,N$34,N$36,N$38,N$40,N$42,N$44,N$46,N$48,N$50,N$52,N$54,N$56,N$58,N$60,N$62,N$64,N$66,N$68,N$70,N$72,N$74,N$76,N$78,N$80,N$82,N$84,N$86,N$88,N$90,N$92,N$94,N$96,N$98,N$100,N$102,N$104,N$106,N$108,N$110,N$112,N$114,N$116,N$118,N$120,N$122,N$124)) -> 1 | P48: =RANK(P47,(P$6,P$8,P$10,P$12,P$14,P$16,P$18,P$20,P$22,P$24,P$26,P$28,P$30,P$32,P$34,P$36,P$38,P$40,P$42,P$44,P$46,P$48,P$50,P$52,P$54,P$56,P$58,P$60,P$62,P$64,P$66,P$68,P$70,P$72,P$74,P$76,P$78,P$80,P$82,P$84,P$86,P$88,P$90,P$92,P$94,P$96,P$98,P$100,P$102,P$104,P$106,P$108,P$110,P$112,P$114,P$116,P$118,P$120,P$122,P$124)) -> 1
A49: Bluecoats | B49: 7 | C49: 18.90 | D49: 18.60 | E49: 37.50 | F49: 18.80 | G49: 18.80 | H49: 18.60 | I49: 28.10 | J49: 18.40 | K49: 18.70 | L49: 18.80 | M49: 27.950 | N49: 93.550 | O49: 0.0 | P49: 93.550
C50: =RANK(C49,(C$6,C$8,C$10,C$12,C$14,C$16,C$18,C$20,C$22,C$24,C$26,C$28,C$30,C$32,C$34,C$36,C$38,C$40,C$42,C$44,C$46,C$48,C$50,C$52,C$54,C$56,C$58,C$60,C$62,C$64,C$66,C$68,C$70,C$72,C$74,C$76,C$78,C$80,C$82,C$84,C$86,C$88,C$90,C$92,C$94,C$96,C$98,C$100,C$102,C$104,C$106,C$108,C$110,C$112,C$114,C$116,C$118,C$120,C$122,C$124)) -> 2 | D50: =RANK(D49,(D$6,D$8,D$10,D$12,D$14,D$16,D$18,D$20,D$22,D$24,D$26,D$28,D$30,D$32,D$34,D$36,D$38,D$40,D$42,D$44,D$46,D$48,D$50,D$52,D$54,D$56,D$58,D$60,D$62,D$64,D$66,D$68,D$70,D$72,D$74,D$76,D$78,D$80,D$82,D$84,D$86,D$88,D$90,D$92,D$94,D$96,D$98,D$100,D$102,D$104,D$106,D$108,D$110,D$112,D$114,D$116,D$118,D$120,D$122,D$124)) -> 2 | E50: =RANK(E49,(E$6,E$8,E$10,E$12,E$14,E$16,E$18,E$20,E$22,E$24,E$26,E$28,E$30,E$32,E$34,E$36,E$38,E$40,E$42,E$44,E$46,E$48,E$50,E$52,E$54,E$56,E$58,E$60,E$62,E$64,E$66,E$68,E$70,E$72,E$74,E$76,E$78,E$80,E$82,E$84,E$86,E$88,E$90,E$92,E$94,E$96,E$98,E$100,E$102,E$104,E$106,E$108,E$110,E$112,E$114,E$116,E$118,E$120,E$122,E$124)) -> 2 | F50: =RANK(F49,(F$6,F$8,F$10,F$12,F$14,F$16,F$18,F$20,F$22,F$24,F$26,F$28,F$30,F$32,F$34,F$36,F$38,F$40,F$42,F$44,F$46,F$48,F$50,F$52,F$54,F$56,F$58,F$60,F$62,F$64,F$66,F$68,F$70,F$72,F$74,F$76,F$78,F$80,F$82,F$84,F$86,F$88,F$90,F$92,F$94,F$96,F$98,F$100,F$102,F$104,F$106,F$108,F$110,F$112,F$114,F$116,F$118,F$120,F$122,F$124)) -> 2 | G50: =RANK(G49,(G$6,G$8,G$10,G$12,G$14,G$16,G$18,G$20,G$22,G$24,G$26,G$28,G$30,G$32,G$34,G$36,G$38,G$40,G$42,G$44,G$46,G$48,G$50,G$52,G$54,G$56,G$58,G$60,G$62,G$64,G$66,G$68,G$70,G$72,G$74,G$76,G$78,G$80,G$82,G$84,G$86,G$88,G$90,G$92,G$94,G$96,G$98,G$100,G$102,G$104,G$106,G$108,G$110,G$112,G$114,G$116,G$118,G$120,G$122,G$124)) -> 2 | H50: =RANK(H49,(H$6,H$8,H$10,H$12,H$14,H$16,H$18,H$20,H$22,H$24,H$26,H$28,H$30,H$32,H$34,H$36,H$38,H$40,H$42,H$44,H$46,H$48,H$50,H$52,H$54,H$56,H$58,H$60,H$62,H$64,H$66,H$68,H$70,H$72,H$74,H$76,H$78,H$80,H$82,H$84,H$86,H$88,H$90,H$92,H$94,H$96,H$98,H$100,H$102,H$104,H$106,H$108,H$110,H$112,H$114,H$116,H$118,H$120,H$122,H$124)) -> 2 | I50: =RANK(I49,(I$6,I$8,I$10,I$12,I$14,I$16,I$18,I$20,I$22,I$24,I$26,I$28,I$30,I$32,I$34,I$36,I$38,I$40,I$42,I$44,I$46,I$48,I$50,I$52,I$54,I$56,I$58,I$60,I$62,I$64,I$66,I$68,I$70,I$72,I$74,I$76,I$78,I$80,I$82,I$84,I$86,I$88,I$90,I$92,I$94,I$96,I$98,I$100,I$102,I$104,I$106,I$108,I$110,I$112,I$114,I$116,I$118,I$120,I$122,I$124)) -> 2 | J50: =RANK(J49,(J$6,J$8,J$10,J$12,J$14,J$16,J$18,J$20,J$22,J$24,J$26,J$28,J$30,J$32,J$34,J$36,J$38,J$40,J$42,J$44,J$46,J$48,J$50,J$52,J$54,J$56,J$58,J$60,J$62,J$64,J$66,J$68,J$70,J$72,J$74,J$76,J$78,J$80,J$82,J$84,J$86,J$88,J$90,J$92,J$94,J$96,J$98,J$100,J$102,J$104,J$106,J$108,J$110,J$112,J$114,J$116,J$118,J$120,J$122,J$124)) -> 2 | K50: =RANK(K49,(K$6,K$8,K$10,K$12,K$14,K$16,K$18,K$20,K$22,K$24,K$26,K$28,K$30,K$32,K$34,K$36,K$38,K$40,K$42,K$44,K$46,K$48,K$50,K$52,K$54,K$56,K$58,K$60,K$62,K$64,K$66,K$68,K$70,K$72,K$74,K$76,K$78,K$80,K$82,K$84,K$86,K$88,K$90,K$92,K$94,K$96,K$98,K$100,K$102,K$104,K$106,K$108,K$110,K$112,K$114,K$116,K$118,K$120,K$122,K$124)) -> 2 | L50: =RANK(L49,(L$6,L$8,L$10,L$12,L$14,L$16,L$18,L$20,L$22,L$24,L$26,L$28,L$30,L$32,L$34,L$36,L$38,L$40,L$42,L$44,L$46,L$48,L$50,L$52,L$54,L$56,L$58,L$60,L$62,L$64,L$66,L$68,L$70,L$72,L$74,L$76,L$78,L$80,L$82,L$84,L$86,L$88,L$90,L$92,L$94,L$96,L$98,L$100,L$102,L$104,L$106,L$108,L$110,L$112,L$114,L$116,L$118,L$120,L$122,L$124)) -> 2 | M50: =RANK(M49,(M$6,M$8,M$10,M$12,M$14,M$16,M$18,M$20,M$22,M$24,M$26,M$28,M$30,M$32,M$34,M$36,M$38,M$40,M$42,M$44,M$46,M$48,M$50,M$52,M$54,M$56,M$58,M$60,M$62,M$64,M$66,M$68,M$70,M$72,M$74,M$76,M$78,M$80,M$82,M$84,M$86,M$88,M$90,M$92,M$94,M$96,M$98,M$100,M$102,M$104,M$106,M$108,M$110,M$112,M$114,M$116,M$118,M$120,M$122,M$124)) -> 2 | N50: =RANK(N49,(N$6,N$8,N$10,N$12,N$14,N$16,N$18,N$20,N$22,N$24,N$26,N$28,N$30,N$32,N$34,N$36,N$38,N$40,N$42,N$44,N$46,N$48,N$50,N$52,N$54,N$56,N$58,N$60,N$62,N$64,N$66,N$68,N$70,N$72,N$74,N$76,N$78,N$80,N$82,N$84,N$86,N$88,N$90,N$92,N$94,N$96,N$98,N$100,N$102,N$104,N$106,N$108,N$110,N$112,N$114,N$116,N$118,N$120,N$122,N$124)) -> 2 | P50: =RANK(P49,(P$6,P$8,P$10,P$12,P$14,P$16,P$18,P$20,P$22,P$24,P$26,P$28,P$30,P$32,P$34,P$36,P$38,P$40,P$42,P$44,P$46,P$48,P$50,P$52,P$54,P$56,P$58,P$60,P$62,P$64,P$66,P$68,P$70,P$72,P$74,P$76,P$78,P$80,P$82,P$84,P$86,P$88,P$90,P$92,P$94,P$96,P$98,P$100,P$102,P$104,P$106,P$108,P$110,P$112,P$114,P$116,P$118,P$120,P$122,P$124)) -> 2
A51: Cadets | B51: 6 | C51: 18.30 | D51: 17.80 | E51: 36.10 | F51: 18.10 | G51: 18.00 | H51: 17.80 | I51: 26.95 | J51: 18.10 | K51: 18.10 | L51: 18.00 | M51: 27.100 | N51: 90.150 | O51: 0.0 | P51: 90.150
C52: =RANK(C51,(C$6,C$8,C$10,C$12,C$14,C$16,C$18,C$20,C$22,C$24,C$26,C$28,C$30,C$32,C$34,C$36,C$38,C$40,C$42,C$44,C$46,C$48,C$50,C$52,C$54,C$56,C$58,C$60,C$62,C$64,C$66,C$68,C$70,C$72,C$74,C$76,C$78,C$80,C$82,C$84,C$86,C$88,C$90,C$92,C$94,C$96,C$98,C$100,C$102,C$104,C$106,C$108,C$110,C$112,C$114,C$116,C$118,C$120,C$122,C$124)) -> 3 | D52: =RANK(D51,(D$6,D$8,D$10,D$12,D$14,D$16,D$18,D$20,D$22,D$24,D$26,D$28,D$30,D$32,D$34,D$36,D$38,D$40,D$42,D$44,D$46,D$48,D$50,D$52,D$54,D$56,D$58,D$60,D$62,D$64,D$66,D$68,D$70,D$72,D$74,D$76,D$78,D$80,D$82,D$84,D$86,D$88,D$90,D$92,D$94,D$96,D$98,D$100,D$102,D$104,D$106,D$108,D$110,D$112,D$114,D$116,D$118,D$120,D$122,D$124)) -> 3 | E52: =RANK(E51,(E$6,E$8,E$10,E$12,E$14,E$16,E$18,E$20,E$22,E$24,E$26,E$28,E$30,E$32,E$34,E$36,E$38,E$40,E$42,E$44,E$46,E$48,E$50,E$52,E$54,E$56,E$58,E$60,E$62,E$64,E$66,E$68,E$70,E$72,E$74,E$76,E$78,E$80,E$82,E$84,E$86,E$88,E$90,E$92,E$94,E$96,E$98,E$100,E$102,E$104,E$106,E$108,E$110,E$112,E$114,E$116,E$118,E$120,E$122,E$124)) -> 3 | F52: =RANK(F51,(F$6,F$8,F$10,F$12,F$14,F$16,F$18,F$20,F$22,F$24,F$26,F$28,F$30,F$32,F$34,F$36,F$38,F$40,F$42,F$44,F$46,F$48,F$50,F$52,F$54,F$56,F$58,F$60,F$62,F$64,F$66,F$68,F$70,F$72,F$74,F$76,F$78,F$80,F$82,F$84,F$86,F$88,F$90,F$92,F$94,F$96,F$98,F$100,F$102,F$104,F$106,F$108,F$110,F$112,F$114,F$116,F$118,F$120,F$122,F$124)) -> 3 | G52: =RANK(G51,(G$6,G$8,G$10,G$12,G$14,G$16,G$18,G$20,G$22,G$24,G$26,G$28,G$30,G$32,G$34,G$36,G$38,G$40,G$42,G$44,G$46,G$48,G$50,G$52,G$54,G$56,G$58,G$60,G$62,G$64,G$66,G$68,G$70,G$72,G$74,G$76,G$78,G$80,G$82,G$84,G$86,G$88,G$90,G$92,G$94,G$96,G$98,G$100,G$102,G$104,G$106,G$108,G$110,G$112,G$114,G$116,G$118,G$120,G$122,G$124)) -> 3 | H52: =RANK(H51,(H$6,H$8,H$10,H$12,H$14,H$16,H$18,H$20,H$22,H$24,H$26,H$28,H$30,H$32,H$34,H$36,H$38,H$40,H$42,H$44,H$46,H$48,H$50,H$52,H$54,H$56,H$58,H$60,H$62,H$64,H$66,H$68,H$70,H$72,H$74,H$76,H$78,H$80,H$82,H$84,H$86,H$88,H$90,H$92,H$94,H$96,H$98,H$100,H$102,H$104,H$106,H$108,H$110,H$112,H$114,H$116,H$118,H$120,H$122,H$124)) -> 3 | I52: =RANK(I51,(I$6,I$8,I$10,I$12,I$14,I$16,I$18,I$20,I$22,I$24,I$26,I$28,I$30,I$32,I$34,I$36,I$38,I$40,I$42,I$44,I$46,I$48,I$50,I$52,I$54,I$56,I$58,I$60,I$62,I$64,I$66,I$68,I$70,I$72,I$74,I$76,I$78,I$80,I$82,I$84,I$86,I$88,I$90,I$92,I$94,I$96,I$98,I$100,I$102,I$104,I$106,I$108,I$110,I$112,I$114,I$116,I$118,I$120,I$122,I$124)) -> 3 | J52: =RANK(J51,(J$6,J$8,J$10,J$12,J$14,J$16,J$18,J$20,J$22,J$24,J$26,J$28,J$30,J$32,J$34,J$36,J$38,J$40,J$42,J$44,J$46,J$48,J$50,J$52,J$54,J$56,J$58,J$60,J$62,J$64,J$66,J$68,J$70,J$72,J$74,J$76,J$78,J$80,J$82,J$84,J$86,J$88,J$90,J$92,J$94,J$96,J$98,J$100,J$102,J$104,J$106,J$108,J$110,J$112,J$114,J$116,J$118,J$120,J$122,J$124)) -> 3 | K52: =RANK(K51,(K$6,K$8,K$10,K$12,K$14,K$16,K$18,K$20,K$22,K$24,K$26,K$28,K$30,K$32,K$34,K$36,K$38,K$40,K$42,K$44,K$46,K$48,K$50,K$52,K$54,K$56,K$58,K$60,K$62,K$64,K$66,K$68,K$70,K$72,K$74,K$76,K$78,K$80,K$82,K$84,K$86,K$88,K$90,K$92,K$94,K$96,K$98,K$100,K$102,K$104,K$106,K$108,K$110,K$112,K$114,K$116,K$118,K$120,K$122,K$124)) -> 3 | L52: =RANK(L51,(L$6,L$8,L$10,L$12,L$14,L$16,L$18,L$20,L$22,L$24,L$26,L$28,L$30,L$32,L$34,L$36,L$38,L$40,L$42,L$44,L$46,L$48,L$50,L$52,L$54,L$56,L$58,L$60,L$62,L$64,L$66,L$68,L$70,L$72,L$74,L$76,L$78,L$80,L$82,L$84,L$86,L$88,L$90,L$92,L$94,L$96,L$98,L$100,L$102,L$104,L$106,L$108,L$110,L$112,L$114,L$116,L$118,L$120,L$122,L$124)) -> 3 | M52: =RANK(M51,(M$6,M$8,M$10,M$12,M$14,M$16,M$18,M$20,M$22,M$24,M$26,M$28,M$30,M$32,M$34,M$36,M$38,M$40,M$42,M$44,M$46,M$48,M$50,M$52,M$54,M$56,M$58,M$60,M$62,M$64,M$66,M$68,M$70,M$72,M$74,M$76,M$78,M$80,M$82,M$84,M$86,M$88,M$90,M$92,M$94,M$96,M$98,M$100,M$102,M$104,M$106,M$108,M$110,M$112,M$114,M$116,M$118,M$120,M$122,M$124)) -> 3 | N52: =RANK(N51,(N$6,N$8,N$10,N$12,N$14,N$16,N$18,N$20,N$22,N$24,N$26,N$28,N$30,N$32,N$34,N$36,N$38,N$40,N$42,N$44,N$46,N$48,N$50,N$52,N$54,N$56,N$58,N$60,N$62,N$64,N$66,N$68,N$70,N$72,N$74,N$76,N$78,N$80,N$82,N$84,N$86,N$88,N$90,N$92,N$94,N$96,N$98,N$100,N$102,N$104,N$106,N$108,N$110,N$112,N$114,N$116,N$118,N$120,N$122,N$124)) -> 3 | P52: =RANK(P51,(P$6,P$8,P$10,P$12,P$14,P$16,P$18,P$20,P$22,P$24,P$26,P$28,P$30,P$32,P$34,P$36,P$38,P$40,P$42,P$44,P$46,P$48,P$50,P$52,P$54,P$56,P$58,P$60,P$62,P$64,P$66,P$68,P$70,P$72,P$74,P$76,P$78,P$80,P$82,P$84,P$86,P$88,P$90,P$92,P$94,P$96,P$98,P$100,P$102,P$104,P$106,P$108,P$110,P$112,P$114,P$116,P$118,P$120,P$122,P$124)) -> 3
A53: Crossmen | B53: 4 | C53: 16.40 | D53: 16.70 | E53: 33.10 | F53: 17.20 | G53: 16.70 | H53: 16.40 | I53: 25.15 | J53: 16.40 | K53: 16.40 | L53: 17.10 | M53: 24.950 | N53: 83.200 | O53: 0.0 | P53: 83.200
C54: =RANK(C53,(C$6,C$8,C$10,C$12,C$14,C$16,C$18,C$20,C$22,C$24,C$26,C$28,C$30,C$32,C$34,C$36,C$38,C$40,C$42,C$44,C$46,C$48,C$50,C$52,C$54,C$56,C$58,C$60,C$62,C$64,C$66,C$68,C$70,C$72,C$74,C$76,C$78,C$80,C$82,C$84,C$86,C$88,C$90,C$92,C$94,C$96,C$98,C$100,C$102,C$104,C$106,C$108,C$110,C$112,C$114,C$116,C$118,C$120,C$122,C$124)) -> 4 | D54: =RANK(D53,(D$6,D$8,D$10,D$12,D$14,D$16,D$18,D$20,D$22,D$24,D$26,D$28,D$30,D$32,D$34,D$36,D$38,D$40,D$42,D$44,D$46,D$48,D$50,D$52,D$54,D$56,D$58,D$60,D$62,D$64,D$66,D$68,D$70,D$72,D$74,D$76,D$78,D$80,D$82,D$84,D$86,D$88,D$90,D$92,D$94,D$96,D$98,D$100,D$102,D$104,D$106,D$108,D$110,D$112,D$114,D$116,D$118,D$120,D$122,D$124)) -> 4 | E54: =RANK(E53,(E$6,E$8,E$10,E$12,E$14,E$16,E$18,E$20,E$22,E$24,E$26,E$28,E$30,E$32,E$34,E$36,E$38,E$40,E$42,E$44,E$46,E$48,E$50,E$52,E$54,E$56,E$58,E$60,E$62,E$64,E$66,E$68,E$70,E$72,E$74,E$76,E$78,E$80,E$82,E$84,E$86,E$88,E$90,E$92,E$94,E$96,E$98,E$100,E$102,E$104,E$106,E$108,E$110,E$112,E$114,E$116,E$118,E$120,E$122,E$124)) -> 4 | F54: =RANK(F53,(F$6,F$8,F$10,F$12,F$14,F$16,F$18,F$20,F$22,F$24,F$26,F$28,F$30,F$32,F$34,F$36,F$38,F$40,F$42,F$44,F$46,F$48,F$50,F$52,F$54,F$56,F$58,F$60,F$62,F$64,F$66,F$68,F$70,F$72,F$74,F$76,F$78,F$80,F$82,F$84,F$86,F$88,F$90,F$92,F$94,F$96,F$98,F$100,F$102,F$104,F$106,F$108,F$110,F$112,F$114,F$116,F$118,F$120,F$122,F$124)) -> 4 | G54: =RANK(G53,(G$6,G$8,G$10,G$12,G$14,G$16,G$18,G$20,G$22,G$24,G$26,G$28,G$30,G$32,G$34,G$36,G$38,G$40,G$42,G$44,G$46,G$48,G$50,G$52,G$54,G$56,G$58,G$60,G$62,G$64,G$66,G$68,G$70,G$72,G$74,G$76,G$78,G$80,G$82,G$84,G$86,G$88,G$90,G$92,G$94,G$96,G$98,G$100,G$102,G$104,G$106,G$108,G$110,G$112,G$114,G$116,G$118,G$120,G$122,G$124)) -> 4 | H54: =RANK(H53,(H$6,H$8,H$10,H$12,H$14,H$16,H$18,H$20,H$22,H$24,H$26,H$28,H$30,H$32,H$34,H$36,H$38,H$40,H$42,H$44,H$46,H$48,H$50,H$52,H$54,H$56,H$58,H$60,H$62,H$64,H$66,H$68,H$70,H$72,H$74,H$76,H$78,H$80,H$82,H$84,H$86,H$88,H$90,H$92,H$94,H$96,H$98,H$100,H$102,H$104,H$106,H$108,H$110,H$112,H$114,H$116,H$118,H$120,H$122,H$124)) -> 4 | I54: =RANK(I53,(I$6,I$8,I$10,I$12,I$14,I$16,I$18,I$20,I$22,I$24,I$26,I$28,I$30,I$32,I$34,I$36,I$38,I$40,I$42,I$44,I$46,I$48,I$50,I$52,I$54,I$56,I$58,I$60,I$62,I$64,I$66,I$68,I$70,I$72,I$74,I$76,I$78,I$80,I$82,I$84,I$86,I$88,I$90,I$92,I$94,I$96,I$98,I$100,I$102,I$104,I$106,I$108,I$110,I$112,I$114,I$116,I$118,I$120,I$122,I$124)) -> 4 | J54: =RANK(J53,(J$6,J$8,J$10,J$12,J$14,J$16,J$18,J$20,J$22,J$24,J$26,J$28,J$30,J$32,J$34,J$36,J$38,J$40,J$42,J$44,J$46,J$48,J$50,J$52,J$54,J$56,J$58,J$60,J$62,J$64,J$66,J$68,J$70,J$72,J$74,J$76,J$78,J$80,J$82,J$84,J$86,J$88,J$90,J$92,J$94,J$96,J$98,J$100,J$102,J$104,J$106,J$108,J$110,J$112,J$114,J$116,J$118,J$120,J$122,J$124)) -> 4 | K54: =RANK(K53,(K$6,K$8,K$10,K$12,K$14,K$16,K$18,K$20,K$22,K$24,K$26,K$28,K$30,K$32,K$34,K$36,K$38,K$40,K$42,K$44,K$46,K$48,K$50,K$52,K$54,K$56,K$58,K$60,K$62,K$64,K$66,K$68,K$70,K$72,K$74,K$76,K$78,K$80,K$82,K$84,K$86,K$88,K$90,K$92,K$94,K$96,K$98,K$100,K$102,K$104,K$106,K$108,K$110,K$112,K$114,K$116,K$118,K$120,K$122,K$124)) -> 4 | L54: =RANK(L53,(L$6,L$8,L$10,L$12,L$14,L$16,L$18,L$20,L$22,L$24,L$26,L$28,L$30,L$32,L$34,L$36,L$38,L$40,L$42,L$44,L$46,L$48,L$50,L$52,L$54,L$56,L$58,L$60,L$62,L$64,L$66,L$68,L$70,L$72,L$74,L$76,L$78,L$80,L$82,L$84,L$86,L$88,L$90,L$92,L$94,L$96,L$98,L$100,L$102,L$104,L$106,L$108,L$110,L$112,L$114,L$116,L$118,L$120,L$122,L$124)) -> 5 | M54: =RANK(M53,(M$6,M$8,M$10,M$12,M$14,M$16,M$18,M$20,M$22,M$24,M$26,M$28,M$30,M$32,M$34,M$36,M$38,M$40,M$42,M$44,M$46,M$48,M$50,M$52,M$54,M$56,M$58,M$60,M$62,M$64,M$66,M$68,M$70,M$72,M$74,M$76,M$78,M$80,M$82,M$84,M$86,M$88,M$90,M$92,M$94,M$96,M$98,M$100,M$102,M$104,M$106,M$108,M$110,M$112,M$114,M$116,M$118,M$120,M$122,M$124)) -> 4 | N54: =RANK(N53,(N$6,N$8,N$10,N$12,N$14,N$16,N$18,N$20,N$22,N$24,N$26,N$28,N$30,N$32,N$34,N$36,N$38,N$40,N$42,N$44,N$46,N$48,N$50,N$52,N$54,N$56,N$58,N$60,N$62,N$64,N$66,N$68,N$70,N$72,N$74,N$76,N$78,N$80,N$82,N$84,N$86,N$88,N$90,N$92,N$94,N$96,N$98,N$100,N$102,N$104,N$106,N$108,N$110,N$112,N$114,N$116,N$118,N$120,N$122,N$124)) -> 4 | P54: =RANK(P53,(P$6,P$8,P$10,P$12,P$14,P$16,P$18,P$20,P$22,P$24,P$26,P$28,P$30,P$32,P$34,P$36,P$38,P$40,P$42,P$44,P$46,P$48,P$50,P$52,P$54,P$56,P$58,P$60,P$62,P$64,P$66,P$68,P$70,P$72,P$74,P$76,P$78,P$80,P$82,P$84,P$86,P$88,P$90,P$92,P$94,P$96,P$98,P$100,P$102,P$104,P$106,P$108,P$110,P$112,P$114,P$116,P$118,P$120,P$122,P$124)) -> 4
A55: Troopers | B55: 5 | C55: 15.90 | D55: 15.90 | E55: 31.80 | F55: 16.30 | G55: 16.40 | H55: 15.40 | I55: 24.05 | J55: 15.70 | K55: 16.20 | L55: 17.30 | M55: 24.600 | N55: 80.450 | O55: 0.0 | P55: 80.450
C56: =RANK(C55,(C$6,C$8,C$10,C$12,C$14,C$16,C$18,C$20,C$22,C$24,C$26,C$28,C$30,C$32,C$34,C$36,C$38,C$40,C$42,C$44,C$46,C$48,C$50,C$52,C$54,C$56,C$58,C$60,C$62,C$64,C$66,C$68,C$70,C$72,C$74,C$76,C$78,C$80,C$82,C$84,C$86,C$88,C$90,C$92,C$94,C$96,C$98,C$100,C$102,C$104,C$106,C$108,C$110,C$112,C$114,C$116,C$118,C$120,C$122,C$124)) -> 5 | D56: =RANK(D55,(D$6,D$8,D$10,D$12,D$14,D$16,D$18,D$20,D$22,D$24,D$26,D$28,D$30,D$32,D$34,D$36,D$38,D$40,D$42,D$44,D$46,D$48,D$50,D$52,D$54,D$56,D$58,D$60,D$62,D$64,D$66,D$68,D$70,D$72,D$74,D$76,D$78,D$80,D$82,D$84,D$86,D$88,D$90,D$92,D$94,D$96,D$98,D$100,D$102,D$104,D$106,D$108,D$110,D$112,D$114,D$116,D$118,D$120,D$122,D$124)) -> 5 | E56: =RANK(E55,(E$6,E$8,E$10,E$12,E$14,E$16,E$18,E$20,E$22,E$24,E$26,E$28,E$30,E$32,E$34,E$36,E$38,E$40,E$42,E$44,E$46,E$48,E$50,E$52,E$54,E$56,E$58,E$60,E$62,E$64,E$66,E$68,E$70,E$72,E$74,E$76,E$78,E$80,E$82,E$84,E$86,E$88,E$90,E$92,E$94,E$96,E$98,E$100,E$102,E$104,E$106,E$108,E$110,E$112,E$114,E$116,E$118,E$120,E$122,E$124)) -> 5 | F56: =RANK(F55,(F$6,F$8,F$10,F$12,F$14,F$16,F$18,F$20,F$22,F$24,F$26,F$28,F$30,F$32,F$34,F$36,F$38,F$40,F$42,F$44,F$46,F$48,F$50,F$52,F$54,F$56,F$58,F$60,F$62,F$64,F$66,F$68,F$70,F$72,F$74,F$76,F$78,F$80,F$82,F$84,F$86,F$88,F$90,F$92,F$94,F$96,F$98,F$100,F$102,F$104,F$106,F$108,F$110,F$112,F$114,F$116,F$118,F$120,F$122,F$124)) -> 5 | G56: =RANK(G55,(G$6,G$8,G$10,G$12,G$14,G$16,G$18,G$20,G$22,G$24,G$26,G$28,G$30,G$32,G$34,G$36,G$38,G$40,G$42,G$44,G$46,G$48,G$50,G$52,G$54,G$56,G$58,G$60,G$62,G$64,G$66,G$68,G$70,G$72,G$74,G$76,G$78,G$80,G$82,G$84,G$86,G$88,G$90,G$92,G$94,G$96,G$98,G$100,G$102,G$104,G$106,G$108,G$110,G$112,G$114,G$116,G$118,G$120,G$122,G$124)) -> 5 | H56: =RANK(H55,(H$6,H$8,H$10,H$12,H$14,H$16,H$18,H$20,H$22,H$24,H$26,H$28,H$30,H$32,H$34,H$36,H$38,H$40,H$42,H$44,H$46,H$48,H$50,H$52,H$54,H$56,H$58,H$60,H$62,H$64,H$66,H$68,H$70,H$72,H$74,H$76,H$78,H$80,H$82,H$84,H$86,H$88,H$90,H$92,H$94,H$96,H$98,H$100,H$102,H$104,H$106,H$108,H$110,H$112,H$114,H$116,H$118,H$120,H$122,H$124)) -> 5 | I56: =RANK(I55,(I$6,I$8,I$10,I$12,I$14,I$16,I$18,I$20,I$22,I$24,I$26,I$28,I$30,I$32,I$34,I$36,I$38,I$40,I$42,I$44,I$46,I$48,I$50,I$52,I$54,I$56,I$58,I$60,I$62,I$64,I$66,I$68,I$70,I$72,I$74,I$76,I$78,I$80,I$82,I$84,I$86,I$88,I$90,I$92,I$94,I$96,I$98,I$100,I$102,I$104,I$106,I$108,I$110,I$112,I$114,I$116,I$118,I$120,I$122,I$124)) -> 5 | J56: =RANK(J55,(J$6,J$8,J$10,J$12,J$14,J$16,J$18,J$20,J$22,J$24,J$26,J$28,J$30,J$32,J$34,J$36,J$38,J$40,J$42,J$44,J$46,J$48,J$50,J$52,J$54,J$56,J$58,J$60,J$62,J$64,J$66,J$68,J$70,J$72,J$74,J$76,J$78,J$80,J$82,J$84,J$86,J$88,J$90,J$92,J$94,J$96,J$98,J$100,J$102,J$104,J$106,J$108,J$110,J$112,J$114,J$116,J$118,J$120,J$122,J$124)) -> 5 | K56: =RANK(K55,(K$6,K$8,K$10,K$12,K$14,K$16,K$18,K$20,K$22,K$24,K$26,K$28,K$30,K$32,K$34,K$36,K$38,K$40,K$42,K$44,K$46,K$48,K$50,K$52,K$54,K$56,K$58,K$60,K$62,K$64,K$66,K$68,K$70,K$72,K$74,K$76,K$78,K$80,K$82,K$84,K$86,K$88,K$90,K$92,K$94,K$96,K$98,K$100,K$102,K$104,K$106,K$108,K$110,K$112,K$114,K$116,K$118,K$120,K$122,K$124)) -> 5 | L56: =RANK(L55,(L$6,L$8,L$10,L$12,L$14,L$16,L$18,L$20,L$22,L$24,L$26,L$28,L$30,L$32,L$34,L$36,L$38,L$40,L$42,L$44,L$46,L$48,L$50,L$52,L$54,L$56,L$58,L$60,L$62,L$64,L$66,L$68,L$70,L$72,L$74,L$76,L$78,L$80,L$82,L$84,L$86,L$88,L$90,L$92,L$94,L$96,L$98,L$100,L$102,L$104,L$106,L$108,L$110,L$112,L$114,L$116,L$118,L$120,L$122,L$124)) -> 4 | M56: =RANK(M55,(M$6,M$8,M$10,M$12,M$14,M$16,M$18,M$20,M$22,M$24,M$26,M$28,M$30,M$32,M$34,M$36,M$38,M$40,M$42,M$44,M$46,M$48,M$50,M$52,M$54,M$56,M$58,M$60,M$62,M$64,M$66,M$68,M$70,M$72,M$74,M$76,M$78,M$80,M$82,M$84,M$86,M$88,M$90,M$92,M$94,M$96,M$98,M$100,M$102,M$104,M$106,M$108,M$110,M$112,M$114,M$116,M$118,M$120,M$122,M$124)) -> 5 | N56: =RANK(N55,(N$6,N$8,N$10,N$12,N$14,N$16,N$18,N$20,N$22,N$24,N$26,N$28,N$30,N$32,N$34,N$36,N$38,N$40,N$42,N$44,N$46,N$48,N$50,N$52,N$54,N$56,N$58,N$60,N$62,N$64,N$66,N$68,N$70,N$72,N$74,N$76,N$78,N$80,N$82,N$84,N$86,N$88,N$90,N$92,N$94,N$96,N$98,N$100,N$102,N$104,N$106,N$108,N$110,N$112,N$114,N$116,N$118,N$120,N$122,N$124)) -> 5 | P56: =RANK(P55,(P$6,P$8,P$10,P$12,P$14,P$16,P$18,P$20,P$22,P$24,P$26,P$28,P$30,P$32,P$34,P$36,P$38,P$40,P$42,P$44,P$46,P$48,P$50,P$52,P$54,P$56,P$58,P$60,P$62,P$64,P$66,P$68,P$70,P$72,P$74,P$76,P$78,P$80,P$82,P$84,P$86,P$88,P$90,P$92,P$94,P$96,P$98,P$100,P$102,P$104,P$106,P$108,P$110,P$112,P$114,P$116,P$118,P$120,P$122,P$124)) -> 5
A57: Academy | B57: 3 | C57: 15.40 | D57: 15.30 | E57: 30.70 | F57: 15.80 | G57: 15.60 | H57: 14.50 | I57: 22.95 | J57: 15.20 | K57: 15.30 | L57: 14.90 | M57: 22.850 | N57: 76.500 | O57: 0.0 | P57: 76.500
C58: =RANK(C57,(C$6,C$8,C$10,C$12,C$14,C$16,C$18,C$20,C$22,C$24,C$26,C$28,C$30,C$32,C$34,C$36,C$38,C$40,C$42,C$44,C$46,C$48,C$50,C$52,C$54,C$56,C$58,C$60,C$62,C$64,C$66,C$68,C$70,C$72,C$74,C$76,C$78,C$80,C$82,C$84,C$86,C$88,C$90,C$92,C$94,C$96,C$98,C$100,C$102,C$104,C$106,C$108,C$110,C$112,C$114,C$116,C$118,C$120,C$122,C$124)) -> 6 | D58: =RANK(D57,(D$6,D$8,D$10,D$12,D$14,D$16,D$18,D$20,D$22,D$24,D$26,D$28,D$30,D$32,D$34,D$36,D$38,D$40,D$42,D$44,D$46,D$48,D$50,D$52,D$54,D$56,D$58,D$60,D$62,D$64,D$66,D$68,D$70,D$72,D$74,D$76,D$78,D$80,D$82,D$84,D$86,D$88,D$90,D$92,D$94,D$96,D$98,D$100,D$102,D$104,D$106,D$108,D$110,D$112,D$114,D$116,D$118,D$120,D$122,D$124)) -> 6 | E58: =RANK(E57,(E$6,E$8,E$10,E$12,E$14,E$16,E$18,E$20,E$22,E$24,E$26,E$28,E$30,E$32,E$34,E$36,E$38,E$40,E$42,E$44,E$46,E$48,E$50,E$52,E$54,E$56,E$58,E$60,E$62,E$64,E$66,E$68,E$70,E$72,E$74,E$76,E$78,E$80,E$82,E$84,E$86,E$88,E$90,E$92,E$94,E$96,E$98,E$100,E$102,E$104,E$106,E$108,E$110,E$112,E$114,E$116,E$118,E$120,E$122,E$124)) -> 6 | F58: =RANK(F57,(F$6,F$8,F$10,F$12,F$14,F$16,F$18,F$20,F$22,F$24,F$26,F$28,F$30,F$32,F$34,F$36,F$38,F$40,F$42,F$44,F$46,F$48,F$50,F$52,F$54,F$56,F$58,F$60,F$62,F$64,F$66,F$68,F$70,F$72,F$74,F$76,F$78,F$80,F$82,F$84,F$86,F$88,F$90,F$92,F$94,F$96,F$98,F$100,F$102,F$104,F$106,F$108,F$110,F$112,F$114,F$116,F$118,F$120,F$122,F$124)) -> 6 | G58: =RANK(G57,(G$6,G$8,G$10,G$12,G$14,G$16,G$18,G$20,G$22,G$24,G$26,G$28,G$30,G$32,G$34,G$36,G$38,G$40,G$42,G$44,G$46,G$48,G$50,G$52,G$54,G$56,G$58,G$60,G$62,G$64,G$66,G$68,G$70,G$72,G$74,G$76,G$78,G$80,G$82,G$84,G$86,G$88,G$90,G$92,G$94,G$96,G$98,G$100,G$102,G$104,G$106,G$108,G$110,G$112,G$114,G$116,G$118,G$120,G$122,G$124)) -> 6 | H58: =RANK(H57,(H$6,H$8,H$10,H$12,H$14,H$16,H$18,H$20,H$22,H$24,H$26,H$28,H$30,H$32,H$34,H$36,H$38,H$40,H$42,H$44,H$46,H$48,H$50,H$52,H$54,H$56,H$58,H$60,H$62,H$64,H$66,H$68,H$70,H$72,H$74,H$76,H$78,H$80,H$82,H$84,H$86,H$88,H$90,H$92,H$94,H$96,H$98,H$100,H$102,H$104,H$106,H$108,H$110,H$112,H$114,H$116,H$118,H$120,H$122,H$124)) -> 7 | I58: =RANK(I57,(I$6,I$8,I$10,I$12,I$14,I$16,I$18,I$20,I$22,I$24,I$26,I$28,I$30,I$32,I$34,I$36,I$38,I$40,I$42,I$44,I$46,I$48,I$50,I$52,I$54,I$56,I$58,I$60,I$62,I$64,I$66,I$68,I$70,I$72,I$74,I$76,I$78,I$80,I$82,I$84,I$86,I$88,I$90,I$92,I$94,I$96,I$98,I$100,I$102,I$104,I$106,I$108,I$110,I$112,I$114,I$116,I$118,I$120,I$122,I$124)) -> 6 | J58: =RANK(J57,(J$6,J$8,J$10,J$12,J$14,J$16,J$18,J$20,J$22,J$24,J$26,J$28,J$30,J$32,J$34,J$36,J$38,J$40,J$42,J$44,J$46,J$48,J$50,J$52,J$54,J$56,J$58,J$60,J$62,J$64,J$66,J$68,J$70,J$72,J$74,J$76,J$78,J$80,J$82,J$84,J$86,J$88,J$90,J$92,J$94,J$96,J$98,J$100,J$102,J$104,J$106,J$108,J$110,J$112,J$114,J$116,J$118,J$120,J$122,J$124)) -> 6 | K58: =RANK(K57,(K$6,K$8,K$10,K$12,K$14,K$16,K$18,K$20,K$22,K$24,K$26,K$28,K$30,K$32,K$34,K$36,K$38,K$40,K$42,K$44,K$46,K$48,K$50,K$52,K$54,K$56,K$58,K$60,K$62,K$64,K$66,K$68,K$70,K$72,K$74,K$76,K$78,K$80,K$82,K$84,K$86,K$88,K$90,K$92,K$94,K$96,K$98,K$100,K$102,K$104,K$106,K$108,K$110,K$112,K$114,K$116,K$118,K$120,K$122,K$124)) -> 6 | L58: =RANK(L57,(L$6,L$8,L$10,L$12,L$14,L$16,L$18,L$20,L$22,L$24,L$26,L$28,L$30,L$32,L$34,L$36,L$38,L$40,L$42,L$44,L$46,L$48,L$50,L$52,L$54,L$56,L$58,L$60,L$62,L$64,L$66,L$68,L$70,L$72,L$74,L$76,L$78,L$80,L$82,L$84,L$86,L$88,L$90,L$92,L$94,L$96,L$98,L$100,L$102,L$104,L$106,L$108,L$110,L$112,L$114,L$116,L$118,L$120,L$122,L$124)) -> 6 | M58: =RANK(M57,(M$6,M$8,M$10,M$12,M$14,M$16,M$18,M$20,M$22,M$24,M$26,M$28,M$30,M$32,M$34,M$36,M$38,M$40,M$42,M$44,M$46,M$48,M$50,M$52,M$54,M$56,M$58,M$60,M$62,M$64,M$66,M$68,M$70,M$72,M$74,M$76,M$78,M$80,M$82,M$84,M$86,M$88,M$90,M$92,M$94,M$96,M$98,M$100,M$102,M$104,M$106,M$108,M$110,M$112,M$114,M$116,M$118,M$120,M$122,M$124)) -> 6 | N58: =RANK(N57,(N$6,N$8,N$10,N$12,N$14,N$16,N$18,N$20,N$22,N$24,N$26,N$28,N$30,N$32,N$34,N$36,N$38,N$40,N$42,N$44,N$46,N$48,N$50,N$52,N$54,N$56,N$58,N$60,N$62,N$64,N$66,N$68,N$70,N$72,N$74,N$76,N$78,N$80,N$82,N$84,N$86,N$88,N$90,N$92,N$94,N$96,N$98,N$100,N$102,N$104,N$106,N$108,N$110,N$112,N$114,N$116,N$118,N$120,N$122,N$124)) -> 6 | P58: =RANK(P57,(P$6,P$8,P$10,P$12,P$14,P$16,P$18,P$20,P$22,P$24,P$26,P$28,P$30,P$32,P$34,P$36,P$38,P$40,P$42,P$44,P$46,P$48,P$50,P$52,P$54,P$56,P$58,P$60,P$62,P$64,P$66,P$68,P$70,P$72,P$74,P$76,P$78,P$80,P$82,P$84,P$86,P$88,P$90,P$92,P$94,P$96,P$98,P$100,P$102,P$104,P$106,P$108,P$110,P$112,P$114,P$116,P$118,P$120,P$122,P$124)) -> 6
A59: Genesis | B59: 2 | C59: 14.60 | D59: 15.00 | E59: 29.60 | F59: 14.80 | G59: 15.10 | H59: 14.70 | I59: 22.30 | J59: 14.60 | K59: 14.70 | L59: 14.20 | M59: 21.750 | N59: 73.650 | O59: 0.0 | P59: 73.650
C60: =RANK(C59,(C$6,C$8,C$10,C$12,C$14,C$16,C$18,C$20,C$22,C$24,C$26,C$28,C$30,C$32,C$34,C$36,C$38,C$40,C$42,C$44,C$46,C$48,C$50,C$52,C$54,C$56,C$58,C$60,C$62,C$64,C$66,C$68,C$70,C$72,C$74,C$76,C$78,C$80,C$82,C$84,C$86,C$88,C$90,C$92,C$94,C$96,C$98,C$100,C$102,C$104,C$106,C$108,C$110,C$112,C$114,C$116,C$118,C$120,C$122,C$124)) -> 7 | D60: =RANK(D59,(D$6,D$8,D$10,D$12,D$14,D$16,D$18,D$20,D$22,D$24,D$26,D$28,D$30,D$32,D$34,D$36,D$38,D$40,D$42,D$44,D$46,D$48,D$50,D$52,D$54,D$56,D$58,D$60,D$62,D$64,D$66,D$68,D$70,D$72,D$74,D$76,D$78,D$80,D$82,D$84,D$86,D$88,D$90,D$92,D$94,D$96,D$98,D$100,D$102,D$104,D$106,D$108,D$110,D$112,D$114,D$116,D$118,D$120,D$122,D$124)) -> 7 | E60: =RANK(E59,(E$6,E$8,E$10,E$12,E$14,E$16,E$18,E$20,E$22,E$24,E$26,E$28,E$30,E$32,E$34,E$36,E$38,E$40,E$42,E$44,E$46,E$48,E$50,E$52,E$54,E$56,E$58,E$60,E$62,E$64,E$66,E$68,E$70,E$72,E$74,E$76,E$78,E$80,E$82,E$84,E$86,E$88,E$90,E$92,E$94,E$96,E$98,E$100,E$102,E$104,E$106,E$108,E$110,E$112,E$114,E$116,E$118,E$120,E$122,E$124)) -> 7 | F60: =RANK(F59,(F$6,F$8,F$10,F$12,F$14,F$16,F$18,F$20,F$22,F$24,F$26,F$28,F$30,F$32,F$34,F$36,F$38,F$40,F$42,F$44,F$46,F$48,F$50,F$52,F$54,F$56,F$58,F$60,F$62,F$64,F$66,F$68,F$70,F$72,F$74,F$76,F$78,F$80,F$82,F$84,F$86,F$88,F$90,F$92,F$94,F$96,F$98,F$100,F$102,F$104,F$106,F$108,F$110,F$112,F$114,F$116,F$118,F$120,F$122,F$124)) -> 7 | G60: =RANK(G59,(G$6,G$8,G$10,G$12,G$14,G$16,G$18,G$20,G$22,G$24,G$26,G$28,G$30,G$32,G$34,G$36,G$38,G$40,G$42,G$44,G$46,G$48,G$50,G$52,G$54,G$56,G$58,G$60,G$62,G$64,G$66,G$68,G$70,G$72,G$74,G$76,G$78,G$80,G$82,G$84,G$86,G$88,G$90,G$92,G$94,G$96,G$98,G$100,G$102,G$104,G$106,G$108,G$110,G$112,G$114,G$116,G$118,G$120,G$122,G$124)) -> 7 | H60: =RANK(H59,(H$6,H$8,H$10,H$12,H$14,H$16,H$18,H$20,H$22,H$24,H$26,H$28,H$30,H$32,H$34,H$36,H$38,H$40,H$42,H$44,H$46,H$48,H$50,H$52,H$54,H$56,H$58,H$60,H$62,H$64,H$66,H$68,H$70,H$72,H$74,H$76,H$78,H$80,H$82,H$84,H$86,H$88,H$90,H$92,H$94,H$96,H$98,H$100,H$102,H$104,H$106,H$108,H$110,H$112,H$114,H$116,H$118,H$120,H$122,H$124)) -> 6 | I60: =RANK(I59,(I$6,I$8,I$10,I$12,I$14,I$16,I$18,I$20,I$22,I$24,I$26,I$28,I$30,I$32,I$34,I$36,I$38,I$40,I$42,I$44,I$46,I$48,I$50,I$52,I$54,I$56,I$58,I$60,I$62,I$64,I$66,I$68,I$70,I$72,I$74,I$76,I$78,I$80,I$82,I$84,I$86,I$88,I$90,I$92,I$94,I$96,I$98,I$100,I$102,I$104,I$106,I$108,I$110,I$112,I$114,I$116,I$118,I$120,I$122,I$124)) -> 7 | J60: =RANK(J59,(J$6,J$8,J$10,J$12,J$14,J$16,J$18,J$20,J$22,J$24,J$26,J$28,J$30,J$32,J$34,J$36,J$38,J$40,J$42,J$44,J$46,J$48,J$50,J$52,J$54,J$56,J$58,J$60,J$62,J$64,J$66,J$68,J$70,J$72,J$74,J$76,J$78,J$80,J$82,J$84,J$86,J$88,J$90,J$92,J$94,J$96,J$98,J$100,J$102,J$104,J$106,J$108,J$110,J$112,J$114,J$116,J$118,J$120,J$122,J$124)) -> 7 | K60: =RANK(K59,(K$6,K$8,K$10,K$12,K$14,K$16,K$18,K$20,K$22,K$24,K$26,K$28,K$30,K$32,K$34,K$36,K$38,K$40,K$42,K$44,K$46,K$48,K$50,K$52,K$54,K$56,K$58,K$60,K$62,K$64,K$66,K$68,K$70,K$72,K$74,K$76,K$78,K$80,K$82,K$84,K$86,K$88,K$90,K$92,K$94,K$96,K$98,K$100,K$102,K$104,K$106,K$108,K$110,K$112,K$114,K$116,K$118,K$120,K$122,K$124)) -> 7 | L60: =RANK(L59,(L$6,L$8,L$10,L$12,L$14,L$16,L$18,L$20,L$22,L$24,L$26,L$28,L$30,L$32,L$34,L$36,L$38,L$40,L$42,L$44,L$46,L$48,L$50,L$52,L$54,L$56,L$58,L$60,L$62,L$64,L$66,L$68,L$70,L$72,L$74,L$76,L$78,L$80,L$82,L$84,L$86,L$88,L$90,L$92,L$94,L$96,L$98,L$100,L$102,L$104,L$106,L$108,L$110,L$112,L$114,L$116,L$118,L$120,L$122,L$124)) -> 7 | M60: =RANK(M59,(M$6,M$8,M$10,M$12,M$14,M$16,M$18,M$20,M$22,M$24,M$26,M$28,M$30,M$32,M$34,M$36,M$38,M$40,M$42,M$44,M$46,M$48,M$50,M$52,M$54,M$56,M$58,M$60,M$62,M$64,M$66,M$68,M$70,M$72,M$74,M$76,M$78,M$80,M$82,M$84,M$86,M$88,M$90,M$92,M$94,M$96,M$98,M$100,M$102,M$104,M$106,M$108,M$110,M$112,M$114,M$116,M$118,M$120,M$122,M$124)) -> 7 | N60: =RANK(N59,(N$6,N$8,N$10,N$12,N$14,N$16,N$18,N$20,N$22,N$24,N$26,N$28,N$30,N$32,N$34,N$36,N$38,N$40,N$42,N$44,N$46,N$48,N$50,N$52,N$54,N$56,N$58,N$60,N$62,N$64,N$66,N$68,N$70,N$72,N$74,N$76,N$78,N$80,N$82,N$84,N$86,N$88,N$90,N$92,N$94,N$96,N$98,N$100,N$102,N$104,N$106,N$108,N$110,N$112,N$114,N$116,N$118,N$120,N$122,N$124)) -> 7 | P60: =RANK(P59,(P$6,P$8,P$10,P$12,P$14,P$16,P$18,P$20,P$22,P$24,P$26,P$28,P$30,P$32,P$34,P$36,P$38,P$40,P$42,P$44,P$46,P$48,P$50,P$52,P$54,P$56,P$58,P$60,P$62,P$64,P$66,P$68,P$70,P$72,P$74,P$76,P$78,P$80,P$82,P$84,P$86,P$88,P$90,P$92,P$94,P$96,P$98,P$100,P$102,P$104,P$106,P$108,P$110,P$112,P$114,P$116,P$118,P$120,P$122,P$124)) -> 7
A61: Jersey | B61: 1 | C61: 14.00 | D61: 14.20 | E61: 28.20 | F61: 12.90 | G61: 14.10 | H61: 13.60 | I61: 20.30 | J61: 13.70 | K61: 14.00 | L61: 12.70 | M61: 20.200 | N61: 68.700 | O61: 0.0 | P61: 68.700
A62: Surf | C62: =RANK(C61,(C$6,C$8,C$10,C$12,C$14,C$16,C$18,C$20,C$22,C$24,C$26,C$28,C$30,C$32,C$34,C$36,C$38,C$40,C$42,C$44,C$46,C$48,C$50,C$52,C$54,C$56,C$58,C$60,C$62,C$64,C$66,C$68,C$70,C$72,C$74,C$76,C$78,C$80,C$82,C$84,C$86,C$88,C$90,C$92,C$94,C$96,C$98,C$100,C$102,C$104,C$106,C$108,C$110,C$112,C$114,C$116,C$118,C$120,C$122,C$124)) -> 8 | D62: =RANK(D61,(D$6,D$8,D$10,D$12,D$14,D$16,D$18,D$20,D$22,D$24,D$26,D$28,D$30,D$32,D$34,D$36,D$38,D$40,D$42,D$44,D$46,D$48,D$50,D$52,D$54,D$56,D$58,D$60,D$62,D$64,D$66,D$68,D$70,D$72,D$74,D$76,D$78,D$80,D$82,D$84,D$86,D$88,D$90,D$92,D$94,D$96,D$98,D$100,D$102,D$104,D$106,D$108,D$110,D$112,D$114,D$116,D$118,D$120,D$122,D$124)) -> 8 | E62: =RANK(E61,(E$6,E$8,E$10,E$12,E$14,E$16,E$18,E$20,E$22,E$24,E$26,E$28,E$30,E$32,E$34,E$36,E$38,E$40,E$42,E$44,E$46,E$48,E$50,E$52,E$54,E$56,E$58,E$60,E$62,E$64,E$66,E$68,E$70,E$72,E$74,E$76,E$78,E$80,E$82,E$84,E$86,E$88,E$90,E$92,E$94,E$96,E$98,E$100,E$102,E$104,E$106,E$108,E$110,E$112,E$114,E$116,E$118,E$120,E$122,E$124)) -> 8 | F62: =RANK(F61,(F$6,F$8,F$10,F$12,F$14,F$16,F$18,F$20,F$22,F$24,F$26,F$28,F$30,F$32,F$34,F$36,F$38,F$40,F$42,F$44,F$46,F$48,F$50,F$52,F$54,F$56,F$58,F$60,F$62,F$64,F$66,F$68,F$70,F$72,F$74,F$76,F$78,F$80,F$82,F$84,F$86,F$88,F$90,F$92,F$94,F$96,F$98,F$100,F$102,F$104,F$106,F$108,F$110,F$112,F$114,F$116,F$118,F$120,F$122,F$124)) -> 8 | G62: =RANK(G61,(G$6,G$8,G$10,G$12,G$14,G$16,G$18,G$20,G$22,G$24,G$26,G$28,G$30,G$32,G$34,G$36,G$38,G$40,G$42,G$44,G$46,G$48,G$50,G$52,G$54,G$56,G$58,G$60,G$62,G$64,G$66,G$68,G$70,G$72,G$74,G$76,G$78,G$80,G$82,G$84,G$86,G$88,G$90,G$92,G$94,G$96,G$98,G$100,G$102,G$104,G$106,G$108,G$110,G$112,G$114,G$116,G$118,G$120,G$122,G$124)) -> 8 | H62: =RANK(H61,(H$6,H$8,H$10,H$12,H$14,H$16,H$18,H$20,H$22,H$24,H$26,H$28,H$30,H$32,H$34,H$36,H$38,H$40,H$42,H$44,H$46,H$48,H$50,H$52,H$54,H$56,H$58,H$60,H$62,H$64,H$66,H$68,H$70,H$72,H$74,H$76,H$78,H$80,H$82,H$84,H$86,H$88,H$90,H$92,H$94,H$96,H$98,H$100,H$102,H$104,H$106,H$108,H$110,H$112,H$114,H$116,H$118,H$120,H$122,H$124)) -> 8 | I62: =RANK(I61,(I$6,I$8,I$10,I$12,I$14,I$16,I$18,I$20,I$22,I$24,I$26,I$28,I$30,I$32,I$34,I$36,I$38,I$40,I$42,I$44,I$46,I$48,I$50,I$52,I$54,I$56,I$58,I$60,I$62,I$64,I$66,I$68,I$70,I$72,I$74,I$76,I$78,I$80,I$82,I$84,I$86,I$88,I$90,I$92,I$94,I$96,I$98,I$100,I$102,I$104,I$106,I$108,I$110,I$112,I$114,I$116,I$118,I$120,I$122,I$124)) -> 8 | J62: =RANK(J61,(J$6,J$8,J$10,J$12,J$14,J$16,J$18,J$20,J$22,J$24,J$26,J$28,J$30,J$32,J$34,J$36,J$38,J$40,J$42,J$44,J$46,J$48,J$50,J$52,J$54,J$56,J$58,J$60,J$62,J$64,J$66,J$68,J$70,J$72,J$74,J$76,J$78,J$80,J$82,J$84,J$86,J$88,J$90,J$92,J$94,J$96,J$98,J$100,J$102,J$104,J$106,J$108,J$110,J$112,J$114,J$116,J$118,J$120,J$122,J$124)) -> 8 | K62: =RANK(K61,(K$6,K$8,K$10,K$12,K$14,K$16,K$18,K$20,K$22,K$24,K$26,K$28,K$30,K$32,K$34,K$36,K$38,K$40,K$42,K$44,K$46,K$48,K$50,K$52,K$54,K$56,K$58,K$60,K$62,K$64,K$66,K$68,K$70,K$72,K$74,K$76,K$78,K$80,K$82,K$84,K$86,K$88,K$90,K$92,K$94,K$96,K$98,K$100,K$102,K$104,K$106,K$108,K$110,K$112,K$114,K$116,K$118,K$120,K$122,K$124)) -> 8 | L62: =RANK(L61,(L$6,L$8,L$10,L$12,L$14,L$16,L$18,L$20,L$22,L$24,L$26,L$28,L$30,L$32,L$34,L$36,L$38,L$40,L$42,L$44,L$46,L$48,L$50,L$52,L$54,L$56,L$58,L$60,L$62,L$64,L$66,L$68,L$70,L$72,L$74,L$76,L$78,L$80,L$82,L$84,L$86,L$88,L$90,L$92,L$94,L$96,L$98,L$100,L$102,L$104,L$106,L$108,L$110,L$112,L$114,L$116,L$118,L$120,L$122,L$124)) -> 8 | M62: =RANK(M61,(M$6,M$8,M$10,M$12,M$14,M$16,M$18,M$20,M$22,M$24,M$26,M$28,M$30,M$32,M$34,M$36,M$38,M$40,M$42,M$44,M$46,M$48,M$50,M$52,M$54,M$56,M$58,M$60,M$62,M$64,M$66,M$68,M$70,M$72,M$74,M$76,M$78,M$80,M$82,M$84,M$86,M$88,M$90,M$92,M$94,M$96,M$98,M$100,M$102,M$104,M$106,M$108,M$110,M$112,M$114,M$116,M$118,M$120,M$122,M$124)) -> 8 | N62: =RANK(N61,(N$6,N$8,N$10,N$12,N$14,N$16,N$18,N$20,N$22,N$24,N$26,N$28,N$30,N$32,N$34,N$36,N$38,N$40,N$42,N$44,N$46,N$48,N$50,N$52,N$54,N$56,N$58,N$60,N$62,N$64,N$66,N$68,N$70,N$72,N$74,N$76,N$78,N$80,N$82,N$84,N$86,N$88,N$90,N$92,N$94,N$96,N$98,N$100,N$102,N$104,N$106,N$108,N$110,N$112,N$114,N$116,N$118,N$120,N$122,N$124)) -> 8 | P62: =RANK(P61,(P$6,P$8,P$10,P$12,P$14,P$16,P$18,P$20,P$22,P$24,P$26,P$28,P$30,P$32,P$34,P$36,P$38,P$40,P$42,P$44,P$46,P$48,P$50,P$52,P$54,P$56,P$58,P$60,P$62,P$64,P$66,P$68,P$70,P$72,P$74,P$76,P$78,P$80,P$82,P$84,P$86,P$88,P$90,P$92,P$94,P$96,P$98,P$100,P$102,P$104,P$106,P$108,P$110,P$112,P$114,P$116,P$118,P$120,P$122,P$124)) -> 8
A65: 8/2/2022 Lima, Ohio
C66: General Effect | F66: Visual | J66: Music
C67: 1 | D67: 2 | F67: Proficiency | G67: Analysis | H67: Color Guard | J67: Brass | K67: Analysis | L67: Percussion | N67: Sub | P67: Total
C68: B. Kuhn | D68: J. Denton | E68: Total | F68: K. Kuhn | G68: J. Purisfull | H68: M. Bowers | I68: Total ÷2 | J68: B. Crisp | K68: C. Armbruster | L68: T. Fox | M68: Total ÷2 | N68: Total | O68: Pen | P68: Score
A69: DCI Open Class | C69: 20 | D69: 20 | E69: 40 | F69: 20 | G69: 20 | H69: 20 | I69: 30 | J69: 20 | K69: 20 | L69: 20 | M69: 30 | N69: 100 | P69: 100
A70: Gold | B70: 2 | C70: 15.00 | D70: 14.90 | E70: 29.90 | F70: 14.90 | G70: 15.00 | H70: 14.90 | I70: 22.40 | J70: 14.60 | K70: 14.80 | L70: 15.10 | M70: 22.25 | N70: 74.55 | O70: 0.0 | P70: 74.55
C71: =RANK(C70,(C$6,C$8,C$10,C$12,C$14,C$16,C$18,C$20,C$22,C$24,C$26,C$28,C$30,C$32,C$34,C$36,C$38,C$40,C$42,C$44,C$46,C$48,C$50,C$52,C$54,C$56,C$58,C$60,C$62,C$64,C$66,C$68,C$70,C$72,C$74,C$76,C$78,C$80,C$82,C$84,C$86,C$88,C$90,C$92,C$94,C$96,C$98,C$100,C$102,C$104,C$106,C$108,C$110,C$112,C$114,C$116,C$118,C$120,C$122,C$124)) -> 1 | D71: =RANK(D70,(D$6,D$8,D$10,D$12,D$14,D$16,D$18,D$20,D$22,D$24,D$26,D$28,D$30,D$32,D$34,D$36,D$38,D$40,D$42,D$44,D$46,D$48,D$50,D$52,D$54,D$56,D$58,D$60,D$62,D$64,D$66,D$68,D$70,D$72,D$74,D$76,D$78,D$80,D$82,D$84,D$86,D$88,D$90,D$92,D$94,D$96,D$98,D$100,D$102,D$104,D$106,D$108,D$110,D$112,D$114,D$116,D$118,D$120,D$122,D$124)) -> 1 | E71: =RANK(E70,(E$6,E$8,E$10,E$12,E$14,E$16,E$18,E$20,E$22,E$24,E$26,E$28,E$30,E$32,E$34,E$36,E$38,E$40,E$42,E$44,E$46,E$48,E$50,E$52,E$54,E$56,E$58,E$60,E$62,E$64,E$66,E$68,E$70,E$72,E$74,E$76,E$78,E$80,E$82,E$84,E$86,E$88,E$90,E$92,E$94,E$96,E$98,E$100,E$102,E$104,E$106,E$108,E$110,E$112,E$114,E$116,E$118,E$120,E$122,E$124)) -> 1 | F71: =RANK(F70,(F$6,F$8,F$10,F$12,F$14,F$16,F$18,F$20,F$22,F$24,F$26,F$28,F$30,F$32,F$34,F$36,F$38,F$40,F$42,F$44,F$46,F$48,F$50,F$52,F$54,F$56,F$58,F$60,F$62,F$64,F$66,F$68,F$70,F$72,F$74,F$76,F$78,F$80,F$82,F$84,F$86,F$88,F$90,F$92,F$94,F$96,F$98,F$100,F$102,F$104,F$106,F$108,F$110,F$112,F$114,F$116,F$118,F$120,F$122,F$124)) -> 1 | G71: =RANK(G70,(G$6,G$8,G$10,G$12,G$14,G$16,G$18,G$20,G$22,G$24,G$26,G$28,G$30,G$32,G$34,G$36,G$38,G$40,G$42,G$44,G$46,G$48,G$50,G$52,G$54,G$56,G$58,G$60,G$62,G$64,G$66,G$68,G$70,G$72,G$74,G$76,G$78,G$80,G$82,G$84,G$86,G$88,G$90,G$92,G$94,G$96,G$98,G$100,G$102,G$104,G$106,G$108,G$110,G$112,G$114,G$116,G$118,G$120,G$122,G$124)) -> 1 | H71: =RANK(H70,(H$6,H$8,H$10,H$12,H$14,H$16,H$18,H$20,H$22,H$24,H$26,H$28,H$30,H$32,H$34,H$36,H$38,H$40,H$42,H$44,H$46,H$48,H$50,H$52,H$54,H$56,H$58,H$60,H$62,H$64,H$66,H$68,H$70,H$72,H$74,H$76,H$78,H$80,H$82,H$84,H$86,H$88,H$90,H$92,H$94,H$96,H$98,H$100,H$102,H$104,H$106,H$108,H$110,H$112,H$114,H$116,H$118,H$120,H$122,H$124)) -> 2 | I71: =RANK(I70,(I$6,I$8,I$10,I$12,I$14,I$16,I$18,I$20,I$22,I$24,I$26,I$28,I$30,I$32,I$34,I$36,I$38,I$40,I$42,I$44,I$46,I$48,I$50,I$52,I$54,I$56,I$58,I$60,I$62,I$64,I$66,I$68,I$70,I$72,I$74,I$76,I$78,I$80,I$82,I$84,I$86,I$88,I$90,I$92,I$94,I$96,I$98,I$100,I$102,I$104,I$106,I$108,I$110,I$112,I$114,I$116,I$118,I$120,I$122,I$124)) -> 1 | J71: =RANK(J70,(J$6,J$8,J$10,J$12,J$14,J$16,J$18,J$20,J$22,J$24,J$26,J$28,J$30,J$32,J$34,J$36,J$38,J$40,J$42,J$44,J$46,J$48,J$50,J$52,J$54,J$56,J$58,J$60,J$62,J$64,J$66,J$68,J$70,J$72,J$74,J$76,J$78,J$80,J$82,J$84,J$86,J$88,J$90,J$92,J$94,J$96,J$98,J$100,J$102,J$104,J$106,J$108,J$110,J$112,J$114,J$116,J$118,J$120,J$122,J$124)) -> 1 | K71: =RANK(K70,(K$6,K$8,K$10,K$12,K$14,K$16,K$18,K$20,K$22,K$24,K$26,K$28,K$30,K$32,K$34,K$36,K$38,K$40,K$42,K$44,K$46,K$48,K$50,K$52,K$54,K$56,K$58,K$60,K$62,K$64,K$66,K$68,K$70,K$72,K$74,K$76,K$78,K$80,K$82,K$84,K$86,K$88,K$90,K$92,K$94,K$96,K$98,K$100,K$102,K$104,K$106,K$108,K$110,K$112,K$114,K$116,K$118,K$120,K$122,K$124)) -> 1 | L71: =RANK(L70,(L$6,L$8,L$10,L$12,L$14,L$16,L$18,L$20,L$22,L$24,L$26,L$28,L$30,L$32,L$34,L$36,L$38,L$40,L$42,L$44,L$46,L$48,L$50,L$52,L$54,L$56,L$58,L$60,L$62,L$64,L$66,L$68,L$70,L$72,L$74,L$76,L$78,L$80,L$82,L$84,L$86,L$88,L$90,L$92,L$94,L$96,L$98,L$100,L$102,L$104,L$106,L$108,L$110,L$112,L$114,L$116,L$118,L$120,L$122,L$124)) -> 1 | M71: =RANK(M70,(M$6,M$8,M$10,M$12,M$14,M$16,M$18,M$20,M$22,M$24,M$26,M$28,M$30,M$32,M$34,M$36,M$38,M$40,M$42,M$44,M$46,M$48,M$50,M$52,M$54,M$56,M$58,M$60,M$62,M$64,M$66,M$68,M$70,M$72,M$74,M$76,M$78,M$80,M$82,M$84,M$86,M$88,M$90,M$92,M$94,M$96,M$98,M$100,M$102,M$104,M$106,M$108,M$110,M$112,M$114,M$116,M$118,M$120,M$122,M$124)) -> 1 | N71: =RANK(N70,(N$6,N$8,N$10,N$12,N$14,N$16,N$18,N$20,N$22,N$24,N$26,N$28,N$30,N$32,N$34,N$36,N$38,N$40,N$42,N$44,N$46,N$48,N$50,N$52,N$54,N$56,N$58,N$60,N$62,N$64,N$66,N$68,N$70,N$72,N$74,N$76,N$78,N$80,N$82,N$84,N$86,N$88,N$90,N$92,N$94,N$96,N$98,N$100,N$102,N$104,N$106,N$108,N$110,N$112,N$114,N$116,N$118,N$120,N$122,N$124)) -> 1 | P71: =RANK(P70,(P$6,P$8,P$10,P$12,P$14,P$16,P$18,P$20,P$22,P$24,P$26,P$28,P$30,P$32,P$34,P$36,P$38,P$40,P$42,P$44,P$46,P$48,P$50,P$52,P$54,P$56,P$58,P$60,P$62,P$64,P$66,P$68,P$70,P$72,P$74,P$76,P$78,P$80,P$82,P$84,P$86,P$88,P$90,P$92,P$94,P$96,P$98,P$100,P$102,P$104,P$106,P$108,P$110,P$112,P$114,P$116,P$118,P$120,P$122,P$124)) -> 1
A72: Southwind | B72: 3 | C72: 14.50 | D72: 14.30 | E72: 28.80 | F72: 14.20 | G72: 14.20 | H72: 15.10 | I72: 21.75 | J72: 14.00 | K72: 14.20 | L72: 14.50 | M72: 21.35 | N72: 71.90 | O72: 0.0 | P72: 71.90
C73: =RANK(C72,(C$6,C$8,C$10,C$12,C$14,C$16,C$18,C$20,C$22,C$24,C$26,C$28,C$30,C$32,C$34,C$36,C$38,C$40,C$42,C$44,C$46,C$48,C$50,C$52,C$54,C$56,C$58,C$60,C$62,C$64,C$66,C$68,C$70,C$72,C$74,C$76,C$78,C$80,C$82,C$84,C$86,C$88,C$90,C$92,C$94,C$96,C$98,C$100,C$102,C$104,C$106,C$108,C$110,C$112,C$114,C$116,C$118,C$120,C$122,C$124)) -> 2 | D73: =RANK(D72,(D$6,D$8,D$10,D$12,D$14,D$16,D$18,D$20,D$22,D$24,D$26,D$28,D$30,D$32,D$34,D$36,D$38,D$40,D$42,D$44,D$46,D$48,D$50,D$52,D$54,D$56,D$58,D$60,D$62,D$64,D$66,D$68,D$70,D$72,D$74,D$76,D$78,D$80,D$82,D$84,D$86,D$88,D$90,D$92,D$94,D$96,D$98,D$100,D$102,D$104,D$106,D$108,D$110,D$112,D$114,D$116,D$118,D$120,D$122,D$124)) -> 2 | E73: =RANK(E72,(E$6,E$8,E$10,E$12,E$14,E$16,E$18,E$20,E$22,E$24,E$26,E$28,E$30,E$32,E$34,E$36,E$38,E$40,E$42,E$44,E$46,E$48,E$50,E$52,E$54,E$56,E$58,E$60,E$62,E$64,E$66,E$68,E$70,E$72,E$74,E$76,E$78,E$80,E$82,E$84,E$86,E$88,E$90,E$92,E$94,E$96,E$98,E$100,E$102,E$104,E$106,E$108,E$110,E$112,E$114,E$116,E$118,E$120,E$122,E$124)) -> 2 | F73: =RANK(F72,(F$6,F$8,F$10,F$12,F$14,F$16,F$18,F$20,F$22,F$24,F$26,F$28,F$30,F$32,F$34,F$36,F$38,F$40,F$42,F$44,F$46,F$48,F$50,F$52,F$54,F$56,F$58,F$60,F$62,F$64,F$66,F$68,F$70,F$72,F$74,F$76,F$78,F$80,F$82,F$84,F$86,F$88,F$90,F$92,F$94,F$96,F$98,F$100,F$102,F$104,F$106,F$108,F$110,F$112,F$114,F$116,F$118,F$120,F$122,F$124)) -> 2 | G73: =RANK(G72,(G$6,G$8,G$10,G$12,G$14,G$16,G$18,G$20,G$22,G$24,G$26,G$28,G$30,G$32,G$34,G$36,G$38,G$40,G$42,G$44,G$46,G$48,G$50,G$52,G$54,G$56,G$58,G$60,G$62,G$64,G$66,G$68,G$70,G$72,G$74,G$76,G$78,G$80,G$82,G$84,G$86,G$88,G$90,G$92,G$94,G$96,G$98,G$100,G$102,G$104,G$106,G$108,G$110,G$112,G$114,G$116,G$118,G$120,G$122,G$124)) -> 2 | H73: =RANK(H72,(H$6,H$8,H$10,H$12,H$14,H$16,H$18,H$20,H$22,H$24,H$26,H$28,H$30,H$32,H$34,H$36,H$38,H$40,H$42,H$44,H$46,H$48,H$50,H$52,H$54,H$56,H$58,H$60,H$62,H$64,H$66,H$68,H$70,H$72,H$74,H$76,H$78,H$80,H$82,H$84,H$86,H$88,H$90,H$92,H$94,H$96,H$98,H$100,H$102,H$104,H$106,H$108,H$110,H$112,H$114,H$116,H$118,H$120,H$122,H$124)) -> 1 | I73: =RANK(I72,(I$6,I$8,I$10,I$12,I$14,I$16,I$18,I$20,I$22,I$24,I$26,I$28,I$30,I$32,I$34,I$36,I$38,I$40,I$42,I$44,I$46,I$48,I$50,I$52,I$54,I$56,I$58,I$60,I$62,I$64,I$66,I$68,I$70,I$72,I$74,I$76,I$78,I$80,I$82,I$84,I$86,I$88,I$90,I$92,I$94,I$96,I$98,I$100,I$102,I$104,I$106,I$108,I$110,I$112,I$114,I$116,I$118,I$120,I$122,I$124)) -> 2 | J73: =RANK(J72,(J$6,J$8,J$10,J$12,J$14,J$16,J$18,J$20,J$22,J$24,J$26,J$28,J$30,J$32,J$34,J$36,J$38,J$40,J$42,J$44,J$46,J$48,J$50,J$52,J$54,J$56,J$58,J$60,J$62,J$64,J$66,J$68,J$70,J$72,J$74,J$76,J$78,J$80,J$82,J$84,J$86,J$88,J$90,J$92,J$94,J$96,J$98,J$100,J$102,J$104,J$106,J$108,J$110,J$112,J$114,J$116,J$118,J$120,J$122,J$124)) -> 3 | K73: =RANK(K72,(K$6,K$8,K$10,K$12,K$14,K$16,K$18,K$20,K$22,K$24,K$26,K$28,K$30,K$32,K$34,K$36,K$38,K$40,K$42,K$44,K$46,K$48,K$50,K$52,K$54,K$56,K$58,K$60,K$62,K$64,K$66,K$68,K$70,K$72,K$74,K$76,K$78,K$80,K$82,K$84,K$86,K$88,K$90,K$92,K$94,K$96,K$98,K$100,K$102,K$104,K$106,K$108,K$110,K$112,K$114,K$116,K$118,K$120,K$122,K$124)) -> 2 | L73: =RANK(L72,(L$6,L$8,L$10,L$12,L$14,L$16,L$18,L$20,L$22,L$24,L$26,L$28,L$30,L$32,L$34,L$36,L$38,L$40,L$42,L$44,L$46,L$48,L$50,L$52,L$54,L$56,L$58,L$60,L$62,L$64,L$66,L$68,L$70,L$72,L$74,L$76,L$78,L$80,L$82,L$84,L$86,L$88,L$90,L$92,L$94,L$96,L$98,L$100,L$102,L$104,L$106,L$108,L$110,L$112,L$114,L$116,L$118,L$120,L$122,L$124)) -> 2 | M73: =RANK(M72,(M$6,M$8,M$10,M$12,M$14,M$16,M$18,M$20,M$22,M$24,M$26,M$28,M$30,M$32,M$34,M$36,M$38,M$40,M$42,M$44,M$46,M$48,M$50,M$52,M$54,M$56,M$58,M$60,M$62,M$64,M$66,M$68,M$70,M$72,M$74,M$76,M$78,M$80,M$82,M$84,M$86,M$88,M$90,M$92,M$94,M$96,M$98,M$100,M$102,M$104,M$106,M$108,M$110,M$112,M$114,M$116,M$118,M$120,M$122,M$124)) -> 2 | N73: =RANK(N72,(N$6,N$8,N$10,N$12,N$14,N$16,N$18,N$20,N$22,N$24,N$26,N$28,N$30,N$32,N$34,N$36,N$38,N$40,N$42,N$44,N$46,N$48,N$50,N$52,N$54,N$56,N$58,N$60,N$62,N$64,N$66,N$68,N$70,N$72,N$74,N$76,N$78,N$80,N$82,N$84,N$86,N$88,N$90,N$92,N$94,N$96,N$98,N$100,N$102,N$104,N$106,N$108,N$110,N$112,N$114,N$116,N$118,N$120,N$122,N$124)) -> 2 | P73: =RANK(P72,(P$6,P$8,P$10,P$12,P$14,P$16,P$18,P$20,P$22,P$24,P$26,P$28,P$30,P$32,P$34,P$36,P$38,P$40,P$42,P$44,P$46,P$48,P$50,P$52,P$54,P$56,P$58,P$60,P$62,P$64,P$66,P$68,P$70,P$72,P$74,P$76,P$78,P$80,P$82,P$84,P$86,P$88,P$90,P$92,P$94,P$96,P$98,P$100,P$102,P$104,P$106,P$108,P$110,P$112,P$114,P$116,P$118,P$120,P$122,P$124)) -> 2
A74: Legends | B74: 5 | C74: 14.30 | D74: 13.90 | E74: 28.20 | F74: 13.30 | G74: 14.00 | H74: 14.30 | I74: 20.80 | J74: 14.20 | K74: 13.40 | L74: 14.30 | M74: 20.95 | N74: 69.95 | O74: 0.0 | P74: 69.95
C75: =RANK(C74,(C$6,C$8,C$10,C$12,C$14,C$16,C$18,C$20,C$22,C$24,C$26,C$28,C$30,C$32,C$34,C$36,C$38,C$40,C$42,C$44,C$46,C$48,C$50,C$52,C$54,C$56,C$58,C$60,C$62,C$64,C$66,C$68,C$70,C$72,C$74,C$76,C$78,C$80,C$82,C$84,C$86,C$88,C$90,C$92,C$94,C$96,C$98,C$100,C$102,C$104,C$106,C$108,C$110,C$112,C$114,C$116,C$118,C$120,C$122,C$124)) -> 3 | D75: =RANK(D74,(D$6,D$8,D$10,D$12,D$14,D$16,D$18,D$20,D$22,D$24,D$26,D$28,D$30,D$32,D$34,D$36,D$38,D$40,D$42,D$44,D$46,D$48,D$50,D$52,D$54,D$56,D$58,D$60,D$62,D$64,D$66,D$68,D$70,D$72,D$74,D$76,D$78,D$80,D$82,D$84,D$86,D$88,D$90,D$92,D$94,D$96,D$98,D$100,D$102,D$104,D$106,D$108,D$110,D$112,D$114,D$116,D$118,D$120,D$122,D$124)) -> 3 | E75: =RANK(E74,(E$6,E$8,E$10,E$12,E$14,E$16,E$18,E$20,E$22,E$24,E$26,E$28,E$30,E$32,E$34,E$36,E$38,E$40,E$42,E$44,E$46,E$48,E$50,E$52,E$54,E$56,E$58,E$60,E$62,E$64,E$66,E$68,E$70,E$72,E$74,E$76,E$78,E$80,E$82,E$84,E$86,E$88,E$90,E$92,E$94,E$96,E$98,E$100,E$102,E$104,E$106,E$108,E$110,E$112,E$114,E$116,E$118,E$120,E$122,E$124)) -> 3 | F75: =RANK(F74,(F$6,F$8,F$10,F$12,F$14,F$16,F$18,F$20,F$22,F$24,F$26,F$28,F$30,F$32,F$34,F$36,F$38,F$40,F$42,F$44,F$46,F$48,F$50,F$52,F$54,F$56,F$58,F$60,F$62,F$64,F$66,F$68,F$70,F$72,F$74,F$76,F$78,F$80,F$82,F$84,F$86,F$88,F$90,F$92,F$94,F$96,F$98,F$100,F$102,F$104,F$106,F$108,F$110,F$112,F$114,F$116,F$118,F$120,F$122,F$124)) -> 3 | G75: =RANK(G74,(G$6,G$8,G$10,G$12,G$14,G$16,G$18,G$20,G$22,G$24,G$26,G$28,G$30,G$32,G$34,G$36,G$38,G$40,G$42,G$44,G$46,G$48,G$50,G$52,G$54,G$56,G$58,G$60,G$62,G$64,G$66,G$68,G$70,G$72,G$74,G$76,G$78,G$80,G$82,G$84,G$86,G$88,G$90,G$92,G$94,G$96,G$98,G$100,G$102,G$104,G$106,G$108,G$110,G$112,G$114,G$116,G$118,G$120,G$122,G$124)) -> 3 | H75: =RANK(H74,(H$6,H$8,H$10,H$12,H$14,H$16,H$18,H$20,H$22,H$24,H$26,H$28,H$30,H$32,H$34,H$36,H$38,H$40,H$42,H$44,H$46,H$48,H$50,H$52,H$54,H$56,H$58,H$60,H$62,H$64,H$66,H$68,H$70,H$72,H$74,H$76,H$78,H$80,H$82,H$84,H$86,H$88,H$90,H$92,H$94,H$96,H$98,H$100,H$102,H$104,H$106,H$108,H$110,H$112,H$114,H$116,H$118,H$120,H$122,H$124)) -> 3 | I75: =RANK(I74,(I$6,I$8,I$10,I$12,I$14,I$16,I$18,I$20,I$22,I$24,I$26,I$28,I$30,I$32,I$34,I$36,I$38,I$40,I$42,I$44,I$46,I$48,I$50,I$52,I$54,I$56,I$58,I$60,I$62,I$64,I$66,I$68,I$70,I$72,I$74,I$76,I$78,I$80,I$82,I$84,I$86,I$88,I$90,I$92,I$94,I$96,I$98,I$100,I$102,I$104,I$106,I$108,I$110,I$112,I$114,I$116,I$118,I$120,I$122,I$124)) -> 3 | J75: =RANK(J74,(J$6,J$8,J$10,J$12,J$14,J$16,J$18,J$20,J$22,J$24,J$26,J$28,J$30,J$32,J$34,J$36,J$38,J$40,J$42,J$44,J$46,J$48,J$50,J$52,J$54,J$56,J$58,J$60,J$62,J$64,J$66,J$68,J$70,J$72,J$74,J$76,J$78,J$80,J$82,J$84,J$86,J$88,J$90,J$92,J$94,J$96,J$98,J$100,J$102,J$104,J$106,J$108,J$110,J$112,J$114,J$116,J$118,J$120,J$122,J$124)) -> 2 | K75: =RANK(K74,(K$6,K$8,K$10,K$12,K$14,K$16,K$18,K$20,K$22,K$24,K$26,K$28,K$30,K$32,K$34,K$36,K$38,K$40,K$42,K$44,K$46,K$48,K$50,K$52,K$54,K$56,K$58,K$60,K$62,K$64,K$66,K$68,K$70,K$72,K$74,K$76,K$78,K$80,K$82,K$84,K$86,K$88,K$90,K$92,K$94,K$96,K$98,K$100,K$102,K$104,K$106,K$108,K$110,K$112,K$114,K$116,K$118,K$120,K$122,K$124)) -> 4 | L75: =RANK(L74,(L$6,L$8,L$10,L$12,L$14,L$16,L$18,L$20,L$22,L$24,L$26,L$28,L$30,L$32,L$34,L$36,L$38,L$40,L$42,L$44,L$46,L$48,L$50,L$52,L$54,L$56,L$58,L$60,L$62,L$64,L$66,L$68,L$70,L$72,L$74,L$76,L$78,L$80,L$82,L$84,L$86,L$88,L$90,L$92,L$94,L$96,L$98,L$100,L$102,L$104,L$106,L$108,L$110,L$112,L$114,L$116,L$118,L$120,L$122,L$124)) -> 3 | M75: =RANK(M74,(M$6,M$8,M$10,M$12,M$14,M$16,M$18,M$20,M$22,M$24,M$26,M$28,M$30,M$32,M$34,M$36,M$38,M$40,M$42,M$44,M$46,M$48,M$50,M$52,M$54,M$56,M$58,M$60,M$62,M$64,M$66,M$68,M$70,M$72,M$74,M$76,M$78,M$80,M$82,M$84,M$86,M$88,M$90,M$92,M$94,M$96,M$98,M$100,M$102,M$104,M$106,M$108,M$110,M$112,M$114,M$116,M$118,M$120,M$122,M$124)) -> 3 | N75: =RANK(N74,(N$6,N$8,N$10,N$12,N$14,N$16,N$18,N$20,N$22,N$24,N$26,N$28,N$30,N$32,N$34,N$36,N$38,N$40,N$42,N$44,N$46,N$48,N$50,N$52,N$54,N$56,N$58,N$60,N$62,N$64,N$66,N$68,N$70,N$72,N$74,N$76,N$78,N$80,N$82,N$84,N$86,N$88,N$90,N$92,N$94,N$96,N$98,N$100,N$102,N$104,N$106,N$108,N$110,N$112,N$114,N$116,N$118,N$120,N$122,N$124)) -> 3 | P75: =RANK(P74,(P$6,P$8,P$10,P$12,P$14,P$16,P$18,P$20,P$22,P$24,P$26,P$28,P$30,P$32,P$34,P$36,P$38,P$40,P$42,P$44,P$46,P$48,P$50,P$52,P$54,P$56,P$58,P$60,P$62,P$64,P$66,P$68,P$70,P$72,P$74,P$76,P$78,P$80,P$82,P$84,P$86,P$88,P$90,P$92,P$94,P$96,P$98,P$100,P$102,P$104,P$106,P$108,P$110,P$112,P$114,P$116,P$118,P$120,P$122,P$124)) -> 3
A76: Louisiana | B76: 4 | C76: 14.10 | D76: 13.40 | E76: 27.50 | F76: 13.00 | G76: 13.30 | H76: 13.40 | I76: 19.85 | J76: 13.40 | K76: 13.70 | L76: 14.00 | M76: 20.55 | N76: 67.90 | O76: 0.0 | P76: 67.90
A77: Stars | C77: =RANK(C76,(C$6,C$8,C$10,C$12,C$14,C$16,C$18,C$20,C$22,C$24,C$26,C$28,C$30,C$32,C$34,C$36,C$38,C$40,C$42,C$44,C$46,C$48,C$50,C$52,C$54,C$56,C$58,C$60,C$62,C$64,C$66,C$68,C$70,C$72,C$74,C$76,C$78,C$80,C$82,C$84,C$86,C$88,C$90,C$92,C$94,C$96,C$98,C$100,C$102,C$104,C$106,C$108,C$110,C$112,C$114,C$116,C$118,C$120,C$122,C$124)) -> 4 | D77: =RANK(D76,(D$6,D$8,D$10,D$12,D$14,D$16,D$18,D$20,D$22,D$24,D$26,D$28,D$30,D$32,D$34,D$36,D$38,D$40,D$42,D$44,D$46,D$48,D$50,D$52,D$54,D$56,D$58,D$60,D$62,D$64,D$66,D$68,D$70,D$72,D$74,D$76,D$78,D$80,D$82,D$84,D$86,D$88,D$90,D$92,D$94,D$96,D$98,D$100,D$102,D$104,D$106,D$108,D$110,D$112,D$114,D$116,D$118,D$120,D$122,D$124)) -> 4 | E77: =RANK(E76,(E$6,E$8,E$10,E$12,E$14,E$16,E$18,E$20,E$22,E$24,E$26,E$28,E$30,E$32,E$34,E$36,E$38,E$40,E$42,E$44,E$46,E$48,E$50,E$52,E$54,E$56,E$58,E$60,E$62,E$64,E$66,E$68,E$70,E$72,E$74,E$76,E$78,E$80,E$82,E$84,E$86,E$88,E$90,E$92,E$94,E$96,E$98,E$100,E$102,E$104,E$106,E$108,E$110,E$112,E$114,E$116,E$118,E$120,E$122,E$124)) -> 4 | F77: =RANK(F76,(F$6,F$8,F$10,F$12,F$14,F$16,F$18,F$20,F$22,F$24,F$26,F$28,F$30,F$32,F$34,F$36,F$38,F$40,F$42,F$44,F$46,F$48,F$50,F$52,F$54,F$56,F$58,F$60,F$62,F$64,F$66,F$68,F$70,F$72,F$74,F$76,F$78,F$80,F$82,F$84,F$86,F$88,F$90,F$92,F$94,F$96,F$98,F$100,F$102,F$104,F$106,F$108,F$110,F$112,F$114,F$116,F$118,F$120,F$122,F$124)) -> 4 | G77: =RANK(G76,(G$6,G$8,G$10,G$12,G$14,G$16,G$18,G$20,G$22,G$24,G$26,G$28,G$30,G$32,G$34,G$36,G$38,G$40,G$42,G$44,G$46,G$48,G$50,G$52,G$54,G$56,G$58,G$60,G$62,G$64,G$66,G$68,G$70,G$72,G$74,G$76,G$78,G$80,G$82,G$84,G$86,G$88,G$90,G$92,G$94,G$96,G$98,G$100,G$102,G$104,G$106,G$108,G$110,G$112,G$114,G$116,G$118,G$120,G$122,G$124)) -> 4 | H77: =RANK(H76,(H$6,H$8,H$10,H$12,H$14,H$16,H$18,H$20,H$22,H$24,H$26,H$28,H$30,H$32,H$34,H$36,H$38,H$40,H$42,H$44,H$46,H$48,H$50,H$52,H$54,H$56,H$58,H$60,H$62,H$64,H$66,H$68,H$70,H$72,H$74,H$76,H$78,H$80,H$82,H$84,H$86,H$88,H$90,H$92,H$94,H$96,H$98,H$100,H$102,H$104,H$106,H$108,H$110,H$112,H$114,H$116,H$118,H$120,H$122,H$124)) -> 4 | I77: =RANK(I76,(I$6,I$8,I$10,I$12,I$14,I$16,I$18,I$20,I$22,I$24,I$26,I$28,I$30,I$32,I$34,I$36,I$38,I$40,I$42,I$44,I$46,I$48,I$50,I$52,I$54,I$56,I$58,I$60,I$62,I$64,I$66,I$68,I$70,I$72,I$74,I$76,I$78,I$80,I$82,I$84,I$86,I$88,I$90,I$92,I$94,I$96,I$98,I$100,I$102,I$104,I$106,I$108,I$110,I$112,I$114,I$116,I$118,I$120,I$122,I$124)) -> 4 | J77: =RANK(J76,(J$6,J$8,J$10,J$12,J$14,J$16,J$18,J$20,J$22,J$24,J$26,J$28,J$30,J$32,J$34,J$36,J$38,J$40,J$42,J$44,J$46,J$48,J$50,J$52,J$54,J$56,J$58,J$60,J$62,J$64,J$66,J$68,J$70,J$72,J$74,J$76,J$78,J$80,J$82,J$84,J$86,J$88,J$90,J$92,J$94,J$96,J$98,J$100,J$102,J$104,J$106,J$108,J$110,J$112,J$114,J$116,J$118,J$120,J$122,J$124)) -> 4 | K77: =RANK(K76,(K$6,K$8,K$10,K$12,K$14,K$16,K$18,K$20,K$22,K$24,K$26,K$28,K$30,K$32,K$34,K$36,K$38,K$40,K$42,K$44,K$46,K$48,K$50,K$52,K$54,K$56,K$58,K$60,K$62,K$64,K$66,K$68,K$70,K$72,K$74,K$76,K$78,K$80,K$82,K$84,K$86,K$88,K$90,K$92,K$94,K$96,K$98,K$100,K$102,K$104,K$106,K$108,K$110,K$112,K$114,K$116,K$118,K$120,K$122,K$124)) -> 3 | L77: =RANK(L76,(L$6,L$8,L$10,L$12,L$14,L$16,L$18,L$20,L$22,L$24,L$26,L$28,L$30,L$32,L$34,L$36,L$38,L$40,L$42,L$44,L$46,L$48,L$50,L$52,L$54,L$56,L$58,L$60,L$62,L$64,L$66,L$68,L$70,L$72,L$74,L$76,L$78,L$80,L$82,L$84,L$86,L$88,L$90,L$92,L$94,L$96,L$98,L$100,L$102,L$104,L$106,L$108,L$110,L$112,L$114,L$116,L$118,L$120,L$122,L$124)) -> 4 | M77: =RANK(M76,(M$6,M$8,M$10,M$12,M$14,M$16,M$18,M$20,M$22,M$24,M$26,M$28,M$30,M$32,M$34,M$36,M$38,M$40,M$42,M$44,M$46,M$48,M$50,M$52,M$54,M$56,M$58,M$60,M$62,M$64,M$66,M$68,M$70,M$72,M$74,M$76,M$78,M$80,M$82,M$84,M$86,M$88,M$90,M$92,M$94,M$96,M$98,M$100,M$102,M$104,M$106,M$108,M$110,M$112,M$114,M$116,M$118,M$120,M$122,M$124)) -> 4 | N77: =RANK(N76,(N$6,N$8,N$10,N$12,N$14,N$16,N$18,N$20,N$22,N$24,N$26,N$28,N$30,N$32,N$34,N$36,N$38,N$40,N$42,N$44,N$46,N$48,N$50,N$52,N$54,N$56,N$58,N$60,N$62,N$64,N$66,N$68,N$70,N$72,N$74,N$76,N$78,N$80,N$82,N$84,N$86,N$88,N$90,N$92,N$94,N$96,N$98,N$100,N$102,N$104,N$106,N$108,N$110,N$112,N$114,N$116,N$118,N$120,N$122,N$124)) -> 4 | P77: =RANK(P76,(P$6,P$8,P$10,P$12,P$14,P$16,P$18,P$20,P$22,P$24,P$26,P$28,P$30,P$32,P$34,P$36,P$38,P$40,P$42,P$44,P$46,P$48,P$50,P$52,P$54,P$56,P$58,P$60,P$62,P$64,P$66,P$68,P$70,P$72,P$74,P$76,P$78,P$80,P$82,P$84,P$86,P$88,P$90,P$92,P$94,P$96,P$98,P$100,P$102,P$104,P$106,P$108,P$110,P$112,P$114,P$116,P$118,P$120,P$122,P$124)) -> 4
A78: Raiders | B78: 1 | C78: 13.60 | D78: 12.80 | E78: 26.40 | F78: 12.80 | G78: 13.20 | H78: 12.90 | I78: 19.45 | J78: 12.70 | K78: 12.60 | L78: 12.20 | M78: 18.75 | N78: 64.60 | O78: 0.0 | P78: 64.60
C79: =RANK(C78,(C$6,C$8,C$10,C$12,C$14,C$16,C$18,C$20,C$22,C$24,C$26,C$28,C$30,C$32,C$34,C$36,C$38,C$40,C$42,C$44,C$46,C$48,C$50,C$52,C$54,C$56,C$58,C$60,C$62,C$64,C$66,C$68,C$70,C$72,C$74,C$76,C$78,C$80,C$82,C$84,C$86,C$88,C$90,C$92,C$94,C$96,C$98,C$100,C$102,C$104,C$106,C$108,C$110,C$112,C$114,C$116,C$118,C$120,C$122,C$124)) -> 5 | D79: =RANK(D78,(D$6,D$8,D$10,D$12,D$14,D$16,D$18,D$20,D$22,D$24,D$26,D$28,D$30,D$32,D$34,D$36,D$38,D$40,D$42,D$44,D$46,D$48,D$50,D$52,D$54,D$56,D$58,D$60,D$62,D$64,D$66,D$68,D$70,D$72,D$74,D$76,D$78,D$80,D$82,D$84,D$86,D$88,D$90,D$92,D$94,D$96,D$98,D$100,D$102,D$104,D$106,D$108,D$110,D$112,D$114,D$116,D$118,D$120,D$122,D$124)) -> 5 | E79: =RANK(E78,(E$6,E$8,E$10,E$12,E$14,E$16,E$18,E$20,E$22,E$24,E$26,E$28,E$30,E$32,E$34,E$36,E$38,E$40,E$42,E$44,E$46,E$48,E$50,E$52,E$54,E$56,E$58,E$60,E$62,E$64,E$66,E$68,E$70,E$72,E$74,E$76,E$78,E$80,E$82,E$84,E$86,E$88,E$90,E$92,E$94,E$96,E$98,E$100,E$102,E$104,E$106,E$108,E$110,E$112,E$114,E$116,E$118,E$120,E$122,E$124)) -> 5 | F79: =RANK(F78,(F$6,F$8,F$10,F$12,F$14,F$16,F$18,F$20,F$22,F$24,F$26,F$28,F$30,F$32,F$34,F$36,F$38,F$40,F$42,F$44,F$46,F$48,F$50,F$52,F$54,F$56,F$58,F$60,F$62,F$64,F$66,F$68,F$70,F$72,F$74,F$76,F$78,F$80,F$82,F$84,F$86,F$88,F$90,F$92,F$94,F$96,F$98,F$100,F$102,F$104,F$106,F$108,F$110,F$112,F$114,F$116,F$118,F$120,F$122,F$124)) -> 5 | G79: =RANK(G78,(G$6,G$8,G$10,G$12,G$14,G$16,G$18,G$20,G$22,G$24,G$26,G$28,G$30,G$32,G$34,G$36,G$38,G$40,G$42,G$44,G$46,G$48,G$50,G$52,G$54,G$56,G$58,G$60,G$62,G$64,G$66,G$68,G$70,G$72,G$74,G$76,G$78,G$80,G$82,G$84,G$86,G$88,G$90,G$92,G$94,G$96,G$98,G$100,G$102,G$104,G$106,G$108,G$110,G$112,G$114,G$116,G$118,G$120,G$122,G$124)) -> 5 | H79: =RANK(H78,(H$6,H$8,H$10,H$12,H$14,H$16,H$18,H$20,H$22,H$24,H$26,H$28,H$30,H$32,H$34,H$36,H$38,H$40,H$42,H$44,H$46,H$48,H$50,H$52,H$54,H$56,H$58,H$60,H$62,H$64,H$66,H$68,H$70,H$72,H$74,H$76,H$78,H$80,H$82,H$84,H$86,H$88,H$90,H$92,H$94,H$96,H$98,H$100,H$102,H$104,H$106,H$108,H$110,H$112,H$114,H$116,H$118,H$120,H$122,H$124)) -> 5 | I79: =RANK(I78,(I$6,I$8,I$10,I$12,I$14,I$16,I$18,I$20,I$22,I$24,I$26,I$28,I$30,I$32,I$34,I$36,I$38,I$40,I$42,I$44,I$46,I$48,I$50,I$52,I$54,I$56,I$58,I$60,I$62,I$64,I$66,I$68,I$70,I$72,I$74,I$76,I$78,I$80,I$82,I$84,I$86,I$88,I$90,I$92,I$94,I$96,I$98,I$100,I$102,I$104,I$106,I$108,I$110,I$112,I$114,I$116,I$118,I$120,I$122,I$124)) -> 5 | J79: =RANK(J78,(J$6,J$8,J$10,J$12,J$14,J$16,J$18,J$20,J$22,J$24,J$26,J$28,J$30,J$32,J$34,J$36,J$38,J$40,J$42,J$44,J$46,J$48,J$50,J$52,J$54,J$56,J$58,J$60,J$62,J$64,J$66,J$68,J$70,J$72,J$74,J$76,J$78,J$80,J$82,J$84,J$86,J$88,J$90,J$92,J$94,J$96,J$98,J$100,J$102,J$104,J$106,J$108,J$110,J$112,J$114,J$116,J$118,J$120,J$122,J$124)) -> 5 | K79: =RANK(K78,(K$6,K$8,K$10,K$12,K$14,K$16,K$18,K$20,K$22,K$24,K$26,K$28,K$30,K$32,K$34,K$36,K$38,K$40,K$42,K$44,K$46,K$48,K$50,K$52,K$54,K$56,K$58,K$60,K$62,K$64,K$66,K$68,K$70,K$72,K$74,K$76,K$78,K$80,K$82,K$84,K$86,K$88,K$90,K$92,K$94,K$96,K$98,K$100,K$102,K$104,K$106,K$108,K$110,K$112,K$114,K$116,K$118,K$120,K$122,K$124)) -> 5 | L79: =RANK(L78,(L$6,L$8,L$10,L$12,L$14,L$16,L$18,L$20,L$22,L$24,L$26,L$28,L$30,L$32,L$34,L$36,L$38,L$40,L$42,L$44,L$46,L$48,L$50,L$52,L$54,L$56,L$58,L$60,L$62,L$64,L$66,L$68,L$70,L$72,L$74,L$76,L$78,L$80,L$82,L$84,L$86,L$88,L$90,L$92,L$94,L$96,L$98,L$100,L$102,L$104,L$106,L$108,L$110,L$112,L$114,L$116,L$118,L$120,L$122,L$124)) -> 5 | M79: =RANK(M78,(M$6,M$8,M$10,M$12,M$14,M$16,M$18,M$20,M$22,M$24,M$26,M$28,M$30,M$32,M$34,M$36,M$38,M$40,M$42,M$44,M$46,M$48,M$50,M$52,M$54,M$56,M$58,M$60,M$62,M$64,M$66,M$68,M$70,M$72,M$74,M$76,M$78,M$80,M$82,M$84,M$86,M$88,M$90,M$92,M$94,M$96,M$98,M$100,M$102,M$104,M$106,M$108,M$110,M$112,M$114,M$116,M$118,M$120,M$122,M$124)) -> 5 | N79: =RANK(N78,(N$6,N$8,N$10,N$12,N$14,N$16,N$18,N$20,N$22,N$24,N$26,N$28,N$30,N$32,N$34,N$36,N$38,N$40,N$42,N$44,N$46,N$48,N$50,N$52,N$54,N$56,N$58,N$60,N$62,N$64,N$66,N$68,N$70,N$72,N$74,N$76,N$78,N$80,N$82,N$84,N$86,N$88,N$90,N$92,N$94,N$96,N$98,N$100,N$102,N$104,N$106,N$108,N$110,N$112,N$114,N$116,N$118,N$120,N$122,N$124)) -> 5 | P79: =RANK(P78,(P$6,P$8,P$10,P$12,P$14,P$16,P$18,P$20,P$22,P$24,P$26,P$28,P$30,P$32,P$34,P$36,P$38,P$40,P$42,P$44,P$46,P$48,P$50,P$52,P$54,P$56,P$58,P$60,P$62,P$64,P$66,P$68,P$70,P$72,P$74,P$76,P$78,P$80,P$82,P$84,P$86,P$88,P$90,P$92,P$94,P$96,P$98,P$100,P$102,P$104,P$106,P$108,P$110,P$112,P$114,P$116,P$118,P$120,P$122,P$124)) -> 5
A82: 8/2/2022 Lima, Ohio
C83: Visual | F83: Music | J83: Effect | M83: Communication
C84: Ensemble | D84: Color Guard | F84: Brass | G84: Ensemble | H84: Percussion | J84: Visual | K84: Music | M84: Visual | N84: Music | P84: Sub | R84: Total
C85: J. Purisfull | D85: M. Bowers | E85: Average | F85: B. Crisp | G85: C. Armbruster | H85: T. Fox | I85: Total ÷2 | J85: B. Kuhn | K85: J. Denton | L85: Total | M85: B. Kuhn | N85: J. Denton | O85: Average | P85: Total | Q85: Pen | R85: Score
A86: DCA Open Class | C86: 20 | D86: 20 | E86: 20 | F86: 20 | G86: 20 | H86: 20 | I86: 30 | J86: 20 | K86: 20 | L86: 40 | M86: 10 | N86: 10 | O86: 10 | P86: 100 | R86: 100
A87: Cincinnati | C87: 15.10 | D87: 15.10 | E87: 15.10 | F87: 13.90 | G87: 15.30 | H87: 13.50 | I87: 21.35 | J87: 14.40 | K87: 14.70 | L87: 29.10 | M87: 7.60 | N87: 7.50 | O87: 7.55 | P87: 73.10 | Q87: 0.0 | R87: 73.10
A88: Tradition | C88: 1 | D88: 1 | E88: 1 | F88: 1 | G88: 1 | H88: 1 | I88: 1 | J88: 1 | K88: 1 | L88: 1 | M88: 1 | N88: 1 | O88: 1 | P88: 1 | R88: 1
A91: 8/2/2022 Salem, Virginia
C92: General Effect | F92: Visual | J92: Music
C93: 1 | D93: 2 | F93: Proficiency | G93: Analysis | H93: Color Guard | J93: Brass | K93: Analysis | L93: Percussion | N93: Sub | P93: Total
C94: B. Jones | D94: K. Turner | E94: Total | F94: No Judge | G94: B. Mascaro | H94: D. Padilla | I94: Total ÷2 | J94: S. Halquist | K94: W. Dillon | L94: M. Davis | M94: Total ÷2 | N94: Total | O94: Pen | P94: Score
A95: DCI World Class | C95: 20 | D95: 20 | E95: 40 | F95: 20 | G95: 20 | H95: 20 | I95: 30 | J95: 20 | K95: 20 | L95: 20 | M95: 30 | N95: 100 | P95: 100
A96: Carolina | B96: 4 | C96: 19.10 | D96: 18.90 | E96: 38.00 | F96: 19.20 | G96: 19.20 | H96: 18.70 | I96: 28.55 | J96: 18.70 | K96: 18.90 | L96: 18.10 | M96: 27.85 | N96: 94.40 | O96: 0.0 | P96: 94.40
A97: Crown | C97: =RANK(C96,(C$6,C$8,C$10,C$12,C$14,C$16,C$18,C$20,C$22,C$24,C$26,C$28,C$30,C$32,C$34,C$36,C$38,C$40,C$42,C$44,C$46,C$48,C$50,C$52,C$54,C$56,C$58,C$60,C$62,C$64,C$66,C$68,C$70,C$72,C$74,C$76,C$78,C$80,C$82,C$84,C$86,C$88,C$90,C$92,C$94,C$96,C$98,C$100,C$102,C$104,C$106,C$108,C$110,C$112,C$114,C$116,C$118,C$120,C$122,C$124)) -> 1 | D97: =RANK(D96,(D$6,D$8,D$10,D$12,D$14,D$16,D$18,D$20,D$22,D$24,D$26,D$28,D$30,D$32,D$34,D$36,D$38,D$40,D$42,D$44,D$46,D$48,D$50,D$52,D$54,D$56,D$58,D$60,D$62,D$64,D$66,D$68,D$70,D$72,D$74,D$76,D$78,D$80,D$82,D$84,D$86,D$88,D$90,D$92,D$94,D$96,D$98,D$100,D$102,D$104,D$106,D$108,D$110,D$112,D$114,D$116,D$118,D$120,D$122,D$124)) -> 1 | E97: =RANK(E96,(E$6,E$8,E$10,E$12,E$14,E$16,E$18,E$20,E$22,E$24,E$26,E$28,E$30,E$32,E$34,E$36,E$38,E$40,E$42,E$44,E$46,E$48,E$50,E$52,E$54,E$56,E$58,E$60,E$62,E$64,E$66,E$68,E$70,E$72,E$74,E$76,E$78,E$80,E$82,E$84,E$86,E$88,E$90,E$92,E$94,E$96,E$98,E$100,E$102,E$104,E$106,E$108,E$110,E$112,E$114,E$116,E$118,E$120,E$122,E$124)) -> 1 | F97: =RANK(F96,(F$6,F$8,F$10,F$12,F$14,F$16,F$18,F$20,F$22,F$24,F$26,F$28,F$30,F$32,F$34,F$36,F$38,F$40,F$42,F$44,F$46,F$48,F$50,F$52,F$54,F$56,F$58,F$60,F$62,F$64,F$66,F$68,F$70,F$72,F$74,F$76,F$78,F$80,F$82,F$84,F$86,F$88,F$90,F$92,F$94,F$96,F$98,F$100,F$102,F$104,F$106,F$108,F$110,F$112,F$114,F$116,F$118,F$120,F$122,F$124)) -> 1 | G97: =RANK(G96,(G$6,G$8,G$10,G$12,G$14,G$16,G$18,G$20,G$22,G$24,G$26,G$28,G$30,G$32,G$34,G$36,G$38,G$40,G$42,G$44,G$46,G$48,G$50,G$52,G$54,G$56,G$58,G$60,G$62,G$64,G$66,G$68,G$70,G$72,G$74,G$76,G$78,G$80,G$82,G$84,G$86,G$88,G$90,G$92,G$94,G$96,G$98,G$100,G$102,G$104,G$106,G$108,G$110,G$112,G$114,G$116,G$118,G$120,G$122,G$124)) -> 1 | H97: =RANK(H96,(H$6,H$8,H$10,H$12,H$14,H$16,H$18,H$20,H$22,H$24,H$26,H$28,H$30,H$32,H$34,H$36,H$38,H$40,H$42,H$44,H$46,H$48,H$50,H$52,H$54,H$56,H$58,H$60,H$62,H$64,H$66,H$68,H$70,H$72,H$74,H$76,H$78,H$80,H$82,H$84,H$86,H$88,H$90,H$92,H$94,H$96,H$98,H$100,H$102,H$104,H$106,H$108,H$110,H$112,H$114,H$116,H$118,H$120,H$122,H$124)) -> 1 | I97: =RANK(I96,(I$6,I$8,I$10,I$12,I$14,I$16,I$18,I$20,I$22,I$24,I$26,I$28,I$30,I$32,I$34,I$36,I$38,I$40,I$42,I$44,I$46,I$48,I$50,I$52,I$54,I$56,I$58,I$60,I$62,I$64,I$66,I$68,I$70,I$72,I$74,I$76,I$78,I$80,I$82,I$84,I$86,I$88,I$90,I$92,I$94,I$96,I$98,I$100,I$102,I$104,I$106,I$108,I$110,I$112,I$114,I$116,I$118,I$120,I$122,I$124)) -> 1 | J97: =RANK(J96,(J$6,J$8,J$10,J$12,J$14,J$16,J$18,J$20,J$22,J$24,J$26,J$28,J$30,J$32,J$34,J$36,J$38,J$40,J$42,J$44,J$46,J$48,J$50,J$52,J$54,J$56,J$58,J$60,J$62,J$64,J$66,J$68,J$70,J$72,J$74,J$76,J$78,J$80,J$82,J$84,J$86,J$88,J$90,J$92,J$94,J$96,J$98,J$100,J$102,J$104,J$106,J$108,J$110,J$112,J$114,J$116,J$118,J$120,J$122,J$124)) -> 1 | K97: =RANK(K96,(K$6,K$8,K$10,K$12,K$14,K$16,K$18,K$20,K$22,K$24,K$26,K$28,K$30,K$32,K$34,K$36,K$38,K$40,K$42,K$44,K$46,K$48,K$50,K$52,K$54,K$56,K$58,K$60,K$62,K$64,K$66,K$68,K$70,K$72,K$74,K$76,K$78,K$80,K$82,K$84,K$86,K$88,K$90,K$92,K$94,K$96,K$98,K$100,K$102,K$104,K$106,K$108,K$110,K$112,K$114,K$116,K$118,K$120,K$122,K$124)) -> 1 | L97: =RANK(L96,(L$6,L$8,L$10,L$12,L$14,L$16,L$18,L$20,L$22,L$24,L$26,L$28,L$30,L$32,L$34,L$36,L$38,L$40,L$42,L$44,L$46,L$48,L$50,L$52,L$54,L$56,L$58,L$60,L$62,L$64,L$66,L$68,L$70,L$72,L$74,L$76,L$78,L$80,L$82,L$84,L$86,L$88,L$90,L$92,L$94,L$96,L$98,L$100,L$102,L$104,L$106,L$108,L$110,L$112,L$114,L$116,L$118,L$120,L$122,L$124)) -> 2 | M97: =RANK(M96,(M$6,M$8,M$10,M$12,M$14,M$16,M$18,M$20,M$22,M$24,M$26,M$28,M$30,M$32,M$34,M$36,M$38,M$40,M$42,M$44,M$46,M$48,M$50,M$52,M$54,M$56,M$58,M$60,M$62,M$64,M$66,M$68,M$70,M$72,M$74,M$76,M$78,M$80,M$82,M$84,M$86,M$88,M$90,M$92,M$94,M$96,M$98,M$100,M$102,M$104,M$106,M$108,M$110,M$112,M$114,M$116,M$118,M$120,M$122,M$124)) -> 1 | N97: =RANK(N96,(N$6,N$8,N$10,N$12,N$14,N$16,N$18,N$20,N$22,N$24,N$26,N$28,N$30,N$32,N$34,N$36,N$38,N$40,N$42,N$44,N$46,N$48,N$50,N$52,N$54,N$56,N$58,N$60,N$62,N$64,N$66,N$68,N$70,N$72,N$74,N$76,N$78,N$80,N$82,N$84,N$86,N$88,N$90,N$92,N$94,N$96,N$98,N$100,N$102,N$104,N$106,N$108,N$110,N$112,N$114,N$116,N$118,N$120,N$122,N$124)) -> 1 | P97: =RANK(P96,(P$6,P$8,P$10,P$12,P$14,P$16,P$18,P$20,P$22,P$24,P$26,P$28,P$30,P$32,P$34,P$36,P$38,P$40,P$42,P$44,P$46,P$48,P$50,P$52,P$54,P$56,P$58,P$60,P$62,P$64,P$66,P$68,P$70,P$72,P$74,P$76,P$78,P$80,P$82,P$84,P$86,P$88,P$90,P$92,P$94,P$96,P$98,P$100,P$102,P$104,P$106,P$108,P$110,P$112,P$114,P$116,P$118,P$120,P$122,P$124)) -> 1
A98: Vanguard | B98: 3 | C98: 18.60 | D98: 18.70 | E98: 37.30 | F98: 18.70 | G98: 18.70 | H98: 18.30 | I98: 27.85 | J98: 18.00 | K98: 18.60 | L98: 18.80 | M98: 27.70 | N98: 92.85 | O98: 0.0 | P98: 92.85
C99: =RANK(C98,(C$6,C$8,C$10,C$12,C$14,C$16,C$18,C$20,C$22,C$24,C$26,C$28,C$30,C$32,C$34,C$36,C$38,C$40,C$42,C$44,C$46,C$48,C$50,C$52,C$54,C$56,C$58,C$60,C$62,C$64,C$66,C$68,C$70,C$72,C$74,C$76,C$78,C$80,C$82,C$84,C$86,C$88,C$90,C$92,C$94,C$96,C$98,C$100,C$102,C$104,C$106,C$108,C$110,C$112,C$114,C$116,C$118,C$120,C$122,C$124)) -> 2 | D99: =RANK(D98,(D$6,D$8,D$10,D$12,D$14,D$16,D$18,D$20,D$22,D$24,D$26,D$28,D$30,D$32,D$34,D$36,D$38,D$40,D$42,D$44,D$46,D$48,D$50,D$52,D$54,D$56,D$58,D$60,D$62,D$64,D$66,D$68,D$70,D$72,D$74,D$76,D$78,D$80,D$82,D$84,D$86,D$88,D$90,D$92,D$94,D$96,D$98,D$100,D$102,D$104,D$106,D$108,D$110,D$112,D$114,D$116,D$118,D$120,D$122,D$124)) -> 2 | E99: =RANK(E98,(E$6,E$8,E$10,E$12,E$14,E$16,E$18,E$20,E$22,E$24,E$26,E$28,E$30,E$32,E$34,E$36,E$38,E$40,E$42,E$44,E$46,E$48,E$50,E$52,E$54,E$56,E$58,E$60,E$62,E$64,E$66,E$68,E$70,E$72,E$74,E$76,E$78,E$80,E$82,E$84,E$86,E$88,E$90,E$92,E$94,E$96,E$98,E$100,E$102,E$104,E$106,E$108,E$110,E$112,E$114,E$116,E$118,E$120,E$122,E$124)) -> 2 | F99: =RANK(F98,(F$6,F$8,F$10,F$12,F$14,F$16,F$18,F$20,F$22,F$24,F$26,F$28,F$30,F$32,F$34,F$36,F$38,F$40,F$42,F$44,F$46,F$48,F$50,F$52,F$54,F$56,F$58,F$60,F$62,F$64,F$66,F$68,F$70,F$72,F$74,F$76,F$78,F$80,F$82,F$84,F$86,F$88,F$90,F$92,F$94,F$96,F$98,F$100,F$102,F$104,F$106,F$108,F$110,F$112,F$114,F$116,F$118,F$120,F$122,F$124)) -> 2 | G99: =RANK(G98,(G$6,G$8,G$10,G$12,G$14,G$16,G$18,G$20,G$22,G$24,G$26,G$28,G$30,G$32,G$34,G$36,G$38,G$40,G$42,G$44,G$46,G$48,G$50,G$52,G$54,G$56,G$58,G$60,G$62,G$64,G$66,G$68,G$70,G$72,G$74,G$76,G$78,G$80,G$82,G$84,G$86,G$88,G$90,G$92,G$94,G$96,G$98,G$100,G$102,G$104,G$106,G$108,G$110,G$112,G$114,G$116,G$118,G$120,G$122,G$124)) -> 2 | H99: =RANK(H98,(H$6,H$8,H$10,H$12,H$14,H$16,H$18,H$20,H$22,H$24,H$26,H$28,H$30,H$32,H$34,H$36,H$38,H$40,H$42,H$44,H$46,H$48,H$50,H$52,H$54,H$56,H$58,H$60,H$62,H$64,H$66,H$68,H$70,H$72,H$74,H$76,H$78,H$80,H$82,H$84,H$86,H$88,H$90,H$92,H$94,H$96,H$98,H$100,H$102,H$104,H$106,H$108,H$110,H$112,H$114,H$116,H$118,H$120,H$122,H$124)) -> 2 | I99: =RANK(I98,(I$6,I$8,I$10,I$12,I$14,I$16,I$18,I$20,I$22,I$24,I$26,I$28,I$30,I$32,I$34,I$36,I$38,I$40,I$42,I$44,I$46,I$48,I$50,I$52,I$54,I$56,I$58,I$60,I$62,I$64,I$66,I$68,I$70,I$72,I$74,I$76,I$78,I$80,I$82,I$84,I$86,I$88,I$90,I$92,I$94,I$96,I$98,I$100,I$102,I$104,I$106,I$108,I$110,I$112,I$114,I$116,I$118,I$120,I$122,I$124)) -> 2 | J99: =RANK(J98,(J$6,J$8,J$10,J$12,J$14,J$16,J$18,J$20,J$22,J$24,J$26,J$28,J$30,J$32,J$34,J$36,J$38,J$40,J$42,J$44,J$46,J$48,J$50,J$52,J$54,J$56,J$58,J$60,J$62,J$64,J$66,J$68,J$70,J$72,J$74,J$76,J$78,J$80,J$82,J$84,J$86,J$88,J$90,J$92,J$94,J$96,J$98,J$100,J$102,J$104,J$106,J$108,J$110,J$112,J$114,J$116,J$118,J$120,J$122,J$124)) -> 2 | K99: =RANK(K98,(K$6,K$8,K$10,K$12,K$14,K$16,K$18,K$20,K$22,K$24,K$26,K$28,K$30,K$32,K$34,K$36,K$38,K$40,K$42,K$44,K$46,K$48,K$50,K$52,K$54,K$56,K$58,K$60,K$62,K$64,K$66,K$68,K$70,K$72,K$74,K$76,K$78,K$80,K$82,K$84,K$86,K$88,K$90,K$92,K$94,K$96,K$98,K$100,K$102,K$104,K$106,K$108,K$110,K$112,K$114,K$116,K$118,K$120,K$122,K$124)) -> 2 | L99: =RANK(L98,(L$6,L$8,L$10,L$12,L$14,L$16,L$18,L$20,L$22,L$24,L$26,L$28,L$30,L$32,L$34,L$36,L$38,L$40,L$42,L$44,L$46,L$48,L$50,L$52,L$54,L$56,L$58,L$60,L$62,L$64,L$66,L$68,L$70,L$72,L$74,L$76,L$78,L$80,L$82,L$84,L$86,L$88,L$90,L$92,L$94,L$96,L$98,L$100,L$102,L$104,L$106,L$108,L$110,L$112,L$114,L$116,L$118,L$120,L$122,L$124)) -> 1 | M99: =RANK(M98,(M$6,M$8,M$10,M$12,M$14,M$16,M$18,M$20,M$22,M$24,M$26,M$28,M$30,M$32,M$34,M$36,M$38,M$40,M$42,M$44,M$46,M$48,M$50,M$52,M$54,M$56,M$58,M$60,M$62,M$64,M$66,M$68,M$70,M$72,M$74,M$76,M$78,M$80,M$82,M$84,M$86,M$88,M$90,M$92,M$94,M$96,M$98,M$100,M$102,M$104,M$106,M$108,M$110,M$112,M$114,M$116,M$118,M$120,M$122,M$124)) -> 2 | N99: =RANK(N98,(N$6,N$8,N$10,N$12,N$14,N$16,N$18,N$20,N$22,N$24,N$26,N$28,N$30,N$32,N$34,N$36,N$38,N$40,N$42,N$44,N$46,N$48,N$50,N$52,N$54,N$56,N$58,N$60,N$62,N$64,N$66,N$68,N$70,N$72,N$74,N$76,N$78,N$80,N$82,N$84,N$86,N$88,N$90,N$92,N$94,N$96,N$98,N$100,N$102,N$104,N$106,N$108,N$110,N$112,N$114,N$116,N$118,N$120,N$122,N$124)) -> 2 | P99: =RANK(P98,(P$6,P$8,P$10,P$12,P$14,P$16,P$18,P$20,P$22,P$24,P$26,P$28,P$30,P$32,P$34,P$36,P$38,P$40,P$42,P$44,P$46,P$48,P$50,P$52,P$54,P$56,P$58,P$60,P$62,P$64,P$66,P$68,P$70,P$72,P$74,P$76,P$78,P$80,P$82,P$84,P$86,P$88,P$90,P$92,P$94,P$96,P$98,P$100,P$102,P$104,P$106,P$108,P$110,P$112,P$114,P$116,P$118,P$120,P$122,P$124)) -> 2
A100: Colts | B100: 2 | C100: 16.70 | D100: 17.40 | E100: 34.10 | F100: 16.80 | G100: 16.80 | H100: 17.00 | I100: 25.30 | J100: 16.70 | K100: 17.30 | L100: 17.00 | M100: 25.50 | N100: 84.90 | O100: 0.0 | P100: 84.90
C101: =RANK(C100,(C$6,C$8,C$10,C$12,C$14,C$16,C$18,C$20,C$22,C$24,C$26,C$28,C$30,C$32,C$34,C$36,C$38,C$40,C$42,C$44,C$46,C$48,C$50,C$52,C$54,C$56,C$58,C$60,C$62,C$64,C$66,C$68,C$70,C$72,C$74,C$76,C$78,C$80,C$82,C$84,C$86,C$88,C$90,C$92,C$94,C$96,C$98,C$100,C$102,C$104,C$106,C$108,C$110,C$112,C$114,C$116,C$118,C$120,C$122,C$124)) -> 3 | D101: =RANK(D100,(D$6,D$8,D$10,D$12,D$14,D$16,D$18,D$20,D$22,D$24,D$26,D$28,D$30,D$32,D$34,D$36,D$38,D$40,D$42,D$44,D$46,D$48,D$50,D$52,D$54,D$56,D$58,D$60,D$62,D$64,D$66,D$68,D$70,D$72,D$74,D$76,D$78,D$80,D$82,D$84,D$86,D$88,D$90,D$92,D$94,D$96,D$98,D$100,D$102,D$104,D$106,D$108,D$110,D$112,D$114,D$116,D$118,D$120,D$122,D$124)) -> 3 | E101: =RANK(E100,(E$6,E$8,E$10,E$12,E$14,E$16,E$18,E$20,E$22,E$24,E$26,E$28,E$30,E$32,E$34,E$36,E$38,E$40,E$42,E$44,E$46,E$48,E$50,E$52,E$54,E$56,E$58,E$60,E$62,E$64,E$66,E$68,E$70,E$72,E$74,E$76,E$78,E$80,E$82,E$84,E$86,E$88,E$90,E$92,E$94,E$96,E$98,E$100,E$102,E$104,E$106,E$108,E$110,E$112,E$114,E$116,E$118,E$120,E$122,E$124)) -> 3 | F101: =RANK(F100,(F$6,F$8,F$10,F$12,F$14,F$16,F$18,F$20,F$22,F$24,F$26,F$28,F$30,F$32,F$34,F$36,F$38,F$40,F$42,F$44,F$46,F$48,F$50,F$52,F$54,F$56,F$58,F$60,F$62,F$64,F$66,F$68,F$70,F$72,F$74,F$76,F$78,F$80,F$82,F$84,F$86,F$88,F$90,F$92,F$94,F$96,F$98,F$100,F$102,F$104,F$106,F$108,F$110,F$112,F$114,F$116,F$118,F$120,F$122,F$124)) -> 3 | G101: =RANK(G100,(G$6,G$8,G$10,G$12,G$14,G$16,G$18,G$20,G$22,G$24,G$26,G$28,G$30,G$32,G$34,G$36,G$38,G$40,G$42,G$44,G$46,G$48,G$50,G$52,G$54,G$56,G$58,G$60,G$62,G$64,G$66,G$68,G$70,G$72,G$74,G$76,G$78,G$80,G$82,G$84,G$86,G$88,G$90,G$92,G$94,G$96,G$98,G$100,G$102,G$104,G$106,G$108,G$110,G$112,G$114,G$116,G$118,G$120,G$122,G$124)) -> 3 | H101: =RANK(H100,(H$6,H$8,H$10,H$12,H$14,H$16,H$18,H$20,H$22,H$24,H$26,H$28,H$30,H$32,H$34,H$36,H$38,H$40,H$42,H$44,H$46,H$48,H$50,H$52,H$54,H$56,H$58,H$60,H$62,H$64,H$66,H$68,H$70,H$72,H$74,H$76,H$78,H$80,H$82,H$84,H$86,H$88,H$90,H$92,H$94,H$96,H$98,H$100,H$102,H$104,H$106,H$108,H$110,H$112,H$114,H$116,H$118,H$120,H$122,H$124)) -> 3 | I101: =RANK(I100,(I$6,I$8,I$10,I$12,I$14,I$16,I$18,I$20,I$22,I$24,I$26,I$28,I$30,I$32,I$34,I$36,I$38,I$40,I$42,I$44,I$46,I$48,I$50,I$52,I$54,I$56,I$58,I$60,I$62,I$64,I$66,I$68,I$70,I$72,I$74,I$76,I$78,I$80,I$82,I$84,I$86,I$88,I$90,I$92,I$94,I$96,I$98,I$100,I$102,I$104,I$106,I$108,I$110,I$112,I$114,I$116,I$118,I$120,I$122,I$124)) -> 3 | J101: =RANK(J100,(J$6,J$8,J$10,J$12,J$14,J$16,J$18,J$20,J$22,J$24,J$26,J$28,J$30,J$32,J$34,J$36,J$38,J$40,J$42,J$44,J$46,J$48,J$50,J$52,J$54,J$56,J$58,J$60,J$62,J$64,J$66,J$68,J$70,J$72,J$74,J$76,J$78,J$80,J$82,J$84,J$86,J$88,J$90,J$92,J$94,J$96,J$98,J$100,J$102,J$104,J$106,J$108,J$110,J$112,J$114,J$116,J$118,J$120,J$122,J$124)) -> 3 | K101: =RANK(K100,(K$6,K$8,K$10,K$12,K$14,K$16,K$18,K$20,K$22,K$24,K$26,K$28,K$30,K$32,K$34,K$36,K$38,K$40,K$42,K$44,K$46,K$48,K$50,K$52,K$54,K$56,K$58,K$60,K$62,K$64,K$66,K$68,K$70,K$72,K$74,K$76,K$78,K$80,K$82,K$84,K$86,K$88,K$90,K$92,K$94,K$96,K$98,K$100,K$102,K$104,K$106,K$108,K$110,K$112,K$114,K$116,K$118,K$120,K$122,K$124)) -> 3 | L101: =RANK(L100,(L$6,L$8,L$10,L$12,L$14,L$16,L$18,L$20,L$22,L$24,L$26,L$28,L$30,L$32,L$34,L$36,L$38,L$40,L$42,L$44,L$46,L$48,L$50,L$52,L$54,L$56,L$58,L$60,L$62,L$64,L$66,L$68,L$70,L$72,L$74,L$76,L$78,L$80,L$82,L$84,L$86,L$88,L$90,L$92,L$94,L$96,L$98,L$100,L$102,L$104,L$106,L$108,L$110,L$112,L$114,L$116,L$118,L$120,L$122,L$124)) -> 3 | M101: =RANK(M100,(M$6,M$8,M$10,M$12,M$14,M$16,M$18,M$20,M$22,M$24,M$26,M$28,M$30,M$32,M$34,M$36,M$38,M$40,M$42,M$44,M$46,M$48,M$50,M$52,M$54,M$56,M$58,M$60,M$62,M$64,M$66,M$68,M$70,M$72,M$74,M$76,M$78,M$80,M$82,M$84,M$86,M$88,M$90,M$92,M$94,M$96,M$98,M$100,M$102,M$104,M$106,M$108,M$110,M$112,M$114,M$116,M$118,M$120,M$122,M$124)) -> 3 | N101: =RANK(N100,(N$6,N$8,N$10,N$12,N$14,N$16,N$18,N$20,N$22,N$24,N$26,N$28,N$30,N$32,N$34,N$36,N$38,N$40,N$42,N$44,N$46,N$48,N$50,N$52,N$54,N$56,N$58,N$60,N$62,N$64,N$66,N$68,N$70,N$72,N$74,N$76,N$78,N$80,N$82,N$84,N$86,N$88,N$90,N$92,N$94,N$96,N$98,N$100,N$102,N$104,N$106,N$108,N$110,N$112,N$114,N$116,N$118,N$120,N$122,N$124)) -> 3 | P101: =RANK(P100,(P$6,P$8,P$10,P$12,P$14,P$16,P$18,P$20,P$22,P$24,P$26,P$28,P$30,P$32,P$34,P$36,P$38,P$40,P$42,P$44,P$46,P$48,P$50,P$52,P$54,P$56,P$58,P$60,P$62,P$64,P$66,P$68,P$70,P$72,P$74,P$76,P$78,P$80,P$82,P$84,P$86,P$88,P$90,P$92,P$94,P$96,P$98,P$100,P$102,P$104,P$106,P$108,P$110,P$112,P$114,P$116,P$118,P$120,P$122,P$124)) -> 3
A102: Pacific | B102: 1 | C102: 14.50 | D102: 15.10 | E102: 29.60 | F102: 14.70 | G102: 14.70 | H102: 15.00 | I102: 22.20 | J102: 15.10 | K102: 15.30 | L102: 15.70 | M102: 23.05 | N102: 74.85 | O102: 0.0 | P102: 74.85
A103: Crest | C103: =RANK(C102,(C$6,C$8,C$10,C$12,C$14,C$16,C$18,C$20,C$22,C$24,C$26,C$28,C$30,C$32,C$34,C$36,C$38,C$40,C$42,C$44,C$46,C$48,C$50,C$52,C$54,C$56,C$58,C$60,C$62,C$64,C$66,C$68,C$70,C$72,C$74,C$76,C$78,C$80,C$82,C$84,C$86,C$88,C$90,C$92,C$94,C$96,C$98,C$100,C$102,C$104,C$106,C$108,C$110,C$112,C$114,C$116,C$118,C$120,C$122,C$124)) -> 4 | D103: =RANK(D102,(D$6,D$8,D$10,D$12,D$14,D$16,D$18,D$20,D$22,D$24,D$26,D$28,D$30,D$32,D$34,D$36,D$38,D$40,D$42,D$44,D$46,D$48,D$50,D$52,D$54,D$56,D$58,D$60,D$62,D$64,D$66,D$68,D$70,D$72,D$74,D$76,D$78,D$80,D$82,D$84,D$86,D$88,D$90,D$92,D$94,D$96,D$98,D$100,D$102,D$104,D$106,D$108,D$110,D$112,D$114,D$116,D$118,D$120,D$122,D$124)) -> 4 | E103: =RANK(E102,(E$6,E$8,E$10,E$12,E$14,E$16,E$18,E$20,E$22,E$24,E$26,E$28,E$30,E$32,E$34,E$36,E$38,E$40,E$42,E$44,E$46,E$48,E$50,E$52,E$54,E$56,E$58,E$60,E$62,E$64,E$66,E$68,E$70,E$72,E$74,E$76,E$78,E$80,E$82,E$84,E$86,E$88,E$90,E$92,E$94,E$96,E$98,E$100,E$102,E$104,E$106,E$108,E$110,E$112,E$114,E$116,E$118,E$120,E$122,E$124)) -> 4 | F103: =RANK(F102,(F$6,F$8,F$10,F$12,F$14,F$16,F$18,F$20,F$22,F$24,F$26,F$28,F$30,F$32,F$34,F$36,F$38,F$40,F$42,F$44,F$46,F$48,F$50,F$52,F$54,F$56,F$58,F$60,F$62,F$64,F$66,F$68,F$70,F$72,F$74,F$76,F$78,F$80,F$82,F$84,F$86,F$88,F$90,F$92,F$94,F$96,F$98,F$100,F$102,F$104,F$106,F$108,F$110,F$112,F$114,F$116,F$118,F$120,F$122,F$124)) -> 4 | G103: =RANK(G102,(G$6,G$8,G$10,G$12,G$14,G$16,G$18,G$20,G$22,G$24,G$26,G$28,G$30,G$32,G$34,G$36,G$38,G$40,G$42,G$44,G$46,G$48,G$50,G$52,G$54,G$56,G$58,G$60,G$62,G$64,G$66,G$68,G$70,G$72,G$74,G$76,G$78,G$80,G$82,G$84,G$86,G$88,G$90,G$92,G$94,G$96,G$98,G$100,G$102,G$104,G$106,G$108,G$110,G$112,G$114,G$116,G$118,G$120,G$122,G$124)) -> 4 | H103: =RANK(H102,(H$6,H$8,H$10,H$12,H$14,H$16,H$18,H$20,H$22,H$24,H$26,H$28,H$30,H$32,H$34,H$36,H$38,H$40,H$42,H$44,H$46,H$48,H$50,H$52,H$54,H$56,H$58,H$60,H$62,H$64,H$66,H$68,H$70,H$72,H$74,H$76,H$78,H$80,H$82,H$84,H$86,H$88,H$90,H$92,H$94,H$96,H$98,H$100,H$102,H$104,H$106,H$108,H$110,H$112,H$114,H$116,H$118,H$120,H$122,H$124)) -> 4 | I103: =RANK(I102,(I$6,I$8,I$10,I$12,I$14,I$16,I$18,I$20,I$22,I$24,I$26,I$28,I$30,I$32,I$34,I$36,I$38,I$40,I$42,I$44,I$46,I$48,I$50,I$52,I$54,I$56,I$58,I$60,I$62,I$64,I$66,I$68,I$70,I$72,I$74,I$76,I$78,I$80,I$82,I$84,I$86,I$88,I$90,I$92,I$94,I$96,I$98,I$100,I$102,I$104,I$106,I$108,I$110,I$112,I$114,I$116,I$118,I$120,I$122,I$124)) -> 4 | J103: =RANK(J102,(J$6,J$8,J$10,J$12,J$14,J$16,J$18,J$20,J$22,J$24,J$26,J$28,J$30,J$32,J$34,J$36,J$38,J$40,J$42,J$44,J$46,J$48,J$50,J$52,J$54,J$56,J$58,J$60,J$62,J$64,J$66,J$68,J$70,J$72,J$74,J$76,J$78,J$80,J$82,J$84,J$86,J$88,J$90,J$92,J$94,J$96,J$98,J$100,J$102,J$104,J$106,J$108,J$110,J$112,J$114,J$116,J$118,J$120,J$122,J$124)) -> 4 | K103: =RANK(K102,(K$6,K$8,K$10,K$12,K$14,K$16,K$18,K$20,K$22,K$24,K$26,K$28,K$30,K$32,K$34,K$36,K$38,K$40,K$42,K$44,K$46,K$48,K$50,K$52,K$54,K$56,K$58,K$60,K$62,K$64,K$66,K$68,K$70,K$72,K$74,K$76,K$78,K$80,K$82,K$84,K$86,K$88,K$90,K$92,K$94,K$96,K$98,K$100,K$102,K$104,K$106,K$108,K$110,K$112,K$114,K$116,K$118,K$120,K$122,K$124)) -> 4 | L103: =RANK(L102,(L$6,L$8,L$10,L$12,L$14,L$16,L$18,L$20,L$22,L$24,L$26,L$28,L$30,L$32,L$34,L$36,L$38,L$40,L$42,L$44,L$46,L$48,L$50,L$52,L$54,L$56,L$58,L$60,L$62,L$64,L$66,L$68,L$70,L$72,L$74,L$76,L$78,L$80,L$82,L$84,L$86,L$88,L$90,L$92,L$94,L$96,L$98,L$100,L$102,L$104,L$106,L$108,L$110,L$112,L$114,L$116,L$118,L$120,L$122,L$124)) -> 4 | M103: =RANK(M102,(M$6,M$8,M$10,M$12,M$14,M$16,M$18,M$20,M$22,M$24,M$26,M$28,M$30,M$32,M$34,M$36,M$38,M$40,M$42,M$44,M$46,M$48,M$50,M$52,M$54,M$56,M$58,M$60,M$62,M$64,M$66,M$68,M$70,M$72,M$74,M$76,M$78,M$80,M$82,M$84,M$86,M$88,M$90,M$92,M$94,M$96,M$98,M$100,M$102,M$104,M$106,M$108,M$110,M$112,M$114,M$116,M$118,M$120,M$122,M$124)) -> 4 | N103: =RANK(N102,(N$6,N$8,N$10,N$12,N$14,N$16,N$18,N$20,N$22,N$24,N$26,N$28,N$30,N$32,N$34,N$36,N$38,N$40,N$42,N$44,N$46,N$48,N$50,N$52,N$54,N$56,N$58,N$60,N$62,N$64,N$66,N$68,N$70,N$72,N$74,N$76,N$78,N$80,N$82,N$84,N$86,N$88,N$90,N$92,N$94,N$96,N$98,N$100,N$102,N$104,N$106,N$108,N$110,N$112,N$114,N$116,N$118,N$120,N$122,N$124)) -> 4 | P103: =RANK(P102,(P$6,P$8,P$10,P$12,P$14,P$16,P$18,P$20,P$22,P$24,P$26,P$28,P$30,P$32,P$34,P$36,P$38,P$40,P$42,P$44,P$46,P$48,P$50,P$52,P$54,P$56,P$58,P$60,P$62,P$64,P$66,P$68,P$70,P$72,P$74,P$76,P$78,P$80,P$82,P$84,P$86,P$88,P$90,P$92,P$94,P$96,P$98,P$100,P$102,P$104,P$106,P$108,P$110,P$112,P$114,P$116,P$118,P$120,P$122,P$124)) -> 4
A106: 8/2/2022 Sevierville, Tennessee
C107: General Effect | F107: Visual | J107: Music
C108: 1 | D108: 2 | F108: Proficiency | G108: Analysis | H108: Color Guard | J108: Brass | K108: Analysis | L108: Percussion | N108: Sub | P108: Total
C109: J. Orefice | D109: D. Aydelott | E109: Total | F109: T. Hundall | G109: C. Church | H109: D. Deems | I109: Total ÷2 | J109: A. Cook | K109: R. Greenwell | L109: T. Hall | M109: Total ÷2 | N109: Total | O109: Pen | P109: Score
A110: DCI World Class | C110: 20 | D110: 20 | E110: 40 | F110: 20 | G110: 20 | H110: 20 | I110: 30 | J110: 20 | K110: 20 | L110: 20 | M110: 30 | N110: 100 | P110: 100
A111: Blue | B111: 3 | C111: 18.00 | D111: 17.50 | E111: 35.50 | F111: 18.30 | G111: 17.90 | H111: 17.90 | I111: 27.05 | J111: 17.60 | K111: 18.00 | L111: 17.40 | M111: 26.50 | N111: 89.05 | O111: 0.0 | P111: 89.05
A112: Stars | C112: =RANK(C111,(C$6,C$8,C$10,C$12,C$14,C$16,C$18,C$20,C$22,C$24,C$26,C$28,C$30,C$32,C$34,C$36,C$38,C$40,C$42,C$44,C$46,C$48,C$50,C$52,C$54,C$56,C$58,C$60,C$62,C$64,C$66,C$68,C$70,C$72,C$74,C$76,C$78,C$80,C$82,C$84,C$86,C$88,C$90,C$92,C$94,C$96,C$98,C$100,C$102,C$104,C$106,C$108,C$110,C$112,C$114,C$116,C$118,C$120,C$122,C$124)) -> 1 | D112: =RANK(D111,(D$6,D$8,D$10,D$12,D$14,D$16,D$18,D$20,D$22,D$24,D$26,D$28,D$30,D$32,D$34,D$36,D$38,D$40,D$42,D$44,D$46,D$48,D$50,D$52,D$54,D$56,D$58,D$60,D$62,D$64,D$66,D$68,D$70,D$72,D$74,D$76,D$78,D$80,D$82,D$84,D$86,D$88,D$90,D$92,D$94,D$96,D$98,D$100,D$102,D$104,D$106,D$108,D$110,D$112,D$114,D$116,D$118,D$120,D$122,D$124)) -> 2 | E112: =RANK(E111,(E$6,E$8,E$10,E$12,E$14,E$16,E$18,E$20,E$22,E$24,E$26,E$28,E$30,E$32,E$34,E$36,E$38,E$40,E$42,E$44,E$46,E$48,E$50,E$52,E$54,E$56,E$58,E$60,E$62,E$64,E$66,E$68,E$70,E$72,E$74,E$76,E$78,E$80,E$82,E$84,E$86,E$88,E$90,E$92,E$94,E$96,E$98,E$100,E$102,E$104,E$106,E$108,E$110,E$112,E$114,E$116,E$118,E$120,E$122,E$124)) -> 1 | F112: =RANK(F111,(F$6,F$8,F$10,F$12,F$14,F$16,F$18,F$20,F$22,F$24,F$26,F$28,F$30,F$32,F$34,F$36,F$38,F$40,F$42,F$44,F$46,F$48,F$50,F$52,F$54,F$56,F$58,F$60,F$62,F$64,F$66,F$68,F$70,F$72,F$74,F$76,F$78,F$80,F$82,F$84,F$86,F$88,F$90,F$92,F$94,F$96,F$98,F$100,F$102,F$104,F$106,F$108,F$110,F$112,F$114,F$116,F$118,F$120,F$122,F$124)) -> 1 | G112: =RANK(G111,(G$6,G$8,G$10,G$12,G$14,G$16,G$18,G$20,G$22,G$24,G$26,G$28,G$30,G$32,G$34,G$36,G$38,G$40,G$42,G$44,G$46,G$48,G$50,G$52,G$54,G$56,G$58,G$60,G$62,G$64,G$66,G$68,G$70,G$72,G$74,G$76,G$78,G$80,G$82,G$84,G$86,G$88,G$90,G$92,G$94,G$96,G$98,G$100,G$102,G$104,G$106,G$108,G$110,G$112,G$114,G$116,G$118,G$120,G$122,G$124)) -> 1 | H112: =RANK(H111,(H$6,H$8,H$10,H$12,H$14,H$16,H$18,H$20,H$22,H$24,H$26,H$28,H$30,H$32,H$34,H$36,H$38,H$40,H$42,H$44,H$46,H$48,H$50,H$52,H$54,H$56,H$58,H$60,H$62,H$64,H$66,H$68,H$70,H$72,H$74,H$76,H$78,H$80,H$82,H$84,H$86,H$88,H$90,H$92,H$94,H$96,H$98,H$100,H$102,H$104,H$106,H$108,H$110,H$112,H$114,H$116,H$118,H$120,H$122,H$124)) -> 1 | I112: =RANK(I111,(I$6,I$8,I$10,I$12,I$14,I$16,I$18,I$20,I$22,I$24,I$26,I$28,I$30,I$32,I$34,I$36,I$38,I$40,I$42,I$44,I$46,I$48,I$50,I$52,I$54,I$56,I$58,I$60,I$62,I$64,I$66,I$68,I$70,I$72,I$74,I$76,I$78,I$80,I$82,I$84,I$86,I$88,I$90,I$92,I$94,I$96,I$98,I$100,I$102,I$104,I$106,I$108,I$110,I$112,I$114,I$116,I$118,I$120,I$122,I$124)) -> 1 | J112: =RANK(J111,(J$6,J$8,J$10,J$12,J$14,J$16,J$18,J$20,J$22,J$24,J$26,J$28,J$30,J$32,J$34,J$36,J$38,J$40,J$42,J$44,J$46,J$48,J$50,J$52,J$54,J$56,J$58,J$60,J$62,J$64,J$66,J$68,J$70,J$72,J$74,J$76,J$78,J$80,J$82,J$84,J$86,J$88,J$90,J$92,J$94,J$96,J$98,J$100,J$102,J$104,J$106,J$108,J$110,J$112,J$114,J$116,J$118,J$120,J$122,J$124)) -> 1 | K112: =RANK(K111,(K$6,K$8,K$10,K$12,K$14,K$16,K$18,K$20,K$22,K$24,K$26,K$28,K$30,K$32,K$34,K$36,K$38,K$40,K$42,K$44,K$46,K$48,K$50,K$52,K$54,K$56,K$58,K$60,K$62,K$64,K$66,K$68,K$70,K$72,K$74,K$76,K$78,K$80,K$82,K$84,K$86,K$88,K$90,K$92,K$94,K$96,K$98,K$100,K$102,K$104,K$106,K$108,K$110,K$112,K$114,K$116,K$118,K$120,K$122,K$124)) -> 2 | L112: =RANK(L111,(L$6,L$8,L$10,L$12,L$14,L$16,L$18,L$20,L$22,L$24,L$26,L$28,L$30,L$32,L$34,L$36,L$38,L$40,L$42,L$44,L$46,L$48,L$50,L$52,L$54,L$56,L$58,L$60,L$62,L$64,L$66,L$68,L$70,L$72,L$74,L$76,L$78,L$80,L$82,L$84,L$86,L$88,L$90,L$92,L$94,L$96,L$98,L$100,L$102,L$104,L$106,L$108,L$110,L$112,L$114,L$116,L$118,L$120,L$122,L$124)) -> 3 | M112: =RANK(M111,(M$6,M$8,M$10,M$12,M$14,M$16,M$18,M$20,M$22,M$24,M$26,M$28,M$30,M$32,M$34,M$36,M$38,M$40,M$42,M$44,M$46,M$48,M$50,M$52,M$54,M$56,M$58,M$60,M$62,M$64,M$66,M$68,M$70,M$72,M$74,M$76,M$78,M$80,M$82,M$84,M$86,M$88,M$90,M$92,M$94,M$96,M$98,M$100,M$102,M$104,M$106,M$108,M$110,M$112,M$114,M$116,M$118,M$120,M$122,M$124)) -> 2 | N112: =RANK(N111,(N$6,N$8,N$10,N$12,N$14,N$16,N$18,N$20,N$22,N$24,N$26,N$28,N$30,N$32,N$34,N$36,N$38,N$40,N$42,N$44,N$46,N$48,N$50,N$52,N$54,N$56,N$58,N$60,N$62,N$64,N$66,N$68,N$70,N$72,N$74,N$76,N$78,N$80,N$82,N$84,N$86,N$88,N$90,N$92,N$94,N$96,N$98,N$100,N$102,N$104,N$106,N$108,N$110,N$112,N$114,N$116,N$118,N$120,N$122,N$124)) -> 1 | P112: =RANK(P111,(P$6,P$8,P$10,P$12,P$14,P$16,P$18,P$20,P$22,P$24,P$26,P$28,P$30,P$32,P$34,P$36,P$38,P$40,P$42,P$44,P$46,P$48,P$50,P$52,P$54,P$56,P$58,P$60,P$62,P$64,P$66,P$68,P$70,P$72,P$74,P$76,P$78,P$80,P$82,P$84,P$86,P$88,P$90,P$92,P$94,P$96,P$98,P$100,P$102,P$104,P$106,P$108,P$110,P$112,P$114,P$116,P$118,P$120,P$122,P$124)) -> 1
A113: Cavaliers | B113: 4 | C113: 17.20 | D113: 17.70 | E113: 34.90 | F113: 18.00 | G113: 17.20 | H113: 17.30 | I113: 26.25 | J113: 17.50 | K113: 18.20 | L113: 18.40 | M113: 27.05 | N113: 88.20 | O113: 0.0 | P113: 88.20
C114: =RANK(C113,(C$6,C$8,C$10,C$12,C$14,C$16,C$18,C$20,C$22,C$24,C$26,C$28,C$30,C$32,C$34,C$36,C$38,C$40,C$42,C$44,C$46,C$48,C$50,C$52,C$54,C$56,C$58,C$60,C$62,C$64,C$66,C$68,C$70,C$72,C$74,C$76,C$78,C$80,C$82,C$84,C$86,C$88,C$90,C$92,C$94,C$96,C$98,C$100,C$102,C$104,C$106,C$108,C$110,C$112,C$114,C$116,C$118,C$120,C$122,C$124)) -> 3 | D114: =RANK(D113,(D$6,D$8,D$10,D$12,D$14,D$16,D$18,D$20,D$22,D$24,D$26,D$28,D$30,D$32,D$34,D$36,D$38,D$40,D$42,D$44,D$46,D$48,D$50,D$52,D$54,D$56,D$58,D$60,D$62,D$64,D$66,D$68,D$70,D$72,D$74,D$76,D$78,D$80,D$82,D$84,D$86,D$88,D$90,D$92,D$94,D$96,D$98,D$100,D$102,D$104,D$106,D$108,D$110,D$112,D$114,D$116,D$118,D$120,D$122,D$124)) -> 1 | E114: =RANK(E113,(E$6,E$8,E$10,E$12,E$14,E$16,E$18,E$20,E$22,E$24,E$26,E$28,E$30,E$32,E$34,E$36,E$38,E$40,E$42,E$44,E$46,E$48,E$50,E$52,E$54,E$56,E$58,E$60,E$62,E$64,E$66,E$68,E$70,E$72,E$74,E$76,E$78,E$80,E$82,E$84,E$86,E$88,E$90,E$92,E$94,E$96,E$98,E$100,E$102,E$104,E$106,E$108,E$110,E$112,E$114,E$116,E$118,E$120,E$122,E$124)) -> 2 | F114: =RANK(F113,(F$6,F$8,F$10,F$12,F$14,F$16,F$18,F$20,F$22,F$24,F$26,F$28,F$30,F$32,F$34,F$36,F$38,F$40,F$42,F$44,F$46,F$48,F$50,F$52,F$54,F$56,F$58,F$60,F$62,F$64,F$66,F$68,F$70,F$72,F$74,F$76,F$78,F$80,F$82,F$84,F$86,F$88,F$90,F$92,F$94,F$96,F$98,F$100,F$102,F$104,F$106,F$108,F$110,F$112,F$114,F$116,F$118,F$120,F$122,F$124)) -> 2 | G114: =RANK(G113,(G$6,G$8,G$10,G$12,G$14,G$16,G$18,G$20,G$22,G$24,G$26,G$28,G$30,G$32,G$34,G$36,G$38,G$40,G$42,G$44,G$46,G$48,G$50,G$52,G$54,G$56,G$58,G$60,G$62,G$64,G$66,G$68,G$70,G$72,G$74,G$76,G$78,G$80,G$82,G$84,G$86,G$88,G$90,G$92,G$94,G$96,G$98,G$100,G$102,G$104,G$106,G$108,G$110,G$112,G$114,G$116,G$118,G$120,G$122,G$124)) -> 3 | H114: =RANK(H113,(H$6,H$8,H$10,H$12,H$14,H$16,H$18,H$20,H$22,H$24,H$26,H$28,H$30,H$32,H$34,H$36,H$38,H$40,H$42,H$44,H$46,H$48,H$50,H$52,H$54,H$56,H$58,H$60,H$62,H$64,H$66,H$68,H$70,H$72,H$74,H$76,H$78,H$80,H$82,H$84,H$86,H$88,H$90,H$92,H$94,H$96,H$98,H$100,H$102,H$104,H$106,H$108,H$110,H$112,H$114,H$116,H$118,H$120,H$122,H$124)) -> 3 | I114: =RANK(I113,(I$6,I$8,I$10,I$12,I$14,I$16,I$18,I$20,I$22,I$24,I$26,I$28,I$30,I$32,I$34,I$36,I$38,I$40,I$42,I$44,I$46,I$48,I$50,I$52,I$54,I$56,I$58,I$60,I$62,I$64,I$66,I$68,I$70,I$72,I$74,I$76,I$78,I$80,I$82,I$84,I$86,I$88,I$90,I$92,I$94,I$96,I$98,I$100,I$102,I$104,I$106,I$108,I$110,I$112,I$114,I$116,I$118,I$120,I$122,I$124)) -> 3 | J114: =RANK(J113,(J$6,J$8,J$10,J$12,J$14,J$16,J$18,J$20,J$22,J$24,J$26,J$28,J$30,J$32,J$34,J$36,J$38,J$40,J$42,J$44,J$46,J$48,J$50,J$52,J$54,J$56,J$58,J$60,J$62,J$64,J$66,J$68,J$70,J$72,J$74,J$76,J$78,J$80,J$82,J$84,J$86,J$88,J$90,J$92,J$94,J$96,J$98,J$100,J$102,J$104,J$106,J$108,J$110,J$112,J$114,J$116,J$118,J$120,J$122,J$124)) -> 2 | K114: =RANK(K113,(K$6,K$8,K$10,K$12,K$14,K$16,K$18,K$20,K$22,K$24,K$26,K$28,K$30,K$32,K$34,K$36,K$38,K$40,K$42,K$44,K$46,K$48,K$50,K$52,K$54,K$56,K$58,K$60,K$62,K$64,K$66,K$68,K$70,K$72,K$74,K$76,K$78,K$80,K$82,K$84,K$86,K$88,K$90,K$92,K$94,K$96,K$98,K$100,K$102,K$104,K$106,K$108,K$110,K$112,K$114,K$116,K$118,K$120,K$122,K$124)) -> 1 | L114: =RANK(L113,(L$6,L$8,L$10,L$12,L$14,L$16,L$18,L$20,L$22,L$24,L$26,L$28,L$30,L$32,L$34,L$36,L$38,L$40,L$42,L$44,L$46,L$48,L$50,L$52,L$54,L$56,L$58,L$60,L$62,L$64,L$66,L$68,L$70,L$72,L$74,L$76,L$78,L$80,L$82,L$84,L$86,L$88,L$90,L$92,L$94,L$96,L$98,L$100,L$102,L$104,L$106,L$108,L$110,L$112,L$114,L$116,L$118,L$120,L$122,L$124)) -> 1 | M114: =RANK(M113,(M$6,M$8,M$10,M$12,M$14,M$16,M$18,M$20,M$22,M$24,M$26,M$28,M$30,M$32,M$34,M$36,M$38,M$40,M$42,M$44,M$46,M$48,M$50,M$52,M$54,M$56,M$58,M$60,M$62,M$64,M$66,M$68,M$70,M$72,M$74,M$76,M$78,M$80,M$82,M$84,M$86,M$88,M$90,M$92,M$94,M$96,M$98,M$100,M$102,M$104,M$106,M$108,M$110,M$112,M$114,M$116,M$118,M$120,M$122,M$124)) -> 1 | N114: =RANK(N113,(N$6,N$8,N$10,N$12,N$14,N$16,N$18,N$20,N$22,N$24,N$26,N$28,N$30,N$32,N$34,N$36,N$38,N$40,N$42,N$44,N$46,N$48,N$50,N$52,N$54,N$56,N$58,N$60,N$62,N$64,N$66,N$68,N$70,N$72,N$74,N$76,N$78,N$80,N$82,N$84,N$86,N$88,N$90,N$92,N$94,N$96,N$98,N$100,N$102,N$104,N$106,N$108,N$110,N$112,N$114,N$116,N$118,N$120,N$122,N$124)) -> 2 | P114: =RANK(P113,(P$6,P$8,P$10,P$12,P$14,P$16,P$18,P$20,P$22,P$24,P$26,P$28,P$30,P$32,P$34,P$36,P$38,P$40,P$42,P$44,P$46,P$48,P$50,P$52,P$54,P$56,P$58,P$60,P$62,P$64,P$66,P$68,P$70,P$72,P$74,P$76,P$78,P$80,P$82,P$84,P$86,P$88,P$90,P$92,P$94,P$96,P$98,P$100,P$102,P$104,P$106,P$108,P$110,P$112,P$114,P$116,P$118,P$120,P$122,P$124)) -> 2
A115: Mandarins | B115: 2 | C115: 17.50 | D115: 17.30 | E115: 34.80 | F115: 17.90 | G115: 17.40 | H115: 17.40 | I115: 26.35 | J115: 17.20 | K115: 17.10 | L115: 17.60 | M115: 25.95 | N115: 87.10 | O115: 0.0 | P115: 87.10
C116: =RANK(C115,(C$6,C$8,C$10,C$12,C$14,C$16,C$18,C$20,C$22,C$24,C$26,C$28,C$30,C$32,C$34,C$36,C$38,C$40,C$42,C$44,C$46,C$48,C$50,C$52,C$54,C$56,C$58,C$60,C$62,C$64,C$66,C$68,C$70,C$72,C$74,C$76,C$78,C$80,C$82,C$84,C$86,C$88,C$90,C$92,C$94,C$96,C$98,C$100,C$102,C$104,C$106,C$108,C$110,C$112,C$114,C$116,C$118,C$120,C$122,C$124)) -> 2 | D116: =RANK(D115,(D$6,D$8,D$10,D$12,D$14,D$16,D$18,D$20,D$22,D$24,D$26,D$28,D$30,D$32,D$34,D$36,D$38,D$40,D$42,D$44,D$46,D$48,D$50,D$52,D$54,D$56,D$58,D$60,D$62,D$64,D$66,D$68,D$70,D$72,D$74,D$76,D$78,D$80,D$82,D$84,D$86,D$88,D$90,D$92,D$94,D$96,D$98,D$100,D$102,D$104,D$106,D$108,D$110,D$112,D$114,D$116,D$118,D$120,D$122,D$124)) -> 3 | E116: =RANK(E115,(E$6,E$8,E$10,E$12,E$14,E$16,E$18,E$20,E$22,E$24,E$26,E$28,E$30,E$32,E$34,E$36,E$38,E$40,E$42,E$44,E$46,E$48,E$50,E$52,E$54,E$56,E$58,E$60,E$62,E$64,E$66,E$68,E$70,E$72,E$74,E$76,E$78,E$80,E$82,E$84,E$86,E$88,E$90,E$92,E$94,E$96,E$98,E$100,E$102,E$104,E$106,E$108,E$110,E$112,E$114,E$116,E$118,E$120,E$122,E$124)) -> 3 | F116: =RANK(F115,(F$6,F$8,F$10,F$12,F$14,F$16,F$18,F$20,F$22,F$24,F$26,F$28,F$30,F$32,F$34,F$36,F$38,F$40,F$42,F$44,F$46,F$48,F$50,F$52,F$54,F$56,F$58,F$60,F$62,F$64,F$66,F$68,F$70,F$72,F$74,F$76,F$78,F$80,F$82,F$84,F$86,F$88,F$90,F$92,F$94,F$96,F$98,F$100,F$102,F$104,F$106,F$108,F$110,F$112,F$114,F$116,F$118,F$120,F$122,F$124)) -> 3 | G116: =RANK(G115,(G$6,G$8,G$10,G$12,G$14,G$16,G$18,G$20,G$22,G$24,G$26,G$28,G$30,G$32,G$34,G$36,G$38,G$40,G$42,G$44,G$46,G$48,G$50,G$52,G$54,G$56,G$58,G$60,G$62,G$64,G$66,G$68,G$70,G$72,G$74,G$76,G$78,G$80,G$82,G$84,G$86,G$88,G$90,G$92,G$94,G$96,G$98,G$100,G$102,G$104,G$106,G$108,G$110,G$112,G$114,G$116,G$118,G$120,G$122,G$124)) -> 2 | H116: =RANK(H115,(H$6,H$8,H$10,H$12,H$14,H$16,H$18,H$20,H$22,H$24,H$26,H$28,H$30,H$32,H$34,H$36,H$38,H$40,H$42,H$44,H$46,H$48,H$50,H$52,H$54,H$56,H$58,H$60,H$62,H$64,H$66,H$68,H$70,H$72,H$74,H$76,H$78,H$80,H$82,H$84,H$86,H$88,H$90,H$92,H$94,H$96,H$98,H$100,H$102,H$104,H$106,H$108,H$110,H$112,H$114,H$116,H$118,H$120,H$122,H$124)) -> 2 | I116: =RANK(I115,(I$6,I$8,I$10,I$12,I$14,I$16,I$18,I$20,I$22,I$24,I$26,I$28,I$30,I$32,I$34,I$36,I$38,I$40,I$42,I$44,I$46,I$48,I$50,I$52,I$54,I$56,I$58,I$60,I$62,I$64,I$66,I$68,I$70,I$72,I$74,I$76,I$78,I$80,I$82,I$84,I$86,I$88,I$90,I$92,I$94,I$96,I$98,I$100,I$102,I$104,I$106,I$108,I$110,I$112,I$114,I$116,I$118,I$120,I$122,I$124)) -> 2 | J116: =RANK(J115,(J$6,J$8,J$10,J$12,J$14,J$16,J$18,J$20,J$22,J$24,J$26,J$28,J$30,J$32,J$34,J$36,J$38,J$40,J$42,J$44,J$46,J$48,J$50,J$52,J$54,J$56,J$58,J$60,J$62,J$64,J$66,J$68,J$70,J$72,J$74,J$76,J$78,J$80,J$82,J$84,J$86,J$88,J$90,J$92,J$94,J$96,J$98,J$100,J$102,J$104,J$106,J$108,J$110,J$112,J$114,J$116,J$118,J$120,J$122,J$124)) -> 3 | K116: =RANK(K115,(K$6,K$8,K$10,K$12,K$14,K$16,K$18,K$20,K$22,K$24,K$26,K$28,K$30,K$32,K$34,K$36,K$38,K$40,K$42,K$44,K$46,K$48,K$50,K$52,K$54,K$56,K$58,K$60,K$62,K$64,K$66,K$68,K$70,K$72,K$74,K$76,K$78,K$80,K$82,K$84,K$86,K$88,K$90,K$92,K$94,K$96,K$98,K$100,K$102,K$104,K$106,K$108,K$110,K$112,K$114,K$116,K$118,K$120,K$122,K$124)) -> 3 | L116: =RANK(L115,(L$6,L$8,L$10,L$12,L$14,L$16,L$18,L$20,L$22,L$24,L$26,L$28,L$30,L$32,L$34,L$36,L$38,L$40,L$42,L$44,L$46,L$48,L$50,L$52,L$54,L$56,L$58,L$60,L$62,L$64,L$66,L$68,L$70,L$72,L$74,L$76,L$78,L$80,L$82,L$84,L$86,L$88,L$90,L$92,L$94,L$96,L$98,L$100,L$102,L$104,L$106,L$108,L$110,L$112,L$114,L$116,L$118,L$120,L$122,L$124)) -> 2 | M116: =RANK(M115,(M$6,M$8,M$10,M$12,M$14,M$16,M$18,M$20,M$22,M$24,M$26,M$28,M$30,M$32,M$34,M$36,M$38,M$40,M$42,M$44,M$46,M$48,M$50,M$52,M$54,M$56,M$58,M$60,M$62,M$64,M$66,M$68,M$70,M$72,M$74,M$76,M$78,M$80,M$82,M$84,M$86,M$88,M$90,M$92,M$94,M$96,M$98,M$100,M$102,M$104,M$106,M$108,M$110,M$112,M$114,M$116,M$118,M$120,M$122,M$124)) -> 3 | N116: =RANK(N115,(N$6,N$8,N$10,N$12,N$14,N$16,N$18,N$20,N$22,N$24,N$26,N$28,N$30,N$32,N$34,N$36,N$38,N$40,N$42,N$44,N$46,N$48,N$50,N$52,N$54,N$56,N$58,N$60,N$62,N$64,N$66,N$68,N$70,N$72,N$74,N$76,N$78,N$80,N$82,N$84,N$86,N$88,N$90,N$92,N$94,N$96,N$98,N$100,N$102,N$104,N$106,N$108,N$110,N$112,N$114,N$116,N$118,N$120,N$122,N$124)) -> 3 | P116: =RANK(P115,(P$6,P$8,P$10,P$12,P$14,P$16,P$18,P$20,P$22,P$24,P$26,P$28,P$30,P$32,P$34,P$36,P$38,P$40,P$42,P$44,P$46,P$48,P$50,P$52,P$54,P$56,P$58,P$60,P$62,P$64,P$66,P$68,P$70,P$72,P$74,P$76,P$78,P$80,P$82,P$84,P$86,P$88,P$90,P$92,P$94,P$96,P$98,P$100,P$102,P$104,P$106,P$108,P$110,P$112,P$114,P$116,P$118,P$120,P$122,P$124)) -> 3
A117: Madison | B117: 1 | C117: 15.70 | D117: 16.00 | E117: 31.70 | F117: 16.20 | G117: 15.70 | H117: 15.60 | I117: 23.75 | J117: 15.60 | K117: 15.70 | L117: 15.20 | M117: 23.25 | N117: 78.70 | O117: 0.0 | P117: 78.70
A118: Scouts | C118: =RANK(C117,(C$6,C$8,C$10,C$12,C$14,C$16,C$18,C$20,C$22,C$24,C$26,C$28,C$30,C$32,C$34,C$36,C$38,C$40,C$42,C$44,C$46,C$48,C$50,C$52,C$54,C$56,C$58,C$60,C$62,C$64,C$66,C$68,C$70,C$72,C$74,C$76,C$78,C$80,C$82,C$84,C$86,C$88,C$90,C$92,C$94,C$96,C$98,C$100,C$102,C$104,C$106,C$108,C$110,C$112,C$114,C$116,C$118,C$120,C$122,C$124)) -> 4 | D118: =RANK(D117,(D$6,D$8,D$10,D$12,D$14,D$16,D$18,D$20,D$22,D$24,D$26,D$28,D$30,D$32,D$34,D$36,D$38,D$40,D$42,D$44,D$46,D$48,D$50,D$52,D$54,D$56,D$58,D$60,D$62,D$64,D$66,D$68,D$70,D$72,D$74,D$76,D$78,D$80,D$82,D$84,D$86,D$88,D$90,D$92,D$94,D$96,D$98,D$100,D$102,D$104,D$106,D$108,D$110,D$112,D$114,D$116,D$118,D$120,D$122,D$124)) -> 4 | E118: =RANK(E117,(E$6,E$8,E$10,E$12,E$14,E$16,E$18,E$20,E$22,E$24,E$26,E$28,E$30,E$32,E$34,E$36,E$38,E$40,E$42,E$44,E$46,E$48,E$50,E$52,E$54,E$56,E$58,E$60,E$62,E$64,E$66,E$68,E$70,E$72,E$74,E$76,E$78,E$80,E$82,E$84,E$86,E$88,E$90,E$92,E$94,E$96,E$98,E$100,E$102,E$104,E$106,E$108,E$110,E$112,E$114,E$116,E$118,E$120,E$122,E$124)) -> 4 | F118: =RANK(F117,(F$6,F$8,F$10,F$12,F$14,F$16,F$18,F$20,F$22,F$24,F$26,F$28,F$30,F$32,F$34,F$36,F$38,F$40,F$42,F$44,F$46,F$48,F$50,F$52,F$54,F$56,F$58,F$60,F$62,F$64,F$66,F$68,F$70,F$72,F$74,F$76,F$78,F$80,F$82,F$84,F$86,F$88,F$90,F$92,F$94,F$96,F$98,F$100,F$102,F$104,F$106,F$108,F$110,F$112,F$114,F$116,F$118,F$120,F$122,F$124)) -> 5 | G118: =RANK(G117,(G$6,G$8,G$10,G$12,G$14,G$16,G$18,G$20,G$22,G$24,G$26,G$28,G$30,G$32,G$34,G$36,G$38,G$40,G$42,G$44,G$46,G$48,G$50,G$52,G$54,G$56,G$58,G$60,G$62,G$64,G$66,G$68,G$70,G$72,G$74,G$76,G$78,G$80,G$82,G$84,G$86,G$88,G$90,G$92,G$94,G$96,G$98,G$100,G$102,G$104,G$106,G$108,G$110,G$112,G$114,G$116,G$118,G$120,G$122,G$124)) -> 4 | H118: =RANK(H117,(H$6,H$8,H$10,H$12,H$14,H$16,H$18,H$20,H$22,H$24,H$26,H$28,H$30,H$32,H$34,H$36,H$38,H$40,H$42,H$44,H$46,H$48,H$50,H$52,H$54,H$56,H$58,H$60,H$62,H$64,H$66,H$68,H$70,H$72,H$74,H$76,H$78,H$80,H$82,H$84,H$86,H$88,H$90,H$92,H$94,H$96,H$98,H$100,H$102,H$104,H$106,H$108,H$110,H$112,H$114,H$116,H$118,H$120,H$122,H$124)) -> 4 | I118: =RANK(I117,(I$6,I$8,I$10,I$12,I$14,I$16,I$18,I$20,I$22,I$24,I$26,I$28,I$30,I$32,I$34,I$36,I$38,I$40,I$42,I$44,I$46,I$48,I$50,I$52,I$54,I$56,I$58,I$60,I$62,I$64,I$66,I$68,I$70,I$72,I$74,I$76,I$78,I$80,I$82,I$84,I$86,I$88,I$90,I$92,I$94,I$96,I$98,I$100,I$102,I$104,I$106,I$108,I$110,I$112,I$114,I$116,I$118,I$120,I$122,I$124)) -> 4 | J118: =RANK(J117,(J$6,J$8,J$10,J$12,J$14,J$16,J$18,J$20,J$22,J$24,J$26,J$28,J$30,J$32,J$34,J$36,J$38,J$40,J$42,J$44,J$46,J$48,J$50,J$52,J$54,J$56,J$58,J$60,J$62,J$64,J$66,J$68,J$70,J$72,J$74,J$76,J$78,J$80,J$82,J$84,J$86,J$88,J$90,J$92,J$94,J$96,J$98,J$100,J$102,J$104,J$106,J$108,J$110,J$112,J$114,J$116,J$118,J$120,J$122,J$124)) -> 4 | K118: =RANK(K117,(K$6,K$8,K$10,K$12,K$14,K$16,K$18,K$20,K$22,K$24,K$26,K$28,K$30,K$32,K$34,K$36,K$38,K$40,K$42,K$44,K$46,K$48,K$50,K$52,K$54,K$56,K$58,K$60,K$62,K$64,K$66,K$68,K$70,K$72,K$74,K$76,K$78,K$80,K$82,K$84,K$86,K$88,K$90,K$92,K$94,K$96,K$98,K$100,K$102,K$104,K$106,K$108,K$110,K$112,K$114,K$116,K$118,K$120,K$122,K$124)) -> 4 | L118: =RANK(L117,(L$6,L$8,L$10,L$12,L$14,L$16,L$18,L$20,L$22,L$24,L$26,L$28,L$30,L$32,L$34,L$36,L$38,L$40,L$42,L$44,L$46,L$48,L$50,L$52,L$54,L$56,L$58,L$60,L$62,L$64,L$66,L$68,L$70,L$72,L$74,L$76,L$78,L$80,L$82,L$84,L$86,L$88,L$90,L$92,L$94,L$96,L$98,L$100,L$102,L$104,L$106,L$108,L$110,L$112,L$114,L$116,L$118,L$120,L$122,L$124)) -> 5 | M118: =RANK(M117,(M$6,M$8,M$10,M$12,M$14,M$16,M$18,M$20,M$22,M$24,M$26,M$28,M$30,M$32,M$34,M$36,M$38,M$40,M$42,M$44,M$46,M$48,M$50,M$52,M$54,M$56,M$58,M$60,M$62,M$64,M$66,M$68,M$70,M$72,M$74,M$76,M$78,M$80,M$82,M$84,M$86,M$88,M$90,M$92,M$94,M$96,M$98,M$100,M$102,M$104,M$106,M$108,M$110,M$112,M$114,M$116,M$118,M$120,M$122,M$124)) -> 5 | N118: =RANK(N117,(N$6,N$8,N$10,N$12,N$14,N$16,N$18,N$20,N$22,N$24,N$26,N$28,N$30,N$32,N$34,N$36,N$38,N$40,N$42,N$44,N$46,N$48,N$50,N$52,N$54,N$56,N$58,N$60,N$62,N$64,N$66,N$68,N$70,N$72,N$74,N$76,N$78,N$80,N$82,N$84,N$86,N$88,N$90,N$92,N$94,N$96,N$98,N$100,N$102,N$104,N$106,N$108,N$110,N$112,N$114,N$116,N$118,N$120,N$122,N$124)) -> 4 | P118: =RANK(P117,(P$6,P$8,P$10,P$12,P$14,P$16,P$18,P$20,P$22,P$24,P$26,P$28,P$30,P$32,P$34,P$36,P$38,P$40,P$42,P$44,P$46,P$48,P$50,P$52,P$54,P$56,P$58,P$60,P$62,P$64,P$66,P$68,P$70,P$72,P$74,P$76,P$78,P$80,P$82,P$84,P$86,P$88,P$90,P$92,P$94,P$96,P$98,P$100,P$102,P$104,P$106,P$108,P$110,P$112,P$114,P$116,P$118,P$120,P$122,P$124)) -> 4
A119: Music | B119: 5 | C119: 15.20 | D119: 15.70 | E119: 30.90 | F119: 16.70 | G119: 14.60 | H119: 15.10 | I119: 23.20 | J119: 15.30 | K119: 15.40 | L119: 16.50 | M119: 23.60 | N119: 77.70 | O119: 0.0 | P119: 77.70
A120: City | C120: =RANK(C119,(C$6,C$8,C$10,C$12,C$14,C$16,C$18,C$20,C$22,C$24,C$26,C$28,C$30,C$32,C$34,C$36,C$38,C$40,C$42,C$44,C$46,C$48,C$50,C$52,C$54,C$56,C$58,C$60,C$62,C$64,C$66,C$68,C$70,C$72,C$74,C$76,C$78,C$80,C$82,C$84,C$86,C$88,C$90,C$92,C$94,C$96,C$98,C$100,C$102,C$104,C$106,C$108,C$110,C$112,C$114,C$116,C$118,C$120,C$122,C$124)) -> 5 | D120: =RANK(D119,(D$6,D$8,D$10,D$12,D$14,D$16,D$18,D$20,D$22,D$24,D$26,D$28,D$30,D$32,D$34,D$36,D$38,D$40,D$42,D$44,D$46,D$48,D$50,D$52,D$54,D$56,D$58,D$60,D$62,D$64,D$66,D$68,D$70,D$72,D$74,D$76,D$78,D$80,D$82,D$84,D$86,D$88,D$90,D$92,D$94,D$96,D$98,D$100,D$102,D$104,D$106,D$108,D$110,D$112,D$114,D$116,D$118,D$120,D$122,D$124)) -> 5 | E120: =RANK(E119,(E$6,E$8,E$10,E$12,E$14,E$16,E$18,E$20,E$22,E$24,E$26,E$28,E$30,E$32,E$34,E$36,E$38,E$40,E$42,E$44,E$46,E$48,E$50,E$52,E$54,E$56,E$58,E$60,E$62,E$64,E$66,E$68,E$70,E$72,E$74,E$76,E$78,E$80,E$82,E$84,E$86,E$88,E$90,E$92,E$94,E$96,E$98,E$100,E$102,E$104,E$106,E$108,E$110,E$112,E$114,E$116,E$118,E$120,E$122,E$124)) -> 5 | F120: =RANK(F119,(F$6,F$8,F$10,F$12,F$14,F$16,F$18,F$20,F$22,F$24,F$26,F$28,F$30,F$32,F$34,F$36,F$38,F$40,F$42,F$44,F$46,F$48,F$50,F$52,F$54,F$56,F$58,F$60,F$62,F$64,F$66,F$68,F$70,F$72,F$74,F$76,F$78,F$80,F$82,F$84,F$86,F$88,F$90,F$92,F$94,F$96,F$98,F$100,F$102,F$104,F$106,F$108,F$110,F$112,F$114,F$116,F$118,F$120,F$122,F$124)) -> 4 | G120: =RANK(G119,(G$6,G$8,G$10,G$12,G$14,G$16,G$18,G$20,G$22,G$24,G$26,G$28,G$30,G$32,G$34,G$36,G$38,G$40,G$42,G$44,G$46,G$48,G$50,G$52,G$54,G$56,G$58,G$60,G$62,G$64,G$66,G$68,G$70,G$72,G$74,G$76,G$78,G$80,G$82,G$84,G$86,G$88,G$90,G$92,G$94,G$96,G$98,G$100,G$102,G$104,G$106,G$108,G$110,G$112,G$114,G$116,G$118,G$120,G$122,G$124)) -> 5 | H120: =RANK(H119,(H$6,H$8,H$10,H$12,H$14,H$16,H$18,H$20,H$22,H$24,H$26,H$28,H$30,H$32,H$34,H$36,H$38,H$40,H$42,H$44,H$46,H$48,H$50,H$52,H$54,H$56,H$58,H$60,H$62,H$64,H$66,H$68,H$70,H$72,H$74,H$76,H$78,H$80,H$82,H$84,H$86,H$88,H$90,H$92,H$94,H$96,H$98,H$100,H$102,H$104,H$106,H$108,H$110,H$112,H$114,H$116,H$118,H$120,H$122,H$124)) -> 5 | I120: =RANK(I119,(I$6,I$8,I$10,I$12,I$14,I$16,I$18,I$20,I$22,I$24,I$26,I$28,I$30,I$32,I$34,I$36,I$38,I$40,I$42,I$44,I$46,I$48,I$50,I$52,I$54,I$56,I$58,I$60,I$62,I$64,I$66,I$68,I$70,I$72,I$74,I$76,I$78,I$80,I$82,I$84,I$86,I$88,I$90,I$92,I$94,I$96,I$98,I$100,I$102,I$104,I$106,I$108,I$110,I$112,I$114,I$116,I$118,I$120,I$122,I$124)) -> 5 | J120: =RANK(J119,(J$6,J$8,J$10,J$12,J$14,J$16,J$18,J$20,J$22,J$24,J$26,J$28,J$30,J$32,J$34,J$36,J$38,J$40,J$42,J$44,J$46,J$48,J$50,J$52,J$54,J$56,J$58,J$60,J$62,J$64,J$66,J$68,J$70,J$72,J$74,J$76,J$78,J$80,J$82,J$84,J$86,J$88,J$90,J$92,J$94,J$96,J$98,J$100,J$102,J$104,J$106,J$108,J$110,J$112,J$114,J$116,J$118,J$120,J$122,J$124)) -> 5 | K120: =RANK(K119,(K$6,K$8,K$10,K$12,K$14,K$16,K$18,K$20,K$22,K$24,K$26,K$28,K$30,K$32,K$34,K$36,K$38,K$40,K$42,K$44,K$46,K$48,K$50,K$52,K$54,K$56,K$58,K$60,K$62,K$64,K$66,K$68,K$70,K$72,K$74,K$76,K$78,K$80,K$82,K$84,K$86,K$88,K$90,K$92,K$94,K$96,K$98,K$100,K$102,K$104,K$106,K$108,K$110,K$112,K$114,K$116,K$118,K$120,K$122,K$124)) -> 5 | L120: =RANK(L119,(L$6,L$8,L$10,L$12,L$14,L$16,L$18,L$20,L$22,L$24,L$26,L$28,L$30,L$32,L$34,L$36,L$38,L$40,L$42,L$44,L$46,L$48,L$50,L$52,L$54,L$56,L$58,L$60,L$62,L$64,L$66,L$68,L$70,L$72,L$74,L$76,L$78,L$80,L$82,L$84,L$86,L$88,L$90,L$92,L$94,L$96,L$98,L$100,L$102,L$104,L$106,L$108,L$110,L$112,L$114,L$116,L$118,L$120,L$122,L$124)) -> 4 | M120: =RANK(M119,(M$6,M$8,M$10,M$12,M$14,M$16,M$18,M$20,M$22,M$24,M$26,M$28,M$30,M$32,M$34,M$36,M$38,M$40,M$42,M$44,M$46,M$48,M$50,M$52,M$54,M$56,M$58,M$60,M$62,M$64,M$66,M$68,M$70,M$72,M$74,M$76,M$78,M$80,M$82,M$84,M$86,M$88,M$90,M$92,M$94,M$96,M$98,M$100,M$102,M$104,M$106,M$108,M$110,M$112,M$114,M$116,M$118,M$120,M$122,M$124)) -> 4 | N120: =RANK(N119,(N$6,N$8,N$10,N$12,N$14,N$16,N$18,N$20,N$22,N$24,N$26,N$28,N$30,N$32,N$34,N$36,N$38,N$40,N$42,N$44,N$46,N$48,N$50,N$52,N$54,N$56,N$58,N$60,N$62,N$64,N$66,N$68,N$70,N$72,N$74,N$76,N$78,N$80,N$82,N$84,N$86,N$88,N$90,N$92,N$94,N$96,N$98,N$100,N$102,N$104,N$106,N$108,N$110,N$112,N$114,N$116,N$118,N$120,N$122,N$124)) -> 5 | P120: =RANK(P119,(P$6,P$8,P$10,P$12,P$14,P$16,P$18,P$20,P$22,P$24,P$26,P$28,P$30,P$32,P$34,P$36,P$38,P$40,P$42,P$44,P$46,P$48,P$50,P$52,P$54,P$56,P$58,P$60,P$62,P$64,P$66,P$68,P$70,P$72,P$74,P$76,P$78,P$80,P$82,P$84,P$86,P$88,P$90,P$92,P$94,P$96,P$98,P$100,P$102,P$104,P$106,P$108,P$110,P$112,P$114,P$116,P$118,P$120,P$122,P$124)) -> 5
A123: 8/3/2022 DCA Virtual
C124: Visual | F124: Music | J124: Effect
C125: Ensemble | D125: Color Guard | F125: Brass | G125: Percussion | H125: Ensemble | J125: Visual | K125: Music | M125: Sub | O125: Total
C126: M. Metz | D126: G. King | E126: Average | F126: P. Hinman | G126: S. Brown | H126: B. Schwartz | I126: Total ÷2 | J126: F. Miller | K126: B. Relyea | L126: Total | M126: Total | N126: Pen | O126: Score
A127: DCA World Class | C127: 20 | D127: 20 | E127: 20 | F127: 20 | G127: 20 | H127: 20 | I127: 30 | J127: 25 | K127: 25 | L127: 50 | M127: 100 | O127: 100
A128: Bushwackers | C128: 15.10 | D128: 16.00 | E128: 15.55 | F128: 16.30 | G128: 16.50 | H128: 16.50 | I128: 24.65 | J128: 18.00 | K128: 20.30 | L128: 38.30 | M128: 78.50 | N128: 0.0 | O128: 78.50
C129: 1 | D129: 1 | E129: 1 | F129: 1 | G129: 1 | H129: 1 | I129: 1 | J129: 1 | K129: 1 | L129: 1 | M129: 1 | O129: 1
A130: DCA Open Class
A131: Connecticut | C131: 14.20 | D131: 15.10 | E131: 14.65 | F131: 15.30 | G131: 15.00 | H131: 15.20 | I131: 22.75 | J131: 16.15 | K131: 18.55 | L131: 34.70 | M131: 72.10 | N131: 0.0 | O131: 72.10
A132: Hurriances | C132: 2 | D132: 1 | E132: 2 | F132: 1 | G132: 2 | H132: 2 | I132: 2 | J132: 2 | K132: 2 | L132: 2 | M132: 2 | O132: 1
A133: Atlanta CV | C133: 14.80 | D133: 14.90 | E133: 14.85 | F133: 14.80 | G133: 16.90 | H133: 15.70 | I133: 23.70 | J133: 17.35 | K133: 19.15 | L133: 36.50 | M133: 75.05 | N133: 4.2 | O133: 70.85
C134: 1 | D134: 2 | E134: 1 | F134: 2 | G134: 1 | H134: 1 | I134: 1 | J134: 1 | K134: 1 | L134: 1 | M134: 1 | O134: 1
A135: DCA Class A
A136: Govenaires | C136: 13.60 | D136: 13.50 | E136: 13.55 | F136: 13.60 | G136: 14.70 | H136: 15.55 | I136: 21.90 | J136: 14.80 | K136: 17.55 | L136: 32.35 | M136: 67.80 | N136: 2.0 | O136: 65.80
C137: 1 | D137: 1 | E137: 1 | F137: 1 | G137: 1 | H137: 1 | I137: 1 | J137: 1 | K137: 1 | L137: 1 | M137: 1 | O137: 1
A140: 8/3/2022 Apple Valley, Minnesota
C141: General Effect | F141: Visual | J141: Music
C142: 1 | D142: 2 | F142: Proficiency | G142: Analysis | H142: Color Guard | J142: Brass | K142: Analysis | L142: Percussion | N142: Sub | P142: Total
C143: A. Combites | D143: S. Halquist | E143: Total | F143: K. Baker | G143: J. Tate | H143: C. Clayton | I143: Total ÷2 | J143: No Judge | K143: C. Armbruster | L143: M. Davis | M143: Total ÷2 | N143: Total | O143: Pen | P143: Score
A144: DCI Open Class | C144: 20 | D144: 20 | E144: 40 | F144: 20 | G144: 20 | H144: 20 | I144: 30 | J144: 20 | K144: 20 | L144: 20 | M144: 30 | N144: 100 | P144: 100
A145: Guardians | B145: 4 | C145: 15.10 | D145: 14.90 | E145: 30.00 | F145: 14.50 | G145: 14.90 | H145: 14.00 | I145: 21.70 | J145: 14.80 | K145: 14.80 | L145: 14.90 | M145: 22.25 | N145: 73.95 | O145: 0.0 | P145: 73.95
C146: =RANK(C145,(C$6,C$8,C$10,C$12,C$14,C$16,C$18,C$20,C$22,C$24,C$26,C$28,C$30,C$32,C$34,C$36,C$38,C$40,C$42,C$44,C$46,C$48,C$50,C$52,C$54,C$56,C$58,C$60,C$62,C$64,C$66,C$68,C$70,C$72,C$74,C$76,C$78,C$80,C$82,C$84,C$86,C$88,C$90,C$92,C$94,C$96,C$98,C$100,C$102,C$104,C$106,C$108,C$110,C$112,C$114,C$116,C$118,C$120,C$122,C$124)) -> 1 | D146: =RANK(D145,(D$6,D$8,D$10,D$12,D$14,D$16,D$18,D$20,D$22,D$24,D$26,D$28,D$30,D$32,D$34,D$36,D$38,D$40,D$42,D$44,D$46,D$48,D$50,D$52,D$54,D$56,D$58,D$60,D$62,D$64,D$66,D$68,D$70,D$72,D$74,D$76,D$78,D$80,D$82,D$84,D$86,D$88,D$90,D$92,D$94,D$96,D$98,D$100,D$102,D$104,D$106,D$108,D$110,D$112,D$114,D$116,D$118,D$120,D$122,D$124)) -> 1 | E146: =RANK(E145,(E$6,E$8,E$10,E$12,E$14,E$16,E$18,E$20,E$22,E$24,E$26,E$28,E$30,E$32,E$34,E$36,E$38,E$40,E$42,E$44,E$46,E$48,E$50,E$52,E$54,E$56,E$58,E$60,E$62,E$64,E$66,E$68,E$70,E$72,E$74,E$76,E$78,E$80,E$82,E$84,E$86,E$88,E$90,E$92,E$94,E$96,E$98,E$100,E$102,E$104,E$106,E$108,E$110,E$112,E$114,E$116,E$118,E$120,E$122,E$124)) -> 1 | F146: =RANK(F145,(F$6,F$8,F$10,F$12,F$14,F$16,F$18,F$20,F$22,F$24,F$26,F$28,F$30,F$32,F$34,F$36,F$38,F$40,F$42,F$44,F$46,F$48,F$50,F$52,F$54,F$56,F$58,F$60,F$62,F$64,F$66,F$68,F$70,F$72,F$74,F$76,F$78,F$80,F$82,F$84,F$86,F$88,F$90,F$92,F$94,F$96,F$98,F$100,F$102,F$104,F$106,F$108,F$110,F$112,F$114,F$116,F$118,F$120,F$122,F$124)) -> 1 | G146: =RANK(G145,(G$6,G$8,G$10,G$12,G$14,G$16,G$18,G$20,G$22,G$24,G$26,G$28,G$30,G$32,G$34,G$36,G$38,G$40,G$42,G$44,G$46,G$48,G$50,G$52,G$54,G$56,G$58,G$60,G$62,G$64,G$66,G$68,G$70,G$72,G$74,G$76,G$78,G$80,G$82,G$84,G$86,G$88,G$90,G$92,G$94,G$96,G$98,G$100,G$102,G$104,G$106,G$108,G$110,G$112,G$114,G$116,G$118,G$120,G$122,G$124)) -> 1 | H146: =RANK(H145,(H$6,H$8,H$10,H$12,H$14,H$16,H$18,H$20,H$22,H$24,H$26,H$28,H$30,H$32,H$34,H$36,H$38,H$40,H$42,H$44,H$46,H$48,H$50,H$52,H$54,H$56,H$58,H$60,H$62,H$64,H$66,H$68,H$70,H$72,H$74,H$76,H$78,H$80,H$82,H$84,H$86,H$88,H$90,H$92,H$94,H$96,H$98,H$100,H$102,H$104,H$106,H$108,H$110,H$112,H$114,H$116,H$118,H$120,H$122,H$124)) -> 1 | I146: =RANK(I145,(I$6,I$8,I$10,I$12,I$14,I$16,I$18,I$20,I$22,I$24,I$26,I$28,I$30,I$32,I$34,I$36,I$38,I$40,I$42,I$44,I$46,I$48,I$50,I$52,I$54,I$56,I$58,I$60,I$62,I$64,I$66,I$68,I$70,I$72,I$74,I$76,I$78,I$80,I$82,I$84,I$86,I$88,I$90,I$92,I$94,I$96,I$98,I$100,I$102,I$104,I$106,I$108,I$110,I$112,I$114,I$116,I$118,I$120,I$122,I$124)) -> 1 | J146: =RANK(J145,(J$6,J$8,J$10,J$12,J$14,J$16,J$18,J$20,J$22,J$24,J$26,J$28,J$30,J$32,J$34,J$36,J$38,J$40,J$42,J$44,J$46,J$48,J$50,J$52,J$54,J$56,J$58,J$60,J$62,J$64,J$66,J$68,J$70,J$72,J$74,J$76,J$78,J$80,J$82,J$84,J$86,J$88,J$90,J$92,J$94,J$96,J$98,J$100,J$102,J$104,J$106,J$108,J$110,J$112,J$114,J$116,J$118,J$120,J$122,J$124)) -> 1 | K146: =RANK(K145,(K$6,K$8,K$10,K$12,K$14,K$16,K$18,K$20,K$22,K$24,K$26,K$28,K$30,K$32,K$34,K$36,K$38,K$40,K$42,K$44,K$46,K$48,K$50,K$52,K$54,K$56,K$58,K$60,K$62,K$64,K$66,K$68,K$70,K$72,K$74,K$76,K$78,K$80,K$82,K$84,K$86,K$88,K$90,K$92,K$94,K$96,K$98,K$100,K$102,K$104,K$106,K$108,K$110,K$112,K$114,K$116,K$118,K$120,K$122,K$124)) -> 1 | L146: =RANK(L145,(L$6,L$8,L$10,L$12,L$14,L$16,L$18,L$20,L$22,L$24,L$26,L$28,L$30,L$32,L$34,L$36,L$38,L$40,L$42,L$44,L$46,L$48,L$50,L$52,L$54,L$56,L$58,L$60,L$62,L$64,L$66,L$68,L$70,L$72,L$74,L$76,L$78,L$80,L$82,L$84,L$86,L$88,L$90,L$92,L$94,L$96,L$98,L$100,L$102,L$104,L$106,L$108,L$110,L$112,L$114,L$116,L$118,L$120,L$122,L$124)) -> 1 | M146: =RANK(M145,(M$6,M$8,M$10,M$12,M$14,M$16,M$18,M$20,M$22,M$24,M$26,M$28,M$30,M$32,M$34,M$36,M$38,M$40,M$42,M$44,M$46,M$48,M$50,M$52,M$54,M$56,M$58,M$60,M$62,M$64,M$66,M$68,M$70,M$72,M$74,M$76,M$78,M$80,M$82,M$84,M$86,M$88,M$90,M$92,M$94,M$96,M$98,M$100,M$102,M$104,M$106,M$108,M$110,M$112,M$114,M$116,M$118,M$120,M$122,M$124)) -> 1 | N146: =RANK(N145,(N$6,N$8,N$10,N$12,N$14,N$16,N$18,N$20,N$22,N$24,N$26,N$28,N$30,N$32,N$34,N$36,N$38,N$40,N$42,N$44,N$46,N$48,N$50,N$52,N$54,N$56,N$58,N$60,N$62,N$64,N$66,N$68,N$70,N$72,N$74,N$76,N$78,N$80,N$82,N$84,N$86,N$88,N$90,N$92,N$94,N$96,N$98,N$100,N$102,N$104,N$106,N$108,N$110,N$112,N$114,N$116,N$118,N$120,N$122,N$124)) -> 1 | P146: =RANK(P145,(P$6,P$8,P$10,P$12,P$14,P$16,P$18,P$20,P$22,P$24,P$26,P$28,P$30,P$32,P$34,P$36,P$38,P$40,P$42,P$44,P$46,P$48,P$50,P$52,P$54,P$56,P$58,P$60,P$62,P$64,P$66,P$68,P$70,P$72,P$74,P$76,P$78,P$80,P$82,P$84,P$86,P$88,P$90,P$92,P$94,P$96,P$98,P$100,P$102,P$104,P$106,P$108,P$110,P$112,P$114,P$116,P$118,P$120,P$122,P$124)) -> 1
A147: Battalion | B147: 1 | C147: 13.80 | D147: 14.40 | E147: 28.20 | F147: 13.50 | G147: 14.10 | H147: 13.90 | I147: 20.75 | J147: 14.20 | K147: 14.20 | L147: 13.80 | M147: 21.10 | N147: 70.05 | O147: 0.0 | P147: 70.05
C148: =RANK(C147,(C$6,C$8,C$10,C$12,C$14,C$16,C$18,C$20,C$22,C$24,C$26,C$28,C$30,C$32,C$34,C$36,C$38,C$40,C$42,C$44,C$46,C$48,C$50,C$52,C$54,C$56,C$58,C$60,C$62,C$64,C$66,C$68,C$70,C$72,C$74,C$76,C$78,C$80,C$82,C$84,C$86,C$88,C$90,C$92,C$94,C$96,C$98,C$100,C$102,C$104,C$106,C$108,C$110,C$112,C$114,C$116,C$118,C$120,C$122,C$124)) -> 3 | D148: =RANK(D147,(D$6,D$8,D$10,D$12,D$14,D$16,D$18,D$20,D$22,D$24,D$26,D$28,D$30,D$32,D$34,D$36,D$38,D$40,D$42,D$44,D$46,D$48,D$50,D$52,D$54,D$56,D$58,D$60,D$62,D$64,D$66,D$68,D$70,D$72,D$74,D$76,D$78,D$80,D$82,D$84,D$86,D$88,D$90,D$92,D$94,D$96,D$98,D$100,D$102,D$104,D$106,D$108,D$110,D$112,D$114,D$116,D$118,D$120,D$122,D$124)) -> 2 | E148: =RANK(E147,(E$6,E$8,E$10,E$12,E$14,E$16,E$18,E$20,E$22,E$24,E$26,E$28,E$30,E$32,E$34,E$36,E$38,E$40,E$42,E$44,E$46,E$48,E$50,E$52,E$54,E$56,E$58,E$60,E$62,E$64,E$66,E$68,E$70,E$72,E$74,E$76,E$78,E$80,E$82,E$84,E$86,E$88,E$90,E$92,E$94,E$96,E$98,E$100,E$102,E$104,E$106,E$108,E$110,E$112,E$114,E$116,E$118,E$120,E$122,E$124)) -> 2 | F148: =RANK(F147,(F$6,F$8,F$10,F$12,F$14,F$16,F$18,F$20,F$22,F$24,F$26,F$28,F$30,F$32,F$34,F$36,F$38,F$40,F$42,F$44,F$46,F$48,F$50,F$52,F$54,F$56,F$58,F$60,F$62,F$64,F$66,F$68,F$70,F$72,F$74,F$76,F$78,F$80,F$82,F$84,F$86,F$88,F$90,F$92,F$94,F$96,F$98,F$100,F$102,F$104,F$106,F$108,F$110,F$112,F$114,F$116,F$118,F$120,F$122,F$124)) -> 2 | G148: =RANK(G147,(G$6,G$8,G$10,G$12,G$14,G$16,G$18,G$20,G$22,G$24,G$26,G$28,G$30,G$32,G$34,G$36,G$38,G$40,G$42,G$44,G$46,G$48,G$50,G$52,G$54,G$56,G$58,G$60,G$62,G$64,G$66,G$68,G$70,G$72,G$74,G$76,G$78,G$80,G$82,G$84,G$86,G$88,G$90,G$92,G$94,G$96,G$98,G$100,G$102,G$104,G$106,G$108,G$110,G$112,G$114,G$116,G$118,G$120,G$122,G$124)) -> 3 | H148: =RANK(H147,(H$6,H$8,H$10,H$12,H$14,H$16,H$18,H$20,H$22,H$24,H$26,H$28,H$30,H$32,H$34,H$36,H$38,H$40,H$42,H$44,H$46,H$48,H$50,H$52,H$54,H$56,H$58,H$60,H$62,H$64,H$66,H$68,H$70,H$72,H$74,H$76,H$78,H$80,H$82,H$84,H$86,H$88,H$90,H$92,H$94,H$96,H$98,H$100,H$102,H$104,H$106,H$108,H$110,H$112,H$114,H$116,H$118,H$120,H$122,H$124)) -> 2 | I148: =RANK(I147,(I$6,I$8,I$10,I$12,I$14,I$16,I$18,I$20,I$22,I$24,I$26,I$28,I$30,I$32,I$34,I$36,I$38,I$40,I$42,I$44,I$46,I$48,I$50,I$52,I$54,I$56,I$58,I$60,I$62,I$64,I$66,I$68,I$70,I$72,I$74,I$76,I$78,I$80,I$82,I$84,I$86,I$88,I$90,I$92,I$94,I$96,I$98,I$100,I$102,I$104,I$106,I$108,I$110,I$112,I$114,I$116,I$118,I$120,I$122,I$124)) -> 2 | J148: =RANK(J147,(J$6,J$8,J$10,J$12,J$14,J$16,J$18,J$20,J$22,J$24,J$26,J$28,J$30,J$32,J$34,J$36,J$38,J$40,J$42,J$44,J$46,J$48,J$50,J$52,J$54,J$56,J$58,J$60,J$62,J$64,J$66,J$68,J$70,J$72,J$74,J$76,J$78,J$80,J$82,J$84,J$86,J$88,J$90,J$92,J$94,J$96,J$98,J$100,J$102,J$104,J$106,J$108,J$110,J$112,J$114,J$116,J$118,J$120,J$122,J$124)) -> 3 | K148: =RANK(K147,(K$6,K$8,K$10,K$12,K$14,K$16,K$18,K$20,K$22,K$24,K$26,K$28,K$30,K$32,K$34,K$36,K$38,K$40,K$42,K$44,K$46,K$48,K$50,K$52,K$54,K$56,K$58,K$60,K$62,K$64,K$66,K$68,K$70,K$72,K$74,K$76,K$78,K$80,K$82,K$84,K$86,K$88,K$90,K$92,K$94,K$96,K$98,K$100,K$102,K$104,K$106,K$108,K$110,K$112,K$114,K$116,K$118,K$120,K$122,K$124)) -> 3 | L148: =RANK(L147,(L$6,L$8,L$10,L$12,L$14,L$16,L$18,L$20,L$22,L$24,L$26,L$28,L$30,L$32,L$34,L$36,L$38,L$40,L$42,L$44,L$46,L$48,L$50,L$52,L$54,L$56,L$58,L$60,L$62,L$64,L$66,L$68,L$70,L$72,L$74,L$76,L$78,L$80,L$82,L$84,L$86,L$88,L$90,L$92,L$94,L$96,L$98,L$100,L$102,L$104,L$106,L$108,L$110,L$112,L$114,L$116,L$118,L$120,L$122,L$124)) -> 3 | M148: =RANK(M147,(M$6,M$8,M$10,M$12,M$14,M$16,M$18,M$20,M$22,M$24,M$26,M$28,M$30,M$32,M$34,M$36,M$38,M$40,M$42,M$44,M$46,M$48,M$50,M$52,M$54,M$56,M$58,M$60,M$62,M$64,M$66,M$68,M$70,M$72,M$74,M$76,M$78,M$80,M$82,M$84,M$86,M$88,M$90,M$92,M$94,M$96,M$98,M$100,M$102,M$104,M$106,M$108,M$110,M$112,M$114,M$116,M$118,M$120,M$122,M$124)) -> 3 | N148: =RANK(N147,(N$6,N$8,N$10,N$12,N$14,N$16,N$18,N$20,N$22,N$24,N$26,N$28,N$30,N$32,N$34,N$36,N$38,N$40,N$42,N$44,N$46,N$48,N$50,N$52,N$54,N$56,N$58,N$60,N$62,N$64,N$66,N$68,N$70,N$72,N$74,N$76,N$78,N$80,N$82,N$84,N$86,N$88,N$90,N$92,N$94,N$96,N$98,N$100,N$102,N$104,N$106,N$108,N$110,N$112,N$114,N$116,N$118,N$120,N$122,N$124)) -> 2 | P148: =RANK(P147,(P$6,P$8,P$10,P$12,P$14,P$16,P$18,P$20,P$22,P$24,P$26,P$28,P$30,P$32,P$34,P$36,P$38,P$40,P$42,P$44,P$46,P$48,P$50,P$52,P$54,P$56,P$58,P$60,P$62,P$64,P$66,P$68,P$70,P$72,P$74,P$76,P$78,P$80,P$82,P$84,P$86,P$88,P$90,P$92,P$94,P$96,P$98,P$100,P$102,P$104,P$106,P$108,P$110,P$112,P$114,P$116,P$118,P$120,P$122,P$124)) -> 2
A149: River City | B149: 5 | C149: 14.20 | D149: 13.90 | E149: 28.10 | F149: 13.10 | G149: 14.40 | H149: 13.80 | I149: 20.65 | J149: 14.30 | K149: 14.30 | L149: 13.90 | M149: 21.25 | N149: 70.00 | O149: 0.0 | P149: 70.00
A150: Rhythm | C150: =RANK(C149,(C$6,C$8,C$10,C$12,C$14,C$16,C$18,C$20,C$22,C$24,C$26,C$28,C$30,C$32,C$34,C$36,C$38,C$40,C$42,C$44,C$46,C$48,C$50,C$52,C$54,C$56,C$58,C$60,C$62,C$64,C$66,C$68,C$70,C$72,C$74,C$76,C$78,C$80,C$82,C$84,C$86,C$88,C$90,C$92,C$94,C$96,C$98,C$100,C$102,C$104,C$106,C$108,C$110,C$112,C$114,C$116,C$118,C$120,C$122,C$124)) -> 2 | D150: =RANK(D149,(D$6,D$8,D$10,D$12,D$14,D$16,D$18,D$20,D$22,D$24,D$26,D$28,D$30,D$32,D$34,D$36,D$38,D$40,D$42,D$44,D$46,D$48,D$50,D$52,D$54,D$56,D$58,D$60,D$62,D$64,D$66,D$68,D$70,D$72,D$74,D$76,D$78,D$80,D$82,D$84,D$86,D$88,D$90,D$92,D$94,D$96,D$98,D$100,D$102,D$104,D$106,D$108,D$110,D$112,D$114,D$116,D$118,D$120,D$122,D$124)) -> 3 | E150: =RANK(E149,(E$6,E$8,E$10,E$12,E$14,E$16,E$18,E$20,E$22,E$24,E$26,E$28,E$30,E$32,E$34,E$36,E$38,E$40,E$42,E$44,E$46,E$48,E$50,E$52,E$54,E$56,E$58,E$60,E$62,E$64,E$66,E$68,E$70,E$72,E$74,E$76,E$78,E$80,E$82,E$84,E$86,E$88,E$90,E$92,E$94,E$96,E$98,E$100,E$102,E$104,E$106,E$108,E$110,E$112,E$114,E$116,E$118,E$120,E$122,E$124)) -> 3 | F150: =RANK(F149,(F$6,F$8,F$10,F$12,F$14,F$16,F$18,F$20,F$22,F$24,F$26,F$28,F$30,F$32,F$34,F$36,F$38,F$40,F$42,F$44,F$46,F$48,F$50,F$52,F$54,F$56,F$58,F$60,F$62,F$64,F$66,F$68,F$70,F$72,F$74,F$76,F$78,F$80,F$82,F$84,F$86,F$88,F$90,F$92,F$94,F$96,F$98,F$100,F$102,F$104,F$106,F$108,F$110,F$112,F$114,F$116,F$118,F$120,F$122,F$124)) -> 3 | G150: =RANK(G149,(G$6,G$8,G$10,G$12,G$14,G$16,G$18,G$20,G$22,G$24,G$26,G$28,G$30,G$32,G$34,G$36,G$38,G$40,G$42,G$44,G$46,G$48,G$50,G$52,G$54,G$56,G$58,G$60,G$62,G$64,G$66,G$68,G$70,G$72,G$74,G$76,G$78,G$80,G$82,G$84,G$86,G$88,G$90,G$92,G$94,G$96,G$98,G$100,G$102,G$104,G$106,G$108,G$110,G$112,G$114,G$116,G$118,G$120,G$122,G$124)) -> 2 | H150: =RANK(H149,(H$6,H$8,H$10,H$12,H$14,H$16,H$18,H$20,H$22,H$24,H$26,H$28,H$30,H$32,H$34,H$36,H$38,H$40,H$42,H$44,H$46,H$48,H$50,H$52,H$54,H$56,H$58,H$60,H$62,H$64,H$66,H$68,H$70,H$72,H$74,H$76,H$78,H$80,H$82,H$84,H$86,H$88,H$90,H$92,H$94,H$96,H$98,H$100,H$102,H$104,H$106,H$108,H$110,H$112,H$114,H$116,H$118,H$120,H$122,H$124)) -> 3 | I150: =RANK(I149,(I$6,I$8,I$10,I$12,I$14,I$16,I$18,I$20,I$22,I$24,I$26,I$28,I$30,I$32,I$34,I$36,I$38,I$40,I$42,I$44,I$46,I$48,I$50,I$52,I$54,I$56,I$58,I$60,I$62,I$64,I$66,I$68,I$70,I$72,I$74,I$76,I$78,I$80,I$82,I$84,I$86,I$88,I$90,I$92,I$94,I$96,I$98,I$100,I$102,I$104,I$106,I$108,I$110,I$112,I$114,I$116,I$118,I$120,I$122,I$124)) -> 3 | J150: =RANK(J149,(J$6,J$8,J$10,J$12,J$14,J$16,J$18,J$20,J$22,J$24,J$26,J$28,J$30,J$32,J$34,J$36,J$38,J$40,J$42,J$44,J$46,J$48,J$50,J$52,J$54,J$56,J$58,J$60,J$62,J$64,J$66,J$68,J$70,J$72,J$74,J$76,J$78,J$80,J$82,J$84,J$86,J$88,J$90,J$92,J$94,J$96,J$98,J$100,J$102,J$104,J$106,J$108,J$110,J$112,J$114,J$116,J$118,J$120,J$122,J$124)) -> 2 | K150: =RANK(K149,(K$6,K$8,K$10,K$12,K$14,K$16,K$18,K$20,K$22,K$24,K$26,K$28,K$30,K$32,K$34,K$36,K$38,K$40,K$42,K$44,K$46,K$48,K$50,K$52,K$54,K$56,K$58,K$60,K$62,K$64,K$66,K$68,K$70,K$72,K$74,K$76,K$78,K$80,K$82,K$84,K$86,K$88,K$90,K$92,K$94,K$96,K$98,K$100,K$102,K$104,K$106,K$108,K$110,K$112,K$114,K$116,K$118,K$120,K$122,K$124)) -> 2 | L150: =RANK(L149,(L$6,L$8,L$10,L$12,L$14,L$16,L$18,L$20,L$22,L$24,L$26,L$28,L$30,L$32,L$34,L$36,L$38,L$40,L$42,L$44,L$46,L$48,L$50,L$52,L$54,L$56,L$58,L$60,L$62,L$64,L$66,L$68,L$70,L$72,L$74,L$76,L$78,L$80,L$82,L$84,L$86,L$88,L$90,L$92,L$94,L$96,L$98,L$100,L$102,L$104,L$106,L$108,L$110,L$112,L$114,L$116,L$118,L$120,L$122,L$124)) -> 2 | M150: =RANK(M149,(M$6,M$8,M$10,M$12,M$14,M$16,M$18,M$20,M$22,M$24,M$26,M$28,M$30,M$32,M$34,M$36,M$38,M$40,M$42,M$44,M$46,M$48,M$50,M$52,M$54,M$56,M$58,M$60,M$62,M$64,M$66,M$68,M$70,M$72,M$74,M$76,M$78,M$80,M$82,M$84,M$86,M$88,M$90,M$92,M$94,M$96,M$98,M$100,M$102,M$104,M$106,M$108,M$110,M$112,M$114,M$116,M$118,M$120,M$122,M$124)) -> 2 | N150: =RANK(N149,(N$6,N$8,N$10,N$12,N$14,N$16,N$18,N$20,N$22,N$24,N$26,N$28,N$30,N$32,N$34,N$36,N$38,N$40,N$42,N$44,N$46,N$48,N$50,N$52,N$54,N$56,N$58,N$60,N$62,N$64,N$66,N$68,N$70,N$72,N$74,N$76,N$78,N$80,N$82,N$84,N$86,N$88,N$90,N$92,N$94,N$96,N$98,N$100,N$102,N$104,N$106,N$108,N$110,N$112,N$114,N$116,N$118,N$120,N$122,N$124)) -> 3 | P150: =RANK(P149,(P$6,P$8,P$10,P$12,P$14,P$16,P$18,P$20,P$22,P$24,P$26,P$28,P$30,P$32,P$34,P$36,P$38,P$40,P$42,P$44,P$46,P$48,P$50,P$52,P$54,P$56,P$58,P$60,P$62,P$64,P$66,P$68,P$70,P$72,P$74,P$76,P$78,P$80,P$82,P$84,P$86,P$88,P$90,P$92,P$94,P$96,P$98,P$100,P$102,P$104,P$106,P$108,P$110,P$112,P$114,P$116,P$118,P$120,P$122,P$124)) -> 3
A151: Les | B151: 2 | C151: 13.60 | D151: 13.00 | E151: 26.60 | F151: 11.60 | G151: 13.00 | H151: 13.20 | I151: 18.90 | J151: 12.50 | K151: 12.50 | L151: 12.60 | M151: 18.80 | N151: 64.30 | O151: 0.0 | P151: 64.30
A152: Stentors | C152: =RANK(C151,(C$6,C$8,C$10,C$12,C$14,C$16,C$18,C$20,C$22,C$24,C$26,C$28,C$30,C$32,C$34,C$36,C$38,C$40,C$42,C$44,C$46,C$48,C$50,C$52,C$54,C$56,C$58,C$60,C$62,C$64,C$66,C$68,C$70,C$72,C$74,C$76,C$78,C$80,C$82,C$84,C$86,C$88,C$90,C$92,C$94,C$96,C$98,C$100,C$102,C$104,C$106,C$108,C$110,C$112,C$114,C$116,C$118,C$120,C$122,C$124)) -> 4 | D152: =RANK(D151,(D$6,D$8,D$10,D$12,D$14,D$16,D$18,D$20,D$22,D$24,D$26,D$28,D$30,D$32,D$34,D$36,D$38,D$40,D$42,D$44,D$46,D$48,D$50,D$52,D$54,D$56,D$58,D$60,D$62,D$64,D$66,D$68,D$70,D$72,D$74,D$76,D$78,D$80,D$82,D$84,D$86,D$88,D$90,D$92,D$94,D$96,D$98,D$100,D$102,D$104,D$106,D$108,D$110,D$112,D$114,D$116,D$118,D$120,D$122,D$124)) -> 4 | E152: =RANK(E151,(E$6,E$8,E$10,E$12,E$14,E$16,E$18,E$20,E$22,E$24,E$26,E$28,E$30,E$32,E$34,E$36,E$38,E$40,E$42,E$44,E$46,E$48,E$50,E$52,E$54,E$56,E$58,E$60,E$62,E$64,E$66,E$68,E$70,E$72,E$74,E$76,E$78,E$80,E$82,E$84,E$86,E$88,E$90,E$92,E$94,E$96,E$98,E$100,E$102,E$104,E$106,E$108,E$110,E$112,E$114,E$116,E$118,E$120,E$122,E$124)) -> 4 | F152: =RANK(F151,(F$6,F$8,F$10,F$12,F$14,F$16,F$18,F$20,F$22,F$24,F$26,F$28,F$30,F$32,F$34,F$36,F$38,F$40,F$42,F$44,F$46,F$48,F$50,F$52,F$54,F$56,F$58,F$60,F$62,F$64,F$66,F$68,F$70,F$72,F$74,F$76,F$78,F$80,F$82,F$84,F$86,F$88,F$90,F$92,F$94,F$96,F$98,F$100,F$102,F$104,F$106,F$108,F$110,F$112,F$114,F$116,F$118,F$120,F$122,F$124)) -> 5 | G152: =RANK(G151,(G$6,G$8,G$10,G$12,G$14,G$16,G$18,G$20,G$22,G$24,G$26,G$28,G$30,G$32,G$34,G$36,G$38,G$40,G$42,G$44,G$46,G$48,G$50,G$52,G$54,G$56,G$58,G$60,G$62,G$64,G$66,G$68,G$70,G$72,G$74,G$76,G$78,G$80,G$82,G$84,G$86,G$88,G$90,G$92,G$94,G$96,G$98,G$100,G$102,G$104,G$106,G$108,G$110,G$112,G$114,G$116,G$118,G$120,G$122,G$124)) -> 4 | H152: =RANK(H151,(H$6,H$8,H$10,H$12,H$14,H$16,H$18,H$20,H$22,H$24,H$26,H$28,H$30,H$32,H$34,H$36,H$38,H$40,H$42,H$44,H$46,H$48,H$50,H$52,H$54,H$56,H$58,H$60,H$62,H$64,H$66,H$68,H$70,H$72,H$74,H$76,H$78,H$80,H$82,H$84,H$86,H$88,H$90,H$92,H$94,H$96,H$98,H$100,H$102,H$104,H$106,H$108,H$110,H$112,H$114,H$116,H$118,H$120,H$122,H$124)) -> 4 | I152: =RANK(I151,(I$6,I$8,I$10,I$12,I$14,I$16,I$18,I$20,I$22,I$24,I$26,I$28,I$30,I$32,I$34,I$36,I$38,I$40,I$42,I$44,I$46,I$48,I$50,I$52,I$54,I$56,I$58,I$60,I$62,I$64,I$66,I$68,I$70,I$72,I$74,I$76,I$78,I$80,I$82,I$84,I$86,I$88,I$90,I$92,I$94,I$96,I$98,I$100,I$102,I$104,I$106,I$108,I$110,I$112,I$114,I$116,I$118,I$120,I$122,I$124)) -> 4 | J152: =RANK(J151,(J$6,J$8,J$10,J$12,J$14,J$16,J$18,J$20,J$22,J$24,J$26,J$28,J$30,J$32,J$34,J$36,J$38,J$40,J$42,J$44,J$46,J$48,J$50,J$52,J$54,J$56,J$58,J$60,J$62,J$64,J$66,J$68,J$70,J$72,J$74,J$76,J$78,J$80,J$82,J$84,J$86,J$88,J$90,J$92,J$94,J$96,J$98,J$100,J$102,J$104,J$106,J$108,J$110,J$112,J$114,J$116,J$118,J$120,J$122,J$124)) -> 5 | K152: =RANK(K151,(K$6,K$8,K$10,K$12,K$14,K$16,K$18,K$20,K$22,K$24,K$26,K$28,K$30,K$32,K$34,K$36,K$38,K$40,K$42,K$44,K$46,K$48,K$50,K$52,K$54,K$56,K$58,K$60,K$62,K$64,K$66,K$68,K$70,K$72,K$74,K$76,K$78,K$80,K$82,K$84,K$86,K$88,K$90,K$92,K$94,K$96,K$98,K$100,K$102,K$104,K$106,K$108,K$110,K$112,K$114,K$116,K$118,K$120,K$122,K$124)) -> 5 | L152: =RANK(L151,(L$6,L$8,L$10,L$12,L$14,L$16,L$18,L$20,L$22,L$24,L$26,L$28,L$30,L$32,L$34,L$36,L$38,L$40,L$42,L$44,L$46,L$48,L$50,L$52,L$54,L$56,L$58,L$60,L$62,L$64,L$66,L$68,L$70,L$72,L$74,L$76,L$78,L$80,L$82,L$84,L$86,L$88,L$90,L$92,L$94,L$96,L$98,L$100,L$102,L$104,L$106,L$108,L$110,L$112,L$114,L$116,L$118,L$120,L$122,L$124)) -> 5 | M152: =RANK(M151,(M$6,M$8,M$10,M$12,M$14,M$16,M$18,M$20,M$22,M$24,M$26,M$28,M$30,M$32,M$34,M$36,M$38,M$40,M$42,M$44,M$46,M$48,M$50,M$52,M$54,M$56,M$58,M$60,M$62,M$64,M$66,M$68,M$70,M$72,M$74,M$76,M$78,M$80,M$82,M$84,M$86,M$88,M$90,M$92,M$94,M$96,M$98,M$100,M$102,M$104,M$106,M$108,M$110,M$112,M$114,M$116,M$118,M$120,M$122,M$124)) -> 5 | N152: =RANK(N151,(N$6,N$8,N$10,N$12,N$14,N$16,N$18,N$20,N$22,N$24,N$26,N$28,N$30,N$32,N$34,N$36,N$38,N$40,N$42,N$44,N$46,N$48,N$50,N$52,N$54,N$56,N$58,N$60,N$62,N$64,N$66,N$68,N$70,N$72,N$74,N$76,N$78,N$80,N$82,N$84,N$86,N$88,N$90,N$92,N$94,N$96,N$98,N$100,N$102,N$104,N$106,N$108,N$110,N$112,N$114,N$116,N$118,N$120,N$122,N$124)) -> 4 | P152: =RANK(P151,(P$6,P$8,P$10,P$12,P$14,P$16,P$18,P$20,P$22,P$24,P$26,P$28,P$30,P$32,P$34,P$36,P$38,P$40,P$42,P$44,P$46,P$48,P$50,P$52,P$54,P$56,P$58,P$60,P$62,P$64,P$66,P$68,P$70,P$72,P$74,P$76,P$78,P$80,P$82,P$84,P$86,P$88,P$90,P$92,P$94,P$96,P$98,P$100,P$102,P$104,P$106,P$108,P$110,P$112,P$114,P$116,P$118,P$120,P$122,P$124)) -> 4
A153: Colt | B153: 3 | C153: 13.40 | D153: 12.60 | E153: 26.00 | F153: 12.60 | G153: 12.60 | H153: 12.00 | I153: 18.60 | J153: 12.80 | K153: 12.80 | L153: 13.20 | M153: 19.40 | N153: 64.00 | O153: 0.0 | P153: 64.00
A154: Cadets | C154: =RANK(C153,(C$6,C$8,C$10,C$12,C$14,C$16,C$18,C$20,C$22,C$24,C$26,C$28,C$30,C$32,C$34,C$36,C$38,C$40,C$42,C$44,C$46,C$48,C$50,C$52,C$54,C$56,C$58,C$60,C$62,C$64,C$66,C$68,C$70,C$72,C$74,C$76,C$78,C$80,C$82,C$84,C$86,C$88,C$90,C$92,C$94,C$96,C$98,C$100,C$102,C$104,C$106,C$108,C$110,C$112,C$114,C$116,C$118,C$120,C$122,C$124)) -> 5 | D154: =RANK(D153,(D$6,D$8,D$10,D$12,D$14,D$16,D$18,D$20,D$22,D$24,D$26,D$28,D$30,D$32,D$34,D$36,D$38,D$40,D$42,D$44,D$46,D$48,D$50,D$52,D$54,D$56,D$58,D$60,D$62,D$64,D$66,D$68,D$70,D$72,D$74,D$76,D$78,D$80,D$82,D$84,D$86,D$88,D$90,D$92,D$94,D$96,D$98,D$100,D$102,D$104,D$106,D$108,D$110,D$112,D$114,D$116,D$118,D$120,D$122,D$124)) -> 5 | E154: =RANK(E153,(E$6,E$8,E$10,E$12,E$14,E$16,E$18,E$20,E$22,E$24,E$26,E$28,E$30,E$32,E$34,E$36,E$38,E$40,E$42,E$44,E$46,E$48,E$50,E$52,E$54,E$56,E$58,E$60,E$62,E$64,E$66,E$68,E$70,E$72,E$74,E$76,E$78,E$80,E$82,E$84,E$86,E$88,E$90,E$92,E$94,E$96,E$98,E$100,E$102,E$104,E$106,E$108,E$110,E$112,E$114,E$116,E$118,E$120,E$122,E$124)) -> 5 | F154: =RANK(F153,(F$6,F$8,F$10,F$12,F$14,F$16,F$18,F$20,F$22,F$24,F$26,F$28,F$30,F$32,F$34,F$36,F$38,F$40,F$42,F$44,F$46,F$48,F$50,F$52,F$54,F$56,F$58,F$60,F$62,F$64,F$66,F$68,F$70,F$72,F$74,F$76,F$78,F$80,F$82,F$84,F$86,F$88,F$90,F$92,F$94,F$96,F$98,F$100,F$102,F$104,F$106,F$108,F$110,F$112,F$114,F$116,F$118,F$120,F$122,F$124)) -> 4 | G154: =RANK(G153,(G$6,G$8,G$10,G$12,G$14,G$16,G$18,G$20,G$22,G$24,G$26,G$28,G$30,G$32,G$34,G$36,G$38,G$40,G$42,G$44,G$46,G$48,G$50,G$52,G$54,G$56,G$58,G$60,G$62,G$64,G$66,G$68,G$70,G$72,G$74,G$76,G$78,G$80,G$82,G$84,G$86,G$88,G$90,G$92,G$94,G$96,G$98,G$100,G$102,G$104,G$106,G$108,G$110,G$112,G$114,G$116,G$118,G$120,G$122,G$124)) -> 5 | H154: =RANK(H153,(H$6,H$8,H$10,H$12,H$14,H$16,H$18,H$20,H$22,H$24,H$26,H$28,H$30,H$32,H$34,H$36,H$38,H$40,H$42,H$44,H$46,H$48,H$50,H$52,H$54,H$56,H$58,H$60,H$62,H$64,H$66,H$68,H$70,H$72,H$74,H$76,H$78,H$80,H$82,H$84,H$86,H$88,H$90,H$92,H$94,H$96,H$98,H$100,H$102,H$104,H$106,H$108,H$110,H$112,H$114,H$116,H$118,H$120,H$122,H$124)) -> 5 | I154: =RANK(I153,(I$6,I$8,I$10,I$12,I$14,I$16,I$18,I$20,I$22,I$24,I$26,I$28,I$30,I$32,I$34,I$36,I$38,I$40,I$42,I$44,I$46,I$48,I$50,I$52,I$54,I$56,I$58,I$60,I$62,I$64,I$66,I$68,I$70,I$72,I$74,I$76,I$78,I$80,I$82,I$84,I$86,I$88,I$90,I$92,I$94,I$96,I$98,I$100,I$102,I$104,I$106,I$108,I$110,I$112,I$114,I$116,I$118,I$120,I$122,I$124)) -> 5 | J154: =RANK(J153,(J$6,J$8,J$10,J$12,J$14,J$16,J$18,J$20,J$22,J$24,J$26,J$28,J$30,J$32,J$34,J$36,J$38,J$40,J$42,J$44,J$46,J$48,J$50,J$52,J$54,J$56,J$58,J$60,J$62,J$64,J$66,J$68,J$70,J$72,J$74,J$76,J$78,J$80,J$82,J$84,J$86,J$88,J$90,J$92,J$94,J$96,J$98,J$100,J$102,J$104,J$106,J$108,J$110,J$112,J$114,J$116,J$118,J$120,J$122,J$124)) -> 4 | K154: =RANK(K153,(K$6,K$8,K$10,K$12,K$14,K$16,K$18,K$20,K$22,K$24,K$26,K$28,K$30,K$32,K$34,K$36,K$38,K$40,K$42,K$44,K$46,K$48,K$50,K$52,K$54,K$56,K$58,K$60,K$62,K$64,K$66,K$68,K$70,K$72,K$74,K$76,K$78,K$80,K$82,K$84,K$86,K$88,K$90,K$92,K$94,K$96,K$98,K$100,K$102,K$104,K$106,K$108,K$110,K$112,K$114,K$116,K$118,K$120,K$122,K$124)) -> 4 | L154: =RANK(L153,(L$6,L$8,L$10,L$12,L$14,L$16,L$18,L$20,L$22,L$24,L$26,L$28,L$30,L$32,L$34,L$36,L$38,L$40,L$42,L$44,L$46,L$48,L$50,L$52,L$54,L$56,L$58,L$60,L$62,L$64,L$66,L$68,L$70,L$72,L$74,L$76,L$78,L$80,L$82,L$84,L$86,L$88,L$90,L$92,L$94,L$96,L$98,L$100,L$102,L$104,L$106,L$108,L$110,L$112,L$114,L$116,L$118,L$120,L$122,L$124)) -> 4 | M154: =RANK(M153,(M$6,M$8,M$10,M$12,M$14,M$16,M$18,M$20,M$22,M$24,M$26,M$28,M$30,M$32,M$34,M$36,M$38,M$40,M$42,M$44,M$46,M$48,M$50,M$52,M$54,M$56,M$58,M$60,M$62,M$64,M$66,M$68,M$70,M$72,M$74,M$76,M$78,M$80,M$82,M$84,M$86,M$88,M$90,M$92,M$94,M$96,M$98,M$100,M$102,M$104,M$106,M$108,M$110,M$112,M$114,M$116,M$118,M$120,M$122,M$124)) -> 4 | N154: =RANK(N153,(N$6,N$8,N$10,N$12,N$14,N$16,N$18,N$20,N$22,N$24,N$26,N$28,N$30,N$32,N$34,N$36,N$38,N$40,N$42,N$44,N$46,N$48,N$50,N$52,N$54,N$56,N$58,N$60,N$62,N$64,N$66,N$68,N$70,N$72,N$74,N$76,N$78,N$80,N$82,N$84,N$86,N$88,N$90,N$92,N$94,N$96,N$98,N$100,N$102,N$104,N$106,N$108,N$110,N$112,N$114,N$116,N$118,N$120,N$122,N$124)) -> 5 | P154: =RANK(P153,(P$6,P$8,P$10,P$12,P$14,P$16,P$18,P$20,P$22,P$24,P$26,P$28,P$30,P$32,P$34,P$36,P$38,P$40,P$42,P$44,P$46,P$48,P$50,P$52,P$54,P$56,P$58,P$60,P$62,P$64,P$66,P$68,P$70,P$72,P$74,P$76,P$78,P$80,P$82,P$84,P$86,P$88,P$90,P$92,P$94,P$96,P$98,P$100,P$102,P$104,P$106,P$108,P$110,P$112,P$114,P$116,P$118,P$120,P$122,P$124)) -> 5
A157: 8/3/2022 Apple Valley, Minnesota
C158: Visual | F158: Music | J158: Effect | M158: Communication
C159: Ensemble | D159: Color Guard | F159: Brass | G159: Ensemble | H159: Percussion | J159: Visual | K159: Music | M159: Visual | N159: Music | P159: Sub | R159: Total
C160: J. Tate | D160: C. Clayton | E160: Average | F160: No Judge | G160: C. Armbruster | H160: M. Davis | I160: Total ÷2 | J160: A. Combites | K160: S. Halquist | L160: Total | M160: A. Combites | N160: S. Halquist | O160: Average | P160: Total | Q160: Pen | R160: Score
A161: DCA Class A | C161: 20 | D161: 20 | E161: 20 | F161: 20 | G161: 20 | H161: 20 | I161: 30 | J161: 20 | K161: 20 | L161: 40 | M161: 10 | N161: 10 | O161: 10 | P161: 100 | R161: 100
A162: Govenaires | C162: 14.60 | D162: 13.20 | E162: 13.90 | F162: 0.00 | G162: 15.00 | H162: 13.80 | I162: 14.40 | J162: 14.50 | K162: 13.00 | L162: 27.50 | M162: 7.30 | N162: 7.00 | O162: 7.15 | P162: 62.95 | Q162: 0.0 | R162: 62.95
C163: 1 | D163: 1 | E163: 1 | F163: 1 | G163: 1 | H163: 1 | I163: 1 | J163: 1 | K163: 1 | L163: 1 | M163: 1 | N163: 1 | O163: 1 | P163: 1 | R163: 1
A166: 8/3/2022 Centerville, Ohio
C167: General Effect | F167: Visual | J167: Music
C168: 1 | D168: 2 | F168: Proficiency | G168: Analysis | H168: Color Guard | J168: Brass | K168: Analysis | L168: Percussion | N168: Sub | P168: Total
C169: D. Deems | D169: K. Young | E169: Total | F169: B. Jones | G169: J. Orefice | H169: C. Church | I169: Total ÷2 | J169: B. Crisp | K169: W. Dillon | L169: T. Fox | M169: Total ÷2 | N169: Total | O169: Pen | P169: Score
A170: DCI World Class | C170: 20 | D170: 20 | E170: 40 | F170: 20 | G170: 20 | H170: 20 | I170: 30 | J170: 20 | K170: 20 | L170: 20 | M170: 30 | N170: 100 | P170: 100
A171: Blue | B171: 5 | C171: 18.30 | D171: 18.20 | E171: 36.50 | F171: 18.10 | G171: 18.30 | H171: 18.20 | I171: 27.30 | J171: 18.20 | K171: 18.30 | L171: 17.30 | M171: 26.90 | N171: 90.70 | O171: 0.0 | P171: 90.70
A172: Stars | C172: =RANK(C171,(C$6,C$8,C$10,C$12,C$14,C$17,C$19,C$21,C$23,C$25,C$27,C$29,C$31,C$33,C$35,C$37,C$39,C$41,C$43,C$45,C$47,C$49,C$51,C$53,C$55,C$57,C$59,C$61,C$63,C$65,C$67,C$69,C$71,C$73,C$75,C$77,C$79,C$81,C$83,C$85,C$87,C$89,C$91,C$93,C$95,C$97,C$99,C$101,C$103,C$105,C$107,C$109,C$111,C$113,C$115,C$117,C$119,C$121,C$123,C$125)) -> 1 | D172: =RANK(D171,(D$6,D$8,D$10,D$12,D$14,D$17,D$19,D$21,D$23,D$25,D$27,D$29,D$31,D$33,D$35,D$37,D$39,D$41,D$43,D$45,D$47,D$49,D$51,D$53,D$55,D$57,D$59,D$61,D$63,D$65,D$67,D$69,D$71,D$73,D$75,D$77,D$79,D$81,D$83,D$85,D$87,D$89,D$91,D$93,D$95,D$97,D$99,D$101,D$103,D$105,D$107,D$109,D$111,D$113,D$115,D$117,D$119,D$121,D$123,D$125)) -> 1 | E172: =RANK(E171,(E$6,E$8,E$10,E$12,E$14,E$17,E$19,E$21,E$23,E$25,E$27,E$29,E$31,E$33,E$35,E$37,E$39,E$41,E$43,E$45,E$47,E$49,E$51,E$53,E$55,E$57,E$59,E$61,E$63,E$65,E$67,E$69,E$71,E$73,E$75,E$77,E$79,E$81,E$83,E$85,E$87,E$89,E$91,E$93,E$95,E$97,E$99,E$101,E$103,E$105,E$107,E$109,E$111,E$113,E$115,E$117,E$119,E$121,E$123,E$125)) -> 1 | F172: =RANK(F171,(F$6,F$8,F$10,F$12,F$14,F$17,F$19,F$21,F$23,F$25,F$27,F$29,F$31,F$33,F$35,F$37,F$39,F$41,F$43,F$45,F$47,F$49,F$51,F$53,F$55,F$57,F$59,F$61,F$63,F$65,F$67,F$69,F$71,F$73,F$75,F$77,F$79,F$81,F$83,F$85,F$87,F$89,F$91,F$93,F$95,F$97,F$99,F$101,F$103,F$105,F$107,F$109,F$111,F$113,F$115,F$117,F$119,F$121,F$123,F$125)) -> 1 | G172: =RANK(G171,(G$6,G$8,G$10,G$12,G$14,G$17,G$19,G$21,G$23,G$25,G$27,G$29,G$31,G$33,G$35,G$37,G$39,G$41,G$43,G$45,G$47,G$49,G$51,G$53,G$55,G$57,G$59,G$61,G$63,G$65,G$67,G$69,G$71,G$73,G$75,G$77,G$79,G$81,G$83,G$85,G$87,G$89,G$91,G$93,G$95,G$97,G$99,G$101,G$103,G$105,G$107,G$109,G$111,G$113,G$115,G$117,G$119,G$121,G$123,G$125)) -> 1 | H172: =RANK(H171,(H$6,H$8,H$10,H$12,H$14,H$17,H$19,H$21,H$23,H$25,H$27,H$29,H$31,H$33,H$35,H$37,H$39,H$41,H$43,H$45,H$47,H$49,H$51,H$53,H$55,H$57,H$59,H$61,H$63,H$65,H$67,H$69,H$71,H$73,H$75,H$77,H$79,H$81,H$83,H$85,H$87,H$89,H$91,H$93,H$95,H$97,H$99,H$101,H$103,H$105,H$107,H$109,H$111,H$113,H$115,H$117,H$119,H$121,H$123,H$125)) -> 1 | I172: =RANK(I171,(I$6,I$8,I$10,I$12,I$14,I$17,I$19,I$21,I$23,I$25,I$27,I$29,I$31,I$33,I$35,I$37,I$39,I$41,I$43,I$45,I$47,I$49,I$51,I$53,I$55,I$57,I$59,I$61,I$63,I$65,I$67,I$69,I$71,I$73,I$75,I$77,I$79,I$81,I$83,I$85,I$87,I$89,I$91,I$93,I$95,I$97,I$99,I$101,I$103,I$105,I$107,I$109,I$111,I$113,I$115,I$117,I$119,I$121,I$123,I$125)) -> 1 | J172: =RANK(J171,(J$6,J$8,J$10,J$12,J$14,J$17,J$19,J$21,J$23,J$25,J$27,J$29,J$31,J$33,J$35,J$37,J$39,J$41,J$43,J$45,J$47,J$49,J$51,J$53,J$55,J$57,J$59,J$61,J$63,J$65,J$67,J$69,J$71,J$73,J$75,J$77,J$79,J$81,J$83,J$85,J$87,J$89,J$91,J$93,J$95,J$97,J$99,J$101,J$103,J$105,J$107,J$109,J$111,J$113,J$115,J$117,J$119,J$121,J$123,J$125)) -> 1 | K172: =RANK(K171,(K$6,K$8,K$10,K$12,K$14,K$17,K$19,K$21,K$23,K$25,K$27,K$29,K$31,K$33,K$35,K$37,K$39,K$41,K$43,K$45,K$47,K$49,K$51,K$53,K$55,K$57,K$59,K$61,K$63,K$65,K$67,K$69,K$71,K$73,K$75,K$77,K$79,K$81,K$83,K$85,K$87,K$89,K$91,K$93,K$95,K$97,K$99,K$101,K$103,K$105,K$107,K$109,K$111,K$113,K$115,K$117,K$119,K$121,K$123,K$125)) -> 1 | L172: =RANK(L171,(L$6,L$8,L$10,L$12,L$14,L$17,L$19,L$21,L$23,L$25,L$27,L$29,L$31,L$33,L$35,L$37,L$39,L$41,L$43,L$45,L$47,L$49,L$51,L$53,L$55,L$57,L$59,L$61,L$63,L$65,L$67,L$69,L$71,L$73,L$75,L$77,L$79,L$81,L$83,L$85,L$87,L$89,L$91,L$93,L$95,L$97,L$99,L$101,L$103,L$105,L$107,L$109,L$111,L$113,L$115,L$117,L$119,L$121,L$123,L$125)) -> 3 | M172: =RANK(M171,(M$6,M$8,M$10,M$12,M$14,M$17,M$19,M$21,M$23,M$25,M$27,M$29,M$31,M$33,M$35,M$37,M$39,M$41,M$43,M$45,M$47,M$49,M$51,M$53,M$55,M$57,M$59,M$61,M$63,M$65,M$67,M$69,M$71,M$73,M$75,M$77,M$79,M$81,M$83,M$85,M$87,M$89,M$91,M$93,M$95,M$97,M$99,M$101,M$103,M$105,M$107,M$109,M$111,M$113,M$115,M$117,M$119,M$121,M$123,M$125)) -> 2 | N172: =RANK(N171,(N$6,N$8,N$10,N$12,N$14,N$17,N$19,N$21,N$23,N$25,N$27,N$29,N$31,N$33,N$35,N$37,N$39,N$41,N$43,N$45,N$47,N$49,N$51,N$53,N$55,N$57,N$59,N$61,N$63,N$65,N$67,N$69,N$71,N$73,N$75,N$77,N$79,N$81,N$83,N$85,N$87,N$89,N$91,N$93,N$95,N$97,N$99,N$101,N$103,N$105,N$107,N$109,N$111,N$113,N$115,N$117,N$119,N$121,N$123,N$125)) -> 1 | P172: =RANK(P171,(P$6,P$8,P$10,P$12,P$14,P$17,P$19,P$21,P$23,P$25,P$27,P$29,P$31,P$33,P$35,P$37,P$39,P$41,P$43,P$45,P$47,P$49,P$51,P$53,P$55,P$57,P$59,P$61,P$63,P$65,P$67,P$69,P$71,P$73,P$75,P$77,P$79,P$81,P$83,P$85,P$87,P$89,P$91,P$93,P$95,P$97,P$99,P$101,P$103,P$105,P$107,P$109,P$111,P$113,P$115,P$117,P$119,P$121,P$123,P$125)) -> 1
A173: Cavaliers | B173: 3 | C173: 18.00 | D173: 17.80 | E173: 35.80 | F173: 17.80 | G173: 18.00 | H173: 17.70 | I173: 26.75 | J173: 17.70 | K173: 18.00 | L173: 18.50 | M173: 27.10 | N173: 89.65 | O173: 0.0 | P173: 89.65
C174: =RANK(C173,(C$6,C$8,C$10,C$12,C$14,C$17,C$19,C$21,C$23,C$25,C$27,C$29,C$31,C$33,C$35,C$37,C$39,C$41,C$43,C$45,C$47,C$49,C$51,C$53,C$55,C$57,C$59,C$61,C$63,C$65,C$67,C$69,C$71,C$73,C$75,C$77,C$79,C$81,C$83,C$85,C$87,C$89,C$91,C$93,C$95,C$97,C$99,C$101,C$103,C$105,C$107,C$109,C$111,C$113,C$115,C$117,C$119,C$121,C$123,C$125)) -> 2 | D174: =RANK(D173,(D$6,D$8,D$10,D$12,D$14,D$17,D$19,D$21,D$23,D$25,D$27,D$29,D$31,D$33,D$35,D$37,D$39,D$41,D$43,D$45,D$47,D$49,D$51,D$53,D$55,D$57,D$59,D$61,D$63,D$65,D$67,D$69,D$71,D$73,D$75,D$77,D$79,D$81,D$83,D$85,D$87,D$89,D$91,D$93,D$95,D$97,D$99,D$101,D$103,D$105,D$107,D$109,D$111,D$113,D$115,D$117,D$119,D$121,D$123,D$125)) -> 3 | E174: =RANK(E173,(E$6,E$8,E$10,E$12,E$14,E$17,E$19,E$21,E$23,E$25,E$27,E$29,E$31,E$33,E$35,E$37,E$39,E$41,E$43,E$45,E$47,E$49,E$51,E$53,E$55,E$57,E$59,E$61,E$63,E$65,E$67,E$69,E$71,E$73,E$75,E$77,E$79,E$81,E$83,E$85,E$87,E$89,E$91,E$93,E$95,E$97,E$99,E$101,E$103,E$105,E$107,E$109,E$111,E$113,E$115,E$117,E$119,E$121,E$123,E$125)) -> 2 | F174: =RANK(F173,(F$6,F$8,F$10,F$12,F$14,F$17,F$19,F$21,F$23,F$25,F$27,F$29,F$31,F$33,F$35,F$37,F$39,F$41,F$43,F$45,F$47,F$49,F$51,F$53,F$55,F$57,F$59,F$61,F$63,F$65,F$67,F$69,F$71,F$73,F$75,F$77,F$79,F$81,F$83,F$85,F$87,F$89,F$91,F$93,F$95,F$97,F$99,F$101,F$103,F$105,F$107,F$109,F$111,F$113,F$115,F$117,F$119,F$121,F$123,F$125)) -> 2 | G174: =RANK(G173,(G$6,G$8,G$10,G$12,G$14,G$17,G$19,G$21,G$23,G$25,G$27,G$29,G$31,G$33,G$35,G$37,G$39,G$41,G$43,G$45,G$47,G$49,G$51,G$53,G$55,G$57,G$59,G$61,G$63,G$65,G$67,G$69,G$71,G$73,G$75,G$77,G$79,G$81,G$83,G$85,G$87,G$89,G$91,G$93,G$95,G$97,G$99,G$101,G$103,G$105,G$107,G$109,G$111,G$113,G$115,G$117,G$119,G$121,G$123,G$125)) -> 2 | H174: =RANK(H173,(H$6,H$8,H$10,H$12,H$14,H$17,H$19,H$21,H$23,H$25,H$27,H$29,H$31,H$33,H$35,H$37,H$39,H$41,H$43,H$45,H$47,H$49,H$51,H$53,H$55,H$57,H$59,H$61,H$63,H$65,H$67,H$69,H$71,H$73,H$75,H$77,H$79,H$81,H$83,H$85,H$87,H$89,H$91,H$93,H$95,H$97,H$99,H$101,H$103,H$105,H$107,H$109,H$111,H$113,H$115,H$117,H$119,H$121,H$123,H$125)) -> 3 | I174: =RANK(I173,(I$6,I$8,I$10,I$12,I$14,I$17,I$19,I$21,I$23,I$25,I$27,I$29,I$31,I$33,I$35,I$37,I$39,I$41,I$43,I$45,I$47,I$49,I$51,I$53,I$55,I$57,I$59,I$61,I$63,I$65,I$67,I$69,I$71,I$73,I$75,I$77,I$79,I$81,I$83,I$85,I$87,I$89,I$91,I$93,I$95,I$97,I$99,I$101,I$103,I$105,I$107,I$109,I$111,I$113,I$115,I$117,I$119,I$121,I$123,I$125)) -> 2 | J174: =RANK(J173,(J$6,J$8,J$10,J$12,J$14,J$17,J$19,J$21,J$23,J$25,J$27,J$29,J$31,J$33,J$35,J$37,J$39,J$41,J$43,J$45,J$47,J$49,J$51,J$53,J$55,J$57,J$59,J$61,J$63,J$65,J$67,J$69,J$71,J$73,J$75,J$77,J$79,J$81,J$83,J$85,J$87,J$89,J$91,J$93,J$95,J$97,J$99,J$101,J$103,J$105,J$107,J$109,J$111,J$113,J$115,J$117,J$119,J$121,J$123,J$125)) -> 2 | K174: =RANK(K173,(K$6,K$8,K$10,K$12,K$14,K$17,K$19,K$21,K$23,K$25,K$27,K$29,K$31,K$33,K$35,K$37,K$39,K$41,K$43,K$45,K$47,K$49,K$51,K$53,K$55,K$57,K$59,K$61,K$63,K$65,K$67,K$69,K$71,K$73,K$75,K$77,K$79,K$81,K$83,K$85,K$87,K$89,K$91,K$93,K$95,K$97,K$99,K$101,K$103,K$105,K$107,K$109,K$111,K$113,K$115,K$117,K$119,K$121,K$123,K$125)) -> 2 | L174: =RANK(L173,(L$6,L$8,L$10,L$12,L$14,L$17,L$19,L$21,L$23,L$25,L$27,L$29,L$31,L$33,L$35,L$37,L$39,L$41,L$43,L$45,L$47,L$49,L$51,L$53,L$55,L$57,L$59,L$61,L$63,L$65,L$67,L$69,L$71,L$73,L$75,L$77,L$79,L$81,L$83,L$85,L$87,L$89,L$91,L$93,L$95,L$97,L$99,L$101,L$103,L$105,L$107,L$109,L$111,L$113,L$115,L$117,L$119,L$121,L$123,L$125)) -> 1 | M174: =RANK(M173,(M$6,M$8,M$10,M$12,M$14,M$17,M$19,M$21,M$23,M$25,M$27,M$29,M$31,M$33,M$35,M$37,M$39,M$41,M$43,M$45,M$47,M$49,M$51,M$53,M$55,M$57,M$59,M$61,M$63,M$65,M$67,M$69,M$71,M$73,M$75,M$77,M$79,M$81,M$83,M$85,M$87,M$89,M$91,M$93,M$95,M$97,M$99,M$101,M$103,M$105,M$107,M$109,M$111,M$113,M$115,M$117,M$119,M$121,M$123,M$125)) -> 1 | N174: =RANK(N173,(N$6,N$8,N$10,N$12,N$14,N$17,N$19,N$21,N$23,N$25,N$27,N$29,N$31,N$33,N$35,N$37,N$39,N$41,N$43,N$45,N$47,N$49,N$51,N$53,N$55,N$57,N$59,N$61,N$63,N$65,N$67,N$69,N$71,N$73,N$75,N$77,N$79,N$81,N$83,N$85,N$87,N$89,N$91,N$93,N$95,N$97,N$99,N$101,N$103,N$105,N$107,N$109,N$111,N$113,N$115,N$117,N$119,N$121,N$123,N$125)) -> 2 | P174: =RANK(P173,(P$6,P$8,P$10,P$12,P$14,P$17,P$19,P$21,P$23,P$25,P$27,P$29,P$31,P$33,P$35,P$37,P$39,P$41,P$43,P$45,P$47,P$49,P$51,P$53,P$55,P$57,P$59,P$61,P$63,P$65,P$67,P$69,P$71,P$73,P$75,P$77,P$79,P$81,P$83,P$85,P$87,P$89,P$91,P$93,P$95,P$97,P$99,P$101,P$103,P$105,P$107,P$109,P$111,P$113,P$115,P$117,P$119,P$121,P$123,P$125)) -> 2
A175: Mandarins | B175: 4 | C175: 17.70 | D175: 18.00 | E175: 35.70 | F175: 17.70 | G175: 17.70 | H175: 17.90 | I175: 26.65 | J175: 17.00 | K175: 17.70 | L175: 17.60 | M175: 26.15 | N175: 88.50 | O175: 0.0 | P175: 88.50
C176: =RANK(C175,(C$6,C$8,C$10,C$12,C$14,C$17,C$19,C$21,C$23,C$25,C$27,C$29,C$31,C$33,C$35,C$37,C$39,C$41,C$43,C$45,C$47,C$49,C$51,C$53,C$55,C$57,C$59,C$61,C$63,C$65,C$67,C$69,C$71,C$73,C$75,C$77,C$79,C$81,C$83,C$85,C$87,C$89,C$91,C$93,C$95,C$97,C$99,C$101,C$103,C$105,C$107,C$109,C$111,C$113,C$115,C$117,C$119,C$121,C$123,C$125)) -> 3 | D176: =RANK(D175,(D$6,D$8,D$10,D$12,D$14,D$17,D$19,D$21,D$23,D$25,D$27,D$29,D$31,D$33,D$35,D$37,D$39,D$41,D$43,D$45,D$47,D$49,D$51,D$53,D$55,D$57,D$59,D$61,D$63,D$65,D$67,D$69,D$71,D$73,D$75,D$77,D$79,D$81,D$83,D$85,D$87,D$89,D$91,D$93,D$95,D$97,D$99,D$101,D$103,D$105,D$107,D$109,D$111,D$113,D$115,D$117,D$119,D$121,D$123,D$125)) -> 2 | E176: =RANK(E175,(E$6,E$8,E$10,E$12,E$14,E$17,E$19,E$21,E$23,E$25,E$27,E$29,E$31,E$33,E$35,E$37,E$39,E$41,E$43,E$45,E$47,E$49,E$51,E$53,E$55,E$57,E$59,E$61,E$63,E$65,E$67,E$69,E$71,E$73,E$75,E$77,E$79,E$81,E$83,E$85,E$87,E$89,E$91,E$93,E$95,E$97,E$99,E$101,E$103,E$105,E$107,E$109,E$111,E$113,E$115,E$117,E$119,E$121,E$123,E$125)) -> 3 | F176: =RANK(F175,(F$6,F$8,F$10,F$12,F$14,F$17,F$19,F$21,F$23,F$25,F$27,F$29,F$31,F$33,F$35,F$37,F$39,F$41,F$43,F$45,F$47,F$49,F$51,F$53,F$55,F$57,F$59,F$61,F$63,F$65,F$67,F$69,F$71,F$73,F$75,F$77,F$79,F$81,F$83,F$85,F$87,F$89,F$91,F$93,F$95,F$97,F$99,F$101,F$103,F$105,F$107,F$109,F$111,F$113,F$115,F$117,F$119,F$121,F$123,F$125)) -> 3 | G176: =RANK(G175,(G$6,G$8,G$10,G$12,G$14,G$17,G$19,G$21,G$23,G$25,G$27,G$29,G$31,G$33,G$35,G$37,G$39,G$41,G$43,G$45,G$47,G$49,G$51,G$53,G$55,G$57,G$59,G$61,G$63,G$65,G$67,G$69,G$71,G$73,G$75,G$77,G$79,G$81,G$83,G$85,G$87,G$89,G$91,G$93,G$95,G$97,G$99,G$101,G$103,G$105,G$107,G$109,G$111,G$113,G$115,G$117,G$119,G$121,G$123,G$125)) -> 3 | H176: =RANK(H175,(H$6,H$8,H$10,H$12,H$14,H$17,H$19,H$21,H$23,H$25,H$27,H$29,H$31,H$33,H$35,H$37,H$39,H$41,H$43,H$45,H$47,H$49,H$51,H$53,H$55,H$57,H$59,H$61,H$63,H$65,H$67,H$69,H$71,H$73,H$75,H$77,H$79,H$81,H$83,H$85,H$87,H$89,H$91,H$93,H$95,H$97,H$99,H$101,H$103,H$105,H$107,H$109,H$111,H$113,H$115,H$117,H$119,H$121,H$123,H$125)) -> 2 | I176: =RANK(I175,(I$6,I$8,I$10,I$12,I$14,I$17,I$19,I$21,I$23,I$25,I$27,I$29,I$31,I$33,I$35,I$37,I$39,I$41,I$43,I$45,I$47,I$49,I$51,I$53,I$55,I$57,I$59,I$61,I$63,I$65,I$67,I$69,I$71,I$73,I$75,I$77,I$79,I$81,I$83,I$85,I$87,I$89,I$91,I$93,I$95,I$97,I$99,I$101,I$103,I$105,I$107,I$109,I$111,I$113,I$115,I$117,I$119,I$121,I$123,I$125)) -> 3 | J176: =RANK(J175,(J$6,J$8,J$10,J$12,J$14,J$17,J$19,J$21,J$23,J$25,J$27,J$29,J$31,J$33,J$35,J$37,J$39,J$41,J$43,J$45,J$47,J$49,J$51,J$53,J$55,J$57,J$59,J$61,J$63,J$65,J$67,J$69,J$71,J$73,J$75,J$77,J$79,J$81,J$83,J$85,J$87,J$89,J$91,J$93,J$95,J$97,J$99,J$101,J$103,J$105,J$107,J$109,J$111,J$113,J$115,J$117,J$119,J$121,J$123,J$125)) -> 3 | K176: =RANK(K175,(K$6,K$8,K$10,K$12,K$14,K$17,K$19,K$21,K$23,K$25,K$27,K$29,K$31,K$33,K$35,K$37,K$39,K$41,K$43,K$45,K$47,K$49,K$51,K$53,K$55,K$57,K$59,K$61,K$63,K$65,K$67,K$69,K$71,K$73,K$75,K$77,K$79,K$81,K$83,K$85,K$87,K$89,K$91,K$93,K$95,K$97,K$99,K$101,K$103,K$105,K$107,K$109,K$111,K$113,K$115,K$117,K$119,K$121,K$123,K$125)) -> 3 | L176: =RANK(L175,(L$6,L$8,L$10,L$12,L$14,L$17,L$19,L$21,L$23,L$25,L$27,L$29,L$31,L$33,L$35,L$37,L$39,L$41,L$43,L$45,L$47,L$49,L$51,L$53,L$55,L$57,L$59,L$61,L$63,L$65,L$67,L$69,L$71,L$73,L$75,L$77,L$79,L$81,L$83,L$85,L$87,L$89,L$91,L$93,L$95,L$97,L$99,L$101,L$103,L$105,L$107,L$109,L$111,L$113,L$115,L$117,L$119,L$121,L$123,L$125)) -> 2 | M176: =RANK(M175,(M$6,M$8,M$10,M$12,M$14,M$17,M$19,M$21,M$23,M$25,M$27,M$29,M$31,M$33,M$35,M$37,M$39,M$41,M$43,M$45,M$47,M$49,M$51,M$53,M$55,M$57,M$59,M$61,M$63,M$65,M$67,M$69,M$71,M$73,M$75,M$77,M$79,M$81,M$83,M$85,M$87,M$89,M$91,M$93,M$95,M$97,M$99,M$101,M$103,M$105,M$107,M$109,M$111,M$113,M$115,M$117,M$119,M$121,M$123,M$125)) -> 3 | N176: =RANK(N175,(N$6,N$8,N$10,N$12,N$14,N$17,N$19,N$21,N$23,N$25,N$27,N$29,N$31,N$33,N$35,N$37,N$39,N$41,N$43,N$45,N$47,N$49,N$51,N$53,N$55,N$57,N$59,N$61,N$63,N$65,N$67,N$69,N$71,N$73,N$75,N$77,N$79,N$81,N$83,N$85,N$87,N$89,N$91,N$93,N$95,N$97,N$99,N$101,N$103,N$105,N$107,N$109,N$111,N$113,N$115,N$117,N$119,N$121,N$123,N$125)) -> 3 | P176: =RANK(P175,(P$6,P$8,P$10,P$12,P$14,P$17,P$19,P$21,P$23,P$25,P$27,P$29,P$31,P$33,P$35,P$37,P$39,P$41,P$43,P$45,P$47,P$49,P$51,P$53,P$55,P$57,P$59,P$61,P$63,P$65,P$67,P$69,P$71,P$73,P$75,P$77,P$79,P$81,P$83,P$85,P$87,P$89,P$91,P$93,P$95,P$97,P$99,P$101,P$103,P$105,P$107,P$109,P$111,P$113,P$115,P$117,P$119,P$121,P$123,P$125)) -> 3
A177: Madison | B177: 2 | C177: 16.60 | D177: 16.10 | E177: 32.70 | F177: 16.30 | G177: 16.20 | H177: 16.40 | I177: 24.45 | J177: 16.60 | K177: 16.00 | L177: 15.60 | M177: 24.10 | N177: 81.25 | O177: 0.0 | P177: 81.25
A178: Scouts | C178: =RANK(C177,(C$6,C$8,C$10,C$12,C$14,C$17,C$19,C$21,C$23,C$25,C$27,C$29,C$31,C$33,C$35,C$37,C$39,C$41,C$43,C$45,C$47,C$49,C$51,C$53,C$55,C$57,C$59,C$61,C$63,C$65,C$67,C$69,C$71,C$73,C$75,C$77,C$79,C$81,C$83,C$85,C$87,C$89,C$91,C$93,C$95,C$97,C$99,C$101,C$103,C$105,C$107,C$109,C$111,C$113,C$115,C$117,C$119,C$121,C$123,C$125)) -> 4 | D178: =RANK(D177,(D$6,D$8,D$10,D$12,D$14,D$17,D$19,D$21,D$23,D$25,D$27,D$29,D$31,D$33,D$35,D$37,D$39,D$41,D$43,D$45,D$47,D$49,D$51,D$53,D$55,D$57,D$59,D$61,D$63,D$65,D$67,D$69,D$71,D$73,D$75,D$77,D$79,D$81,D$83,D$85,D$87,D$89,D$91,D$93,D$95,D$97,D$99,D$101,D$103,D$105,D$107,D$109,D$111,D$113,D$115,D$117,D$119,D$121,D$123,D$125)) -> 4 | E178: =RANK(E177,(E$6,E$8,E$10,E$12,E$14,E$17,E$19,E$21,E$23,E$25,E$27,E$29,E$31,E$33,E$35,E$37,E$39,E$41,E$43,E$45,E$47,E$49,E$51,E$53,E$55,E$57,E$59,E$61,E$63,E$65,E$67,E$69,E$71,E$73,E$75,E$77,E$79,E$81,E$83,E$85,E$87,E$89,E$91,E$93,E$95,E$97,E$99,E$101,E$103,E$105,E$107,E$109,E$111,E$113,E$115,E$117,E$119,E$121,E$123,E$125)) -> 4 | F178: =RANK(F177,(F$6,F$8,F$10,F$12,F$14,F$17,F$19,F$21,F$23,F$25,F$27,F$29,F$31,F$33,F$35,F$37,F$39,F$41,F$43,F$45,F$47,F$49,F$51,F$53,F$55,F$57,F$59,F$61,F$63,F$65,F$67,F$69,F$71,F$73,F$75,F$77,F$79,F$81,F$83,F$85,F$87,F$89,F$91,F$93,F$95,F$97,F$99,F$101,F$103,F$105,F$107,F$109,F$111,F$113,F$115,F$117,F$119,F$121,F$123,F$125)) -> 4 | G178: =RANK(G177,(G$6,G$8,G$10,G$12,G$14,G$17,G$19,G$21,G$23,G$25,G$27,G$29,G$31,G$33,G$35,G$37,G$39,G$41,G$43,G$45,G$47,G$49,G$51,G$53,G$55,G$57,G$59,G$61,G$63,G$65,G$67,G$69,G$71,G$73,G$75,G$77,G$79,G$81,G$83,G$85,G$87,G$89,G$91,G$93,G$95,G$97,G$99,G$101,G$103,G$105,G$107,G$109,G$111,G$113,G$115,G$117,G$119,G$121,G$123,G$125)) -> 4 | H178: =RANK(H177,(H$6,H$8,H$10,H$12,H$14,H$17,H$19,H$21,H$23,H$25,H$27,H$29,H$31,H$33,H$35,H$37,H$39,H$41,H$43,H$45,H$47,H$49,H$51,H$53,H$55,H$57,H$59,H$61,H$63,H$65,H$67,H$69,H$71,H$73,H$75,H$77,H$79,H$81,H$83,H$85,H$87,H$89,H$91,H$93,H$95,H$97,H$99,H$101,H$103,H$105,H$107,H$109,H$111,H$113,H$115,H$117,H$119,H$121,H$123,H$125)) -> 4 | I178: =RANK(I177,(I$6,I$8,I$10,I$12,I$14,I$17,I$19,I$21,I$23,I$25,I$27,I$29,I$31,I$33,I$35,I$37,I$39,I$41,I$43,I$45,I$47,I$49,I$51,I$53,I$55,I$57,I$59,I$61,I$63,I$65,I$67,I$69,I$71,I$73,I$75,I$77,I$79,I$81,I$83,I$85,I$87,I$89,I$91,I$93,I$95,I$97,I$99,I$101,I$103,I$105,I$107,I$109,I$111,I$113,I$115,I$117,I$119,I$121,I$123,I$125)) -> 4 | J178: =RANK(J177,(J$6,J$8,J$10,J$12,J$14,J$17,J$19,J$21,J$23,J$25,J$27,J$29,J$31,J$33,J$35,J$37,J$39,J$41,J$43,J$45,J$47,J$49,J$51,J$53,J$55,J$57,J$59,J$61,J$63,J$65,J$67,J$69,J$71,J$73,J$75,J$77,J$79,J$81,J$83,J$85,J$87,J$89,J$91,J$93,J$95,J$97,J$99,J$101,J$103,J$105,J$107,J$109,J$111,J$113,J$115,J$117,J$119,J$121,J$123,J$125)) -> 4 | K178: =RANK(K177,(K$6,K$8,K$10,K$12,K$14,K$17,K$19,K$21,K$23,K$25,K$27,K$29,K$31,K$33,K$35,K$37,K$39,K$41,K$43,K$45,K$47,K$49,K$51,K$53,K$55,K$57,K$59,K$61,K$63,K$65,K$67,K$69,K$71,K$73,K$75,K$77,K$79,K$81,K$83,K$85,K$87,K$89,K$91,K$93,K$95,K$97,K$99,K$101,K$103,K$105,K$107,K$109,K$111,K$113,K$115,K$117,K$119,K$121,K$123,K$125)) -> 4 | L178: 5 | M178: =RANK(M177,(M$6,M$8,M$10,M$12,M$14,M$17,M$19,M$21,M$23,M$25,M$27,M$29,M$31,M$33,M$35,M$37,M$39,M$41,M$43,M$45,M$47,M$49,M$51,M$53,M$55,M$57,M$59,M$61,M$63,M$65,M$67,M$69,M$71,M$73,M$75,M$77,M$79,M$81,M$83,M$85,M$87,M$89,M$91,M$93,M$95,M$97,M$99,M$101,M$103,M$105,M$107,M$109,M$111,M$113,M$115,M$117,M$119,M$121,M$123,M$125)) -> 4 | N178: =RANK(N177,(N$6,N$8,N$10,N$12,N$14,N$17,N$19,N$21,N$23,N$25,N$27,N$29,N$31,N$33,N$35,N$37,N$39,N$41,N$43,N$45,N$47,N$49,N$51,N$53,N$55,N$57,N$59,N$61,N$63,N$65,N$67,N$69,N$71,N$73,N$75,N$77,N$79,N$81,N$83,N$85,N$87,N$89,N$91,N$93,N$95,N$97,N$99,N$101,N$103,N$105,N$107,N$109,N$111,N$113,N$115,N$117,N$119,N$121,N$123,N$125)) -> 4 | P178: =RANK(P177,(P$6,P$8,P$10,P$12,P$14,P$17,P$19,P$21,P$23,P$25,P$27,P$29,P$31,P$33,P$35,P$37,P$39,P$41,P$43,P$45,P$47,P$49,P$51,P$53,P$55,P$57,P$59,P$61,P$63,P$65,P$67,P$69,P$71,P$73,P$75,P$77,P$79,P$81,P$83,P$85,P$87,P$89,P$91,P$93,P$95,P$97,P$99,P$101,P$103,P$105,P$107,P$109,P$111,P$113,P$115,P$117,P$119,P$121,P$123,P$125)) -> 4
A179: Music | B179: 1 | C179: 15.70 | D179: 15.30 | E179: 31.50 | F179: 15.00 | G179: 15.70 | H179: 15.60 | I179: 23.15 | J179: 15.50 | K179: 15.40 | L179: 16.20 | M179: 23.55 | N179: 77.70 | O179: 0.0 | P179: 77.70
A180: City | C180: =RANK(C179,(C$6,C$8,C$10,C$12,C$14,C$17,C$19,C$21,C$23,C$25,C$27,C$29,C$31,C$33,C$35,C$37,C$39,C$41,C$43,C$45,C$47,C$49,C$51,C$53,C$55,C$57,C$59,C$61,C$63,C$65,C$67,C$69,C$71,C$73,C$75,C$77,C$79,C$81,C$83,C$85,C$87,C$89,C$91,C$93,C$95,C$97,C$99,C$101,C$103,C$105,C$107,C$109,C$111,C$113,C$115,C$117,C$119,C$121,C$123,C$125)) -> 5 | D180: =RANK(D179,(D$6,D$8,D$10,D$12,D$14,D$17,D$19,D$21,D$23,D$25,D$27,D$29,D$31,D$33,D$35,D$37,D$39,D$41,D$43,D$45,D$47,D$49,D$51,D$53,D$55,D$57,D$59,D$61,D$63,D$65,D$67,D$69,D$71,D$73,D$75,D$77,D$79,D$81,D$83,D$85,D$87,D$89,D$91,D$93,D$95,D$97,D$99,D$101,D$103,D$105,D$107,D$109,D$111,D$113,D$115,D$117,D$119,D$121,D$123,D$125)) -> 5 | E180: =RANK(E179,(E$6,E$8,E$10,E$12,E$14,E$17,E$19,E$21,E$23,E$25,E$27,E$29,E$31,E$33,E$35,E$37,E$39,E$41,E$43,E$45,E$47,E$49,E$51,E$53,E$55,E$57,E$59,E$61,E$63,E$65,E$67,E$69,E$71,E$73,E$75,E$77,E$79,E$81,E$83,E$85,E$87,E$89,E$91,E$93,E$95,E$97,E$99,E$101,E$103,E$105,E$107,E$109,E$111,E$113,E$115,E$117,E$119,E$121,E$123,E$125)) -> 5 | F180: =RANK(F179,(F$6,F$8,F$10,F$12,F$14,F$17,F$19,F$21,F$23,F$25,F$27,F$29,F$31,F$33,F$35,F$37,F$39,F$41,F$43,F$45,F$47,F$49,F$51,F$53,F$55,F$57,F$59,F$61,F$63,F$65,F$67,F$69,F$71,F$73,F$75,F$77,F$79,F$81,F$83,F$85,F$87,F$89,F$91,F$93,F$95,F$97,F$99,F$101,F$103,F$105,F$107,F$109,F$111,F$113,F$115,F$117,F$119,F$121,F$123,F$125)) -> 5 | G180: =RANK(G179,(G$6,G$8,G$10,G$12,G$14,G$17,G$19,G$21,G$23,G$25,G$27,G$29,G$31,G$33,G$35,G$37,G$39,G$41,G$43,G$45,G$47,G$49,G$51,G$53,G$55,G$57,G$59,G$61,G$63,G$65,G$67,G$69,G$71,G$73,G$75,G$77,G$79,G$81,G$83,G$85,G$87,G$89,G$91,G$93,G$95,G$97,G$99,G$101,G$103,G$105,G$107,G$109,G$111,G$113,G$115,G$117,G$119,G$121,G$123,G$125)) -> 5 | H180: =RANK(H179,(H$6,H$8,H$10,H$12,H$14,H$17,H$19,H$21,H$23,H$25,H$27,H$29,H$31,H$33,H$35,H$37,H$39,H$41,H$43,H$45,H$47,H$49,H$51,H$53,H$55,H$57,H$59,H$61,H$63,H$65,H$67,H$69,H$71,H$73,H$75,H$77,H$79,H$81,H$83,H$85,H$87,H$89,H$91,H$93,H$95,H$97,H$99,H$101,H$103,H$105,H$107,H$109,H$111,H$113,H$115,H$117,H$119,H$121,H$123,H$125)) -> 5 | I180: =RANK(I179,(I$6,I$8,I$10,I$12,I$14,I$17,I$19,I$21,I$23,I$25,I$27,I$29,I$31,I$33,I$35,I$37,I$39,I$41,I$43,I$45,I$47,I$49,I$51,I$53,I$55,I$57,I$59,I$61,I$63,I$65,I$67,I$69,I$71,I$73,I$75,I$77,I$79,I$81,I$83,I$85,I$87,I$89,I$91,I$93,I$95,I$97,I$99,I$101,I$103,I$105,I$107,I$109,I$111,I$113,I$115,I$117,I$119,I$121,I$123,I$125)) -> 5 | J180: =RANK(J179,(J$6,J$8,J$10,J$12,J$14,J$17,J$19,J$21,J$23,J$25,J$27,J$29,J$31,J$33,J$35,J$37,J$39,J$41,J$43,J$45,J$47,J$49,J$51,J$53,J$55,J$57,J$59,J$61,J$63,J$65,J$67,J$69,J$71,J$73,J$75,J$77,J$79,J$81,J$83,J$85,J$87,J$89,J$91,J$93,J$95,J$97,J$99,J$101,J$103,J$105,J$107,J$109,J$111,J$113,J$115,J$117,J$119,J$121,J$123,J$125)) -> 5 | K180: =RANK(K179,(K$6,K$8,K$10,K$12,K$14,K$17,K$19,K$21,K$23,K$25,K$27,K$29,K$31,K$33,K$35,K$37,K$39,K$41,K$43,K$45,K$47,K$49,K$51,K$53,K$55,K$57,K$59,K$61,K$63,K$65,K$67,K$69,K$71,K$73,K$75,K$77,K$79,K$81,K$83,K$85,K$87,K$89,K$91,K$93,K$95,K$97,K$99,K$101,K$103,K$105,K$107,K$109,K$111,K$113,K$115,K$117,K$119,K$121,K$123,K$125)) -> 5 | L180: =RANK(L179,(L$6,L$8,L$10,L$12,L$14,L$17,L$19,L$21,L$23,L$25,L$27,L$29,L$31,L$33,L$35,L$37,L$39,L$41,L$43,L$45,L$47,L$49,L$51,L$53,L$55,L$57,L$59,L$61,L$63,L$65,L$67,L$69,L$71,L$73,L$75,L$77,L$79,L$81,L$83,L$85,L$87,L$89,L$91,L$93,L$95,L$97,L$99,L$101,L$103,L$105,L$107,L$109,L$111,L$113,L$115,L$117,L$119,L$121,L$123,L$125)) -> 4 | M180: =RANK(M179,(M$6,M$8,M$10,M$12,M$14,M$17,M$19,M$21,M$23,M$25,M$27,M$29,M$31,M$33,M$35,M$37,M$39,M$41,M$43,M$45,M$47,M$49,M$51,M$53,M$55,M$57,M$59,M$61,M$63,M$65,M$67,M$69,M$71,M$73,M$75,M$77,M$79,M$81,M$83,M$85,M$87,M$89,M$91,M$93,M$95,M$97,M$99,M$101,M$103,M$105,M$107,M$109,M$111,M$113,M$115,M$117,M$119,M$121,M$123,M$125)) -> 5 | N180: =RANK(N179,(N$6,N$8,N$10,N$12,N$14,N$17,N$19,N$21,N$23,N$25,N$27,N$29,N$31,N$33,N$35,N$37,N$39,N$41,N$43,N$45,N$47,N$49,N$51,N$53,N$55,N$57,N$59,N$61,N$63,N$65,N$67,N$69,N$71,N$73,N$75,N$77,N$79,N$81,N$83,N$85,N$87,N$89,N$91,N$93,N$95,N$97,N$99,N$101,N$103,N$105,N$107,N$109,N$111,N$113,N$115,N$117,N$119,N$121,N$123,N$125)) -> 5 | P180: =RANK(P179,(P$6,P$8,P$10,P$12,P$14,P$17,P$19,P$21,P$23,P$25,P$27,P$29,P$31,P$33,P$35,P$37,P$39,P$41,P$43,P$45,P$47,P$49,P$51,P$53,P$55,P$57,P$59,P$61,P$63,P$65,P$67,P$69,P$71,P$73,P$75,P$77,P$79,P$81,P$83,P$85,P$87,P$89,P$91,P$93,P$95,P$97,P$99,P$101,P$103,P$105,P$107,P$109,P$111,P$113,P$115,P$117,P$119,P$121,P$123,P$125)) -> 5
A181: DCI Open Class
A182: Spartans | B182: 1 | C182: 15.30 | D182: 15.00 | E182: 30.30 | F182: 14.40 | G182: 15.20 | H182: 15.10 | I182: 22.35 | J182: 14.80 | K182: 14.90 | L182: 15.80 | M182: 22.75 | N182: 75.40 | O182: 0.0 | P182: 75.40
C183: 1 | D183: 1 | E183: 1 | F183: 1 | G183: 1 | H183: 1 | I183: 1 | J183: 1 | K183: 1 | L183: 1 | M183: 1 | N183: 1 | P183: 1
A186: 8/3/2022 Centerville, Ohio
C187: Visual | F187: Music | J187: Effect | M187: Communication
C188: Ensemble | D188: Color Guard | F188: Brass | G188: Ensemble | H188: Percussion | J188: Visual | K188: Music | M188: Visual | N188: Music | P188: Sub | R188: Total
C189: J. Orefice | D189: C. Church | E189: Average | F189: B. Crisp | G189: W. Dillon | H189: T. Fox | I189: Total ÷2 | J189: D. Deems | K189: K. Young | L189: Total | M189: D. Deems | N189: K. Young | O189: Average | P189: Total | Q189: Pen | R189: Score
A190: DCA Class A | C190: 20 | D190: 20 | E190: 20 | F190: 20 | G190: 20 | H190: 20 | I190: 30 | J190: 20 | K190: 20 | L190: 40 | M190: 10 | N190: 10 | O190: 10 | P190: 100 | R190: 100
A191: Govenaires | C191: 14.80 | D191: 14.80 | E191: 14.80 | F191: 13.60 | G191: 14.50 | H191: 13.60 | I191: 20.85 | J191: 15.50 | K191: 14.60 | L191: 30.10 | M191: 7.90 | N191: 7.40 | O191: 7.65 | P191: 73.40 | Q191: 0.0 | R191: 73.40
C192: 1 | D192: 1 | E192: 1 | F192: 1 | G192: 1 | H192: 1 | I192: 1 | J192: 1 | K192: 1 | L192: 1 | M192: 1 | N192: 1 | O192: 1 | P192: 1 | R192: 1
A195: 8/3/2022 Glassboro, New Jersey
C196: General Effect | F196: Visual | J196: Music
C197: 1 | D197: 2 | F197: Proficiency | G197: Analysis | H197: Color Guard | J197: Brass | K197: Analysis | L197: Percussion | N197: Sub | P197: Total
C198: M. Tarr | D198: J. Webb | E198: Total | F198: H. Nguyen | G198: S. Adamo | H198: J. Howell | I198: Total ÷2 | J198: D. Thomas | K198: K. Turner | L198: T. Mengel | M198: Total ÷2 | N198: Total | O198: Pen | P198: Score
A199: DCI World Class | C199: 20 | D199: 20 | E199: 40 | F199: 20 | G199: 20 | H199: 20 | I199: 30 | J199: 20 | K199: 20 | L199: 20 | M199: 30 | N199: 100 | P199: 100
A200: Boston | B200: 8 | C200: 19.25 | D200: 18.90 | E200: 38.15 | F200: 19.00 | G200: 19.30 | H200: 19.20 | I200: 28.75 | J200: 18.80 | K200: 18.70 | L200: 19.10 | M200: 28.30 | N200: 95.20 | O200: 0.0 | P200: 95.20
A201: Crusaders | C201: =RANK(C200,(C$6,C$8,C$10,C$12,C$14,C$16,C$18,C$20,C$22,C$24,C$26,C$28,C$30,C$32,C$34,C$36,C$38,C$40,C$42,C$44,C$46,C$48,C$50,C$52,C$54,C$56,C$58,C$60,C$62,C$64,C$66,C$68,C$70,C$72,C$74,C$76,C$78,C$80,C$82,C$84,C$86,C$88,C$90,C$92,C$94,C$96,C$98,C$100,C$102,C$104,C$106,C$108,C$110,C$112,C$114,C$116,C$118,C$120,C$122,C$124)) -> 1 | D201: =RANK(D200,(D$6,D$8,D$10,D$12,D$14,D$16,D$18,D$20,D$22,D$24,D$26,D$28,D$30,D$32,D$34,D$36,D$38,D$40,D$42,D$44,D$46,D$48,D$50,D$52,D$54,D$56,D$58,D$60,D$62,D$64,D$66,D$68,D$70,D$72,D$74,D$76,D$78,D$80,D$82,D$84,D$86,D$88,D$90,D$92,D$94,D$96,D$98,D$100,D$102,D$104,D$106,D$108,D$110,D$112,D$114,D$116,D$118,D$120,D$122,D$124)) -> 1 | E201: =RANK(E200,(E$6,E$8,E$10,E$12,E$14,E$16,E$18,E$20,E$22,E$24,E$26,E$28,E$30,E$32,E$34,E$36,E$38,E$40,E$42,E$44,E$46,E$48,E$50,E$52,E$54,E$56,E$58,E$60,E$62,E$64,E$66,E$68,E$70,E$72,E$74,E$76,E$78,E$80,E$82,E$84,E$86,E$88,E$90,E$92,E$94,E$96,E$98,E$100,E$102,E$104,E$106,E$108,E$110,E$112,E$114,E$116,E$118,E$120,E$122,E$124)) -> 1 | F201: =RANK(F200,(F$6,F$8,F$10,F$12,F$14,F$16,F$18,F$20,F$22,F$24,F$26,F$28,F$30,F$32,F$34,F$36,F$38,F$40,F$42,F$44,F$46,F$48,F$50,F$52,F$54,F$56,F$58,F$60,F$62,F$64,F$66,F$68,F$70,F$72,F$74,F$76,F$78,F$80,F$82,F$84,F$86,F$88,F$90,F$92,F$94,F$96,F$98,F$100,F$102,F$104,F$106,F$108,F$110,F$112,F$114,F$116,F$118,F$120,F$122,F$124)) -> 1 | G201: =RANK(G200,(G$6,G$8,G$10,G$12,G$14,G$16,G$18,G$20,G$22,G$24,G$26,G$28,G$30,G$32,G$34,G$36,G$38,G$40,G$42,G$44,G$46,G$48,G$50,G$52,G$54,G$56,G$58,G$60,G$62,G$64,G$66,G$68,G$70,G$72,G$74,G$76,G$78,G$80,G$82,G$84,G$86,G$88,G$90,G$92,G$94,G$96,G$98,G$100,G$102,G$104,G$106,G$108,G$110,G$112,G$114,G$116,G$118,G$120,G$122,G$124)) -> 1 | H201: =RANK(H200,(H$6,H$8,H$10,H$12,H$14,H$16,H$18,H$20,H$22,H$24,H$26,H$28,H$30,H$32,H$34,H$36,H$38,H$40,H$42,H$44,H$46,H$48,H$50,H$52,H$54,H$56,H$58,H$60,H$62,H$64,H$66,H$68,H$70,H$72,H$74,H$76,H$78,H$80,H$82,H$84,H$86,H$88,H$90,H$92,H$94,H$96,H$98,H$100,H$102,H$104,H$106,H$108,H$110,H$112,H$114,H$116,H$118,H$120,H$122,H$124)) -> 1 | I201: =RANK(I200,(I$6,I$8,I$10,I$12,I$14,I$16,I$18,I$20,I$22,I$24,I$26,I$28,I$30,I$32,I$34,I$36,I$38,I$40,I$42,I$44,I$46,I$48,I$50,I$52,I$54,I$56,I$58,I$60,I$62,I$64,I$66,I$68,I$70,I$72,I$74,I$76,I$78,I$80,I$82,I$84,I$86,I$88,I$90,I$92,I$94,I$96,I$98,I$100,I$102,I$104,I$106,I$108,I$110,I$112,I$114,I$116,I$118,I$120,I$122,I$124)) -> 1 | J201: =RANK(J200,(J$6,J$8,J$10,J$12,J$14,J$16,J$18,J$20,J$22,J$24,J$26,J$28,J$30,J$32,J$34,J$36,J$38,J$40,J$42,J$44,J$46,J$48,J$50,J$52,J$54,J$56,J$58,J$60,J$62,J$64,J$66,J$68,J$70,J$72,J$74,J$76,J$78,J$80,J$82,J$84,J$86,J$88,J$90,J$92,J$94,J$96,J$98,J$100,J$102,J$104,J$106,J$108,J$110,J$112,J$114,J$116,J$118,J$120,J$122,J$124)) -> 1 | K201: =RANK(K200,(K$6,K$8,K$10,K$12,K$14,K$16,K$18,K$20,K$22,K$24,K$26,K$28,K$30,K$32,K$34,K$36,K$38,K$40,K$42,K$44,K$46,K$48,K$50,K$52,K$54,K$56,K$58,K$60,K$62,K$64,K$66,K$68,K$70,K$72,K$74,K$76,K$78,K$80,K$82,K$84,K$86,K$88,K$90,K$92,K$94,K$96,K$98,K$100,K$102,K$104,K$106,K$108,K$110,K$112,K$114,K$116,K$118,K$120,K$122,K$124)) -> 1 | L201: =RANK(L200,(L$6,L$8,L$10,L$12,L$14,L$16,L$18,L$20,L$22,L$24,L$26,L$28,L$30,L$32,L$34,L$36,L$38,L$40,L$42,L$44,L$46,L$48,L$50,L$52,L$54,L$56,L$58,L$60,L$62,L$64,L$66,L$68,L$70,L$72,L$74,L$76,L$78,L$80,L$82,L$84,L$86,L$88,L$90,L$92,L$94,L$96,L$98,L$100,L$102,L$104,L$106,L$108,L$110,L$112,L$114,L$116,L$118,L$120,L$122,L$124)) -> 1 | M201: =RANK(M200,(M$6,M$8,M$10,M$12,M$14,M$16,M$18,M$20,M$22,M$24,M$26,M$28,M$30,M$32,M$34,M$36,M$38,M$40,M$42,M$44,M$46,M$48,M$50,M$52,M$54,M$56,M$58,M$60,M$62,M$64,M$66,M$68,M$70,M$72,M$74,M$76,M$78,M$80,M$82,M$84,M$86,M$88,M$90,M$92,M$94,M$96,M$98,M$100,M$102,M$104,M$106,M$108,M$110,M$112,M$114,M$116,M$118,M$120,M$122,M$124)) -> 1 | N201: =RANK(N200,(N$6,N$8,N$10,N$12,N$14,N$16,N$18,N$20,N$22,N$24,N$26,N$28,N$30,N$32,N$34,N$36,N$38,N$40,N$42,N$44,N$46,N$48,N$50,N$52,N$54,N$56,N$58,N$60,N$62,N$64,N$66,N$68,N$70,N$72,N$74,N$76,N$78,N$80,N$82,N$84,N$86,N$88,N$90,N$92,N$94,N$96,N$98,N$100,N$102,N$104,N$106,N$108,N$110,N$112,N$114,N$116,N$118,N$120,N$122,N$124)) -> 1 | P201: =RANK(P200,(P$6,P$8,P$10,P$12,P$14,P$16,P$18,P$20,P$22,P$24,P$26,P$28,P$30,P$32,P$34,P$36,P$38,P$40,P$42,P$44,P$46,P$48,P$50,P$52,P$54,P$56,P$58,P$60,P$62,P$64,P$66,P$68,P$70,P$72,P$74,P$76,P$78,P$80,P$82,P$84,P$86,P$88,P$90,P$92,P$94,P$96,P$98,P$100,P$102,P$104,P$106,P$108,P$110,P$112,P$114,P$116,P$118,P$120,P$122,P$124)) -> 1
A202: Bluecoats | B202: 6 | C202: 19.00 | D202: 18.60 | E202: 37.60 | F202: 18.70 | G202: 19.00 | H202: 18.90 | I202: 28.30 | J202: 18.60 | K202: 18.20 | L202: 19.00 | M202: 27.90 | N202: 93.80 | O202: 0.0 | P202: 93.80
C203: =RANK(C202,(C$6,C$8,C$10,C$12,C$14,C$16,C$18,C$20,C$22,C$24,C$26,C$28,C$30,C$32,C$34,C$36,C$38,C$40,C$42,C$44,C$46,C$48,C$50,C$52,C$54,C$56,C$58,C$60,C$62,C$64,C$66,C$68,C$70,C$72,C$74,C$76,C$78,C$80,C$82,C$84,C$86,C$88,C$90,C$92,C$94,C$96,C$98,C$100,C$102,C$104,C$106,C$108,C$110,C$112,C$114,C$116,C$118,C$120,C$122,C$124)) -> 2 | D203: =RANK(D202,(D$6,D$8,D$10,D$12,D$14,D$16,D$18,D$20,D$22,D$24,D$26,D$28,D$30,D$32,D$34,D$36,D$38,D$40,D$42,D$44,D$46,D$48,D$50,D$52,D$54,D$56,D$58,D$60,D$62,D$64,D$66,D$68,D$70,D$72,D$74,D$76,D$78,D$80,D$82,D$84,D$86,D$88,D$90,D$92,D$94,D$96,D$98,D$100,D$102,D$104,D$106,D$108,D$110,D$112,D$114,D$116,D$118,D$120,D$122,D$124)) -> 2 | E203: =RANK(E202,(E$6,E$8,E$10,E$12,E$14,E$16,E$18,E$20,E$22,E$24,E$26,E$28,E$30,E$32,E$34,E$36,E$38,E$40,E$42,E$44,E$46,E$48,E$50,E$52,E$54,E$56,E$58,E$60,E$62,E$64,E$66,E$68,E$70,E$72,E$74,E$76,E$78,E$80,E$82,E$84,E$86,E$88,E$90,E$92,E$94,E$96,E$98,E$100,E$102,E$104,E$106,E$108,E$110,E$112,E$114,E$116,E$118,E$120,E$122,E$124)) -> 2 | F203: =RANK(F202,(F$6,F$8,F$10,F$12,F$14,F$16,F$18,F$20,F$22,F$24,F$26,F$28,F$30,F$32,F$34,F$36,F$38,F$40,F$42,F$44,F$46,F$48,F$50,F$52,F$54,F$56,F$58,F$60,F$62,F$64,F$66,F$68,F$70,F$72,F$74,F$76,F$78,F$80,F$82,F$84,F$86,F$88,F$90,F$92,F$94,F$96,F$98,F$100,F$102,F$104,F$106,F$108,F$110,F$112,F$114,F$116,F$118,F$120,F$122,F$124)) -> 2 | G203: =RANK(G202,(G$6,G$8,G$10,G$12,G$14,G$16,G$18,G$20,G$22,G$24,G$26,G$28,G$30,G$32,G$34,G$36,G$38,G$40,G$42,G$44,G$46,G$48,G$50,G$52,G$54,G$56,G$58,G$60,G$62,G$64,G$66,G$68,G$70,G$72,G$74,G$76,G$78,G$80,G$82,G$84,G$86,G$88,G$90,G$92,G$94,G$96,G$98,G$100,G$102,G$104,G$106,G$108,G$110,G$112,G$114,G$116,G$118,G$120,G$122,G$124)) -> 2 | H203: =RANK(H202,(H$6,H$8,H$10,H$12,H$14,H$16,H$18,H$20,H$22,H$24,H$26,H$28,H$30,H$32,H$34,H$36,H$38,H$40,H$42,H$44,H$46,H$48,H$50,H$52,H$54,H$56,H$58,H$60,H$62,H$64,H$66,H$68,H$70,H$72,H$74,H$76,H$78,H$80,H$82,H$84,H$86,H$88,H$90,H$92,H$94,H$96,H$98,H$100,H$102,H$104,H$106,H$108,H$110,H$112,H$114,H$116,H$118,H$120,H$122,H$124)) -> 2 | I203: =RANK(I202,(I$6,I$8,I$10,I$12,I$14,I$16,I$18,I$20,I$22,I$24,I$26,I$28,I$30,I$32,I$34,I$36,I$38,I$40,I$42,I$44,I$46,I$48,I$50,I$52,I$54,I$56,I$58,I$60,I$62,I$64,I$66,I$68,I$70,I$72,I$74,I$76,I$78,I$80,I$82,I$84,I$86,I$88,I$90,I$92,I$94,I$96,I$98,I$100,I$102,I$104,I$106,I$108,I$110,I$112,I$114,I$116,I$118,I$120,I$122,I$124)) -> 2 | J203: =RANK(J202,(J$6,J$8,J$10,J$12,J$14,J$16,J$18,J$20,J$22,J$24,J$26,J$28,J$30,J$32,J$34,J$36,J$38,J$40,J$42,J$44,J$46,J$48,J$50,J$52,J$54,J$56,J$58,J$60,J$62,J$64,J$66,J$68,J$70,J$72,J$74,J$76,J$78,J$80,J$82,J$84,J$86,J$88,J$90,J$92,J$94,J$96,J$98,J$100,J$102,J$104,J$106,J$108,J$110,J$112,J$114,J$116,J$118,J$120,J$122,J$124)) -> 2 | K203: =RANK(K202,(K$6,K$8,K$10,K$12,K$14,K$16,K$18,K$20,K$22,K$24,K$26,K$28,K$30,K$32,K$34,K$36,K$38,K$40,K$42,K$44,K$46,K$48,K$50,K$52,K$54,K$56,K$58,K$60,K$62,K$64,K$66,K$68,K$70,K$72,K$74,K$76,K$78,K$80,K$82,K$84,K$86,K$88,K$90,K$92,K$94,K$96,K$98,K$100,K$102,K$104,K$106,K$108,K$110,K$112,K$114,K$116,K$118,K$120,K$122,K$124)) -> 3 | L203: =RANK(L202,(L$6,L$8,L$10,L$12,L$14,L$16,L$18,L$20,L$22,L$24,L$26,L$28,L$30,L$32,L$34,L$36,L$38,L$40,L$42,L$44,L$46,L$48,L$50,L$52,L$54,L$56,L$58,L$60,L$62,L$64,L$66,L$68,L$70,L$72,L$74,L$76,L$78,L$80,L$82,L$84,L$86,L$88,L$90,L$92,L$94,L$96,L$98,L$100,L$102,L$104,L$106,L$108,L$110,L$112,L$114,L$116,L$118,L$120,L$122,L$124)) -> 2 | M203: =RANK(M202,(M$6,M$8,M$10,M$12,M$14,M$16,M$18,M$20,M$22,M$24,M$26,M$28,M$30,M$32,M$34,M$36,M$38,M$40,M$42,M$44,M$46,M$48,M$50,M$52,M$54,M$56,M$58,M$60,M$62,M$64,M$66,M$68,M$70,M$72,M$74,M$76,M$78,M$80,M$82,M$84,M$86,M$88,M$90,M$92,M$94,M$96,M$98,M$100,M$102,M$104,M$106,M$108,M$110,M$112,M$114,M$116,M$118,M$120,M$122,M$124)) -> 2 | N203: =RANK(N202,(N$6,N$8,N$10,N$12,N$14,N$16,N$18,N$20,N$22,N$24,N$26,N$28,N$30,N$32,N$34,N$36,N$38,N$40,N$42,N$44,N$46,N$48,N$50,N$52,N$54,N$56,N$58,N$60,N$62,N$64,N$66,N$68,N$70,N$72,N$74,N$76,N$78,N$80,N$82,N$84,N$86,N$88,N$90,N$92,N$94,N$96,N$98,N$100,N$102,N$104,N$106,N$108,N$110,N$112,N$114,N$116,N$118,N$120,N$122,N$124)) -> 2 | P203: =RANK(P202,(P$6,P$8,P$10,P$12,P$14,P$16,P$18,P$20,P$22,P$24,P$26,P$28,P$30,P$32,P$34,P$36,P$38,P$40,P$42,P$44,P$46,P$48,P$50,P$52,P$54,P$56,P$58,P$60,P$62,P$64,P$66,P$68,P$70,P$72,P$74,P$76,P$78,P$80,P$82,P$84,P$86,P$88,P$90,P$92,P$94,P$96,P$98,P$100,P$102,P$104,P$106,P$108,P$110,P$112,P$114,P$116,P$118,P$120,P$122,P$124)) -> 2
A204: Cadets | B204: 7 | C204: 18.10 | D204: 17.80 | E204: 35.90 | F204: 18.00 | G204: 18.30 | H204: 18.00 | I204: 27.15 | J204: 18.20 | K204: 18.40 | L204: 18.20 | M204: 27.40 | N204: 90.45 | O204: 0.0 | P204: 90.45
C205: =RANK(C204,(C$6,C$8,C$10,C$12,C$14,C$16,C$18,C$20,C$22,C$24,C$26,C$28,C$30,C$32,C$34,C$36,C$38,C$40,C$42,C$44,C$46,C$48,C$50,C$52,C$54,C$56,C$58,C$60,C$62,C$64,C$66,C$68,C$70,C$72,C$74,C$76,C$78,C$80,C$82,C$84,C$86,C$88,C$90,C$92,C$94,C$96,C$98,C$100,C$102,C$104,C$106,C$108,C$110,C$112,C$114,C$116,C$118,C$120,C$122,C$124)) -> 3 | D205: =RANK(D204,(D$6,D$8,D$10,D$12,D$14,D$16,D$18,D$20,D$22,D$24,D$26,D$28,D$30,D$32,D$34,D$36,D$38,D$40,D$42,D$44,D$46,D$48,D$50,D$52,D$54,D$56,D$58,D$60,D$62,D$64,D$66,D$68,D$70,D$72,D$74,D$76,D$78,D$80,D$82,D$84,D$86,D$88,D$90,D$92,D$94,D$96,D$98,D$100,D$102,D$104,D$106,D$108,D$110,D$112,D$114,D$116,D$118,D$120,D$122,D$124)) -> 3 | E205: =RANK(E204,(E$6,E$8,E$10,E$12,E$14,E$16,E$18,E$20,E$22,E$24,E$26,E$28,E$30,E$32,E$34,E$36,E$38,E$40,E$42,E$44,E$46,E$48,E$50,E$52,E$54,E$56,E$58,E$60,E$62,E$64,E$66,E$68,E$70,E$72,E$74,E$76,E$78,E$80,E$82,E$84,E$86,E$88,E$90,E$92,E$94,E$96,E$98,E$100,E$102,E$104,E$106,E$108,E$110,E$112,E$114,E$116,E$118,E$120,E$122,E$124)) -> 3 | F205: =RANK(F204,(F$6,F$8,F$10,F$12,F$14,F$16,F$18,F$20,F$22,F$24,F$26,F$28,F$30,F$32,F$34,F$36,F$38,F$40,F$42,F$44,F$46,F$48,F$50,F$52,F$54,F$56,F$58,F$60,F$62,F$64,F$66,F$68,F$70,F$72,F$74,F$76,F$78,F$80,F$82,F$84,F$86,F$88,F$90,F$92,F$94,F$96,F$98,F$100,F$102,F$104,F$106,F$108,F$110,F$112,F$114,F$116,F$118,F$120,F$122,F$124)) -> 3 | G205: =RANK(G204,(G$6,G$8,G$10,G$12,G$14,G$16,G$18,G$20,G$22,G$24,G$26,G$28,G$30,G$32,G$34,G$36,G$38,G$40,G$42,G$44,G$46,G$48,G$50,G$52,G$54,G$56,G$58,G$60,G$62,G$64,G$66,G$68,G$70,G$72,G$74,G$76,G$78,G$80,G$82,G$84,G$86,G$88,G$90,G$92,G$94,G$96,G$98,G$100,G$102,G$104,G$106,G$108,G$110,G$112,G$114,G$116,G$118,G$120,G$122,G$124)) -> 3 | H205: =RANK(H204,(H$6,H$8,H$10,H$12,H$14,H$16,H$18,H$20,H$22,H$24,H$26,H$28,H$30,H$32,H$34,H$36,H$38,H$40,H$42,H$44,H$46,H$48,H$50,H$52,H$54,H$56,H$58,H$60,H$62,H$64,H$66,H$68,H$70,H$72,H$74,H$76,H$78,H$80,H$82,H$84,H$86,H$88,H$90,H$92,H$94,H$96,H$98,H$100,H$102,H$104,H$106,H$108,H$110,H$112,H$114,H$116,H$118,H$120,H$122,H$124)) -> 3 | I205: =RANK(I204,(I$6,I$8,I$10,I$12,I$14,I$16,I$18,I$20,I$22,I$24,I$26,I$28,I$30,I$32,I$34,I$36,I$38,I$40,I$42,I$44,I$46,I$48,I$50,I$52,I$54,I$56,I$58,I$60,I$62,I$64,I$66,I$68,I$70,I$72,I$74,I$76,I$78,I$80,I$82,I$84,I$86,I$88,I$90,I$92,I$94,I$96,I$98,I$100,I$102,I$104,I$106,I$108,I$110,I$112,I$114,I$116,I$118,I$120,I$122,I$124)) -> 3 | J205: =RANK(J204,(J$6,J$8,J$10,J$12,J$14,J$16,J$18,J$20,J$22,J$24,J$26,J$28,J$30,J$32,J$34,J$36,J$38,J$40,J$42,J$44,J$46,J$48,J$50,J$52,J$54,J$56,J$58,J$60,J$62,J$64,J$66,J$68,J$70,J$72,J$74,J$76,J$78,J$80,J$82,J$84,J$86,J$88,J$90,J$92,J$94,J$96,J$98,J$100,J$102,J$104,J$106,J$108,J$110,J$112,J$114,J$116,J$118,J$120,J$122,J$124)) -> 3 | K205: =RANK(K204,(K$6,K$8,K$10,K$12,K$14,K$16,K$18,K$20,K$22,K$24,K$26,K$28,K$30,K$32,K$34,K$36,K$38,K$40,K$42,K$44,K$46,K$48,K$50,K$52,K$54,K$56,K$58,K$60,K$62,K$64,K$66,K$68,K$70,K$72,K$74,K$76,K$78,K$80,K$82,K$84,K$86,K$88,K$90,K$92,K$94,K$96,K$98,K$100,K$102,K$104,K$106,K$108,K$110,K$112,K$114,K$116,K$118,K$120,K$122,K$124)) -> 2 | L205: =RANK(L204,(L$6,L$8,L$10,L$12,L$14,L$16,L$18,L$20,L$22,L$24,L$26,L$28,L$30,L$32,L$34,L$36,L$38,L$40,L$42,L$44,L$46,L$48,L$50,L$52,L$54,L$56,L$58,L$60,L$62,L$64,L$66,L$68,L$70,L$72,L$74,L$76,L$78,L$80,L$82,L$84,L$86,L$88,L$90,L$92,L$94,L$96,L$98,L$100,L$102,L$104,L$106,L$108,L$110,L$112,L$114,L$116,L$118,L$120,L$122,L$124)) -> 3 | M205: =RANK(M204,(M$6,M$8,M$10,M$12,M$14,M$16,M$18,M$20,M$22,M$24,M$26,M$28,M$30,M$32,M$34,M$36,M$38,M$40,M$42,M$44,M$46,M$48,M$50,M$52,M$54,M$56,M$58,M$60,M$62,M$64,M$66,M$68,M$70,M$72,M$74,M$76,M$78,M$80,M$82,M$84,M$86,M$88,M$90,M$92,M$94,M$96,M$98,M$100,M$102,M$104,M$106,M$108,M$110,M$112,M$114,M$116,M$118,M$120,M$122,M$124)) -> 3 | N205: =RANK(N204,(N$6,N$8,N$10,N$12,N$14,N$16,N$18,N$20,N$22,N$24,N$26,N$28,N$30,N$32,N$34,N$36,N$38,N$40,N$42,N$44,N$46,N$48,N$50,N$52,N$54,N$56,N$58,N$60,N$62,N$64,N$66,N$68,N$70,N$72,N$74,N$76,N$78,N$80,N$82,N$84,N$86,N$88,N$90,N$92,N$94,N$96,N$98,N$100,N$102,N$104,N$106,N$108,N$110,N$112,N$114,N$116,N$118,N$120,N$122,N$124)) -> 3 | P205: =RANK(P204,(P$6,P$8,P$10,P$12,P$14,P$16,P$18,P$20,P$22,P$24,P$26,P$28,P$30,P$32,P$34,P$36,P$38,P$40,P$42,P$44,P$46,P$48,P$50,P$52,P$54,P$56,P$58,P$60,P$62,P$64,P$66,P$68,P$70,P$72,P$74,P$76,P$78,P$80,P$82,P$84,P$86,P$88,P$90,P$92,P$94,P$96,P$98,P$100,P$102,P$104,P$106,P$108,P$110,P$112,P$114,P$116,P$118,P$120,P$122,P$124)) -> 3
A206: Blue | B206: 5 | C206: 16.90 | D206: 17.10 | E206: 34.00 | F206: 16.50 | G206: 17.00 | H206: 16.40 | I206: 24.95 | J206: 17.00 | K206: 17.60 | L206: 16.80 | M206: 25.70 | N206: 84.65 | O206: 0.0 | P206: 84.65
A207: Knights | C207: =RANK(C206,(C$6,C$8,C$10,C$12,C$14,C$16,C$18,C$20,C$22,C$24,C$26,C$28,C$30,C$32,C$34,C$36,C$38,C$40,C$42,C$44,C$46,C$48,C$50,C$52,C$54,C$56,C$58,C$60,C$62,C$64,C$66,C$68,C$70,C$72,C$74,C$76,C$78,C$80,C$82,C$84,C$86,C$88,C$90,C$92,C$94,C$96,C$98,C$100,C$102,C$104,C$106,C$108,C$110,C$112,C$114,C$116,C$118,C$120,C$122,C$124)) -> 4 | D207: =RANK(D206,(D$6,D$8,D$10,D$12,D$14,D$16,D$18,D$20,D$22,D$24,D$26,D$28,D$30,D$32,D$34,D$36,D$38,D$40,D$42,D$44,D$46,D$48,D$50,D$52,D$54,D$56,D$58,D$60,D$62,D$64,D$66,D$68,D$70,D$72,D$74,D$76,D$78,D$80,D$82,D$84,D$86,D$88,D$90,D$92,D$94,D$96,D$98,D$100,D$102,D$104,D$106,D$108,D$110,D$112,D$114,D$116,D$118,D$120,D$122,D$124)) -> 4 | E207: =RANK(E206,(E$6,E$8,E$10,E$12,E$14,E$16,E$18,E$20,E$22,E$24,E$26,E$28,E$30,E$32,E$34,E$36,E$38,E$40,E$42,E$44,E$46,E$48,E$50,E$52,E$54,E$56,E$58,E$60,E$62,E$64,E$66,E$68,E$70,E$72,E$74,E$76,E$78,E$80,E$82,E$84,E$86,E$88,E$90,E$92,E$94,E$96,E$98,E$100,E$102,E$104,E$106,E$108,E$110,E$112,E$114,E$116,E$118,E$120,E$122,E$124)) -> 4 | F207: =RANK(F206,(F$6,F$8,F$10,F$12,F$14,F$16,F$18,F$20,F$22,F$24,F$26,F$28,F$30,F$32,F$34,F$36,F$38,F$40,F$42,F$44,F$46,F$48,F$50,F$52,F$54,F$56,F$58,F$60,F$62,F$64,F$66,F$68,F$70,F$72,F$74,F$76,F$78,F$80,F$82,F$84,F$86,F$88,F$90,F$92,F$94,F$96,F$98,F$100,F$102,F$104,F$106,F$108,F$110,F$112,F$114,F$116,F$118,F$120,F$122,F$124)) -> 5 | G207: =RANK(G206,(G$6,G$8,G$10,G$12,G$14,G$16,G$18,G$20,G$22,G$24,G$26,G$28,G$30,G$32,G$34,G$36,G$38,G$40,G$42,G$44,G$46,G$48,G$50,G$52,G$54,G$56,G$58,G$60,G$62,G$64,G$66,G$68,G$70,G$72,G$74,G$76,G$78,G$80,G$82,G$84,G$86,G$88,G$90,G$92,G$94,G$96,G$98,G$100,G$102,G$104,G$106,G$108,G$110,G$112,G$114,G$116,G$118,G$120,G$122,G$124)) -> 4 | H207: =RANK(H206,(H$6,H$8,H$10,H$12,H$14,H$16,H$18,H$20,H$22,H$24,H$26,H$28,H$30,H$32,H$34,H$36,H$38,H$40,H$42,H$44,H$46,H$48,H$50,H$52,H$54,H$56,H$58,H$60,H$62,H$64,H$66,H$68,H$70,H$72,H$74,H$76,H$78,H$80,H$82,H$84,H$86,H$88,H$90,H$92,H$94,H$96,H$98,H$100,H$102,H$104,H$106,H$108,H$110,H$112,H$114,H$116,H$118,H$120,H$122,H$124)) -> 5 | I207: =RANK(I206,(I$6,I$8,I$10,I$12,I$14,I$16,I$18,I$20,I$22,I$24,I$26,I$28,I$30,I$32,I$34,I$36,I$38,I$40,I$42,I$44,I$46,I$48,I$50,I$52,I$54,I$56,I$58,I$60,I$62,I$64,I$66,I$68,I$70,I$72,I$74,I$76,I$78,I$80,I$82,I$84,I$86,I$88,I$90,I$92,I$94,I$96,I$98,I$100,I$102,I$104,I$106,I$108,I$110,I$112,I$114,I$116,I$118,I$120,I$122,I$124)) -> 5 | J207: =RANK(J206,(J$6,J$8,J$10,J$12,J$14,J$16,J$18,J$20,J$22,J$24,J$26,J$28,J$30,J$32,J$34,J$36,J$38,J$40,J$42,J$44,J$46,J$48,J$50,J$52,J$54,J$56,J$58,J$60,J$62,J$64,J$66,J$68,J$70,J$72,J$74,J$76,J$78,J$80,J$82,J$84,J$86,J$88,J$90,J$92,J$94,J$96,J$98,J$100,J$102,J$104,J$106,J$108,J$110,J$112,J$114,J$116,J$118,J$120,J$122,J$124)) -> 4 | K207: =RANK(K206,(K$6,K$8,K$10,K$12,K$14,K$16,K$18,K$20,K$22,K$24,K$26,K$28,K$30,K$32,K$34,K$36,K$38,K$40,K$42,K$44,K$46,K$48,K$50,K$52,K$54,K$56,K$58,K$60,K$62,K$64,K$66,K$68,K$70,K$72,K$74,K$76,K$78,K$80,K$82,K$84,K$86,K$88,K$90,K$92,K$94,K$96,K$98,K$100,K$102,K$104,K$106,K$108,K$110,K$112,K$114,K$116,K$118,K$120,K$122,K$124)) -> 4 | L207: =RANK(L206,(L$6,L$8,L$10,L$12,L$14,L$16,L$18,L$20,L$22,L$24,L$26,L$28,L$30,L$32,L$34,L$36,L$38,L$40,L$42,L$44,L$46,L$48,L$50,L$52,L$54,L$56,L$58,L$60,L$62,L$64,L$66,L$68,L$70,L$72,L$74,L$76,L$78,L$80,L$82,L$84,L$86,L$88,L$90,L$92,L$94,L$96,L$98,L$100,L$102,L$104,L$106,L$108,L$110,L$112,L$114,L$116,L$118,L$120,L$122,L$124)) -> 6 | M207: =RANK(M206,(M$6,M$8,M$10,M$12,M$14,M$16,M$18,M$20,M$22,M$24,M$26,M$28,M$30,M$32,M$34,M$36,M$38,M$40,M$42,M$44,M$46,M$48,M$50,M$52,M$54,M$56,M$58,M$60,M$62,M$64,M$66,M$68,M$70,M$72,M$74,M$76,M$78,M$80,M$82,M$84,M$86,M$88,M$90,M$92,M$94,M$96,M$98,M$100,M$102,M$104,M$106,M$108,M$110,M$112,M$114,M$116,M$118,M$120,M$122,M$124)) -> 4 | N207: =RANK(N206,(N$6,N$8,N$10,N$12,N$14,N$16,N$18,N$20,N$22,N$24,N$26,N$28,N$30,N$32,N$34,N$36,N$38,N$40,N$42,N$44,N$46,N$48,N$50,N$52,N$54,N$56,N$58,N$60,N$62,N$64,N$66,N$68,N$70,N$72,N$74,N$76,N$78,N$80,N$82,N$84,N$86,N$88,N$90,N$92,N$94,N$96,N$98,N$100,N$102,N$104,N$106,N$108,N$110,N$112,N$114,N$116,N$118,N$120,N$122,N$124)) -> 4 | P207: =RANK(P206,(P$6,P$8,P$10,P$12,P$14,P$16,P$18,P$20,P$22,P$24,P$26,P$28,P$30,P$32,P$34,P$36,P$38,P$40,P$42,P$44,P$46,P$48,P$50,P$52,P$54,P$56,P$58,P$60,P$62,P$64,P$66,P$68,P$70,P$72,P$74,P$76,P$78,P$80,P$82,P$84,P$86,P$88,P$90,P$92,P$94,P$96,P$98,P$100,P$102,P$104,P$106,P$108,P$110,P$112,P$114,P$116,P$118,P$120,P$122,P$124)) -> 4
A208: Crossmen | B208: 4 | C208: 16.50 | D208: 16.80 | E208: 33.30 | F208: 16.90 | G208: 16.50 | H208: 17.00 | I208: 25.20 | J208: 16.80 | K208: 17.20 | L208: 17.30 | M208: 25.65 | N208: 84.15 | O208: 0.0 | P208: 84.15
C209: =RANK(C208,(C$6,C$8,C$10,C$12,C$14,C$16,C$18,C$20,C$22,C$24,C$26,C$28,C$30,C$32,C$34,C$36,C$38,C$40,C$42,C$44,C$46,C$48,C$50,C$52,C$54,C$56,C$58,C$60,C$62,C$64,C$66,C$68,C$70,C$72,C$74,C$76,C$78,C$80,C$82,C$84,C$86,C$88,C$90,C$92,C$94,C$96,C$98,C$100,C$102,C$104,C$106,C$108,C$110,C$112,C$114,C$116,C$118,C$120,C$122,C$124)) -> 5 | D209: =RANK(D208,(D$6,D$8,D$10,D$12,D$14,D$16,D$18,D$20,D$22,D$24,D$26,D$28,D$30,D$32,D$34,D$36,D$38,D$40,D$42,D$44,D$46,D$48,D$50,D$52,D$54,D$56,D$58,D$60,D$62,D$64,D$66,D$68,D$70,D$72,D$74,D$76,D$78,D$80,D$82,D$84,D$86,D$88,D$90,D$92,D$94,D$96,D$98,D$100,D$102,D$104,D$106,D$108,D$110,D$112,D$114,D$116,D$118,D$120,D$122,D$124)) -> 5 | E209: =RANK(E208,(E$6,E$8,E$10,E$12,E$14,E$16,E$18,E$20,E$22,E$24,E$26,E$28,E$30,E$32,E$34,E$36,E$38,E$40,E$42,E$44,E$46,E$48,E$50,E$52,E$54,E$56,E$58,E$60,E$62,E$64,E$66,E$68,E$70,E$72,E$74,E$76,E$78,E$80,E$82,E$84,E$86,E$88,E$90,E$92,E$94,E$96,E$98,E$100,E$102,E$104,E$106,E$108,E$110,E$112,E$114,E$116,E$118,E$120,E$122,E$124)) -> 5 | F209: =RANK(F208,(F$6,F$8,F$10,F$12,F$14,F$16,F$18,F$20,F$22,F$24,F$26,F$28,F$30,F$32,F$34,F$36,F$38,F$40,F$42,F$44,F$46,F$48,F$50,F$52,F$54,F$56,F$58,F$60,F$62,F$64,F$66,F$68,F$70,F$72,F$74,F$76,F$78,F$80,F$82,F$84,F$86,F$88,F$90,F$92,F$94,F$96,F$98,F$100,F$102,F$104,F$106,F$108,F$110,F$112,F$114,F$116,F$118,F$120,F$122,F$124)) -> 4 | G209: =RANK(G208,(G$6,G$8,G$10,G$12,G$14,G$16,G$18,G$20,G$22,G$24,G$26,G$28,G$30,G$32,G$34,G$36,G$38,G$40,G$42,G$44,G$46,G$48,G$50,G$52,G$54,G$56,G$58,G$60,G$62,G$64,G$66,G$68,G$70,G$72,G$74,G$76,G$78,G$80,G$82,G$84,G$86,G$88,G$90,G$92,G$94,G$96,G$98,G$100,G$102,G$104,G$106,G$108,G$110,G$112,G$114,G$116,G$118,G$120,G$122,G$124)) -> 5 | H209: =RANK(H208,(H$6,H$8,H$10,H$12,H$14,H$16,H$18,H$20,H$22,H$24,H$26,H$28,H$30,H$32,H$34,H$36,H$38,H$40,H$42,H$44,H$46,H$48,H$50,H$52,H$54,H$56,H$58,H$60,H$62,H$64,H$66,H$68,H$70,H$72,H$74,H$76,H$78,H$80,H$82,H$84,H$86,H$88,H$90,H$92,H$94,H$96,H$98,H$100,H$102,H$104,H$106,H$108,H$110,H$112,H$114,H$116,H$118,H$120,H$122,H$124)) -> 4 | I209: =RANK(I208,(I$6,I$8,I$10,I$12,I$14,I$16,I$18,I$20,I$22,I$24,I$26,I$28,I$30,I$32,I$34,I$36,I$38,I$40,I$42,I$44,I$46,I$48,I$50,I$52,I$54,I$56,I$58,I$60,I$62,I$64,I$66,I$68,I$70,I$72,I$74,I$76,I$78,I$80,I$82,I$84,I$86,I$88,I$90,I$92,I$94,I$96,I$98,I$100,I$102,I$104,I$106,I$108,I$110,I$112,I$114,I$116,I$118,I$120,I$122,I$124)) -> 4 | J209: =RANK(J208,(J$6,J$8,J$10,J$12,J$14,J$16,J$18,J$20,J$22,J$24,J$26,J$28,J$30,J$32,J$34,J$36,J$38,J$40,J$42,J$44,J$46,J$48,J$50,J$52,J$54,J$56,J$58,J$60,J$62,J$64,J$66,J$68,J$70,J$72,J$74,J$76,J$78,J$80,J$82,J$84,J$86,J$88,J$90,J$92,J$94,J$96,J$98,J$100,J$102,J$104,J$106,J$108,J$110,J$112,J$114,J$116,J$118,J$120,J$122,J$124)) -> 5 | K209: =RANK(K208,(K$6,K$8,K$10,K$12,K$14,K$16,K$18,K$20,K$22,K$24,K$26,K$28,K$30,K$32,K$34,K$36,K$38,K$40,K$42,K$44,K$46,K$48,K$50,K$52,K$54,K$56,K$58,K$60,K$62,K$64,K$66,K$68,K$70,K$72,K$74,K$76,K$78,K$80,K$82,K$84,K$86,K$88,K$90,K$92,K$94,K$96,K$98,K$100,K$102,K$104,K$106,K$108,K$110,K$112,K$114,K$116,K$118,K$120,K$122,K$124)) -> 5 | L209: =RANK(L208,(L$6,L$8,L$10,L$12,L$14,L$16,L$18,L$20,L$22,L$24,L$26,L$28,L$30,L$32,L$34,L$36,L$38,L$40,L$42,L$44,L$46,L$48,L$50,L$52,L$54,L$56,L$58,L$60,L$62,L$64,L$66,L$68,L$70,L$72,L$74,L$76,L$78,L$80,L$82,L$84,L$86,L$88,L$90,L$92,L$94,L$96,L$98,L$100,L$102,L$104,L$106,L$108,L$110,L$112,L$114,L$116,L$118,L$120,L$122,L$124)) -> 4 | M209: =RANK(M208,(M$6,M$8,M$10,M$12,M$14,M$16,M$18,M$20,M$22,M$24,M$26,M$28,M$30,M$32,M$34,M$36,M$38,M$40,M$42,M$44,M$46,M$48,M$50,M$52,M$54,M$56,M$58,M$60,M$62,M$64,M$66,M$68,M$70,M$72,M$74,M$76,M$78,M$80,M$82,M$84,M$86,M$88,M$90,M$92,M$94,M$96,M$98,M$100,M$102,M$104,M$106,M$108,M$110,M$112,M$114,M$116,M$118,M$120,M$122,M$124)) -> 5 | N209: =RANK(N208,(N$6,N$8,N$10,N$12,N$14,N$16,N$18,N$20,N$22,N$24,N$26,N$28,N$30,N$32,N$34,N$36,N$38,N$40,N$42,N$44,N$46,N$48,N$50,N$52,N$54,N$56,N$58,N$60,N$62,N$64,N$66,N$68,N$70,N$72,N$74,N$76,N$78,N$80,N$82,N$84,N$86,N$88,N$90,N$92,N$94,N$96,N$98,N$100,N$102,N$104,N$106,N$108,N$110,N$112,N$114,N$116,N$118,N$120,N$122,N$124)) -> 5 | P209: =RANK(P208,(P$6,P$8,P$10,P$12,P$14,P$16,P$18,P$20,P$22,P$24,P$26,P$28,P$30,P$32,P$34,P$36,P$38,P$40,P$42,P$44,P$46,P$48,P$50,P$52,P$54,P$56,P$58,P$60,P$62,P$64,P$66,P$68,P$70,P$72,P$74,P$76,P$78,P$80,P$82,P$84,P$86,P$88,P$90,P$92,P$94,P$96,P$98,P$100,P$102,P$104,P$106,P$108,P$110,P$112,P$114,P$116,P$118,P$120,P$122,P$124)) -> 5
A210: Troopers | B210: 3 | C210: 16.10 | D210: 16.10 | E210: 32.20 | F210: 16.40 | G210: 16.00 | H210: 15.30 | I210: 23.85 | J210: 16.20 | K210: 16.50 | L210: 17.00 | M210: 24.85 | N210: 80.90 | O210: 0.0 | P210: 80.90
C211: =RANK(C210,(C$6,C$8,C$10,C$12,C$14,C$16,C$18,C$20,C$22,C$24,C$26,C$28,C$30,C$32,C$34,C$36,C$38,C$40,C$42,C$44,C$46,C$48,C$50,C$52,C$54,C$56,C$58,C$60,C$62,C$64,C$66,C$68,C$70,C$72,C$74,C$76,C$78,C$80,C$82,C$84,C$86,C$88,C$90,C$92,C$94,C$96,C$98,C$100,C$102,C$104,C$106,C$108,C$110,C$112,C$114,C$116,C$118,C$120,C$122,C$124)) -> 6 | D211: =RANK(D210,(D$6,D$8,D$10,D$12,D$14,D$16,D$18,D$20,D$22,D$24,D$26,D$28,D$30,D$32,D$34,D$36,D$38,D$40,D$42,D$44,D$46,D$48,D$50,D$52,D$54,D$56,D$58,D$60,D$62,D$64,D$66,D$68,D$70,D$72,D$74,D$76,D$78,D$80,D$82,D$84,D$86,D$88,D$90,D$92,D$94,D$96,D$98,D$100,D$102,D$104,D$106,D$108,D$110,D$112,D$114,D$116,D$118,D$120,D$122,D$124)) -> 6 | E211: =RANK(E210,(E$6,E$8,E$10,E$12,E$14,E$16,E$18,E$20,E$22,E$24,E$26,E$28,E$30,E$32,E$34,E$36,E$38,E$40,E$42,E$44,E$46,E$48,E$50,E$52,E$54,E$56,E$58,E$60,E$62,E$64,E$66,E$68,E$70,E$72,E$74,E$76,E$78,E$80,E$82,E$84,E$86,E$88,E$90,E$92,E$94,E$96,E$98,E$100,E$102,E$104,E$106,E$108,E$110,E$112,E$114,E$116,E$118,E$120,E$122,E$124)) -> 6 | F211: =RANK(F210,(F$6,F$8,F$10,F$12,F$14,F$16,F$18,F$20,F$22,F$24,F$26,F$28,F$30,F$32,F$34,F$36,F$38,F$40,F$42,F$44,F$46,F$48,F$50,F$52,F$54,F$56,F$58,F$60,F$62,F$64,F$66,F$68,F$70,F$72,F$74,F$76,F$78,F$80,F$82,F$84,F$86,F$88,F$90,F$92,F$94,F$96,F$98,F$100,F$102,F$104,F$106,F$108,F$110,F$112,F$114,F$116,F$118,F$120,F$122,F$124)) -> 6 | G211: =RANK(G210,(G$6,G$8,G$10,G$12,G$14,G$16,G$18,G$20,G$22,G$24,G$26,G$28,G$30,G$32,G$34,G$36,G$38,G$40,G$42,G$44,G$46,G$48,G$50,G$52,G$54,G$56,G$58,G$60,G$62,G$64,G$66,G$68,G$70,G$72,G$74,G$76,G$78,G$80,G$82,G$84,G$86,G$88,G$90,G$92,G$94,G$96,G$98,G$100,G$102,G$104,G$106,G$108,G$110,G$112,G$114,G$116,G$118,G$120,G$122,G$124)) -> 6 | H211: =RANK(H210,(H$6,H$8,H$10,H$12,H$14,H$16,H$18,H$20,H$22,H$24,H$26,H$28,H$30,H$32,H$34,H$36,H$38,H$40,H$42,H$44,H$46,H$48,H$50,H$52,H$54,H$56,H$58,H$60,H$62,H$64,H$66,H$68,H$70,H$72,H$74,H$76,H$78,H$80,H$82,H$84,H$86,H$88,H$90,H$92,H$94,H$96,H$98,H$100,H$102,H$104,H$106,H$108,H$110,H$112,H$114,H$116,H$118,H$120,H$122,H$124)) -> 6 | I211: =RANK(I210,(I$6,I$8,I$10,I$12,I$14,I$16,I$18,I$20,I$22,I$24,I$26,I$28,I$30,I$32,I$34,I$36,I$38,I$40,I$42,I$44,I$46,I$48,I$50,I$52,I$54,I$56,I$58,I$60,I$62,I$64,I$66,I$68,I$70,I$72,I$74,I$76,I$78,I$80,I$82,I$84,I$86,I$88,I$90,I$92,I$94,I$96,I$98,I$100,I$102,I$104,I$106,I$108,I$110,I$112,I$114,I$116,I$118,I$120,I$122,I$124)) -> 6 | J211: =RANK(J210,(J$6,J$8,J$10,J$12,J$14,J$16,J$18,J$20,J$22,J$24,J$26,J$28,J$30,J$32,J$34,J$36,J$38,J$40,J$42,J$44,J$46,J$48,J$50,J$52,J$54,J$56,J$58,J$60,J$62,J$64,J$66,J$68,J$70,J$72,J$74,J$76,J$78,J$80,J$82,J$84,J$86,J$88,J$90,J$92,J$94,J$96,J$98,J$100,J$102,J$104,J$106,J$108,J$110,J$112,J$114,J$116,J$118,J$120,J$122,J$124)) -> 6 | K211: =RANK(K210,(K$6,K$8,K$10,K$12,K$14,K$16,K$18,K$20,K$22,K$24,K$26,K$28,K$30,K$32,K$34,K$36,K$38,K$40,K$42,K$44,K$46,K$48,K$50,K$52,K$54,K$56,K$58,K$60,K$62,K$64,K$66,K$68,K$70,K$72,K$74,K$76,K$78,K$80,K$82,K$84,K$86,K$88,K$90,K$92,K$94,K$96,K$98,K$100,K$102,K$104,K$106,K$108,K$110,K$112,K$114,K$116,K$118,K$120,K$122,K$124)) -> 6 | L211: =RANK(L210,(L$6,L$8,L$10,L$12,L$14,L$16,L$18,L$20,L$22,L$24,L$26,L$28,L$30,L$32,L$34,L$36,L$38,L$40,L$42,L$44,L$46,L$48,L$50,L$52,L$54,L$56,L$58,L$60,L$62,L$64,L$66,L$68,L$70,L$72,L$74,L$76,L$78,L$80,L$82,L$84,L$86,L$88,L$90,L$92,L$94,L$96,L$98,L$100,L$102,L$104,L$106,L$108,L$110,L$112,L$114,L$116,L$118,L$120,L$122,L$124)) -> 5 | M211: =RANK(M210,(M$6,M$8,M$10,M$12,M$14,M$16,M$18,M$20,M$22,M$24,M$26,M$28,M$30,M$32,M$34,M$36,M$38,M$40,M$42,M$44,M$46,M$48,M$50,M$52,M$54,M$56,M$58,M$60,M$62,M$64,M$66,M$68,M$70,M$72,M$74,M$76,M$78,M$80,M$82,M$84,M$86,M$88,M$90,M$92,M$94,M$96,M$98,M$100,M$102,M$104,M$106,M$108,M$110,M$112,M$114,M$116,M$118,M$120,M$122,M$124)) -> 6 | N211: =RANK(N210,(N$6,N$8,N$10,N$12,N$14,N$16,N$18,N$20,N$22,N$24,N$26,N$28,N$30,N$32,N$34,N$36,N$38,N$40,N$42,N$44,N$46,N$48,N$50,N$52,N$54,N$56,N$58,N$60,N$62,N$64,N$66,N$68,N$70,N$72,N$74,N$76,N$78,N$80,N$82,N$84,N$86,N$88,N$90,N$92,N$94,N$96,N$98,N$100,N$102,N$104,N$106,N$108,N$110,N$112,N$114,N$116,N$118,N$120,N$122,N$124)) -> 6 | P211: =RANK(P210,(P$6,P$8,P$10,P$12,P$14,P$16,P$18,P$20,P$22,P$24,P$26,P$28,P$30,P$32,P$34,P$36,P$38,P$40,P$42,P$44,P$46,P$48,P$50,P$52,P$54,P$56,P$58,P$60,P$62,P$64,P$66,P$68,P$70,P$72,P$74,P$76,P$78,P$80,P$82,P$84,P$86,P$88,P$90,P$92,P$94,P$96,P$98,P$100,P$102,P$104,P$106,P$108,P$110,P$112,P$114,P$116,P$118,P$120,P$122,P$124)) -> 6
A212: Academy | B212: 2 | C212: 15.50 | D212: 15.40 | E212: 30.90 | F212: 15.80 | G212: 15.50 | H212: 14.30 | I212: 22.80 | J212: 16.00 | K212: 15.40 | L212: 14.90 | M212: 23.15 | N212: 76.85 | O212: 0.0 | P212: 76.85
C213: =RANK(C212,(C$6,C$8,C$10,C$12,C$14,C$16,C$18,C$20,C$22,C$24,C$26,C$28,C$30,C$32,C$34,C$36,C$38,C$40,C$42,C$44,C$46,C$48,C$50,C$52,C$54,C$56,C$58,C$60,C$62,C$64,C$66,C$68,C$70,C$72,C$74,C$76,C$78,C$80,C$82,C$84,C$86,C$88,C$90,C$92,C$94,C$96,C$98,C$100,C$102,C$104,C$106,C$108,C$110,C$112,C$114,C$116,C$118,C$120,C$122,C$124)) -> 7 | D213: =RANK(D212,(D$6,D$8,D$10,D$12,D$14,D$16,D$18,D$20,D$22,D$24,D$26,D$28,D$30,D$32,D$34,D$36,D$38,D$40,D$42,D$44,D$46,D$48,D$50,D$52,D$54,D$56,D$58,D$60,D$62,D$64,D$66,D$68,D$70,D$72,D$74,D$76,D$78,D$80,D$82,D$84,D$86,D$88,D$90,D$92,D$94,D$96,D$98,D$100,D$102,D$104,D$106,D$108,D$110,D$112,D$114,D$116,D$118,D$120,D$122,D$124)) -> 7 | E213: =RANK(E212,(E$6,E$8,E$10,E$12,E$14,E$16,E$18,E$20,E$22,E$24,E$26,E$28,E$30,E$32,E$34,E$36,E$38,E$40,E$42,E$44,E$46,E$48,E$50,E$52,E$54,E$56,E$58,E$60,E$62,E$64,E$66,E$68,E$70,E$72,E$74,E$76,E$78,E$80,E$82,E$84,E$86,E$88,E$90,E$92,E$94,E$96,E$98,E$100,E$102,E$104,E$106,E$108,E$110,E$112,E$114,E$116,E$118,E$120,E$122,E$124)) -> 7 | F213: =RANK(F212,(F$6,F$8,F$10,F$12,F$14,F$16,F$18,F$20,F$22,F$24,F$26,F$28,F$30,F$32,F$34,F$36,F$38,F$40,F$42,F$44,F$46,F$48,F$50,F$52,F$54,F$56,F$58,F$60,F$62,F$64,F$66,F$68,F$70,F$72,F$74,F$76,F$78,F$80,F$82,F$84,F$86,F$88,F$90,F$92,F$94,F$96,F$98,F$100,F$102,F$104,F$106,F$108,F$110,F$112,F$114,F$116,F$118,F$120,F$122,F$124)) -> 7 | G213: =RANK(G212,(G$6,G$8,G$10,G$12,G$14,G$16,G$18,G$20,G$22,G$24,G$26,G$28,G$30,G$32,G$34,G$36,G$38,G$40,G$42,G$44,G$46,G$48,G$50,G$52,G$54,G$56,G$58,G$60,G$62,G$64,G$66,G$68,G$70,G$72,G$74,G$76,G$78,G$80,G$82,G$84,G$86,G$88,G$90,G$92,G$94,G$96,G$98,G$100,G$102,G$104,G$106,G$108,G$110,G$112,G$114,G$116,G$118,G$120,G$122,G$124)) -> 7 | H213: =RANK(H212,(H$6,H$8,H$10,H$12,H$14,H$16,H$18,H$20,H$22,H$24,H$26,H$28,H$30,H$32,H$34,H$36,H$38,H$40,H$42,H$44,H$46,H$48,H$50,H$52,H$54,H$56,H$58,H$60,H$62,H$64,H$66,H$68,H$70,H$72,H$74,H$76,H$78,H$80,H$82,H$84,H$86,H$88,H$90,H$92,H$94,H$96,H$98,H$100,H$102,H$104,H$106,H$108,H$110,H$112,H$114,H$116,H$118,H$120,H$122,H$124)) -> 7 | I213: =RANK(I212,(I$6,I$8,I$10,I$12,I$14,I$16,I$18,I$20,I$22,I$24,I$26,I$28,I$30,I$32,I$34,I$36,I$38,I$40,I$42,I$44,I$46,I$48,I$50,I$52,I$54,I$56,I$58,I$60,I$62,I$64,I$66,I$68,I$70,I$72,I$74,I$76,I$78,I$80,I$82,I$84,I$86,I$88,I$90,I$92,I$94,I$96,I$98,I$100,I$102,I$104,I$106,I$108,I$110,I$112,I$114,I$116,I$118,I$120,I$122,I$124)) -> 7 | J213: =RANK(J212,(J$6,J$8,J$10,J$12,J$14,J$16,J$18,J$20,J$22,J$24,J$26,J$28,J$30,J$32,J$34,J$36,J$38,J$40,J$42,J$44,J$46,J$48,J$50,J$52,J$54,J$56,J$58,J$60,J$62,J$64,J$66,J$68,J$70,J$72,J$74,J$76,J$78,J$80,J$82,J$84,J$86,J$88,J$90,J$92,J$94,J$96,J$98,J$100,J$102,J$104,J$106,J$108,J$110,J$112,J$114,J$116,J$118,J$120,J$122,J$124)) -> 7 | K213: =RANK(K212,(K$6,K$8,K$10,K$12,K$14,K$16,K$18,K$20,K$22,K$24,K$26,K$28,K$30,K$32,K$34,K$36,K$38,K$40,K$42,K$44,K$46,K$48,K$50,K$52,K$54,K$56,K$58,K$60,K$62,K$64,K$66,K$68,K$70,K$72,K$74,K$76,K$78,K$80,K$82,K$84,K$86,K$88,K$90,K$92,K$94,K$96,K$98,K$100,K$102,K$104,K$106,K$108,K$110,K$112,K$114,K$116,K$118,K$120,K$122,K$124)) -> 7 | L213: =RANK(L212,(L$6,L$8,L$10,L$12,L$14,L$16,L$18,L$20,L$22,L$24,L$26,L$28,L$30,L$32,L$34,L$36,L$38,L$40,L$42,L$44,L$46,L$48,L$50,L$52,L$54,L$56,L$58,L$60,L$62,L$64,L$66,L$68,L$70,L$72,L$74,L$76,L$78,L$80,L$82,L$84,L$86,L$88,L$90,L$92,L$94,L$96,L$98,L$100,L$102,L$104,L$106,L$108,L$110,L$112,L$114,L$116,L$118,L$120,L$122,L$124)) -> 7 | M213: =RANK(M212,(M$6,M$8,M$10,M$12,M$14,M$16,M$18,M$20,M$22,M$24,M$26,M$28,M$30,M$32,M$34,M$36,M$38,M$40,M$42,M$44,M$46,M$48,M$50,M$52,M$54,M$56,M$58,M$60,M$62,M$64,M$66,M$68,M$70,M$72,M$74,M$76,M$78,M$80,M$82,M$84,M$86,M$88,M$90,M$92,M$94,M$96,M$98,M$100,M$102,M$104,M$106,M$108,M$110,M$112,M$114,M$116,M$118,M$120,M$122,M$124)) -> 7 | N213: =RANK(N212,(N$6,N$8,N$10,N$12,N$14,N$16,N$18,N$20,N$22,N$24,N$26,N$28,N$30,N$32,N$34,N$36,N$38,N$40,N$42,N$44,N$46,N$48,N$50,N$52,N$54,N$56,N$58,N$60,N$62,N$64,N$66,N$68,N$70,N$72,N$74,N$76,N$78,N$80,N$82,N$84,N$86,N$88,N$90,N$92,N$94,N$96,N$98,N$100,N$102,N$104,N$106,N$108,N$110,N$112,N$114,N$116,N$118,N$120,N$122,N$124)) -> 7 | P213: =RANK(P212,(P$6,P$8,P$10,P$12,P$14,P$16,P$18,P$20,P$22,P$24,P$26,P$28,P$30,P$32,P$34,P$36,P$38,P$40,P$42,P$44,P$46,P$48,P$50,P$52,P$54,P$56,P$58,P$60,P$62,P$64,P$66,P$68,P$70,P$72,P$74,P$76,P$78,P$80,P$82,P$84,P$86,P$88,P$90,P$92,P$94,P$96,P$98,P$100,P$102,P$104,P$106,P$108,P$110,P$112,P$114,P$116,P$118,P$120,P$122,P$124)) -> 7
A214: Jersey | B214: 1 | C214: 14.10 | D214: 13.80 | E214: 27.90 | F214: 13.50 | G214: 14.40 | H214: 12.60 | I214: 20.25 | J214: 14.30 | K214: 13.90 | L214: 13.50 | M214: 20.85 | N214: 69.00 | O214: 0.0 | P214: 69.00
A215: Surf | C215: =RANK(C214,(C$6,C$8,C$10,C$12,C$14,C$16,C$18,C$20,C$22,C$24,C$26,C$28,C$30,C$32,C$34,C$36,C$38,C$40,C$42,C$44,C$46,C$48,C$50,C$52,C$54,C$56,C$58,C$60,C$62,C$64,C$66,C$68,C$70,C$72,C$74,C$76,C$78,C$80,C$82,C$84,C$86,C$88,C$90,C$92,C$94,C$96,C$98,C$100,C$102,C$104,C$106,C$108,C$110,C$112,C$114,C$116,C$118,C$120,C$122,C$124)) -> 8 | D215: =RANK(D214,(D$6,D$8,D$10,D$12,D$14,D$16,D$18,D$20,D$22,D$24,D$26,D$28,D$30,D$32,D$34,D$36,D$38,D$40,D$42,D$44,D$46,D$48,D$50,D$52,D$54,D$56,D$58,D$60,D$62,D$64,D$66,D$68,D$70,D$72,D$74,D$76,D$78,D$80,D$82,D$84,D$86,D$88,D$90,D$92,D$94,D$96,D$98,D$100,D$102,D$104,D$106,D$108,D$110,D$112,D$114,D$116,D$118,D$120,D$122,D$124)) -> 8 | E215: =RANK(E214,(E$6,E$8,E$10,E$12,E$14,E$16,E$18,E$20,E$22,E$24,E$26,E$28,E$30,E$32,E$34,E$36,E$38,E$40,E$42,E$44,E$46,E$48,E$50,E$52,E$54,E$56,E$58,E$60,E$62,E$64,E$66,E$68,E$70,E$72,E$74,E$76,E$78,E$80,E$82,E$84,E$86,E$88,E$90,E$92,E$94,E$96,E$98,E$100,E$102,E$104,E$106,E$108,E$110,E$112,E$114,E$116,E$118,E$120,E$122,E$124)) -> 8 | F215: =RANK(F214,(F$6,F$8,F$10,F$12,F$14,F$16,F$18,F$20,F$22,F$24,F$26,F$28,F$30,F$32,F$34,F$36,F$38,F$40,F$42,F$44,F$46,F$48,F$50,F$52,F$54,F$56,F$58,F$60,F$62,F$64,F$66,F$68,F$70,F$72,F$74,F$76,F$78,F$80,F$82,F$84,F$86,F$88,F$90,F$92,F$94,F$96,F$98,F$100,F$102,F$104,F$106,F$108,F$110,F$112,F$114,F$116,F$118,F$120,F$122,F$124)) -> 8 | G215: =RANK(G214,(G$6,G$8,G$10,G$12,G$14,G$16,G$18,G$20,G$22,G$24,G$26,G$28,G$30,G$32,G$34,G$36,G$38,G$40,G$42,G$44,G$46,G$48,G$50,G$52,G$54,G$56,G$58,G$60,G$62,G$64,G$66,G$68,G$70,G$72,G$74,G$76,G$78,G$80,G$82,G$84,G$86,G$88,G$90,G$92,G$94,G$96,G$98,G$100,G$102,G$104,G$106,G$108,G$110,G$112,G$114,G$116,G$118,G$120,G$122,G$124)) -> 8 | H215: =RANK(H214,(H$6,H$8,H$10,H$12,H$14,H$16,H$18,H$20,H$22,H$24,H$26,H$28,H$30,H$32,H$34,H$36,H$38,H$40,H$42,H$44,H$46,H$48,H$50,H$52,H$54,H$56,H$58,H$60,H$62,H$64,H$66,H$68,H$70,H$72,H$74,H$76,H$78,H$80,H$82,H$84,H$86,H$88,H$90,H$92,H$94,H$96,H$98,H$100,H$102,H$104,H$106,H$108,H$110,H$112,H$114,H$116,H$118,H$120,H$122,H$124)) -> 8 | I215: =RANK(I214,(I$6,I$8,I$10,I$12,I$14,I$16,I$18,I$20,I$22,I$24,I$26,I$28,I$30,I$32,I$34,I$36,I$38,I$40,I$42,I$44,I$46,I$48,I$50,I$52,I$54,I$56,I$58,I$60,I$62,I$64,I$66,I$68,I$70,I$72,I$74,I$76,I$78,I$80,I$82,I$84,I$86,I$88,I$90,I$92,I$94,I$96,I$98,I$100,I$102,I$104,I$106,I$108,I$110,I$112,I$114,I$116,I$118,I$120,I$122,I$124)) -> 8 | J215: =RANK(J214,(J$6,J$8,J$10,J$12,J$14,J$16,J$18,J$20,J$22,J$24,J$26,J$28,J$30,J$32,J$34,J$36,J$38,J$40,J$42,J$44,J$46,J$48,J$50,J$52,J$54,J$56,J$58,J$60,J$62,J$64,J$66,J$68,J$70,J$72,J$74,J$76,J$78,J$80,J$82,J$84,J$86,J$88,J$90,J$92,J$94,J$96,J$98,J$100,J$102,J$104,J$106,J$108,J$110,J$112,J$114,J$116,J$118,J$120,J$122,J$124)) -> 8 | K215: =RANK(K214,(K$6,K$8,K$10,K$12,K$14,K$16,K$18,K$20,K$22,K$24,K$26,K$28,K$30,K$32,K$34,K$36,K$38,K$40,K$42,K$44,K$46,K$48,K$50,K$52,K$54,K$56,K$58,K$60,K$62,K$64,K$66,K$68,K$70,K$72,K$74,K$76,K$78,K$80,K$82,K$84,K$86,K$88,K$90,K$92,K$94,K$96,K$98,K$100,K$102,K$104,K$106,K$108,K$110,K$112,K$114,K$116,K$118,K$120,K$122,K$124)) -> 8 | L215: =RANK(L214,(L$6,L$8,L$10,L$12,L$14,L$16,L$18,L$20,L$22,L$24,L$26,L$28,L$30,L$32,L$34,L$36,L$38,L$40,L$42,L$44,L$46,L$48,L$50,L$52,L$54,L$56,L$58,L$60,L$62,L$64,L$66,L$68,L$70,L$72,L$74,L$76,L$78,L$80,L$82,L$84,L$86,L$88,L$90,L$92,L$94,L$96,L$98,L$100,L$102,L$104,L$106,L$108,L$110,L$112,L$114,L$116,L$118,L$120,L$122,L$124)) -> 8 | M215: =RANK(M214,(M$6,M$8,M$10,M$12,M$14,M$16,M$18,M$20,M$22,M$24,M$26,M$28,M$30,M$32,M$34,M$36,M$38,M$40,M$42,M$44,M$46,M$48,M$50,M$52,M$54,M$56,M$58,M$60,M$62,M$64,M$66,M$68,M$70,M$72,M$74,M$76,M$78,M$80,M$82,M$84,M$86,M$88,M$90,M$92,M$94,M$96,M$98,M$100,M$102,M$104,M$106,M$108,M$110,M$112,M$114,M$116,M$118,M$120,M$122,M$124)) -> 8 | N215: =RANK(N214,(N$6,N$8,N$10,N$12,N$14,N$16,N$18,N$20,N$22,N$24,N$26,N$28,N$30,N$32,N$34,N$36,N$38,N$40,N$42,N$44,N$46,N$48,N$50,N$52,N$54,N$56,N$58,N$60,N$62,N$64,N$66,N$68,N$70,N$72,N$74,N$76,N$78,N$80,N$82,N$84,N$86,N$88,N$90,N$92,N$94,N$96,N$98,N$100,N$102,N$104,N$106,N$108,N$110,N$112,N$114,N$116,N$118,N$120,N$122,N$124)) -> 8 | P215: =RANK(P214,(P$6,P$8,P$10,P$12,P$14,P$16,P$18,P$20,P$22,P$24,P$26,P$28,P$30,P$32,P$34,P$36,P$38,P$40,P$42,P$44,P$46,P$48,P$50,P$52,P$54,P$56,P$58,P$60,P$62,P$64,P$66,P$68,P$70,P$72,P$74,P$76,P$78,P$80,P$82,P$84,P$86,P$88,P$90,P$92,P$94,P$96,P$98,P$100,P$102,P$104,P$106,P$108,P$110,P$112,P$114,P$116,P$118,P$120,P$122,P$124)) -> 8
A218: 8/5/2022 Portage, Michigan
C219: General Effect | F219: Visual | J219: Music
C220: 1 | D220: 2 | F220: Proficiency | G220: Analysis | H220: Color Guard | J220: Brass | K220: Analysis | L220: Percussion | N220: Sub | P220: Total
C221: J. Orefice | D221: J. Denton | E221: Total | F221: M. Turner | G221: T. Wingate | H221: C. Quamme | I221: Total ÷2 | J221: No Judge | K221: J. Kennedy | L221: C. Rapacki | M221: Total ÷2 | N221: Total | O221: Pen | P221: Score
A222: DCI Open Class | C222: 20 | D222: 20 | E222: 40 | F222: 20 | G222: 20 | H222: 20 | I222: 30 | J222: 20 | K222: 20 | L222: 20 | M222: 30 | N222: 100 | P222: 100
A223: Spartans | B223: 5 | C223: 15.40 | D223: 15.50 | E223: 30.90 | F223: 15.70 | G223: 15.50 | H223: 15.10 | I223: 23.15 | J223: 15.30 | K223: 15.30 | L223: 16.00 | M223: 23.30 | N223: 77.35 | O223: 0.0 | P223: 77.35
C224: =RANK(C223,(C$6,C$8,C$10,C$12,C$14,C$16,C$18,C$20,C$22,C$24,C$26,C$28,C$30,C$32,C$34,C$36,C$38,C$40,C$42,C$44,C$46,C$48,C$50,C$52,C$54,C$56,C$58,C$60,C$62,C$64,C$66,C$68,C$70,C$72,C$74,C$76,C$78,C$80,C$82,C$84,C$86,C$88,C$90,C$92,C$94,C$96,C$98,C$100,C$102,C$104,C$106,C$108,C$110,C$112,C$114,C$116,C$118,C$120,C$122,C$124)) -> 1 | D224: =RANK(D223,(D$6,D$8,D$10,D$12,D$14,D$16,D$18,D$20,D$22,D$24,D$26,D$28,D$30,D$32,D$34,D$36,D$38,D$40,D$42,D$44,D$46,D$48,D$50,D$52,D$54,D$56,D$58,D$60,D$62,D$64,D$66,D$68,D$70,D$72,D$74,D$76,D$78,D$80,D$82,D$84,D$86,D$88,D$90,D$92,D$94,D$96,D$98,D$100,D$102,D$104,D$106,D$108,D$110,D$112,D$114,D$116,D$118,D$120,D$122,D$124)) -> 1 | E224: =RANK(E223,(E$6,E$8,E$10,E$12,E$14,E$16,E$18,E$20,E$22,E$24,E$26,E$28,E$30,E$32,E$34,E$36,E$38,E$40,E$42,E$44,E$46,E$48,E$50,E$52,E$54,E$56,E$58,E$60,E$62,E$64,E$66,E$68,E$70,E$72,E$74,E$76,E$78,E$80,E$82,E$84,E$86,E$88,E$90,E$92,E$94,E$96,E$98,E$100,E$102,E$104,E$106,E$108,E$110,E$112,E$114,E$116,E$118,E$120,E$122,E$124)) -> 1 | F224: =RANK(F223,(F$6,F$8,F$10,F$12,F$14,F$16,F$18,F$20,F$22,F$24,F$26,F$28,F$30,F$32,F$34,F$36,F$38,F$40,F$42,F$44,F$46,F$48,F$50,F$52,F$54,F$56,F$58,F$60,F$62,F$64,F$66,F$68,F$70,F$72,F$74,F$76,F$78,F$80,F$82,F$84,F$86,F$88,F$90,F$92,F$94,F$96,F$98,F$100,F$102,F$104,F$106,F$108,F$110,F$112,F$114,F$116,F$118,F$120,F$122,F$124)) -> 1 | G224: =RANK(G223,(G$6,G$8,G$10,G$12,G$14,G$16,G$18,G$20,G$22,G$24,G$26,G$28,G$30,G$32,G$34,G$36,G$38,G$40,G$42,G$44,G$46,G$48,G$50,G$52,G$54,G$56,G$58,G$60,G$62,G$64,G$66,G$68,G$70,G$72,G$74,G$76,G$78,G$80,G$82,G$84,G$86,G$88,G$90,G$92,G$94,G$96,G$98,G$100,G$102,G$104,G$106,G$108,G$110,G$112,G$114,G$116,G$118,G$120,G$122,G$124)) -> 1 | H224: =RANK(H223,(H$6,H$8,H$10,H$12,H$14,H$16,H$18,H$20,H$22,H$24,H$26,H$28,H$30,H$32,H$34,H$36,H$38,H$40,H$42,H$44,H$46,H$48,H$50,H$52,H$54,H$56,H$58,H$60,H$62,H$64,H$66,H$68,H$70,H$72,H$74,H$76,H$78,H$80,H$82,H$84,H$86,H$88,H$90,H$92,H$94,H$96,H$98,H$100,H$102,H$104,H$106,H$108,H$110,H$112,H$114,H$116,H$118,H$120,H$122,H$124)) -> 2 | I224: =RANK(I223,(I$6,I$8,I$10,I$12,I$14,I$16,I$18,I$20,I$22,I$24,I$26,I$28,I$30,I$32,I$34,I$36,I$38,I$40,I$42,I$44,I$46,I$48,I$50,I$52,I$54,I$56,I$58,I$60,I$62,I$64,I$66,I$68,I$70,I$72,I$74,I$76,I$78,I$80,I$82,I$84,I$86,I$88,I$90,I$92,I$94,I$96,I$98,I$100,I$102,I$104,I$106,I$108,I$110,I$112,I$114,I$116,I$118,I$120,I$122,I$124)) -> 1 | J224: =RANK(J223,(J$6,J$8,J$10,J$12,J$14,J$16,J$18,J$20,J$22,J$24,J$26,J$28,J$30,J$32,J$34,J$36,J$38,J$40,J$42,J$44,J$46,J$48,J$50,J$52,J$54,J$56,J$58,J$60,J$62,J$64,J$66,J$68,J$70,J$72,J$74,J$76,J$78,J$80,J$82,J$84,J$86,J$88,J$90,J$92,J$94,J$96,J$98,J$100,J$102,J$104,J$106,J$108,J$110,J$112,J$114,J$116,J$118,J$120,J$122,J$124)) -> 1 | K224: =RANK(K223,(K$6,K$8,K$10,K$12,K$14,K$16,K$18,K$20,K$22,K$24,K$26,K$28,K$30,K$32,K$34,K$36,K$38,K$40,K$42,K$44,K$46,K$48,K$50,K$52,K$54,K$56,K$58,K$60,K$62,K$64,K$66,K$68,K$70,K$72,K$74,K$76,K$78,K$80,K$82,K$84,K$86,K$88,K$90,K$92,K$94,K$96,K$98,K$100,K$102,K$104,K$106,K$108,K$110,K$112,K$114,K$116,K$118,K$120,K$122,K$124)) -> 1 | L224: =RANK(L223,(L$6,L$8,L$10,L$12,L$14,L$16,L$18,L$20,L$22,L$24,L$26,L$28,L$30,L$32,L$34,L$36,L$38,L$40,L$42,L$44,L$46,L$48,L$50,L$52,L$54,L$56,L$58,L$60,L$62,L$64,L$66,L$68,L$70,L$72,L$74,L$76,L$78,L$80,L$82,L$84,L$86,L$88,L$90,L$92,L$94,L$96,L$98,L$100,L$102,L$104,L$106,L$108,L$110,L$112,L$114,L$116,L$118,L$120,L$122,L$124)) -> 1 | M224: =RANK(M223,(M$6,M$8,M$10,M$12,M$14,M$16,M$18,M$20,M$22,M$24,M$26,M$28,M$30,M$32,M$34,M$36,M$38,M$40,M$42,M$44,M$46,M$48,M$50,M$52,M$54,M$56,M$58,M$60,M$62,M$64,M$66,M$68,M$70,M$72,M$74,M$76,M$78,M$80,M$82,M$84,M$86,M$88,M$90,M$92,M$94,M$96,M$98,M$100,M$102,M$104,M$106,M$108,M$110,M$112,M$114,M$116,M$118,M$120,M$122,M$124)) -> 1 | N224: =RANK(N223,(N$6,N$8,N$10,N$12,N$14,N$16,N$18,N$20,N$22,N$24,N$26,N$28,N$30,N$32,N$34,N$36,N$38,N$40,N$42,N$44,N$46,N$48,N$50,N$52,N$54,N$56,N$58,N$60,N$62,N$64,N$66,N$68,N$70,N$72,N$74,N$76,N$78,N$80,N$82,N$84,N$86,N$88,N$90,N$92,N$94,N$96,N$98,N$100,N$102,N$104,N$106,N$108,N$110,N$112,N$114,N$116,N$118,N$120,N$122,N$124)) -> 1 | P224: =RANK(P223,(P$6,P$8,P$10,P$12,P$14,P$16,P$18,P$20,P$22,P$24,P$26,P$28,P$30,P$32,P$34,P$36,P$38,P$40,P$42,P$44,P$46,P$48,P$50,P$52,P$54,P$56,P$58,P$60,P$62,P$64,P$66,P$68,P$70,P$72,P$74,P$76,P$78,P$80,P$82,P$84,P$86,P$88,P$90,P$92,P$94,P$96,P$98,P$100,P$102,P$104,P$106,P$108,P$110,P$112,P$114,P$116,P$118,P$120,P$122,P$124)) -> 1
A225: Southwind | B225: 3 | C225: 15.00 | D225: 14.80 | E225: 29.80 | F225: 14.20 | G225: 14.50 | H225: 15.20 | I225: 21.95 | J225: 14.80 | K225: 14.80 | L225: 14.50 | M225: 22.05 | N225: 73.80 | O225: 0.0 | P225: 73.80
C226: =RANK(C225,(C$6,C$8,C$10,C$12,C$14,C$16,C$18,C$20,C$22,C$24,C$26,C$28,C$30,C$32,C$34,C$36,C$38,C$40,C$42,C$44,C$46,C$48,C$50,C$52,C$54,C$56,C$58,C$60,C$62,C$64,C$66,C$68,C$70,C$72,C$74,C$76,C$78,C$80,C$82,C$84,C$86,C$88,C$90,C$92,C$94,C$96,C$98,C$100,C$102,C$104,C$106,C$108,C$110,C$112,C$114,C$116,C$118,C$120,C$122,C$124)) -> 2 | D226: =RANK(D225,(D$6,D$8,D$10,D$12,D$14,D$16,D$18,D$20,D$22,D$24,D$26,D$28,D$30,D$32,D$34,D$36,D$38,D$40,D$42,D$44,D$46,D$48,D$50,D$52,D$54,D$56,D$58,D$60,D$62,D$64,D$66,D$68,D$70,D$72,D$74,D$76,D$78,D$80,D$82,D$84,D$86,D$88,D$90,D$92,D$94,D$96,D$98,D$100,D$102,D$104,D$106,D$108,D$110,D$112,D$114,D$116,D$118,D$120,D$122,D$124)) -> 2 | E226: =RANK(E225,(E$6,E$8,E$10,E$12,E$14,E$16,E$18,E$20,E$22,E$24,E$26,E$28,E$30,E$32,E$34,E$36,E$38,E$40,E$42,E$44,E$46,E$48,E$50,E$52,E$54,E$56,E$58,E$60,E$62,E$64,E$66,E$68,E$70,E$72,E$74,E$76,E$78,E$80,E$82,E$84,E$86,E$88,E$90,E$92,E$94,E$96,E$98,E$100,E$102,E$104,E$106,E$108,E$110,E$112,E$114,E$116,E$118,E$120,E$122,E$124)) -> 2 | F226: =RANK(F225,(F$6,F$8,F$10,F$12,F$14,F$16,F$18,F$20,F$22,F$24,F$26,F$28,F$30,F$32,F$34,F$36,F$38,F$40,F$42,F$44,F$46,F$48,F$50,F$52,F$54,F$56,F$58,F$60,F$62,F$64,F$66,F$68,F$70,F$72,F$74,F$76,F$78,F$80,F$82,F$84,F$86,F$88,F$90,F$92,F$94,F$96,F$98,F$100,F$102,F$104,F$106,F$108,F$110,F$112,F$114,F$116,F$118,F$120,F$122,F$124)) -> 4 | G226: =RANK(G225,(G$6,G$8,G$10,G$12,G$14,G$16,G$18,G$20,G$22,G$24,G$26,G$28,G$30,G$32,G$34,G$36,G$38,G$40,G$42,G$44,G$46,G$48,G$50,G$52,G$54,G$56,G$58,G$60,G$62,G$64,G$66,G$68,G$70,G$72,G$74,G$76,G$78,G$80,G$82,G$84,G$86,G$88,G$90,G$92,G$94,G$96,G$98,G$100,G$102,G$104,G$106,G$108,G$110,G$112,G$114,G$116,G$118,G$120,G$122,G$124)) -> 2 | H226: =RANK(H225,(H$6,H$8,H$10,H$12,H$14,H$16,H$18,H$20,H$22,H$24,H$26,H$28,H$30,H$32,H$34,H$36,H$38,H$40,H$42,H$44,H$46,H$48,H$50,H$52,H$54,H$56,H$58,H$60,H$62,H$64,H$66,H$68,H$70,H$72,H$74,H$76,H$78,H$80,H$82,H$84,H$86,H$88,H$90,H$92,H$94,H$96,H$98,H$100,H$102,H$104,H$106,H$108,H$110,H$112,H$114,H$116,H$118,H$120,H$122,H$124)) -> 1 | I226: =RANK(I225,(I$6,I$8,I$10,I$12,I$14,I$16,I$18,I$20,I$22,I$24,I$26,I$28,I$30,I$32,I$34,I$36,I$38,I$40,I$42,I$44,I$46,I$48,I$50,I$52,I$54,I$56,I$58,I$60,I$62,I$64,I$66,I$68,I$70,I$72,I$74,I$76,I$78,I$80,I$82,I$84,I$86,I$88,I$90,I$92,I$94,I$96,I$98,I$100,I$102,I$104,I$106,I$108,I$110,I$112,I$114,I$116,I$118,I$120,I$122,I$124)) -> 3 | J226: =RANK(J225,(J$6,J$8,J$10,J$12,J$14,J$16,J$18,J$20,J$22,J$24,J$26,J$28,J$30,J$32,J$34,J$36,J$38,J$40,J$42,J$44,J$46,J$48,J$50,J$52,J$54,J$56,J$58,J$60,J$62,J$64,J$66,J$68,J$70,J$72,J$74,J$76,J$78,J$80,J$82,J$84,J$86,J$88,J$90,J$92,J$94,J$96,J$98,J$100,J$102,J$104,J$106,J$108,J$110,J$112,J$114,J$116,J$118,J$120,J$122,J$124)) -> 2 | K226: =RANK(K225,(K$6,K$8,K$10,K$12,K$14,K$16,K$18,K$20,K$22,K$24,K$26,K$28,K$30,K$32,K$34,K$36,K$38,K$40,K$42,K$44,K$46,K$48,K$50,K$52,K$54,K$56,K$58,K$60,K$62,K$64,K$66,K$68,K$70,K$72,K$74,K$76,K$78,K$80,K$82,K$84,K$86,K$88,K$90,K$92,K$94,K$96,K$98,K$100,K$102,K$104,K$106,K$108,K$110,K$112,K$114,K$116,K$118,K$120,K$122,K$124)) -> 2 | L226: =RANK(L225,(L$6,L$8,L$10,L$12,L$14,L$16,L$18,L$20,L$22,L$24,L$26,L$28,L$30,L$32,L$34,L$36,L$38,L$40,L$42,L$44,L$46,L$48,L$50,L$52,L$54,L$56,L$58,L$60,L$62,L$64,L$66,L$68,L$70,L$72,L$74,L$76,L$78,L$80,L$82,L$84,L$86,L$88,L$90,L$92,L$94,L$96,L$98,L$100,L$102,L$104,L$106,L$108,L$110,L$112,L$114,L$116,L$118,L$120,L$122,L$124)) -> 4 | M226: =RANK(M225,(M$6,M$8,M$10,M$12,M$14,M$16,M$18,M$20,M$22,M$24,M$26,M$28,M$30,M$32,M$34,M$36,M$38,M$40,M$42,M$44,M$46,M$48,M$50,M$52,M$54,M$56,M$58,M$60,M$62,M$64,M$66,M$68,M$70,M$72,M$74,M$76,M$78,M$80,M$82,M$84,M$86,M$88,M$90,M$92,M$94,M$96,M$98,M$100,M$102,M$104,M$106,M$108,M$110,M$112,M$114,M$116,M$118,M$120,M$122,M$124)) -> 2 | N226: =RANK(N225,(N$6,N$8,N$10,N$12,N$14,N$16,N$18,N$20,N$22,N$24,N$26,N$28,N$30,N$32,N$34,N$36,N$38,N$40,N$42,N$44,N$46,N$48,N$50,N$52,N$54,N$56,N$58,N$60,N$62,N$64,N$66,N$68,N$70,N$72,N$74,N$76,N$78,N$80,N$82,N$84,N$86,N$88,N$90,N$92,N$94,N$96,N$98,N$100,N$102,N$104,N$106,N$108,N$110,N$112,N$114,N$116,N$118,N$120,N$122,N$124)) -> 2 | P226: =RANK(P225,(P$6,P$8,P$10,P$12,P$14,P$16,P$18,P$20,P$22,P$24,P$26,P$28,P$30,P$32,P$34,P$36,P$38,P$40,P$42,P$44,P$46,P$48,P$50,P$52,P$54,P$56,P$58,P$60,P$62,P$64,P$66,P$68,P$70,P$72,P$74,P$76,P$78,P$80,P$82,P$84,P$86,P$88,P$90,P$92,P$94,P$96,P$98,P$100,P$102,P$104,P$106,P$108,P$110,P$112,P$114,P$116,P$118,P$120,P$122,P$124)) -> 2
A227: Legends | B227: 6 | C227: 14.40 | D227: 14.20 | E227: 28.60 | F227: 15.30 | G227: 14.40 | H227: 14.80 | I227: 22.25 | J227: 14.10 | K227: 14.10 | L227: 14.60 | M227: 21.40 | N227: 72.25 | O227: 0.0 | P227: 72.25
C228: =RANK(C227,(C$6,C$8,C$10,C$12,C$14,C$16,C$18,C$20,C$22,C$24,C$26,C$28,C$30,C$32,C$34,C$36,C$38,C$40,C$42,C$44,C$46,C$48,C$50,C$52,C$54,C$56,C$58,C$60,C$62,C$64,C$66,C$68,C$70,C$72,C$74,C$76,C$78,C$80,C$82,C$84,C$86,C$88,C$90,C$92,C$94,C$96,C$98,C$100,C$102,C$104,C$106,C$108,C$110,C$112,C$114,C$116,C$118,C$120,C$122,C$124)) -> 4 | D228: =RANK(D227,(D$6,D$8,D$10,D$12,D$14,D$16,D$18,D$20,D$22,D$24,D$26,D$28,D$30,D$32,D$34,D$36,D$38,D$40,D$42,D$44,D$46,D$48,D$50,D$52,D$54,D$56,D$58,D$60,D$62,D$64,D$66,D$68,D$70,D$72,D$74,D$76,D$78,D$80,D$82,D$84,D$86,D$88,D$90,D$92,D$94,D$96,D$98,D$100,D$102,D$104,D$106,D$108,D$110,D$112,D$114,D$116,D$118,D$120,D$122,D$124)) -> 3 | E228: =RANK(E227,(E$6,E$8,E$10,E$12,E$14,E$16,E$18,E$20,E$22,E$24,E$26,E$28,E$30,E$32,E$34,E$36,E$38,E$40,E$42,E$44,E$46,E$48,E$50,E$52,E$54,E$56,E$58,E$60,E$62,E$64,E$66,E$68,E$70,E$72,E$74,E$76,E$78,E$80,E$82,E$84,E$86,E$88,E$90,E$92,E$94,E$96,E$98,E$100,E$102,E$104,E$106,E$108,E$110,E$112,E$114,E$116,E$118,E$120,E$122,E$124)) -> 3 | F228: =RANK(F227,(F$6,F$8,F$10,F$12,F$14,F$16,F$18,F$20,F$22,F$24,F$26,F$28,F$30,F$32,F$34,F$36,F$38,F$40,F$42,F$44,F$46,F$48,F$50,F$52,F$54,F$56,F$58,F$60,F$62,F$64,F$66,F$68,F$70,F$72,F$74,F$76,F$78,F$80,F$82,F$84,F$86,F$88,F$90,F$92,F$94,F$96,F$98,F$100,F$102,F$104,F$106,F$108,F$110,F$112,F$114,F$116,F$118,F$120,F$122,F$124)) -> 2 | G228: =RANK(G227,(G$6,G$8,G$10,G$12,G$14,G$16,G$18,G$20,G$22,G$24,G$26,G$28,G$30,G$32,G$34,G$36,G$38,G$40,G$42,G$44,G$46,G$48,G$50,G$52,G$54,G$56,G$58,G$60,G$62,G$64,G$66,G$68,G$70,G$72,G$74,G$76,G$78,G$80,G$82,G$84,G$86,G$88,G$90,G$92,G$94,G$96,G$98,G$100,G$102,G$104,G$106,G$108,G$110,G$112,G$114,G$116,G$118,G$120,G$122,G$124)) -> 3 | H228: =RANK(H227,(H$6,H$8,H$10,H$12,H$14,H$16,H$18,H$20,H$22,H$24,H$26,H$28,H$30,H$32,H$34,H$36,H$38,H$40,H$42,H$44,H$46,H$48,H$50,H$52,H$54,H$56,H$58,H$60,H$62,H$64,H$66,H$68,H$70,H$72,H$74,H$76,H$78,H$80,H$82,H$84,H$86,H$88,H$90,H$92,H$94,H$96,H$98,H$100,H$102,H$104,H$106,H$108,H$110,H$112,H$114,H$116,H$118,H$120,H$122,H$124)) -> 3 | I228: =RANK(I227,(I$6,I$8,I$10,I$12,I$14,I$16,I$18,I$20,I$22,I$24,I$26,I$28,I$30,I$32,I$34,I$36,I$38,I$40,I$42,I$44,I$46,I$48,I$50,I$52,I$54,I$56,I$58,I$60,I$62,I$64,I$66,I$68,I$70,I$72,I$74,I$76,I$78,I$80,I$82,I$84,I$86,I$88,I$90,I$92,I$94,I$96,I$98,I$100,I$102,I$104,I$106,I$108,I$110,I$112,I$114,I$116,I$118,I$120,I$122,I$124)) -> 2 | J228: =RANK(J227,(J$6,J$8,J$10,J$12,J$14,J$16,J$18,J$20,J$22,J$24,J$26,J$28,J$30,J$32,J$34,J$36,J$38,J$40,J$42,J$44,J$46,J$48,J$50,J$52,J$54,J$56,J$58,J$60,J$62,J$64,J$66,J$68,J$70,J$72,J$74,J$76,J$78,J$80,J$82,J$84,J$86,J$88,J$90,J$92,J$94,J$96,J$98,J$100,J$102,J$104,J$106,J$108,J$110,J$112,J$114,J$116,J$118,J$120,J$122,J$124)) -> 4 | K228: =RANK(K227,(K$6,K$8,K$10,K$12,K$14,K$16,K$18,K$20,K$22,K$24,K$26,K$28,K$30,K$32,K$34,K$36,K$38,K$40,K$42,K$44,K$46,K$48,K$50,K$52,K$54,K$56,K$58,K$60,K$62,K$64,K$66,K$68,K$70,K$72,K$74,K$76,K$78,K$80,K$82,K$84,K$86,K$88,K$90,K$92,K$94,K$96,K$98,K$100,K$102,K$104,K$106,K$108,K$110,K$112,K$114,K$116,K$118,K$120,K$122,K$124)) -> 4 | L228: =RANK(L227,(L$6,L$8,L$10,L$12,L$14,L$16,L$18,L$20,L$22,L$24,L$26,L$28,L$30,L$32,L$34,L$36,L$38,L$40,L$42,L$44,L$46,L$48,L$50,L$52,L$54,L$56,L$58,L$60,L$62,L$64,L$66,L$68,L$70,L$72,L$74,L$76,L$78,L$80,L$82,L$84,L$86,L$88,L$90,L$92,L$94,L$96,L$98,L$100,L$102,L$104,L$106,L$108,L$110,L$112,L$114,L$116,L$118,L$120,L$122,L$124)) -> 3 | M228: =RANK(M227,(M$6,M$8,M$10,M$12,M$14,M$16,M$18,M$20,M$22,M$24,M$26,M$28,M$30,M$32,M$34,M$36,M$38,M$40,M$42,M$44,M$46,M$48,M$50,M$52,M$54,M$56,M$58,M$60,M$62,M$64,M$66,M$68,M$70,M$72,M$74,M$76,M$78,M$80,M$82,M$84,M$86,M$88,M$90,M$92,M$94,M$96,M$98,M$100,M$102,M$104,M$106,M$108,M$110,M$112,M$114,M$116,M$118,M$120,M$122,M$124)) -> 4 | N228: =RANK(N227,(N$6,N$8,N$10,N$12,N$14,N$16,N$18,N$20,N$22,N$24,N$26,N$28,N$30,N$32,N$34,N$36,N$38,N$40,N$42,N$44,N$46,N$48,N$50,N$52,N$54,N$56,N$58,N$60,N$62,N$64,N$66,N$68,N$70,N$72,N$74,N$76,N$78,N$80,N$82,N$84,N$86,N$88,N$90,N$92,N$94,N$96,N$98,N$100,N$102,N$104,N$106,N$108,N$110,N$112,N$114,N$116,N$118,N$120,N$122,N$124)) -> 3 | P228: =RANK(P227,(P$6,P$8,P$10,P$12,P$14,P$16,P$18,P$20,P$22,P$24,P$26,P$28,P$30,P$32,P$34,P$36,P$38,P$40,P$42,P$44,P$46,P$48,P$50,P$52,P$54,P$56,P$58,P$60,P$62,P$64,P$66,P$68,P$70,P$72,P$74,P$76,P$78,P$80,P$82,P$84,P$86,P$88,P$90,P$92,P$94,P$96,P$98,P$100,P$102,P$104,P$106,P$108,P$110,P$112,P$114,P$116,P$118,P$120,P$122,P$124)) -> 3
A229: Louisiana | B229: 4 | C229: 14.70 | D229: 13.80 | E229: 28.50 | F229: 14.90 | G229: 13.20 | H229: 13.10 | I229: 20.60 | J229: 14.20 | K229: 14.20 | L229: 14.80 | M229: 21.60 | N229: 70.70 | O229: 0.0 | P229: 70.70
A230: Stars | C230: =RANK(C229,(C$6,C$8,C$10,C$12,C$14,C$16,C$18,C$20,C$22,C$24,C$26,C$28,C$30,C$32,C$34,C$36,C$38,C$40,C$42,C$44,C$46,C$48,C$50,C$52,C$54,C$56,C$58,C$60,C$62,C$64,C$66,C$68,C$70,C$72,C$74,C$76,C$78,C$80,C$82,C$84,C$86,C$88,C$90,C$92,C$94,C$96,C$98,C$100,C$102,C$104,C$106,C$108,C$110,C$112,C$114,C$116,C$118,C$120,C$122,C$124)) -> 3 | D230: =RANK(D229,(D$6,D$8,D$10,D$12,D$14,D$16,D$18,D$20,D$22,D$24,D$26,D$28,D$30,D$32,D$34,D$36,D$38,D$40,D$42,D$44,D$46,D$48,D$50,D$52,D$54,D$56,D$58,D$60,D$62,D$64,D$66,D$68,D$70,D$72,D$74,D$76,D$78,D$80,D$82,D$84,D$86,D$88,D$90,D$92,D$94,D$96,D$98,D$100,D$102,D$104,D$106,D$108,D$110,D$112,D$114,D$116,D$118,D$120,D$122,D$124)) -> 4 | E230: =RANK(E229,(E$6,E$8,E$10,E$12,E$14,E$16,E$18,E$20,E$22,E$24,E$26,E$28,E$30,E$32,E$34,E$36,E$38,E$40,E$42,E$44,E$46,E$48,E$50,E$52,E$54,E$56,E$58,E$60,E$62,E$64,E$66,E$68,E$70,E$72,E$74,E$76,E$78,E$80,E$82,E$84,E$86,E$88,E$90,E$92,E$94,E$96,E$98,E$100,E$102,E$104,E$106,E$108,E$110,E$112,E$114,E$116,E$118,E$120,E$122,E$124)) -> 4 | F230: =RANK(F229,(F$6,F$8,F$10,F$12,F$14,F$16,F$18,F$20,F$22,F$24,F$26,F$28,F$30,F$32,F$34,F$36,F$38,F$40,F$42,F$44,F$46,F$48,F$50,F$52,F$54,F$56,F$58,F$60,F$62,F$64,F$66,F$68,F$70,F$72,F$74,F$76,F$78,F$80,F$82,F$84,F$86,F$88,F$90,F$92,F$94,F$96,F$98,F$100,F$102,F$104,F$106,F$108,F$110,F$112,F$114,F$116,F$118,F$120,F$122,F$124)) -> 3 | G230: =RANK(G229,(G$6,G$8,G$10,G$12,G$14,G$16,G$18,G$20,G$22,G$24,G$26,G$28,G$30,G$32,G$34,G$36,G$38,G$40,G$42,G$44,G$46,G$48,G$50,G$52,G$54,G$56,G$58,G$60,G$62,G$64,G$66,G$68,G$70,G$72,G$74,G$76,G$78,G$80,G$82,G$84,G$86,G$88,G$90,G$92,G$94,G$96,G$98,G$100,G$102,G$104,G$106,G$108,G$110,G$112,G$114,G$116,G$118,G$120,G$122,G$124)) -> 5 | H230: =RANK(H229,(H$6,H$8,H$10,H$12,H$14,H$16,H$18,H$20,H$22,H$24,H$26,H$28,H$30,H$32,H$34,H$36,H$38,H$40,H$42,H$44,H$46,H$48,H$50,H$52,H$54,H$56,H$58,H$60,H$62,H$64,H$66,H$68,H$70,H$72,H$74,H$76,H$78,H$80,H$82,H$84,H$86,H$88,H$90,H$92,H$94,H$96,H$98,H$100,H$102,H$104,H$106,H$108,H$110,H$112,H$114,H$116,H$118,H$120,H$122,H$124)) -> 5 | I230: =RANK(I229,(I$6,I$8,I$10,I$12,I$14,I$16,I$18,I$20,I$22,I$24,I$26,I$28,I$30,I$32,I$34,I$36,I$38,I$40,I$42,I$44,I$46,I$48,I$50,I$52,I$54,I$56,I$58,I$60,I$62,I$64,I$66,I$68,I$70,I$72,I$74,I$76,I$78,I$80,I$82,I$84,I$86,I$88,I$90,I$92,I$94,I$96,I$98,I$100,I$102,I$104,I$106,I$108,I$110,I$112,I$114,I$116,I$118,I$120,I$122,I$124)) -> 4 | J230: =RANK(J229,(J$6,J$8,J$10,J$12,J$14,J$16,J$18,J$20,J$22,J$24,J$26,J$28,J$30,J$32,J$34,J$36,J$38,J$40,J$42,J$44,J$46,J$48,J$50,J$52,J$54,J$56,J$58,J$60,J$62,J$64,J$66,J$68,J$70,J$72,J$74,J$76,J$78,J$80,J$82,J$84,J$86,J$88,J$90,J$92,J$94,J$96,J$98,J$100,J$102,J$104,J$106,J$108,J$110,J$112,J$114,J$116,J$118,J$120,J$122,J$124)) -> 3 | K230: =RANK(K229,(K$6,K$8,K$10,K$12,K$14,K$16,K$18,K$20,K$22,K$24,K$26,K$28,K$30,K$32,K$34,K$36,K$38,K$40,K$42,K$44,K$46,K$48,K$50,K$52,K$54,K$56,K$58,K$60,K$62,K$64,K$66,K$68,K$70,K$72,K$74,K$76,K$78,K$80,K$82,K$84,K$86,K$88,K$90,K$92,K$94,K$96,K$98,K$100,K$102,K$104,K$106,K$108,K$110,K$112,K$114,K$116,K$118,K$120,K$122,K$124)) -> 3 | L230: =RANK(L229,(L$6,L$8,L$10,L$12,L$14,L$16,L$18,L$20,L$22,L$24,L$26,L$28,L$30,L$32,L$34,L$36,L$38,L$40,L$42,L$44,L$46,L$48,L$50,L$52,L$54,L$56,L$58,L$60,L$62,L$64,L$66,L$68,L$70,L$72,L$74,L$76,L$78,L$80,L$82,L$84,L$86,L$88,L$90,L$92,L$94,L$96,L$98,L$100,L$102,L$104,L$106,L$108,L$110,L$112,L$114,L$116,L$118,L$120,L$122,L$124)) -> 2 | M230: =RANK(M229,(M$6,M$8,M$10,M$12,M$14,M$16,M$18,M$20,M$22,M$24,M$26,M$28,M$30,M$32,M$34,M$36,M$38,M$40,M$42,M$44,M$46,M$48,M$50,M$52,M$54,M$56,M$58,M$60,M$62,M$64,M$66,M$68,M$70,M$72,M$74,M$76,M$78,M$80,M$82,M$84,M$86,M$88,M$90,M$92,M$94,M$96,M$98,M$100,M$102,M$104,M$106,M$108,M$110,M$112,M$114,M$116,M$118,M$120,M$122,M$124)) -> 3 | N230: =RANK(N229,(N$6,N$8,N$10,N$12,N$14,N$16,N$18,N$20,N$22,N$24,N$26,N$28,N$30,N$32,N$34,N$36,N$38,N$40,N$42,N$44,N$46,N$48,N$50,N$52,N$54,N$56,N$58,N$60,N$62,N$64,N$66,N$68,N$70,N$72,N$74,N$76,N$78,N$80,N$82,N$84,N$86,N$88,N$90,N$92,N$94,N$96,N$98,N$100,N$102,N$104,N$106,N$108,N$110,N$112,N$114,N$116,N$118,N$120,N$122,N$124)) -> 4 | P230: =RANK(P229,(P$6,P$8,P$10,P$12,P$14,P$16,P$18,P$20,P$22,P$24,P$26,P$28,P$30,P$32,P$34,P$36,P$38,P$40,P$42,P$44,P$46,P$48,P$50,P$52,P$54,P$56,P$58,P$60,P$62,P$64,P$66,P$68,P$70,P$72,P$74,P$76,P$78,P$80,P$82,P$84,P$86,P$88,P$90,P$92,P$94,P$96,P$98,P$100,P$102,P$104,P$106,P$108,P$110,P$112,P$114,P$116,P$118,P$120,P$122,P$124)) -> 4
A231: 7th | B231: 2 | C231: 13.60 | D231: 13.30 | E231: 26.90 | F231: 13.00 | G231: 13.10 | H231: 13.80 | I231: 19.95 | J231: 13.30 | K231: 13.30 | L231: 13.30 | M231: 19.95 | N231: 66.80 | O231: 0.0 | P231: 66.80
A232: Regiment | C232: =RANK(C231,(C$6,C$8,C$10,C$12,C$14,C$16,C$18,C$20,C$22,C$24,C$26,C$28,C$30,C$32,C$34,C$36,C$38,C$40,C$42,C$44,C$46,C$48,C$50,C$52,C$54,C$56,C$58,C$60,C$62,C$64,C$66,C$68,C$70,C$72,C$74,C$76,C$78,C$80,C$82,C$84,C$86,C$88,C$90,C$92,C$94,C$96,C$98,C$100,C$102,C$104,C$106,C$108,C$110,C$112,C$114,C$116,C$118,C$120,C$122,C$124)) -> 5 | D232: =RANK(D231,(D$6,D$8,D$10,D$12,D$14,D$16,D$18,D$20,D$22,D$24,D$26,D$28,D$30,D$32,D$34,D$36,D$38,D$40,D$42,D$44,D$46,D$48,D$50,D$52,D$54,D$56,D$58,D$60,D$62,D$64,D$66,D$68,D$70,D$72,D$74,D$76,D$78,D$80,D$82,D$84,D$86,D$88,D$90,D$92,D$94,D$96,D$98,D$100,D$102,D$104,D$106,D$108,D$110,D$112,D$114,D$116,D$118,D$120,D$122,D$124)) -> 5 | E232: =RANK(E231,(E$6,E$8,E$10,E$12,E$14,E$16,E$18,E$20,E$22,E$24,E$26,E$28,E$30,E$32,E$34,E$36,E$38,E$40,E$42,E$44,E$46,E$48,E$50,E$52,E$54,E$56,E$58,E$60,E$62,E$64,E$66,E$68,E$70,E$72,E$74,E$76,E$78,E$80,E$82,E$84,E$86,E$88,E$90,E$92,E$94,E$96,E$98,E$100,E$102,E$104,E$106,E$108,E$110,E$112,E$114,E$116,E$118,E$120,E$122,E$124)) -> 5 | F232: =RANK(F231,(F$6,F$8,F$10,F$12,F$14,F$16,F$18,F$20,F$22,F$24,F$26,F$28,F$30,F$32,F$34,F$36,F$38,F$40,F$42,F$44,F$46,F$48,F$50,F$52,F$54,F$56,F$58,F$60,F$62,F$64,F$66,F$68,F$70,F$72,F$74,F$76,F$78,F$80,F$82,F$84,F$86,F$88,F$90,F$92,F$94,F$96,F$98,F$100,F$102,F$104,F$106,F$108,F$110,F$112,F$114,F$116,F$118,F$120,F$122,F$124)) -> 5 | G232: =RANK(G231,(G$6,G$8,G$10,G$12,G$14,G$16,G$18,G$20,G$22,G$24,G$26,G$28,G$30,G$32,G$34,G$36,G$38,G$40,G$42,G$44,G$46,G$48,G$50,G$52,G$54,G$56,G$58,G$60,G$62,G$64,G$66,G$68,G$70,G$72,G$74,G$76,G$78,G$80,G$82,G$84,G$86,G$88,G$90,G$92,G$94,G$96,G$98,G$100,G$102,G$104,G$106,G$108,G$110,G$112,G$114,G$116,G$118,G$120,G$122,G$124)) -> 6 | H232: =RANK(H231,(H$6,H$8,H$10,H$12,H$14,H$16,H$18,H$20,H$22,H$24,H$26,H$28,H$30,H$32,H$34,H$36,H$38,H$40,H$42,H$44,H$46,H$48,H$50,H$52,H$54,H$56,H$58,H$60,H$62,H$64,H$66,H$68,H$70,H$72,H$74,H$76,H$78,H$80,H$82,H$84,H$86,H$88,H$90,H$92,H$94,H$96,H$98,H$100,H$102,H$104,H$106,H$108,H$110,H$112,H$114,H$116,H$118,H$120,H$122,H$124)) -> 4 | I232: =RANK(I231,(I$6,I$8,I$10,I$12,I$14,I$16,I$18,I$20,I$22,I$24,I$26,I$28,I$30,I$32,I$34,I$36,I$38,I$40,I$42,I$44,I$46,I$48,I$50,I$52,I$54,I$56,I$58,I$60,I$62,I$64,I$66,I$68,I$70,I$72,I$74,I$76,I$78,I$80,I$82,I$84,I$86,I$88,I$90,I$92,I$94,I$96,I$98,I$100,I$102,I$104,I$106,I$108,I$110,I$112,I$114,I$116,I$118,I$120,I$122,I$124)) -> 5 | J232: =RANK(J231,(J$6,J$8,J$10,J$12,J$14,J$16,J$18,J$20,J$22,J$24,J$26,J$28,J$30,J$32,J$34,J$36,J$38,J$40,J$42,J$44,J$46,J$48,J$50,J$52,J$54,J$56,J$58,J$60,J$62,J$64,J$66,J$68,J$70,J$72,J$74,J$76,J$78,J$80,J$82,J$84,J$86,J$88,J$90,J$92,J$94,J$96,J$98,J$100,J$102,J$104,J$106,J$108,J$110,J$112,J$114,J$116,J$118,J$120,J$122,J$124)) -> 5 | K232: =RANK(K231,(K$6,K$8,K$10,K$12,K$14,K$16,K$18,K$20,K$22,K$24,K$26,K$28,K$30,K$32,K$34,K$36,K$38,K$40,K$42,K$44,K$46,K$48,K$50,K$52,K$54,K$56,K$58,K$60,K$62,K$64,K$66,K$68,K$70,K$72,K$74,K$76,K$78,K$80,K$82,K$84,K$86,K$88,K$90,K$92,K$94,K$96,K$98,K$100,K$102,K$104,K$106,K$108,K$110,K$112,K$114,K$116,K$118,K$120,K$122,K$124)) -> 5 | L232: =RANK(L231,(L$6,L$8,L$10,L$12,L$14,L$16,L$18,L$20,L$22,L$24,L$26,L$28,L$30,L$32,L$34,L$36,L$38,L$40,L$42,L$44,L$46,L$48,L$50,L$52,L$54,L$56,L$58,L$60,L$62,L$64,L$66,L$68,L$70,L$72,L$74,L$76,L$78,L$80,L$82,L$84,L$86,L$88,L$90,L$92,L$94,L$96,L$98,L$100,L$102,L$104,L$106,L$108,L$110,L$112,L$114,L$116,L$118,L$120,L$122,L$124)) -> 5 | M232: =RANK(M231,(M$6,M$8,M$10,M$12,M$14,M$16,M$18,M$20,M$22,M$24,M$26,M$28,M$30,M$32,M$34,M$36,M$38,M$40,M$42,M$44,M$46,M$48,M$50,M$52,M$54,M$56,M$58,M$60,M$62,M$64,M$66,M$68,M$70,M$72,M$74,M$76,M$78,M$80,M$82,M$84,M$86,M$88,M$90,M$92,M$94,M$96,M$98,M$100,M$102,M$104,M$106,M$108,M$110,M$112,M$114,M$116,M$118,M$120,M$122,M$124)) -> 5 | N232: =RANK(N231,(N$6,N$8,N$10,N$12,N$14,N$16,N$18,N$20,N$22,N$24,N$26,N$28,N$30,N$32,N$34,N$36,N$38,N$40,N$42,N$44,N$46,N$48,N$50,N$52,N$54,N$56,N$58,N$60,N$62,N$64,N$66,N$68,N$70,N$72,N$74,N$76,N$78,N$80,N$82,N$84,N$86,N$88,N$90,N$92,N$94,N$96,N$98,N$100,N$102,N$104,N$106,N$108,N$110,N$112,N$114,N$116,N$118,N$120,N$122,N$124)) -> 5 | P232: =RANK(P231,(P$6,P$8,P$10,P$12,P$14,P$16,P$18,P$20,P$22,P$24,P$26,P$28,P$30,P$32,P$34,P$36,P$38,P$40,P$42,P$44,P$46,P$48,P$50,P$52,P$54,P$56,P$58,P$60,P$62,P$64,P$66,P$68,P$70,P$72,P$74,P$76,P$78,P$80,P$82,P$84,P$86,P$88,P$90,P$92,P$94,P$96,P$98,P$100,P$102,P$104,P$106,P$108,P$110,P$112,P$114,P$116,P$118,P$120,P$122,P$124)) -> 5
A233: Raiders | B233: 1 | C233: 13.10 | D233: 13.00 | E233: 26.10 | F233: 12.60 | G233: 13.30 | H233: 12.60 | I233: 19.25 | J233: 12.50 | K233: 12.50 | L233: 12.40 | M233: 18.70 | N233: 64.05 | O233: 0.0 | P233: 64.05
C234: =RANK(C233,(C$6,C$8,C$10,C$12,C$14,C$16,C$18,C$20,C$22,C$24,C$26,C$28,C$30,C$32,C$34,C$36,C$38,C$40,C$42,C$44,C$46,C$48,C$50,C$52,C$54,C$56,C$58,C$60,C$62,C$64,C$66,C$68,C$70,C$72,C$74,C$76,C$78,C$80,C$82,C$84,C$86,C$88,C$90,C$92,C$94,C$96,C$98,C$100,C$102,C$104,C$106,C$108,C$110,C$112,C$114,C$116,C$118,C$120,C$122,C$124)) -> 6 | D234: =RANK(D233,(D$6,D$8,D$10,D$12,D$14,D$16,D$18,D$20,D$22,D$24,D$26,D$28,D$30,D$32,D$34,D$36,D$38,D$40,D$42,D$44,D$46,D$48,D$50,D$52,D$54,D$56,D$58,D$60,D$62,D$64,D$66,D$68,D$70,D$72,D$74,D$76,D$78,D$80,D$82,D$84,D$86,D$88,D$90,D$92,D$94,D$96,D$98,D$100,D$102,D$104,D$106,D$108,D$110,D$112,D$114,D$116,D$118,D$120,D$122,D$124)) -> 6 | E234: =RANK(E233,(E$6,E$8,E$10,E$12,E$14,E$16,E$18,E$20,E$22,E$24,E$26,E$28,E$30,E$32,E$34,E$36,E$38,E$40,E$42,E$44,E$46,E$48,E$50,E$52,E$54,E$56,E$58,E$60,E$62,E$64,E$66,E$68,E$70,E$72,E$74,E$76,E$78,E$80,E$82,E$84,E$86,E$88,E$90,E$92,E$94,E$96,E$98,E$100,E$102,E$104,E$106,E$108,E$110,E$112,E$114,E$116,E$118,E$120,E$122,E$124)) -> 6 | F234: =RANK(F233,(F$6,F$8,F$10,F$12,F$14,F$16,F$18,F$20,F$22,F$24,F$26,F$28,F$30,F$32,F$34,F$36,F$38,F$40,F$42,F$44,F$46,F$48,F$50,F$52,F$54,F$56,F$58,F$60,F$62,F$64,F$66,F$68,F$70,F$72,F$74,F$76,F$78,F$80,F$82,F$84,F$86,F$88,F$90,F$92,F$94,F$96,F$98,F$100,F$102,F$104,F$106,F$108,F$110,F$112,F$114,F$116,F$118,F$120,F$122,F$124)) -> 6 | G234: =RANK(G233,(G$6,G$8,G$10,G$12,G$14,G$16,G$18,G$20,G$22,G$24,G$26,G$28,G$30,G$32,G$34,G$36,G$38,G$40,G$42,G$44,G$46,G$48,G$50,G$52,G$54,G$56,G$58,G$60,G$62,G$64,G$66,G$68,G$70,G$72,G$74,G$76,G$78,G$80,G$82,G$84,G$86,G$88,G$90,G$92,G$94,G$96,G$98,G$100,G$102,G$104,G$106,G$108,G$110,G$112,G$114,G$116,G$118,G$120,G$122,G$124)) -> 4 | H234: =RANK(H233,(H$6,H$8,H$10,H$12,H$14,H$16,H$18,H$20,H$22,H$24,H$26,H$28,H$30,H$32,H$34,H$36,H$38,H$40,H$42,H$44,H$46,H$48,H$50,H$52,H$54,H$56,H$58,H$60,H$62,H$64,H$66,H$68,H$70,H$72,H$74,H$76,H$78,H$80,H$82,H$84,H$86,H$88,H$90,H$92,H$94,H$96,H$98,H$100,H$102,H$104,H$106,H$108,H$110,H$112,H$114,H$116,H$118,H$120,H$122,H$124)) -> 6 | I234: =RANK(I233,(I$6,I$8,I$10,I$12,I$14,I$16,I$18,I$20,I$22,I$24,I$26,I$28,I$30,I$32,I$34,I$36,I$38,I$40,I$42,I$44,I$46,I$48,I$50,I$52,I$54,I$56,I$58,I$60,I$62,I$64,I$66,I$68,I$70,I$72,I$74,I$76,I$78,I$80,I$82,I$84,I$86,I$88,I$90,I$92,I$94,I$96,I$98,I$100,I$102,I$104,I$106,I$108,I$110,I$112,I$114,I$116,I$118,I$120,I$122,I$124)) -> 6 | J234: =RANK(J233,(J$6,J$8,J$10,J$12,J$14,J$16,J$18,J$20,J$22,J$24,J$26,J$28,J$30,J$32,J$34,J$36,J$38,J$40,J$42,J$44,J$46,J$48,J$50,J$52,J$54,J$56,J$58,J$60,J$62,J$64,J$66,J$68,J$70,J$72,J$74,J$76,J$78,J$80,J$82,J$84,J$86,J$88,J$90,J$92,J$94,J$96,J$98,J$100,J$102,J$104,J$106,J$108,J$110,J$112,J$114,J$116,J$118,J$120,J$122,J$124)) -> 6 | K234: =RANK(K233,(K$6,K$8,K$10,K$12,K$14,K$16,K$18,K$20,K$22,K$24,K$26,K$28,K$30,K$32,K$34,K$36,K$38,K$40,K$42,K$44,K$46,K$48,K$50,K$52,K$54,K$56,K$58,K$60,K$62,K$64,K$66,K$68,K$70,K$72,K$74,K$76,K$78,K$80,K$82,K$84,K$86,K$88,K$90,K$92,K$94,K$96,K$98,K$100,K$102,K$104,K$106,K$108,K$110,K$112,K$114,K$116,K$118,K$120,K$122,K$124)) -> 6 | L234: =RANK(L233,(L$6,L$8,L$10,L$12,L$14,L$16,L$18,L$20,L$22,L$24,L$26,L$28,L$30,L$32,L$34,L$36,L$38,L$40,L$42,L$44,L$46,L$48,L$50,L$52,L$54,L$56,L$58,L$60,L$62,L$64,L$66,L$68,L$70,L$72,L$74,L$76,L$78,L$80,L$82,L$84,L$86,L$88,L$90,L$92,L$94,L$96,L$98,L$100,L$102,L$104,L$106,L$108,L$110,L$112,L$114,L$116,L$118,L$120,L$122,L$124)) -> 6 | M234: =RANK(M233,(M$6,M$8,M$10,M$12,M$14,M$16,M$18,M$20,M$22,M$24,M$26,M$28,M$30,M$32,M$34,M$36,M$38,M$40,M$42,M$44,M$46,M$48,M$50,M$52,M$54,M$56,M$58,M$60,M$62,M$64,M$66,M$68,M$70,M$72,M$74,M$76,M$78,M$80,M$82,M$84,M$86,M$88,M$90,M$92,M$94,M$96,M$98,M$100,M$102,M$104,M$106,M$108,M$110,M$112,M$114,M$116,M$118,M$120,M$122,M$124)) -> 6 | N234: =RANK(N233,(N$6,N$8,N$10,N$12,N$14,N$16,N$18,N$20,N$22,N$24,N$26,N$28,N$30,N$32,N$34,N$36,N$38,N$40,N$42,N$44,N$46,N$48,N$50,N$52,N$54,N$56,N$58,N$60,N$62,N$64,N$66,N$68,N$70,N$72,N$74,N$76,N$78,N$80,N$82,N$84,N$86,N$88,N$90,N$92,N$94,N$96,N$98,N$100,N$102,N$104,N$106,N$108,N$110,N$112,N$114,N$116,N$118,N$120,N$122,N$124)) -> 6 | P234: =RANK(P233,(P$6,P$8,P$10,P$12,P$14,P$16,P$18,P$20,P$22,P$24,P$26,P$28,P$30,P$32,P$34,P$36,P$38,P$40,P$42,P$44,P$46,P$48,P$50,P$52,P$54,P$56,P$58,P$60,P$62,P$64,P$66,P$68,P$70,P$72,P$74,P$76,P$78,P$80,P$82,P$84,P$86,P$88,P$90,P$92,P$94,P$96,P$98,P$100,P$102,P$104,P$106,P$108,P$110,P$112,P$114,P$116,P$118,P$120,P$122,P$124)) -> 6
A237: 8/5/2022 Cedar Rapids, Iowa
C238: General Effect | F238: Visual | J238: Music
C239: 1 | D239: 2 | F239: Proficiency | G239: Analysis | H239: Color Guard | J239: Brass | K239: Analysis | L239: Percussion | N239: Sub | P239: Total
C240: M. Czapinski | D240: J. Rhodes | E240: Total | F240: R. Solomon | G240: C. Clayton | H240: D. Deems | I240: Total ÷2 | J240: A. Cook | K240: A. Kristensen | L240: M. Davis | M240: Total ÷2 | N240: Total | O240: Pen | P240: Score
A241: DCI World Class | C241: 20 | D241: 20 | E241: 40 | F241: 20 | G241: 20 | H241: 20 | I241: 30 | J241: 20 | K241: 20 | L241: 20 | M241: 30 | N241: 100 | P241: 100
A242: Vanguard | B242: 1 | C242: 16.00 | D242: 16.10 | E242: 32.10 | F242: 15.40 | G242: 15.80 | H242: 15.60 | I242: 23.40 | J242: 15.70 | K242: 15.90 | L242: 15.10 | M242: 23.35 | N242: 78.85 | O242: 0.0 | P242: 78.85
A243: Cadets | C243: =RANK(C242,(C$6,C$8,C$10,C$12,C$14,C$16,C$18,C$20,C$22,C$24,C$26,C$28,C$30,C$32,C$34,C$36,C$38,C$40,C$42,C$44,C$46,C$48,C$50,C$52,C$54,C$56,C$58,C$60,C$62,C$64,C$66,C$68,C$70,C$72,C$74,C$76,C$78,C$80,C$82,C$84,C$86,C$88,C$90,C$92,C$94,C$96,C$98,C$100,C$102,C$104,C$106,C$108,C$110,C$112,C$114,C$116,C$118,C$120,C$122,C$124)) -> 2 | D243: =RANK(D242,(D$6,D$8,D$10,D$12,D$14,D$16,D$18,D$20,D$22,D$24,D$26,D$28,D$30,D$32,D$34,D$36,D$38,D$40,D$42,D$44,D$46,D$48,D$50,D$52,D$54,D$56,D$58,D$60,D$62,D$64,D$66,D$68,D$70,D$72,D$74,D$76,D$78,D$80,D$82,D$84,D$86,D$88,D$90,D$92,D$94,D$96,D$98,D$100,D$102,D$104,D$106,D$108,D$110,D$112,D$114,D$116,D$118,D$120,D$122,D$124)) -> 2 | E243: =RANK(E242,(E$6,E$8,E$10,E$12,E$14,E$16,E$18,E$20,E$22,E$24,E$26,E$28,E$30,E$32,E$34,E$36,E$38,E$40,E$42,E$44,E$46,E$48,E$50,E$52,E$54,E$56,E$58,E$60,E$62,E$64,E$66,E$68,E$70,E$72,E$74,E$76,E$78,E$80,E$82,E$84,E$86,E$88,E$90,E$92,E$94,E$96,E$98,E$100,E$102,E$104,E$106,E$108,E$110,E$112,E$114,E$116,E$118,E$120,E$122,E$124)) -> 2 | F243: =RANK(F242,(F$6,F$8,F$10,F$12,F$14,F$16,F$18,F$20,F$22,F$24,F$26,F$28,F$30,F$32,F$34,F$36,F$38,F$40,F$42,F$44,F$46,F$48,F$50,F$52,F$54,F$56,F$58,F$60,F$62,F$64,F$66,F$68,F$70,F$72,F$74,F$76,F$78,F$80,F$82,F$84,F$86,F$88,F$90,F$92,F$94,F$96,F$98,F$100,F$102,F$104,F$106,F$108,F$110,F$112,F$114,F$116,F$118,F$120,F$122,F$124)) -> 1 | G243: =RANK(G242,(G$6,G$8,G$10,G$12,G$14,G$16,G$18,G$20,G$22,G$24,G$26,G$28,G$30,G$32,G$34,G$36,G$38,G$40,G$42,G$44,G$46,G$48,G$50,G$52,G$54,G$56,G$58,G$60,G$62,G$64,G$66,G$68,G$70,G$72,G$74,G$76,G$78,G$80,G$82,G$84,G$86,G$88,G$90,G$92,G$94,G$96,G$98,G$100,G$102,G$104,G$106,G$108,G$110,G$112,G$114,G$116,G$118,G$120,G$122,G$124)) -> 1 | H243: =RANK(H242,(H$6,H$8,H$10,H$12,H$14,H$16,H$18,H$20,H$22,H$24,H$26,H$28,H$30,H$32,H$34,H$36,H$38,H$40,H$42,H$44,H$46,H$48,H$50,H$52,H$54,H$56,H$58,H$60,H$62,H$64,H$66,H$68,H$70,H$72,H$74,H$76,H$78,H$80,H$82,H$84,H$86,H$88,H$90,H$92,H$94,H$96,H$98,H$100,H$102,H$104,H$106,H$108,H$110,H$112,H$114,H$116,H$118,H$120,H$122,H$124)) -> 2 | I243: =RANK(I242,(I$6,I$8,I$10,I$12,I$14,I$16,I$18,I$20,I$22,I$24,I$26,I$28,I$30,I$32,I$34,I$36,I$38,I$40,I$42,I$44,I$46,I$48,I$50,I$52,I$54,I$56,I$58,I$60,I$62,I$64,I$66,I$68,I$70,I$72,I$74,I$76,I$78,I$80,I$82,I$84,I$86,I$88,I$90,I$92,I$94,I$96,I$98,I$100,I$102,I$104,I$106,I$108,I$110,I$112,I$114,I$116,I$118,I$120,I$122,I$124)) -> 1 | J243: =RANK(J242,(J$6,J$8,J$10,J$12,J$14,J$16,J$18,J$20,J$22,J$24,J$26,J$28,J$30,J$32,J$34,J$36,J$38,J$40,J$42,J$44,J$46,J$48,J$50,J$52,J$54,J$56,J$58,J$60,J$62,J$64,J$66,J$68,J$70,J$72,J$74,J$76,J$78,J$80,J$82,J$84,J$86,J$88,J$90,J$92,J$94,J$96,J$98,J$100,J$102,J$104,J$106,J$108,J$110,J$112,J$114,J$116,J$118,J$120,J$122,J$124)) -> 1 | K243: =RANK(K242,(K$6,K$8,K$10,K$12,K$14,K$16,K$18,K$20,K$22,K$24,K$26,K$28,K$30,K$32,K$34,K$36,K$38,K$40,K$42,K$44,K$46,K$48,K$50,K$52,K$54,K$56,K$58,K$60,K$62,K$64,K$66,K$68,K$70,K$72,K$74,K$76,K$78,K$80,K$82,K$84,K$86,K$88,K$90,K$92,K$94,K$96,K$98,K$100,K$102,K$104,K$106,K$108,K$110,K$112,K$114,K$116,K$118,K$120,K$122,K$124)) -> 1 | L243: =RANK(L242,(L$6,L$8,L$10,L$12,L$14,L$16,L$18,L$20,L$22,L$24,L$26,L$28,L$30,L$32,L$34,L$36,L$38,L$40,L$42,L$44,L$46,L$48,L$50,L$52,L$54,L$56,L$58,L$60,L$62,L$64,L$66,L$68,L$70,L$72,L$74,L$76,L$78,L$80,L$82,L$84,L$86,L$88,L$90,L$92,L$94,L$96,L$98,L$100,L$102,L$104,L$106,L$108,L$110,L$112,L$114,L$116,L$118,L$120,L$122,L$124)) -> 2 | M243: =RANK(M242,(M$6,M$8,M$10,M$12,M$14,M$16,M$18,M$20,M$22,M$24,M$26,M$28,M$30,M$32,M$34,M$36,M$38,M$40,M$42,M$44,M$46,M$48,M$50,M$52,M$54,M$56,M$58,M$60,M$62,M$64,M$66,M$68,M$70,M$72,M$74,M$76,M$78,M$80,M$82,M$84,M$86,M$88,M$90,M$92,M$94,M$96,M$98,M$100,M$102,M$104,M$106,M$108,M$110,M$112,M$114,M$116,M$118,M$120,M$122,M$124)) -> 1 | N243: =RANK(N242,(N$6,N$8,N$10,N$12,N$14,N$16,N$18,N$20,N$22,N$24,N$26,N$28,N$30,N$32,N$34,N$36,N$38,N$40,N$42,N$44,N$46,N$48,N$50,N$52,N$54,N$56,N$58,N$60,N$62,N$64,N$66,N$68,N$70,N$72,N$74,N$76,N$78,N$80,N$82,N$84,N$86,N$88,N$90,N$92,N$94,N$96,N$98,N$100,N$102,N$104,N$106,N$108,N$110,N$112,N$114,N$116,N$118,N$120,N$122,N$124)) -> 1 | P243: =RANK(P242,(P$6,P$8,P$10,P$12,P$14,P$16,P$18,P$20,P$22,P$24,P$26,P$28,P$30,P$32,P$34,P$36,P$38,P$40,P$42,P$44,P$46,P$48,P$50,P$52,P$54,P$56,P$58,P$60,P$62,P$64,P$66,P$68,P$70,P$72,P$74,P$76,P$78,P$80,P$82,P$84,P$86,P$88,P$90,P$92,P$94,P$96,P$98,P$100,P$102,P$104,P$106,P$108,P$110,P$112,P$114,P$116,P$118,P$120,P$122,P$124)) -> 1
A244: Gold | B244: 6 | C244: 16.30 | D244: 16.40 | E244: 32.70 | F244: 15.10 | G244: 15.70 | H244: 15.50 | I244: 23.15 | J244: 15.50 | K244: 15.10 | L244: 15.20 | M244: 22.90 | N244: 78.75 | O244: 0.0 | P244: 78.75
C245: =RANK(C244,(C$6,C$8,C$10,C$12,C$14,C$16,C$18,C$20,C$22,C$24,C$26,C$28,C$30,C$32,C$34,C$36,C$38,C$40,C$42,C$44,C$46,C$48,C$50,C$52,C$54,C$56,C$58,C$60,C$62,C$64,C$66,C$68,C$70,C$72,C$74,C$76,C$78,C$80,C$82,C$84,C$86,C$88,C$90,C$92,C$94,C$96,C$98,C$100,C$102,C$104,C$106,C$108,C$110,C$112,C$114,C$116,C$118,C$120,C$122,C$124)) -> 1 | D245: =RANK(D244,(D$6,D$8,D$10,D$12,D$14,D$16,D$18,D$20,D$22,D$24,D$26,D$28,D$30,D$32,D$34,D$36,D$38,D$40,D$42,D$44,D$46,D$48,D$50,D$52,D$54,D$56,D$58,D$60,D$62,D$64,D$66,D$68,D$70,D$72,D$74,D$76,D$78,D$80,D$82,D$84,D$86,D$88,D$90,D$92,D$94,D$96,D$98,D$100,D$102,D$104,D$106,D$108,D$110,D$112,D$114,D$116,D$118,D$120,D$122,D$124)) -> 1 | E245: =RANK(E244,(E$6,E$8,E$10,E$12,E$14,E$16,E$18,E$20,E$22,E$24,E$26,E$28,E$30,E$32,E$34,E$36,E$38,E$40,E$42,E$44,E$46,E$48,E$50,E$52,E$54,E$56,E$58,E$60,E$62,E$64,E$66,E$68,E$70,E$72,E$74,E$76,E$78,E$80,E$82,E$84,E$86,E$88,E$90,E$92,E$94,E$96,E$98,E$100,E$102,E$104,E$106,E$108,E$110,E$112,E$114,E$116,E$118,E$120,E$122,E$124)) -> 1 | F245: =RANK(F244,(F$6,F$8,F$10,F$12,F$14,F$16,F$18,F$20,F$22,F$24,F$26,F$28,F$30,F$32,F$34,F$36,F$38,F$40,F$42,F$44,F$46,F$48,F$50,F$52,F$54,F$56,F$58,F$60,F$62,F$64,F$66,F$68,F$70,F$72,F$74,F$76,F$78,F$80,F$82,F$84,F$86,F$88,F$90,F$92,F$94,F$96,F$98,F$100,F$102,F$104,F$106,F$108,F$110,F$112,F$114,F$116,F$118,F$120,F$122,F$124)) -> 2 | G245: =RANK(G244,(G$6,G$8,G$10,G$12,G$14,G$16,G$18,G$20,G$22,G$24,G$26,G$28,G$30,G$32,G$34,G$36,G$38,G$40,G$42,G$44,G$46,G$48,G$50,G$52,G$54,G$56,G$58,G$60,G$62,G$64,G$66,G$68,G$70,G$72,G$74,G$76,G$78,G$80,G$82,G$84,G$86,G$88,G$90,G$92,G$94,G$96,G$98,G$100,G$102,G$104,G$106,G$108,G$110,G$112,G$114,G$116,G$118,G$120,G$122,G$124)) -> 2 | H245: =RANK(H244,(H$6,H$8,H$10,H$12,H$14,H$16,H$18,H$20,H$22,H$24,H$26,H$28,H$30,H$32,H$34,H$36,H$38,H$40,H$42,H$44,H$46,H$48,H$50,H$52,H$54,H$56,H$58,H$60,H$62,H$64,H$66,H$68,H$70,H$72,H$74,H$76,H$78,H$80,H$82,H$84,H$86,H$88,H$90,H$92,H$94,H$96,H$98,H$100,H$102,H$104,H$106,H$108,H$110,H$112,H$114,H$116,H$118,H$120,H$122,H$124)) -> 3 | I245: =RANK(I244,(I$6,I$8,I$10,I$12,I$14,I$16,I$18,I$20,I$22,I$24,I$26,I$28,I$30,I$32,I$34,I$36,I$38,I$40,I$42,I$44,I$46,I$48,I$50,I$52,I$54,I$56,I$58,I$60,I$62,I$64,I$66,I$68,I$70,I$72,I$74,I$76,I$78,I$80,I$82,I$84,I$86,I$88,I$90,I$92,I$94,I$96,I$98,I$100,I$102,I$104,I$106,I$108,I$110,I$112,I$114,I$116,I$118,I$120,I$122,I$124)) -> 2 | J245: =RANK(J244,(J$6,J$8,J$10,J$12,J$14,J$16,J$18,J$20,J$22,J$24,J$26,J$28,J$30,J$32,J$34,J$36,J$38,J$40,J$42,J$44,J$46,J$48,J$50,J$52,J$54,J$56,J$58,J$60,J$62,J$64,J$66,J$68,J$70,J$72,J$74,J$76,J$78,J$80,J$82,J$84,J$86,J$88,J$90,J$92,J$94,J$96,J$98,J$100,J$102,J$104,J$106,J$108,J$110,J$112,J$114,J$116,J$118,J$120,J$122,J$124)) -> 2 | K245: =RANK(K244,(K$6,K$8,K$10,K$12,K$14,K$16,K$18,K$20,K$22,K$24,K$26,K$28,K$30,K$32,K$34,K$36,K$38,K$40,K$42,K$44,K$46,K$48,K$50,K$52,K$54,K$56,K$58,K$60,K$62,K$64,K$66,K$68,K$70,K$72,K$74,K$76,K$78,K$80,K$82,K$84,K$86,K$88,K$90,K$92,K$94,K$96,K$98,K$100,K$102,K$104,K$106,K$108,K$110,K$112,K$114,K$116,K$118,K$120,K$122,K$124)) -> 3 | L245: =RANK(L244,(L$6,L$8,L$10,L$12,L$14,L$16,L$18,L$20,L$22,L$24,L$26,L$28,L$30,L$32,L$34,L$36,L$38,L$40,L$42,L$44,L$46,L$48,L$50,L$52,L$54,L$56,L$58,L$60,L$62,L$64,L$66,L$68,L$70,L$72,L$74,L$76,L$78,L$80,L$82,L$84,L$86,L$88,L$90,L$92,L$94,L$96,L$98,L$100,L$102,L$104,L$106,L$108,L$110,L$112,L$114,L$116,L$118,L$120,L$122,L$124)) -> 1 | M245: =RANK(M244,(M$6,M$8,M$10,M$12,M$14,M$16,M$18,M$20,M$22,M$24,M$26,M$28,M$30,M$32,M$34,M$36,M$38,M$40,M$42,M$44,M$46,M$48,M$50,M$52,M$54,M$56,M$58,M$60,M$62,M$64,M$66,M$68,M$70,M$72,M$74,M$76,M$78,M$80,M$82,M$84,M$86,M$88,M$90,M$92,M$94,M$96,M$98,M$100,M$102,M$104,M$106,M$108,M$110,M$112,M$114,M$116,M$118,M$120,M$122,M$124)) -> 2 | N245: =RANK(N244,(N$6,N$8,N$10,N$12,N$14,N$16,N$18,N$20,N$22,N$24,N$26,N$28,N$30,N$32,N$34,N$36,N$38,N$40,N$42,N$44,N$46,N$48,N$50,N$52,N$54,N$56,N$58,N$60,N$62,N$64,N$66,N$68,N$70,N$72,N$74,N$76,N$78,N$80,N$82,N$84,N$86,N$88,N$90,N$92,N$94,N$96,N$98,N$100,N$102,N$104,N$106,N$108,N$110,N$112,N$114,N$116,N$118,N$120,N$122,N$124)) -> 2 | P245: =RANK(P244,(P$6,P$8,P$10,P$12,P$14,P$16,P$18,P$20,P$22,P$24,P$26,P$28,P$30,P$32,P$34,P$36,P$38,P$40,P$42,P$44,P$46,P$48,P$50,P$52,P$54,P$56,P$58,P$60,P$62,P$64,P$66,P$68,P$70,P$72,P$74,P$76,P$78,P$80,P$82,P$84,P$86,P$88,P$90,P$92,P$94,P$96,P$98,P$100,P$102,P$104,P$106,P$108,P$110,P$112,P$114,P$116,P$118,P$120,P$122,P$124)) -> 2
A246: Guardians | B246: 5 | C246: 15.40 | D246: 15.40 | E246: 30.80 | F246: 14.90 | G246: 14.80 | H246: 15.70 | I246: 22.70 | J246: 15.20 | K246: 15.40 | L246: 15.00 | M246: 22.80 | N246: 76.30 | O246: 0.0 | P246: 76.30
C247: =RANK(C246,(C$6,C$8,C$10,C$12,C$14,C$16,C$18,C$20,C$22,C$24,C$26,C$28,C$30,C$32,C$34,C$36,C$38,C$40,C$42,C$44,C$46,C$48,C$50,C$52,C$54,C$56,C$58,C$60,C$62,C$64,C$66,C$68,C$70,C$72,C$74,C$76,C$78,C$80,C$82,C$84,C$86,C$88,C$90,C$92,C$94,C$96,C$98,C$100,C$102,C$104,C$106,C$108,C$110,C$112,C$114,C$116,C$118,C$120,C$122,C$124)) -> 3 | D247: =RANK(D246,(D$6,D$8,D$10,D$12,D$14,D$16,D$18,D$20,D$22,D$24,D$26,D$28,D$30,D$32,D$34,D$36,D$38,D$40,D$42,D$44,D$46,D$48,D$50,D$52,D$54,D$56,D$58,D$60,D$62,D$64,D$66,D$68,D$70,D$72,D$74,D$76,D$78,D$80,D$82,D$84,D$86,D$88,D$90,D$92,D$94,D$96,D$98,D$100,D$102,D$104,D$106,D$108,D$110,D$112,D$114,D$116,D$118,D$120,D$122,D$124)) -> 3 | E247: =RANK(E246,(E$6,E$8,E$10,E$12,E$14,E$16,E$18,E$20,E$22,E$24,E$26,E$28,E$30,E$32,E$34,E$36,E$38,E$40,E$42,E$44,E$46,E$48,E$50,E$52,E$54,E$56,E$58,E$60,E$62,E$64,E$66,E$68,E$70,E$72,E$74,E$76,E$78,E$80,E$82,E$84,E$86,E$88,E$90,E$92,E$94,E$96,E$98,E$100,E$102,E$104,E$106,E$108,E$110,E$112,E$114,E$116,E$118,E$120,E$122,E$124)) -> 3 | F247: =RANK(F246,(F$6,F$8,F$10,F$12,F$14,F$16,F$18,F$20,F$22,F$24,F$26,F$28,F$30,F$32,F$34,F$36,F$38,F$40,F$42,F$44,F$46,F$48,F$50,F$52,F$54,F$56,F$58,F$60,F$62,F$64,F$66,F$68,F$70,F$72,F$74,F$76,F$78,F$80,F$82,F$84,F$86,F$88,F$90,F$92,F$94,F$96,F$98,F$100,F$102,F$104,F$106,F$108,F$110,F$112,F$114,F$116,F$118,F$120,F$122,F$124)) -> 3 | G247: =RANK(G246,(G$6,G$8,G$10,G$12,G$14,G$16,G$18,G$20,G$22,G$24,G$26,G$28,G$30,G$32,G$34,G$36,G$38,G$40,G$42,G$44,G$46,G$48,G$50,G$52,G$54,G$56,G$58,G$60,G$62,G$64,G$66,G$68,G$70,G$72,G$74,G$76,G$78,G$80,G$82,G$84,G$86,G$88,G$90,G$92,G$94,G$96,G$98,G$100,G$102,G$104,G$106,G$108,G$110,G$112,G$114,G$116,G$118,G$120,G$122,G$124)) -> 3 | H247: =RANK(H246,(H$6,H$8,H$10,H$12,H$14,H$16,H$18,H$20,H$22,H$24,H$26,H$28,H$30,H$32,H$34,H$36,H$38,H$40,H$42,H$44,H$46,H$48,H$50,H$52,H$54,H$56,H$58,H$60,H$62,H$64,H$66,H$68,H$70,H$72,H$74,H$76,H$78,H$80,H$82,H$84,H$86,H$88,H$90,H$92,H$94,H$96,H$98,H$100,H$102,H$104,H$106,H$108,H$110,H$112,H$114,H$116,H$118,H$120,H$122,H$124)) -> 1 | I247: =RANK(I246,(I$6,I$8,I$10,I$12,I$14,I$16,I$18,I$20,I$22,I$24,I$26,I$28,I$30,I$32,I$34,I$36,I$38,I$40,I$42,I$44,I$46,I$48,I$50,I$52,I$54,I$56,I$58,I$60,I$62,I$64,I$66,I$68,I$70,I$72,I$74,I$76,I$78,I$80,I$82,I$84,I$86,I$88,I$90,I$92,I$94,I$96,I$98,I$100,I$102,I$104,I$106,I$108,I$110,I$112,I$114,I$116,I$118,I$120,I$122,I$124)) -> 3 | J247: =RANK(J246,(J$6,J$8,J$10,J$12,J$14,J$16,J$18,J$20,J$22,J$24,J$26,J$28,J$30,J$32,J$34,J$36,J$38,J$40,J$42,J$44,J$46,J$48,J$50,J$52,J$54,J$56,J$58,J$60,J$62,J$64,J$66,J$68,J$70,J$72,J$74,J$76,J$78,J$80,J$82,J$84,J$86,J$88,J$90,J$92,J$94,J$96,J$98,J$100,J$102,J$104,J$106,J$108,J$110,J$112,J$114,J$116,J$118,J$120,J$122,J$124)) -> 3 | K247: =RANK(K246,(K$6,K$8,K$10,K$12,K$14,K$16,K$18,K$20,K$22,K$24,K$26,K$28,K$30,K$32,K$34,K$36,K$38,K$40,K$42,K$44,K$46,K$48,K$50,K$52,K$54,K$56,K$58,K$60,K$62,K$64,K$66,K$68,K$70,K$72,K$74,K$76,K$78,K$80,K$82,K$84,K$86,K$88,K$90,K$92,K$94,K$96,K$98,K$100,K$102,K$104,K$106,K$108,K$110,K$112,K$114,K$116,K$118,K$120,K$122,K$124)) -> 2 | L247: =RANK(L246,(L$6,L$8,L$10,L$12,L$14,L$16,L$18,L$20,L$22,L$24,L$26,L$28,L$30,L$32,L$34,L$36,L$38,L$40,L$42,L$44,L$46,L$48,L$50,L$52,L$54,L$56,L$58,L$60,L$62,L$64,L$66,L$68,L$70,L$72,L$74,L$76,L$78,L$80,L$82,L$84,L$86,L$88,L$90,L$92,L$94,L$96,L$98,L$100,L$102,L$104,L$106,L$108,L$110,L$112,L$114,L$116,L$118,L$120,L$122,L$124)) -> 3 | M247: =RANK(M246,(M$6,M$8,M$10,M$12,M$14,M$16,M$18,M$20,M$22,M$24,M$26,M$28,M$30,M$32,M$34,M$36,M$38,M$40,M$42,M$44,M$46,M$48,M$50,M$52,M$54,M$56,M$58,M$60,M$62,M$64,M$66,M$68,M$70,M$72,M$74,M$76,M$78,M$80,M$82,M$84,M$86,M$88,M$90,M$92,M$94,M$96,M$98,M$100,M$102,M$104,M$106,M$108,M$110,M$112,M$114,M$116,M$118,M$120,M$122,M$124)) -> 3 | N247: =RANK(N246,(N$6,N$8,N$10,N$12,N$14,N$16,N$18,N$20,N$22,N$24,N$26,N$28,N$30,N$32,N$34,N$36,N$38,N$40,N$42,N$44,N$46,N$48,N$50,N$52,N$54,N$56,N$58,N$60,N$62,N$64,N$66,N$68,N$70,N$72,N$74,N$76,N$78,N$80,N$82,N$84,N$86,N$88,N$90,N$92,N$94,N$96,N$98,N$100,N$102,N$104,N$106,N$108,N$110,N$112,N$114,N$116,N$118,N$120,N$122,N$124)) -> 3 | P247: =RANK(P246,(P$6,P$8,P$10,P$12,P$14,P$16,P$18,P$20,P$22,P$24,P$26,P$28,P$30,P$32,P$34,P$36,P$38,P$40,P$42,P$44,P$46,P$48,P$50,P$52,P$54,P$56,P$58,P$60,P$62,P$64,P$66,P$68,P$70,P$72,P$74,P$76,P$78,P$80,P$82,P$84,P$86,P$88,P$90,P$92,P$94,P$96,P$98,P$100,P$102,P$104,P$106,P$108,P$110,P$112,P$114,P$116,P$118,P$120,P$122,P$124)) -> 3
A248: Battalion | B248: 2 | C248: 14.50 | D248: 15.00 | E248: 29.50 | F248: 14.30 | G248: 14.40 | H248: 14.30 | I248: 21.50 | J248: 14.40 | K248: 14.80 | L248: 14.50 | M248: 21.85 | N248: 72.85 | O248: 0.0 | P248: 72.85
C249: =RANK(C248,(C$6,C$8,C$10,C$12,C$14,C$16,C$18,C$20,C$22,C$24,C$26,C$28,C$30,C$32,C$34,C$36,C$38,C$40,C$42,C$44,C$46,C$48,C$50,C$52,C$54,C$56,C$58,C$60,C$62,C$64,C$66,C$68,C$70,C$72,C$74,C$76,C$78,C$80,C$82,C$84,C$86,C$88,C$90,C$92,C$94,C$96,C$98,C$100,C$102,C$104,C$106,C$108,C$110,C$112,C$114,C$116,C$118,C$120,C$122,C$124)) -> 4 | D249: =RANK(D248,(D$6,D$8,D$10,D$12,D$14,D$16,D$18,D$20,D$22,D$24,D$26,D$28,D$30,D$32,D$34,D$36,D$38,D$40,D$42,D$44,D$46,D$48,D$50,D$52,D$54,D$56,D$58,D$60,D$62,D$64,D$66,D$68,D$70,D$72,D$74,D$76,D$78,D$80,D$82,D$84,D$86,D$88,D$90,D$92,D$94,D$96,D$98,D$100,D$102,D$104,D$106,D$108,D$110,D$112,D$114,D$116,D$118,D$120,D$122,D$124)) -> 4 | E249: =RANK(E248,(E$6,E$8,E$10,E$12,E$14,E$16,E$18,E$20,E$22,E$24,E$26,E$28,E$30,E$32,E$34,E$36,E$38,E$40,E$42,E$44,E$46,E$48,E$50,E$52,E$54,E$56,E$58,E$60,E$62,E$64,E$66,E$68,E$70,E$72,E$74,E$76,E$78,E$80,E$82,E$84,E$86,E$88,E$90,E$92,E$94,E$96,E$98,E$100,E$102,E$104,E$106,E$108,E$110,E$112,E$114,E$116,E$118,E$120,E$122,E$124)) -> 4 | F249: =RANK(F248,(F$6,F$8,F$10,F$12,F$14,F$16,F$18,F$20,F$22,F$24,F$26,F$28,F$30,F$32,F$34,F$36,F$38,F$40,F$42,F$44,F$46,F$48,F$50,F$52,F$54,F$56,F$58,F$60,F$62,F$64,F$66,F$68,F$70,F$72,F$74,F$76,F$78,F$80,F$82,F$84,F$86,F$88,F$90,F$92,F$94,F$96,F$98,F$100,F$102,F$104,F$106,F$108,F$110,F$112,F$114,F$116,F$118,F$120,F$122,F$124)) -> 5 | G249: =RANK(G248,(G$6,G$8,G$10,G$12,G$14,G$16,G$18,G$20,G$22,G$24,G$26,G$28,G$30,G$32,G$34,G$36,G$38,G$40,G$42,G$44,G$46,G$48,G$50,G$52,G$54,G$56,G$58,G$60,G$62,G$64,G$66,G$68,G$70,G$72,G$74,G$76,G$78,G$80,G$82,G$84,G$86,G$88,G$90,G$92,G$94,G$96,G$98,G$100,G$102,G$104,G$106,G$108,G$110,G$112,G$114,G$116,G$118,G$120,G$122,G$124)) -> 4 | H249: =RANK(H248,(H$6,H$8,H$10,H$12,H$14,H$16,H$18,H$20,H$22,H$24,H$26,H$28,H$30,H$32,H$34,H$36,H$38,H$40,H$42,H$44,H$46,H$48,H$50,H$52,H$54,H$56,H$58,H$60,H$62,H$64,H$66,H$68,H$70,H$72,H$74,H$76,H$78,H$80,H$82,H$84,H$86,H$88,H$90,H$92,H$94,H$96,H$98,H$100,H$102,H$104,H$106,H$108,H$110,H$112,H$114,H$116,H$118,H$120,H$122,H$124)) -> 4 | I249: =RANK(I248,(I$6,I$8,I$10,I$12,I$14,I$16,I$18,I$20,I$22,I$24,I$26,I$28,I$30,I$32,I$34,I$36,I$38,I$40,I$42,I$44,I$46,I$48,I$50,I$52,I$54,I$56,I$58,I$60,I$62,I$64,I$66,I$68,I$70,I$72,I$74,I$76,I$78,I$80,I$82,I$84,I$86,I$88,I$90,I$92,I$94,I$96,I$98,I$100,I$102,I$104,I$106,I$108,I$110,I$112,I$114,I$116,I$118,I$120,I$122,I$124)) -> 5 | J249: =RANK(J248,(J$6,J$8,J$10,J$12,J$14,J$16,J$18,J$20,J$22,J$24,J$26,J$28,J$30,J$32,J$34,J$36,J$38,J$40,J$42,J$44,J$46,J$48,J$50,J$52,J$54,J$56,J$58,J$60,J$62,J$64,J$66,J$68,J$70,J$72,J$74,J$76,J$78,J$80,J$82,J$84,J$86,J$88,J$90,J$92,J$94,J$96,J$98,J$100,J$102,J$104,J$106,J$108,J$110,J$112,J$114,J$116,J$118,J$120,J$122,J$124)) -> 4 | K249: =RANK(K248,(K$6,K$8,K$10,K$12,K$14,K$16,K$18,K$20,K$22,K$24,K$26,K$28,K$30,K$32,K$34,K$36,K$38,K$40,K$42,K$44,K$46,K$48,K$50,K$52,K$54,K$56,K$58,K$60,K$62,K$64,K$66,K$68,K$70,K$72,K$74,K$76,K$78,K$80,K$82,K$84,K$86,K$88,K$90,K$92,K$94,K$96,K$98,K$100,K$102,K$104,K$106,K$108,K$110,K$112,K$114,K$116,K$118,K$120,K$122,K$124)) -> 4 | L249: =RANK(L248,(L$6,L$8,L$10,L$12,L$14,L$16,L$18,L$20,L$22,L$24,L$26,L$28,L$30,L$32,L$34,L$36,L$38,L$40,L$42,L$44,L$46,L$48,L$50,L$52,L$54,L$56,L$58,L$60,L$62,L$64,L$66,L$68,L$70,L$72,L$74,L$76,L$78,L$80,L$82,L$84,L$86,L$88,L$90,L$92,L$94,L$96,L$98,L$100,L$102,L$104,L$106,L$108,L$110,L$112,L$114,L$116,L$118,L$120,L$122,L$124)) -> 4 | M249: =RANK(M248,(M$6,M$8,M$10,M$12,M$14,M$16,M$18,M$20,M$22,M$24,M$26,M$28,M$30,M$32,M$34,M$36,M$38,M$40,M$42,M$44,M$46,M$48,M$50,M$52,M$54,M$56,M$58,M$60,M$62,M$64,M$66,M$68,M$70,M$72,M$74,M$76,M$78,M$80,M$82,M$84,M$86,M$88,M$90,M$92,M$94,M$96,M$98,M$100,M$102,M$104,M$106,M$108,M$110,M$112,M$114,M$116,M$118,M$120,M$122,M$124)) -> 4 | N249: =RANK(N248,(N$6,N$8,N$10,N$12,N$14,N$16,N$18,N$20,N$22,N$24,N$26,N$28,N$30,N$32,N$34,N$36,N$38,N$40,N$42,N$44,N$46,N$48,N$50,N$52,N$54,N$56,N$58,N$60,N$62,N$64,N$66,N$68,N$70,N$72,N$74,N$76,N$78,N$80,N$82,N$84,N$86,N$88,N$90,N$92,N$94,N$96,N$98,N$100,N$102,N$104,N$106,N$108,N$110,N$112,N$114,N$116,N$118,N$120,N$122,N$124)) -> 4 | P249: =RANK(P248,(P$6,P$8,P$10,P$12,P$14,P$16,P$18,P$20,P$22,P$24,P$26,P$28,P$30,P$32,P$34,P$36,P$38,P$40,P$42,P$44,P$46,P$48,P$50,P$52,P$54,P$56,P$58,P$60,P$62,P$64,P$66,P$68,P$70,P$72,P$74,P$76,P$78,P$80,P$82,P$84,P$86,P$88,P$90,P$92,P$94,P$96,P$98,P$100,P$102,P$104,P$106,P$108,P$110,P$112,P$114,P$116,P$118,P$120,P$122,P$124)) -> 4
A250: River City | B250: 4 | C250: 13.70 | D250: 14.50 | E250: 28.20 | F250: 14.60 | G250: 14.30 | H250: 14.20 | I250: 21.55 | J250: 14.20 | K250: 14.40 | L250: 14.20 | M250: 21.40 | N250: 71.15 | O250: 0.0 | P250: 71.15
A251: Rhythm | C251: =RANK(C250,(C$6,C$8,C$10,C$12,C$14,C$16,C$18,C$20,C$22,C$24,C$26,C$28,C$30,C$32,C$34,C$36,C$38,C$40,C$42,C$44,C$46,C$48,C$50,C$52,C$54,C$56,C$58,C$60,C$62,C$64,C$66,C$68,C$70,C$72,C$74,C$76,C$78,C$80,C$82,C$84,C$86,C$88,C$90,C$92,C$94,C$96,C$98,C$100,C$102,C$104,C$106,C$108,C$110,C$112,C$114,C$116,C$118,C$120,C$122,C$124)) -> 5 | D251: =RANK(D250,(D$6,D$8,D$10,D$12,D$14,D$16,D$18,D$20,D$22,D$24,D$26,D$28,D$30,D$32,D$34,D$36,D$38,D$40,D$42,D$44,D$46,D$48,D$50,D$52,D$54,D$56,D$58,D$60,D$62,D$64,D$66,D$68,D$70,D$72,D$74,D$76,D$78,D$80,D$82,D$84,D$86,D$88,D$90,D$92,D$94,D$96,D$98,D$100,D$102,D$104,D$106,D$108,D$110,D$112,D$114,D$116,D$118,D$120,D$122,D$124)) -> 5 | E251: =RANK(E250,(E$6,E$8,E$10,E$12,E$14,E$16,E$18,E$20,E$22,E$24,E$26,E$28,E$30,E$32,E$34,E$36,E$38,E$40,E$42,E$44,E$46,E$48,E$50,E$52,E$54,E$56,E$58,E$60,E$62,E$64,E$66,E$68,E$70,E$72,E$74,E$76,E$78,E$80,E$82,E$84,E$86,E$88,E$90,E$92,E$94,E$96,E$98,E$100,E$102,E$104,E$106,E$108,E$110,E$112,E$114,E$116,E$118,E$120,E$122,E$124)) -> 5 | F251: =RANK(F250,(F$6,F$8,F$10,F$12,F$14,F$16,F$18,F$20,F$22,F$24,F$26,F$28,F$30,F$32,F$34,F$36,F$38,F$40,F$42,F$44,F$46,F$48,F$50,F$52,F$54,F$56,F$58,F$60,F$62,F$64,F$66,F$68,F$70,F$72,F$74,F$76,F$78,F$80,F$82,F$84,F$86,F$88,F$90,F$92,F$94,F$96,F$98,F$100,F$102,F$104,F$106,F$108,F$110,F$112,F$114,F$116,F$118,F$120,F$122,F$124)) -> 4 | G251: =RANK(G250,(G$6,G$8,G$10,G$12,G$14,G$16,G$18,G$20,G$22,G$24,G$26,G$28,G$30,G$32,G$34,G$36,G$38,G$40,G$42,G$44,G$46,G$48,G$50,G$52,G$54,G$56,G$58,G$60,G$62,G$64,G$66,G$68,G$70,G$72,G$74,G$76,G$78,G$80,G$82,G$84,G$86,G$88,G$90,G$92,G$94,G$96,G$98,G$100,G$102,G$104,G$106,G$108,G$110,G$112,G$114,G$116,G$118,G$120,G$122,G$124)) -> 5 | H251: =RANK(H250,(H$6,H$8,H$10,H$12,H$14,H$16,H$18,H$20,H$22,H$24,H$26,H$28,H$30,H$32,H$34,H$36,H$38,H$40,H$42,H$44,H$46,H$48,H$50,H$52,H$54,H$56,H$58,H$60,H$62,H$64,H$66,H$68,H$70,H$72,H$74,H$76,H$78,H$80,H$82,H$84,H$86,H$88,H$90,H$92,H$94,H$96,H$98,H$100,H$102,H$104,H$106,H$108,H$110,H$112,H$114,H$116,H$118,H$120,H$122,H$124)) -> 5 | I251: =RANK(I250,(I$6,I$8,I$10,I$12,I$14,I$16,I$18,I$20,I$22,I$24,I$26,I$28,I$30,I$32,I$34,I$36,I$38,I$40,I$42,I$44,I$46,I$48,I$50,I$52,I$54,I$56,I$58,I$60,I$62,I$64,I$66,I$68,I$70,I$72,I$74,I$76,I$78,I$80,I$82,I$84,I$86,I$88,I$90,I$92,I$94,I$96,I$98,I$100,I$102,I$104,I$106,I$108,I$110,I$112,I$114,I$116,I$118,I$120,I$122,I$124)) -> 4 | J251: =RANK(J250,(J$6,J$8,J$10,J$12,J$14,J$16,J$18,J$20,J$22,J$24,J$26,J$28,J$30,J$32,J$34,J$36,J$38,J$40,J$42,J$44,J$46,J$48,J$50,J$52,J$54,J$56,J$58,J$60,J$62,J$64,J$66,J$68,J$70,J$72,J$74,J$76,J$78,J$80,J$82,J$84,J$86,J$88,J$90,J$92,J$94,J$96,J$98,J$100,J$102,J$104,J$106,J$108,J$110,J$112,J$114,J$116,J$118,J$120,J$122,J$124)) -> 5 | K251: =RANK(K250,(K$6,K$8,K$10,K$12,K$14,K$16,K$18,K$20,K$22,K$24,K$26,K$28,K$30,K$32,K$34,K$36,K$38,K$40,K$42,K$44,K$46,K$48,K$50,K$52,K$54,K$56,K$58,K$60,K$62,K$64,K$66,K$68,K$70,K$72,K$74,K$76,K$78,K$80,K$82,K$84,K$86,K$88,K$90,K$92,K$94,K$96,K$98,K$100,K$102,K$104,K$106,K$108,K$110,K$112,K$114,K$116,K$118,K$120,K$122,K$124)) -> 5 | L251: =RANK(L250,(L$6,L$8,L$10,L$12,L$14,L$16,L$18,L$20,L$22,L$24,L$26,L$28,L$30,L$32,L$34,L$36,L$38,L$40,L$42,L$44,L$46,L$48,L$50,L$52,L$54,L$56,L$58,L$60,L$62,L$64,L$66,L$68,L$70,L$72,L$74,L$76,L$78,L$80,L$82,L$84,L$86,L$88,L$90,L$92,L$94,L$96,L$98,L$100,L$102,L$104,L$106,L$108,L$110,L$112,L$114,L$116,L$118,L$120,L$122,L$124)) -> 5 | M251: =RANK(M250,(M$6,M$8,M$10,M$12,M$14,M$16,M$18,M$20,M$22,M$24,M$26,M$28,M$30,M$32,M$34,M$36,M$38,M$40,M$42,M$44,M$46,M$48,M$50,M$52,M$54,M$56,M$58,M$60,M$62,M$64,M$66,M$68,M$70,M$72,M$74,M$76,M$78,M$80,M$82,M$84,M$86,M$88,M$90,M$92,M$94,M$96,M$98,M$100,M$102,M$104,M$106,M$108,M$110,M$112,M$114,M$116,M$118,M$120,M$122,M$124)) -> 5 | N251: =RANK(N250,(N$6,N$8,N$10,N$12,N$14,N$16,N$18,N$20,N$22,N$24,N$26,N$28,N$30,N$32,N$34,N$36,N$38,N$40,N$42,N$44,N$46,N$48,N$50,N$52,N$54,N$56,N$58,N$60,N$62,N$64,N$66,N$68,N$70,N$72,N$74,N$76,N$78,N$80,N$82,N$84,N$86,N$88,N$90,N$92,N$94,N$96,N$98,N$100,N$102,N$104,N$106,N$108,N$110,N$112,N$114,N$116,N$118,N$120,N$122,N$124)) -> 5 | P251: =RANK(P250,(P$6,P$8,P$10,P$12,P$14,P$16,P$18,P$20,P$22,P$24,P$26,P$28,P$30,P$32,P$34,P$36,P$38,P$40,P$42,P$44,P$46,P$48,P$50,P$52,P$54,P$56,P$58,P$60,P$62,P$64,P$66,P$68,P$70,P$72,P$74,P$76,P$78,P$80,P$82,P$84,P$86,P$88,P$90,P$92,P$94,P$96,P$98,P$100,P$102,P$104,P$106,P$108,P$110,P$112,P$114,P$116,P$118,P$120,P$122,P$124)) -> 5
A252: Les | B252: 3 | C252: 13.00 | D252: 13.50 | E252: 26.50 | F252: 13.00 | G252: 13.40 | H252: 13.30 | I252: 19.85 | J252: 13.20 | K252: 12.90 | L252: 12.80 | M252: 19.45 | N252: 65.80 | O252: 0.0 | P252: 65.80
A253: Stentors | C253: =RANK(C252,(C$6,C$8,C$10,C$12,C$14,C$16,C$18,C$20,C$22,C$24,C$26,C$28,C$30,C$32,C$34,C$36,C$38,C$40,C$42,C$44,C$46,C$48,C$50,C$52,C$54,C$56,C$58,C$60,C$62,C$64,C$66,C$68,C$70,C$72,C$74,C$76,C$78,C$80,C$82,C$84,C$86,C$88,C$90,C$92,C$94,C$96,C$98,C$100,C$102,C$104,C$106,C$108,C$110,C$112,C$114,C$116,C$118,C$120,C$122,C$124)) -> 6 | D253: =RANK(D252,(D$6,D$8,D$10,D$12,D$14,D$16,D$18,D$20,D$22,D$24,D$26,D$28,D$30,D$32,D$34,D$36,D$38,D$40,D$42,D$44,D$46,D$48,D$50,D$52,D$54,D$56,D$58,D$60,D$62,D$64,D$66,D$68,D$70,D$72,D$74,D$76,D$78,D$80,D$82,D$84,D$86,D$88,D$90,D$92,D$94,D$96,D$98,D$100,D$102,D$104,D$106,D$108,D$110,D$112,D$114,D$116,D$118,D$120,D$122,D$124)) -> 7 | E253: =RANK(E252,(E$6,E$8,E$10,E$12,E$14,E$16,E$18,E$20,E$22,E$24,E$26,E$28,E$30,E$32,E$34,E$36,E$38,E$40,E$42,E$44,E$46,E$48,E$50,E$52,E$54,E$56,E$58,E$60,E$62,E$64,E$66,E$68,E$70,E$72,E$74,E$76,E$78,E$80,E$82,E$84,E$86,E$88,E$90,E$92,E$94,E$96,E$98,E$100,E$102,E$104,E$106,E$108,E$110,E$112,E$114,E$116,E$118,E$120,E$122,E$124)) -> 6 | F253: =RANK(F252,(F$6,F$8,F$10,F$12,F$14,F$16,F$18,F$20,F$22,F$24,F$26,F$28,F$30,F$32,F$34,F$36,F$38,F$40,F$42,F$44,F$46,F$48,F$50,F$52,F$54,F$56,F$58,F$60,F$62,F$64,F$66,F$68,F$70,F$72,F$74,F$76,F$78,F$80,F$82,F$84,F$86,F$88,F$90,F$92,F$94,F$96,F$98,F$100,F$102,F$104,F$106,F$108,F$110,F$112,F$114,F$116,F$118,F$120,F$122,F$124)) -> 6 | G253: =RANK(G252,(G$6,G$8,G$10,G$12,G$14,G$16,G$18,G$20,G$22,G$24,G$26,G$28,G$30,G$32,G$34,G$36,G$38,G$40,G$42,G$44,G$46,G$48,G$50,G$52,G$54,G$56,G$58,G$60,G$62,G$64,G$66,G$68,G$70,G$72,G$74,G$76,G$78,G$80,G$82,G$84,G$86,G$88,G$90,G$92,G$94,G$96,G$98,G$100,G$102,G$104,G$106,G$108,G$110,G$112,G$114,G$116,G$118,G$120,G$122,G$124)) -> 6 | H253: =RANK(H252,(H$6,H$8,H$10,H$12,H$14,H$16,H$18,H$20,H$22,H$24,H$26,H$28,H$30,H$32,H$34,H$36,H$38,H$40,H$42,H$44,H$46,H$48,H$50,H$52,H$54,H$56,H$58,H$60,H$62,H$64,H$66,H$68,H$70,H$72,H$74,H$76,H$78,H$80,H$82,H$84,H$86,H$88,H$90,H$92,H$94,H$96,H$98,H$100,H$102,H$104,H$106,H$108,H$110,H$112,H$114,H$116,H$118,H$120,H$122,H$124)) -> 6 | I253: =RANK(I252,(I$6,I$8,I$10,I$12,I$14,I$16,I$18,I$20,I$22,I$24,I$26,I$28,I$30,I$32,I$34,I$36,I$38,I$40,I$42,I$44,I$46,I$48,I$50,I$52,I$54,I$56,I$58,I$60,I$62,I$64,I$66,I$68,I$70,I$72,I$74,I$76,I$78,I$80,I$82,I$84,I$86,I$88,I$90,I$92,I$94,I$96,I$98,I$100,I$102,I$104,I$106,I$108,I$110,I$112,I$114,I$116,I$118,I$120,I$122,I$124)) -> 6 | J253: =RANK(J252,(J$6,J$8,J$10,J$12,J$14,J$16,J$18,J$20,J$22,J$24,J$26,J$28,J$30,J$32,J$34,J$36,J$38,J$40,J$42,J$44,J$46,J$48,J$50,J$52,J$54,J$56,J$58,J$60,J$62,J$64,J$66,J$68,J$70,J$72,J$74,J$76,J$78,J$80,J$82,J$84,J$86,J$88,J$90,J$92,J$94,J$96,J$98,J$100,J$102,J$104,J$106,J$108,J$110,J$112,J$114,J$116,J$118,J$120,J$122,J$124)) -> 7 | K253: =RANK(K252,(K$6,K$8,K$10,K$12,K$14,K$16,K$18,K$20,K$22,K$24,K$26,K$28,K$30,K$32,K$34,K$36,K$38,K$40,K$42,K$44,K$46,K$48,K$50,K$52,K$54,K$56,K$58,K$60,K$62,K$64,K$66,K$68,K$70,K$72,K$74,K$76,K$78,K$80,K$82,K$84,K$86,K$88,K$90,K$92,K$94,K$96,K$98,K$100,K$102,K$104,K$106,K$108,K$110,K$112,K$114,K$116,K$118,K$120,K$122,K$124)) -> 7 | L253: =RANK(L252,(L$6,L$8,L$10,L$12,L$14,L$16,L$18,L$20,L$22,L$24,L$26,L$28,L$30,L$32,L$34,L$36,L$38,L$40,L$42,L$44,L$46,L$48,L$50,L$52,L$54,L$56,L$58,L$60,L$62,L$64,L$66,L$68,L$70,L$72,L$74,L$76,L$78,L$80,L$82,L$84,L$86,L$88,L$90,L$92,L$94,L$96,L$98,L$100,L$102,L$104,L$106,L$108,L$110,L$112,L$114,L$116,L$118,L$120,L$122,L$124)) -> 7 | M253: =RANK(M252,(M$6,M$8,M$10,M$12,M$14,M$16,M$18,M$20,M$22,M$24,M$26,M$28,M$30,M$32,M$34,M$36,M$38,M$40,M$42,M$44,M$46,M$48,M$50,M$52,M$54,M$56,M$58,M$60,M$62,M$64,M$66,M$68,M$70,M$72,M$74,M$76,M$78,M$80,M$82,M$84,M$86,M$88,M$90,M$92,M$94,M$96,M$98,M$100,M$102,M$104,M$106,M$108,M$110,M$112,M$114,M$116,M$118,M$120,M$122,M$124)) -> 7 | N253: =RANK(N252,(N$6,N$8,N$10,N$12,N$14,N$16,N$18,N$20,N$22,N$24,N$26,N$28,N$30,N$32,N$34,N$36,N$38,N$40,N$42,N$44,N$46,N$48,N$50,N$52,N$54,N$56,N$58,N$60,N$62,N$64,N$66,N$68,N$70,N$72,N$74,N$76,N$78,N$80,N$82,N$84,N$86,N$88,N$90,N$92,N$94,N$96,N$98,N$100,N$102,N$104,N$106,N$108,N$110,N$112,N$114,N$116,N$118,N$120,N$122,N$124)) -> 6 | P253: =RANK(P252,(P$6,P$8,P$10,P$12,P$14,P$16,P$18,P$20,P$22,P$24,P$26,P$28,P$30,P$32,P$34,P$36,P$38,P$40,P$42,P$44,P$46,P$48,P$50,P$52,P$54,P$56,P$58,P$60,P$62,P$64,P$66,P$68,P$70,P$72,P$74,P$76,P$78,P$80,P$82,P$84,P$86,P$88,P$90,P$92,P$94,P$96,P$98,P$100,P$102,P$104,P$106,P$108,P$110,P$112,P$114,P$116,P$118,P$120,P$122,P$124)) -> 6
A254: Colt | B254: 7 | C254: 12.30 | D254: 13.80 | E254: 26.10 | F254: 12.80 | G254: 13.20 | H254: 13.10 | I254: 19.55 | J254: 13.30 | K254: 13.40 | L254: 13.40 | M254: 20.05 | N254: 65.70 | O254: 0.0 | P254: 65.70
A255: Cadets | C255: =RANK(C254,(C$6,C$8,C$10,C$12,C$14,C$16,C$18,C$20,C$22,C$24,C$26,C$28,C$30,C$32,C$34,C$36,C$38,C$40,C$42,C$44,C$46,C$48,C$50,C$52,C$54,C$56,C$58,C$60,C$62,C$64,C$66,C$68,C$70,C$72,C$74,C$76,C$78,C$80,C$82,C$84,C$86,C$88,C$90,C$92,C$94,C$96,C$98,C$100,C$102,C$104,C$106,C$108,C$110,C$112,C$114,C$116,C$118,C$120,C$122,C$124)) -> 7 | D255: =RANK(D254,(D$6,D$8,D$10,D$12,D$14,D$16,D$18,D$20,D$22,D$24,D$26,D$28,D$30,D$32,D$34,D$36,D$38,D$40,D$42,D$44,D$46,D$48,D$50,D$52,D$54,D$56,D$58,D$60,D$62,D$64,D$66,D$68,D$70,D$72,D$74,D$76,D$78,D$80,D$82,D$84,D$86,D$88,D$90,D$92,D$94,D$96,D$98,D$100,D$102,D$104,D$106,D$108,D$110,D$112,D$114,D$116,D$118,D$120,D$122,D$124)) -> 6 | E255: =RANK(E254,(E$6,E$8,E$10,E$12,E$14,E$16,E$18,E$20,E$22,E$24,E$26,E$28,E$30,E$32,E$34,E$36,E$38,E$40,E$42,E$44,E$46,E$48,E$50,E$52,E$54,E$56,E$58,E$60,E$62,E$64,E$66,E$68,E$70,E$72,E$74,E$76,E$78,E$80,E$82,E$84,E$86,E$88,E$90,E$92,E$94,E$96,E$98,E$100,E$102,E$104,E$106,E$108,E$110,E$112,E$114,E$116,E$118,E$120,E$122,E$124)) -> 7 | F255: =RANK(F254,(F$6,F$8,F$10,F$12,F$14,F$16,F$18,F$20,F$22,F$24,F$26,F$28,F$30,F$32,F$34,F$36,F$38,F$40,F$42,F$44,F$46,F$48,F$50,F$52,F$54,F$56,F$58,F$60,F$62,F$64,F$66,F$68,F$70,F$72,F$74,F$76,F$78,F$80,F$82,F$84,F$86,F$88,F$90,F$92,F$94,F$96,F$98,F$100,F$102,F$104,F$106,F$108,F$110,F$112,F$114,F$116,F$118,F$120,F$122,F$124)) -> 7 | G255: =RANK(G254,(G$6,G$8,G$10,G$12,G$14,G$16,G$18,G$20,G$22,G$24,G$26,G$28,G$30,G$32,G$34,G$36,G$38,G$40,G$42,G$44,G$46,G$48,G$50,G$52,G$54,G$56,G$58,G$60,G$62,G$64,G$66,G$68,G$70,G$72,G$74,G$76,G$78,G$80,G$82,G$84,G$86,G$88,G$90,G$92,G$94,G$96,G$98,G$100,G$102,G$104,G$106,G$108,G$110,G$112,G$114,G$116,G$118,G$120,G$122,G$124)) -> 7 | H255: =RANK(H254,(H$6,H$8,H$10,H$12,H$14,H$16,H$18,H$20,H$22,H$24,H$26,H$28,H$30,H$32,H$34,H$36,H$38,H$40,H$42,H$44,H$46,H$48,H$50,H$52,H$54,H$56,H$58,H$60,H$62,H$64,H$66,H$68,H$70,H$72,H$74,H$76,H$78,H$80,H$82,H$84,H$86,H$88,H$90,H$92,H$94,H$96,H$98,H$100,H$102,H$104,H$106,H$108,H$110,H$112,H$114,H$116,H$118,H$120,H$122,H$124)) -> 7 | I255: =RANK(I254,(I$6,I$8,I$10,I$12,I$14,I$16,I$18,I$20,I$22,I$24,I$26,I$28,I$30,I$32,I$34,I$36,I$38,I$40,I$42,I$44,I$46,I$48,I$50,I$52,I$54,I$56,I$58,I$60,I$62,I$64,I$66,I$68,I$70,I$72,I$74,I$76,I$78,I$80,I$82,I$84,I$86,I$88,I$90,I$92,I$94,I$96,I$98,I$100,I$102,I$104,I$106,I$108,I$110,I$112,I$114,I$116,I$118,I$120,I$122,I$124)) -> 7 | J255: =RANK(J254,(J$6,J$8,J$10,J$12,J$14,J$16,J$18,J$20,J$22,J$24,J$26,J$28,J$30,J$32,J$34,J$36,J$38,J$40,J$42,J$44,J$46,J$48,J$50,J$52,J$54,J$56,J$58,J$60,J$62,J$64,J$66,J$68,J$70,J$72,J$74,J$76,J$78,J$80,J$82,J$84,J$86,J$88,J$90,J$92,J$94,J$96,J$98,J$100,J$102,J$104,J$106,J$108,J$110,J$112,J$114,J$116,J$118,J$120,J$122,J$124)) -> 6 | K255: =RANK(K254,(K$6,K$8,K$10,K$12,K$14,K$16,K$18,K$20,K$22,K$24,K$26,K$28,K$30,K$32,K$34,K$36,K$38,K$40,K$42,K$44,K$46,K$48,K$50,K$52,K$54,K$56,K$58,K$60,K$62,K$64,K$66,K$68,K$70,K$72,K$74,K$76,K$78,K$80,K$82,K$84,K$86,K$88,K$90,K$92,K$94,K$96,K$98,K$100,K$102,K$104,K$106,K$108,K$110,K$112,K$114,K$116,K$118,K$120,K$122,K$124)) -> 6 | L255: =RANK(L254,(L$6,L$8,L$10,L$12,L$14,L$16,L$18,L$20,L$22,L$24,L$26,L$28,L$30,L$32,L$34,L$36,L$38,L$40,L$42,L$44,L$46,L$48,L$50,L$52,L$54,L$56,L$58,L$60,L$62,L$64,L$66,L$68,L$70,L$72,L$74,L$76,L$78,L$80,L$82,L$84,L$86,L$88,L$90,L$92,L$94,L$96,L$98,L$100,L$102,L$104,L$106,L$108,L$110,L$112,L$114,L$116,L$118,L$120,L$122,L$124)) -> 6 | M255: =RANK(M254,(M$6,M$8,M$10,M$12,M$14,M$16,M$18,M$20,M$22,M$24,M$26,M$28,M$30,M$32,M$34,M$36,M$38,M$40,M$42,M$44,M$46,M$48,M$50,M$52,M$54,M$56,M$58,M$60,M$62,M$64,M$66,M$68,M$70,M$72,M$74,M$76,M$78,M$80,M$82,M$84,M$86,M$88,M$90,M$92,M$94,M$96,M$98,M$100,M$102,M$104,M$106,M$108,M$110,M$112,M$114,M$116,M$118,M$120,M$122,M$124)) -> 6 | N255: =RANK(N254,(N$6,N$8,N$10,N$12,N$14,N$16,N$18,N$20,N$22,N$24,N$26,N$28,N$30,N$32,N$34,N$36,N$38,N$40,N$42,N$44,N$46,N$48,N$50,N$52,N$54,N$56,N$58,N$60,N$62,N$64,N$66,N$68,N$70,N$72,N$74,N$76,N$78,N$80,N$82,N$84,N$86,N$88,N$90,N$92,N$94,N$96,N$98,N$100,N$102,N$104,N$106,N$108,N$110,N$112,N$114,N$116,N$118,N$120,N$122,N$124)) -> 7 | P255: =RANK(P254,(P$6,P$8,P$10,P$12,P$14,P$16,P$18,P$20,P$22,P$24,P$26,P$28,P$30,P$32,P$34,P$36,P$38,P$40,P$42,P$44,P$46,P$48,P$50,P$52,P$54,P$56,P$58,P$60,P$62,P$64,P$66,P$68,P$70,P$72,P$74,P$76,P$78,P$80,P$82,P$84,P$86,P$88,P$90,P$92,P$94,P$96,P$98,P$100,P$102,P$104,P$106,P$108,P$110,P$112,P$114,P$116,P$118,P$120,P$122,P$124)) -> 7
A258: 8/5/2022 Allentown, Pennsylvania--DCI East
C259: General Effect | J259: Visual | N259: Music
C260: 1 | D260: 1 | F260: 2 | G260: 2 | J260: Proficiency | K260: Analysis | L260: Color Guard | N260: Brass | O260: Analysis | P260: Analysis 2 | Q260: Analysis | R260: Percussion | T260: Sub | V260: Total
C261: M. McCourt | D261: K. Miller | E261: Average | F261: G. Fugett | G261: M. Waymire | H261: Average | I261: Total | J261: J. Sturgeon | K261: G. Oliviero | L261: H. Nguyen | M261: Total ÷2 | N261: B. Fabrizio | O261: J. Webb | P261: No Judge | Q261: Average | R261: J. Ausdemore | S261: Total ÷2 | T261: Total | U261: Pen | V261: Score
A262: DCI World Class | C262: 20 | D262: 20 | E262: 20 | F262: 20 | G262: 20 | H262: 20 | I262: 40 | J262: 20 | K262: 20 | L262: 20 | M262: 30 | N262: 20 | O262: 20 | P262: 20 | Q262: 20 | R262: 20 | S262: 30 | T262: 100 | V262: 100
A263: Blue | B263: 8 | C263: 19.50 | D263: 19.00 | E263: 19.350 | F263: 19.10 | G263: 19.40 | H263: 19.250 | I263: 38.500 | J263: 19.30 | K263: 19.40 | L263: 19.25 | M263: 28.975000000000001 | N263: 19.20 | O263: 18.95 | P263: 18.95 | Q263: 18.950 | R263: 19.00 | S263: 28.574999999999999 | T263: 96.050 | U263: 0.0 | V263: 96.050
A264: Devils | C264: 1 | D264: 1 | E264: 1 | F264: 1 | G264: 1 | H264: 1 | I264: 1 | J264: 1 | K264: 1 | L264: 2 | M264: 1 | N264: 1 | O264: 1 | P264: 1 | Q264: 1 | R264: 1 | S264: 1 | T264: 1 | V264: 1
A265: Boston | B265: 9 | C265: 19.30 | D265: 18.60 | E265: 18.950 | F265: 18.70 | G265: 18.95 | H265: 18.824999999999999 | I265: 37.774999999999999 | J265: 18.80 | K265: 18.90 | L265: 19.40 | M265: 28.550 | N265: 19.00 | O265: 18.65 | P265: 18.65 | Q265: 18.650 | R265: 18.70 | S265: 28.175000000000001 | T265: 94.500 | U265: 0.0 | V265: 94.500
A266: Crusaders | C266: 2 | D266: 3 | E266: 2 | F266: 3 | G266: 2 | H266: 3 | I266: 3 | J266: 3 | K266: 3 | L266: 1 | M266: 2 | N266: 2 | O266: 3 | P266: 3 | Q266: 3 | R266: 3 | S266: 2 | T266: 2 | V266: 2
A267: Bluecoats | B267: 7 | C267: 19.10 | D267: 18.70 | E267: 18.900 | F267: 18.90 | G267: 18.90 | H267: 18.900 | I267: 37.800 | J267: 18.90 | K267: 19.00 | L267: 18.95 | M267: 28.425000000000001 | N267: 18.70 | O267: 18.70 | P267: 18.70 | Q267: 18.700 | R267: 18.90 | S267: 28.150 | T267: 94.375 | U267: 0.0 | V267: 94.375
C268: 3 | D268: 2 | E268: 3 | F268: 2 | G268: 3 | H268: 2 | I268: 2 | J268: 2 | K268: 2 | L268: 3 | M268: 3 | N268: 3 | O268: 2 | P268: 2 | Q268: 2 | R268: 2 | S268: 3 | T268: 3 | V268: 3
A269: Mandarins | B269: 4 | C269: 17.60 | D269: 17.60 | E269: 17.600 | F269: 17.80 | G269: 18.20 | H269: 18.000 | I269: 35.600 | J269: 17.80 | K269: 17.50 | L269: 18.30 | M269: 26.800 | N269: 17.50 | O269: 17.70 | P269: 17.70 | Q269: 17.700 | R269: 17.40 | S269: 26.300 | T269: 88.700 | U269: 0.0 | V269: 88.700
C270: 5 | D270: 5 | E270: 5 | F270: 4 | G270: 4 | H270: 4 | I270: 5 | J270: 4 | K270: 4 | L270: 4 | M270: 4 | N270: 5 | O270: 4 | P270: 4 | Q270: 4 | R270: 5 | S270: 5 | T270: 4 | V270: 4
A271: Phantom | B271: 6 | C271: 17.70 | D271: 17.80 | E271: 17.750 | F271: 17.60 | G271: 18.15 | H271: 17.875 | I271: 35.625 | J271: 17.60 | K271: 17.40 | L271: 17.60 | M271: 26.300 | N271: 17.90 | O271: 17.40 | P271: 17.40 | Q271: 17.400 | R271: 17.60 | S271: 26.450 | T271: 88.375 | U271: 0.0 | V271: 88.375
A272: Regiment | C272: 4 | D272: 4 | E272: 4 | F272: 5 | G272: 5 | H272: 5 | I272: 4 | J272: 5 | K272: 5 | L272: 5 | M272: 5 | N272: 4 | O272: 5 | P272: 5 | Q272: 5 | R272: 4 | S272: 4 | T272: 5 | V272: 5
A273: Colts | B273: 5 | C273: 17.40 | D273: 16.70 | E273: 17.050 | F273: 16.90 | G273: 17.25 | H273: 17.074999999999999 | I273: 34.125 | J273: 17.00 | K273: 16.30 | L273: 17.10 | M273: 25.200 | N273: 16.80 | O273: 16.60 | P273: 16.60 | Q273: 16.600 | R273: 17.00 | S273: 25.200 | T273: 84.525000000000006 | U273: 0.0 | V273: 84.525000000000006
C274: 6 | D274: 6 | E274: 6 | F274: 6 | G274: 7 | H274: 6 | I274: 6 | J274: 6 | K274: 7 | L274: 6 | M274: 6 | N274: 7 | O274: 7 | P274: 7 | Q274: 7 | R274: 7 | S274: 7 | T274: 6 | V274: 6
A275: Blue | B275: 3 | C275: 15.90 | D275: 16.60 | E275: 16.250 | F275: 16.70 | G275: 17.30 | H275: 17.000 | I275: 33.250 | J275: 16.60 | K275: 17.10 | L275: 16.60 | M275: 25.150 | N275: 17.10 | O275: 17.20 | P275: 17.20 | Q275: 17.200 | R275: 17.10 | S275: 25.700 | T275: 84.100 | U275: 0.0 | V275: 84.100
A276: Knights | C276: 7 | D276: 7 | E276: 7 | F276: 7 | G276: 6 | H276: 7 | I276: 7 | J276: 7 | K276: 6 | L276: 7 | M276: 7 | N276: 6 | O276: 6 | P276: 6 | Q276: 6 | R276: 6 | S276: 6 | T276: 7 | V276: 7
A277: Academy | B277: 1 | C277: 15.40 | D277: 15.70 | E277: 15.550 | F277: 15.30 | G277: 15.40 | H277: 15.350 | I277: 30.900 | J277: 15.60 | K277: 15.40 | L277: 15.60 | M277: 23.300 | N277: 16.20 | O277: 15.80 | P277: 15.80 | Q277: 15.800 | R277: 16.50 | S277: 24.250 | T277: 78.450 | U277: 0.0 | V277: 78.450
C278: 8 | D278: 9 | E278: 8 | F278: 9 | G278: 9 | H278: 9 | I278: 9 | J278: 9 | K278: 8 | L278: 8 | M278: 8 | N278: 8 | O278: 8 | P278: 8 | Q278: 8 | R278: 8 | S278: 8 | T278: 8 | V278: 8
A279: Music | B279: 2 | C279: 15.30 | D279: 15.80 | E279: 15.550 | F279: 15.50 | G279: 16.60 | H279: 16.050 | I279: 31.600 | J279: 16.00 | K279: 14.60 | L279: 15.10 | M279: 22.850 | N279: 15.80 | O279: 15.10 | P279: 15.10 | Q279: 15.100 | R279: 16.20 | S279: 23.550 | T279: 78.000 | U279: 0.0 | V279: 78.000
A280: City | C280: 9 | D280: 8 | E280: 8 | F280: 8 | G280: 8 | H280: 8 | I280: 8 | J280: 8 | K280: 9 | L280: 9 | M280: 9 | N280: 9 | O280: 9 | P280: 9 | Q280: 9 | R280: 9 | S280: 9 | T280: 9 | V280: 9
A283: 8/6/2022 Allentown, Pennsylvania--DCI East
C284: General Effect | J284: Visual | N284: Music
C285: 1 | D285: 1 | F285: 2 | G285: 2 | J285: Proficiency | K285: Analysis | L285: Color Guard | N285: Brass | O285: Analysis 1 | P285: Analysis 2 | Q285: Analysis | R285: Percussion | T285: Sub | V285: Total
C286: M. McCourt | D286: K. Miller | E286: Average | F286: G. Fugett | G286: M. Waymire | H286: Average | I286: Total | J286: J. Sturgeon | K286: G. Oliviero | L286: H. Nguyen | M286: Total ÷2 | N286: B. Fabrizio | O286: No Judge | P286: J. Webb | Q286: Average | R286: J. Ausdemore | S286: Total ÷2 | T286: Total | U286: Pen | V286: Score
A287: DCI World Class | C287: 20 | D287: 20 | E287: 20 | F287: 20 | G287: 20 | H287: 20 | I287: 40 | J287: 20 | K287: 20 | L287: 20 | M287: 30 | N287: 20 | O287: 20 | P287: 20 | Q287: 20 | R287: 20 | S287: 30 | T287: 100 | V287: 100
A288: Carolina | B288: 11 | C288: 19.05 | D288: 18.95 | E288: 19.000 | F288: 19.05 | G288: 18.80 | H288: 18.925000000000001 | I288: 37.924999999999997 | J288: 19.40 | K288: 19.20 | L288: 19.15 | M288: 28.875 | N288: 19.10 | O288: 19.00 | P288: 19.00 | Q288: 19.000 | R288: 18.45 | S288: 28.274999999999999 | T288: 95.075000000000003 | U288: 0.0 | V288: 95.075000000000003
A289: Crown | C289: 1 | D289: 1 | E289: 1 | F289: 1 | G289: 1 | H289: 1 | I289: 1 | J289: 1 | K289: 1 | L289: 1 | M289: 1 | N289: 1 | O289: 1 | P289: 1 | Q289: 1 | R289: 3 | S289: 1 | T289: 1 | V289: 1
A290: Vanguard | B290: 9 | C290: 19.00 | D290: 18.60 | E290: 18.800 | F290: 18.60 | G290: 18.75 | H290: 18.675000000000001 | I290: 37.475000000000001 | J290: 18.70 | K290: 18.85 | L290: 18.35 | M290: 27.950 | N290: 18.40 | O290: 18.55 | P290: 18.55 | Q290: 18.550 | R290: 19.05 | S290: 28.000 | T290: 93.424999999999997 | U290: 0.0 | V290: 93.424999999999997
C291: 2 | D291: 2 | E291: 2 | F291: 2 | G291: 2 | H291: 2 | I291: 2 | J291: 2 | K291: 2 | L291: 2 | M291: 2 | N291: 3 | O291: 2 | P291: 2 | Q291: 2 | R291: 1 | S291: 2 | T291: 2 | V291: 2
A292: Cadets | B292: 10 | C292: 18.50 | D292: 18.25 | E292: 18.375 | F292: 18.20 | G292: 18.35 | H292: 18.274999999999999 | I292: 36.650 | J292: 18.25 | K292: 17.85 | L292: 18.10 | M292: 27.100 | N292: 18.60 | O292: 18.15 | P292: 18.15 | Q292: 18.150 | R292: 18.40 | S292: 27.574999999999999 | T292: 91.325000000000003 | U292: 0.0 | V292: 91.325000000000003
C293: 3 | D293: 4 | E293: 3 | F293: 3 | G293: 4 | H293: 4 | I293: 3 | J293: 3 | K293: 5 | L293: 4 | M293: 4 | N293: 2 | O293: 4 | P293: 4 | Q293: 4 | R293: 4 | S293: 3 | T293: 3 | V293: 3
A294: Blue | B294: 8 | C294: 18.30 | D294: 18.30 | E294: 18.300 | F294: 18.10 | G294: 18.50 | H294: 18.300 | I294: 36.600 | J294: 18.10 | K294: 17.95 | L294: 18.20 | M294: 27.125 | N294: 18.05 | O294: 18.20 | P294: 18.20 | Q294: 18.200 | R294: 18.10 | S294: 27.175000000000001 | T294: 90.900 | U294: 0.0 | V294: 90.900
A295: Stars | C295: 4 | D295: 3 | E295: 4 | F295: 4 | G295: 3 | H295: 3 | I295: 4 | J295: 4 | K295: 4 | L295: 3 | M295: 3 | N295: 5 | O295: 3 | P295: 3 | Q295: 3 | R295: 5 | S295: 5 | T295: 4 | V295: 4
A296: Cavaliers | B296: 7 | C296: 17.70 | D296: 17.70 | E296: 17.700 | F296: 17.75 | G296: 18.05 | H296: 17.900 | I296: 35.600 | J296: 17.90 | K296: 18.05 | L296: 17.40 | M296: 26.675000000000001 | N296: 18.20 | O296: 18.05 | P296: 18.05 | Q296: 18.050 | R296: 18.60 | S296: 27.425000000000001 | T296: 89.700 | U296: 0.0 | V296: 89.700
C297: 5 | D297: 5 | E297: 5 | F297: 5 | G297: 5 | H297: 5 | I297: 5 | J297: 5 | K297: 3 | L297: 5 | M297: 5 | N297: 4 | O297: 5 | P297: 5 | Q297: 5 | R297: 2 | S297: 4 | T297: 5 | V297: 5
A298: Crossmen | B298: 6 | C298: 17.50 | D298: 17.10 | E298: 17.300 | F298: 16.95 | G298: 17.00 | H298: 16.975000000000001 | I298: 34.274999999999999 | J298: 17.05 | K298: 17.40 | L298: 16.70 | M298: 25.574999999999999 | N298: 17.65 | O298: 17.30 | P298: 17.30 | Q298: 17.300 | R298: 17.65 | S298: 26.300 | T298: 86.150 | U298: 0.0 | V298: 86.150
C299: 6 | D299: 6 | E299: 6 | F299: 7 | G299: 7 | H299: 7 | I299: 6 | J299: 6 | K299: 6 | L299: 6 | M299: 6 | N299: 6 | O299: 6 | P299: 6 | Q299: 6 | R299: 7 | S299: 6 | T299: 6 | V299: 6
A300: Troopers | B300: 5 | C300: 16.50 | D300: 17.00 | E300: 16.750 | F300: 17.20 | G300: 17.05 | H300: 17.125 | I300: 33.875 | J300: 16.80 | K300: 16.70 | L300: 16.30 | M300: 24.900 | N300: 17.30 | O300: 17.05 | P300: 17.05 | Q300: 17.050 | R300: 17.70 | S300: 26.024999999999999 | T300: 84.800 | U300: 0.0 | V300: 84.800
C301: 7 | D301: 7 | E301: 7 | F301: 6 | G301: 6 | H301: 6 | I301: 7 | J301: 7 | K301: 7 | L301: 7 | M301: 7 | N301: 7 | O301: 7 | P301: 7 | Q301: 7 | R301: 6 | S301: 7 | T301: 7 | V301: 7
A302: Madison | B302: 4 | C302: 16.20 | D302: 16.30 | E302: 16.250 | F302: 16.30 | G302: 16.70 | H302: 16.500 | I302: 32.750 | J302: 16.70 | K302: 15.40 | L302: 15.40 | M302: 23.750 | N302: 16.40 | O302: 16.50 | P302: 16.50 | Q302: 16.500 | R302: 16.00 | S302: 24.450 | T302: 80.950 | U302: 0.0 | V302: 80.950
A303: Scouts | C303: 8 | D303: 8 | E303: 8 | F303: 8 | G303: 8 | H303: 8 | I303: 8 | J303: 8 | K303: 8 | L303: 9 | M303: 8 | N303: 8 | O303: 8 | P303: 8 | Q303: 8 | R303: 8 | S303: 8 | T303: 8 | V303: 8
A304: Pacific | B304: 3 | C304: 15.20 | D304: 15.30 | E304: 15.250 | F304: 15.10 | G304: 15.20 | H304: 15.150 | I304: 30.400 | J304: 15.70 | K304: 14.80 | L304: 15.70 | M304: 23.100 | N304: 15.50 | O304: 16.30 | P304: 16.30 | Q304: 16.300 | R304: 15.40 | S304: 23.600 | T304: 77.100 | U304: 0.0 | V304: 77.100
A305: Crest | C305: 11 | D305: 9 | E305: 9 | F305: 9 | G305: 9 | H305: 9 | I305: 9 | J305: 9 | K305: 9 | L305: 8 | M305: 9 | N305: 9 | O305: 9 | P305: 9 | Q305: 9 | R305: 9 | S305: 9 | T305: 9 | V305: 9
A306: Genesis | B306: 1 | C306: 15.50 | D306: 15.00 | E306: 15.250 | F306: 14.90 | G306: 14.80 | H306: 14.850 | I306: 30.100 | J306: 15.40 | K306: 14.20 | L306: 14.80 | M306: 22.200 | N306: 15.30 | O306: 15.30 | P306: 15.30 | Q306: 15.300 | R306: 14.90 | S306: 22.750 | T306: 75.050 | U306: 0.0 | V306: 75.050
C307: 10 | D307: 10 | E307: 9 | F307: 10 | G307: 10 | H307: 10 | I307: 10 | J307: 10 | K307: 11 | L307: 10 | M307: 10 | N307: 10 | O307: 10 | P307: 10 | Q307: 10 | R307: 10 | S307: 10 | T307: 10 | V307: 10
A308: Jersey | B308: 2 | C308: 15.60 | D308: 14.80 | E308: 15.200 | F308: 14.40 | G308: 14.60 | H308: 14.500 | I308: 29.700 | J308: 14.90 | K308: 14.40 | L308: 13.70 | M308: 21.500 | N308: 14.80 | O308: 14.50 | P308: 14.50 | Q308: 14.500 | R308: 13.70 | S308: 21.500 | T308: 72.700 | U308: 0.0 | V308: 72.700
A309: Surf | C309: 9 | D309: 11 | E309: 11 | F309: 11 | G309: 11 | H309: 11 | I309: 11 | J309: 11 | K309: 10 | L309: 11 | M309: 11 | N309: 11 | O309: 11 | P309: 11 | Q309: 11 | R309: 11 | S309: 11 | T309: 11 | V309: 11
A312: 8/6/2022 Allentown, Pennsylvania
C313: Visual | F313: Music | J313: Effect | M313: Communication
C314: Ensemble | D314: Color Guard | F314: Brass | G314: Ensemble | H314: Percussion | J314: Visual | K314: Music | M314: Visual | N314: Music | P314: Sub | R314: Total
C315: G. Oliviero | D315: H. Nguyen | E315: Average | F315: B. Fabrizio | G315: J. Webb | H315: J. Ausdemore | I315: Total ÷2 | J315: M. McCourt | K315: K. Miller | L315: Total | M315: M. McCourt | N315: K. Miller | O315: Average | P315: Total | Q315: Pen | R315: Score
A316: DCA World Class | C316: 20 | D316: 20 | E316: 20 | F316: 20 | G316: 20 | H316: 20 | I316: 30 | J316: 20 | K316: 20 | L316: 40 | M316: 10 | N316: 10 | O316: 10 | P316: 100 | R316: 100
A317: Reading | C317: 16.80 | D317: 15.80 | E317: 16.30 | F317: 16.90 | G317: 16.20 | H317: 17.00 | I317: 25.05 | J317: 16.10 | K317: 16.20 | L317: 32.30 | M317: 8.10 | N317: 8.20 | O317: 8.15 | P317: 81.80 | Q317: 0.0 | R317: 81.80
A318: Buccaneers | C318: 1 | D318: 1 | E318: 1 | F318: 1 | G318: 1 | H318: 1 | I318: 1 | J318: 1 | K318: 1 | L318: 1 | M318: 1 | N318: 1 | O318: 1 | P318: 1 | R318: 1
A321: 8/6/2022 Kingston, New York
C322: Visual | F322: Music | J322: Effect
C323: Ensemble | D323: Color Guard | F323: Brass | G323: Percussion | H323: Ensemble | J323: Visual | K323: Music | M323: Sub | O323: Total
C324: M. Metz | D324: J. Ulchinsky | E324: Average | F324: D. Thomas | G324: J. Stauffer | H324: S. Halquist | I324: Total ÷2 | J324: R. Abate | K324: B. Relyea | L324: Total | M324: Total | N324: Pen | O324: Score
A325: DCA World Class | C325: 20 | D325: 20 | E325: 20 | F325: 20 | G325: 20 | H325: 20 | I325: 30 | J325: 25 | K325: 25 | L325: 50 | M325: 100 | O325: 100
A326: Hawthorne | C326: 16.70 | D326: 18.00 | E326: 17.35 | F326: 17.50 | G326: 18.10 | H326: 17.30 | I326: 26.45 | J326: 20.75 | K326: 22.05 | L326: 42.80 | M326: 86.60 | N326: 0.0 | O326: 86.60
A327: Caballeros | C327: =RANK(C326,(C$6,C$8,C$10,C$13,C$16,C$18,C$20,C$22,C$24,C$26,C$28,C$30,C$32,C$34,C$36,C$38,C$40,C$42,C$44,C$46,C$48,C$50,C$52,C$54,C$56,C$58,C$60,C$62,C$64,C$66,C$68,C$70,C$72,C$74,C$76,C$78,C$80,C$82,C$84,C$86,C$88,C$90,C$92,C$94,C$96,C$98,C$100,C$102,C$104,C$106,C$108,C$110,C$112,C$114,C$116,C$118,C$120,C$122,C$124,C$126)) -> 1 | D327: =RANK(D326,(D$6,D$8,D$10,D$13,D$16,D$18,D$20,D$22,D$24,D$26,D$28,D$30,D$32,D$34,D$36,D$38,D$40,D$42,D$44,D$46,D$48,D$50,D$52,D$54,D$56,D$58,D$60,D$62,D$64,D$66,D$68,D$70,D$72,D$74,D$76,D$78,D$80,D$82,D$84,D$86,D$88,D$90,D$92,D$94,D$96,D$98,D$100,D$102,D$104,D$106,D$108,D$110,D$112,D$114,D$116,D$118,D$120,D$122,D$124,D$126)) -> 1 | E327: =RANK(E326,(E$6,E$8,E$10,E$13,E$16,E$18,E$20,E$22,E$24,E$26,E$28,E$30,E$32,E$34,E$36,E$38,E$40,E$42,E$44,E$46,E$48,E$50,E$52,E$54,E$56,E$58,E$60,E$62,E$64,E$66,E$68,E$70,E$72,E$74,E$76,E$78,E$80,E$82,E$84,E$86,E$88,E$90,E$92,E$94,E$96,E$98,E$100,E$102,E$104,E$106,E$108,E$110,E$112,E$114,E$116,E$118,E$120,E$122,E$124,E$126)) -> 1 | F327: =RANK(F326,(F$6,F$8,F$10,F$13,F$16,F$18,F$20,F$22,F$24,F$26,F$28,F$30,F$32,F$34,F$36,F$38,F$40,F$42,F$44,F$46,F$48,F$50,F$52,F$54,F$56,F$58,F$60,F$62,F$64,F$66,F$68,F$70,F$72,F$74,F$76,F$78,F$80,F$82,F$84,F$86,F$88,F$90,F$92,F$94,F$96,F$98,F$100,F$102,F$104,F$106,F$108,F$110,F$112,F$114,F$116,F$118,F$120,F$122,F$124,F$126)) -> 1 | G327: =RANK(G326,(G$6,G$8,G$10,G$13,G$16,G$18,G$20,G$22,G$24,G$26,G$28,G$30,G$32,G$34,G$36,G$38,G$40,G$42,G$44,G$46,G$48,G$50,G$52,G$54,G$56,G$58,G$60,G$62,G$64,G$66,G$68,G$70,G$72,G$74,G$76,G$78,G$80,G$82,G$84,G$86,G$88,G$90,G$92,G$94,G$96,G$98,G$100,G$102,G$104,G$106,G$108,G$110,G$112,G$114,G$116,G$118,G$120,G$122,G$124,G$126)) -> 1 | H327: =RANK(H326,(H$6,H$8,H$10,H$13,H$16,H$18,H$20,H$22,H$24,H$26,H$28,H$30,H$32,H$34,H$36,H$38,H$40,H$42,H$44,H$46,H$48,H$50,H$52,H$54,H$56,H$58,H$60,H$62,H$64,H$66,H$68,H$70,H$72,H$74,H$76,H$78,H$80,H$82,H$84,H$86,H$88,H$90,H$92,H$94,H$96,H$98,H$100,H$102,H$104,H$106,H$108,H$110,H$112,H$114,H$116,H$118,H$120,H$122,H$124,H$126)) -> 1 | I327: =RANK(I326,(I$6,I$8,I$10,I$13,I$16,I$18,I$20,I$22,I$24,I$26,I$28,I$30,I$32,I$34,I$36,I$38,I$40,I$42,I$44,I$46,I$48,I$50,I$52,I$54,I$56,I$58,I$60,I$62,I$64,I$66,I$68,I$70,I$72,I$74,I$76,I$78,I$80,I$82,I$84,I$86,I$88,I$90,I$92,I$94,I$96,I$98,I$100,I$102,I$104,I$106,I$108,I$110,I$112,I$114,I$116,I$118,I$120,I$122,I$124,I$126)) -> 1 | J327: =RANK(J326,(J$6,J$8,J$10,J$13,J$16,J$18,J$20,J$22,J$24,J$26,J$28,J$30,J$32,J$34,J$36,J$38,J$40,J$42,J$44,J$46,J$48,J$50,J$52,J$54,J$56,J$58,J$60,J$62,J$64,J$66,J$68,J$70,J$72,J$74,J$76,J$78,J$80,J$82,J$84,J$86,J$88,J$90,J$92,J$94,J$96,J$98,J$100,J$102,J$104,J$106,J$108,J$110,J$112,J$114,J$116,J$118,J$120,J$122,J$124,J$126)) -> 1 | K327: =RANK(K326,(K$6,K$8,K$10,K$13,K$16,K$18,K$20,K$22,K$24,K$26,K$28,K$30,K$32,K$34,K$36,K$38,K$40,K$42,K$44,K$46,K$48,K$50,K$52,K$54,K$56,K$58,K$60,K$62,K$64,K$66,K$68,K$70,K$72,K$74,K$76,K$78,K$80,K$82,K$84,K$86,K$88,K$90,K$92,K$94,K$96,K$98,K$100,K$102,K$104,K$106,K$108,K$110,K$112,K$114,K$116,K$118,K$120,K$122,K$124,K$126)) -> 1 | L327: =RANK(L326,(L$6,L$8,L$10,L$13,L$16,L$18,L$20,L$22,L$24,L$26,L$28,L$30,L$32,L$34,L$36,L$38,L$40,L$42,L$44,L$46,L$48,L$50,L$52,L$54,L$56,L$58,L$60,L$62,L$64,L$66,L$68,L$70,L$72,L$74,L$76,L$78,L$80,L$82,L$84,L$86,L$88,L$90,L$92,L$94,L$96,L$98,L$100,L$102,L$104,L$106,L$108,L$110,L$112,L$114,L$116,L$118,L$120,L$122,L$124,L$126)) -> 1 | M327: =RANK(M326,(M$6,M$8,M$10,M$13,M$16,M$18,M$20,M$22,M$24,M$26,M$28,M$30,M$32,M$34,M$36,M$38,M$40,M$42,M$44,M$46,M$48,M$50,M$52,M$54,M$56,M$58,M$60,M$62,M$64,M$66,M$68,M$70,M$72,M$74,M$76,M$78,M$80,M$82,M$84,M$86,M$88,M$90,M$92,M$94,M$96,M$98,M$100,M$102,M$104,M$106,M$108,M$110,M$112,M$114,M$116,M$118,M$120,M$122,M$124,M$126)) -> 1 | O327: 1
A328: Bushwackers | C328: 15.90 | D328: 17.40 | E328: 16.65 | F328: 16.90 | G328: 17.40 | H328: 16.20 | I328: 25.25 | J328: 18.80 | K328: 20.90 | L328: 39.70 | M328: 81.60 | N328: 0.0 | O328: 81.60
C329: =RANK(C328,(C$6,C$8,C$10,C$13,C$16,C$18,C$20,C$22,C$24,C$26,C$28,C$30,C$32,C$34,C$36,C$38,C$40,C$42,C$44,C$46,C$48,C$50,C$52,C$54,C$56,C$58,C$60,C$62,C$64,C$66,C$68,C$70,C$72,C$74,C$76,C$78,C$80,C$82,C$84,C$86,C$88,C$90,C$92,C$94,C$96,C$98,C$100,C$102,C$104,C$106,C$108,C$110,C$112,C$114,C$116,C$118,C$120,C$122,C$124,C$126)) -> 2 | D329: =RANK(D328,(D$6,D$8,D$10,D$13,D$16,D$18,D$20,D$22,D$24,D$26,D$28,D$30,D$32,D$34,D$36,D$38,D$40,D$42,D$44,D$46,D$48,D$50,D$52,D$54,D$56,D$58,D$60,D$62,D$64,D$66,D$68,D$70,D$72,D$74,D$76,D$78,D$80,D$82,D$84,D$86,D$88,D$90,D$92,D$94,D$96,D$98,D$100,D$102,D$104,D$106,D$108,D$110,D$112,D$114,D$116,D$118,D$120,D$122,D$124,D$126)) -> 2 | E329: =RANK(E328,(E$6,E$8,E$10,E$13,E$16,E$18,E$20,E$22,E$24,E$26,E$28,E$30,E$32,E$34,E$36,E$38,E$40,E$42,E$44,E$46,E$48,E$50,E$52,E$54,E$56,E$58,E$60,E$62,E$64,E$66,E$68,E$70,E$72,E$74,E$76,E$78,E$80,E$82,E$84,E$86,E$88,E$90,E$92,E$94,E$96,E$98,E$100,E$102,E$104,E$106,E$108,E$110,E$112,E$114,E$116,E$118,E$120,E$122,E$124,E$126)) -> 2 | F329: =RANK(F328,(F$6,F$8,F$10,F$13,F$16,F$18,F$20,F$22,F$24,F$26,F$28,F$30,F$32,F$34,F$36,F$38,F$40,F$42,F$44,F$46,F$48,F$50,F$52,F$54,F$56,F$58,F$60,F$62,F$64,F$66,F$68,F$70,F$72,F$74,F$76,F$78,F$80,F$82,F$84,F$86,F$88,F$90,F$92,F$94,F$96,F$98,F$100,F$102,F$104,F$106,F$108,F$110,F$112,F$114,F$116,F$118,F$120,F$122,F$124,F$126)) -> 2 | G329: =RANK(G328,(G$6,G$8,G$10,G$13,G$16,G$18,G$20,G$22,G$24,G$26,G$28,G$30,G$32,G$34,G$36,G$38,G$40,G$42,G$44,G$46,G$48,G$50,G$52,G$54,G$56,G$58,G$60,G$62,G$64,G$66,G$68,G$70,G$72,G$74,G$76,G$78,G$80,G$82,G$84,G$86,G$88,G$90,G$92,G$94,G$96,G$98,G$100,G$102,G$104,G$106,G$108,G$110,G$112,G$114,G$116,G$118,G$120,G$122,G$124,G$126)) -> 2 | H329: =RANK(H328,(H$6,H$8,H$10,H$13,H$16,H$18,H$20,H$22,H$24,H$26,H$28,H$30,H$32,H$34,H$36,H$38,H$40,H$42,H$44,H$46,H$48,H$50,H$52,H$54,H$56,H$58,H$60,H$62,H$64,H$66,H$68,H$70,H$72,H$74,H$76,H$78,H$80,H$82,H$84,H$86,H$88,H$90,H$92,H$94,H$96,H$98,H$100,H$102,H$104,H$106,H$108,H$110,H$112,H$114,H$116,H$118,H$120,H$122,H$124,H$126)) -> 2 | I329: =RANK(I328,(I$6,I$8,I$10,I$13,I$16,I$18,I$20,I$22,I$24,I$26,I$28,I$30,I$32,I$34,I$36,I$38,I$40,I$42,I$44,I$46,I$48,I$50,I$52,I$54,I$56,I$58,I$60,I$62,I$64,I$66,I$68,I$70,I$72,I$74,I$76,I$78,I$80,I$82,I$84,I$86,I$88,I$90,I$92,I$94,I$96,I$98,I$100,I$102,I$104,I$106,I$108,I$110,I$112,I$114,I$116,I$118,I$120,I$122,I$124,I$126)) -> 2 | J329: =RANK(J328,(J$6,J$8,J$10,J$13,J$16,J$18,J$20,J$22,J$24,J$26,J$28,J$30,J$32,J$34,J$36,J$38,J$40,J$42,J$44,J$46,J$48,J$50,J$52,J$54,J$56,J$58,J$60,J$62,J$64,J$66,J$68,J$70,J$72,J$74,J$76,J$78,J$80,J$82,J$84,J$86,J$88,J$90,J$92,J$94,J$96,J$98,J$100,J$102,J$104,J$106,J$108,J$110,J$112,J$114,J$116,J$118,J$120,J$122,J$124,J$126)) -> 2 | K329: =RANK(K328,(K$6,K$8,K$10,K$13,K$16,K$18,K$20,K$22,K$24,K$26,K$28,K$30,K$32,K$34,K$36,K$38,K$40,K$42,K$44,K$46,K$48,K$50,K$52,K$54,K$56,K$58,K$60,K$62,K$64,K$66,K$68,K$70,K$72,K$74,K$76,K$78,K$80,K$82,K$84,K$86,K$88,K$90,K$92,K$94,K$96,K$98,K$100,K$102,K$104,K$106,K$108,K$110,K$112,K$114,K$116,K$118,K$120,K$122,K$124,K$126)) -> 2 | L329: =RANK(L328,(L$6,L$8,L$10,L$13,L$16,L$18,L$20,L$22,L$24,L$26,L$28,L$30,L$32,L$34,L$36,L$38,L$40,L$42,L$44,L$46,L$48,L$50,L$52,L$54,L$56,L$58,L$60,L$62,L$64,L$66,L$68,L$70,L$72,L$74,L$76,L$78,L$80,L$82,L$84,L$86,L$88,L$90,L$92,L$94,L$96,L$98,L$100,L$102,L$104,L$106,L$108,L$110,L$112,L$114,L$116,L$118,L$120,L$122,L$124,L$126)) -> 2 | M329: =RANK(M328,(M$6,M$8,M$10,M$13,M$16,M$18,M$20,M$22,M$24,M$26,M$28,M$30,M$32,M$34,M$36,M$38,M$40,M$42,M$44,M$46,M$48,M$50,M$52,M$54,M$56,M$58,M$60,M$62,M$64,M$66,M$68,M$70,M$72,M$74,M$76,M$78,M$80,M$82,M$84,M$86,M$88,M$90,M$92,M$94,M$96,M$98,M$100,M$102,M$104,M$106,M$108,M$110,M$112,M$114,M$116,M$118,M$120,M$122,M$124,M$126)) -> 2 | O329: 2
A330: White | C330: 15.00 | D330: 16.00 | E330: 15.50 | F330: 16.80 | G330: 15.50 | H330: 15.80 | I330: 24.05 | J330: 18.15 | K330: 19.80 | L330: 37.95 | M330: 77.50 | N330: 0.0 | O330: 77.50
A331: Sabers | C331: 3 | D331: 3 | E331: 3 | F331: 3 | G331: 3 | H331: 3 | I331: 3 | J331: 3 | K331: 3 | L331: 3 | M331: 3 | O331: 3
A332: DCA Open Class
A333: Connecticut | C333: 13.90 | D333: 16.60 | E333: 15.25 | F333: 15.80 | G333: 16.30 | H333: 15.20 | I333: 23.65 | J333: 18.45 | K333: 19.65 | L333: 38.10 | M333: 77.00 | N333: 0.0 | O333: 77.00
A334: Hurricanes | C334: 1 | D334: 1 | E334: 1 | F334: 1 | G334: 1 | H334: 1 | I334: 1 | J334: 1 | K334: 1 | L334: 1 | M334: 1 | O334: 1
A335: DCA Class A
A336: Fusion | C336: 14.50 | D336: 14.80 | E336: 14.65 | F336: 14.90 | G336: 15.40 | H336: 14.80 | I336: 22.55 | J336: 17.75 | K336: 18.05 | L336: 35.80 | M336: 73.00 | N336: 0.0 | O336: 73.00
A337: Core | C337: 1 | D337: 1 | E337: 1 | F337: 1 | G337: 1 | H337: 1 | I337: 1 | J337: 1 | K337: 1 | L337: 1 | M337: 1 | O337: 1
A340: 8/6/2022 Charleston, Illinois
C341: General Effect | F341: Visual | J341: Music
C342: 1 | D342: 2 | F342: Proficiency | G342: Analysis | H342: Color Guard | J342: Brass | K342: Analysis | L342: Percussion | N342: Sub | P342: Total
C343: K. Baker | D343: J. Denton | E343: Total | F343: M. Turner | G343: T. Wingate | H343: C. Quamme | I343: Total ÷2 | J343: R. Greenwell | K343: J. Kennedy | L343: C. Rapacki | M343: Total ÷2 | N343: Total | O343: Pen | P343: Score
A344: DCI Open Class | C344: 20 | D344: 20 | E344: 40 | F344: 20 | G344: 20 | H344: 20 | I344: 30 | J344: 20 | K344: 20 | L344: 20 | M344: 30 | N344: 100 | P344: 100
A345: Gold | B345: 8 | C345: 16.30 | D345: 16.30 | E345: 31.90 | F345: 16.70 | G345: 16.20 | H345: 16.00 | I345: 24.45 | J345: 16.10 | K345: 16.00 | L345: 15.70 | M345: 23.90 | N345: 80.25 | O345: 0.0 | P345: 80.25
C346: =RANK(C345,(C$6,C$8,C$10,C$12,C$14,C$16,C$18,C$20,C$22,C$24,C$26,C$28,C$30,C$32,C$34,C$36,C$38,C$40,C$42,C$44,C$46,C$48,C$50,C$52,C$54,C$56,C$58,C$60,C$62,C$64,C$66,C$68,C$70,C$72,C$74,C$76,C$78,C$80,C$82,C$84,C$86,C$88,C$90,C$92,C$94,C$96,C$98,C$100,C$102,C$104,C$106,C$108,C$110,C$112,C$114,C$116,C$118,C$120,C$122,C$124)) -> 1 | D346: =RANK(D345,(D$6,D$8,D$10,D$12,D$14,D$16,D$18,D$20,D$22,D$24,D$26,D$28,D$30,D$32,D$34,D$36,D$38,D$40,D$42,D$44,D$46,D$48,D$50,D$52,D$54,D$56,D$58,D$60,D$62,D$64,D$66,D$68,D$70,D$72,D$74,D$76,D$78,D$80,D$82,D$84,D$86,D$88,D$90,D$92,D$94,D$96,D$98,D$100,D$102,D$104,D$106,D$108,D$110,D$112,D$114,D$116,D$118,D$120,D$122,D$124)) -> 2 | E346: =RANK(E345,(E$6,E$8,E$10,E$12,E$14,E$16,E$18,E$20,E$22,E$24,E$26,E$28,E$30,E$32,E$34,E$36,E$38,E$40,E$42,E$44,E$46,E$48,E$50,E$52,E$54,E$56,E$58,E$60,E$62,E$64,E$66,E$68,E$70,E$72,E$74,E$76,E$78,E$80,E$82,E$84,E$86,E$88,E$90,E$92,E$94,E$96,E$98,E$100,E$102,E$104,E$106,E$108,E$110,E$112,E$114,E$116,E$118,E$120,E$122,E$124)) -> 2 | F346: =RANK(F345,(F$6,F$8,F$10,F$12,F$14,F$16,F$18,F$20,F$22,F$24,F$26,F$28,F$30,F$32,F$34,F$36,F$38,F$40,F$42,F$44,F$46,F$48,F$50,F$52,F$54,F$56,F$58,F$60,F$62,F$64,F$66,F$68,F$70,F$72,F$74,F$76,F$78,F$80,F$82,F$84,F$86,F$88,F$90,F$92,F$94,F$96,F$98,F$100,F$102,F$104,F$106,F$108,F$110,F$112,F$114,F$116,F$118,F$120,F$122,F$124)) -> 2 | G346: =RANK(G345,(G$6,G$8,G$10,G$12,G$14,G$16,G$18,G$20,G$22,G$24,G$26,G$28,G$30,G$32,G$34,G$36,G$38,G$40,G$42,G$44,G$46,G$48,G$50,G$52,G$54,G$56,G$58,G$60,G$62,G$64,G$66,G$68,G$70,G$72,G$74,G$76,G$78,G$80,G$82,G$84,G$86,G$88,G$90,G$92,G$94,G$96,G$98,G$100,G$102,G$104,G$106,G$108,G$110,G$112,G$114,G$116,G$118,G$120,G$122,G$124)) -> 1 | H346: =RANK(H345,(H$6,H$8,H$10,H$12,H$14,H$16,H$18,H$20,H$22,H$24,H$26,H$28,H$30,H$32,H$34,H$36,H$38,H$40,H$42,H$44,H$46,H$48,H$50,H$52,H$54,H$56,H$58,H$60,H$62,H$64,H$66,H$68,H$70,H$72,H$74,H$76,H$78,H$80,H$82,H$84,H$86,H$88,H$90,H$92,H$94,H$96,H$98,H$100,H$102,H$104,H$106,H$108,H$110,H$112,H$114,H$116,H$118,H$120,H$122,H$124)) -> 1 | I346: =RANK(I345,(I$6,I$8,I$10,I$12,I$14,I$16,I$18,I$20,I$22,I$24,I$26,I$28,I$30,I$32,I$34,I$36,I$38,I$40,I$42,I$44,I$46,I$48,I$50,I$52,I$54,I$56,I$58,I$60,I$62,I$64,I$66,I$68,I$70,I$72,I$74,I$76,I$78,I$80,I$82,I$84,I$86,I$88,I$90,I$92,I$94,I$96,I$98,I$100,I$102,I$104,I$106,I$108,I$110,I$112,I$114,I$116,I$118,I$120,I$122,I$124)) -> 1 | J346: =RANK(J345,(J$6,J$8,J$10,J$12,J$14,J$16,J$18,J$20,J$22,J$24,J$26,J$28,J$30,J$32,J$34,J$36,J$38,J$40,J$42,J$44,J$46,J$48,J$50,J$52,J$54,J$56,J$58,J$60,J$62,J$64,J$66,J$68,J$70,J$72,J$74,J$76,J$78,J$80,J$82,J$84,J$86,J$88,J$90,J$92,J$94,J$96,J$98,J$100,J$102,J$104,J$106,J$108,J$110,J$112,J$114,J$116,J$118,J$120,J$122,J$124)) -> 1 | K346: =RANK(K345,(K$6,K$8,K$10,K$12,K$14,K$16,K$18,K$20,K$22,K$24,K$26,K$28,K$30,K$32,K$34,K$36,K$38,K$40,K$42,K$44,K$46,K$48,K$50,K$52,K$54,K$56,K$58,K$60,K$62,K$64,K$66,K$68,K$70,K$72,K$74,K$76,K$78,K$80,K$82,K$84,K$86,K$88,K$90,K$92,K$94,K$96,K$98,K$100,K$102,K$104,K$106,K$108,K$110,K$112,K$114,K$116,K$118,K$120,K$122,K$124)) -> 3 | L346: =RANK(L345,(L$6,L$8,L$10,L$12,L$14,L$16,L$18,L$20,L$22,L$24,L$26,L$28,L$30,L$32,L$34,L$36,L$38,L$40,L$42,L$44,L$46,L$48,L$50,L$52,L$54,L$56,L$58,L$60,L$62,L$64,L$66,L$68,L$70,L$72,L$74,L$76,L$78,L$80,L$82,L$84,L$86,L$88,L$90,L$92,L$94,L$96,L$98,L$100,L$102,L$104,L$106,L$108,L$110,L$112,L$114,L$116,L$118,L$120,L$122,L$124)) -> 1 | M346: =RANK(M345,(M$6,M$8,M$10,M$12,M$14,M$16,M$18,M$20,M$22,M$24,M$26,M$28,M$30,M$32,M$34,M$36,M$38,M$40,M$42,M$44,M$46,M$48,M$50,M$52,M$54,M$56,M$58,M$60,M$62,M$64,M$66,M$68,M$70,M$72,M$74,M$76,M$78,M$80,M$82,M$84,M$86,M$88,M$90,M$92,M$94,M$96,M$98,M$100,M$102,M$104,M$106,M$108,M$110,M$112,M$114,M$116,M$118,M$120,M$122,M$124)) -> 1 | N346: =RANK(N345,(N$6,N$8,N$10,N$12,N$14,N$16,N$18,N$20,N$22,N$24,N$26,N$28,N$30,N$32,N$34,N$36,N$38,N$40,N$42,N$44,N$46,N$48,N$50,N$52,N$54,N$56,N$58,N$60,N$62,N$64,N$66,N$68,N$70,N$72,N$74,N$76,N$78,N$80,N$82,N$84,N$86,N$88,N$90,N$92,N$94,N$96,N$98,N$100,N$102,N$104,N$106,N$108,N$110,N$112,N$114,N$116,N$118,N$120,N$122,N$124)) -> 1 | P346: =RANK(P345,(P$6,P$8,P$10,P$12,P$14,P$16,P$18,P$20,P$22,P$24,P$26,P$28,P$30,P$32,P$34,P$36,P$38,P$40,P$42,P$44,P$46,P$48,P$50,P$52,P$54,P$56,P$58,P$60,P$62,P$64,P$66,P$68,P$70,P$72,P$74,P$76,P$78,P$80,P$82,P$84,P$86,P$88,P$90,P$92,P$94,P$96,P$98,P$100,P$102,P$104,P$106,P$108,P$110,P$112,P$114,P$116,P$118,P$120,P$122,P$124)) -> 1
A347: Vanguard | B347: 2 | C347: 15.80 | D347: 16.50 | E347: 32.30 | F347: 16.80 | G347: 16.10 | H347: 15.70 | I347: 24.30 | J347: 15.90 | K347: 16.20 | L347: 15.20 | M347: 23.65 | N347: 80.25 | O347: 0.0 | P347: 80.25
A348: Cadets | C348: =RANK(C347,(C$6,C$8,C$10,C$12,C$14,C$16,C$18,C$20,C$22,C$24,C$26,C$28,C$30,C$32,C$34,C$36,C$38,C$40,C$42,C$44,C$46,C$48,C$50,C$52,C$54,C$56,C$58,C$60,C$62,C$64,C$66,C$68,C$70,C$72,C$74,C$76,C$78,C$80,C$82,C$84,C$86,C$88,C$90,C$92,C$94,C$96,C$98,C$100,C$102,C$104,C$106,C$108,C$110,C$112,C$114,C$116,C$118,C$120,C$122,C$124)) -> 2 | D348: =RANK(D347,(D$6,D$8,D$10,D$12,D$14,D$16,D$18,D$20,D$22,D$24,D$26,D$28,D$30,D$32,D$34,D$36,D$38,D$40,D$42,D$44,D$46,D$48,D$50,D$52,D$54,D$56,D$58,D$60,D$62,D$64,D$66,D$68,D$70,D$72,D$74,D$76,D$78,D$80,D$82,D$84,D$86,D$88,D$90,D$92,D$94,D$96,D$98,D$100,D$102,D$104,D$106,D$108,D$110,D$112,D$114,D$116,D$118,D$120,D$122,D$124)) -> 1 | E348: =RANK(E347,(E$6,E$8,E$10,E$12,E$14,E$16,E$18,E$20,E$22,E$24,E$26,E$28,E$30,E$32,E$34,E$36,E$38,E$40,E$42,E$44,E$46,E$48,E$50,E$52,E$54,E$56,E$58,E$60,E$62,E$64,E$66,E$68,E$70,E$72,E$74,E$76,E$78,E$80,E$82,E$84,E$86,E$88,E$90,E$92,E$94,E$96,E$98,E$100,E$102,E$104,E$106,E$108,E$110,E$112,E$114,E$116,E$118,E$120,E$122,E$124)) -> 1 | F348: =RANK(F347,(F$6,F$8,F$10,F$12,F$14,F$16,F$18,F$20,F$22,F$24,F$26,F$28,F$30,F$32,F$34,F$36,F$38,F$40,F$42,F$44,F$46,F$48,F$50,F$52,F$54,F$56,F$58,F$60,F$62,F$64,F$66,F$68,F$70,F$72,F$74,F$76,F$78,F$80,F$82,F$84,F$86,F$88,F$90,F$92,F$94,F$96,F$98,F$100,F$102,F$104,F$106,F$108,F$110,F$112,F$114,F$116,F$118,F$120,F$122,F$124)) -> 1 | G348: =RANK(G347,(G$6,G$8,G$10,G$12,G$14,G$16,G$18,G$20,G$22,G$24,G$26,G$28,G$30,G$32,G$34,G$36,G$38,G$40,G$42,G$44,G$46,G$48,G$50,G$52,G$54,G$56,G$58,G$60,G$62,G$64,G$66,G$68,G$70,G$72,G$74,G$76,G$78,G$80,G$82,G$84,G$86,G$88,G$90,G$92,G$94,G$96,G$98,G$100,G$102,G$104,G$106,G$108,G$110,G$112,G$114,G$116,G$118,G$120,G$122,G$124)) -> 2 | H348: =RANK(H347,(H$6,H$8,H$10,H$12,H$14,H$16,H$18,H$20,H$22,H$24,H$26,H$28,H$30,H$32,H$34,H$36,H$38,H$40,H$42,H$44,H$46,H$48,H$50,H$52,H$54,H$56,H$58,H$60,H$62,H$64,H$66,H$68,H$70,H$72,H$74,H$76,H$78,H$80,H$82,H$84,H$86,H$88,H$90,H$92,H$94,H$96,H$98,H$100,H$102,H$104,H$106,H$108,H$110,H$112,H$114,H$116,H$118,H$120,H$122,H$124)) -> 2 | I348: =RANK(I347,(I$6,I$8,I$10,I$12,I$14,I$16,I$18,I$20,I$22,I$24,I$26,I$28,I$30,I$32,I$34,I$36,I$38,I$40,I$42,I$44,I$46,I$48,I$50,I$52,I$54,I$56,I$58,I$60,I$62,I$64,I$66,I$68,I$70,I$72,I$74,I$76,I$78,I$80,I$82,I$84,I$86,I$88,I$90,I$92,I$94,I$96,I$98,I$100,I$102,I$104,I$106,I$108,I$110,I$112,I$114,I$116,I$118,I$120,I$122,I$124)) -> 2 | J348: =RANK(J347,(J$6,J$8,J$10,J$12,J$14,J$16,J$18,J$20,J$22,J$24,J$26,J$28,J$30,J$32,J$34,J$36,J$38,J$40,J$42,J$44,J$46,J$48,J$50,J$52,J$54,J$56,J$58,J$60,J$62,J$64,J$66,J$68,J$70,J$72,J$74,J$76,J$78,J$80,J$82,J$84,J$86,J$88,J$90,J$92,J$94,J$96,J$98,J$100,J$102,J$104,J$106,J$108,J$110,J$112,J$114,J$116,J$118,J$120,J$122,J$124)) -> 2 | K348: =RANK(K347,(K$6,K$8,K$10,K$12,K$14,K$16,K$18,K$20,K$22,K$24,K$26,K$28,K$30,K$32,K$34,K$36,K$38,K$40,K$42,K$44,K$46,K$48,K$50,K$52,K$54,K$56,K$58,K$60,K$62,K$64,K$66,K$68,K$70,K$72,K$74,K$76,K$78,K$80,K$82,K$84,K$86,K$88,K$90,K$92,K$94,K$96,K$98,K$100,K$102,K$104,K$106,K$108,K$110,K$112,K$114,K$116,K$118,K$120,K$122,K$124)) -> 2 | L348: =RANK(L347,(L$6,L$8,L$10,L$12,L$14,L$16,L$18,L$20,L$22,L$24,L$26,L$28,L$30,L$32,L$34,L$36,L$38,L$40,L$42,L$44,L$46,L$48,L$50,L$52,L$54,L$56,L$58,L$60,L$62,L$64,L$66,L$68,L$70,L$72,L$74,L$76,L$78,L$80,L$82,L$84,L$86,L$88,L$90,L$92,L$94,L$96,L$98,L$100,L$102,L$104,L$106,L$108,L$110,L$112,L$114,L$116,L$118,L$120,L$122,L$124)) -> 3 | M348: =RANK(M347,(M$6,M$8,M$10,M$12,M$14,M$16,M$18,M$20,M$22,M$24,M$26,M$28,M$30,M$32,M$34,M$36,M$38,M$40,M$42,M$44,M$46,M$48,M$50,M$52,M$54,M$56,M$58,M$60,M$62,M$64,M$66,M$68,M$70,M$72,M$74,M$76,M$78,M$80,M$82,M$84,M$86,M$88,M$90,M$92,M$94,M$96,M$98,M$100,M$102,M$104,M$106,M$108,M$110,M$112,M$114,M$116,M$118,M$120,M$122,M$124)) -> 2 | N348: =RANK(N347,(N$6,N$8,N$10,N$12,N$14,N$16,N$18,N$20,N$22,N$24,N$26,N$28,N$30,N$32,N$34,N$36,N$38,N$40,N$42,N$44,N$46,N$48,N$50,N$52,N$54,N$56,N$58,N$60,N$62,N$64,N$66,N$68,N$70,N$72,N$74,N$76,N$78,N$80,N$82,N$84,N$86,N$88,N$90,N$92,N$94,N$96,N$98,N$100,N$102,N$104,N$106,N$108,N$110,N$112,N$114,N$116,N$118,N$120,N$122,N$124)) -> 1 | P348: =RANK(P347,(P$6,P$8,P$10,P$12,P$14,P$16,P$18,P$20,P$22,P$24,P$26,P$28,P$30,P$32,P$34,P$36,P$38,P$40,P$42,P$44,P$46,P$48,P$50,P$52,P$54,P$56,P$58,P$60,P$62,P$64,P$66,P$68,P$70,P$72,P$74,P$76,P$78,P$80,P$82,P$84,P$86,P$88,P$90,P$92,P$94,P$96,P$98,P$100,P$102,P$104,P$106,P$108,P$110,P$112,P$114,P$116,P$118,P$120,P$122,P$124)) -> 1
A349: Blue | B349: 1 | C349: 15.20 | D349: 15.90 | E349: 31.10 | F349: 16.20 | G349: 15.50 | H349: 15.30 | I349: 23.50 | J349: 15.50 | K349: 16.30 | L349: 15.10 | M349: 23.45 | N349: 78.05 | O349: 0.0 | P349: 78.05
A350: Devils B | C350: =RANK(C349,(C$6,C$8,C$10,C$12,C$14,C$16,C$18,C$20,C$22,C$24,C$26,C$28,C$30,C$32,C$34,C$36,C$38,C$40,C$42,C$44,C$46,C$48,C$50,C$52,C$54,C$56,C$58,C$60,C$62,C$64,C$66,C$68,C$70,C$72,C$74,C$76,C$78,C$80,C$82,C$84,C$86,C$88,C$90,C$92,C$94,C$96,C$98,C$100,C$102,C$104,C$106,C$108,C$110,C$112,C$114,C$116,C$118,C$120,C$122,C$124)) -> 4 | D350: =RANK(D349,(D$6,D$8,D$10,D$12,D$14,D$16,D$18,D$20,D$22,D$24,D$26,D$28,D$30,D$32,D$34,D$36,D$38,D$40,D$42,D$44,D$46,D$48,D$50,D$52,D$54,D$56,D$58,D$60,D$62,D$64,D$66,D$68,D$70,D$72,D$74,D$76,D$78,D$80,D$82,D$84,D$86,D$88,D$90,D$92,D$94,D$96,D$98,D$100,D$102,D$104,D$106,D$108,D$110,D$112,D$114,D$116,D$118,D$120,D$122,D$124)) -> 3 | E350: =RANK(E349,(E$6,E$8,E$10,E$12,E$14,E$16,E$18,E$20,E$22,E$24,E$26,E$28,E$30,E$32,E$34,E$36,E$38,E$40,E$42,E$44,E$46,E$48,E$50,E$52,E$54,E$56,E$58,E$60,E$62,E$64,E$66,E$68,E$70,E$72,E$74,E$76,E$78,E$80,E$82,E$84,E$86,E$88,E$90,E$92,E$94,E$96,E$98,E$100,E$102,E$104,E$106,E$108,E$110,E$112,E$114,E$116,E$118,E$120,E$122,E$124)) -> 3 | F350: =RANK(F349,(F$6,F$8,F$10,F$12,F$14,F$16,F$18,F$20,F$22,F$24,F$26,F$28,F$30,F$32,F$34,F$36,F$38,F$40,F$42,F$44,F$46,F$48,F$50,F$52,F$54,F$56,F$58,F$60,F$62,F$64,F$66,F$68,F$70,F$72,F$74,F$76,F$78,F$80,F$82,F$84,F$86,F$88,F$90,F$92,F$94,F$96,F$98,F$100,F$102,F$104,F$106,F$108,F$110,F$112,F$114,F$116,F$118,F$120,F$122,F$124)) -> 3 | G350: =RANK(G349,(G$6,G$8,G$10,G$12,G$14,G$16,G$18,G$20,G$22,G$24,G$26,G$28,G$30,G$32,G$34,G$36,G$38,G$40,G$42,G$44,G$46,G$48,G$50,G$52,G$54,G$56,G$58,G$60,G$62,G$64,G$66,G$68,G$70,G$72,G$74,G$76,G$78,G$80,G$82,G$84,G$86,G$88,G$90,G$92,G$94,G$96,G$98,G$100,G$102,G$104,G$106,G$108,G$110,G$112,G$114,G$116,G$118,G$120,G$122,G$124)) -> 4 | H350: =RANK(H349,(H$6,H$8,H$10,H$12,H$14,H$16,H$18,H$20,H$22,H$24,H$26,H$28,H$30,H$32,H$34,H$36,H$38,H$40,H$42,H$44,H$46,H$48,H$50,H$52,H$54,H$56,H$58,H$60,H$62,H$64,H$66,H$68,H$70,H$72,H$74,H$76,H$78,H$80,H$82,H$84,H$86,H$88,H$90,H$92,H$94,H$96,H$98,H$100,H$102,H$104,H$106,H$108,H$110,H$112,H$114,H$116,H$118,H$120,H$122,H$124)) -> 4 | I350: =RANK(I349,(I$6,I$8,I$10,I$12,I$14,I$16,I$18,I$20,I$22,I$24,I$26,I$28,I$30,I$32,I$34,I$36,I$38,I$40,I$42,I$44,I$46,I$48,I$50,I$52,I$54,I$56,I$58,I$60,I$62,I$64,I$66,I$68,I$70,I$72,I$74,I$76,I$78,I$80,I$82,I$84,I$86,I$88,I$90,I$92,I$94,I$96,I$98,I$100,I$102,I$104,I$106,I$108,I$110,I$112,I$114,I$116,I$118,I$120,I$122,I$124)) -> 3 | J350: =RANK(J349,(J$6,J$8,J$10,J$12,J$14,J$16,J$18,J$20,J$22,J$24,J$26,J$28,J$30,J$32,J$34,J$36,J$38,J$40,J$42,J$44,J$46,J$48,J$50,J$52,J$54,J$56,J$58,J$60,J$62,J$64,J$66,J$68,J$70,J$72,J$74,J$76,J$78,J$80,J$82,J$84,J$86,J$88,J$90,J$92,J$94,J$96,J$98,J$100,J$102,J$104,J$106,J$108,J$110,J$112,J$114,J$116,J$118,J$120,J$122,J$124)) -> 3 | K350: =RANK(K349,(K$6,K$8,K$10,K$12,K$14,K$16,K$18,K$20,K$22,K$24,K$26,K$28,K$30,K$32,K$34,K$36,K$38,K$40,K$42,K$44,K$46,K$48,K$50,K$52,K$54,K$56,K$58,K$60,K$62,K$64,K$66,K$68,K$70,K$72,K$74,K$76,K$78,K$80,K$82,K$84,K$86,K$88,K$90,K$92,K$94,K$96,K$98,K$100,K$102,K$104,K$106,K$108,K$110,K$112,K$114,K$116,K$118,K$120,K$122,K$124)) -> 1 | L350: =RANK(L349,(L$6,L$8,L$10,L$12,L$14,L$16,L$18,L$20,L$22,L$24,L$26,L$28,L$30,L$32,L$34,L$36,L$38,L$40,L$42,L$44,L$46,L$48,L$50,L$52,L$54,L$56,L$58,L$60,L$62,L$64,L$66,L$68,L$70,L$72,L$74,L$76,L$78,L$80,L$82,L$84,L$86,L$88,L$90,L$92,L$94,L$96,L$98,L$100,L$102,L$104,L$106,L$108,L$110,L$112,L$114,L$116,L$118,L$120,L$122,L$124)) -> 4 | M350: =RANK(M349,(M$6,M$8,M$10,M$12,M$14,M$16,M$18,M$20,M$22,M$24,M$26,M$28,M$30,M$32,M$34,M$36,M$38,M$40,M$42,M$44,M$46,M$48,M$50,M$52,M$54,M$56,M$58,M$60,M$62,M$64,M$66,M$68,M$70,M$72,M$74,M$76,M$78,M$80,M$82,M$84,M$86,M$88,M$90,M$92,M$94,M$96,M$98,M$100,M$102,M$104,M$106,M$108,M$110,M$112,M$114,M$116,M$118,M$120,M$122,M$124)) -> 3 | N350: =RANK(N349,(N$6,N$8,N$10,N$12,N$14,N$16,N$18,N$20,N$22,N$24,N$26,N$28,N$30,N$32,N$34,N$36,N$38,N$40,N$42,N$44,N$46,N$48,N$50,N$52,N$54,N$56,N$58,N$60,N$62,N$64,N$66,N$68,N$70,N$72,N$74,N$76,N$78,N$80,N$82,N$84,N$86,N$88,N$90,N$92,N$94,N$96,N$98,N$100,N$102,N$104,N$106,N$108,N$110,N$112,N$114,N$116,N$118,N$120,N$122,N$124)) -> 3 | P350: =RANK(P349,(P$6,P$8,P$10,P$12,P$14,P$16,P$18,P$20,P$22,P$24,P$26,P$28,P$30,P$32,P$34,P$36,P$38,P$40,P$42,P$44,P$46,P$48,P$50,P$52,P$54,P$56,P$58,P$60,P$62,P$64,P$66,P$68,P$70,P$72,P$74,P$76,P$78,P$80,P$82,P$84,P$86,P$88,P$90,P$92,P$94,P$96,P$98,P$100,P$102,P$104,P$106,P$108,P$110,P$112,P$114,P$116,P$118,P$120,P$122,P$124)) -> 3
A351: Guardians | B351: 6 | C351: 15.30 | D351: 15.50 | E351: 30.80 | F351: 14.60 | G351: 15.60 | H351: 15.60 | I351: 22.90 | J351: 15.00 | K351: 15.80 | L351: 15.50 | M351: 23.15 | N351: 76.85 | O351: 0.0 | P351: 76.85
C352: =RANK(C351,(C$6,C$8,C$10,C$12,C$14,C$16,C$18,C$20,C$22,C$24,C$26,C$28,C$30,C$32,C$34,C$36,C$38,C$40,C$42,C$44,C$46,C$48,C$50,C$52,C$54,C$56,C$58,C$60,C$62,C$64,C$66,C$68,C$70,C$72,C$74,C$76,C$78,C$80,C$82,C$84,C$86,C$88,C$90,C$92,C$94,C$96,C$98,C$100,C$102,C$104,C$106,C$108,C$110,C$112,C$114,C$116,C$118,C$120,C$122,C$124)) -> 3 | D352: =RANK(D351,(D$6,D$8,D$10,D$12,D$14,D$16,D$18,D$20,D$22,D$24,D$26,D$28,D$30,D$32,D$34,D$36,D$38,D$40,D$42,D$44,D$46,D$48,D$50,D$52,D$54,D$56,D$58,D$60,D$62,D$64,D$66,D$68,D$70,D$72,D$74,D$76,D$78,D$80,D$82,D$84,D$86,D$88,D$90,D$92,D$94,D$96,D$98,D$100,D$102,D$104,D$106,D$108,D$110,D$112,D$114,D$116,D$118,D$120,D$122,D$124)) -> 4 | E352: =RANK(E351,(E$6,E$8,E$10,E$12,E$14,E$16,E$18,E$20,E$22,E$24,E$26,E$28,E$30,E$32,E$34,E$36,E$38,E$40,E$42,E$44,E$46,E$48,E$50,E$52,E$54,E$56,E$58,E$60,E$62,E$64,E$66,E$68,E$70,E$72,E$74,E$76,E$78,E$80,E$82,E$84,E$86,E$88,E$90,E$92,E$94,E$96,E$98,E$100,E$102,E$104,E$106,E$108,E$110,E$112,E$114,E$116,E$118,E$120,E$122,E$124)) -> 4 | F352: =RANK(F351,(F$6,F$8,F$10,F$12,F$14,F$16,F$18,F$20,F$22,F$24,F$26,F$28,F$30,F$32,F$34,F$36,F$38,F$40,F$42,F$44,F$46,F$48,F$50,F$52,F$54,F$56,F$58,F$60,F$62,F$64,F$66,F$68,F$70,F$72,F$74,F$76,F$78,F$80,F$82,F$84,F$86,F$88,F$90,F$92,F$94,F$96,F$98,F$100,F$102,F$104,F$106,F$108,F$110,F$112,F$114,F$116,F$118,F$120,F$122,F$124)) -> 6 | G352: =RANK(G351,(G$6,G$8,G$10,G$12,G$14,G$16,G$18,G$20,G$22,G$24,G$26,G$28,G$30,G$32,G$34,G$36,G$38,G$40,G$42,G$44,G$46,G$48,G$50,G$52,G$54,G$56,G$58,G$60,G$62,G$64,G$66,G$68,G$70,G$72,G$74,G$76,G$78,G$80,G$82,G$84,G$86,G$88,G$90,G$92,G$94,G$96,G$98,G$100,G$102,G$104,G$106,G$108,G$110,G$112,G$114,G$116,G$118,G$120,G$122,G$124)) -> 3 | H352: =RANK(H351,(H$6,H$8,H$10,H$12,H$14,H$16,H$18,H$20,H$22,H$24,H$26,H$28,H$30,H$32,H$34,H$36,H$38,H$40,H$42,H$44,H$46,H$48,H$50,H$52,H$54,H$56,H$58,H$60,H$62,H$64,H$66,H$68,H$70,H$72,H$74,H$76,H$78,H$80,H$82,H$84,H$86,H$88,H$90,H$92,H$94,H$96,H$98,H$100,H$102,H$104,H$106,H$108,H$110,H$112,H$114,H$116,H$118,H$120,H$122,H$124)) -> 3 | I352: =RANK(I351,(I$6,I$8,I$10,I$12,I$14,I$16,I$18,I$20,I$22,I$24,I$26,I$28,I$30,I$32,I$34,I$36,I$38,I$40,I$42,I$44,I$46,I$48,I$50,I$52,I$54,I$56,I$58,I$60,I$62,I$64,I$66,I$68,I$70,I$72,I$74,I$76,I$78,I$80,I$82,I$84,I$86,I$88,I$90,I$92,I$94,I$96,I$98,I$100,I$102,I$104,I$106,I$108,I$110,I$112,I$114,I$116,I$118,I$120,I$122,I$124)) -> 4 | J352: =RANK(J351,(J$6,J$8,J$10,J$12,J$14,J$16,J$18,J$20,J$22,J$24,J$26,J$28,J$30,J$32,J$34,J$36,J$38,J$40,J$42,J$44,J$46,J$48,J$50,J$52,J$54,J$56,J$58,J$60,J$62,J$64,J$66,J$68,J$70,J$72,J$74,J$76,J$78,J$80,J$82,J$84,J$86,J$88,J$90,J$92,J$94,J$96,J$98,J$100,J$102,J$104,J$106,J$108,J$110,J$112,J$114,J$116,J$118,J$120,J$122,J$124)) -> 4 | K352: =RANK(K351,(K$6,K$8,K$10,K$12,K$14,K$16,K$18,K$20,K$22,K$24,K$26,K$28,K$30,K$32,K$34,K$36,K$38,K$40,K$42,K$44,K$46,K$48,K$50,K$52,K$54,K$56,K$58,K$60,K$62,K$64,K$66,K$68,K$70,K$72,K$74,K$76,K$78,K$80,K$82,K$84,K$86,K$88,K$90,K$92,K$94,K$96,K$98,K$100,K$102,K$104,K$106,K$108,K$110,K$112,K$114,K$116,K$118,K$120,K$122,K$124)) -> 4 | L352: =RANK(L351,(L$6,L$8,L$10,L$12,L$14,L$16,L$18,L$20,L$22,L$24,L$26,L$28,L$30,L$32,L$34,L$36,L$38,L$40,L$42,L$44,L$46,L$48,L$50,L$52,L$54,L$56,L$58,L$60,L$62,L$64,L$66,L$68,L$70,L$72,L$74,L$76,L$78,L$80,L$82,L$84,L$86,L$88,L$90,L$92,L$94,L$96,L$98,L$100,L$102,L$104,L$106,L$108,L$110,L$112,L$114,L$116,L$118,L$120,L$122,L$124)) -> 2 | M352: =RANK(M351,(M$6,M$8,M$10,M$12,M$14,M$16,M$18,M$20,M$22,M$24,M$26,M$28,M$30,M$32,M$34,M$36,M$38,M$40,M$42,M$44,M$46,M$48,M$50,M$52,M$54,M$56,M$58,M$60,M$62,M$64,M$66,M$68,M$70,M$72,M$74,M$76,M$78,M$80,M$82,M$84,M$86,M$88,M$90,M$92,M$94,M$96,M$98,M$100,M$102,M$104,M$106,M$108,M$110,M$112,M$114,M$116,M$118,M$120,M$122,M$124)) -> 4 | N352: =RANK(N351,(N$6,N$8,N$10,N$12,N$14,N$16,N$18,N$20,N$22,N$24,N$26,N$28,N$30,N$32,N$34,N$36,N$38,N$40,N$42,N$44,N$46,N$48,N$50,N$52,N$54,N$56,N$58,N$60,N$62,N$64,N$66,N$68,N$70,N$72,N$74,N$76,N$78,N$80,N$82,N$84,N$86,N$88,N$90,N$92,N$94,N$96,N$98,N$100,N$102,N$104,N$106,N$108,N$110,N$112,N$114,N$116,N$118,N$120,N$122,N$124)) -> 4 | P352: =RANK(P351,(P$6,P$8,P$10,P$12,P$14,P$16,P$18,P$20,P$22,P$24,P$26,P$28,P$30,P$32,P$34,P$36,P$38,P$40,P$42,P$44,P$46,P$48,P$50,P$52,P$54,P$56,P$58,P$60,P$62,P$64,P$66,P$68,P$70,P$72,P$74,P$76,P$78,P$80,P$82,P$84,P$86,P$88,P$90,P$92,P$94,P$96,P$98,P$100,P$102,P$104,P$106,P$108,P$110,P$112,P$114,P$116,P$118,P$120,P$122,P$124)) -> 4
A353: Battalion | B353: 3 | C353: 14.30 | D353: 15.00 | E353: 29.30 | F353: 15.00 | G353: 14.60 | H353: 14.80 | I353: 22.20 | J353: 14.20 | K353: 14.80 | L353: 14.60 | M353: 21.80 | N353: 73.30 | O353: 0.0 | P353: 73.30
C354: =RANK(C353,(C$6,C$8,C$10,C$12,C$14,C$16,C$18,C$20,C$22,C$24,C$26,C$28,C$30,C$32,C$34,C$36,C$38,C$40,C$42,C$44,C$46,C$48,C$50,C$52,C$54,C$56,C$58,C$60,C$62,C$64,C$66,C$68,C$70,C$72,C$74,C$76,C$78,C$80,C$82,C$84,C$86,C$88,C$90,C$92,C$94,C$96,C$98,C$100,C$102,C$104,C$106,C$108,C$110,C$112,C$114,C$116,C$118,C$120,C$122,C$124)) -> 5 | D354: =RANK(D353,(D$6,D$8,D$10,D$12,D$14,D$16,D$18,D$20,D$22,D$24,D$26,D$28,D$30,D$32,D$34,D$36,D$38,D$40,D$42,D$44,D$46,D$48,D$50,D$52,D$54,D$56,D$58,D$60,D$62,D$64,D$66,D$68,D$70,D$72,D$74,D$76,D$78,D$80,D$82,D$84,D$86,D$88,D$90,D$92,D$94,D$96,D$98,D$100,D$102,D$104,D$106,D$108,D$110,D$112,D$114,D$116,D$118,D$120,D$122,D$124)) -> 5 | E354: =RANK(E353,(E$6,E$8,E$10,E$12,E$14,E$16,E$18,E$20,E$22,E$24,E$26,E$28,E$30,E$32,E$34,E$36,E$38,E$40,E$42,E$44,E$46,E$48,E$50,E$52,E$54,E$56,E$58,E$60,E$62,E$64,E$66,E$68,E$70,E$72,E$74,E$76,E$78,E$80,E$82,E$84,E$86,E$88,E$90,E$92,E$94,E$96,E$98,E$100,E$102,E$104,E$106,E$108,E$110,E$112,E$114,E$116,E$118,E$120,E$122,E$124)) -> 5 | F354: =RANK(F353,(F$6,F$8,F$10,F$12,F$14,F$16,F$18,F$20,F$22,F$24,F$26,F$28,F$30,F$32,F$34,F$36,F$38,F$40,F$42,F$44,F$46,F$48,F$50,F$52,F$54,F$56,F$58,F$60,F$62,F$64,F$66,F$68,F$70,F$72,F$74,F$76,F$78,F$80,F$82,F$84,F$86,F$88,F$90,F$92,F$94,F$96,F$98,F$100,F$102,F$104,F$106,F$108,F$110,F$112,F$114,F$116,F$118,F$120,F$122,F$124)) -> 4 | G354: =RANK(G353,(G$6,G$8,G$10,G$12,G$14,G$16,G$18,G$20,G$22,G$24,G$26,G$28,G$30,G$32,G$34,G$36,G$38,G$40,G$42,G$44,G$46,G$48,G$50,G$52,G$54,G$56,G$58,G$60,G$62,G$64,G$66,G$68,G$70,G$72,G$74,G$76,G$78,G$80,G$82,G$84,G$86,G$88,G$90,G$92,G$94,G$96,G$98,G$100,G$102,G$104,G$106,G$108,G$110,G$112,G$114,G$116,G$118,G$120,G$122,G$124)) -> 5 | H354: =RANK(H353,(H$6,H$8,H$10,H$12,H$14,H$16,H$18,H$20,H$22,H$24,H$26,H$28,H$30,H$32,H$34,H$36,H$38,H$40,H$42,H$44,H$46,H$48,H$50,H$52,H$54,H$56,H$58,H$60,H$62,H$64,H$66,H$68,H$70,H$72,H$74,H$76,H$78,H$80,H$82,H$84,H$86,H$88,H$90,H$92,H$94,H$96,H$98,H$100,H$102,H$104,H$106,H$108,H$110,H$112,H$114,H$116,H$118,H$120,H$122,H$124)) -> 5 | I354: =RANK(I353,(I$6,I$8,I$10,I$12,I$14,I$16,I$18,I$20,I$22,I$24,I$26,I$28,I$30,I$32,I$34,I$36,I$38,I$40,I$42,I$44,I$46,I$48,I$50,I$52,I$54,I$56,I$58,I$60,I$62,I$64,I$66,I$68,I$70,I$72,I$74,I$76,I$78,I$80,I$82,I$84,I$86,I$88,I$90,I$92,I$94,I$96,I$98,I$100,I$102,I$104,I$106,I$108,I$110,I$112,I$114,I$116,I$118,I$120,I$122,I$124)) -> 5 | J354: =RANK(J353,(J$6,J$8,J$10,J$12,J$14,J$16,J$18,J$20,J$22,J$24,J$26,J$28,J$30,J$32,J$34,J$36,J$38,J$40,J$42,J$44,J$46,J$48,J$50,J$52,J$54,J$56,J$58,J$60,J$62,J$64,J$66,J$68,J$70,J$72,J$74,J$76,J$78,J$80,J$82,J$84,J$86,J$88,J$90,J$92,J$94,J$96,J$98,J$100,J$102,J$104,J$106,J$108,J$110,J$112,J$114,J$116,J$118,J$120,J$122,J$124)) -> 5 | K354: =RANK(K353,(K$6,K$8,K$10,K$12,K$14,K$16,K$18,K$20,K$22,K$24,K$26,K$28,K$30,K$32,K$34,K$36,K$38,K$40,K$42,K$44,K$46,K$48,K$50,K$52,K$54,K$56,K$58,K$60,K$62,K$64,K$66,K$68,K$70,K$72,K$74,K$76,K$78,K$80,K$82,K$84,K$86,K$88,K$90,K$92,K$94,K$96,K$98,K$100,K$102,K$104,K$106,K$108,K$110,K$112,K$114,K$116,K$118,K$120,K$122,K$124)) -> 6 | L354: =RANK(L353,(L$6,L$8,L$10,L$12,L$14,L$16,L$18,L$20,L$22,L$24,L$26,L$28,L$30,L$32,L$34,L$36,L$38,L$40,L$42,L$44,L$46,L$48,L$50,L$52,L$54,L$56,L$58,L$60,L$62,L$64,L$66,L$68,L$70,L$72,L$74,L$76,L$78,L$80,L$82,L$84,L$86,L$88,L$90,L$92,L$94,L$96,L$98,L$100,L$102,L$104,L$106,L$108,L$110,L$112,L$114,L$116,L$118,L$120,L$122,L$124)) -> 5 | M354: =RANK(M353,(M$6,M$8,M$10,M$12,M$14,M$16,M$18,M$20,M$22,M$24,M$26,M$28,M$30,M$32,M$34,M$36,M$38,M$40,M$42,M$44,M$46,M$48,M$50,M$52,M$54,M$56,M$58,M$60,M$62,M$64,M$66,M$68,M$70,M$72,M$74,M$76,M$78,M$80,M$82,M$84,M$86,M$88,M$90,M$92,M$94,M$96,M$98,M$100,M$102,M$104,M$106,M$108,M$110,M$112,M$114,M$116,M$118,M$120,M$122,M$124)) -> 6 | N354: =RANK(N353,(N$6,N$8,N$10,N$12,N$14,N$16,N$18,N$20,N$22,N$24,N$26,N$28,N$30,N$32,N$34,N$36,N$38,N$40,N$42,N$44,N$46,N$48,N$50,N$52,N$54,N$56,N$58,N$60,N$62,N$64,N$66,N$68,N$70,N$72,N$74,N$76,N$78,N$80,N$82,N$84,N$86,N$88,N$90,N$92,N$94,N$96,N$98,N$100,N$102,N$104,N$106,N$108,N$110,N$112,N$114,N$116,N$118,N$120,N$122,N$124)) -> 5 | P354: =RANK(P353,(P$6,P$8,P$10,P$12,P$14,P$16,P$18,P$20,P$22,P$24,P$26,P$28,P$30,P$32,P$34,P$36,P$38,P$40,P$42,P$44,P$46,P$48,P$50,P$52,P$54,P$56,P$58,P$60,P$62,P$64,P$66,P$68,P$70,P$72,P$74,P$76,P$78,P$80,P$82,P$84,P$86,P$88,P$90,P$92,P$94,P$96,P$98,P$100,P$102,P$104,P$106,P$108,P$110,P$112,P$114,P$116,P$118,P$120,P$122,P$124)) -> 5
A355: River City | B355: 7 | C355: 14.10 | D355: 14.60 | E355: 28.70 | F355: 14.80 | G355: 14.50 | H355: 14.40 | I355: 21.85 | J355: 14.10 | K355: 15.10 | L355: 14.50 | M355: 21.85 | N355: 72.40 | O355: 0.0 | P355: 72.40
A356: Rhythm | C356: =RANK(C355,(C$6,C$8,C$10,C$12,C$14,C$16,C$18,C$20,C$22,C$24,C$26,C$28,C$30,C$32,C$34,C$36,C$38,C$40,C$42,C$44,C$46,C$48,C$50,C$52,C$54,C$56,C$58,C$60,C$62,C$64,C$66,C$68,C$70,C$72,C$74,C$76,C$78,C$80,C$82,C$84,C$86,C$88,C$90,C$92,C$94,C$96,C$98,C$100,C$102,C$104,C$106,C$108,C$110,C$112,C$114,C$116,C$118,C$120,C$122,C$124)) -> 6 | D356: =RANK(D355,(D$6,D$8,D$10,D$12,D$14,D$16,D$18,D$20,D$22,D$24,D$26,D$28,D$30,D$32,D$34,D$36,D$38,D$40,D$42,D$44,D$46,D$48,D$50,D$52,D$54,D$56,D$58,D$60,D$62,D$64,D$66,D$68,D$70,D$72,D$74,D$76,D$78,D$80,D$82,D$84,D$86,D$88,D$90,D$92,D$94,D$96,D$98,D$100,D$102,D$104,D$106,D$108,D$110,D$112,D$114,D$116,D$118,D$120,D$122,D$124)) -> 6 | E356: =RANK(E355,(E$6,E$8,E$10,E$12,E$14,E$16,E$18,E$20,E$22,E$24,E$26,E$28,E$30,E$32,E$34,E$36,E$38,E$40,E$42,E$44,E$46,E$48,E$50,E$52,E$54,E$56,E$58,E$60,E$62,E$64,E$66,E$68,E$70,E$72,E$74,E$76,E$78,E$80,E$82,E$84,E$86,E$88,E$90,E$92,E$94,E$96,E$98,E$100,E$102,E$104,E$106,E$108,E$110,E$112,E$114,E$116,E$118,E$120,E$122,E$124)) -> 6 | F356: =RANK(F355,(F$6,F$8,F$10,F$12,F$14,F$16,F$18,F$20,F$22,F$24,F$26,F$28,F$30,F$32,F$34,F$36,F$38,F$40,F$42,F$44,F$46,F$48,F$50,F$52,F$54,F$56,F$58,F$60,F$62,F$64,F$66,F$68,F$70,F$72,F$74,F$76,F$78,F$80,F$82,F$84,F$86,F$88,F$90,F$92,F$94,F$96,F$98,F$100,F$102,F$104,F$106,F$108,F$110,F$112,F$114,F$116,F$118,F$120,F$122,F$124)) -> 5 | G356: =RANK(G355,(G$6,G$8,G$10,G$12,G$14,G$16,G$18,G$20,G$22,G$24,G$26,G$28,G$30,G$32,G$34,G$36,G$38,G$40,G$42,G$44,G$46,G$48,G$50,G$52,G$54,G$56,G$58,G$60,G$62,G$64,G$66,G$68,G$70,G$72,G$74,G$76,G$78,G$80,G$82,G$84,G$86,G$88,G$90,G$92,G$94,G$96,G$98,G$100,G$102,G$104,G$106,G$108,G$110,G$112,G$114,G$116,G$118,G$120,G$122,G$124)) -> 6 | H356: =RANK(H355,(H$6,H$8,H$10,H$12,H$14,H$16,H$18,H$20,H$22,H$24,H$26,H$28,H$30,H$32,H$34,H$36,H$38,H$40,H$42,H$44,H$46,H$48,H$50,H$52,H$54,H$56,H$58,H$60,H$62,H$64,H$66,H$68,H$70,H$72,H$74,H$76,H$78,H$80,H$82,H$84,H$86,H$88,H$90,H$92,H$94,H$96,H$98,H$100,H$102,H$104,H$106,H$108,H$110,H$112,H$114,H$116,H$118,H$120,H$122,H$124)) -> 6 | I356: =RANK(I355,(I$6,I$8,I$10,I$12,I$14,I$16,I$18,I$20,I$22,I$24,I$26,I$28,I$30,I$32,I$34,I$36,I$38,I$40,I$42,I$44,I$46,I$48,I$50,I$52,I$54,I$56,I$58,I$60,I$62,I$64,I$66,I$68,I$70,I$72,I$74,I$76,I$78,I$80,I$82,I$84,I$86,I$88,I$90,I$92,I$94,I$96,I$98,I$100,I$102,I$104,I$106,I$108,I$110,I$112,I$114,I$116,I$118,I$120,I$122,I$124)) -> 6 | J356: =RANK(J355,(J$6,J$8,J$10,J$12,J$14,J$16,J$18,J$20,J$22,J$24,J$26,J$28,J$30,J$32,J$34,J$36,J$38,J$40,J$42,J$44,J$46,J$48,J$50,J$52,J$54,J$56,J$58,J$60,J$62,J$64,J$66,J$68,J$70,J$72,J$74,J$76,J$78,J$80,J$82,J$84,J$86,J$88,J$90,J$92,J$94,J$96,J$98,J$100,J$102,J$104,J$106,J$108,J$110,J$112,J$114,J$116,J$118,J$120,J$122,J$124)) -> 6 | K356: =RANK(K355,(K$6,K$8,K$10,K$12,K$14,K$16,K$18,K$20,K$22,K$24,K$26,K$28,K$30,K$32,K$34,K$36,K$38,K$40,K$42,K$44,K$46,K$48,K$50,K$52,K$54,K$56,K$58,K$60,K$62,K$64,K$66,K$68,K$70,K$72,K$74,K$76,K$78,K$80,K$82,K$84,K$86,K$88,K$90,K$92,K$94,K$96,K$98,K$100,K$102,K$104,K$106,K$108,K$110,K$112,K$114,K$116,K$118,K$120,K$122,K$124)) -> 5 | L356: =RANK(L355,(L$6,L$8,L$10,L$12,L$14,L$16,L$18,L$20,L$22,L$24,L$26,L$28,L$30,L$32,L$34,L$36,L$38,L$40,L$42,L$44,L$46,L$48,L$50,L$52,L$54,L$56,L$58,L$60,L$62,L$64,L$66,L$68,L$70,L$72,L$74,L$76,L$78,L$80,L$82,L$84,L$86,L$88,L$90,L$92,L$94,L$96,L$98,L$100,L$102,L$104,L$106,L$108,L$110,L$112,L$114,L$116,L$118,L$120,L$122,L$124)) -> 6 | M356: =RANK(M355,(M$6,M$8,M$10,M$12,M$14,M$16,M$18,M$20,M$22,M$24,M$26,M$28,M$30,M$32,M$34,M$36,M$38,M$40,M$42,M$44,M$46,M$48,M$50,M$52,M$54,M$56,M$58,M$60,M$62,M$64,M$66,M$68,M$70,M$72,M$74,M$76,M$78,M$80,M$82,M$84,M$86,M$88,M$90,M$92,M$94,M$96,M$98,M$100,M$102,M$104,M$106,M$108,M$110,M$112,M$114,M$116,M$118,M$120,M$122,M$124)) -> 5 | N356: =RANK(N355,(N$6,N$8,N$10,N$12,N$14,N$16,N$18,N$20,N$22,N$24,N$26,N$28,N$30,N$32,N$34,N$36,N$38,N$40,N$42,N$44,N$46,N$48,N$50,N$52,N$54,N$56,N$58,N$60,N$62,N$64,N$66,N$68,N$70,N$72,N$74,N$76,N$78,N$80,N$82,N$84,N$86,N$88,N$90,N$92,N$94,N$96,N$98,N$100,N$102,N$104,N$106,N$108,N$110,N$112,N$114,N$116,N$118,N$120,N$122,N$124)) -> 6 | P356: =RANK(P355,(P$6,P$8,P$10,P$12,P$14,P$16,P$18,P$20,P$22,P$24,P$26,P$28,P$30,P$32,P$34,P$36,P$38,P$40,P$42,P$44,P$46,P$48,P$50,P$52,P$54,P$56,P$58,P$60,P$62,P$64,P$66,P$68,P$70,P$72,P$74,P$76,P$78,P$80,P$82,P$84,P$86,P$88,P$90,P$92,P$94,P$96,P$98,P$100,P$102,P$104,P$106,P$108,P$110,P$112,P$114,P$116,P$118,P$120,P$122,P$124)) -> 6
A357: Les | B357: 4 | C357: 12.80 | D357: 13.30 | E357: 26.10 | F357: 14.00 | G357: 13.00 | H357: 13.80 | I357: 20.40 | J357: 13.10 | K357: 12.40 | L357: 12.50 | M357: 19.00 | N357: 65.50 | O357: 0.0 | P357: 65.50
A358: Stentors | C358: =RANK(C357,(C$6,C$8,C$10,C$12,C$14,C$16,C$18,C$20,C$22,C$24,C$26,C$28,C$30,C$32,C$34,C$36,C$38,C$40,C$42,C$44,C$46,C$48,C$50,C$52,C$54,C$56,C$58,C$60,C$62,C$64,C$66,C$68,C$70,C$72,C$74,C$76,C$78,C$80,C$82,C$84,C$86,C$88,C$90,C$92,C$94,C$96,C$98,C$100,C$102,C$104,C$106,C$108,C$110,C$112,C$114,C$116,C$118,C$120,C$122,C$124)) -> 8 | D358: =RANK(D357,(D$6,D$8,D$10,D$12,D$14,D$16,D$18,D$20,D$22,D$24,D$26,D$28,D$30,D$32,D$34,D$36,D$38,D$40,D$42,D$44,D$46,D$48,D$50,D$52,D$54,D$56,D$58,D$60,D$62,D$64,D$66,D$68,D$70,D$72,D$74,D$76,D$78,D$80,D$82,D$84,D$86,D$88,D$90,D$92,D$94,D$96,D$98,D$100,D$102,D$104,D$106,D$108,D$110,D$112,D$114,D$116,D$118,D$120,D$122,D$124)) -> 7 | E358: =RANK(E357,(E$6,E$8,E$10,E$12,E$14,E$16,E$18,E$20,E$22,E$24,E$26,E$28,E$30,E$32,E$34,E$36,E$38,E$40,E$42,E$44,E$46,E$48,E$50,E$52,E$54,E$56,E$58,E$60,E$62,E$64,E$66,E$68,E$70,E$72,E$74,E$76,E$78,E$80,E$82,E$84,E$86,E$88,E$90,E$92,E$94,E$96,E$98,E$100,E$102,E$104,E$106,E$108,E$110,E$112,E$114,E$116,E$118,E$120,E$122,E$124)) -> 7 | F358: =RANK(F357,(F$6,F$8,F$10,F$12,F$14,F$16,F$18,F$20,F$22,F$24,F$26,F$28,F$30,F$32,F$34,F$36,F$38,F$40,F$42,F$44,F$46,F$48,F$50,F$52,F$54,F$56,F$58,F$60,F$62,F$64,F$66,F$68,F$70,F$72,F$74,F$76,F$78,F$80,F$82,F$84,F$86,F$88,F$90,F$92,F$94,F$96,F$98,F$100,F$102,F$104,F$106,F$108,F$110,F$112,F$114,F$116,F$118,F$120,F$122,F$124)) -> 7 | G358: =RANK(G357,(G$6,G$8,G$10,G$12,G$14,G$16,G$18,G$20,G$22,G$24,G$26,G$28,G$30,G$32,G$34,G$36,G$38,G$40,G$42,G$44,G$46,G$48,G$50,G$52,G$54,G$56,G$58,G$60,G$62,G$64,G$66,G$68,G$70,G$72,G$74,G$76,G$78,G$80,G$82,G$84,G$86,G$88,G$90,G$92,G$94,G$96,G$98,G$100,G$102,G$104,G$106,G$108,G$110,G$112,G$114,G$116,G$118,G$120,G$122,G$124)) -> 7 | H358: =RANK(H357,(H$6,H$8,H$10,H$12,H$14,H$16,H$18,H$20,H$22,H$24,H$26,H$28,H$30,H$32,H$34,H$36,H$38,H$40,H$42,H$44,H$46,H$48,H$50,H$52,H$54,H$56,H$58,H$60,H$62,H$64,H$66,H$68,H$70,H$72,H$74,H$76,H$78,H$80,H$82,H$84,H$86,H$88,H$90,H$92,H$94,H$96,H$98,H$100,H$102,H$104,H$106,H$108,H$110,H$112,H$114,H$116,H$118,H$120,H$122,H$124)) -> 7 | I358: =RANK(I357,(I$6,I$8,I$10,I$12,I$14,I$16,I$18,I$20,I$22,I$24,I$26,I$28,I$30,I$32,I$34,I$36,I$38,I$40,I$42,I$44,I$46,I$48,I$50,I$52,I$54,I$56,I$58,I$60,I$62,I$64,I$66,I$68,I$70,I$72,I$74,I$76,I$78,I$80,I$82,I$84,I$86,I$88,I$90,I$92,I$94,I$96,I$98,I$100,I$102,I$104,I$106,I$108,I$110,I$112,I$114,I$116,I$118,I$120,I$122,I$124)) -> 7 | J358: =RANK(J357,(J$6,J$8,J$10,J$12,J$14,J$16,J$18,J$20,J$22,J$24,J$26,J$28,J$30,J$32,J$34,J$36,J$38,J$40,J$42,J$44,J$46,J$48,J$50,J$52,J$54,J$56,J$58,J$60,J$62,J$64,J$66,J$68,J$70,J$72,J$74,J$76,J$78,J$80,J$82,J$84,J$86,J$88,J$90,J$92,J$94,J$96,J$98,J$100,J$102,J$104,J$106,J$108,J$110,J$112,J$114,J$116,J$118,J$120,J$122,J$124)) -> 8 | K358: =RANK(K357,(K$6,K$8,K$10,K$12,K$14,K$16,K$18,K$20,K$22,K$24,K$26,K$28,K$30,K$32,K$34,K$36,K$38,K$40,K$42,K$44,K$46,K$48,K$50,K$52,K$54,K$56,K$58,K$60,K$62,K$64,K$66,K$68,K$70,K$72,K$74,K$76,K$78,K$80,K$82,K$84,K$86,K$88,K$90,K$92,K$94,K$96,K$98,K$100,K$102,K$104,K$106,K$108,K$110,K$112,K$114,K$116,K$118,K$120,K$122,K$124)) -> 8 | L358: =RANK(L357,(L$6,L$8,L$10,L$12,L$14,L$16,L$18,L$20,L$22,L$24,L$26,L$28,L$30,L$32,L$34,L$36,L$38,L$40,L$42,L$44,L$46,L$48,L$50,L$52,L$54,L$56,L$58,L$60,L$62,L$64,L$66,L$68,L$70,L$72,L$74,L$76,L$78,L$80,L$82,L$84,L$86,L$88,L$90,L$92,L$94,L$96,L$98,L$100,L$102,L$104,L$106,L$108,L$110,L$112,L$114,L$116,L$118,L$120,L$122,L$124)) -> 8 | M358: =RANK(M357,(M$6,M$8,M$10,M$12,M$14,M$16,M$18,M$20,M$22,M$24,M$26,M$28,M$30,M$32,M$34,M$36,M$38,M$40,M$42,M$44,M$46,M$48,M$50,M$52,M$54,M$56,M$58,M$60,M$62,M$64,M$66,M$68,M$70,M$72,M$74,M$76,M$78,M$80,M$82,M$84,M$86,M$88,M$90,M$92,M$94,M$96,M$98,M$100,M$102,M$104,M$106,M$108,M$110,M$112,M$114,M$116,M$118,M$120,M$122,M$124)) -> 8 | N358: =RANK(N357,(N$6,N$8,N$10,N$12,N$14,N$16,N$18,N$20,N$22,N$24,N$26,N$28,N$30,N$32,N$34,N$36,N$38,N$40,N$42,N$44,N$46,N$48,N$50,N$52,N$54,N$56,N$58,N$60,N$62,N$64,N$66,N$68,N$70,N$72,N$74,N$76,N$78,N$80,N$82,N$84,N$86,N$88,N$90,N$92,N$94,N$96,N$98,N$100,N$102,N$104,N$106,N$108,N$110,N$112,N$114,N$116,N$118,N$120,N$122,N$124)) -> 7 | P358: =RANK(P357,(P$6,P$8,P$10,P$12,P$14,P$16,P$18,P$20,P$22,P$24,P$26,P$28,P$30,P$32,P$34,P$36,P$38,P$40,P$42,P$44,P$46,P$48,P$50,P$52,P$54,P$56,P$58,P$60,P$62,P$64,P$66,P$68,P$70,P$72,P$74,P$76,P$78,P$80,P$82,P$84,P$86,P$88,P$90,P$92,P$94,P$96,P$98,P$100,P$102,P$104,P$106,P$108,P$110,P$112,P$114,P$116,P$118,P$120,P$122,P$124)) -> 7
A359: Colt | B359: 5 | C359: 13.00 | D359: 13.10 | E359: 26.10 | F359: 12.50 | G359: 12.90 | H359: 13.20 | I359: 19.30 | J359: 13.30 | K359: 13.10 | L359: 13.50 | M359: 19.95 | N359: 65.35 | O359: 0.0 | P359: 65.35
A360: Cadets | C360: =RANK(C359,(C$6,C$8,C$10,C$12,C$14,C$16,C$18,C$20,C$22,C$24,C$26,C$28,C$30,C$32,C$34,C$36,C$38,C$40,C$42,C$44,C$46,C$48,C$50,C$52,C$54,C$56,C$58,C$60,C$62,C$64,C$66,C$68,C$70,C$72,C$74,C$76,C$78,C$80,C$82,C$84,C$86,C$88,C$90,C$92,C$94,C$96,C$98,C$100,C$102,C$104,C$106,C$108,C$110,C$112,C$114,C$116,C$118,C$120,C$122,C$124)) -> 7 | D360: =RANK(D359,(D$6,D$8,D$10,D$12,D$14,D$16,D$18,D$20,D$22,D$24,D$26,D$28,D$30,D$32,D$34,D$36,D$38,D$40,D$42,D$44,D$46,D$48,D$50,D$52,D$54,D$56,D$58,D$60,D$62,D$64,D$66,D$68,D$70,D$72,D$74,D$76,D$78,D$80,D$82,D$84,D$86,D$88,D$90,D$92,D$94,D$96,D$98,D$100,D$102,D$104,D$106,D$108,D$110,D$112,D$114,D$116,D$118,D$120,D$122,D$124)) -> 8 | E360: =RANK(E359,(E$6,E$8,E$10,E$12,E$14,E$16,E$18,E$20,E$22,E$24,E$26,E$28,E$30,E$32,E$34,E$36,E$38,E$40,E$42,E$44,E$46,E$48,E$50,E$52,E$54,E$56,E$58,E$60,E$62,E$64,E$66,E$68,E$70,E$72,E$74,E$76,E$78,E$80,E$82,E$84,E$86,E$88,E$90,E$92,E$94,E$96,E$98,E$100,E$102,E$104,E$106,E$108,E$110,E$112,E$114,E$116,E$118,E$120,E$122,E$124)) -> 7 | F360: =RANK(F359,(F$6,F$8,F$10,F$12,F$14,F$16,F$18,F$20,F$22,F$24,F$26,F$28,F$30,F$32,F$34,F$36,F$38,F$40,F$42,F$44,F$46,F$48,F$50,F$52,F$54,F$56,F$58,F$60,F$62,F$64,F$66,F$68,F$70,F$72,F$74,F$76,F$78,F$80,F$82,F$84,F$86,F$88,F$90,F$92,F$94,F$96,F$98,F$100,F$102,F$104,F$106,F$108,F$110,F$112,F$114,F$116,F$118,F$120,F$122,F$124)) -> 8 | G360: =RANK(G359,(G$6,G$8,G$10,G$12,G$14,G$16,G$18,G$20,G$22,G$24,G$26,G$28,G$30,G$32,G$34,G$36,G$38,G$40,G$42,G$44,G$46,G$48,G$50,G$52,G$54,G$56,G$58,G$60,G$62,G$64,G$66,G$68,G$70,G$72,G$74,G$76,G$78,G$80,G$82,G$84,G$86,G$88,G$90,G$92,G$94,G$96,G$98,G$100,G$102,G$104,G$106,G$108,G$110,G$112,G$114,G$116,G$118,G$120,G$122,G$124)) -> 8 | H360: =RANK(H359,(H$6,H$8,H$10,H$12,H$14,H$16,H$18,H$20,H$22,H$24,H$26,H$28,H$30,H$32,H$34,H$36,H$38,H$40,H$42,H$44,H$46,H$48,H$50,H$52,H$54,H$56,H$58,H$60,H$62,H$64,H$66,H$68,H$70,H$72,H$74,H$76,H$78,H$80,H$82,H$84,H$86,H$88,H$90,H$92,H$94,H$96,H$98,H$100,H$102,H$104,H$106,H$108,H$110,H$112,H$114,H$116,H$118,H$120,H$122,H$124)) -> 8 | I360: =RANK(I359,(I$6,I$8,I$10,I$12,I$14,I$16,I$18,I$20,I$22,I$24,I$26,I$28,I$30,I$32,I$34,I$36,I$38,I$40,I$42,I$44,I$46,I$48,I$50,I$52,I$54,I$56,I$58,I$60,I$62,I$64,I$66,I$68,I$70,I$72,I$74,I$76,I$78,I$80,I$82,I$84,I$86,I$88,I$90,I$92,I$94,I$96,I$98,I$100,I$102,I$104,I$106,I$108,I$110,I$112,I$114,I$116,I$118,I$120,I$122,I$124)) -> 8 | J360: =RANK(J359,(J$6,J$8,J$10,J$12,J$14,J$16,J$18,J$20,J$22,J$24,J$26,J$28,J$30,J$32,J$34,J$36,J$38,J$40,J$42,J$44,J$46,J$48,J$50,J$52,J$54,J$56,J$58,J$60,J$62,J$64,J$66,J$68,J$70,J$72,J$74,J$76,J$78,J$80,J$82,J$84,J$86,J$88,J$90,J$92,J$94,J$96,J$98,J$100,J$102,J$104,J$106,J$108,J$110,J$112,J$114,J$116,J$118,J$120,J$122,J$124)) -> 7 | K360: =RANK(K359,(K$6,K$8,K$10,K$12,K$14,K$16,K$18,K$20,K$22,K$24,K$26,K$28,K$30,K$32,K$34,K$36,K$38,K$40,K$42,K$44,K$46,K$48,K$50,K$52,K$54,K$56,K$58,K$60,K$62,K$64,K$66,K$68,K$70,K$72,K$74,K$76,K$78,K$80,K$82,K$84,K$86,K$88,K$90,K$92,K$94,K$96,K$98,K$100,K$102,K$104,K$106,K$108,K$110,K$112,K$114,K$116,K$118,K$120,K$122,K$124)) -> 7 | L360: =RANK(L359,(L$6,L$8,L$10,L$12,L$14,L$16,L$18,L$20,L$22,L$24,L$26,L$28,L$30,L$32,L$34,L$36,L$38,L$40,L$42,L$44,L$46,L$48,L$50,L$52,L$54,L$56,L$58,L$60,L$62,L$64,L$66,L$68,L$70,L$72,L$74,L$76,L$78,L$80,L$82,L$84,L$86,L$88,L$90,L$92,L$94,L$96,L$98,L$100,L$102,L$104,L$106,L$108,L$110,L$112,L$114,L$116,L$118,L$120,L$122,L$124)) -> 7 | M360: =RANK(M359,(M$6,M$8,M$10,M$12,M$14,M$16,M$18,M$20,M$22,M$24,M$26,M$28,M$30,M$32,M$34,M$36,M$38,M$40,M$42,M$44,M$46,M$48,M$50,M$52,M$54,M$56,M$58,M$60,M$62,M$64,M$66,M$68,M$70,M$72,M$74,M$76,M$78,M$80,M$82,M$84,M$86,M$88,M$90,M$92,M$94,M$96,M$98,M$100,M$102,M$104,M$106,M$108,M$110,M$112,M$114,M$116,M$118,M$120,M$122,M$124)) -> 7 | N360: =RANK(N359,(N$6,N$8,N$10,N$12,N$14,N$16,N$18,N$20,N$22,N$24,N$26,N$28,N$30,N$32,N$34,N$36,N$38,N$40,N$42,N$44,N$46,N$48,N$50,N$52,N$54,N$56,N$58,N$60,N$62,N$64,N$66,N$68,N$70,N$72,N$74,N$76,N$78,N$80,N$82,N$84,N$86,N$88,N$90,N$92,N$94,N$96,N$98,N$100,N$102,N$104,N$106,N$108,N$110,N$112,N$114,N$116,N$118,N$120,N$122,N$124)) -> 8 | P360: =RANK(P359,(P$6,P$8,P$10,P$12,P$14,P$16,P$18,P$20,P$22,P$24,P$26,P$28,P$30,P$32,P$34,P$36,P$38,P$40,P$42,P$44,P$46,P$48,P$50,P$52,P$54,P$56,P$58,P$60,P$62,P$64,P$66,P$68,P$70,P$72,P$74,P$76,P$78,P$80,P$82,P$84,P$86,P$88,P$90,P$92,P$94,P$96,P$98,P$100,P$102,P$104,P$106,P$108,P$110,P$112,P$114,P$116,P$118,P$120,P$122,P$124)) -> 8
A363: 8/6/2022 Avon Lake, Ohio
C364: General Effect | F364: Visual | J364: Music
C365: 1 | D365: 2 | F365: Proficiency | G365: Analysis | H365: Color Guard | J365: Brass | K365: Analysis | L365: Percussion | N365: Sub | P365: Total
C366: M. Czapinski | D366: J. Rhodes | E366: Total | F366: R. Solomon | G366: C. Clayton | H366: D. Deems | I366: Total ÷2 | J366: A. Cook | K366: K. Weirich | L366: A. Kristensen | M366: Total ÷2 | N366: Total | O366: Pen | P366: Score
A367: DCI Open Class | C367: 20 | D367: 20 | E367: 40 | F367: 20 | G367: 20 | H367: 20 | I367: 30 | J367: 20 | K367: 20 | L367: 20 | M367: 30 | N367: 100 | P367: 100
A368: Spartans | B368: 5 | C368: 16.10 | D368: 16.50 | E368: 32.60 | F368: 15.30 | G368: 16.00 | H368: 16.00 | I368: 23.65 | J368: 15.60 | K368: 15.10 | L368: 15.70 | M368: 23.20 | N368: 79.45 | O368: 0.0 | P368: 79.45
C369: =RANK(C368,(C$6,C$8,C$10,C$12,C$14,C$16,C$18,C$20,C$22,C$24,C$26,C$28,C$30,C$32,C$34,C$36,C$38,C$40,C$42,C$44,C$46,C$48,C$50,C$52,C$54,C$56,C$58,C$60,C$62,C$64,C$66,C$68,C$70,C$72,C$74,C$76,C$78,C$80,C$82,C$84,C$86,C$88,C$90,C$92,C$94,C$96,C$98,C$100,C$102,C$104,C$106,C$108,C$110,C$112,C$114,C$116,C$118,C$120,C$122,C$124)) -> 1 | D369: =RANK(D368,(D$6,D$8,D$10,D$12,D$14,D$16,D$18,D$20,D$22,D$24,D$26,D$28,D$30,D$32,D$34,D$36,D$38,D$40,D$42,D$44,D$46,D$48,D$50,D$52,D$54,D$56,D$58,D$60,D$62,D$64,D$66,D$68,D$70,D$72,D$74,D$76,D$78,D$80,D$82,D$84,D$86,D$88,D$90,D$92,D$94,D$96,D$98,D$100,D$102,D$104,D$106,D$108,D$110,D$112,D$114,D$116,D$118,D$120,D$122,D$124)) -> 1 | E369: =RANK(E368,(E$6,E$8,E$10,E$12,E$14,E$16,E$18,E$20,E$22,E$24,E$26,E$28,E$30,E$32,E$34,E$36,E$38,E$40,E$42,E$44,E$46,E$48,E$50,E$52,E$54,E$56,E$58,E$60,E$62,E$64,E$66,E$68,E$70,E$72,E$74,E$76,E$78,E$80,E$82,E$84,E$86,E$88,E$90,E$92,E$94,E$96,E$98,E$100,E$102,E$104,E$106,E$108,E$110,E$112,E$114,E$116,E$118,E$120,E$122,E$124)) -> 1 | F369: =RANK(F368,(F$6,F$8,F$10,F$12,F$14,F$16,F$18,F$20,F$22,F$24,F$26,F$28,F$30,F$32,F$34,F$36,F$38,F$40,F$42,F$44,F$46,F$48,F$50,F$52,F$54,F$56,F$58,F$60,F$62,F$64,F$66,F$68,F$70,F$72,F$74,F$76,F$78,F$80,F$82,F$84,F$86,F$88,F$90,F$92,F$94,F$96,F$98,F$100,F$102,F$104,F$106,F$108,F$110,F$112,F$114,F$116,F$118,F$120,F$122,F$124)) -> 1 | G369: =RANK(G368,(G$6,G$8,G$10,G$12,G$14,G$16,G$18,G$20,G$22,G$24,G$26,G$28,G$30,G$32,G$34,G$36,G$38,G$40,G$42,G$44,G$46,G$48,G$50,G$52,G$54,G$56,G$58,G$60,G$62,G$64,G$66,G$68,G$70,G$72,G$74,G$76,G$78,G$80,G$82,G$84,G$86,G$88,G$90,G$92,G$94,G$96,G$98,G$100,G$102,G$104,G$106,G$108,G$110,G$112,G$114,G$116,G$118,G$120,G$122,G$124)) -> 1 | H369: =RANK(H368,(H$6,H$8,H$10,H$12,H$14,H$16,H$18,H$20,H$22,H$24,H$26,H$28,H$30,H$32,H$34,H$36,H$38,H$40,H$42,H$44,H$46,H$48,H$50,H$52,H$54,H$56,H$58,H$60,H$62,H$64,H$66,H$68,H$70,H$72,H$74,H$76,H$78,H$80,H$82,H$84,H$86,H$88,H$90,H$92,H$94,H$96,H$98,H$100,H$102,H$104,H$106,H$108,H$110,H$112,H$114,H$116,H$118,H$120,H$122,H$124)) -> 2 | I369: =RANK(I368,(I$6,I$8,I$10,I$12,I$14,I$16,I$18,I$20,I$22,I$24,I$26,I$28,I$30,I$32,I$34,I$36,I$38,I$40,I$42,I$44,I$46,I$48,I$50,I$52,I$54,I$56,I$58,I$60,I$62,I$64,I$66,I$68,I$70,I$72,I$74,I$76,I$78,I$80,I$82,I$84,I$86,I$88,I$90,I$92,I$94,I$96,I$98,I$100,I$102,I$104,I$106,I$108,I$110,I$112,I$114,I$116,I$118,I$120,I$122,I$124)) -> 1 | J369: =RANK(J368,(J$6,J$8,J$10,J$12,J$14,J$16,J$18,J$20,J$22,J$24,J$26,J$28,J$30,J$32,J$34,J$36,J$38,J$40,J$42,J$44,J$46,J$48,J$50,J$52,J$54,J$56,J$58,J$60,J$62,J$64,J$66,J$68,J$70,J$72,J$74,J$76,J$78,J$80,J$82,J$84,J$86,J$88,J$90,J$92,J$94,J$96,J$98,J$100,J$102,J$104,J$106,J$108,J$110,J$112,J$114,J$116,J$118,J$120,J$122,J$124)) -> 1 | K369: =RANK(K368,(K$6,K$8,K$10,K$12,K$14,K$16,K$18,K$20,K$22,K$24,K$26,K$28,K$30,K$32,K$34,K$36,K$38,K$40,K$42,K$44,K$46,K$48,K$50,K$52,K$54,K$56,K$58,K$60,K$62,K$64,K$66,K$68,K$70,K$72,K$74,K$76,K$78,K$80,K$82,K$84,K$86,K$88,K$90,K$92,K$94,K$96,K$98,K$100,K$102,K$104,K$106,K$108,K$110,K$112,K$114,K$116,K$118,K$120,K$122,K$124)) -> 1 | L369: =RANK(L368,(L$6,L$8,L$10,L$12,L$14,L$16,L$18,L$20,L$22,L$24,L$26,L$28,L$30,L$32,L$34,L$36,L$38,L$40,L$42,L$44,L$46,L$48,L$50,L$52,L$54,L$56,L$58,L$60,L$62,L$64,L$66,L$68,L$70,L$72,L$74,L$76,L$78,L$80,L$82,L$84,L$86,L$88,L$90,L$92,L$94,L$96,L$98,L$100,L$102,L$104,L$106,L$108,L$110,L$112,L$114,L$116,L$118,L$120,L$122,L$124)) -> 1 | M369: =RANK(M368,(M$6,M$8,M$10,M$12,M$14,M$16,M$18,M$20,M$22,M$24,M$26,M$28,M$30,M$32,M$34,M$36,M$38,M$40,M$42,M$44,M$46,M$48,M$50,M$52,M$54,M$56,M$58,M$60,M$62,M$64,M$66,M$68,M$70,M$72,M$74,M$76,M$78,M$80,M$82,M$84,M$86,M$88,M$90,M$92,M$94,M$96,M$98,M$100,M$102,M$104,M$106,M$108,M$110,M$112,M$114,M$116,M$118,M$120,M$122,M$124)) -> 1 | N369: =RANK(N368,(N$6,N$8,N$10,N$12,N$14,N$16,N$18,N$20,N$22,N$24,N$26,N$28,N$30,N$32,N$34,N$36,N$38,N$40,N$42,N$44,N$46,N$48,N$50,N$52,N$54,N$56,N$58,N$60,N$62,N$64,N$66,N$68,N$70,N$72,N$74,N$76,N$78,N$80,N$82,N$84,N$86,N$88,N$90,N$92,N$94,N$96,N$98,N$100,N$102,N$104,N$106,N$108,N$110,N$112,N$114,N$116,N$118,N$120,N$122,N$124)) -> 1 | P369: =RANK(P368,(P$6,P$8,P$10,P$12,P$14,P$16,P$18,P$20,P$22,P$24,P$26,P$28,P$30,P$32,P$34,P$36,P$38,P$40,P$42,P$44,P$46,P$48,P$50,P$52,P$54,P$56,P$58,P$60,P$62,P$64,P$66,P$68,P$70,P$72,P$74,P$76,P$78,P$80,P$82,P$84,P$86,P$88,P$90,P$92,P$94,P$96,P$98,P$100,P$102,P$104,P$106,P$108,P$110,P$112,P$114,P$116,P$118,P$120,P$122,P$124)) -> 1
A370: Southwind | B370: 4 | C370: 15.30 | D370: 15.20 | E370: 30.50 | F370: 15.00 | G370: 15.30 | H370: 16.10 | I370: 23.20 | J370: 15.00 | K370: 14.60 | L370: 14.90 | M370: 22.25 | N370: 75.95 | O370: 0.0 | P370: 75.95
C371: =RANK(C370,(C$6,C$8,C$10,C$12,C$14,C$16,C$18,C$20,C$22,C$24,C$26,C$28,C$30,C$32,C$34,C$36,C$38,C$40,C$42,C$44,C$46,C$48,C$50,C$52,C$54,C$56,C$58,C$60,C$62,C$64,C$66,C$68,C$70,C$72,C$74,C$76,C$78,C$80,C$82,C$84,C$86,C$88,C$90,C$92,C$94,C$96,C$98,C$100,C$102,C$104,C$106,C$108,C$110,C$112,C$114,C$116,C$118,C$120,C$122,C$124)) -> 2 | D371: =RANK(D370,(D$6,D$8,D$10,D$12,D$14,D$16,D$18,D$20,D$22,D$24,D$26,D$28,D$30,D$32,D$34,D$36,D$38,D$40,D$42,D$44,D$46,D$48,D$50,D$52,D$54,D$56,D$58,D$60,D$62,D$64,D$66,D$68,D$70,D$72,D$74,D$76,D$78,D$80,D$82,D$84,D$86,D$88,D$90,D$92,D$94,D$96,D$98,D$100,D$102,D$104,D$106,D$108,D$110,D$112,D$114,D$116,D$118,D$120,D$122,D$124)) -> 2 | E371: =RANK(E370,(E$6,E$8,E$10,E$12,E$14,E$16,E$18,E$20,E$22,E$24,E$26,E$28,E$30,E$32,E$34,E$36,E$38,E$40,E$42,E$44,E$46,E$48,E$50,E$52,E$54,E$56,E$58,E$60,E$62,E$64,E$66,E$68,E$70,E$72,E$74,E$76,E$78,E$80,E$82,E$84,E$86,E$88,E$90,E$92,E$94,E$96,E$98,E$100,E$102,E$104,E$106,E$108,E$110,E$112,E$114,E$116,E$118,E$120,E$122,E$124)) -> 2 | F371: =RANK(F370,(F$6,F$8,F$10,F$12,F$14,F$16,F$18,F$20,F$22,F$24,F$26,F$28,F$30,F$32,F$34,F$36,F$38,F$40,F$42,F$44,F$46,F$48,F$50,F$52,F$54,F$56,F$58,F$60,F$62,F$64,F$66,F$68,F$70,F$72,F$74,F$76,F$78,F$80,F$82,F$84,F$86,F$88,F$90,F$92,F$94,F$96,F$98,F$100,F$102,F$104,F$106,F$108,F$110,F$112,F$114,F$116,F$118,F$120,F$122,F$124)) -> 2 | G371: =RANK(G370,(G$6,G$8,G$10,G$12,G$14,G$16,G$18,G$20,G$22,G$24,G$26,G$28,G$30,G$32,G$34,G$36,G$38,G$40,G$42,G$44,G$46,G$48,G$50,G$52,G$54,G$56,G$58,G$60,G$62,G$64,G$66,G$68,G$70,G$72,G$74,G$76,G$78,G$80,G$82,G$84,G$86,G$88,G$90,G$92,G$94,G$96,G$98,G$100,G$102,G$104,G$106,G$108,G$110,G$112,G$114,G$116,G$118,G$120,G$122,G$124)) -> 2 | H371: =RANK(H370,(H$6,H$8,H$10,H$12,H$14,H$16,H$18,H$20,H$22,H$24,H$26,H$28,H$30,H$32,H$34,H$36,H$38,H$40,H$42,H$44,H$46,H$48,H$50,H$52,H$54,H$56,H$58,H$60,H$62,H$64,H$66,H$68,H$70,H$72,H$74,H$76,H$78,H$80,H$82,H$84,H$86,H$88,H$90,H$92,H$94,H$96,H$98,H$100,H$102,H$104,H$106,H$108,H$110,H$112,H$114,H$116,H$118,H$120,H$122,H$124)) -> 1 | I371: =RANK(I370,(I$6,I$8,I$10,I$12,I$14,I$16,I$18,I$20,I$22,I$24,I$26,I$28,I$30,I$32,I$34,I$36,I$38,I$40,I$42,I$44,I$46,I$48,I$50,I$52,I$54,I$56,I$58,I$60,I$62,I$64,I$66,I$68,I$70,I$72,I$74,I$76,I$78,I$80,I$82,I$84,I$86,I$88,I$90,I$92,I$94,I$96,I$98,I$100,I$102,I$104,I$106,I$108,I$110,I$112,I$114,I$116,I$118,I$120,I$122,I$124)) -> 2 | J371: =RANK(J370,(J$6,J$8,J$10,J$12,J$14,J$16,J$18,J$20,J$22,J$24,J$26,J$28,J$30,J$32,J$34,J$36,J$38,J$40,J$42,J$44,J$46,J$48,J$50,J$52,J$54,J$56,J$58,J$60,J$62,J$64,J$66,J$68,J$70,J$72,J$74,J$76,J$78,J$80,J$82,J$84,J$86,J$88,J$90,J$92,J$94,J$96,J$98,J$100,J$102,J$104,J$106,J$108,J$110,J$112,J$114,J$116,J$118,J$120,J$122,J$124)) -> 2 | K371: =RANK(K370,(K$6,K$8,K$10,K$12,K$14,K$16,K$18,K$20,K$22,K$24,K$26,K$28,K$30,K$32,K$34,K$36,K$38,K$40,K$42,K$44,K$46,K$48,K$50,K$52,K$54,K$56,K$58,K$60,K$62,K$64,K$66,K$68,K$70,K$72,K$74,K$76,K$78,K$80,K$82,K$84,K$86,K$88,K$90,K$92,K$94,K$96,K$98,K$100,K$102,K$104,K$106,K$108,K$110,K$112,K$114,K$116,K$118,K$120,K$122,K$124)) -> 2 | L371: =RANK(L370,(L$6,L$8,L$10,L$12,L$14,L$16,L$18,L$20,L$22,L$24,L$26,L$28,L$30,L$32,L$34,L$36,L$38,L$40,L$42,L$44,L$46,L$48,L$50,L$52,L$54,L$56,L$58,L$60,L$62,L$64,L$66,L$68,L$70,L$72,L$74,L$76,L$78,L$80,L$82,L$84,L$86,L$88,L$90,L$92,L$94,L$96,L$98,L$100,L$102,L$104,L$106,L$108,L$110,L$112,L$114,L$116,L$118,L$120,L$122,L$124)) -> 3 | M371: =RANK(M370,(M$6,M$8,M$10,M$12,M$14,M$16,M$18,M$20,M$22,M$24,M$26,M$28,M$30,M$32,M$34,M$36,M$38,M$40,M$42,M$44,M$46,M$48,M$50,M$52,M$54,M$56,M$58,M$60,M$62,M$64,M$66,M$68,M$70,M$72,M$74,M$76,M$78,M$80,M$82,M$84,M$86,M$88,M$90,M$92,M$94,M$96,M$98,M$100,M$102,M$104,M$106,M$108,M$110,M$112,M$114,M$116,M$118,M$120,M$122,M$124)) -> 2 | N371: =RANK(N370,(N$6,N$8,N$10,N$12,N$14,N$16,N$18,N$20,N$22,N$24,N$26,N$28,N$30,N$32,N$34,N$36,N$38,N$40,N$42,N$44,N$46,N$48,N$50,N$52,N$54,N$56,N$58,N$60,N$62,N$64,N$66,N$68,N$70,N$72,N$74,N$76,N$78,N$80,N$82,N$84,N$86,N$88,N$90,N$92,N$94,N$96,N$98,N$100,N$102,N$104,N$106,N$108,N$110,N$112,N$114,N$116,N$118,N$120,N$122,N$124)) -> 2 | P371: =RANK(P370,(P$6,P$8,P$10,P$12,P$14,P$16,P$18,P$20,P$22,P$24,P$26,P$28,P$30,P$32,P$34,P$36,P$38,P$40,P$42,P$44,P$46,P$48,P$50,P$52,P$54,P$56,P$58,P$60,P$62,P$64,P$66,P$68,P$70,P$72,P$74,P$76,P$78,P$80,P$82,P$84,P$86,P$88,P$90,P$92,P$94,P$96,P$98,P$100,P$102,P$104,P$106,P$108,P$110,P$112,P$114,P$116,P$118,P$120,P$122,P$124)) -> 2
A372: Legends | B372: 6 | C372: 15.00 | D372: 14.90 | E372: 29.90 | F372: 14.70 | G372: 14.90 | H372: 15.80 | I372: 22.70 | J372: 14.70 | K372: 14.30 | L372: 14.80 | M372: 21.90 | N372: 74.50 | O372: 0.0 | P372: 74.50
C373: =RANK(C372,(C$6,C$8,C$10,C$12,C$14,C$16,C$18,C$20,C$22,C$24,C$26,C$28,C$30,C$32,C$34,C$36,C$38,C$40,C$42,C$44,C$46,C$48,C$50,C$52,C$54,C$56,C$58,C$60,C$62,C$64,C$66,C$68,C$70,C$72,C$74,C$76,C$78,C$80,C$82,C$84,C$86,C$88,C$90,C$92,C$94,C$96,C$98,C$100,C$102,C$104,C$106,C$108,C$110,C$112,C$114,C$116,C$118,C$120,C$122,C$124)) -> 3 | D373: =RANK(D372,(D$6,D$8,D$10,D$12,D$14,D$16,D$18,D$20,D$22,D$24,D$26,D$28,D$30,D$32,D$34,D$36,D$38,D$40,D$42,D$44,D$46,D$48,D$50,D$52,D$54,D$56,D$58,D$60,D$62,D$64,D$66,D$68,D$70,D$72,D$74,D$76,D$78,D$80,D$82,D$84,D$86,D$88,D$90,D$92,D$94,D$96,D$98,D$100,D$102,D$104,D$106,D$108,D$110,D$112,D$114,D$116,D$118,D$120,D$122,D$124)) -> 3 | E373: =RANK(E372,(E$6,E$8,E$10,E$12,E$14,E$16,E$18,E$20,E$22,E$24,E$26,E$28,E$30,E$32,E$34,E$36,E$38,E$40,E$42,E$44,E$46,E$48,E$50,E$52,E$54,E$56,E$58,E$60,E$62,E$64,E$66,E$68,E$70,E$72,E$74,E$76,E$78,E$80,E$82,E$84,E$86,E$88,E$90,E$92,E$94,E$96,E$98,E$100,E$102,E$104,E$106,E$108,E$110,E$112,E$114,E$116,E$118,E$120,E$122,E$124)) -> 3 | F373: =RANK(F372,(F$6,F$8,F$10,F$12,F$14,F$16,F$18,F$20,F$22,F$24,F$26,F$28,F$30,F$32,F$34,F$36,F$38,F$40,F$42,F$44,F$46,F$48,F$50,F$52,F$54,F$56,F$58,F$60,F$62,F$64,F$66,F$68,F$70,F$72,F$74,F$76,F$78,F$80,F$82,F$84,F$86,F$88,F$90,F$92,F$94,F$96,F$98,F$100,F$102,F$104,F$106,F$108,F$110,F$112,F$114,F$116,F$118,F$120,F$122,F$124)) -> 3 | G373: =RANK(G372,(G$6,G$8,G$10,G$12,G$14,G$16,G$18,G$20,G$22,G$24,G$26,G$28,G$30,G$32,G$34,G$36,G$38,G$40,G$42,G$44,G$46,G$48,G$50,G$52,G$54,G$56,G$58,G$60,G$62,G$64,G$66,G$68,G$70,G$72,G$74,G$76,G$78,G$80,G$82,G$84,G$86,G$88,G$90,G$92,G$94,G$96,G$98,G$100,G$102,G$104,G$106,G$108,G$110,G$112,G$114,G$116,G$118,G$120,G$122,G$124)) -> 3 | H373: =RANK(H372,(H$6,H$8,H$10,H$12,H$14,H$16,H$18,H$20,H$22,H$24,H$26,H$28,H$30,H$32,H$34,H$36,H$38,H$40,H$42,H$44,H$46,H$48,H$50,H$52,H$54,H$56,H$58,H$60,H$62,H$64,H$66,H$68,H$70,H$72,H$74,H$76,H$78,H$80,H$82,H$84,H$86,H$88,H$90,H$92,H$94,H$96,H$98,H$100,H$102,H$104,H$106,H$108,H$110,H$112,H$114,H$116,H$118,H$120,H$122,H$124)) -> 3 | I373: =RANK(I372,(I$6,I$8,I$10,I$12,I$14,I$16,I$18,I$20,I$22,I$24,I$26,I$28,I$30,I$32,I$34,I$36,I$38,I$40,I$42,I$44,I$46,I$48,I$50,I$52,I$54,I$56,I$58,I$60,I$62,I$64,I$66,I$68,I$70,I$72,I$74,I$76,I$78,I$80,I$82,I$84,I$86,I$88,I$90,I$92,I$94,I$96,I$98,I$100,I$102,I$104,I$106,I$108,I$110,I$112,I$114,I$116,I$118,I$120,I$122,I$124)) -> 3 | J373: =RANK(J372,(J$6,J$8,J$10,J$12,J$14,J$16,J$18,J$20,J$22,J$24,J$26,J$28,J$30,J$32,J$34,J$36,J$38,J$40,J$42,J$44,J$46,J$48,J$50,J$52,J$54,J$56,J$58,J$60,J$62,J$64,J$66,J$68,J$70,J$72,J$74,J$76,J$78,J$80,J$82,J$84,J$86,J$88,J$90,J$92,J$94,J$96,J$98,J$100,J$102,J$104,J$106,J$108,J$110,J$112,J$114,J$116,J$118,J$120,J$122,J$124)) -> 3 | K373: =RANK(K372,(K$6,K$8,K$10,K$12,K$14,K$16,K$18,K$20,K$22,K$24,K$26,K$28,K$30,K$32,K$34,K$36,K$38,K$40,K$42,K$44,K$46,K$48,K$50,K$52,K$54,K$56,K$58,K$60,K$62,K$64,K$66,K$68,K$70,K$72,K$74,K$76,K$78,K$80,K$82,K$84,K$86,K$88,K$90,K$92,K$94,K$96,K$98,K$100,K$102,K$104,K$106,K$108,K$110,K$112,K$114,K$116,K$118,K$120,K$122,K$124)) -> 3 | L373: =RANK(L372,(L$6,L$8,L$10,L$12,L$14,L$16,L$18,L$20,L$22,L$24,L$26,L$28,L$30,L$32,L$34,L$36,L$38,L$40,L$42,L$44,L$46,L$48,L$50,L$52,L$54,L$56,L$58,L$60,L$62,L$64,L$66,L$68,L$70,L$72,L$74,L$76,L$78,L$80,L$82,L$84,L$86,L$88,L$90,L$92,L$94,L$96,L$98,L$100,L$102,L$104,L$106,L$108,L$110,L$112,L$114,L$116,L$118,L$120,L$122,L$124)) -> 4 | M373: =RANK(M372,(M$6,M$8,M$10,M$12,M$14,M$16,M$18,M$20,M$22,M$24,M$26,M$28,M$30,M$32,M$34,M$36,M$38,M$40,M$42,M$44,M$46,M$48,M$50,M$52,M$54,M$56,M$58,M$60,M$62,M$64,M$66,M$68,M$70,M$72,M$74,M$76,M$78,M$80,M$82,M$84,M$86,M$88,M$90,M$92,M$94,M$96,M$98,M$100,M$102,M$104,M$106,M$108,M$110,M$112,M$114,M$116,M$118,M$120,M$122,M$124)) -> 4 | N373: =RANK(N372,(N$6,N$8,N$10,N$12,N$14,N$16,N$18,N$20,N$22,N$24,N$26,N$28,N$30,N$32,N$34,N$36,N$38,N$40,N$42,N$44,N$46,N$48,N$50,N$52,N$54,N$56,N$58,N$60,N$62,N$64,N$66,N$68,N$70,N$72,N$74,N$76,N$78,N$80,N$82,N$84,N$86,N$88,N$90,N$92,N$94,N$96,N$98,N$100,N$102,N$104,N$106,N$108,N$110,N$112,N$114,N$116,N$118,N$120,N$122,N$124)) -> 3 | P373: =RANK(P372,(P$6,P$8,P$10,P$12,P$14,P$16,P$18,P$20,P$22,P$24,P$26,P$28,P$30,P$32,P$34,P$36,P$38,P$40,P$42,P$44,P$46,P$48,P$50,P$52,P$54,P$56,P$58,P$60,P$62,P$64,P$66,P$68,P$70,P$72,P$74,P$76,P$78,P$80,P$82,P$84,P$86,P$88,P$90,P$92,P$94,P$96,P$98,P$100,P$102,P$104,P$106,P$108,P$110,P$112,P$114,P$116,P$118,P$120,P$122,P$124)) -> 3
A374: Louisiana | B374: 3 | C374: 13.70 | D374: 14.40 | E374: 28.10 | F374: 14.40 | G374: 14.00 | H374: 15.40 | I374: 21.90 | J374: 14.60 | K374: 14.10 | L374: 15.40 | M374: 22.05 | N374: 72.05 | O374: 0.0 | P374: 72.05
A375: Stars | C375: =RANK(C374,(C$6,C$8,C$10,C$12,C$14,C$16,C$18,C$20,C$22,C$24,C$26,C$28,C$30,C$32,C$34,C$36,C$38,C$40,C$42,C$44,C$46,C$48,C$50,C$52,C$54,C$56,C$58,C$60,C$62,C$64,C$66,C$68,C$70,C$72,C$74,C$76,C$78,C$80,C$82,C$84,C$86,C$88,C$90,C$92,C$94,C$96,C$98,C$100,C$102,C$104,C$106,C$108,C$110,C$112,C$114,C$116,C$118,C$120,C$122,C$124)) -> 6 | D375: =RANK(D374,(D$6,D$8,D$10,D$12,D$14,D$16,D$18,D$20,D$22,D$24,D$26,D$28,D$30,D$32,D$34,D$36,D$38,D$40,D$42,D$44,D$46,D$48,D$50,D$52,D$54,D$56,D$58,D$60,D$62,D$64,D$66,D$68,D$70,D$72,D$74,D$76,D$78,D$80,D$82,D$84,D$86,D$88,D$90,D$92,D$94,D$96,D$98,D$100,D$102,D$104,D$106,D$108,D$110,D$112,D$114,D$116,D$118,D$120,D$122,D$124)) -> 5 | E375: =RANK(E374,(E$6,E$8,E$10,E$12,E$14,E$16,E$18,E$20,E$22,E$24,E$26,E$28,E$30,E$32,E$34,E$36,E$38,E$40,E$42,E$44,E$46,E$48,E$50,E$52,E$54,E$56,E$58,E$60,E$62,E$64,E$66,E$68,E$70,E$72,E$74,E$76,E$78,E$80,E$82,E$84,E$86,E$88,E$90,E$92,E$94,E$96,E$98,E$100,E$102,E$104,E$106,E$108,E$110,E$112,E$114,E$116,E$118,E$120,E$122,E$124)) -> 6 | F375: =RANK(F374,(F$6,F$8,F$10,F$12,F$14,F$16,F$18,F$20,F$22,F$24,F$26,F$28,F$30,F$32,F$34,F$36,F$38,F$40,F$42,F$44,F$46,F$48,F$50,F$52,F$54,F$56,F$58,F$60,F$62,F$64,F$66,F$68,F$70,F$72,F$74,F$76,F$78,F$80,F$82,F$84,F$86,F$88,F$90,F$92,F$94,F$96,F$98,F$100,F$102,F$104,F$106,F$108,F$110,F$112,F$114,F$116,F$118,F$120,F$122,F$124)) -> 4 | G375: =RANK(G374,(G$6,G$8,G$10,G$12,G$14,G$16,G$18,G$20,G$22,G$24,G$26,G$28,G$30,G$32,G$34,G$36,G$38,G$40,G$42,G$44,G$46,G$48,G$50,G$52,G$54,G$56,G$58,G$60,G$62,G$64,G$66,G$68,G$70,G$72,G$74,G$76,G$78,G$80,G$82,G$84,G$86,G$88,G$90,G$92,G$94,G$96,G$98,G$100,G$102,G$104,G$106,G$108,G$110,G$112,G$114,G$116,G$118,G$120,G$122,G$124)) -> 5 | H375: =RANK(H374,(H$6,H$8,H$10,H$12,H$14,H$16,H$18,H$20,H$22,H$24,H$26,H$28,H$30,H$32,H$34,H$36,H$38,H$40,H$42,H$44,H$46,H$48,H$50,H$52,H$54,H$56,H$58,H$60,H$62,H$64,H$66,H$68,H$70,H$72,H$74,H$76,H$78,H$80,H$82,H$84,H$86,H$88,H$90,H$92,H$94,H$96,H$98,H$100,H$102,H$104,H$106,H$108,H$110,H$112,H$114,H$116,H$118,H$120,H$122,H$124)) -> 4 | I375: =RANK(I374,(I$6,I$8,I$10,I$12,I$14,I$16,I$18,I$20,I$22,I$24,I$26,I$28,I$30,I$32,I$34,I$36,I$38,I$40,I$42,I$44,I$46,I$48,I$50,I$52,I$54,I$56,I$58,I$60,I$62,I$64,I$66,I$68,I$70,I$72,I$74,I$76,I$78,I$80,I$82,I$84,I$86,I$88,I$90,I$92,I$94,I$96,I$98,I$100,I$102,I$104,I$106,I$108,I$110,I$112,I$114,I$116,I$118,I$120,I$122,I$124)) -> 4 | J375: =RANK(J374,(J$6,J$8,J$10,J$12,J$14,J$16,J$18,J$20,J$22,J$24,J$26,J$28,J$30,J$32,J$34,J$36,J$38,J$40,J$42,J$44,J$46,J$48,J$50,J$52,J$54,J$56,J$58,J$60,J$62,J$64,J$66,J$68,J$70,J$72,J$74,J$76,J$78,J$80,J$82,J$84,J$86,J$88,J$90,J$92,J$94,J$96,J$98,J$100,J$102,J$104,J$106,J$108,J$110,J$112,J$114,J$116,J$118,J$120,J$122,J$124)) -> 4 | K375: =RANK(K374,(K$6,K$8,K$10,K$12,K$14,K$16,K$18,K$20,K$22,K$24,K$26,K$28,K$30,K$32,K$34,K$36,K$38,K$40,K$42,K$44,K$46,K$48,K$50,K$52,K$54,K$56,K$58,K$60,K$62,K$64,K$66,K$68,K$70,K$72,K$74,K$76,K$78,K$80,K$82,K$84,K$86,K$88,K$90,K$92,K$94,K$96,K$98,K$100,K$102,K$104,K$106,K$108,K$110,K$112,K$114,K$116,K$118,K$120,K$122,K$124)) -> 4 | L375: =RANK(L374,(L$6,L$8,L$10,L$12,L$14,L$16,L$18,L$20,L$22,L$24,L$26,L$28,L$30,L$32,L$34,L$36,L$38,L$40,L$42,L$44,L$46,L$48,L$50,L$52,L$54,L$56,L$58,L$60,L$62,L$64,L$66,L$68,L$70,L$72,L$74,L$76,L$78,L$80,L$82,L$84,L$86,L$88,L$90,L$92,L$94,L$96,L$98,L$100,L$102,L$104,L$106,L$108,L$110,L$112,L$114,L$116,L$118,L$120,L$122,L$124)) -> 2 | M375: =RANK(M374,(M$6,M$8,M$10,M$12,M$14,M$16,M$18,M$20,M$22,M$24,M$26,M$28,M$30,M$32,M$34,M$36,M$38,M$40,M$42,M$44,M$46,M$48,M$50,M$52,M$54,M$56,M$58,M$60,M$62,M$64,M$66,M$68,M$70,M$72,M$74,M$76,M$78,M$80,M$82,M$84,M$86,M$88,M$90,M$92,M$94,M$96,M$98,M$100,M$102,M$104,M$106,M$108,M$110,M$112,M$114,M$116,M$118,M$120,M$122,M$124)) -> 3 | N375: =RANK(N374,(N$6,N$8,N$10,N$12,N$14,N$16,N$18,N$20,N$22,N$24,N$26,N$28,N$30,N$32,N$34,N$36,N$38,N$40,N$42,N$44,N$46,N$48,N$50,N$52,N$54,N$56,N$58,N$60,N$62,N$64,N$66,N$68,N$70,N$72,N$74,N$76,N$78,N$80,N$82,N$84,N$86,N$88,N$90,N$92,N$94,N$96,N$98,N$100,N$102,N$104,N$106,N$108,N$110,N$112,N$114,N$116,N$118,N$120,N$122,N$124)) -> 4 | P375: =RANK(P374,(P$6,P$8,P$10,P$12,P$14,P$16,P$18,P$20,P$22,P$24,P$26,P$28,P$30,P$32,P$34,P$36,P$38,P$40,P$42,P$44,P$46,P$48,P$50,P$52,P$54,P$56,P$58,P$60,P$62,P$64,P$66,P$68,P$70,P$72,P$74,P$76,P$78,P$80,P$82,P$84,P$86,P$88,P$90,P$92,P$94,P$96,P$98,P$100,P$102,P$104,P$106,P$108,P$110,P$112,P$114,P$116,P$118,P$120,P$122,P$124)) -> 4
A376: 7th | B376: 2 | C376: 14.40 | D376: 14.60 | E376: 29.00 | F376: 13.90 | G376: 13.90 | H376: 14.50 | I376: 21.15 | J376: 14.20 | K376: 12.90 | L376: 13.40 | M376: 20.25 | N376: 70.40 | O376: 0.0 | P376: 70.40
A377: Regiment | C377: =RANK(C376,(C$6,C$8,C$10,C$12,C$14,C$16,C$18,C$20,C$22,C$24,C$26,C$28,C$30,C$32,C$34,C$36,C$38,C$40,C$42,C$44,C$46,C$48,C$50,C$52,C$54,C$56,C$58,C$60,C$62,C$64,C$66,C$68,C$70,C$72,C$74,C$76,C$78,C$80,C$82,C$84,C$86,C$88,C$90,C$92,C$94,C$96,C$98,C$100,C$102,C$104,C$106,C$108,C$110,C$112,C$114,C$116,C$118,C$120,C$122,C$124)) -> 4 | D377: =RANK(D376,(D$6,D$8,D$10,D$12,D$14,D$16,D$18,D$20,D$22,D$24,D$26,D$28,D$30,D$32,D$34,D$36,D$38,D$40,D$42,D$44,D$46,D$48,D$50,D$52,D$54,D$56,D$58,D$60,D$62,D$64,D$66,D$68,D$70,D$72,D$74,D$76,D$78,D$80,D$82,D$84,D$86,D$88,D$90,D$92,D$94,D$96,D$98,D$100,D$102,D$104,D$106,D$108,D$110,D$112,D$114,D$116,D$118,D$120,D$122,D$124)) -> 4 | E377: =RANK(E376,(E$6,E$8,E$10,E$12,E$14,E$16,E$18,E$20,E$22,E$24,E$26,E$28,E$30,E$32,E$34,E$36,E$38,E$40,E$42,E$44,E$46,E$48,E$50,E$52,E$54,E$56,E$58,E$60,E$62,E$64,E$66,E$68,E$70,E$72,E$74,E$76,E$78,E$80,E$82,E$84,E$86,E$88,E$90,E$92,E$94,E$96,E$98,E$100,E$102,E$104,E$106,E$108,E$110,E$112,E$114,E$116,E$118,E$120,E$122,E$124)) -> 4 | F377: =RANK(F376,(F$6,F$8,F$10,F$12,F$14,F$16,F$18,F$20,F$22,F$24,F$26,F$28,F$30,F$32,F$34,F$36,F$38,F$40,F$42,F$44,F$46,F$48,F$50,F$52,F$54,F$56,F$58,F$60,F$62,F$64,F$66,F$68,F$70,F$72,F$74,F$76,F$78,F$80,F$82,F$84,F$86,F$88,F$90,F$92,F$94,F$96,F$98,F$100,F$102,F$104,F$106,F$108,F$110,F$112,F$114,F$116,F$118,F$120,F$122,F$124)) -> 5 | G377: =RANK(G376,(G$6,G$8,G$10,G$12,G$14,G$16,G$18,G$20,G$22,G$24,G$26,G$28,G$30,G$32,G$34,G$36,G$38,G$40,G$42,G$44,G$46,G$48,G$50,G$52,G$54,G$56,G$58,G$60,G$62,G$64,G$66,G$68,G$70,G$72,G$74,G$76,G$78,G$80,G$82,G$84,G$86,G$88,G$90,G$92,G$94,G$96,G$98,G$100,G$102,G$104,G$106,G$108,G$110,G$112,G$114,G$116,G$118,G$120,G$122,G$124)) -> 6 | H377: =RANK(H376,(H$6,H$8,H$10,H$12,H$14,H$16,H$18,H$20,H$22,H$24,H$26,H$28,H$30,H$32,H$34,H$36,H$38,H$40,H$42,H$44,H$46,H$48,H$50,H$52,H$54,H$56,H$58,H$60,H$62,H$64,H$66,H$68,H$70,H$72,H$74,H$76,H$78,H$80,H$82,H$84,H$86,H$88,H$90,H$92,H$94,H$96,H$98,H$100,H$102,H$104,H$106,H$108,H$110,H$112,H$114,H$116,H$118,H$120,H$122,H$124)) -> 5 | I377: =RANK(I376,(I$6,I$8,I$10,I$12,I$14,I$16,I$18,I$20,I$22,I$24,I$26,I$28,I$30,I$32,I$34,I$36,I$38,I$40,I$42,I$44,I$46,I$48,I$50,I$52,I$54,I$56,I$58,I$60,I$62,I$64,I$66,I$68,I$70,I$72,I$74,I$76,I$78,I$80,I$82,I$84,I$86,I$88,I$90,I$92,I$94,I$96,I$98,I$100,I$102,I$104,I$106,I$108,I$110,I$112,I$114,I$116,I$118,I$120,I$122,I$124)) -> 5 | J377: =RANK(J376,(J$6,J$8,J$10,J$12,J$14,J$16,J$18,J$20,J$22,J$24,J$26,J$28,J$30,J$32,J$34,J$36,J$38,J$40,J$42,J$44,J$46,J$48,J$50,J$52,J$54,J$56,J$58,J$60,J$62,J$64,J$66,J$68,J$70,J$72,J$74,J$76,J$78,J$80,J$82,J$84,J$86,J$88,J$90,J$92,J$94,J$96,J$98,J$100,J$102,J$104,J$106,J$108,J$110,J$112,J$114,J$116,J$118,J$120,J$122,J$124)) -> 5 | K377: =RANK(K376,(K$6,K$8,K$10,K$12,K$14,K$16,K$18,K$20,K$22,K$24,K$26,K$28,K$30,K$32,K$34,K$36,K$38,K$40,K$42,K$44,K$46,K$48,K$50,K$52,K$54,K$56,K$58,K$60,K$62,K$64,K$66,K$68,K$70,K$72,K$74,K$76,K$78,K$80,K$82,K$84,K$86,K$88,K$90,K$92,K$94,K$96,K$98,K$100,K$102,K$104,K$106,K$108,K$110,K$112,K$114,K$116,K$118,K$120,K$122,K$124)) -> 5 | L377: =RANK(L376,(L$6,L$8,L$10,L$12,L$14,L$16,L$18,L$20,L$22,L$24,L$26,L$28,L$30,L$32,L$34,L$36,L$38,L$40,L$42,L$44,L$46,L$48,L$50,L$52,L$54,L$56,L$58,L$60,L$62,L$64,L$66,L$68,L$70,L$72,L$74,L$76,L$78,L$80,L$82,L$84,L$86,L$88,L$90,L$92,L$94,L$96,L$98,L$100,L$102,L$104,L$106,L$108,L$110,L$112,L$114,L$116,L$118,L$120,L$122,L$124)) -> 6 | M377: =RANK(M376,(M$6,M$8,M$10,M$12,M$14,M$16,M$18,M$20,M$22,M$24,M$26,M$28,M$30,M$32,M$34,M$36,M$38,M$40,M$42,M$44,M$46,M$48,M$50,M$52,M$54,M$56,M$58,M$60,M$62,M$64,M$66,M$68,M$70,M$72,M$74,M$76,M$78,M$80,M$82,M$84,M$86,M$88,M$90,M$92,M$94,M$96,M$98,M$100,M$102,M$104,M$106,M$108,M$110,M$112,M$114,M$116,M$118,M$120,M$122,M$124)) -> 5 | N377: =RANK(N376,(N$6,N$8,N$10,N$12,N$14,N$16,N$18,N$20,N$22,N$24,N$26,N$28,N$30,N$32,N$34,N$36,N$38,N$40,N$42,N$44,N$46,N$48,N$50,N$52,N$54,N$56,N$58,N$60,N$62,N$64,N$66,N$68,N$70,N$72,N$74,N$76,N$78,N$80,N$82,N$84,N$86,N$88,N$90,N$92,N$94,N$96,N$98,N$100,N$102,N$104,N$106,N$108,N$110,N$112,N$114,N$116,N$118,N$120,N$122,N$124)) -> 5 | P377: =RANK(P376,(P$6,P$8,P$10,P$12,P$14,P$16,P$18,P$20,P$22,P$24,P$26,P$28,P$30,P$32,P$34,P$36,P$38,P$40,P$42,P$44,P$46,P$48,P$50,P$52,P$54,P$56,P$58,P$60,P$62,P$64,P$66,P$68,P$70,P$72,P$74,P$76,P$78,P$80,P$82,P$84,P$86,P$88,P$90,P$92,P$94,P$96,P$98,P$100,P$102,P$104,P$106,P$108,P$110,P$112,P$114,P$116,P$118,P$120,P$122,P$124)) -> 5
A378: Raiders | B378: 1 | C378: 14.10 | D378: 14.20 | E378: 28.30 | F378: 13.30 | G378: 14.20 | H378: 13.20 | I378: 20.35 | J378: 13.90 | K378: 12.70 | L378: 13.90 | M378: 20.25 | N378: 68.90 | O378: 0.0 | P378: 68.90
C379: =RANK(C378,(C$6,C$8,C$10,C$12,C$14,C$16,C$18,C$20,C$22,C$24,C$26,C$28,C$30,C$32,C$34,C$36,C$38,C$40,C$42,C$44,C$46,C$48,C$50,C$52,C$54,C$56,C$58,C$60,C$62,C$64,C$66,C$68,C$70,C$72,C$74,C$76,C$78,C$80,C$82,C$84,C$86,C$88,C$90,C$92,C$94,C$96,C$98,C$100,C$102,C$104,C$106,C$108,C$110,C$112,C$114,C$116,C$118,C$120,C$122,C$124)) -> 5 | D379: =RANK(D378,(D$6,D$8,D$10,D$12,D$14,D$16,D$18,D$20,D$22,D$24,D$26,D$28,D$30,D$32,D$34,D$36,D$38,D$40,D$42,D$44,D$46,D$48,D$50,D$52,D$54,D$56,D$58,D$60,D$62,D$64,D$66,D$68,D$70,D$72,D$74,D$76,D$78,D$80,D$82,D$84,D$86,D$88,D$90,D$92,D$94,D$96,D$98,D$100,D$102,D$104,D$106,D$108,D$110,D$112,D$114,D$116,D$118,D$120,D$122,D$124)) -> 6 | E379: =RANK(E378,(E$6,E$8,E$10,E$12,E$14,E$16,E$18,E$20,E$22,E$24,E$26,E$28,E$30,E$32,E$34,E$36,E$38,E$40,E$42,E$44,E$46,E$48,E$50,E$52,E$54,E$56,E$58,E$60,E$62,E$64,E$66,E$68,E$70,E$72,E$74,E$76,E$78,E$80,E$82,E$84,E$86,E$88,E$90,E$92,E$94,E$96,E$98,E$100,E$102,E$104,E$106,E$108,E$110,E$112,E$114,E$116,E$118,E$120,E$122,E$124)) -> 5 | F379: =RANK(F378,(F$6,F$8,F$10,F$12,F$14,F$16,F$18,F$20,F$22,F$24,F$26,F$28,F$30,F$32,F$34,F$36,F$38,F$40,F$42,F$44,F$46,F$48,F$50,F$52,F$54,F$56,F$58,F$60,F$62,F$64,F$66,F$68,F$70,F$72,F$74,F$76,F$78,F$80,F$82,F$84,F$86,F$88,F$90,F$92,F$94,F$96,F$98,F$100,F$102,F$104,F$106,F$108,F$110,F$112,F$114,F$116,F$118,F$120,F$122,F$124)) -> 6 | G379: =RANK(G378,(G$6,G$8,G$10,G$12,G$14,G$16,G$18,G$20,G$22,G$24,G$26,G$28,G$30,G$32,G$34,G$36,G$38,G$40,G$42,G$44,G$46,G$48,G$50,G$52,G$54,G$56,G$58,G$60,G$62,G$64,G$66,G$68,G$70,G$72,G$74,G$76,G$78,G$80,G$82,G$84,G$86,G$88,G$90,G$92,G$94,G$96,G$98,G$100,G$102,G$104,G$106,G$108,G$110,G$112,G$114,G$116,G$118,G$120,G$122,G$124)) -> 4 | H379: =RANK(H378,(H$6,H$8,H$10,H$12,H$14,H$16,H$18,H$20,H$22,H$24,H$26,H$28,H$30,H$32,H$34,H$36,H$38,H$40,H$42,H$44,H$46,H$48,H$50,H$52,H$54,H$56,H$58,H$60,H$62,H$64,H$66,H$68,H$70,H$72,H$74,H$76,H$78,H$80,H$82,H$84,H$86,H$88,H$90,H$92,H$94,H$96,H$98,H$100,H$102,H$104,H$106,H$108,H$110,H$112,H$114,H$116,H$118,H$120,H$122,H$124)) -> 6 | I379: =RANK(I378,(I$6,I$8,I$10,I$12,I$14,I$16,I$18,I$20,I$22,I$24,I$26,I$28,I$30,I$32,I$34,I$36,I$38,I$40,I$42,I$44,I$46,I$48,I$50,I$52,I$54,I$56,I$58,I$60,I$62,I$64,I$66,I$68,I$70,I$72,I$74,I$76,I$78,I$80,I$82,I$84,I$86,I$88,I$90,I$92,I$94,I$96,I$98,I$100,I$102,I$104,I$106,I$108,I$110,I$112,I$114,I$116,I$118,I$120,I$122,I$124)) -> 6 | J379: =RANK(J378,(J$6,J$8,J$10,J$12,J$14,J$16,J$18,J$20,J$22,J$24,J$26,J$28,J$30,J$32,J$34,J$36,J$38,J$40,J$42,J$44,J$46,J$48,J$50,J$52,J$54,J$56,J$58,J$60,J$62,J$64,J$66,J$68,J$70,J$72,J$74,J$76,J$78,J$80,J$82,J$84,J$86,J$88,J$90,J$92,J$94,J$96,J$98,J$100,J$102,J$104,J$106,J$108,J$110,J$112,J$114,J$116,J$118,J$120,J$122,J$124)) -> 6 | K379: =RANK(K378,(K$6,K$8,K$10,K$12,K$14,K$16,K$18,K$20,K$22,K$24,K$26,K$28,K$30,K$32,K$34,K$36,K$38,K$40,K$42,K$44,K$46,K$48,K$50,K$52,K$54,K$56,K$58,K$60,K$62,K$64,K$66,K$68,K$70,K$72,K$74,K$76,K$78,K$80,K$82,K$84,K$86,K$88,K$90,K$92,K$94,K$96,K$98,K$100,K$102,K$104,K$106,K$108,K$110,K$112,K$114,K$116,K$118,K$120,K$122,K$124)) -> 6 | L379: =RANK(L378,(L$6,L$8,L$10,L$12,L$14,L$16,L$18,L$20,L$22,L$24,L$26,L$28,L$30,L$32,L$34,L$36,L$38,L$40,L$42,L$44,L$46,L$48,L$50,L$52,L$54,L$56,L$58,L$60,L$62,L$64,L$66,L$68,L$70,L$72,L$74,L$76,L$78,L$80,L$82,L$84,L$86,L$88,L$90,L$92,L$94,L$96,L$98,L$100,L$102,L$104,L$106,L$108,L$110,L$112,L$114,L$116,L$118,L$120,L$122,L$124)) -> 5 | M379: =RANK(M378,(M$6,M$8,M$10,M$12,M$14,M$16,M$18,M$20,M$22,M$24,M$26,M$28,M$30,M$32,M$34,M$36,M$38,M$40,M$42,M$44,M$46,M$48,M$50,M$52,M$54,M$56,M$58,M$60,M$62,M$64,M$66,M$68,M$70,M$72,M$74,M$76,M$78,M$80,M$82,M$84,M$86,M$88,M$90,M$92,M$94,M$96,M$98,M$100,M$102,M$104,M$106,M$108,M$110,M$112,M$114,M$116,M$118,M$120,M$122,M$124)) -> 5 | N379: =RANK(N378,(N$6,N$8,N$10,N$12,N$14,N$16,N$18,N$20,N$22,N$24,N$26,N$28,N$30,N$32,N$34,N$36,N$38,N$40,N$42,N$44,N$46,N$48,N$50,N$52,N$54,N$56,N$58,N$60,N$62,N$64,N$66,N$68,N$70,N$72,N$74,N$76,N$78,N$80,N$82,N$84,N$86,N$88,N$90,N$92,N$94,N$96,N$98,N$100,N$102,N$104,N$106,N$108,N$110,N$112,N$114,N$116,N$118,N$120,N$122,N$124)) -> 6 | P379: =RANK(P378,(P$6,P$8,P$10,P$12,P$14,P$16,P$18,P$20,P$22,P$24,P$26,P$28,P$30,P$32,P$34,P$36,P$38,P$40,P$42,P$44,P$46,P$48,P$50,P$52,P$54,P$56,P$58,P$60,P$62,P$64,P$66,P$68,P$70,P$72,P$74,P$76,P$78,P$80,P$82,P$84,P$86,P$88,P$90,P$92,P$94,P$96,P$98,P$100,P$102,P$104,P$106,P$108,P$110,P$112,P$114,P$116,P$118,P$120,P$122,P$124)) -> 6
A382: 8/6/2022 Avon Lake, Ohio
C383: Visual | F383: Music | J383: Effect | M383: Communication
C384: Ensemble | D384: Color Guard | F384: Brass | G384: Ensemble | H384: Percussion | J384: Visual | K384: Music | M384: Visual | N384: Music | P384: Sub | R384: Total
C385: C. Clayton | D385: D. Deems | E385: Average | F385: A. Cook | G385: K. Weirich | H385: A. Kristensen | I385: Total ÷2 | J385: M. Czapinski | K385: J. Rhodes | L385: Total | M385: M. Czapinski | N385: J. Rhodes | O385: Average | P385: Total | Q385: Pen | R385: Score
A386: DCA Open Class | C386: 20 | D386: 20 | E386: 20 | F386: 20 | G386: 20 | H386: 20 | I386: 30 | J386: 20 | K386: 20 | L386: 40 | M386: 10 | N386: 10 | O386: 10 | P386: 100 | R386: 100
A387: Cincinnati | B387: 2 | C387: 15.30 | D387: 15.10 | E387: 15.20 | F387: 15.70 | G387: 16.00 | H387: 14.00 | I387: 22.85 | J387: 16.40 | K387: 15.40 | L387: 31.80 | M387: 8.00 | N387: 7.40 | O387: 7.70 | P387: 77.55 | Q387: 0.0 | R387: 77.55
A388: Tradition | C388: 1 | D388: 2 | E388: 2 | F388: 1 | G388: 1 | H388: 2 | I388: 1 | J388: 1 | K388: 1 | L388: 1 | M388: 1 | N388: 2 | O388: 1 | P388: 1 | R388: 1
A389: Rogues Hollow | B389: 1 | C389: 15.20 | D389: 15.30 | E389: 15.25 | F389: 15.10 | G389: 15.30 | H389: 14.90 | I389: 22.65 | J389: 14.80 | K389: 14.90 | L389: 29.70 | M389: 7.60 | N389: 7.80 | O389: 7.70 | P389: 75.30 | Q389: 0.0 | R389: 75.30
A390: Regiment | C390: 2 | D390: 1 | E390: 1 | F390: 2 | G390: 2 | H390: 1 | I390: 2 | J390: 2 | K390: 2 | L390: 2 | M390: 2 | N390: 1 | O390: 1 | P390: 1 | R390: 1
A391: DCA Open Class
A392: Columbus | B392: 1 | C392: 13.50 | D392: 13.90 | E392: 13.70 | F392: 11.40 | G392: 13.70 | H392: 11.20 | I392: 18.15 | J392: 13.60 | K392: 12.80 | L392: 26.40 | M392: 6.50 | N392: 6.20 | O392: 6.35 | P392: 0.00 | Q392: 0.0 | R392: 0.00
A393: Saints | C393: 1 | D393: 1 | E393: 1 | F393: 1 | G393: 1 | H393: 1 | I393: 1 | J393: 1 | K393: 1 | L393: 1 | M393: 1 | N393: 1 | O393: 1 | P393: 1 | R393: 1
A396: 8/7/2022 Pittsburgh, Pennsylvania
C397: General Effect | F397: Visual | J397: Music
C398: 1 | D398: 2 | F398: Proficiency | G398: Analysis | H398: Color Guard | J398: Brass | K398: Analysis | L398: Percussion | N398: Sub | P398: Total
C399: B. Kuhn | D399: C. Hestin | E399: Total | F399: B. Jones | G399: J. Orefice | H399: J. Howell | I399: Total ÷2 | J399: D. Orser | K399: P. McGarr | L399: T. Fox | M399: Total ÷2 | N399: Total | O399: Pen | P399: Score
A400: DCI World Class | C400: 20 | D400: 20 | E400: 40 | F400: 20 | G400: 20 | H400: 20 | I400: 30 | J400: 20 | K400: 20 | L400: 20 | M400: 30 | N400: 100 | P400: 100
A401: Cadets | B401: 5 | C401: 18.60 | D401: 18.40 | E401: 37.00 | F401: 18.30 | G401: 18.30 | H401: 18.40 | I401: 27.50 | J401: 18.60 | K401: 18.30 | L401: 18.70 | M401: 27.80 | N401: 92.30 | O401: 0.0 | P401: 92.30
C402: =RANK(C401,(C$6,C$8,C$10,C$12,C$14,C$16,C$18,C$20,C$22,C$24,C$26,C$28,C$30,C$32,C$34,C$36,C$38,C$40,C$42,C$44,C$46,C$48,C$50,C$52,C$54,C$56,C$58,C$60,C$62,C$64,C$66,C$68,C$70,C$72,C$74,C$76,C$78,C$80,C$82,C$84,C$86,C$88,C$90,C$92,C$94,C$96,C$98,C$100,C$102,C$104,C$106,C$108,C$110,C$112,C$114,C$116,C$118,C$120,C$122,C$124)) -> 1 | D402: =RANK(D401,(D$6,D$8,D$10,D$12,D$14,D$16,D$18,D$20,D$22,D$24,D$26,D$28,D$30,D$32,D$34,D$36,D$38,D$40,D$42,D$44,D$46,D$48,D$50,D$52,D$54,D$56,D$58,D$60,D$62,D$64,D$66,D$68,D$70,D$72,D$74,D$76,D$78,D$80,D$82,D$84,D$86,D$88,D$90,D$92,D$94,D$96,D$98,D$100,D$102,D$104,D$106,D$108,D$110,D$112,D$114,D$116,D$118,D$120,D$122,D$124)) -> 1 | E402: =RANK(E401,(E$6,E$8,E$10,E$12,E$14,E$16,E$18,E$20,E$22,E$24,E$26,E$28,E$30,E$32,E$34,E$36,E$38,E$40,E$42,E$44,E$46,E$48,E$50,E$52,E$54,E$56,E$58,E$60,E$62,E$64,E$66,E$68,E$70,E$72,E$74,E$76,E$78,E$80,E$82,E$84,E$86,E$88,E$90,E$92,E$94,E$96,E$98,E$100,E$102,E$104,E$106,E$108,E$110,E$112,E$114,E$116,E$118,E$120,E$122,E$124)) -> 1 | F402: =RANK(F401,(F$6,F$8,F$10,F$12,F$14,F$16,F$18,F$20,F$22,F$24,F$26,F$28,F$30,F$32,F$34,F$36,F$38,F$40,F$42,F$44,F$46,F$48,F$50,F$52,F$54,F$56,F$58,F$60,F$62,F$64,F$66,F$68,F$70,F$72,F$74,F$76,F$78,F$80,F$82,F$84,F$86,F$88,F$90,F$92,F$94,F$96,F$98,F$100,F$102,F$104,F$106,F$108,F$110,F$112,F$114,F$116,F$118,F$120,F$122,F$124)) -> 1 | G402: =RANK(G401,(G$6,G$8,G$10,G$12,G$14,G$16,G$18,G$20,G$22,G$24,G$26,G$28,G$30,G$32,G$34,G$36,G$38,G$40,G$42,G$44,G$46,G$48,G$50,G$52,G$54,G$56,G$58,G$60,G$62,G$64,G$66,G$68,G$70,G$72,G$74,G$76,G$78,G$80,G$82,G$84,G$86,G$88,G$90,G$92,G$94,G$96,G$98,G$100,G$102,G$104,G$106,G$108,G$110,G$112,G$114,G$116,G$118,G$120,G$122,G$124)) -> 1 | H402: =RANK(H401,(H$6,H$8,H$10,H$12,H$14,H$16,H$18,H$20,H$22,H$24,H$26,H$28,H$30,H$32,H$34,H$36,H$38,H$40,H$42,H$44,H$46,H$48,H$50,H$52,H$54,H$56,H$58,H$60,H$62,H$64,H$66,H$68,H$70,H$72,H$74,H$76,H$78,H$80,H$82,H$84,H$86,H$88,H$90,H$92,H$94,H$96,H$98,H$100,H$102,H$104,H$106,H$108,H$110,H$112,H$114,H$116,H$118,H$120,H$122,H$124)) -> 1 | I402: =RANK(I401,(I$6,I$8,I$10,I$12,I$14,I$16,I$18,I$20,I$22,I$24,I$26,I$28,I$30,I$32,I$34,I$36,I$38,I$40,I$42,I$44,I$46,I$48,I$50,I$52,I$54,I$56,I$58,I$60,I$62,I$64,I$66,I$68,I$70,I$72,I$74,I$76,I$78,I$80,I$82,I$84,I$86,I$88,I$90,I$92,I$94,I$96,I$98,I$100,I$102,I$104,I$106,I$108,I$110,I$112,I$114,I$116,I$118,I$120,I$122,I$124)) -> 1 | J402: =RANK(J401,(J$6,J$8,J$10,J$12,J$14,J$16,J$18,J$20,J$22,J$24,J$26,J$28,J$30,J$32,J$34,J$36,J$38,J$40,J$42,J$44,J$46,J$48,J$50,J$52,J$54,J$56,J$58,J$60,J$62,J$64,J$66,J$68,J$70,J$72,J$74,J$76,J$78,J$80,J$82,J$84,J$86,J$88,J$90,J$92,J$94,J$96,J$98,J$100,J$102,J$104,J$106,J$108,J$110,J$112,J$114,J$116,J$118,J$120,J$122,J$124)) -> 1 | K402: =RANK(K401,(K$6,K$8,K$10,K$12,K$14,K$16,K$18,K$20,K$22,K$24,K$26,K$28,K$30,K$32,K$34,K$36,K$38,K$40,K$42,K$44,K$46,K$48,K$50,K$52,K$54,K$56,K$58,K$60,K$62,K$64,K$66,K$68,K$70,K$72,K$74,K$76,K$78,K$80,K$82,K$84,K$86,K$88,K$90,K$92,K$94,K$96,K$98,K$100,K$102,K$104,K$106,K$108,K$110,K$112,K$114,K$116,K$118,K$120,K$122,K$124)) -> 1 | L402: =RANK(L401,(L$6,L$8,L$10,L$12,L$14,L$16,L$18,L$20,L$22,L$24,L$26,L$28,L$30,L$32,L$34,L$36,L$38,L$40,L$42,L$44,L$46,L$48,L$50,L$52,L$54,L$56,L$58,L$60,L$62,L$64,L$66,L$68,L$70,L$72,L$74,L$76,L$78,L$80,L$82,L$84,L$86,L$88,L$90,L$92,L$94,L$96,L$98,L$100,L$102,L$104,L$106,L$108,L$110,L$112,L$114,L$116,L$118,L$120,L$122,L$124)) -> 1 | M402: =RANK(M401,(M$6,M$8,M$10,M$12,M$14,M$16,M$18,M$20,M$22,M$24,M$26,M$28,M$30,M$32,M$34,M$36,M$38,M$40,M$42,M$44,M$46,M$48,M$50,M$52,M$54,M$56,M$58,M$60,M$62,M$64,M$66,M$68,M$70,M$72,M$74,M$76,M$78,M$80,M$82,M$84,M$86,M$88,M$90,M$92,M$94,M$96,M$98,M$100,M$102,M$104,M$106,M$108,M$110,M$112,M$114,M$116,M$118,M$120,M$122,M$124)) -> 1 | N402: =RANK(N401,(N$6,N$8,N$10,N$12,N$14,N$16,N$18,N$20,N$22,N$24,N$26,N$28,N$30,N$32,N$34,N$36,N$38,N$40,N$42,N$44,N$46,N$48,N$50,N$52,N$54,N$56,N$58,N$60,N$62,N$64,N$66,N$68,N$70,N$72,N$74,N$76,N$78,N$80,N$82,N$84,N$86,N$88,N$90,N$92,N$94,N$96,N$98,N$100,N$102,N$104,N$106,N$108,N$110,N$112,N$114,N$116,N$118,N$120,N$122,N$124)) -> 1 | P402: =RANK(P401,(P$6,P$8,P$10,P$12,P$14,P$16,P$18,P$20,P$22,P$24,P$26,P$28,P$30,P$32,P$34,P$36,P$38,P$40,P$42,P$44,P$46,P$48,P$50,P$52,P$54,P$56,P$58,P$60,P$62,P$64,P$66,P$68,P$70,P$72,P$74,P$76,P$78,P$80,P$82,P$84,P$86,P$88,P$90,P$92,P$94,P$96,P$98,P$100,P$102,P$104,P$106,P$108,P$110,P$112,P$114,P$116,P$118,P$120,P$122,P$124)) -> 1
A403: Mandarins | B403: 4 | C403: 18.10 | D403: 17.20 | E403: 35.30 | F403: 18.00 | G403: 17.80 | H403: 18.30 | I403: 27.05 | J403: 17.60 | K403: 17.60 | L403: 17.90 | M403: 26.55 | N403: 88.90 | O403: 0.0 | P403: 88.90
C404: =RANK(C403,(C$6,C$8,C$10,C$12,C$14,C$16,C$18,C$20,C$22,C$24,C$26,C$28,C$30,C$32,C$34,C$36,C$38,C$40,C$42,C$44,C$46,C$48,C$50,C$52,C$54,C$56,C$58,C$60,C$62,C$64,C$66,C$68,C$70,C$72,C$74,C$76,C$78,C$80,C$82,C$84,C$86,C$88,C$90,C$92,C$94,C$96,C$98,C$100,C$102,C$104,C$106,C$108,C$110,C$112,C$114,C$116,C$118,C$120,C$122,C$124)) -> 2 | D404: =RANK(D403,(D$6,D$8,D$10,D$12,D$14,D$16,D$18,D$20,D$22,D$24,D$26,D$28,D$30,D$32,D$34,D$36,D$38,D$40,D$42,D$44,D$46,D$48,D$50,D$52,D$54,D$56,D$58,D$60,D$62,D$64,D$66,D$68,D$70,D$72,D$74,D$76,D$78,D$80,D$82,D$84,D$86,D$88,D$90,D$92,D$94,D$96,D$98,D$100,D$102,D$104,D$106,D$108,D$110,D$112,D$114,D$116,D$118,D$120,D$122,D$124)) -> 2 | E404: =RANK(E403,(E$6,E$8,E$10,E$12,E$14,E$16,E$18,E$20,E$22,E$24,E$26,E$28,E$30,E$32,E$34,E$36,E$38,E$40,E$42,E$44,E$46,E$48,E$50,E$52,E$54,E$56,E$58,E$60,E$62,E$64,E$66,E$68,E$70,E$72,E$74,E$76,E$78,E$80,E$82,E$84,E$86,E$88,E$90,E$92,E$94,E$96,E$98,E$100,E$102,E$104,E$106,E$108,E$110,E$112,E$114,E$116,E$118,E$120,E$122,E$124)) -> 2 | F404: =RANK(F403,(F$6,F$8,F$10,F$12,F$14,F$16,F$18,F$20,F$22,F$24,F$26,F$28,F$30,F$32,F$34,F$36,F$38,F$40,F$42,F$44,F$46,F$48,F$50,F$52,F$54,F$56,F$58,F$60,F$62,F$64,F$66,F$68,F$70,F$72,F$74,F$76,F$78,F$80,F$82,F$84,F$86,F$88,F$90,F$92,F$94,F$96,F$98,F$100,F$102,F$104,F$106,F$108,F$110,F$112,F$114,F$116,F$118,F$120,F$122,F$124)) -> 2 | G404: =RANK(G403,(G$6,G$8,G$10,G$12,G$14,G$16,G$18,G$20,G$22,G$24,G$26,G$28,G$30,G$32,G$34,G$36,G$38,G$40,G$42,G$44,G$46,G$48,G$50,G$52,G$54,G$56,G$58,G$60,G$62,G$64,G$66,G$68,G$70,G$72,G$74,G$76,G$78,G$80,G$82,G$84,G$86,G$88,G$90,G$92,G$94,G$96,G$98,G$100,G$102,G$104,G$106,G$108,G$110,G$112,G$114,G$116,G$118,G$120,G$122,G$124)) -> 2 | H404: =RANK(H403,(H$6,H$8,H$10,H$12,H$14,H$16,H$18,H$20,H$22,H$24,H$26,H$28,H$30,H$32,H$34,H$36,H$38,H$40,H$42,H$44,H$46,H$48,H$50,H$52,H$54,H$56,H$58,H$60,H$62,H$64,H$66,H$68,H$70,H$72,H$74,H$76,H$78,H$80,H$82,H$84,H$86,H$88,H$90,H$92,H$94,H$96,H$98,H$100,H$102,H$104,H$106,H$108,H$110,H$112,H$114,H$116,H$118,H$120,H$122,H$124)) -> 2 | I404: =RANK(I403,(I$6,I$8,I$10,I$12,I$14,I$16,I$18,I$20,I$22,I$24,I$26,I$28,I$30,I$32,I$34,I$36,I$38,I$40,I$42,I$44,I$46,I$48,I$50,I$52,I$54,I$56,I$58,I$60,I$62,I$64,I$66,I$68,I$70,I$72,I$74,I$76,I$78,I$80,I$82,I$84,I$86,I$88,I$90,I$92,I$94,I$96,I$98,I$100,I$102,I$104,I$106,I$108,I$110,I$112,I$114,I$116,I$118,I$120,I$122,I$124)) -> 2 | J404: =RANK(J403,(J$6,J$8,J$10,J$12,J$14,J$16,J$18,J$20,J$22,J$24,J$26,J$28,J$30,J$32,J$34,J$36,J$38,J$40,J$42,J$44,J$46,J$48,J$50,J$52,J$54,J$56,J$58,J$60,J$62,J$64,J$66,J$68,J$70,J$72,J$74,J$76,J$78,J$80,J$82,J$84,J$86,J$88,J$90,J$92,J$94,J$96,J$98,J$100,J$102,J$104,J$106,J$108,J$110,J$112,J$114,J$116,J$118,J$120,J$122,J$124)) -> 2 | K404: =RANK(K403,(K$6,K$8,K$10,K$12,K$14,K$16,K$18,K$20,K$22,K$24,K$26,K$28,K$30,K$32,K$34,K$36,K$38,K$40,K$42,K$44,K$46,K$48,K$50,K$52,K$54,K$56,K$58,K$60,K$62,K$64,K$66,K$68,K$70,K$72,K$74,K$76,K$78,K$80,K$82,K$84,K$86,K$88,K$90,K$92,K$94,K$96,K$98,K$100,K$102,K$104,K$106,K$108,K$110,K$112,K$114,K$116,K$118,K$120,K$122,K$124)) -> 2 | L404: =RANK(L403,(L$6,L$8,L$10,L$12,L$14,L$16,L$18,L$20,L$22,L$24,L$26,L$28,L$30,L$32,L$34,L$36,L$38,L$40,L$42,L$44,L$46,L$48,L$50,L$52,L$54,L$56,L$58,L$60,L$62,L$64,L$66,L$68,L$70,L$72,L$74,L$76,L$78,L$80,L$82,L$84,L$86,L$88,L$90,L$92,L$94,L$96,L$98,L$100,L$102,L$104,L$106,L$108,L$110,L$112,L$114,L$116,L$118,L$120,L$122,L$124)) -> 2 | M404: =RANK(M403,(M$6,M$8,M$10,M$12,M$14,M$16,M$18,M$20,M$22,M$24,M$26,M$28,M$30,M$32,M$34,M$36,M$38,M$40,M$42,M$44,M$46,M$48,M$50,M$52,M$54,M$56,M$58,M$60,M$62,M$64,M$66,M$68,M$70,M$72,M$74,M$76,M$78,M$80,M$82,M$84,M$86,M$88,M$90,M$92,M$94,M$96,M$98,M$100,M$102,M$104,M$106,M$108,M$110,M$112,M$114,M$116,M$118,M$120,M$122,M$124)) -> 2 | N404: =RANK(N403,(N$6,N$8,N$10,N$12,N$14,N$16,N$18,N$20,N$22,N$24,N$26,N$28,N$30,N$32,N$34,N$36,N$38,N$40,N$42,N$44,N$46,N$48,N$50,N$52,N$54,N$56,N$58,N$60,N$62,N$64,N$66,N$68,N$70,N$72,N$74,N$76,N$78,N$80,N$82,N$84,N$86,N$88,N$90,N$92,N$94,N$96,N$98,N$100,N$102,N$104,N$106,N$108,N$110,N$112,N$114,N$116,N$118,N$120,N$122,N$124)) -> 2 | P404: =RANK(P403,(P$6,P$8,P$10,P$12,P$14,P$16,P$18,P$20,P$22,P$24,P$26,P$28,P$30,P$32,P$34,P$36,P$38,P$40,P$42,P$44,P$46,P$48,P$50,P$52,P$54,P$56,P$58,P$60,P$62,P$64,P$66,P$68,P$70,P$72,P$74,P$76,P$78,P$80,P$82,P$84,P$86,P$88,P$90,P$92,P$94,P$96,P$98,P$100,P$102,P$104,P$106,P$108,P$110,P$112,P$114,P$116,P$118,P$120,P$122,P$124)) -> 2
A405: Blue | B405: 3 | C405: 17.10 | D405: 16.50 | E405: 33.60 | F405: 16.60 | G405: 17.20 | H405: 16.60 | I405: 25.20 | J405: 17.20 | K405: 17.30 | L405: 16.90 | M405: 25.70 | N405: 84.50 | O405: 0.0 | P405: 84.50
A406: Knights | C406: =RANK(C405,(C$6,C$8,C$10,C$12,C$14,C$16,C$18,C$20,C$22,C$24,C$26,C$28,C$30,C$32,C$34,C$36,C$38,C$40,C$42,C$44,C$46,C$48,C$50,C$52,C$54,C$56,C$58,C$60,C$62,C$64,C$66,C$68,C$70,C$72,C$74,C$76,C$78,C$80,C$82,C$84,C$86,C$88,C$90,C$92,C$94,C$96,C$98,C$100,C$102,C$104,C$106,C$108,C$110,C$112,C$114,C$116,C$118,C$120,C$122,C$124)) -> 3 | D406: =RANK(D405,(D$6,D$8,D$10,D$12,D$14,D$16,D$18,D$20,D$22,D$24,D$26,D$28,D$30,D$32,D$34,D$36,D$38,D$40,D$42,D$44,D$46,D$48,D$50,D$52,D$54,D$56,D$58,D$60,D$62,D$64,D$66,D$68,D$70,D$72,D$74,D$76,D$78,D$80,D$82,D$84,D$86,D$88,D$90,D$92,D$94,D$96,D$98,D$100,D$102,D$104,D$106,D$108,D$110,D$112,D$114,D$116,D$118,D$120,D$122,D$124)) -> 4 | E406: =RANK(E405,(E$6,E$8,E$10,E$12,E$14,E$16,E$18,E$20,E$22,E$24,E$26,E$28,E$30,E$32,E$34,E$36,E$38,E$40,E$42,E$44,E$46,E$48,E$50,E$52,E$54,E$56,E$58,E$60,E$62,E$64,E$66,E$68,E$70,E$72,E$74,E$76,E$78,E$80,E$82,E$84,E$86,E$88,E$90,E$92,E$94,E$96,E$98,E$100,E$102,E$104,E$106,E$108,E$110,E$112,E$114,E$116,E$118,E$120,E$122,E$124)) -> 3 | F406: =RANK(F405,(F$6,F$8,F$10,F$12,F$14,F$16,F$18,F$20,F$22,F$24,F$26,F$28,F$30,F$32,F$34,F$36,F$38,F$40,F$42,F$44,F$46,F$48,F$50,F$52,F$54,F$56,F$58,F$60,F$62,F$64,F$66,F$68,F$70,F$72,F$74,F$76,F$78,F$80,F$82,F$84,F$86,F$88,F$90,F$92,F$94,F$96,F$98,F$100,F$102,F$104,F$106,F$108,F$110,F$112,F$114,F$116,F$118,F$120,F$122,F$124)) -> 3 | G406: =RANK(G405,(G$6,G$8,G$10,G$12,G$14,G$16,G$18,G$20,G$22,G$24,G$26,G$28,G$30,G$32,G$34,G$36,G$38,G$40,G$42,G$44,G$46,G$48,G$50,G$52,G$54,G$56,G$58,G$60,G$62,G$64,G$66,G$68,G$70,G$72,G$74,G$76,G$78,G$80,G$82,G$84,G$86,G$88,G$90,G$92,G$94,G$96,G$98,G$100,G$102,G$104,G$106,G$108,G$110,G$112,G$114,G$116,G$118,G$120,G$122,G$124)) -> 3 | H406: =RANK(H405,(H$6,H$8,H$10,H$12,H$14,H$16,H$18,H$20,H$22,H$24,H$26,H$28,H$30,H$32,H$34,H$36,H$38,H$40,H$42,H$44,H$46,H$48,H$50,H$52,H$54,H$56,H$58,H$60,H$62,H$64,H$66,H$68,H$70,H$72,H$74,H$76,H$78,H$80,H$82,H$84,H$86,H$88,H$90,H$92,H$94,H$96,H$98,H$100,H$102,H$104,H$106,H$108,H$110,H$112,H$114,H$116,H$118,H$120,H$122,H$124)) -> 3 | I406: =RANK(I405,(I$6,I$8,I$10,I$12,I$14,I$16,I$18,I$20,I$22,I$24,I$26,I$28,I$30,I$32,I$34,I$36,I$38,I$40,I$42,I$44,I$46,I$48,I$50,I$52,I$54,I$56,I$58,I$60,I$62,I$64,I$66,I$68,I$70,I$72,I$74,I$76,I$78,I$80,I$82,I$84,I$86,I$88,I$90,I$92,I$94,I$96,I$98,I$100,I$102,I$104,I$106,I$108,I$110,I$112,I$114,I$116,I$118,I$120,I$122,I$124)) -> 3 | J406: =RANK(J405,(J$6,J$8,J$10,J$12,J$14,J$16,J$18,J$20,J$22,J$24,J$26,J$28,J$30,J$32,J$34,J$36,J$38,J$40,J$42,J$44,J$46,J$48,J$50,J$52,J$54,J$56,J$58,J$60,J$62,J$64,J$66,J$68,J$70,J$72,J$74,J$76,J$78,J$80,J$82,J$84,J$86,J$88,J$90,J$92,J$94,J$96,J$98,J$100,J$102,J$104,J$106,J$108,J$110,J$112,J$114,J$116,J$118,J$120,J$122,J$124)) -> 3 | K406: =RANK(K405,(K$6,K$8,K$10,K$12,K$14,K$16,K$18,K$20,K$22,K$24,K$26,K$28,K$30,K$32,K$34,K$36,K$38,K$40,K$42,K$44,K$46,K$48,K$50,K$52,K$54,K$56,K$58,K$60,K$62,K$64,K$66,K$68,K$70,K$72,K$74,K$76,K$78,K$80,K$82,K$84,K$86,K$88,K$90,K$92,K$94,K$96,K$98,K$100,K$102,K$104,K$106,K$108,K$110,K$112,K$114,K$116,K$118,K$120,K$122,K$124)) -> 3 | L406: =RANK(L405,(L$6,L$8,L$10,L$12,L$14,L$16,L$18,L$20,L$22,L$24,L$26,L$28,L$30,L$32,L$34,L$36,L$38,L$40,L$42,L$44,L$46,L$48,L$50,L$52,L$54,L$56,L$58,L$60,L$62,L$64,L$66,L$68,L$70,L$72,L$74,L$76,L$78,L$80,L$82,L$84,L$86,L$88,L$90,L$92,L$94,L$96,L$98,L$100,L$102,L$104,L$106,L$108,L$110,L$112,L$114,L$116,L$118,L$120,L$122,L$124)) -> 4 | M406: =RANK(M405,(M$6,M$8,M$10,M$12,M$14,M$16,M$18,M$20,M$22,M$24,M$26,M$28,M$30,M$32,M$34,M$36,M$38,M$40,M$42,M$44,M$46,M$48,M$50,M$52,M$54,M$56,M$58,M$60,M$62,M$64,M$66,M$68,M$70,M$72,M$74,M$76,M$78,M$80,M$82,M$84,M$86,M$88,M$90,M$92,M$94,M$96,M$98,M$100,M$102,M$104,M$106,M$108,M$110,M$112,M$114,M$116,M$118,M$120,M$122,M$124)) -> 3 | N406: =RANK(N405,(N$6,N$8,N$10,N$12,N$14,N$16,N$18,N$20,N$22,N$24,N$26,N$28,N$30,N$32,N$34,N$36,N$38,N$40,N$42,N$44,N$46,N$48,N$50,N$52,N$54,N$56,N$58,N$60,N$62,N$64,N$66,N$68,N$70,N$72,N$74,N$76,N$78,N$80,N$82,N$84,N$86,N$88,N$90,N$92,N$94,N$96,N$98,N$100,N$102,N$104,N$106,N$108,N$110,N$112,N$114,N$116,N$118,N$120,N$122,N$124)) -> 3 | P406: =RANK(P405,(P$6,P$8,P$10,P$12,P$14,P$16,P$18,P$20,P$22,P$24,P$26,P$28,P$30,P$32,P$34,P$36,P$38,P$40,P$42,P$44,P$46,P$48,P$50,P$52,P$54,P$56,P$58,P$60,P$62,P$64,P$66,P$68,P$70,P$72,P$74,P$76,P$78,P$80,P$82,P$84,P$86,P$88,P$90,P$92,P$94,P$96,P$98,P$100,P$102,P$104,P$106,P$108,P$110,P$112,P$114,P$116,P$118,P$120,P$122,P$124)) -> 3
A407: Troopers | B407: 2 | C407: 16.90 | D407: 16.70 | E407: 33.60 | F407: 16.30 | G407: 16.90 | H407: 15.90 | I407: 24.55 | J407: 16.30 | K407: 16.80 | L407: 17.70 | M407: 25.40 | N407: 83.55 | O407: 0.0 | P407: 83.55
C408: =RANK(C407,(C$6,C$8,C$10,C$12,C$14,C$16,C$18,C$20,C$22,C$24,C$26,C$28,C$30,C$32,C$34,C$36,C$38,C$40,C$42,C$44,C$46,C$48,C$50,C$52,C$54,C$56,C$58,C$60,C$62,C$64,C$66,C$68,C$70,C$72,C$74,C$76,C$78,C$80,C$82,C$84,C$86,C$88,C$90,C$92,C$94,C$96,C$98,C$100,C$102,C$104,C$106,C$108,C$110,C$112,C$114,C$116,C$118,C$120,C$122,C$124)) -> 4 | D408: =RANK(D407,(D$6,D$8,D$10,D$12,D$14,D$16,D$18,D$20,D$22,D$24,D$26,D$28,D$30,D$32,D$34,D$36,D$38,D$40,D$42,D$44,D$46,D$48,D$50,D$52,D$54,D$56,D$58,D$60,D$62,D$64,D$66,D$68,D$70,D$72,D$74,D$76,D$78,D$80,D$82,D$84,D$86,D$88,D$90,D$92,D$94,D$96,D$98,D$100,D$102,D$104,D$106,D$108,D$110,D$112,D$114,D$116,D$118,D$120,D$122,D$124)) -> 3 | E408: =RANK(E407,(E$6,E$8,E$10,E$12,E$14,E$16,E$18,E$20,E$22,E$24,E$26,E$28,E$30,E$32,E$34,E$36,E$38,E$40,E$42,E$44,E$46,E$48,E$50,E$52,E$54,E$56,E$58,E$60,E$62,E$64,E$66,E$68,E$70,E$72,E$74,E$76,E$78,E$80,E$82,E$84,E$86,E$88,E$90,E$92,E$94,E$96,E$98,E$100,E$102,E$104,E$106,E$108,E$110,E$112,E$114,E$116,E$118,E$120,E$122,E$124)) -> 3 | F408: =RANK(F407,(F$6,F$8,F$10,F$12,F$14,F$16,F$18,F$20,F$22,F$24,F$26,F$28,F$30,F$32,F$34,F$36,F$38,F$40,F$42,F$44,F$46,F$48,F$50,F$52,F$54,F$56,F$58,F$60,F$62,F$64,F$66,F$68,F$70,F$72,F$74,F$76,F$78,F$80,F$82,F$84,F$86,F$88,F$90,F$92,F$94,F$96,F$98,F$100,F$102,F$104,F$106,F$108,F$110,F$112,F$114,F$116,F$118,F$120,F$122,F$124)) -> 4 | G408: =RANK(G407,(G$6,G$8,G$10,G$12,G$14,G$16,G$18,G$20,G$22,G$24,G$26,G$28,G$30,G$32,G$34,G$36,G$38,G$40,G$42,G$44,G$46,G$48,G$50,G$52,G$54,G$56,G$58,G$60,G$62,G$64,G$66,G$68,G$70,G$72,G$74,G$76,G$78,G$80,G$82,G$84,G$86,G$88,G$90,G$92,G$94,G$96,G$98,G$100,G$102,G$104,G$106,G$108,G$110,G$112,G$114,G$116,G$118,G$120,G$122,G$124)) -> 4 | H408: =RANK(H407,(H$6,H$8,H$10,H$12,H$14,H$16,H$18,H$20,H$22,H$24,H$26,H$28,H$30,H$32,H$34,H$36,H$38,H$40,H$42,H$44,H$46,H$48,H$50,H$52,H$54,H$56,H$58,H$60,H$62,H$64,H$66,H$68,H$70,H$72,H$74,H$76,H$78,H$80,H$82,H$84,H$86,H$88,H$90,H$92,H$94,H$96,H$98,H$100,H$102,H$104,H$106,H$108,H$110,H$112,H$114,H$116,H$118,H$120,H$122,H$124)) -> 4 | I408: =RANK(I407,(I$6,I$8,I$10,I$12,I$14,I$16,I$18,I$20,I$22,I$24,I$26,I$28,I$30,I$32,I$34,I$36,I$38,I$40,I$42,I$44,I$46,I$48,I$50,I$52,I$54,I$56,I$58,I$60,I$62,I$64,I$66,I$68,I$70,I$72,I$74,I$76,I$78,I$80,I$82,I$84,I$86,I$88,I$90,I$92,I$94,I$96,I$98,I$100,I$102,I$104,I$106,I$108,I$110,I$112,I$114,I$116,I$118,I$120,I$122,I$124)) -> 4 | J408: =RANK(J407,(J$6,J$8,J$10,J$12,J$14,J$16,J$18,J$20,J$22,J$24,J$26,J$28,J$30,J$32,J$34,J$36,J$38,J$40,J$42,J$44,J$46,J$48,J$50,J$52,J$54,J$56,J$58,J$60,J$62,J$64,J$66,J$68,J$70,J$72,J$74,J$76,J$78,J$80,J$82,J$84,J$86,J$88,J$90,J$92,J$94,J$96,J$98,J$100,J$102,J$104,J$106,J$108,J$110,J$112,J$114,J$116,J$118,J$120,J$122,J$124)) -> 4 | K408: =RANK(K407,(K$6,K$8,K$10,K$12,K$14,K$16,K$18,K$20,K$22,K$24,K$26,K$28,K$30,K$32,K$34,K$36,K$38,K$40,K$42,K$44,K$46,K$48,K$50,K$52,K$54,K$56,K$58,K$60,K$62,K$64,K$66,K$68,K$70,K$72,K$74,K$76,K$78,K$80,K$82,K$84,K$86,K$88,K$90,K$92,K$94,K$96,K$98,K$100,K$102,K$104,K$106,K$108,K$110,K$112,K$114,K$116,K$118,K$120,K$122,K$124)) -> 4 | L408: =RANK(L407,(L$6,L$8,L$10,L$12,L$14,L$16,L$18,L$20,L$22,L$24,L$26,L$28,L$30,L$32,L$34,L$36,L$38,L$40,L$42,L$44,L$46,L$48,L$50,L$52,L$54,L$56,L$58,L$60,L$62,L$64,L$66,L$68,L$70,L$72,L$74,L$76,L$78,L$80,L$82,L$84,L$86,L$88,L$90,L$92,L$94,L$96,L$98,L$100,L$102,L$104,L$106,L$108,L$110,L$112,L$114,L$116,L$118,L$120,L$122,L$124)) -> 3 | M408: =RANK(M407,(M$6,M$8,M$10,M$12,M$14,M$16,M$18,M$20,M$22,M$24,M$26,M$28,M$30,M$32,M$34,M$36,M$38,M$40,M$42,M$44,M$46,M$48,M$50,M$52,M$54,M$56,M$58,M$60,M$62,M$64,M$66,M$68,M$70,M$72,M$74,M$76,M$78,M$80,M$82,M$84,M$86,M$88,M$90,M$92,M$94,M$96,M$98,M$100,M$102,M$104,M$106,M$108,M$110,M$112,M$114,M$116,M$118,M$120,M$122,M$124)) -> 4 | N408: =RANK(N407,(N$6,N$8,N$10,N$12,N$14,N$16,N$18,N$20,N$22,N$24,N$26,N$28,N$30,N$32,N$34,N$36,N$38,N$40,N$42,N$44,N$46,N$48,N$50,N$52,N$54,N$56,N$58,N$60,N$62,N$64,N$66,N$68,N$70,N$72,N$74,N$76,N$78,N$80,N$82,N$84,N$86,N$88,N$90,N$92,N$94,N$96,N$98,N$100,N$102,N$104,N$106,N$108,N$110,N$112,N$114,N$116,N$118,N$120,N$122,N$124)) -> 4 | P408: =RANK(P407,(P$6,P$8,P$10,P$12,P$14,P$16,P$18,P$20,P$22,P$24,P$26,P$28,P$30,P$32,P$34,P$36,P$38,P$40,P$42,P$44,P$46,P$48,P$50,P$52,P$54,P$56,P$58,P$60,P$62,P$64,P$66,P$68,P$70,P$72,P$74,P$76,P$78,P$80,P$82,P$84,P$86,P$88,P$90,P$92,P$94,P$96,P$98,P$100,P$102,P$104,P$106,P$108,P$110,P$112,P$114,P$116,P$118,P$120,P$122,P$124)) -> 4
A409: Pacific | B409: 1 | C409: 14.80 | D409: 15.30 | E409: 30.10 | F409: 15.70 | G409: 15.40 | H409: 15.00 | I409: 23.05 | J409: 15.40 | K409: 16.00 | L409: 15.60 | M409: 23.50 | N409: 76.65 | O409: 0.0 | P409: 76.65
A410: Crest | C410: =RANK(C409,(C$6,C$8,C$10,C$12,C$14,C$16,C$18,C$20,C$22,C$24,C$26,C$28,C$30,C$32,C$34,C$36,C$38,C$40,C$42,C$44,C$46,C$48,C$50,C$52,C$54,C$56,C$58,C$60,C$62,C$64,C$66,C$68,C$70,C$72,C$74,C$76,C$78,C$80,C$82,C$84,C$86,C$88,C$90,C$92,C$94,C$96,C$98,C$100,C$102,C$104,C$106,C$108,C$110,C$112,C$114,C$116,C$118,C$120,C$122,C$124)) -> 5 | D410: =RANK(D409,(D$6,D$8,D$10,D$12,D$14,D$16,D$18,D$20,D$22,D$24,D$26,D$28,D$30,D$32,D$34,D$36,D$38,D$40,D$42,D$44,D$46,D$48,D$50,D$52,D$54,D$56,D$58,D$60,D$62,D$64,D$66,D$68,D$70,D$72,D$74,D$76,D$78,D$80,D$82,D$84,D$86,D$88,D$90,D$92,D$94,D$96,D$98,D$100,D$102,D$104,D$106,D$108,D$110,D$112,D$114,D$116,D$118,D$120,D$122,D$124)) -> 5 | E410: =RANK(E409,(E$6,E$8,E$10,E$12,E$14,E$16,E$18,E$20,E$22,E$24,E$26,E$28,E$30,E$32,E$34,E$36,E$38,E$40,E$42,E$44,E$46,E$48,E$50,E$52,E$54,E$56,E$58,E$60,E$62,E$64,E$66,E$68,E$70,E$72,E$74,E$76,E$78,E$80,E$82,E$84,E$86,E$88,E$90,E$92,E$94,E$96,E$98,E$100,E$102,E$104,E$106,E$108,E$110,E$112,E$114,E$116,E$118,E$120,E$122,E$124)) -> 5 | F410: =RANK(F409,(F$6,F$8,F$10,F$12,F$14,F$16,F$18,F$20,F$22,F$24,F$26,F$28,F$30,F$32,F$34,F$36,F$38,F$40,F$42,F$44,F$46,F$48,F$50,F$52,F$54,F$56,F$58,F$60,F$62,F$64,F$66,F$68,F$70,F$72,F$74,F$76,F$78,F$80,F$82,F$84,F$86,F$88,F$90,F$92,F$94,F$96,F$98,F$100,F$102,F$104,F$106,F$108,F$110,F$112,F$114,F$116,F$118,F$120,F$122,F$124)) -> 5 | G410: =RANK(G409,(G$6,G$8,G$10,G$12,G$14,G$16,G$18,G$20,G$22,G$24,G$26,G$28,G$30,G$32,G$34,G$36,G$38,G$40,G$42,G$44,G$46,G$48,G$50,G$52,G$54,G$56,G$58,G$60,G$62,G$64,G$66,G$68,G$70,G$72,G$74,G$76,G$78,G$80,G$82,G$84,G$86,G$88,G$90,G$92,G$94,G$96,G$98,G$100,G$102,G$104,G$106,G$108,G$110,G$112,G$114,G$116,G$118,G$120,G$122,G$124)) -> 5 | H410: =RANK(H409,(H$6,H$8,H$10,H$12,H$14,H$16,H$18,H$20,H$22,H$24,H$26,H$28,H$30,H$32,H$34,H$36,H$38,H$40,H$42,H$44,H$46,H$48,H$50,H$52,H$54,H$56,H$58,H$60,H$62,H$64,H$66,H$68,H$70,H$72,H$74,H$76,H$78,H$80,H$82,H$84,H$86,H$88,H$90,H$92,H$94,H$96,H$98,H$100,H$102,H$104,H$106,H$108,H$110,H$112,H$114,H$116,H$118,H$120,H$122,H$124)) -> 5 | I410: =RANK(I409,(I$6,I$8,I$10,I$12,I$14,I$16,I$18,I$20,I$22,I$24,I$26,I$28,I$30,I$32,I$34,I$36,I$38,I$40,I$42,I$44,I$46,I$48,I$50,I$52,I$54,I$56,I$58,I$60,I$62,I$64,I$66,I$68,I$70,I$72,I$74,I$76,I$78,I$80,I$82,I$84,I$86,I$88,I$90,I$92,I$94,I$96,I$98,I$100,I$102,I$104,I$106,I$108,I$110,I$112,I$114,I$116,I$118,I$120,I$122,I$124)) -> 5 | J410: =RANK(J409,(J$6,J$8,J$10,J$12,J$14,J$16,J$18,J$20,J$22,J$24,J$26,J$28,J$30,J$32,J$34,J$36,J$38,J$40,J$42,J$44,J$46,J$48,J$50,J$52,J$54,J$56,J$58,J$60,J$62,J$64,J$66,J$68,J$70,J$72,J$74,J$76,J$78,J$80,J$82,J$84,J$86,J$88,J$90,J$92,J$94,J$96,J$98,J$100,J$102,J$104,J$106,J$108,J$110,J$112,J$114,J$116,J$118,J$120,J$122,J$124)) -> 5 | K410: =RANK(K409,(K$6,K$8,K$10,K$12,K$14,K$16,K$18,K$20,K$22,K$24,K$26,K$28,K$30,K$32,K$34,K$36,K$38,K$40,K$42,K$44,K$46,K$48,K$50,K$52,K$54,K$56,K$58,K$60,K$62,K$64,K$66,K$68,K$70,K$72,K$74,K$76,K$78,K$80,K$82,K$84,K$86,K$88,K$90,K$92,K$94,K$96,K$98,K$100,K$102,K$104,K$106,K$108,K$110,K$112,K$114,K$116,K$118,K$120,K$122,K$124)) -> 5 | L410: =RANK(L409,(L$6,L$8,L$10,L$12,L$14,L$16,L$18,L$20,L$22,L$24,L$26,L$28,L$30,L$32,L$34,L$36,L$38,L$40,L$42,L$44,L$46,L$48,L$50,L$52,L$54,L$56,L$58,L$60,L$62,L$64,L$66,L$68,L$70,L$72,L$74,L$76,L$78,L$80,L$82,L$84,L$86,L$88,L$90,L$92,L$94,L$96,L$98,L$100,L$102,L$104,L$106,L$108,L$110,L$112,L$114,L$116,L$118,L$120,L$122,L$124)) -> 5 | M410: =RANK(M409,(M$6,M$8,M$10,M$12,M$14,M$16,M$18,M$20,M$22,M$24,M$26,M$28,M$30,M$32,M$34,M$36,M$38,M$40,M$42,M$44,M$46,M$48,M$50,M$52,M$54,M$56,M$58,M$60,M$62,M$64,M$66,M$68,M$70,M$72,M$74,M$76,M$78,M$80,M$82,M$84,M$86,M$88,M$90,M$92,M$94,M$96,M$98,M$100,M$102,M$104,M$106,M$108,M$110,M$112,M$114,M$116,M$118,M$120,M$122,M$124)) -> 5 | N410: =RANK(N409,(N$6,N$8,N$10,N$12,N$14,N$16,N$18,N$20,N$22,N$24,N$26,N$28,N$30,N$32,N$34,N$36,N$38,N$40,N$42,N$44,N$46,N$48,N$50,N$52,N$54,N$56,N$58,N$60,N$62,N$64,N$66,N$68,N$70,N$72,N$74,N$76,N$78,N$80,N$82,N$84,N$86,N$88,N$90,N$92,N$94,N$96,N$98,N$100,N$102,N$104,N$106,N$108,N$110,N$112,N$114,N$116,N$118,N$120,N$122,N$124)) -> 5 | P410: =RANK(P409,(P$6,P$8,P$10,P$12,P$14,P$16,P$18,P$20,P$22,P$24,P$26,P$28,P$30,P$32,P$34,P$36,P$38,P$40,P$42,P$44,P$46,P$48,P$50,P$52,P$54,P$56,P$58,P$60,P$62,P$64,P$66,P$68,P$70,P$72,P$74,P$76,P$78,P$80,P$82,P$84,P$86,P$88,P$90,P$92,P$94,P$96,P$98,P$100,P$102,P$104,P$106,P$108,P$110,P$112,P$114,P$116,P$118,P$120,P$122,P$124)) -> 5
A413: 8/8/2022 Cincinnati, Ohio
C414: General Effect | F414: Visual | J414: Music
C415: 1 | D415: 2 | F415: Proficiency | G415: Analysis | H415: Color Guard | J415: Brass | K415: Analysis | L415: Percussion | N415: Sub | P415: Total
C416: C. Quamme | D416: R. Greenwell | E416: Total | F416: D. Deems | G416: J. Pursifull | H416: D. Padilla | I416: Total ÷2 | J416: M. Rubino | K416: A. Brown | L416: M. Leitzke | M416: Total ÷2 | N416: Total | O416: Pen | P416: Score
A417: DCI World Class | C417: 20 | D417: 20 | E417: 40 | F417: 20 | G417: 20 | H417: 20 | I417: 30 | J417: 20 | K417: 20 | L417: 20 | M417: 30 | N417: 100 | P417: 100
A418: Vanguard | B418: 6 | C418: 18.80 | D418: 18.50 | E418: 37.30 | F418: 18.60 | G418: 18.80 | H418: 18.40 | I418: 27.90 | J418: 18.20 | K418: 18.60 | L418: 18.90 | M418: 27.85 | N418: 93.05 | O418: 0.0 | P418: 93.05
C419: =RANK(C418,(C$6,C$8,C$10,C$12,C$14,C$16,C$18,C$20,C$22,C$24,C$26,C$28,C$30,C$32,C$34,C$36,C$38,C$40,C$42,C$44,C$46,C$48,C$50,C$52,C$54,C$56,C$58,C$60,C$62,C$64,C$66,C$68,C$70,C$72,C$74,C$76,C$78,C$80,C$82,C$84,C$86,C$88,C$90,C$92,C$94,C$96,C$98,C$100,C$102,C$104,C$106,C$108,C$110,C$112,C$114,C$116,C$118,C$120,C$122,C$124)) -> 1 | D419: =RANK(D418,(D$6,D$8,D$10,D$12,D$14,D$16,D$18,D$20,D$22,D$24,D$26,D$28,D$30,D$32,D$34,D$36,D$38,D$40,D$42,D$44,D$46,D$48,D$50,D$52,D$54,D$56,D$58,D$60,D$62,D$64,D$66,D$68,D$70,D$72,D$74,D$76,D$78,D$80,D$82,D$84,D$86,D$88,D$90,D$92,D$94,D$96,D$98,D$100,D$102,D$104,D$106,D$108,D$110,D$112,D$114,D$116,D$118,D$120,D$122,D$124)) -> 1 | E419: =RANK(E418,(E$6,E$8,E$10,E$12,E$14,E$16,E$18,E$20,E$22,E$24,E$26,E$28,E$30,E$32,E$34,E$36,E$38,E$40,E$42,E$44,E$46,E$48,E$50,E$52,E$54,E$56,E$58,E$60,E$62,E$64,E$66,E$68,E$70,E$72,E$74,E$76,E$78,E$80,E$82,E$84,E$86,E$88,E$90,E$92,E$94,E$96,E$98,E$100,E$102,E$104,E$106,E$108,E$110,E$112,E$114,E$116,E$118,E$120,E$122,E$124)) -> 1 | F419: =RANK(F418,(F$6,F$8,F$10,F$12,F$14,F$16,F$18,F$20,F$22,F$24,F$26,F$28,F$30,F$32,F$34,F$36,F$38,F$40,F$42,F$44,F$46,F$48,F$50,F$52,F$54,F$56,F$58,F$60,F$62,F$64,F$66,F$68,F$70,F$72,F$74,F$76,F$78,F$80,F$82,F$84,F$86,F$88,F$90,F$92,F$94,F$96,F$98,F$100,F$102,F$104,F$106,F$108,F$110,F$112,F$114,F$116,F$118,F$120,F$122,F$124)) -> 2 | G419: =RANK(G418,(G$6,G$8,G$10,G$12,G$14,G$16,G$18,G$20,G$22,G$24,G$26,G$28,G$30,G$32,G$34,G$36,G$38,G$40,G$42,G$44,G$46,G$48,G$50,G$52,G$54,G$56,G$58,G$60,G$62,G$64,G$66,G$68,G$70,G$72,G$74,G$76,G$78,G$80,G$82,G$84,G$86,G$88,G$90,G$92,G$94,G$96,G$98,G$100,G$102,G$104,G$106,G$108,G$110,G$112,G$114,G$116,G$118,G$120,G$122,G$124)) -> 1 | H419: =RANK(H418,(H$6,H$8,H$10,H$12,H$14,H$16,H$18,H$20,H$22,H$24,H$26,H$28,H$30,H$32,H$34,H$36,H$38,H$40,H$42,H$44,H$46,H$48,H$50,H$52,H$54,H$56,H$58,H$60,H$62,H$64,H$66,H$68,H$70,H$72,H$74,H$76,H$78,H$80,H$82,H$84,H$86,H$88,H$90,H$92,H$94,H$96,H$98,H$100,H$102,H$104,H$106,H$108,H$110,H$112,H$114,H$116,H$118,H$120,H$122,H$124)) -> 1 | I419: =RANK(I418,(I$6,I$8,I$10,I$12,I$14,I$16,I$18,I$20,I$22,I$24,I$26,I$28,I$30,I$32,I$34,I$36,I$38,I$40,I$42,I$44,I$46,I$48,I$50,I$52,I$54,I$56,I$58,I$60,I$62,I$64,I$66,I$68,I$70,I$72,I$74,I$76,I$78,I$80,I$82,I$84,I$86,I$88,I$90,I$92,I$94,I$96,I$98,I$100,I$102,I$104,I$106,I$108,I$110,I$112,I$114,I$116,I$118,I$120,I$122,I$124)) -> 1 | J419: =RANK(J418,(J$6,J$8,J$10,J$12,J$14,J$16,J$18,J$20,J$22,J$24,J$26,J$28,J$30,J$32,J$34,J$36,J$38,J$40,J$42,J$44,J$46,J$48,J$50,J$52,J$54,J$56,J$58,J$60,J$62,J$64,J$66,J$68,J$70,J$72,J$74,J$76,J$78,J$80,J$82,J$84,J$86,J$88,J$90,J$92,J$94,J$96,J$98,J$100,J$102,J$104,J$106,J$108,J$110,J$112,J$114,J$116,J$118,J$120,J$122,J$124)) -> 2 | K419: =RANK(K418,(K$6,K$8,K$10,K$12,K$14,K$16,K$18,K$20,K$22,K$24,K$26,K$28,K$30,K$32,K$34,K$36,K$38,K$40,K$42,K$44,K$46,K$48,K$50,K$52,K$54,K$56,K$58,K$60,K$62,K$64,K$66,K$68,K$70,K$72,K$74,K$76,K$78,K$80,K$82,K$84,K$86,K$88,K$90,K$92,K$94,K$96,K$98,K$100,K$102,K$104,K$106,K$108,K$110,K$112,K$114,K$116,K$118,K$120,K$122,K$124)) -> 1 | L419: =RANK(L418,(L$6,L$8,L$10,L$12,L$14,L$16,L$18,L$20,L$22,L$24,L$26,L$28,L$30,L$32,L$34,L$36,L$38,L$40,L$42,L$44,L$46,L$48,L$50,L$52,L$54,L$56,L$58,L$60,L$62,L$64,L$66,L$68,L$70,L$72,L$74,L$76,L$78,L$80,L$82,L$84,L$86,L$88,L$90,L$92,L$94,L$96,L$98,L$100,L$102,L$104,L$106,L$108,L$110,L$112,L$114,L$116,L$118,L$120,L$122,L$124)) -> 1 | M419: =RANK(M418,(M$6,M$8,M$10,M$12,M$14,M$16,M$18,M$20,M$22,M$24,M$26,M$28,M$30,M$32,M$34,M$36,M$38,M$40,M$42,M$44,M$46,M$48,M$50,M$52,M$54,M$56,M$58,M$60,M$62,M$64,M$66,M$68,M$70,M$72,M$74,M$76,M$78,M$80,M$82,M$84,M$86,M$88,M$90,M$92,M$94,M$96,M$98,M$100,M$102,M$104,M$106,M$108,M$110,M$112,M$114,M$116,M$118,M$120,M$122,M$124)) -> 1 | N419: =RANK(N418,(N$6,N$8,N$10,N$12,N$14,N$16,N$18,N$20,N$22,N$24,N$26,N$28,N$30,N$32,N$34,N$36,N$38,N$40,N$42,N$44,N$46,N$48,N$50,N$52,N$54,N$56,N$58,N$60,N$62,N$64,N$66,N$68,N$70,N$72,N$74,N$76,N$78,N$80,N$82,N$84,N$86,N$88,N$90,N$92,N$94,N$96,N$98,N$100,N$102,N$104,N$106,N$108,N$110,N$112,N$114,N$116,N$118,N$120,N$122,N$124)) -> 1 | P419: =RANK(P418,(P$6,P$8,P$10,P$12,P$14,P$16,P$18,P$20,P$22,P$24,P$26,P$28,P$30,P$32,P$34,P$36,P$38,P$40,P$42,P$44,P$46,P$48,P$50,P$52,P$54,P$56,P$58,P$60,P$62,P$64,P$66,P$68,P$70,P$72,P$74,P$76,P$78,P$80,P$82,P$84,P$86,P$88,P$90,P$92,P$94,P$96,P$98,P$100,P$102,P$104,P$106,P$108,P$110,P$112,P$114,P$116,P$118,P$120,P$122,P$124)) -> 1
A420: Cadets | B420: 5 | C420: 18.40 | D420: 18.30 | E420: 36.70 | F420: 18.70 | G420: 18.40 | H420: 18.20 | I420: 27.65 | J420: 18.30 | K420: 18.30 | L420: 18.10 | M420: 27.35 | N420: 91.70 | O420: 0.0 | P420: 91.70
C421: =RANK(C420,(C$6,C$8,C$10,C$12,C$14,C$16,C$18,C$20,C$22,C$24,C$26,C$28,C$30,C$32,C$34,C$36,C$38,C$40,C$42,C$44,C$46,C$48,C$50,C$52,C$54,C$56,C$58,C$60,C$62,C$64,C$66,C$68,C$70,C$72,C$74,C$76,C$78,C$80,C$82,C$84,C$86,C$88,C$90,C$92,C$94,C$96,C$98,C$100,C$102,C$104,C$106,C$108,C$110,C$112,C$114,C$116,C$118,C$120,C$122,C$124)) -> 2 | D421: =RANK(D420,(D$6,D$8,D$10,D$12,D$14,D$16,D$18,D$20,D$22,D$24,D$26,D$28,D$30,D$32,D$34,D$36,D$38,D$40,D$42,D$44,D$46,D$48,D$50,D$52,D$54,D$56,D$58,D$60,D$62,D$64,D$66,D$68,D$70,D$72,D$74,D$76,D$78,D$80,D$82,D$84,D$86,D$88,D$90,D$92,D$94,D$96,D$98,D$100,D$102,D$104,D$106,D$108,D$110,D$112,D$114,D$116,D$118,D$120,D$122,D$124)) -> 2 | E421: =RANK(E420,(E$6,E$8,E$10,E$12,E$14,E$16,E$18,E$20,E$22,E$24,E$26,E$28,E$30,E$32,E$34,E$36,E$38,E$40,E$42,E$44,E$46,E$48,E$50,E$52,E$54,E$56,E$58,E$60,E$62,E$64,E$66,E$68,E$70,E$72,E$74,E$76,E$78,E$80,E$82,E$84,E$86,E$88,E$90,E$92,E$94,E$96,E$98,E$100,E$102,E$104,E$106,E$108,E$110,E$112,E$114,E$116,E$118,E$120,E$122,E$124)) -> 2 | F421: =RANK(F420,(F$6,F$8,F$10,F$12,F$14,F$16,F$18,F$20,F$22,F$24,F$26,F$28,F$30,F$32,F$34,F$36,F$38,F$40,F$42,F$44,F$46,F$48,F$50,F$52,F$54,F$56,F$58,F$60,F$62,F$64,F$66,F$68,F$70,F$72,F$74,F$76,F$78,F$80,F$82,F$84,F$86,F$88,F$90,F$92,F$94,F$96,F$98,F$100,F$102,F$104,F$106,F$108,F$110,F$112,F$114,F$116,F$118,F$120,F$122,F$124)) -> 1 | G421: =RANK(G420,(G$6,G$8,G$10,G$12,G$14,G$16,G$18,G$20,G$22,G$24,G$26,G$28,G$30,G$32,G$34,G$36,G$38,G$40,G$42,G$44,G$46,G$48,G$50,G$52,G$54,G$56,G$58,G$60,G$62,G$64,G$66,G$68,G$70,G$72,G$74,G$76,G$78,G$80,G$82,G$84,G$86,G$88,G$90,G$92,G$94,G$96,G$98,G$100,G$102,G$104,G$106,G$108,G$110,G$112,G$114,G$116,G$118,G$120,G$122,G$124)) -> 2 | H421: =RANK(H420,(H$6,H$8,H$10,H$12,H$14,H$16,H$18,H$20,H$22,H$24,H$26,H$28,H$30,H$32,H$34,H$36,H$38,H$40,H$42,H$44,H$46,H$48,H$50,H$52,H$54,H$56,H$58,H$60,H$62,H$64,H$66,H$68,H$70,H$72,H$74,H$76,H$78,H$80,H$82,H$84,H$86,H$88,H$90,H$92,H$94,H$96,H$98,H$100,H$102,H$104,H$106,H$108,H$110,H$112,H$114,H$116,H$118,H$120,H$122,H$124)) -> 2 | I421: =RANK(I420,(I$6,I$8,I$10,I$12,I$14,I$16,I$18,I$20,I$22,I$24,I$26,I$28,I$30,I$32,I$34,I$36,I$38,I$40,I$42,I$44,I$46,I$48,I$50,I$52,I$54,I$56,I$58,I$60,I$62,I$64,I$66,I$68,I$70,I$72,I$74,I$76,I$78,I$80,I$82,I$84,I$86,I$88,I$90,I$92,I$94,I$96,I$98,I$100,I$102,I$104,I$106,I$108,I$110,I$112,I$114,I$116,I$118,I$120,I$122,I$124)) -> 2 | J421: =RANK(J420,(J$6,J$8,J$10,J$12,J$14,J$16,J$18,J$20,J$22,J$24,J$26,J$28,J$30,J$32,J$34,J$36,J$38,J$40,J$42,J$44,J$46,J$48,J$50,J$52,J$54,J$56,J$58,J$60,J$62,J$64,J$66,J$68,J$70,J$72,J$74,J$76,J$78,J$80,J$82,J$84,J$86,J$88,J$90,J$92,J$94,J$96,J$98,J$100,J$102,J$104,J$106,J$108,J$110,J$112,J$114,J$116,J$118,J$120,J$122,J$124)) -> 1 | K421: =RANK(K420,(K$6,K$8,K$10,K$12,K$14,K$16,K$18,K$20,K$22,K$24,K$26,K$28,K$30,K$32,K$34,K$36,K$38,K$40,K$42,K$44,K$46,K$48,K$50,K$52,K$54,K$56,K$58,K$60,K$62,K$64,K$66,K$68,K$70,K$72,K$74,K$76,K$78,K$80,K$82,K$84,K$86,K$88,K$90,K$92,K$94,K$96,K$98,K$100,K$102,K$104,K$106,K$108,K$110,K$112,K$114,K$116,K$118,K$120,K$122,K$124)) -> 2 | L421: =RANK(L420,(L$6,L$8,L$10,L$12,L$14,L$16,L$18,L$20,L$22,L$24,L$26,L$28,L$30,L$32,L$34,L$36,L$38,L$40,L$42,L$44,L$46,L$48,L$50,L$52,L$54,L$56,L$58,L$60,L$62,L$64,L$66,L$68,L$70,L$72,L$74,L$76,L$78,L$80,L$82,L$84,L$86,L$88,L$90,L$92,L$94,L$96,L$98,L$100,L$102,L$104,L$106,L$108,L$110,L$112,L$114,L$116,L$118,L$120,L$122,L$124)) -> 2 | M421: =RANK(M420,(M$6,M$8,M$10,M$12,M$14,M$16,M$18,M$20,M$22,M$24,M$26,M$28,M$30,M$32,M$34,M$36,M$38,M$40,M$42,M$44,M$46,M$48,M$50,M$52,M$54,M$56,M$58,M$60,M$62,M$64,M$66,M$68,M$70,M$72,M$74,M$76,M$78,M$80,M$82,M$84,M$86,M$88,M$90,M$92,M$94,M$96,M$98,M$100,M$102,M$104,M$106,M$108,M$110,M$112,M$114,M$116,M$118,M$120,M$122,M$124)) -> 2 | N421: =RANK(N420,(N$6,N$8,N$10,N$12,N$14,N$16,N$18,N$20,N$22,N$24,N$26,N$28,N$30,N$32,N$34,N$36,N$38,N$40,N$42,N$44,N$46,N$48,N$50,N$52,N$54,N$56,N$58,N$60,N$62,N$64,N$66,N$68,N$70,N$72,N$74,N$76,N$78,N$80,N$82,N$84,N$86,N$88,N$90,N$92,N$94,N$96,N$98,N$100,N$102,N$104,N$106,N$108,N$110,N$112,N$114,N$116,N$118,N$120,N$122,N$124)) -> 2 | P421: =RANK(P420,(P$6,P$8,P$10,P$12,P$14,P$16,P$18,P$20,P$22,P$24,P$26,P$28,P$30,P$32,P$34,P$36,P$38,P$40,P$42,P$44,P$46,P$48,P$50,P$52,P$54,P$56,P$58,P$60,P$62,P$64,P$66,P$68,P$70,P$72,P$74,P$76,P$78,P$80,P$82,P$84,P$86,P$88,P$90,P$92,P$94,P$96,P$98,P$100,P$102,P$104,P$106,P$108,P$110,P$112,P$114,P$116,P$118,P$120,P$122,P$124)) -> 2
A422: Blue | B422: 4 | C422: 17.00 | D422: 16.80 | E422: 33.80 | F422: 16.90 | G422: 17.10 | H422: 16.70 | I422: 25.35 | J422: 17.40 | K422: 17.30 | L422: 16.90 | M422: 25.80 | N422: 84.95 | O422: 0.0 | P422: 84.95
A423: Knights | C423: =RANK(C422,(C$6,C$8,C$10,C$12,C$14,C$16,C$18,C$20,C$22,C$24,C$26,C$28,C$30,C$32,C$34,C$36,C$38,C$40,C$42,C$44,C$46,C$48,C$50,C$52,C$54,C$56,C$58,C$60,C$62,C$64,C$66,C$68,C$70,C$72,C$74,C$76,C$78,C$80,C$82,C$84,C$86,C$88,C$90,C$92,C$94,C$96,C$98,C$100,C$102,C$104,C$106,C$108,C$110,C$112,C$114,C$116,C$118,C$120,C$122,C$124)) -> 3 | D423: =RANK(D422,(D$6,D$8,D$10,D$12,D$14,D$16,D$18,D$20,D$22,D$24,D$26,D$28,D$30,D$32,D$34,D$36,D$38,D$40,D$42,D$44,D$46,D$48,D$50,D$52,D$54,D$56,D$58,D$60,D$62,D$64,D$66,D$68,D$70,D$72,D$74,D$76,D$78,D$80,D$82,D$84,D$86,D$88,D$90,D$92,D$94,D$96,D$98,D$100,D$102,D$104,D$106,D$108,D$110,D$112,D$114,D$116,D$118,D$120,D$122,D$124)) -> 4 | E423: =RANK(E422,(E$6,E$8,E$10,E$12,E$14,E$16,E$18,E$20,E$22,E$24,E$26,E$28,E$30,E$32,E$34,E$36,E$38,E$40,E$42,E$44,E$46,E$48,E$50,E$52,E$54,E$56,E$58,E$60,E$62,E$64,E$66,E$68,E$70,E$72,E$74,E$76,E$78,E$80,E$82,E$84,E$86,E$88,E$90,E$92,E$94,E$96,E$98,E$100,E$102,E$104,E$106,E$108,E$110,E$112,E$114,E$116,E$118,E$120,E$122,E$124)) -> 3 | F423: =RANK(F422,(F$6,F$8,F$10,F$12,F$14,F$16,F$18,F$20,F$22,F$24,F$26,F$28,F$30,F$32,F$34,F$36,F$38,F$40,F$42,F$44,F$46,F$48,F$50,F$52,F$54,F$56,F$58,F$60,F$62,F$64,F$66,F$68,F$70,F$72,F$74,F$76,F$78,F$80,F$82,F$84,F$86,F$88,F$90,F$92,F$94,F$96,F$98,F$100,F$102,F$104,F$106,F$108,F$110,F$112,F$114,F$116,F$118,F$120,F$122,F$124)) -> 4 | G423: =RANK(G422,(G$6,G$8,G$10,G$12,G$14,G$16,G$18,G$20,G$22,G$24,G$26,G$28,G$30,G$32,G$34,G$36,G$38,G$40,G$42,G$44,G$46,G$48,G$50,G$52,G$54,G$56,G$58,G$60,G$62,G$64,G$66,G$68,G$70,G$72,G$74,G$76,G$78,G$80,G$82,G$84,G$86,G$88,G$90,G$92,G$94,G$96,G$98,G$100,G$102,G$104,G$106,G$108,G$110,G$112,G$114,G$116,G$118,G$120,G$122,G$124)) -> 3 | H423: =RANK(H422,(H$6,H$8,H$10,H$12,H$14,H$16,H$18,H$20,H$22,H$24,H$26,H$28,H$30,H$32,H$34,H$36,H$38,H$40,H$42,H$44,H$46,H$48,H$50,H$52,H$54,H$56,H$58,H$60,H$62,H$64,H$66,H$68,H$70,H$72,H$74,H$76,H$78,H$80,H$82,H$84,H$86,H$88,H$90,H$92,H$94,H$96,H$98,H$100,H$102,H$104,H$106,H$108,H$110,H$112,H$114,H$116,H$118,H$120,H$122,H$124)) -> 3 | I423: =RANK(I422,(I$6,I$8,I$10,I$12,I$14,I$16,I$18,I$20,I$22,I$24,I$26,I$28,I$30,I$32,I$34,I$36,I$38,I$40,I$42,I$44,I$46,I$48,I$50,I$52,I$54,I$56,I$58,I$60,I$62,I$64,I$66,I$68,I$70,I$72,I$74,I$76,I$78,I$80,I$82,I$84,I$86,I$88,I$90,I$92,I$94,I$96,I$98,I$100,I$102,I$104,I$106,I$108,I$110,I$112,I$114,I$116,I$118,I$120,I$122,I$124)) -> 3 | J423: =RANK(J422,(J$6,J$8,J$10,J$12,J$14,J$16,J$18,J$20,J$22,J$24,J$26,J$28,J$30,J$32,J$34,J$36,J$38,J$40,J$42,J$44,J$46,J$48,J$50,J$52,J$54,J$56,J$58,J$60,J$62,J$64,J$66,J$68,J$70,J$72,J$74,J$76,J$78,J$80,J$82,J$84,J$86,J$88,J$90,J$92,J$94,J$96,J$98,J$100,J$102,J$104,J$106,J$108,J$110,J$112,J$114,J$116,J$118,J$120,J$122,J$124)) -> 3 | K423: =RANK(K422,(K$6,K$8,K$10,K$12,K$14,K$16,K$18,K$20,K$22,K$24,K$26,K$28,K$30,K$32,K$34,K$36,K$38,K$40,K$42,K$44,K$46,K$48,K$50,K$52,K$54,K$56,K$58,K$60,K$62,K$64,K$66,K$68,K$70,K$72,K$74,K$76,K$78,K$80,K$82,K$84,K$86,K$88,K$90,K$92,K$94,K$96,K$98,K$100,K$102,K$104,K$106,K$108,K$110,K$112,K$114,K$116,K$118,K$120,K$122,K$124)) -> 3 | L423: =RANK(L422,(L$6,L$8,L$10,L$12,L$14,L$16,L$18,L$20,L$22,L$24,L$26,L$28,L$30,L$32,L$34,L$36,L$38,L$40,L$42,L$44,L$46,L$48,L$50,L$52,L$54,L$56,L$58,L$60,L$62,L$64,L$66,L$68,L$70,L$72,L$74,L$76,L$78,L$80,L$82,L$84,L$86,L$88,L$90,L$92,L$94,L$96,L$98,L$100,L$102,L$104,L$106,L$108,L$110,L$112,L$114,L$116,L$118,L$120,L$122,L$124)) -> 4 | M423: =RANK(M422,(M$6,M$8,M$10,M$12,M$14,M$16,M$18,M$20,M$22,M$24,M$26,M$28,M$30,M$32,M$34,M$36,M$38,M$40,M$42,M$44,M$46,M$48,M$50,M$52,M$54,M$56,M$58,M$60,M$62,M$64,M$66,M$68,M$70,M$72,M$74,M$76,M$78,M$80,M$82,M$84,M$86,M$88,M$90,M$92,M$94,M$96,M$98,M$100,M$102,M$104,M$106,M$108,M$110,M$112,M$114,M$116,M$118,M$120,M$122,M$124)) -> 3 | N423: =RANK(N422,(N$6,N$8,N$10,N$12,N$14,N$16,N$18,N$20,N$22,N$24,N$26,N$28,N$30,N$32,N$34,N$36,N$38,N$40,N$42,N$44,N$46,N$48,N$50,N$52,N$54,N$56,N$58,N$60,N$62,N$64,N$66,N$68,N$70,N$72,N$74,N$76,N$78,N$80,N$82,N$84,N$86,N$88,N$90,N$92,N$94,N$96,N$98,N$100,N$102,N$104,N$106,N$108,N$110,N$112,N$114,N$116,N$118,N$120,N$122,N$124)) -> 3 | P423: =RANK(P422,(P$6,P$8,P$10,P$12,P$14,P$16,P$18,P$20,P$22,P$24,P$26,P$28,P$30,P$32,P$34,P$36,P$38,P$40,P$42,P$44,P$46,P$48,P$50,P$52,P$54,P$56,P$58,P$60,P$62,P$64,P$66,P$68,P$70,P$72,P$74,P$76,P$78,P$80,P$82,P$84,P$86,P$88,P$90,P$92,P$94,P$96,P$98,P$100,P$102,P$104,P$106,P$108,P$110,P$112,P$114,P$116,P$118,P$120,P$122,P$124)) -> 3
A424: Troopers | B424: 3 | C424: 16.90 | D424: 16.90 | E424: 33.80 | F424: 17.10 | G424: 16.90 | H424: 16.50 | I424: 25.25 | J424: 17.20 | K424: 16.90 | L424: 17.40 | M424: 25.75 | N424: 84.80 | O424: 0.0 | P424: 84.80
C425: =RANK(C424,(C$6,C$8,C$10,C$12,C$14,C$16,C$18,C$20,C$22,C$24,C$26,C$28,C$30,C$32,C$34,C$36,C$38,C$40,C$42,C$44,C$46,C$48,C$50,C$52,C$54,C$56,C$58,C$60,C$62,C$64,C$66,C$68,C$70,C$72,C$74,C$76,C$78,C$80,C$82,C$84,C$86,C$88,C$90,C$92,C$94,C$96,C$98,C$100,C$102,C$104,C$106,C$108,C$110,C$112,C$114,C$116,C$118,C$120,C$122,C$124)) -> 4 | D425: =RANK(D424,(D$6,D$8,D$10,D$12,D$14,D$16,D$18,D$20,D$22,D$24,D$26,D$28,D$30,D$32,D$34,D$36,D$38,D$40,D$42,D$44,D$46,D$48,D$50,D$52,D$54,D$56,D$58,D$60,D$62,D$64,D$66,D$68,D$70,D$72,D$74,D$76,D$78,D$80,D$82,D$84,D$86,D$88,D$90,D$92,D$94,D$96,D$98,D$100,D$102,D$104,D$106,D$108,D$110,D$112,D$114,D$116,D$118,D$120,D$122,D$124)) -> 3 | E425: =RANK(E424,(E$6,E$8,E$10,E$12,E$14,E$16,E$18,E$20,E$22,E$24,E$26,E$28,E$30,E$32,E$34,E$36,E$38,E$40,E$42,E$44,E$46,E$48,E$50,E$52,E$54,E$56,E$58,E$60,E$62,E$64,E$66,E$68,E$70,E$72,E$74,E$76,E$78,E$80,E$82,E$84,E$86,E$88,E$90,E$92,E$94,E$96,E$98,E$100,E$102,E$104,E$106,E$108,E$110,E$112,E$114,E$116,E$118,E$120,E$122,E$124)) -> 3 | F425: =RANK(F424,(F$6,F$8,F$10,F$12,F$14,F$16,F$18,F$20,F$22,F$24,F$26,F$28,F$30,F$32,F$34,F$36,F$38,F$40,F$42,F$44,F$46,F$48,F$50,F$52,F$54,F$56,F$58,F$60,F$62,F$64,F$66,F$68,F$70,F$72,F$74,F$76,F$78,F$80,F$82,F$84,F$86,F$88,F$90,F$92,F$94,F$96,F$98,F$100,F$102,F$104,F$106,F$108,F$110,F$112,F$114,F$116,F$118,F$120,F$122,F$124)) -> 3 | G425: =RANK(G424,(G$6,G$8,G$10,G$12,G$14,G$16,G$18,G$20,G$22,G$24,G$26,G$28,G$30,G$32,G$34,G$36,G$38,G$40,G$42,G$44,G$46,G$48,G$50,G$52,G$54,G$56,G$58,G$60,G$62,G$64,G$66,G$68,G$70,G$72,G$74,G$76,G$78,G$80,G$82,G$84,G$86,G$88,G$90,G$92,G$94,G$96,G$98,G$100,G$102,G$104,G$106,G$108,G$110,G$112,G$114,G$116,G$118,G$120,G$122,G$124)) -> 4 | H425: =RANK(H424,(H$6,H$8,H$10,H$12,H$14,H$16,H$18,H$20,H$22,H$24,H$26,H$28,H$30,H$32,H$34,H$36,H$38,H$40,H$42,H$44,H$46,H$48,H$50,H$52,H$54,H$56,H$58,H$60,H$62,H$64,H$66,H$68,H$70,H$72,H$74,H$76,H$78,H$80,H$82,H$84,H$86,H$88,H$90,H$92,H$94,H$96,H$98,H$100,H$102,H$104,H$106,H$108,H$110,H$112,H$114,H$116,H$118,H$120,H$122,H$124)) -> 4 | I425: =RANK(I424,(I$6,I$8,I$10,I$12,I$14,I$16,I$18,I$20,I$22,I$24,I$26,I$28,I$30,I$32,I$34,I$36,I$38,I$40,I$42,I$44,I$46,I$48,I$50,I$52,I$54,I$56,I$58,I$60,I$62,I$64,I$66,I$68,I$70,I$72,I$74,I$76,I$78,I$80,I$82,I$84,I$86,I$88,I$90,I$92,I$94,I$96,I$98,I$100,I$102,I$104,I$106,I$108,I$110,I$112,I$114,I$116,I$118,I$120,I$122,I$124)) -> 4 | J425: =RANK(J424,(J$6,J$8,J$10,J$12,J$14,J$16,J$18,J$20,J$22,J$24,J$26,J$28,J$30,J$32,J$34,J$36,J$38,J$40,J$42,J$44,J$46,J$48,J$50,J$52,J$54,J$56,J$58,J$60,J$62,J$64,J$66,J$68,J$70,J$72,J$74,J$76,J$78,J$80,J$82,J$84,J$86,J$88,J$90,J$92,J$94,J$96,J$98,J$100,J$102,J$104,J$106,J$108,J$110,J$112,J$114,J$116,J$118,J$120,J$122,J$124)) -> 4 | K425: =RANK(K424,(K$6,K$8,K$10,K$12,K$14,K$16,K$18,K$20,K$22,K$24,K$26,K$28,K$30,K$32,K$34,K$36,K$38,K$40,K$42,K$44,K$46,K$48,K$50,K$52,K$54,K$56,K$58,K$60,K$62,K$64,K$66,K$68,K$70,K$72,K$74,K$76,K$78,K$80,K$82,K$84,K$86,K$88,K$90,K$92,K$94,K$96,K$98,K$100,K$102,K$104,K$106,K$108,K$110,K$112,K$114,K$116,K$118,K$120,K$122,K$124)) -> 4 | L425: =RANK(L424,(L$6,L$8,L$10,L$12,L$14,L$16,L$18,L$20,L$22,L$24,L$26,L$28,L$30,L$32,L$34,L$36,L$38,L$40,L$42,L$44,L$46,L$48,L$50,L$52,L$54,L$56,L$58,L$60,L$62,L$64,L$66,L$68,L$70,L$72,L$74,L$76,L$78,L$80,L$82,L$84,L$86,L$88,L$90,L$92,L$94,L$96,L$98,L$100,L$102,L$104,L$106,L$108,L$110,L$112,L$114,L$116,L$118,L$120,L$122,L$124)) -> 3 | M425: =RANK(M424,(M$6,M$8,M$10,M$12,M$14,M$16,M$18,M$20,M$22,M$24,M$26,M$28,M$30,M$32,M$34,M$36,M$38,M$40,M$42,M$44,M$46,M$48,M$50,M$52,M$54,M$56,M$58,M$60,M$62,M$64,M$66,M$68,M$70,M$72,M$74,M$76,M$78,M$80,M$82,M$84,M$86,M$88,M$90,M$92,M$94,M$96,M$98,M$100,M$102,M$104,M$106,M$108,M$110,M$112,M$114,M$116,M$118,M$120,M$122,M$124)) -> 4 | N425: =RANK(N424,(N$6,N$8,N$10,N$12,N$14,N$16,N$18,N$20,N$22,N$24,N$26,N$28,N$30,N$32,N$34,N$36,N$38,N$40,N$42,N$44,N$46,N$48,N$50,N$52,N$54,N$56,N$58,N$60,N$62,N$64,N$66,N$68,N$70,N$72,N$74,N$76,N$78,N$80,N$82,N$84,N$86,N$88,N$90,N$92,N$94,N$96,N$98,N$100,N$102,N$104,N$106,N$108,N$110,N$112,N$114,N$116,N$118,N$120,N$122,N$124)) -> 4 | P425: =RANK(P424,(P$6,P$8,P$10,P$12,P$14,P$16,P$18,P$20,P$22,P$24,P$26,P$28,P$30,P$32,P$34,P$36,P$38,P$40,P$42,P$44,P$46,P$48,P$50,P$52,P$54,P$56,P$58,P$60,P$62,P$64,P$66,P$68,P$70,P$72,P$74,P$76,P$78,P$80,P$82,P$84,P$86,P$88,P$90,P$92,P$94,P$96,P$98,P$100,P$102,P$104,P$106,P$108,P$110,P$112,P$114,P$116,P$118,P$120,P$122,P$124)) -> 4
A426: Music | B426: 2 | C426: 15.80 | D426: 15.70 | E426: 31.50 | F426: 15.70 | G426: 15.90 | H426: 15.70 | I426: 23.65 | J426: 16.00 | K426: 15.20 | L426: 16.20 | M426: 23.70 | N426: 78.85 | O426: 0.0 | P426: 78.85
A427: City | C427: =RANK(C426,(C$6,C$8,C$10,C$12,C$14,C$16,C$18,C$20,C$22,C$24,C$26,C$28,C$30,C$32,C$34,C$36,C$38,C$40,C$42,C$44,C$46,C$48,C$50,C$52,C$54,C$56,C$58,C$60,C$62,C$64,C$66,C$68,C$70,C$72,C$74,C$76,C$78,C$80,C$82,C$84,C$86,C$88,C$90,C$92,C$94,C$96,C$98,C$100,C$102,C$104,C$106,C$108,C$110,C$112,C$114,C$116,C$118,C$120,C$122,C$124)) -> 5 | D427: =RANK(D426,(D$6,D$8,D$10,D$12,D$14,D$16,D$18,D$20,D$22,D$24,D$26,D$28,D$30,D$32,D$34,D$36,D$38,D$40,D$42,D$44,D$46,D$48,D$50,D$52,D$54,D$56,D$58,D$60,D$62,D$64,D$66,D$68,D$70,D$72,D$74,D$76,D$78,D$80,D$82,D$84,D$86,D$88,D$90,D$92,D$94,D$96,D$98,D$100,D$102,D$104,D$106,D$108,D$110,D$112,D$114,D$116,D$118,D$120,D$122,D$124)) -> 5 | E427: =RANK(E426,(E$6,E$8,E$10,E$12,E$14,E$16,E$18,E$20,E$22,E$24,E$26,E$28,E$30,E$32,E$34,E$36,E$38,E$40,E$42,E$44,E$46,E$48,E$50,E$52,E$54,E$56,E$58,E$60,E$62,E$64,E$66,E$68,E$70,E$72,E$74,E$76,E$78,E$80,E$82,E$84,E$86,E$88,E$90,E$92,E$94,E$96,E$98,E$100,E$102,E$104,E$106,E$108,E$110,E$112,E$114,E$116,E$118,E$120,E$122,E$124)) -> 5 | F427: =RANK(F426,(F$6,F$8,F$10,F$12,F$14,F$16,F$18,F$20,F$22,F$24,F$26,F$28,F$30,F$32,F$34,F$36,F$38,F$40,F$42,F$44,F$46,F$48,F$50,F$52,F$54,F$56,F$58,F$60,F$62,F$64,F$66,F$68,F$70,F$72,F$74,F$76,F$78,F$80,F$82,F$84,F$86,F$88,F$90,F$92,F$94,F$96,F$98,F$100,F$102,F$104,F$106,F$108,F$110,F$112,F$114,F$116,F$118,F$120,F$122,F$124)) -> 5 | G427: =RANK(G426,(G$6,G$8,G$10,G$12,G$14,G$16,G$18,G$20,G$22,G$24,G$26,G$28,G$30,G$32,G$34,G$36,G$38,G$40,G$42,G$44,G$46,G$48,G$50,G$52,G$54,G$56,G$58,G$60,G$62,G$64,G$66,G$68,G$70,G$72,G$74,G$76,G$78,G$80,G$82,G$84,G$86,G$88,G$90,G$92,G$94,G$96,G$98,G$100,G$102,G$104,G$106,G$108,G$110,G$112,G$114,G$116,G$118,G$120,G$122,G$124)) -> 5 | H427: =RANK(H426,(H$6,H$8,H$10,H$12,H$14,H$16,H$18,H$20,H$22,H$24,H$26,H$28,H$30,H$32,H$34,H$36,H$38,H$40,H$42,H$44,H$46,H$48,H$50,H$52,H$54,H$56,H$58,H$60,H$62,H$64,H$66,H$68,H$70,H$72,H$74,H$76,H$78,H$80,H$82,H$84,H$86,H$88,H$90,H$92,H$94,H$96,H$98,H$100,H$102,H$104,H$106,H$108,H$110,H$112,H$114,H$116,H$118,H$120,H$122,H$124)) -> 5 | I427: =RANK(I426,(I$6,I$8,I$10,I$12,I$14,I$16,I$18,I$20,I$22,I$24,I$26,I$28,I$30,I$32,I$34,I$36,I$38,I$40,I$42,I$44,I$46,I$48,I$50,I$52,I$54,I$56,I$58,I$60,I$62,I$64,I$66,I$68,I$70,I$72,I$74,I$76,I$78,I$80,I$82,I$84,I$86,I$88,I$90,I$92,I$94,I$96,I$98,I$100,I$102,I$104,I$106,I$108,I$110,I$112,I$114,I$116,I$118,I$120,I$122,I$124)) -> 5 | J427: =RANK(J426,(J$6,J$8,J$10,J$12,J$14,J$16,J$18,J$20,J$22,J$24,J$26,J$28,J$30,J$32,J$34,J$36,J$38,J$40,J$42,J$44,J$46,J$48,J$50,J$52,J$54,J$56,J$58,J$60,J$62,J$64,J$66,J$68,J$70,J$72,J$74,J$76,J$78,J$80,J$82,J$84,J$86,J$88,J$90,J$92,J$94,J$96,J$98,J$100,J$102,J$104,J$106,J$108,J$110,J$112,J$114,J$116,J$118,J$120,J$122,J$124)) -> 5 | K427: =RANK(K426,(K$6,K$8,K$10,K$12,K$14,K$16,K$18,K$20,K$22,K$24,K$26,K$28,K$30,K$32,K$34,K$36,K$38,K$40,K$42,K$44,K$46,K$48,K$50,K$52,K$54,K$56,K$58,K$60,K$62,K$64,K$66,K$68,K$70,K$72,K$74,K$76,K$78,K$80,K$82,K$84,K$86,K$88,K$90,K$92,K$94,K$96,K$98,K$100,K$102,K$104,K$106,K$108,K$110,K$112,K$114,K$116,K$118,K$120,K$122,K$124)) -> 5 | L427: =RANK(L426,(L$6,L$8,L$10,L$12,L$14,L$16,L$18,L$20,L$22,L$24,L$26,L$28,L$30,L$32,L$34,L$36,L$38,L$40,L$42,L$44,L$46,L$48,L$50,L$52,L$54,L$56,L$58,L$60,L$62,L$64,L$66,L$68,L$70,L$72,L$74,L$76,L$78,L$80,L$82,L$84,L$86,L$88,L$90,L$92,L$94,L$96,L$98,L$100,L$102,L$104,L$106,L$108,L$110,L$112,L$114,L$116,L$118,L$120,L$122,L$124)) -> 5 | M427: =RANK(M426,(M$6,M$8,M$10,M$12,M$14,M$16,M$18,M$20,M$22,M$24,M$26,M$28,M$30,M$32,M$34,M$36,M$38,M$40,M$42,M$44,M$46,M$48,M$50,M$52,M$54,M$56,M$58,M$60,M$62,M$64,M$66,M$68,M$70,M$72,M$74,M$76,M$78,M$80,M$82,M$84,M$86,M$88,M$90,M$92,M$94,M$96,M$98,M$100,M$102,M$104,M$106,M$108,M$110,M$112,M$114,M$116,M$118,M$120,M$122,M$124)) -> 5 | N427: =RANK(N426,(N$6,N$8,N$10,N$12,N$14,N$16,N$18,N$20,N$22,N$24,N$26,N$28,N$30,N$32,N$34,N$36,N$38,N$40,N$42,N$44,N$46,N$48,N$50,N$52,N$54,N$56,N$58,N$60,N$62,N$64,N$66,N$68,N$70,N$72,N$74,N$76,N$78,N$80,N$82,N$84,N$86,N$88,N$90,N$92,N$94,N$96,N$98,N$100,N$102,N$104,N$106,N$108,N$110,N$112,N$114,N$116,N$118,N$120,N$122,N$124)) -> 5 | P427: =RANK(P426,(P$6,P$8,P$10,P$12,P$14,P$16,P$18,P$20,P$22,P$24,P$26,P$28,P$30,P$32,P$34,P$36,P$38,P$40,P$42,P$44,P$46,P$48,P$50,P$52,P$54,P$56,P$58,P$60,P$62,P$64,P$66,P$68,P$70,P$72,P$74,P$76,P$78,P$80,P$82,P$84,P$86,P$88,P$90,P$92,P$94,P$96,P$98,P$100,P$102,P$104,P$106,P$108,P$110,P$112,P$114,P$116,P$118,P$120,P$122,P$124)) -> 5
A428: Jersey | B428: 1 | C428: 15.40 | D428: 14.60 | E428: 30.00 | F428: 14.00 | G428: 14.50 | H428: 14.40 | I428: 21.45 | J428: 14.80 | K428: 14.60 | L428: 13.80 | M428: 21.60 | N428: 73.05 | O428: 0.0 | P428: 73.05
A429: Surf | C429: =RANK(C428,(C$6,C$8,C$10,C$12,C$14,C$16,C$18,C$20,C$22,C$24,C$26,C$28,C$30,C$32,C$34,C$36,C$38,C$40,C$42,C$44,C$46,C$48,C$50,C$52,C$54,C$56,C$58,C$60,C$62,C$64,C$66,C$68,C$70,C$72,C$74,C$76,C$78,C$80,C$82,C$84,C$86,C$88,C$90,C$92,C$94,C$96,C$98,C$100,C$102,C$104,C$106,C$108,C$110,C$112,C$114,C$116,C$118,C$120,C$122,C$124)) -> 6 | D429: =RANK(D428,(D$6,D$8,D$10,D$12,D$14,D$16,D$18,D$20,D$22,D$24,D$26,D$28,D$30,D$32,D$34,D$36,D$38,D$40,D$42,D$44,D$46,D$48,D$50,D$52,D$54,D$56,D$58,D$60,D$62,D$64,D$66,D$68,D$70,D$72,D$74,D$76,D$78,D$80,D$82,D$84,D$86,D$88,D$90,D$92,D$94,D$96,D$98,D$100,D$102,D$104,D$106,D$108,D$110,D$112,D$114,D$116,D$118,D$120,D$122,D$124)) -> 6 | E429: =RANK(E428,(E$6,E$8,E$10,E$12,E$14,E$16,E$18,E$20,E$22,E$24,E$26,E$28,E$30,E$32,E$34,E$36,E$38,E$40,E$42,E$44,E$46,E$48,E$50,E$52,E$54,E$56,E$58,E$60,E$62,E$64,E$66,E$68,E$70,E$72,E$74,E$76,E$78,E$80,E$82,E$84,E$86,E$88,E$90,E$92,E$94,E$96,E$98,E$100,E$102,E$104,E$106,E$108,E$110,E$112,E$114,E$116,E$118,E$120,E$122,E$124)) -> 6 | F429: =RANK(F428,(F$6,F$8,F$10,F$12,F$14,F$16,F$18,F$20,F$22,F$24,F$26,F$28,F$30,F$32,F$34,F$36,F$38,F$40,F$42,F$44,F$46,F$48,F$50,F$52,F$54,F$56,F$58,F$60,F$62,F$64,F$66,F$68,F$70,F$72,F$74,F$76,F$78,F$80,F$82,F$84,F$86,F$88,F$90,F$92,F$94,F$96,F$98,F$100,F$102,F$104,F$106,F$108,F$110,F$112,F$114,F$116,F$118,F$120,F$122,F$124)) -> 6 | G429: =RANK(G428,(G$6,G$8,G$10,G$12,G$14,G$16,G$18,G$20,G$22,G$24,G$26,G$28,G$30,G$32,G$34,G$36,G$38,G$40,G$42,G$44,G$46,G$48,G$50,G$52,G$54,G$56,G$58,G$60,G$62,G$64,G$66,G$68,G$70,G$72,G$74,G$76,G$78,G$80,G$82,G$84,G$86,G$88,G$90,G$92,G$94,G$96,G$98,G$100,G$102,G$104,G$106,G$108,G$110,G$112,G$114,G$116,G$118,G$120,G$122,G$124)) -> 6 | H429: =RANK(H428,(H$6,H$8,H$10,H$12,H$14,H$16,H$18,H$20,H$22,H$24,H$26,H$28,H$30,H$32,H$34,H$36,H$38,H$40,H$42,H$44,H$46,H$48,H$50,H$52,H$54,H$56,H$58,H$60,H$62,H$64,H$66,H$68,H$70,H$72,H$74,H$76,H$78,H$80,H$82,H$84,H$86,H$88,H$90,H$92,H$94,H$96,H$98,H$100,H$102,H$104,H$106,H$108,H$110,H$112,H$114,H$116,H$118,H$120,H$122,H$124)) -> 6 | I429: =RANK(I428,(I$6,I$8,I$10,I$12,I$14,I$16,I$18,I$20,I$22,I$24,I$26,I$28,I$30,I$32,I$34,I$36,I$38,I$40,I$42,I$44,I$46,I$48,I$50,I$52,I$54,I$56,I$58,I$60,I$62,I$64,I$66,I$68,I$70,I$72,I$74,I$76,I$78,I$80,I$82,I$84,I$86,I$88,I$90,I$92,I$94,I$96,I$98,I$100,I$102,I$104,I$106,I$108,I$110,I$112,I$114,I$116,I$118,I$120,I$122,I$124)) -> 6 | J429: =RANK(J428,(J$6,J$8,J$10,J$12,J$14,J$16,J$18,J$20,J$22,J$24,J$26,J$28,J$30,J$32,J$34,J$36,J$38,J$40,J$42,J$44,J$46,J$48,J$50,J$52,J$54,J$56,J$58,J$60,J$62,J$64,J$66,J$68,J$70,J$72,J$74,J$76,J$78,J$80,J$82,J$84,J$86,J$88,J$90,J$92,J$94,J$96,J$98,J$100,J$102,J$104,J$106,J$108,J$110,J$112,J$114,J$116,J$118,J$120,J$122,J$124)) -> 6 | K429: =RANK(K428,(K$6,K$8,K$10,K$12,K$14,K$16,K$18,K$20,K$22,K$24,K$26,K$28,K$30,K$32,K$34,K$36,K$38,K$40,K$42,K$44,K$46,K$48,K$50,K$52,K$54,K$56,K$58,K$60,K$62,K$64,K$66,K$68,K$70,K$72,K$74,K$76,K$78,K$80,K$82,K$84,K$86,K$88,K$90,K$92,K$94,K$96,K$98,K$100,K$102,K$104,K$106,K$108,K$110,K$112,K$114,K$116,K$118,K$120,K$122,K$124)) -> 6 | L429: =RANK(L428,(L$6,L$8,L$10,L$12,L$14,L$16,L$18,L$20,L$22,L$24,L$26,L$28,L$30,L$32,L$34,L$36,L$38,L$40,L$42,L$44,L$46,L$48,L$50,L$52,L$54,L$56,L$58,L$60,L$62,L$64,L$66,L$68,L$70,L$72,L$74,L$76,L$78,L$80,L$82,L$84,L$86,L$88,L$90,L$92,L$94,L$96,L$98,L$100,L$102,L$104,L$106,L$108,L$110,L$112,L$114,L$116,L$118,L$120,L$122,L$124)) -> 6 | M429: =RANK(M428,(M$6,M$8,M$10,M$12,M$14,M$16,M$18,M$20,M$22,M$24,M$26,M$28,M$30,M$32,M$34,M$36,M$38,M$40,M$42,M$44,M$46,M$48,M$50,M$52,M$54,M$56,M$58,M$60,M$62,M$64,M$66,M$68,M$70,M$72,M$74,M$76,M$78,M$80,M$82,M$84,M$86,M$88,M$90,M$92,M$94,M$96,M$98,M$100,M$102,M$104,M$106,M$108,M$110,M$112,M$114,M$116,M$118,M$120,M$122,M$124)) -> 6 | N429: =RANK(N428,(N$6,N$8,N$10,N$12,N$14,N$16,N$18,N$20,N$22,N$24,N$26,N$28,N$30,N$32,N$34,N$36,N$38,N$40,N$42,N$44,N$46,N$48,N$50,N$52,N$54,N$56,N$58,N$60,N$62,N$64,N$66,N$68,N$70,N$72,N$74,N$76,N$78,N$80,N$82,N$84,N$86,N$88,N$90,N$92,N$94,N$96,N$98,N$100,N$102,N$104,N$106,N$108,N$110,N$112,N$114,N$116,N$118,N$120,N$122,N$124)) -> 6 | P429: =RANK(P428,(P$6,P$8,P$10,P$12,P$14,P$16,P$18,P$20,P$22,P$24,P$26,P$28,P$30,P$32,P$34,P$36,P$38,P$40,P$42,P$44,P$46,P$48,P$50,P$52,P$54,P$56,P$58,P$60,P$62,P$64,P$66,P$68,P$70,P$72,P$74,P$76,P$78,P$80,P$82,P$84,P$86,P$88,P$90,P$92,P$94,P$96,P$98,P$100,P$102,P$104,P$106,P$108,P$110,P$112,P$114,P$116,P$118,P$120,P$122,P$124)) -> 6
A432: 8/8/2022 Cincinnati, Ohio
C433: Visual | F433: Music | J433: Effect | M433: Communication
C434: Ensemble | D434: Color Guard | F434: Brass | G434: Ensemble | H434: Percussion | J434: Visual | K434: Music | M434: Visual | N434: Music | P434: Sub | R434: Total
C435: J. Pursifull | D435: D. Padilla | E435: Average | F435: M. Rubino | G435: A. Brown | H435: M. Leitzke | I435: Total ÷2 | J435: C. Quamme | K435: R. Greenwell | L435: Total | M435: C. Quamme | N435: R. Greenwell | O435: Average | P435: Total | Q435: Pen | R435: Score
A436: DCA Open Class | C436: 20 | D436: 20 | E436: 20 | F436: 20 | G436: 20 | H436: 20 | I436: 30 | J436: 20 | K436: 20 | L436: 40 | M436: 10 | N436: 10 | O436: 10 | P436: 100 | R436: 100
A437: Cincinnati | C437: 15.30 | D437: 15.40 | E437: 15.35 | F437: 14.40 | G437: 16.10 | H437: 13.40 | I437: 21.95 | J437: 14.30 | K437: 14.70 | L437: 29.00 | M437: 7.30 | N437: 7.10 | O437: 7.20 | P437: 73.50 | Q437: 0.0 | R437: 73.50
A438: Tradition | C438: 1 | D438: 1 | E438: 1 | F438: 1 | G438: 1 | H438: 1 | I438: 1 | J438: 1 | K438: 1 | L438: 1 | M438: 1 | N438: 1 | O438: 1 | P438: 1 | R438: 1
A441: 8/8/2022 Marion, Indiana--DCI Open Class World Championship Prelims
C442: General Effect | F442: Visual | J442: Music
C443: 1 | D443: 2 | F443: Proficiency | G443: Analysis | H443: Color Guard | J443: Brass | K443: Analysis 1 | L443: Analysis 2 | M443: Analysis | N443: Percussion | P443: Sub | R443: Total
C444: R. Solomon | D444: J. Rhodes | E444: Total | F444: M. Turner | G444: T. Wingate | H444: C. Clayton | I444: Total ÷2 | J444: J. Denton | K444: C. Armbruster | L444: A. Kristensen | M444: Average | N444: C. Rapacki | O444: Total ÷2 | P444: Total | Q444: Pen | R444: Score
A445: DCI Open Class | C445: 20 | D445: 20 | E445: 40 | F445: 20 | G445: 20 | H445: 20 | I445: 30 | J445: 20 | K445: 20 | L445: 20 | M445: 20 | N445: 20 | O445: 30 | P445: 100 | R445: 100
A446: Vanguard | B446: 14 | C446: 16.60 | D446: 16.90 | E446: 33.50 | F446: 17.00 | G446: 16.60 | H446: 16.40 | I446: 25.00 | J446: 16.40 | K446: 16.30 | L446: 16.20 | M446: 16.25 | N446: 16.20 | O446: 24.425000000000001 | P446: 82.924999999999997 | Q446: 0.0 | R446: 82.924999999999997
A447: Cadets | C447: 1 | D447: 2 | E447: 1 | F447: 1 | G447: 1 | H447: 1 | I447: 1 | J447: 1 | K447: 2 | L447: 3 | M447: 2 | N447: 1 | O447: 1 | P447: 1 | R447: 1
A448: Gold | B448: 13 | C448: 16.50 | D448: 16.40 | E448: 32.90 | F448: 16.80 | G448: 16.50 | H448: 16.00 | I448: 24.65 | J448: 16.20 | K448: 16.40 | L448: 16.10 | M448: 16.25 | N448: 15.80 | O448: 24.125 | P448: 81.674999999999997 | Q448: 0.0 | R448: 81.674999999999997
C449: 2 | D449: 4 | E449: 3 | F449: 2 | G449: 2 | H449: 4 | I449: 2 | J449: 2 | K449: 1 | L449: 4 | M449: 2 | N449: 4 | O449: 2 | P449: 2 | R449: 2
A450: Blue | B450: 11 | C450: 16.10 | D450: 17.05 | E450: 33.15 | F450: 16.30 | G450: 15.90 | H450: 16.20 | I450: 24.20 | J450: 15.70 | K450: 16.20 | L450: 16.60 | M450: 16.40 | N450: 15.90 | O450: 24.000 | P450: 81.350 | Q450: 0.0 | R450: 81.350
A451: Devils B | C451: 3 | D451: 1 | E451: 2 | F451: 4 | G451: 4 | H451: 3 | I451: 4 | J451: 4 | K451: 3 | L451: 1 | M451: 1 | N451: 3 | O451: 4 | P451: 3 | R451: 3
A452: Spartans | B452: 12 | C452: 16.00 | D452: 16.60 | E452: 32.60 | F452: 16.50 | G452: 16.10 | H452: 16.30 | I452: 24.45 | J452: 15.90 | K452: 15.90 | L452: 16.40 | M452: 16.15 | N452: 16.00 | O452: 24.024999999999999 | P452: 81.075000000000003 | Q452: 0.0 | R452: 81.075000000000003
C453: 4 | D453: 3 | E453: 4 | F453: 3 | G453: 3 | H453: 2 | I453: 3 | J453: 3 | K453: 4 | L453: 2 | M453: 4 | N453: 2 | O453: 3 | P453: 4 | R453: 4
A454: Guardians | B454: 10 | C454: 15.60 | D454: 16.20 | E454: 31.80 | F454: 15.70 | G454: 15.80 | H454: 15.00 | I454: 23.25 | J454: 15.50 | K454: 15.70 | L454: 15.90 | M454: 15.80 | N454: 15.00 | O454: 23.150 | P454: 78.200 | Q454: 0.0 | R454: 78.200
C455: 5 | D455: 5 | E455: 5 | F455: 5 | G455: 5 | H455: 6 | I455: 5 | J455: 5 | K455: 5 | L455: 5 | M455: 5 | N455: 6 | O455: 5 | P455: 5 | R455: 5
A456: Southwind | B456: 9 | C456: 15.40 | D456: 15.90 | E456: 31.30 | F456: 15.10 | G456: 15.10 | H456: 15.40 | I456: 22.80 | J456: 15.20 | K456: 15.40 | L456: 15.50 | M456: 15.45 | N456: 14.80 | O456: 22.725000000000001 | P456: 76.825000000000003 | Q456: 0.0 | R456: 76.825000000000003
C457: 6 | D457: 6 | E457: 6 | F457: 8 | G457: 6 | H457: 5 | I457: 6 | J457: 6 | K457: 6 | L457: 7 | M457: 6 | N457: 8 | O457: 6 | P457: 6 | R457: 6
A458: Legends | B458: 8 | C458: 14.80 | D458: 15.40 | E458: 30.20 | F458: 15.40 | G458: 15.00 | H458: 14.70 | I458: 22.55 | J458: 15.00 | K458: 15.00 | L458: 15.20 | M458: 15.10 | N458: 14.90 | O458: 22.500 | P458: 75.250 | Q458: 0.0 | R458: 75.250
C459: 8 | D459: 8 | E459: 8 | F459: 6 | G459: 7 | H459: 7 | I459: 7 | J459: 7 | K459: 8 | L459: 8 | M459: 8 | N459: 7 | O459: 7 | P459: 7 | R459: 7
A460: Battalion | B460: 7 | C460: 14.90 | D460: 15.70 | E460: 30.60 | F460: 15.30 | G460: 14.80 | H460: 14.30 | I460: 22.20 | J460: 14.80 | K460: 15.10 | L460: 15.60 | M460: 15.35 | N460: 14.30 | O460: 22.225000000000001 | P460: 75.025000000000006 | Q460: 0.0 | R460: 75.025000000000006
C461: 7 | D461: 7 | E461: 7 | F461: 7 | G461: 8 | H461: 9 | I461: 8 | J461: 8 | K461: 7 | L461: 6 | M461: 7 | N461: 10 | O461: 8 | P461: 8 | R461: 8
A462: River City | B462: 6 | C462: 14.70 | D462: 15.05 | E462: 29.75 | F462: 14.60 | G462: 14.30 | H462: 14.60 | I462: 21.75 | J462: 14.40 | K462: 14.50 | L462: 14.90 | M462: 14.70 | N462: 14.50 | O462: 21.800 | P462: 73.300 | Q462: 0.0 | R462: 73.300
A463: Rhythm | C463: 9 | D463: 10 | E463: 9 | F463: 10 | G463: 9 | H463: 8 | I463: 9 | J463: 10 | K463: 9 | L463: 9 | M463: 9 | N463: 9 | O463: 10 | P463: 9 | R463: 9
A464: Louisana | B464: 5 | C464: 14.50 | D464: 15.20 | E464: 29.70 | F464: 15.00 | G464: 13.50 | H464: 13.50 | I464: 21.00 | J464: 14.50 | K464: 14.20 | L464: 14.70 | M464: 14.45 | N464: 15.30 | O464: 22.125 | P464: 72.825000000000003 | Q464: 0.0 | R464: 72.825000000000003
A465: Stars | C465: 10 | D465: 9 | E465: 10 | F465: 9 | G465: 12 | H465: 12 | I465: 10 | J465: 9 | K465: 10 | L465: 10 | M465: 10 | N465: 5 | O465: 9 | P465: 10 | R465: 10
A466: 7th | B466: 4 | C466: 14.20 | D466: 14.90 | E466: 29.10 | F466: 13.30 | G466: 13.60 | H466: 13.60 | I466: 20.25 | J466: 14.30 | K466: 13.30 | L466: 13.10 | M466: 13.20 | N466: 13.90 | O466: 20.700 | P466: 70.050 | Q466: 0.0 | R466: 70.050
A467: Regiment | C467: 11 | D467: 11 | E467: 11 | F467: 12 | G467: 11 | H467: 11 | I467: 12 | J467: 11 | K467: 11 | L467: 14 | M467: 11 | N467: 12 | O467: 11 | P467: 11 | R467: 11
A468: Les | B468: 2 | C468: 13.80 | D468: 14.30 | E468: 28.10 | F468: 14.20 | G468: 13.20 | H468: 13.80 | I468: 20.60 | J468: 13.40 | K468: 12.60 | L468: 13.30 | M468: 12.95 | N468: 13.30 | O468: 19.824999999999999 | P468: 68.525000000000006 | Q468: 0.0 | R468: 68.525000000000006
A469: Stentors | C469: 12 | D469: 12 | E469: 12 | F469: 11 | G469: 13 | H469: 10 | I469: 11 | J469: 13 | K469: 14 | L469: 12 | M469: 14 | N469: 14 | O469: 14 | P469: 12 | R469: 12
A470: Raiders | B470: 3 | C470: 13.60 | D470: 13.60 | E470: 27.20 | F470: 12.70 | G470: 13.70 | H470: 13.30 | I470: 19.85 | J470: 13.90 | K470: 13.10 | L470: 13.20 | M470: 13.15 | N470: 14.10 | O470: 20.574999999999999 | P470: 67.625 | Q470: 0.0 | R470: 67.625
C471: 14 | D471: 14 | E471: 14 | F471: 14 | G471: 10 | H471: 13 | I471: 13 | J471: 12 | K471: 12 | L471: 13 | M471: 12 | N471: 11 | O471: 12 | P471: 13 | R471: 13
A472: Colt | B472: 1 | C472: 13.70 | D472: 14.00 | E472: 27.70 | F472: 12.90 | G472: 13.00 | H472: 13.00 | I472: 19.45 | J472: 13.30 | K472: 12.80 | L472: 13.40 | M472: 13.10 | N472: 13.60 | O472: 20.000 | P472: 67.150 | Q472: 0.0 | R472: 67.150
A473: Cadets | C473: 13 | D473: 13 | E473: 13 | F473: 13 | G473: 14 | H473: 14 | I473: 14 | J473: 14 | K473: 13 | L473: 11 | M473: 13 | N473: 13 | O473: 13 | P473: 14 | R473: 14
A474: DCI International Class
A475: Calgary | B475: 1 | C475: 15.80 | D475: 16.00 | E475: 31.80 | F475: 14.30 | G475: 16.00 | H475: 16.00 | I475: 23.15 | J475: 14.60 | K475: 14.70 | L475: 15.20 | M475: 14.95 | N475: 14.40 | O475: 21.975000000000001 | P475: 76.924999999999997 | Q475: 0.0 | R475: 76.924999999999997
A476: Stampede Band | C476: 1 | D476: 1 | E476: 1 | F476: 1 | G476: 1 | H476: 1 | I476: 1 | J476: 1 | K476: 1 | L476: 1 | M476: 1 | N476: 1 | O476: 1 | P476: 1 | R476: 1
A479: 8/9/2022 Marion, Indiana--DCI Open Class World Championship Finals
C480: General Effect | F480: Visual | J480: Music
C481: 1 | D481: 2 | F481: Proficiency | G481: Analysis | H481: Color Guard | J481: Brass | K481: Analysis 1 | L481: Analysis 2 | M481: Analysis | N481: Percussion | P481: Sub | R481: Total
C482: M. Czapinski | D482: J. Denton | E482: Total | F482: R. Solomon | G482: D. Deems | H482: C. Quamme | I482: Total ÷2 | J482: A. Cook | K482: J. Kennedy | L482: K. Weirich | M482: Average | N482: A. Kristensen | O482: Total ÷2 | P482: Total | Q482: Pen | R482: Score
A483: DCI Open Class | C483: 20 | D483: 20 | E483: 40 | F483: 20 | G483: 20 | H483: 20 | I483: 30 | J483: 20 | K483: 20 | L483: 20 | M483: 20 | N483: 20 | O483: 30 | P483: 100 | R483: 100
A484: Vanguard | B484: 12 | C484: 16.60 | D484: 17.00 | E484: 33.60 | F484: 16.60 | G484: 17.00 | H484: 16.80 | I484: 25.200 | J484: 16.50 | K484: 16.50 | L484: 16.50 | M484: 16.500 | N484: 16.50 | O484: 24.7500 | P484: 83.5500 | Q484: 0.0 | R484: 83.5500
A485: Cadets | C485: 1 | D485: 1 | E485: 1 | F485: 1 | G485: 1 | H485: 1 | I485: 1 | J485: 1 | K485: 1 | L485: 2 | M485: 2 | N485: 1 | O485: 1 | P485: 1 | R485: 1
A486: Gold | B486: 11 | C486: 16.40 | D486: 16.80 | E486: 33.20 | F486: 16.40 | G486: 16.55 | H486: 16.20 | I486: 24.574999999999999 | J486: 16.05 | K486: 15.90 | L486: 16.10 | M486: 16.000 | N486: 16.20 | O486: 24.125 | P486: 81.9000 | Q486: 0.0 | R486: 81.9000
C487: 2 | D487: 2 | E487: 2 | F487: 2 | G487: 3 | H487: 3 | I487: 2 | J487: 3 | K487: 5 | L487: 4 | M487: 4 | N487: 2 | O487: 4 | P487: 2 | R487: 2
A488: Blue | B488: 10 | C488: 16.10 | D488: 16.60 | E488: 32.70 | F488: 16.30 | G488: 16.20 | H488: 16.60 | I488: 24.550 | J488: 16.00 | K488: 16.35 | L488: 16.70 | M488: 16.524999999999999 | N488: 16.15 | O488: 24.337499999999999 | P488: 81.587500000000006 | Q488: 0.0 | R488: 81.587500000000006
A489: Devils B | C489: 3 | D489: 3 | E489: 3 | F489: 3 | G489: 4 | H489: 2 | I489: 3 | J489: 4 | K489: 2 | L489: 1 | M489: 1 | N489: 3 | O489: 2 | P489: 3 | R489: 3
A490: Spartans | B490: 9 | C490: 16.00 | D490: 16.40 | E490: 32.40 | F490: 16.00 | G490: 16.70 | H490: 16.10 | I490: 24.400 | J490: 16.10 | K490: 16.20 | L490: 16.30 | M490: 16.250 | N490: 16.10 | O490: 24.225000000000001 | P490: 81.025000000000006 | Q490: 0.0 | R490: 81.025000000000006
C491: 4 | D491: 4 | E491: 4 | F491: 4 | G491: 2 | H491: 4 | I491: 4 | J491: 2 | K491: 3 | L491: 3 | M491: 3 | N491: 4 | O491: 3 | P491: 4 | R491: 4
A492: Guardians | B492: 8 | C492: 15.90 | D492: 16.10 | E492: 32.00 | F492: 15.60 | G492: 16.00 | H492: 15.70 | I492: 23.650 | J492: 15.70 | K492: 15.95 | L492: 15.90 | M492: 15.925000000000001 | N492: 15.50 | O492: 23.5625 | P492: 79.212500000000006 | Q492: 0.0 | R492: 79.212500000000006
C493: 5 | D493: 5 | E493: 5 | F493: 5 | G493: 5 | H493: 5 | I493: 5 | J493: 5 | K493: 4 | L493: 5 | M493: 5 | N493: 5 | O493: 5 | P493: 5 | R493: 5
A494: Southwind | B494: 7 | C494: 15.60 | D494: 15.80 | E494: 31.40 | F494: 15.30 | G494: 15.50 | H494: 15.60 | I494: 23.200 | J494: 15.30 | K494: 15.85 | L494: 15.60 | M494: 15.725 | N494: 15.05 | O494: 23.037500000000001 | P494: 77.637500000000003 | Q494: 0.0 | R494: 77.637500000000003
C495: 6 | D495: 6 | E495: 6 | F495: 6 | G495: 6 | H495: 6 | I495: 6 | J495: 6 | K495: 6 | L495: 6 | M495: 6 | N495: 7 | O495: 6 | P495: 6 | R495: 6
A496: Battalion | B496: 5 | C496: 15.40 | D496: 15.20 | E496: 30.60 | F496: 15.10 | G496: 15.40 | H496: 14.70 | I496: 22.000 | J496: 14.90 | K496: 14.90 | L496: 15.50 | M496: 15.200 | N496: 14.70 | O496: 22.4000 | P496: 75.6000 | Q496: 0.0 | R496: 75.6000
C497: 7 | D497: 7 | E497: 7 | F497: 7 | G497: 7 | H497: 9 | I497: 10 | J497: 8 | K497: 9 | L497: 7 | M497: 7 | N497: 9 | O497: 8 | P497: 7 | R497: 7
A498: Legends | B498: 6 | C498: 14.90 | D498: 15.00 | E498: 29.90 | F498: 14.60 | G498: 14.90 | H498: 15.10 | I498: 22.300 | J498: 15.10 | K498: 14.80 | L498: 15.20 | M498: 15.000 | N498: 15.00 | O498: 22.5500 | P498: 74.7500 | Q498: 0.0 | R498: 74.7500
C499: 9 | D499: 8 | E499: 8 | F499: 9 | G499: 9 | H499: 7 | I499: 7 | J499: 7 | K499: 10 | L499: 8 | M499: 9 | N499: 8 | O499: 7 | P499: 8 | R499: 8
A500: Louisana | B500: 3 | C500: 15.10 | D500: 14.60 | E500: 29.70 | F500: 14.50 | G500: 15.30 | H500: 14.30 | I500: 22.050 | J500: 14.50 | K500: 15.00 | L500: 15.00 | M500: 15.000 | N500: 15.30 | O500: 22.4000 | P500: 74.1500 | Q500: 0.0 | R500: 74.1500
A501: Stars | C501: 8 | D501: 9 | E501: 9 | F501: 10 | G501: 8 | H501: 10 | I501: 9 | J501: 9 | K501: 8 | L501: 9 | M501: 9 | N501: 6 | O501: 8 | P501: 9 | R501: 9
A502: River City | B502: 4 | C502: 14.70 | D502: 14.40 | E502: 29.10 | F502: 14.70 | G502: 14.70 | H502: 15.00 | I502: 22.200 | J502: 14.20 | K502: 15.40 | L502: 14.70 | M502: 15.050 | N502: 14.60 | O502: 21.925000000000001 | P502: 73.224999999999994 | Q502: 0.0 | R502: 73.224999999999994
A503: Rhythm | C503: 10 | D503: 10 | E503: 10 | F503: 8 | G503: 10 | H503: 8 | I503: 8 | J503: 10 | K503: 7 | L503: 10 | M503: 8 | N503: 10 | O503: 10 | P503: 10 | R503: 10
A504: 7th | B504: 2 | C504: 14.20 | D504: 13.80 | E504: 28.00 | F504: 14.10 | G504: 14.50 | H504: 14.00 | I504: 21.300 | J504: 13.90 | K504: 13.40 | L504: 14.10 | M504: 13.750 | N504: 14.00 | O504: 20.824999999999999 | P504: 70.125 | Q504: 0.0 | R504: 70.125
A505: Regiment | C505: 12 | D505: 12 | E505: 12 | F505: 11 | G505: 11 | H505: 12 | I505: 11 | J505: 11 | K505: 12 | L505: 11 | M505: 11 | N505: 11 | O505: 11 | P505: 11 | R505: 11
A506: Les | B506: 1 | C506: 14.50 | D506: 14.10 | E506: 28.60 | F506: 13.70 | G506: 13.60 | H506: 14.10 | I506: 20.700 | J506: 13.50 | K506: 13.50 | L506: 13.70 | M506: 13.600 | N506: 13.30 | O506: 20.2000 | P506: 69.5000 | Q506: 0.0 | R506: 69.5000
A507: Stentors | C507: 11 | D507: 11 | E507: 11 | F507: 12 | G507: 12 | H507: 11 | I507: 12 | J507: 12 | K507: 11 | L507: 12 | M507: 12 | N507: 12 | O507: 12 | P507: 12 | R507: 12
A508: DCI International Class
A509: Calgary | B509: 1 | C509: 16.20 | D509: 16.00 | E509: 32.20 | F509: 15.00 | G509: 15.70 | H509: 16.10 | I509: 23.400 | J509: 15.30 | K509: 15.30 | L509: 15.40 | M509: 15.350 | N509: 15.10 | O509: 22.875 | P509: 78.474999999999994 | Q509: 0.0 | R509: 78.474999999999994
A510: Stampede Band | C510: 1 | D510: 1 | E510: 1 | F510: 1 | G510: 1 | H510: 1 | I510: 1 | J510: 1 | K510: 1 | L510: 1 | M510: 1 | N510: 1 | O510: 1 | P510: 1 | R510: 1
A513: 8/11/2022 Indianapolis, Indiana--DCI World Class World Championship Prelims
C514: General Effect | J514: Visual | N514: Music
C515: 1 | D515: 1 | F515: 2 | G515: 2 | J515: Proficiency | K515: Analysis | L515: Color Guard | N515: Brass | O515: Analysis 1 | P515: Analysis 2 | Q515: Analysis | R515: Percussion | T515: Sub | V515: Total
C516: D. Padilla | D516: T. Wemhoff | E516: Average | F516: C. Hestin | G516: G. Miller | H516: Average | I516: Total | J516: C. Moss | K516: B. Kuhn | L516: I. Jenkins | M516: Total ÷2 | N516: B Fabrizio | O516: J. Webb | P516: R. Greenwell | Q516: Average | R516: J. Brooks | S516: Total ÷2 | T516: Total | U516: Pen | V516: Score
A517: DCI World Class | C517: 20 | D517: 20 | E517: 20 | F517: 20 | G517: 20 | H517: 20 | I517: 40 | J517: 20 | K517: 20 | L517: 20 | M517: 30 | N517: 20 | O517: 20 | P517: 20 | Q517: 20 | R517: 20 | S517: 30 | T517: 100 | V517: 100
A518: Blue | B518: 35 | C518: 19.50 | D518: 19.60 | E518: 19.550 | F518: 19.50 | G518: 19.40 | H518: 19.45 | I518: 39.000 | J518: 19.50 | K518: 19.60 | L518: 19.00 | M518: 29.050 | N518: 19.60 | O518: 19.50 | P518: 19.60 | Q518: 19.550 | R518: 19.65 | S518: 29.4000 | T518: 97.4500 | U518: 0.0 | V518: 97.4500
A519: Devils | C519: 1 | D519: 1 | E519: 1 | F519: 1 | G519: 1 | H519: 1 | I519: 1 | J519: 2 | K519: 1 | L519: 2 | M519: 1 | N519: 1 | O519: 1 | P519: 1 | Q519: 1 | R519: 1 | S519: 1 | T519: 1 | V519: 1
A520: Boston | B520: 34 | C520: 19.10 | D520: 19.40 | E520: 19.250 | F520: 19.35 | G520: 19.20 | H520: 19.274999999999999 | I520: 38.524999999999999 | J520: 19.40 | K520: 19.30 | L520: 19.20 | M520: 28.950 | N520: 19.45 | O520: 19.25 | P520: 19.45 | Q520: 19.350 | R520: 19.25 | S520: 29.024999999999999 | T520: 96.5000 | U520: 0.0 | V520: 96.5000
A521: Crusaders | C521: 2 | D521: 2 | E521: 2 | F521: 2 | G521: 2 | H521: 2 | I521: 2 | J521: 3 | K521: 3 | L521: 1 | M521: 2 | N521: 3 | O521: 4 | P521: 2 | Q521: 2 | R521: 4 | S521: 2 | T521: 2 | V521: 2
A522: Bluecoats | B522: 32 | C522: 18.90 | D522: 19.30 | E522: 19.100 | F522: 18.95 | G522: 18.90 | H522: 18.925000000000001 | I522: 38.024999999999999 | J522: 19.55 | K522: 19.25 | L522: 18.70 | M522: 28.750 | N522: 19.10 | O522: 19.30 | P522: 19.10 | Q522: 19.200 | R522: 19.55 | S522: 28.925000000000001 | T522: 95.7000 | U522: 0.0 | V522: 95.7000
C523: 4 | D523: 3 | E523: 3 | F523: 4 | G523: 3 | H523: 4 | I523: 3 | J523: 1 | K523: 4 | L523: 3 | M523: 3 | N523: 4 | O523: 3 | P523: 4 | Q523: 4 | R523: 2 | S523: 4 | T523: 3 | V523: 3
A524: Carolina | B524: 33 | C524: 19.00 | D524: 19.00 | E524: 19.000 | F524: 19.25 | G524: 18.70 | H524: 18.975000000000001 | I524: 37.975000000000001 | J524: 19.20 | K524: 19.40 | L524: 18.65 | M524: 28.625 | N524: 19.50 | O524: 19.45 | P524: 19.25 | Q524: 19.350 | R524: 19.05 | S524: 28.9500 | T524: 95.5500 | U524: 0.0 | V524: 95.5500
A525: Crown | C525: 3 | D525: 4 | E525: 4 | F525: 3 | G525: 4 | H525: 3 | I525: 4 | J525: 4 | K525: 2 | L525: 4 | M525: 4 | N525: 2 | O525: 2 | P525: 3 | Q525: 2 | R525: 5 | S525: 3 | T525: 4 | V525: 4
A526: Vanguard | B526: 31 | C526: 18.50 | D526: 18.80 | E526: 18.650 | F526: 18.90 | G526: 18.35 | H526: 18.625 | I526: 37.274999999999999 | J526: 19.10 | K526: 19.10 | L526: 18.40 | M526: 28.300 | N526: 18.70 | O526: 18.90 | P526: 19.00 | Q526: 18.950 | R526: 19.35 | S526: 28.5000 | T526: 94.075000000000003 | U526: 0.0 | V526: 94.075000000000003
C527: 5 | D527: 5 | E527: 5 | F527: 5 | G527: 6 | H527: 5 | I527: 5 | J527: 5 | K527: 5 | L527: 5 | M527: 5 | N527: 6 | O527: 5 | P527: 5 | Q527: 5 | R527: 3 | S527: 5 | T527: 5 | V527: 5
A528: Cadets | B528: 30 | C528: 18.30 | D528: 18.50 | E528: 18.400 | F528: 18.60 | G528: 18.50 | H528: 18.550 | I528: 36.950 | J528: 18.65 | K528: 18.90 | L528: 18.00 | M528: 27.774999999999999 | N528: 18.90 | O528: 18.50 | P528: 18.80 | Q528: 18.650 | R528: 18.75 | S528: 28.1500 | T528: 92.875 | U528: 0.0 | V528: 92.875
C529: 6 | D529: 6 | E529: 6 | F529: 6 | G529: 5 | H529: 6 | I529: 6 | J529: 6 | K529: 6 | L529: 6 | M529: 6 | N529: 5 | O529: 6 | P529: 6 | Q529: 6 | R529: 7 | S529: 6 | T529: 6 | V529: 6
A530: Blue | B530: 29 | C530: 18.20 | D530: 18.30 | E530: 18.250 | F530: 18.00 | G530: 18.20 | H530: 18.100 | I530: 36.350 | J530: 18.40 | K530: 18.60 | L530: 17.70 | M530: 27.350 | N530: 18.30 | O530: 18.25 | P530: 18.75 | Q530: 18.500 | R530: 18.55 | S530: 27.675000000000001 | T530: 91.375 | U530: 0.0 | V530: 91.375
A531: Stars | C531: 7 | D531: 7 | E531: 7 | F531: 9 | G531: 7 | H531: 7 | I531: 7 | J531: 8 | K531: 8 | L531: 7 | M531: 8 | N531: 9 | O531: 7 | P531: 7 | Q531: 7 | R531: 8 | S531: 8 | T531: 7 | V531: 7
A532: Cavaliers | B532: 28 | C532: 17.60 | D532: 18.00 | E532: 17.800 | F532: 18.30 | G532: 17.80 | H532: 18.050 | I532: 35.850 | J532: 18.60 | K532: 18.65 | L532: 17.60 | M532: 27.425000000000001 | N532: 18.50 | O532: 17.95 | P532: 18.50 | Q532: 18.225000000000001 | R532: 19.00 | S532: 27.862500000000001 | T532: 91.137500000000003 | U532: 0.0 | V532: 91.137500000000003
C533: 10 | D533: 9 | E533: 9 | F533: 7 | G533: 9 | H533: 9 | I533: 9 | J533: 7 | K533: 7 | L533: 8 | M533: 7 | N533: 7 | O533: 8 | P533: 8 | Q533: 8 | R533: 6 | S533: 7 | T533: 8 | V533: 8
A534: Phantom | B534: 26 | C534: 17.70 | D534: 18.10 | E534: 17.900 | F534: 18.25 | G534: 17.90 | H534: 18.074999999999999 | I534: 35.975000000000001 | J534: 18.00 | K534: 18.10 | L534: 17.30 | M534: 26.700 | N534: 18.05 | O534: 17.70 | P534: 17.90 | Q534: 17.800 | R534: 18.25 | S534: 27.0500 | T534: 89.724999999999994 | U534: 0.0 | V534: 89.724999999999994
A535: Regiment | C535: 9 | D535: 8 | E535: 8 | F535: 8 | G535: 8 | H535: 8 | I535: 8 | J535: 10 | K535: 10 | L535: 10 | M535: 10 | N535: 10 | O535: 10 | P535: 10 | Q535: 10 | R535: 11 | S535: 9 | T535: 9 | V535: 9
A536: Mandarins | B536: 25 | C536: 17.80 | D536: 17.80 | E536: 17.800 | F536: 17.50 | G536: 17.70 | H536: 17.600 | I536: 35.400 | J536: 18.10 | K536: 18.30 | L536: 17.40 | M536: 26.900 | N536: 17.80 | O536: 17.80 | P536: 18.30 | Q536: 18.050 | R536: 17.90 | S536: 26.875 | T536: 89.174999999999997 | U536: 0.0 | V536: 89.174999999999997
C537: 8 | D537: 10 | E537: 9 | F537: 11 | G537: 10 | H537: 10 | I537: 10 | J537: 9 | K537: 9 | L537: 9 | M537: 9 | N537: 12 | O537: 9 | P537: 9 | Q537: 9 | R537: 13 | S537: 10 | T537: 10 | V537: 10
A538: Colts | B538: 24 | C538: 17.20 | D538: 17.40 | E538: 17.300 | F538: 16.95 | G538: 17.50 | H538: 17.225000000000001 | I538: 34.524999999999999 | J538: 17.60 | K538: 17.90 | L538: 16.90 | M538: 26.200 | N538: 17.65 | O538: 16.70 | P538: 17.35 | Q538: 17.024999999999999 | R538: 18.30 | S538: 26.487500000000001 | T538: 87.212500000000006 | U538: 0.0 | V538: 87.212500000000006
C539: 11 | D539: 11 | E539: 11 | F539: 15 | G539: 11 | H539: 13 | I539: 11 | J539: 11 | K539: 11 | L539: 11 | M539: 11 | N539: 13 | O539: 13 | P539: 11 | Q539: 12 | R539: 10 | S539: 13 | T539: 11 | V539: 11
A540: Troopers | B540: 22 | C540: 17.00 | D540: 17.10 | E540: 17.050 | F540: 17.40 | G540: 17.30 | H540: 17.350 | I540: 34.400 | J540: 17.20 | K540: 17.50 | L540: 16.50 | M540: 25.600 | N540: 18.00 | O540: 16.60 | P540: 17.10 | Q540: 16.850 | R540: 18.50 | S540: 26.675000000000001 | T540: 86.674999999999997 | U540: 0.0 | V540: 86.674999999999997
C541: 12 | D541: 12 | E541: 12 | F541: 12 | G541: 12 | H541: 12 | I541: 12 | J541: 13 | K541: 13 | L541: 13 | M541: 13 | N541: 11 | O541: 15 | P541: 13 | Q541: 14 | R541: 9 | S541: 11 | T541: 12 | V541: 12
A542: Crossmen | B542: 25 | C542: 16.80 | D542: 16.90 | E542: 16.850 | F542: 17.75 | G542: 17.00 | H542: 17.375 | I542: 34.225000000000001 | J542: 17.40 | K542: 17.40 | L542: 16.70 | M542: 25.750 | N542: 18.35 | O542: 17.00 | P542: 16.90 | Q542: 16.950 | R542: 18.00 | S542: 26.6500 | T542: 86.625 | U542: 0.0 | V542: 86.625
C543: 14 | D543: 13 | E543: 13 | F543: 10 | G543: 13 | H543: 11 | I543: 13 | J543: 12 | K543: 14 | L543: 12 | M543: 12 | N543: 8 | O543: 12 | P543: 14 | Q543: 13 | R543: 12 | S543: 12 | T543: 13 | V543: 13
A544: Blue | B544: 23 | C544: 16.90 | D544: 16.80 | E544: 16.850 | F544: 17.25 | G544: 16.45 | H544: 16.850 | I544: 33.700 | J544: 17.00 | K544: 17.60 | L544: 16.35 | M544: 25.475000000000001 | N544: 17.60 | O544: 17.05 | P544: 17.15 | Q544: 17.100 | R544: 17.45 | S544: 26.074999999999999 | T544: 85.2500 | U544: 0.0 | V544: 85.2500
A545: Knights | C545: 13 | D545: 14 | E545: 13 | F545: 13 | G545: 15 | H545: 14 | I545: 14 | J545: 14 | K545: 12 | L545: 14 | M545: 14 | N545: 14 | O545: 11 | P545: 12 | Q545: 11 | R545: 15 | S545: 14 | T545: 14 | V545: 14
A546: Madison | B546: 21 | C546: 16.30 | D546: 16.50 | E546: 16.400 | F546: 16.60 | G546: 16.50 | H546: 16.550 | I546: 32.950 | J546: 16.80 | K546: 17.10 | L546: 16.20 | M546: 25.050 | N546: 17.20 | O546: 16.65 | P546: 16.45 | Q546: 16.550 | R546: 17.70 | S546: 25.725000000000001 | T546: 83.724999999999994 | U546: 0.0 | V546: 83.724999999999994
A547: Scouts | C547: 15 | D547: 15 | E547: 15 | F547: 17 | G547: 14 | H547: 16 | I547: 16 | J547: 15 | K547: 15 | L547: 15 | M547: 15 | N547: 16 | O547: 14 | P547: 15 | Q547: 15 | R547: 14 | S547: 15 | T547: 15 | V547: 15
A548: Academy | B548: 20 | C548: 16.20 | D548: 16.40 | E548: 16.300 | F548: 17.05 | G548: 16.30 | H548: 16.675000000000001 | I548: 32.975000000000001 | J548: 16.50 | K548: 16.90 | L548: 15.80 | M548: 24.600 | N548: 16.65 | O548: 16.20 | P548: 15.65 | Q548: 15.925000000000001 | R548: 17.25 | S548: 24.912500000000001 | T548: 82.487499999999997 | U548: 0.0 | V548: 82.487499999999997
C549: 16 | D549: 16 | E549: 16 | F549: 14 | G549: 16 | H549: 15 | I549: 15 | J549: 17 | K549: 16 | L549: 18 | M549: 16 | N549: 20 | O549: 16 | P549: 21 | Q549: 18 | R549: 16 | S549: 17 | T549: 16 | V549: 16
A550: Music | B550: 19 | C550: 15.70 | D550: 16.30 | E550: 16.000 | F550: 16.55 | G550: 15.90 | H550: 16.225000000000001 | I550: 32.225000000000001 | J550: 16.10 | K550: 16.45 | L550: 16.10 | M550: 24.324999999999999 | N550: 17.10 | O550: 15.85 | P550: 16.20 | Q550: 16.024999999999999 | R550: 17.20 | S550: 25.162500000000001 | T550: 81.712500000000006 | U550: 0.0 | V550: 81.712500000000006
A551: City | C551: 18 | D551: 17 | E551: 18 | F551: 18 | G551: 18 | H551: 17 | I551: 17 | J551: 20 | K551: 19 | L551: 16 | M551: 18 | N551: 17 | O551: 18 | P551: 17 | Q551: 16 | R551: 17 | S551: 16 | T551: 17 | V551: 17
A552: Vanguard | B552: 15 | C552: 16.10 | D552: 16.10 | E552: 16.100 | F552: 16.15 | G552: 16.10 | H552: 16.125 | I552: 32.225000000000001 | J552: 16.60 | K552: 16.75 | L552: 15.75 | M552: 24.550 | N552: 16.70 | O552: 15.70 | P552: 16.30 | Q552: 16.000 | R552: 16.80 | S552: 24.7500 | T552: 81.525000000000006 | U552: 0.0 | V552: 81.525000000000006
A553: Cadets | C553: 17 | D553: 18 | E553: 17 | F553: 21 | G553: 17 | H553: 18 | I553: 17 | J553: 16 | K553: 17 | L553: 19 | M553: 17 | N553: 19 | O553: 20 | P553: 16 | Q553: 17 | R553: 19 | S553: 19 | T553: 18 | V553: 18
A554: Genesis | B554: 17 | C554: 14.90 | D554: 15.80 | E554: 15.350 | F554: 16.80 | G554: 15.30 | H554: 16.050 | I554: 31.400 | J554: 16.30 | K554: 15.70 | L554: 15.00 | M554: 23.500 | N554: 17.40 | O554: 16.00 | P554: 15.05 | Q554: 15.525 | R554: 16.90 | S554: 24.912500000000001 | T554: 79.8125 | U554: 0.0 | V554: 79.8125
C555: 22 | D555: 19 | E555: 21 | F555: 16 | G555: 21 | H555: 19 | I555: 19 | J555: 18 | K555: 23 | L555: 24 | M555: 23 | N555: 15 | O555: 17 | P555: 26 | Q555: 22 | R555: 18 | S555: 17 | T555: 19 | V555: 19
A556: Pacific | B556: 18 | C556: 15.60 | D556: 15.45 | E556: 15.525 | F556: 16.25 | G556: 15.50 | H556: 15.875 | I556: 31.400 | J556: 16.20 | K556: 16.05 | L556: 15.90 | M556: 24.074999999999999 | N556: 16.90 | O556: 15.80 | P556: 15.45 | Q556: 15.625 | R556: 15.95 | S556: 24.237500000000001 | T556: 79.712500000000006 | U556: 0.0 | V556: 79.712500000000006
A557: Crest | C557: 19 | D557: 21 | E557: 20 | F557: 20 | G557: 20 | H557: 20 | I557: 19 | J557: 19 | K557: 21 | L557: 17 | M557: 19 | N557: 18 | O557: 19 | P557: 22 | Q557: 21 | R557: 23 | S557: 20 | T557: 20 | V557: 20
A558: Gold | B558: 14 | C558: 15.40 | D558: 15.70 | E558: 15.550 | F558: 15.95 | G558: 15.70 | H558: 15.824999999999999 | I558: 31.375 | J558: 15.80 | K558: 16.20 | L558: 15.50 | M558: 23.750 | N558: 16.45 | O558: 15.65 | P558: 15.80 | Q558: 15.725 | R558: 16.10 | S558: 24.137499999999999 | T558: 79.262500000000003 | U558: 0.0 | V558: 79.262500000000003
C559: 20 | D559: 20 | E559: 19 | F559: 23 | G559: 19 | H559: 21 | I559: 21 | J559: 23 | K559: 20 | L559: 20 | M559: 21 | N559: 21 | O559: 21 | P559: 20 | Q559: 19 | R559: 22 | S559: 21 | T559: 21 | V559: 21
A560: Blue | B560: 13 | C560: 15.30 | D560: 15.40 | E560: 15.350 | F560: 16.50 | G560: 15.10 | H560: 15.800 | I560: 31.150 | J560: 15.90 | K560: 16.50 | L560: 15.15 | M560: 23.774999999999999 | N560: 15.90 | O560: 15.35 | P560: 16.00 | Q560: 15.675000000000001 | R560: 16.20 | S560: 23.887499999999999 | T560: 78.8125 | U560: 0.0 | V560: 78.8125
A561: Devils B | C561: 21 | D561: 22 | E561: 21 | F561: 19 | G561: 22 | H561: 22 | I561: 22 | J561: 22 | K561: 18 | L561: 22 | M561: 20 | N561: 23 | O561: 22 | P561: 18 | Q561: 20 | R561: 21 | S561: 22 | T561: 22 | V561: 22
A562: Spartans | B562: 12 | C562: 14.80 | D562: 15.30 | E562: 15.050 | F562: 15.75 | G562: 14.70 | H562: 15.225 | I562: 30.274999999999999 | J562: 16.00 | K562: 15.80 | L562: 15.25 | M562: 23.524999999999999 | N562: 16.30 | O562: 15.10 | P562: 15.90 | Q562: 15.500 | R562: 15.70 | S562: 23.7500 | T562: 77.5500 | U562: 0.0 | V562: 77.5500
C563: 23 | D563: 23 | E563: 23 | F563: 25 | G563: 24 | H563: 24 | I563: 23 | J563: 21 | K563: 22 | L563: 21 | M563: 22 | N563: 22 | O563: 23 | P563: 19 | Q563: 23 | R563: 24 | S563: 23 | T563: 23 | V563: 23
A564: Guardians | B564: 11 | C564: 14.60 | D564: 15.20 | E564: 14.900 | F564: 15.70 | G564: 14.20 | H564: 14.950 | I564: 29.850 | J564: 15.20 | K564: 15.30 | L564: 15.10 | M564: 22.800 | N564: 15.80 | O564: 14.65 | P564: 15.40 | Q564: 15.025 | R564: 16.30 | S564: 23.5625 | T564: 76.212500000000006 | U564: 0.0 | V564: 76.212500000000006
C565: 24 | D565: 24 | E565: 24 | F565: 26 | G565: 28 | H565: 26 | I565: 24 | J565: 26 | K565: 25 | L565: 23 | M565: 24 | N565: 25 | O565: 27 | P565: 23 | Q565: 24 | R565: 20 | S565: 24 | T565: 24 | V565: 24
A566: Jersey | B566: 16 | C566: 14.40 | D566: 14.80 | E566: 14.600 | F566: 15.90 | G566: 14.55 | H566: 15.225 | I566: 29.824999999999999 | J566: 15.70 | K566: 15.00 | L566: 14.55 | M566: 22.625 | N566: 15.90 | O566: 15.00 | P566: 14.80 | Q566: 14.900 | R566: 14.35 | S566: 22.375 | T566: 74.825000000000003 | U566: 0.0 | V566: 74.825000000000003
A567: Surf | C567: 25 | D567: 25 | E567: 25 | F567: 24 | G567: 25 | H567: 24 | I567: 25 | J567: 24 | K567: 26 | L567: 27 | M567: 25 | N567: 23 | O567: 24 | P567: 28 | Q567: 25 | R567: 30 | S567: 27 | T567: 25 | V567: 25
A568: Calgary | B568: 10 | C568: 14.00 | D568: 14.50 | E568: 14.250 | F568: 16.00 | G568: 14.90 | H568: 15.450 | I568: 29.700 | J568: 14.65 | K568: 15.60 | L568: 14.80 | M568: 22.524999999999999 | N568: 14.90 | O568: 14.80 | P568: 14.30 | Q568: 14.550 | R568: 14.40 | S568: 21.925000000000001 | T568: 74.1500 | U568: 0.0 | V568: 74.1500
A569: Stampede Band | C569: 26 | D569: 26 | E569: 26 | F569: 22 | G569: 23 | H569: 23 | I569: 26 | J569: 29 | K569: 24 | L569: 26 | M569: 26 | N569: 28 | O569: 25 | P569: 30 | Q569: 29 | R569: 29 | S569: 29 | T569: 26 | V569: 26
A570: Battalion | B570: 8 | C570: 13.70 | D570: 14.30 | E570: 14.000 | F570: 15.50 | G570: 13.90 | H570: 14.700 | I570: 28.700 | J570: 15.00 | K570: 14.70 | L570: 14.20 | M570: 21.950 | N570: 15.00 | O570: 14.50 | P570: 15.15 | Q570: 14.824999999999999 | R570: 15.20 | S570: 22.512499999999999 | T570: 73.162499999999994 | U570: 0.0 | V570: 73.162499999999994
C571: 28 | D571: 28 | E571: 28 | F571: 27 | G571: 30 | H571: 28 | I571: 28 | J571: 27 | K571: 28 | L571: 29 | M571: 29 | N571: 27 | O571: 29 | P571: 25 | Q571: 27 | R571: 25 | S571: 26 | T571: 27 | V571: 27
A572: Southwind | B572: 9 | C572: 13.90 | D572: 14.40 | E572: 14.150 | F572: 15.15 | G572: 14.30 | H572: 14.725 | I572: 28.875 | J572: 14.70 | K572: 14.90 | L572: 14.90 | M572: 22.250 | N572: 14.60 | O572: 14.60 | P572: 15.20 | Q572: 14.900 | R572: 14.50 | S572: 22.0000 | T572: 73.125 | U572: 0.0 | V572: 73.125
C573: 27 | D573: 27 | E573: 27 | F573: 28 | G573: 27 | H573: 27 | I573: 27 | J573: 28 | K573: 27 | L573: 25 | M573: 27 | N573: 30 | O573: 28 | P573: 24 | Q573: 25 | R573: 28 | S573: 28 | T573: 28 | V573: 28
A574: Legends | B574: 7 | C574: 13.60 | D574: 14.00 | E574: 13.800 | F574: 14.80 | G574: 14.45 | H574: 14.625 | I574: 28.425000000000001 | J574: 15.40 | K574: 14.60 | L574: 14.00 | M574: 22.000 | N574: 15.20 | O574: 14.70 | P574: 14.90 | Q574: 14.800 | R574: 15.10 | S574: 22.5500 | T574: 72.974999999999994 | U574: 0.0 | V574: 72.974999999999994
C575: 29 | D575: 29 | E575: 29 | F575: 30 | G575: 26 | H575: 29 | I575: 29 | J575: 25 | K575: 29 | L575: 30 | M575: 28 | N575: 26 | O575: 26 | P575: 27 | Q575: 28 | R575: 26 | S575: 25 | T575: 29 | V575: 29
A576: Louisiana | B576: 6 | C576: 13.20 | D576: 13.40 | E576: 13.300 | F576: 15.00 | G576: 13.60 | H576: 14.300 | I576: 27.600 | J576: 14.00 | K576: 14.30 | L576: 13.60 | M576: 20.950 | N576: 14.70 | O576: 14.40 | P576: 14.50 | Q576: 14.450 | R576: 13.80 | S576: 21.475000000000001 | T576: 70.025000000000006 | U576: 0.0 | V576: 70.025000000000006
A577: Stars | C577: 30 | D577: 31 | E577: 30 | F577: 29 | G577: 31 | H577: 30 | I577: 30 | J577: 32 | K577: 30 | L577: 32 | M577: 31 | N577: 29 | O577: 30 | P577: 29 | Q577: 30 | R577: 32 | S577: 30 | T577: 30 | V577: 30
A578: River City | B578: 5 | C578: 13.10 | D578: 13.30 | E578: 13.200 | F578: 14.40 | G578: 14.10 | H578: 14.250 | I578: 27.450 | J578: 14.30 | K578: 13.90 | L578: 13.90 | M578: 21.050 | N578: 13.90 | O578: 14.20 | P578: 14.20 | Q578: 14.200 | R578: 14.80 | S578: 21.4500 | T578: 69.9500 | U578: 0.0 | V578: 69.9500
A579: Rhythm | C579: 31 | D579: 32 | E579: 32 | F579: 31 | G579: 29 | H579: 31 | I579: 31 | J579: 31 | K579: 32 | L579: 31 | M579: 30 | N579: 32 | O579: 31 | P579: 31 | Q579: 31 | R579: 27 | S579: 31 | T579: 31 | V579: 31
A580: Les | B580: 3 | C580: 12.80 | D580: 13.10 | E580: 12.950 | F580: 14.30 | G580: 13.40 | H580: 13.850 | I580: 26.800 | J580: 13.80 | K580: 13.30 | L580: 14.30 | M580: 20.700 | N580: 13.60 | O580: 13.00 | P580: 13.70 | Q580: 13.350 | R580: 13.10 | S580: 20.024999999999999 | T580: 67.525000000000006 | U580: 0.0 | V580: 67.525000000000006
A581: Stentors | C581: 33 | D581: 33 | E581: 33 | F581: 32 | G581: 32 | H581: 32 | I581: 32 | J581: 33 | K581: 35 | L581: 28 | M581: 32 | N581: 33 | O581: 34 | P581: 33 | Q581: 33 | R581: 35 | S581: 33 | T581: 33 | V581: 32
A582: 7th | B582: 4 | C582: 12.90 | D582: 13.70 | E582: 13.300 | F582: 13.60 | G582: 13.20 | H582: 13.400 | I582: 26.700 | J582: 14.40 | K582: 13.50 | L582: 13.40 | M582: 20.650 | N582: 14.20 | O582: 13.15 | P582: 13.80 | Q582: 13.475 | R582: 14.00 | S582: 20.837499999999999 | T582: 68.1875 | U582: 2.0 | V582: 66.1875
A583: Regiment | C583: 32 | D583: 30 | E583: 30 | F583: 34 | G583: 33 | H583: 33 | I583: 33 | J583: 30 | K583: 33 | L583: 33 | M583: 33 | N583: 31 | O583: 33 | P583: 32 | Q583: 32 | R583: 31 | S583: 32 | T583: 32 | V583: 33
A584: Raiders | B584: 2 | C584: 12.40 | D584: 12.70 | E584: 12.550 | F584: 13.30 | G584: 13.00 | H584: 13.150 | I584: 25.700 | J584: 13.60 | K584: 14.00 | L584: 13.00 | M584: 20.300 | N584: 13.10 | O584: 13.50 | P584: 13.00 | Q584: 13.250 | R584: 13.30 | S584: 19.824999999999999 | T584: 65.825000000000003 | U584: 0.0 | V584: 65.825000000000003
C585: 34 | D585: 34 | E585: 34 | F585: 35 | G585: 34 | H585: 35 | I585: 34 | J585: 34 | K585: 31 | L585: 34 | M585: 34 | N585: 35 | O585: 32 | P585: 35 | Q585: 34 | R585: 34 | S585: 35 | T585: 34 | V585: 34
A586: Colts | B586: 1 | C586: 12.30 | D586: 12.40 | E586: 12.350 | F586: 13.70 | G586: 12.80 | H586: 13.250 | I586: 25.600 | J586: 13.30 | K586: 13.40 | L586: 12.60 | M586: 19.650 | N586: 13.30 | O586: 12.90 | P586: 13.20 | Q586: 13.050 | R586: 13.60 | S586: 19.975000000000001 | T586: 62.225000000000001 | U586: 0.0 | V586: 62.225000000000001
A587: Cadets | C587: 35 | D587: 35 | E587: 35 | F587: 33 | G587: 35 | H587: 34 | I587: 35 | J587: 35 | K587: 34 | L587: 35 | M587: 35 | N587: 34 | O587: 35 | P587: 34 | Q587: 35 | R587: 33 | S587: 34 | T587: 35 | V587: 35
A590: 8/12/2022 Indianapolis, Indiana--DCI World Class World Championship Semi-Finals
C591: General Effect | J591: Visual | N591: Music
C592: 1 | D592: 1 | F592: 2 | G592: 2 | J592: Proficiency | K592: Analysis | L592: Color Guard | N592: Brass | O592: Analysis 1 | P592: Analysis 2 | Q592: Analysis | R592: Percussion | T592: Sub | V592: Total
C593: M. McCourt | D593: W. Chumley | E593: Average | F593: C. Rothe | G593: K. Young | H593: Average | I593: Total | J593: J. Sturgeon | K593: T. Slaughter | L593: T. Landress | M593: Total ÷2 | N593: M. Hoskins | O593: D. Carbone | P593: N. Jones | Q593: Average | R593: M. Leitzke | S593: Total ÷2 | T593: Total | U593: Pen | V593: Score
A594: DCI World Class | C594: 20 | D594: 20 | E594: 20 | F594: 20 | G594: 20 | H594: 20 | I594: 40 | J594: 20 | K594: 20 | L594: 20 | M594: 30 | N594: 20 | O594: 20 | P594: 20 | Q594: 20 | R594: 20 | S594: 30 | T594: 100 | V594: 100
A595: Blue | B595: 25 | C595: 19.80 | D595: 19.80 | E595: 19.800 | F595: 19.70 | G595: 19.70 | H595: 19.700 | I595: 39.500 | J595: 19.70 | K595: 19.70 | L595: 19.50 | M595: 29.450 | N595: 19.65 | O595: 19.70 | P595: 19.40 | Q595: 19.550 | R595: 19.50 | S595: 29.3500 | T595: 98.3000 | U595: 0.0 | V595: 98.3000
A596: Devils | C596: 1 | D596: 1 | E596: 1 | F596: 1 | G596: 1 | H596: 1 | I596: 1 | J596: 1 | K596: 1 | L596: 2 | M596: 1 | N596: 1 | O596: 1 | P596: 1 | Q596: 1 | R596: 3 | S596: 1 | T596: 1 | V596: 1
A597: Boston | B597: 24 | C597: 19.70 | D597: 19.40 | E597: 19.550 | F597: 19.50 | G597: 19.55 | H597: 19.524999999999999 | I597: 39.075000000000003 | J597: 19.20 | K597: 19.40 | L597: 19.70 | M597: 29.150 | N597: 19.15 | O597: 19.15 | P597: 18.95 | Q597: 19.050 | R597: 19.30 | S597: 28.7500 | T597: 96.974999999999994 | U597: 0.0 | V597: 96.974999999999994
A598: Crusaders | C598: 2 | D598: 3 | E598: 2 | F598: 2 | G598: 2 | H598: 2 | I598: 2 | J598: 3 | K598: 3 | L598: 1 | M598: 2 | N598: 4 | O598: 4 | P598: 4 | Q598: 4 | R598: 4 | S598: 4 | T598: 2 | V598: 2
A599: Bluecoats | B599: 23 | C599: 19.35 | D599: 19.60 | E599: 19.475000000000001 | F599: 19.30 | G599: 19.40 | H599: 19.350 | I599: 38.825000000000003 | J599: 19.50 | K599: 19.50 | L599: 19.10 | M599: 29.050 | N599: 19.30 | O599: 19.40 | P599: 19.30 | Q599: 19.350 | R599: 19.55 | S599: 29.1000 | T599: 96.974999999999994 | U599: 0.0 | V599: 96.974999999999994
C600: 3 | D600: 2 | E600: 3 | F600: 3 | G600: 3 | H600: 3 | I600: 3 | J600: 2 | K600: 2 | L600: 4 | M600: 3 | N600: 3 | O600: 3 | P600: 2 | Q600: 2 | R600: 2 | S600: 2 | T600: 2 | V600: 2
A601: Carolina | B601: 22 | C601: 19.00 | D601: 19.20 | E601: 19.100 | F601: 19.20 | G601: 19.30 | H601: 19.250 | I601: 38.350 | J601: 19.10 | K601: 19.10 | L601: 19.20 | M601: 28.700 | N601: 19.40 | O601: 19.45 | P601: 19.00 | Q601: 19.225000000000001 | R601: 18.90 | S601: 28.762499999999999 | T601: 95.8125 | U601: 0.0 | V601: 95.8125
A602: Crown | C602: 5 | D602: 4 | E602: 4 | F602: 4 | G602: 4 | H602: 4 | I602: 4 | J602: 4 | K602: 4 | L602: 3 | M602: 4 | N602: 2 | O602: 2 | P602: 3 | Q602: 3 | R602: 6 | S602: 3 | T602: 4 | V602: 4
A603: Vanguard | B603: 21 | C603: 19.10 | D603: 19.10 | E603: 19.100 | F603: 19.00 | G603: 19.15 | H603: 19.074999999999999 | I603: 38.174999999999997 | J603: 19.00 | K603: 18.90 | L603: 18.60 | M603: 28.250 | N603: 19.00 | O603: 19.00 | P603: 18.70 | Q603: 18.850 | R603: 19.60 | S603: 28.725000000000001 | T603: 95.1500 | U603: 0.0 | V603: 95.1500
C604: 4 | D604: 5 | E604: 4 | F604: 5 | G604: 5 | H604: 5 | I604: 5 | J604: 5 | K604: 5 | L604: 5 | M604: 5 | N604: 5 | O604: 5 | P604: 5 | Q604: 5 | R604: 1 | S604: 5 | T604: 5 | V604: 5
A605: Cadets | B605: 20 | C605: 18.20 | D605: 18.60 | E605: 18.400 | F605: 18.70 | G605: 19.00 | H605: 18.850 | I605: 37.250 | J605: 18.75 | K605: 18.70 | L605: 18.30 | M605: 27.875 | N605: 18.90 | O605: 18.70 | P605: 18.55 | Q605: 18.625 | R605: 18.80 | S605: 28.162500000000001 | T605: 93.287499999999994 | U605: 0.0 | V605: 93.287499999999994
C606: 7 | D606: 6 | E606: 6 | F606: 6 | G606: 6 | H606: 6 | I606: 6 | J606: 6 | K606: 6 | L606: 7 | M606: 6 | N606: 6 | O606: 6 | P606: 6 | Q606: 6 | R606: 7 | S606: 6 | T606: 6 | V606: 6
A607: Blue | B607: 19 | C607: 18.30 | D607: 18.30 | E607: 18.300 | F607: 18.45 | G607: 18.85 | H607: 18.650 | I607: 36.950 | J607: 18.30 | K607: 18.60 | L607: 18.50 | M607: 27.700 | N607: 18.70 | O607: 18.50 | P607: 18.40 | Q607: 18.450 | R607: 18.05 | S607: 27.6000 | T607: 92.2500 | U607: 0.0 | V607: 92.2500
A608: Stars | C608: 6 | D608: 7 | E608: 7 | F608: 8 | G608: 7 | H608: 7 | I608: 7 | J608: 9 | K608: 7 | L608: 6 | M608: 7 | N608: 7 | O608: 7 | P608: 7 | Q608: 7 | R608: 9 | S608: 8 | T608: 7 | V608: 7
A609: Cavaliers | B609: 18 | C609: 18.00 | D609: 18.00 | E609: 18.000 | F609: 18.50 | G609: 18.65 | H609: 18.574999999999999 | I609: 36.575000000000003 | J609: 18.50 | K609: 18.30 | L609: 17.80 | M609: 27.300 | N609: 18.50 | O609: 18.35 | P609: 18.20 | Q609: 18.274999999999999 | R609: 19.20 | S609: 27.987500000000001 | T609: 91.862499999999997 | U609: 0.0 | V609: 91.862499999999997
C610: 8 | D610: 9 | E610: 8 | F610: 7 | G610: 8 | H610: 8 | I610: 8 | J610: 7 | K610: 8 | L610: 9 | M610: 8 | N610: 8 | O610: 8 | P610: 8 | Q610: 8 | R610: 5 | S610: 7 | T610: 8 | V610: 8
A611: Phantom | B611: 17 | C611: 17.70 | D611: 18.10 | E611: 17.900 | F611: 18.20 | G611: 18.60 | H611: 18.400 | I611: 36.300 | J611: 18.40 | K611: 18.20 | L611: 17.60 | M611: 27.100 | N611: 18.35 | O611: 17.90 | P611: 18.00 | Q611: 17.950 | R611: 18.30 | S611: 27.3000 | T611: 90.7000 | U611: 0.0 | V611: 90.7000
A612: Regiment | C612: 9 | D612: 8 | E612: 9 | F612: 9 | G612: 9 | H612: 9 | I612: 9 | J612: 8 | K612: 9 | L612: 10 | M612: 10 | N612: 9 | O612: 9 | P612: 10 | Q612: 9 | R612: 8 | S612: 9 | T612: 9 | V612: 9
A613: Mandarins | B613: 16 | C613: 17.60 | D613: 17.80 | E613: 17.700 | F613: 18.05 | G613: 18.20 | H613: 18.125 | I613: 35.825000000000003 | J613: 18.00 | K613: 18.10 | L613: 18.20 | M613: 27.150 | N613: 18.05 | O613: 17.55 | P613: 18.10 | Q613: 17.824999999999999 | R613: 17.25 | S613: 26.5625 | T613: 89.537499999999994 | U613: 0.0 | V613: 89.537499999999994
C614: 10 | D614: 10 | E614: 10 | F614: 10 | G614: 10 | H614: 10 | I614: 10 | J614: 10 | K614: 10 | L614: 8 | M614: 9 | N614: 10 | O614: 10 | P614: 9 | Q614: 10 | R614: 14 | S614: 11 | T614: 10 | V614: 10
A615: Colts | B615: 15 | C615: 16.80 | D615: 17.50 | E615: 17.150 | F615: 17.55 | G615: 17.95 | H615: 17.750 | I615: 34.900 | J615: 17.80 | K615: 17.60 | L615: 17.00 | M615: 26.200 | N615: 17.75 | O615: 17.30 | P615: 17.60 | Q615: 17.450 | R615: 17.50 | S615: 26.3500 | T615: 87.4500 | U615: 0.0 | V615: 87.4500
C616: 13 | D616: 11 | E616: 12 | F616: 12 | G616: 11 | H616: 12 | I616: 12 | J616: 11 | K616: 12 | L616: 12 | M616: 11 | N616: 12 | O616: 12 | P616: 11 | Q616: 11 | R616: 12 | S616: 12 | T616: 11 | V616: 11
A617: Troopers | B617: 14 | C617: 17.10 | D617: 17.40 | E617: 17.250 | F617: 17.80 | G617: 17.75 | H617: 17.774999999999999 | I617: 35.024999999999999 | J617: 17.35 | K617: 17.50 | L617: 16.80 | M617: 25.824999999999999 | N617: 18.00 | O617: 16.80 | P617: 17.50 | Q617: 17.150 | R617: 18.00 | S617: 26.574999999999999 | T617: 87.424999999999997 | U617: 0.0 | V617: 87.424999999999997
C618: 12 | D618: 12 | E618: 11 | F618: 11 | G618: 12 | H618: 11 | I618: 11 | J618: 14 | K618: 13 | L618: 13 | M618: 13 | N618: 11 | O618: 14 | P618: 12 | Q618: 13 | R618: 10 | S618: 10 | T618: 12 | V618: 12
A619: Crossmen | B619: 13 | C619: 17.30 | D619: 17.00 | E619: 17.150 | F619: 17.40 | G619: 17.70 | H619: 17.550 | I619: 34.700 | J619: 17.60 | K619: 17.70 | L619: 17.10 | M619: 26.200 | N619: 17.50 | O619: 17.00 | P619: 16.90 | Q619: 16.950 | R619: 17.60 | S619: 26.024999999999999 | T619: 86.924999999999997 | U619: 0.0 | V619: 86.924999999999997
C620: 11 | D620: 14 | E620: 12 | F620: 13 | G620: 13 | H620: 13 | I620: 13 | J620: 12 | K620: 11 | L620: 11 | M620: 11 | N620: 13 | O620: 13 | P620: 14 | Q620: 14 | R620: 11 | S620: 13 | T620: 13 | V620: 13
A621: Blue | B621: 12 | C621: 16.50 | D621: 17.10 | E621: 16.800 | F621: 17.20 | G621: 17.40 | H621: 17.300 | I621: 34.100 | J621: 17.40 | K621: 17.30 | L621: 16.70 | M621: 25.700 | N621: 17.35 | O621: 17.35 | P621: 17.10 | Q621: 17.225000000000001 | R621: 17.40 | S621: 25.987500000000001 | T621: 85.787499999999994 | U621: 0.0 | V621: 85.787499999999994
A622: Knights | C622: 14 | D622: 13 | E622: 14 | F622: 14 | G622: 14 | H622: 14 | I622: 14 | J622: 13 | K622: 14 | L622: 14 | M622: 14 | N622: 14 | O622: 11 | P622: 13 | Q622: 12 | R622: 13 | S622: 14 | T622: 14 | V622: 14
A623: Madison | B623: 11 | C623: 16.40 | D623: 16.70 | E623: 16.550 | F623: 16.85 | G623: 17.10 | H623: 16.975000000000001 | I623: 33.524999999999999 | J623: 16.90 | K623: 17.00 | L623: 16.00 | M623: 24.950 | N623: 17.20 | O623: 16.60 | P623: 16.70 | Q623: 16.650 | R623: 16.55 | S623: 25.2500 | T623: 83.724999999999994 | U623: 0.0 | V623: 83.724999999999994
A624: Scouts | C624: 15 | D624: 15 | E624: 15 | F624: 16 | G624: 15 | H624: 15 | I624: 15 | J624: 15 | K624: 15 | L624: 15 | M624: 15 | N624: 15 | O624: 15 | P624: 15 | Q624: 15 | R624: 16 | S624: 15 | T624: 15 | V624: 15
A625: Academy | B625: 10 | C625: 16.10 | D625: 16.50 | E625: 16.300 | F625: 17.05 | G625: 16.80 | H625: 16.925000000000001 | I625: 33.225000000000001 | J625: 16.50 | K625: 16.65 | L625: 15.70 | M625: 24.425000000000001 | N625: 16.85 | O625: 15.70 | P625: 16.30 | Q625: 16.000 | R625: 16.25 | S625: 24.5500 | T625: 82.2000 | U625: 0.0 | V625: 82.2000
C626: 17 | D626: 16 | E626: 16 | F626: 15 | G626: 16 | H626: 16 | I626: 16 | J626: 18 | K626: 16 | L626: 17 | M626: 16 | N626: 17 | O626: 19 | P626: 18 | Q626: 18 | R626: 18 | S626: 17 | T626: 16 | V626: 16
A627: Music | B627: 9 | C627: 15.90 | D627: 16.30 | E627: 16.100 | F627: 16.80 | G627: 16.60 | H627: 16.700 | I627: 32.800 | J627: 16.30 | K627: 16.40 | L627: 15.30 | M627: 24.000 | N627: 17.00 | O627: 16.10 | P627: 16.55 | Q627: 16.324999999999999 | R627: 16.60 | S627: 24.962499999999999 | T627: 81.762500000000003 | U627: 0.0 | V627: 81.762500000000003
A628: City | C628: 18 | D628: 17 | E628: 18 | F628: 17 | G628: 17 | H628: 17 | I628: 17 | J628: 19 | K628: 18 | L628: 19 | M628: 19 | N628: 16 | O628: 16 | P628: 16 | Q628: 16 | R628: 15 | S628: 16 | T628: 17 | V628: 17
A629: Vanguard | B629: 8 | C629: 16.30 | D629: 16.10 | E629: 16.200 | F629: 16.35 | G629: 16.40 | H629: 16.375 | I629: 32.575000000000003 | J629: 16.55 | K629: 16.50 | L629: 15.50 | M629: 24.274999999999999 | N629: 16.60 | O629: 16.05 | P629: 16.35 | Q629: 16.200 | R629: 15.60 | S629: 24.2000 | T629: 81.0500 | U629: 0.0 | V629: 81.0500
A630: Cadets | C630: 16 | D630: 18 | E630: 17 | F630: 18 | G630: 18 | H630: 18 | I630: 18 | J630: 17 | K630: 17 | L630: 18 | M630: 18 | N630: 19 | O630: 17 | P630: 17 | Q630: 17 | R630: 21 | S630: 19 | T630: 18 | V630: 18
A631: Pacific | B631: 6 | C631: 15.40 | D631: 15.60 | E631: 15.500 | F631: 16.20 | G631: 16.00 | H631: 16.100 | I631: 31.600 | J631: 16.70 | K631: 16.00 | L631: 15.90 | M631: 24.300 | N631: 16.70 | O631: 15.40 | P631: 15.80 | Q631: 15.600 | R631: 16.40 | S631: 24.3500 | T631: 80.2500 | U631: 0.0 | V631: 80.2500
A632: Crest | C632: 21 | D632: 21 | E632: 22 | F632: 19 | G632: 20 | H632: 20 | I632: 20 | J632: 16 | K632: 20 | L632: 16 | M632: 17 | N632: 18 | O632: 21 | P632: 21 | Q632: 21 | R632: 17 | S632: 18 | T632: 19 | V632: 19
A633: Gold | B633: 5 | C633: 15.80 | D633: 15.40 | E633: 15.600 | F633: 16.00 | G633: 15.80 | H633: 15.900 | I633: 31.500 | J633: 16.05 | K633: 16.30 | L633: 15.10 | M633: 23.725000000000001 | N633: 16.30 | O633: 15.80 | P633: 16.20 | Q633: 16.000 | R633: 15.30 | S633: 23.8000 | T633: 79.025000000000006 | U633: 0.0 | V633: 79.025000000000006
C634: 19 | D634: 22 | E634: 20 | F634: 21 | G634: 21 | H634: 21 | I634: 21 | J634: 20 | K634: 19 | L634: 20 | M634: 20 | N634: 21 | O634: 18 | P634: 20 | Q634: 18 | R634: 23 | S634: 22 | T634: 20 | V634: 20
A635: Genesis | B635: 7 | C635: 15.20 | D635: 15.90 | E635: 15.550 | F635: 16.10 | G635: 16.20 | H635: 16.150 | I635: 31.700 | J635: 15.70 | K635: 15.70 | L635: 14.50 | M635: 22.950 | N635: 16.55 | O635: 15.10 | P635: 16.25 | Q635: 15.675000000000001 | R635: 16.10 | S635: 24.162500000000001 | T635: 78.8125 | U635: 0.0 | V635: 78.8125
C636: 22 | D636: 19 | E636: 21 | F636: 20 | G636: 19 | H636: 19 | I636: 19 | J636: 23 | K636: 21 | L636: 23 | M636: 23 | N636: 20 | O636: 22 | P636: 19 | Q636: 20 | R636: 19 | S636: 20 | T636: 21 | V636: 21
A637: Blue | B637: 4 | C637: 15.70 | D637: 15.70 | E637: 15.700 | F637: 15.70 | G637: 15.60 | H637: 15.650 | I637: 31.350 | J637: 15.90 | K637: 15.60 | L637: 14.90 | M637: 23.200 | N637: 16.10 | O637: 15.60 | P637: 15.50 | Q637: 15.550 | R637: 16.00 | S637: 23.824999999999999 | T637: 78.375 | U637: 0.0 | V637: 78.375
A638: Devils B | C638: 20 | D638: 20 | E638: 19 | F638: 22 | G638: 22 | H638: 22 | I638: 22 | J638: 22 | K638: 22 | L638: 21 | M638: 21 | N638: 22 | O638: 20 | P638: 22 | Q638: 22 | R638: 20 | S638: 21 | T638: 22 | V638: 22
A639: Spartans | B639: 3 | C639: 15.00 | D639: 15.30 | E639: 15.150 | F639: 15.40 | G639: 15.30 | H639: 15.350 | I639: 30.500 | J639: 16.00 | K639: 15.40 | L639: 14.70 | M639: 23.050 | N639: 15.40 | O639: 15.00 | P639: 15.40 | Q639: 15.200 | R639: 15.50 | S639: 23.0500 | T639: 76.6000 | U639: 0.0 | V639: 76.6000
C640: 23 | D640: 23 | E640: 23 | F640: 23 | G640: 23 | H640: 23 | I640: 23 | J640: 21 | K640: 23 | L640: 22 | M640: 22 | N640: 23 | O640: 23 | P640: 23 | Q640: 23 | R640: 22 | S640: 23 | T640: 23 | V640: 23
A641: Guardians | B641: 2 | C641: 14.60 | D641: 14.90 | E641: 14.750 | F641: 14.80 | G641: 15.00 | H641: 14.900 | I641: 29.650 | J641: 15.00 | K641: 15.30 | L641: 14.30 | M641: 22.300 | N641: 14.70 | O641: 14.70 | P641: 15.20 | Q641: 14.950 | R641: 14.30 | S641: 21.975000000000001 | T641: 73.924999999999997 | U641: 0.0 | V641: 73.924999999999997
C642: 25 | D642: 24 | E642: 24 | F642: 25 | G642: 24 | H642: 24 | I642: 24 | J642: 25 | K642: 24 | L642: 24 | M642: 24 | N642: 25 | O642: 24 | P642: 24 | Q642: 24 | R642: 25 | S642: 25 | T642: 24 | V642: 24
A643: Jersey | B643: 1 | C643: 14.80 | D643: 14.50 | E643: 14.650 | F643: 15.00 | G643: 14.80 | H643: 14.900 | I643: 29.550 | J643: 15.40 | K643: 15.00 | L643: 14.10 | M643: 22.250 | N643: 15.00 | O643: 14.50 | P643: 15.00 | Q643: 14.750 | R643: 14.40 | S643: 22.074999999999999 | T643: 73.875 | U643: 0.0 | V643: 73.875
A644: Surf | C644: 24 | D644: 25 | E644: 25 | F644: 24 | G644: 25 | H644: 24 | I644: 25 | J644: 24 | K644: 25 | L644: 25 | M644: 25 | N644: 24 | O644: 25 | P644: 25 | Q644: 25 | R644: 24 | S644: 24 | T644: 25 | V644: 25
A647: 8/13/2022 Indianapolis, Indiana--DCI World Class World Championship Finals
C648: General Effect | J648: Visual | N648: Music
C649: 1 | D649: 1 | F649: 2 | G649: 2 | J649: Proficiency | K649: Analysis | L649: Color Guard | N649: Brass | O649: Analysis 1 | P649: Analysis 2 | Q649: Analysis | R649: Percussion | T649: Sub | V649: Total
C650: K. Miller | D650: W. Rickart | E650: Average | F650: G. Fugett | G650: M. Waymire | H650: Average | I650: Total | J650: C. Nelson | K650: G. Oliviero | L650: H. Nguyen | M650: Total ÷2 | N650: S. Page | O650: M. Griffin | P650: W. Dillon | Q650: Average | R650: J. Ausdemore | S650: Total ÷2 | T650: Total | U650: Pen | V650: Score
A651: DCI World Class | C651: 20 | D651: 20 | E651: 20 | F651: 20 | G651: 20 | H651: 20 | I651: 40 | J651: 20 | K651: 20 | L651: 20 | M651: 30 | N651: 20 | O651: 20 | P651: 20 | Q651: 20 | R651: 20 | S651: 30 | T651: 100 | V651: 100
A652: Blue | B652: 12 | C652: 19.65 | D652: 19.85 | E652: 19.75 | F652: 19.70 | G652: 19.80 | H652: 19.75 | I652: 39.500 | J652: 20.00 | K652: 19.90 | L652: 19.70 | M652: 29.800 | N652: 19.60 | O652: 19.85 | P652: 19.45 | Q652: 19.650 | R652: 19.65 | S652: 29.4500 | T652: 98.7500 | U652: 0.0 | V652: 98.7500
A653: Devils | C653: 1 | D653: 1 | E653: 1 | F653: 1 | G653: 1 | H653: 1 | I653: 1 | J653: 1 | K653: 1 | L653: 1 | M653: 1 | N653: 3 | O653: 1 | P653: 1 | Q653: 1 | R653: 3 | S653: 1 | T653: 1 | V653: 1
A654: Boston | B654: 11 | C654: 19.10 | D654: 19.50 | E654: 19.30 | F654: 19.35 | G654: 19.60 | H654: 19.475000000000001 | I654: 38.774999999999999 | J654: 19.50 | K654: 19.40 | L654: 19.65 | M654: 29.274999999999999 | N654: 19.75 | O654: 19.75 | P654: 18.95 | Q654: 19.350 | R654: 19.45 | S654: 29.274999999999999 | T654: 97.325000000000003 | U654: 0.0 | V654: 97.325000000000003
A655: Crusaders | C655: 4 | D655: 3 | E655: 3 | F655: 3 | G655: 2 | H655: 3 | I655: 3 | J655: 2 | K655: 3 | L655: 2 | M655: 2 | N655: 2 | O655: 2 | P655: 4 | Q655: 3 | R655: 4 | S655: 2 | T655: 2 | V655: 2
A656: Bluecoats | B656: 10 | C656: 19.50 | D656: 19.60 | E656: 19.55 | F656: 19.50 | G656: 19.50 | H656: 19.50 | I656: 39.050 | J656: 19.40 | K656: 19.60 | L656: 19.10 | M656: 29.050 | N656: 19.45 | O656: 19.50 | P656: 19.00 | Q656: 19.250 | R656: 19.745000000000001 | S656: 29.225000000000001 | T656: 97.325000000000003 | U656: 0.0 | V656: 97.325000000000003
C657: 2 | D657: 2 | E657: 2 | F657: 2 | G657: 3 | H657: 2 | I657: 2 | J657: 3 | K657: 2 | L657: 4 | M657: 3 | N657: 4 | O657: 4 | P657: 3 | Q657: 4 | R657: 1 | S657: 3 | T657: 2 | V657: 2
A658: Carolina | B658: 9 | C658: 19.20 | D658: 19.30 | E658: 19.25 | F658: 19.25 | G658: 19.05 | H658: 19.15 | I658: 38.400 | J658: 19.20 | K658: 19.05 | L658: 19.25 | M658: 28.750 | N658: 19.80 | O658: 19.70 | P658: 19.40 | Q658: 19.550 | R658: 19.05 | S658: 29.2000 | T658: 96.3500 | U658: 0.0 | V658: 96.3500
A659: Crown | C659: 3 | D659: 4 | E659: 4 | F659: 4 | G659: 5 | H659: 4 | I659: 4 | J659: 4 | K659: 4 | L659: 3 | M659: 4 | N659: 1 | O659: 3 | P659: 2 | Q659: 2 | R659: 5 | S659: 4 | T659: 4 | V659: 4
A660: Vanguard | B660: 8 | C660: 18.60 | D660: 19.00 | E660: 18.80 | F660: 18.90 | G660: 19.20 | H660: 19.05 | I660: 37.850 | J660: 18.80 | K660: 19.00 | L660: 18.65 | M660: 28.225000000000001 | N660: 19.10 | O660: 19.30 | P660: 18.80 | Q660: 19.050 | R660: 19.70 | S660: 28.925000000000001 | T660: 95.0000 | U660: 0.0 | V660: 95.0000
C661: 5 | D661: 5 | E661: 5 | F661: 5 | G661: 4 | H661: 5 | I661: 5 | J661: 5 | K661: 5 | L661: 6 | M661: 5 | N661: 5 | O661: 5 | P661: 5 | Q661: 5 | R661: 2 | S661: 5 | T661: 5 | V661: 5
A662: Cadets | B662: 7 | C662: 18.30 | D662: 18.70 | E662: 18.50 | F662: 18.50 | G662: 18.55 | H662: 18.524999999999999 | I662: 37.024999999999999 | J662: 18.40 | K662: 18.40 | L662: 18.25 | M662: 27.524999999999999 | N662: 18.90 | O662: 19.05 | P662: 18.70 | Q662: 18.875 | R662: 18.95 | S662: 28.362500000000001 | T662: 92.912499999999994 | U662: 0.0 | V662: 92.912499999999994
C663: 7 | D663: 6 | E663: 6 | F663: 6 | G663: 7 | H663: 7 | I663: 6 | J663: 7 | K663: 6 | L663: 8 | M663: 7 | N663: 6 | O663: 6 | P663: 6 | Q663: 6 | R663: 6 | S663: 6 | T663: 6 | V663: 6
A664: Blue | B664: 6 | C664: 18.40 | D664: 18.40 | E664: 18.40 | F664: 18.40 | G664: 18.75 | H664: 18.574999999999999 | I664: 36.975000000000001 | J664: 18.70 | K664: 18.35 | L664: 18.75 | M664: 27.900 | N664: 18.65 | O664: 18.70 | P664: 18.50 | Q664: 18.600 | R664: 18.55 | S664: 27.9000 | T664: 92.775000000000006 | U664: 0.0 | V664: 92.775000000000006
A665: Stars | C665: 6 | D665: 7 | E665: 7 | F665: 7 | G665: 6 | H665: 6 | I665: 7 | J665: 6 | K665: 7 | L665: 5 | M665: 6 | N665: 7 | O665: 7 | P665: 7 | Q665: 7 | R665: 8 | S665: 7 | T665: 7 | V665: 7
A666: Phantom | B666: 4 | C666: 18.00 | D666: 17.70 | E666: 17.85 | F666: 18.05 | G666: 18.30 | H666: 18.175000000000001 | I666: 36.024999999999999 | J666: 18.00 | K666: 18.30 | L666: 18.05 | M666: 27.175000000000001 | N666: 18.45 | O666: 18.30 | P666: 17.90 | Q666: 18.100 | R666: 18.40 | S666: 27.475000000000001 | T666: 90.674999999999997 | U666: 0.0 | V666: 90.674999999999997
A667: Regiment | C667: 8 | D667: 9 | E667: 8 | F667: 8 | G667: 8 | H667: 8 | I667: 8 | J667: 9 | K667: 8 | L667: 9 | M667: 8 | N667: 8 | O667: 9 | P667: 10 | Q667: 9 | R667: 10 | S667: 9 | T667: 8 | V667: 8
A668: Cavaliers | B668: 5 | C668: 17.60 | D668: 18.10 | E668: 17.85 | F668: 17.95 | G668: 18.25 | H668: 18.10 | I668: 35.950 | J668: 18.10 | K668: 17.80 | L668: 17.80 | M668: 26.850 | N668: 18.30 | O668: 18.60 | P668: 18.20 | Q668: 18.400 | R668: 18.90 | S668: 27.8000 | T668: 90.6000 | U668: 0.0 | V668: 90.6000
C669: 9 | D669: 8 | E669: 8 | F669: 9 | G669: 9 | H669: 9 | I669: 9 | J669: 8 | K669: 10 | L669: 10 | M669: 10 | N669: 9 | O669: 8 | P669: 8 | Q669: 8 | R669: 7 | S669: 8 | T669: 9 | V669: 9
A670: Mandarins | B670: 3 | C670: 17.50 | D670: 17.50 | E670: 17.50 | F670: 17.90 | G670: 18.15 | H670: 18.05 | I670: 35.524999999999999 | J670: 17.90 | K670: 18.00 | L670: 18.45 | M670: 27.175000000000001 | N670: 18.15 | O670: 18.00 | P670: 18.05 | Q670: 18.024999999999999 | R670: 18.45 | S670: 27.3125 | T670: 90.012500000000003 | U670: 0.0 | V670: 90.012500000000003
C671: 10 | D671: 10 | E671: 10 | F671: 10 | G671: 10 | H671: 10 | I671: 10 | J671: 10 | K671: 9 | L671: 7 | M671: 8 | N671: 10 | O671: 10 | P671: 9 | Q671: 10 | R671: 9 | S671: 10 | T671: 10 | V671: 10
A672: Colts | B672: 2 | C672: 16.90 | D672: 17.00 | E672: 16.95 | F672: 17.10 | G672: 17.45 | H672: 17.274999999999999 | I672: 34.225000000000001 | J672: 17.40 | K672: 17.50 | L672: 17.50 | M672: 26.200 | N672: 17.95 | O672: 17.40 | P672: 17.50 | Q672: 17.450 | R672: 18.15 | S672: 26.774999999999999 | T672: 87.2000 | U672: 0.0 | V672: 87.2000
C673: 12 | D673: 12 | E673: 12 | F673: 12 | G673: 12 | H673: 12 | I673: 12 | J673: 11 | K673: 11 | L673: 11 | M673: 11 | N673: 11 | O673: 11 | P673: 11 | Q673: 11 | R673: 12 | S673: 11 | T673: 11 | V673: 11
A674: Troopers | B674: 1 | C674: 17.10 | D674: 17.20 | E674: 17.15 | F674: 17.40 | G674: 17.50 | H674: 17.45 | I674: 34.600 | J674: 16.90 | K674: 17.00 | L674: 16.50 | M674: 25.200 | N674: 17.70 | O674: 17.30 | P674: 17.20 | Q674: 17.250 | R674: 18.30 | S674: 26.625 | T674: 86.424999999999997 | U674: 0.0 | V674: 86.424999999999997
C675: 11 | D675: 11 | E675: 11 | F675: 11 | G675: 11 | H675: 11 | I675: 11 | J675: 12 | K675: 12 | L675: 12 | M675: 12 | N675: 12 | O675: 12 | P675: 12 | Q675: 12 | R675: 11 | S675: 12 | T675: 12 | V675: 12
A678: 8/20/2022 Flanders, New Jersey
C679: Visual | F679: Music | J679: Effect
C680: Ensemble | D680: Color Guard | F680: Brass | G680: Percussion | H680: Ensemble | J680: Visual | K680: Music | M680: Sub | O680: Total
C681: C. Raichle | D681: K. Templin | E681: Average | F681: N. Greeson | G681: T. Mengel | H681: J. Itkor | I681: Total ÷2 | J681: S. Adamo | K681: P. Smith | L681: Total | M681: Total | N681: Pen | O681: Score
A682: DCA World Class | C682: 20 | D682: 20 | E682: 20 | F682: 20 | G682: 20 | H682: 20 | I682: 30 | J682: 25 | K682: 25 | L682: 50 | M682: 100 | O682: 100
A683: Hawthorne | B683: 2 | C683: 17.50 | D683: 18.50 | E683: 18.00 | F683: 17.80 | G683: 18.50 | H683: 18.80 | I683: 27.55 | J683: 23.10 | K683: 22.95 | L683: 46.05 | M683: 91.60 | N683: 0.0 | O683: 91.60
A684: Caballeros | C684: =RANK(C683,(C$6,C$8,C$10,C$12,C$15,C$17,C$19,C$21,C$23,C$25,C$27,C$29,C$31,C$33,C$35,C$37,C$39,C$41,C$43,C$45,C$47,C$49,C$51,C$53,C$55,C$57,C$59,C$61,C$63,C$65,C$67,C$69,C$71,C$73,C$75,C$77,C$79,C$81,C$83,C$85,C$87,C$89,C$91,C$93,C$95,C$97,C$99,C$101,C$103,C$105,C$107,C$109,C$111,C$113,C$115,C$117,C$119,C$121,C$123,C$125)) -> 2 | D684: =RANK(D683,(D$6,D$8,D$10,D$12,D$15,D$17,D$19,D$21,D$23,D$25,D$27,D$29,D$31,D$33,D$35,D$37,D$39,D$41,D$43,D$45,D$47,D$49,D$51,D$53,D$55,D$57,D$59,D$61,D$63,D$65,D$67,D$69,D$71,D$73,D$75,D$77,D$79,D$81,D$83,D$85,D$87,D$89,D$91,D$93,D$95,D$97,D$99,D$101,D$103,D$105,D$107,D$109,D$111,D$113,D$115,D$117,D$119,D$121,D$123,D$125)) -> 1 | E684: =RANK(E683,(E$6,E$8,E$10,E$12,E$15,E$17,E$19,E$21,E$23,E$25,E$27,E$29,E$31,E$33,E$35,E$37,E$39,E$41,E$43,E$45,E$47,E$49,E$51,E$53,E$55,E$57,E$59,E$61,E$63,E$65,E$67,E$69,E$71,E$73,E$75,E$77,E$79,E$81,E$83,E$85,E$87,E$89,E$91,E$93,E$95,E$97,E$99,E$101,E$103,E$105,E$107,E$109,E$111,E$113,E$115,E$117,E$119,E$121,E$123,E$125)) -> 1 | F684: =RANK(F683,(F$6,F$8,F$10,F$12,F$15,F$17,F$19,F$21,F$23,F$25,F$27,F$29,F$31,F$33,F$35,F$37,F$39,F$41,F$43,F$45,F$47,F$49,F$51,F$53,F$55,F$57,F$59,F$61,F$63,F$65,F$67,F$69,F$71,F$73,F$75,F$77,F$79,F$81,F$83,F$85,F$87,F$89,F$91,F$93,F$95,F$97,F$99,F$101,F$103,F$105,F$107,F$109,F$111,F$113,F$115,F$117,F$119,F$121,F$123,F$125)) -> 2 | G684: =RANK(G683,(G$6,G$8,G$10,G$12,G$15,G$17,G$19,G$21,G$23,G$25,G$27,G$29,G$31,G$33,G$35,G$37,G$39,G$41,G$43,G$45,G$47,G$49,G$51,G$53,G$55,G$57,G$59,G$61,G$63,G$65,G$67,G$69,G$71,G$73,G$75,G$77,G$79,G$81,G$83,G$85,G$87,G$89,G$91,G$93,G$95,G$97,G$99,G$101,G$103,G$105,G$107,G$109,G$111,G$113,G$115,G$117,G$119,G$121,G$123,G$125)) -> 2 | H684: =RANK(H683,(H$6,H$8,H$10,H$12,H$15,H$17,H$19,H$21,H$23,H$25,H$27,H$29,H$31,H$33,H$35,H$37,H$39,H$41,H$43,H$45,H$47,H$49,H$51,H$53,H$55,H$57,H$59,H$61,H$63,H$65,H$67,H$69,H$71,H$73,H$75,H$77,H$79,H$81,H$83,H$85,H$87,H$89,H$91,H$93,H$95,H$97,H$99,H$101,H$103,H$105,H$107,H$109,H$111,H$113,H$115,H$117,H$119,H$121,H$123,H$125)) -> 1 | I684: =RANK(I683,(I$6,I$8,I$10,I$12,I$15,I$17,I$19,I$21,I$23,I$25,I$27,I$29,I$31,I$33,I$35,I$37,I$39,I$41,I$43,I$45,I$47,I$49,I$51,I$53,I$55,I$57,I$59,I$61,I$63,I$65,I$67,I$69,I$71,I$73,I$75,I$77,I$79,I$81,I$83,I$85,I$87,I$89,I$91,I$93,I$95,I$97,I$99,I$101,I$103,I$105,I$107,I$109,I$111,I$113,I$115,I$117,I$119,I$121,I$123,I$125)) -> 2 | J684: =RANK(J683,(J$6,J$8,J$10,J$12,J$15,J$17,J$19,J$21,J$23,J$25,J$27,J$29,J$31,J$33,J$35,J$37,J$39,J$41,J$43,J$45,J$47,J$49,J$51,J$53,J$55,J$57,J$59,J$61,J$63,J$65,J$67,J$69,J$71,J$73,J$75,J$77,J$79,J$81,J$83,J$85,J$87,J$89,J$91,J$93,J$95,J$97,J$99,J$101,J$103,J$105,J$107,J$109,J$111,J$113,J$115,J$117,J$119,J$121,J$123,J$125)) -> 1 | K684: =RANK(K683,(K$6,K$8,K$10,K$12,K$15,K$17,K$19,K$21,K$23,K$25,K$27,K$29,K$31,K$33,K$35,K$37,K$39,K$41,K$43,K$45,K$47,K$49,K$51,K$53,K$55,K$57,K$59,K$61,K$63,K$65,K$67,K$69,K$71,K$73,K$75,K$77,K$79,K$81,K$83,K$85,K$87,K$89,K$91,K$93,K$95,K$97,K$99,K$101,K$103,K$105,K$107,K$109,K$111,K$113,K$115,K$117,K$119,K$121,K$123,K$125)) -> 1 | L684: =RANK(L683,(L$6,L$8,L$10,L$12,L$15,L$17,L$19,L$21,L$23,L$25,L$27,L$29,L$31,L$33,L$35,L$37,L$39,L$41,L$43,L$45,L$47,L$49,L$51,L$53,L$55,L$57,L$59,L$61,L$63,L$65,L$67,L$69,L$71,L$73,L$75,L$77,L$79,L$81,L$83,L$85,L$87,L$89,L$91,L$93,L$95,L$97,L$99,L$101,L$103,L$105,L$107,L$109,L$111,L$113,L$115,L$117,L$119,L$121,L$123,L$125)) -> 1 | M684: =RANK(M683,(M$6,M$8,M$10,M$12,M$15,M$17,M$19,M$21,M$23,M$25,M$27,M$29,M$31,M$33,M$35,M$37,M$39,M$41,M$43,M$45,M$47,M$49,M$51,M$53,M$55,M$57,M$59,M$61,M$63,M$65,M$67,M$69,M$71,M$73,M$75,M$77,M$79,M$81,M$83,M$85,M$87,M$89,M$91,M$93,M$95,M$97,M$99,M$101,M$103,M$105,M$107,M$109,M$111,M$113,M$115,M$117,M$119,M$121,M$123,M$125)) -> 1 | O684: 1
A685: Reading | B685: 3 | C685: 17.60 | D685: 18.20 | E685: 17.90 | F685: 18.10 | G685: 18.60 | H685: 18.50 | I685: 27.60 | J685: 22.60 | K685: 22.55 | L685: 45.15 | M685: 90.65 | N685: 0.0 | O685: 90.65
A686: Buccaneers | C686: =RANK(C685,(C$6,C$8,C$10,C$12,C$15,C$17,C$19,C$21,C$23,C$25,C$27,C$29,C$31,C$33,C$35,C$37,C$39,C$41,C$43,C$45,C$47,C$49,C$51,C$53,C$55,C$57,C$59,C$61,C$63,C$65,C$67,C$69,C$71,C$73,C$75,C$77,C$79,C$81,C$83,C$85,C$87,C$89,C$91,C$93,C$95,C$97,C$99,C$101,C$103,C$105,C$107,C$109,C$111,C$113,C$115,C$117,C$119,C$121,C$123,C$125)) -> 1 | D686: =RANK(D685,(D$6,D$8,D$10,D$12,D$15,D$17,D$19,D$21,D$23,D$25,D$27,D$29,D$31,D$33,D$35,D$37,D$39,D$41,D$43,D$45,D$47,D$49,D$51,D$53,D$55,D$57,D$59,D$61,D$63,D$65,D$67,D$69,D$71,D$73,D$75,D$77,D$79,D$81,D$83,D$85,D$87,D$89,D$91,D$93,D$95,D$97,D$99,D$101,D$103,D$105,D$107,D$109,D$111,D$113,D$115,D$117,D$119,D$121,D$123,D$125)) -> 2 | E686: =RANK(E685,(E$6,E$8,E$10,E$12,E$15,E$17,E$19,E$21,E$23,E$25,E$27,E$29,E$31,E$33,E$35,E$37,E$39,E$41,E$43,E$45,E$47,E$49,E$51,E$53,E$55,E$57,E$59,E$61,E$63,E$65,E$67,E$69,E$71,E$73,E$75,E$77,E$79,E$81,E$83,E$85,E$87,E$89,E$91,E$93,E$95,E$97,E$99,E$101,E$103,E$105,E$107,E$109,E$111,E$113,E$115,E$117,E$119,E$121,E$123,E$125)) -> 2 | F686: =RANK(F685,(F$6,F$8,F$10,F$12,F$15,F$17,F$19,F$21,F$23,F$25,F$27,F$29,F$31,F$33,F$35,F$37,F$39,F$41,F$43,F$45,F$47,F$49,F$51,F$53,F$55,F$57,F$59,F$61,F$63,F$65,F$67,F$69,F$71,F$73,F$75,F$77,F$79,F$81,F$83,F$85,F$87,F$89,F$91,F$93,F$95,F$97,F$99,F$101,F$103,F$105,F$107,F$109,F$111,F$113,F$115,F$117,F$119,F$121,F$123,F$125)) -> 1 | G686: =RANK(G685,(G$6,G$8,G$10,G$12,G$15,G$17,G$19,G$21,G$23,G$25,G$27,G$29,G$31,G$33,G$35,G$37,G$39,G$41,G$43,G$45,G$47,G$49,G$51,G$53,G$55,G$57,G$59,G$61,G$63,G$65,G$67,G$69,G$71,G$73,G$75,G$77,G$79,G$81,G$83,G$85,G$87,G$89,G$91,G$93,G$95,G$97,G$99,G$101,G$103,G$105,G$107,G$109,G$111,G$113,G$115,G$117,G$119,G$121,G$123,G$125)) -> 1 | H686: =RANK(H685,(H$6,H$8,H$10,H$12,H$15,H$17,H$19,H$21,H$23,H$25,H$27,H$29,H$31,H$33,H$35,H$37,H$39,H$41,H$43,H$45,H$47,H$49,H$51,H$53,H$55,H$57,H$59,H$61,H$63,H$65,H$67,H$69,H$71,H$73,H$75,H$77,H$79,H$81,H$83,H$85,H$87,H$89,H$91,H$93,H$95,H$97,H$99,H$101,H$103,H$105,H$107,H$109,H$111,H$113,H$115,H$117,H$119,H$121,H$123,H$125)) -> 2 | I686: =RANK(I685,(I$6,I$8,I$10,I$12,I$15,I$17,I$19,I$21,I$23,I$25,I$27,I$29,I$31,I$33,I$35,I$37,I$39,I$41,I$43,I$45,I$47,I$49,I$51,I$53,I$55,I$57,I$59,I$61,I$63,I$65,I$67,I$69,I$71,I$73,I$75,I$77,I$79,I$81,I$83,I$85,I$87,I$89,I$91,I$93,I$95,I$97,I$99,I$101,I$103,I$105,I$107,I$109,I$111,I$113,I$115,I$117,I$119,I$121,I$123,I$125)) -> 1 | J686: =RANK(J685,(J$6,J$8,J$10,J$12,J$15,J$17,J$19,J$21,J$23,J$25,J$27,J$29,J$31,J$33,J$35,J$37,J$39,J$41,J$43,J$45,J$47,J$49,J$51,J$53,J$55,J$57,J$59,J$61,J$63,J$65,J$67,J$69,J$71,J$73,J$75,J$77,J$79,J$81,J$83,J$85,J$87,J$89,J$91,J$93,J$95,J$97,J$99,J$101,J$103,J$105,J$107,J$109,J$111,J$113,J$115,J$117,J$119,J$121,J$123,J$125)) -> 2 | K686: =RANK(K685,(K$6,K$8,K$10,K$12,K$15,K$17,K$19,K$21,K$23,K$25,K$27,K$29,K$31,K$33,K$35,K$37,K$39,K$41,K$43,K$45,K$47,K$49,K$51,K$53,K$55,K$57,K$59,K$61,K$63,K$65,K$67,K$69,K$71,K$73,K$75,K$77,K$79,K$81,K$83,K$85,K$87,K$89,K$91,K$93,K$95,K$97,K$99,K$101,K$103,K$105,K$107,K$109,K$111,K$113,K$115,K$117,K$119,K$121,K$123,K$125)) -> 2 | L686: =RANK(L685,(L$6,L$8,L$10,L$12,L$15,L$17,L$19,L$21,L$23,L$25,L$27,L$29,L$31,L$33,L$35,L$37,L$39,L$41,L$43,L$45,L$47,L$49,L$51,L$53,L$55,L$57,L$59,L$61,L$63,L$65,L$67,L$69,L$71,L$73,L$75,L$77,L$79,L$81,L$83,L$85,L$87,L$89,L$91,L$93,L$95,L$97,L$99,L$101,L$103,L$105,L$107,L$109,L$111,L$113,L$115,L$117,L$119,L$121,L$123,L$125)) -> 2 | M686: =RANK(M685,(M$6,M$8,M$10,M$12,M$15,M$17,M$19,M$21,M$23,M$25,M$27,M$29,M$31,M$33,M$35,M$37,M$39,M$41,M$43,M$45,M$47,M$49,M$51,M$53,M$55,M$57,M$59,M$61,M$63,M$65,M$67,M$69,M$71,M$73,M$75,M$77,M$79,M$81,M$83,M$85,M$87,M$89,M$91,M$93,M$95,M$97,M$99,M$101,M$103,M$105,M$107,M$109,M$111,M$113,M$115,M$117,M$119,M$121,M$123,M$125)) -> 2 | O686: 2
A687: Bushwackers | B687: 4 | C687: 16.80 | D687: 17.60 | E687: 17.20 | F687: 17.10 | G687: 17.80 | H687: 18.20 | I687: 26.55 | J687: 19.85 | K687: 21.00 | L687: 40.85 | M687: 84.60 | N687: 0.0 | O687: 84.60
C688: =RANK(C687,(C$6,C$8,C$10,C$12,C$15,C$17,C$19,C$21,C$23,C$25,C$27,C$29,C$31,C$33,C$35,C$37,C$39,C$41,C$43,C$45,C$47,C$49,C$51,C$53,C$55,C$57,C$59,C$61,C$63,C$65,C$67,C$69,C$71,C$73,C$75,C$77,C$79,C$81,C$83,C$85,C$87,C$89,C$91,C$93,C$95,C$97,C$99,C$101,C$103,C$105,C$107,C$109,C$111,C$113,C$115,C$117,C$119,C$121,C$123,C$125)) -> 3 | D688: =RANK(D687,(D$6,D$8,D$10,D$12,D$15,D$17,D$19,D$21,D$23,D$25,D$27,D$29,D$31,D$33,D$35,D$37,D$39,D$41,D$43,D$45,D$47,D$49,D$51,D$53,D$55,D$57,D$59,D$61,D$63,D$65,D$67,D$69,D$71,D$73,D$75,D$77,D$79,D$81,D$83,D$85,D$87,D$89,D$91,D$93,D$95,D$97,D$99,D$101,D$103,D$105,D$107,D$109,D$111,D$113,D$115,D$117,D$119,D$121,D$123,D$125)) -> 3 | E688: =RANK(E687,(E$6,E$8,E$10,E$12,E$15,E$17,E$19,E$21,E$23,E$25,E$27,E$29,E$31,E$33,E$35,E$37,E$39,E$41,E$43,E$45,E$47,E$49,E$51,E$53,E$55,E$57,E$59,E$61,E$63,E$65,E$67,E$69,E$71,E$73,E$75,E$77,E$79,E$81,E$83,E$85,E$87,E$89,E$91,E$93,E$95,E$97,E$99,E$101,E$103,E$105,E$107,E$109,E$111,E$113,E$115,E$117,E$119,E$121,E$123,E$125)) -> 3 | F688: =RANK(F687,(F$6,F$8,F$10,F$12,F$15,F$17,F$19,F$21,F$23,F$25,F$27,F$29,F$31,F$33,F$35,F$37,F$39,F$41,F$43,F$45,F$47,F$49,F$51,F$53,F$55,F$57,F$59,F$61,F$63,F$65,F$67,F$69,F$71,F$73,F$75,F$77,F$79,F$81,F$83,F$85,F$87,F$89,F$91,F$93,F$95,F$97,F$99,F$101,F$103,F$105,F$107,F$109,F$111,F$113,F$115,F$117,F$119,F$121,F$123,F$125)) -> 4 | G688: =RANK(G687,(G$6,G$8,G$10,G$12,G$15,G$17,G$19,G$21,G$23,G$25,G$27,G$29,G$31,G$33,G$35,G$37,G$39,G$41,G$43,G$45,G$47,G$49,G$51,G$53,G$55,G$57,G$59,G$61,G$63,G$65,G$67,G$69,G$71,G$73,G$75,G$77,G$79,G$81,G$83,G$85,G$87,G$89,G$91,G$93,G$95,G$97,G$99,G$101,G$103,G$105,G$107,G$109,G$111,G$113,G$115,G$117,G$119,G$121,G$123,G$125)) -> 3 | H688: =RANK(H687,(H$6,H$8,H$10,H$12,H$15,H$17,H$19,H$21,H$23,H$25,H$27,H$29,H$31,H$33,H$35,H$37,H$39,H$41,H$43,H$45,H$47,H$49,H$51,H$53,H$55,H$57,H$59,H$61,H$63,H$65,H$67,H$69,H$71,H$73,H$75,H$77,H$79,H$81,H$83,H$85,H$87,H$89,H$91,H$93,H$95,H$97,H$99,H$101,H$103,H$105,H$107,H$109,H$111,H$113,H$115,H$117,H$119,H$121,H$123,H$125)) -> 3 | I688: =RANK(I687,(I$6,I$8,I$10,I$12,I$15,I$17,I$19,I$21,I$23,I$25,I$27,I$29,I$31,I$33,I$35,I$37,I$39,I$41,I$43,I$45,I$47,I$49,I$51,I$53,I$55,I$57,I$59,I$61,I$63,I$65,I$67,I$69,I$71,I$73,I$75,I$77,I$79,I$81,I$83,I$85,I$87,I$89,I$91,I$93,I$95,I$97,I$99,I$101,I$103,I$105,I$107,I$109,I$111,I$113,I$115,I$117,I$119,I$121,I$123,I$125)) -> 3 | J688: =RANK(J687,(J$6,J$8,J$10,J$12,J$15,J$17,J$19,J$21,J$23,J$25,J$27,J$29,J$31,J$33,J$35,J$37,J$39,J$41,J$43,J$45,J$47,J$49,J$51,J$53,J$55,J$57,J$59,J$61,J$63,J$65,J$67,J$69,J$71,J$73,J$75,J$77,J$79,J$81,J$83,J$85,J$87,J$89,J$91,J$93,J$95,J$97,J$99,J$101,J$103,J$105,J$107,J$109,J$111,J$113,J$115,J$117,J$119,J$121,J$123,J$125)) -> 4 | K688: =RANK(K687,(K$6,K$8,K$10,K$12,K$15,K$17,K$19,K$21,K$23,K$25,K$27,K$29,K$31,K$33,K$35,K$37,K$39,K$41,K$43,K$45,K$47,K$49,K$51,K$53,K$55,K$57,K$59,K$61,K$63,K$65,K$67,K$69,K$71,K$73,K$75,K$77,K$79,K$81,K$83,K$85,K$87,K$89,K$91,K$93,K$95,K$97,K$99,K$101,K$103,K$105,K$107,K$109,K$111,K$113,K$115,K$117,K$119,K$121,K$123,K$125)) -> 3 | L688: =RANK(L687,(L$6,L$8,L$10,L$12,L$15,L$17,L$19,L$21,L$23,L$25,L$27,L$29,L$31,L$33,L$35,L$37,L$39,L$41,L$43,L$45,L$47,L$49,L$51,L$53,L$55,L$57,L$59,L$61,L$63,L$65,L$67,L$69,L$71,L$73,L$75,L$77,L$79,L$81,L$83,L$85,L$87,L$89,L$91,L$93,L$95,L$97,L$99,L$101,L$103,L$105,L$107,L$109,L$111,L$113,L$115,L$117,L$119,L$121,L$123,L$125)) -> 3 | M688: =RANK(M687,(M$6,M$8,M$10,M$12,M$15,M$17,M$19,M$21,M$23,M$25,M$27,M$29,M$31,M$33,M$35,M$37,M$39,M$41,M$43,M$45,M$47,M$49,M$51,M$53,M$55,M$57,M$59,M$61,M$63,M$65,M$67,M$69,M$71,M$73,M$75,M$77,M$79,M$81,M$83,M$85,M$87,M$89,M$91,M$93,M$95,M$97,M$99,M$101,M$103,M$105,M$107,M$109,M$111,M$113,M$115,M$117,M$119,M$121,M$123,M$125)) -> 3 | O688: 3
A689: White | B689: 1 | C689: 16.00 | D689: 16.60 | E689: 16.30 | F689: 17.20 | G689: 16.00 | H689: 17.50 | I689: 25.35 | J689: 20.10 | K689: 20.05 | L689: 40.15 | M689: 81.80 | N689: 0.0 | O689: 81.80
A690: Sabers | C690: =RANK(C689,(C$6,C$8,C$10,C$12,C$15,C$17,C$19,C$21,C$23,C$25,C$27,C$29,C$31,C$33,C$35,C$37,C$39,C$41,C$43,C$45,C$47,C$49,C$51,C$53,C$55,C$57,C$59,C$61,C$63,C$65,C$67,C$69,C$71,C$73,C$75,C$77,C$79,C$81,C$83,C$85,C$87,C$89,C$91,C$93,C$95,C$97,C$99,C$101,C$103,C$105,C$107,C$109,C$111,C$113,C$115,C$117,C$119,C$121,C$123,C$125)) -> 4 | D690: =RANK(D689,(D$6,D$8,D$10,D$12,D$15,D$17,D$19,D$21,D$23,D$25,D$27,D$29,D$31,D$33,D$35,D$37,D$39,D$41,D$43,D$45,D$47,D$49,D$51,D$53,D$55,D$57,D$59,D$61,D$63,D$65,D$67,D$69,D$71,D$73,D$75,D$77,D$79,D$81,D$83,D$85,D$87,D$89,D$91,D$93,D$95,D$97,D$99,D$101,D$103,D$105,D$107,D$109,D$111,D$113,D$115,D$117,D$119,D$121,D$123,D$125)) -> 4 | E690: =RANK(E689,(E$6,E$8,E$10,E$12,E$15,E$17,E$19,E$21,E$23,E$25,E$27,E$29,E$31,E$33,E$35,E$37,E$39,E$41,E$43,E$45,E$47,E$49,E$51,E$53,E$55,E$57,E$59,E$61,E$63,E$65,E$67,E$69,E$71,E$73,E$75,E$77,E$79,E$81,E$83,E$85,E$87,E$89,E$91,E$93,E$95,E$97,E$99,E$101,E$103,E$105,E$107,E$109,E$111,E$113,E$115,E$117,E$119,E$121,E$123,E$125)) -> 4 | F690: =RANK(F689,(F$6,F$8,F$10,F$12,F$15,F$17,F$19,F$21,F$23,F$25,F$27,F$29,F$31,F$33,F$35,F$37,F$39,F$41,F$43,F$45,F$47,F$49,F$51,F$53,F$55,F$57,F$59,F$61,F$63,F$65,F$67,F$69,F$71,F$73,F$75,F$77,F$79,F$81,F$83,F$85,F$87,F$89,F$91,F$93,F$95,F$97,F$99,F$101,F$103,F$105,F$107,F$109,F$111,F$113,F$115,F$117,F$119,F$121,F$123,F$125)) -> 3 | G690: =RANK(G689,(G$6,G$8,G$10,G$12,G$15,G$17,G$19,G$21,G$23,G$25,G$27,G$29,G$31,G$33,G$35,G$37,G$39,G$41,G$43,G$45,G$47,G$49,G$51,G$53,G$55,G$57,G$59,G$61,G$63,G$65,G$67,G$69,G$71,G$73,G$75,G$77,G$79,G$81,G$83,G$85,G$87,G$89,G$91,G$93,G$95,G$97,G$99,G$101,G$103,G$105,G$107,G$109,G$111,G$113,G$115,G$117,G$119,G$121,G$123,G$125)) -> 4 | H690: =RANK(H689,(H$6,H$8,H$10,H$12,H$15,H$17,H$19,H$21,H$23,H$25,H$27,H$29,H$31,H$33,H$35,H$37,H$39,H$41,H$43,H$45,H$47,H$49,H$51,H$53,H$55,H$57,H$59,H$61,H$63,H$65,H$67,H$69,H$71,H$73,H$75,H$77,H$79,H$81,H$83,H$85,H$87,H$89,H$91,H$93,H$95,H$97,H$99,H$101,H$103,H$105,H$107,H$109,H$111,H$113,H$115,H$117,H$119,H$121,H$123,H$125)) -> 4 | I690: =RANK(I689,(I$6,I$8,I$10,I$12,I$15,I$17,I$19,I$21,I$23,I$25,I$27,I$29,I$31,I$33,I$35,I$37,I$39,I$41,I$43,I$45,I$47,I$49,I$51,I$53,I$55,I$57,I$59,I$61,I$63,I$65,I$67,I$69,I$71,I$73,I$75,I$77,I$79,I$81,I$83,I$85,I$87,I$89,I$91,I$93,I$95,I$97,I$99,I$101,I$103,I$105,I$107,I$109,I$111,I$113,I$115,I$117,I$119,I$121,I$123,I$125)) -> 4 | J690: =RANK(J689,(J$6,J$8,J$10,J$12,J$15,J$17,J$19,J$21,J$23,J$25,J$27,J$29,J$31,J$33,J$35,J$37,J$39,J$41,J$43,J$45,J$47,J$49,J$51,J$53,J$55,J$57,J$59,J$61,J$63,J$65,J$67,J$69,J$71,J$73,J$75,J$77,J$79,J$81,J$83,J$85,J$87,J$89,J$91,J$93,J$95,J$97,J$99,J$101,J$103,J$105,J$107,J$109,J$111,J$113,J$115,J$117,J$119,J$121,J$123,J$125)) -> 3 | K690: =RANK(K689,(K$6,K$8,K$10,K$12,K$15,K$17,K$19,K$21,K$23,K$25,K$27,K$29,K$31,K$33,K$35,K$37,K$39,K$41,K$43,K$45,K$47,K$49,K$51,K$53,K$55,K$57,K$59,K$61,K$63,K$65,K$67,K$69,K$71,K$73,K$75,K$77,K$79,K$81,K$83,K$85,K$87,K$89,K$91,K$93,K$95,K$97,K$99,K$101,K$103,K$105,K$107,K$109,K$111,K$113,K$115,K$117,K$119,K$121,K$123,K$125)) -> 4 | L690: =RANK(L689,(L$6,L$8,L$10,L$12,L$15,L$17,L$19,L$21,L$23,L$25,L$27,L$29,L$31,L$33,L$35,L$37,L$39,L$41,L$43,L$45,L$47,L$49,L$51,L$53,L$55,L$57,L$59,L$61,L$63,L$65,L$67,L$69,L$71,L$73,L$75,L$77,L$79,L$81,L$83,L$85,L$87,L$89,L$91,L$93,L$95,L$97,L$99,L$101,L$103,L$105,L$107,L$109,L$111,L$113,L$115,L$117,L$119,L$121,L$123,L$125)) -> 4 | M690: =RANK(M689,(M$6,M$8,M$10,M$12,M$15,M$17,M$19,M$21,M$23,M$25,M$27,M$29,M$31,M$33,M$35,M$37,M$39,M$41,M$43,M$45,M$47,M$49,M$51,M$53,M$55,M$57,M$59,M$61,M$63,M$65,M$67,M$69,M$71,M$73,M$75,M$77,M$79,M$81,M$83,M$85,M$87,M$89,M$91,M$93,M$95,M$97,M$99,M$101,M$103,M$105,M$107,M$109,M$111,M$113,M$115,M$117,M$119,M$121,M$123,M$125)) -> 4 | O690: 4
A691: DCA Class A
A692: Fusion | B692: 1 | C692: 15.40 | D692: 15.30 | E692: 15.35 | F692: 15.40 | G692: 15.90 | H692: 16.00 | I692: 23.65 | J692: 19.10 | K692: 19.35 | L692: 38.45 | M692: 77.45 | N692: 0.0 | O692: 77.45
A693: Core | C693: 1 | D693: 1 | E693: 1 | F693: 1 | G693: 1 | H693: 1 | I693: 1 | J693: 1 | K693: 1 | L693: 1 | M693: 1 | O693: 1
A696: 8/24/2022 DCA Virtual
C697: Visual | F697: Music | J697: Effect
C698: Ensemble | D698: Color Guard | F698: Brass | G698: Percussion | H698: Ensemble | J698: Visual | K698: Music | M698: Sub | O698: Total
C699: J. Shade | D699: E. Dosher | E699: Average | F699: B. Rice | G699: R. Zamperini | H699: P. Hinman | I699: Total ÷2 | J699: N. Smith | K699: C. Poole | L699: Total | M699: Total | N699: Pen | O699: Score
A700: DCA Open Class | C700: 20 | D700: 20 | E700: 20 | F700: 20 | G700: 20 | H700: 20 | I700: 30 | J700: 25 | K700: 25 | L700: 50 | M700: 100 | O700: 100
A701: Atlanta CV | C701: 16.50 | D701: 16.20 | E701: 16.35 | F701: 16.20 | G701: 18.60 | H701: 16.60 | I701: 25.70 | J701: 19.70 | K701: 19.95 | L701: 39.65 | M701: 81.70 | N701: 0.0 | O701: 81.70
C702: =RANK(C701,(C$6,C$8,C$10,C$12,C$15,C$17,C$19,C$21,C$23,C$25,C$27,C$29,C$31,C$33,C$35,C$37,C$39,C$41,C$43,C$45,C$47,C$49,C$51,C$53,C$55,C$57,C$59,C$61,C$63,C$65,C$67,C$69,C$71,C$73,C$75,C$77,C$79,C$81,C$83,C$85,C$87,C$89,C$91,C$93,C$95,C$97,C$99,C$101,C$103,C$105,C$107,C$109,C$111,C$113,C$115,C$117,C$119,C$121,C$123,C$125)) -> 1 | D702: =RANK(D701,(D$6,D$8,D$10,D$12,D$15,D$17,D$19,D$21,D$23,D$25,D$27,D$29,D$31,D$33,D$35,D$37,D$39,D$41,D$43,D$45,D$47,D$49,D$51,D$53,D$55,D$57,D$59,D$61,D$63,D$65,D$67,D$69,D$71,D$73,D$75,D$77,D$79,D$81,D$83,D$85,D$87,D$89,D$91,D$93,D$95,D$97,D$99,D$101,D$103,D$105,D$107,D$109,D$111,D$113,D$115,D$117,D$119,D$121,D$123,D$125)) -> 1 | E702: =RANK(E701,(E$6,E$8,E$10,E$12,E$15,E$17,E$19,E$21,E$23,E$25,E$27,E$29,E$31,E$33,E$35,E$37,E$39,E$41,E$43,E$45,E$47,E$49,E$51,E$53,E$55,E$57,E$59,E$61,E$63,E$65,E$67,E$69,E$71,E$73,E$75,E$77,E$79,E$81,E$83,E$85,E$87,E$89,E$91,E$93,E$95,E$97,E$99,E$101,E$103,E$105,E$107,E$109,E$111,E$113,E$115,E$117,E$119,E$121,E$123,E$125)) -> 1 | F702: =RANK(F701,(F$6,F$8,F$10,F$12,F$15,F$17,F$19,F$21,F$23,F$25,F$27,F$29,F$31,F$33,F$35,F$37,F$39,F$41,F$43,F$45,F$47,F$49,F$51,F$53,F$55,F$57,F$59,F$61,F$63,F$65,F$67,F$69,F$71,F$73,F$75,F$77,F$79,F$81,F$83,F$85,F$87,F$89,F$91,F$93,F$95,F$97,F$99,F$101,F$103,F$105,F$107,F$109,F$111,F$113,F$115,F$117,F$119,F$121,F$123,F$125)) -> 3 | G702: =RANK(G701,(G$6,G$8,G$10,G$12,G$15,G$17,G$19,G$21,G$23,G$25,G$27,G$29,G$31,G$33,G$35,G$37,G$39,G$41,G$43,G$45,G$47,G$49,G$51,G$53,G$55,G$57,G$59,G$61,G$63,G$65,G$67,G$69,G$71,G$73,G$75,G$77,G$79,G$81,G$83,G$85,G$87,G$89,G$91,G$93,G$95,G$97,G$99,G$101,G$103,G$105,G$107,G$109,G$111,G$113,G$115,G$117,G$119,G$121,G$123,G$125)) -> 1 | H702: =RANK(H701,(H$6,H$8,H$10,H$12,H$15,H$17,H$19,H$21,H$23,H$25,H$27,H$29,H$31,H$33,H$35,H$37,H$39,H$41,H$43,H$45,H$47,H$49,H$51,H$53,H$55,H$57,H$59,H$61,H$63,H$65,H$67,H$69,H$71,H$73,H$75,H$77,H$79,H$81,H$83,H$85,H$87,H$89,H$91,H$93,H$95,H$97,H$99,H$101,H$103,H$105,H$107,H$109,H$111,H$113,H$115,H$117,H$119,H$121,H$123,H$125)) -> 2 | I702: =RANK(I701,(I$6,I$8,I$10,I$12,I$15,I$17,I$19,I$21,I$23,I$25,I$27,I$29,I$31,I$33,I$35,I$37,I$39,I$41,I$43,I$45,I$47,I$49,I$51,I$53,I$55,I$57,I$59,I$61,I$63,I$65,I$67,I$69,I$71,I$73,I$75,I$77,I$79,I$81,I$83,I$85,I$87,I$89,I$91,I$93,I$95,I$97,I$99,I$101,I$103,I$105,I$107,I$109,I$111,I$113,I$115,I$117,I$119,I$121,I$123,I$125)) -> 2 | J702: =RANK(J701,(J$6,J$8,J$10,J$12,J$15,J$17,J$19,J$21,J$23,J$25,J$27,J$29,J$31,J$33,J$35,J$37,J$39,J$41,J$43,J$45,J$47,J$49,J$51,J$53,J$55,J$57,J$59,J$61,J$63,J$65,J$67,J$69,J$71,J$73,J$75,J$77,J$79,J$81,J$83,J$85,J$87,J$89,J$91,J$93,J$95,J$97,J$99,J$101,J$103,J$105,J$107,J$109,J$111,J$113,J$115,J$117,J$119,J$121,J$123,J$125)) -> 1 | K702: =RANK(K701,(K$6,K$8,K$10,K$12,K$15,K$17,K$19,K$21,K$23,K$25,K$27,K$29,K$31,K$33,K$35,K$37,K$39,K$41,K$43,K$45,K$47,K$49,K$51,K$53,K$55,K$57,K$59,K$61,K$63,K$65,K$67,K$69,K$71,K$73,K$75,K$77,K$79,K$81,K$83,K$85,K$87,K$89,K$91,K$93,K$95,K$97,K$99,K$101,K$103,K$105,K$107,K$109,K$111,K$113,K$115,K$117,K$119,K$121,K$123,K$125)) -> 3 | L702: =RANK(L701,(L$6,L$8,L$10,L$12,L$15,L$17,L$19,L$21,L$23,L$25,L$27,L$29,L$31,L$33,L$35,L$37,L$39,L$41,L$43,L$45,L$47,L$49,L$51,L$53,L$55,L$57,L$59,L$61,L$63,L$65,L$67,L$69,L$71,L$73,L$75,L$77,L$79,L$81,L$83,L$85,L$87,L$89,L$91,L$93,L$95,L$97,L$99,L$101,L$103,L$105,L$107,L$109,L$111,L$113,L$115,L$117,L$119,L$121,L$123,L$125)) -> 1 | M702: =RANK(M701,(M$6,M$8,M$10,M$12,M$15,M$17,M$19,M$21,M$23,M$25,M$27,M$29,M$31,M$33,M$35,M$37,M$39,M$41,M$43,M$45,M$47,M$49,M$51,M$53,M$55,M$57,M$59,M$61,M$63,M$65,M$67,M$69,M$71,M$73,M$75,M$77,M$79,M$81,M$83,M$85,M$87,M$89,M$91,M$93,M$95,M$97,M$99,M$101,M$103,M$105,M$107,M$109,M$111,M$113,M$115,M$117,M$119,M$121,M$123,M$125)) -> 1 | O702: 1
A703: Connecticut | C703: 15.90 | D703: 15.90 | E703: 15.90 | F703: 16.40 | G703: 18.50 | H703: 16.80 | I703: 25.85 | J703: 18.80 | K703: 20.70 | L703: 39.50 | M703: 81.25 | N703: 0.0 | O703: 81.25
A704: Hurricanes | C704: =RANK(C703,(C$6,C$8,C$10,C$12,C$15,C$17,C$19,C$21,C$23,C$25,C$27,C$29,C$31,C$33,C$35,C$37,C$39,C$41,C$43,C$45,C$47,C$49,C$51,C$53,C$55,C$57,C$59,C$61,C$63,C$65,C$67,C$69,C$71,C$73,C$75,C$77,C$79,C$81,C$83,C$85,C$87,C$89,C$91,C$93,C$95,C$97,C$99,C$101,C$103,C$105,C$107,C$109,C$111,C$113,C$115,C$117,C$119,C$121,C$123,C$125)) -> 2 | D704: =RANK(D703,(D$6,D$8,D$10,D$12,D$15,D$17,D$19,D$21,D$23,D$25,D$27,D$29,D$31,D$33,D$35,D$37,D$39,D$41,D$43,D$45,D$47,D$49,D$51,D$53,D$55,D$57,D$59,D$61,D$63,D$65,D$67,D$69,D$71,D$73,D$75,D$77,D$79,D$81,D$83,D$85,D$87,D$89,D$91,D$93,D$95,D$97,D$99,D$101,D$103,D$105,D$107,D$109,D$111,D$113,D$115,D$117,D$119,D$121,D$123,D$125)) -> 2 | E704: =RANK(E703,(E$6,E$8,E$10,E$12,E$15,E$17,E$19,E$21,E$23,E$25,E$27,E$29,E$31,E$33,E$35,E$37,E$39,E$41,E$43,E$45,E$47,E$49,E$51,E$53,E$55,E$57,E$59,E$61,E$63,E$65,E$67,E$69,E$71,E$73,E$75,E$77,E$79,E$81,E$83,E$85,E$87,E$89,E$91,E$93,E$95,E$97,E$99,E$101,E$103,E$105,E$107,E$109,E$111,E$113,E$115,E$117,E$119,E$121,E$123,E$125)) -> 2 | F704: =RANK(F703,(F$6,F$8,F$10,F$12,F$15,F$17,F$19,F$21,F$23,F$25,F$27,F$29,F$31,F$33,F$35,F$37,F$39,F$41,F$43,F$45,F$47,F$49,F$51,F$53,F$55,F$57,F$59,F$61,F$63,F$65,F$67,F$69,F$71,F$73,F$75,F$77,F$79,F$81,F$83,F$85,F$87,F$89,F$91,F$93,F$95,F$97,F$99,F$101,F$103,F$105,F$107,F$109,F$111,F$113,F$115,F$117,F$119,F$121,F$123,F$125)) -> 2 | G704: =RANK(G703,(G$6,G$8,G$10,G$12,G$15,G$17,G$19,G$21,G$23,G$25,G$27,G$29,G$31,G$33,G$35,G$37,G$39,G$41,G$43,G$45,G$47,G$49,G$51,G$53,G$55,G$57,G$59,G$61,G$63,G$65,G$67,G$69,G$71,G$73,G$75,G$77,G$79,G$81,G$83,G$85,G$87,G$89,G$91,G$93,G$95,G$97,G$99,G$101,G$103,G$105,G$107,G$109,G$111,G$113,G$115,G$117,G$119,G$121,G$123,G$125)) -> 2 | H704: =RANK(H703,(H$6,H$8,H$10,H$12,H$15,H$17,H$19,H$21,H$23,H$25,H$27,H$29,H$31,H$33,H$35,H$37,H$39,H$41,H$43,H$45,H$47,H$49,H$51,H$53,H$55,H$57,H$59,H$61,H$63,H$65,H$67,H$69,H$71,H$73,H$75,H$77,H$79,H$81,H$83,H$85,H$87,H$89,H$91,H$93,H$95,H$97,H$99,H$101,H$103,H$105,H$107,H$109,H$111,H$113,H$115,H$117,H$119,H$121,H$123,H$125)) -> 1 | I704: =RANK(I703,(I$6,I$8,I$10,I$12,I$15,I$17,I$19,I$21,I$23,I$25,I$27,I$29,I$31,I$33,I$35,I$37,I$39,I$41,I$43,I$45,I$47,I$49,I$51,I$53,I$55,I$57,I$59,I$61,I$63,I$65,I$67,I$69,I$71,I$73,I$75,I$77,I$79,I$81,I$83,I$85,I$87,I$89,I$91,I$93,I$95,I$97,I$99,I$101,I$103,I$105,I$107,I$109,I$111,I$113,I$115,I$117,I$119,I$121,I$123,I$125)) -> 1 | J704: =RANK(J703,(J$6,J$8,J$10,J$12,J$15,J$17,J$19,J$21,J$23,J$25,J$27,J$29,J$31,J$33,J$35,J$37,J$39,J$41,J$43,J$45,J$47,J$49,J$51,J$53,J$55,J$57,J$59,J$61,J$63,J$65,J$67,J$69,J$71,J$73,J$75,J$77,J$79,J$81,J$83,J$85,J$87,J$89,J$91,J$93,J$95,J$97,J$99,J$101,J$103,J$105,J$107,J$109,J$111,J$113,J$115,J$117,J$119,J$121,J$123,J$125)) -> 3 | K704: =RANK(K703,(K$6,K$8,K$10,K$12,K$15,K$17,K$19,K$21,K$23,K$25,K$27,K$29,K$31,K$33,K$35,K$37,K$39,K$41,K$43,K$45,K$47,K$49,K$51,K$53,K$55,K$57,K$59,K$61,K$63,K$65,K$67,K$69,K$71,K$73,K$75,K$77,K$79,K$81,K$83,K$85,K$87,K$89,K$91,K$93,K$95,K$97,K$99,K$101,K$103,K$105,K$107,K$109,K$111,K$113,K$115,K$117,K$119,K$121,K$123,K$125)) -> 1 | L704: =RANK(L703,(L$6,L$8,L$10,L$12,L$15,L$17,L$19,L$21,L$23,L$25,L$27,L$29,L$31,L$33,L$35,L$37,L$39,L$41,L$43,L$45,L$47,L$49,L$51,L$53,L$55,L$57,L$59,L$61,L$63,L$65,L$67,L$69,L$71,L$73,L$75,L$77,L$79,L$81,L$83,L$85,L$87,L$89,L$91,L$93,L$95,L$97,L$99,L$101,L$103,L$105,L$107,L$109,L$111,L$113,L$115,L$117,L$119,L$121,L$123,L$125)) -> 2 | M704: =RANK(M703,(M$6,M$8,M$10,M$12,M$15,M$17,M$19,M$21,M$23,M$25,M$27,M$29,M$31,M$33,M$35,M$37,M$39,M$41,M$43,M$45,M$47,M$49,M$51,M$53,M$55,M$57,M$59,M$61,M$63,M$65,M$67,M$69,M$71,M$73,M$75,M$77,M$79,M$81,M$83,M$85,M$87,M$89,M$91,M$93,M$95,M$97,M$99,M$101,M$103,M$105,M$107,M$109,M$111,M$113,M$115,M$117,M$119,M$121,M$123,M$125)) -> 2 | O704: 2
A705: Cincinnati | C705: 15.40 | D705: 15.70 | E705: 15.55 | F705: 15.60 | G705: 16.70 | H705: 15.30 | I705: 23.80 | J705: 19.15 | K705: 20.35 | L705: 39.50 | M705: 78.85 | N705: 0.0 | O705: 78.85
A706: Tradition | C706: =RANK(C705,(C$6,C$8,C$10,C$12,C$15,C$17,C$19,C$21,C$23,C$25,C$27,C$29,C$31,C$33,C$35,C$37,C$39,C$41,C$43,C$45,C$47,C$49,C$51,C$53,C$55,C$57,C$59,C$61,C$63,C$65,C$67,C$69,C$71,C$73,C$75,C$77,C$79,C$81,C$83,C$85,C$87,C$89,C$91,C$93,C$95,C$97,C$99,C$101,C$103,C$105,C$107,C$109,C$111,C$113,C$115,C$117,C$119,C$121,C$123,C$125)) -> 3 | D706: =RANK(D705,(D$6,D$8,D$10,D$12,D$15,D$17,D$19,D$21,D$23,D$25,D$27,D$29,D$31,D$33,D$35,D$37,D$39,D$41,D$43,D$45,D$47,D$49,D$51,D$53,D$55,D$57,D$59,D$61,D$63,D$65,D$67,D$69,D$71,D$73,D$75,D$77,D$79,D$81,D$83,D$85,D$87,D$89,D$91,D$93,D$95,D$97,D$99,D$101,D$103,D$105,D$107,D$109,D$111,D$113,D$115,D$117,D$119,D$121,D$123,D$125)) -> 3 | E706: =RANK(E705,(E$6,E$8,E$10,E$12,E$15,E$17,E$19,E$21,E$23,E$25,E$27,E$29,E$31,E$33,E$35,E$37,E$39,E$41,E$43,E$45,E$47,E$49,E$51,E$53,E$55,E$57,E$59,E$61,E$63,E$65,E$67,E$69,E$71,E$73,E$75,E$77,E$79,E$81,E$83,E$85,E$87,E$89,E$91,E$93,E$95,E$97,E$99,E$101,E$103,E$105,E$107,E$109,E$111,E$113,E$115,E$117,E$119,E$121,E$123,E$125)) -> 3 | F706: =RANK(F705,(F$6,F$8,F$10,F$12,F$15,F$17,F$19,F$21,F$23,F$25,F$27,F$29,F$31,F$33,F$35,F$37,F$39,F$41,F$43,F$45,F$47,F$49,F$51,F$53,F$55,F$57,F$59,F$61,F$63,F$65,F$67,F$69,F$71,F$73,F$75,F$77,F$79,F$81,F$83,F$85,F$87,F$89,F$91,F$93,F$95,F$97,F$99,F$101,F$103,F$105,F$107,F$109,F$111,F$113,F$115,F$117,F$119,F$121,F$123,F$125)) -> 4 | G706: =RANK(G705,(G$6,G$8,G$10,G$12,G$15,G$17,G$19,G$21,G$23,G$25,G$27,G$29,G$31,G$33,G$35,G$37,G$39,G$41,G$43,G$45,G$47,G$49,G$51,G$53,G$55,G$57,G$59,G$61,G$63,G$65,G$67,G$69,G$71,G$73,G$75,G$77,G$79,G$81,G$83,G$85,G$87,G$89,G$91,G$93,G$95,G$97,G$99,G$101,G$103,G$105,G$107,G$109,G$111,G$113,G$115,G$117,G$119,G$121,G$123,G$125)) -> 3 | H706: =RANK(H705,(H$6,H$8,H$10,H$12,H$15,H$17,H$19,H$21,H$23,H$25,H$27,H$29,H$31,H$33,H$35,H$37,H$39,H$41,H$43,H$45,H$47,H$49,H$51,H$53,H$55,H$57,H$59,H$61,H$63,H$65,H$67,H$69,H$71,H$73,H$75,H$77,H$79,H$81,H$83,H$85,H$87,H$89,H$91,H$93,H$95,H$97,H$99,H$101,H$103,H$105,H$107,H$109,H$111,H$113,H$115,H$117,H$119,H$121,H$123,H$125)) -> 4 | I706: =RANK(I705,(I$6,I$8,I$10,I$12,I$15,I$17,I$19,I$21,I$23,I$25,I$27,I$29,I$31,I$33,I$35,I$37,I$39,I$41,I$43,I$45,I$47,I$49,I$51,I$53,I$55,I$57,I$59,I$61,I$63,I$65,I$67,I$69,I$71,I$73,I$75,I$77,I$79,I$81,I$83,I$85,I$87,I$89,I$91,I$93,I$95,I$97,I$99,I$101,I$103,I$105,I$107,I$109,I$111,I$113,I$115,I$117,I$119,I$121,I$123,I$125)) -> 4 | J706: =RANK(J705,(J$6,J$8,J$10,J$12,J$15,J$17,J$19,J$21,J$23,J$25,J$27,J$29,J$31,J$33,J$35,J$37,J$39,J$41,J$43,J$45,J$47,J$49,J$51,J$53,J$55,J$57,J$59,J$61,J$63,J$65,J$67,J$69,J$71,J$73,J$75,J$77,J$79,J$81,J$83,J$85,J$87,J$89,J$91,J$93,J$95,J$97,J$99,J$101,J$103,J$105,J$107,J$109,J$111,J$113,J$115,J$117,J$119,J$121,J$123,J$125)) -> 2 | K706: =RANK(K705,(K$6,K$8,K$10,K$12,K$15,K$17,K$19,K$21,K$23,K$25,K$27,K$29,K$31,K$33,K$35,K$37,K$39,K$41,K$43,K$45,K$47,K$49,K$51,K$53,K$55,K$57,K$59,K$61,K$63,K$65,K$67,K$69,K$71,K$73,K$75,K$77,K$79,K$81,K$83,K$85,K$87,K$89,K$91,K$93,K$95,K$97,K$99,K$101,K$103,K$105,K$107,K$109,K$111,K$113,K$115,K$117,K$119,K$121,K$123,K$125)) -> 2 | L706: =RANK(L705,(L$6,L$8,L$10,L$12,L$15,L$17,L$19,L$21,L$23,L$25,L$27,L$29,L$31,L$33,L$35,L$37,L$39,L$41,L$43,L$45,L$47,L$49,L$51,L$53,L$55,L$57,L$59,L$61,L$63,L$65,L$67,L$69,L$71,L$73,L$75,L$77,L$79,L$81,L$83,L$85,L$87,L$89,L$91,L$93,L$95,L$97,L$99,L$101,L$103,L$105,L$107,L$109,L$111,L$113,L$115,L$117,L$119,L$121,L$123,L$125)) -> 2 | M706: =RANK(M705,(M$6,M$8,M$10,M$12,M$15,M$17,M$19,M$21,M$23,M$25,M$27,M$29,M$31,M$33,M$35,M$37,M$39,M$41,M$43,M$45,M$47,M$49,M$51,M$53,M$55,M$57,M$59,M$61,M$63,M$65,M$67,M$69,M$71,M$73,M$75,M$77,M$79,M$81,M$83,M$85,M$87,M$89,M$91,M$93,M$95,M$97,M$99,M$101,M$103,M$105,M$107,M$109,M$111,M$113,M$115,M$117,M$119,M$121,M$123,M$125)) -> 3 | O706: 3
A707: Rogues Hollow | C707: 14.90 | D707: 15.00 | E707: 14.95 | F707: 16.80 | G707: 15.60 | H707: 16.10 | I707: 24.25 | J707: 17.00 | K707: 19.80 | L707: 36.80 | M707: 76.00 | N707: 0.0 | O707: 76.00
A708: Regiment | C708: =RANK(C707,(C$6,C$8,C$10,C$12,C$15,C$17,C$19,C$21,C$23,C$25,C$27,C$29,C$31,C$33,C$35,C$37,C$39,C$41,C$43,C$45,C$47,C$49,C$51,C$53,C$55,C$57,C$59,C$61,C$63,C$65,C$67,C$69,C$71,C$73,C$75,C$77,C$79,C$81,C$83,C$85,C$87,C$89,C$91,C$93,C$95,C$97,C$99,C$101,C$103,C$105,C$107,C$109,C$111,C$113,C$115,C$117,C$119,C$121,C$123,C$125)) -> 4 | D708: =RANK(D707,(D$6,D$8,D$10,D$12,D$15,D$17,D$19,D$21,D$23,D$25,D$27,D$29,D$31,D$33,D$35,D$37,D$39,D$41,D$43,D$45,D$47,D$49,D$51,D$53,D$55,D$57,D$59,D$61,D$63,D$65,D$67,D$69,D$71,D$73,D$75,D$77,D$79,D$81,D$83,D$85,D$87,D$89,D$91,D$93,D$95,D$97,D$99,D$101,D$103,D$105,D$107,D$109,D$111,D$113,D$115,D$117,D$119,D$121,D$123,D$125)) -> 4 | E708: =RANK(E707,(E$6,E$8,E$10,E$12,E$15,E$17,E$19,E$21,E$23,E$25,E$27,E$29,E$31,E$33,E$35,E$37,E$39,E$41,E$43,E$45,E$47,E$49,E$51,E$53,E$55,E$57,E$59,E$61,E$63,E$65,E$67,E$69,E$71,E$73,E$75,E$77,E$79,E$81,E$83,E$85,E$87,E$89,E$91,E$93,E$95,E$97,E$99,E$101,E$103,E$105,E$107,E$109,E$111,E$113,E$115,E$117,E$119,E$121,E$123,E$125)) -> 4 | F708: =RANK(F707,(F$6,F$8,F$10,F$12,F$15,F$17,F$19,F$21,F$23,F$25,F$27,F$29,F$31,F$33,F$35,F$37,F$39,F$41,F$43,F$45,F$47,F$49,F$51,F$53,F$55,F$57,F$59,F$61,F$63,F$65,F$67,F$69,F$71,F$73,F$75,F$77,F$79,F$81,F$83,F$85,F$87,F$89,F$91,F$93,F$95,F$97,F$99,F$101,F$103,F$105,F$107,F$109,F$111,F$113,F$115,F$117,F$119,F$121,F$123,F$125)) -> 1 | G708: 4 | H708: =RANK(H707,(H$6,H$8,H$10,H$12,H$15,H$17,H$19,H$21,H$23,H$25,H$27,H$29,H$31,H$33,H$35,H$37,H$39,H$41,H$43,H$45,H$47,H$49,H$51,H$53,H$55,H$57,H$59,H$61,H$63,H$65,H$67,H$69,H$71,H$73,H$75,H$77,H$79,H$81,H$83,H$85,H$87,H$89,H$91,H$93,H$95,H$97,H$99,H$101,H$103,H$105,H$107,H$109,H$111,H$113,H$115,H$117,H$119,H$121,H$123,H$125)) -> 3 | I708: =RANK(I707,(I$6,I$8,I$10,I$12,I$15,I$17,I$19,I$21,I$23,I$25,I$27,I$29,I$31,I$33,I$35,I$37,I$39,I$41,I$43,I$45,I$47,I$49,I$51,I$53,I$55,I$57,I$59,I$61,I$63,I$65,I$67,I$69,I$71,I$73,I$75,I$77,I$79,I$81,I$83,I$85,I$87,I$89,I$91,I$93,I$95,I$97,I$99,I$101,I$103,I$105,I$107,I$109,I$111,I$113,I$115,I$117,I$119,I$121,I$123,I$125)) -> 3 | J708: 4 | K708: =RANK(K707,(K$6,K$8,K$10,K$12,K$15,K$17,K$19,K$21,K$23,K$25,K$27,K$29,K$31,K$33,K$35,K$37,K$39,K$41,K$43,K$45,K$47,K$49,K$51,K$53,K$55,K$57,K$59,K$61,K$63,K$65,K$67,K$69,K$71,K$73,K$75,K$77,K$79,K$81,K$83,K$85,K$87,K$89,K$91,K$93,K$95,K$97,K$99,K$101,K$103,K$105,K$107,K$109,K$111,K$113,K$115,K$117,K$119,K$121,K$123,K$125)) -> 4 | L708: =RANK(L707,(L$6,L$8,L$10,L$12,L$15,L$17,L$19,L$21,L$23,L$25,L$27,L$29,L$31,L$33,L$35,L$37,L$39,L$41,L$43,L$45,L$47,L$49,L$51,L$53,L$55,L$57,L$59,L$61,L$63,L$65,L$67,L$69,L$71,L$73,L$75,L$77,L$79,L$81,L$83,L$85,L$87,L$89,L$91,L$93,L$95,L$97,L$99,L$101,L$103,L$105,L$107,L$109,L$111,L$113,L$115,L$117,L$119,L$121,L$123,L$125)) -> 4 | M708: =RANK(M707,(M$6,M$8,M$10,M$12,M$15,M$17,M$19,M$21,M$23,M$25,M$27,M$29,M$31,M$33,M$35,M$37,M$39,M$41,M$43,M$45,M$47,M$49,M$51,M$53,M$55,M$57,M$59,M$61,M$63,M$65,M$67,M$69,M$71,M$73,M$75,M$77,M$79,M$81,M$83,M$85,M$87,M$89,M$91,M$93,M$95,M$97,M$99,M$101,M$103,M$105,M$107,M$109,M$111,M$113,M$115,M$117,M$119,M$121,M$123,M$125)) -> 4 | O708: 4
A709: DCA Class A
A710: Govenaires | C710: 14.40 | D710: 14.30 | E710: 14.35 | F710: 14.30 | G710: 15.80 | H710: 15.00 | I710: 22.55 | J710: 17.15 | K710: 19.55 | L710: 36.70 | M710: 73.60 | N710: 0.0 | O710: 73.60
C711: 1 | D711: 1 | E711: 1 | F711: 1 | G711: 1 | H711: 1 | I711: 1 | J711: 1 | K711: 1 | L711: 1 | M711: 1 | O711: 1
A712: Columbus | C712: 11.00 | D712: 13.50 | E712: 12.25 | F712: 11.80 | G712: 11.40 | H712: 10.60 | I712: 16.90 | J712: 16.10 | K712: 16.60 | L712: 32.70 | M712: 61.85 | N712: 1.0 | O712: 60.85
A713: Saints | C713: 2 | D713: 2 | E713: 2 | F713: 2 | G713: 2 | H713: 2 | I713: 2 | J713: 2 | K713: 2 | L713: 2 | M713: 2 | O713: 2
A716: 8/27/2022 Seymour, Connecticut
C717: Visual | F717: Music | J717: Effect
C718: Ensemble | D718: Color Guard | F718: Brass | G718: Percussion | H718: Ensemble | J718: Visual | K718: Music | M718: Sub | O718: Total
C719: C. Raichle | D719: B. Kenny | E719: Average | F719: D. Groth | G719: F. Ford | H719: B. Schwartz | I719: Total ÷2 | J719: I. Delgado | K719: C. Poole | L719: Total | M719: Total | N719: Pen | O719: Score
A720: DCA World Class | C720: 20 | D720: 20 | E720: 20 | F720: 20 | G720: 20 | H720: 20 | I720: 30 | J720: 25 | K720: 25 | L720: 50 | M720: 100 | O720: 100
A721: Hawthorne | C721: 17.90 | D721: 19.10 | E721: 18.50 | F721: 18.70 | G721: 19.00 | H721: 19.10 | I721: 28.40 | J721: 23.45 | K721: 23.20 | L721: 46.65 | M721: 93.55 | N721: 0.0 | O721: 93.55
A722: Caballeros | C722: 1 | D722: 1 | E722: 1 | F722: 1 | G722: 1 | H722: 1 | I722: 1 | J722: 1 | K722: 1 | L722: 1 | M722: 1 | O722: 1
A723: DCA Open Class
A724: Connecticut | C724: 16.30 | D724: 17.00 | E724: 16.65 | F724: 16.80 | G724: 18.10 | H724: 15.60 | I724: 25.25 | J724: 20.05 | K724: 21.15 | L724: 41.20 | M724: 83.10 | N724: 0.0 | O724: 83.10
A725: Hurricanes | C725: 1 | D725: 1 | E725: 1 | F725: 1 | G725: 1 | H725: 1 | I725: 1 | J725: 1 | K725: 1 | L725: 1 | M725: 1 | O725: 1
A726: DCA Class A
A727: Fusion | C727: 16.00 | D727: 16.10 | E727: 16.05 | F727: 16.00 | G727: 16.50 | H727: 16.60 | I727: 24.55 | J727: 19.85 | K727: 20.40 | L727: 40.25 | M727: 80.85 | N727: 0.0 | O727: 80.85
A728: Core | C728: 1 | D728: 1 | E728: 1 | F728: 1 | G728: 1 | H728: 1 | I728: 1 | J728: 1 | K728: 1 | L728: 1 | M728: 1 | O728: 1
A731: 8/27/2022 Reading, Pennsylvania
C732: Visual | F732: Music | J732: Effect
C733: Ensemble | D733: Color Guard | F733: Brass | G733: Percussion | H733: Ensemble | J733: Visual | K733: Music | M733: Sub | O733: Total
C734: R. Templin | D734: E. Doscher | E734: Average | F734: D. Thomas | G734: J. Stauffer | H734: S. Halquist | I734: Total ÷2 | J734: J. Shade | K734: P. Smith | L734: Total | M734: Total | N734: Pen | O734: Score
A735: DCA World Class | C735: 20 | D735: 20 | E735: 20 | F735: 20 | G735: 20 | H735: 20 | I735: 30 | J735: 25 | K735: 25 | L735: 50 | M735: 100 | O735: 100
A736: Reading | C736: 18.30 | D736: 18.80 | E736: 18.55 | F736: 18.60 | G736: 19.00 | H736: 18.80 | I736: 28.20 | J736: 23.40 | K736: 23.35 | L736: 46.75 | M736: 93.50 | N736: 0.0 | O736: 93.50
A737: Buccaneers | C737: =RANK(C736,(C$6,C$8,C$10,C$13,C$15,C$17,C$19,C$21,C$23,C$25,C$27,C$29,C$31,C$33,C$35,C$37,C$39,C$41,C$43,C$45,C$47,C$49,C$51,C$53,C$55,C$57,C$59,C$61,C$63,C$65,C$67,C$69,C$71,C$73,C$75,C$77,C$79,C$81,C$83,C$85,C$87,C$89,C$91,C$93,C$95,C$97,C$99,C$101,C$103,C$105,C$107,C$109,C$111,C$113,C$115,C$117,C$119,C$121,C$123,C$125)) -> 1 | D737: =RANK(D736,(D$6,D$8,D$10,D$13,D$15,D$17,D$19,D$21,D$23,D$25,D$27,D$29,D$31,D$33,D$35,D$37,D$39,D$41,D$43,D$45,D$47,D$49,D$51,D$53,D$55,D$57,D$59,D$61,D$63,D$65,D$67,D$69,D$71,D$73,D$75,D$77,D$79,D$81,D$83,D$85,D$87,D$89,D$91,D$93,D$95,D$97,D$99,D$101,D$103,D$105,D$107,D$109,D$111,D$113,D$115,D$117,D$119,D$121,D$123,D$125)) -> 1 | E737: =RANK(E736,(E$6,E$8,E$10,E$13,E$15,E$17,E$19,E$21,E$23,E$25,E$27,E$29,E$31,E$33,E$35,E$37,E$39,E$41,E$43,E$45,E$47,E$49,E$51,E$53,E$55,E$57,E$59,E$61,E$63,E$65,E$67,E$69,E$71,E$73,E$75,E$77,E$79,E$81,E$83,E$85,E$87,E$89,E$91,E$93,E$95,E$97,E$99,E$101,E$103,E$105,E$107,E$109,E$111,E$113,E$115,E$117,E$119,E$121,E$123,E$125)) -> 1 | F737: =RANK(F736,(F$6,F$8,F$10,F$13,F$15,F$17,F$19,F$21,F$23,F$25,F$27,F$29,F$31,F$33,F$35,F$37,F$39,F$41,F$43,F$45,F$47,F$49,F$51,F$53,F$55,F$57,F$59,F$61,F$63,F$65,F$67,F$69,F$71,F$73,F$75,F$77,F$79,F$81,F$83,F$85,F$87,F$89,F$91,F$93,F$95,F$97,F$99,F$101,F$103,F$105,F$107,F$109,F$111,F$113,F$115,F$117,F$119,F$121,F$123,F$125)) -> 1 | G737: =RANK(G736,(G$6,G$8,G$10,G$13,G$15,G$17,G$19,G$21,G$23,G$25,G$27,G$29,G$31,G$33,G$35,G$37,G$39,G$41,G$43,G$45,G$47,G$49,G$51,G$53,G$55,G$57,G$59,G$61,G$63,G$65,G$67,G$69,G$71,G$73,G$75,G$77,G$79,G$81,G$83,G$85,G$87,G$89,G$91,G$93,G$95,G$97,G$99,G$101,G$103,G$105,G$107,G$109,G$111,G$113,G$115,G$117,G$119,G$121,G$123,G$125)) -> 1 | H737: =RANK(H736,(H$6,H$8,H$10,H$13,H$15,H$17,H$19,H$21,H$23,H$25,H$27,H$29,H$31,H$33,H$35,H$37,H$39,H$41,H$43,H$45,H$47,H$49,H$51,H$53,H$55,H$57,H$59,H$61,H$63,H$65,H$67,H$69,H$71,H$73,H$75,H$77,H$79,H$81,H$83,H$85,H$87,H$89,H$91,H$93,H$95,H$97,H$99,H$101,H$103,H$105,H$107,H$109,H$111,H$113,H$115,H$117,H$119,H$121,H$123,H$125)) -> 1 | I737: =RANK(I736,(I$6,I$8,I$10,I$13,I$15,I$17,I$19,I$21,I$23,I$25,I$27,I$29,I$31,I$33,I$35,I$37,I$39,I$41,I$43,I$45,I$47,I$49,I$51,I$53,I$55,I$57,I$59,I$61,I$63,I$65,I$67,I$69,I$71,I$73,I$75,I$77,I$79,I$81,I$83,I$85,I$87,I$89,I$91,I$93,I$95,I$97,I$99,I$101,I$103,I$105,I$107,I$109,I$111,I$113,I$115,I$117,I$119,I$121,I$123,I$125)) -> 1 | J737: =RANK(J736,(J$6,J$8,J$10,J$13,J$15,J$17,J$19,J$21,J$23,J$25,J$27,J$29,J$31,J$33,J$35,J$37,J$39,J$41,J$43,J$45,J$47,J$49,J$51,J$53,J$55,J$57,J$59,J$61,J$63,J$65,J$67,J$69,J$71,J$73,J$75,J$77,J$79,J$81,J$83,J$85,J$87,J$89,J$91,J$93,J$95,J$97,J$99,J$101,J$103,J$105,J$107,J$109,J$111,J$113,J$115,J$117,J$119,J$121,J$123,J$125)) -> 1 | K737: =RANK(K736,(K$6,K$8,K$10,K$13,K$15,K$17,K$19,K$21,K$23,K$25,K$27,K$29,K$31,K$33,K$35,K$37,K$39,K$41,K$43,K$45,K$47,K$49,K$51,K$53,K$55,K$57,K$59,K$61,K$63,K$65,K$67,K$69,K$71,K$73,K$75,K$77,K$79,K$81,K$83,K$85,K$87,K$89,K$91,K$93,K$95,K$97,K$99,K$101,K$103,K$105,K$107,K$109,K$111,K$113,K$115,K$117,K$119,K$121,K$123,K$125)) -> 1 | L737: =RANK(L736,(L$6,L$8,L$10,L$13,L$15,L$17,L$19,L$21,L$23,L$25,L$27,L$29,L$31,L$33,L$35,L$37,L$39,L$41,L$43,L$45,L$47,L$49,L$51,L$53,L$55,L$57,L$59,L$61,L$63,L$65,L$67,L$69,L$71,L$73,L$75,L$77,L$79,L$81,L$83,L$85,L$87,L$89,L$91,L$93,L$95,L$97,L$99,L$101,L$103,L$105,L$107,L$109,L$111,L$113,L$115,L$117,L$119,L$121,L$123,L$125)) -> 1 | M737: =RANK(M736,(M$6,M$8,M$10,M$13,M$15,M$17,M$19,M$21,M$23,M$25,M$27,M$29,M$31,M$33,M$35,M$37,M$39,M$41,M$43,M$45,M$47,M$49,M$51,M$53,M$55,M$57,M$59,M$61,M$63,M$65,M$67,M$69,M$71,M$73,M$75,M$77,M$79,M$81,M$83,M$85,M$87,M$89,M$91,M$93,M$95,M$97,M$99,M$101,M$103,M$105,M$107,M$109,M$111,M$113,M$115,M$117,M$119,M$121,M$123,M$125)) -> 1 | O737: 1
A738: Bushwackers | C738: 17.10 | D738: 18.50 | E738: 17.80 | F738: 17.60 | G738: 18.70 | H738: 18.20 | I738: 27.25 | J738: 21.95 | K738: 22.75 | L738: 44.70 | M738: 89.75 | N738: 0.0 | O738: 89.75
C739: =RANK(C738,(C$6,C$8,C$10,C$13,C$15,C$17,C$19,C$21,C$23,C$25,C$27,C$29,C$31,C$33,C$35,C$37,C$39,C$41,C$43,C$45,C$47,C$49,C$51,C$53,C$55,C$57,C$59,C$61,C$63,C$65,C$67,C$69,C$71,C$73,C$75,C$77,C$79,C$81,C$83,C$85,C$87,C$89,C$91,C$93,C$95,C$97,C$99,C$101,C$103,C$105,C$107,C$109,C$111,C$113,C$115,C$117,C$119,C$121,C$123,C$125)) -> 2 | D739: =RANK(D738,(D$6,D$8,D$10,D$13,D$15,D$17,D$19,D$21,D$23,D$25,D$27,D$29,D$31,D$33,D$35,D$37,D$39,D$41,D$43,D$45,D$47,D$49,D$51,D$53,D$55,D$57,D$59,D$61,D$63,D$65,D$67,D$69,D$71,D$73,D$75,D$77,D$79,D$81,D$83,D$85,D$87,D$89,D$91,D$93,D$95,D$97,D$99,D$101,D$103,D$105,D$107,D$109,D$111,D$113,D$115,D$117,D$119,D$121,D$123,D$125)) -> 2 | E739: =RANK(E738,(E$6,E$8,E$10,E$13,E$15,E$17,E$19,E$21,E$23,E$25,E$27,E$29,E$31,E$33,E$35,E$37,E$39,E$41,E$43,E$45,E$47,E$49,E$51,E$53,E$55,E$57,E$59,E$61,E$63,E$65,E$67,E$69,E$71,E$73,E$75,E$77,E$79,E$81,E$83,E$85,E$87,E$89,E$91,E$93,E$95,E$97,E$99,E$101,E$103,E$105,E$107,E$109,E$111,E$113,E$115,E$117,E$119,E$121,E$123,E$125)) -> 2 | F739: =RANK(F738,(F$6,F$8,F$10,F$13,F$15,F$17,F$19,F$21,F$23,F$25,F$27,F$29,F$31,F$33,F$35,F$37,F$39,F$41,F$43,F$45,F$47,F$49,F$51,F$53,F$55,F$57,F$59,F$61,F$63,F$65,F$67,F$69,F$71,F$73,F$75,F$77,F$79,F$81,F$83,F$85,F$87,F$89,F$91,F$93,F$95,F$97,F$99,F$101,F$103,F$105,F$107,F$109,F$111,F$113,F$115,F$117,F$119,F$121,F$123,F$125)) -> 3 | G739: =RANK(G738,(G$6,G$8,G$10,G$13,G$15,G$17,G$19,G$21,G$23,G$25,G$27,G$29,G$31,G$33,G$35,G$37,G$39,G$41,G$43,G$45,G$47,G$49,G$51,G$53,G$55,G$57,G$59,G$61,G$63,G$65,G$67,G$69,G$71,G$73,G$75,G$77,G$79,G$81,G$83,G$85,G$87,G$89,G$91,G$93,G$95,G$97,G$99,G$101,G$103,G$105,G$107,G$109,G$111,G$113,G$115,G$117,G$119,G$121,G$123,G$125)) -> 2 | H739: =RANK(H738,(H$6,H$8,H$10,H$13,H$15,H$17,H$19,H$21,H$23,H$25,H$27,H$29,H$31,H$33,H$35,H$37,H$39,H$41,H$43,H$45,H$47,H$49,H$51,H$53,H$55,H$57,H$59,H$61,H$63,H$65,H$67,H$69,H$71,H$73,H$75,H$77,H$79,H$81,H$83,H$85,H$87,H$89,H$91,H$93,H$95,H$97,H$99,H$101,H$103,H$105,H$107,H$109,H$111,H$113,H$115,H$117,H$119,H$121,H$123,H$125)) -> 2 | I739: =RANK(I738,(I$6,I$8,I$10,I$13,I$15,I$17,I$19,I$21,I$23,I$25,I$27,I$29,I$31,I$33,I$35,I$37,I$39,I$41,I$43,I$45,I$47,I$49,I$51,I$53,I$55,I$57,I$59,I$61,I$63,I$65,I$67,I$69,I$71,I$73,I$75,I$77,I$79,I$81,I$83,I$85,I$87,I$89,I$91,I$93,I$95,I$97,I$99,I$101,I$103,I$105,I$107,I$109,I$111,I$113,I$115,I$117,I$119,I$121,I$123,I$125)) -> 2 | J739: =RANK(J738,(J$6,J$8,J$10,J$13,J$15,J$17,J$19,J$21,J$23,J$25,J$27,J$29,J$31,J$33,J$35,J$37,J$39,J$41,J$43,J$45,J$47,J$49,J$51,J$53,J$55,J$57,J$59,J$61,J$63,J$65,J$67,J$69,J$71,J$73,J$75,J$77,J$79,J$81,J$83,J$85,J$87,J$89,J$91,J$93,J$95,J$97,J$99,J$101,J$103,J$105,J$107,J$109,J$111,J$113,J$115,J$117,J$119,J$121,J$123,J$125)) -> 2 | K739: =RANK(K738,(K$6,K$8,K$10,K$13,K$15,K$17,K$19,K$21,K$23,K$25,K$27,K$29,K$31,K$33,K$35,K$37,K$39,K$41,K$43,K$45,K$47,K$49,K$51,K$53,K$55,K$57,K$59,K$61,K$63,K$65,K$67,K$69,K$71,K$73,K$75,K$77,K$79,K$81,K$83,K$85,K$87,K$89,K$91,K$93,K$95,K$97,K$99,K$101,K$103,K$105,K$107,K$109,K$111,K$113,K$115,K$117,K$119,K$121,K$123,K$125)) -> 2 | L739: =RANK(L738,(L$6,L$8,L$10,L$13,L$15,L$17,L$19,L$21,L$23,L$25,L$27,L$29,L$31,L$33,L$35,L$37,L$39,L$41,L$43,L$45,L$47,L$49,L$51,L$53,L$55,L$57,L$59,L$61,L$63,L$65,L$67,L$69,L$71,L$73,L$75,L$77,L$79,L$81,L$83,L$85,L$87,L$89,L$91,L$93,L$95,L$97,L$99,L$101,L$103,L$105,L$107,L$109,L$111,L$113,L$115,L$117,L$119,L$121,L$123,L$125)) -> 2 | M739: =RANK(M738,(M$6,M$8,M$10,M$13,M$15,M$17,M$19,M$21,M$23,M$25,M$27,M$29,M$31,M$33,M$35,M$37,M$39,M$41,M$43,M$45,M$47,M$49,M$51,M$53,M$55,M$57,M$59,M$61,M$63,M$65,M$67,M$69,M$71,M$73,M$75,M$77,M$79,M$81,M$83,M$85,M$87,M$89,M$91,M$93,M$95,M$97,M$99,M$101,M$103,M$105,M$107,M$109,M$111,M$113,M$115,M$117,M$119,M$121,M$123,M$125)) -> 2 | O739: 2
A740: White | C740: 16.60 | D740: 17.30 | E740: 16.95 | F740: 17.80 | G740: 17.00 | H740: 17.90 | I740: 26.35 | J740: 21.20 | K740: 21.35 | L740: 42.55 | M740: 85.85 | N740: 0.0 | O740: 85.85
A741: Sabers | C741: =RANK(C740,(C$6,C$8,C$10,C$13,C$15,C$17,C$19,C$21,C$23,C$25,C$27,C$29,C$31,C$33,C$35,C$37,C$39,C$41,C$43,C$45,C$47,C$49,C$51,C$53,C$55,C$57,C$59,C$61,C$63,C$65,C$67,C$69,C$71,C$73,C$75,C$77,C$79,C$81,C$83,C$85,C$87,C$89,C$91,C$93,C$95,C$97,C$99,C$101,C$103,C$105,C$107,C$109,C$111,C$113,C$115,C$117,C$119,C$121,C$123,C$125)) -> 3 | D741: =RANK(D740,(D$6,D$8,D$10,D$13,D$15,D$17,D$19,D$21,D$23,D$25,D$27,D$29,D$31,D$33,D$35,D$37,D$39,D$41,D$43,D$45,D$47,D$49,D$51,D$53,D$55,D$57,D$59,D$61,D$63,D$65,D$67,D$69,D$71,D$73,D$75,D$77,D$79,D$81,D$83,D$85,D$87,D$89,D$91,D$93,D$95,D$97,D$99,D$101,D$103,D$105,D$107,D$109,D$111,D$113,D$115,D$117,D$119,D$121,D$123,D$125)) -> 3 | E741: =RANK(E740,(E$6,E$8,E$10,E$13,E$15,E$17,E$19,E$21,E$23,E$25,E$27,E$29,E$31,E$33,E$35,E$37,E$39,E$41,E$43,E$45,E$47,E$49,E$51,E$53,E$55,E$57,E$59,E$61,E$63,E$65,E$67,E$69,E$71,E$73,E$75,E$77,E$79,E$81,E$83,E$85,E$87,E$89,E$91,E$93,E$95,E$97,E$99,E$101,E$103,E$105,E$107,E$109,E$111,E$113,E$115,E$117,E$119,E$121,E$123,E$125)) -> 3 | F741: =RANK(F740,(F$6,F$8,F$10,F$13,F$15,F$17,F$19,F$21,F$23,F$25,F$27,F$29,F$31,F$33,F$35,F$37,F$39,F$41,F$43,F$45,F$47,F$49,F$51,F$53,F$55,F$57,F$59,F$61,F$63,F$65,F$67,F$69,F$71,F$73,F$75,F$77,F$79,F$81,F$83,F$85,F$87,F$89,F$91,F$93,F$95,F$97,F$99,F$101,F$103,F$105,F$107,F$109,F$111,F$113,F$115,F$117,F$119,F$121,F$123,F$125)) -> 2 | G741: =RANK(G740,(G$6,G$8,G$10,G$13,G$15,G$17,G$19,G$21,G$23,G$25,G$27,G$29,G$31,G$33,G$35,G$37,G$39,G$41,G$43,G$45,G$47,G$49,G$51,G$53,G$55,G$57,G$59,G$61,G$63,G$65,G$67,G$69,G$71,G$73,G$75,G$77,G$79,G$81,G$83,G$85,G$87,G$89,G$91,G$93,G$95,G$97,G$99,G$101,G$103,G$105,G$107,G$109,G$111,G$113,G$115,G$117,G$119,G$121,G$123,G$125)) -> 3 | H741: =RANK(H740,(H$6,H$8,H$10,H$13,H$15,H$17,H$19,H$21,H$23,H$25,H$27,H$29,H$31,H$33,H$35,H$37,H$39,H$41,H$43,H$45,H$47,H$49,H$51,H$53,H$55,H$57,H$59,H$61,H$63,H$65,H$67,H$69,H$71,H$73,H$75,H$77,H$79,H$81,H$83,H$85,H$87,H$89,H$91,H$93,H$95,H$97,H$99,H$101,H$103,H$105,H$107,H$109,H$111,H$113,H$115,H$117,H$119,H$121,H$123,H$125)) -> 3 | I741: =RANK(I740,(I$6,I$8,I$10,I$13,I$15,I$17,I$19,I$21,I$23,I$25,I$27,I$29,I$31,I$33,I$35,I$37,I$39,I$41,I$43,I$45,I$47,I$49,I$51,I$53,I$55,I$57,I$59,I$61,I$63,I$65,I$67,I$69,I$71,I$73,I$75,I$77,I$79,I$81,I$83,I$85,I$87,I$89,I$91,I$93,I$95,I$97,I$99,I$101,I$103,I$105,I$107,I$109,I$111,I$113,I$115,I$117,I$119,I$121,I$123,I$125)) -> 3 | J741: =RANK(J740,(J$6,J$8,J$10,J$13,J$15,J$17,J$19,J$21,J$23,J$25,J$27,J$29,J$31,J$33,J$35,J$37,J$39,J$41,J$43,J$45,J$47,J$49,J$51,J$53,J$55,J$57,J$59,J$61,J$63,J$65,J$67,J$69,J$71,J$73,J$75,J$77,J$79,J$81,J$83,J$85,J$87,J$89,J$91,J$93,J$95,J$97,J$99,J$101,J$103,J$105,J$107,J$109,J$111,J$113,J$115,J$117,J$119,J$121,J$123,J$125)) -> 3 | K741: =RANK(K740,(K$6,K$8,K$10,K$13,K$15,K$17,K$19,K$21,K$23,K$25,K$27,K$29,K$31,K$33,K$35,K$37,K$39,K$41,K$43,K$45,K$47,K$49,K$51,K$53,K$55,K$57,K$59,K$61,K$63,K$65,K$67,K$69,K$71,K$73,K$75,K$77,K$79,K$81,K$83,K$85,K$87,K$89,K$91,K$93,K$95,K$97,K$99,K$101,K$103,K$105,K$107,K$109,K$111,K$113,K$115,K$117,K$119,K$121,K$123,K$125)) -> 3 | L741: =RANK(L740,(L$6,L$8,L$10,L$13,L$15,L$17,L$19,L$21,L$23,L$25,L$27,L$29,L$31,L$33,L$35,L$37,L$39,L$41,L$43,L$45,L$47,L$49,L$51,L$53,L$55,L$57,L$59,L$61,L$63,L$65,L$67,L$69,L$71,L$73,L$75,L$77,L$79,L$81,L$83,L$85,L$87,L$89,L$91,L$93,L$95,L$97,L$99,L$101,L$103,L$105,L$107,L$109,L$111,L$113,L$115,L$117,L$119,L$121,L$123,L$125)) -> 3 | M741: =RANK(M740,(M$6,M$8,M$10,M$13,M$15,M$17,M$19,M$21,M$23,M$25,M$27,M$29,M$31,M$33,M$35,M$37,M$39,M$41,M$43,M$45,M$47,M$49,M$51,M$53,M$55,M$57,M$59,M$61,M$63,M$65,M$67,M$69,M$71,M$73,M$75,M$77,M$79,M$81,M$83,M$85,M$87,M$89,M$91,M$93,M$95,M$97,M$99,M$101,M$103,M$105,M$107,M$109,M$111,M$113,M$115,M$117,M$119,M$121,M$123,M$125)) -> 3 | O741: 3
A742: DCA Class A
A743: Fusion | C743: 14.50 | D743: 14.90 | E743: 14.70 | F743: 15.10 | G743: 14.90 | H743: 15.20 | I743: 22.60 | J743: 18.85 | K743: 19.60 | L743: 38.45 | M743: 75.75 | N743: 0.0 | O743: 75.75
A744: Core | C744: 1 | D744: 1 | E744: 1 | F744: 1 | G744: 1 | H744: 1 | I744: 1 | J744: 1 | K744: 1 | L744: 1 | M744: 1 | O744: 1
A747: 8/31/2022 DCA Virtual
C748: Visual | F748: Music | J748: Effect
C749: Ensemble | D749: Color Guard | F749: Brass | G749: Percussion | H749: Ensemble | J749: Visual | K749: Music | M749: Sub | O749: Total
C750: C. Rachle | D750: K. Templin | E750: Average | F750: C. Diefenbach | G750: J. Stauffer | H750: S. Halquist | I750: Total ÷2 | J750: J. Shade | K750: P. Shade | L750: Total | M750: Total | N750: Pen | O750: Score
A751: DCA Open Class | C751: 20 | D751: 20 | E751: 20 | F751: 20 | G751: 20 | H751: 20 | I751: 30 | J751: 25 | K751: 25 | L751: 50 | M751: 100 | O751: 100
A752: Atlanta CV | C752: 16.50 | D752: 16.80 | E752: 16.65 | F752: 16.70 | G752: 17.40 | H752: 17.10 | I752: 25.60 | J752: 20.85 | K752: 20.95 | L752: 41.80 | M752: 84.05 | N752: 0.0 | O752: 84.05
C753: =RANK(C752,(C$6,C$8,C$10,C$13,C$16,C$18,C$20,C$22,C$24,C$26,C$28,C$30,C$32,C$34,C$36,C$38,C$40,C$42,C$44,C$46,C$48,C$50,C$52,C$54,C$56,C$58,C$60,C$62,C$64,C$66,C$68,C$70,C$72,C$74,C$76,C$78,C$80,C$82,C$84,C$86,C$88,C$90,C$92,C$94,C$96,C$98,C$100,C$102,C$104,C$106,C$108,C$110,C$112,C$114,C$116,C$118,C$120,C$122,C$124,C$126)) -> 1 | D753: =RANK(D752,(D$6,D$8,D$10,D$13,D$16,D$18,D$20,D$22,D$24,D$26,D$28,D$30,D$32,D$34,D$36,D$38,D$40,D$42,D$44,D$46,D$48,D$50,D$52,D$54,D$56,D$58,D$60,D$62,D$64,D$66,D$68,D$70,D$72,D$74,D$76,D$78,D$80,D$82,D$84,D$86,D$88,D$90,D$92,D$94,D$96,D$98,D$100,D$102,D$104,D$106,D$108,D$110,D$112,D$114,D$116,D$118,D$120,D$122,D$124,D$126)) -> 1 | E753: =RANK(E752,(E$6,E$8,E$10,E$13,E$16,E$18,E$20,E$22,E$24,E$26,E$28,E$30,E$32,E$34,E$36,E$38,E$40,E$42,E$44,E$46,E$48,E$50,E$52,E$54,E$56,E$58,E$60,E$62,E$64,E$66,E$68,E$70,E$72,E$74,E$76,E$78,E$80,E$82,E$84,E$86,E$88,E$90,E$92,E$94,E$96,E$98,E$100,E$102,E$104,E$106,E$108,E$110,E$112,E$114,E$116,E$118,E$120,E$122,E$124,E$126)) -> 1 | F753: =RANK(F752,(F$6,F$8,F$10,F$13,F$16,F$18,F$20,F$22,F$24,F$26,F$28,F$30,F$32,F$34,F$36,F$38,F$40,F$42,F$44,F$46,F$48,F$50,F$52,F$54,F$56,F$58,F$60,F$62,F$64,F$66,F$68,F$70,F$72,F$74,F$76,F$78,F$80,F$82,F$84,F$86,F$88,F$90,F$92,F$94,F$96,F$98,F$100,F$102,F$104,F$106,F$108,F$110,F$112,F$114,F$116,F$118,F$120,F$122,F$124,F$126)) -> 2 | G753: =RANK(G752,(G$6,G$8,G$10,G$13,G$16,G$18,G$20,G$22,G$24,G$26,G$28,G$30,G$32,G$34,G$36,G$38,G$40,G$42,G$44,G$46,G$48,G$50,G$52,G$54,G$56,G$58,G$60,G$62,G$64,G$66,G$68,G$70,G$72,G$74,G$76,G$78,G$80,G$82,G$84,G$86,G$88,G$90,G$92,G$94,G$96,G$98,G$100,G$102,G$104,G$106,G$108,G$110,G$112,G$114,G$116,G$118,G$120,G$122,G$124,G$126)) -> 1 | H753: =RANK(H752,(H$6,H$8,H$10,H$13,H$16,H$18,H$20,H$22,H$24,H$26,H$28,H$30,H$32,H$34,H$36,H$38,H$40,H$42,H$44,H$46,H$48,H$50,H$52,H$54,H$56,H$58,H$60,H$62,H$64,H$66,H$68,H$70,H$72,H$74,H$76,H$78,H$80,H$82,H$84,H$86,H$88,H$90,H$92,H$94,H$96,H$98,H$100,H$102,H$104,H$106,H$108,H$110,H$112,H$114,H$116,H$118,H$120,H$122,H$124,H$126)) -> 1 | I753: =RANK(I752,(I$6,I$8,I$10,I$13,I$16,I$18,I$20,I$22,I$24,I$26,I$28,I$30,I$32,I$34,I$36,I$38,I$40,I$42,I$44,I$46,I$48,I$50,I$52,I$54,I$56,I$58,I$60,I$62,I$64,I$66,I$68,I$70,I$72,I$74,I$76,I$78,I$80,I$82,I$84,I$86,I$88,I$90,I$92,I$94,I$96,I$98,I$100,I$102,I$104,I$106,I$108,I$110,I$112,I$114,I$116,I$118,I$120,I$122,I$124,I$126)) -> 1 | J753: =RANK(J752,(J$6,J$8,J$10,J$13,J$16,J$18,J$20,J$22,J$24,J$26,J$28,J$30,J$32,J$34,J$36,J$38,J$40,J$42,J$44,J$46,J$48,J$50,J$52,J$54,J$56,J$58,J$60,J$62,J$64,J$66,J$68,J$70,J$72,J$74,J$76,J$78,J$80,J$82,J$84,J$86,J$88,J$90,J$92,J$94,J$96,J$98,J$100,J$102,J$104,J$106,J$108,J$110,J$112,J$114,J$116,J$118,J$120,J$122,J$124,J$126)) -> 1 | K753: =RANK(K752,(K$6,K$8,K$10,K$13,K$16,K$18,K$20,K$22,K$24,K$26,K$28,K$30,K$32,K$34,K$36,K$38,K$40,K$42,K$44,K$46,K$48,K$50,K$52,K$54,K$56,K$58,K$60,K$62,K$64,K$66,K$68,K$70,K$72,K$74,K$76,K$78,K$80,K$82,K$84,K$86,K$88,K$90,K$92,K$94,K$96,K$98,K$100,K$102,K$104,K$106,K$108,K$110,K$112,K$114,K$116,K$118,K$120,K$122,K$124,K$126)) -> 1 | L753: =RANK(L752,(L$6,L$8,L$10,L$13,L$16,L$18,L$20,L$22,L$24,L$26,L$28,L$30,L$32,L$34,L$36,L$38,L$40,L$42,L$44,L$46,L$48,L$50,L$52,L$54,L$56,L$58,L$60,L$62,L$64,L$66,L$68,L$70,L$72,L$74,L$76,L$78,L$80,L$82,L$84,L$86,L$88,L$90,L$92,L$94,L$96,L$98,L$100,L$102,L$104,L$106,L$108,L$110,L$112,L$114,L$116,L$118,L$120,L$122,L$124,L$126)) -> 1 | M753: =RANK(M752,(M$6,M$8,M$10,M$13,M$16,M$18,M$20,M$22,M$24,M$26,M$28,M$30,M$32,M$34,M$36,M$38,M$40,M$42,M$44,M$46,M$48,M$50,M$52,M$54,M$56,M$58,M$60,M$62,M$64,M$66,M$68,M$70,M$72,M$74,M$76,M$78,M$80,M$82,M$84,M$86,M$88,M$90,M$92,M$94,M$96,M$98,M$100,M$102,M$104,M$106,M$108,M$110,M$112,M$114,M$116,M$118,M$120,M$122,M$124,M$126)) -> 1 | O753: 1
A754: Rogues Hollow | C754: 15.00 | D754: 15.90 | E754: 15.45 | F754: 17.00 | G754: 15.20 | H754: 16.20 | I754: 24.20 | J754: 19.90 | K754: 20.70 | L754: 40.60 | M754: 80.25 | N754: 0.0 | O754: 80.25
A755: Regiment | C755: =RANK(C754,(C$6,C$8,C$10,C$13,C$16,C$18,C$20,C$22,C$24,C$26,C$28,C$30,C$32,C$34,C$36,C$38,C$40,C$42,C$44,C$46,C$48,C$50,C$52,C$54,C$56,C$58,C$60,C$62,C$64,C$66,C$68,C$70,C$72,C$74,C$76,C$78,C$80,C$82,C$84,C$86,C$88,C$90,C$92,C$94,C$96,C$98,C$100,C$102,C$104,C$106,C$108,C$110,C$112,C$114,C$116,C$118,C$120,C$122,C$124,C$126)) -> 3 | D755: =RANK(D754,(D$6,D$8,D$10,D$13,D$16,D$18,D$20,D$22,D$24,D$26,D$28,D$30,D$32,D$34,D$36,D$38,D$40,D$42,D$44,D$46,D$48,D$50,D$52,D$54,D$56,D$58,D$60,D$62,D$64,D$66,D$68,D$70,D$72,D$74,D$76,D$78,D$80,D$82,D$84,D$86,D$88,D$90,D$92,D$94,D$96,D$98,D$100,D$102,D$104,D$106,D$108,D$110,D$112,D$114,D$116,D$118,D$120,D$122,D$124,D$126)) -> 3 | E755: =RANK(E754,(E$6,E$8,E$10,E$13,E$16,E$18,E$20,E$22,E$24,E$26,E$28,E$30,E$32,E$34,E$36,E$38,E$40,E$42,E$44,E$46,E$48,E$50,E$52,E$54,E$56,E$58,E$60,E$62,E$64,E$66,E$68,E$70,E$72,E$74,E$76,E$78,E$80,E$82,E$84,E$86,E$88,E$90,E$92,E$94,E$96,E$98,E$100,E$102,E$104,E$106,E$108,E$110,E$112,E$114,E$116,E$118,E$120,E$122,E$124,E$126)) -> 3 | F755: =RANK(F754,(F$6,F$8,F$10,F$13,F$16,F$18,F$20,F$22,F$24,F$26,F$28,F$30,F$32,F$34,F$36,F$38,F$40,F$42,F$44,F$46,F$48,F$50,F$52,F$54,F$56,F$58,F$60,F$62,F$64,F$66,F$68,F$70,F$72,F$74,F$76,F$78,F$80,F$82,F$84,F$86,F$88,F$90,F$92,F$94,F$96,F$98,F$100,F$102,F$104,F$106,F$108,F$110,F$112,F$114,F$116,F$118,F$120,F$122,F$124,F$126)) -> 1 | G755: =RANK(G754,(G$6,G$8,G$10,G$13,G$16,G$18,G$20,G$22,G$24,G$26,G$28,G$30,G$32,G$34,G$36,G$38,G$40,G$42,G$44,G$46,G$48,G$50,G$52,G$54,G$56,G$58,G$60,G$62,G$64,G$66,G$68,G$70,G$72,G$74,G$76,G$78,G$80,G$82,G$84,G$86,G$88,G$90,G$92,G$94,G$96,G$98,G$100,G$102,G$104,G$106,G$108,G$110,G$112,G$114,G$116,G$118,G$120,G$122,G$124,G$126)) -> 3 | H755: =RANK(H754,(H$6,H$8,H$10,H$13,H$16,H$18,H$20,H$22,H$24,H$26,H$28,H$30,H$32,H$34,H$36,H$38,H$40,H$42,H$44,H$46,H$48,H$50,H$52,H$54,H$56,H$58,H$60,H$62,H$64,H$66,H$68,H$70,H$72,H$74,H$76,H$78,H$80,H$82,H$84,H$86,H$88,H$90,H$92,H$94,H$96,H$98,H$100,H$102,H$104,H$106,H$108,H$110,H$112,H$114,H$116,H$118,H$120,H$122,H$124,H$126)) -> 2 | I755: =RANK(I754,(I$6,I$8,I$10,I$13,I$16,I$18,I$20,I$22,I$24,I$26,I$28,I$30,I$32,I$34,I$36,I$38,I$40,I$42,I$44,I$46,I$48,I$50,I$52,I$54,I$56,I$58,I$60,I$62,I$64,I$66,I$68,I$70,I$72,I$74,I$76,I$78,I$80,I$82,I$84,I$86,I$88,I$90,I$92,I$94,I$96,I$98,I$100,I$102,I$104,I$106,I$108,I$110,I$112,I$114,I$116,I$118,I$120,I$122,I$124,I$126)) -> 2 | J755: =RANK(J754,(J$6,J$8,J$10,J$13,J$16,J$18,J$20,J$22,J$24,J$26,J$28,J$30,J$32,J$34,J$36,J$38,J$40,J$42,J$44,J$46,J$48,J$50,J$52,J$54,J$56,J$58,J$60,J$62,J$64,J$66,J$68,J$70,J$72,J$74,J$76,J$78,J$80,J$82,J$84,J$86,J$88,J$90,J$92,J$94,J$96,J$98,J$100,J$102,J$104,J$106,J$108,J$110,J$112,J$114,J$116,J$118,J$120,J$122,J$124,J$126)) -> 3 | K755: =RANK(K754,(K$6,K$8,K$10,K$13,K$16,K$18,K$20,K$22,K$24,K$26,K$28,K$30,K$32,K$34,K$36,K$38,K$40,K$42,K$44,K$46,K$48,K$50,K$52,K$54,K$56,K$58,K$60,K$62,K$64,K$66,K$68,K$70,K$72,K$74,K$76,K$78,K$80,K$82,K$84,K$86,K$88,K$90,K$92,K$94,K$96,K$98,K$100,K$102,K$104,K$106,K$108,K$110,K$112,K$114,K$116,K$118,K$120,K$122,K$124,K$126)) -> 2 | L755: =RANK(L754,(L$6,L$8,L$10,L$13,L$16,L$18,L$20,L$22,L$24,L$26,L$28,L$30,L$32,L$34,L$36,L$38,L$40,L$42,L$44,L$46,L$48,L$50,L$52,L$54,L$56,L$58,L$60,L$62,L$64,L$66,L$68,L$70,L$72,L$74,L$76,L$78,L$80,L$82,L$84,L$86,L$88,L$90,L$92,L$94,L$96,L$98,L$100,L$102,L$104,L$106,L$108,L$110,L$112,L$114,L$116,L$118,L$120,L$122,L$124,L$126)) -> 2 | M755: =RANK(M754,(M$6,M$8,M$10,M$13,M$16,M$18,M$20,M$22,M$24,M$26,M$28,M$30,M$32,M$34,M$36,M$38,M$40,M$42,M$44,M$46,M$48,M$50,M$52,M$54,M$56,M$58,M$60,M$62,M$64,M$66,M$68,M$70,M$72,M$74,M$76,M$78,M$80,M$82,M$84,M$86,M$88,M$90,M$92,M$94,M$96,M$98,M$100,M$102,M$104,M$106,M$108,M$110,M$112,M$114,M$116,M$118,M$120,M$122,M$124,M$126)) -> 2 | O755: 2
A756: Cincinnati | C756: 15.20 | D756: 16.50 | E756: 15.85 | F756: 16.10 | G756: 16.10 | H756: 15.50 | I756: 23.85 | J756: 20.10 | K756: 19.90 | L756: 40.00 | M756: 79.70 | N756: 0.0 | O756: 79.70
A757: Tradition | C757: =RANK(C756,(C$6,C$8,C$10,C$13,C$16,C$18,C$20,C$22,C$24,C$26,C$28,C$30,C$32,C$34,C$36,C$38,C$40,C$42,C$44,C$46,C$48,C$50,C$52,C$54,C$56,C$58,C$60,C$62,C$64,C$66,C$68,C$70,C$72,C$74,C$76,C$78,C$80,C$82,C$84,C$86,C$88,C$90,C$92,C$94,C$96,C$98,C$100,C$102,C$104,C$106,C$108,C$110,C$112,C$114,C$116,C$118,C$120,C$122,C$124,C$126)) -> 2 | D757: =RANK(D756,(D$6,D$8,D$10,D$13,D$16,D$18,D$20,D$22,D$24,D$26,D$28,D$30,D$32,D$34,D$36,D$38,D$40,D$42,D$44,D$46,D$48,D$50,D$52,D$54,D$56,D$58,D$60,D$62,D$64,D$66,D$68,D$70,D$72,D$74,D$76,D$78,D$80,D$82,D$84,D$86,D$88,D$90,D$92,D$94,D$96,D$98,D$100,D$102,D$104,D$106,D$108,D$110,D$112,D$114,D$116,D$118,D$120,D$122,D$124,D$126)) -> 2 | E757: =RANK(E756,(E$6,E$8,E$10,E$13,E$16,E$18,E$20,E$22,E$24,E$26,E$28,E$30,E$32,E$34,E$36,E$38,E$40,E$42,E$44,E$46,E$48,E$50,E$52,E$54,E$56,E$58,E$60,E$62,E$64,E$66,E$68,E$70,E$72,E$74,E$76,E$78,E$80,E$82,E$84,E$86,E$88,E$90,E$92,E$94,E$96,E$98,E$100,E$102,E$104,E$106,E$108,E$110,E$112,E$114,E$116,E$118,E$120,E$122,E$124,E$126)) -> 2 | F757: =RANK(F756,(F$6,F$8,F$10,F$13,F$16,F$18,F$20,F$22,F$24,F$26,F$28,F$30,F$32,F$34,F$36,F$38,F$40,F$42,F$44,F$46,F$48,F$50,F$52,F$54,F$56,F$58,F$60,F$62,F$64,F$66,F$68,F$70,F$72,F$74,F$76,F$78,F$80,F$82,F$84,F$86,F$88,F$90,F$92,F$94,F$96,F$98,F$100,F$102,F$104,F$106,F$108,F$110,F$112,F$114,F$116,F$118,F$120,F$122,F$124,F$126)) -> 3 | G757: =RANK(G756,(G$6,G$8,G$10,G$13,G$16,G$18,G$20,G$22,G$24,G$26,G$28,G$30,G$32,G$34,G$36,G$38,G$40,G$42,G$44,G$46,G$48,G$50,G$52,G$54,G$56,G$58,G$60,G$62,G$64,G$66,G$68,G$70,G$72,G$74,G$76,G$78,G$80,G$82,G$84,G$86,G$88,G$90,G$92,G$94,G$96,G$98,G$100,G$102,G$104,G$106,G$108,G$110,G$112,G$114,G$116,G$118,G$120,G$122,G$124,G$126)) -> 2 | H757: =RANK(H756,(H$6,H$8,H$10,H$13,H$16,H$18,H$20,H$22,H$24,H$26,H$28,H$30,H$32,H$34,H$36,H$38,H$40,H$42,H$44,H$46,H$48,H$50,H$52,H$54,H$56,H$58,H$60,H$62,H$64,H$66,H$68,H$70,H$72,H$74,H$76,H$78,H$80,H$82,H$84,H$86,H$88,H$90,H$92,H$94,H$96,H$98,H$100,H$102,H$104,H$106,H$108,H$110,H$112,H$114,H$116,H$118,H$120,H$122,H$124,H$126)) -> 3 | I757: =RANK(I756,(I$6,I$8,I$10,I$13,I$16,I$18,I$20,I$22,I$24,I$26,I$28,I$30,I$32,I$34,I$36,I$38,I$40,I$42,I$44,I$46,I$48,I$50,I$52,I$54,I$56,I$58,I$60,I$62,I$64,I$66,I$68,I$70,I$72,I$74,I$76,I$78,I$80,I$82,I$84,I$86,I$88,I$90,I$92,I$94,I$96,I$98,I$100,I$102,I$104,I$106,I$108,I$110,I$112,I$114,I$116,I$118,I$120,I$122,I$124,I$126)) -> 3 | J757: =RANK(J756,(J$6,J$8,J$10,J$13,J$16,J$18,J$20,J$22,J$24,J$26,J$28,J$30,J$32,J$34,J$36,J$38,J$40,J$42,J$44,J$46,J$48,J$50,J$52,J$54,J$56,J$58,J$60,J$62,J$64,J$66,J$68,J$70,J$72,J$74,J$76,J$78,J$80,J$82,J$84,J$86,J$88,J$90,J$92,J$94,J$96,J$98,J$100,J$102,J$104,J$106,J$108,J$110,J$112,J$114,J$116,J$118,J$120,J$122,J$124,J$126)) -> 2 | K757: =RANK(K756,(K$6,K$8,K$10,K$13,K$16,K$18,K$20,K$22,K$24,K$26,K$28,K$30,K$32,K$34,K$36,K$38,K$40,K$42,K$44,K$46,K$48,K$50,K$52,K$54,K$56,K$58,K$60,K$62,K$64,K$66,K$68,K$70,K$72,K$74,K$76,K$78,K$80,K$82,K$84,K$86,K$88,K$90,K$92,K$94,K$96,K$98,K$100,K$102,K$104,K$106,K$108,K$110,K$112,K$114,K$116,K$118,K$120,K$122,K$124,K$126)) -> 3 | L757: =RANK(L756,(L$6,L$8,L$10,L$13,L$16,L$18,L$20,L$22,L$24,L$26,L$28,L$30,L$32,L$34,L$36,L$38,L$40,L$42,L$44,L$46,L$48,L$50,L$52,L$54,L$56,L$58,L$60,L$62,L$64,L$66,L$68,L$70,L$72,L$74,L$76,L$78,L$80,L$82,L$84,L$86,L$88,L$90,L$92,L$94,L$96,L$98,L$100,L$102,L$104,L$106,L$108,L$110,L$112,L$114,L$116,L$118,L$120,L$122,L$124,L$126)) -> 3 | M757: =RANK(M756,(M$6,M$8,M$10,M$13,M$16,M$18,M$20,M$22,M$24,M$26,M$28,M$30,M$32,M$34,M$36,M$38,M$40,M$42,M$44,M$46,M$48,M$50,M$52,M$54,M$56,M$58,M$60,M$62,M$64,M$66,M$68,M$70,M$72,M$74,M$76,M$78,M$80,M$82,M$84,M$86,M$88,M$90,M$92,M$94,M$96,M$98,M$100,M$102,M$104,M$106,M$108,M$110,M$112,M$114,M$116,M$118,M$120,M$122,M$124,M$126)) -> 3 | O757: 3
A758: DCA Class A
A759: Columbus | C759: 11.30 | D759: 14.70 | E759: 13.00 | F759: 11.90 | G759: 13.50 | H759: 10.50 | I759: 17.95 | J759: 16.85 | K759: 16.90 | L759: 33.75 | M759: 64.70 | N759: 0.0 | O759: 64.70
A760: Saints | C760: 1 | D760: 1 | E760: 1 | F760: 1 | G760: 1 | H760: 1 | I760: 1 | J760: 1 | K760: 1 | L760: 1 | M760: 1 | O760: 1
A763: 9/3/2022 Rochester, New York--DCA World Championship Prelims
C764: Visual | F764: Music | J764: Effect
C765: Ensemble | D765: Color Guard | F765: Brass | G765: Percussion | H765: Ensemble | J765: Visual #1 | K765: Visual #2 | L765: Visual | M765: Music #1 | N765: Music #2 | O765: Music | Q765: Sub | S765: Total
C766: R. Templin | D766: E. Doscher | E766: Average | F766: C. Diefenbach | G766: T. Mengel | H766: T. Stodd | I766: Total ÷2 | J766: J. Shade | K766: R. Morey | L766: Average | M766: P. Smith | N766: C. Poole | O766: Average | P766: Total | Q766: Total | R766: Pen | S766: Score
A767: DCA World Class | C767: 20 | D767: 20 | E767: 20 | F767: 20 | G767: 20 | H767: 20 | I767: 30 | J767: 25 | K767: 25 | L767: 25 | M767: 25 | N767: 25 | O767: 25 | P767: 50 | Q767: 100 | S767: 100
A768: Reading | B768: 3 | C768: 19.60 | D768: 19.20 | E768: 19.40 | F768: 19.10 | G768: 19.30 | H768: 19.60 | I768: 29.00 | J768: 11.925000000000001 | K768: 12.250 | L768: 24.175000000000001 | M768: 12.100 | N768: 12.200 | O768: 24.300 | P768: 48.475000000000001 | Q768: 96.875 | R768: 0.0 | S768: 96.875
A769: Buccaneers | C769: 1 | D769: 2 | E769: 1 | F769: 1 | G769: 2 | H769: 1 | I769: 1 | J769: 1 | K769: 1 | L769: 1 | M769: 2 | N769: 1 | O769: 1 | P769: 1 | Q769: 1 | S769: 1
A770: Hawthorne | B770: 4 | C770: 19.20 | D770: 19.50 | E770: 19.35 | F770: 18.90 | G770: 19.40 | H770: 19.40 | I770: 28.85 | J770: 11.750 | K770: 12.074999999999999 | L770: 23.824999999999999 | M770: 12.300 | N770: 12.000 | O770: 24.300 | P770: 48.125 | Q770: 96.325000000000003 | R770: 0.0 | S770: 96.325000000000003
A771: Caballeros | C771: 2 | D771: 1 | E771: 2 | F771: 2 | G771: 1 | H771: 2 | I771: 2 | J771: 2 | K771: 2 | L771: 2 | M771: 1 | N771: 2 | O771: 1 | P771: 2 | Q771: 2 | S771: 2
A772: Bushwackers | B772: 2 | C772: 18.70 | D772: 18.90 | E772: 18.80 | F772: 18.10 | G772: 19.20 | H772: 18.60 | I772: 27.95 | J772: 11.375 | K772: 11.225 | L772: 22.600 | M772: 11.700 | N772: 11.475 | O772: 23.175000000000001 | P772: 45.774999999999999 | Q772: 92.525000000000006 | R772: 0.0 | S772: 92.525000000000006
C773: 3 | D773: 3 | E773: 3 | F773: 4 | G773: 3 | H773: 4 | I773: 3 | J773: 3 | K773: 3 | L773: 3 | M773: 3 | N773: 3 | O773: 3 | P773: 3 | Q773: 3 | S773: 3
A774: White | B774: 1 | C774: 17.90 | D774: 18.50 | E774: 18.20 | F774: 18.20 | G774: 17.60 | H774: 18.70 | I774: 27.25 | J774: 11.175000000000001 | K774: 10.900 | L774: 22.074999999999999 | M774: 11.475 | N774: 11.324999999999999 | O774: 22.800 | P774: 44.875 | Q774: 90.325000000000003 | R774: 0.0 | S774: 90.325000000000003
A775: Sabers | C775: 4 | D775: 4 | E775: 4 | F775: 3 | G775: 4 | H775: 3 | I775: 4 | J775: 4 | K775: 4 | L775: 4 | M775: 4 | N775: 4 | O775: 4 | P775: 4 | Q775: 4 | S775: 4
A776: DCA Open Class
A777: Connecticut | B777: 3 | C777: 17.50 | D777: 17.60 | E777: 17.55 | F777: 17.70 | G777: 18.20 | H777: 17.80 | I777: 26.85 | J777: 11.025 | K777: 10.324999999999999 | L777: 21.350 | M777: 11.100 | N777: 11.250 | O777: 22.350 | P777: 43.700 | Q777: 88.100 | R777: 0.0 | S777: 88.100
A778: Hurricanes | C778: 2 | D778: 1 | E778: 1 | F778: 1 | G778: 2 | H778: 1 | I778: 1 | J778: 1 | K778: 2 | L778: 2 | M778: 1 | N778: 1 | O778: 1 | P778: 1 | Q778: 1 | S778: 1
A779: Atlanta CV | B779: 4 | C779: 17.60 | D779: 17.30 | E779: 17.45 | F779: 17.10 | G779: 18.70 | H779: 17.60 | I779: 26.70 | J779: 10.975 | K779: 10.625 | L779: 21.600 | M779: 10.925000000000001 | N779: 11.050 | O779: 21.975000000000001 | P779: 43.575000000000003 | Q779: 87.724999999999994 | R779: 0.0 | S779: 87.724999999999994
C780: 1 | D780: 2 | E780: 2 | F780: 3 | G780: 1 | H780: 2 | I780: 2 | J780: 2 | K780: 1 | L780: 1 | M780: 2 | N780: 2 | O780: 2 | P780: 2 | Q780: 2 | S780: 2
A781: Cincinnati | B781: 1 | C781: 16.30 | D781: 17.00 | E781: 16.65 | F781: 17.50 | G781: 16.70 | H781: 17.00 | I781: 25.60 | J781: 10.450 | K781: 9.900 | L781: 20.350 | M781: 10.525 | N781: 10.600 | O781: 21.125 | P781: 41.475000000000001 | Q781: 83.724999999999994 | R781: 0.0 | S781: 83.724999999999994
A782: Tradition | C782: 3 | D782: 3 | E782: 3 | F782: 2 | G782: 3 | H782: 3 | I782: 3 | J782: 3 | K782: 3 | L782: 3 | M782: 4 | N782: 4 | O782: 4 | P782: 3 | Q782: 3 | S782: 3
A783: Rogues Hollow | B783: 2 | C783: 15.80 | D783: 16.60 | E783: 16.20 | F783: 17.00 | G783: 16.40 | H783: 16.30 | I783: 24.85 | J783: 10.025 | K783: 9.625 | L783: 19.650 | M783: 10.574999999999999 | N783: 10.625 | O783: 21.200 | P783: 40.850 | Q783: 81.900 | R783: 0.0 | S783: 81.900
A784: Regiment | C784: 4 | D784: 4 | E784: 4 | F784: 4 | G784: 4 | H784: 4 | I784: 4 | J784: 4 | K784: 4 | L784: 4 | M784: 3 | N784: 3 | O784: 3 | P784: 4 | Q784: 4 | S784: 4
A785: DCA Class A
A786: Fusion | B786: 4 | C786: 17.00 | D786: 18.20 | E786: 17.60 | F786: 15.90 | G786: 17.20 | H786: 16.60 | I786: 24.85 | J786: 10.475 | K786: 10.150 | L786: 20.625 | M786: 10.850 | N786: 10.574999999999999 | O786: 21.425000000000001 | P786: 42.050 | Q786: 84.500 | R786: 0.0 | S786: 84.500
A787: Core | C787: 1 | D787: 1 | E787: 1 | F787: 2 | G787: 1 | H787: 1 | I787: 1 | J787: 1 | K787: 1 | L787: 1 | M787: 1 | N787: 1 | O787: 1 | P787: 1 | Q787: 1 | S787: 1
A788: Skyliners | B788: 3 | C788: 15.60 | D788: 16.20 | E788: 15.90 | F788: 16.20 | G788: 16.20 | H788: 16.00 | I788: 24.20 | J788: 9.750 | K788: 9.550 | L788: 19.300 | M788: 10.100 | N788: 10.300 | O788: 20.400 | P788: 39.700 | Q788: 79.800 | R788: 0.0 | S788: 79.800
C789: 2 | D789: 2 | E789: 2 | F789: 1 | G789: 2 | H789: 2 | I789: 2 | J789: 2 | K789: 2 | L789: 2 | M789: 3 | N789: 2 | O789: 3 | P789: 3 | Q789: 2 | S789: 2
A790: Govenaires | B790: 2 | C790: 15.00 | D790: 16.00 | E790: 15.50 | F790: 15.50 | G790: 15.80 | H790: 15.40 | I790: 23.35 | J790: 9.6750000000000007 | K790: 9.400 | L790: 19.074999999999999 | M790: 10.650 | N790: 10.275 | O790: 20.925000000000001 | P790: 40.000 | Q790: 78.850 | R790: 0.0 | S790: 78.850
C791: 3 | D791: 3 | E791: 3 | F791: 3 | G791: 3 | H791: 3 | I791: 3 | J791: 3 | K791: 3 | L791: 3 | M791: 2 | N791: 3 | O791: 2 | P791: 2 | Q791: 3 | S791: 3
A792: Columbus | B792: 1 | C792: 14.20 | D792: 15.00 | E792: 14.60 | F792: 13.80 | G792: 14.50 | H792: 13.60 | I792: 20.95 | J792: 8.875 | K792: 8.7750000000000004 | L792: 17.650 | M792: 9.0250000000000004 | N792: 8.750 | O792: 17.774999999999999 | P792: 35.424999999999997 | Q792: 70.974999999999994 | R792: 0.0 | S792: 70.974999999999994
A793: Saints | C793: 4 | D793: 4 | E793: 4 | F793: 4 | G793: 4 | H793: 4 | I793: 4 | J793: 4 | K793: 4 | L793: 4 | M793: 4 | N793: 4 | O793: 4 | P793: 4 | Q793: 4 | S793: 4
A796: 9/4/2022 Rochester, New York DCA World Championship Finals
C797: Visual | F797: Music | J797: Effect
C798: Ensemble | D798: Color Guard | F798: Brass | G798: Percussion | H798: Ensemble | J798: Visual #1 | K798: Visual #2 | L798: Visual | M798: Music #1 | N798: Music #2 | O798: Music | Q798: Sub | S798: Total
C799: C. Raichle | D799: K. Templin | E799: Average | F799: D. Thompson | G799: J. Stauffer | H799: S. Halquist | I799: Total ÷2 | J799: R. Abate | K799: N. Smith | L799: Average | M799: B. Relyea | N799: T. Mascari | O799: Average | P799: Total | Q799: Total | R799: Pen | S799: Score
A800: DCA World Class | C800: 20 | D800: 20 | E800: 20 | F800: 20 | G800: 20 | H800: 20 | I800: 30 | J800: 25 | K800: 25 | L800: 25 | M800: 25 | N800: 25 | O800: 25 | P800: 50 | Q800: 100 | S800: 100
A801: Reading | B801: 4 | C801: 19.60 | D801: 19.20 | E801: 19.40 | F801: 19.70 | G801: 19.40 | H801: 19.40 | I801: 29.25 | J801: 12.375 | K801: 12.375 | L801: 24.750 | M801: 12.275 | N801: 11.925000000000001 | O801: 24.200 | P801: 48.950 | Q801: 97.600 | R801: 0.0 | S801: 97.600
A802: Buccaneers | C802: 1 | D802: 2 | E802: 2 | F802: 1 | G802: 2 | H802: 1 | I802: 1 | J802: 1 | K802: 1 | L802: 1 | M802: 1 | N802: 1 | O802: 1 | P802: 1 | Q802: 1 | S802: 1
A803: Hawthorne | B803: 3 | C803: 19.40 | D803: 19.50 | E803: 19.45 | F803: 19.30 | G803: 19.50 | H803: 19.10 | I803: 28.95 | J803: 12.175000000000001 | K803: 12.250 | L803: 24.425000000000001 | M803: 12.025 | N803: 11.875 | O803: 23.900 | P803: 48.325000000000003 | Q803: 96.724999999999994 | R803: 0.0 | S803: 96.724999999999994
A804: Caballeros | C804: 2 | D804: 1 | E804: 1 | F804: 2 | G804: 1 | H804: 2 | I804: 2 | J804: 2 | K804: 2 | L804: 2 | M804: 2 | N804: 2 | O804: 2 | P804: 2 | Q804: 2 | S804: 2
A805: Bushwackers | B805: 2 | C805: 19.10 | D805: 19.10 | E805: 19.10 | F805: 19.10 | G805: 19.30 | H805: 18.80 | I805: 28.60 | J805: 11.800 | K805: 11.725 | L805: 23.524999999999999 | M805: 11.875 | N805: 11.500 | O805: 23.375 | P805: 46.900 | Q805: 94.600 | R805: 0.0 | S805: 94.600
C806: 3 | D806: 3 | E806: 3 | F806: 3 | G806: 3 | H806: 3 | I806: 3 | J806: 3 | K806: 3 | L806: 3 | M806: 3 | N806: 3 | O806: 3 | P806: 3 | Q806: 3 | S806: 3
A807: White | B807: 1 | C807: 18.50 | D807: 18.60 | E807: 18.55 | F807: 18.40 | G807: 18.10 | H807: 18.20 | I807: 27.35 | J807: 11.200 | K807: 11.425000000000001 | L807: 22.625 | M807: 11.324999999999999 | N807: 10.950 | O807: 22.274999999999999 | P807: 44.900 | Q807: 90.800 | R807: 0.0 | S807: 90.800
A808: Sabers | C808: 4 | D808: 4 | E808: 4 | F808: 4 | G808: 4 | H808: 4 | I808: 4 | J808: 4 | K808: 4 | L808: 4 | M808: 4 | N808: 4 | O808: 4 | P808: 4 | Q808: 4 | S808: 4
A809: DCA Open Class
A810: Connecticut | B810: 4 | C810: 17.90 | D810: 18.90 | E810: 18.40 | F810: 18.30 | G810: 18.60 | H810: 18.00 | I810: 27.45 | J810: 10.574999999999999 | K810: 10.95 | L810: 21.524999999999999 | M810: 11.20 | N810: 10.875 | O810: 22.074999999999999 | P810: 43.600 | Q810: 89.450 | R810: 0.0 | S810: 89.450
A811: Hurricanes | C811: 1 | D811: 1 | E811: 1 | F811: 1 | G811: 2 | H811: 1 | I811: 1 | J811: 2 | K811: 1 | L811: 2 | M811: 1 | N811: 1 | O811: 1 | P811: 1 | Q811: 1 | S811: 1
A812: Atlanta CV | B812: 3 | C812: 17.70 | D812: 17.50 | E812: 17.60 | F812: 17.60 | G812: 18.70 | H812: 17.50 | I812: 26.90 | J812: 10.70 | K812: 10.925000000000001 | L812: 21.625 | M812: 10.95 | N812: 10.675000000000001 | O812: 21.625 | P812: 43.250 | Q812: 87.750 | R812: 0.0 | S812: 87.750
C813: 2 | D813: 2 | E813: 2 | F813: 2 | G813: 1 | H813: 2 | I813: 2 | J813: 1 | K813: 2 | L813: 1 | M813: 2 | N813: 2 | O813: 2 | P813: 2 | Q813: 2 | S813: 2
A814: Cincinnati | B814: 2 | C814: 17.10 | D814: 16.40 | E814: 16.75 | F814: 17.50 | G814: 16.40 | H814: 16.50 | I814: 25.20 | J814: 10.35 | K814: 10.35 | L814: 20.700 | M814: 10.475 | N814: 10.225 | O814: 20.700 | P814: 41.400 | Q814: 83.350 | R814: 0.0 | S814: 83.350
A815: Tradition | C815: 3 | D815: 3 | E815: 3 | F815: 3 | G815: 3 | H815: 3 | I815: 3 | J815: 4 | K815: 3 | L815: 3 | M815: 4 | N815: 4 | O815: 4 | P815: 3 | Q815: 3 | S815: 3
A816: Rogues Hollow | B816: 1 | C816: 16.50 | D816: 16.10 | E816: 16.30 | F816: 16.20 | G816: 16.20 | H816: 16.30 | I816: 24.35 | J816: 10.375 | K816: 9.60 | L816: 19.975000000000001 | M816: 10.55 | N816: 10.30 | O816: 20.850 | P816: 40.825000000000003 | Q816: 81.474999999999994 | R816: 0.0 | S816: 81.474999999999994
A817: Regiment | C817: 4 | D817: 4 | E817: 4 | F817: 4 | G817: 4 | H817: 4 | I817: 4 | J817: 3 | K817: 4 | L817: 4 | M817: 3 | N817: 3 | O817: 3 | P817: 4 | Q817: 4 | S817: 4
A818: DCA Class A
A819: Fusion | B819: 4 | C819: 17.00 | D819: 17.30 | E819: 17.15 | F819: 17.00 | G819: 17.00 | H819: 17.00 | I819: 25.50 | J819: 10.60 | K819: 10.525 | L819: 21.125 | M819: 10.975 | N819: 10.525 | O819: 21.500 | P819: 42.625 | Q819: 85.275000000000006 | R819: 0.0 | S819: 85.275000000000006
A820: Core | C820: 1 | D820: 1 | E820: 1 | F820: 1 | G820: 1 | H820: 1 | I820: 1 | J820: 1 | K820: 1 | L820: 1 | M820: 1 | N820: 1 | O820: 1 | P820: 1 | Q820: 1 | S820: 1
A821: Skyliners | B821: 3 | C821: 16.30 | D821: 15.70 | E821: 16.00 | F821: 16.90 | G821: 16.50 | H821: 16.10 | I821: 24.75 | J821: 10.35 | K821: 9.70 | L821: 20.050 | M821: 10.35 | N821: 9.80 | O821: 20.150 | P821: 40.200 | Q821: 80.950 | R821: 0.0 | S821: 80.950
C822: 2 | D822: 2 | E822: 2 | F822: 2 | G822: 2 | H822: 2 | I822: 2 | J822: 3 | K822: 2 | L822: 2 | M822: 2 | N822: 2 | O822: 2 | P822: 2 | Q822: 2 | S822: 2
A823: Govenaires | B823: 2 | C823: 15.80 | D823: 15.20 | E823: 15.50 | F823: 15.80 | G823: 16.00 | H823: 15.70 | I823: 23.75 | J823: 10.375 | K823: 9.625 | L823: 20.000 | M823: 10.225 | N823: 9.50 | O823: 19.725000000000001 | P823: 39.725000000000001 | Q823: 78.974999999999994 | R823: 0.0 | S823: 78.974999999999994
C824: 3 | D824: 3 | E824: 3 | F824: 3 | G824: 3 | H824: 3 | I824: 3 | J824: 2 | K824: 3 | L824: 3 | M824: 3 | N824: 3 | O824: 3 | P824: 3 | Q824: 3 | S824: 3
A825: Columbus | B825: 1 | C825: 14.30 | D825: 14.80 | E825: 14.55 | F825: 14.20 | G825: 14.10 | H825: 14.50 | I825: 21.40 | J825: 9.125 | K825: 8.85 | L825: 17.975000000000001 | M825: 8.90 | N825: 8.85 | O825: 17.750 | P825: 35.725000000000001 | Q825: 71.674999999999997 | R825: 0.0 | S825: 71.674999999999997
A826: Saints | C826: 4 | D826: 4 | E826: 4 | F826: 4 | G826: 4 | H826: 4 | I826: 4 | J826: 4 | K826: 4 | L826: 4 | M826: 4 | N826: 4 | O826: 4 | P826: 4 | Q826: 4 | S826: 4