A1: 7/2/2024 Mason, OH
C2: General Effect | F2: Visual | J2: Music
C3: 1 | D3: 2 | F3: Proficiency | G3: Analysis | H3: Color Guard | J3: Brass | K3: Analysis | L3: Percussion | N3: Sub | P3: Total
C4: D. Deems | D4: M. Howard | E4: Total | F4: B. Jones | G4: K. Baker | H4: S. Clark | I4: Total ÷2 | J4: K. Weirich | K4: J. Harper | L4: M. Teal | M4: Total ÷2 | N4: Total | O4: Pen | P4: Score
A5: DCI World Class | C5: 20 | D5: 20 | E5: 40 | F5: 20 | G5: 20 | H5: 20 | I5: 30 | J5: 20 | K5: 20 | L5: 20 | M5: 30 | N5: 100 | P5: 100
A6: Bluecoats | B6: 4 | C6: 16.30 | D6: 15.90 | E6: 32.20 | F6: 15.40 | G6: 15.50 | H6: 15.70 | I6: 23.30 | J6: 15.30 | K6: 15.60 | L6: 15.60 | M6: 23.25 | N6: 78.75 | O6: 0.0 | P6: 78.75
C7: =RANK(C6,(C$6,C$8,C$10,C$12,C$15,C$18,C$20,C$22,C$24,C$26,C$28,C$30,C$32,C$34,C$36,C$38,C$40,C$42,C$44,C$46,C$48,C$50,C$52,C$54,C$56,C$58,C$60,C$62,C$64,C$66,C$68,C$70,C$72,C$74,C$76,C$78,C$80,C$82,C$84,C$86,C$88,C$90,C$92,C$94,C$96,C$98,C$100,C$102,C$104,C$106,C$108,C$110,C$112,C$114,C$116,C$118,C$120,C$122,C$124,C$126)) -> 4 | D7: =RANK(D6,(D$6,D$8,D$10,D$12,D$15,D$18,D$20,D$22,D$24,D$26,D$28,D$30,D$32,D$34,D$36,D$38,D$40,D$42,D$44,D$46,D$48,D$50,D$52,D$54,D$56,D$58,D$60,D$62,D$64,D$66,D$68,D$70,D$72,D$74,D$76,D$78,D$80,D$82,D$84,D$86,D$88,D$90,D$92,D$94,D$96,D$98,D$100,D$102,D$104,D$106,D$108,D$110,D$112,D$114,D$116,D$118,D$120,D$122,D$124,D$126)) -> 4 | E7: =RANK(E6,(E$6,E$8,E$10,E$12,E$15,E$18,E$20,E$22,E$24,E$26,E$28,E$30,E$32,E$34,E$36,E$38,E$40,E$42,E$44,E$46,E$48,E$50,E$52,E$54,E$56,E$58,E$60,E$62,E$64,E$66,E$68,E$70,E$72,E$74,E$76,E$78,E$80,E$82,E$84,E$86,E$88,E$90,E$92,E$94,E$96,E$98,E$100,E$102,E$104,E$106,E$108,E$110,E$112,E$114,E$116,E$118,E$120,E$122,E$124,E$126)) -> 4 | F7: =RANK(F6,(F$6,F$8,F$10,F$12,F$15,F$18,F$20,F$22,F$24,F$26,F$28,F$30,F$32,F$34,F$36,F$38,F$40,F$42,F$44,F$46,F$48,F$50,F$52,F$54,F$56,F$58,F$60,F$62,F$64,F$66,F$68,F$70,F$72,F$74,F$76,F$78,F$80,F$82,F$84,F$86,F$88,F$90,F$92,F$94,F$96,F$98,F$100,F$102,F$104,F$106,F$108,F$110,F$112,F$114,F$116,F$118,F$120,F$122,F$124,F$126)) -> 9 | G7: =RANK(G6,(G$6,G$8,G$10,G$12,G$15,G$18,G$20,G$22,G$24,G$26,G$28,G$30,G$32,G$34,G$36,G$38,G$40,G$42,G$44,G$46,G$48,G$50,G$52,G$54,G$56,G$58,G$60,G$62,G$64,G$66,G$68,G$70,G$72,G$74,G$76,G$78,G$80,G$82,G$84,G$86,G$88,G$90,G$92,G$94,G$96,G$98,G$100,G$102,G$104,G$106,G$108,G$110,G$112,G$114,G$116,G$118,G$120,G$122,G$124,G$126)) -> 6 | H7: =RANK(H6,(H$6,H$8,H$10,H$12,H$15,H$18,H$20,H$22,H$24,H$26,H$28,H$30,H$32,H$34,H$36,H$38,H$40,H$42,H$44,H$46,H$48,H$50,H$52,H$54,H$56,H$58,H$60,H$62,H$64,H$66,H$68,H$70,H$72,H$74,H$76,H$78,H$80,H$82,H$84,H$86,H$88,H$90,H$92,H$94,H$96,H$98,H$100,H$102,H$104,H$106,H$108,H$110,H$112,H$114,H$116,H$118,H$120,H$122,H$124,H$126)) -> 6 | I7: =RANK(I6,(I$6,I$8,I$10,I$12,I$15,I$18,I$20,I$22,I$24,I$26,I$28,I$30,I$32,I$34,I$36,I$38,I$40,I$42,I$44,I$46,I$48,I$50,I$52,I$54,I$56,I$58,I$60,I$62,I$64,I$66,I$68,I$70,I$72,I$74,I$76,I$78,I$80,I$82,I$84,I$86,I$88,I$90,I$92,I$94,I$96,I$98,I$100,I$102,I$104,I$106,I$108,I$110,I$112,I$114,I$116,I$118,I$120,I$122,I$124,I$126)) -> 6 | J7: =RANK(J6,(J$6,J$8,J$10,J$12,J$15,J$18,J$20,J$22,J$24,J$26,J$28,J$30,J$32,J$34,J$36,J$38,J$40,J$42,J$44,J$46,J$48,J$50,J$52,J$54,J$56,J$58,J$60,J$62,J$64,J$66,J$68,J$70,J$72,J$74,J$76,J$78,J$80,J$82,J$84,J$86,J$88,J$90,J$92,J$94,J$96,J$98,J$100,J$102,J$104,J$106,J$108,J$110,J$112,J$114,J$116,J$118,J$120,J$122,J$124,J$126)) -> 7 | K7: =RANK(K6,(K$6,K$8,K$10,K$12,K$15,K$18,K$20,K$22,K$24,K$26,K$28,K$30,K$32,K$34,K$36,K$38,K$40,K$42,K$44,K$46,K$48,K$50,K$52,K$54,K$56,K$58,K$60,K$62,K$64,K$66,K$68,K$70,K$72,K$74,K$76,K$78,K$80,K$82,K$84,K$86,K$88,K$90,K$92,K$94,K$96,K$98,K$100,K$102,K$104,K$106,K$108,K$110,K$112,K$114,K$116,K$118,K$120,K$122,K$124,K$126)) -> 6 | L7: =RANK(L6,(L$6,L$8,L$10,L$12,L$15,L$18,L$20,L$22,L$24,L$26,L$28,L$30,L$32,L$34,L$36,L$38,L$40,L$42,L$44,L$46,L$48,L$50,L$52,L$54,L$56,L$58,L$60,L$62,L$64,L$66,L$68,L$70,L$72,L$74,L$76,L$78,L$80,L$82,L$84,L$86,L$88,L$90,L$92,L$94,L$96,L$98,L$100,L$102,L$104,L$106,L$108,L$110,L$112,L$114,L$116,L$118,L$120,L$122,L$124,L$126)) -> 10 | M7: =RANK(M6,(M$6,M$8,M$10,M$12,M$15,M$18,M$20,M$22,M$24,M$26,M$28,M$30,M$32,M$34,M$36,M$38,M$40,M$42,M$44,M$46,M$48,M$50,M$52,M$54,M$56,M$58,M$60,M$62,M$64,M$66,M$68,M$70,M$72,M$74,M$76,M$78,M$80,M$82,M$84,M$86,M$88,M$90,M$92,M$94,M$96,M$98,M$100,M$102,M$104,M$106,M$108,M$110,M$112,M$114,M$116,M$118,M$120,M$122,M$124,M$126)) -> 7 | N7: =RANK(N6,(N$6,N$8,N$10,N$12,N$15,N$18,N$20,N$22,N$24,N$26,N$28,N$30,N$32,N$34,N$36,N$38,N$40,N$42,N$44,N$46,N$48,N$50,N$52,N$54,N$56,N$58,N$60,N$62,N$64,N$66,N$68,N$70,N$72,N$74,N$76,N$78,N$80,N$82,N$84,N$86,N$88,N$90,N$92,N$94,N$96,N$98,N$100,N$102,N$104,N$106,N$108,N$110,N$112,N$114,N$116,N$118,N$120,N$122,N$124,N$126)) -> 5 | P7: =RANK(P6,(P$6,P$8,P$10,P$12,P$15,P$18,P$20,P$22,P$24,P$26,P$28,P$30,P$32,P$34,P$36,P$38,P$40,P$42,P$44,P$46,P$48,P$50,P$52,P$54,P$56,P$58,P$60,P$62,P$64,P$66,P$68,P$70,P$72,P$74,P$76,P$78,P$80,P$82,P$84,P$86,P$88,P$90,P$92,P$94,P$96,P$98,P$100,P$102,P$104,P$106,P$108,P$110,P$112,P$114,P$116,P$118,P$120,P$122,P$124,P$126)) -> 5
A8: Boston | B8: 2 | C8: 16.10 | D8: 15.70 | E8: 31.80 | F8: 15.80 | G8: 15.20 | H8: 15.80 | I8: 23.40 | J8: 15.40 | K8: 15.40 | L8: 15.70 | M8: 23.25 | N8: 78.45 | O8: 0.0 | P8: 78.45
A9: Crusaders | C9: =RANK(C8,(C$6,C$8,C$10,C$12,C$15,C$18,C$20,C$22,C$24,C$26,C$28,C$30,C$32,C$34,C$36,C$38,C$40,C$42,C$44,C$46,C$48,C$50,C$52,C$54,C$56,C$58,C$60,C$62,C$64,C$66,C$68,C$70,C$72,C$74,C$76,C$78,C$80,C$82,C$84,C$86,C$88,C$90,C$92,C$94,C$96,C$98,C$100,C$102,C$104,C$106,C$108,C$110,C$112,C$114,C$116,C$118,C$120,C$122,C$124,C$126)) -> 5 | D9: =RANK(D8,(D$6,D$8,D$10,D$12,D$15,D$18,D$20,D$22,D$24,D$26,D$28,D$30,D$32,D$34,D$36,D$38,D$40,D$42,D$44,D$46,D$48,D$50,D$52,D$54,D$56,D$58,D$60,D$62,D$64,D$66,D$68,D$70,D$72,D$74,D$76,D$78,D$80,D$82,D$84,D$86,D$88,D$90,D$92,D$94,D$96,D$98,D$100,D$102,D$104,D$106,D$108,D$110,D$112,D$114,D$116,D$118,D$120,D$122,D$124,D$126)) -> 6 | E9: =RANK(E8,(E$6,E$8,E$10,E$12,E$15,E$18,E$20,E$22,E$24,E$26,E$28,E$30,E$32,E$34,E$36,E$38,E$40,E$42,E$44,E$46,E$48,E$50,E$52,E$54,E$56,E$58,E$60,E$62,E$64,E$66,E$68,E$70,E$72,E$74,E$76,E$78,E$80,E$82,E$84,E$86,E$88,E$90,E$92,E$94,E$96,E$98,E$100,E$102,E$104,E$106,E$108,E$110,E$112,E$114,E$116,E$118,E$120,E$122,E$124,E$126)) -> 5 | F9: =RANK(F8,(F$6,F$8,F$10,F$12,F$15,F$18,F$20,F$22,F$24,F$26,F$28,F$30,F$32,F$34,F$36,F$38,F$40,F$42,F$44,F$46,F$48,F$50,F$52,F$54,F$56,F$58,F$60,F$62,F$64,F$66,F$68,F$70,F$72,F$74,F$76,F$78,F$80,F$82,F$84,F$86,F$88,F$90,F$92,F$94,F$96,F$98,F$100,F$102,F$104,F$106,F$108,F$110,F$112,F$114,F$116,F$118,F$120,F$122,F$124,F$126)) -> 4 | G9: =RANK(G8,(G$6,G$8,G$10,G$12,G$15,G$18,G$20,G$22,G$24,G$26,G$28,G$30,G$32,G$34,G$36,G$38,G$40,G$42,G$44,G$46,G$48,G$50,G$52,G$54,G$56,G$58,G$60,G$62,G$64,G$66,G$68,G$70,G$72,G$74,G$76,G$78,G$80,G$82,G$84,G$86,G$88,G$90,G$92,G$94,G$96,G$98,G$100,G$102,G$104,G$106,G$108,G$110,G$112,G$114,G$116,G$118,G$120,G$122,G$124,G$126)) -> 10 | H9: =RANK(H8,(H$6,H$8,H$10,H$12,H$15,H$18,H$20,H$22,H$24,H$26,H$28,H$30,H$32,H$34,H$36,H$38,H$40,H$42,H$44,H$46,H$48,H$50,H$52,H$54,H$56,H$58,H$60,H$62,H$64,H$66,H$68,H$70,H$72,H$74,H$76,H$78,H$80,H$82,H$84,H$86,H$88,H$90,H$92,H$94,H$96,H$98,H$100,H$102,H$104,H$106,H$108,H$110,H$112,H$114,H$116,H$118,H$120,H$122,H$124,H$126)) -> 4 | I9: =RANK(I8,(I$6,I$8,I$10,I$12,I$15,I$18,I$20,I$22,I$24,I$26,I$28,I$30,I$32,I$34,I$36,I$38,I$40,I$42,I$44,I$46,I$48,I$50,I$52,I$54,I$56,I$58,I$60,I$62,I$64,I$66,I$68,I$70,I$72,I$74,I$76,I$78,I$80,I$82,I$84,I$86,I$88,I$90,I$92,I$94,I$96,I$98,I$100,I$102,I$104,I$106,I$108,I$110,I$112,I$114,I$116,I$118,I$120,I$122,I$124,I$126)) -> 5 | J9: =RANK(J8,(J$6,J$8,J$10,J$12,J$15,J$18,J$20,J$22,J$24,J$26,J$28,J$30,J$32,J$34,J$36,J$38,J$40,J$42,J$44,J$46,J$48,J$50,J$52,J$54,J$56,J$58,J$60,J$62,J$64,J$66,J$68,J$70,J$72,J$74,J$76,J$78,J$80,J$82,J$84,J$86,J$88,J$90,J$92,J$94,J$96,J$98,J$100,J$102,J$104,J$106,J$108,J$110,J$112,J$114,J$116,J$118,J$120,J$122,J$124,J$126)) -> 5 | K9: =RANK(K8,(K$6,K$8,K$10,K$12,K$15,K$18,K$20,K$22,K$24,K$26,K$28,K$30,K$32,K$34,K$36,K$38,K$40,K$42,K$44,K$46,K$48,K$50,K$52,K$54,K$56,K$58,K$60,K$62,K$64,K$66,K$68,K$70,K$72,K$74,K$76,K$78,K$80,K$82,K$84,K$86,K$88,K$90,K$92,K$94,K$96,K$98,K$100,K$102,K$104,K$106,K$108,K$110,K$112,K$114,K$116,K$118,K$120,K$122,K$124,K$126)) -> 7 | L9: =RANK(L8,(L$6,L$8,L$10,L$12,L$15,L$18,L$20,L$22,L$24,L$26,L$28,L$30,L$32,L$34,L$36,L$38,L$40,L$42,L$44,L$46,L$48,L$50,L$52,L$54,L$56,L$58,L$60,L$62,L$64,L$66,L$68,L$70,L$72,L$74,L$76,L$78,L$80,L$82,L$84,L$86,L$88,L$90,L$92,L$94,L$96,L$98,L$100,L$102,L$104,L$106,L$108,L$110,L$112,L$114,L$116,L$118,L$120,L$122,L$124,L$126)) -> 8 | M9: =RANK(M8,(M$6,M$8,M$10,M$12,M$15,M$18,M$20,M$22,M$24,M$26,M$28,M$30,M$32,M$34,M$36,M$38,M$40,M$42,M$44,M$46,M$48,M$50,M$52,M$54,M$56,M$58,M$60,M$62,M$64,M$66,M$68,M$70,M$72,M$74,M$76,M$78,M$80,M$82,M$84,M$86,M$88,M$90,M$92,M$94,M$96,M$98,M$100,M$102,M$104,M$106,M$108,M$110,M$112,M$114,M$116,M$118,M$120,M$122,M$124,M$126)) -> 7 | N9: =RANK(N8,(N$6,N$8,N$10,N$12,N$15,N$18,N$20,N$22,N$24,N$26,N$28,N$30,N$32,N$34,N$36,N$38,N$40,N$42,N$44,N$46,N$48,N$50,N$52,N$54,N$56,N$58,N$60,N$62,N$64,N$66,N$68,N$70,N$72,N$74,N$76,N$78,N$80,N$82,N$84,N$86,N$88,N$90,N$92,N$94,N$96,N$98,N$100,N$102,N$104,N$106,N$108,N$110,N$112,N$114,N$116,N$118,N$120,N$122,N$124,N$126)) -> 6 | P9: =RANK(P8,(P$6,P$8,P$10,P$12,P$15,P$18,P$20,P$22,P$24,P$26,P$28,P$30,P$32,P$34,P$36,P$38,P$40,P$42,P$44,P$46,P$48,P$50,P$52,P$54,P$56,P$58,P$60,P$62,P$64,P$66,P$68,P$70,P$72,P$74,P$76,P$78,P$80,P$82,P$84,P$86,P$88,P$90,P$92,P$94,P$96,P$98,P$100,P$102,P$104,P$106,P$108,P$110,P$112,P$114,P$116,P$118,P$120,P$122,P$124,P$126)) -> 6
A10: Carolina | B10: 3 | C10: 15.80 | D10: 15.50 | E10: 31.30 | F10: 15.60 | G10: 15.10 | H10: 15.50 | I10: 23.10 | J10: 15.80 | K10: 15.80 | L10: 15.50 | M10: 23.55 | N10: 77.95 | O10: 0.0 | P10: 77.95
A11: Crown | C11: =RANK(C10,(C$6,C$8,C$10,C$12,C$15,C$18,C$20,C$22,C$24,C$26,C$28,C$30,C$32,C$34,C$36,C$38,C$40,C$42,C$44,C$46,C$48,C$50,C$52,C$54,C$56,C$58,C$60,C$62,C$64,C$66,C$68,C$70,C$72,C$74,C$76,C$78,C$80,C$82,C$84,C$86,C$88,C$90,C$92,C$94,C$96,C$98,C$100,C$102,C$104,C$106,C$108,C$110,C$112,C$114,C$116,C$118,C$120,C$122,C$124,C$126)) -> 7 | D11: =RANK(D10,(D$6,D$8,D$10,D$12,D$15,D$18,D$20,D$22,D$24,D$26,D$28,D$30,D$32,D$34,D$36,D$38,D$40,D$42,D$44,D$46,D$48,D$50,D$52,D$54,D$56,D$58,D$60,D$62,D$64,D$66,D$68,D$70,D$72,D$74,D$76,D$78,D$80,D$82,D$84,D$86,D$88,D$90,D$92,D$94,D$96,D$98,D$100,D$102,D$104,D$106,D$108,D$110,D$112,D$114,D$116,D$118,D$120,D$122,D$124,D$126)) -> 7 | E11: =RANK(E10,(E$6,E$8,E$10,E$12,E$15,E$18,E$20,E$22,E$24,E$26,E$28,E$30,E$32,E$34,E$36,E$38,E$40,E$42,E$44,E$46,E$48,E$50,E$52,E$54,E$56,E$58,E$60,E$62,E$64,E$66,E$68,E$70,E$72,E$74,E$76,E$78,E$80,E$82,E$84,E$86,E$88,E$90,E$92,E$94,E$96,E$98,E$100,E$102,E$104,E$106,E$108,E$110,E$112,E$114,E$116,E$118,E$120,E$122,E$124,E$126)) -> 7 | F11: =RANK(F10,(F$6,F$8,F$10,F$12,F$15,F$18,F$20,F$22,F$24,F$26,F$28,F$30,F$32,F$34,F$36,F$38,F$40,F$42,F$44,F$46,F$48,F$50,F$52,F$54,F$56,F$58,F$60,F$62,F$64,F$66,F$68,F$70,F$72,F$74,F$76,F$78,F$80,F$82,F$84,F$86,F$88,F$90,F$92,F$94,F$96,F$98,F$100,F$102,F$104,F$106,F$108,F$110,F$112,F$114,F$116,F$118,F$120,F$122,F$124,F$126)) -> 6 | G11: =RANK(G10,(G$6,G$8,G$10,G$12,G$15,G$18,G$20,G$22,G$24,G$26,G$28,G$30,G$32,G$34,G$36,G$38,G$40,G$42,G$44,G$46,G$48,G$50,G$52,G$54,G$56,G$58,G$60,G$62,G$64,G$66,G$68,G$70,G$72,G$74,G$76,G$78,G$80,G$82,G$84,G$86,G$88,G$90,G$92,G$94,G$96,G$98,G$100,G$102,G$104,G$106,G$108,G$110,G$112,G$114,G$116,G$118,G$120,G$122,G$124,G$126)) -> 12 | H11: =RANK(H10,(H$6,H$8,H$10,H$12,H$15,H$18,H$20,H$22,H$24,H$26,H$28,H$30,H$32,H$34,H$36,H$38,H$40,H$42,H$44,H$46,H$48,H$50,H$52,H$54,H$56,H$58,H$60,H$62,H$64,H$66,H$68,H$70,H$72,H$74,H$76,H$78,H$80,H$82,H$84,H$86,H$88,H$90,H$92,H$94,H$96,H$98,H$100,H$102,H$104,H$106,H$108,H$110,H$112,H$114,H$116,H$118,H$120,H$122,H$124,H$126)) -> 7 | I11: =RANK(I10,(I$6,I$8,I$10,I$12,I$15,I$18,I$20,I$22,I$24,I$26,I$28,I$30,I$32,I$34,I$36,I$38,I$40,I$42,I$44,I$46,I$48,I$50,I$52,I$54,I$56,I$58,I$60,I$62,I$64,I$66,I$68,I$70,I$72,I$74,I$76,I$78,I$80,I$82,I$84,I$86,I$88,I$90,I$92,I$94,I$96,I$98,I$100,I$102,I$104,I$106,I$108,I$110,I$112,I$114,I$116,I$118,I$120,I$122,I$124,I$126)) -> 9 | J11: =RANK(J10,(J$6,J$8,J$10,J$12,J$15,J$18,J$20,J$22,J$24,J$26,J$28,J$30,J$32,J$34,J$36,J$38,J$40,J$42,J$44,J$46,J$48,J$50,J$52,J$54,J$56,J$58,J$60,J$62,J$64,J$66,J$68,J$70,J$72,J$74,J$76,J$78,J$80,J$82,J$84,J$86,J$88,J$90,J$92,J$94,J$96,J$98,J$100,J$102,J$104,J$106,J$108,J$110,J$112,J$114,J$116,J$118,J$120,J$122,J$124,J$126)) -> 4 | K11: =RANK(K10,(K$6,K$8,K$10,K$12,K$15,K$18,K$20,K$22,K$24,K$26,K$28,K$30,K$32,K$34,K$36,K$38,K$40,K$42,K$44,K$46,K$48,K$50,K$52,K$54,K$56,K$58,K$60,K$62,K$64,K$66,K$68,K$70,K$72,K$74,K$76,K$78,K$80,K$82,K$84,K$86,K$88,K$90,K$92,K$94,K$96,K$98,K$100,K$102,K$104,K$106,K$108,K$110,K$112,K$114,K$116,K$118,K$120,K$122,K$124,K$126)) -> 5 | L11: =RANK(L10,(L$6,L$8,L$10,L$12,L$15,L$18,L$20,L$22,L$24,L$26,L$28,L$30,L$32,L$34,L$36,L$38,L$40,L$42,L$44,L$46,L$48,L$50,L$52,L$54,L$56,L$58,L$60,L$62,L$64,L$66,L$68,L$70,L$72,L$74,L$76,L$78,L$80,L$82,L$84,L$86,L$88,L$90,L$92,L$94,L$96,L$98,L$100,L$102,L$104,L$106,L$108,L$110,L$112,L$114,L$116,L$118,L$120,L$122,L$124,L$126)) -> 12 | M11: =RANK(M10,(M$6,M$8,M$10,M$12,M$15,M$18,M$20,M$22,M$24,M$26,M$28,M$30,M$32,M$34,M$36,M$38,M$40,M$42,M$44,M$46,M$48,M$50,M$52,M$54,M$56,M$58,M$60,M$62,M$64,M$66,M$68,M$70,M$72,M$74,M$76,M$78,M$80,M$82,M$84,M$86,M$88,M$90,M$92,M$94,M$96,M$98,M$100,M$102,M$104,M$106,M$108,M$110,M$112,M$114,M$116,M$118,M$120,M$122,M$124,M$126)) -> 5 | N11: =RANK(N10,(N$6,N$8,N$10,N$12,N$15,N$18,N$20,N$22,N$24,N$26,N$28,N$30,N$32,N$34,N$36,N$38,N$40,N$42,N$44,N$46,N$48,N$50,N$52,N$54,N$56,N$58,N$60,N$62,N$64,N$66,N$68,N$70,N$72,N$74,N$76,N$78,N$80,N$82,N$84,N$86,N$88,N$90,N$92,N$94,N$96,N$98,N$100,N$102,N$104,N$106,N$108,N$110,N$112,N$114,N$116,N$118,N$120,N$122,N$124,N$126)) -> 7 | P11: =RANK(P10,(P$6,P$8,P$10,P$12,P$15,P$18,P$20,P$22,P$24,P$26,P$28,P$30,P$32,P$34,P$36,P$38,P$40,P$42,P$44,P$46,P$48,P$50,P$52,P$54,P$56,P$58,P$60,P$62,P$64,P$66,P$68,P$70,P$72,P$74,P$76,P$78,P$80,P$82,P$84,P$86,P$88,P$90,P$92,P$94,P$96,P$98,P$100,P$102,P$104,P$106,P$108,P$110,P$112,P$114,P$116,P$118,P$120,P$122,P$124,P$126)) -> 7
A12: Phantom | B12: 1 | C12: 15.60 | D12: 15.00 | E12: 30.60 | F12: 15.20 | G12: 14.70 | H12: 15.20 | I12: 22.55 | J12: 14.80 | K12: 15.10 | L12: 15.00 | M12: 22.45 | N12: 75.60 | O12: 0.0 | P12: 75.60
A13: Regiment | C13: =RANK(C12,(C$6,C$8,C$10,C$12,C$15,C$18,C$20,C$22,C$24,C$26,C$28,C$30,C$32,C$34,C$36,C$38,C$40,C$42,C$44,C$46,C$48,C$50,C$52,C$54,C$56,C$58,C$60,C$62,C$64,C$66,C$68,C$70,C$72,C$74,C$76,C$78,C$80,C$82,C$84,C$86,C$88,C$90,C$92,C$94,C$96,C$98,C$100,C$102,C$104,C$106,C$108,C$110,C$112,C$114,C$116,C$118,C$120,C$122,C$124,C$126)) -> 9 | D13: 4 | E13: =RANK(E12,(E$6,E$8,E$10,E$12,E$15,E$18,E$20,E$22,E$24,E$26,E$28,E$30,E$32,E$34,E$36,E$38,E$40,E$42,E$44,E$46,E$48,E$50,E$52,E$54,E$56,E$58,E$60,E$62,E$64,E$66,E$68,E$70,E$72,E$74,E$76,E$78,E$80,E$82,E$84,E$86,E$88,E$90,E$92,E$94,E$96,E$98,E$100,E$102,E$104,E$106,E$108,E$110,E$112,E$114,E$116,E$118,E$120,E$122,E$124,E$126)) -> 9 | F13: 4 | G13: 4 | H13: 4 | I13: 4 | J13: 4 | K13: 4 | L13: 4 | M13: 4 | N13: 4 | P13: 4
A14: DCI All Age Open Class
A15: Cincinnati | B15: 1 | C15: 14.90 | D15: 15.10 | E15: 30.00 | F15: 15.30 | G15: 14.70 | H15: 15.00 | I15: 22.50 | J15: 15.10 | K15: 14.90 | L15: 14.90 | M15: 22.45 | N15: 74.95 | O15: 0.0 | P15: 74.95
A16: Tradition | C16: 1 | D16: 1 | E16: 1 | F16: 1 | G16: 1 | H16: 1 | I16: 1 | J16: 1 | K16: 1 | L16: 1 | M16: 1 | N16: 1 | P16: 1
A19: 7/3/2024 Cedarburg, Wisconsin
C20: General Effect | F20: Visual | J20: Music
C21: 1 | D21: 2 | F21: Proficiency | G21: Analysis | H21: Color Guard | J21: Brass | K21: Analysis | L21: Percussion | N21: Sub | P21: Total
C22: D. Deems | D22: M. Howard | E22: Total | F22: S. Clark | G22: B. Jones | H22: I. Jenkins | I22: Total ÷2 | J22: K. Weirch | K22: J. Harper | L22: M. Teal | M22: Total ÷2 | N22: Total | O22: Pen | P22: Score
A23: DCI World Class | C23: 20 | D23: 20 | E23: 40 | F23: 20 | G23: 20 | H23: 20 | I23: 30 | J23: 20 | K23: 20 | L23: 20 | M23: 30 | N23: 100 | P23: 100
A24: Cavaliers | B24: 4 | C24: 15.10 | D24: 14.90 | E24: 30.00 | F24: 14.60 | G24: 15.50 | H24: 14.80 | I24: 22.45 | J24: 14.90 | K24: 14.70 | L24: 15.60 | M24: 22.60 | N24: 75.05 | O24: 0.0 | P24: 75.05
C25: =RANK(C24,(C$6,C$8,C$10,C$12,C$15,C$17,C$19,C$21,C$23,C$25,C$27,C$29,C$31,C$33,C$35,C$37,C$39,C$41,C$43,C$45,C$47,C$49,C$51,C$53,C$55,C$57,C$59,C$61,C$63,C$65,C$67,C$69,C$71,C$73,C$75,C$77,C$79,C$81,C$83,C$85,C$87,C$89,C$91,C$93,C$95,C$97,C$99,C$101,C$103,C$105,C$107,C$109,C$111,C$113,C$115,C$117,C$119,C$121,C$123,C$125)) -> 1 | D25: =RANK(D24,(D$6,D$8,D$10,D$12,D$15,D$17,D$19,D$21,D$23,D$25,D$27,D$29,D$31,D$33,D$35,D$37,D$39,D$41,D$43,D$45,D$47,D$49,D$51,D$53,D$55,D$57,D$59,D$61,D$63,D$65,D$67,D$69,D$71,D$73,D$75,D$77,D$79,D$81,D$83,D$85,D$87,D$89,D$91,D$93,D$95,D$97,D$99,D$101,D$103,D$105,D$107,D$109,D$111,D$113,D$115,D$117,D$119,D$121,D$123,D$125)) -> 1 | E25: =RANK(E24,(E$6,E$8,E$10,E$12,E$15,E$17,E$19,E$21,E$23,E$25,E$27,E$29,E$31,E$33,E$35,E$37,E$39,E$41,E$43,E$45,E$47,E$49,E$51,E$53,E$55,E$57,E$59,E$61,E$63,E$65,E$67,E$69,E$71,E$73,E$75,E$77,E$79,E$81,E$83,E$85,E$87,E$89,E$91,E$93,E$95,E$97,E$99,E$101,E$103,E$105,E$107,E$109,E$111,E$113,E$115,E$117,E$119,E$121,E$123,E$125)) -> 1 | F25: =RANK(F24,(F$6,F$8,F$10,F$12,F$15,F$17,F$19,F$21,F$23,F$25,F$27,F$29,F$31,F$33,F$35,F$37,F$39,F$41,F$43,F$45,F$47,F$49,F$51,F$53,F$55,F$57,F$59,F$61,F$63,F$65,F$67,F$69,F$71,F$73,F$75,F$77,F$79,F$81,F$83,F$85,F$87,F$89,F$91,F$93,F$95,F$97,F$99,F$101,F$103,F$105,F$107,F$109,F$111,F$113,F$115,F$117,F$119,F$121,F$123,F$125)) -> 3 | G25: =RANK(G24,(G$6,G$8,G$10,G$12,G$15,G$17,G$19,G$21,G$23,G$25,G$27,G$29,G$31,G$33,G$35,G$37,G$39,G$41,G$43,G$45,G$47,G$49,G$51,G$53,G$55,G$57,G$59,G$61,G$63,G$65,G$67,G$69,G$71,G$73,G$75,G$77,G$79,G$81,G$83,G$85,G$87,G$89,G$91,G$93,G$95,G$97,G$99,G$101,G$103,G$105,G$107,G$109,G$111,G$113,G$115,G$117,G$119,G$121,G$123,G$125)) -> 1 | H25: =RANK(H24,(H$6,H$8,H$10,H$12,H$15,H$17,H$19,H$21,H$23,H$25,H$27,H$29,H$31,H$33,H$35,H$37,H$39,H$41,H$43,H$45,H$47,H$49,H$51,H$53,H$55,H$57,H$59,H$61,H$63,H$65,H$67,H$69,H$71,H$73,H$75,H$77,H$79,H$81,H$83,H$85,H$87,H$89,H$91,H$93,H$95,H$97,H$99,H$101,H$103,H$105,H$107,H$109,H$111,H$113,H$115,H$117,H$119,H$121,H$123,H$125)) -> 3 | I25: =RANK(I24,(I$6,I$8,I$10,I$12,I$15,I$17,I$19,I$21,I$23,I$25,I$27,I$29,I$31,I$33,I$35,I$37,I$39,I$41,I$43,I$45,I$47,I$49,I$51,I$53,I$55,I$57,I$59,I$61,I$63,I$65,I$67,I$69,I$71,I$73,I$75,I$77,I$79,I$81,I$83,I$85,I$87,I$89,I$91,I$93,I$95,I$97,I$99,I$101,I$103,I$105,I$107,I$109,I$111,I$113,I$115,I$117,I$119,I$121,I$123,I$125)) -> 2 | J25: =RANK(J24,(J$6,J$8,J$10,J$12,J$15,J$17,J$19,J$21,J$23,J$25,J$27,J$29,J$31,J$33,J$35,J$37,J$39,J$41,J$43,J$45,J$47,J$49,J$51,J$53,J$55,J$57,J$59,J$61,J$63,J$65,J$67,J$69,J$71,J$73,J$75,J$77,J$79,J$81,J$83,J$85,J$87,J$89,J$91,J$93,J$95,J$97,J$99,J$101,J$103,J$105,J$107,J$109,J$111,J$113,J$115,J$117,J$119,J$121,J$123,J$125)) -> 1 | K25: =RANK(K24,(K$6,K$8,K$10,K$12,K$15,K$17,K$19,K$21,K$23,K$25,K$27,K$29,K$31,K$33,K$35,K$37,K$39,K$41,K$43,K$45,K$47,K$49,K$51,K$53,K$55,K$57,K$59,K$61,K$63,K$65,K$67,K$69,K$71,K$73,K$75,K$77,K$79,K$81,K$83,K$85,K$87,K$89,K$91,K$93,K$95,K$97,K$99,K$101,K$103,K$105,K$107,K$109,K$111,K$113,K$115,K$117,K$119,K$121,K$123,K$125)) -> 1 | L25: =RANK(L24,(L$6,L$8,L$10,L$12,L$15,L$17,L$19,L$21,L$23,L$25,L$27,L$29,L$31,L$33,L$35,L$37,L$39,L$41,L$43,L$45,L$47,L$49,L$51,L$53,L$55,L$57,L$59,L$61,L$63,L$65,L$67,L$69,L$71,L$73,L$75,L$77,L$79,L$81,L$83,L$85,L$87,L$89,L$91,L$93,L$95,L$97,L$99,L$101,L$103,L$105,L$107,L$109,L$111,L$113,L$115,L$117,L$119,L$121,L$123,L$125)) -> 1 | M25: =RANK(M24,(M$6,M$8,M$10,M$12,M$15,M$17,M$19,M$21,M$23,M$25,M$27,M$29,M$31,M$33,M$35,M$37,M$39,M$41,M$43,M$45,M$47,M$49,M$51,M$53,M$55,M$57,M$59,M$61,M$63,M$65,M$67,M$69,M$71,M$73,M$75,M$77,M$79,M$81,M$83,M$85,M$87,M$89,M$91,M$93,M$95,M$97,M$99,M$101,M$103,M$105,M$107,M$109,M$111,M$113,M$115,M$117,M$119,M$121,M$123,M$125)) -> 1 | N25: =RANK(N24,(N$6,N$8,N$10,N$12,N$15,N$17,N$19,N$21,N$23,N$25,N$27,N$29,N$31,N$33,N$35,N$37,N$39,N$41,N$43,N$45,N$47,N$49,N$51,N$53,N$55,N$57,N$59,N$61,N$63,N$65,N$67,N$69,N$71,N$73,N$75,N$77,N$79,N$81,N$83,N$85,N$87,N$89,N$91,N$93,N$95,N$97,N$99,N$101,N$103,N$105,N$107,N$109,N$111,N$113,N$115,N$117,N$119,N$121,N$123,N$125)) -> 1 | P25: =RANK(P24,(P$6,P$8,P$10,P$12,P$15,P$17,P$19,P$21,P$23,P$25,P$27,P$29,P$31,P$33,P$35,P$37,P$39,P$41,P$43,P$45,P$47,P$49,P$51,P$53,P$55,P$57,P$59,P$61,P$63,P$65,P$67,P$69,P$71,P$73,P$75,P$77,P$79,P$81,P$83,P$85,P$87,P$89,P$91,P$93,P$95,P$97,P$99,P$101,P$103,P$105,P$107,P$109,P$111,P$113,P$115,P$117,P$119,P$121,P$123,P$125)) -> 1
A26: Blue | B26: 2 | C26: 14.50 | D26: 14.40 | E26: 28.90 | F26: 15.10 | G26: 15.10 | H26: 15.00 | I26: 22.60 | J26: 14.70 | K26: 14.50 | L26: 14.50 | M26: 21.85 | N26: 73.35 | O26: 0.0 | P26: 73.35
A27: Stars | C27: =RANK(C26,(C$6,C$8,C$10,C$12,C$15,C$17,C$19,C$21,C$23,C$25,C$27,C$29,C$31,C$33,C$35,C$37,C$39,C$41,C$43,C$45,C$47,C$49,C$51,C$53,C$55,C$57,C$59,C$61,C$63,C$65,C$67,C$69,C$71,C$73,C$75,C$77,C$79,C$81,C$83,C$85,C$87,C$89,C$91,C$93,C$95,C$97,C$99,C$101,C$103,C$105,C$107,C$109,C$111,C$113,C$115,C$117,C$119,C$121,C$123,C$125)) -> 3 | D27: =RANK(D26,(D$6,D$8,D$10,D$12,D$15,D$17,D$19,D$21,D$23,D$25,D$27,D$29,D$31,D$33,D$35,D$37,D$39,D$41,D$43,D$45,D$47,D$49,D$51,D$53,D$55,D$57,D$59,D$61,D$63,D$65,D$67,D$69,D$71,D$73,D$75,D$77,D$79,D$81,D$83,D$85,D$87,D$89,D$91,D$93,D$95,D$97,D$99,D$101,D$103,D$105,D$107,D$109,D$111,D$113,D$115,D$117,D$119,D$121,D$123,D$125)) -> 3 | E27: =RANK(E26,(E$6,E$8,E$10,E$12,E$15,E$17,E$19,E$21,E$23,E$25,E$27,E$29,E$31,E$33,E$35,E$37,E$39,E$41,E$43,E$45,E$47,E$49,E$51,E$53,E$55,E$57,E$59,E$61,E$63,E$65,E$67,E$69,E$71,E$73,E$75,E$77,E$79,E$81,E$83,E$85,E$87,E$89,E$91,E$93,E$95,E$97,E$99,E$101,E$103,E$105,E$107,E$109,E$111,E$113,E$115,E$117,E$119,E$121,E$123,E$125)) -> 3 | F27: =RANK(F26,(F$6,F$8,F$10,F$12,F$15,F$17,F$19,F$21,F$23,F$25,F$27,F$29,F$31,F$33,F$35,F$37,F$39,F$41,F$43,F$45,F$47,F$49,F$51,F$53,F$55,F$57,F$59,F$61,F$63,F$65,F$67,F$69,F$71,F$73,F$75,F$77,F$79,F$81,F$83,F$85,F$87,F$89,F$91,F$93,F$95,F$97,F$99,F$101,F$103,F$105,F$107,F$109,F$111,F$113,F$115,F$117,F$119,F$121,F$123,F$125)) -> 1 | G27: =RANK(G26,(G$6,G$8,G$10,G$12,G$15,G$17,G$19,G$21,G$23,G$25,G$27,G$29,G$31,G$33,G$35,G$37,G$39,G$41,G$43,G$45,G$47,G$49,G$51,G$53,G$55,G$57,G$59,G$61,G$63,G$65,G$67,G$69,G$71,G$73,G$75,G$77,G$79,G$81,G$83,G$85,G$87,G$89,G$91,G$93,G$95,G$97,G$99,G$101,G$103,G$105,G$107,G$109,G$111,G$113,G$115,G$117,G$119,G$121,G$123,G$125)) -> 2 | H27: =RANK(H26,(H$6,H$8,H$10,H$12,H$15,H$17,H$19,H$21,H$23,H$25,H$27,H$29,H$31,H$33,H$35,H$37,H$39,H$41,H$43,H$45,H$47,H$49,H$51,H$53,H$55,H$57,H$59,H$61,H$63,H$65,H$67,H$69,H$71,H$73,H$75,H$77,H$79,H$81,H$83,H$85,H$87,H$89,H$91,H$93,H$95,H$97,H$99,H$101,H$103,H$105,H$107,H$109,H$111,H$113,H$115,H$117,H$119,H$121,H$123,H$125)) -> 1 | I27: =RANK(I26,(I$6,I$8,I$10,I$12,I$15,I$17,I$19,I$21,I$23,I$25,I$27,I$29,I$31,I$33,I$35,I$37,I$39,I$41,I$43,I$45,I$47,I$49,I$51,I$53,I$55,I$57,I$59,I$61,I$63,I$65,I$67,I$69,I$71,I$73,I$75,I$77,I$79,I$81,I$83,I$85,I$87,I$89,I$91,I$93,I$95,I$97,I$99,I$101,I$103,I$105,I$107,I$109,I$111,I$113,I$115,I$117,I$119,I$121,I$123,I$125)) -> 1 | J27: =RANK(J26,(J$6,J$8,J$10,J$12,J$15,J$17,J$19,J$21,J$23,J$25,J$27,J$29,J$31,J$33,J$35,J$37,J$39,J$41,J$43,J$45,J$47,J$49,J$51,J$53,J$55,J$57,J$59,J$61,J$63,J$65,J$67,J$69,J$71,J$73,J$75,J$77,J$79,J$81,J$83,J$85,J$87,J$89,J$91,J$93,J$95,J$97,J$99,J$101,J$103,J$105,J$107,J$109,J$111,J$113,J$115,J$117,J$119,J$121,J$123,J$125)) -> 2 | K27: =RANK(K26,(K$6,K$8,K$10,K$12,K$15,K$17,K$19,K$21,K$23,K$25,K$27,K$29,K$31,K$33,K$35,K$37,K$39,K$41,K$43,K$45,K$47,K$49,K$51,K$53,K$55,K$57,K$59,K$61,K$63,K$65,K$67,K$69,K$71,K$73,K$75,K$77,K$79,K$81,K$83,K$85,K$87,K$89,K$91,K$93,K$95,K$97,K$99,K$101,K$103,K$105,K$107,K$109,K$111,K$113,K$115,K$117,K$119,K$121,K$123,K$125)) -> 2 | L27: =RANK(L26,(L$6,L$8,L$10,L$12,L$15,L$17,L$19,L$21,L$23,L$25,L$27,L$29,L$31,L$33,L$35,L$37,L$39,L$41,L$43,L$45,L$47,L$49,L$51,L$53,L$55,L$57,L$59,L$61,L$63,L$65,L$67,L$69,L$71,L$73,L$75,L$77,L$79,L$81,L$83,L$85,L$87,L$89,L$91,L$93,L$95,L$97,L$99,L$101,L$103,L$105,L$107,L$109,L$111,L$113,L$115,L$117,L$119,L$121,L$123,L$125)) -> 3 | M27: =RANK(M26,(M$6,M$8,M$10,M$12,M$15,M$17,M$19,M$21,M$23,M$25,M$27,M$29,M$31,M$33,M$35,M$37,M$39,M$41,M$43,M$45,M$47,M$49,M$51,M$53,M$55,M$57,M$59,M$61,M$63,M$65,M$67,M$69,M$71,M$73,M$75,M$77,M$79,M$81,M$83,M$85,M$87,M$89,M$91,M$93,M$95,M$97,M$99,M$101,M$103,M$105,M$107,M$109,M$111,M$113,M$115,M$117,M$119,M$121,M$123,M$125)) -> 2 | N27: =RANK(N26,(N$6,N$8,N$10,N$12,N$15,N$17,N$19,N$21,N$23,N$25,N$27,N$29,N$31,N$33,N$35,N$37,N$39,N$41,N$43,N$45,N$47,N$49,N$51,N$53,N$55,N$57,N$59,N$61,N$63,N$65,N$67,N$69,N$71,N$73,N$75,N$77,N$79,N$81,N$83,N$85,N$87,N$89,N$91,N$93,N$95,N$97,N$99,N$101,N$103,N$105,N$107,N$109,N$111,N$113,N$115,N$117,N$119,N$121,N$123,N$125)) -> 2 | P27: =RANK(P26,(P$6,P$8,P$10,P$12,P$15,P$17,P$19,P$21,P$23,P$25,P$27,P$29,P$31,P$33,P$35,P$37,P$39,P$41,P$43,P$45,P$47,P$49,P$51,P$53,P$55,P$57,P$59,P$61,P$63,P$65,P$67,P$69,P$71,P$73,P$75,P$77,P$79,P$81,P$83,P$85,P$87,P$89,P$91,P$93,P$95,P$97,P$99,P$101,P$103,P$105,P$107,P$109,P$111,P$113,P$115,P$117,P$119,P$121,P$123,P$125)) -> 2
A28: Colts | B28: 3 | C28: 14.60 | D28: 14.70 | E28: 29.30 | F28: 14.70 | G28: 14.80 | H28: 14.90 | I28: 22.20 | J28: 14.20 | K28: 14.30 | L28: 14.80 | M28: 21.65 | N28: 73.15 | O28: 0.0 | P28: 73.15
C29: =RANK(C28,(C$6,C$8,C$10,C$12,C$15,C$17,C$19,C$21,C$23,C$25,C$27,C$29,C$31,C$33,C$35,C$37,C$39,C$41,C$43,C$45,C$47,C$49,C$51,C$53,C$55,C$57,C$59,C$61,C$63,C$65,C$67,C$69,C$71,C$73,C$75,C$77,C$79,C$81,C$83,C$85,C$87,C$89,C$91,C$93,C$95,C$97,C$99,C$101,C$103,C$105,C$107,C$109,C$111,C$113,C$115,C$117,C$119,C$121,C$123,C$125)) -> 2 | D29: =RANK(D28,(D$6,D$8,D$10,D$12,D$15,D$17,D$19,D$21,D$23,D$25,D$27,D$29,D$31,D$33,D$35,D$37,D$39,D$41,D$43,D$45,D$47,D$49,D$51,D$53,D$55,D$57,D$59,D$61,D$63,D$65,D$67,D$69,D$71,D$73,D$75,D$77,D$79,D$81,D$83,D$85,D$87,D$89,D$91,D$93,D$95,D$97,D$99,D$101,D$103,D$105,D$107,D$109,D$111,D$113,D$115,D$117,D$119,D$121,D$123,D$125)) -> 2 | E29: =RANK(E28,(E$6,E$8,E$10,E$12,E$15,E$17,E$19,E$21,E$23,E$25,E$27,E$29,E$31,E$33,E$35,E$37,E$39,E$41,E$43,E$45,E$47,E$49,E$51,E$53,E$55,E$57,E$59,E$61,E$63,E$65,E$67,E$69,E$71,E$73,E$75,E$77,E$79,E$81,E$83,E$85,E$87,E$89,E$91,E$93,E$95,E$97,E$99,E$101,E$103,E$105,E$107,E$109,E$111,E$113,E$115,E$117,E$119,E$121,E$123,E$125)) -> 2 | F29: =RANK(F28,(F$6,F$8,F$10,F$12,F$15,F$17,F$19,F$21,F$23,F$25,F$27,F$29,F$31,F$33,F$35,F$37,F$39,F$41,F$43,F$45,F$47,F$49,F$51,F$53,F$55,F$57,F$59,F$61,F$63,F$65,F$67,F$69,F$71,F$73,F$75,F$77,F$79,F$81,F$83,F$85,F$87,F$89,F$91,F$93,F$95,F$97,F$99,F$101,F$103,F$105,F$107,F$109,F$111,F$113,F$115,F$117,F$119,F$121,F$123,F$125)) -> 2 | G29: =RANK(G28,(G$6,G$8,G$10,G$12,G$15,G$17,G$19,G$21,G$23,G$25,G$27,G$29,G$31,G$33,G$35,G$37,G$39,G$41,G$43,G$45,G$47,G$49,G$51,G$53,G$55,G$57,G$59,G$61,G$63,G$65,G$67,G$69,G$71,G$73,G$75,G$77,G$79,G$81,G$83,G$85,G$87,G$89,G$91,G$93,G$95,G$97,G$99,G$101,G$103,G$105,G$107,G$109,G$111,G$113,G$115,G$117,G$119,G$121,G$123,G$125)) -> 3 | H29: =RANK(H28,(H$6,H$8,H$10,H$12,H$15,H$17,H$19,H$21,H$23,H$25,H$27,H$29,H$31,H$33,H$35,H$37,H$39,H$41,H$43,H$45,H$47,H$49,H$51,H$53,H$55,H$57,H$59,H$61,H$63,H$65,H$67,H$69,H$71,H$73,H$75,H$77,H$79,H$81,H$83,H$85,H$87,H$89,H$91,H$93,H$95,H$97,H$99,H$101,H$103,H$105,H$107,H$109,H$111,H$113,H$115,H$117,H$119,H$121,H$123,H$125)) -> 2 | I29: =RANK(I28,(I$6,I$8,I$10,I$12,I$15,I$17,I$19,I$21,I$23,I$25,I$27,I$29,I$31,I$33,I$35,I$37,I$39,I$41,I$43,I$45,I$47,I$49,I$51,I$53,I$55,I$57,I$59,I$61,I$63,I$65,I$67,I$69,I$71,I$73,I$75,I$77,I$79,I$81,I$83,I$85,I$87,I$89,I$91,I$93,I$95,I$97,I$99,I$101,I$103,I$105,I$107,I$109,I$111,I$113,I$115,I$117,I$119,I$121,I$123,I$125)) -> 3 | J29: =RANK(J28,(J$6,J$8,J$10,J$12,J$15,J$17,J$19,J$21,J$23,J$25,J$27,J$29,J$31,J$33,J$35,J$37,J$39,J$41,J$43,J$45,J$47,J$49,J$51,J$53,J$55,J$57,J$59,J$61,J$63,J$65,J$67,J$69,J$71,J$73,J$75,J$77,J$79,J$81,J$83,J$85,J$87,J$89,J$91,J$93,J$95,J$97,J$99,J$101,J$103,J$105,J$107,J$109,J$111,J$113,J$115,J$117,J$119,J$121,J$123,J$125)) -> 3 | K29: =RANK(K28,(K$6,K$8,K$10,K$12,K$15,K$17,K$19,K$21,K$23,K$25,K$27,K$29,K$31,K$33,K$35,K$37,K$39,K$41,K$43,K$45,K$47,K$49,K$51,K$53,K$55,K$57,K$59,K$61,K$63,K$65,K$67,K$69,K$71,K$73,K$75,K$77,K$79,K$81,K$83,K$85,K$87,K$89,K$91,K$93,K$95,K$97,K$99,K$101,K$103,K$105,K$107,K$109,K$111,K$113,K$115,K$117,K$119,K$121,K$123,K$125)) -> 3 | L29: =RANK(L28,(L$6,L$8,L$10,L$12,L$15,L$17,L$19,L$21,L$23,L$25,L$27,L$29,L$31,L$33,L$35,L$37,L$39,L$41,L$43,L$45,L$47,L$49,L$51,L$53,L$55,L$57,L$59,L$61,L$63,L$65,L$67,L$69,L$71,L$73,L$75,L$77,L$79,L$81,L$83,L$85,L$87,L$89,L$91,L$93,L$95,L$97,L$99,L$101,L$103,L$105,L$107,L$109,L$111,L$113,L$115,L$117,L$119,L$121,L$123,L$125)) -> 2 | M29: =RANK(M28,(M$6,M$8,M$10,M$12,M$15,M$17,M$19,M$21,M$23,M$25,M$27,M$29,M$31,M$33,M$35,M$37,M$39,M$41,M$43,M$45,M$47,M$49,M$51,M$53,M$55,M$57,M$59,M$61,M$63,M$65,M$67,M$69,M$71,M$73,M$75,M$77,M$79,M$81,M$83,M$85,M$87,M$89,M$91,M$93,M$95,M$97,M$99,M$101,M$103,M$105,M$107,M$109,M$111,M$113,M$115,M$117,M$119,M$121,M$123,M$125)) -> 3 | N29: =RANK(N28,(N$6,N$8,N$10,N$12,N$15,N$17,N$19,N$21,N$23,N$25,N$27,N$29,N$31,N$33,N$35,N$37,N$39,N$41,N$43,N$45,N$47,N$49,N$51,N$53,N$55,N$57,N$59,N$61,N$63,N$65,N$67,N$69,N$71,N$73,N$75,N$77,N$79,N$81,N$83,N$85,N$87,N$89,N$91,N$93,N$95,N$97,N$99,N$101,N$103,N$105,N$107,N$109,N$111,N$113,N$115,N$117,N$119,N$121,N$123,N$125)) -> 3 | P29: =RANK(P28,(P$6,P$8,P$10,P$12,P$15,P$17,P$19,P$21,P$23,P$25,P$27,P$29,P$31,P$33,P$35,P$37,P$39,P$41,P$43,P$45,P$47,P$49,P$51,P$53,P$55,P$57,P$59,P$61,P$63,P$65,P$67,P$69,P$71,P$73,P$75,P$77,P$79,P$81,P$83,P$85,P$87,P$89,P$91,P$93,P$95,P$97,P$99,P$101,P$103,P$105,P$107,P$109,P$111,P$113,P$115,P$117,P$119,P$121,P$123,P$125)) -> 3
A30: Madison | B30: 1 | C30: 14.20 | D30: 14.10 | E30: 28.30 | F30: 14.30 | G30: 14.50 | H30: 13.80 | I30: 21.30 | J30: 13.90 | K30: 14.10 | L30: 13.20 | M30: 20.60 | N30: 70.20 | O30: 0.0 | P30: 70.20
A31: Scouts | C31: =RANK(C30,(C$6,C$8,C$10,C$12,C$15,C$17,C$19,C$21,C$23,C$25,C$27,C$29,C$31,C$33,C$35,C$37,C$39,C$41,C$43,C$45,C$47,C$49,C$51,C$53,C$55,C$57,C$59,C$61,C$63,C$65,C$67,C$69,C$71,C$73,C$75,C$77,C$79,C$81,C$83,C$85,C$87,C$89,C$91,C$93,C$95,C$97,C$99,C$101,C$103,C$105,C$107,C$109,C$111,C$113,C$115,C$117,C$119,C$121,C$123,C$125)) -> 4 | D31: =RANK(D30,(D$6,D$8,D$10,D$12,D$15,D$17,D$19,D$21,D$23,D$25,D$27,D$29,D$31,D$33,D$35,D$37,D$39,D$41,D$43,D$45,D$47,D$49,D$51,D$53,D$55,D$57,D$59,D$61,D$63,D$65,D$67,D$69,D$71,D$73,D$75,D$77,D$79,D$81,D$83,D$85,D$87,D$89,D$91,D$93,D$95,D$97,D$99,D$101,D$103,D$105,D$107,D$109,D$111,D$113,D$115,D$117,D$119,D$121,D$123,D$125)) -> 4 | E31: =RANK(E30,(E$6,E$8,E$10,E$12,E$15,E$17,E$19,E$21,E$23,E$25,E$27,E$29,E$31,E$33,E$35,E$37,E$39,E$41,E$43,E$45,E$47,E$49,E$51,E$53,E$55,E$57,E$59,E$61,E$63,E$65,E$67,E$69,E$71,E$73,E$75,E$77,E$79,E$81,E$83,E$85,E$87,E$89,E$91,E$93,E$95,E$97,E$99,E$101,E$103,E$105,E$107,E$109,E$111,E$113,E$115,E$117,E$119,E$121,E$123,E$125)) -> 4 | F31: =RANK(F30,(F$6,F$8,F$10,F$12,F$15,F$17,F$19,F$21,F$23,F$25,F$27,F$29,F$31,F$33,F$35,F$37,F$39,F$41,F$43,F$45,F$47,F$49,F$51,F$53,F$55,F$57,F$59,F$61,F$63,F$65,F$67,F$69,F$71,F$73,F$75,F$77,F$79,F$81,F$83,F$85,F$87,F$89,F$91,F$93,F$95,F$97,F$99,F$101,F$103,F$105,F$107,F$109,F$111,F$113,F$115,F$117,F$119,F$121,F$123,F$125)) -> 4 | G31: =RANK(G30,(G$6,G$8,G$10,G$12,G$15,G$17,G$19,G$21,G$23,G$25,G$27,G$29,G$31,G$33,G$35,G$37,G$39,G$41,G$43,G$45,G$47,G$49,G$51,G$53,G$55,G$57,G$59,G$61,G$63,G$65,G$67,G$69,G$71,G$73,G$75,G$77,G$79,G$81,G$83,G$85,G$87,G$89,G$91,G$93,G$95,G$97,G$99,G$101,G$103,G$105,G$107,G$109,G$111,G$113,G$115,G$117,G$119,G$121,G$123,G$125)) -> 4 | H31: =RANK(H30,(H$6,H$8,H$10,H$12,H$15,H$17,H$19,H$21,H$23,H$25,H$27,H$29,H$31,H$33,H$35,H$37,H$39,H$41,H$43,H$45,H$47,H$49,H$51,H$53,H$55,H$57,H$59,H$61,H$63,H$65,H$67,H$69,H$71,H$73,H$75,H$77,H$79,H$81,H$83,H$85,H$87,H$89,H$91,H$93,H$95,H$97,H$99,H$101,H$103,H$105,H$107,H$109,H$111,H$113,H$115,H$117,H$119,H$121,H$123,H$125)) -> 4 | I31: =RANK(I30,(I$6,I$8,I$10,I$12,I$15,I$17,I$19,I$21,I$23,I$25,I$27,I$29,I$31,I$33,I$35,I$37,I$39,I$41,I$43,I$45,I$47,I$49,I$51,I$53,I$55,I$57,I$59,I$61,I$63,I$65,I$67,I$69,I$71,I$73,I$75,I$77,I$79,I$81,I$83,I$85,I$87,I$89,I$91,I$93,I$95,I$97,I$99,I$101,I$103,I$105,I$107,I$109,I$111,I$113,I$115,I$117,I$119,I$121,I$123,I$125)) -> 4 | J31: =RANK(J30,(J$6,J$8,J$10,J$12,J$15,J$17,J$19,J$21,J$23,J$25,J$27,J$29,J$31,J$33,J$35,J$37,J$39,J$41,J$43,J$45,J$47,J$49,J$51,J$53,J$55,J$57,J$59,J$61,J$63,J$65,J$67,J$69,J$71,J$73,J$75,J$77,J$79,J$81,J$83,J$85,J$87,J$89,J$91,J$93,J$95,J$97,J$99,J$101,J$103,J$105,J$107,J$109,J$111,J$113,J$115,J$117,J$119,J$121,J$123,J$125)) -> 4 | K31: =RANK(K30,(K$6,K$8,K$10,K$12,K$15,K$17,K$19,K$21,K$23,K$25,K$27,K$29,K$31,K$33,K$35,K$37,K$39,K$41,K$43,K$45,K$47,K$49,K$51,K$53,K$55,K$57,K$59,K$61,K$63,K$65,K$67,K$69,K$71,K$73,K$75,K$77,K$79,K$81,K$83,K$85,K$87,K$89,K$91,K$93,K$95,K$97,K$99,K$101,K$103,K$105,K$107,K$109,K$111,K$113,K$115,K$117,K$119,K$121,K$123,K$125)) -> 4 | L31: =RANK(L30,(L$6,L$8,L$10,L$12,L$15,L$17,L$19,L$21,L$23,L$25,L$27,L$29,L$31,L$33,L$35,L$37,L$39,L$41,L$43,L$45,L$47,L$49,L$51,L$53,L$55,L$57,L$59,L$61,L$63,L$65,L$67,L$69,L$71,L$73,L$75,L$77,L$79,L$81,L$83,L$85,L$87,L$89,L$91,L$93,L$95,L$97,L$99,L$101,L$103,L$105,L$107,L$109,L$111,L$113,L$115,L$117,L$119,L$121,L$123,L$125)) -> 4 | M31: =RANK(M30,(M$6,M$8,M$10,M$12,M$15,M$17,M$19,M$21,M$23,M$25,M$27,M$29,M$31,M$33,M$35,M$37,M$39,M$41,M$43,M$45,M$47,M$49,M$51,M$53,M$55,M$57,M$59,M$61,M$63,M$65,M$67,M$69,M$71,M$73,M$75,M$77,M$79,M$81,M$83,M$85,M$87,M$89,M$91,M$93,M$95,M$97,M$99,M$101,M$103,M$105,M$107,M$109,M$111,M$113,M$115,M$117,M$119,M$121,M$123,M$125)) -> 4 | N31: =RANK(N30,(N$6,N$8,N$10,N$12,N$15,N$17,N$19,N$21,N$23,N$25,N$27,N$29,N$31,N$33,N$35,N$37,N$39,N$41,N$43,N$45,N$47,N$49,N$51,N$53,N$55,N$57,N$59,N$61,N$63,N$65,N$67,N$69,N$71,N$73,N$75,N$77,N$79,N$81,N$83,N$85,N$87,N$89,N$91,N$93,N$95,N$97,N$99,N$101,N$103,N$105,N$107,N$109,N$111,N$113,N$115,N$117,N$119,N$121,N$123,N$125)) -> 4 | P31: =RANK(P30,(P$6,P$8,P$10,P$12,P$15,P$17,P$19,P$21,P$23,P$25,P$27,P$29,P$31,P$33,P$35,P$37,P$39,P$41,P$43,P$45,P$47,P$49,P$51,P$53,P$55,P$57,P$59,P$61,P$63,P$65,P$67,P$69,P$71,P$73,P$75,P$77,P$79,P$81,P$83,P$85,P$87,P$89,P$91,P$93,P$95,P$97,P$99,P$101,P$103,P$105,P$107,P$109,P$111,P$113,P$115,P$117,P$119,P$121,P$123,P$125)) -> 4
A32: DCI Open Class
A33: Colt | B33: 1 | C33: 11.80 | D33: 11.80 | E33: 23.60 | F33: 11.10 | G33: 10.90 | H33: 11.40 | I33: 16.70 | J33: 11.00 | K33: 11.40 | L33: 10.50 | M33: 16.45 | N33: 56.75 | O33: 0.0 | P33: 56.75
A34: Cadets | C34: 1 | D34: 1 | E34: 1 | F34: 1 | G34: 1 | H34: 1 | I34: 1 | J34: 1 | K34: 1 | L34: 1 | M34: 1 | N34: 1 | P34: 1
A37: 7/5/2024 Rockford, Illinois
C38: General Effect | F38: Visual | J38: Music
C39: 1 | D39: 2 | F39: Proficiency | G39: Analysis | H39: Color Guard | J39: Brass | K39: Analysis | L39: Percussion | N39: Sub | P39: Total
C40: I. Jenkins | D40: J. Denton | E40: Total | F40: M. Tarr | G40: T. Slaughter | H40: B. Spidel | I40: Total ÷2 | J40: K. Shuttleworth | K40: R. Rios | L40: G. Howarth | M40: Total ÷2 | N40: Total | O40: Pen | P40: Score
A41: DCI World Class | C41: 20 | D41: 20 | E41: 40 | F41: 20 | G41: 20 | H41: 20 | I41: 30 | J41: 20 | K41: 20 | L41: 20 | M41: 30 | N41: 100 | P41: 100
A42: Phantom | B42: 4 | C42: 15.70 | D42: 15.30 | E42: 31.00 | F42: 15.60 | G42: 15.60 | H42: 15.40 | I42: 23.30 | J42: 15.30 | K42: 15.30 | L42: 15.80 | M42: 23.20 | N42: 77.50 | O42: 0.0 | P42: 77.50
A43: Regiment | C43: =RANK(C42,(C$6,C$8,C$10,C$12,C$15,C$17,C$19,C$21,C$23,C$25,C$27,C$29,C$31,C$33,C$35,C$37,C$39,C$41,C$43,C$45,C$47,C$49,C$51,C$53,C$55,C$57,C$59,C$61,C$63,C$65,C$67,C$69,C$71,C$73,C$75,C$77,C$79,C$81,C$83,C$85,C$87,C$89,C$91,C$93,C$95,C$97,C$99,C$101,C$103,C$105,C$107,C$109,C$111,C$113,C$115,C$117,C$119,C$121,C$123,C$125)) -> 1 | D43: =RANK(D42,(D$6,D$8,D$10,D$12,D$15,D$17,D$19,D$21,D$23,D$25,D$27,D$29,D$31,D$33,D$35,D$37,D$39,D$41,D$43,D$45,D$47,D$49,D$51,D$53,D$55,D$57,D$59,D$61,D$63,D$65,D$67,D$69,D$71,D$73,D$75,D$77,D$79,D$81,D$83,D$85,D$87,D$89,D$91,D$93,D$95,D$97,D$99,D$101,D$103,D$105,D$107,D$109,D$111,D$113,D$115,D$117,D$119,D$121,D$123,D$125)) -> 1 | E43: =RANK(E42,(E$6,E$8,E$10,E$12,E$15,E$17,E$19,E$21,E$23,E$25,E$27,E$29,E$31,E$33,E$35,E$37,E$39,E$41,E$43,E$45,E$47,E$49,E$51,E$53,E$55,E$57,E$59,E$61,E$63,E$65,E$67,E$69,E$71,E$73,E$75,E$77,E$79,E$81,E$83,E$85,E$87,E$89,E$91,E$93,E$95,E$97,E$99,E$101,E$103,E$105,E$107,E$109,E$111,E$113,E$115,E$117,E$119,E$121,E$123,E$125)) -> 1 | F43: =RANK(F42,(F$6,F$8,F$10,F$12,F$15,F$17,F$19,F$21,F$23,F$25,F$27,F$29,F$31,F$33,F$35,F$37,F$39,F$41,F$43,F$45,F$47,F$49,F$51,F$53,F$55,F$57,F$59,F$61,F$63,F$65,F$67,F$69,F$71,F$73,F$75,F$77,F$79,F$81,F$83,F$85,F$87,F$89,F$91,F$93,F$95,F$97,F$99,F$101,F$103,F$105,F$107,F$109,F$111,F$113,F$115,F$117,F$119,F$121,F$123,F$125)) -> 1 | G43: =RANK(G42,(G$6,G$8,G$10,G$12,G$15,G$17,G$19,G$21,G$23,G$25,G$27,G$29,G$31,G$33,G$35,G$37,G$39,G$41,G$43,G$45,G$47,G$49,G$51,G$53,G$55,G$57,G$59,G$61,G$63,G$65,G$67,G$69,G$71,G$73,G$75,G$77,G$79,G$81,G$83,G$85,G$87,G$89,G$91,G$93,G$95,G$97,G$99,G$101,G$103,G$105,G$107,G$109,G$111,G$113,G$115,G$117,G$119,G$121,G$123,G$125)) -> 1 | H43: =RANK(H42,(H$6,H$8,H$10,H$12,H$15,H$17,H$19,H$21,H$23,H$25,H$27,H$29,H$31,H$33,H$35,H$37,H$39,H$41,H$43,H$45,H$47,H$49,H$51,H$53,H$55,H$57,H$59,H$61,H$63,H$65,H$67,H$69,H$71,H$73,H$75,H$77,H$79,H$81,H$83,H$85,H$87,H$89,H$91,H$93,H$95,H$97,H$99,H$101,H$103,H$105,H$107,H$109,H$111,H$113,H$115,H$117,H$119,H$121,H$123,H$125)) -> 1 | I43: =RANK(I42,(I$6,I$8,I$10,I$12,I$15,I$17,I$19,I$21,I$23,I$25,I$27,I$29,I$31,I$33,I$35,I$37,I$39,I$41,I$43,I$45,I$47,I$49,I$51,I$53,I$55,I$57,I$59,I$61,I$63,I$65,I$67,I$69,I$71,I$73,I$75,I$77,I$79,I$81,I$83,I$85,I$87,I$89,I$91,I$93,I$95,I$97,I$99,I$101,I$103,I$105,I$107,I$109,I$111,I$113,I$115,I$117,I$119,I$121,I$123,I$125)) -> 1 | J43: =RANK(J42,(J$6,J$8,J$10,J$12,J$15,J$17,J$19,J$21,J$23,J$25,J$27,J$29,J$31,J$33,J$35,J$37,J$39,J$41,J$43,J$45,J$47,J$49,J$51,J$53,J$55,J$57,J$59,J$61,J$63,J$65,J$67,J$69,J$71,J$73,J$75,J$77,J$79,J$81,J$83,J$85,J$87,J$89,J$91,J$93,J$95,J$97,J$99,J$101,J$103,J$105,J$107,J$109,J$111,J$113,J$115,J$117,J$119,J$121,J$123,J$125)) -> 1 | K43: =RANK(K42,(K$6,K$8,K$10,K$12,K$15,K$17,K$19,K$21,K$23,K$25,K$27,K$29,K$31,K$33,K$35,K$37,K$39,K$41,K$43,K$45,K$47,K$49,K$51,K$53,K$55,K$57,K$59,K$61,K$63,K$65,K$67,K$69,K$71,K$73,K$75,K$77,K$79,K$81,K$83,K$85,K$87,K$89,K$91,K$93,K$95,K$97,K$99,K$101,K$103,K$105,K$107,K$109,K$111,K$113,K$115,K$117,K$119,K$121,K$123,K$125)) -> 1 | L43: =RANK(L42,(L$6,L$8,L$10,L$12,L$15,L$17,L$19,L$21,L$23,L$25,L$27,L$29,L$31,L$33,L$35,L$37,L$39,L$41,L$43,L$45,L$47,L$49,L$51,L$53,L$55,L$57,L$59,L$61,L$63,L$65,L$67,L$69,L$71,L$73,L$75,L$77,L$79,L$81,L$83,L$85,L$87,L$89,L$91,L$93,L$95,L$97,L$99,L$101,L$103,L$105,L$107,L$109,L$111,L$113,L$115,L$117,L$119,L$121,L$123,L$125)) -> 2 | M43: =RANK(M42,(M$6,M$8,M$10,M$12,M$15,M$17,M$19,M$21,M$23,M$25,M$27,M$29,M$31,M$33,M$35,M$37,M$39,M$41,M$43,M$45,M$47,M$49,M$51,M$53,M$55,M$57,M$59,M$61,M$63,M$65,M$67,M$69,M$71,M$73,M$75,M$77,M$79,M$81,M$83,M$85,M$87,M$89,M$91,M$93,M$95,M$97,M$99,M$101,M$103,M$105,M$107,M$109,M$111,M$113,M$115,M$117,M$119,M$121,M$123,M$125)) -> 1 | N43: =RANK(N42,(N$6,N$8,N$10,N$12,N$15,N$17,N$19,N$21,N$23,N$25,N$27,N$29,N$31,N$33,N$35,N$37,N$39,N$41,N$43,N$45,N$47,N$49,N$51,N$53,N$55,N$57,N$59,N$61,N$63,N$65,N$67,N$69,N$71,N$73,N$75,N$77,N$79,N$81,N$83,N$85,N$87,N$89,N$91,N$93,N$95,N$97,N$99,N$101,N$103,N$105,N$107,N$109,N$111,N$113,N$115,N$117,N$119,N$121,N$123,N$125)) -> 1 | P43: =RANK(P42,(P$6,P$8,P$10,P$12,P$15,P$17,P$19,P$21,P$23,P$25,P$27,P$29,P$31,P$33,P$35,P$37,P$39,P$41,P$43,P$45,P$47,P$49,P$51,P$53,P$55,P$57,P$59,P$61,P$63,P$65,P$67,P$69,P$71,P$73,P$75,P$77,P$79,P$81,P$83,P$85,P$87,P$89,P$91,P$93,P$95,P$97,P$99,P$101,P$103,P$105,P$107,P$109,P$111,P$113,P$115,P$117,P$119,P$121,P$123,P$125)) -> 1
A44: Cavaliers | B44: 3 | C44: 15.00 | D44: 15.00 | E44: 30.00 | F44: 15.00 | G44: 15.20 | H44: 15.30 | I44: 22.75 | J44: 15.00 | K44: 15.30 | L44: 16.00 | M44: 23.15 | N44: 75.90 | O44: 0.0 | P44: 75.90
C45: =RANK(C44,(C$6,C$8,C$10,C$12,C$15,C$17,C$19,C$21,C$23,C$25,C$27,C$29,C$31,C$33,C$35,C$37,C$39,C$41,C$43,C$45,C$47,C$49,C$51,C$53,C$55,C$57,C$59,C$61,C$63,C$65,C$67,C$69,C$71,C$73,C$75,C$77,C$79,C$81,C$83,C$85,C$87,C$89,C$91,C$93,C$95,C$97,C$99,C$101,C$103,C$105,C$107,C$109,C$111,C$113,C$115,C$117,C$119,C$121,C$123,C$125)) -> 2 | D45: =RANK(D44,(D$6,D$8,D$10,D$12,D$15,D$17,D$19,D$21,D$23,D$25,D$27,D$29,D$31,D$33,D$35,D$37,D$39,D$41,D$43,D$45,D$47,D$49,D$51,D$53,D$55,D$57,D$59,D$61,D$63,D$65,D$67,D$69,D$71,D$73,D$75,D$77,D$79,D$81,D$83,D$85,D$87,D$89,D$91,D$93,D$95,D$97,D$99,D$101,D$103,D$105,D$107,D$109,D$111,D$113,D$115,D$117,D$119,D$121,D$123,D$125)) -> 2 | E45: =RANK(E44,(E$6,E$8,E$10,E$12,E$15,E$17,E$19,E$21,E$23,E$25,E$27,E$29,E$31,E$33,E$35,E$37,E$39,E$41,E$43,E$45,E$47,E$49,E$51,E$53,E$55,E$57,E$59,E$61,E$63,E$65,E$67,E$69,E$71,E$73,E$75,E$77,E$79,E$81,E$83,E$85,E$87,E$89,E$91,E$93,E$95,E$97,E$99,E$101,E$103,E$105,E$107,E$109,E$111,E$113,E$115,E$117,E$119,E$121,E$123,E$125)) -> 2 | F45: =RANK(F44,(F$6,F$8,F$10,F$12,F$15,F$17,F$19,F$21,F$23,F$25,F$27,F$29,F$31,F$33,F$35,F$37,F$39,F$41,F$43,F$45,F$47,F$49,F$51,F$53,F$55,F$57,F$59,F$61,F$63,F$65,F$67,F$69,F$71,F$73,F$75,F$77,F$79,F$81,F$83,F$85,F$87,F$89,F$91,F$93,F$95,F$97,F$99,F$101,F$103,F$105,F$107,F$109,F$111,F$113,F$115,F$117,F$119,F$121,F$123,F$125)) -> 2 | G45: =RANK(G44,(G$6,G$8,G$10,G$12,G$15,G$17,G$19,G$21,G$23,G$25,G$27,G$29,G$31,G$33,G$35,G$37,G$39,G$41,G$43,G$45,G$47,G$49,G$51,G$53,G$55,G$57,G$59,G$61,G$63,G$65,G$67,G$69,G$71,G$73,G$75,G$77,G$79,G$81,G$83,G$85,G$87,G$89,G$91,G$93,G$95,G$97,G$99,G$101,G$103,G$105,G$107,G$109,G$111,G$113,G$115,G$117,G$119,G$121,G$123,G$125)) -> 2 | H45: =RANK(H44,(H$6,H$8,H$10,H$12,H$15,H$17,H$19,H$21,H$23,H$25,H$27,H$29,H$31,H$33,H$35,H$37,H$39,H$41,H$43,H$45,H$47,H$49,H$51,H$53,H$55,H$57,H$59,H$61,H$63,H$65,H$67,H$69,H$71,H$73,H$75,H$77,H$79,H$81,H$83,H$85,H$87,H$89,H$91,H$93,H$95,H$97,H$99,H$101,H$103,H$105,H$107,H$109,H$111,H$113,H$115,H$117,H$119,H$121,H$123,H$125)) -> 2 | I45: =RANK(I44,(I$6,I$8,I$10,I$12,I$15,I$17,I$19,I$21,I$23,I$25,I$27,I$29,I$31,I$33,I$35,I$37,I$39,I$41,I$43,I$45,I$47,I$49,I$51,I$53,I$55,I$57,I$59,I$61,I$63,I$65,I$67,I$69,I$71,I$73,I$75,I$77,I$79,I$81,I$83,I$85,I$87,I$89,I$91,I$93,I$95,I$97,I$99,I$101,I$103,I$105,I$107,I$109,I$111,I$113,I$115,I$117,I$119,I$121,I$123,I$125)) -> 2 | J45: =RANK(J44,(J$6,J$8,J$10,J$12,J$15,J$17,J$19,J$21,J$23,J$25,J$27,J$29,J$31,J$33,J$35,J$37,J$39,J$41,J$43,J$45,J$47,J$49,J$51,J$53,J$55,J$57,J$59,J$61,J$63,J$65,J$67,J$69,J$71,J$73,J$75,J$77,J$79,J$81,J$83,J$85,J$87,J$89,J$91,J$93,J$95,J$97,J$99,J$101,J$103,J$105,J$107,J$109,J$111,J$113,J$115,J$117,J$119,J$121,J$123,J$125)) -> 2 | K45: =RANK(K44,(K$6,K$8,K$10,K$12,K$15,K$17,K$19,K$21,K$23,K$25,K$27,K$29,K$31,K$33,K$35,K$37,K$39,K$41,K$43,K$45,K$47,K$49,K$51,K$53,K$55,K$57,K$59,K$61,K$63,K$65,K$67,K$69,K$71,K$73,K$75,K$77,K$79,K$81,K$83,K$85,K$87,K$89,K$91,K$93,K$95,K$97,K$99,K$101,K$103,K$105,K$107,K$109,K$111,K$113,K$115,K$117,K$119,K$121,K$123,K$125)) -> 1 | L45: =RANK(L44,(L$6,L$8,L$10,L$12,L$15,L$17,L$19,L$21,L$23,L$25,L$27,L$29,L$31,L$33,L$35,L$37,L$39,L$41,L$43,L$45,L$47,L$49,L$51,L$53,L$55,L$57,L$59,L$61,L$63,L$65,L$67,L$69,L$71,L$73,L$75,L$77,L$79,L$81,L$83,L$85,L$87,L$89,L$91,L$93,L$95,L$97,L$99,L$101,L$103,L$105,L$107,L$109,L$111,L$113,L$115,L$117,L$119,L$121,L$123,L$125)) -> 1 | M45: =RANK(M44,(M$6,M$8,M$10,M$12,M$15,M$17,M$19,M$21,M$23,M$25,M$27,M$29,M$31,M$33,M$35,M$37,M$39,M$41,M$43,M$45,M$47,M$49,M$51,M$53,M$55,M$57,M$59,M$61,M$63,M$65,M$67,M$69,M$71,M$73,M$75,M$77,M$79,M$81,M$83,M$85,M$87,M$89,M$91,M$93,M$95,M$97,M$99,M$101,M$103,M$105,M$107,M$109,M$111,M$113,M$115,M$117,M$119,M$121,M$123,M$125)) -> 2 | N45: =RANK(N44,(N$6,N$8,N$10,N$12,N$15,N$17,N$19,N$21,N$23,N$25,N$27,N$29,N$31,N$33,N$35,N$37,N$39,N$41,N$43,N$45,N$47,N$49,N$51,N$53,N$55,N$57,N$59,N$61,N$63,N$65,N$67,N$69,N$71,N$73,N$75,N$77,N$79,N$81,N$83,N$85,N$87,N$89,N$91,N$93,N$95,N$97,N$99,N$101,N$103,N$105,N$107,N$109,N$111,N$113,N$115,N$117,N$119,N$121,N$123,N$125)) -> 2 | P45: =RANK(P44,(P$6,P$8,P$10,P$12,P$15,P$17,P$19,P$21,P$23,P$25,P$27,P$29,P$31,P$33,P$35,P$37,P$39,P$41,P$43,P$45,P$47,P$49,P$51,P$53,P$55,P$57,P$59,P$61,P$63,P$65,P$67,P$69,P$71,P$73,P$75,P$77,P$79,P$81,P$83,P$85,P$87,P$89,P$91,P$93,P$95,P$97,P$99,P$101,P$103,P$105,P$107,P$109,P$111,P$113,P$115,P$117,P$119,P$121,P$123,P$125)) -> 2
A46: Blue | B46: 2 | C46: 14.50 | D46: 14.70 | E46: 29.20 | F46: 14.80 | G46: 14.90 | H46: 15.00 | I46: 22.35 | J46: 14.90 | K46: 15.00 | L46: 15.20 | M46: 22.55 | N46: 74.10 | O46: 0.0 | P46: 74.10
A47: Stars | C47: =RANK(C46,(C$6,C$8,C$10,C$12,C$15,C$17,C$19,C$21,C$23,C$25,C$27,C$29,C$31,C$33,C$35,C$37,C$39,C$41,C$43,C$45,C$47,C$49,C$51,C$53,C$55,C$57,C$59,C$61,C$63,C$65,C$67,C$69,C$71,C$73,C$75,C$77,C$79,C$81,C$83,C$85,C$87,C$89,C$91,C$93,C$95,C$97,C$99,C$101,C$103,C$105,C$107,C$109,C$111,C$113,C$115,C$117,C$119,C$121,C$123,C$125)) -> 3 | D47: =RANK(D46,(D$6,D$8,D$10,D$12,D$15,D$17,D$19,D$21,D$23,D$25,D$27,D$29,D$31,D$33,D$35,D$37,D$39,D$41,D$43,D$45,D$47,D$49,D$51,D$53,D$55,D$57,D$59,D$61,D$63,D$65,D$67,D$69,D$71,D$73,D$75,D$77,D$79,D$81,D$83,D$85,D$87,D$89,D$91,D$93,D$95,D$97,D$99,D$101,D$103,D$105,D$107,D$109,D$111,D$113,D$115,D$117,D$119,D$121,D$123,D$125)) -> 3 | E47: =RANK(E46,(E$6,E$8,E$10,E$12,E$15,E$17,E$19,E$21,E$23,E$25,E$27,E$29,E$31,E$33,E$35,E$37,E$39,E$41,E$43,E$45,E$47,E$49,E$51,E$53,E$55,E$57,E$59,E$61,E$63,E$65,E$67,E$69,E$71,E$73,E$75,E$77,E$79,E$81,E$83,E$85,E$87,E$89,E$91,E$93,E$95,E$97,E$99,E$101,E$103,E$105,E$107,E$109,E$111,E$113,E$115,E$117,E$119,E$121,E$123,E$125)) -> 3 | F47: =RANK(F46,(F$6,F$8,F$10,F$12,F$15,F$17,F$19,F$21,F$23,F$25,F$27,F$29,F$31,F$33,F$35,F$37,F$39,F$41,F$43,F$45,F$47,F$49,F$51,F$53,F$55,F$57,F$59,F$61,F$63,F$65,F$67,F$69,F$71,F$73,F$75,F$77,F$79,F$81,F$83,F$85,F$87,F$89,F$91,F$93,F$95,F$97,F$99,F$101,F$103,F$105,F$107,F$109,F$111,F$113,F$115,F$117,F$119,F$121,F$123,F$125)) -> 3 | G47: =RANK(G46,(G$6,G$8,G$10,G$12,G$15,G$17,G$19,G$21,G$23,G$25,G$27,G$29,G$31,G$33,G$35,G$37,G$39,G$41,G$43,G$45,G$47,G$49,G$51,G$53,G$55,G$57,G$59,G$61,G$63,G$65,G$67,G$69,G$71,G$73,G$75,G$77,G$79,G$81,G$83,G$85,G$87,G$89,G$91,G$93,G$95,G$97,G$99,G$101,G$103,G$105,G$107,G$109,G$111,G$113,G$115,G$117,G$119,G$121,G$123,G$125)) -> 3 | H47: =RANK(H46,(H$6,H$8,H$10,H$12,H$15,H$17,H$19,H$21,H$23,H$25,H$27,H$29,H$31,H$33,H$35,H$37,H$39,H$41,H$43,H$45,H$47,H$49,H$51,H$53,H$55,H$57,H$59,H$61,H$63,H$65,H$67,H$69,H$71,H$73,H$75,H$77,H$79,H$81,H$83,H$85,H$87,H$89,H$91,H$93,H$95,H$97,H$99,H$101,H$103,H$105,H$107,H$109,H$111,H$113,H$115,H$117,H$119,H$121,H$123,H$125)) -> 3 | I47: =RANK(I46,(I$6,I$8,I$10,I$12,I$15,I$17,I$19,I$21,I$23,I$25,I$27,I$29,I$31,I$33,I$35,I$37,I$39,I$41,I$43,I$45,I$47,I$49,I$51,I$53,I$55,I$57,I$59,I$61,I$63,I$65,I$67,I$69,I$71,I$73,I$75,I$77,I$79,I$81,I$83,I$85,I$87,I$89,I$91,I$93,I$95,I$97,I$99,I$101,I$103,I$105,I$107,I$109,I$111,I$113,I$115,I$117,I$119,I$121,I$123,I$125)) -> 3 | J47: =RANK(J46,(J$6,J$8,J$10,J$12,J$15,J$17,J$19,J$21,J$23,J$25,J$27,J$29,J$31,J$33,J$35,J$37,J$39,J$41,J$43,J$45,J$47,J$49,J$51,J$53,J$55,J$57,J$59,J$61,J$63,J$65,J$67,J$69,J$71,J$73,J$75,J$77,J$79,J$81,J$83,J$85,J$87,J$89,J$91,J$93,J$95,J$97,J$99,J$101,J$103,J$105,J$107,J$109,J$111,J$113,J$115,J$117,J$119,J$121,J$123,J$125)) -> 3 | K47: =RANK(K46,(K$6,K$8,K$10,K$12,K$15,K$17,K$19,K$21,K$23,K$25,K$27,K$29,K$31,K$33,K$35,K$37,K$39,K$41,K$43,K$45,K$47,K$49,K$51,K$53,K$55,K$57,K$59,K$61,K$63,K$65,K$67,K$69,K$71,K$73,K$75,K$77,K$79,K$81,K$83,K$85,K$87,K$89,K$91,K$93,K$95,K$97,K$99,K$101,K$103,K$105,K$107,K$109,K$111,K$113,K$115,K$117,K$119,K$121,K$123,K$125)) -> 3 | L47: =RANK(L46,(L$6,L$8,L$10,L$12,L$15,L$17,L$19,L$21,L$23,L$25,L$27,L$29,L$31,L$33,L$35,L$37,L$39,L$41,L$43,L$45,L$47,L$49,L$51,L$53,L$55,L$57,L$59,L$61,L$63,L$65,L$67,L$69,L$71,L$73,L$75,L$77,L$79,L$81,L$83,L$85,L$87,L$89,L$91,L$93,L$95,L$97,L$99,L$101,L$103,L$105,L$107,L$109,L$111,L$113,L$115,L$117,L$119,L$121,L$123,L$125)) -> 3 | M47: =RANK(M46,(M$6,M$8,M$10,M$12,M$15,M$17,M$19,M$21,M$23,M$25,M$27,M$29,M$31,M$33,M$35,M$37,M$39,M$41,M$43,M$45,M$47,M$49,M$51,M$53,M$55,M$57,M$59,M$61,M$63,M$65,M$67,M$69,M$71,M$73,M$75,M$77,M$79,M$81,M$83,M$85,M$87,M$89,M$91,M$93,M$95,M$97,M$99,M$101,M$103,M$105,M$107,M$109,M$111,M$113,M$115,M$117,M$119,M$121,M$123,M$125)) -> 3 | N47: =RANK(N46,(N$6,N$8,N$10,N$12,N$15,N$17,N$19,N$21,N$23,N$25,N$27,N$29,N$31,N$33,N$35,N$37,N$39,N$41,N$43,N$45,N$47,N$49,N$51,N$53,N$55,N$57,N$59,N$61,N$63,N$65,N$67,N$69,N$71,N$73,N$75,N$77,N$79,N$81,N$83,N$85,N$87,N$89,N$91,N$93,N$95,N$97,N$99,N$101,N$103,N$105,N$107,N$109,N$111,N$113,N$115,N$117,N$119,N$121,N$123,N$125)) -> 3 | P47: =RANK(P46,(P$6,P$8,P$10,P$12,P$15,P$17,P$19,P$21,P$23,P$25,P$27,P$29,P$31,P$33,P$35,P$37,P$39,P$41,P$43,P$45,P$47,P$49,P$51,P$53,P$55,P$57,P$59,P$61,P$63,P$65,P$67,P$69,P$71,P$73,P$75,P$77,P$79,P$81,P$83,P$85,P$87,P$89,P$91,P$93,P$95,P$97,P$99,P$101,P$103,P$105,P$107,P$109,P$111,P$113,P$115,P$117,P$119,P$121,P$123,P$125)) -> 3
A48: Madison | B48: 1 | C48: 14.40 | D48: 14.40 | E48: 28.80 | F48: 14.30 | G48: 14.30 | H48: 14.00 | I48: 21.30 | J48: 14.50 | K48: 14.20 | L48: 13.80 | M48: 21.25 | N48: 71.35 | O48: 0.0 | P48: 71.35
A49: Scouts | C49: =RANK(C48,(C$6,C$8,C$10,C$12,C$15,C$17,C$19,C$21,C$23,C$25,C$27,C$29,C$31,C$33,C$35,C$37,C$39,C$41,C$43,C$45,C$47,C$49,C$51,C$53,C$55,C$57,C$59,C$61,C$63,C$65,C$67,C$69,C$71,C$73,C$75,C$77,C$79,C$81,C$83,C$85,C$87,C$89,C$91,C$93,C$95,C$97,C$99,C$101,C$103,C$105,C$107,C$109,C$111,C$113,C$115,C$117,C$119,C$121,C$123,C$125)) -> 4 | D49: =RANK(D48,(D$6,D$8,D$10,D$12,D$15,D$17,D$19,D$21,D$23,D$25,D$27,D$29,D$31,D$33,D$35,D$37,D$39,D$41,D$43,D$45,D$47,D$49,D$51,D$53,D$55,D$57,D$59,D$61,D$63,D$65,D$67,D$69,D$71,D$73,D$75,D$77,D$79,D$81,D$83,D$85,D$87,D$89,D$91,D$93,D$95,D$97,D$99,D$101,D$103,D$105,D$107,D$109,D$111,D$113,D$115,D$117,D$119,D$121,D$123,D$125)) -> 4 | E49: =RANK(E48,(E$6,E$8,E$10,E$12,E$15,E$17,E$19,E$21,E$23,E$25,E$27,E$29,E$31,E$33,E$35,E$37,E$39,E$41,E$43,E$45,E$47,E$49,E$51,E$53,E$55,E$57,E$59,E$61,E$63,E$65,E$67,E$69,E$71,E$73,E$75,E$77,E$79,E$81,E$83,E$85,E$87,E$89,E$91,E$93,E$95,E$97,E$99,E$101,E$103,E$105,E$107,E$109,E$111,E$113,E$115,E$117,E$119,E$121,E$123,E$125)) -> 4 | F49: =RANK(F48,(F$6,F$8,F$10,F$12,F$15,F$17,F$19,F$21,F$23,F$25,F$27,F$29,F$31,F$33,F$35,F$37,F$39,F$41,F$43,F$45,F$47,F$49,F$51,F$53,F$55,F$57,F$59,F$61,F$63,F$65,F$67,F$69,F$71,F$73,F$75,F$77,F$79,F$81,F$83,F$85,F$87,F$89,F$91,F$93,F$95,F$97,F$99,F$101,F$103,F$105,F$107,F$109,F$111,F$113,F$115,F$117,F$119,F$121,F$123,F$125)) -> 4 | G49: =RANK(G48,(G$6,G$8,G$10,G$12,G$15,G$17,G$19,G$21,G$23,G$25,G$27,G$29,G$31,G$33,G$35,G$37,G$39,G$41,G$43,G$45,G$47,G$49,G$51,G$53,G$55,G$57,G$59,G$61,G$63,G$65,G$67,G$69,G$71,G$73,G$75,G$77,G$79,G$81,G$83,G$85,G$87,G$89,G$91,G$93,G$95,G$97,G$99,G$101,G$103,G$105,G$107,G$109,G$111,G$113,G$115,G$117,G$119,G$121,G$123,G$125)) -> 4 | H49: =RANK(H48,(H$6,H$8,H$10,H$12,H$15,H$17,H$19,H$21,H$23,H$25,H$27,H$29,H$31,H$33,H$35,H$37,H$39,H$41,H$43,H$45,H$47,H$49,H$51,H$53,H$55,H$57,H$59,H$61,H$63,H$65,H$67,H$69,H$71,H$73,H$75,H$77,H$79,H$81,H$83,H$85,H$87,H$89,H$91,H$93,H$95,H$97,H$99,H$101,H$103,H$105,H$107,H$109,H$111,H$113,H$115,H$117,H$119,H$121,H$123,H$125)) -> 4 | I49: =RANK(I48,(I$6,I$8,I$10,I$12,I$15,I$17,I$19,I$21,I$23,I$25,I$27,I$29,I$31,I$33,I$35,I$37,I$39,I$41,I$43,I$45,I$47,I$49,I$51,I$53,I$55,I$57,I$59,I$61,I$63,I$65,I$67,I$69,I$71,I$73,I$75,I$77,I$79,I$81,I$83,I$85,I$87,I$89,I$91,I$93,I$95,I$97,I$99,I$101,I$103,I$105,I$107,I$109,I$111,I$113,I$115,I$117,I$119,I$121,I$123,I$125)) -> 4 | J49: =RANK(J48,(J$6,J$8,J$10,J$12,J$15,J$17,J$19,J$21,J$23,J$25,J$27,J$29,J$31,J$33,J$35,J$37,J$39,J$41,J$43,J$45,J$47,J$49,J$51,J$53,J$55,J$57,J$59,J$61,J$63,J$65,J$67,J$69,J$71,J$73,J$75,J$77,J$79,J$81,J$83,J$85,J$87,J$89,J$91,J$93,J$95,J$97,J$99,J$101,J$103,J$105,J$107,J$109,J$111,J$113,J$115,J$117,J$119,J$121,J$123,J$125)) -> 4 | K49: =RANK(K48,(K$6,K$8,K$10,K$12,K$15,K$17,K$19,K$21,K$23,K$25,K$27,K$29,K$31,K$33,K$35,K$37,K$39,K$41,K$43,K$45,K$47,K$49,K$51,K$53,K$55,K$57,K$59,K$61,K$63,K$65,K$67,K$69,K$71,K$73,K$75,K$77,K$79,K$81,K$83,K$85,K$87,K$89,K$91,K$93,K$95,K$97,K$99,K$101,K$103,K$105,K$107,K$109,K$111,K$113,K$115,K$117,K$119,K$121,K$123,K$125)) -> 4 | L49: =RANK(L48,(L$6,L$8,L$10,L$12,L$15,L$17,L$19,L$21,L$23,L$25,L$27,L$29,L$31,L$33,L$35,L$37,L$39,L$41,L$43,L$45,L$47,L$49,L$51,L$53,L$55,L$57,L$59,L$61,L$63,L$65,L$67,L$69,L$71,L$73,L$75,L$77,L$79,L$81,L$83,L$85,L$87,L$89,L$91,L$93,L$95,L$97,L$99,L$101,L$103,L$105,L$107,L$109,L$111,L$113,L$115,L$117,L$119,L$121,L$123,L$125)) -> 4 | M49: =RANK(M48,(M$6,M$8,M$10,M$12,M$15,M$17,M$19,M$21,M$23,M$25,M$27,M$29,M$31,M$33,M$35,M$37,M$39,M$41,M$43,M$45,M$47,M$49,M$51,M$53,M$55,M$57,M$59,M$61,M$63,M$65,M$67,M$69,M$71,M$73,M$75,M$77,M$79,M$81,M$83,M$85,M$87,M$89,M$91,M$93,M$95,M$97,M$99,M$101,M$103,M$105,M$107,M$109,M$111,M$113,M$115,M$117,M$119,M$121,M$123,M$125)) -> 4 | N49: =RANK(N48,(N$6,N$8,N$10,N$12,N$15,N$17,N$19,N$21,N$23,N$25,N$27,N$29,N$31,N$33,N$35,N$37,N$39,N$41,N$43,N$45,N$47,N$49,N$51,N$53,N$55,N$57,N$59,N$61,N$63,N$65,N$67,N$69,N$71,N$73,N$75,N$77,N$79,N$81,N$83,N$85,N$87,N$89,N$91,N$93,N$95,N$97,N$99,N$101,N$103,N$105,N$107,N$109,N$111,N$113,N$115,N$117,N$119,N$121,N$123,N$125)) -> 4 | P49: =RANK(P48,(P$6,P$8,P$10,P$12,P$15,P$17,P$19,P$21,P$23,P$25,P$27,P$29,P$31,P$33,P$35,P$37,P$39,P$41,P$43,P$45,P$47,P$49,P$51,P$53,P$55,P$57,P$59,P$61,P$63,P$65,P$67,P$69,P$71,P$73,P$75,P$77,P$79,P$81,P$83,P$85,P$87,P$89,P$91,P$93,P$95,P$97,P$99,P$101,P$103,P$105,P$107,P$109,P$111,P$113,P$115,P$117,P$119,P$121,P$123,P$125)) -> 4
A50: DCI Open Class
A51: River City | B51: 1 | C51: 12.50 | D51: 12.50 | E51: 25.00 | F51: 12.60 | G51: 12.80 | H51: 10.90 | I51: 18.15 | J51: 12.10 | K51: 13.10 | L51: 11.70 | M51: 18.45 | N51: 61.60 | O51: 0.0 | P51: 61.60
A52: Rhythm | C52: 1 | D52: 1 | E52: 1 | F52: 1 | G52: 1 | H52: 2 | I52: 1 | J52: 1 | K52: 1 | L52: 2 | M52: 1 | N52: 1 | P52: 1
A53: Colt | B53: 2 | C53: 12.10 | D53: 11.90 | E53: 24.00 | F53: 11.80 | G53: 11.90 | H53: 11.30 | I53: 17.50 | J53: 11.70 | K53: 12.10 | L53: 11.80 | M53: 17.80 | N53: 59.30 | O53: 0.0 | P53: 59.30
A54: Cadets | C54: 2 | D54: 2 | E54: 2 | F54: 2 | G54: 2 | H54: 1 | I54: 2 | J54: 2 | K54: 2 | L54: 1 | M54: 2 | N54: 2 | P54: 2
A57: 7/5/2024 Portland, Oregon
C58: General Effect | F58: Visual | J58: Music
C59: 1 | D59: 2 | F59: Proficiency | G59: Analysis | H59: Color Guard | J59: Brass | K59: Analysis | L59: Percussion | N59: Sub | P59: Total
C60: P. Madden | D60: N. Jones | E60: Total | F60: B. Brahan | G60: W. Chumley | H60: C. Costanza | I60: Total ÷2 | J60: B. Fabrizio | K60: J. Webb | L60: P. Furnari | M60: Total ÷2 | N60: Total | O60: Pen | P60: Score
A61: DCI World Class | C61: 20 | D61: 20 | E61: 40 | F61: 20 | G61: 20 | H61: 20 | I61: 30 | J61: 20 | K61: 20 | L61: 20 | M61: 30 | N61: 100 | P61: 100
A62: Troopers | B62: 2 | C62: 14.20 | D62: 14.40 | E62: 28.60 | F62: 14.00 | G62: 14.40 | H62: 13.60 | I62: 21.00 | J62: 14.90 | K62: 14.10 | L62: 14.70 | M62: 21.85 | N62: 71.45 | O62: 0.0 | P62: 71.45
C63: 1 | D63: 1 | E63: 1 | F63: 2 | G63: 1 | H63: 2 | I63: 2 | J63: 1 | K63: 1 | L63: 1 | M63: 1 | N63: 1 | P63: 1
A64: Blue | B64: 1 | C64: 13.80 | D64: 13.90 | E64: 27.70 | F64: 14.50 | G64: 14.20 | H64: 14.00 | I64: 21.35 | J64: 13.70 | K64: 13.60 | L64: 13.80 | M64: 20.55 | N64: 69.60 | O64: 0.0 | P64: 69.60
A65: Knights | C65: 2 | D65: 2 | E65: 2 | F65: 1 | G65: 2 | H65: 1 | I65: 1 | J65: 2 | K65: 2 | L65: 2 | M65: 2 | N65: 2 | P65: 2
A66: Seattle | B66: 3 | C66: 12.20 | D66: 12.50 | E66: 24.70 | F66: 13.30 | G66: 12.00 | H66: 10.80 | I66: 18.05 | J66: 12.50 | K66: 12.80 | L66: 12.50 | M66: 18.90 | N66: 61.65 | O66: 0.0 | P66: 61.65
A67: Cascades | C67: 3 | D67: 3 | E67: 3 | F67: 3 | G67: 3 | H67: 3 | I67: 3 | J67: 3 | K67: 3 | L67: 3 | M67: 3 | N67: 3 | P67: 3
A70: 7/5/2024 Clovis, California
C71: General Effect | F71: Visual | J71: Music
C72: 1 | D72: 2 | F72: Proficiency | G72: Analysis | H72: Color Guard | J72: Brass | K72: Analysis | L72: Percussion | N72: Sub | P72: Total
C73: C. Moss | D73: A. Kristensen | E73: Total | F73: E. Martinez | G73: T. Ochran | H73: M. Turner | I73: Total ÷2 | J73: J. Loyde | K73: S. Page | L73: D. Carbone | M73: Total ÷2 | N73: Total | O73: Pen | P73: Score
A74: DCI World Class | C74: 20 | D74: 20 | E74: 40 | F74: 20 | G74: 20 | H74: 20 | I74: 30 | J74: 20 | K74: 20 | L74: 20 | M74: 30 | N74: 100 | P74: 100
A75: Blue | B75: 5 | C75: 16.00 | D75: 16.30 | E75: 32.30 | F75: 16.30 | G75: 16.20 | H75: 15.80 | I75: 24.15 | J75: 16.10 | K75: 16.20 | L75: 16.00 | M75: 24.15 | N75: 80.60 | O75: 0.0 | P75: 80.60
A76: Devils | C76: 1 | D76: 1 | E76: 1 | F76: 1 | G76: 1 | H76: 1 | I76: 1 | J76: 1 | K76: 1 | L76: 2 | M76: 1 | N76: 1 | P76: 1
A77: Mandarins | B77: 4 | C77: 15.10 | D77: 15.60 | E77: 30.70 | F77: 15.50 | G77: 15.40 | H77: 15.30 | I77: 23.10 | J77: 14.90 | K77: 15.50 | L77: 15.20 | M77: 22.80 | N77: 76.60 | O77: 0.0 | P77: 76.60
C78: 2 | D78: 2 | E78: 2 | F78: 2 | G78: 2 | H78: 2 | I78: 2 | J78: 2 | K78: 3 | L78: 3 | M78: 3 | N78: 2 | P78: 2
A79: Vanguard | B79: 1 | C79: 14.80 | D79: 15.20 | E79: 30.00 | F79: 15.40 | G79: 14.90 | H79: 15.10 | I79: 22.70 | J79: 14.70 | K79: 15.60 | L79: 16.10 | M79: 23.20 | N79: 75.90 | O79: 0.0 | P79: 75.90
C80: 3 | D80: 3 | E80: 3 | F80: 3 | G80: 3 | H80: 3 | I80: 3 | J80: 3 | K80: 2 | L80: 1 | M80: 2 | N80: 3 | P80: 3
A81: Pacific | B81: 3 | C81: 13.30 | D81: 13.10 | E81: 26.40 | F81: 14.00 | G81: 13.00 | H81: 14.00 | I81: 20.50 | J81: 14.20 | K81: 14.70 | L81: 14.60 | M81: 21.75 | N81: 68.65 | O81: 0.0 | P81: 68.65
A82: Crest | C82: 4 | D82: 4 | E82: 4 | F82: 4 | G82: 5 | H82: 4 | I82: 4 | J82: 4 | K82: 4 | L82: 4 | M82: 4 | N82: 4 | P82: 4
A83: Academy | B83: 2 | C83: 12.40 | D83: 12.10 | E83: 24.50 | F83: 13.90 | G83: 13.90 | H83: 12.50 | I83: 20.15 | J83: 13.60 | K83: 14.20 | L83: 13.90 | M83: 20.85 | N83: 65.50 | O83: 0.0 | P83: 65.50
C84: 5 | D84: 5 | E84: 5 | F84: 5 | G84: 4 | H84: 5 | I84: 5 | J84: 5 | K84: 5 | L84: 5 | M84: 5 | N84: 5 | P84: 5
A87: 7/6/2024 Whitewater, Wisconsin
C88: General Effect | F88: Visual | J88: Music
C89: 1 | D89: 2 | F89: Proficiency | G89: Analysis | H89: Color Guard | J89: Brass | K89: Analysis | L89: Percussion | N89: Sub | P89: Total
C90: M. Tarr | D90: K. Shuttleworth | E90: Total | F90: T. Slaughter | G90: B. Spidel | H90: I. Jenkins | I90: Total ÷2 | J90: P. McGarr | K90: G. Howarth | L90: B. Williams | M90: Total ÷2 | N90: Total | O90: Pen | P90: Score
A91: DCI World Class | C91: 20 | D91: 20 | E91: 40 | F91: 20 | G91: 20 | H91: 20 | I91: 30 | J91: 20 | K91: 20 | L91: 20 | M91: 30 | N91: 100 | P91: 100
A92: Bluecoats | B92: 4 | C92: 16.40 | D92: 16.60 | E92: 33.00 | F92: 16.10 | G92: 16.40 | H92: 16.50 | I92: 24.50 | J92: 15.90 | K92: 16.40 | L92: 16.50 | M92: 24.40 | N92: 81.90 | O92: 0.0 | P92: 81.90
C93: 1 | D93: 1 | E93: 1 | F93: 1 | G93: 1 | H93: 1 | I93: 1 | J93: 1 | K93: 1 | L93: 1 | M93: 1 | N93: 1 | P93: 1
A94: Phantom | B94: 2 | C94: 15.90 | D94: 15.80 | E94: 31.70 | F94: 15.80 | G94: 15.90 | H94: 15.80 | I94: 23.75 | J94: 15.40 | K94: 16.00 | L94: 16.00 | M94: 23.70 | N94: 79.15 | O94: 0.0 | P94: 79.15
A95: Regiment | C95: 2 | D95: 2 | E95: 2 | F95: 2 | G95: 2 | H95: 2 | I95: 2 | J95: 2 | K95: 2 | L95: 3 | M95: 2 | N95: 2 | P95: 2
A96: Cavaliers | B96: 1 | C96: 15.40 | D96: 15.20 | E96: 30.60 | F96: 15.50 | G96: 15.50 | H96: 15.40 | I96: 23.20 | J96: 14.90 | K96: 15.40 | L96: 16.40 | M96: 23.35 | N96: 77.15 | O96: 0.0 | P96: 77.15
C97: 3 | D97: 3 | E97: 3 | F97: 3 | G97: 3 | H97: 3 | I97: 3 | J97: 3 | K97: 3 | L97: 2 | M97: 3 | N97: 3 | P97: 3
A98: Colts | B98: 3 | C98: 15.30 | D98: 15.10 | E98: 30.40 | F98: 14.80 | G98: 15.30 | H98: 15.30 | I98: 22.70 | J98: 14.60 | K98: 15.20 | L98: 15.70 | M98: 22.75 | N98: 75.85 | O98: 0.0 | P98: 75.85
C99: 4 | D99: 4 | E99: 4 | F99: 4 | G99: 4 | H99: 4 | I99: 4 | J99: 4 | K99: 4 | L99: 4 | M99: 4 | N99: 4 | P99: 4
A100: Madison | B100: 5 | C100: 14.50 | D100: 14.70 | E100: 29.20 | F100: 14.20 | G100: 14.70 | H100: 14.20 | I100: 21.55 | J100: 14.20 | K100: 14.50 | L100: 14.80 | M100: 21.75 | N100: 72.50 | O100: 0.0 | P100: 72.50
A101: Scouts | C101: 5 | D101: 5 | E101: 5 | F101: 5 | G101: 5 | H101: 5 | I101: 5 | J101: 5 | K101: 5 | L101: 5 | M101: 5 | N101: 5 | P101: 5
A102: DCI Open Class
A103: Colt | B103: 1 | C103: 12.30 | D103: 12.10 | E103: 24.40 | F103: 12.20 | G103: 12.30 | H103: 11.50 | I103: 18.00 | J103: 11.20 | K103: 12.40 | L103: 13.90 | M103: 18.75 | N103: 61.15 | O103: 0.0 | P103: 61.15
A104: Cadets | C104: 1 | D104: 1 | E104: 1 | F104: 1 | G104: 1 | H104: 1 | I104: 1 | J104: 1 | K104: 1 | L104: 1 | M104: 1 | N104: 1 | P104: 1
A105: DCI All Age Open Class
A106: Rogues Hollow | B106: 1 | C106: 15.20 | D106: 14.70 | E106: 29.90 | F106: 14.40 | G106: 15.10 | H106: 14.40 | I106: 21.95 | J106: 14.00 | K106: 14.20 | L106: 13.50 | M106: 20.85 | N106: 72.70 | O106: 0.0 | P106: 72.70
A107: Regiment | C107: 1 | D107: 1 | E107: 1 | F107: 1 | G107: 1 | H107: 1 | I107: 1 | J107: 1 | K107: 1 | L107: 1 | M107: 1 | N107: 1 | P107: 1
A110: 7/6/2024 Seattle, Washington
C111: General Effect | F111: Visual | J111: Music
C112: 1 | D112: 2 | F112: Proficiency | G112: Analysis | H112: Color Guard | J112: Brass | K112: Analysis | L112: Percussion | N112: Sub | P112: Total
C113: P. Madden | D113: P. Furnari | E113: Total | F113: W. Chumley | G113: C. Costanza | H113: B. Brahan | I113: Total ÷2 | J113: N. Jones | K113: B. Fabrizio | L113: J. Webb | M113: Total ÷2 | N113: Total | O113: Pen | P113: Score
A114: DCI World Class | C114: 20 | D114: 20 | E114: 40 | F114: 20 | G114: 20 | H114: 20 | I114: 30 | J114: 20 | K114: 20 | L114: 20 | M114: 30 | N114: 100 | P114: 100
A115: Troopers | B115: 1 | C115: 14.60 | D115: 14.90 | E115: 29.50 | F115: 14.50 | G115: 14.00 | H115: 14.30 | I115: 21.40 | J115: 14.60 | K115: 14.70 | L115: 14.70 | M115: 22.00 | N115: 72.90 | O115: 0.0 | P115: 72.90
C116: 1 | D116: 2 | E116: 1 | F116: 2 | G116: 2 | H116: 2 | I116: 2 | J116: 1 | K116: 1 | L116: 1 | M116: 1 | N116: 1 | P116: 1
A117: Blue | B117: 2 | C117: 14.20 | D117: 15.00 | E117: 29.20 | F117: 15.00 | G117: 14.30 | H117: 14.60 | I117: 21.95 | J117: 14.00 | K117: 14.00 | L117: 14.20 | M117: 21.10 | N117: 72.25 | O117: 0.0 | P117: 72.25
A118: Knights | C118: 2 | D118: 1 | E118: 2 | F118: 1 | G118: 1 | H118: 1 | I118: 1 | J118: 2 | K118: 2 | L118: 2 | M118: 2 | N118: 2 | P118: 2
A119: Seattle | B119: 3 | C119: 12.30 | D119: 12.70 | E119: 25.00 | F119: 12.60 | G119: 11.00 | H119: 11.10 | I119: 17.35 | J119: 12.30 | K119: 12.90 | L119: 13.40 | M119: 19.30 | N119: 61.65 | O119: 0.0 | P119: 61.65
A120: Cascades | C120: 3 | D120: 3 | E120: 3 | F120: 3 | G120: 3 | H120: 3 | I120: 3 | J120: 3 | K120: 3 | L120: 3 | M120: 3 | N120: 3 | P120: 3
A121: DCI Open Class
A122: Columbians | B122: 1 | C122: 13.10 | D122: 13.70 | E122: 26.80 | F122: 12.80 | G122: 12.20 | H122: 13.30 | I122: 19.15 | J122: 11.90 | K122: 13.60 | L122: 12.50 | M122: 19.00 | N122: 64.95 | O122: 0.0 | P122: 64.95
C123: 1 | D123: 1 | E123: 1 | F123: 1 | G123: 1 | H123: 1 | I123: 1 | J123: 1 | K123: 1 | L123: 1 | M123: 1 | N123: 1 | P123: 1
A126: 7/6/2024 Stanford, California--DCI West
C127: General Effect | F127: Visual | J127: Music
C128: 1 | D128: 2 | F128: Proficiency | G128: Analysis | H128: Color Guard | J128: Brass | K128: Analysis | L128: Percussion | N128: Sub | P128: Total
C129: T. Ochran | D129: D. Carbone | E129: Total | F129: C. Moss | G129: G. Oliviero | H129: H. Nguyen | I129: Total ÷2 | J129: S. Page | K129: J. Loyde | L129: A. Kristensen | M129: Total ÷2 | N129: Total | O129: Pen | P129: Score
A130: DCI World Class | C130: 20 | D130: 20 | E130: 40 | F130: 20 | G130: 20 | H130: 20 | I130: 30 | J130: 20 | K130: 20 | L130: 20 | M130: 30 | N130: 100 | P130: 100
A131: Blue | B131: 5 | C131: 16.60 | D131: 16.20 | E131: 32.80 | F131: 16.00 | G131: 16.20 | H131: 15.70 | I131: 23.95 | J131: 16.20 | K131: 16.70 | L131: 16.20 | M131: 24.55 | N131: 81.30 | O131: 0.0 | P131: 81.30
A132: Devils | C132: 1 | D132: 1 | E132: 1 | F132: 1 | G132: 1 | H132: 1 | I132: 1 | J132: 1 | K132: 1 | L132: 1 | M132: 1 | N132: 1 | P132: 1
A133: Mandarins | B133: 4 | C133: 15.60 | D133: 15.20 | E133: 30.80 | F133: 15.00 | G133: 15.20 | H133: 15.10 | I133: 22.65 | J133: 15.60 | K133: 15.80 | L133: 14.90 | M133: 23.15 | N133: 76.60 | O133: 0.0 | P133: 76.60
C134: 2 | D134: 2 | E134: 2 | F134: 2 | G134: 2 | H134: 2 | I134: 2 | J134: 2 | K134: 3 | L134: 3 | M134: 3 | N134: 2 | P134: 2
A135: Vanguard | B135: 1 | C135: 15.10 | D135: 15.10 | E135: 30.20 | F135: 14.70 | G135: 15.10 | H135: 14.60 | I135: 22.20 | J135: 15.40 | K135: 16.00 | L135: 16.00 | M135: 23.70 | N135: 76.10 | O135: 0.0 | P135: 76.10
C136: 3 | D136: 3 | E136: 3 | F136: 3 | G136: 3 | H136: 3 | I136: 3 | J136: 3 | K136: 2 | L136: 2 | M136: 2 | N136: 3 | P136: 3
A137: Pacific | B137: 3 | C137: 14.50 | D137: 13.70 | E137: 28.20 | F137: 14.10 | G137: 13.80 | H137: 13.40 | I137: 20.65 | J137: 14.50 | K137: 14.60 | L137: 14.60 | M137: 21.85 | N137: 70.70 | O137: 0.0 | P137: 70.70
A138: Crest | C138: 4 | D138: 4 | E138: 4 | F138: 4 | G138: 4 | H138: 4 | I138: 4 | J138: 4 | K138: 4 | L138: 4 | M138: 4 | N138: 4 | P138: 4
A139: Academy | B139: 2 | C139: 14.10 | D139: 13.00 | E139: 27.10 | F139: 12.40 | G139: 13.00 | H139: 12.60 | I139: 19.00 | J139: 13.90 | K139: 14.40 | L139: 14.00 | M139: 21.15 | N139: 67.25 | O139: 0.0 | P139: 67.25
C140: 5 | D140: 5 | E140: 5 | F140: 5 | G140: 5 | H140: 5 | I140: 5 | J140: 5 | K140: 5 | L140: 5 | M140: 5 | N140: 5 | P140: 5
A141: DCI Open Class
A142: Blue | B142: 5 | C142: 13.00 | D142: 13.40 | E142: 26.40 | F142: 12.30 | G142: 13.80 | H142: 12.20 | I142: 19.15 | J142: 14.00 | K142: 13.00 | L142: 13.90 | M142: 20.45 | N142: 66.00 | O142: 0.0 | P142: 66.00
A143: Devils B | C143: 1 | D143: 1 | E143: 1 | F143: 1 | G143: 1 | H143: 1 | I143: 1 | J143: 1 | K143: 1 | L143: 1 | M143: 1 | N143: 1 | P143: 1
A144: Gold | B144: 4 | C144: 12.20 | D144: 12.90 | E144: 25.10 | F144: 11.90 | G144: 13.40 | H144: 12.00 | I144: 18.65 | J144: 13.20 | K144: 12.50 | L144: 13.30 | M144: 19.50 | N144: 63.25 | O144: 0.0 | P144: 63.25
C145: 2 | D145: 2 | E145: 2 | F145: 2 | G145: 2 | H145: 2 | I145: 2 | J145: 2 | K145: 2 | L145: 2 | M145: 2 | N145: 2 | P145: 2
A146: Impulse | B146: 1 | C146: 11.60 | D146: 12.30 | E146: 23.90 | F146: 10.90 | G146: 12.50 | H146: 11.20 | I146: 17.30 | J146: 11.60 | K146: 11.10 | L146: 11.70 | M146: 17.20 | N146: 58.40 | O146: 0.0 | P146: 58.40
C147: 3 | D147: 3 | E147: 3 | F147: 5 | G147: 3 | H147: 3 | I147: 3 | J147: 4 | K147: 5 | L147: 3 | M147: 4 | N147: 3 | P147: 3
A148: Golden | B148: 3 | C148: 11.00 | D148: 12.00 | E148: 23.00 | F148: 11.10 | G148: 12.00 | H148: 10.60 | I148: 16.85 | J148: 11.70 | K148: 11.40 | L148: 11.50 | M148: 17.30 | N148: 57.15 | O148: 0.0 | P148: 57.15
A149: Empire | C149: 6 | D149: 4 | E149: 4 | F149: 3 | G149: 4 | H149: 4 | I149: 4 | J149: 3 | K149: 4 | L149: 4 | M149: 3 | N149: 4 | P149: 4
A150: Vessel | B150: 2 | C150: 11.50 | D150: 11.40 | E150: 22.90 | F150: 11.00 | G150: 10.70 | H150: 10.50 | I150: 16.10 | J150: 11.20 | K150: 11.60 | L150: 11.10 | M150: 16.95 | N150: 55.95 | O150: 0.0 | P150: 55.95
C151: 4 | D151: 5 | E151: 5 | F151: 4 | G151: 6 | H151: 5 | I151: 5 | J151: 5 | K151: 3 | L151: 5 | M151: 5 | N151: 5 | P151: 5
A152: Blue | B152: 6 | C152: 11.20 | D152: 10.70 | E152: 21.90 | F152: 10.00 | G152: 11.10 | H152: 9.40 | I152: 15.25 | J152: 10.20 | K152: 10.30 | L152: 9.80 | M152: 15.15 | N152: 52.30 | O152: 0.0 | P152: 52.30
A153: Devils C | C153: 5 | D153: 6 | E153: 6 | F153: 6 | G153: 5 | H153: 6 | I153: 6 | J153: 6 | K153: 6 | L153: 6 | M153: 6 | N153: 6 | P153: 6
A156: 7/7/2024 LaCrosse, Wisconsin
C157: General Effect | F157: Visual | J157: Music
C158: 1 | D158: 2 | F158: Proficiency | G158: Analysis | H158: Color Guard | J158: Brass | K158: Analysis | L158: Percussion | N158: Sub | P158: Total
C159: K. Baker | D159: K. Turner | E159: Total | F159: T. Slaughter | G159: M. Tarr | H159: B. Spidel | I159: Total ÷2 | J159: S. Halquist | K159: B. Williams | L159: C. Poole | M159: Total ÷2 | N159: Total | O159: Pen | P159: Score
A160: DCI World Class | C160: 20 | D160: 20 | E160: 40 | F160: 20 | G160: 20 | H160: 20 | I160: 30 | J160: 20 | K160: 20 | L160: 20 | M160: 30 | N160: 100 | P160: 100
A161: Bluecoats | B161: 4 | C161: 16.60 | D161: 17.30 | E161: 33.90 | F161: 16.40 | G161: 16.50 | H161: 16.50 | I161: 24.70 | J161: 16.50 | K161: 16.50 | L161: 16.60 | M161: 24.80 | N161: 83.40 | O161: 0.0 | P161: 83.40
C162: 1 | D162: 1 | E162: 1 | F162: 1 | G162: 1 | H162: 1 | I162: 1 | J162: 1 | K162: 1 | L162: 1 | M162: 1 | N162: 1 | P162: 1
A163: Phantom | B163: 2 | C163: 15.80 | D163: 16.90 | E163: 32.70 | F163: 16.00 | G163: 16.10 | H163: 16.10 | I163: 24.10 | J163: 15.60 | K163: 16.10 | L163: 16.00 | M163: 23.85 | N163: 80.65 | O163: 0.0 | P163: 80.65
A164: Regiment | C164: 2 | D164: 2 | E164: 2 | F164: 2 | G164: 2 | H164: 2 | I164: 2 | J164: 2 | K164: 2 | L164: 2 | M164: 2 | N164: 2 | P164: 2
A165: Colts | B165: 3 | C165: 15.00 | D165: 16.00 | E165: 31.00 | F165: 14.80 | G165: 15.60 | H165: 15.20 | I165: 22.80 | J165: 14.70 | K165: 15.40 | L165: 15.60 | M165: 22.85 | N165: 76.65 | O165: 0.0 | P165: 76.65
C166: 3 | D166: 3 | E166: 3 | F166: 4 | G166: 3 | H166: 4 | I166: 4 | J166: 4 | K166: 3 | L166: 3 | M166: 3 | N166: 3 | P166: 3
A167: Blue | B167: 5 | C167: 14.70 | D167: 15.20 | E167: 29.90 | F167: 15.10 | G167: 15.30 | H167: 15.30 | I167: 22.85 | J167: 15.30 | K167: 15.00 | L167: 15.30 | M167: 22.80 | N167: 75.55 | O167: 0.0 | P167: 75.55
A168: Stars | C168: 5 | D168: 4 | E168: 4 | F168: 3 | G168: 4 | H168: 3 | I168: 3 | J168: 3 | K168: 4 | L168: 4 | M168: 4 | N168: 4 | P168: 4
A169: Madison | B169: 1 | C169: 14.80 | D169: 14.70 | E169: 29.50 | F169: 14.50 | G169: 14.80 | H169: 14.50 | I169: 21.90 | J169: 14.30 | K169: 14.70 | L169: 14.50 | M169: 21.75 | N169: 73.15 | O169: 0.0 | P169: 73.15
A170: Scouts | C170: 4 | D170: 5 | E170: 5 | F170: 5 | G170: 5 | H170: 5 | I170: 5 | J170: 5 | K170: 5 | L170: 5 | M170: 5 | N170: 5 | P170: 5
A171: DCI Open Class
A172: River City | B172: 1 | C172: 12.40 | D172: 12.20 | E172: 24.60 | F172: 13.10 | G172: 12.50 | H172: 11.90 | I172: 18.75 | J172: 12.40 | K172: 12.80 | L172: 12.30 | M172: 18.75 | N172: 62.10 | O172: 0.0 | P172: 62.10
A173: Rhythm | C173: 1 | D173: 1 | E173: 1 | F173: 1 | G173: 1 | H173: 1 | I173: 1 | J173: 1 | K173: 1 | L173: 1 | M173: 1 | N173: 1 | P173: 1
A176: 7/7/2024 Sacramento, California
C177: General Effect | F177: Visual | J177: Music
C178: 1 | D178: 2 | F178: Proficiency | G178: Analysis | H178: Color Guard | J178: Brass | K178: Analysis | L178: Percussion | N178: Sub | P178: Total
C179: G. Oliviero | D179: S. Page | E179: Total | F179: H. Nguyen | G179: T. Ochran | H179: C. Moss | I179: Total ÷2 | J179: B. Huneycutt | K179: D. Carbone | L179: J. Wilson | M179: Total ÷2 | N179: Total | O179: Pen | P179: Score
A180: DCI World Class | C180: 20 | D180: 20 | E180: 40 | F180: 20 | G180: 20 | H180: 20 | I180: 30 | J180: 20 | K180: 20 | L180: 20 | M180: 30 | N180: 100 | P180: 100
A181: Blue | B181: 4 | C181: 16.50 | D181: 16.40 | E181: 32.90 | F181: 16.20 | G181: 16.80 | H181: 16.00 | I181: 24.50 | J181: 16.50 | K181: 16.40 | L181: 16.40 | M181: 24.65 | N181: 82.05 | O181: 0.0 | P181: 82.05
A182: Devils | C182: =RANK(C181,(C$6,C$8,C$10,C$12,C$14,C$17,C$19,C$21,C$23,C$25,C$27,C$29,C$31,C$33,C$35,C$37,C$39,C$41,C$43,C$45,C$47,C$49,C$51,C$53,C$55,C$57,C$59,C$61,C$63,C$65,C$67,C$69,C$71,C$73,C$75,C$77,C$79,C$81,C$83,C$85,C$87,C$89,C$91,C$93,C$95,C$97,C$99,C$101,C$103,C$105,C$107,C$109,C$111,C$113,C$115,C$117,C$119,C$121,C$123,C$125)) -> 1 | D182: =RANK(D181,(D$6,D$8,D$10,D$12,D$14,D$17,D$19,D$21,D$23,D$25,D$27,D$29,D$31,D$33,D$35,D$37,D$39,D$41,D$43,D$45,D$47,D$49,D$51,D$53,D$55,D$57,D$59,D$61,D$63,D$65,D$67,D$69,D$71,D$73,D$75,D$77,D$79,D$81,D$83,D$85,D$87,D$89,D$91,D$93,D$95,D$97,D$99,D$101,D$103,D$105,D$107,D$109,D$111,D$113,D$115,D$117,D$119,D$121,D$123,D$125)) -> 1 | E182: =RANK(E181,(E$6,E$8,E$10,E$12,E$14,E$17,E$19,E$21,E$23,E$25,E$27,E$29,E$31,E$33,E$35,E$37,E$39,E$41,E$43,E$45,E$47,E$49,E$51,E$53,E$55,E$57,E$59,E$61,E$63,E$65,E$67,E$69,E$71,E$73,E$75,E$77,E$79,E$81,E$83,E$85,E$87,E$89,E$91,E$93,E$95,E$97,E$99,E$101,E$103,E$105,E$107,E$109,E$111,E$113,E$115,E$117,E$119,E$121,E$123,E$125)) -> 1 | F182: =RANK(F181,(F$6,F$8,F$10,F$12,F$14,F$17,F$19,F$21,F$23,F$25,F$27,F$29,F$31,F$33,F$35,F$37,F$39,F$41,F$43,F$45,F$47,F$49,F$51,F$53,F$55,F$57,F$59,F$61,F$63,F$65,F$67,F$69,F$71,F$73,F$75,F$77,F$79,F$81,F$83,F$85,F$87,F$89,F$91,F$93,F$95,F$97,F$99,F$101,F$103,F$105,F$107,F$109,F$111,F$113,F$115,F$117,F$119,F$121,F$123,F$125)) -> 1 | G182: =RANK(G181,(G$6,G$8,G$10,G$12,G$14,G$17,G$19,G$21,G$23,G$25,G$27,G$29,G$31,G$33,G$35,G$37,G$39,G$41,G$43,G$45,G$47,G$49,G$51,G$53,G$55,G$57,G$59,G$61,G$63,G$65,G$67,G$69,G$71,G$73,G$75,G$77,G$79,G$81,G$83,G$85,G$87,G$89,G$91,G$93,G$95,G$97,G$99,G$101,G$103,G$105,G$107,G$109,G$111,G$113,G$115,G$117,G$119,G$121,G$123,G$125)) -> 1 | H182: =RANK(H181,(H$6,H$8,H$10,H$12,H$14,H$17,H$19,H$21,H$23,H$25,H$27,H$29,H$31,H$33,H$35,H$37,H$39,H$41,H$43,H$45,H$47,H$49,H$51,H$53,H$55,H$57,H$59,H$61,H$63,H$65,H$67,H$69,H$71,H$73,H$75,H$77,H$79,H$81,H$83,H$85,H$87,H$89,H$91,H$93,H$95,H$97,H$99,H$101,H$103,H$105,H$107,H$109,H$111,H$113,H$115,H$117,H$119,H$121,H$123,H$125)) -> 1 | I182: =RANK(I181,(I$6,I$8,I$10,I$12,I$14,I$17,I$19,I$21,I$23,I$25,I$27,I$29,I$31,I$33,I$35,I$37,I$39,I$41,I$43,I$45,I$47,I$49,I$51,I$53,I$55,I$57,I$59,I$61,I$63,I$65,I$67,I$69,I$71,I$73,I$75,I$77,I$79,I$81,I$83,I$85,I$87,I$89,I$91,I$93,I$95,I$97,I$99,I$101,I$103,I$105,I$107,I$109,I$111,I$113,I$115,I$117,I$119,I$121,I$123,I$125)) -> 1 | J182: =RANK(J181,(J$6,J$8,J$10,J$12,J$14,J$17,J$19,J$21,J$23,J$25,J$27,J$29,J$31,J$33,J$35,J$37,J$39,J$41,J$43,J$45,J$47,J$49,J$51,J$53,J$55,J$57,J$59,J$61,J$63,J$65,J$67,J$69,J$71,J$73,J$75,J$77,J$79,J$81,J$83,J$85,J$87,J$89,J$91,J$93,J$95,J$97,J$99,J$101,J$103,J$105,J$107,J$109,J$111,J$113,J$115,J$117,J$119,J$121,J$123,J$125)) -> 1 | K182: =RANK(K181,(K$6,K$8,K$10,K$12,K$14,K$17,K$19,K$21,K$23,K$25,K$27,K$29,K$31,K$33,K$35,K$37,K$39,K$41,K$43,K$45,K$47,K$49,K$51,K$53,K$55,K$57,K$59,K$61,K$63,K$65,K$67,K$69,K$71,K$73,K$75,K$77,K$79,K$81,K$83,K$85,K$87,K$89,K$91,K$93,K$95,K$97,K$99,K$101,K$103,K$105,K$107,K$109,K$111,K$113,K$115,K$117,K$119,K$121,K$123,K$125)) -> 1 | L182: =RANK(L181,(L$6,L$8,L$10,L$12,L$14,L$17,L$19,L$21,L$23,L$25,L$27,L$29,L$31,L$33,L$35,L$37,L$39,L$41,L$43,L$45,L$47,L$49,L$51,L$53,L$55,L$57,L$59,L$61,L$63,L$65,L$67,L$69,L$71,L$73,L$75,L$77,L$79,L$81,L$83,L$85,L$87,L$89,L$91,L$93,L$95,L$97,L$99,L$101,L$103,L$105,L$107,L$109,L$111,L$113,L$115,L$117,L$119,L$121,L$123,L$125)) -> 1 | M182: =RANK(M181,(M$6,M$8,M$10,M$12,M$14,M$17,M$19,M$21,M$23,M$25,M$27,M$29,M$31,M$33,M$35,M$37,M$39,M$41,M$43,M$45,M$47,M$49,M$51,M$53,M$55,M$57,M$59,M$61,M$63,M$65,M$67,M$69,M$71,M$73,M$75,M$77,M$79,M$81,M$83,M$85,M$87,M$89,M$91,M$93,M$95,M$97,M$99,M$101,M$103,M$105,M$107,M$109,M$111,M$113,M$115,M$117,M$119,M$121,M$123,M$125)) -> 1 | N182: =RANK(N181,(N$6,N$8,N$10,N$12,N$14,N$17,N$19,N$21,N$23,N$25,N$27,N$29,N$31,N$33,N$35,N$37,N$39,N$41,N$43,N$45,N$47,N$49,N$51,N$53,N$55,N$57,N$59,N$61,N$63,N$65,N$67,N$69,N$71,N$73,N$75,N$77,N$79,N$81,N$83,N$85,N$87,N$89,N$91,N$93,N$95,N$97,N$99,N$101,N$103,N$105,N$107,N$109,N$111,N$113,N$115,N$117,N$119,N$121,N$123,N$125)) -> 1 | P182: =RANK(P181,(P$6,P$8,P$10,P$12,P$14,P$17,P$19,P$21,P$23,P$25,P$27,P$29,P$31,P$33,P$35,P$37,P$39,P$41,P$43,P$45,P$47,P$49,P$51,P$53,P$55,P$57,P$59,P$61,P$63,P$65,P$67,P$69,P$71,P$73,P$75,P$77,P$79,P$81,P$83,P$85,P$87,P$89,P$91,P$93,P$95,P$97,P$99,P$101,P$103,P$105,P$107,P$109,P$111,P$113,P$115,P$117,P$119,P$121,P$123,P$125)) -> 1
A183: Mandarins | B183: 5 | C183: 16.10 | D183: 16.00 | E183: 32.10 | F183: 15.40 | G183: 15.80 | H183: 15.00 | I183: 23.10 | J183: 15.90 | K183: 15.50 | L183: 15.00 | M183: 23.20 | N183: 78.40 | O183: 0.0 | P183: 78.40
C184: =RANK(C183,(C$6,C$8,C$10,C$12,C$14,C$17,C$19,C$21,C$23,C$25,C$27,C$29,C$31,C$33,C$35,C$37,C$39,C$41,C$43,C$45,C$47,C$49,C$51,C$53,C$55,C$57,C$59,C$61,C$63,C$65,C$67,C$69,C$71,C$73,C$75,C$77,C$79,C$81,C$83,C$85,C$87,C$89,C$91,C$93,C$95,C$97,C$99,C$101,C$103,C$105,C$107,C$109,C$111,C$113,C$115,C$117,C$119,C$121,C$123,C$125)) -> 2 | D184: =RANK(D183,(D$6,D$8,D$10,D$12,D$14,D$17,D$19,D$21,D$23,D$25,D$27,D$29,D$31,D$33,D$35,D$37,D$39,D$41,D$43,D$45,D$47,D$49,D$51,D$53,D$55,D$57,D$59,D$61,D$63,D$65,D$67,D$69,D$71,D$73,D$75,D$77,D$79,D$81,D$83,D$85,D$87,D$89,D$91,D$93,D$95,D$97,D$99,D$101,D$103,D$105,D$107,D$109,D$111,D$113,D$115,D$117,D$119,D$121,D$123,D$125)) -> 2 | E184: =RANK(E183,(E$6,E$8,E$10,E$12,E$14,E$17,E$19,E$21,E$23,E$25,E$27,E$29,E$31,E$33,E$35,E$37,E$39,E$41,E$43,E$45,E$47,E$49,E$51,E$53,E$55,E$57,E$59,E$61,E$63,E$65,E$67,E$69,E$71,E$73,E$75,E$77,E$79,E$81,E$83,E$85,E$87,E$89,E$91,E$93,E$95,E$97,E$99,E$101,E$103,E$105,E$107,E$109,E$111,E$113,E$115,E$117,E$119,E$121,E$123,E$125)) -> 2 | F184: =RANK(F183,(F$6,F$8,F$10,F$12,F$14,F$17,F$19,F$21,F$23,F$25,F$27,F$29,F$31,F$33,F$35,F$37,F$39,F$41,F$43,F$45,F$47,F$49,F$51,F$53,F$55,F$57,F$59,F$61,F$63,F$65,F$67,F$69,F$71,F$73,F$75,F$77,F$79,F$81,F$83,F$85,F$87,F$89,F$91,F$93,F$95,F$97,F$99,F$101,F$103,F$105,F$107,F$109,F$111,F$113,F$115,F$117,F$119,F$121,F$123,F$125)) -> 3 | G184: =RANK(G183,(G$6,G$8,G$10,G$12,G$14,G$17,G$19,G$21,G$23,G$25,G$27,G$29,G$31,G$33,G$35,G$37,G$39,G$41,G$43,G$45,G$47,G$49,G$51,G$53,G$55,G$57,G$59,G$61,G$63,G$65,G$67,G$69,G$71,G$73,G$75,G$77,G$79,G$81,G$83,G$85,G$87,G$89,G$91,G$93,G$95,G$97,G$99,G$101,G$103,G$105,G$107,G$109,G$111,G$113,G$115,G$117,G$119,G$121,G$123,G$125)) -> 2 | H184: =RANK(H183,(H$6,H$8,H$10,H$12,H$14,H$17,H$19,H$21,H$23,H$25,H$27,H$29,H$31,H$33,H$35,H$37,H$39,H$41,H$43,H$45,H$47,H$49,H$51,H$53,H$55,H$57,H$59,H$61,H$63,H$65,H$67,H$69,H$71,H$73,H$75,H$77,H$79,H$81,H$83,H$85,H$87,H$89,H$91,H$93,H$95,H$97,H$99,H$101,H$103,H$105,H$107,H$109,H$111,H$113,H$115,H$117,H$119,H$121,H$123,H$125)) -> 2 | I184: =RANK(I183,(I$6,I$8,I$10,I$12,I$14,I$17,I$19,I$21,I$23,I$25,I$27,I$29,I$31,I$33,I$35,I$37,I$39,I$41,I$43,I$45,I$47,I$49,I$51,I$53,I$55,I$57,I$59,I$61,I$63,I$65,I$67,I$69,I$71,I$73,I$75,I$77,I$79,I$81,I$83,I$85,I$87,I$89,I$91,I$93,I$95,I$97,I$99,I$101,I$103,I$105,I$107,I$109,I$111,I$113,I$115,I$117,I$119,I$121,I$123,I$125)) -> 2 | J184: =RANK(J183,(J$6,J$8,J$10,J$12,J$14,J$17,J$19,J$21,J$23,J$25,J$27,J$29,J$31,J$33,J$35,J$37,J$39,J$41,J$43,J$45,J$47,J$49,J$51,J$53,J$55,J$57,J$59,J$61,J$63,J$65,J$67,J$69,J$71,J$73,J$75,J$77,J$79,J$81,J$83,J$85,J$87,J$89,J$91,J$93,J$95,J$97,J$99,J$101,J$103,J$105,J$107,J$109,J$111,J$113,J$115,J$117,J$119,J$121,J$123,J$125)) -> 2 | K184: =RANK(K183,(K$6,K$8,K$10,K$12,K$14,K$17,K$19,K$21,K$23,K$25,K$27,K$29,K$31,K$33,K$35,K$37,K$39,K$41,K$43,K$45,K$47,K$49,K$51,K$53,K$55,K$57,K$59,K$61,K$63,K$65,K$67,K$69,K$71,K$73,K$75,K$77,K$79,K$81,K$83,K$85,K$87,K$89,K$91,K$93,K$95,K$97,K$99,K$101,K$103,K$105,K$107,K$109,K$111,K$113,K$115,K$117,K$119,K$121,K$123,K$125)) -> 2 | L184: =RANK(L183,(L$6,L$8,L$10,L$12,L$14,L$17,L$19,L$21,L$23,L$25,L$27,L$29,L$31,L$33,L$35,L$37,L$39,L$41,L$43,L$45,L$47,L$49,L$51,L$53,L$55,L$57,L$59,L$61,L$63,L$65,L$67,L$69,L$71,L$73,L$75,L$77,L$79,L$81,L$83,L$85,L$87,L$89,L$91,L$93,L$95,L$97,L$99,L$101,L$103,L$105,L$107,L$109,L$111,L$113,L$115,L$117,L$119,L$121,L$123,L$125)) -> 3 | M184: =RANK(M183,(M$6,M$8,M$10,M$12,M$14,M$17,M$19,M$21,M$23,M$25,M$27,M$29,M$31,M$33,M$35,M$37,M$39,M$41,M$43,M$45,M$47,M$49,M$51,M$53,M$55,M$57,M$59,M$61,M$63,M$65,M$67,M$69,M$71,M$73,M$75,M$77,M$79,M$81,M$83,M$85,M$87,M$89,M$91,M$93,M$95,M$97,M$99,M$101,M$103,M$105,M$107,M$109,M$111,M$113,M$115,M$117,M$119,M$121,M$123,M$125)) -> 3 | N184: =RANK(N183,(N$6,N$8,N$10,N$12,N$14,N$17,N$19,N$21,N$23,N$25,N$27,N$29,N$31,N$33,N$35,N$37,N$39,N$41,N$43,N$45,N$47,N$49,N$51,N$53,N$55,N$57,N$59,N$61,N$63,N$65,N$67,N$69,N$71,N$73,N$75,N$77,N$79,N$81,N$83,N$85,N$87,N$89,N$91,N$93,N$95,N$97,N$99,N$101,N$103,N$105,N$107,N$109,N$111,N$113,N$115,N$117,N$119,N$121,N$123,N$125)) -> 2 | P184: =RANK(P183,(P$6,P$8,P$10,P$12,P$14,P$17,P$19,P$21,P$23,P$25,P$27,P$29,P$31,P$33,P$35,P$37,P$39,P$41,P$43,P$45,P$47,P$49,P$51,P$53,P$55,P$57,P$59,P$61,P$63,P$65,P$67,P$69,P$71,P$73,P$75,P$77,P$79,P$81,P$83,P$85,P$87,P$89,P$91,P$93,P$95,P$97,P$99,P$101,P$103,P$105,P$107,P$109,P$111,P$113,P$115,P$117,P$119,P$121,P$123,P$125)) -> 2
A185: Vanguard | B185: 1 | C185: 15.40 | D185: 15.80 | E185: 31.20 | F185: 15.60 | G185: 15.40 | H185: 14.50 | I185: 22.75 | J185: 15.70 | K185: 15.30 | L185: 16.10 | M185: 23.55 | N185: 77.50 | O185: 0.0 | P185: 77.50
C186: =RANK(C185,(C$6,C$8,C$10,C$12,C$14,C$17,C$19,C$21,C$23,C$25,C$27,C$29,C$31,C$33,C$35,C$37,C$39,C$41,C$43,C$45,C$47,C$49,C$51,C$53,C$55,C$57,C$59,C$61,C$63,C$65,C$67,C$69,C$71,C$73,C$75,C$77,C$79,C$81,C$83,C$85,C$87,C$89,C$91,C$93,C$95,C$97,C$99,C$101,C$103,C$105,C$107,C$109,C$111,C$113,C$115,C$117,C$119,C$121,C$123,C$125)) -> 3 | D186: =RANK(D185,(D$6,D$8,D$10,D$12,D$14,D$17,D$19,D$21,D$23,D$25,D$27,D$29,D$31,D$33,D$35,D$37,D$39,D$41,D$43,D$45,D$47,D$49,D$51,D$53,D$55,D$57,D$59,D$61,D$63,D$65,D$67,D$69,D$71,D$73,D$75,D$77,D$79,D$81,D$83,D$85,D$87,D$89,D$91,D$93,D$95,D$97,D$99,D$101,D$103,D$105,D$107,D$109,D$111,D$113,D$115,D$117,D$119,D$121,D$123,D$125)) -> 3 | E186: =RANK(E185,(E$6,E$8,E$10,E$12,E$14,E$17,E$19,E$21,E$23,E$25,E$27,E$29,E$31,E$33,E$35,E$37,E$39,E$41,E$43,E$45,E$47,E$49,E$51,E$53,E$55,E$57,E$59,E$61,E$63,E$65,E$67,E$69,E$71,E$73,E$75,E$77,E$79,E$81,E$83,E$85,E$87,E$89,E$91,E$93,E$95,E$97,E$99,E$101,E$103,E$105,E$107,E$109,E$111,E$113,E$115,E$117,E$119,E$121,E$123,E$125)) -> 3 | F186: =RANK(F185,(F$6,F$8,F$10,F$12,F$14,F$17,F$19,F$21,F$23,F$25,F$27,F$29,F$31,F$33,F$35,F$37,F$39,F$41,F$43,F$45,F$47,F$49,F$51,F$53,F$55,F$57,F$59,F$61,F$63,F$65,F$67,F$69,F$71,F$73,F$75,F$77,F$79,F$81,F$83,F$85,F$87,F$89,F$91,F$93,F$95,F$97,F$99,F$101,F$103,F$105,F$107,F$109,F$111,F$113,F$115,F$117,F$119,F$121,F$123,F$125)) -> 2 | G186: =RANK(G185,(G$6,G$8,G$10,G$12,G$14,G$17,G$19,G$21,G$23,G$25,G$27,G$29,G$31,G$33,G$35,G$37,G$39,G$41,G$43,G$45,G$47,G$49,G$51,G$53,G$55,G$57,G$59,G$61,G$63,G$65,G$67,G$69,G$71,G$73,G$75,G$77,G$79,G$81,G$83,G$85,G$87,G$89,G$91,G$93,G$95,G$97,G$99,G$101,G$103,G$105,G$107,G$109,G$111,G$113,G$115,G$117,G$119,G$121,G$123,G$125)) -> 3 | H186: =RANK(H185,(H$6,H$8,H$10,H$12,H$14,H$17,H$19,H$21,H$23,H$25,H$27,H$29,H$31,H$33,H$35,H$37,H$39,H$41,H$43,H$45,H$47,H$49,H$51,H$53,H$55,H$57,H$59,H$61,H$63,H$65,H$67,H$69,H$71,H$73,H$75,H$77,H$79,H$81,H$83,H$85,H$87,H$89,H$91,H$93,H$95,H$97,H$99,H$101,H$103,H$105,H$107,H$109,H$111,H$113,H$115,H$117,H$119,H$121,H$123,H$125)) -> 3 | I186: =RANK(I185,(I$6,I$8,I$10,I$12,I$14,I$17,I$19,I$21,I$23,I$25,I$27,I$29,I$31,I$33,I$35,I$37,I$39,I$41,I$43,I$45,I$47,I$49,I$51,I$53,I$55,I$57,I$59,I$61,I$63,I$65,I$67,I$69,I$71,I$73,I$75,I$77,I$79,I$81,I$83,I$85,I$87,I$89,I$91,I$93,I$95,I$97,I$99,I$101,I$103,I$105,I$107,I$109,I$111,I$113,I$115,I$117,I$119,I$121,I$123,I$125)) -> 3 | J186: =RANK(J185,(J$6,J$8,J$10,J$12,J$14,J$17,J$19,J$21,J$23,J$25,J$27,J$29,J$31,J$33,J$35,J$37,J$39,J$41,J$43,J$45,J$47,J$49,J$51,J$53,J$55,J$57,J$59,J$61,J$63,J$65,J$67,J$69,J$71,J$73,J$75,J$77,J$79,J$81,J$83,J$85,J$87,J$89,J$91,J$93,J$95,J$97,J$99,J$101,J$103,J$105,J$107,J$109,J$111,J$113,J$115,J$117,J$119,J$121,J$123,J$125)) -> 3 | K186: =RANK(K185,(K$6,K$8,K$10,K$12,K$14,K$17,K$19,K$21,K$23,K$25,K$27,K$29,K$31,K$33,K$35,K$37,K$39,K$41,K$43,K$45,K$47,K$49,K$51,K$53,K$55,K$57,K$59,K$61,K$63,K$65,K$67,K$69,K$71,K$73,K$75,K$77,K$79,K$81,K$83,K$85,K$87,K$89,K$91,K$93,K$95,K$97,K$99,K$101,K$103,K$105,K$107,K$109,K$111,K$113,K$115,K$117,K$119,K$121,K$123,K$125)) -> 3 | L186: =RANK(L185,(L$6,L$8,L$10,L$12,L$14,L$17,L$19,L$21,L$23,L$25,L$27,L$29,L$31,L$33,L$35,L$37,L$39,L$41,L$43,L$45,L$47,L$49,L$51,L$53,L$55,L$57,L$59,L$61,L$63,L$65,L$67,L$69,L$71,L$73,L$75,L$77,L$79,L$81,L$83,L$85,L$87,L$89,L$91,L$93,L$95,L$97,L$99,L$101,L$103,L$105,L$107,L$109,L$111,L$113,L$115,L$117,L$119,L$121,L$123,L$125)) -> 2 | M186: =RANK(M185,(M$6,M$8,M$10,M$12,M$14,M$17,M$19,M$21,M$23,M$25,M$27,M$29,M$31,M$33,M$35,M$37,M$39,M$41,M$43,M$45,M$47,M$49,M$51,M$53,M$55,M$57,M$59,M$61,M$63,M$65,M$67,M$69,M$71,M$73,M$75,M$77,M$79,M$81,M$83,M$85,M$87,M$89,M$91,M$93,M$95,M$97,M$99,M$101,M$103,M$105,M$107,M$109,M$111,M$113,M$115,M$117,M$119,M$121,M$123,M$125)) -> 2 | N186: =RANK(N185,(N$6,N$8,N$10,N$12,N$14,N$17,N$19,N$21,N$23,N$25,N$27,N$29,N$31,N$33,N$35,N$37,N$39,N$41,N$43,N$45,N$47,N$49,N$51,N$53,N$55,N$57,N$59,N$61,N$63,N$65,N$67,N$69,N$71,N$73,N$75,N$77,N$79,N$81,N$83,N$85,N$87,N$89,N$91,N$93,N$95,N$97,N$99,N$101,N$103,N$105,N$107,N$109,N$111,N$113,N$115,N$117,N$119,N$121,N$123,N$125)) -> 3 | P186: =RANK(P185,(P$6,P$8,P$10,P$12,P$14,P$17,P$19,P$21,P$23,P$25,P$27,P$29,P$31,P$33,P$35,P$37,P$39,P$41,P$43,P$45,P$47,P$49,P$51,P$53,P$55,P$57,P$59,P$61,P$63,P$65,P$67,P$69,P$71,P$73,P$75,P$77,P$79,P$81,P$83,P$85,P$87,P$89,P$91,P$93,P$95,P$97,P$99,P$101,P$103,P$105,P$107,P$109,P$111,P$113,P$115,P$117,P$119,P$121,P$123,P$125)) -> 3
A187: Pacific | B187: 2 | C187: 13.90 | D187: 14.80 | E187: 28.70 | F187: 13.30 | G187: 14.80 | H187: 13.20 | I187: 20.65 | J187: 14.70 | K187: 14.00 | L187: 14.70 | M187: 21.70 | N187: 71.05 | O187: 0.0 | P187: 71.05
A188: Crest | C188: =RANK(C187,(C$6,C$8,C$10,C$12,C$14,C$17,C$19,C$21,C$23,C$25,C$27,C$29,C$31,C$33,C$35,C$37,C$39,C$41,C$43,C$45,C$47,C$49,C$51,C$53,C$55,C$57,C$59,C$61,C$63,C$65,C$67,C$69,C$71,C$73,C$75,C$77,C$79,C$81,C$83,C$85,C$87,C$89,C$91,C$93,C$95,C$97,C$99,C$101,C$103,C$105,C$107,C$109,C$111,C$113,C$115,C$117,C$119,C$121,C$123,C$125)) -> 5 | D188: =RANK(D187,(D$6,D$8,D$10,D$12,D$14,D$17,D$19,D$21,D$23,D$25,D$27,D$29,D$31,D$33,D$35,D$37,D$39,D$41,D$43,D$45,D$47,D$49,D$51,D$53,D$55,D$57,D$59,D$61,D$63,D$65,D$67,D$69,D$71,D$73,D$75,D$77,D$79,D$81,D$83,D$85,D$87,D$89,D$91,D$93,D$95,D$97,D$99,D$101,D$103,D$105,D$107,D$109,D$111,D$113,D$115,D$117,D$119,D$121,D$123,D$125)) -> 4 | E188: =RANK(E187,(E$6,E$8,E$10,E$12,E$14,E$17,E$19,E$21,E$23,E$25,E$27,E$29,E$31,E$33,E$35,E$37,E$39,E$41,E$43,E$45,E$47,E$49,E$51,E$53,E$55,E$57,E$59,E$61,E$63,E$65,E$67,E$69,E$71,E$73,E$75,E$77,E$79,E$81,E$83,E$85,E$87,E$89,E$91,E$93,E$95,E$97,E$99,E$101,E$103,E$105,E$107,E$109,E$111,E$113,E$115,E$117,E$119,E$121,E$123,E$125)) -> 4 | F188: =RANK(F187,(F$6,F$8,F$10,F$12,F$14,F$17,F$19,F$21,F$23,F$25,F$27,F$29,F$31,F$33,F$35,F$37,F$39,F$41,F$43,F$45,F$47,F$49,F$51,F$53,F$55,F$57,F$59,F$61,F$63,F$65,F$67,F$69,F$71,F$73,F$75,F$77,F$79,F$81,F$83,F$85,F$87,F$89,F$91,F$93,F$95,F$97,F$99,F$101,F$103,F$105,F$107,F$109,F$111,F$113,F$115,F$117,F$119,F$121,F$123,F$125)) -> 4 | G188: =RANK(G187,(G$6,G$8,G$10,G$12,G$14,G$17,G$19,G$21,G$23,G$25,G$27,G$29,G$31,G$33,G$35,G$37,G$39,G$41,G$43,G$45,G$47,G$49,G$51,G$53,G$55,G$57,G$59,G$61,G$63,G$65,G$67,G$69,G$71,G$73,G$75,G$77,G$79,G$81,G$83,G$85,G$87,G$89,G$91,G$93,G$95,G$97,G$99,G$101,G$103,G$105,G$107,G$109,G$111,G$113,G$115,G$117,G$119,G$121,G$123,G$125)) -> 4 | H188: =RANK(H187,(H$6,H$8,H$10,H$12,H$14,H$17,H$19,H$21,H$23,H$25,H$27,H$29,H$31,H$33,H$35,H$37,H$39,H$41,H$43,H$45,H$47,H$49,H$51,H$53,H$55,H$57,H$59,H$61,H$63,H$65,H$67,H$69,H$71,H$73,H$75,H$77,H$79,H$81,H$83,H$85,H$87,H$89,H$91,H$93,H$95,H$97,H$99,H$101,H$103,H$105,H$107,H$109,H$111,H$113,H$115,H$117,H$119,H$121,H$123,H$125)) -> 4 | I188: =RANK(I187,(I$6,I$8,I$10,I$12,I$14,I$17,I$19,I$21,I$23,I$25,I$27,I$29,I$31,I$33,I$35,I$37,I$39,I$41,I$43,I$45,I$47,I$49,I$51,I$53,I$55,I$57,I$59,I$61,I$63,I$65,I$67,I$69,I$71,I$73,I$75,I$77,I$79,I$81,I$83,I$85,I$87,I$89,I$91,I$93,I$95,I$97,I$99,I$101,I$103,I$105,I$107,I$109,I$111,I$113,I$115,I$117,I$119,I$121,I$123,I$125)) -> 4 | J188: =RANK(J187,(J$6,J$8,J$10,J$12,J$14,J$17,J$19,J$21,J$23,J$25,J$27,J$29,J$31,J$33,J$35,J$37,J$39,J$41,J$43,J$45,J$47,J$49,J$51,J$53,J$55,J$57,J$59,J$61,J$63,J$65,J$67,J$69,J$71,J$73,J$75,J$77,J$79,J$81,J$83,J$85,J$87,J$89,J$91,J$93,J$95,J$97,J$99,J$101,J$103,J$105,J$107,J$109,J$111,J$113,J$115,J$117,J$119,J$121,J$123,J$125)) -> 4 | K188: =RANK(K187,(K$6,K$8,K$10,K$12,K$14,K$17,K$19,K$21,K$23,K$25,K$27,K$29,K$31,K$33,K$35,K$37,K$39,K$41,K$43,K$45,K$47,K$49,K$51,K$53,K$55,K$57,K$59,K$61,K$63,K$65,K$67,K$69,K$71,K$73,K$75,K$77,K$79,K$81,K$83,K$85,K$87,K$89,K$91,K$93,K$95,K$97,K$99,K$101,K$103,K$105,K$107,K$109,K$111,K$113,K$115,K$117,K$119,K$121,K$123,K$125)) -> 4 | L188: =RANK(L187,(L$6,L$8,L$10,L$12,L$14,L$17,L$19,L$21,L$23,L$25,L$27,L$29,L$31,L$33,L$35,L$37,L$39,L$41,L$43,L$45,L$47,L$49,L$51,L$53,L$55,L$57,L$59,L$61,L$63,L$65,L$67,L$69,L$71,L$73,L$75,L$77,L$79,L$81,L$83,L$85,L$87,L$89,L$91,L$93,L$95,L$97,L$99,L$101,L$103,L$105,L$107,L$109,L$111,L$113,L$115,L$117,L$119,L$121,L$123,L$125)) -> 4 | M188: =RANK(M187,(M$6,M$8,M$10,M$12,M$14,M$17,M$19,M$21,M$23,M$25,M$27,M$29,M$31,M$33,M$35,M$37,M$39,M$41,M$43,M$45,M$47,M$49,M$51,M$53,M$55,M$57,M$59,M$61,M$63,M$65,M$67,M$69,M$71,M$73,M$75,M$77,M$79,M$81,M$83,M$85,M$87,M$89,M$91,M$93,M$95,M$97,M$99,M$101,M$103,M$105,M$107,M$109,M$111,M$113,M$115,M$117,M$119,M$121,M$123,M$125)) -> 4 | N188: =RANK(N187,(N$6,N$8,N$10,N$12,N$14,N$17,N$19,N$21,N$23,N$25,N$27,N$29,N$31,N$33,N$35,N$37,N$39,N$41,N$43,N$45,N$47,N$49,N$51,N$53,N$55,N$57,N$59,N$61,N$63,N$65,N$67,N$69,N$71,N$73,N$75,N$77,N$79,N$81,N$83,N$85,N$87,N$89,N$91,N$93,N$95,N$97,N$99,N$101,N$103,N$105,N$107,N$109,N$111,N$113,N$115,N$117,N$119,N$121,N$123,N$125)) -> 4 | P188: =RANK(P187,(P$6,P$8,P$10,P$12,P$14,P$17,P$19,P$21,P$23,P$25,P$27,P$29,P$31,P$33,P$35,P$37,P$39,P$41,P$43,P$45,P$47,P$49,P$51,P$53,P$55,P$57,P$59,P$61,P$63,P$65,P$67,P$69,P$71,P$73,P$75,P$77,P$79,P$81,P$83,P$85,P$87,P$89,P$91,P$93,P$95,P$97,P$99,P$101,P$103,P$105,P$107,P$109,P$111,P$113,P$115,P$117,P$119,P$121,P$123,P$125)) -> 4
A189: Academy | B189: 3 | C189: 13.40 | D189: 14.40 | E189: 27.80 | F189: 12.50 | G189: 14.50 | H189: 12.60 | I189: 19.80 | J189: 14.10 | K189: 13.50 | L189: 13.90 | M189: 20.75 | N189: 68.35 | O189: 0.0 | P189: 68.35
C190: 4 | D190: 5 | E190: 5 | F190: 5 | G190: 5 | H190: 5 | I190: 5 | J190: 5 | K190: 5 | L190: 5 | M190: 5 | N190: 5 | P190: 5
A191: DCI Open Class
A192: Blue | B192: 5 | C192: 14.10 | D192: 14.20 | E192: 28.30 | F192: 12.90 | G192: 13.60 | H192: 12.60 | I192: 19.55 | J192: 12.80 | K192: 13.70 | L192: 14.00 | M192: 20.25 | N192: 68.10 | O192: 0.0 | P192: 68.10
A193: Devils B | C193: 1 | D193: 1 | E193: 1 | F193: 1 | G193: 1 | H193: 1 | I193: 1 | J193: 1 | K193: 1 | L193: 1 | M193: 1 | N193: 1 | P193: 1
A194: Gold | B194: 4 | C194: 13.80 | D194: 13.30 | E194: 27.10 | F194: 12.20 | G194: 12.90 | H194: 12.00 | I194: 18.55 | J194: 12.30 | K194: 13.00 | L194: 13.50 | M194: 19.40 | N194: 65.05 | O194: 0.0 | P194: 65.05
C195: 2 | D195: 2 | E195: 2 | F195: 2 | G195: 2 | H195: 2 | I195: 2 | J195: 2 | K195: 2 | L195: 2 | M195: 2 | N195: 2 | P195: 2
A196: Impulse | B196: 1 | C196: 13.20 | D196: 11.90 | E196: 25.10 | F196: 10.60 | G196: 12.00 | H196: 11.20 | I196: 16.90 | J196: 10.80 | K196: 11.80 | L196: 11.60 | M196: 17.10 | N196: 59.10 | O196: 0.0 | P196: 59.10
C197: 3 | D197: 3 | E197: 3 | F197: 4 | G197: 4 | H197: 3 | I197: 4 | J197: 4 | K197: 4 | L197: 3 | M197: 4 | N197: 3 | P197: 3
A198: Golden | B198: 3 | C198: 11.80 | D198: 11.60 | E198: 23.40 | F198: 11.10 | G198: 12.40 | H198: 11.00 | I198: 17.25 | J198: 11.30 | K198: 12.40 | L198: 11.50 | M198: 17.60 | N198: 58.25 | O198: 0.0 | P198: 58.25
A199: Empire | C199: 4 | D199: 4 | E199: 4 | F199: 3 | G199: 3 | H199: 4 | I199: 3 | J199: 3 | K199: 3 | L199: 4 | M199: 3 | N199: 4 | P199: 4
A200: Blue | B200: 2 | C200: 11.00 | D200: 10.40 | E200: 21.40 | F200: 9.30 | G200: 11.30 | H200: 10.00 | I200: 15.30 | J200: 10.20 | K200: 10.70 | L200: 10.20 | M200: 15.55 | N200: 52.25 | O200: 0.0 | P200: 52.25
A201: Devils C | C201: 5 | D201: 5 | E201: 5 | F201: 5 | G201: 5 | H201: 5 | I201: 5 | J201: 5 | K201: 5 | L201: 5 | M201: 5 | N201: 5 | P201: 5
A204: 7/8/2024 Sevierville, Tennessee
C205: General Effect | F205: Visual | J205: Music
C206: 1 | D206: 2 | F206: Proficiency | G206: Analysis | H206: Color Guard | J206: Brass | K206: Analysis | L206: Percussion | N206: Sub | P206: Total
C207: W. Rickhart | D207: S. Halquist | E207: Total | F207: J. Barton | G207: D. Padilla | H207: T. Hundall | I207: Total ÷2 | J207: B. Crisp | K207: K. Turner | L207: C. Poole | M207: Total ÷2 | N207: Total | O207: Pen | P207: Score
A208: DCI World Class | C208: 20 | D208: 20 | E208: 40 | F208: 20 | G208: 20 | H208: 20 | I208: 30 | J208: 20 | K208: 20 | L208: 20 | M208: 30 | N208: 100 | P208: 100
A209: Carolina | B209: 4 | C209: 16.60 | D209: 16.70 | E209: 33.30 | F209: 16.70 | G209: 16.50 | H209: 16.50 | I209: 24.85 | J209: 16.20 | K209: 18.00 | L209: 16.40 | M209: 25.30 | N209: 83.45 | O209: 0.0 | P209: 83.45
A210: Crown | C210: =RANK(C209,(C$6,C$8,C$10,C$12,C$14,C$17,C$19,C$21,C$23,C$25,C$27,C$29,C$31,C$33,C$35,C$37,C$39,C$41,C$43,C$45,C$47,C$49,C$51,C$53,C$55,C$57,C$59,C$61,C$63,C$65,C$67,C$69,C$71,C$73,C$75,C$77,C$79,C$81,C$83,C$85,C$87,C$89,C$91,C$93,C$95,C$97,C$99,C$101,C$103,C$105,C$107,C$109,C$111,C$113,C$115,C$117,C$119,C$121,C$123,C$125)) -> 1 | D210: =RANK(D209,(D$6,D$8,D$10,D$12,D$14,D$17,D$19,D$21,D$23,D$25,D$27,D$29,D$31,D$33,D$35,D$37,D$39,D$41,D$43,D$45,D$47,D$49,D$51,D$53,D$55,D$57,D$59,D$61,D$63,D$65,D$67,D$69,D$71,D$73,D$75,D$77,D$79,D$81,D$83,D$85,D$87,D$89,D$91,D$93,D$95,D$97,D$99,D$101,D$103,D$105,D$107,D$109,D$111,D$113,D$115,D$117,D$119,D$121,D$123,D$125)) -> 1 | E210: =RANK(E209,(E$6,E$8,E$10,E$12,E$14,E$17,E$19,E$21,E$23,E$25,E$27,E$29,E$31,E$33,E$35,E$37,E$39,E$41,E$43,E$45,E$47,E$49,E$51,E$53,E$55,E$57,E$59,E$61,E$63,E$65,E$67,E$69,E$71,E$73,E$75,E$77,E$79,E$81,E$83,E$85,E$87,E$89,E$91,E$93,E$95,E$97,E$99,E$101,E$103,E$105,E$107,E$109,E$111,E$113,E$115,E$117,E$119,E$121,E$123,E$125)) -> 1 | F210: =RANK(F209,(F$6,F$8,F$10,F$12,F$14,F$17,F$19,F$21,F$23,F$25,F$27,F$29,F$31,F$33,F$35,F$37,F$39,F$41,F$43,F$45,F$47,F$49,F$51,F$53,F$55,F$57,F$59,F$61,F$63,F$65,F$67,F$69,F$71,F$73,F$75,F$77,F$79,F$81,F$83,F$85,F$87,F$89,F$91,F$93,F$95,F$97,F$99,F$101,F$103,F$105,F$107,F$109,F$111,F$113,F$115,F$117,F$119,F$121,F$123,F$125)) -> 1 | G210: =RANK(G209,(G$6,G$8,G$10,G$12,G$14,G$17,G$19,G$21,G$23,G$25,G$27,G$29,G$31,G$33,G$35,G$37,G$39,G$41,G$43,G$45,G$47,G$49,G$51,G$53,G$55,G$57,G$59,G$61,G$63,G$65,G$67,G$69,G$71,G$73,G$75,G$77,G$79,G$81,G$83,G$85,G$87,G$89,G$91,G$93,G$95,G$97,G$99,G$101,G$103,G$105,G$107,G$109,G$111,G$113,G$115,G$117,G$119,G$121,G$123,G$125)) -> 1 | H210: =RANK(H209,(H$6,H$8,H$10,H$12,H$14,H$17,H$19,H$21,H$23,H$25,H$27,H$29,H$31,H$33,H$35,H$37,H$39,H$41,H$43,H$45,H$47,H$49,H$51,H$53,H$55,H$57,H$59,H$61,H$63,H$65,H$67,H$69,H$71,H$73,H$75,H$77,H$79,H$81,H$83,H$85,H$87,H$89,H$91,H$93,H$95,H$97,H$99,H$101,H$103,H$105,H$107,H$109,H$111,H$113,H$115,H$117,H$119,H$121,H$123,H$125)) -> 1 | I210: =RANK(I209,(I$6,I$8,I$10,I$12,I$14,I$17,I$19,I$21,I$23,I$25,I$27,I$29,I$31,I$33,I$35,I$37,I$39,I$41,I$43,I$45,I$47,I$49,I$51,I$53,I$55,I$57,I$59,I$61,I$63,I$65,I$67,I$69,I$71,I$73,I$75,I$77,I$79,I$81,I$83,I$85,I$87,I$89,I$91,I$93,I$95,I$97,I$99,I$101,I$103,I$105,I$107,I$109,I$111,I$113,I$115,I$117,I$119,I$121,I$123,I$125)) -> 1 | J210: =RANK(J209,(J$6,J$8,J$10,J$12,J$14,J$17,J$19,J$21,J$23,J$25,J$27,J$29,J$31,J$33,J$35,J$37,J$39,J$41,J$43,J$45,J$47,J$49,J$51,J$53,J$55,J$57,J$59,J$61,J$63,J$65,J$67,J$69,J$71,J$73,J$75,J$77,J$79,J$81,J$83,J$85,J$87,J$89,J$91,J$93,J$95,J$97,J$99,J$101,J$103,J$105,J$107,J$109,J$111,J$113,J$115,J$117,J$119,J$121,J$123,J$125)) -> 1 | K210: =RANK(K209,(K$6,K$8,K$10,K$12,K$14,K$17,K$19,K$21,K$23,K$25,K$27,K$29,K$31,K$33,K$35,K$37,K$39,K$41,K$43,K$45,K$47,K$49,K$51,K$53,K$55,K$57,K$59,K$61,K$63,K$65,K$67,K$69,K$71,K$73,K$75,K$77,K$79,K$81,K$83,K$85,K$87,K$89,K$91,K$93,K$95,K$97,K$99,K$101,K$103,K$105,K$107,K$109,K$111,K$113,K$115,K$117,K$119,K$121,K$123,K$125)) -> 1 | L210: =RANK(L209,(L$6,L$8,L$10,L$12,L$14,L$17,L$19,L$21,L$23,L$25,L$27,L$29,L$31,L$33,L$35,L$37,L$39,L$41,L$43,L$45,L$47,L$49,L$51,L$53,L$55,L$57,L$59,L$61,L$63,L$65,L$67,L$69,L$71,L$73,L$75,L$77,L$79,L$81,L$83,L$85,L$87,L$89,L$91,L$93,L$95,L$97,L$99,L$101,L$103,L$105,L$107,L$109,L$111,L$113,L$115,L$117,L$119,L$121,L$123,L$125)) -> 1 | M210: =RANK(M209,(M$6,M$8,M$10,M$12,M$14,M$17,M$19,M$21,M$23,M$25,M$27,M$29,M$31,M$33,M$35,M$37,M$39,M$41,M$43,M$45,M$47,M$49,M$51,M$53,M$55,M$57,M$59,M$61,M$63,M$65,M$67,M$69,M$71,M$73,M$75,M$77,M$79,M$81,M$83,M$85,M$87,M$89,M$91,M$93,M$95,M$97,M$99,M$101,M$103,M$105,M$107,M$109,M$111,M$113,M$115,M$117,M$119,M$121,M$123,M$125)) -> 1 | N210: =RANK(N209,(N$6,N$8,N$10,N$12,N$14,N$17,N$19,N$21,N$23,N$25,N$27,N$29,N$31,N$33,N$35,N$37,N$39,N$41,N$43,N$45,N$47,N$49,N$51,N$53,N$55,N$57,N$59,N$61,N$63,N$65,N$67,N$69,N$71,N$73,N$75,N$77,N$79,N$81,N$83,N$85,N$87,N$89,N$91,N$93,N$95,N$97,N$99,N$101,N$103,N$105,N$107,N$109,N$111,N$113,N$115,N$117,N$119,N$121,N$123,N$125)) -> 1 | P210: =RANK(P209,(P$6,P$8,P$10,P$12,P$14,P$17,P$19,P$21,P$23,P$25,P$27,P$29,P$31,P$33,P$35,P$37,P$39,P$41,P$43,P$45,P$47,P$49,P$51,P$53,P$55,P$57,P$59,P$61,P$63,P$65,P$67,P$69,P$71,P$73,P$75,P$77,P$79,P$81,P$83,P$85,P$87,P$89,P$91,P$93,P$95,P$97,P$99,P$101,P$103,P$105,P$107,P$109,P$111,P$113,P$115,P$117,P$119,P$121,P$123,P$125)) -> 1
A211: Crossmen | B211: 3 | C211: 14.90 | D211: 15.30 | E211: 30.20 | F211: 14.70 | G211: 14.80 | H211: 14.50 | I211: 22.00 | J211: 14.70 | K211: 14.70 | L211: 15.50 | M211: 22.45 | N211: 74.65 | O211: 0.0 | P211: 74.65
C212: =RANK(C211,(C$6,C$8,C$10,C$12,C$14,C$17,C$19,C$21,C$23,C$25,C$27,C$29,C$31,C$33,C$35,C$37,C$39,C$41,C$43,C$45,C$47,C$49,C$51,C$53,C$55,C$57,C$59,C$61,C$63,C$65,C$67,C$69,C$71,C$73,C$75,C$77,C$79,C$81,C$83,C$85,C$87,C$89,C$91,C$93,C$95,C$97,C$99,C$101,C$103,C$105,C$107,C$109,C$111,C$113,C$115,C$117,C$119,C$121,C$123,C$125)) -> 2 | D212: =RANK(D211,(D$6,D$8,D$10,D$12,D$14,D$17,D$19,D$21,D$23,D$25,D$27,D$29,D$31,D$33,D$35,D$37,D$39,D$41,D$43,D$45,D$47,D$49,D$51,D$53,D$55,D$57,D$59,D$61,D$63,D$65,D$67,D$69,D$71,D$73,D$75,D$77,D$79,D$81,D$83,D$85,D$87,D$89,D$91,D$93,D$95,D$97,D$99,D$101,D$103,D$105,D$107,D$109,D$111,D$113,D$115,D$117,D$119,D$121,D$123,D$125)) -> 2 | E212: =RANK(E211,(E$6,E$8,E$10,E$12,E$14,E$17,E$19,E$21,E$23,E$25,E$27,E$29,E$31,E$33,E$35,E$37,E$39,E$41,E$43,E$45,E$47,E$49,E$51,E$53,E$55,E$57,E$59,E$61,E$63,E$65,E$67,E$69,E$71,E$73,E$75,E$77,E$79,E$81,E$83,E$85,E$87,E$89,E$91,E$93,E$95,E$97,E$99,E$101,E$103,E$105,E$107,E$109,E$111,E$113,E$115,E$117,E$119,E$121,E$123,E$125)) -> 2 | F212: =RANK(F211,(F$6,F$8,F$10,F$12,F$14,F$17,F$19,F$21,F$23,F$25,F$27,F$29,F$31,F$33,F$35,F$37,F$39,F$41,F$43,F$45,F$47,F$49,F$51,F$53,F$55,F$57,F$59,F$61,F$63,F$65,F$67,F$69,F$71,F$73,F$75,F$77,F$79,F$81,F$83,F$85,F$87,F$89,F$91,F$93,F$95,F$97,F$99,F$101,F$103,F$105,F$107,F$109,F$111,F$113,F$115,F$117,F$119,F$121,F$123,F$125)) -> 3 | G212: =RANK(G211,(G$6,G$8,G$10,G$12,G$14,G$17,G$19,G$21,G$23,G$25,G$27,G$29,G$31,G$33,G$35,G$37,G$39,G$41,G$43,G$45,G$47,G$49,G$51,G$53,G$55,G$57,G$59,G$61,G$63,G$65,G$67,G$69,G$71,G$73,G$75,G$77,G$79,G$81,G$83,G$85,G$87,G$89,G$91,G$93,G$95,G$97,G$99,G$101,G$103,G$105,G$107,G$109,G$111,G$113,G$115,G$117,G$119,G$121,G$123,G$125)) -> 2 | H212: =RANK(H211,(H$6,H$8,H$10,H$12,H$14,H$17,H$19,H$21,H$23,H$25,H$27,H$29,H$31,H$33,H$35,H$37,H$39,H$41,H$43,H$45,H$47,H$49,H$51,H$53,H$55,H$57,H$59,H$61,H$63,H$65,H$67,H$69,H$71,H$73,H$75,H$77,H$79,H$81,H$83,H$85,H$87,H$89,H$91,H$93,H$95,H$97,H$99,H$101,H$103,H$105,H$107,H$109,H$111,H$113,H$115,H$117,H$119,H$121,H$123,H$125)) -> 2 | I212: =RANK(I211,(I$6,I$8,I$10,I$12,I$14,I$17,I$19,I$21,I$23,I$25,I$27,I$29,I$31,I$33,I$35,I$37,I$39,I$41,I$43,I$45,I$47,I$49,I$51,I$53,I$55,I$57,I$59,I$61,I$63,I$65,I$67,I$69,I$71,I$73,I$75,I$77,I$79,I$81,I$83,I$85,I$87,I$89,I$91,I$93,I$95,I$97,I$99,I$101,I$103,I$105,I$107,I$109,I$111,I$113,I$115,I$117,I$119,I$121,I$123,I$125)) -> 2 | J212: =RANK(J211,(J$6,J$8,J$10,J$12,J$14,J$17,J$19,J$21,J$23,J$25,J$27,J$29,J$31,J$33,J$35,J$37,J$39,J$41,J$43,J$45,J$47,J$49,J$51,J$53,J$55,J$57,J$59,J$61,J$63,J$65,J$67,J$69,J$71,J$73,J$75,J$77,J$79,J$81,J$83,J$85,J$87,J$89,J$91,J$93,J$95,J$97,J$99,J$101,J$103,J$105,J$107,J$109,J$111,J$113,J$115,J$117,J$119,J$121,J$123,J$125)) -> 2 | K212: =RANK(K211,(K$6,K$8,K$10,K$12,K$14,K$17,K$19,K$21,K$23,K$25,K$27,K$29,K$31,K$33,K$35,K$37,K$39,K$41,K$43,K$45,K$47,K$49,K$51,K$53,K$55,K$57,K$59,K$61,K$63,K$65,K$67,K$69,K$71,K$73,K$75,K$77,K$79,K$81,K$83,K$85,K$87,K$89,K$91,K$93,K$95,K$97,K$99,K$101,K$103,K$105,K$107,K$109,K$111,K$113,K$115,K$117,K$119,K$121,K$123,K$125)) -> 2 | L212: =RANK(L211,(L$6,L$8,L$10,L$12,L$14,L$17,L$19,L$21,L$23,L$25,L$27,L$29,L$31,L$33,L$35,L$37,L$39,L$41,L$43,L$45,L$47,L$49,L$51,L$53,L$55,L$57,L$59,L$61,L$63,L$65,L$67,L$69,L$71,L$73,L$75,L$77,L$79,L$81,L$83,L$85,L$87,L$89,L$91,L$93,L$95,L$97,L$99,L$101,L$103,L$105,L$107,L$109,L$111,L$113,L$115,L$117,L$119,L$121,L$123,L$125)) -> 2 | M212: =RANK(M211,(M$6,M$8,M$10,M$12,M$14,M$17,M$19,M$21,M$23,M$25,M$27,M$29,M$31,M$33,M$35,M$37,M$39,M$41,M$43,M$45,M$47,M$49,M$51,M$53,M$55,M$57,M$59,M$61,M$63,M$65,M$67,M$69,M$71,M$73,M$75,M$77,M$79,M$81,M$83,M$85,M$87,M$89,M$91,M$93,M$95,M$97,M$99,M$101,M$103,M$105,M$107,M$109,M$111,M$113,M$115,M$117,M$119,M$121,M$123,M$125)) -> 2 | N212: =RANK(N211,(N$6,N$8,N$10,N$12,N$14,N$17,N$19,N$21,N$23,N$25,N$27,N$29,N$31,N$33,N$35,N$37,N$39,N$41,N$43,N$45,N$47,N$49,N$51,N$53,N$55,N$57,N$59,N$61,N$63,N$65,N$67,N$69,N$71,N$73,N$75,N$77,N$79,N$81,N$83,N$85,N$87,N$89,N$91,N$93,N$95,N$97,N$99,N$101,N$103,N$105,N$107,N$109,N$111,N$113,N$115,N$117,N$119,N$121,N$123,N$125)) -> 2 | P212: =RANK(P211,(P$6,P$8,P$10,P$12,P$14,P$17,P$19,P$21,P$23,P$25,P$27,P$29,P$31,P$33,P$35,P$37,P$39,P$41,P$43,P$45,P$47,P$49,P$51,P$53,P$55,P$57,P$59,P$61,P$63,P$65,P$67,P$69,P$71,P$73,P$75,P$77,P$79,P$81,P$83,P$85,P$87,P$89,P$91,P$93,P$95,P$97,P$99,P$101,P$103,P$105,P$107,P$109,P$111,P$113,P$115,P$117,P$119,P$121,P$123,P$125)) -> 2
A213: Spirit of | B213: 2 | C213: 14.40 | D213: 14.40 | E213: 28.80 | F213: 14.40 | G213: 14.30 | H213: 14.20 | I213: 21.45 | J213: 14.10 | K213: 13.40 | L213: 14.40 | M213: 20.95 | N213: 71.20 | O213: 0.0 | P213: 71.20
A214: Atlanta | C214: =RANK(C213,(C$6,C$8,C$10,C$12,C$14,C$17,C$19,C$21,C$23,C$25,C$27,C$29,C$31,C$33,C$35,C$37,C$39,C$41,C$43,C$45,C$47,C$49,C$51,C$53,C$55,C$57,C$59,C$61,C$63,C$65,C$67,C$69,C$71,C$73,C$75,C$77,C$79,C$81,C$83,C$85,C$87,C$89,C$91,C$93,C$95,C$97,C$99,C$101,C$103,C$105,C$107,C$109,C$111,C$113,C$115,C$117,C$119,C$121,C$123,C$125)) -> 3 | D214: =RANK(D213,(D$6,D$8,D$10,D$12,D$14,D$17,D$19,D$21,D$23,D$25,D$27,D$29,D$31,D$33,D$35,D$37,D$39,D$41,D$43,D$45,D$47,D$49,D$51,D$53,D$55,D$57,D$59,D$61,D$63,D$65,D$67,D$69,D$71,D$73,D$75,D$77,D$79,D$81,D$83,D$85,D$87,D$89,D$91,D$93,D$95,D$97,D$99,D$101,D$103,D$105,D$107,D$109,D$111,D$113,D$115,D$117,D$119,D$121,D$123,D$125)) -> 3 | E214: =RANK(E213,(E$6,E$8,E$10,E$12,E$14,E$17,E$19,E$21,E$23,E$25,E$27,E$29,E$31,E$33,E$35,E$37,E$39,E$41,E$43,E$45,E$47,E$49,E$51,E$53,E$55,E$57,E$59,E$61,E$63,E$65,E$67,E$69,E$71,E$73,E$75,E$77,E$79,E$81,E$83,E$85,E$87,E$89,E$91,E$93,E$95,E$97,E$99,E$101,E$103,E$105,E$107,E$109,E$111,E$113,E$115,E$117,E$119,E$121,E$123,E$125)) -> 3 | F214: =RANK(F213,(F$6,F$8,F$10,F$12,F$14,F$17,F$19,F$21,F$23,F$25,F$27,F$29,F$31,F$33,F$35,F$37,F$39,F$41,F$43,F$45,F$47,F$49,F$51,F$53,F$55,F$57,F$59,F$61,F$63,F$65,F$67,F$69,F$71,F$73,F$75,F$77,F$79,F$81,F$83,F$85,F$87,F$89,F$91,F$93,F$95,F$97,F$99,F$101,F$103,F$105,F$107,F$109,F$111,F$113,F$115,F$117,F$119,F$121,F$123,F$125)) -> 4 | G214: =RANK(G213,(G$6,G$8,G$10,G$12,G$14,G$17,G$19,G$21,G$23,G$25,G$27,G$29,G$31,G$33,G$35,G$37,G$39,G$41,G$43,G$45,G$47,G$49,G$51,G$53,G$55,G$57,G$59,G$61,G$63,G$65,G$67,G$69,G$71,G$73,G$75,G$77,G$79,G$81,G$83,G$85,G$87,G$89,G$91,G$93,G$95,G$97,G$99,G$101,G$103,G$105,G$107,G$109,G$111,G$113,G$115,G$117,G$119,G$121,G$123,G$125)) -> 3 | H214: =RANK(H213,(H$6,H$8,H$10,H$12,H$14,H$17,H$19,H$21,H$23,H$25,H$27,H$29,H$31,H$33,H$35,H$37,H$39,H$41,H$43,H$45,H$47,H$49,H$51,H$53,H$55,H$57,H$59,H$61,H$63,H$65,H$67,H$69,H$71,H$73,H$75,H$77,H$79,H$81,H$83,H$85,H$87,H$89,H$91,H$93,H$95,H$97,H$99,H$101,H$103,H$105,H$107,H$109,H$111,H$113,H$115,H$117,H$119,H$121,H$123,H$125)) -> 3 | I214: =RANK(I213,(I$6,I$8,I$10,I$12,I$14,I$17,I$19,I$21,I$23,I$25,I$27,I$29,I$31,I$33,I$35,I$37,I$39,I$41,I$43,I$45,I$47,I$49,I$51,I$53,I$55,I$57,I$59,I$61,I$63,I$65,I$67,I$69,I$71,I$73,I$75,I$77,I$79,I$81,I$83,I$85,I$87,I$89,I$91,I$93,I$95,I$97,I$99,I$101,I$103,I$105,I$107,I$109,I$111,I$113,I$115,I$117,I$119,I$121,I$123,I$125)) -> 3 | J214: =RANK(J213,(J$6,J$8,J$10,J$12,J$14,J$17,J$19,J$21,J$23,J$25,J$27,J$29,J$31,J$33,J$35,J$37,J$39,J$41,J$43,J$45,J$47,J$49,J$51,J$53,J$55,J$57,J$59,J$61,J$63,J$65,J$67,J$69,J$71,J$73,J$75,J$77,J$79,J$81,J$83,J$85,J$87,J$89,J$91,J$93,J$95,J$97,J$99,J$101,J$103,J$105,J$107,J$109,J$111,J$113,J$115,J$117,J$119,J$121,J$123,J$125)) -> 3 | K214: =RANK(K213,(K$6,K$8,K$10,K$12,K$14,K$17,K$19,K$21,K$23,K$25,K$27,K$29,K$31,K$33,K$35,K$37,K$39,K$41,K$43,K$45,K$47,K$49,K$51,K$53,K$55,K$57,K$59,K$61,K$63,K$65,K$67,K$69,K$71,K$73,K$75,K$77,K$79,K$81,K$83,K$85,K$87,K$89,K$91,K$93,K$95,K$97,K$99,K$101,K$103,K$105,K$107,K$109,K$111,K$113,K$115,K$117,K$119,K$121,K$123,K$125)) -> 4 | L214: =RANK(L213,(L$6,L$8,L$10,L$12,L$14,L$17,L$19,L$21,L$23,L$25,L$27,L$29,L$31,L$33,L$35,L$37,L$39,L$41,L$43,L$45,L$47,L$49,L$51,L$53,L$55,L$57,L$59,L$61,L$63,L$65,L$67,L$69,L$71,L$73,L$75,L$77,L$79,L$81,L$83,L$85,L$87,L$89,L$91,L$93,L$95,L$97,L$99,L$101,L$103,L$105,L$107,L$109,L$111,L$113,L$115,L$117,L$119,L$121,L$123,L$125)) -> 3 | M214: =RANK(M213,(M$6,M$8,M$10,M$12,M$14,M$17,M$19,M$21,M$23,M$25,M$27,M$29,M$31,M$33,M$35,M$37,M$39,M$41,M$43,M$45,M$47,M$49,M$51,M$53,M$55,M$57,M$59,M$61,M$63,M$65,M$67,M$69,M$71,M$73,M$75,M$77,M$79,M$81,M$83,M$85,M$87,M$89,M$91,M$93,M$95,M$97,M$99,M$101,M$103,M$105,M$107,M$109,M$111,M$113,M$115,M$117,M$119,M$121,M$123,M$125)) -> 3 | N214: =RANK(N213,(N$6,N$8,N$10,N$12,N$14,N$17,N$19,N$21,N$23,N$25,N$27,N$29,N$31,N$33,N$35,N$37,N$39,N$41,N$43,N$45,N$47,N$49,N$51,N$53,N$55,N$57,N$59,N$61,N$63,N$65,N$67,N$69,N$71,N$73,N$75,N$77,N$79,N$81,N$83,N$85,N$87,N$89,N$91,N$93,N$95,N$97,N$99,N$101,N$103,N$105,N$107,N$109,N$111,N$113,N$115,N$117,N$119,N$121,N$123,N$125)) -> 3 | P214: =RANK(P213,(P$6,P$8,P$10,P$12,P$14,P$17,P$19,P$21,P$23,P$25,P$27,P$29,P$31,P$33,P$35,P$37,P$39,P$41,P$43,P$45,P$47,P$49,P$51,P$53,P$55,P$57,P$59,P$61,P$63,P$65,P$67,P$69,P$71,P$73,P$75,P$77,P$79,P$81,P$83,P$85,P$87,P$89,P$91,P$93,P$95,P$97,P$99,P$101,P$103,P$105,P$107,P$109,P$111,P$113,P$115,P$117,P$119,P$121,P$123,P$125)) -> 3
A215: Music | B215: 1 | C215: 14.00 | D215: 14.10 | E215: 28.10 | F215: 14.80 | G215: 14.20 | H215: 13.70 | I215: 21.35 | J215: 13.30 | K215: 13.60 | L215: 14.10 | M215: 20.50 | N215: 69.95 | O215: 0.0 | P215: 69.95
A216: City | C216: =RANK(C215,(C$6,C$8,C$10,C$12,C$14,C$17,C$19,C$21,C$23,C$25,C$27,C$29,C$31,C$33,C$35,C$37,C$39,C$41,C$43,C$45,C$47,C$49,C$51,C$53,C$55,C$57,C$59,C$61,C$63,C$65,C$67,C$69,C$71,C$73,C$75,C$77,C$79,C$81,C$83,C$85,C$87,C$89,C$91,C$93,C$95,C$97,C$99,C$101,C$103,C$105,C$107,C$109,C$111,C$113,C$115,C$117,C$119,C$121,C$123,C$125)) -> 4 | D216: =RANK(D215,(D$6,D$8,D$10,D$12,D$14,D$17,D$19,D$21,D$23,D$25,D$27,D$29,D$31,D$33,D$35,D$37,D$39,D$41,D$43,D$45,D$47,D$49,D$51,D$53,D$55,D$57,D$59,D$61,D$63,D$65,D$67,D$69,D$71,D$73,D$75,D$77,D$79,D$81,D$83,D$85,D$87,D$89,D$91,D$93,D$95,D$97,D$99,D$101,D$103,D$105,D$107,D$109,D$111,D$113,D$115,D$117,D$119,D$121,D$123,D$125)) -> 4 | E216: =RANK(E215,(E$6,E$8,E$10,E$12,E$14,E$17,E$19,E$21,E$23,E$25,E$27,E$29,E$31,E$33,E$35,E$37,E$39,E$41,E$43,E$45,E$47,E$49,E$51,E$53,E$55,E$57,E$59,E$61,E$63,E$65,E$67,E$69,E$71,E$73,E$75,E$77,E$79,E$81,E$83,E$85,E$87,E$89,E$91,E$93,E$95,E$97,E$99,E$101,E$103,E$105,E$107,E$109,E$111,E$113,E$115,E$117,E$119,E$121,E$123,E$125)) -> 4 | F216: =RANK(F215,(F$6,F$8,F$10,F$12,F$14,F$17,F$19,F$21,F$23,F$25,F$27,F$29,F$31,F$33,F$35,F$37,F$39,F$41,F$43,F$45,F$47,F$49,F$51,F$53,F$55,F$57,F$59,F$61,F$63,F$65,F$67,F$69,F$71,F$73,F$75,F$77,F$79,F$81,F$83,F$85,F$87,F$89,F$91,F$93,F$95,F$97,F$99,F$101,F$103,F$105,F$107,F$109,F$111,F$113,F$115,F$117,F$119,F$121,F$123,F$125)) -> 2 | G216: =RANK(G215,(G$6,G$8,G$10,G$12,G$14,G$17,G$19,G$21,G$23,G$25,G$27,G$29,G$31,G$33,G$35,G$37,G$39,G$41,G$43,G$45,G$47,G$49,G$51,G$53,G$55,G$57,G$59,G$61,G$63,G$65,G$67,G$69,G$71,G$73,G$75,G$77,G$79,G$81,G$83,G$85,G$87,G$89,G$91,G$93,G$95,G$97,G$99,G$101,G$103,G$105,G$107,G$109,G$111,G$113,G$115,G$117,G$119,G$121,G$123,G$125)) -> 4 | H216: =RANK(H215,(H$6,H$8,H$10,H$12,H$14,H$17,H$19,H$21,H$23,H$25,H$27,H$29,H$31,H$33,H$35,H$37,H$39,H$41,H$43,H$45,H$47,H$49,H$51,H$53,H$55,H$57,H$59,H$61,H$63,H$65,H$67,H$69,H$71,H$73,H$75,H$77,H$79,H$81,H$83,H$85,H$87,H$89,H$91,H$93,H$95,H$97,H$99,H$101,H$103,H$105,H$107,H$109,H$111,H$113,H$115,H$117,H$119,H$121,H$123,H$125)) -> 4 | I216: =RANK(I215,(I$6,I$8,I$10,I$12,I$14,I$17,I$19,I$21,I$23,I$25,I$27,I$29,I$31,I$33,I$35,I$37,I$39,I$41,I$43,I$45,I$47,I$49,I$51,I$53,I$55,I$57,I$59,I$61,I$63,I$65,I$67,I$69,I$71,I$73,I$75,I$77,I$79,I$81,I$83,I$85,I$87,I$89,I$91,I$93,I$95,I$97,I$99,I$101,I$103,I$105,I$107,I$109,I$111,I$113,I$115,I$117,I$119,I$121,I$123,I$125)) -> 4 | J216: =RANK(J215,(J$6,J$8,J$10,J$12,J$14,J$17,J$19,J$21,J$23,J$25,J$27,J$29,J$31,J$33,J$35,J$37,J$39,J$41,J$43,J$45,J$47,J$49,J$51,J$53,J$55,J$57,J$59,J$61,J$63,J$65,J$67,J$69,J$71,J$73,J$75,J$77,J$79,J$81,J$83,J$85,J$87,J$89,J$91,J$93,J$95,J$97,J$99,J$101,J$103,J$105,J$107,J$109,J$111,J$113,J$115,J$117,J$119,J$121,J$123,J$125)) -> 4 | K216: =RANK(K215,(K$6,K$8,K$10,K$12,K$14,K$17,K$19,K$21,K$23,K$25,K$27,K$29,K$31,K$33,K$35,K$37,K$39,K$41,K$43,K$45,K$47,K$49,K$51,K$53,K$55,K$57,K$59,K$61,K$63,K$65,K$67,K$69,K$71,K$73,K$75,K$77,K$79,K$81,K$83,K$85,K$87,K$89,K$91,K$93,K$95,K$97,K$99,K$101,K$103,K$105,K$107,K$109,K$111,K$113,K$115,K$117,K$119,K$121,K$123,K$125)) -> 3 | L216: =RANK(L215,(L$6,L$8,L$10,L$12,L$14,L$17,L$19,L$21,L$23,L$25,L$27,L$29,L$31,L$33,L$35,L$37,L$39,L$41,L$43,L$45,L$47,L$49,L$51,L$53,L$55,L$57,L$59,L$61,L$63,L$65,L$67,L$69,L$71,L$73,L$75,L$77,L$79,L$81,L$83,L$85,L$87,L$89,L$91,L$93,L$95,L$97,L$99,L$101,L$103,L$105,L$107,L$109,L$111,L$113,L$115,L$117,L$119,L$121,L$123,L$125)) -> 4 | M216: =RANK(M215,(M$6,M$8,M$10,M$12,M$14,M$17,M$19,M$21,M$23,M$25,M$27,M$29,M$31,M$33,M$35,M$37,M$39,M$41,M$43,M$45,M$47,M$49,M$51,M$53,M$55,M$57,M$59,M$61,M$63,M$65,M$67,M$69,M$71,M$73,M$75,M$77,M$79,M$81,M$83,M$85,M$87,M$89,M$91,M$93,M$95,M$97,M$99,M$101,M$103,M$105,M$107,M$109,M$111,M$113,M$115,M$117,M$119,M$121,M$123,M$125)) -> 4 | N216: =RANK(N215,(N$6,N$8,N$10,N$12,N$14,N$17,N$19,N$21,N$23,N$25,N$27,N$29,N$31,N$33,N$35,N$37,N$39,N$41,N$43,N$45,N$47,N$49,N$51,N$53,N$55,N$57,N$59,N$61,N$63,N$65,N$67,N$69,N$71,N$73,N$75,N$77,N$79,N$81,N$83,N$85,N$87,N$89,N$91,N$93,N$95,N$97,N$99,N$101,N$103,N$105,N$107,N$109,N$111,N$113,N$115,N$117,N$119,N$121,N$123,N$125)) -> 4 | P216: =RANK(P215,(P$6,P$8,P$10,P$12,P$14,P$17,P$19,P$21,P$23,P$25,P$27,P$29,P$31,P$33,P$35,P$37,P$39,P$41,P$43,P$45,P$47,P$49,P$51,P$53,P$55,P$57,P$59,P$61,P$63,P$65,P$67,P$69,P$71,P$73,P$75,P$77,P$79,P$81,P$83,P$85,P$87,P$89,P$91,P$93,P$95,P$97,P$99,P$101,P$103,P$105,P$107,P$109,P$111,P$113,P$115,P$117,P$119,P$121,P$123,P$125)) -> 4
A217: DCI Open Class
A218: Spartans | B218: 1 | C218: 13.70 | D218: 13.60 | E218: 27.30 | F218: 13.60 | G218: 13.00 | H218: 12.40 | I218: 19.50 | J218: 12.40 | K218: 13.80 | L218: 13.70 | M218: 19.95 | N218: 66.75 | O218: 0.0 | P218: 66.75
C219: 1 | D219: 1 | E219: 1 | F219: 1 | G219: 1 | H219: 1 | I219: 1 | J219: 1 | K219: 1 | L219: 1 | M219: 1 | N219: 1 | P219: 1
A222: 7/8/2024 Kennewick, Washington
C223: General Effect | F223: Visual | J223: Music
C224: 1 | D224: 2 | F224: Proficiency | G224: Analysis | H224: Color Guard | J224: Brass | K224: Analysis | L224: Percussion | N224: Sub | P224: Total
C225: C. Costanza | D225: J. Webb | E225: Total | F225: B. Brahan | G225: P. Madden | H225: W. Chumley | I225: Total ÷2 | J225: B. Fabrizio | K225: N. Jones | L225: P. Furnari | M225: Total ÷2 | N225: Total | O225: Pen | P225: Score
A226: DCI World Class | C226: 20 | D226: 20 | E226: 40 | F226: 20 | G226: 20 | H226: 20 | I226: 30 | J226: 20 | K226: 20 | L226: 20 | M226: 30 | N226: 100 | P226: 100
A227: Troopers | B227: 3 | C227: 15.00 | D227: 15.10 | E227: 30.10 | F227: 14.90 | G227: 15.30 | H227: 15.00 | I227: 22.60 | J227: 15.50 | K227: 14.90 | L227: 15.70 | M227: 23.05 | N227: 75.75 | O227: 0.0 | P227: 75.75
C228: =RANK(C227,(C$6,C$8,C$10,C$13,C$15,C$17,C$19,C$21,C$23,C$25,C$27,C$29,C$31,C$33,C$35,C$37,C$39,C$41,C$43,C$45,C$47,C$49,C$51,C$53,C$55,C$57,C$59,C$61,C$63,C$65,C$67,C$69,C$71,C$73,C$75,C$77,C$79,C$81,C$83,C$85,C$87,C$89,C$91,C$93,C$95,C$97,C$99,C$101,C$103,C$105,C$107,C$109,C$111,C$113,C$115,C$117,C$119,C$121,C$123,C$125)) -> 1 | D228: =RANK(D227,(D$6,D$8,D$10,D$13,D$15,D$17,D$19,D$21,D$23,D$25,D$27,D$29,D$31,D$33,D$35,D$37,D$39,D$41,D$43,D$45,D$47,D$49,D$51,D$53,D$55,D$57,D$59,D$61,D$63,D$65,D$67,D$69,D$71,D$73,D$75,D$77,D$79,D$81,D$83,D$85,D$87,D$89,D$91,D$93,D$95,D$97,D$99,D$101,D$103,D$105,D$107,D$109,D$111,D$113,D$115,D$117,D$119,D$121,D$123,D$125)) -> 1 | E228: =RANK(E227,(E$6,E$8,E$10,E$13,E$15,E$17,E$19,E$21,E$23,E$25,E$27,E$29,E$31,E$33,E$35,E$37,E$39,E$41,E$43,E$45,E$47,E$49,E$51,E$53,E$55,E$57,E$59,E$61,E$63,E$65,E$67,E$69,E$71,E$73,E$75,E$77,E$79,E$81,E$83,E$85,E$87,E$89,E$91,E$93,E$95,E$97,E$99,E$101,E$103,E$105,E$107,E$109,E$111,E$113,E$115,E$117,E$119,E$121,E$123,E$125)) -> 1 | F228: =RANK(F227,(F$6,F$8,F$10,F$13,F$15,F$17,F$19,F$21,F$23,F$25,F$27,F$29,F$31,F$33,F$35,F$37,F$39,F$41,F$43,F$45,F$47,F$49,F$51,F$53,F$55,F$57,F$59,F$61,F$63,F$65,F$67,F$69,F$71,F$73,F$75,F$77,F$79,F$81,F$83,F$85,F$87,F$89,F$91,F$93,F$95,F$97,F$99,F$101,F$103,F$105,F$107,F$109,F$111,F$113,F$115,F$117,F$119,F$121,F$123,F$125)) -> 2 | G228: =RANK(G227,(G$6,G$8,G$10,G$13,G$15,G$17,G$19,G$21,G$23,G$25,G$27,G$29,G$31,G$33,G$35,G$37,G$39,G$41,G$43,G$45,G$47,G$49,G$51,G$53,G$55,G$57,G$59,G$61,G$63,G$65,G$67,G$69,G$71,G$73,G$75,G$77,G$79,G$81,G$83,G$85,G$87,G$89,G$91,G$93,G$95,G$97,G$99,G$101,G$103,G$105,G$107,G$109,G$111,G$113,G$115,G$117,G$119,G$121,G$123,G$125)) -> 1 | H228: =RANK(H227,(H$6,H$8,H$10,H$13,H$15,H$17,H$19,H$21,H$23,H$25,H$27,H$29,H$31,H$33,H$35,H$37,H$39,H$41,H$43,H$45,H$47,H$49,H$51,H$53,H$55,H$57,H$59,H$61,H$63,H$65,H$67,H$69,H$71,H$73,H$75,H$77,H$79,H$81,H$83,H$85,H$87,H$89,H$91,H$93,H$95,H$97,H$99,H$101,H$103,H$105,H$107,H$109,H$111,H$113,H$115,H$117,H$119,H$121,H$123,H$125)) -> 2 | I228: =RANK(I227,(I$6,I$8,I$10,I$13,I$15,I$17,I$19,I$21,I$23,I$25,I$27,I$29,I$31,I$33,I$35,I$37,I$39,I$41,I$43,I$45,I$47,I$49,I$51,I$53,I$55,I$57,I$59,I$61,I$63,I$65,I$67,I$69,I$71,I$73,I$75,I$77,I$79,I$81,I$83,I$85,I$87,I$89,I$91,I$93,I$95,I$97,I$99,I$101,I$103,I$105,I$107,I$109,I$111,I$113,I$115,I$117,I$119,I$121,I$123,I$125)) -> 2 | J228: =RANK(J227,(J$6,J$8,J$10,J$13,J$15,J$17,J$19,J$21,J$23,J$25,J$27,J$29,J$31,J$33,J$35,J$37,J$39,J$41,J$43,J$45,J$47,J$49,J$51,J$53,J$55,J$57,J$59,J$61,J$63,J$65,J$67,J$69,J$71,J$73,J$75,J$77,J$79,J$81,J$83,J$85,J$87,J$89,J$91,J$93,J$95,J$97,J$99,J$101,J$103,J$105,J$107,J$109,J$111,J$113,J$115,J$117,J$119,J$121,J$123,J$125)) -> 1 | K228: =RANK(K227,(K$6,K$8,K$10,K$13,K$15,K$17,K$19,K$21,K$23,K$25,K$27,K$29,K$31,K$33,K$35,K$37,K$39,K$41,K$43,K$45,K$47,K$49,K$51,K$53,K$55,K$57,K$59,K$61,K$63,K$65,K$67,K$69,K$71,K$73,K$75,K$77,K$79,K$81,K$83,K$85,K$87,K$89,K$91,K$93,K$95,K$97,K$99,K$101,K$103,K$105,K$107,K$109,K$111,K$113,K$115,K$117,K$119,K$121,K$123,K$125)) -> 1 | L228: =RANK(L227,(L$6,L$8,L$10,L$13,L$15,L$17,L$19,L$21,L$23,L$25,L$27,L$29,L$31,L$33,L$35,L$37,L$39,L$41,L$43,L$45,L$47,L$49,L$51,L$53,L$55,L$57,L$59,L$61,L$63,L$65,L$67,L$69,L$71,L$73,L$75,L$77,L$79,L$81,L$83,L$85,L$87,L$89,L$91,L$93,L$95,L$97,L$99,L$101,L$103,L$105,L$107,L$109,L$111,L$113,L$115,L$117,L$119,L$121,L$123,L$125)) -> 1 | M228: =RANK(M227,(M$6,M$8,M$10,M$13,M$15,M$17,M$19,M$21,M$23,M$25,M$27,M$29,M$31,M$33,M$35,M$37,M$39,M$41,M$43,M$45,M$47,M$49,M$51,M$53,M$55,M$57,M$59,M$61,M$63,M$65,M$67,M$69,M$71,M$73,M$75,M$77,M$79,M$81,M$83,M$85,M$87,M$89,M$91,M$93,M$95,M$97,M$99,M$101,M$103,M$105,M$107,M$109,M$111,M$113,M$115,M$117,M$119,M$121,M$123,M$125)) -> 1 | N228: =RANK(N227,(N$6,N$8,N$10,N$13,N$15,N$17,N$19,N$21,N$23,N$25,N$27,N$29,N$31,N$33,N$35,N$37,N$39,N$41,N$43,N$45,N$47,N$49,N$51,N$53,N$55,N$57,N$59,N$61,N$63,N$65,N$67,N$69,N$71,N$73,N$75,N$77,N$79,N$81,N$83,N$85,N$87,N$89,N$91,N$93,N$95,N$97,N$99,N$101,N$103,N$105,N$107,N$109,N$111,N$113,N$115,N$117,N$119,N$121,N$123,N$125)) -> 1 | P228: =RANK(P227,(P$6,P$8,P$10,P$13,P$15,P$17,P$19,P$21,P$23,P$25,P$27,P$29,P$31,P$33,P$35,P$37,P$39,P$41,P$43,P$45,P$47,P$49,P$51,P$53,P$55,P$57,P$59,P$61,P$63,P$65,P$67,P$69,P$71,P$73,P$75,P$77,P$79,P$81,P$83,P$85,P$87,P$89,P$91,P$93,P$95,P$97,P$99,P$101,P$103,P$105,P$107,P$109,P$111,P$113,P$115,P$117,P$119,P$121,P$123,P$125)) -> 1
A229: Blue | B229: 2 | C229: 14.90 | D229: 14.80 | E229: 29.70 | F229: 15.20 | G229: 15.00 | H229: 15.10 | I229: 22.65 | J229: 14.60 | K229: 14.70 | L229: 14.80 | M229: 22.05 | N229: 74.40 | O229: 0.0 | P229: 74.40
A230: Knights | C230: =RANK(C229,(C$6,C$8,C$10,C$13,C$15,C$17,C$19,C$21,C$23,C$25,C$27,C$29,C$31,C$33,C$35,C$37,C$39,C$41,C$43,C$45,C$47,C$49,C$51,C$53,C$55,C$57,C$59,C$61,C$63,C$65,C$67,C$69,C$71,C$73,C$75,C$77,C$79,C$81,C$83,C$85,C$87,C$89,C$91,C$93,C$95,C$97,C$99,C$101,C$103,C$105,C$107,C$109,C$111,C$113,C$115,C$117,C$119,C$121,C$123,C$125)) -> 2 | D230: =RANK(D229,(D$6,D$8,D$10,D$13,D$15,D$17,D$19,D$21,D$23,D$25,D$27,D$29,D$31,D$33,D$35,D$37,D$39,D$41,D$43,D$45,D$47,D$49,D$51,D$53,D$55,D$57,D$59,D$61,D$63,D$65,D$67,D$69,D$71,D$73,D$75,D$77,D$79,D$81,D$83,D$85,D$87,D$89,D$91,D$93,D$95,D$97,D$99,D$101,D$103,D$105,D$107,D$109,D$111,D$113,D$115,D$117,D$119,D$121,D$123,D$125)) -> 2 | E230: =RANK(E229,(E$6,E$8,E$10,E$13,E$15,E$17,E$19,E$21,E$23,E$25,E$27,E$29,E$31,E$33,E$35,E$37,E$39,E$41,E$43,E$45,E$47,E$49,E$51,E$53,E$55,E$57,E$59,E$61,E$63,E$65,E$67,E$69,E$71,E$73,E$75,E$77,E$79,E$81,E$83,E$85,E$87,E$89,E$91,E$93,E$95,E$97,E$99,E$101,E$103,E$105,E$107,E$109,E$111,E$113,E$115,E$117,E$119,E$121,E$123,E$125)) -> 2 | F230: =RANK(F229,(F$6,F$8,F$10,F$13,F$15,F$17,F$19,F$21,F$23,F$25,F$27,F$29,F$31,F$33,F$35,F$37,F$39,F$41,F$43,F$45,F$47,F$49,F$51,F$53,F$55,F$57,F$59,F$61,F$63,F$65,F$67,F$69,F$71,F$73,F$75,F$77,F$79,F$81,F$83,F$85,F$87,F$89,F$91,F$93,F$95,F$97,F$99,F$101,F$103,F$105,F$107,F$109,F$111,F$113,F$115,F$117,F$119,F$121,F$123,F$125)) -> 1 | G230: =RANK(G229,(G$6,G$8,G$10,G$13,G$15,G$17,G$19,G$21,G$23,G$25,G$27,G$29,G$31,G$33,G$35,G$37,G$39,G$41,G$43,G$45,G$47,G$49,G$51,G$53,G$55,G$57,G$59,G$61,G$63,G$65,G$67,G$69,G$71,G$73,G$75,G$77,G$79,G$81,G$83,G$85,G$87,G$89,G$91,G$93,G$95,G$97,G$99,G$101,G$103,G$105,G$107,G$109,G$111,G$113,G$115,G$117,G$119,G$121,G$123,G$125)) -> 2 | H230: =RANK(H229,(H$6,H$8,H$10,H$13,H$15,H$17,H$19,H$21,H$23,H$25,H$27,H$29,H$31,H$33,H$35,H$37,H$39,H$41,H$43,H$45,H$47,H$49,H$51,H$53,H$55,H$57,H$59,H$61,H$63,H$65,H$67,H$69,H$71,H$73,H$75,H$77,H$79,H$81,H$83,H$85,H$87,H$89,H$91,H$93,H$95,H$97,H$99,H$101,H$103,H$105,H$107,H$109,H$111,H$113,H$115,H$117,H$119,H$121,H$123,H$125)) -> 1 | I230: =RANK(I229,(I$6,I$8,I$10,I$13,I$15,I$17,I$19,I$21,I$23,I$25,I$27,I$29,I$31,I$33,I$35,I$37,I$39,I$41,I$43,I$45,I$47,I$49,I$51,I$53,I$55,I$57,I$59,I$61,I$63,I$65,I$67,I$69,I$71,I$73,I$75,I$77,I$79,I$81,I$83,I$85,I$87,I$89,I$91,I$93,I$95,I$97,I$99,I$101,I$103,I$105,I$107,I$109,I$111,I$113,I$115,I$117,I$119,I$121,I$123,I$125)) -> 1 | J230: =RANK(J229,(J$6,J$8,J$10,J$13,J$15,J$17,J$19,J$21,J$23,J$25,J$27,J$29,J$31,J$33,J$35,J$37,J$39,J$41,J$43,J$45,J$47,J$49,J$51,J$53,J$55,J$57,J$59,J$61,J$63,J$65,J$67,J$69,J$71,J$73,J$75,J$77,J$79,J$81,J$83,J$85,J$87,J$89,J$91,J$93,J$95,J$97,J$99,J$101,J$103,J$105,J$107,J$109,J$111,J$113,J$115,J$117,J$119,J$121,J$123,J$125)) -> 2 | K230: =RANK(K229,(K$6,K$8,K$10,K$13,K$15,K$17,K$19,K$21,K$23,K$25,K$27,K$29,K$31,K$33,K$35,K$37,K$39,K$41,K$43,K$45,K$47,K$49,K$51,K$53,K$55,K$57,K$59,K$61,K$63,K$65,K$67,K$69,K$71,K$73,K$75,K$77,K$79,K$81,K$83,K$85,K$87,K$89,K$91,K$93,K$95,K$97,K$99,K$101,K$103,K$105,K$107,K$109,K$111,K$113,K$115,K$117,K$119,K$121,K$123,K$125)) -> 2 | L230: =RANK(L229,(L$6,L$8,L$10,L$13,L$15,L$17,L$19,L$21,L$23,L$25,L$27,L$29,L$31,L$33,L$35,L$37,L$39,L$41,L$43,L$45,L$47,L$49,L$51,L$53,L$55,L$57,L$59,L$61,L$63,L$65,L$67,L$69,L$71,L$73,L$75,L$77,L$79,L$81,L$83,L$85,L$87,L$89,L$91,L$93,L$95,L$97,L$99,L$101,L$103,L$105,L$107,L$109,L$111,L$113,L$115,L$117,L$119,L$121,L$123,L$125)) -> 2 | M230: =RANK(M229,(M$6,M$8,M$10,M$13,M$15,M$17,M$19,M$21,M$23,M$25,M$27,M$29,M$31,M$33,M$35,M$37,M$39,M$41,M$43,M$45,M$47,M$49,M$51,M$53,M$55,M$57,M$59,M$61,M$63,M$65,M$67,M$69,M$71,M$73,M$75,M$77,M$79,M$81,M$83,M$85,M$87,M$89,M$91,M$93,M$95,M$97,M$99,M$101,M$103,M$105,M$107,M$109,M$111,M$113,M$115,M$117,M$119,M$121,M$123,M$125)) -> 2 | N230: =RANK(N229,(N$6,N$8,N$10,N$13,N$15,N$17,N$19,N$21,N$23,N$25,N$27,N$29,N$31,N$33,N$35,N$37,N$39,N$41,N$43,N$45,N$47,N$49,N$51,N$53,N$55,N$57,N$59,N$61,N$63,N$65,N$67,N$69,N$71,N$73,N$75,N$77,N$79,N$81,N$83,N$85,N$87,N$89,N$91,N$93,N$95,N$97,N$99,N$101,N$103,N$105,N$107,N$109,N$111,N$113,N$115,N$117,N$119,N$121,N$123,N$125)) -> 2 | P230: =RANK(P229,(P$6,P$8,P$10,P$13,P$15,P$17,P$19,P$21,P$23,P$25,P$27,P$29,P$31,P$33,P$35,P$37,P$39,P$41,P$43,P$45,P$47,P$49,P$51,P$53,P$55,P$57,P$59,P$61,P$63,P$65,P$67,P$69,P$71,P$73,P$75,P$77,P$79,P$81,P$83,P$85,P$87,P$89,P$91,P$93,P$95,P$97,P$99,P$101,P$103,P$105,P$107,P$109,P$111,P$113,P$115,P$117,P$119,P$121,P$123,P$125)) -> 2
A231: Seattle | B231: 1 | C231: 12.80 | D231: 12.90 | E231: 25.70 | F231: 13.30 | G231: 12.00 | H231: 11.00 | I231: 18.15 | J231: 12.70 | K231: 12.70 | L231: 13.20 | M231: 19.30 | N231: 63.15 | O231: 0.0 | P231: 63.15
A232: Cascades | C232: 3 | D232: 3 | E232: 3 | F232: 3 | G232: 3 | H232: 3 | I232: 3 | J232: 3 | K232: 3 | L232: 3 | M232: 3 | N232: 3 | P232: 3
A233: DCI Open Class
A234: Columbians | B234: 1 | C234: 12.90 | D234: 13.00 | E234: 25.90 | F234: 13.20 | G234: 13.40 | H234: 13.00 | I234: 19.80 | J234: 12.30 | K234: 12.90 | L234: 12.60 | M234: 18.90 | N234: 64.60 | O234: 0.0 | P234: 64.60
C235: 1 | D235: 1 | E235: 1 | F235: 1 | G235: 1 | H235: 1 | I235: 1 | J235: 1 | K235: 1 | L235: 1 | M235: 1 | N235: 1 | P235: 1
A238: 7/10/2024 Ogden, Utah
C239: General Effect | F239: Visual | J239: Music
C240: 1 | D240: 2 | F240: Proficiency | G240: Analysis | H240: Color Guard | J240: Brass | K240: Analysis | L240: Percussion | N240: Sub | P240: Total
C241: W. Chumley | D241: J. Bell | E241: Total | F241: M. Turner | G241: E. Beens | H241: H. Nguyen | I241: Total ÷2 | J241: C. Armbruster | K241: C. Rapacki | L241: J. Brooks | M241: Total ÷2 | N241: Total | O241: Pen | P241: Score
A242: DCI World Class | C242: 20 | D242: 20 | E242: 40 | F242: 20 | G242: 20 | H242: 20 | I242: 30 | J242: 20 | K242: 20 | L242: 20 | M242: 30 | N242: 100 | P242: 100
A243: Blue | B243: 7 | C243: 16.60 | D243: 17.10 | E243: 33.70 | F243: 16.50 | G243: 16.30 | H243: 16.50 | I243: 24.65 | J243: 17.10 | K243: 17.00 | L243: 17.20 | M243: 25.65 | N243: 84.00 | O243: 0.0 | P243: 84.00
A244: Devils | C244: 1 | D244: 1 | E244: 1 | F244: 1 | G244: 1 | H244: 1 | I244: 1 | J244: 1 | K244: 1 | L244: 1 | M244: 1 | N244: 1 | P244: 1
A245: Mandarins | B245: 6 | C245: 15.80 | D245: 16.20 | E245: 32.00 | F245: 16.00 | G245: 15.70 | H245: 15.80 | I245: 23.75 | J245: 16.20 | K245: 16.30 | L245: 15.80 | M245: 24.15 | N245: 79.90 | O245: 0.0 | P245: 79.90
C246: 3 | D246: 2 | E246: 2 | F246: 2 | G246: 2 | H246: 2 | I246: 2 | J246: 2 | K246: 2 | L246: 4 | M246: 3 | N246: 2 | P246: 2
A247: Vanguard | B247: 1 | C247: 15.90 | D247: 16.00 | E247: 31.90 | F247: 15.80 | G247: 15.60 | H247: 15.50 | I247: 23.45 | J247: 15.90 | K247: 16.10 | L247: 16.60 | M247: 24.30 | N247: 79.65 | O247: 0.0 | P247: 79.65
C248: 2 | D248: 3 | E248: 3 | F248: 3 | G248: 3 | H248: 3 | I248: 3 | J248: 3 | K248: 3 | L248: 2 | M248: 2 | N248: 3 | P248: 3
A249: Troopers | B249: 5 | C249: 15.30 | D249: 15.20 | E249: 30.50 | F249: 15.20 | G249: 14.80 | H249: 14.60 | I249: 22.30 | J249: 15.80 | K249: 15.60 | L249: 16.30 | M249: 23.85 | N249: 76.65 | O249: 0.0 | P249: 76.65
C250: 4 | D250: 4 | E250: 4 | F250: 4 | G250: 5 | H250: 4 | I250: 4 | J250: 4 | K250: 4 | L250: 3 | M250: 4 | N250: 4 | P250: 4
A251: Blue | B251: 8 | C251: 14.90 | D251: 15.00 | E251: 29.90 | F251: 15.00 | G251: 15.00 | H251: 14.20 | I251: 22.10 | J251: 14.60 | K251: 15.30 | L251: 15.50 | M251: 22.70 | N251: 74.70 | O251: 0.0 | P251: 74.70
A252: Knights | C252: 5 | D252: 5 | E252: 5 | F252: 5 | G252: 4 | H252: 6 | I252: 5 | J252: 5 | K252: 5 | L252: 5 | M252: 5 | N252: 5 | P252: 5
A253: Pacific | B253: 4 | C253: 13.80 | D253: 14.80 | E253: 28.60 | F253: 14.30 | G253: 13.60 | H253: 14.50 | I253: 21.20 | J253: 14.10 | K253: 14.50 | L253: 15.10 | M253: 21.85 | N253: 71.65 | O253: 0.0 | P253: 71.65
A254: Crest | C254: 7 | D254: 6 | E254: 6 | F254: 7 | G254: 6 | H254: 5 | I254: 6 | J254: 7 | K254: 6 | L254: 6 | M254: 6 | N254: 6 | P254: 6
A255: Academy | B255: 3 | C255: 14.00 | D255: 14.60 | E255: 28.60 | F255: 14.50 | G255: 13.50 | H255: 12.80 | I255: 20.40 | J255: 14.20 | K255: 14.20 | L255: 15.00 | M255: 21.70 | N255: 70.70 | O255: 0.0 | P255: 70.70
C256: 6 | D256: 7 | E256: 6 | F256: 6 | G256: 7 | H256: 7 | I256: 7 | J256: 6 | K256: 7 | L256: 7 | M256: 7 | N256: 7 | P256: 7
A257: Seattle | B257: 2 | C257: 12.60 | D257: 12.90 | E257: 25.50 | F257: 13.70 | G257: 12.50 | H257: 11.70 | I257: 18.95 | J257: 12.90 | K257: 13.20 | L257: 12.80 | M257: 19.45 | N257: 63.90 | O257: 0.0 | P257: 63.90
A258: Cascades | C258: 8 | D258: 8 | E258: 8 | F258: 8 | G258: 8 | H258: 8 | I258: 8 | J258: 8 | K258: 8 | L258: 8 | M258: 8 | N258: 8 | P258: 8
A259: DCI Open Class
A260: Battalion | B260: 1 | C260: 11.80 | D260: 12.00 | E260: 23.80 | F260: 12.90 | G260: 12.00 | H260: 11.60 | I260: 18.25 | J260: 12.80 | K260: 12.50 | L260: 12.10 | M260: 18.70 | N260: 60.75 | O260: 0.0 | P260: 60.75
C261: 1 | D261: 1 | E261: 1 | F261: 1 | G261: 1 | H261: 1 | I261: 1 | J261: 1 | K261: 1 | L261: 1 | M261: 1 | N261: 1 | P261: 1
A264: 7/11/2024 Dubuque, Iowa
C265: General Effect | F265: Visual | J265: Music
C266: 1 | D266: 2 | F266: Proficiency | G266: Analysis | H266: Color Guard | J266: Brass | K266: Analysis | L266: Percussion | N266: Sub | P266: Total
C267: J. Howell | D267: A. Snipes | E267: Total | F267: S. Chumley | G267: B. Jones | H267: C. Fisher | I267: Total ÷2 | J267: D. Orser | K267: C. Armbruster | L267: J. Brooks | M267: Total ÷2 | N267: Total | O267: Pen | P267: Score
A268: DCI World Class | C268: 20 | D268: 20 | E268: 40 | F268: 20 | G268: 20 | H268: 20 | I268: 30 | J268: 20 | K268: 20 | L268: 20 | M268: 30 | N268: 100 | P268: 100
A269: Phantom | B269: 3 | C269: 16.40 | D269: 16.60 | E269: 33.00 | F269: 16.50 | G269: 16.70 | H269: 16.80 | I269: 25.00 | J269: 16.60 | K269: 16.40 | L269: 16.80 | M269: 24.90 | N269: 82.90 | O269: 0.0 | P269: 82.90
A270: Regiment | C270: =RANK(C269,(C$6,C$8,C$10,C$12,C$15,C$17,C$19,C$21,C$23,C$25,C$27,C$29,C$31,C$33,C$35,C$37,C$39,C$41,C$43,C$45,C$47,C$49,C$51,C$53,C$55,C$57,C$59,C$61,C$63,C$65,C$67,C$69,C$71,C$73,C$75,C$77,C$79,C$81,C$83,C$85,C$87,C$89,C$91,C$93,C$95,C$97,C$99,C$101,C$103,C$105,C$107,C$109,C$111,C$113,C$115,C$117,C$119,C$121,C$123,C$125)) -> 1 | D270: =RANK(D269,(D$6,D$8,D$10,D$12,D$15,D$17,D$19,D$21,D$23,D$25,D$27,D$29,D$31,D$33,D$35,D$37,D$39,D$41,D$43,D$45,D$47,D$49,D$51,D$53,D$55,D$57,D$59,D$61,D$63,D$65,D$67,D$69,D$71,D$73,D$75,D$77,D$79,D$81,D$83,D$85,D$87,D$89,D$91,D$93,D$95,D$97,D$99,D$101,D$103,D$105,D$107,D$109,D$111,D$113,D$115,D$117,D$119,D$121,D$123,D$125)) -> 1 | E270: =RANK(E269,(E$6,E$8,E$10,E$12,E$15,E$17,E$19,E$21,E$23,E$25,E$27,E$29,E$31,E$33,E$35,E$37,E$39,E$41,E$43,E$45,E$47,E$49,E$51,E$53,E$55,E$57,E$59,E$61,E$63,E$65,E$67,E$69,E$71,E$73,E$75,E$77,E$79,E$81,E$83,E$85,E$87,E$89,E$91,E$93,E$95,E$97,E$99,E$101,E$103,E$105,E$107,E$109,E$111,E$113,E$115,E$117,E$119,E$121,E$123,E$125)) -> 1 | F270: =RANK(F269,(F$6,F$8,F$10,F$12,F$15,F$17,F$19,F$21,F$23,F$25,F$27,F$29,F$31,F$33,F$35,F$37,F$39,F$41,F$43,F$45,F$47,F$49,F$51,F$53,F$55,F$57,F$59,F$61,F$63,F$65,F$67,F$69,F$71,F$73,F$75,F$77,F$79,F$81,F$83,F$85,F$87,F$89,F$91,F$93,F$95,F$97,F$99,F$101,F$103,F$105,F$107,F$109,F$111,F$113,F$115,F$117,F$119,F$121,F$123,F$125)) -> 1 | G270: =RANK(G269,(G$6,G$8,G$10,G$12,G$15,G$17,G$19,G$21,G$23,G$25,G$27,G$29,G$31,G$33,G$35,G$37,G$39,G$41,G$43,G$45,G$47,G$49,G$51,G$53,G$55,G$57,G$59,G$61,G$63,G$65,G$67,G$69,G$71,G$73,G$75,G$77,G$79,G$81,G$83,G$85,G$87,G$89,G$91,G$93,G$95,G$97,G$99,G$101,G$103,G$105,G$107,G$109,G$111,G$113,G$115,G$117,G$119,G$121,G$123,G$125)) -> 1 | H270: =RANK(H269,(H$6,H$8,H$10,H$12,H$15,H$17,H$19,H$21,H$23,H$25,H$27,H$29,H$31,H$33,H$35,H$37,H$39,H$41,H$43,H$45,H$47,H$49,H$51,H$53,H$55,H$57,H$59,H$61,H$63,H$65,H$67,H$69,H$71,H$73,H$75,H$77,H$79,H$81,H$83,H$85,H$87,H$89,H$91,H$93,H$95,H$97,H$99,H$101,H$103,H$105,H$107,H$109,H$111,H$113,H$115,H$117,H$119,H$121,H$123,H$125)) -> 1 | I270: =RANK(I269,(I$6,I$8,I$10,I$12,I$15,I$17,I$19,I$21,I$23,I$25,I$27,I$29,I$31,I$33,I$35,I$37,I$39,I$41,I$43,I$45,I$47,I$49,I$51,I$53,I$55,I$57,I$59,I$61,I$63,I$65,I$67,I$69,I$71,I$73,I$75,I$77,I$79,I$81,I$83,I$85,I$87,I$89,I$91,I$93,I$95,I$97,I$99,I$101,I$103,I$105,I$107,I$109,I$111,I$113,I$115,I$117,I$119,I$121,I$123,I$125)) -> 1 | J270: =RANK(J269,(J$6,J$8,J$10,J$12,J$15,J$17,J$19,J$21,J$23,J$25,J$27,J$29,J$31,J$33,J$35,J$37,J$39,J$41,J$43,J$45,J$47,J$49,J$51,J$53,J$55,J$57,J$59,J$61,J$63,J$65,J$67,J$69,J$71,J$73,J$75,J$77,J$79,J$81,J$83,J$85,J$87,J$89,J$91,J$93,J$95,J$97,J$99,J$101,J$103,J$105,J$107,J$109,J$111,J$113,J$115,J$117,J$119,J$121,J$123,J$125)) -> 1 | K270: =RANK(K269,(K$6,K$8,K$10,K$12,K$15,K$17,K$19,K$21,K$23,K$25,K$27,K$29,K$31,K$33,K$35,K$37,K$39,K$41,K$43,K$45,K$47,K$49,K$51,K$53,K$55,K$57,K$59,K$61,K$63,K$65,K$67,K$69,K$71,K$73,K$75,K$77,K$79,K$81,K$83,K$85,K$87,K$89,K$91,K$93,K$95,K$97,K$99,K$101,K$103,K$105,K$107,K$109,K$111,K$113,K$115,K$117,K$119,K$121,K$123,K$125)) -> 1 | L270: =RANK(L269,(L$6,L$8,L$10,L$12,L$15,L$17,L$19,L$21,L$23,L$25,L$27,L$29,L$31,L$33,L$35,L$37,L$39,L$41,L$43,L$45,L$47,L$49,L$51,L$53,L$55,L$57,L$59,L$61,L$63,L$65,L$67,L$69,L$71,L$73,L$75,L$77,L$79,L$81,L$83,L$85,L$87,L$89,L$91,L$93,L$95,L$97,L$99,L$101,L$103,L$105,L$107,L$109,L$111,L$113,L$115,L$117,L$119,L$121,L$123,L$125)) -> 1 | M270: =RANK(M269,(M$6,M$8,M$10,M$12,M$15,M$17,M$19,M$21,M$23,M$25,M$27,M$29,M$31,M$33,M$35,M$37,M$39,M$41,M$43,M$45,M$47,M$49,M$51,M$53,M$55,M$57,M$59,M$61,M$63,M$65,M$67,M$69,M$71,M$73,M$75,M$77,M$79,M$81,M$83,M$85,M$87,M$89,M$91,M$93,M$95,M$97,M$99,M$101,M$103,M$105,M$107,M$109,M$111,M$113,M$115,M$117,M$119,M$121,M$123,M$125)) -> 1 | N270: =RANK(N269,(N$6,N$8,N$10,N$12,N$15,N$17,N$19,N$21,N$23,N$25,N$27,N$29,N$31,N$33,N$35,N$37,N$39,N$41,N$43,N$45,N$47,N$49,N$51,N$53,N$55,N$57,N$59,N$61,N$63,N$65,N$67,N$69,N$71,N$73,N$75,N$77,N$79,N$81,N$83,N$85,N$87,N$89,N$91,N$93,N$95,N$97,N$99,N$101,N$103,N$105,N$107,N$109,N$111,N$113,N$115,N$117,N$119,N$121,N$123,N$125)) -> 1 | P270: =RANK(P269,(P$6,P$8,P$10,P$12,P$15,P$17,P$19,P$21,P$23,P$25,P$27,P$29,P$31,P$33,P$35,P$37,P$39,P$41,P$43,P$45,P$47,P$49,P$51,P$53,P$55,P$57,P$59,P$61,P$63,P$65,P$67,P$69,P$71,P$73,P$75,P$77,P$79,P$81,P$83,P$85,P$87,P$89,P$91,P$93,P$95,P$97,P$99,P$101,P$103,P$105,P$107,P$109,P$111,P$113,P$115,P$117,P$119,P$121,P$123,P$125)) -> 1
A271: Cavaliers | B271: 2 | C271: 15.40 | D271: 15.80 | E271: 31.20 | F271: 15.40 | G271: 15.90 | H271: 15.40 | I271: 23.35 | J271: 15.80 | K271: 15.30 | L271: 16.00 | M271: 23.55 | N271: 78.10 | O271: 0.0 | P271: 78.10
C272: =RANK(C271,(C$6,C$8,C$10,C$12,C$15,C$17,C$19,C$21,C$23,C$25,C$27,C$29,C$31,C$33,C$35,C$37,C$39,C$41,C$43,C$45,C$47,C$49,C$51,C$53,C$55,C$57,C$59,C$61,C$63,C$65,C$67,C$69,C$71,C$73,C$75,C$77,C$79,C$81,C$83,C$85,C$87,C$89,C$91,C$93,C$95,C$97,C$99,C$101,C$103,C$105,C$107,C$109,C$111,C$113,C$115,C$117,C$119,C$121,C$123,C$125)) -> 3 | D272: =RANK(D271,(D$6,D$8,D$10,D$12,D$15,D$17,D$19,D$21,D$23,D$25,D$27,D$29,D$31,D$33,D$35,D$37,D$39,D$41,D$43,D$45,D$47,D$49,D$51,D$53,D$55,D$57,D$59,D$61,D$63,D$65,D$67,D$69,D$71,D$73,D$75,D$77,D$79,D$81,D$83,D$85,D$87,D$89,D$91,D$93,D$95,D$97,D$99,D$101,D$103,D$105,D$107,D$109,D$111,D$113,D$115,D$117,D$119,D$121,D$123,D$125)) -> 2 | E272: =RANK(E271,(E$6,E$8,E$10,E$12,E$15,E$17,E$19,E$21,E$23,E$25,E$27,E$29,E$31,E$33,E$35,E$37,E$39,E$41,E$43,E$45,E$47,E$49,E$51,E$53,E$55,E$57,E$59,E$61,E$63,E$65,E$67,E$69,E$71,E$73,E$75,E$77,E$79,E$81,E$83,E$85,E$87,E$89,E$91,E$93,E$95,E$97,E$99,E$101,E$103,E$105,E$107,E$109,E$111,E$113,E$115,E$117,E$119,E$121,E$123,E$125)) -> 2 | F272: =RANK(F271,(F$6,F$8,F$10,F$12,F$15,F$17,F$19,F$21,F$23,F$25,F$27,F$29,F$31,F$33,F$35,F$37,F$39,F$41,F$43,F$45,F$47,F$49,F$51,F$53,F$55,F$57,F$59,F$61,F$63,F$65,F$67,F$69,F$71,F$73,F$75,F$77,F$79,F$81,F$83,F$85,F$87,F$89,F$91,F$93,F$95,F$97,F$99,F$101,F$103,F$105,F$107,F$109,F$111,F$113,F$115,F$117,F$119,F$121,F$123,F$125)) -> 4 | G272: =RANK(G271,(G$6,G$8,G$10,G$12,G$15,G$17,G$19,G$21,G$23,G$25,G$27,G$29,G$31,G$33,G$35,G$37,G$39,G$41,G$43,G$45,G$47,G$49,G$51,G$53,G$55,G$57,G$59,G$61,G$63,G$65,G$67,G$69,G$71,G$73,G$75,G$77,G$79,G$81,G$83,G$85,G$87,G$89,G$91,G$93,G$95,G$97,G$99,G$101,G$103,G$105,G$107,G$109,G$111,G$113,G$115,G$117,G$119,G$121,G$123,G$125)) -> 3 | H272: =RANK(H271,(H$6,H$8,H$10,H$12,H$15,H$17,H$19,H$21,H$23,H$25,H$27,H$29,H$31,H$33,H$35,H$37,H$39,H$41,H$43,H$45,H$47,H$49,H$51,H$53,H$55,H$57,H$59,H$61,H$63,H$65,H$67,H$69,H$71,H$73,H$75,H$77,H$79,H$81,H$83,H$85,H$87,H$89,H$91,H$93,H$95,H$97,H$99,H$101,H$103,H$105,H$107,H$109,H$111,H$113,H$115,H$117,H$119,H$121,H$123,H$125)) -> 3 | I272: =RANK(I271,(I$6,I$8,I$10,I$12,I$15,I$17,I$19,I$21,I$23,I$25,I$27,I$29,I$31,I$33,I$35,I$37,I$39,I$41,I$43,I$45,I$47,I$49,I$51,I$53,I$55,I$57,I$59,I$61,I$63,I$65,I$67,I$69,I$71,I$73,I$75,I$77,I$79,I$81,I$83,I$85,I$87,I$89,I$91,I$93,I$95,I$97,I$99,I$101,I$103,I$105,I$107,I$109,I$111,I$113,I$115,I$117,I$119,I$121,I$123,I$125)) -> 4 | J272: =RANK(J271,(J$6,J$8,J$10,J$12,J$15,J$17,J$19,J$21,J$23,J$25,J$27,J$29,J$31,J$33,J$35,J$37,J$39,J$41,J$43,J$45,J$47,J$49,J$51,J$53,J$55,J$57,J$59,J$61,J$63,J$65,J$67,J$69,J$71,J$73,J$75,J$77,J$79,J$81,J$83,J$85,J$87,J$89,J$91,J$93,J$95,J$97,J$99,J$101,J$103,J$105,J$107,J$109,J$111,J$113,J$115,J$117,J$119,J$121,J$123,J$125)) -> 3 | K272: =RANK(K271,(K$6,K$8,K$10,K$12,K$15,K$17,K$19,K$21,K$23,K$25,K$27,K$29,K$31,K$33,K$35,K$37,K$39,K$41,K$43,K$45,K$47,K$49,K$51,K$53,K$55,K$57,K$59,K$61,K$63,K$65,K$67,K$69,K$71,K$73,K$75,K$77,K$79,K$81,K$83,K$85,K$87,K$89,K$91,K$93,K$95,K$97,K$99,K$101,K$103,K$105,K$107,K$109,K$111,K$113,K$115,K$117,K$119,K$121,K$123,K$125)) -> 4 | L272: =RANK(L271,(L$6,L$8,L$10,L$12,L$15,L$17,L$19,L$21,L$23,L$25,L$27,L$29,L$31,L$33,L$35,L$37,L$39,L$41,L$43,L$45,L$47,L$49,L$51,L$53,L$55,L$57,L$59,L$61,L$63,L$65,L$67,L$69,L$71,L$73,L$75,L$77,L$79,L$81,L$83,L$85,L$87,L$89,L$91,L$93,L$95,L$97,L$99,L$101,L$103,L$105,L$107,L$109,L$111,L$113,L$115,L$117,L$119,L$121,L$123,L$125)) -> 4 | M272: =RANK(M271,(M$6,M$8,M$10,M$12,M$15,M$17,M$19,M$21,M$23,M$25,M$27,M$29,M$31,M$33,M$35,M$37,M$39,M$41,M$43,M$45,M$47,M$49,M$51,M$53,M$55,M$57,M$59,M$61,M$63,M$65,M$67,M$69,M$71,M$73,M$75,M$77,M$79,M$81,M$83,M$85,M$87,M$89,M$91,M$93,M$95,M$97,M$99,M$101,M$103,M$105,M$107,M$109,M$111,M$113,M$115,M$117,M$119,M$121,M$123,M$125)) -> 4 | N272: =RANK(N271,(N$6,N$8,N$10,N$12,N$15,N$17,N$19,N$21,N$23,N$25,N$27,N$29,N$31,N$33,N$35,N$37,N$39,N$41,N$43,N$45,N$47,N$49,N$51,N$53,N$55,N$57,N$59,N$61,N$63,N$65,N$67,N$69,N$71,N$73,N$75,N$77,N$79,N$81,N$83,N$85,N$87,N$89,N$91,N$93,N$95,N$97,N$99,N$101,N$103,N$105,N$107,N$109,N$111,N$113,N$115,N$117,N$119,N$121,N$123,N$125)) -> 2 | P272: =RANK(P271,(P$6,P$8,P$10,P$12,P$15,P$17,P$19,P$21,P$23,P$25,P$27,P$29,P$31,P$33,P$35,P$37,P$39,P$41,P$43,P$45,P$47,P$49,P$51,P$53,P$55,P$57,P$59,P$61,P$63,P$65,P$67,P$69,P$71,P$73,P$75,P$77,P$79,P$81,P$83,P$85,P$87,P$89,P$91,P$93,P$95,P$97,P$99,P$101,P$103,P$105,P$107,P$109,P$111,P$113,P$115,P$117,P$119,P$121,P$123,P$125)) -> 2
A273: Colts | B273: 4 | C273: 15.60 | D273: 15.30 | E273: 30.90 | F273: 15.50 | G273: 16.00 | H273: 15.30 | I273: 23.40 | J273: 15.50 | K273: 15.70 | L273: 16.40 | M273: 23.80 | N273: 78.10 | O273: 0.0 | P273: 78.10
C274: =RANK(C273,(C$6,C$8,C$10,C$12,C$15,C$17,C$19,C$21,C$23,C$25,C$27,C$29,C$31,C$33,C$35,C$37,C$39,C$41,C$43,C$45,C$47,C$49,C$51,C$53,C$55,C$57,C$59,C$61,C$63,C$65,C$67,C$69,C$71,C$73,C$75,C$77,C$79,C$81,C$83,C$85,C$87,C$89,C$91,C$93,C$95,C$97,C$99,C$101,C$103,C$105,C$107,C$109,C$111,C$113,C$115,C$117,C$119,C$121,C$123,C$125)) -> 2 | D274: =RANK(D273,(D$6,D$8,D$10,D$12,D$15,D$17,D$19,D$21,D$23,D$25,D$27,D$29,D$31,D$33,D$35,D$37,D$39,D$41,D$43,D$45,D$47,D$49,D$51,D$53,D$55,D$57,D$59,D$61,D$63,D$65,D$67,D$69,D$71,D$73,D$75,D$77,D$79,D$81,D$83,D$85,D$87,D$89,D$91,D$93,D$95,D$97,D$99,D$101,D$103,D$105,D$107,D$109,D$111,D$113,D$115,D$117,D$119,D$121,D$123,D$125)) -> 4 | E274: =RANK(E273,(E$6,E$8,E$10,E$12,E$15,E$17,E$19,E$21,E$23,E$25,E$27,E$29,E$31,E$33,E$35,E$37,E$39,E$41,E$43,E$45,E$47,E$49,E$51,E$53,E$55,E$57,E$59,E$61,E$63,E$65,E$67,E$69,E$71,E$73,E$75,E$77,E$79,E$81,E$83,E$85,E$87,E$89,E$91,E$93,E$95,E$97,E$99,E$101,E$103,E$105,E$107,E$109,E$111,E$113,E$115,E$117,E$119,E$121,E$123,E$125)) -> 3 | F274: =RANK(F273,(F$6,F$8,F$10,F$12,F$15,F$17,F$19,F$21,F$23,F$25,F$27,F$29,F$31,F$33,F$35,F$37,F$39,F$41,F$43,F$45,F$47,F$49,F$51,F$53,F$55,F$57,F$59,F$61,F$63,F$65,F$67,F$69,F$71,F$73,F$75,F$77,F$79,F$81,F$83,F$85,F$87,F$89,F$91,F$93,F$95,F$97,F$99,F$101,F$103,F$105,F$107,F$109,F$111,F$113,F$115,F$117,F$119,F$121,F$123,F$125)) -> 3 | G274: =RANK(G273,(G$6,G$8,G$10,G$12,G$15,G$17,G$19,G$21,G$23,G$25,G$27,G$29,G$31,G$33,G$35,G$37,G$39,G$41,G$43,G$45,G$47,G$49,G$51,G$53,G$55,G$57,G$59,G$61,G$63,G$65,G$67,G$69,G$71,G$73,G$75,G$77,G$79,G$81,G$83,G$85,G$87,G$89,G$91,G$93,G$95,G$97,G$99,G$101,G$103,G$105,G$107,G$109,G$111,G$113,G$115,G$117,G$119,G$121,G$123,G$125)) -> 2 | H274: =RANK(H273,(H$6,H$8,H$10,H$12,H$15,H$17,H$19,H$21,H$23,H$25,H$27,H$29,H$31,H$33,H$35,H$37,H$39,H$41,H$43,H$45,H$47,H$49,H$51,H$53,H$55,H$57,H$59,H$61,H$63,H$65,H$67,H$69,H$71,H$73,H$75,H$77,H$79,H$81,H$83,H$85,H$87,H$89,H$91,H$93,H$95,H$97,H$99,H$101,H$103,H$105,H$107,H$109,H$111,H$113,H$115,H$117,H$119,H$121,H$123,H$125)) -> 4 | I274: =RANK(I273,(I$6,I$8,I$10,I$12,I$15,I$17,I$19,I$21,I$23,I$25,I$27,I$29,I$31,I$33,I$35,I$37,I$39,I$41,I$43,I$45,I$47,I$49,I$51,I$53,I$55,I$57,I$59,I$61,I$63,I$65,I$67,I$69,I$71,I$73,I$75,I$77,I$79,I$81,I$83,I$85,I$87,I$89,I$91,I$93,I$95,I$97,I$99,I$101,I$103,I$105,I$107,I$109,I$111,I$113,I$115,I$117,I$119,I$121,I$123,I$125)) -> 3 | J274: =RANK(J273,(J$6,J$8,J$10,J$12,J$15,J$17,J$19,J$21,J$23,J$25,J$27,J$29,J$31,J$33,J$35,J$37,J$39,J$41,J$43,J$45,J$47,J$49,J$51,J$53,J$55,J$57,J$59,J$61,J$63,J$65,J$67,J$69,J$71,J$73,J$75,J$77,J$79,J$81,J$83,J$85,J$87,J$89,J$91,J$93,J$95,J$97,J$99,J$101,J$103,J$105,J$107,J$109,J$111,J$113,J$115,J$117,J$119,J$121,J$123,J$125)) -> 4 | K274: =RANK(K273,(K$6,K$8,K$10,K$12,K$15,K$17,K$19,K$21,K$23,K$25,K$27,K$29,K$31,K$33,K$35,K$37,K$39,K$41,K$43,K$45,K$47,K$49,K$51,K$53,K$55,K$57,K$59,K$61,K$63,K$65,K$67,K$69,K$71,K$73,K$75,K$77,K$79,K$81,K$83,K$85,K$87,K$89,K$91,K$93,K$95,K$97,K$99,K$101,K$103,K$105,K$107,K$109,K$111,K$113,K$115,K$117,K$119,K$121,K$123,K$125)) -> 2 | L274: =RANK(L273,(L$6,L$8,L$10,L$12,L$15,L$17,L$19,L$21,L$23,L$25,L$27,L$29,L$31,L$33,L$35,L$37,L$39,L$41,L$43,L$45,L$47,L$49,L$51,L$53,L$55,L$57,L$59,L$61,L$63,L$65,L$67,L$69,L$71,L$73,L$75,L$77,L$79,L$81,L$83,L$85,L$87,L$89,L$91,L$93,L$95,L$97,L$99,L$101,L$103,L$105,L$107,L$109,L$111,L$113,L$115,L$117,L$119,L$121,L$123,L$125)) -> 2 | M274: =RANK(M273,(M$6,M$8,M$10,M$12,M$15,M$17,M$19,M$21,M$23,M$25,M$27,M$29,M$31,M$33,M$35,M$37,M$39,M$41,M$43,M$45,M$47,M$49,M$51,M$53,M$55,M$57,M$59,M$61,M$63,M$65,M$67,M$69,M$71,M$73,M$75,M$77,M$79,M$81,M$83,M$85,M$87,M$89,M$91,M$93,M$95,M$97,M$99,M$101,M$103,M$105,M$107,M$109,M$111,M$113,M$115,M$117,M$119,M$121,M$123,M$125)) -> 3 | N274: =RANK(N273,(N$6,N$8,N$10,N$12,N$15,N$17,N$19,N$21,N$23,N$25,N$27,N$29,N$31,N$33,N$35,N$37,N$39,N$41,N$43,N$45,N$47,N$49,N$51,N$53,N$55,N$57,N$59,N$61,N$63,N$65,N$67,N$69,N$71,N$73,N$75,N$77,N$79,N$81,N$83,N$85,N$87,N$89,N$91,N$93,N$95,N$97,N$99,N$101,N$103,N$105,N$107,N$109,N$111,N$113,N$115,N$117,N$119,N$121,N$123,N$125)) -> 2 | P274: =RANK(P273,(P$6,P$8,P$10,P$12,P$15,P$17,P$19,P$21,P$23,P$25,P$27,P$29,P$31,P$33,P$35,P$37,P$39,P$41,P$43,P$45,P$47,P$49,P$51,P$53,P$55,P$57,P$59,P$61,P$63,P$65,P$67,P$69,P$71,P$73,P$75,P$77,P$79,P$81,P$83,P$85,P$87,P$89,P$91,P$93,P$95,P$97,P$99,P$101,P$103,P$105,P$107,P$109,P$111,P$113,P$115,P$117,P$119,P$121,P$123,P$125)) -> 2
A275: Blue | B275: 1 | C275: 15.10 | D275: 15.50 | E275: 30.60 | F275: 16.10 | G275: 15.60 | H275: 15.50 | I275: 23.60 | J275: 16.20 | K275: 15.40 | L275: 16.10 | M275: 23.85 | N275: 78.05 | O275: 0.0 | P275: 78.05
A276: Stars | C276: =RANK(C275,(C$6,C$8,C$10,C$12,C$15,C$17,C$19,C$21,C$23,C$25,C$27,C$29,C$31,C$33,C$35,C$37,C$39,C$41,C$43,C$45,C$47,C$49,C$51,C$53,C$55,C$57,C$59,C$61,C$63,C$65,C$67,C$69,C$71,C$73,C$75,C$77,C$79,C$81,C$83,C$85,C$87,C$89,C$91,C$93,C$95,C$97,C$99,C$101,C$103,C$105,C$107,C$109,C$111,C$113,C$115,C$117,C$119,C$121,C$123,C$125)) -> 4 | D276: =RANK(D275,(D$6,D$8,D$10,D$12,D$15,D$17,D$19,D$21,D$23,D$25,D$27,D$29,D$31,D$33,D$35,D$37,D$39,D$41,D$43,D$45,D$47,D$49,D$51,D$53,D$55,D$57,D$59,D$61,D$63,D$65,D$67,D$69,D$71,D$73,D$75,D$77,D$79,D$81,D$83,D$85,D$87,D$89,D$91,D$93,D$95,D$97,D$99,D$101,D$103,D$105,D$107,D$109,D$111,D$113,D$115,D$117,D$119,D$121,D$123,D$125)) -> 3 | E276: =RANK(E275,(E$6,E$8,E$10,E$12,E$15,E$17,E$19,E$21,E$23,E$25,E$27,E$29,E$31,E$33,E$35,E$37,E$39,E$41,E$43,E$45,E$47,E$49,E$51,E$53,E$55,E$57,E$59,E$61,E$63,E$65,E$67,E$69,E$71,E$73,E$75,E$77,E$79,E$81,E$83,E$85,E$87,E$89,E$91,E$93,E$95,E$97,E$99,E$101,E$103,E$105,E$107,E$109,E$111,E$113,E$115,E$117,E$119,E$121,E$123,E$125)) -> 4 | F276: =RANK(F275,(F$6,F$8,F$10,F$12,F$15,F$17,F$19,F$21,F$23,F$25,F$27,F$29,F$31,F$33,F$35,F$37,F$39,F$41,F$43,F$45,F$47,F$49,F$51,F$53,F$55,F$57,F$59,F$61,F$63,F$65,F$67,F$69,F$71,F$73,F$75,F$77,F$79,F$81,F$83,F$85,F$87,F$89,F$91,F$93,F$95,F$97,F$99,F$101,F$103,F$105,F$107,F$109,F$111,F$113,F$115,F$117,F$119,F$121,F$123,F$125)) -> 2 | G276: =RANK(G275,(G$6,G$8,G$10,G$12,G$15,G$17,G$19,G$21,G$23,G$25,G$27,G$29,G$31,G$33,G$35,G$37,G$39,G$41,G$43,G$45,G$47,G$49,G$51,G$53,G$55,G$57,G$59,G$61,G$63,G$65,G$67,G$69,G$71,G$73,G$75,G$77,G$79,G$81,G$83,G$85,G$87,G$89,G$91,G$93,G$95,G$97,G$99,G$101,G$103,G$105,G$107,G$109,G$111,G$113,G$115,G$117,G$119,G$121,G$123,G$125)) -> 4 | H276: =RANK(H275,(H$6,H$8,H$10,H$12,H$15,H$17,H$19,H$21,H$23,H$25,H$27,H$29,H$31,H$33,H$35,H$37,H$39,H$41,H$43,H$45,H$47,H$49,H$51,H$53,H$55,H$57,H$59,H$61,H$63,H$65,H$67,H$69,H$71,H$73,H$75,H$77,H$79,H$81,H$83,H$85,H$87,H$89,H$91,H$93,H$95,H$97,H$99,H$101,H$103,H$105,H$107,H$109,H$111,H$113,H$115,H$117,H$119,H$121,H$123,H$125)) -> 2 | I276: =RANK(I275,(I$6,I$8,I$10,I$12,I$15,I$17,I$19,I$21,I$23,I$25,I$27,I$29,I$31,I$33,I$35,I$37,I$39,I$41,I$43,I$45,I$47,I$49,I$51,I$53,I$55,I$57,I$59,I$61,I$63,I$65,I$67,I$69,I$71,I$73,I$75,I$77,I$79,I$81,I$83,I$85,I$87,I$89,I$91,I$93,I$95,I$97,I$99,I$101,I$103,I$105,I$107,I$109,I$111,I$113,I$115,I$117,I$119,I$121,I$123,I$125)) -> 2 | J276: =RANK(J275,(J$6,J$8,J$10,J$12,J$15,J$17,J$19,J$21,J$23,J$25,J$27,J$29,J$31,J$33,J$35,J$37,J$39,J$41,J$43,J$45,J$47,J$49,J$51,J$53,J$55,J$57,J$59,J$61,J$63,J$65,J$67,J$69,J$71,J$73,J$75,J$77,J$79,J$81,J$83,J$85,J$87,J$89,J$91,J$93,J$95,J$97,J$99,J$101,J$103,J$105,J$107,J$109,J$111,J$113,J$115,J$117,J$119,J$121,J$123,J$125)) -> 2 | K276: =RANK(K275,(K$6,K$8,K$10,K$12,K$15,K$17,K$19,K$21,K$23,K$25,K$27,K$29,K$31,K$33,K$35,K$37,K$39,K$41,K$43,K$45,K$47,K$49,K$51,K$53,K$55,K$57,K$59,K$61,K$63,K$65,K$67,K$69,K$71,K$73,K$75,K$77,K$79,K$81,K$83,K$85,K$87,K$89,K$91,K$93,K$95,K$97,K$99,K$101,K$103,K$105,K$107,K$109,K$111,K$113,K$115,K$117,K$119,K$121,K$123,K$125)) -> 3 | L276: =RANK(L275,(L$6,L$8,L$10,L$12,L$15,L$17,L$19,L$21,L$23,L$25,L$27,L$29,L$31,L$33,L$35,L$37,L$39,L$41,L$43,L$45,L$47,L$49,L$51,L$53,L$55,L$57,L$59,L$61,L$63,L$65,L$67,L$69,L$71,L$73,L$75,L$77,L$79,L$81,L$83,L$85,L$87,L$89,L$91,L$93,L$95,L$97,L$99,L$101,L$103,L$105,L$107,L$109,L$111,L$113,L$115,L$117,L$119,L$121,L$123,L$125)) -> 3 | M276: =RANK(M275,(M$6,M$8,M$10,M$12,M$15,M$17,M$19,M$21,M$23,M$25,M$27,M$29,M$31,M$33,M$35,M$37,M$39,M$41,M$43,M$45,M$47,M$49,M$51,M$53,M$55,M$57,M$59,M$61,M$63,M$65,M$67,M$69,M$71,M$73,M$75,M$77,M$79,M$81,M$83,M$85,M$87,M$89,M$91,M$93,M$95,M$97,M$99,M$101,M$103,M$105,M$107,M$109,M$111,M$113,M$115,M$117,M$119,M$121,M$123,M$125)) -> 2 | N276: =RANK(N275,(N$6,N$8,N$10,N$12,N$15,N$17,N$19,N$21,N$23,N$25,N$27,N$29,N$31,N$33,N$35,N$37,N$39,N$41,N$43,N$45,N$47,N$49,N$51,N$53,N$55,N$57,N$59,N$61,N$63,N$65,N$67,N$69,N$71,N$73,N$75,N$77,N$79,N$81,N$83,N$85,N$87,N$89,N$91,N$93,N$95,N$97,N$99,N$101,N$103,N$105,N$107,N$109,N$111,N$113,N$115,N$117,N$119,N$121,N$123,N$125)) -> 4 | P276: =RANK(P275,(P$6,P$8,P$10,P$12,P$15,P$17,P$19,P$21,P$23,P$25,P$27,P$29,P$31,P$33,P$35,P$37,P$39,P$41,P$43,P$45,P$47,P$49,P$51,P$53,P$55,P$57,P$59,P$61,P$63,P$65,P$67,P$69,P$71,P$73,P$75,P$77,P$79,P$81,P$83,P$85,P$87,P$89,P$91,P$93,P$95,P$97,P$99,P$101,P$103,P$105,P$107,P$109,P$111,P$113,P$115,P$117,P$119,P$121,P$123,P$125)) -> 4
A277: DCI Open Class
A278: River City | B278: 1 | C278: 12.70 | D278: 14.30 | E278: 27.00 | F278: 13.10 | G278: 13.80 | H278: 13.30 | I278: 20.10 | J278: 12.40 | K278: 12.70 | L278: 12.80 | M278: 18.95 | N278: 66.05 | O278: 0.0 | P278: 66.05
A279: Rhythm | C279: 1 | D279: 1 | E279: 1 | F279: 1 | G279: 1 | H279: 1 | I279: 1 | J279: 1 | K279: 1 | L279: 1 | M279: 1 | N279: 1 | P279: 1
A280: Colt | B280: 2 | C280: 11.90 | D280: 12.50 | E280: 24.40 | F280: 12.50 | G280: 12.30 | H280: 12.50 | I280: 18.65 | J280: 12.00 | K280: 12.10 | L280: 11.90 | M280: 18.00 | N280: 61.05 | O280: 0.0 | P280: 61.05
A281: Cadets | C281: 2 | D281: 2 | E281: 2 | F281: 2 | G281: 2 | H281: 2 | I281: 2 | J281: 2 | K281: 2 | L281: 2 | M281: 2 | N281: 2 | P281: 2
A284: 7/11/2024 Muscle Shoals, Alabama
C285: General Effect | F285: Visual | J285: Music
C286: 1 | D286: 2 | F286: Proficiency | G286: Analysis | H286: Color Guard | J286: Brass | K286: Analysis | L286: Percussion | N286: Sub | P286: Total
C287: R. Bailey | D287: G. Miller | E287: Total | F287: J. Gilley | G287: C. Dillon | H287: B. Brahan | I287: Total ÷2 | J287: M. Hoskins | K287: R. Rios | L287: M. Davis | M287: Total ÷2 | N287: Total | O287: Pen | P287: Score
A288: DCI World Class | C288: 20 | D288: 20 | E288: 40 | F288: 20 | G288: 20 | H288: 20 | I288: 30 | J288: 20 | K288: 20 | L288: 20 | M288: 30 | N288: 100 | P288: 100
A289: Boston | B289: 4 | C289: 17.30 | D289: 17.40 | E289: 34.70 | F289: 16.80 | G289: 17.10 | H289: 17.40 | I289: 25.65 | J289: 17.00 | K289: 17.50 | L289: 16.90 | M289: 25.70 | N289: 86.05 | O289: 0.0 | P289: 86.05
A290: Crusaders | C290: 1 | D290: 1 | E290: 1 | F290: 1 | G290: 1 | H290: 1 | I290: 1 | J290: 1 | K290: 1 | L290: 1 | M290: 1 | N290: 1 | P290: 1
A291: Spirit of | B291: 2 | C291: 15.60 | D291: 15.70 | E291: 31.30 | F291: 14.90 | G291: 15.40 | H291: 15.00 | I291: 22.65 | J291: 14.70 | K291: 15.50 | L291: 15.30 | M291: 22.75 | N291: 76.70 | O291: 0.0 | P291: 76.70
A292: Atlanta | C292: 2 | D292: 2 | E292: 2 | F292: 2 | G292: 2 | H292: 2 | I292: 2 | J292: 3 | K292: 2 | L292: 2 | M292: 2 | N292: 2 | P292: 2
A293: Crossmen | B293: 3 | C293: 14.80 | D293: 14.30 | E293: 29.10 | F293: 14.00 | G293: 14.50 | H293: 14.60 | I293: 21.55 | J293: 14.90 | K293: 14.80 | L293: 14.50 | M293: 22.10 | N293: 72.75 | O293: 0.0 | P293: 72.75
C294: 3 | D294: 4 | E294: 4 | F294: 4 | G294: 3 | H294: 3 | I294: 3 | J294: 2 | K294: 3 | L294: 3 | M294: 3 | N294: 3 | P294: 3
A295: Music | B295: 1 | C295: 14.60 | D295: 14.60 | E295: 29.20 | F295: 14.40 | G295: 14.40 | H295: 14.30 | I295: 21.55 | J295: 14.30 | K295: 14.50 | L295: 14.30 | M295: 21.55 | N295: 72.30 | O295: 0.0 | P295: 72.30
A296: City | C296: 4 | D296: 3 | E296: 3 | F296: 3 | G296: 4 | H296: 4 | I296: 3 | J296: 4 | K296: 4 | L296: 4 | M296: 4 | N296: 4 | P296: 4
A297: DCI Open Class
A298: Spartans | B298: 1 | C298: 14.20 | D298: 13.80 | E298: 28.00 | F298: 13.70 | G298: 13.60 | H298: 13.80 | I298: 20.55 | J298: 13.30 | K298: 14.10 | L298: 13.20 | M298: 20.30 | N298: 68.85 | O298: 0.0 | P298: 68.85
C299: 1 | D299: 1 | E299: 1 | F299: 1 | G299: 1 | H299: 1 | I299: 1 | J299: 1 | K299: 1 | L299: 1 | M299: 1 | N299: 1 | P299: 1
A302: 7/12/2024 Cheyenne, Wyoming
C303: General Effect | F303: Visual | J303: Music
C304: 1 | D304: 2 | F304: Proficiency | G304: Analysis | H304: Color Guard | J304: Brass | K304: Analysis | L304: Percussion | N304: Sub | P304: Total
C305: W. Chumley | D305: M. Howard | E305: Total | F305: T. Wingate | G305: G. Oliviero | H305: E. Beens | I305: Total ÷2 | J305: D. Orser | K305: A. Snipes | L305: B. Williams | M305: Total ÷2 | N305: Total | O305: Pen | P305: Score
A306: DCI World Class | C306: 20 | D306: 20 | E306: 40 | F306: 20 | G306: 20 | H306: 20 | I306: 30 | J306: 20 | K306: 20 | L306: 20 | M306: 30 | N306: 100 | P306: 100
A307: Troopers | B307: 5 | C307: 15.50 | D307: 15.60 | E307: 31.10 | F307: 15.50 | G307: 15.60 | H307: 14.80 | I307: 22.95 | J307: 16.40 | K307: 15.90 | L307: 16.40 | M307: 24.35 | N307: 78.40 | O307: 0.0 | P307: 78.40
C308: 1 | D308: 1 | E308: 1 | F308: 1 | G308: 1 | H308: 2 | I308: 1 | J308: 1 | K308: 1 | L308: 1 | M308: 1 | N308: 1 | P308: 1
A309: Pacific | B309: 3 | C309: 14.40 | D309: 14.90 | E309: 29.30 | F309: 14.60 | G309: 15.00 | H309: 15.20 | I309: 22.40 | J309: 15.50 | K309: 14.80 | L309: 15.20 | M309: 22.75 | N309: 74.45 | O309: 0.0 | P309: 74.45
A310: Crest | C310: 2 | D310: 2 | E310: 2 | F310: 2 | G310: 2 | H310: 1 | I310: 2 | J310: 2 | K310: 3 | L310: 2 | M310: 2 | N310: 2 | P310: 2
A311: Academy | B311: 4 | C311: 14.10 | D311: 14.50 | E311: 28.60 | F311: 14.40 | G311: 14.60 | H311: 13.50 | I311: 21.25 | J311: 13.30 | K311: 15.10 | L311: 15.00 | M311: 21.70 | N311: 71.55 | O311: 0.0 | P311: 71.55
C312: 3 | D312: 3 | E312: 3 | F312: 3 | G312: 3 | H312: 4 | I312: 3 | J312: 4 | K312: 2 | L312: 3 | M312: 3 | N312: 3 | P312: 3
A313: Genesis | B313: 2 | C313: 13.40 | D313: 12.90 | E313: 26.30 | F313: 13.70 | G313: 14.30 | H313: 14.30 | I313: 21.15 | J313: 13.40 | K313: 13.50 | L313: 14.10 | M313: 20.50 | N313: 67.95 | O313: 0.0 | P313: 67.95
C314: 4 | D314: 4 | E314: 4 | F314: 4 | G314: 4 | H314: 3 | I314: 4 | J314: 3 | K314: 4 | L314: 4 | M314: 4 | N314: 4 | P314: 4
A315: Seattle | B315: 1 | C315: 12.80 | D315: 12.70 | E315: 25.50 | F315: 12.70 | G315: 12.60 | H315: 12.60 | I315: 18.95 | J315: 12.60 | K315: 13.20 | L315: 13.70 | M315: 19.75 | N315: 64.20 | O315: 0.0 | P315: 64.20
A316: Cascades | C316: 5 | D316: 5 | E316: 5 | F316: 5 | G316: 5 | H316: 5 | I316: 5 | J316: 5 | K316: 5 | L316: 5 | M316: 5 | N316: 5 | P316: 5
A317: DCI Open Class
A318: Battalion | B318: 1 | C318: 12.40 | D318: 12.10 | E318: 24.50 | F318: 12.50 | G318: 13.00 | H318: 12.30 | I318: 18.90 | J318: 12.90 | K318: 12.80 | L318: 12.90 | M318: 19.30 | N318: 62.70 | O318: 0.0 | P318: 62.70
C319: 1 | D319: 1 | E319: 1 | F319: 1 | G319: 1 | H319: 1 | I319: 1 | J319: 1 | K319: 1 | L319: 1 | M319: 1 | N319: 1 | P319: 1
A322: 7/12/2024 Riverside, California
C323: General Effect | F323: Visual | J323: Music
C324: 1 | D324: 2 | F324: Proficiency | G324: Analysis | H324: Color Guard | J324: Brass | K324: Analysis | L324: Percussion | N324: Sub | P324: Total
C325: D. Torchia | D325: T. Fox | E325: Total | F325: B. Spidel | G325: C. Nelson | H325: E. Martinez | I325: Total ÷2 | J325: K. Shuttleworth | K325: P. Haines | L325: J. Wilson | M325: Total ÷2 | N325: Total | O325: Pen | P325: Score
A326: DCI Open Class | C326: 20 | D326: 20 | E326: 40 | F326: 20 | G326: 20 | H326: 20 | I326: 30 | J326: 20 | K326: 20 | L326: 20 | M326: 30 | N326: 100 | P326: 100
A327: Blue | B327: 4 | C327: 14.40 | D327: 14.40 | E327: 28.80 | F327: 14.70 | G327: 14.00 | H327: 14.40 | I327: 21.55 | J327: 14.40 | K327: 14.00 | L327: 14.30 | M327: 21.35 | N327: 71.70 | O327: 0.0 | P327: 71.70
A328: Devils B | C328: 1 | D328: 1 | E328: 1 | F328: 1 | G328: 1 | H328: 1 | I328: 1 | J328: 1 | K328: 1 | L328: 1 | M328: 1 | N328: 1 | P328: 1
A329: Gold | B329: 5 | C329: 14.00 | D329: 13.40 | E329: 27.40 | F329: 14.10 | G329: 13.40 | H329: 13.60 | I329: 20.55 | J329: 13.10 | K329: 13.50 | L329: 14.00 | M329: 20.30 | N329: 68.25 | O329: 0.0 | P329: 68.25
C330: 2 | D330: 2 | E330: 2 | F330: 2 | G330: 2 | H330: 2 | I330: 2 | J330: 2 | K330: 2 | L330: 2 | M330: 2 | N330: 2 | P330: 2
A331: Impulse | B331: 2 | C331: 13.30 | D331: 12.30 | E331: 25.60 | F331: 12.50 | G331: 12.10 | H331: 12.60 | I331: 18.60 | J331: 12.30 | K331: 12.10 | L331: 12.30 | M331: 18.35 | N331: 62.55 | O331: 0.0 | P331: 62.55
C332: 3 | D332: 4 | E332: 3 | F332: 3 | G332: 4 | H332: 3 | I332: 3 | J332: 3 | K332: 4 | L332: 4 | M332: 3 | N332: 3 | P332: 3
A333: Golden | B333: 1 | C333: 12.30 | D333: 11.60 | E333: 23.90 | F333: 12.30 | G333: 12.40 | H333: 11.60 | I333: 18.15 | J333: 11.70 | K333: 12.30 | L333: 12.00 | M333: 18.00 | N333: 60.05 | O333: 0.0 | P333: 60.05
A334: Empire | C334: 4 | D334: 5 | E334: 5 | F334: 4 | G334: 3 | H334: 4 | I334: 4 | J334: 5 | K334: 3 | L334: 5 | M334: 5 | N334: 4 | P334: 4
A335: Vessel | B335: 3 | C335: 12.00 | D335: 12.40 | E335: 24.40 | F335: 11.70 | G335: 11.60 | H335: 11.20 | I335: 17.25 | J335: 11.90 | K335: 11.90 | L335: 12.70 | M335: 18.25 | N335: 59.90 | O335: 0.0 | P335: 59.90
C336: 5 | D336: 3 | E336: 4 | F336: 5 | G336: 5 | H336: 5 | I336: 5 | J336: 4 | K336: 5 | L336: 3 | M336: 4 | N336: 5 | P336: 5
A339: 7/13/2024 Clifton, New Jersey
C340: General Effect | F340: Visual | J340: Music
C341: 1 | D341: 2 | F341: Proficiency | G341: Analysis | H341: Color Guard | J341: Brass | K341: Analysis | L341: Percussion | N341: Sub | P341: Total
C342: W. Rickart | D342: K. Turner | E342: Total | F342: D. Deems | G342: S. Adamo | H342: M. Bowers | I342: Total ÷2 | J342: S. Halquist | K342: D. Thomas | L342: M. Griffin | M342: Total ÷2 | N342: Total | O342: Pen | P342: Score
A343: DCI World Class | C343: 20 | D343: 20 | E343: 40 | F343: 20 | G343: 20 | H343: 20 | I343: 30 | J343: 20 | K343: 20 | L343: 20 | M343: 30 | N343: 100 | P343: 100
A344: Jersey | B344: 1 | C344: 13.40 | D344: 12.80 | E344: 26.20 | F344: 12.90 | G344: 12.40 | H344: 12.80 | I344: 19.05 | J344: 12.30 | K344: 12.30 | L344: 12.50 | M344: 18.55 | N344: 63.85 | O344: 0.0 | P344: 63.85
A345: Surf | C345: 1 | D345: 1 | E345: 1 | F345: 1 | G345: 1 | H345: 1 | I345: 1 | J345: 1 | K345: 1 | L345: 1 | M345: 1 | N345: 1 | P345: 1
A346: DCI All Age World Class
A347: Reading | B347: 3 | C347: 17.50 | D347: 17.30 | E347: 34.80 | F347: 16.40 | G347: 17.50 | H347: 17.20 | I347: 25.55 | J347: 16.70 | K347: 17.40 | L347: 16.90 | M347: 25.50 | N347: 85.85 | O347: 0.0 | P347: 85.85
A348: Buccaneers | C348: =RANK(C347,(C$6,C$9,C$11,C$13,C$15,C$18,C$21,C$23,C$25,C$27,C$29,C$31,C$33,C$35,C$37,C$39,C$41,C$43,C$45,C$47,C$49,C$51,C$53,C$55,C$57,C$59,C$61,C$63,C$65,C$67,C$69,C$71,C$73,C$75,C$77,C$79,C$81,C$83,C$85,C$87,C$89,C$91,C$93,C$95,C$97,C$99,C$101,C$103,C$105,C$107,C$109,C$111,C$113,C$115,C$117,C$119,C$121,C$123,C$125,C$127)) -> 1 | D348: =RANK(D347,(D$6,D$9,D$11,D$13,D$15,D$18,D$21,D$23,D$25,D$27,D$29,D$31,D$33,D$35,D$37,D$39,D$41,D$43,D$45,D$47,D$49,D$51,D$53,D$55,D$57,D$59,D$61,D$63,D$65,D$67,D$69,D$71,D$73,D$75,D$77,D$79,D$81,D$83,D$85,D$87,D$89,D$91,D$93,D$95,D$97,D$99,D$101,D$103,D$105,D$107,D$109,D$111,D$113,D$115,D$117,D$119,D$121,D$123,D$125,D$127)) -> 1 | E348: =RANK(E347,(E$6,E$9,E$11,E$13,E$15,E$18,E$21,E$23,E$25,E$27,E$29,E$31,E$33,E$35,E$37,E$39,E$41,E$43,E$45,E$47,E$49,E$51,E$53,E$55,E$57,E$59,E$61,E$63,E$65,E$67,E$69,E$71,E$73,E$75,E$77,E$79,E$81,E$83,E$85,E$87,E$89,E$91,E$93,E$95,E$97,E$99,E$101,E$103,E$105,E$107,E$109,E$111,E$113,E$115,E$117,E$119,E$121,E$123,E$125,E$127)) -> 1 | F348: =RANK(F347,(F$6,F$9,F$11,F$13,F$15,F$18,F$21,F$23,F$25,F$27,F$29,F$31,F$33,F$35,F$37,F$39,F$41,F$43,F$45,F$47,F$49,F$51,F$53,F$55,F$57,F$59,F$61,F$63,F$65,F$67,F$69,F$71,F$73,F$75,F$77,F$79,F$81,F$83,F$85,F$87,F$89,F$91,F$93,F$95,F$97,F$99,F$101,F$103,F$105,F$107,F$109,F$111,F$113,F$115,F$117,F$119,F$121,F$123,F$125,F$127)) -> 1 | G348: =RANK(G347,(G$6,G$9,G$11,G$13,G$15,G$18,G$21,G$23,G$25,G$27,G$29,G$31,G$33,G$35,G$37,G$39,G$41,G$43,G$45,G$47,G$49,G$51,G$53,G$55,G$57,G$59,G$61,G$63,G$65,G$67,G$69,G$71,G$73,G$75,G$77,G$79,G$81,G$83,G$85,G$87,G$89,G$91,G$93,G$95,G$97,G$99,G$101,G$103,G$105,G$107,G$109,G$111,G$113,G$115,G$117,G$119,G$121,G$123,G$125,G$127)) -> 1 | H348: =RANK(H347,(H$6,H$9,H$11,H$13,H$15,H$18,H$21,H$23,H$25,H$27,H$29,H$31,H$33,H$35,H$37,H$39,H$41,H$43,H$45,H$47,H$49,H$51,H$53,H$55,H$57,H$59,H$61,H$63,H$65,H$67,H$69,H$71,H$73,H$75,H$77,H$79,H$81,H$83,H$85,H$87,H$89,H$91,H$93,H$95,H$97,H$99,H$101,H$103,H$105,H$107,H$109,H$111,H$113,H$115,H$117,H$119,H$121,H$123,H$125,H$127)) -> 1 | I348: =RANK(I347,(I$6,I$9,I$11,I$13,I$15,I$18,I$21,I$23,I$25,I$27,I$29,I$31,I$33,I$35,I$37,I$39,I$41,I$43,I$45,I$47,I$49,I$51,I$53,I$55,I$57,I$59,I$61,I$63,I$65,I$67,I$69,I$71,I$73,I$75,I$77,I$79,I$81,I$83,I$85,I$87,I$89,I$91,I$93,I$95,I$97,I$99,I$101,I$103,I$105,I$107,I$109,I$111,I$113,I$115,I$117,I$119,I$121,I$123,I$125,I$127)) -> 1 | J348: =RANK(J347,(J$6,J$9,J$11,J$13,J$15,J$18,J$21,J$23,J$25,J$27,J$29,J$31,J$33,J$35,J$37,J$39,J$41,J$43,J$45,J$47,J$49,J$51,J$53,J$55,J$57,J$59,J$61,J$63,J$65,J$67,J$69,J$71,J$73,J$75,J$77,J$79,J$81,J$83,J$85,J$87,J$89,J$91,J$93,J$95,J$97,J$99,J$101,J$103,J$105,J$107,J$109,J$111,J$113,J$115,J$117,J$119,J$121,J$123,J$125,J$127)) -> 1 | K348: =RANK(K347,(K$6,K$9,K$11,K$13,K$15,K$18,K$21,K$23,K$25,K$27,K$29,K$31,K$33,K$35,K$37,K$39,K$41,K$43,K$45,K$47,K$49,K$51,K$53,K$55,K$57,K$59,K$61,K$63,K$65,K$67,K$69,K$71,K$73,K$75,K$77,K$79,K$81,K$83,K$85,K$87,K$89,K$91,K$93,K$95,K$97,K$99,K$101,K$103,K$105,K$107,K$109,K$111,K$113,K$115,K$117,K$119,K$121,K$123,K$125,K$127)) -> 1 | L348: =RANK(L347,(L$6,L$9,L$11,L$13,L$15,L$18,L$21,L$23,L$25,L$27,L$29,L$31,L$33,L$35,L$37,L$39,L$41,L$43,L$45,L$47,L$49,L$51,L$53,L$55,L$57,L$59,L$61,L$63,L$65,L$67,L$69,L$71,L$73,L$75,L$77,L$79,L$81,L$83,L$85,L$87,L$89,L$91,L$93,L$95,L$97,L$99,L$101,L$103,L$105,L$107,L$109,L$111,L$113,L$115,L$117,L$119,L$121,L$123,L$125,L$127)) -> 2 | M348: =RANK(M347,(M$6,M$9,M$11,M$13,M$15,M$18,M$21,M$23,M$25,M$27,M$29,M$31,M$33,M$35,M$37,M$39,M$41,M$43,M$45,M$47,M$49,M$51,M$53,M$55,M$57,M$59,M$61,M$63,M$65,M$67,M$69,M$71,M$73,M$75,M$77,M$79,M$81,M$83,M$85,M$87,M$89,M$91,M$93,M$95,M$97,M$99,M$101,M$103,M$105,M$107,M$109,M$111,M$113,M$115,M$117,M$119,M$121,M$123,M$125,M$127)) -> 1 | N348: =RANK(N347,(N$6,N$9,N$11,N$13,N$15,N$18,N$21,N$23,N$25,N$27,N$29,N$31,N$33,N$35,N$37,N$39,N$41,N$43,N$45,N$47,N$49,N$51,N$53,N$55,N$57,N$59,N$61,N$63,N$65,N$67,N$69,N$71,N$73,N$75,N$77,N$79,N$81,N$83,N$85,N$87,N$89,N$91,N$93,N$95,N$97,N$99,N$101,N$103,N$105,N$107,N$109,N$111,N$113,N$115,N$117,N$119,N$121,N$123,N$125,N$127)) -> 1 | P348: =RANK(P347,(P$6,P$9,P$11,P$13,P$15,P$18,P$21,P$23,P$25,P$27,P$29,P$31,P$33,P$35,P$37,P$39,P$41,P$43,P$45,P$47,P$49,P$51,P$53,P$55,P$57,P$59,P$61,P$63,P$65,P$67,P$69,P$71,P$73,P$75,P$77,P$79,P$81,P$83,P$85,P$87,P$89,P$91,P$93,P$95,P$97,P$99,P$101,P$103,P$105,P$107,P$109,P$111,P$113,P$115,P$117,P$119,P$121,P$123,P$125,P$127)) -> 1
A349: Bushwackers | B349: 1 | C349: 17.10 | D349: 17.00 | E349: 34.10 | F349: 16.00 | G349: 17.10 | H349: 17.10 | I349: 25.10 | J349: 15.70 | K349: 16.80 | L349: 17.10 | M349: 24.80 | N349: 84.00 | O349: 0.0 | P349: 84.00
C350: =RANK(C349,(C$6,C$9,C$11,C$13,C$15,C$18,C$21,C$23,C$25,C$27,C$29,C$31,C$33,C$35,C$37,C$39,C$41,C$43,C$45,C$47,C$49,C$51,C$53,C$55,C$57,C$59,C$61,C$63,C$65,C$67,C$69,C$71,C$73,C$75,C$77,C$79,C$81,C$83,C$85,C$87,C$89,C$91,C$93,C$95,C$97,C$99,C$101,C$103,C$105,C$107,C$109,C$111,C$113,C$115,C$117,C$119,C$121,C$123,C$125,C$127)) -> 2 | D350: =RANK(D349,(D$6,D$9,D$11,D$13,D$15,D$18,D$21,D$23,D$25,D$27,D$29,D$31,D$33,D$35,D$37,D$39,D$41,D$43,D$45,D$47,D$49,D$51,D$53,D$55,D$57,D$59,D$61,D$63,D$65,D$67,D$69,D$71,D$73,D$75,D$77,D$79,D$81,D$83,D$85,D$87,D$89,D$91,D$93,D$95,D$97,D$99,D$101,D$103,D$105,D$107,D$109,D$111,D$113,D$115,D$117,D$119,D$121,D$123,D$125,D$127)) -> 2 | E350: =RANK(E349,(E$6,E$9,E$11,E$13,E$15,E$18,E$21,E$23,E$25,E$27,E$29,E$31,E$33,E$35,E$37,E$39,E$41,E$43,E$45,E$47,E$49,E$51,E$53,E$55,E$57,E$59,E$61,E$63,E$65,E$67,E$69,E$71,E$73,E$75,E$77,E$79,E$81,E$83,E$85,E$87,E$89,E$91,E$93,E$95,E$97,E$99,E$101,E$103,E$105,E$107,E$109,E$111,E$113,E$115,E$117,E$119,E$121,E$123,E$125,E$127)) -> 2 | F350: =RANK(F349,(F$6,F$9,F$11,F$13,F$15,F$18,F$21,F$23,F$25,F$27,F$29,F$31,F$33,F$35,F$37,F$39,F$41,F$43,F$45,F$47,F$49,F$51,F$53,F$55,F$57,F$59,F$61,F$63,F$65,F$67,F$69,F$71,F$73,F$75,F$77,F$79,F$81,F$83,F$85,F$87,F$89,F$91,F$93,F$95,F$97,F$99,F$101,F$103,F$105,F$107,F$109,F$111,F$113,F$115,F$117,F$119,F$121,F$123,F$125,F$127)) -> 2 | G350: =RANK(G349,(G$6,G$9,G$11,G$13,G$15,G$18,G$21,G$23,G$25,G$27,G$29,G$31,G$33,G$35,G$37,G$39,G$41,G$43,G$45,G$47,G$49,G$51,G$53,G$55,G$57,G$59,G$61,G$63,G$65,G$67,G$69,G$71,G$73,G$75,G$77,G$79,G$81,G$83,G$85,G$87,G$89,G$91,G$93,G$95,G$97,G$99,G$101,G$103,G$105,G$107,G$109,G$111,G$113,G$115,G$117,G$119,G$121,G$123,G$125,G$127)) -> 2 | H350: =RANK(H349,(H$6,H$9,H$11,H$13,H$15,H$18,H$21,H$23,H$25,H$27,H$29,H$31,H$33,H$35,H$37,H$39,H$41,H$43,H$45,H$47,H$49,H$51,H$53,H$55,H$57,H$59,H$61,H$63,H$65,H$67,H$69,H$71,H$73,H$75,H$77,H$79,H$81,H$83,H$85,H$87,H$89,H$91,H$93,H$95,H$97,H$99,H$101,H$103,H$105,H$107,H$109,H$111,H$113,H$115,H$117,H$119,H$121,H$123,H$125,H$127)) -> 2 | I350: =RANK(I349,(I$6,I$9,I$11,I$13,I$15,I$18,I$21,I$23,I$25,I$27,I$29,I$31,I$33,I$35,I$37,I$39,I$41,I$43,I$45,I$47,I$49,I$51,I$53,I$55,I$57,I$59,I$61,I$63,I$65,I$67,I$69,I$71,I$73,I$75,I$77,I$79,I$81,I$83,I$85,I$87,I$89,I$91,I$93,I$95,I$97,I$99,I$101,I$103,I$105,I$107,I$109,I$111,I$113,I$115,I$117,I$119,I$121,I$123,I$125,I$127)) -> 2 | J350: =RANK(J349,(J$6,J$9,J$11,J$13,J$15,J$18,J$21,J$23,J$25,J$27,J$29,J$31,J$33,J$35,J$37,J$39,J$41,J$43,J$45,J$47,J$49,J$51,J$53,J$55,J$57,J$59,J$61,J$63,J$65,J$67,J$69,J$71,J$73,J$75,J$77,J$79,J$81,J$83,J$85,J$87,J$89,J$91,J$93,J$95,J$97,J$99,J$101,J$103,J$105,J$107,J$109,J$111,J$113,J$115,J$117,J$119,J$121,J$123,J$125,J$127)) -> 3 | K350: =RANK(K349,(K$6,K$9,K$11,K$13,K$15,K$18,K$21,K$23,K$25,K$27,K$29,K$31,K$33,K$35,K$37,K$39,K$41,K$43,K$45,K$47,K$49,K$51,K$53,K$55,K$57,K$59,K$61,K$63,K$65,K$67,K$69,K$71,K$73,K$75,K$77,K$79,K$81,K$83,K$85,K$87,K$89,K$91,K$93,K$95,K$97,K$99,K$101,K$103,K$105,K$107,K$109,K$111,K$113,K$115,K$117,K$119,K$121,K$123,K$125,K$127)) -> 3 | L350: =RANK(L349,(L$6,L$9,L$11,L$13,L$15,L$18,L$21,L$23,L$25,L$27,L$29,L$31,L$33,L$35,L$37,L$39,L$41,L$43,L$45,L$47,L$49,L$51,L$53,L$55,L$57,L$59,L$61,L$63,L$65,L$67,L$69,L$71,L$73,L$75,L$77,L$79,L$81,L$83,L$85,L$87,L$89,L$91,L$93,L$95,L$97,L$99,L$101,L$103,L$105,L$107,L$109,L$111,L$113,L$115,L$117,L$119,L$121,L$123,L$125,L$127)) -> 1 | M350: =RANK(M349,(M$6,M$9,M$11,M$13,M$15,M$18,M$21,M$23,M$25,M$27,M$29,M$31,M$33,M$35,M$37,M$39,M$41,M$43,M$45,M$47,M$49,M$51,M$53,M$55,M$57,M$59,M$61,M$63,M$65,M$67,M$69,M$71,M$73,M$75,M$77,M$79,M$81,M$83,M$85,M$87,M$89,M$91,M$93,M$95,M$97,M$99,M$101,M$103,M$105,M$107,M$109,M$111,M$113,M$115,M$117,M$119,M$121,M$123,M$125,M$127)) -> 2 | N350: =RANK(N349,(N$6,N$9,N$11,N$13,N$15,N$18,N$21,N$23,N$25,N$27,N$29,N$31,N$33,N$35,N$37,N$39,N$41,N$43,N$45,N$47,N$49,N$51,N$53,N$55,N$57,N$59,N$61,N$63,N$65,N$67,N$69,N$71,N$73,N$75,N$77,N$79,N$81,N$83,N$85,N$87,N$89,N$91,N$93,N$95,N$97,N$99,N$101,N$103,N$105,N$107,N$109,N$111,N$113,N$115,N$117,N$119,N$121,N$123,N$125,N$127)) -> 2 | P350: =RANK(P349,(P$6,P$9,P$11,P$13,P$15,P$18,P$21,P$23,P$25,P$27,P$29,P$31,P$33,P$35,P$37,P$39,P$41,P$43,P$45,P$47,P$49,P$51,P$53,P$55,P$57,P$59,P$61,P$63,P$65,P$67,P$69,P$71,P$73,P$75,P$77,P$79,P$81,P$83,P$85,P$87,P$89,P$91,P$93,P$95,P$97,P$99,P$101,P$103,P$105,P$107,P$109,P$111,P$113,P$115,P$117,P$119,P$121,P$123,P$125,P$127)) -> 2
A351: Hawthorne | B351: 4 | C351: 16.40 | D351: 16.60 | E351: 33.00 | F351: 15.70 | G351: 16.60 | H351: 16.00 | I351: 24.15 | J351: 16.00 | K351: 16.90 | L351: 16.70 | M351: 24.80 | N351: 81.95 | O351: 0.0 | P351: 81.95
A352: Caballeros | C352: =RANK(C351,(C$6,C$9,C$11,C$13,C$15,C$18,C$21,C$23,C$25,C$27,C$29,C$31,C$33,C$35,C$37,C$39,C$41,C$43,C$45,C$47,C$49,C$51,C$53,C$55,C$57,C$59,C$61,C$63,C$65,C$67,C$69,C$71,C$73,C$75,C$77,C$79,C$81,C$83,C$85,C$87,C$89,C$91,C$93,C$95,C$97,C$99,C$101,C$103,C$105,C$107,C$109,C$111,C$113,C$115,C$117,C$119,C$121,C$123,C$125,C$127)) -> 3 | D352: =RANK(D351,(D$6,D$9,D$11,D$13,D$15,D$18,D$21,D$23,D$25,D$27,D$29,D$31,D$33,D$35,D$37,D$39,D$41,D$43,D$45,D$47,D$49,D$51,D$53,D$55,D$57,D$59,D$61,D$63,D$65,D$67,D$69,D$71,D$73,D$75,D$77,D$79,D$81,D$83,D$85,D$87,D$89,D$91,D$93,D$95,D$97,D$99,D$101,D$103,D$105,D$107,D$109,D$111,D$113,D$115,D$117,D$119,D$121,D$123,D$125,D$127)) -> 3 | E352: =RANK(E351,(E$6,E$9,E$11,E$13,E$15,E$18,E$21,E$23,E$25,E$27,E$29,E$31,E$33,E$35,E$37,E$39,E$41,E$43,E$45,E$47,E$49,E$51,E$53,E$55,E$57,E$59,E$61,E$63,E$65,E$67,E$69,E$71,E$73,E$75,E$77,E$79,E$81,E$83,E$85,E$87,E$89,E$91,E$93,E$95,E$97,E$99,E$101,E$103,E$105,E$107,E$109,E$111,E$113,E$115,E$117,E$119,E$121,E$123,E$125,E$127)) -> 3 | F352: =RANK(F351,(F$6,F$9,F$11,F$13,F$15,F$18,F$21,F$23,F$25,F$27,F$29,F$31,F$33,F$35,F$37,F$39,F$41,F$43,F$45,F$47,F$49,F$51,F$53,F$55,F$57,F$59,F$61,F$63,F$65,F$67,F$69,F$71,F$73,F$75,F$77,F$79,F$81,F$83,F$85,F$87,F$89,F$91,F$93,F$95,F$97,F$99,F$101,F$103,F$105,F$107,F$109,F$111,F$113,F$115,F$117,F$119,F$121,F$123,F$125,F$127)) -> 3 | G352: =RANK(G351,(G$6,G$9,G$11,G$13,G$15,G$18,G$21,G$23,G$25,G$27,G$29,G$31,G$33,G$35,G$37,G$39,G$41,G$43,G$45,G$47,G$49,G$51,G$53,G$55,G$57,G$59,G$61,G$63,G$65,G$67,G$69,G$71,G$73,G$75,G$77,G$79,G$81,G$83,G$85,G$87,G$89,G$91,G$93,G$95,G$97,G$99,G$101,G$103,G$105,G$107,G$109,G$111,G$113,G$115,G$117,G$119,G$121,G$123,G$125,G$127)) -> 3 | H352: =RANK(H351,(H$6,H$9,H$11,H$13,H$15,H$18,H$21,H$23,H$25,H$27,H$29,H$31,H$33,H$35,H$37,H$39,H$41,H$43,H$45,H$47,H$49,H$51,H$53,H$55,H$57,H$59,H$61,H$63,H$65,H$67,H$69,H$71,H$73,H$75,H$77,H$79,H$81,H$83,H$85,H$87,H$89,H$91,H$93,H$95,H$97,H$99,H$101,H$103,H$105,H$107,H$109,H$111,H$113,H$115,H$117,H$119,H$121,H$123,H$125,H$127)) -> 4 | I352: =RANK(I351,(I$6,I$9,I$11,I$13,I$15,I$18,I$21,I$23,I$25,I$27,I$29,I$31,I$33,I$35,I$37,I$39,I$41,I$43,I$45,I$47,I$49,I$51,I$53,I$55,I$57,I$59,I$61,I$63,I$65,I$67,I$69,I$71,I$73,I$75,I$77,I$79,I$81,I$83,I$85,I$87,I$89,I$91,I$93,I$95,I$97,I$99,I$101,I$103,I$105,I$107,I$109,I$111,I$113,I$115,I$117,I$119,I$121,I$123,I$125,I$127)) -> 3 | J352: =RANK(J351,(J$6,J$9,J$11,J$13,J$15,J$18,J$21,J$23,J$25,J$27,J$29,J$31,J$33,J$35,J$37,J$39,J$41,J$43,J$45,J$47,J$49,J$51,J$53,J$55,J$57,J$59,J$61,J$63,J$65,J$67,J$69,J$71,J$73,J$75,J$77,J$79,J$81,J$83,J$85,J$87,J$89,J$91,J$93,J$95,J$97,J$99,J$101,J$103,J$105,J$107,J$109,J$111,J$113,J$115,J$117,J$119,J$121,J$123,J$125,J$127)) -> 2 | K352: =RANK(K351,(K$6,K$9,K$11,K$13,K$15,K$18,K$21,K$23,K$25,K$27,K$29,K$31,K$33,K$35,K$37,K$39,K$41,K$43,K$45,K$47,K$49,K$51,K$53,K$55,K$57,K$59,K$61,K$63,K$65,K$67,K$69,K$71,K$73,K$75,K$77,K$79,K$81,K$83,K$85,K$87,K$89,K$91,K$93,K$95,K$97,K$99,K$101,K$103,K$105,K$107,K$109,K$111,K$113,K$115,K$117,K$119,K$121,K$123,K$125,K$127)) -> 2 | L352: =RANK(L351,(L$6,L$9,L$11,L$13,L$15,L$18,L$21,L$23,L$25,L$27,L$29,L$31,L$33,L$35,L$37,L$39,L$41,L$43,L$45,L$47,L$49,L$51,L$53,L$55,L$57,L$59,L$61,L$63,L$65,L$67,L$69,L$71,L$73,L$75,L$77,L$79,L$81,L$83,L$85,L$87,L$89,L$91,L$93,L$95,L$97,L$99,L$101,L$103,L$105,L$107,L$109,L$111,L$113,L$115,L$117,L$119,L$121,L$123,L$125,L$127)) -> 3 | M352: =RANK(M351,(M$6,M$9,M$11,M$13,M$15,M$18,M$21,M$23,M$25,M$27,M$29,M$31,M$33,M$35,M$37,M$39,M$41,M$43,M$45,M$47,M$49,M$51,M$53,M$55,M$57,M$59,M$61,M$63,M$65,M$67,M$69,M$71,M$73,M$75,M$77,M$79,M$81,M$83,M$85,M$87,M$89,M$91,M$93,M$95,M$97,M$99,M$101,M$103,M$105,M$107,M$109,M$111,M$113,M$115,M$117,M$119,M$121,M$123,M$125,M$127)) -> 2 | N352: =RANK(N351,(N$6,N$9,N$11,N$13,N$15,N$18,N$21,N$23,N$25,N$27,N$29,N$31,N$33,N$35,N$37,N$39,N$41,N$43,N$45,N$47,N$49,N$51,N$53,N$55,N$57,N$59,N$61,N$63,N$65,N$67,N$69,N$71,N$73,N$75,N$77,N$79,N$81,N$83,N$85,N$87,N$89,N$91,N$93,N$95,N$97,N$99,N$101,N$103,N$105,N$107,N$109,N$111,N$113,N$115,N$117,N$119,N$121,N$123,N$125,N$127)) -> 3 | P352: =RANK(P351,(P$6,P$9,P$11,P$13,P$15,P$18,P$21,P$23,P$25,P$27,P$29,P$31,P$33,P$35,P$37,P$39,P$41,P$43,P$45,P$47,P$49,P$51,P$53,P$55,P$57,P$59,P$61,P$63,P$65,P$67,P$69,P$71,P$73,P$75,P$77,P$79,P$81,P$83,P$85,P$87,P$89,P$91,P$93,P$95,P$97,P$99,P$101,P$103,P$105,P$107,P$109,P$111,P$113,P$115,P$117,P$119,P$121,P$123,P$125,P$127)) -> 3
A353: Connecticut | B353: 2 | C353: 16.00 | D353: 15.50 | E353: 31.50 | F353: 15.30 | G353: 15.70 | H353: 16.10 | I353: 23.55 | J353: 14.10 | K353: 15.70 | L353: 15.60 | M353: 22.70 | N353: 77.75 | O353: 0.0 | P353: 77.75
A354: Hurricanes | C354: =RANK(C353,(C$6,C$9,C$11,C$13,C$15,C$18,C$21,C$23,C$25,C$27,C$29,C$31,C$33,C$35,C$37,C$39,C$41,C$43,C$45,C$47,C$49,C$51,C$53,C$55,C$57,C$59,C$61,C$63,C$65,C$67,C$69,C$71,C$73,C$75,C$77,C$79,C$81,C$83,C$85,C$87,C$89,C$91,C$93,C$95,C$97,C$99,C$101,C$103,C$105,C$107,C$109,C$111,C$113,C$115,C$117,C$119,C$121,C$123,C$125,C$127)) -> 4 | D354: =RANK(D353,(D$6,D$9,D$11,D$13,D$15,D$18,D$21,D$23,D$25,D$27,D$29,D$31,D$33,D$35,D$37,D$39,D$41,D$43,D$45,D$47,D$49,D$51,D$53,D$55,D$57,D$59,D$61,D$63,D$65,D$67,D$69,D$71,D$73,D$75,D$77,D$79,D$81,D$83,D$85,D$87,D$89,D$91,D$93,D$95,D$97,D$99,D$101,D$103,D$105,D$107,D$109,D$111,D$113,D$115,D$117,D$119,D$121,D$123,D$125,D$127)) -> 4 | E354: =RANK(E353,(E$6,E$9,E$11,E$13,E$15,E$18,E$21,E$23,E$25,E$27,E$29,E$31,E$33,E$35,E$37,E$39,E$41,E$43,E$45,E$47,E$49,E$51,E$53,E$55,E$57,E$59,E$61,E$63,E$65,E$67,E$69,E$71,E$73,E$75,E$77,E$79,E$81,E$83,E$85,E$87,E$89,E$91,E$93,E$95,E$97,E$99,E$101,E$103,E$105,E$107,E$109,E$111,E$113,E$115,E$117,E$119,E$121,E$123,E$125,E$127)) -> 4 | F354: =RANK(F353,(F$6,F$9,F$11,F$13,F$15,F$18,F$21,F$23,F$25,F$27,F$29,F$31,F$33,F$35,F$37,F$39,F$41,F$43,F$45,F$47,F$49,F$51,F$53,F$55,F$57,F$59,F$61,F$63,F$65,F$67,F$69,F$71,F$73,F$75,F$77,F$79,F$81,F$83,F$85,F$87,F$89,F$91,F$93,F$95,F$97,F$99,F$101,F$103,F$105,F$107,F$109,F$111,F$113,F$115,F$117,F$119,F$121,F$123,F$125,F$127)) -> 4 | G354: =RANK(G353,(G$6,G$9,G$11,G$13,G$15,G$18,G$21,G$23,G$25,G$27,G$29,G$31,G$33,G$35,G$37,G$39,G$41,G$43,G$45,G$47,G$49,G$51,G$53,G$55,G$57,G$59,G$61,G$63,G$65,G$67,G$69,G$71,G$73,G$75,G$77,G$79,G$81,G$83,G$85,G$87,G$89,G$91,G$93,G$95,G$97,G$99,G$101,G$103,G$105,G$107,G$109,G$111,G$113,G$115,G$117,G$119,G$121,G$123,G$125,G$127)) -> 4 | H354: =RANK(H353,(H$6,H$9,H$11,H$13,H$15,H$18,H$21,H$23,H$25,H$27,H$29,H$31,H$33,H$35,H$37,H$39,H$41,H$43,H$45,H$47,H$49,H$51,H$53,H$55,H$57,H$59,H$61,H$63,H$65,H$67,H$69,H$71,H$73,H$75,H$77,H$79,H$81,H$83,H$85,H$87,H$89,H$91,H$93,H$95,H$97,H$99,H$101,H$103,H$105,H$107,H$109,H$111,H$113,H$115,H$117,H$119,H$121,H$123,H$125,H$127)) -> 3 | I354: =RANK(I353,(I$6,I$9,I$11,I$13,I$15,I$18,I$21,I$23,I$25,I$27,I$29,I$31,I$33,I$35,I$37,I$39,I$41,I$43,I$45,I$47,I$49,I$51,I$53,I$55,I$57,I$59,I$61,I$63,I$65,I$67,I$69,I$71,I$73,I$75,I$77,I$79,I$81,I$83,I$85,I$87,I$89,I$91,I$93,I$95,I$97,I$99,I$101,I$103,I$105,I$107,I$109,I$111,I$113,I$115,I$117,I$119,I$121,I$123,I$125,I$127)) -> 4 | J354: =RANK(J353,(J$6,J$9,J$11,J$13,J$15,J$18,J$21,J$23,J$25,J$27,J$29,J$31,J$33,J$35,J$37,J$39,J$41,J$43,J$45,J$47,J$49,J$51,J$53,J$55,J$57,J$59,J$61,J$63,J$65,J$67,J$69,J$71,J$73,J$75,J$77,J$79,J$81,J$83,J$85,J$87,J$89,J$91,J$93,J$95,J$97,J$99,J$101,J$103,J$105,J$107,J$109,J$111,J$113,J$115,J$117,J$119,J$121,J$123,J$125,J$127)) -> 4 | K354: =RANK(K353,(K$6,K$9,K$11,K$13,K$15,K$18,K$21,K$23,K$25,K$27,K$29,K$31,K$33,K$35,K$37,K$39,K$41,K$43,K$45,K$47,K$49,K$51,K$53,K$55,K$57,K$59,K$61,K$63,K$65,K$67,K$69,K$71,K$73,K$75,K$77,K$79,K$81,K$83,K$85,K$87,K$89,K$91,K$93,K$95,K$97,K$99,K$101,K$103,K$105,K$107,K$109,K$111,K$113,K$115,K$117,K$119,K$121,K$123,K$125,K$127)) -> 4 | L354: =RANK(L353,(L$6,L$9,L$11,L$13,L$15,L$18,L$21,L$23,L$25,L$27,L$29,L$31,L$33,L$35,L$37,L$39,L$41,L$43,L$45,L$47,L$49,L$51,L$53,L$55,L$57,L$59,L$61,L$63,L$65,L$67,L$69,L$71,L$73,L$75,L$77,L$79,L$81,L$83,L$85,L$87,L$89,L$91,L$93,L$95,L$97,L$99,L$101,L$103,L$105,L$107,L$109,L$111,L$113,L$115,L$117,L$119,L$121,L$123,L$125,L$127)) -> 4 | M354: =RANK(M353,(M$6,M$9,M$11,M$13,M$15,M$18,M$21,M$23,M$25,M$27,M$29,M$31,M$33,M$35,M$37,M$39,M$41,M$43,M$45,M$47,M$49,M$51,M$53,M$55,M$57,M$59,M$61,M$63,M$65,M$67,M$69,M$71,M$73,M$75,M$77,M$79,M$81,M$83,M$85,M$87,M$89,M$91,M$93,M$95,M$97,M$99,M$101,M$103,M$105,M$107,M$109,M$111,M$113,M$115,M$117,M$119,M$121,M$123,M$125,M$127)) -> 4 | N354: =RANK(N353,(N$6,N$9,N$11,N$13,N$15,N$18,N$21,N$23,N$25,N$27,N$29,N$31,N$33,N$35,N$37,N$39,N$41,N$43,N$45,N$47,N$49,N$51,N$53,N$55,N$57,N$59,N$61,N$63,N$65,N$67,N$69,N$71,N$73,N$75,N$77,N$79,N$81,N$83,N$85,N$87,N$89,N$91,N$93,N$95,N$97,N$99,N$101,N$103,N$105,N$107,N$109,N$111,N$113,N$115,N$117,N$119,N$121,N$123,N$125,N$127)) -> 4 | P354: =RANK(P353,(P$6,P$9,P$11,P$13,P$15,P$18,P$21,P$23,P$25,P$27,P$29,P$31,P$33,P$35,P$37,P$39,P$41,P$43,P$45,P$47,P$49,P$51,P$53,P$55,P$57,P$59,P$61,P$63,P$65,P$67,P$69,P$71,P$73,P$75,P$77,P$79,P$81,P$83,P$85,P$87,P$89,P$91,P$93,P$95,P$97,P$99,P$101,P$103,P$105,P$107,P$109,P$111,P$113,P$115,P$117,P$119,P$121,P$123,P$125,P$127)) -> 4
A355: DCI All Age Open Class
A356: Fusion | B356: 1 | C356: 15.30 | D356: 15.20 | E356: 30.50 | F356: 12.80 | G356: 15.00 | H356: 15.30 | I356: 21.55 | J356: 13.90 | K356: 15.00 | L356: 14.30 | M356: 21.60 | N356: 73.65 | O356: 0.0 | P356: 73.65
A357: Core | C357: 1 | D357: 1 | E357: 1 | F357: 1 | G357: 1 | H357: 1 | I357: 1 | J357: 1 | K357: 1 | L357: 1 | M357: 1 | N357: 1 | P357: 1
A358: DCI All Age Class A
A359: Sunrisers | B359: 1 | C359: 14.80 | D359: 14.70 | E359: 29.50 | F359: 13.20 | G359: 14.40 | H359: 14.20 | I359: 20.90 | J359: 13.10 | K359: 13.20 | L359: 13.00 | M359: 19.65 | N359: 70.05 | O359: 0.0 | P359: 70.05
C360: 1 | D360: 1 | E360: 1 | F360: 1 | G360: 1 | H360: 1 | I360: 1 | J360: 1 | K360: 1 | L360: 1 | M360: 1 | N360: 1 | P360: 1
A361: Skyliners | B361: 2 | C361: 14.20 | D361: 14.00 | E361: 28.20 | F361: 12.30 | G361: 13.00 | H361: 13.30 | I361: 19.30 | J361: 12.60 | K361: 12.80 | L361: 12.40 | M361: 18.90 | N361: 66.40 | O361: 0.0 | P361: 66.40
C362: 2 | D362: 2 | E362: 2 | F362: 2 | G362: 2 | H362: 2 | I362: 2 | J362: 2 | K362: 2 | L362: 2 | M362: 2 | N362: 2 | P362: 2
A365: 7/13/2024 DeKalb, Illinois
C366: General Effect | F366: Visual | J366: Music
C367: 1 | D367: 2 | F367: Proficiency | G367: Analysis | H367: Color Guard | J367: Brass | K367: Analysis | L367: Percussion | N367: Sub | P367: Total
C368: K. Baker | D368: A. Cook | E368: Total | F368: T. Wemhoff | G368: C. Church | H368: T. Hundall | I368: Total ÷2 | J368: D. Argl | K368: M. Howard | L368: B. Williams | M368: Total ÷2 | N368: Total | O368: Pen | P368: Score
A369: DCI World Class | C369: 20 | D369: 20 | E369: 40 | F369: 20 | G369: 20 | H369: 20 | I369: 30 | J369: 20 | K369: 20 | L369: 20 | M369: 30 | N369: 100 | P369: 100
A370: Bluecoats | B370: 5 | C370: 17.30 | D370: 17.20 | E370: 34.50 | F370: 17.40 | G370: 17.20 | H370: 17.70 | I370: 26.15 | J370: 17.80 | K370: 17.50 | L370: 17.50 | M370: 26.40 | N370: 87.05 | O370: 0.0 | P370: 87.05
C371: =RANK(C370,(C$6,C$8,C$10,C$12,C$14,C$16,C$19,C$21,C$23,C$25,C$27,C$29,C$31,C$33,C$35,C$37,C$39,C$41,C$43,C$45,C$47,C$49,C$51,C$53,C$55,C$57,C$59,C$61,C$63,C$65,C$67,C$69,C$71,C$73,C$75,C$77,C$79,C$81,C$83,C$85,C$87,C$89,C$91,C$93,C$95,C$97,C$99,C$101,C$103,C$105,C$107,C$109,C$111,C$113,C$115,C$117,C$119,C$121,C$123,C$125)) -> 1 | D371: =RANK(D370,(D$6,D$8,D$10,D$12,D$14,D$16,D$19,D$21,D$23,D$25,D$27,D$29,D$31,D$33,D$35,D$37,D$39,D$41,D$43,D$45,D$47,D$49,D$51,D$53,D$55,D$57,D$59,D$61,D$63,D$65,D$67,D$69,D$71,D$73,D$75,D$77,D$79,D$81,D$83,D$85,D$87,D$89,D$91,D$93,D$95,D$97,D$99,D$101,D$103,D$105,D$107,D$109,D$111,D$113,D$115,D$117,D$119,D$121,D$123,D$125)) -> 1 | E371: =RANK(E370,(E$6,E$8,E$10,E$12,E$14,E$16,E$19,E$21,E$23,E$25,E$27,E$29,E$31,E$33,E$35,E$37,E$39,E$41,E$43,E$45,E$47,E$49,E$51,E$53,E$55,E$57,E$59,E$61,E$63,E$65,E$67,E$69,E$71,E$73,E$75,E$77,E$79,E$81,E$83,E$85,E$87,E$89,E$91,E$93,E$95,E$97,E$99,E$101,E$103,E$105,E$107,E$109,E$111,E$113,E$115,E$117,E$119,E$121,E$123,E$125)) -> 1 | F371: =RANK(F370,(F$6,F$8,F$10,F$12,F$14,F$16,F$19,F$21,F$23,F$25,F$27,F$29,F$31,F$33,F$35,F$37,F$39,F$41,F$43,F$45,F$47,F$49,F$51,F$53,F$55,F$57,F$59,F$61,F$63,F$65,F$67,F$69,F$71,F$73,F$75,F$77,F$79,F$81,F$83,F$85,F$87,F$89,F$91,F$93,F$95,F$97,F$99,F$101,F$103,F$105,F$107,F$109,F$111,F$113,F$115,F$117,F$119,F$121,F$123,F$125)) -> 1 | G371: =RANK(G370,(G$6,G$8,G$10,G$12,G$14,G$16,G$19,G$21,G$23,G$25,G$27,G$29,G$31,G$33,G$35,G$37,G$39,G$41,G$43,G$45,G$47,G$49,G$51,G$53,G$55,G$57,G$59,G$61,G$63,G$65,G$67,G$69,G$71,G$73,G$75,G$77,G$79,G$81,G$83,G$85,G$87,G$89,G$91,G$93,G$95,G$97,G$99,G$101,G$103,G$105,G$107,G$109,G$111,G$113,G$115,G$117,G$119,G$121,G$123,G$125)) -> 1 | H371: =RANK(H370,(H$6,H$8,H$10,H$12,H$14,H$16,H$19,H$21,H$23,H$25,H$27,H$29,H$31,H$33,H$35,H$37,H$39,H$41,H$43,H$45,H$47,H$49,H$51,H$53,H$55,H$57,H$59,H$61,H$63,H$65,H$67,H$69,H$71,H$73,H$75,H$77,H$79,H$81,H$83,H$85,H$87,H$89,H$91,H$93,H$95,H$97,H$99,H$101,H$103,H$105,H$107,H$109,H$111,H$113,H$115,H$117,H$119,H$121,H$123,H$125)) -> 1 | I371: =RANK(I370,(I$6,I$8,I$10,I$12,I$14,I$16,I$19,I$21,I$23,I$25,I$27,I$29,I$31,I$33,I$35,I$37,I$39,I$41,I$43,I$45,I$47,I$49,I$51,I$53,I$55,I$57,I$59,I$61,I$63,I$65,I$67,I$69,I$71,I$73,I$75,I$77,I$79,I$81,I$83,I$85,I$87,I$89,I$91,I$93,I$95,I$97,I$99,I$101,I$103,I$105,I$107,I$109,I$111,I$113,I$115,I$117,I$119,I$121,I$123,I$125)) -> 1 | J371: =RANK(J370,(J$6,J$8,J$10,J$12,J$14,J$16,J$19,J$21,J$23,J$25,J$27,J$29,J$31,J$33,J$35,J$37,J$39,J$41,J$43,J$45,J$47,J$49,J$51,J$53,J$55,J$57,J$59,J$61,J$63,J$65,J$67,J$69,J$71,J$73,J$75,J$77,J$79,J$81,J$83,J$85,J$87,J$89,J$91,J$93,J$95,J$97,J$99,J$101,J$103,J$105,J$107,J$109,J$111,J$113,J$115,J$117,J$119,J$121,J$123,J$125)) -> 1 | K371: =RANK(K370,(K$6,K$8,K$10,K$12,K$14,K$16,K$19,K$21,K$23,K$25,K$27,K$29,K$31,K$33,K$35,K$37,K$39,K$41,K$43,K$45,K$47,K$49,K$51,K$53,K$55,K$57,K$59,K$61,K$63,K$65,K$67,K$69,K$71,K$73,K$75,K$77,K$79,K$81,K$83,K$85,K$87,K$89,K$91,K$93,K$95,K$97,K$99,K$101,K$103,K$105,K$107,K$109,K$111,K$113,K$115,K$117,K$119,K$121,K$123,K$125)) -> 1 | L371: =RANK(L370,(L$6,L$8,L$10,L$12,L$14,L$16,L$19,L$21,L$23,L$25,L$27,L$29,L$31,L$33,L$35,L$37,L$39,L$41,L$43,L$45,L$47,L$49,L$51,L$53,L$55,L$57,L$59,L$61,L$63,L$65,L$67,L$69,L$71,L$73,L$75,L$77,L$79,L$81,L$83,L$85,L$87,L$89,L$91,L$93,L$95,L$97,L$99,L$101,L$103,L$105,L$107,L$109,L$111,L$113,L$115,L$117,L$119,L$121,L$123,L$125)) -> 1 | M371: =RANK(M370,(M$6,M$8,M$10,M$12,M$14,M$16,M$19,M$21,M$23,M$25,M$27,M$29,M$31,M$33,M$35,M$37,M$39,M$41,M$43,M$45,M$47,M$49,M$51,M$53,M$55,M$57,M$59,M$61,M$63,M$65,M$67,M$69,M$71,M$73,M$75,M$77,M$79,M$81,M$83,M$85,M$87,M$89,M$91,M$93,M$95,M$97,M$99,M$101,M$103,M$105,M$107,M$109,M$111,M$113,M$115,M$117,M$119,M$121,M$123,M$125)) -> 1 | N371: =RANK(N370,(N$6,N$8,N$10,N$12,N$14,N$16,N$19,N$21,N$23,N$25,N$27,N$29,N$31,N$33,N$35,N$37,N$39,N$41,N$43,N$45,N$47,N$49,N$51,N$53,N$55,N$57,N$59,N$61,N$63,N$65,N$67,N$69,N$71,N$73,N$75,N$77,N$79,N$81,N$83,N$85,N$87,N$89,N$91,N$93,N$95,N$97,N$99,N$101,N$103,N$105,N$107,N$109,N$111,N$113,N$115,N$117,N$119,N$121,N$123,N$125)) -> 1 | P371: =RANK(P370,(P$6,P$8,P$10,P$12,P$14,P$16,P$19,P$21,P$23,P$25,P$27,P$29,P$31,P$33,P$35,P$37,P$39,P$41,P$43,P$45,P$47,P$49,P$51,P$53,P$55,P$57,P$59,P$61,P$63,P$65,P$67,P$69,P$71,P$73,P$75,P$77,P$79,P$81,P$83,P$85,P$87,P$89,P$91,P$93,P$95,P$97,P$99,P$101,P$103,P$105,P$107,P$109,P$111,P$113,P$115,P$117,P$119,P$121,P$123,P$125)) -> 1
A372: Phantom | B372: 6 | C372: 16.80 | D372: 17.00 | E372: 33.80 | F372: 16.90 | G372: 16.90 | H372: 16.80 | I372: 25.30 | J372: 17.30 | K372: 16.80 | L372: 17.20 | M372: 25.65 | N372: 84.75 | O372: 0.0 | P372: 84.75
A373: Regiment | C373: =RANK(C372,(C$6,C$8,C$10,C$12,C$14,C$16,C$19,C$21,C$23,C$25,C$27,C$29,C$31,C$33,C$35,C$37,C$39,C$41,C$43,C$45,C$47,C$49,C$51,C$53,C$55,C$57,C$59,C$61,C$63,C$65,C$67,C$69,C$71,C$73,C$75,C$77,C$79,C$81,C$83,C$85,C$87,C$89,C$91,C$93,C$95,C$97,C$99,C$101,C$103,C$105,C$107,C$109,C$111,C$113,C$115,C$117,C$119,C$121,C$123,C$125)) -> 2 | D373: =RANK(D372,(D$6,D$8,D$10,D$12,D$14,D$16,D$19,D$21,D$23,D$25,D$27,D$29,D$31,D$33,D$35,D$37,D$39,D$41,D$43,D$45,D$47,D$49,D$51,D$53,D$55,D$57,D$59,D$61,D$63,D$65,D$67,D$69,D$71,D$73,D$75,D$77,D$79,D$81,D$83,D$85,D$87,D$89,D$91,D$93,D$95,D$97,D$99,D$101,D$103,D$105,D$107,D$109,D$111,D$113,D$115,D$117,D$119,D$121,D$123,D$125)) -> 2 | E373: =RANK(E372,(E$6,E$8,E$10,E$12,E$14,E$16,E$19,E$21,E$23,E$25,E$27,E$29,E$31,E$33,E$35,E$37,E$39,E$41,E$43,E$45,E$47,E$49,E$51,E$53,E$55,E$57,E$59,E$61,E$63,E$65,E$67,E$69,E$71,E$73,E$75,E$77,E$79,E$81,E$83,E$85,E$87,E$89,E$91,E$93,E$95,E$97,E$99,E$101,E$103,E$105,E$107,E$109,E$111,E$113,E$115,E$117,E$119,E$121,E$123,E$125)) -> 2 | F373: =RANK(F372,(F$6,F$8,F$10,F$12,F$14,F$16,F$19,F$21,F$23,F$25,F$27,F$29,F$31,F$33,F$35,F$37,F$39,F$41,F$43,F$45,F$47,F$49,F$51,F$53,F$55,F$57,F$59,F$61,F$63,F$65,F$67,F$69,F$71,F$73,F$75,F$77,F$79,F$81,F$83,F$85,F$87,F$89,F$91,F$93,F$95,F$97,F$99,F$101,F$103,F$105,F$107,F$109,F$111,F$113,F$115,F$117,F$119,F$121,F$123,F$125)) -> 2 | G373: =RANK(G372,(G$6,G$8,G$10,G$12,G$14,G$16,G$19,G$21,G$23,G$25,G$27,G$29,G$31,G$33,G$35,G$37,G$39,G$41,G$43,G$45,G$47,G$49,G$51,G$53,G$55,G$57,G$59,G$61,G$63,G$65,G$67,G$69,G$71,G$73,G$75,G$77,G$79,G$81,G$83,G$85,G$87,G$89,G$91,G$93,G$95,G$97,G$99,G$101,G$103,G$105,G$107,G$109,G$111,G$113,G$115,G$117,G$119,G$121,G$123,G$125)) -> 2 | H373: =RANK(H372,(H$6,H$8,H$10,H$12,H$14,H$16,H$19,H$21,H$23,H$25,H$27,H$29,H$31,H$33,H$35,H$37,H$39,H$41,H$43,H$45,H$47,H$49,H$51,H$53,H$55,H$57,H$59,H$61,H$63,H$65,H$67,H$69,H$71,H$73,H$75,H$77,H$79,H$81,H$83,H$85,H$87,H$89,H$91,H$93,H$95,H$97,H$99,H$101,H$103,H$105,H$107,H$109,H$111,H$113,H$115,H$117,H$119,H$121,H$123,H$125)) -> 2 | I373: =RANK(I372,(I$6,I$8,I$10,I$12,I$14,I$16,I$19,I$21,I$23,I$25,I$27,I$29,I$31,I$33,I$35,I$37,I$39,I$41,I$43,I$45,I$47,I$49,I$51,I$53,I$55,I$57,I$59,I$61,I$63,I$65,I$67,I$69,I$71,I$73,I$75,I$77,I$79,I$81,I$83,I$85,I$87,I$89,I$91,I$93,I$95,I$97,I$99,I$101,I$103,I$105,I$107,I$109,I$111,I$113,I$115,I$117,I$119,I$121,I$123,I$125)) -> 2 | J373: =RANK(J372,(J$6,J$8,J$10,J$12,J$14,J$16,J$19,J$21,J$23,J$25,J$27,J$29,J$31,J$33,J$35,J$37,J$39,J$41,J$43,J$45,J$47,J$49,J$51,J$53,J$55,J$57,J$59,J$61,J$63,J$65,J$67,J$69,J$71,J$73,J$75,J$77,J$79,J$81,J$83,J$85,J$87,J$89,J$91,J$93,J$95,J$97,J$99,J$101,J$103,J$105,J$107,J$109,J$111,J$113,J$115,J$117,J$119,J$121,J$123,J$125)) -> 2 | K373: =RANK(K372,(K$6,K$8,K$10,K$12,K$14,K$16,K$19,K$21,K$23,K$25,K$27,K$29,K$31,K$33,K$35,K$37,K$39,K$41,K$43,K$45,K$47,K$49,K$51,K$53,K$55,K$57,K$59,K$61,K$63,K$65,K$67,K$69,K$71,K$73,K$75,K$77,K$79,K$81,K$83,K$85,K$87,K$89,K$91,K$93,K$95,K$97,K$99,K$101,K$103,K$105,K$107,K$109,K$111,K$113,K$115,K$117,K$119,K$121,K$123,K$125)) -> 2 | L373: =RANK(L372,(L$6,L$8,L$10,L$12,L$14,L$16,L$19,L$21,L$23,L$25,L$27,L$29,L$31,L$33,L$35,L$37,L$39,L$41,L$43,L$45,L$47,L$49,L$51,L$53,L$55,L$57,L$59,L$61,L$63,L$65,L$67,L$69,L$71,L$73,L$75,L$77,L$79,L$81,L$83,L$85,L$87,L$89,L$91,L$93,L$95,L$97,L$99,L$101,L$103,L$105,L$107,L$109,L$111,L$113,L$115,L$117,L$119,L$121,L$123,L$125)) -> 2 | M373: =RANK(M372,(M$6,M$8,M$10,M$12,M$14,M$16,M$19,M$21,M$23,M$25,M$27,M$29,M$31,M$33,M$35,M$37,M$39,M$41,M$43,M$45,M$47,M$49,M$51,M$53,M$55,M$57,M$59,M$61,M$63,M$65,M$67,M$69,M$71,M$73,M$75,M$77,M$79,M$81,M$83,M$85,M$87,M$89,M$91,M$93,M$95,M$97,M$99,M$101,M$103,M$105,M$107,M$109,M$111,M$113,M$115,M$117,M$119,M$121,M$123,M$125)) -> 2 | N373: =RANK(N372,(N$6,N$8,N$10,N$12,N$14,N$16,N$19,N$21,N$23,N$25,N$27,N$29,N$31,N$33,N$35,N$37,N$39,N$41,N$43,N$45,N$47,N$49,N$51,N$53,N$55,N$57,N$59,N$61,N$63,N$65,N$67,N$69,N$71,N$73,N$75,N$77,N$79,N$81,N$83,N$85,N$87,N$89,N$91,N$93,N$95,N$97,N$99,N$101,N$103,N$105,N$107,N$109,N$111,N$113,N$115,N$117,N$119,N$121,N$123,N$125)) -> 2 | P373: =RANK(P372,(P$6,P$8,P$10,P$12,P$14,P$16,P$19,P$21,P$23,P$25,P$27,P$29,P$31,P$33,P$35,P$37,P$39,P$41,P$43,P$45,P$47,P$49,P$51,P$53,P$55,P$57,P$59,P$61,P$63,P$65,P$67,P$69,P$71,P$73,P$75,P$77,P$79,P$81,P$83,P$85,P$87,P$89,P$91,P$93,P$95,P$97,P$99,P$101,P$103,P$105,P$107,P$109,P$111,P$113,P$115,P$117,P$119,P$121,P$123,P$125)) -> 2
A374: Cavaliers | B374: 3 | C374: 16.00 | D374: 15.70 | E374: 31.70 | F374: 15.90 | G374: 15.80 | H374: 16.20 | I374: 23.95 | J374: 16.00 | K374: 15.90 | L374: 16.00 | M374: 23.95 | N374: 79.60 | O374: 0.0 | P374: 79.60
C375: =RANK(C374,(C$6,C$8,C$10,C$12,C$14,C$16,C$19,C$21,C$23,C$25,C$27,C$29,C$31,C$33,C$35,C$37,C$39,C$41,C$43,C$45,C$47,C$49,C$51,C$53,C$55,C$57,C$59,C$61,C$63,C$65,C$67,C$69,C$71,C$73,C$75,C$77,C$79,C$81,C$83,C$85,C$87,C$89,C$91,C$93,C$95,C$97,C$99,C$101,C$103,C$105,C$107,C$109,C$111,C$113,C$115,C$117,C$119,C$121,C$123,C$125)) -> 3 | D375: =RANK(D374,(D$6,D$8,D$10,D$12,D$14,D$16,D$19,D$21,D$23,D$25,D$27,D$29,D$31,D$33,D$35,D$37,D$39,D$41,D$43,D$45,D$47,D$49,D$51,D$53,D$55,D$57,D$59,D$61,D$63,D$65,D$67,D$69,D$71,D$73,D$75,D$77,D$79,D$81,D$83,D$85,D$87,D$89,D$91,D$93,D$95,D$97,D$99,D$101,D$103,D$105,D$107,D$109,D$111,D$113,D$115,D$117,D$119,D$121,D$123,D$125)) -> 3 | E375: =RANK(E374,(E$6,E$8,E$10,E$12,E$14,E$16,E$19,E$21,E$23,E$25,E$27,E$29,E$31,E$33,E$35,E$37,E$39,E$41,E$43,E$45,E$47,E$49,E$51,E$53,E$55,E$57,E$59,E$61,E$63,E$65,E$67,E$69,E$71,E$73,E$75,E$77,E$79,E$81,E$83,E$85,E$87,E$89,E$91,E$93,E$95,E$97,E$99,E$101,E$103,E$105,E$107,E$109,E$111,E$113,E$115,E$117,E$119,E$121,E$123,E$125)) -> 3 | F375: =RANK(F374,(F$6,F$8,F$10,F$12,F$14,F$16,F$19,F$21,F$23,F$25,F$27,F$29,F$31,F$33,F$35,F$37,F$39,F$41,F$43,F$45,F$47,F$49,F$51,F$53,F$55,F$57,F$59,F$61,F$63,F$65,F$67,F$69,F$71,F$73,F$75,F$77,F$79,F$81,F$83,F$85,F$87,F$89,F$91,F$93,F$95,F$97,F$99,F$101,F$103,F$105,F$107,F$109,F$111,F$113,F$115,F$117,F$119,F$121,F$123,F$125)) -> 5 | G375: =RANK(G374,(G$6,G$8,G$10,G$12,G$14,G$16,G$19,G$21,G$23,G$25,G$27,G$29,G$31,G$33,G$35,G$37,G$39,G$41,G$43,G$45,G$47,G$49,G$51,G$53,G$55,G$57,G$59,G$61,G$63,G$65,G$67,G$69,G$71,G$73,G$75,G$77,G$79,G$81,G$83,G$85,G$87,G$89,G$91,G$93,G$95,G$97,G$99,G$101,G$103,G$105,G$107,G$109,G$111,G$113,G$115,G$117,G$119,G$121,G$123,G$125)) -> 4 | H375: =RANK(H374,(H$6,H$8,H$10,H$12,H$14,H$16,H$19,H$21,H$23,H$25,H$27,H$29,H$31,H$33,H$35,H$37,H$39,H$41,H$43,H$45,H$47,H$49,H$51,H$53,H$55,H$57,H$59,H$61,H$63,H$65,H$67,H$69,H$71,H$73,H$75,H$77,H$79,H$81,H$83,H$85,H$87,H$89,H$91,H$93,H$95,H$97,H$99,H$101,H$103,H$105,H$107,H$109,H$111,H$113,H$115,H$117,H$119,H$121,H$123,H$125)) -> 4 | I375: =RANK(I374,(I$6,I$8,I$10,I$12,I$14,I$16,I$19,I$21,I$23,I$25,I$27,I$29,I$31,I$33,I$35,I$37,I$39,I$41,I$43,I$45,I$47,I$49,I$51,I$53,I$55,I$57,I$59,I$61,I$63,I$65,I$67,I$69,I$71,I$73,I$75,I$77,I$79,I$81,I$83,I$85,I$87,I$89,I$91,I$93,I$95,I$97,I$99,I$101,I$103,I$105,I$107,I$109,I$111,I$113,I$115,I$117,I$119,I$121,I$123,I$125)) -> 4 | J375: =RANK(J374,(J$6,J$8,J$10,J$12,J$14,J$16,J$19,J$21,J$23,J$25,J$27,J$29,J$31,J$33,J$35,J$37,J$39,J$41,J$43,J$45,J$47,J$49,J$51,J$53,J$55,J$57,J$59,J$61,J$63,J$65,J$67,J$69,J$71,J$73,J$75,J$77,J$79,J$81,J$83,J$85,J$87,J$89,J$91,J$93,J$95,J$97,J$99,J$101,J$103,J$105,J$107,J$109,J$111,J$113,J$115,J$117,J$119,J$121,J$123,J$125)) -> 5 | K375: =RANK(K374,(K$6,K$8,K$10,K$12,K$14,K$16,K$19,K$21,K$23,K$25,K$27,K$29,K$31,K$33,K$35,K$37,K$39,K$41,K$43,K$45,K$47,K$49,K$51,K$53,K$55,K$57,K$59,K$61,K$63,K$65,K$67,K$69,K$71,K$73,K$75,K$77,K$79,K$81,K$83,K$85,K$87,K$89,K$91,K$93,K$95,K$97,K$99,K$101,K$103,K$105,K$107,K$109,K$111,K$113,K$115,K$117,K$119,K$121,K$123,K$125)) -> 4 | L375: =RANK(L374,(L$6,L$8,L$10,L$12,L$14,L$16,L$19,L$21,L$23,L$25,L$27,L$29,L$31,L$33,L$35,L$37,L$39,L$41,L$43,L$45,L$47,L$49,L$51,L$53,L$55,L$57,L$59,L$61,L$63,L$65,L$67,L$69,L$71,L$73,L$75,L$77,L$79,L$81,L$83,L$85,L$87,L$89,L$91,L$93,L$95,L$97,L$99,L$101,L$103,L$105,L$107,L$109,L$111,L$113,L$115,L$117,L$119,L$121,L$123,L$125)) -> 5 | M375: =RANK(M374,(M$6,M$8,M$10,M$12,M$14,M$16,M$19,M$21,M$23,M$25,M$27,M$29,M$31,M$33,M$35,M$37,M$39,M$41,M$43,M$45,M$47,M$49,M$51,M$53,M$55,M$57,M$59,M$61,M$63,M$65,M$67,M$69,M$71,M$73,M$75,M$77,M$79,M$81,M$83,M$85,M$87,M$89,M$91,M$93,M$95,M$97,M$99,M$101,M$103,M$105,M$107,M$109,M$111,M$113,M$115,M$117,M$119,M$121,M$123,M$125)) -> 5 | N375: =RANK(N374,(N$6,N$8,N$10,N$12,N$14,N$16,N$19,N$21,N$23,N$25,N$27,N$29,N$31,N$33,N$35,N$37,N$39,N$41,N$43,N$45,N$47,N$49,N$51,N$53,N$55,N$57,N$59,N$61,N$63,N$65,N$67,N$69,N$71,N$73,N$75,N$77,N$79,N$81,N$83,N$85,N$87,N$89,N$91,N$93,N$95,N$97,N$99,N$101,N$103,N$105,N$107,N$109,N$111,N$113,N$115,N$117,N$119,N$121,N$123,N$125)) -> 3 | P375: =RANK(P374,(P$6,P$8,P$10,P$12,P$14,P$16,P$19,P$21,P$23,P$25,P$27,P$29,P$31,P$33,P$35,P$37,P$39,P$41,P$43,P$45,P$47,P$49,P$51,P$53,P$55,P$57,P$59,P$61,P$63,P$65,P$67,P$69,P$71,P$73,P$75,P$77,P$79,P$81,P$83,P$85,P$87,P$89,P$91,P$93,P$95,P$97,P$99,P$101,P$103,P$105,P$107,P$109,P$111,P$113,P$115,P$117,P$119,P$121,P$123,P$125)) -> 3
A376: Blue | B376: 2 | C376: 15.20 | D376: 15.30 | E376: 30.50 | F376: 16.10 | G376: 15.50 | H376: 16.30 | I376: 23.95 | J376: 16.50 | K376: 15.70 | L376: 16.70 | M376: 24.45 | N376: 78.90 | O376: 0.0 | P376: 78.90
A377: Stars | C377: =RANK(C376,(C$6,C$8,C$10,C$12,C$14,C$16,C$19,C$21,C$23,C$25,C$27,C$29,C$31,C$33,C$35,C$37,C$39,C$41,C$43,C$45,C$47,C$49,C$51,C$53,C$55,C$57,C$59,C$61,C$63,C$65,C$67,C$69,C$71,C$73,C$75,C$77,C$79,C$81,C$83,C$85,C$87,C$89,C$91,C$93,C$95,C$97,C$99,C$101,C$103,C$105,C$107,C$109,C$111,C$113,C$115,C$117,C$119,C$121,C$123,C$125)) -> 4 | D377: =RANK(D376,(D$6,D$8,D$10,D$12,D$14,D$16,D$19,D$21,D$23,D$25,D$27,D$29,D$31,D$33,D$35,D$37,D$39,D$41,D$43,D$45,D$47,D$49,D$51,D$53,D$55,D$57,D$59,D$61,D$63,D$65,D$67,D$69,D$71,D$73,D$75,D$77,D$79,D$81,D$83,D$85,D$87,D$89,D$91,D$93,D$95,D$97,D$99,D$101,D$103,D$105,D$107,D$109,D$111,D$113,D$115,D$117,D$119,D$121,D$123,D$125)) -> 5 | E377: =RANK(E376,(E$6,E$8,E$10,E$12,E$14,E$16,E$19,E$21,E$23,E$25,E$27,E$29,E$31,E$33,E$35,E$37,E$39,E$41,E$43,E$45,E$47,E$49,E$51,E$53,E$55,E$57,E$59,E$61,E$63,E$65,E$67,E$69,E$71,E$73,E$75,E$77,E$79,E$81,E$83,E$85,E$87,E$89,E$91,E$93,E$95,E$97,E$99,E$101,E$103,E$105,E$107,E$109,E$111,E$113,E$115,E$117,E$119,E$121,E$123,E$125)) -> 5 | F377: =RANK(F376,(F$6,F$8,F$10,F$12,F$14,F$16,F$19,F$21,F$23,F$25,F$27,F$29,F$31,F$33,F$35,F$37,F$39,F$41,F$43,F$45,F$47,F$49,F$51,F$53,F$55,F$57,F$59,F$61,F$63,F$65,F$67,F$69,F$71,F$73,F$75,F$77,F$79,F$81,F$83,F$85,F$87,F$89,F$91,F$93,F$95,F$97,F$99,F$101,F$103,F$105,F$107,F$109,F$111,F$113,F$115,F$117,F$119,F$121,F$123,F$125)) -> 3 | G377: =RANK(G376,(G$6,G$8,G$10,G$12,G$14,G$16,G$19,G$21,G$23,G$25,G$27,G$29,G$31,G$33,G$35,G$37,G$39,G$41,G$43,G$45,G$47,G$49,G$51,G$53,G$55,G$57,G$59,G$61,G$63,G$65,G$67,G$69,G$71,G$73,G$75,G$77,G$79,G$81,G$83,G$85,G$87,G$89,G$91,G$93,G$95,G$97,G$99,G$101,G$103,G$105,G$107,G$109,G$111,G$113,G$115,G$117,G$119,G$121,G$123,G$125)) -> 5 | H377: =RANK(H376,(H$6,H$8,H$10,H$12,H$14,H$16,H$19,H$21,H$23,H$25,H$27,H$29,H$31,H$33,H$35,H$37,H$39,H$41,H$43,H$45,H$47,H$49,H$51,H$53,H$55,H$57,H$59,H$61,H$63,H$65,H$67,H$69,H$71,H$73,H$75,H$77,H$79,H$81,H$83,H$85,H$87,H$89,H$91,H$93,H$95,H$97,H$99,H$101,H$103,H$105,H$107,H$109,H$111,H$113,H$115,H$117,H$119,H$121,H$123,H$125)) -> 3 | I377: =RANK(I376,(I$6,I$8,I$10,I$12,I$14,I$16,I$19,I$21,I$23,I$25,I$27,I$29,I$31,I$33,I$35,I$37,I$39,I$41,I$43,I$45,I$47,I$49,I$51,I$53,I$55,I$57,I$59,I$61,I$63,I$65,I$67,I$69,I$71,I$73,I$75,I$77,I$79,I$81,I$83,I$85,I$87,I$89,I$91,I$93,I$95,I$97,I$99,I$101,I$103,I$105,I$107,I$109,I$111,I$113,I$115,I$117,I$119,I$121,I$123,I$125)) -> 4 | J377: =RANK(J376,(J$6,J$8,J$10,J$12,J$14,J$16,J$19,J$21,J$23,J$25,J$27,J$29,J$31,J$33,J$35,J$37,J$39,J$41,J$43,J$45,J$47,J$49,J$51,J$53,J$55,J$57,J$59,J$61,J$63,J$65,J$67,J$69,J$71,J$73,J$75,J$77,J$79,J$81,J$83,J$85,J$87,J$89,J$91,J$93,J$95,J$97,J$99,J$101,J$103,J$105,J$107,J$109,J$111,J$113,J$115,J$117,J$119,J$121,J$123,J$125)) -> 3 | K377: =RANK(K376,(K$6,K$8,K$10,K$12,K$14,K$16,K$19,K$21,K$23,K$25,K$27,K$29,K$31,K$33,K$35,K$37,K$39,K$41,K$43,K$45,K$47,K$49,K$51,K$53,K$55,K$57,K$59,K$61,K$63,K$65,K$67,K$69,K$71,K$73,K$75,K$77,K$79,K$81,K$83,K$85,K$87,K$89,K$91,K$93,K$95,K$97,K$99,K$101,K$103,K$105,K$107,K$109,K$111,K$113,K$115,K$117,K$119,K$121,K$123,K$125)) -> 5 | L377: =RANK(L376,(L$6,L$8,L$10,L$12,L$14,L$16,L$19,L$21,L$23,L$25,L$27,L$29,L$31,L$33,L$35,L$37,L$39,L$41,L$43,L$45,L$47,L$49,L$51,L$53,L$55,L$57,L$59,L$61,L$63,L$65,L$67,L$69,L$71,L$73,L$75,L$77,L$79,L$81,L$83,L$85,L$87,L$89,L$91,L$93,L$95,L$97,L$99,L$101,L$103,L$105,L$107,L$109,L$111,L$113,L$115,L$117,L$119,L$121,L$123,L$125)) -> 3 | M377: =RANK(M376,(M$6,M$8,M$10,M$12,M$14,M$16,M$19,M$21,M$23,M$25,M$27,M$29,M$31,M$33,M$35,M$37,M$39,M$41,M$43,M$45,M$47,M$49,M$51,M$53,M$55,M$57,M$59,M$61,M$63,M$65,M$67,M$69,M$71,M$73,M$75,M$77,M$79,M$81,M$83,M$85,M$87,M$89,M$91,M$93,M$95,M$97,M$99,M$101,M$103,M$105,M$107,M$109,M$111,M$113,M$115,M$117,M$119,M$121,M$123,M$125)) -> 3 | N377: =RANK(N376,(N$6,N$8,N$10,N$12,N$14,N$16,N$19,N$21,N$23,N$25,N$27,N$29,N$31,N$33,N$35,N$37,N$39,N$41,N$43,N$45,N$47,N$49,N$51,N$53,N$55,N$57,N$59,N$61,N$63,N$65,N$67,N$69,N$71,N$73,N$75,N$77,N$79,N$81,N$83,N$85,N$87,N$89,N$91,N$93,N$95,N$97,N$99,N$101,N$103,N$105,N$107,N$109,N$111,N$113,N$115,N$117,N$119,N$121,N$123,N$125)) -> 4 | P377: =RANK(P376,(P$6,P$8,P$10,P$12,P$14,P$16,P$19,P$21,P$23,P$25,P$27,P$29,P$31,P$33,P$35,P$37,P$39,P$41,P$43,P$45,P$47,P$49,P$51,P$53,P$55,P$57,P$59,P$61,P$63,P$65,P$67,P$69,P$71,P$73,P$75,P$77,P$79,P$81,P$83,P$85,P$87,P$89,P$91,P$93,P$95,P$97,P$99,P$101,P$103,P$105,P$107,P$109,P$111,P$113,P$115,P$117,P$119,P$121,P$123,P$125)) -> 4
A378: Colts | B378: 4 | C378: 15.10 | D378: 15.50 | E378: 30.60 | F378: 16.00 | G378: 15.90 | H378: 16.10 | I378: 24.00 | J378: 16.20 | K378: 16.00 | L378: 16.30 | M378: 24.25 | N378: 78.85 | O378: 0.0 | P378: 78.85
C379: =RANK(C378,(C$6,C$8,C$10,C$12,C$14,C$16,C$19,C$21,C$23,C$25,C$27,C$29,C$31,C$33,C$35,C$37,C$39,C$41,C$43,C$45,C$47,C$49,C$51,C$53,C$55,C$57,C$59,C$61,C$63,C$65,C$67,C$69,C$71,C$73,C$75,C$77,C$79,C$81,C$83,C$85,C$87,C$89,C$91,C$93,C$95,C$97,C$99,C$101,C$103,C$105,C$107,C$109,C$111,C$113,C$115,C$117,C$119,C$121,C$123,C$125)) -> 5 | D379: =RANK(D378,(D$6,D$8,D$10,D$12,D$14,D$16,D$19,D$21,D$23,D$25,D$27,D$29,D$31,D$33,D$35,D$37,D$39,D$41,D$43,D$45,D$47,D$49,D$51,D$53,D$55,D$57,D$59,D$61,D$63,D$65,D$67,D$69,D$71,D$73,D$75,D$77,D$79,D$81,D$83,D$85,D$87,D$89,D$91,D$93,D$95,D$97,D$99,D$101,D$103,D$105,D$107,D$109,D$111,D$113,D$115,D$117,D$119,D$121,D$123,D$125)) -> 4 | E379: =RANK(E378,(E$6,E$8,E$10,E$12,E$14,E$16,E$19,E$21,E$23,E$25,E$27,E$29,E$31,E$33,E$35,E$37,E$39,E$41,E$43,E$45,E$47,E$49,E$51,E$53,E$55,E$57,E$59,E$61,E$63,E$65,E$67,E$69,E$71,E$73,E$75,E$77,E$79,E$81,E$83,E$85,E$87,E$89,E$91,E$93,E$95,E$97,E$99,E$101,E$103,E$105,E$107,E$109,E$111,E$113,E$115,E$117,E$119,E$121,E$123,E$125)) -> 4 | F379: =RANK(F378,(F$6,F$8,F$10,F$12,F$14,F$16,F$19,F$21,F$23,F$25,F$27,F$29,F$31,F$33,F$35,F$37,F$39,F$41,F$43,F$45,F$47,F$49,F$51,F$53,F$55,F$57,F$59,F$61,F$63,F$65,F$67,F$69,F$71,F$73,F$75,F$77,F$79,F$81,F$83,F$85,F$87,F$89,F$91,F$93,F$95,F$97,F$99,F$101,F$103,F$105,F$107,F$109,F$111,F$113,F$115,F$117,F$119,F$121,F$123,F$125)) -> 4 | G379: =RANK(G378,(G$6,G$8,G$10,G$12,G$14,G$16,G$19,G$21,G$23,G$25,G$27,G$29,G$31,G$33,G$35,G$37,G$39,G$41,G$43,G$45,G$47,G$49,G$51,G$53,G$55,G$57,G$59,G$61,G$63,G$65,G$67,G$69,G$71,G$73,G$75,G$77,G$79,G$81,G$83,G$85,G$87,G$89,G$91,G$93,G$95,G$97,G$99,G$101,G$103,G$105,G$107,G$109,G$111,G$113,G$115,G$117,G$119,G$121,G$123,G$125)) -> 3 | H379: =RANK(H378,(H$6,H$8,H$10,H$12,H$14,H$16,H$19,H$21,H$23,H$25,H$27,H$29,H$31,H$33,H$35,H$37,H$39,H$41,H$43,H$45,H$47,H$49,H$51,H$53,H$55,H$57,H$59,H$61,H$63,H$65,H$67,H$69,H$71,H$73,H$75,H$77,H$79,H$81,H$83,H$85,H$87,H$89,H$91,H$93,H$95,H$97,H$99,H$101,H$103,H$105,H$107,H$109,H$111,H$113,H$115,H$117,H$119,H$121,H$123,H$125)) -> 5 | I379: =RANK(I378,(I$6,I$8,I$10,I$12,I$14,I$16,I$19,I$21,I$23,I$25,I$27,I$29,I$31,I$33,I$35,I$37,I$39,I$41,I$43,I$45,I$47,I$49,I$51,I$53,I$55,I$57,I$59,I$61,I$63,I$65,I$67,I$69,I$71,I$73,I$75,I$77,I$79,I$81,I$83,I$85,I$87,I$89,I$91,I$93,I$95,I$97,I$99,I$101,I$103,I$105,I$107,I$109,I$111,I$113,I$115,I$117,I$119,I$121,I$123,I$125)) -> 3 | J379: =RANK(J378,(J$6,J$8,J$10,J$12,J$14,J$16,J$19,J$21,J$23,J$25,J$27,J$29,J$31,J$33,J$35,J$37,J$39,J$41,J$43,J$45,J$47,J$49,J$51,J$53,J$55,J$57,J$59,J$61,J$63,J$65,J$67,J$69,J$71,J$73,J$75,J$77,J$79,J$81,J$83,J$85,J$87,J$89,J$91,J$93,J$95,J$97,J$99,J$101,J$103,J$105,J$107,J$109,J$111,J$113,J$115,J$117,J$119,J$121,J$123,J$125)) -> 4 | K379: =RANK(K378,(K$6,K$8,K$10,K$12,K$14,K$16,K$19,K$21,K$23,K$25,K$27,K$29,K$31,K$33,K$35,K$37,K$39,K$41,K$43,K$45,K$47,K$49,K$51,K$53,K$55,K$57,K$59,K$61,K$63,K$65,K$67,K$69,K$71,K$73,K$75,K$77,K$79,K$81,K$83,K$85,K$87,K$89,K$91,K$93,K$95,K$97,K$99,K$101,K$103,K$105,K$107,K$109,K$111,K$113,K$115,K$117,K$119,K$121,K$123,K$125)) -> 3 | L379: =RANK(L378,(L$6,L$8,L$10,L$12,L$14,L$16,L$19,L$21,L$23,L$25,L$27,L$29,L$31,L$33,L$35,L$37,L$39,L$41,L$43,L$45,L$47,L$49,L$51,L$53,L$55,L$57,L$59,L$61,L$63,L$65,L$67,L$69,L$71,L$73,L$75,L$77,L$79,L$81,L$83,L$85,L$87,L$89,L$91,L$93,L$95,L$97,L$99,L$101,L$103,L$105,L$107,L$109,L$111,L$113,L$115,L$117,L$119,L$121,L$123,L$125)) -> 4 | M379: =RANK(M378,(M$6,M$8,M$10,M$12,M$14,M$16,M$19,M$21,M$23,M$25,M$27,M$29,M$31,M$33,M$35,M$37,M$39,M$41,M$43,M$45,M$47,M$49,M$51,M$53,M$55,M$57,M$59,M$61,M$63,M$65,M$67,M$69,M$71,M$73,M$75,M$77,M$79,M$81,M$83,M$85,M$87,M$89,M$91,M$93,M$95,M$97,M$99,M$101,M$103,M$105,M$107,M$109,M$111,M$113,M$115,M$117,M$119,M$121,M$123,M$125)) -> 4 | N379: =RANK(N378,(N$6,N$8,N$10,N$12,N$14,N$16,N$19,N$21,N$23,N$25,N$27,N$29,N$31,N$33,N$35,N$37,N$39,N$41,N$43,N$45,N$47,N$49,N$51,N$53,N$55,N$57,N$59,N$61,N$63,N$65,N$67,N$69,N$71,N$73,N$75,N$77,N$79,N$81,N$83,N$85,N$87,N$89,N$91,N$93,N$95,N$97,N$99,N$101,N$103,N$105,N$107,N$109,N$111,N$113,N$115,N$117,N$119,N$121,N$123,N$125)) -> 5 | P379: =RANK(P378,(P$6,P$8,P$10,P$12,P$14,P$16,P$19,P$21,P$23,P$25,P$27,P$29,P$31,P$33,P$35,P$37,P$39,P$41,P$43,P$45,P$47,P$49,P$51,P$53,P$55,P$57,P$59,P$61,P$63,P$65,P$67,P$69,P$71,P$73,P$75,P$77,P$79,P$81,P$83,P$85,P$87,P$89,P$91,P$93,P$95,P$97,P$99,P$101,P$103,P$105,P$107,P$109,P$111,P$113,P$115,P$117,P$119,P$121,P$123,P$125)) -> 5
A380: Madison | B380: 1 | C380: 14.60 | D380: 15.00 | E380: 29.60 | F380: 15.30 | G380: 14.80 | H380: 15.50 | I380: 22.80 | J380: 15.30 | K380: 15.40 | L380: 14.00 | M380: 22.35 | N380: 74.75 | O380: 0.0 | P380: 74.75
A381: Scouts | C381: =RANK(C380,(C$6,C$8,C$10,C$12,C$14,C$16,C$19,C$21,C$23,C$25,C$27,C$29,C$31,C$33,C$35,C$37,C$39,C$41,C$43,C$45,C$47,C$49,C$51,C$53,C$55,C$57,C$59,C$61,C$63,C$65,C$67,C$69,C$71,C$73,C$75,C$77,C$79,C$81,C$83,C$85,C$87,C$89,C$91,C$93,C$95,C$97,C$99,C$101,C$103,C$105,C$107,C$109,C$111,C$113,C$115,C$117,C$119,C$121,C$123,C$125)) -> 6 | D381: =RANK(D380,(D$6,D$8,D$10,D$12,D$14,D$16,D$19,D$21,D$23,D$25,D$27,D$29,D$31,D$33,D$35,D$37,D$39,D$41,D$43,D$45,D$47,D$49,D$51,D$53,D$55,D$57,D$59,D$61,D$63,D$65,D$67,D$69,D$71,D$73,D$75,D$77,D$79,D$81,D$83,D$85,D$87,D$89,D$91,D$93,D$95,D$97,D$99,D$101,D$103,D$105,D$107,D$109,D$111,D$113,D$115,D$117,D$119,D$121,D$123,D$125)) -> 6 | E381: =RANK(E380,(E$6,E$8,E$10,E$12,E$14,E$16,E$19,E$21,E$23,E$25,E$27,E$29,E$31,E$33,E$35,E$37,E$39,E$41,E$43,E$45,E$47,E$49,E$51,E$53,E$55,E$57,E$59,E$61,E$63,E$65,E$67,E$69,E$71,E$73,E$75,E$77,E$79,E$81,E$83,E$85,E$87,E$89,E$91,E$93,E$95,E$97,E$99,E$101,E$103,E$105,E$107,E$109,E$111,E$113,E$115,E$117,E$119,E$121,E$123,E$125)) -> 6 | F381: =RANK(F380,(F$6,F$8,F$10,F$12,F$14,F$16,F$19,F$21,F$23,F$25,F$27,F$29,F$31,F$33,F$35,F$37,F$39,F$41,F$43,F$45,F$47,F$49,F$51,F$53,F$55,F$57,F$59,F$61,F$63,F$65,F$67,F$69,F$71,F$73,F$75,F$77,F$79,F$81,F$83,F$85,F$87,F$89,F$91,F$93,F$95,F$97,F$99,F$101,F$103,F$105,F$107,F$109,F$111,F$113,F$115,F$117,F$119,F$121,F$123,F$125)) -> 6 | G381: =RANK(G380,(G$6,G$8,G$10,G$12,G$14,G$16,G$19,G$21,G$23,G$25,G$27,G$29,G$31,G$33,G$35,G$37,G$39,G$41,G$43,G$45,G$47,G$49,G$51,G$53,G$55,G$57,G$59,G$61,G$63,G$65,G$67,G$69,G$71,G$73,G$75,G$77,G$79,G$81,G$83,G$85,G$87,G$89,G$91,G$93,G$95,G$97,G$99,G$101,G$103,G$105,G$107,G$109,G$111,G$113,G$115,G$117,G$119,G$121,G$123,G$125)) -> 6 | H381: =RANK(H380,(H$6,H$8,H$10,H$12,H$14,H$16,H$19,H$21,H$23,H$25,H$27,H$29,H$31,H$33,H$35,H$37,H$39,H$41,H$43,H$45,H$47,H$49,H$51,H$53,H$55,H$57,H$59,H$61,H$63,H$65,H$67,H$69,H$71,H$73,H$75,H$77,H$79,H$81,H$83,H$85,H$87,H$89,H$91,H$93,H$95,H$97,H$99,H$101,H$103,H$105,H$107,H$109,H$111,H$113,H$115,H$117,H$119,H$121,H$123,H$125)) -> 6 | I381: =RANK(I380,(I$6,I$8,I$10,I$12,I$14,I$16,I$19,I$21,I$23,I$25,I$27,I$29,I$31,I$33,I$35,I$37,I$39,I$41,I$43,I$45,I$47,I$49,I$51,I$53,I$55,I$57,I$59,I$61,I$63,I$65,I$67,I$69,I$71,I$73,I$75,I$77,I$79,I$81,I$83,I$85,I$87,I$89,I$91,I$93,I$95,I$97,I$99,I$101,I$103,I$105,I$107,I$109,I$111,I$113,I$115,I$117,I$119,I$121,I$123,I$125)) -> 6 | J381: =RANK(J380,(J$6,J$8,J$10,J$12,J$14,J$16,J$19,J$21,J$23,J$25,J$27,J$29,J$31,J$33,J$35,J$37,J$39,J$41,J$43,J$45,J$47,J$49,J$51,J$53,J$55,J$57,J$59,J$61,J$63,J$65,J$67,J$69,J$71,J$73,J$75,J$77,J$79,J$81,J$83,J$85,J$87,J$89,J$91,J$93,J$95,J$97,J$99,J$101,J$103,J$105,J$107,J$109,J$111,J$113,J$115,J$117,J$119,J$121,J$123,J$125)) -> 6 | K381: =RANK(K380,(K$6,K$8,K$10,K$12,K$14,K$16,K$19,K$21,K$23,K$25,K$27,K$29,K$31,K$33,K$35,K$37,K$39,K$41,K$43,K$45,K$47,K$49,K$51,K$53,K$55,K$57,K$59,K$61,K$63,K$65,K$67,K$69,K$71,K$73,K$75,K$77,K$79,K$81,K$83,K$85,K$87,K$89,K$91,K$93,K$95,K$97,K$99,K$101,K$103,K$105,K$107,K$109,K$111,K$113,K$115,K$117,K$119,K$121,K$123,K$125)) -> 6 | L381: =RANK(L380,(L$6,L$8,L$10,L$12,L$14,L$16,L$19,L$21,L$23,L$25,L$27,L$29,L$31,L$33,L$35,L$37,L$39,L$41,L$43,L$45,L$47,L$49,L$51,L$53,L$55,L$57,L$59,L$61,L$63,L$65,L$67,L$69,L$71,L$73,L$75,L$77,L$79,L$81,L$83,L$85,L$87,L$89,L$91,L$93,L$95,L$97,L$99,L$101,L$103,L$105,L$107,L$109,L$111,L$113,L$115,L$117,L$119,L$121,L$123,L$125)) -> 6 | M381: =RANK(M380,(M$6,M$8,M$10,M$12,M$14,M$16,M$19,M$21,M$23,M$25,M$27,M$29,M$31,M$33,M$35,M$37,M$39,M$41,M$43,M$45,M$47,M$49,M$51,M$53,M$55,M$57,M$59,M$61,M$63,M$65,M$67,M$69,M$71,M$73,M$75,M$77,M$79,M$81,M$83,M$85,M$87,M$89,M$91,M$93,M$95,M$97,M$99,M$101,M$103,M$105,M$107,M$109,M$111,M$113,M$115,M$117,M$119,M$121,M$123,M$125)) -> 6 | N381: =RANK(N380,(N$6,N$8,N$10,N$12,N$14,N$16,N$19,N$21,N$23,N$25,N$27,N$29,N$31,N$33,N$35,N$37,N$39,N$41,N$43,N$45,N$47,N$49,N$51,N$53,N$55,N$57,N$59,N$61,N$63,N$65,N$67,N$69,N$71,N$73,N$75,N$77,N$79,N$81,N$83,N$85,N$87,N$89,N$91,N$93,N$95,N$97,N$99,N$101,N$103,N$105,N$107,N$109,N$111,N$113,N$115,N$117,N$119,N$121,N$123,N$125)) -> 6 | P381: =RANK(P380,(P$6,P$8,P$10,P$12,P$14,P$16,P$19,P$21,P$23,P$25,P$27,P$29,P$31,P$33,P$35,P$37,P$39,P$41,P$43,P$45,P$47,P$49,P$51,P$53,P$55,P$57,P$59,P$61,P$63,P$65,P$67,P$69,P$71,P$73,P$75,P$77,P$79,P$81,P$83,P$85,P$87,P$89,P$91,P$93,P$95,P$97,P$99,P$101,P$103,P$105,P$107,P$109,P$111,P$113,P$115,P$117,P$119,P$121,P$123,P$125)) -> 6
A382: DCI Open Class
A383: Spartans | B383: 1 | C383: 14.00 | D383: 13.90 | E383: 27.90 | F383: 13.80 | G383: 13.90 | H383: 14.20 | I383: 20.95 | J383: 13.80 | K383: 13.80 | L383: 13.00 | M383: 20.30 | N383: 69.15 | O383: 0.0 | P383: 69.15
C384: 1 | D384: 1 | E384: 1 | F384: 1 | G384: 1 | H384: 1 | I384: 1 | J384: 1 | K384: 1 | L384: 1 | M384: 1 | N384: 1 | P384: 1
A387: 7/13/2024 Little Rock, Arkansas
C388: General Effect | F388: Visual | J388: Music
C389: 1 | D389: 2 | F389: Proficiency | G389: Analysis | H389: Color Guard | J389: Brass | K389: Analysis | L389: Percussion | N389: Sub | P389: Total
C390: J. Tate | D390: J. Rhodes | E390: Total | F390: T. Landess | G390: J. Pursifull | H390: C. Fisher | I390: Total ÷2 | J390: B. Dacy | K390: D. Davis | L390: K. Burja | M390: Total ÷2 | N390: Total | O390: Pen | P390: Score
A391: DCI World Class | C391: 20 | D391: 20 | E391: 40 | F391: 20 | G391: 20 | H391: 20 | I391: 30 | J391: 20 | K391: 20 | L391: 20 | M391: 30 | N391: 100 | P391: 100
A392: Boston | B392: 4 | C392: 17.30 | D392: 17.00 | E392: 34.30 | F392: 17.40 | G392: 17.10 | H392: 17.50 | I392: 26.00 | J392: 17.20 | K392: 16.80 | L392: 17.70 | M392: 25.85 | N392: 86.15 | O392: 0.0 | P392: 86.15
A393: Crusaders | C393: 1 | D393: 1 | E393: 1 | F393: 1 | G393: 2 | H393: 1 | I393: 1 | J393: 2 | K393: 2 | L393: 1 | M393: 1 | N393: 1 | P393: 1
A394: Carolina | B394: 5 | C394: 17.20 | D394: 16.60 | E394: 33.80 | F394: 17.10 | G394: 17.20 | H394: 17.00 | I394: 25.65 | J394: 17.50 | K394: 17.10 | L394: 17.00 | M394: 25.80 | N394: 85.25 | O394: 0.0 | P394: 85.25
A395: Crown | C395: 2 | D395: 2 | E395: 2 | F395: 2 | G395: 1 | H395: 2 | I395: 2 | J395: 1 | K395: 1 | L395: 2 | M395: 2 | N395: 2 | P395: 2
A396: Crossmen | B396: 2 | C396: 15.90 | D396: 15.20 | E396: 31.10 | F396: 15.30 | G396: 15.50 | H396: 15.10 | I396: 22.95 | J396: 14.60 | K396: 15.20 | L396: 16.50 | M396: 23.15 | N396: 77.20 | O396: 0.0 | P396: 77.20
C397: 3 | D397: 3 | E397: 3 | F397: 3 | G397: 3 | H397: 3 | I397: 3 | J397: 4 | K397: 3 | L397: 3 | M397: 3 | N397: 3 | P397: 3
A398: Spirit of | B398: 3 | C398: 15.10 | D398: 15.00 | E398: 30.10 | F398: 15.00 | G398: 14.90 | H398: 14.60 | I398: 22.25 | J398: 15.00 | K398: 14.80 | L398: 16.00 | M398: 22.90 | N398: 75.25 | O398: 0.0 | P398: 75.25
A399: Atlanta | C399: 4 | D399: 4 | E399: 4 | F399: 4 | G399: 4 | H399: 4 | I399: 4 | J399: 3 | K399: 4 | L399: 4 | M399: 4 | N399: 4 | P399: 4
A400: Music | B400: 1 | C400: 14.90 | D400: 14.30 | E400: 29.20 | F400: 14.50 | G400: 14.50 | H400: 14.30 | I400: 21.65 | J400: 14.50 | K400: 14.50 | L400: 15.50 | M400: 22.25 | N400: 73.10 | O400: 0.0 | P400: 73.10
A401: City | C401: 5 | D401: 5 | E401: 5 | F401: 5 | G401: 5 | H401: 5 | I401: 5 | J401: 5 | K401: 5 | L401: 5 | M401: 5 | N401: 5 | P401: 5
A404: 7/13/2024 Fort Collins, Colorado--Drums Along The Rockies
C405: General Effect | F405: Visual | J405: Music
C406: 1 | D406: 2 | F406: Proficiency | G406: Analysis | H406: Color Guard | J406: Brass | K406: Analysis | L406: Percussion | N406: Sub | P406: Total
C407: G. Oliviero | D407: J. Bell | E407: Total | F407: W. Chumley | G407: E. Beens | H407: T. Wingate | I407: Total ÷2 | J407: A. Brown | K407: J. Kennedy | L407: M. Leitzke | M407: Total ÷2 | N407: Total | O407: Pen | P407: Score
A408: DCI World Class | C408: 20 | D408: 20 | E408: 40 | F408: 20 | G408: 20 | H408: 20 | I408: 30 | J408: 20 | K408: 20 | L408: 20 | M408: 30 | N408: 100 | P408: 100
A409: Blue | B409: 8 | C409: 17.00 | D409: 17.30 | E409: 34.30 | F409: 17.30 | G409: 16.80 | H409: 17.30 | I409: 25.70 | J409: 17.10 | K409: 17.10 | L409: 16.90 | M409: 25.55 | N409: 85.55 | O409: 0.0 | P409: 85.55
A410: Devils | C410: =RANK(C409,(C$6,C$8,C$10,C$12,C$14,C$16,C$18,C$20,C$22,C$25,C$27,C$29,C$31,C$33,C$35,C$37,C$39,C$41,C$43,C$45,C$47,C$49,C$51,C$53,C$55,C$57,C$59,C$61,C$63,C$65,C$67,C$69,C$71,C$73,C$75,C$77,C$79,C$81,C$83,C$85,C$87,C$89,C$91,C$93,C$95,C$97,C$99,C$101,C$103,C$105,C$107,C$109,C$111,C$113,C$115,C$117,C$119,C$121,C$123,C$125)) -> 1 | D410: =RANK(D409,(D$6,D$8,D$10,D$12,D$14,D$16,D$18,D$20,D$22,D$25,D$27,D$29,D$31,D$33,D$35,D$37,D$39,D$41,D$43,D$45,D$47,D$49,D$51,D$53,D$55,D$57,D$59,D$61,D$63,D$65,D$67,D$69,D$71,D$73,D$75,D$77,D$79,D$81,D$83,D$85,D$87,D$89,D$91,D$93,D$95,D$97,D$99,D$101,D$103,D$105,D$107,D$109,D$111,D$113,D$115,D$117,D$119,D$121,D$123,D$125)) -> 1 | E410: =RANK(E409,(E$6,E$8,E$10,E$12,E$14,E$16,E$18,E$20,E$22,E$25,E$27,E$29,E$31,E$33,E$35,E$37,E$39,E$41,E$43,E$45,E$47,E$49,E$51,E$53,E$55,E$57,E$59,E$61,E$63,E$65,E$67,E$69,E$71,E$73,E$75,E$77,E$79,E$81,E$83,E$85,E$87,E$89,E$91,E$93,E$95,E$97,E$99,E$101,E$103,E$105,E$107,E$109,E$111,E$113,E$115,E$117,E$119,E$121,E$123,E$125)) -> 1 | F410: =RANK(F409,(F$6,F$8,F$10,F$12,F$14,F$16,F$18,F$20,F$22,F$25,F$27,F$29,F$31,F$33,F$35,F$37,F$39,F$41,F$43,F$45,F$47,F$49,F$51,F$53,F$55,F$57,F$59,F$61,F$63,F$65,F$67,F$69,F$71,F$73,F$75,F$77,F$79,F$81,F$83,F$85,F$87,F$89,F$91,F$93,F$95,F$97,F$99,F$101,F$103,F$105,F$107,F$109,F$111,F$113,F$115,F$117,F$119,F$121,F$123,F$125)) -> 1 | G410: =RANK(G409,(G$6,G$8,G$10,G$12,G$14,G$16,G$18,G$20,G$22,G$25,G$27,G$29,G$31,G$33,G$35,G$37,G$39,G$41,G$43,G$45,G$47,G$49,G$51,G$53,G$55,G$57,G$59,G$61,G$63,G$65,G$67,G$69,G$71,G$73,G$75,G$77,G$79,G$81,G$83,G$85,G$87,G$89,G$91,G$93,G$95,G$97,G$99,G$101,G$103,G$105,G$107,G$109,G$111,G$113,G$115,G$117,G$119,G$121,G$123,G$125)) -> 1 | H410: =RANK(H409,(H$6,H$8,H$10,H$12,H$14,H$16,H$18,H$20,H$22,H$25,H$27,H$29,H$31,H$33,H$35,H$37,H$39,H$41,H$43,H$45,H$47,H$49,H$51,H$53,H$55,H$57,H$59,H$61,H$63,H$65,H$67,H$69,H$71,H$73,H$75,H$77,H$79,H$81,H$83,H$85,H$87,H$89,H$91,H$93,H$95,H$97,H$99,H$101,H$103,H$105,H$107,H$109,H$111,H$113,H$115,H$117,H$119,H$121,H$123,H$125)) -> 1 | I410: =RANK(I409,(I$6,I$8,I$10,I$12,I$14,I$16,I$18,I$20,I$22,I$25,I$27,I$29,I$31,I$33,I$35,I$37,I$39,I$41,I$43,I$45,I$47,I$49,I$51,I$53,I$55,I$57,I$59,I$61,I$63,I$65,I$67,I$69,I$71,I$73,I$75,I$77,I$79,I$81,I$83,I$85,I$87,I$89,I$91,I$93,I$95,I$97,I$99,I$101,I$103,I$105,I$107,I$109,I$111,I$113,I$115,I$117,I$119,I$121,I$123,I$125)) -> 1 | J410: =RANK(J409,(J$6,J$8,J$10,J$12,J$14,J$16,J$18,J$20,J$22,J$25,J$27,J$29,J$31,J$33,J$35,J$37,J$39,J$41,J$43,J$45,J$47,J$49,J$51,J$53,J$55,J$57,J$59,J$61,J$63,J$65,J$67,J$69,J$71,J$73,J$75,J$77,J$79,J$81,J$83,J$85,J$87,J$89,J$91,J$93,J$95,J$97,J$99,J$101,J$103,J$105,J$107,J$109,J$111,J$113,J$115,J$117,J$119,J$121,J$123,J$125)) -> 1 | K410: =RANK(K409,(K$6,K$8,K$10,K$12,K$14,K$16,K$18,K$20,K$22,K$25,K$27,K$29,K$31,K$33,K$35,K$37,K$39,K$41,K$43,K$45,K$47,K$49,K$51,K$53,K$55,K$57,K$59,K$61,K$63,K$65,K$67,K$69,K$71,K$73,K$75,K$77,K$79,K$81,K$83,K$85,K$87,K$89,K$91,K$93,K$95,K$97,K$99,K$101,K$103,K$105,K$107,K$109,K$111,K$113,K$115,K$117,K$119,K$121,K$123,K$125)) -> 1 | L410: =RANK(L409,(L$6,L$8,L$10,L$12,L$14,L$16,L$18,L$20,L$22,L$25,L$27,L$29,L$31,L$33,L$35,L$37,L$39,L$41,L$43,L$45,L$47,L$49,L$51,L$53,L$55,L$57,L$59,L$61,L$63,L$65,L$67,L$69,L$71,L$73,L$75,L$77,L$79,L$81,L$83,L$85,L$87,L$89,L$91,L$93,L$95,L$97,L$99,L$101,L$103,L$105,L$107,L$109,L$111,L$113,L$115,L$117,L$119,L$121,L$123,L$125)) -> 2 | M410: =RANK(M409,(M$6,M$8,M$10,M$12,M$14,M$16,M$18,M$20,M$22,M$25,M$27,M$29,M$31,M$33,M$35,M$37,M$39,M$41,M$43,M$45,M$47,M$49,M$51,M$53,M$55,M$57,M$59,M$61,M$63,M$65,M$67,M$69,M$71,M$73,M$75,M$77,M$79,M$81,M$83,M$85,M$87,M$89,M$91,M$93,M$95,M$97,M$99,M$101,M$103,M$105,M$107,M$109,M$111,M$113,M$115,M$117,M$119,M$121,M$123,M$125)) -> 1 | N410: =RANK(N409,(N$6,N$8,N$10,N$12,N$14,N$16,N$18,N$20,N$22,N$25,N$27,N$29,N$31,N$33,N$35,N$37,N$39,N$41,N$43,N$45,N$47,N$49,N$51,N$53,N$55,N$57,N$59,N$61,N$63,N$65,N$67,N$69,N$71,N$73,N$75,N$77,N$79,N$81,N$83,N$85,N$87,N$89,N$91,N$93,N$95,N$97,N$99,N$101,N$103,N$105,N$107,N$109,N$111,N$113,N$115,N$117,N$119,N$121,N$123,N$125)) -> 1 | P410: =RANK(P409,(P$6,P$8,P$10,P$12,P$14,P$16,P$18,P$20,P$22,P$25,P$27,P$29,P$31,P$33,P$35,P$37,P$39,P$41,P$43,P$45,P$47,P$49,P$51,P$53,P$55,P$57,P$59,P$61,P$63,P$65,P$67,P$69,P$71,P$73,P$75,P$77,P$79,P$81,P$83,P$85,P$87,P$89,P$91,P$93,P$95,P$97,P$99,P$101,P$103,P$105,P$107,P$109,P$111,P$113,P$115,P$117,P$119,P$121,P$123,P$125)) -> 1
A411: Vanguard | B411: 1 | C411: 16.50 | D411: 16.30 | E411: 32.80 | F411: 16.50 | G411: 16.10 | H411: 16.20 | I411: 24.40 | J411: 16.50 | K411: 16.00 | L411: 17.10 | M411: 24.80 | N411: 82.00 | O411: 0.0 | P411: 82.00
C412: =RANK(C411,(C$6,C$8,C$10,C$12,C$14,C$16,C$18,C$20,C$22,C$25,C$27,C$29,C$31,C$33,C$35,C$37,C$39,C$41,C$43,C$45,C$47,C$49,C$51,C$53,C$55,C$57,C$59,C$61,C$63,C$65,C$67,C$69,C$71,C$73,C$75,C$77,C$79,C$81,C$83,C$85,C$87,C$89,C$91,C$93,C$95,C$97,C$99,C$101,C$103,C$105,C$107,C$109,C$111,C$113,C$115,C$117,C$119,C$121,C$123,C$125)) -> 2 | D412: =RANK(D411,(D$6,D$8,D$10,D$12,D$14,D$16,D$18,D$20,D$22,D$25,D$27,D$29,D$31,D$33,D$35,D$37,D$39,D$41,D$43,D$45,D$47,D$49,D$51,D$53,D$55,D$57,D$59,D$61,D$63,D$65,D$67,D$69,D$71,D$73,D$75,D$77,D$79,D$81,D$83,D$85,D$87,D$89,D$91,D$93,D$95,D$97,D$99,D$101,D$103,D$105,D$107,D$109,D$111,D$113,D$115,D$117,D$119,D$121,D$123,D$125)) -> 3 | E412: =RANK(E411,(E$6,E$8,E$10,E$12,E$14,E$16,E$18,E$20,E$22,E$25,E$27,E$29,E$31,E$33,E$35,E$37,E$39,E$41,E$43,E$45,E$47,E$49,E$51,E$53,E$55,E$57,E$59,E$61,E$63,E$65,E$67,E$69,E$71,E$73,E$75,E$77,E$79,E$81,E$83,E$85,E$87,E$89,E$91,E$93,E$95,E$97,E$99,E$101,E$103,E$105,E$107,E$109,E$111,E$113,E$115,E$117,E$119,E$121,E$123,E$125)) -> 2 | F412: =RANK(F411,(F$6,F$8,F$10,F$12,F$14,F$16,F$18,F$20,F$22,F$25,F$27,F$29,F$31,F$33,F$35,F$37,F$39,F$41,F$43,F$45,F$47,F$49,F$51,F$53,F$55,F$57,F$59,F$61,F$63,F$65,F$67,F$69,F$71,F$73,F$75,F$77,F$79,F$81,F$83,F$85,F$87,F$89,F$91,F$93,F$95,F$97,F$99,F$101,F$103,F$105,F$107,F$109,F$111,F$113,F$115,F$117,F$119,F$121,F$123,F$125)) -> 2 | G412: =RANK(G411,(G$6,G$8,G$10,G$12,G$14,G$16,G$18,G$20,G$22,G$25,G$27,G$29,G$31,G$33,G$35,G$37,G$39,G$41,G$43,G$45,G$47,G$49,G$51,G$53,G$55,G$57,G$59,G$61,G$63,G$65,G$67,G$69,G$71,G$73,G$75,G$77,G$79,G$81,G$83,G$85,G$87,G$89,G$91,G$93,G$95,G$97,G$99,G$101,G$103,G$105,G$107,G$109,G$111,G$113,G$115,G$117,G$119,G$121,G$123,G$125)) -> 3 | H412: =RANK(H411,(H$6,H$8,H$10,H$12,H$14,H$16,H$18,H$20,H$22,H$25,H$27,H$29,H$31,H$33,H$35,H$37,H$39,H$41,H$43,H$45,H$47,H$49,H$51,H$53,H$55,H$57,H$59,H$61,H$63,H$65,H$67,H$69,H$71,H$73,H$75,H$77,H$79,H$81,H$83,H$85,H$87,H$89,H$91,H$93,H$95,H$97,H$99,H$101,H$103,H$105,H$107,H$109,H$111,H$113,H$115,H$117,H$119,H$121,H$123,H$125)) -> 3 | I412: =RANK(I411,(I$6,I$8,I$10,I$12,I$14,I$16,I$18,I$20,I$22,I$25,I$27,I$29,I$31,I$33,I$35,I$37,I$39,I$41,I$43,I$45,I$47,I$49,I$51,I$53,I$55,I$57,I$59,I$61,I$63,I$65,I$67,I$69,I$71,I$73,I$75,I$77,I$79,I$81,I$83,I$85,I$87,I$89,I$91,I$93,I$95,I$97,I$99,I$101,I$103,I$105,I$107,I$109,I$111,I$113,I$115,I$117,I$119,I$121,I$123,I$125)) -> 3 | J412: =RANK(J411,(J$6,J$8,J$10,J$12,J$14,J$16,J$18,J$20,J$22,J$25,J$27,J$29,J$31,J$33,J$35,J$37,J$39,J$41,J$43,J$45,J$47,J$49,J$51,J$53,J$55,J$57,J$59,J$61,J$63,J$65,J$67,J$69,J$71,J$73,J$75,J$77,J$79,J$81,J$83,J$85,J$87,J$89,J$91,J$93,J$95,J$97,J$99,J$101,J$103,J$105,J$107,J$109,J$111,J$113,J$115,J$117,J$119,J$121,J$123,J$125)) -> 2 | K412: =RANK(K411,(K$6,K$8,K$10,K$12,K$14,K$16,K$18,K$20,K$22,K$25,K$27,K$29,K$31,K$33,K$35,K$37,K$39,K$41,K$43,K$45,K$47,K$49,K$51,K$53,K$55,K$57,K$59,K$61,K$63,K$65,K$67,K$69,K$71,K$73,K$75,K$77,K$79,K$81,K$83,K$85,K$87,K$89,K$91,K$93,K$95,K$97,K$99,K$101,K$103,K$105,K$107,K$109,K$111,K$113,K$115,K$117,K$119,K$121,K$123,K$125)) -> 3 | L412: =RANK(L411,(L$6,L$8,L$10,L$12,L$14,L$16,L$18,L$20,L$22,L$25,L$27,L$29,L$31,L$33,L$35,L$37,L$39,L$41,L$43,L$45,L$47,L$49,L$51,L$53,L$55,L$57,L$59,L$61,L$63,L$65,L$67,L$69,L$71,L$73,L$75,L$77,L$79,L$81,L$83,L$85,L$87,L$89,L$91,L$93,L$95,L$97,L$99,L$101,L$103,L$105,L$107,L$109,L$111,L$113,L$115,L$117,L$119,L$121,L$123,L$125)) -> 1 | M412: =RANK(M411,(M$6,M$8,M$10,M$12,M$14,M$16,M$18,M$20,M$22,M$25,M$27,M$29,M$31,M$33,M$35,M$37,M$39,M$41,M$43,M$45,M$47,M$49,M$51,M$53,M$55,M$57,M$59,M$61,M$63,M$65,M$67,M$69,M$71,M$73,M$75,M$77,M$79,M$81,M$83,M$85,M$87,M$89,M$91,M$93,M$95,M$97,M$99,M$101,M$103,M$105,M$107,M$109,M$111,M$113,M$115,M$117,M$119,M$121,M$123,M$125)) -> 2 | N412: =RANK(N411,(N$6,N$8,N$10,N$12,N$14,N$16,N$18,N$20,N$22,N$25,N$27,N$29,N$31,N$33,N$35,N$37,N$39,N$41,N$43,N$45,N$47,N$49,N$51,N$53,N$55,N$57,N$59,N$61,N$63,N$65,N$67,N$69,N$71,N$73,N$75,N$77,N$79,N$81,N$83,N$85,N$87,N$89,N$91,N$93,N$95,N$97,N$99,N$101,N$103,N$105,N$107,N$109,N$111,N$113,N$115,N$117,N$119,N$121,N$123,N$125)) -> 2 | P412: =RANK(P411,(P$6,P$8,P$10,P$12,P$14,P$16,P$18,P$20,P$22,P$25,P$27,P$29,P$31,P$33,P$35,P$37,P$39,P$41,P$43,P$45,P$47,P$49,P$51,P$53,P$55,P$57,P$59,P$61,P$63,P$65,P$67,P$69,P$71,P$73,P$75,P$77,P$79,P$81,P$83,P$85,P$87,P$89,P$91,P$93,P$95,P$97,P$99,P$101,P$103,P$105,P$107,P$109,P$111,P$113,P$115,P$117,P$119,P$121,P$123,P$125)) -> 2
A413: Mandarins | B413: 7 | C413: 16.20 | D413: 16.60 | E413: 32.80 | F413: 16.40 | G413: 16.20 | H413: 16.40 | I413: 24.50 | J413: 16.10 | K413: 16.60 | L413: 16.10 | M413: 24.40 | N413: 81.70 | O413: 0.0 | P413: 81.70
C414: =RANK(C413,(C$6,C$8,C$10,C$12,C$14,C$16,C$18,C$20,C$22,C$25,C$27,C$29,C$31,C$33,C$35,C$37,C$39,C$41,C$43,C$45,C$47,C$49,C$51,C$53,C$55,C$57,C$59,C$61,C$63,C$65,C$67,C$69,C$71,C$73,C$75,C$77,C$79,C$81,C$83,C$85,C$87,C$89,C$91,C$93,C$95,C$97,C$99,C$101,C$103,C$105,C$107,C$109,C$111,C$113,C$115,C$117,C$119,C$121,C$123,C$125)) -> 3 | D414: =RANK(D413,(D$6,D$8,D$10,D$12,D$14,D$16,D$18,D$20,D$22,D$25,D$27,D$29,D$31,D$33,D$35,D$37,D$39,D$41,D$43,D$45,D$47,D$49,D$51,D$53,D$55,D$57,D$59,D$61,D$63,D$65,D$67,D$69,D$71,D$73,D$75,D$77,D$79,D$81,D$83,D$85,D$87,D$89,D$91,D$93,D$95,D$97,D$99,D$101,D$103,D$105,D$107,D$109,D$111,D$113,D$115,D$117,D$119,D$121,D$123,D$125)) -> 2 | E414: =RANK(E413,(E$6,E$8,E$10,E$12,E$14,E$16,E$18,E$20,E$22,E$25,E$27,E$29,E$31,E$33,E$35,E$37,E$39,E$41,E$43,E$45,E$47,E$49,E$51,E$53,E$55,E$57,E$59,E$61,E$63,E$65,E$67,E$69,E$71,E$73,E$75,E$77,E$79,E$81,E$83,E$85,E$87,E$89,E$91,E$93,E$95,E$97,E$99,E$101,E$103,E$105,E$107,E$109,E$111,E$113,E$115,E$117,E$119,E$121,E$123,E$125)) -> 2 | F414: =RANK(F413,(F$6,F$8,F$10,F$12,F$14,F$16,F$18,F$20,F$22,F$25,F$27,F$29,F$31,F$33,F$35,F$37,F$39,F$41,F$43,F$45,F$47,F$49,F$51,F$53,F$55,F$57,F$59,F$61,F$63,F$65,F$67,F$69,F$71,F$73,F$75,F$77,F$79,F$81,F$83,F$85,F$87,F$89,F$91,F$93,F$95,F$97,F$99,F$101,F$103,F$105,F$107,F$109,F$111,F$113,F$115,F$117,F$119,F$121,F$123,F$125)) -> 3 | G414: =RANK(G413,(G$6,G$8,G$10,G$12,G$14,G$16,G$18,G$20,G$22,G$25,G$27,G$29,G$31,G$33,G$35,G$37,G$39,G$41,G$43,G$45,G$47,G$49,G$51,G$53,G$55,G$57,G$59,G$61,G$63,G$65,G$67,G$69,G$71,G$73,G$75,G$77,G$79,G$81,G$83,G$85,G$87,G$89,G$91,G$93,G$95,G$97,G$99,G$101,G$103,G$105,G$107,G$109,G$111,G$113,G$115,G$117,G$119,G$121,G$123,G$125)) -> 2 | H414: =RANK(H413,(H$6,H$8,H$10,H$12,H$14,H$16,H$18,H$20,H$22,H$25,H$27,H$29,H$31,H$33,H$35,H$37,H$39,H$41,H$43,H$45,H$47,H$49,H$51,H$53,H$55,H$57,H$59,H$61,H$63,H$65,H$67,H$69,H$71,H$73,H$75,H$77,H$79,H$81,H$83,H$85,H$87,H$89,H$91,H$93,H$95,H$97,H$99,H$101,H$103,H$105,H$107,H$109,H$111,H$113,H$115,H$117,H$119,H$121,H$123,H$125)) -> 2 | I414: =RANK(I413,(I$6,I$8,I$10,I$12,I$14,I$16,I$18,I$20,I$22,I$25,I$27,I$29,I$31,I$33,I$35,I$37,I$39,I$41,I$43,I$45,I$47,I$49,I$51,I$53,I$55,I$57,I$59,I$61,I$63,I$65,I$67,I$69,I$71,I$73,I$75,I$77,I$79,I$81,I$83,I$85,I$87,I$89,I$91,I$93,I$95,I$97,I$99,I$101,I$103,I$105,I$107,I$109,I$111,I$113,I$115,I$117,I$119,I$121,I$123,I$125)) -> 2 | J414: =RANK(J413,(J$6,J$8,J$10,J$12,J$14,J$16,J$18,J$20,J$22,J$25,J$27,J$29,J$31,J$33,J$35,J$37,J$39,J$41,J$43,J$45,J$47,J$49,J$51,J$53,J$55,J$57,J$59,J$61,J$63,J$65,J$67,J$69,J$71,J$73,J$75,J$77,J$79,J$81,J$83,J$85,J$87,J$89,J$91,J$93,J$95,J$97,J$99,J$101,J$103,J$105,J$107,J$109,J$111,J$113,J$115,J$117,J$119,J$121,J$123,J$125)) -> 4 | K414: =RANK(K413,(K$6,K$8,K$10,K$12,K$14,K$16,K$18,K$20,K$22,K$25,K$27,K$29,K$31,K$33,K$35,K$37,K$39,K$41,K$43,K$45,K$47,K$49,K$51,K$53,K$55,K$57,K$59,K$61,K$63,K$65,K$67,K$69,K$71,K$73,K$75,K$77,K$79,K$81,K$83,K$85,K$87,K$89,K$91,K$93,K$95,K$97,K$99,K$101,K$103,K$105,K$107,K$109,K$111,K$113,K$115,K$117,K$119,K$121,K$123,K$125)) -> 2 | L414: =RANK(L413,(L$6,L$8,L$10,L$12,L$14,L$16,L$18,L$20,L$22,L$25,L$27,L$29,L$31,L$33,L$35,L$37,L$39,L$41,L$43,L$45,L$47,L$49,L$51,L$53,L$55,L$57,L$59,L$61,L$63,L$65,L$67,L$69,L$71,L$73,L$75,L$77,L$79,L$81,L$83,L$85,L$87,L$89,L$91,L$93,L$95,L$97,L$99,L$101,L$103,L$105,L$107,L$109,L$111,L$113,L$115,L$117,L$119,L$121,L$123,L$125)) -> 3 | M414: =RANK(M413,(M$6,M$8,M$10,M$12,M$14,M$16,M$18,M$20,M$22,M$25,M$27,M$29,M$31,M$33,M$35,M$37,M$39,M$41,M$43,M$45,M$47,M$49,M$51,M$53,M$55,M$57,M$59,M$61,M$63,M$65,M$67,M$69,M$71,M$73,M$75,M$77,M$79,M$81,M$83,M$85,M$87,M$89,M$91,M$93,M$95,M$97,M$99,M$101,M$103,M$105,M$107,M$109,M$111,M$113,M$115,M$117,M$119,M$121,M$123,M$125)) -> 3 | N414: =RANK(N413,(N$6,N$8,N$10,N$12,N$14,N$16,N$18,N$20,N$22,N$25,N$27,N$29,N$31,N$33,N$35,N$37,N$39,N$41,N$43,N$45,N$47,N$49,N$51,N$53,N$55,N$57,N$59,N$61,N$63,N$65,N$67,N$69,N$71,N$73,N$75,N$77,N$79,N$81,N$83,N$85,N$87,N$89,N$91,N$93,N$95,N$97,N$99,N$101,N$103,N$105,N$107,N$109,N$111,N$113,N$115,N$117,N$119,N$121,N$123,N$125)) -> 3 | P414: =RANK(P413,(P$6,P$8,P$10,P$12,P$14,P$16,P$18,P$20,P$22,P$25,P$27,P$29,P$31,P$33,P$35,P$37,P$39,P$41,P$43,P$45,P$47,P$49,P$51,P$53,P$55,P$57,P$59,P$61,P$63,P$65,P$67,P$69,P$71,P$73,P$75,P$77,P$79,P$81,P$83,P$85,P$87,P$89,P$91,P$93,P$95,P$97,P$99,P$101,P$103,P$105,P$107,P$109,P$111,P$113,P$115,P$117,P$119,P$121,P$123,P$125)) -> 3
A415: Troopers | B415: 6 | C415: 15.50 | D415: 15.40 | E415: 30.90 | F415: 15.40 | G415: 15.30 | H415: 14.90 | I415: 22.80 | J415: 16.20 | K415: 15.90 | L415: 16.00 | M415: 24.05 | N415: 77.75 | O415: 0.0 | P415: 77.75
C416: =RANK(C415,(C$6,C$8,C$10,C$12,C$14,C$16,C$18,C$20,C$22,C$25,C$27,C$29,C$31,C$33,C$35,C$37,C$39,C$41,C$43,C$45,C$47,C$49,C$51,C$53,C$55,C$57,C$59,C$61,C$63,C$65,C$67,C$69,C$71,C$73,C$75,C$77,C$79,C$81,C$83,C$85,C$87,C$89,C$91,C$93,C$95,C$97,C$99,C$101,C$103,C$105,C$107,C$109,C$111,C$113,C$115,C$117,C$119,C$121,C$123,C$125)) -> 4 | D416: =RANK(D415,(D$6,D$8,D$10,D$12,D$14,D$16,D$18,D$20,D$22,D$25,D$27,D$29,D$31,D$33,D$35,D$37,D$39,D$41,D$43,D$45,D$47,D$49,D$51,D$53,D$55,D$57,D$59,D$61,D$63,D$65,D$67,D$69,D$71,D$73,D$75,D$77,D$79,D$81,D$83,D$85,D$87,D$89,D$91,D$93,D$95,D$97,D$99,D$101,D$103,D$105,D$107,D$109,D$111,D$113,D$115,D$117,D$119,D$121,D$123,D$125)) -> 5 | E416: =RANK(E415,(E$6,E$8,E$10,E$12,E$14,E$16,E$18,E$20,E$22,E$25,E$27,E$29,E$31,E$33,E$35,E$37,E$39,E$41,E$43,E$45,E$47,E$49,E$51,E$53,E$55,E$57,E$59,E$61,E$63,E$65,E$67,E$69,E$71,E$73,E$75,E$77,E$79,E$81,E$83,E$85,E$87,E$89,E$91,E$93,E$95,E$97,E$99,E$101,E$103,E$105,E$107,E$109,E$111,E$113,E$115,E$117,E$119,E$121,E$123,E$125)) -> 4 | F416: =RANK(F415,(F$6,F$8,F$10,F$12,F$14,F$16,F$18,F$20,F$22,F$25,F$27,F$29,F$31,F$33,F$35,F$37,F$39,F$41,F$43,F$45,F$47,F$49,F$51,F$53,F$55,F$57,F$59,F$61,F$63,F$65,F$67,F$69,F$71,F$73,F$75,F$77,F$79,F$81,F$83,F$85,F$87,F$89,F$91,F$93,F$95,F$97,F$99,F$101,F$103,F$105,F$107,F$109,F$111,F$113,F$115,F$117,F$119,F$121,F$123,F$125)) -> 4 | G416: =RANK(G415,(G$6,G$8,G$10,G$12,G$14,G$16,G$18,G$20,G$22,G$25,G$27,G$29,G$31,G$33,G$35,G$37,G$39,G$41,G$43,G$45,G$47,G$49,G$51,G$53,G$55,G$57,G$59,G$61,G$63,G$65,G$67,G$69,G$71,G$73,G$75,G$77,G$79,G$81,G$83,G$85,G$87,G$89,G$91,G$93,G$95,G$97,G$99,G$101,G$103,G$105,G$107,G$109,G$111,G$113,G$115,G$117,G$119,G$121,G$123,G$125)) -> 4 | H416: =RANK(H415,(H$6,H$8,H$10,H$12,H$14,H$16,H$18,H$20,H$22,H$25,H$27,H$29,H$31,H$33,H$35,H$37,H$39,H$41,H$43,H$45,H$47,H$49,H$51,H$53,H$55,H$57,H$59,H$61,H$63,H$65,H$67,H$69,H$71,H$73,H$75,H$77,H$79,H$81,H$83,H$85,H$87,H$89,H$91,H$93,H$95,H$97,H$99,H$101,H$103,H$105,H$107,H$109,H$111,H$113,H$115,H$117,H$119,H$121,H$123,H$125)) -> 5 | I416: =RANK(I415,(I$6,I$8,I$10,I$12,I$14,I$16,I$18,I$20,I$22,I$25,I$27,I$29,I$31,I$33,I$35,I$37,I$39,I$41,I$43,I$45,I$47,I$49,I$51,I$53,I$55,I$57,I$59,I$61,I$63,I$65,I$67,I$69,I$71,I$73,I$75,I$77,I$79,I$81,I$83,I$85,I$87,I$89,I$91,I$93,I$95,I$97,I$99,I$101,I$103,I$105,I$107,I$109,I$111,I$113,I$115,I$117,I$119,I$121,I$123,I$125)) -> 4 | J416: =RANK(J415,(J$6,J$8,J$10,J$12,J$14,J$16,J$18,J$20,J$22,J$25,J$27,J$29,J$31,J$33,J$35,J$37,J$39,J$41,J$43,J$45,J$47,J$49,J$51,J$53,J$55,J$57,J$59,J$61,J$63,J$65,J$67,J$69,J$71,J$73,J$75,J$77,J$79,J$81,J$83,J$85,J$87,J$89,J$91,J$93,J$95,J$97,J$99,J$101,J$103,J$105,J$107,J$109,J$111,J$113,J$115,J$117,J$119,J$121,J$123,J$125)) -> 3 | K416: =RANK(K415,(K$6,K$8,K$10,K$12,K$14,K$16,K$18,K$20,K$22,K$25,K$27,K$29,K$31,K$33,K$35,K$37,K$39,K$41,K$43,K$45,K$47,K$49,K$51,K$53,K$55,K$57,K$59,K$61,K$63,K$65,K$67,K$69,K$71,K$73,K$75,K$77,K$79,K$81,K$83,K$85,K$87,K$89,K$91,K$93,K$95,K$97,K$99,K$101,K$103,K$105,K$107,K$109,K$111,K$113,K$115,K$117,K$119,K$121,K$123,K$125)) -> 4 | L416: =RANK(L415,(L$6,L$8,L$10,L$12,L$14,L$16,L$18,L$20,L$22,L$25,L$27,L$29,L$31,L$33,L$35,L$37,L$39,L$41,L$43,L$45,L$47,L$49,L$51,L$53,L$55,L$57,L$59,L$61,L$63,L$65,L$67,L$69,L$71,L$73,L$75,L$77,L$79,L$81,L$83,L$85,L$87,L$89,L$91,L$93,L$95,L$97,L$99,L$101,L$103,L$105,L$107,L$109,L$111,L$113,L$115,L$117,L$119,L$121,L$123,L$125)) -> 4 | M416: =RANK(M415,(M$6,M$8,M$10,M$12,M$14,M$16,M$18,M$20,M$22,M$25,M$27,M$29,M$31,M$33,M$35,M$37,M$39,M$41,M$43,M$45,M$47,M$49,M$51,M$53,M$55,M$57,M$59,M$61,M$63,M$65,M$67,M$69,M$71,M$73,M$75,M$77,M$79,M$81,M$83,M$85,M$87,M$89,M$91,M$93,M$95,M$97,M$99,M$101,M$103,M$105,M$107,M$109,M$111,M$113,M$115,M$117,M$119,M$121,M$123,M$125)) -> 4 | N416: =RANK(N415,(N$6,N$8,N$10,N$12,N$14,N$16,N$18,N$20,N$22,N$25,N$27,N$29,N$31,N$33,N$35,N$37,N$39,N$41,N$43,N$45,N$47,N$49,N$51,N$53,N$55,N$57,N$59,N$61,N$63,N$65,N$67,N$69,N$71,N$73,N$75,N$77,N$79,N$81,N$83,N$85,N$87,N$89,N$91,N$93,N$95,N$97,N$99,N$101,N$103,N$105,N$107,N$109,N$111,N$113,N$115,N$117,N$119,N$121,N$123,N$125)) -> 4 | P416: =RANK(P415,(P$6,P$8,P$10,P$12,P$14,P$16,P$18,P$20,P$22,P$25,P$27,P$29,P$31,P$33,P$35,P$37,P$39,P$41,P$43,P$45,P$47,P$49,P$51,P$53,P$55,P$57,P$59,P$61,P$63,P$65,P$67,P$69,P$71,P$73,P$75,P$77,P$79,P$81,P$83,P$85,P$87,P$89,P$91,P$93,P$95,P$97,P$99,P$101,P$103,P$105,P$107,P$109,P$111,P$113,P$115,P$117,P$119,P$121,P$123,P$125)) -> 4
A417: Blue | B417: 9 | C417: 14.50 | D417: 15.80 | E417: 30.30 | F417: 15.20 | G417: 15.20 | H417: 15.10 | I417: 22.75 | J417: 14.40 | K417: 15.30 | L417: 14.50 | M417: 22.10 | N417: 75.15 | O417: 0.0 | P417: 75.15
A418: Knights | C418: =RANK(C417,(C$6,C$8,C$10,C$12,C$14,C$16,C$18,C$20,C$22,C$25,C$27,C$29,C$31,C$33,C$35,C$37,C$39,C$41,C$43,C$45,C$47,C$49,C$51,C$53,C$55,C$57,C$59,C$61,C$63,C$65,C$67,C$69,C$71,C$73,C$75,C$77,C$79,C$81,C$83,C$85,C$87,C$89,C$91,C$93,C$95,C$97,C$99,C$101,C$103,C$105,C$107,C$109,C$111,C$113,C$115,C$117,C$119,C$121,C$123,C$125)) -> 7 | D418: =RANK(D417,(D$6,D$8,D$10,D$12,D$14,D$16,D$18,D$20,D$22,D$25,D$27,D$29,D$31,D$33,D$35,D$37,D$39,D$41,D$43,D$45,D$47,D$49,D$51,D$53,D$55,D$57,D$59,D$61,D$63,D$65,D$67,D$69,D$71,D$73,D$75,D$77,D$79,D$81,D$83,D$85,D$87,D$89,D$91,D$93,D$95,D$97,D$99,D$101,D$103,D$105,D$107,D$109,D$111,D$113,D$115,D$117,D$119,D$121,D$123,D$125)) -> 4 | E418: =RANK(E417,(E$6,E$8,E$10,E$12,E$14,E$16,E$18,E$20,E$22,E$25,E$27,E$29,E$31,E$33,E$35,E$37,E$39,E$41,E$43,E$45,E$47,E$49,E$51,E$53,E$55,E$57,E$59,E$61,E$63,E$65,E$67,E$69,E$71,E$73,E$75,E$77,E$79,E$81,E$83,E$85,E$87,E$89,E$91,E$93,E$95,E$97,E$99,E$101,E$103,E$105,E$107,E$109,E$111,E$113,E$115,E$117,E$119,E$121,E$123,E$125)) -> 5 | F418: =RANK(F417,(F$6,F$8,F$10,F$12,F$14,F$16,F$18,F$20,F$22,F$25,F$27,F$29,F$31,F$33,F$35,F$37,F$39,F$41,F$43,F$45,F$47,F$49,F$51,F$53,F$55,F$57,F$59,F$61,F$63,F$65,F$67,F$69,F$71,F$73,F$75,F$77,F$79,F$81,F$83,F$85,F$87,F$89,F$91,F$93,F$95,F$97,F$99,F$101,F$103,F$105,F$107,F$109,F$111,F$113,F$115,F$117,F$119,F$121,F$123,F$125)) -> 5 | G418: =RANK(G417,(G$6,G$8,G$10,G$12,G$14,G$16,G$18,G$20,G$22,G$25,G$27,G$29,G$31,G$33,G$35,G$37,G$39,G$41,G$43,G$45,G$47,G$49,G$51,G$53,G$55,G$57,G$59,G$61,G$63,G$65,G$67,G$69,G$71,G$73,G$75,G$77,G$79,G$81,G$83,G$85,G$87,G$89,G$91,G$93,G$95,G$97,G$99,G$101,G$103,G$105,G$107,G$109,G$111,G$113,G$115,G$117,G$119,G$121,G$123,G$125)) -> 5 | H418: =RANK(H417,(H$6,H$8,H$10,H$12,H$14,H$16,H$18,H$20,H$22,H$25,H$27,H$29,H$31,H$33,H$35,H$37,H$39,H$41,H$43,H$45,H$47,H$49,H$51,H$53,H$55,H$57,H$59,H$61,H$63,H$65,H$67,H$69,H$71,H$73,H$75,H$77,H$79,H$81,H$83,H$85,H$87,H$89,H$91,H$93,H$95,H$97,H$99,H$101,H$103,H$105,H$107,H$109,H$111,H$113,H$115,H$117,H$119,H$121,H$123,H$125)) -> 4 | I418: =RANK(I417,(I$6,I$8,I$10,I$12,I$14,I$16,I$18,I$20,I$22,I$25,I$27,I$29,I$31,I$33,I$35,I$37,I$39,I$41,I$43,I$45,I$47,I$49,I$51,I$53,I$55,I$57,I$59,I$61,I$63,I$65,I$67,I$69,I$71,I$73,I$75,I$77,I$79,I$81,I$83,I$85,I$87,I$89,I$91,I$93,I$95,I$97,I$99,I$101,I$103,I$105,I$107,I$109,I$111,I$113,I$115,I$117,I$119,I$121,I$123,I$125)) -> 5 | J418: =RANK(J417,(J$6,J$8,J$10,J$12,J$14,J$16,J$18,J$20,J$22,J$25,J$27,J$29,J$31,J$33,J$35,J$37,J$39,J$41,J$43,J$45,J$47,J$49,J$51,J$53,J$55,J$57,J$59,J$61,J$63,J$65,J$67,J$69,J$71,J$73,J$75,J$77,J$79,J$81,J$83,J$85,J$87,J$89,J$91,J$93,J$95,J$97,J$99,J$101,J$103,J$105,J$107,J$109,J$111,J$113,J$115,J$117,J$119,J$121,J$123,J$125)) -> 6 | K418: =RANK(K417,(K$6,K$8,K$10,K$12,K$14,K$16,K$18,K$20,K$22,K$25,K$27,K$29,K$31,K$33,K$35,K$37,K$39,K$41,K$43,K$45,K$47,K$49,K$51,K$53,K$55,K$57,K$59,K$61,K$63,K$65,K$67,K$69,K$71,K$73,K$75,K$77,K$79,K$81,K$83,K$85,K$87,K$89,K$91,K$93,K$95,K$97,K$99,K$101,K$103,K$105,K$107,K$109,K$111,K$113,K$115,K$117,K$119,K$121,K$123,K$125)) -> 5 | L418: =RANK(L417,(L$6,L$8,L$10,L$12,L$14,L$16,L$18,L$20,L$22,L$25,L$27,L$29,L$31,L$33,L$35,L$37,L$39,L$41,L$43,L$45,L$47,L$49,L$51,L$53,L$55,L$57,L$59,L$61,L$63,L$65,L$67,L$69,L$71,L$73,L$75,L$77,L$79,L$81,L$83,L$85,L$87,L$89,L$91,L$93,L$95,L$97,L$99,L$101,L$103,L$105,L$107,L$109,L$111,L$113,L$115,L$117,L$119,L$121,L$123,L$125)) -> 6 | M418: =RANK(M417,(M$6,M$8,M$10,M$12,M$14,M$16,M$18,M$20,M$22,M$25,M$27,M$29,M$31,M$33,M$35,M$37,M$39,M$41,M$43,M$45,M$47,M$49,M$51,M$53,M$55,M$57,M$59,M$61,M$63,M$65,M$67,M$69,M$71,M$73,M$75,M$77,M$79,M$81,M$83,M$85,M$87,M$89,M$91,M$93,M$95,M$97,M$99,M$101,M$103,M$105,M$107,M$109,M$111,M$113,M$115,M$117,M$119,M$121,M$123,M$125)) -> 6 | N418: =RANK(N417,(N$6,N$8,N$10,N$12,N$14,N$16,N$18,N$20,N$22,N$25,N$27,N$29,N$31,N$33,N$35,N$37,N$39,N$41,N$43,N$45,N$47,N$49,N$51,N$53,N$55,N$57,N$59,N$61,N$63,N$65,N$67,N$69,N$71,N$73,N$75,N$77,N$79,N$81,N$83,N$85,N$87,N$89,N$91,N$93,N$95,N$97,N$99,N$101,N$103,N$105,N$107,N$109,N$111,N$113,N$115,N$117,N$119,N$121,N$123,N$125)) -> 5 | P418: =RANK(P417,(P$6,P$8,P$10,P$12,P$14,P$16,P$18,P$20,P$22,P$25,P$27,P$29,P$31,P$33,P$35,P$37,P$39,P$41,P$43,P$45,P$47,P$49,P$51,P$53,P$55,P$57,P$59,P$61,P$63,P$65,P$67,P$69,P$71,P$73,P$75,P$77,P$79,P$81,P$83,P$85,P$87,P$89,P$91,P$93,P$95,P$97,P$99,P$101,P$103,P$105,P$107,P$109,P$111,P$113,P$115,P$117,P$119,P$121,P$123,P$125)) -> 5
A419: Pacific | B419: 5 | C419: 15.00 | D419: 14.70 | E419: 29.70 | F419: 14.40 | G419: 14.70 | H419: 14.80 | I419: 21.95 | J419: 15.00 | K419: 15.00 | L419: 14.80 | M419: 22.40 | N419: 74.05 | O419: 0.0 | P419: 74.05
A420: Crest | C420: =RANK(C419,(C$6,C$8,C$10,C$12,C$14,C$16,C$18,C$20,C$22,C$25,C$27,C$29,C$31,C$33,C$35,C$37,C$39,C$41,C$43,C$45,C$47,C$49,C$51,C$53,C$55,C$57,C$59,C$61,C$63,C$65,C$67,C$69,C$71,C$73,C$75,C$77,C$79,C$81,C$83,C$85,C$87,C$89,C$91,C$93,C$95,C$97,C$99,C$101,C$103,C$105,C$107,C$109,C$111,C$113,C$115,C$117,C$119,C$121,C$123,C$125)) -> 5 | D420: =RANK(D419,(D$6,D$8,D$10,D$12,D$14,D$16,D$18,D$20,D$22,D$25,D$27,D$29,D$31,D$33,D$35,D$37,D$39,D$41,D$43,D$45,D$47,D$49,D$51,D$53,D$55,D$57,D$59,D$61,D$63,D$65,D$67,D$69,D$71,D$73,D$75,D$77,D$79,D$81,D$83,D$85,D$87,D$89,D$91,D$93,D$95,D$97,D$99,D$101,D$103,D$105,D$107,D$109,D$111,D$113,D$115,D$117,D$119,D$121,D$123,D$125)) -> 7 | E420: =RANK(E419,(E$6,E$8,E$10,E$12,E$14,E$16,E$18,E$20,E$22,E$25,E$27,E$29,E$31,E$33,E$35,E$37,E$39,E$41,E$43,E$45,E$47,E$49,E$51,E$53,E$55,E$57,E$59,E$61,E$63,E$65,E$67,E$69,E$71,E$73,E$75,E$77,E$79,E$81,E$83,E$85,E$87,E$89,E$91,E$93,E$95,E$97,E$99,E$101,E$103,E$105,E$107,E$109,E$111,E$113,E$115,E$117,E$119,E$121,E$123,E$125)) -> 6 | F420: =RANK(F419,(F$6,F$8,F$10,F$12,F$14,F$16,F$18,F$20,F$22,F$25,F$27,F$29,F$31,F$33,F$35,F$37,F$39,F$41,F$43,F$45,F$47,F$49,F$51,F$53,F$55,F$57,F$59,F$61,F$63,F$65,F$67,F$69,F$71,F$73,F$75,F$77,F$79,F$81,F$83,F$85,F$87,F$89,F$91,F$93,F$95,F$97,F$99,F$101,F$103,F$105,F$107,F$109,F$111,F$113,F$115,F$117,F$119,F$121,F$123,F$125)) -> 7 | G420: =RANK(G419,(G$6,G$8,G$10,G$12,G$14,G$16,G$18,G$20,G$22,G$25,G$27,G$29,G$31,G$33,G$35,G$37,G$39,G$41,G$43,G$45,G$47,G$49,G$51,G$53,G$55,G$57,G$59,G$61,G$63,G$65,G$67,G$69,G$71,G$73,G$75,G$77,G$79,G$81,G$83,G$85,G$87,G$89,G$91,G$93,G$95,G$97,G$99,G$101,G$103,G$105,G$107,G$109,G$111,G$113,G$115,G$117,G$119,G$121,G$123,G$125)) -> 6 | H420: =RANK(H419,(H$6,H$8,H$10,H$12,H$14,H$16,H$18,H$20,H$22,H$25,H$27,H$29,H$31,H$33,H$35,H$37,H$39,H$41,H$43,H$45,H$47,H$49,H$51,H$53,H$55,H$57,H$59,H$61,H$63,H$65,H$67,H$69,H$71,H$73,H$75,H$77,H$79,H$81,H$83,H$85,H$87,H$89,H$91,H$93,H$95,H$97,H$99,H$101,H$103,H$105,H$107,H$109,H$111,H$113,H$115,H$117,H$119,H$121,H$123,H$125)) -> 6 | I420: =RANK(I419,(I$6,I$8,I$10,I$12,I$14,I$16,I$18,I$20,I$22,I$25,I$27,I$29,I$31,I$33,I$35,I$37,I$39,I$41,I$43,I$45,I$47,I$49,I$51,I$53,I$55,I$57,I$59,I$61,I$63,I$65,I$67,I$69,I$71,I$73,I$75,I$77,I$79,I$81,I$83,I$85,I$87,I$89,I$91,I$93,I$95,I$97,I$99,I$101,I$103,I$105,I$107,I$109,I$111,I$113,I$115,I$117,I$119,I$121,I$123,I$125)) -> 6 | J420: =RANK(J419,(J$6,J$8,J$10,J$12,J$14,J$16,J$18,J$20,J$22,J$25,J$27,J$29,J$31,J$33,J$35,J$37,J$39,J$41,J$43,J$45,J$47,J$49,J$51,J$53,J$55,J$57,J$59,J$61,J$63,J$65,J$67,J$69,J$71,J$73,J$75,J$77,J$79,J$81,J$83,J$85,J$87,J$89,J$91,J$93,J$95,J$97,J$99,J$101,J$103,J$105,J$107,J$109,J$111,J$113,J$115,J$117,J$119,J$121,J$123,J$125)) -> 5 | K420: =RANK(K419,(K$6,K$8,K$10,K$12,K$14,K$16,K$18,K$20,K$22,K$25,K$27,K$29,K$31,K$33,K$35,K$37,K$39,K$41,K$43,K$45,K$47,K$49,K$51,K$53,K$55,K$57,K$59,K$61,K$63,K$65,K$67,K$69,K$71,K$73,K$75,K$77,K$79,K$81,K$83,K$85,K$87,K$89,K$91,K$93,K$95,K$97,K$99,K$101,K$103,K$105,K$107,K$109,K$111,K$113,K$115,K$117,K$119,K$121,K$123,K$125)) -> 6 | L420: =RANK(L419,(L$6,L$8,L$10,L$12,L$14,L$16,L$18,L$20,L$22,L$25,L$27,L$29,L$31,L$33,L$35,L$37,L$39,L$41,L$43,L$45,L$47,L$49,L$51,L$53,L$55,L$57,L$59,L$61,L$63,L$65,L$67,L$69,L$71,L$73,L$75,L$77,L$79,L$81,L$83,L$85,L$87,L$89,L$91,L$93,L$95,L$97,L$99,L$101,L$103,L$105,L$107,L$109,L$111,L$113,L$115,L$117,L$119,L$121,L$123,L$125)) -> 5 | M420: =RANK(M419,(M$6,M$8,M$10,M$12,M$14,M$16,M$18,M$20,M$22,M$25,M$27,M$29,M$31,M$33,M$35,M$37,M$39,M$41,M$43,M$45,M$47,M$49,M$51,M$53,M$55,M$57,M$59,M$61,M$63,M$65,M$67,M$69,M$71,M$73,M$75,M$77,M$79,M$81,M$83,M$85,M$87,M$89,M$91,M$93,M$95,M$97,M$99,M$101,M$103,M$105,M$107,M$109,M$111,M$113,M$115,M$117,M$119,M$121,M$123,M$125)) -> 5 | N420: =RANK(N419,(N$6,N$8,N$10,N$12,N$14,N$16,N$18,N$20,N$22,N$25,N$27,N$29,N$31,N$33,N$35,N$37,N$39,N$41,N$43,N$45,N$47,N$49,N$51,N$53,N$55,N$57,N$59,N$61,N$63,N$65,N$67,N$69,N$71,N$73,N$75,N$77,N$79,N$81,N$83,N$85,N$87,N$89,N$91,N$93,N$95,N$97,N$99,N$101,N$103,N$105,N$107,N$109,N$111,N$113,N$115,N$117,N$119,N$121,N$123,N$125)) -> 6 | P420: =RANK(P419,(P$6,P$8,P$10,P$12,P$14,P$16,P$18,P$20,P$22,P$25,P$27,P$29,P$31,P$33,P$35,P$37,P$39,P$41,P$43,P$45,P$47,P$49,P$51,P$53,P$55,P$57,P$59,P$61,P$63,P$65,P$67,P$69,P$71,P$73,P$75,P$77,P$79,P$81,P$83,P$85,P$87,P$89,P$91,P$93,P$95,P$97,P$99,P$101,P$103,P$105,P$107,P$109,P$111,P$113,P$115,P$117,P$119,P$121,P$123,P$125)) -> 6
A421: Academy | B421: 4 | C421: 14.60 | D421: 14.90 | E421: 29.50 | F421: 14.70 | G421: 14.30 | H421: 14.10 | I421: 21.55 | J421: 13.80 | K421: 14.80 | L421: 14.00 | M421: 21.30 | N421: 72.35 | O421: 0.0 | P421: 72.35
C422: =RANK(C421,(C$6,C$8,C$10,C$12,C$14,C$16,C$18,C$20,C$22,C$25,C$27,C$29,C$31,C$33,C$35,C$37,C$39,C$41,C$43,C$45,C$47,C$49,C$51,C$53,C$55,C$57,C$59,C$61,C$63,C$65,C$67,C$69,C$71,C$73,C$75,C$77,C$79,C$81,C$83,C$85,C$87,C$89,C$91,C$93,C$95,C$97,C$99,C$101,C$103,C$105,C$107,C$109,C$111,C$113,C$115,C$117,C$119,C$121,C$123,C$125)) -> 6 | D422: =RANK(D421,(D$6,D$8,D$10,D$12,D$14,D$16,D$18,D$20,D$22,D$25,D$27,D$29,D$31,D$33,D$35,D$37,D$39,D$41,D$43,D$45,D$47,D$49,D$51,D$53,D$55,D$57,D$59,D$61,D$63,D$65,D$67,D$69,D$71,D$73,D$75,D$77,D$79,D$81,D$83,D$85,D$87,D$89,D$91,D$93,D$95,D$97,D$99,D$101,D$103,D$105,D$107,D$109,D$111,D$113,D$115,D$117,D$119,D$121,D$123,D$125)) -> 6 | E422: =RANK(E421,(E$6,E$8,E$10,E$12,E$14,E$16,E$18,E$20,E$22,E$25,E$27,E$29,E$31,E$33,E$35,E$37,E$39,E$41,E$43,E$45,E$47,E$49,E$51,E$53,E$55,E$57,E$59,E$61,E$63,E$65,E$67,E$69,E$71,E$73,E$75,E$77,E$79,E$81,E$83,E$85,E$87,E$89,E$91,E$93,E$95,E$97,E$99,E$101,E$103,E$105,E$107,E$109,E$111,E$113,E$115,E$117,E$119,E$121,E$123,E$125)) -> 7 | F422: =RANK(F421,(F$6,F$8,F$10,F$12,F$14,F$16,F$18,F$20,F$22,F$25,F$27,F$29,F$31,F$33,F$35,F$37,F$39,F$41,F$43,F$45,F$47,F$49,F$51,F$53,F$55,F$57,F$59,F$61,F$63,F$65,F$67,F$69,F$71,F$73,F$75,F$77,F$79,F$81,F$83,F$85,F$87,F$89,F$91,F$93,F$95,F$97,F$99,F$101,F$103,F$105,F$107,F$109,F$111,F$113,F$115,F$117,F$119,F$121,F$123,F$125)) -> 6 | G422: =RANK(G421,(G$6,G$8,G$10,G$12,G$14,G$16,G$18,G$20,G$22,G$25,G$27,G$29,G$31,G$33,G$35,G$37,G$39,G$41,G$43,G$45,G$47,G$49,G$51,G$53,G$55,G$57,G$59,G$61,G$63,G$65,G$67,G$69,G$71,G$73,G$75,G$77,G$79,G$81,G$83,G$85,G$87,G$89,G$91,G$93,G$95,G$97,G$99,G$101,G$103,G$105,G$107,G$109,G$111,G$113,G$115,G$117,G$119,G$121,G$123,G$125)) -> 8 | H422: =RANK(H421,(H$6,H$8,H$10,H$12,H$14,H$16,H$18,H$20,H$22,H$25,H$27,H$29,H$31,H$33,H$35,H$37,H$39,H$41,H$43,H$45,H$47,H$49,H$51,H$53,H$55,H$57,H$59,H$61,H$63,H$65,H$67,H$69,H$71,H$73,H$75,H$77,H$79,H$81,H$83,H$85,H$87,H$89,H$91,H$93,H$95,H$97,H$99,H$101,H$103,H$105,H$107,H$109,H$111,H$113,H$115,H$117,H$119,H$121,H$123,H$125)) -> 7 | I422: =RANK(I421,(I$6,I$8,I$10,I$12,I$14,I$16,I$18,I$20,I$22,I$25,I$27,I$29,I$31,I$33,I$35,I$37,I$39,I$41,I$43,I$45,I$47,I$49,I$51,I$53,I$55,I$57,I$59,I$61,I$63,I$65,I$67,I$69,I$71,I$73,I$75,I$77,I$79,I$81,I$83,I$85,I$87,I$89,I$91,I$93,I$95,I$97,I$99,I$101,I$103,I$105,I$107,I$109,I$111,I$113,I$115,I$117,I$119,I$121,I$123,I$125)) -> 7 | J422: =RANK(J421,(J$6,J$8,J$10,J$12,J$14,J$16,J$18,J$20,J$22,J$25,J$27,J$29,J$31,J$33,J$35,J$37,J$39,J$41,J$43,J$45,J$47,J$49,J$51,J$53,J$55,J$57,J$59,J$61,J$63,J$65,J$67,J$69,J$71,J$73,J$75,J$77,J$79,J$81,J$83,J$85,J$87,J$89,J$91,J$93,J$95,J$97,J$99,J$101,J$103,J$105,J$107,J$109,J$111,J$113,J$115,J$117,J$119,J$121,J$123,J$125)) -> 7 | K422: =RANK(K421,(K$6,K$8,K$10,K$12,K$14,K$16,K$18,K$20,K$22,K$25,K$27,K$29,K$31,K$33,K$35,K$37,K$39,K$41,K$43,K$45,K$47,K$49,K$51,K$53,K$55,K$57,K$59,K$61,K$63,K$65,K$67,K$69,K$71,K$73,K$75,K$77,K$79,K$81,K$83,K$85,K$87,K$89,K$91,K$93,K$95,K$97,K$99,K$101,K$103,K$105,K$107,K$109,K$111,K$113,K$115,K$117,K$119,K$121,K$123,K$125)) -> 7 | L422: =RANK(L421,(L$6,L$8,L$10,L$12,L$14,L$16,L$18,L$20,L$22,L$25,L$27,L$29,L$31,L$33,L$35,L$37,L$39,L$41,L$43,L$45,L$47,L$49,L$51,L$53,L$55,L$57,L$59,L$61,L$63,L$65,L$67,L$69,L$71,L$73,L$75,L$77,L$79,L$81,L$83,L$85,L$87,L$89,L$91,L$93,L$95,L$97,L$99,L$101,L$103,L$105,L$107,L$109,L$111,L$113,L$115,L$117,L$119,L$121,L$123,L$125)) -> 7 | M422: =RANK(M421,(M$6,M$8,M$10,M$12,M$14,M$16,M$18,M$20,M$22,M$25,M$27,M$29,M$31,M$33,M$35,M$37,M$39,M$41,M$43,M$45,M$47,M$49,M$51,M$53,M$55,M$57,M$59,M$61,M$63,M$65,M$67,M$69,M$71,M$73,M$75,M$77,M$79,M$81,M$83,M$85,M$87,M$89,M$91,M$93,M$95,M$97,M$99,M$101,M$103,M$105,M$107,M$109,M$111,M$113,M$115,M$117,M$119,M$121,M$123,M$125)) -> 7 | N422: =RANK(N421,(N$6,N$8,N$10,N$12,N$14,N$16,N$18,N$20,N$22,N$25,N$27,N$29,N$31,N$33,N$35,N$37,N$39,N$41,N$43,N$45,N$47,N$49,N$51,N$53,N$55,N$57,N$59,N$61,N$63,N$65,N$67,N$69,N$71,N$73,N$75,N$77,N$79,N$81,N$83,N$85,N$87,N$89,N$91,N$93,N$95,N$97,N$99,N$101,N$103,N$105,N$107,N$109,N$111,N$113,N$115,N$117,N$119,N$121,N$123,N$125)) -> 7 | P422: =RANK(P421,(P$6,P$8,P$10,P$12,P$14,P$16,P$18,P$20,P$22,P$25,P$27,P$29,P$31,P$33,P$35,P$37,P$39,P$41,P$43,P$45,P$47,P$49,P$51,P$53,P$55,P$57,P$59,P$61,P$63,P$65,P$67,P$69,P$71,P$73,P$75,P$77,P$79,P$81,P$83,P$85,P$87,P$89,P$91,P$93,P$95,P$97,P$99,P$101,P$103,P$105,P$107,P$109,P$111,P$113,P$115,P$117,P$119,P$121,P$123,P$125)) -> 7
A423: Genesis | B423: 3 | C423: 13.50 | D423: 13.20 | E423: 26.70 | F423: 13.50 | G423: 14.40 | H423: 13.80 | I423: 20.85 | J423: 12.50 | K423: 14.40 | L423: 13.90 | M423: 20.40 | N423: 67.95 | O423: 0.0 | P423: 67.95
C424: =RANK(C423,(C$6,C$8,C$10,C$12,C$14,C$16,C$18,C$20,C$22,C$25,C$27,C$29,C$31,C$33,C$35,C$37,C$39,C$41,C$43,C$45,C$47,C$49,C$51,C$53,C$55,C$57,C$59,C$61,C$63,C$65,C$67,C$69,C$71,C$73,C$75,C$77,C$79,C$81,C$83,C$85,C$87,C$89,C$91,C$93,C$95,C$97,C$99,C$101,C$103,C$105,C$107,C$109,C$111,C$113,C$115,C$117,C$119,C$121,C$123,C$125)) -> 8 | D424: =RANK(D423,(D$6,D$8,D$10,D$12,D$14,D$16,D$18,D$20,D$22,D$25,D$27,D$29,D$31,D$33,D$35,D$37,D$39,D$41,D$43,D$45,D$47,D$49,D$51,D$53,D$55,D$57,D$59,D$61,D$63,D$65,D$67,D$69,D$71,D$73,D$75,D$77,D$79,D$81,D$83,D$85,D$87,D$89,D$91,D$93,D$95,D$97,D$99,D$101,D$103,D$105,D$107,D$109,D$111,D$113,D$115,D$117,D$119,D$121,D$123,D$125)) -> 8 | E424: =RANK(E423,(E$6,E$8,E$10,E$12,E$14,E$16,E$18,E$20,E$22,E$25,E$27,E$29,E$31,E$33,E$35,E$37,E$39,E$41,E$43,E$45,E$47,E$49,E$51,E$53,E$55,E$57,E$59,E$61,E$63,E$65,E$67,E$69,E$71,E$73,E$75,E$77,E$79,E$81,E$83,E$85,E$87,E$89,E$91,E$93,E$95,E$97,E$99,E$101,E$103,E$105,E$107,E$109,E$111,E$113,E$115,E$117,E$119,E$121,E$123,E$125)) -> 8 | F424: =RANK(F423,(F$6,F$8,F$10,F$12,F$14,F$16,F$18,F$20,F$22,F$25,F$27,F$29,F$31,F$33,F$35,F$37,F$39,F$41,F$43,F$45,F$47,F$49,F$51,F$53,F$55,F$57,F$59,F$61,F$63,F$65,F$67,F$69,F$71,F$73,F$75,F$77,F$79,F$81,F$83,F$85,F$87,F$89,F$91,F$93,F$95,F$97,F$99,F$101,F$103,F$105,F$107,F$109,F$111,F$113,F$115,F$117,F$119,F$121,F$123,F$125)) -> 8 | G424: =RANK(G423,(G$6,G$8,G$10,G$12,G$14,G$16,G$18,G$20,G$22,G$25,G$27,G$29,G$31,G$33,G$35,G$37,G$39,G$41,G$43,G$45,G$47,G$49,G$51,G$53,G$55,G$57,G$59,G$61,G$63,G$65,G$67,G$69,G$71,G$73,G$75,G$77,G$79,G$81,G$83,G$85,G$87,G$89,G$91,G$93,G$95,G$97,G$99,G$101,G$103,G$105,G$107,G$109,G$111,G$113,G$115,G$117,G$119,G$121,G$123,G$125)) -> 7 | H424: =RANK(H423,(H$6,H$8,H$10,H$12,H$14,H$16,H$18,H$20,H$22,H$25,H$27,H$29,H$31,H$33,H$35,H$37,H$39,H$41,H$43,H$45,H$47,H$49,H$51,H$53,H$55,H$57,H$59,H$61,H$63,H$65,H$67,H$69,H$71,H$73,H$75,H$77,H$79,H$81,H$83,H$85,H$87,H$89,H$91,H$93,H$95,H$97,H$99,H$101,H$103,H$105,H$107,H$109,H$111,H$113,H$115,H$117,H$119,H$121,H$123,H$125)) -> 8 | I424: =RANK(I423,(I$6,I$8,I$10,I$12,I$14,I$16,I$18,I$20,I$22,I$25,I$27,I$29,I$31,I$33,I$35,I$37,I$39,I$41,I$43,I$45,I$47,I$49,I$51,I$53,I$55,I$57,I$59,I$61,I$63,I$65,I$67,I$69,I$71,I$73,I$75,I$77,I$79,I$81,I$83,I$85,I$87,I$89,I$91,I$93,I$95,I$97,I$99,I$101,I$103,I$105,I$107,I$109,I$111,I$113,I$115,I$117,I$119,I$121,I$123,I$125)) -> 8 | J424: 9 | K424: =RANK(K423,(K$6,K$8,K$10,K$12,K$14,K$16,K$18,K$20,K$22,K$25,K$27,K$29,K$31,K$33,K$35,K$37,K$39,K$41,K$43,K$45,K$47,K$49,K$51,K$53,K$55,K$57,K$59,K$61,K$63,K$65,K$67,K$69,K$71,K$73,K$75,K$77,K$79,K$81,K$83,K$85,K$87,K$89,K$91,K$93,K$95,K$97,K$99,K$101,K$103,K$105,K$107,K$109,K$111,K$113,K$115,K$117,K$119,K$121,K$123,K$125)) -> 8 | L424: =RANK(L423,(L$6,L$8,L$10,L$12,L$14,L$16,L$18,L$20,L$22,L$25,L$27,L$29,L$31,L$33,L$35,L$37,L$39,L$41,L$43,L$45,L$47,L$49,L$51,L$53,L$55,L$57,L$59,L$61,L$63,L$65,L$67,L$69,L$71,L$73,L$75,L$77,L$79,L$81,L$83,L$85,L$87,L$89,L$91,L$93,L$95,L$97,L$99,L$101,L$103,L$105,L$107,L$109,L$111,L$113,L$115,L$117,L$119,L$121,L$123,L$125)) -> 8 | M424: =RANK(M423,(M$6,M$8,M$10,M$12,M$14,M$16,M$18,M$20,M$22,M$25,M$27,M$29,M$31,M$33,M$35,M$37,M$39,M$41,M$43,M$45,M$47,M$49,M$51,M$53,M$55,M$57,M$59,M$61,M$63,M$65,M$67,M$69,M$71,M$73,M$75,M$77,M$79,M$81,M$83,M$85,M$87,M$89,M$91,M$93,M$95,M$97,M$99,M$101,M$103,M$105,M$107,M$109,M$111,M$113,M$115,M$117,M$119,M$121,M$123,M$125)) -> 8 | N424: =RANK(N423,(N$6,N$8,N$10,N$12,N$14,N$16,N$18,N$20,N$22,N$25,N$27,N$29,N$31,N$33,N$35,N$37,N$39,N$41,N$43,N$45,N$47,N$49,N$51,N$53,N$55,N$57,N$59,N$61,N$63,N$65,N$67,N$69,N$71,N$73,N$75,N$77,N$79,N$81,N$83,N$85,N$87,N$89,N$91,N$93,N$95,N$97,N$99,N$101,N$103,N$105,N$107,N$109,N$111,N$113,N$115,N$117,N$119,N$121,N$123,N$125)) -> 8 | P424: =RANK(P423,(P$6,P$8,P$10,P$12,P$14,P$16,P$18,P$20,P$22,P$25,P$27,P$29,P$31,P$33,P$35,P$37,P$39,P$41,P$43,P$45,P$47,P$49,P$51,P$53,P$55,P$57,P$59,P$61,P$63,P$65,P$67,P$69,P$71,P$73,P$75,P$77,P$79,P$81,P$83,P$85,P$87,P$89,P$91,P$93,P$95,P$97,P$99,P$101,P$103,P$105,P$107,P$109,P$111,P$113,P$115,P$117,P$119,P$121,P$123,P$125)) -> 8
A425: Seattle | B425: 2 | C425: 12.70 | D425: 12.90 | E425: 25.60 | F425: 12.90 | G425: 12.60 | H425: 12.80 | I425: 19.15 | J425: 12.70 | K425: 13.80 | L425: 13.00 | M425: 19.75 | N425: 64.50 | O425: 0.0 | P425: 64.50
A426: Cascades | C426: =RANK(C425,(C$6,C$8,C$10,C$12,C$14,C$16,C$18,C$20,C$22,C$25,C$27,C$29,C$31,C$33,C$35,C$37,C$39,C$41,C$43,C$45,C$47,C$49,C$51,C$53,C$55,C$57,C$59,C$61,C$63,C$65,C$67,C$69,C$71,C$73,C$75,C$77,C$79,C$81,C$83,C$85,C$87,C$89,C$91,C$93,C$95,C$97,C$99,C$101,C$103,C$105,C$107,C$109,C$111,C$113,C$115,C$117,C$119,C$121,C$123,C$125)) -> 9 | D426: =RANK(D425,(D$6,D$8,D$10,D$12,D$14,D$16,D$18,D$20,D$22,D$25,D$27,D$29,D$31,D$33,D$35,D$37,D$39,D$41,D$43,D$45,D$47,D$49,D$51,D$53,D$55,D$57,D$59,D$61,D$63,D$65,D$67,D$69,D$71,D$73,D$75,D$77,D$79,D$81,D$83,D$85,D$87,D$89,D$91,D$93,D$95,D$97,D$99,D$101,D$103,D$105,D$107,D$109,D$111,D$113,D$115,D$117,D$119,D$121,D$123,D$125)) -> 9 | E426: =RANK(E425,(E$6,E$8,E$10,E$12,E$14,E$16,E$18,E$20,E$22,E$25,E$27,E$29,E$31,E$33,E$35,E$37,E$39,E$41,E$43,E$45,E$47,E$49,E$51,E$53,E$55,E$57,E$59,E$61,E$63,E$65,E$67,E$69,E$71,E$73,E$75,E$77,E$79,E$81,E$83,E$85,E$87,E$89,E$91,E$93,E$95,E$97,E$99,E$101,E$103,E$105,E$107,E$109,E$111,E$113,E$115,E$117,E$119,E$121,E$123,E$125)) -> 9 | F426: =RANK(F425,(F$6,F$8,F$10,F$12,F$14,F$16,F$18,F$20,F$22,F$25,F$27,F$29,F$31,F$33,F$35,F$37,F$39,F$41,F$43,F$45,F$47,F$49,F$51,F$53,F$55,F$57,F$59,F$61,F$63,F$65,F$67,F$69,F$71,F$73,F$75,F$77,F$79,F$81,F$83,F$85,F$87,F$89,F$91,F$93,F$95,F$97,F$99,F$101,F$103,F$105,F$107,F$109,F$111,F$113,F$115,F$117,F$119,F$121,F$123,F$125)) -> 9 | G426: 9 | H426: =RANK(H425,(H$6,H$8,H$10,H$12,H$14,H$16,H$18,H$20,H$22,H$25,H$27,H$29,H$31,H$33,H$35,H$37,H$39,H$41,H$43,H$45,H$47,H$49,H$51,H$53,H$55,H$57,H$59,H$61,H$63,H$65,H$67,H$69,H$71,H$73,H$75,H$77,H$79,H$81,H$83,H$85,H$87,H$89,H$91,H$93,H$95,H$97,H$99,H$101,H$103,H$105,H$107,H$109,H$111,H$113,H$115,H$117,H$119,H$121,H$123,H$125)) -> 9 | I426: =RANK(I425,(I$6,I$8,I$10,I$12,I$14,I$16,I$18,I$20,I$22,I$25,I$27,I$29,I$31,I$33,I$35,I$37,I$39,I$41,I$43,I$45,I$47,I$49,I$51,I$53,I$55,I$57,I$59,I$61,I$63,I$65,I$67,I$69,I$71,I$73,I$75,I$77,I$79,I$81,I$83,I$85,I$87,I$89,I$91,I$93,I$95,I$97,I$99,I$101,I$103,I$105,I$107,I$109,I$111,I$113,I$115,I$117,I$119,I$121,I$123,I$125)) -> 9 | J426: 8 | K426: =RANK(K425,(K$6,K$8,K$10,K$12,K$14,K$16,K$18,K$20,K$22,K$25,K$27,K$29,K$31,K$33,K$35,K$37,K$39,K$41,K$43,K$45,K$47,K$49,K$51,K$53,K$55,K$57,K$59,K$61,K$63,K$65,K$67,K$69,K$71,K$73,K$75,K$77,K$79,K$81,K$83,K$85,K$87,K$89,K$91,K$93,K$95,K$97,K$99,K$101,K$103,K$105,K$107,K$109,K$111,K$113,K$115,K$117,K$119,K$121,K$123,K$125)) -> 9 | L426: =RANK(L425,(L$6,L$8,L$10,L$12,L$14,L$16,L$18,L$20,L$22,L$25,L$27,L$29,L$31,L$33,L$35,L$37,L$39,L$41,L$43,L$45,L$47,L$49,L$51,L$53,L$55,L$57,L$59,L$61,L$63,L$65,L$67,L$69,L$71,L$73,L$75,L$77,L$79,L$81,L$83,L$85,L$87,L$89,L$91,L$93,L$95,L$97,L$99,L$101,L$103,L$105,L$107,L$109,L$111,L$113,L$115,L$117,L$119,L$121,L$123,L$125)) -> 9 | M426: =RANK(M425,(M$6,M$8,M$10,M$12,M$14,M$16,M$18,M$20,M$22,M$25,M$27,M$29,M$31,M$33,M$35,M$37,M$39,M$41,M$43,M$45,M$47,M$49,M$51,M$53,M$55,M$57,M$59,M$61,M$63,M$65,M$67,M$69,M$71,M$73,M$75,M$77,M$79,M$81,M$83,M$85,M$87,M$89,M$91,M$93,M$95,M$97,M$99,M$101,M$103,M$105,M$107,M$109,M$111,M$113,M$115,M$117,M$119,M$121,M$123,M$125)) -> 9 | N426: =RANK(N425,(N$6,N$8,N$10,N$12,N$14,N$16,N$18,N$20,N$22,N$25,N$27,N$29,N$31,N$33,N$35,N$37,N$39,N$41,N$43,N$45,N$47,N$49,N$51,N$53,N$55,N$57,N$59,N$61,N$63,N$65,N$67,N$69,N$71,N$73,N$75,N$77,N$79,N$81,N$83,N$85,N$87,N$89,N$91,N$93,N$95,N$97,N$99,N$101,N$103,N$105,N$107,N$109,N$111,N$113,N$115,N$117,N$119,N$121,N$123,N$125)) -> 9 | P426: =RANK(P425,(P$6,P$8,P$10,P$12,P$14,P$16,P$18,P$20,P$22,P$25,P$27,P$29,P$31,P$33,P$35,P$37,P$39,P$41,P$43,P$45,P$47,P$49,P$51,P$53,P$55,P$57,P$59,P$61,P$63,P$65,P$67,P$69,P$71,P$73,P$75,P$77,P$79,P$81,P$83,P$85,P$87,P$89,P$91,P$93,P$95,P$97,P$99,P$101,P$103,P$105,P$107,P$109,P$111,P$113,P$115,P$117,P$119,P$121,P$123,P$125)) -> 9
A427: DCI Open Class
A428: Battalion | B428: 1 | C428: 12.60 | D428: 12.30 | E428: 24.90 | F428: 12.20 | G428: 12.80 | H428: 12.50 | I428: 18.75 | J428: 13.20 | K428: 12.20 | L428: 11.40 | M428: 18.40 | N428: 62.05 | O428: 0.0 | P428: 62.05
C429: 1 | D429: 1 | E429: 1 | F429: 1 | G429: 1 | H429: 1 | I429: 1 | J429: 1 | K429: 1 | L429: 1 | M429: 1 | N429: 1 | P429: 1
A432: 7/13/2024 Vista, California
C433: General Effect | F433: Visual | J433: Music
C434: 1 | D434: 2 | F434: Proficiency | G434: Analysis | H434: Color Guard | J434: Brass | K434: Analysis | L434: Percussion | N434: Sub | P434: Total
C435: C. Nelson | D435: J. Davila | E435: Total | F435: E. Martinez | G435: D. Torchia | H435: B. Spidel | I435: Total ÷2 | J435: P. Haines | K435: K. Shuttleworth | L435: T. Fox | M435: Total ÷2 | N435: Total | O435: Pen | P435: Score
A436: DCI Open Class | C436: 20 | D436: 20 | E436: 40 | F436: 20 | G436: 20 | H436: 20 | I436: 30 | J436: 20 | K436: 20 | L436: 20 | M436: 30 | N436: 100 | P436: 100
A437: Blue | B437: 5 | C437: 14.80 | D437: 14.60 | E437: 29.40 | F437: 14.90 | G437: 14.50 | H437: 14.10 | I437: 21.75 | J437: 14.20 | K437: 14.40 | L437: 15.00 | M437: 21.80 | N437: 72.95 | O437: 0.0 | P437: 72.95
A438: Devils B | C438: 1 | D438: 1 | E438: 1 | F438: 1 | G438: 1 | H438: 1 | I438: 1 | J438: 1 | K438: 1 | L438: 1 | M438: 1 | N438: 1 | P438: 1
A439: Gold | B439: 4 | C439: 14.30 | D439: 13.90 | E439: 28.20 | F439: 14.80 | G439: 14.00 | H439: 13.80 | I439: 21.30 | J439: 13.60 | K439: 14.00 | L439: 14.20 | M439: 20.90 | N439: 70.40 | O439: 0.0 | P439: 70.40
C440: 2 | D440: 2 | E440: 2 | F440: 2 | G440: 2 | H440: 2 | I440: 2 | J440: 2 | K440: 2 | L440: 2 | M440: 2 | N440: 2 | P440: 2
A441: Impulse | B441: 3 | C441: 13.60 | D441: 13.30 | E441: 26.90 | F441: 12.80 | G441: 13.00 | H441: 13.60 | I441: 19.70 | J441: 12.60 | K441: 12.00 | L441: 12.50 | M441: 18.55 | N441: 65.15 | O441: 0.0 | P441: 65.15
C442: 3 | D442: 3 | E442: 3 | F442: 3 | G442: 3 | H442: 3 | I442: 3 | J442: 3 | K442: 5 | L442: 4 | M442: 4 | N442: 3 | P442: 3
A443: Golden | B443: 2 | C443: 12.70 | D443: 12.50 | E443: 25.20 | F443: 12.60 | G443: 12.40 | H443: 12.10 | I443: 18.55 | J443: 12.00 | K443: 12.60 | L443: 12.80 | M443: 18.70 | N443: 62.45 | O443: 0.0 | P443: 62.45
A444: Empire | C444: 4 | D444: 4 | E444: 4 | F444: 4 | G444: 4 | H444: 4 | I444: 4 | J444: 5 | K444: 3 | L444: 3 | M444: 3 | N444: 4 | P444: 4
A445: Vessel | B445: 1 | C445: 12.10 | D445: 12.00 | E445: 24.10 | F445: 12.00 | G445: 11.90 | H445: 11.90 | I445: 17.90 | J445: 12.10 | K445: 12.20 | L445: 12.10 | M445: 18.20 | N445: 60.20 | O445: 0.0 | P445: 60.20
C446: 5 | D446: 5 | E446: 5 | F446: 5 | G446: 5 | H446: 5 | I446: 5 | J446: 4 | K446: 4 | L446: 5 | M446: 5 | N446: 5 | P446: 5
A449: 7/14/2024 Ankeny, Iowa
C450: General Effect | F450: Visual | J450: Music
C451: 1 | D451: 2 | F451: Proficiency | G451: Analysis | H451: Color Guard | J451: Brass | K451: Analysis | L451: Percussion | N451: Sub | P451: Total
C452: C. Fisher | D452: J. Rhodes | E452: Total | F452: C. Church | G452: J. Pursifull | H452: T. Landess | I452: Total ÷2 | J452: P. McGarr | K452: D. Argul | L452: K. Burja | M452: Total ÷2 | N452: Total | O452: Pen | P452: Score
A453: DCI World Class | C453: 20 | D453: 20 | E453: 40 | F453: 20 | G453: 20 | H453: 20 | I453: 30 | J453: 20 | K453: 20 | L453: 20 | M453: 30 | N453: 100 | P453: 100
A454: Bluecoats | B454: 2 | C454: 17.70 | D454: 17.60 | E454: 35.30 | F454: 17.60 | G454: 17.70 | H454: 17.80 | I454: 26.55 | J454: 17.10 | K454: 18.00 | L454: 17.90 | M454: 26.50 | N454: 88.35 | O454: 0.0 | P454: 88.35
C455: 1 | D455: 1 | E455: 1 | F455: 1 | G455: 1 | H455: 1 | I455: 1 | J455: 1 | K455: 1 | L455: 1 | M455: 1 | N455: 1 | P455: 1
A456: Blue | B456: 1 | C456: 16.00 | D456: 15.90 | E456: 31.90 | F456: 16.20 | G456: 16.20 | H456: 16.50 | I456: 24.45 | J456: 16.10 | K456: 16.20 | L456: 17.30 | M456: 24.80 | N456: 81.15 | O456: 0.0 | P456: 81.15
A457: Stars | C457: 2 | D457: 2 | E457: 2 | F457: 2 | G457: 2 | H457: 2 | I457: 2 | J457: 2 | K457: 3 | L457: 2 | M457: 2 | N457: 2 | P457: 2
A458: Colts | B458: 3 | C458: 15.70 | D458: 15.60 | E458: 31.30 | F458: 15.70 | G458: 15.90 | H458: 16.20 | I458: 23.90 | J458: 15.80 | K458: 16.50 | L458: 16.90 | M458: 24.60 | N458: 79.80 | O458: 0.0 | P458: 79.80
C459: 3 | D459: 3 | E459: 3 | F459: 3 | G459: 3 | H459: 3 | I459: 3 | J459: 3 | K459: 2 | L459: 3 | M459: 3 | N459: 3 | P459: 3
A460: DCI Open Class
A461: River City | B461: 1 | C461: 13.00 | D461: 13.20 | E461: 26.20 | F461: 14.90 | G461: 13.30 | H461: 13.30 | I461: 20.75 | J461: 12.20 | K461: 13.40 | L461: 14.60 | M461: 20.10 | N461: 67.05 | O461: 0.0 | P461: 67.05
A462: Rhytm | C462: 1 | D462: 1 | E462: 1 | F462: 1 | G462: 1 | H462: 1 | I462: 1 | J462: 1 | K462: 1 | L462: 1 | M462: 1 | N462: 1 | P462: 1
A463: Colt | B463: 2 | C463: 12.40 | D463: 12.70 | E463: 25.10 | F463: 14.50 | G463: 12.80 | H463: 12.70 | I463: 20.00 | J463: 11.70 | K463: 13.00 | L463: 14.10 | M463: 19.40 | N463: 64.50 | O463: 0.0 | P463: 64.50
A464: Cadets | C464: 2 | D464: 2 | E464: 2 | F464: 2 | G464: 2 | H464: 2 | I464: 2 | J464: 2 | K464: 2 | L464: 2 | M464: 2 | N464: 2 | P464: 2
A465: DCI All Age Class A
A466: Govenaires | B466: 1 | C466: 14.10 | D466: 14.80 | E466: 28.90 | F466: 14.40 | G466: 14.20 | H466: 14.10 | I466: 21.35 | J466: 13.30 | K466: 14.20 | L466: 13.60 | M466: 20.55 | N466: 70.80 | O466: 0.0 | P466: 70.80
C467: 1 | D467: 1 | E467: 1 | F467: 1 | G467: 1 | H467: 1 | I467: 1 | J467: 1 | K467: 1 | L467: 1 | M467: 1 | N467: 1 | P467: 1
A470: 7/14/2024 Cerritos, California
C471: General Effect | F471: Visual | J471: Music
C472: 1 | D472: 2 | F472: Proficiency | G472: Analysis | H472: Color Guard | J472: Brass | K472: Analysis | L472: Percussion | N472: Sub | P472: Total
C473: B. Spidel | D473: P. Haines | E473: Total | F473: C. Nelson | G473: D. Torchia | H473: E. Martinez | I473: Total ÷2 | J473: K. Shuttleworth | K473: T. Fox | L473: J. Davila | M473: Total ÷2 | N473: Total | O473: Pen | P473: Score
A474: DCI Open Class | C474: 20 | D474: 20 | E474: 40 | F474: 20 | G474: 20 | H474: 20 | I474: 30 | J474: 20 | K474: 20 | L474: 20 | M474: 30 | N474: 100 | P474: 100
A475: Blue | B475: 5 | C475: 14.90 | D475: 14.70 | E475: 29.60 | F475: 15.50 | G475: 14.70 | H475: 14.40 | I475: 22.30 | J475: 14.50 | K475: 14.70 | L475: 14.40 | M475: 21.80 | N475: 73.70 | O475: 0.0 | P475: 73.70
A476: Devils B | C476: 1 | D476: 1 | E476: 1 | F476: 1 | G476: 1 | H476: 1 | I476: 1 | J476: 1 | K476: 1 | L476: 1 | M476: 1 | N476: 1 | P476: 1
A477: Gold | B477: 4 | C477: 14.50 | D477: 14.10 | E477: 28.60 | F477: 15.00 | G477: 14.10 | H477: 14.20 | I477: 21.65 | J477: 14.10 | K477: 14.20 | L477: 13.70 | M477: 21.00 | N477: 71.25 | O477: 0.0 | P477: 71.25
C478: 2 | D478: 2 | E478: 2 | F478: 2 | G478: 2 | H478: 2 | I478: 2 | J478: 2 | K478: 2 | L478: 2 | M478: 2 | N478: 2 | P478: 2
A479: Impulse | B479: 3 | C479: 13.40 | D479: 13.10 | E479: 26.50 | F479: 12.90 | G479: 13.10 | H479: 14.10 | I479: 20.05 | J479: 12.80 | K479: 12.90 | L479: 12.70 | M479: 19.20 | N479: 65.75 | O479: 0.0 | P479: 65.75
C480: 3 | D480: 3 | E480: 3 | F480: 3 | G480: 3 | H480: 3 | I480: 3 | J480: 3 | K480: 3 | L480: 4 | M480: 3 | N480: 3 | P480: 3
A481: Golden | B481: 2 | C481: 12.80 | D481: 12.70 | E481: 25.50 | F481: 12.80 | G481: 12.60 | H481: 12.10 | I481: 18.75 | J481: 12.20 | K481: 12.80 | L481: 13.20 | M481: 19.10 | N481: 63.35 | O481: 0.0 | P481: 63.35
A482: Empire | C482: 4 | D482: 4 | E482: 4 | F482: 4 | G482: 4 | H482: 4 | I482: 4 | J482: 5 | K482: 4 | L482: 3 | M482: 4 | N482: 4 | P482: 4
A483: Vessel | B483: 1 | C483: 12.20 | D483: 12.20 | E483: 24.40 | F483: 12.30 | G483: 12.10 | H483: 11.60 | I483: 18.00 | J483: 12.40 | K483: 12.20 | L483: 12.20 | M483: 18.40 | N483: 60.80 | O483: 0.0 | P483: 60.80
C484: 5 | D484: 5 | E484: 5 | F484: 5 | G484: 5 | H484: 5 | I484: 5 | J484: 4 | K484: 5 | L484: 5 | M484: 5 | N484: 5 | P484: 5
A487: 7/15/2024 Canyon, Texas
C488: General Effect | F488: Visual | J488: Music
C489: 1 | D489: 2 | F489: Proficiency | G489: Analysis | H489: Color Guard | J489: Brass | K489: Analysis | L489: Percussion | N489: Sub | P489: Total
C490: S. Adamo | D490: J. Rhodes | E490: Total | F490: J. Gilley | G490: D. Solomonson | H490: A. Dalton | I490: Total ÷2 | J490: B. Dacy | K490: J. Harper | L490: M. Teal | M490: Total ÷2 | N490: Total | O490: Pen | P490: Score
A491: DCI World Class | C491: 20 | D491: 20 | E491: 40 | F491: 20 | G491: 20 | H491: 20 | I491: 30 | J491: 20 | K491: 20 | L491: 20 | M491: 30 | N491: 100 | P491: 100
A492: Vanguard | B492: 1 | C492: 16.80 | D492: 16.60 | E492: 33.40 | F492: 16.30 | G492: 16.60 | H492: 16.50 | I492: 24.70 | J492: 16.60 | K492: 16.40 | L492: 17.30 | M492: 25.15 | N492: 83.25 | O492: 0.0 | P492: 83.25
C493: 1 | D493: 1 | E493: 1 | F493: 1 | G493: 1 | H493: 1 | I493: 1 | J493: 1 | K493: 1 | L493: 1 | M493: 1 | N493: 1 | P493: 1
A494: Pacific | B494: 5 | C494: 15.30 | D494: 15.20 | E494: 30.50 | F494: 14.80 | G494: 15.00 | H494: 15.10 | I494: 22.45 | J494: 14.80 | K494: 15.00 | L494: 15.50 | M494: 22.65 | N494: 75.60 | O494: 0.0 | P494: 75.60
A495: Crest | C495: 2 | D495: 3 | E495: 2 | F495: 3 | G495: 3 | H495: 2 | I495: 3 | J495: 2 | K495: 3 | L495: 2 | M495: 2 | N495: 2 | P495: 2
A496: Blue | B496: 6 | C496: 14.90 | D496: 15.40 | E496: 30.30 | F496: 15.20 | G496: 15.30 | H496: 14.80 | I496: 22.65 | J496: 14.60 | K496: 15.30 | L496: 14.60 | M496: 22.25 | N496: 75.20 | O496: 0.0 | P496: 75.20
A497: Knights | C497: 3 | D497: 2 | E497: 3 | F497: 2 | G497: 2 | H497: 3 | I497: 2 | J497: 3 | K497: 2 | L497: 4 | M497: 3 | N497: 3 | P497: 3
A498: Academy | B498: 4 | C498: 14.60 | D498: 14.50 | E498: 29.10 | F498: 14.50 | G498: 14.70 | H498: 14.70 | I498: 21.95 | J498: 13.80 | K498: 14.80 | L498: 15.00 | M498: 21.80 | N498: 72.85 | O498: 0.0 | P498: 72.85
C499: 4 | D499: 4 | E499: 4 | F499: 4 | G499: 4 | H499: 4 | I499: 4 | J499: 4 | K499: 4 | L499: 3 | M499: 4 | N499: 4 | P499: 4
A500: Genesis | B500: 2 | C500: 13.30 | D500: 13.70 | E500: 27.00 | F500: 12.90 | G500: 14.30 | H500: 14.40 | I500: 20.80 | J500: 12.70 | K500: 14.30 | L500: 13.80 | M500: 20.40 | N500: 68.20 | O500: 0.0 | P500: 68.20
C501: 5 | D501: 5 | E501: 5 | F501: 5 | G501: 5 | H501: 5 | I501: 5 | J501: 6 | K501: 5 | L501: 5 | M501: 5 | N501: 5 | P501: 5
A502: Seattle | B502: 3 | C502: 12.50 | D502: 13.10 | E502: 25.60 | F502: 12.60 | G502: 12.80 | H502: 12.90 | I502: 19.15 | J502: 13.00 | K502: 13.70 | L502: 13.00 | M502: 19.85 | N502: 64.60 | O502: 0.0 | P502: 64.60
A503: Cascades | C503: 6 | D503: 6 | E503: 6 | F503: 6 | G503: 6 | H503: 6 | I503: 6 | J503: 5 | K503: 6 | L503: 6 | M503: 6 | N503: 6 | P503: 6
A506: 7/15/2024 Olathe, Kansas
C507: General Effect | F507: Visual | J507: Music
C508: 1 | D508: 2 | F508: Proficiency | G508: Analysis | H508: Color Guard | J508: Brass | K508: Analysis | L508: Percussion | N508: Sub | P508: Total
C509: M. Gray | D509: C. Rothe | E509: Total | F509: J. Pursifull | G509: C. Fisher | H509: T. Landess | I509: Total ÷2 | J509: M. Hoskins | K509: P. McGarr | L509: M. Davis | M509: Total ÷2 | N509: Total | O509: Pen | P509: Score
A510: DCI World Class | C510: 20 | D510: 20 | E510: 40 | F510: 20 | G510: 20 | H510: 20 | I510: 30 | J510: 20 | K510: 20 | L510: 20 | M510: 30 | N510: 100 | P510: 100
A511: Phantom | B511: 3 | C511: 17.20 | D511: 17.10 | E511: 34.30 | F511: 17.20 | G511: 17.10 | H511: 17.00 | I511: 25.65 | J511: 17.00 | K511: 16.90 | L511: 16.90 | M511: 25.40 | N511: 85.35 | O511: 0.0 | P511: 85.35
A512: Regiment | C512: 1 | D512: 1 | E512: 1 | F512: 1 | G512: 1 | H512: 1 | I512: 1 | J512: 1 | K512: 1 | L512: 1 | M512: 1 | N512: 1 | P512: 1
A513: Colts | B513: 4 | C513: 15.90 | D513: 16.10 | E513: 32.00 | F513: 15.80 | G513: 16.00 | H513: 16.20 | I513: 24.00 | J513: 16.10 | K513: 15.60 | L513: 16.50 | M513: 24.10 | N513: 80.10 | O513: 0.0 | P513: 80.10
C514: 2 | D514: 2 | E514: 2 | F514: 3 | G514: 2 | H514: 2 | I514: 2 | J514: 3 | K514: 3 | L514: 2 | M514: 3 | N514: 2 | P514: 2
A515: Troopers | B515: 2 | C515: 15.60 | D515: 15.70 | E515: 31.30 | F515: 16.30 | G515: 15.50 | H515: 15.30 | I515: 23.55 | J515: 16.40 | K515: 15.90 | L515: 16.20 | M515: 24.25 | N515: 79.10 | O515: 0.0 | P515: 79.10
C516: 3 | D516: 3 | E516: 3 | F516: 2 | G516: 3 | H516: 4 | I516: 3 | J516: 2 | K516: 2 | L516: 3 | M516: 2 | N516: 3 | P516: 3
A517: Madison | B517: 1 | C517: 15.10 | D517: 14.00 | E517: 30.00 | F517: 15.50 | G517: 15.30 | H517: 15.60 | I517: 23.20 | J517: 15.60 | K517: 15.10 | L517: 15.60 | M517: 23.15 | N517: 76.35 | O517: 0.0 | P517: 76.35
A518: Scouts | C518: 4 | D518: 4 | E518: 4 | F518: 4 | G518: 4 | H518: 3 | I518: 4 | J518: 4 | K518: 4 | L518: 4 | M518: 4 | N518: 4 | P518: 4
A519: DCI Open Class
A520: Colt | B520: 1 | C520: 12.70 | D520: 13.00 | E520: 25.70 | F520: 12.90 | G520: 12.80 | H520: 12.80 | I520: 19.25 | J520: 12.40 | K520: 12.60 | L520: 12.60 | M520: 18.80 | N520: 63.75 | O520: 0.0 | P520: 63.75
A521: Cadets | C521: 1 | D521: 1 | E521: 1 | F521: 1 | G521: 1 | H521: 1 | I521: 1 | J521: 1 | K521: 1 | L521: 1 | M521: 1 | N521: 1 | P521: 1
A524: 7/16/2024 Broken Arrow, Oklahoma
C525: General Effect | F525: Visual | J525: Music
C526: 1 | D526: 2 | F526: Proficiency | G526: Analysis | H526: Color Guard | J526: Brass | K526: Analysis | L526: Percussion | N526: Sub | P526: Total
C527: T. Wemhoff | D527: G. Miller | E527: Total | F527: J. Orefice | G527: S. Adamo | H527: J. Campbell | I527: Total ÷2 | J527: M. Hoskins | K527: J. Harper | L527: M. Teal | M527: Total ÷2 | N527: Total | O527: Pen | P527: Score
A528: DCI World Class | C528: 20 | D528: 20 | E528: 40 | F528: 20 | G528: 20 | H528: 20 | I528: 30 | J528: 20 | K528: 20 | L528: 20 | M528: 30 | N528: 100 | P528: 100
A529: Bluecoats | B529: 6 | C529: 18.00 | D529: 17.90 | E529: 35.90 | F529: 17.90 | G529: 18.30 | H529: 17.10 | I529: 26.65 | J529: 18.10 | K529: 17.80 | L529: 17.30 | M529: 26.60 | N529: 89.15 | O529: 0.0 | P529: 89.15
C530: 1 | D530: 1 | E530: 1 | F530: 1 | G530: 1 | H530: 4 | I530: 2 | J530: 1 | K530: 1 | L530: 3 | M530: 1 | N530: 1 | P530: 1
A531: Blue | B531: 5 | C531: 17.80 | D531: 17.50 | E531: 35.30 | F531: 17.80 | G531: 18.10 | H531: 17.50 | I531: 26.70 | J531: 17.70 | K531: 17.40 | L531: 17.40 | M531: 26.25 | N531: 88.25 | O531: 0.0 | P531: 88.25
A532: Devils | C532: 2 | D532: 3 | E532: 3 | F532: 2 | G532: 2 | H532: 2 | I532: 1 | J532: 3 | K532: 3 | L532: 2 | M532: 3 | N532: 2 | P532: 2
A533: Boston | B533: 3 | C533: 17.70 | D533: 17.70 | E533: 35.40 | F533: 17.70 | G533: 17.70 | H533: 17.60 | I533: 26.50 | J533: 17.90 | K533: 17.10 | L533: 17.70 | M533: 26.35 | N533: 88.25 | O533: 0.0 | P533: 88.25
A534: Crusaders | C534: 3 | D534: 2 | E534: 2 | F534: 3 | G534: 3 | H534: 1 | I534: 3 | J534: 2 | K534: 4 | L534: 1 | M534: 2 | N534: 2 | P534: 2
A535: Carolina | B535: 7 | C535: 17.30 | D535: 17.20 | E535: 34.50 | F535: 17.40 | G535: 17.60 | H535: 17.40 | I535: 26.20 | J535: 17.40 | K535: 17.50 | L535: 17.20 | M535: 26.05 | N535: 86.75 | O535: 0.0 | P535: 86.75
A536: Crown | C536: 4 | D536: 4 | E536: 4 | F536: 4 | G536: 4 | H536: 3 | I536: 4 | J536: 4 | K536: 2 | L536: 4 | M536: 4 | N536: 4 | P536: 4
A537: Phantom | B537: 2 | C537: 17.10 | D537: 16.80 | E537: 33.90 | F537: 16.80 | G537: 17.30 | H537: 16.60 | I537: 25.35 | J537: 16.80 | K537: 16.90 | L537: 16.90 | M537: 25.30 | N537: 84.55 | O537: 0.0 | P537: 84.55
A538: Regiment | C538: 5 | D538: 5 | E538: 5 | F538: 5 | G538: 5 | H538: 5 | I538: 5 | J538: 5 | K538: 5 | L538: 5 | M538: 5 | N538: 5 | P538: 5
A539: Mandarins | B539: 4 | C539: 16.70 | D539: 16.50 | E539: 33.20 | F539: 16.50 | G539: 16.30 | H539: 16.50 | I539: 24.65 | J539: 16.60 | K539: 16.40 | L539: 16.30 | M539: 24.65 | N539: 82.50 | O539: 0.0 | P539: 82.50
C540: 6 | D540: 6 | E540: 6 | F540: 6 | G540: 7 | H540: 6 | I540: 6 | J540: 6 | K540: 6 | L540: 7 | M540: 6 | N540: 6 | P540: 6
A541: Cavaliers | B541: 1 | C541: 16.10 | D541: 16.20 | E541: 32.30 | F541: 16.10 | G541: 16.40 | H541: 16.00 | I541: 24.25 | J541: 16.20 | K541: 16.10 | L541: 16.50 | M541: 24.40 | N541: 80.95 | O541: 0.0 | P541: 80.95
C542: 7 | D542: 7 | E542: 7 | F542: 7 | G542: 6 | H542: 7 | I542: 7 | J542: 7 | K542: 7 | L542: 6 | M542: 7 | N542: 7 | P542: 7
A545: 7/16/2024 Abilene, Texas
C546: General Effect | F546: Visual | J546: Music
C547: 1 | D547: 2 | F547: Proficiency | G547: Analysis | H547: Color Guard | J547: Brass | K547: Analysis | L547: Percussion | N547: Sub | P547: Total
C548: A. Dalton | D548: K. Lejune | E548: Total | F548: D. Solomonson | G548: M. Gray | H548: J. Gilley | I548: Total ÷2 | J548: C. Rios | K548: C. Rothe | L548: M. Davis | M548: Total ÷2 | N548: Total | O548: Pen | P548: Score
A549: DCI World Class | C549: 20 | D549: 20 | E549: 40 | F549: 20 | G549: 20 | H549: 20 | I549: 30 | J549: 20 | K549: 20 | L549: 20 | M549: 30 | N549: 100 | P549: 100
A550: Blue | B550: 6 | C550: 16.10 | D550: 15.60 | E550: 31.70 | F550: 15.50 | G550: 15.80 | H550: 15.10 | I550: 23.20 | J550: 15.00 | K550: 15.10 | L550: 15.50 | M550: 22.80 | N550: 77.70 | O550: 0.0 | P550: 77.70
A551: Knights | C551: 1 | D551: 1 | E551: 1 | F551: 2 | G551: 1 | H551: 3 | I551: 2 | J551: 3 | K551: 3 | L551: 3 | M551: 3 | N551: 1 | P551: 1
A552: Crossmen | B552: 4 | C552: 15.80 | D552: 15.00 | E552: 30.80 | F552: 15.70 | G552: 15.50 | H552: 15.40 | I552: 23.30 | J552: 15.80 | K552: 15.40 | L552: 15.80 | M552: 23.50 | N552: 77.60 | O552: 0.0 | P552: 77.60
C553: 2 | D553: 3 | E553: 3 | F553: 1 | G553: 2 | H553: 2 | I553: 1 | J553: 1 | K553: 1 | L553: 2 | M553: 1 | N553: 2 | P553: 2
A554: Pacific | B554: 5 | C554: 15.70 | D554: 15.40 | E554: 31.10 | F554: 15.20 | G554: 15.20 | H554: 15.60 | I554: 23.00 | J554: 15.20 | K554: 15.30 | L554: 16.20 | M554: 23.35 | N554: 77.45 | O554: 0.0 | P554: 77.45
A555: Crest | C555: 3 | D555: 2 | E555: 2 | F555: 3 | G555: 3 | H555: 1 | I555: 3 | J555: 2 | K555: 2 | L555: 1 | M555: 2 | N555: 3 | P555: 3
A556: Music | B556: 3 | C556: 15.00 | D556: 14.40 | E556: 29.40 | F556: 14.80 | G556: 14.60 | H556: 14.60 | I556: 22.00 | J556: 14.60 | K556: 14.70 | L556: 14.90 | M556: 22.10 | N556: 73.50 | O556: 0.0 | P556: 73.50
A557: City | C557: 4 | D557: 4 | E557: 4 | F557: 4 | G557: 4 | H557: 4 | I557: 4 | J557: 4 | K557: 4 | L557: 4 | M557: 4 | N557: 4 | P557: 4
A558: Genesis | B558: 2 | C558: 14.00 | D558: 13.80 | E558: 27.80 | F558: 13.40 | G558: 13.80 | H558: 13.90 | I558: 20.55 | J558: 14.10 | K558: 13.60 | L558: 14.30 | M558: 21.00 | N558: 69.35 | O558: 0.0 | P558: 69.35
C559: 5 | D559: 5 | E559: 5 | F559: 5 | G559: 5 | H559: 5 | I559: 5 | J559: 5 | K559: 5 | L559: 5 | M559: 5 | N559: 5 | P559: 5
A560: Seattle | B560: 1 | C560: 13.20 | D560: 13.40 | E560: 26.60 | F560: 13.00 | G560: 12.90 | H560: 12.90 | I560: 19.40 | J560: 12.90 | K560: 13.10 | L560: 13.70 | M560: 19.85 | N560: 65.85 | O560: 0.0 | P560: 65.85
A561: Cascades | C561: 6 | D561: 6 | E561: 6 | F561: 6 | G561: 6 | H561: 6 | I561: 6 | J561: 6 | K561: 6 | L561: 6 | M561: 6 | N561: 6 | P561: 6
A562: DCI Open Class
A563: Guardians | B563: 1 | C563: 11.70 | D563: 12.30 | E563: 24.00 | F563: 12.70 | G563: 11.80 | H563: 11.60 | I563: 18.05 | J563: 12.10 | K563: 12.20 | L563: 13.10 | M563: 18.70 | N563: 60.75 | O563: 0.0 | P563: 60.75
C564: 1 | D564: 1 | E564: 1 | F564: 1 | G564: 1 | H564: 1 | I564: 1 | J564: 1 | K564: 1 | L564: 1 | M564: 1 | N564: 1 | P564: 1
A567: 7/18/2024 Denton, Texas
C568: General Effect | F568: Visual | J568: Music
C569: 1 | D569: 2 | F569: Proficiency | G569: Analysis | H569: Color Guard | J569: Brass | K569: Analysis | L569: Percussion | N569: Sub | P569: Total
C570: T. Wemhoff | D570: N. Jones | E570: Total | F570: J. Campbell | G570: K. Miller | H570: H. Nguyen | I570: Total ÷2 | J570: W. Dillon | K570: J. Kennedy | L570: J. Davila | M570: Total ÷2 | N570: Total | O570: Pen | P570: Score
A571: DCI World Class | C571: 20 | D571: 20 | E571: 40 | F571: 20 | G571: 20 | H571: 20 | I571: 30 | J571: 20 | K571: 20 | L571: 20 | M571: 30 | N571: 100 | P571: 100
A572: Bluecoats | B572: 7 | C572: 18.10 | D572: 18.50 | E572: 36.60 | F572: 17.80 | G572: 17.80 | H572: 17.70 | I572: 26.65 | J572: 18.30 | K572: 18.00 | L572: 18.20 | M572: 27.250 | N572: 90.500 | O572: 0.0 | P572: 90.500
C573: 1 | D573: 1 | E573: 1 | F573: 1 | G573: 1 | H573: 2 | I573: 1 | J573: 1 | K573: 1 | L573: 2 | M573: 1 | N573: 1 | P573: 1
A574: Boston | B574: 6 | C574: 17.80 | D574: 18.30 | E574: 36.10 | F574: 17.50 | G574: 17.30 | H574: 18.10 | I574: 26.45 | J574: 17.90 | K574: 17.80 | L574: 18.50 | M574: 27.100 | N574: 89.650 | O574: 0.0 | P574: 89.650
A575: Crusaders | C575: 2 | D575: 2 | E575: 2 | F575: 2 | G575: 3 | H575: 1 | I575: 2 | J575: 3 | K575: 3 | L575: 1 | M575: 2 | N575: 2 | P575: 2
A576: Carolina | B576: 8 | C576: 17.30 | D576: 18.00 | E576: 35.30 | F576: 17.20 | G576: 17.20 | H576: 17.60 | I576: 26.00 | J576: 18.00 | K576: 17.90 | L576: 17.45 | M576: 26.675000000000001 | N576: 87.974999999999994 | O576: 0.0 | P576: 87.974999999999994
A577: Crown | C577: 4 | D577: 3 | E577: 3 | F577: 3 | G577: 4 | H577: 3 | I577: 3 | J577: 2 | K577: 2 | L577: 4 | M577: 3 | N577: 3 | P577: 3
A578: Phantom | B578: 5 | C578: 17.40 | D578: 17.70 | E578: 35.10 | F578: 17.10 | G578: 17.40 | H578: 17.00 | I578: 25.75 | J578: 17.30 | K578: 16.80 | L578: 17.40 | M578: 25.750 | N578: 86.600 | O578: 0.0 | P578: 86.600
A579: Regiment | C579: 3 | D579: 4 | E579: 4 | F579: 4 | G579: 2 | H579: 4 | I579: 4 | J579: 4 | K579: 5 | L579: 5 | M579: 5 | N579: 4 | P579: 4
A580: Vanguard | B580: 1 | C580: 16.70 | D580: 17.00 | E580: 33.70 | F580: 16.60 | G580: 16.50 | H580: 16.50 | I580: 24.80 | J580: 16.90 | K580: 16.90 | L580: 17.80 | M580: 25.800 | N580: 84.300 | O580: 0.0 | P580: 84.300
C581: 5 | D581: 5 | E581: 5 | F581: 5 | G581: 5 | H581: 5 | I581: 5 | J581: 5 | K581: 4 | L581: 3 | M581: 4 | N581: 5 | P581: 5
A582: Crossmen | B582: 4 | C582: 15.70 | D582: 16.00 | E582: 31.70 | F582: 16.00 | G582: 15.80 | H582: 15.20 | I582: 23.50 | J582: 15.50 | K582: 15.10 | L582: 15.10 | M582: 22.850 | N582: 78.050 | O582: 0.0 | P582: 78.050
C583: 6 | D583: 7 | E583: 7 | F583: 6 | G583: 6 | H583: 6 | I583: 6 | J583: 7 | K583: 7 | L583: 6 | M583: 7 | N583: 6 | P583: 6
A584: Pacific | B584: 3 | C584: 15.60 | D584: 16.20 | E584: 31.80 | F584: 15.30 | G584: 14.80 | H584: 15.10 | I584: 22.60 | J584: 15.80 | K584: 15.40 | L584: 14.90 | M584: 23.050 | N584: 77.450 | O584: 0.0 | P584: 77.450
A585: Crest | C585: 7 | D585: 6 | E585: 6 | F585: 7 | G585: 8 | H585: 7 | I585: 7 | J585: 6 | K585: 6 | L585: 7 | M585: 6 | N585: 7 | P585: 7
A586: Music | B586: 2 | C586: 14.80 | D586: 15.50 | E586: 30.30 | F586: 14.90 | G586: 14.90 | H586: 14.60 | I586: 22.20 | J586: 15.10 | K586: 15.00 | L586: 14.80 | M586: 22.450 | N586: 74.950 | O586: 0.0 | P586: 74.950
A587: City | C587: 8 | D587: 8 | E587: 8 | F587: 8 | G587: 7 | H587: 8 | I587: 8 | J587: 8 | K587: 8 | L587: 8 | M587: 8 | N587: 8 | P587: 8
A590: 7/18/2024 Waco, Texas
C591: General Effect | F591: Visual | J591: Music
C592: 1 | D592: 2 | F592: Proficiency | G592: Analysis | H592: Color Guard | J592: Brass | K592: Analysis | L592: Percussion | N592: Sub | P592: Total
C593: K. Lejeune | D593: A. Snipes | E593: Total | F593: D. Solmonson | G593: J. Howell | H593: D. Henderson | I593: Total ÷2 | J593: K. Shuttlesworth | K593: M. Teal | L593: J. Prosperie | M593: Total ÷2 | N593: Total | O593: Pen | P593: Score
A594: DCI World Class | C594: 20 | D594: 20 | E594: 40 | F594: 20 | G594: 20 | H594: 20 | I594: 30 | J594: 20 | K594: 20 | L594: 20 | M594: 30 | N594: 100 | P594: 100
A595: Cavaliers | B595: 8 | C595: 16.60 | D595: 16.10 | E595: 32.70 | F595: 16.40 | G595: 16.30 | H595: 16.30 | I595: 24.50 | J595: 16.70 | K595: 17.40 | L595: 16.70 | M595: 25.40 | N595: 82.60 | O595: 0.0 | P595: 82.60
C596: 1 | D596: 1 | E596: 1 | F596: 1 | G596: 2 | H596: 1 | I596: 1 | J596: 1 | K596: 1 | L596: 1 | M596: 1 | N596: 1 | P596: 1
A597: Madison | B597: 5 | C597: 16.30 | D597: 15.40 | E597: 31.70 | F597: 15.80 | G597: 16.60 | H597: 16.20 | I597: 24.30 | J597: 16.30 | K597: 16.10 | L597: 15.10 | M597: 23.75 | N597: 79.75 | O597: 0.0 | P597: 79.75
A598: Scouts | C598: 2 | D598: 3 | E598: 2 | F598: 3 | G598: 1 | H598: 2 | I598: 2 | J598: 2 | K598: 2 | L598: 4 | M598: 2 | N598: 2 | P598: 2
A599: Blue | B599: 7 | C599: 15.80 | D599: 15.80 | E599: 31.60 | F599: 16.00 | G599: 16.00 | H599: 15.30 | I599: 23.65 | J599: 16.00 | K599: 16.00 | L599: 15.50 | M599: 23.75 | N599: 79.00 | O599: 0.0 | P599: 79.00
A600: Knights | C600: 4 | D600: 2 | E600: 3 | F600: 2 | G600: 3 | H600: 4 | I600: 3 | J600: 3 | K600: 3 | L600: 2 | M600: 2 | N600: 3 | P600: 3
A601: Spirit of | B601: 6 | C601: 16.00 | D601: 14.70 | E601: 30.70 | F601: 15.30 | G601: 15.80 | H601: 15.40 | I601: 23.25 | J601: 15.70 | K601: 15.80 | L601: 15.40 | M601: 23.45 | N601: 77.40 | O601: 0.0 | P601: 77.40
A602: Atlanta | C602: 3 | D602: 4 | E602: 4 | F602: 4 | G602: 4 | H602: 3 | I602: 4 | J602: 4 | K602: 4 | L602: 3 | M602: 4 | N602: 4 | P602: 4
A603: Academy | B603: 4 | C603: 15.20 | D603: 14.60 | E603: 29.80 | F603: 14.90 | G603: 15.10 | H603: 15.10 | I603: 22.55 | J603: 14.40 | K603: 15.40 | L603: 14.50 | M603: 22.15 | N603: 74.50 | O603: 0.0 | P603: 74.50
C604: 5 | D604: 5 | E604: 5 | F604: 5 | G604: 5 | H604: 5 | I604: 5 | J604: 6 | K604: 5 | L604: 5 | M604: 5 | N604: 5 | P604: 5
A605: Genesis | B605: 3 | C605: 14.10 | D605: 14.50 | E605: 28.60 | F605: 13.80 | G605: 14.10 | H605: 14.20 | I605: 21.05 | J605: 14.60 | K605: 14.20 | L605: 12.50 | M605: 20.65 | N605: 70.30 | O605: 0.0 | P605: 70.30
C606: 6 | D606: 6 | E606: 6 | F606: 6 | G606: 6 | H606: 6 | I606: 6 | J606: 5 | K606: 6 | L606: 7 | M606: 6 | N606: 6 | P606: 6
A607: Seattle | B607: 2 | C607: 13.60 | D607: 14.20 | E607: 27.80 | F607: 13.20 | G607: 13.20 | H607: 13.20 | I607: 19.80 | J607: 13.60 | K607: 13.40 | L607: 12.80 | M607: 19.90 | N607: 67.50 | O607: 0.0 | P607: 67.50
A608: Cascades | C608: 7 | D608: 7 | E608: 7 | F608: 7 | G608: 8 | H608: 8 | I608: 8 | J608: 7 | K608: 7 | L608: 6 | M608: 7 | N608: 7 | P608: 7
A609: Jersey | B609: 1 | C609: 13.30 | D609: 13.50 | E609: 26.80 | F609: 12.90 | G609: 13.40 | H609: 14.00 | I609: 20.15 | J609: 13.10 | K609: 12.70 | L609: 11.10 | M609: 18.45 | N609: 65.40 | O609: 0.0 | P609: 65.40
A610: Surf | C610: 8 | D610: 8 | E610: 8 | F610: 8 | G610: 7 | H610: 7 | I610: 7 | J610: 8 | K610: 8 | L610: 8 | M610: 8 | N610: 8 | P610: 8
A613: 7/19/2024 Bellbrook, Ohio
C614: General Effect | F614: Visual | J614: Music
C615: 1 | D615: 2 | F615: Proficiency | G615: Analysis | H615: Color Guard | J615: Brass | K615: Analysis | L615: Percussion | N615: Sub | P615: Total
C616: J. Tate | D616: M. McGahey | E616: Total | F616: E. Martinez | G616: P. Madden | H616: M. Bowers | I616: Total ÷2 | J616: No Judge | K616: A. Kristensen | L616: No Judge | M616: Total ÷2 | N616: Total | O616: Pen | P616: Score
A617: DCI Open Class | C617: 20 | D617: 20 | E617: 40 | F617: 20 | G617: 20 | H617: 20 | I617: 30 | J617: 20 | K617: 20 | L617: 20 | M617: 30 | N617: 100 | P617: 100
A618: Spartans | B618: 3 | C618: 14.70 | D618: 14.40 | E618: 29.10 | F618: 15.00 | G618: 15.20 | H618: 14.90 | I618: 22.55 | J618: 14.80 | K618: 14.80 | L618: 14.80 | M618: 22.20 | N618: 73.85 | O618: 0.0 | P618: 73.85
C619: 1 | D619: 1 | E619: 1 | F619: 1 | G619: 1 | H619: 1 | I619: 1 | J619: 1 | K619: 1 | L619: 1 | M619: 1 | N619: 1 | P619: 1
A620: Battalion | B620: 2 | C620: 13.50 | D620: 13.80 | E620: 27.30 | F620: 14.40 | G620: 14.80 | H620: 14.00 | I620: 21.60 | J620: 14.10 | K620: 14.10 | L620: 14.10 | M620: 21.15 | N620: 70.05 | O620: 0.0 | P620: 70.05
C621: 3 | D621: 2 | E621: 2 | F621: 2 | G621: 2 | H621: 3 | I621: 2 | J621: 3 | K621: 3 | L621: 3 | M621: 3 | N621: 2 | P621: 2
A622: River City | B622: 1 | C622: 13.90 | D622: 13.20 | E622: 27.10 | F622: 14.30 | G622: 13.90 | H622: 14.20 | I622: 21.20 | J622: 14.50 | K622: 14.50 | L622: 14.50 | M622: 21.75 | N622: 70.05 | O622: 0.0 | P622: 70.05
A623: Rhythm | C623: 2 | D623: 3 | E623: 3 | F623: 3 | G623: 3 | H623: 2 | I623: 3 | J623: 2 | K623: 2 | L623: 2 | M623: 2 | N623: 2 | P623: 2
A624: DCI All Age Open Class
A625: Cincinnati | B625: 1 | C625: 16.40 | D625: 16.70 | E625: 33.10 | F625: 16.60 | G625: 16.90 | H625: 16.50 | I625: 25.00 | J625: 16.50 | K625: 16.50 | L625: 16.50 | M625: 24.75 | N625: 82.85 | O625: 0.0 | P625: 82.85
A626: Tradition | C626: 1 | D626: 1 | E626: 1 | F626: 1 | G626: 1 | H626: 1 | I626: 1 | J626: 1 | K626: 1 | L626: 1 | M626: 1 | N626: 1 | P626: 1
A627: DCI All Age Class A
A628: Columbus | B628: 1 | C628: 12.80 | D628: 13.50 | E628: 26.30 | F628: 14.90 | G628: 14.40 | H628: 14.40 | I628: 21.65 | J628: 14.10 | K628: 14.10 | L628: 14.10 | M628: 21.15 | N628: 69.10 | O628: 0.0 | P628: 69.10
A629: Saints | C629: 1 | D629: 1 | E629: 1 | F629: 1 | G629: 1 | H629: 1 | I629: 1 | J629: 1 | K629: 1 | L629: 1 | M629: 1 | N629: 1 | P629: 1
A632: 7/19/2024 Prairie View, Texas
C633: General Effect | F633: Visual | J633: Music
C634: 1 | D634: 2 | F634: Proficiency | G634: Analysis | H634: Color Guard | J634: Brass | K634: Analysis | L634: Percussion | N634: Sub | P634: Total
C635: J. Howell | D635: A. Snipes | E635: Total | F635: D. Solomonson | G635: G. Llacer | H635: J. Campbell | I635: Total ÷2 | J635: B. Dacy | K635: J. Loyde | L635: J. Prosperie | M635: Total ÷2 | N635: Total | O635: Pen | P635: Score
A636: DCI World Class | C636: 20 | D636: 20 | E636: 40 | F636: 20 | G636: 20 | H636: 20 | I636: 30 | J636: 20 | K636: 20 | L636: 20 | M636: 30 | N636: 100 | P636: 100
A637: Bluecoats | B637: 5 | C637: 18.40 | D637: 18.70 | E637: 37.10 | F637: 18.30 | G637: 18.60 | H637: 17.90 | I637: 27.40 | J637: 18.60 | K637: 18.20 | L637: 18.40 | M637: 27.60 | N637: 92.10 | O637: 0.0 | P637: 92.10
C638: 1 | D638: 1 | E638: 1 | F638: 1 | G638: 1 | H638: 3 | I638: 1 | J638: 1 | K638: 1 | L638: 1 | M638: 1 | N638: 1 | P638: 1
A639: Blue | B639: 7 | C639: 18.20 | D639: 18.40 | E639: 36.60 | F639: 18.00 | G639: 18.30 | H639: 18.30 | I639: 27.30 | J639: 18.20 | K639: 18.00 | L639: 18.30 | M639: 27.25 | N639: 91.15 | O639: 0.0 | P639: 91.15
A640: Devils | C640: 2 | D640: 2 | E640: 2 | F640: 2 | G640: 2 | H640: 1 | I640: 2 | J640: 3 | K640: 3 | L640: 2 | M640: 2 | N640: 2 | P640: 2
A641: Carolina | B641: 6 | C641: 17.90 | D641: 18.10 | E641: 36.00 | F641: 17.60 | G641: 17.90 | H641: 18.00 | I641: 26.75 | J641: 18.30 | K641: 18.10 | L641: 17.70 | M641: 27.05 | N641: 89.80 | O641: 0.0 | P641: 89.80
A642: Crown | C642: 3 | D642: 3 | E642: 3 | F642: 3 | G642: 3 | H642: 2 | I642: 3 | J642: 2 | K642: 2 | L642: 3 | M642: 3 | N642: 3 | P642: 3
A643: Mandarins | B643: 4 | C643: 17.50 | D643: 17.70 | E643: 35.20 | F643: 17.10 | G643: 17.10 | H643: 17.10 | I643: 25.65 | J643: 17.20 | K643: 17.50 | L643: 16.40 | M643: 25.55 | N643: 86.40 | O643: 0.0 | P643: 86.40
C644: 4 | D644: 4 | E644: 4 | F644: 4 | G644: 4 | H644: 4 | I644: 4 | J644: 4 | K644: 4 | L644: 6 | M644: 4 | N644: 4 | P644: 4
A645: Cavaliers | B645: 3 | C645: 16.80 | D645: 16.90 | E645: 33.70 | F645: 16.50 | G645: 16.90 | H645: 16.50 | I645: 24.95 | J645: 16.60 | K645: 17.00 | L645: 17.10 | M645: 25.35 | N645: 84.00 | O645: 0.0 | P645: 84.00
C646: 6 | D646: 5 | E646: 5 | F646: 6 | G646: 5 | H646: 7 | I646: 6 | J646: 6 | K646: 5 | L646: 4 | M646: 5 | N646: 5 | P646: 5
A647: Blue | B647: 1 | C647: 17.00 | D647: 16.50 | E647: 33.50 | F647: 16.80 | G647: 16.70 | H647: 17.00 | I647: 25.25 | J647: 16.70 | K647: 16.60 | L647: 16.00 | M647: 24.65 | N647: 83.40 | O647: 0.0 | P647: 83.40
A648: Stars | C648: 5 | D648: 6 | E648: 6 | F648: 5 | G648: 6 | H648: 5 | I648: 5 | J648: 5 | K648: 6 | L648: 7 | M648: 7 | N648: 6 | P648: 6
A649: Colts | B649: 2 | C649: 16.50 | D649: 16.20 | E649: 32.70 | F649: 15.90 | G649: 16.40 | H649: 16.60 | I649: 24.45 | J649: 16.50 | K649: 16.50 | L649: 16.60 | M649: 24.80 | N649: 81.95 | O649: 0.0 | P649: 81.95
C650: 7 | D650: 7 | E650: 7 | F650: 7 | G650: 7 | H650: 6 | I650: 7 | J650: 7 | K650: 7 | L650: 5 | M650: 6 | N650: 7 | P650: 7
A651: DCI Open Class
A652: Guardians | B652: 1 | C652: 12.60 | D652: 12.20 | E652: 24.80 | F652: 13.00 | G652: 12.20 | H652: 14.20 | I652: 19.70 | J652: 12.50 | K652: 13.20 | L652: 12.50 | M652: 19.10 | N652: 63.60 | O652: 0.0 | P652: 63.60
C653: 1 | D653: 1 | E653: 1 | F653: 1 | G653: 1 | H653: 1 | I653: 1 | J653: 1 | K653: 1 | L653: 1 | M653: 1 | N653: 1 | P653: 1
A656: 7/20/2024 Brunswick, Ohio
C657: General Effect | F657: Visual | J657: Music
C658: 1 | D658: 2 | F658: Proficiency | G658: Analysis | H658: Color Guard | J658: Brass | K658: Analysis | L658: Percussion | N658: Sub | P658: Total
C659: P. Madden | D659: C. Rapacki | E659: Total | F659: J. Tate | G659: M. Bowers | H659: E. Martinez | I659: Total ÷2 | J659: No Judge | K659: M. McGahey | L659: A. Kristensen | M659: Total ÷2 | N659: Total | O659: Pen | P659: Score
A660: DCI Open Class | C660: 20 | D660: 20 | E660: 40 | F660: 20 | G660: 20 | H660: 20 | I660: 30 | J660: 20 | K660: 20 | L660: 20 | M660: 30 | N660: 100 | P660: 100
A661: Spartans | B661: 3 | C661: 15.30 | D661: 14.70 | E661: 30.00 | F661: 15.40 | G661: 15.40 | H661: 14.90 | I661: 22.85 | J661: 15.20 | K661: 15.20 | L661: 15.60 | M661: 23.00 | N661: 75.85 | O661: 0.0 | P661: 75.85
C662: 1 | D662: 1 | E662: 1 | F662: 1 | G662: 1 | H662: 1 | I662: 1 | J662: 1 | K662: 1 | L662: 1 | M662: 1 | N662: 1 | P662: 1
A663: Battalion | B663: 2 | C663: 15.10 | D663: 14.10 | E663: 29.20 | F663: 14.70 | G663: 14.70 | H663: 14.10 | I663: 21.75 | J663: 14.60 | K663: 14.60 | L663: 14.50 | M663: 21.85 | N663: 72.80 | O663: 0.0 | P663: 72.80
C664: 2 | D664: 2 | E664: 2 | F664: 2 | G664: 2 | H664: 2 | I664: 2 | J664: 2 | K664: 2 | L664: 3 | M664: 2 | N664: 2 | P664: 2
A665: River City | B665: 1 | C665: 14.20 | D665: 13.80 | E665: 28.00 | F665: 14.10 | G665: 14.10 | H665: 14.00 | I665: 21.10 | J665: 14.40 | K665: 14.40 | L665: 14.80 | M665: 21.80 | N665: 70.90 | O665: 0.0 | P665: 70.90
A666: Rhythm | C666: 3 | D666: 3 | E666: 3 | F666: 3 | G666: 3 | H666: 3 | I666: 3 | J666: 3 | K666: 3 | L666: 2 | M666: 3 | N666: 3 | P666: 3
A667: DCI All Age Open Class
A668: Cincinnati | B668: 2 | C668: 16.80 | D668: 16.40 | E668: 33.20 | F668: 16.70 | G668: 17.00 | H668: 16.60 | I668: 25.15 | J668: 16.70 | K668: 16.70 | L668: 16.40 | M668: 24.90 | N668: 83.25 | O668: 0.0 | P668: 83.25
A669: Tradition | C669: 1 | D669: 1 | E669: 1 | F669: 1 | G669: 1 | H669: 1 | I669: 1 | J669: 1 | K669: 1 | L669: 1 | M669: 1 | N669: 1 | P669: 1
A670: Rogues Hollow | B670: 1 | C670: 15.60 | D670: 14.60 | E670: 30.20 | F670: 15.60 | G670: 15.80 | H670: 16.10 | I670: 23.75 | J670: 16.00 | K670: 16.00 | L670: 14.90 | M670: 23.45 | N670: 77.40 | O670: 0.0 | P670: 77.40
A671: Regiment | C671: 2 | D671: 2 | E671: 2 | F671: 2 | G671: 2 | H671: 2 | I671: 2 | J671: 2 | K671: 2 | L671: 2 | M671: 2 | N671: 2 | P671: 2
A674: 7/20/2024 Landisville, Pennsylvania
C675: General Effect | F675: Visual | J675: Music
C676: 1 | D676: 2 | F676: Proficiency | G676: Analysis | H676: Color Guard | J676: Brass | K676: Analysis | L676: Percussion | N676: Sub | P676: Total
C677: T. Fox | D677: D. Orser | E677: Total | F677: C. Raichle | G677: M. Thompson | H677: T. Wingate | I677: Total ÷2 | J677: C. Marra | K677: G. Howarth | L677: T. Mengel | M677: Total ÷2 | N677: Total | O677: Pen | P677: Score
A678: DCI Open Class | C678: 20 | D678: 20 | E678: 40 | F678: 20 | G678: 20 | H678: 20 | I678: 30 | J678: 20 | K678: 20 | L678: 20 | M678: 30 | N678: 100 | P678: 100
A679: Raiders | B679: 1 | C679: 12.40 | D679: 12.70 | E679: 25.10 | F679: 12.80 | G679: 12.70 | H679: 12.00 | I679: 18.75 | J679: 13.60 | K679: 12.70 | L679: 10.90 | M679: 18.60 | N679: 62.45 | O679: 0.0 | P679: 62.45
C680: 1 | D680: 1 | E680: 1 | F680: 1 | G680: 1 | H680: 1 | I680: 1 | J680: 1 | K680: 1 | L680: 1 | M680: 1 | N680: 1 | P680: 1
A681: DCI All Age World Class
A682: Reading | B682: 3 | C682: 17.80 | D682: 17.70 | E682: 35.50 | F682: 17.20 | G682: 17.80 | H682: 17.30 | I682: 26.15 | J682: 17.10 | K682: 17.70 | L682: 17.80 | M682: 26.30 | N682: 87.95 | O682: 0.0 | P682: 87.95
A683: Buccaneers | C683: 1 | D683: 1 | E683: 1 | F683: 1 | G683: 1 | H683: 1 | I683: 1 | J683: 1 | K683: 1 | L683: 1 | M683: 1 | N683: 1 | P683: 1
A684: Bushwackers | B684: 2 | C684: 17.30 | D684: 17.10 | E684: 34.40 | F684: 16.70 | G684: 17.30 | H684: 17.10 | I684: 25.55 | J684: 16.00 | K684: 17.00 | L684: 17.70 | M684: 25.35 | N684: 85.30 | O684: 0.0 | P684: 85.30
C685: 2 | D685: 2 | E685: 2 | F685: 3 | G685: 2 | H685: 2 | I685: 2 | J685: 3 | K685: 3 | L685: 2 | M685: 3 | N685: 2 | P685: 2
A686: Hawthorne | B686: 1 | C686: 17.10 | D686: 16.80 | E686: 33.90 | F686: 16.90 | G686: 17.00 | H686: 16.90 | I686: 25.40 | J686: 16.70 | K686: 17.30 | L686: 17.50 | M686: 25.75 | N686: 85.05 | O686: 0.0 | P686: 85.05
A687: Caballeros | C687: 3 | D687: 3 | E687: 3 | F687: 2 | G687: 3 | H687: 3 | I687: 3 | J687: 2 | K687: 2 | L687: 3 | M687: 2 | N687: 3 | P687: 3
A688: DCI All Age Open Class
A689: White | B689: 1 | C689: 15.40 | D689: 15.60 | E689: 31.00 | F689: 15.80 | G689: 15.20 | H689: 15.30 | I689: 23.15 | J689: 15.80 | K689: 15.80 | L689: 16.00 | M689: 23.80 | N689: 77.95 | O689: 0.0 | P689: 77.95
A690: Sabers | C690: 1 | D690: 1 | E690: 1 | F690: 1 | G690: 1 | H690: 2 | I690: 1 | J690: 1 | K690: 1 | L690: 1 | M690: 1 | N690: 1 | P690: 4
A691: Fusion | B691: 2 | C691: 15.10 | D691: 15.20 | E691: 30.30 | F691: 15.50 | G691: 14.90 | H691: 15.50 | I691: 22.95 | J691: 14.90 | K691: 15.20 | L691: 15.40 | M691: 22.75 | N691: 76.00 | O691: 0.0 | P691: 76.00
A692: Core | C692: 2 | D692: 2 | E692: 2 | F692: 2 | G692: 2 | H692: 1 | I692: 2 | J692: 2 | K692: 2 | L692: 2 | M692: 2 | N692: 2 | P692: 2
A693: DCI All Age Class A
A694: Skyliners | B694: 1 | C694: 13.60 | D694: 13.20 | E694: 26.80 | F694: 13.50 | G694: 13.70 | H694: 13.40 | I694: 20.30 | J694: 13.10 | K694: 13.90 | L694: 12.80 | M694: 19.90 | N694: 67.00 | O694: 0.0 | P694: 67.00
C695: 1 | D695: 1 | E695: 1 | F695: 1 | G695: 1 | H695: 1 | I695: 1 | J695: 1 | K695: 1 | L695: 1 | M695: 1 | N695: 1 | P695: 1
A698: 7/20/2024 San Antonio, Texas--DCI Southwestern
C699: General Effect | J699: Visual | N699: Music
C700: 1 | D700: 1 | F700: 2 | G700: 2 | J700: Proficiency | K700: Analysis | L700: Color Guard | N700: Brass | O700: Analysis 1 | P700: Analysis 2 | Q700: Analysis | R700: Percussion | T700: Sub | V700: Total
C701: G. Llacer | D701: D. Padilla | E701: Average | F701: G. Fugett | G701: J. Rhodes | H701: Average | I701: Total | J701: M. Turner | K701: K. Baker | L701: J. Campbell | M701: Total ÷2 | N701: B. Crisp | O701: M. Griffin | P701: K. Young | Q701: Average | R701: P. Furnari | S701: Total ÷2 | T701: Total | U701: Pen | V701: Score
A702: DCI World Class | C702: 20 | D702: 20 | E702: 20 | F702: 20 | G702: 20 | H702: 20 | I702: 40 | J702: 20 | K702: 20 | L702: 20 | M702: 30 | N702: 20 | O702: 20 | P702: 20 | Q702: 20 | R702: 20 | S702: 30 | T702: 100 | V702: 100
A703: Bluecoats | B703: 21 | C703: 18.60 | D703: 18.30 | E703: 18.450 | F703: 18.70 | G703: 18.90 | H703: 18.800 | I703: 37.250 | J703: 18.60 | K703: 18.50 | L703: 18.10 | M703: 27.600 | N703: 18.60 | O703: 19.40 | P703: 18.50 | Q703: 18.950 | R703: 18.80 | S703: 28.175000000000001 | T703: 93.025000000000006 | U703: 0.0 | V703: 93.025000000000006
C704: 1 | D704: 1 | E704: 1 | F704: 1 | G704: 1 | H704: 1 | I704: 1 | J704: 1 | K704: 1 | L704: 4 | M704: 1 | N704: 2 | O704: 1 | P704: 1 | Q704: 1 | R704: 2 | S704: 1 | T704: 1 | V704: 1
A705: Blue | B705: 20 | C705: 18.20 | D705: 18.00 | E705: 18.100 | F705: 18.30 | G705: 18.75 | H705: 18.524999999999999 | I705: 36.625 | J705: 18.40 | K705: 18.00 | L705: 18.20 | M705: 27.300 | N705: 18.70 | O705: 19.00 | P705: 18.30 | Q705: 18.650 | R705: 18.55 | S705: 27.950 | T705: 91.875 | U705: 0.0 | V705: 91.875
A706: Devils | C706: 3 | D706: 2 | E706: 2 | F706: 3 | G706: 2 | H706: 2 | I706: 2 | J706: 2 | K706: 4 | L706: 3 | M706: 2 | N706: 1 | O706: 3 | P706: 2 | Q706: 2 | R706: 3 | S706: 3 | T706: 2 | V706: 2
A707: Boston | B707: 19 | C707: 18.30 | D707: 17.90 | E707: 18.100 | F707: 18.50 | G707: 18.45 | H707: 18.475000000000001 | I707: 36.575000000000003 | J707: 17.90 | K707: 18.10 | L707: 18.60 | M707: 27.300 | N707: 18.30 | O707: 19.10 | P707: 18.20 | Q707: 18.650 | R707: 19.00 | S707: 27.975000000000001 | T707: 91.850 | U707: 0.0 | V707: 91.850
A708: Crusaders | C708: 2 | D708: 3 | E708: 2 | F708: 2 | G708: 3 | H708: 3 | I708: 3 | J708: 5 | K708: 3 | L708: 1 | M708: 2 | N708: 3 | O708: 2 | P708: 3 | Q708: 2 | R708: 1 | S708: 2 | T708: 3 | V708: 3
A709: Carolina | B709: 17 | C709: 17.90 | D709: 17.40 | E709: 17.650 | F709: 18.00 | G709: 18.25 | H709: 18.125 | I709: 35.774999999999999 | J709: 18.20 | K709: 17.70 | L709: 18.30 | M709: 27.100 | N709: 18.00 | O709: 18.50 | P709: 18.10 | Q709: 18.300 | R709: 17.80 | S709: 27.050 | T709: 89.924999999999997 | U709: 0.0 | V709: 89.924999999999997
A710: Crown | C710: 4 | D710: 5 | E710: 4 | F710: 4 | G710: 4 | H710: 4 | I710: 4 | J710: 3 | K710: 5 | L710: 2 | M710: 4 | N710: 4 | O710: 5 | P710: 4 | Q710: 4 | R710: 6 | S710: 5 | T710: 4 | V710: 4
A711: Phantom | B711: 18 | C711: 17.80 | D711: 17.50 | E711: 17.650 | F711: 17.90 | G711: 18.20 | H711: 18.050 | I711: 35.700 | J711: 17.80 | K711: 18.20 | L711: 17.70 | M711: 26.850 | N711: 17.90 | O711: 18.60 | P711: 17.70 | Q711: 18.150 | R711: 18.10 | S711: 27.074999999999999 | T711: 89.625 | U711: 0.0 | V711: 89.625
A712: Regiment | C712: 5 | D712: 4 | E712: 4 | F712: 5 | G712: 5 | H712: 5 | I712: 5 | J712: 6 | K712: 2 | L712: 5 | M712: 5 | N712: 5 | O712: 4 | P712: 5 | Q712: 5 | R712: 5 | S712: 4 | T712: 5 | V712: 5
A713: Vanguard | B713: 16 | C713: 17.60 | D713: 17.10 | E713: 17.350 | F713: 17.40 | G713: 17.85 | H713: 17.625 | I713: 34.975000000000001 | J713: 17.40 | K713: 17.10 | L713: 17.40 | M713: 25.950 | N713: 17.10 | O713: 17.70 | P713: 17.50 | Q713: 17.600 | R713: 18.50 | S713: 26.600 | T713: 87.525000000000006 | U713: 0.0 | V713: 87.525000000000006
C714: 6 | D714: 7 | E714: 6 | F714: 7 | G714: 6 | H714: 6 | I714: 6 | J714: 7 | K714: 7 | L714: 6 | M714: 7 | N714: 8 | O714: 8 | P714: 6 | Q714: 7 | R714: 4 | S714: 6 | T714: 6 | V714: 6
A715: Mandarins | B715: 15 | C715: 17.40 | D715: 17.20 | E715: 17.300 | F715: 17.50 | G715: 17.65 | H715: 17.574999999999999 | I715: 34.875 | J715: 18.00 | K715: 17.30 | L715: 17.10 | M715: 26.200 | N715: 17.60 | O715: 18.10 | P715: 17.30 | Q715: 17.700 | R715: 17.00 | S715: 26.150 | T715: 87.224999999999994 | U715: 0.0 | V715: 87.224999999999994
C716: 7 | D716: 6 | E716: 7 | F716: 6 | G716: 7 | H716: 7 | I716: 7 | J716: 4 | K716: 6 | L716: 7 | M716: 6 | N716: 6 | O716: 6 | P716: 7 | Q716: 6 | R716: 9 | S716: 7 | T716: 7 | V716: 7
A717: Blue | B717: 13 | C717: 17.00 | D717: 16.70 | E717: 16.850 | F717: 17.00 | G717: 17.45 | H717: 17.225000000000001 | I717: 34.075000000000003 | J717: 16.90 | K717: 16.70 | L717: 16.90 | M717: 25.250 | N717: 17.40 | O717: 18.00 | P717: 16.85 | Q717: 17.425000000000001 | R717: 16.40 | S717: 25.613 | T717: 84.938000000000002 | U717: 0.0 | V717: 84.938000000000002
A718: Stars | C718: 8 | D718: 8 | E718: 8 | F718: 8 | G718: 8 | H718: 8 | I718: 8 | J718: 9 | K718: 9 | L718: 8 | M718: 8 | N718: 7 | O718: 7 | P718: 10 | Q718: 8 | R718: 11 | S718: 9 | T718: 8 | V718: 8
A719: Cavaliers | B719: 14 | C719: 16.70 | D719: 16.40 | E719: 16.550 | F719: 16.80 | G719: 17.30 | H719: 17.050 | I719: 33.600 | J719: 17.10 | K719: 17.00 | L719: 16.40 | M719: 25.250 | N719: 16.80 | O719: 17.40 | P719: 17.10 | Q719: 17.250 | R719: 17.60 | S719: 25.824999999999999 | T719: 84.674999999999997 | U719: 0.0 | V719: 84.674999999999997
C720: 9 | D720: 9 | E720: 9 | F720: 9 | G720: 9 | H720: 9 | I720: 9 | J720: 8 | K720: 8 | L720: 10 | M720: 8 | N720: 10 | O720: 9 | P720: 8 | Q720: 9 | R720: 7 | S720: 8 | T720: 9 | V720: 9
A721: Colts | B721: 12 | C721: 16.50 | D721: 16.30 | E721: 16.400 | F721: 16.50 | G721: 17.10 | H721: 16.800 | I721: 33.200 | J721: 16.70 | K721: 16.30 | L721: 16.70 | M721: 24.850 | N721: 16.90 | O721: 16.60 | P721: 16.60 | Q721: 16.600 | R721: 17.10 | S721: 25.300 | T721: 83.350 | U721: 0.0 | V721: 83.350
C722: 10 | D722: 10 | E722: 10 | F722: 11 | G722: 11 | H722: 11 | I722: 10 | J722: 10 | K722: 10 | L722: 9 | M722: 10 | N722: 9 | O722: 11 | P722: 11 | Q722: 11 | R722: 8 | S722: 10 | T722: 10 | V722: 10
A723: Troopers | B723: 10 | C723: 16.00 | D723: 16.20 | E723: 16.100 | F723: 16.70 | G723: 17.20 | H723: 16.950 | I723: 33.050 | J723: 15.70 | K723: 15.80 | L723: 15.90 | M723: 23.700 | N723: 16.50 | O723: 16.80 | P723: 16.90 | Q723: 16.850 | R723: 16.90 | S723: 25.125 | T723: 81.875 | U723: 0.0 | V723: 81.875
C724: 12 | D724: 11 | E724: 11 | F724: 10 | G724: 10 | H724: 10 | I724: 11 | J724: 14 | K724: 13 | L724: 13 | M724: 13 | N724: 12 | O724: 10 | P724: 9 | Q724: 10 | R724: 10 | S724: 11 | T724: 11 | V724: 11
A725: Madison | B725: 9 | C725: 15.70 | D725: 15.40 | E725: 15.550 | F725: 16.05 | G725: 16.50 | H725: 16.274999999999999 | I725: 31.824999999999999 | J725: 16.20 | K725: 16.20 | L725: 16.30 | M725: 24.350 | N725: 16.60 | O725: 16.20 | P725: 16.30 | Q725: 16.250 | R725: 14.90 | S725: 23.875 | T725: 80.050 | U725: 0.0 | V725: 80.050
A726: Scouts | C726: 14 | D726: 15 | E726: 14 | F726: 12 | G726: 13 | H726: 13 | I726: 13 | J726: 12 | K726: 11 | L726: 11 | M726: 11 | N726: 11 | O726: 12 | P726: 12 | Q726: 12 | R726: 18 | S726: 13 | T726: 12 | V726: 12
A727: Crossmen | B727: 11 | C727: 15.90 | D727: 15.80 | E727: 15.850 | F727: 16.00 | G727: 16.75 | H727: 16.375 | I727: 32.225000000000001 | J727: 16.40 | K727: 16.00 | L727: 16.00 | M727: 24.200 | N727: 15.50 | O727: 16.10 | P727: 15.90 | Q727: 16.000 | R727: 15.50 | S727: 23.500 | T727: 79.924999999999997 | U727: 0.0 | V727: 79.924999999999997
C728: 13 | D728: 12 | E728: 13 | F728: 13 | G728: 12 | H728: 12 | I728: 12 | J728: 11 | K728: 12 | L728: 12 | M728: 12 | N728: 15 | O728: 13 | P728: 14 | Q728: 13 | R728: 15 | S728: 15 | T728: 13 | V728: 13
A729: Blue | B729: 8 | C729: 16.30 | D729: 15.70 | E729: 16.000 | F729: 15.30 | G729: 16.30 | H729: 15.800 | I729: 31.800 | J729: 16.00 | K729: 15.50 | L729: 15.00 | M729: 23.250 | N729: 15.90 | O729: 15.80 | P729: 16.00 | Q729: 15.900 | R729: 16.30 | S729: 24.050 | T729: 79.100 | U729: 0.0 | V729: 79.100
A730: Knights | C730: 11 | D730: 13 | E730: 12 | F730: 16 | G730: 14 | H730: 15 | I730: 14 | J730: 13 | K730: 14 | L730: 17 | M730: 14 | N730: 14 | O730: 15 | P730: 13 | Q730: 14 | R730: 12 | S730: 12 | T730: 14 | V730: 14
A731: Pacific | B731: 5 | C731: 15.60 | D731: 15.50 | E731: 15.550 | F731: 15.85 | G731: 16.00 | H731: 15.925000000000001 | I731: 31.475000000000001 | J731: 15.10 | K731: 14.90 | L731: 15.60 | M731: 22.800 | N731: 15.00 | O731: 16.00 | P731: 15.80 | Q731: 15.900 | R731: 15.30 | S731: 23.100 | T731: 73.375 | U731: 0.0 | V731: 77.375
A732: Crest | C732: 15 | D732: 14 | E732: 14 | F732: 14 | G732: 15 | H732: 14 | I732: 15 | J732: 17 | K732: 17 | L732: 14 | M732: 16 | N732: 16 | O732: 14 | P732: 15 | Q732: 14 | R732: 16 | S732: 16 | T732: 18 | V732: 15
A733: Spirit of | B733: 7 | C733: 15.30 | D733: 14.90 | E733: 15.100 | F733: 15.50 | G733: 15.80 | H733: 15.650 | I733: 30.750 | J733: 15.50 | K733: 15.00 | L733: 15.20 | M733: 22.850 | N733: 16.10 | O733: 15.30 | P733: 15.50 | Q733: 15.400 | R733: 16.00 | S733: 23.750 | T733: 77.350 | U733: 0.0 | V733: 77.350
A734: Atlanta | C734: 16 | D734: 17 | E734: 16 | F734: 15 | G734: 16 | H734: 16 | I734: 16 | J734: 15 | K734: 16 | L734: 15 | M734: 15 | N734: 13 | O734: 16 | P734: 16 | Q734: 16 | R734: 13 | S734: 14 | T734: 15 | V734: 16
A735: Academy | B735: 4 | C735: 14.50 | D735: 14.80 | E735: 14.650 | F735: 14.90 | G735: 15.20 | H735: 15.050 | I735: 29.700 | J735: 14.80 | K735: 15.20 | L735: 15.10 | M735: 22.550 | N735: 14.90 | O735: 14.80 | P735: 15.20 | Q735: 15.000 | R735: 15.60 | S735: 22.750 | T735: 75.000 | U735: 0.0 | V735: 75.000
C736: 18 | D736: 18 | E736: 18 | F736: 18 | G736: 18 | H736: 18 | I736: 18 | J736: 18 | K736: 15 | L736: 16 | M736: 17 | N736: 17 | O736: 18 | P736: 17 | Q736: 18 | R736: 14 | S736: 17 | T736: 16 | V736: 17
A737: Music | B737: 6 | C737: 14.70 | D737: 15.00 | E737: 14.850 | F737: 15.10 | G737: 15.40 | H737: 15.250 | I737: 30.100 | J737: 15.30 | K737: 14.30 | L737: 14.20 | M737: 21.900 | N737: 14.40 | O737: 15.20 | P737: 15.00 | Q737: 15.100 | R737: 15.20 | S737: 22.350 | T737: 74.350 | U737: 0.0 | V737: 74.350
A738: City | C738: 17 | D738: 16 | E738: 17 | F738: 17 | G738: 17 | H738: 17 | I738: 17 | J738: 16 | K738: 18 | L738: 20 | M738: 18 | N738: 18 | O738: 17 | P738: 18 | Q738: 17 | R738: 17 | S738: 18 | T738: 17 | V738: 18
A739: Genesis | B739: 1 | C739: 13.90 | D739: 14.30 | E739: 14.100 | F739: 14.00 | G739: 14.20 | H739: 14.100 | I739: 28.200 | J739: 13.50 | K739: 13.90 | L739: 14.50 | M739: 20.950 | N739: 14.10 | O739: 13.30 | P739: 14.20 | Q739: 13.750 | R739: 14.30 | S739: 21.074999999999999 | T739: 70.224999999999994 | U739: 0.0 | V739: 70.224999999999994
C740: 19 | D740: 19 | E740: 19 | F740: 20 | G740: 20 | H740: 20 | I740: 19 | J740: 21 | K740: 19 | L740: 19 | M740: 21 | N740: 19 | O740: 20 | P740: 19 | Q740: 19 | R740: 19 | S740: 19 | T740: 19 | V740: 19
A741: Seattle | B741: 3 | C741: 13.70 | D741: 14.10 | E741: 13.900 | F741: 13.60 | G741: 13.60 | H741: 13.600 | I741: 27.500 | J741: 14.40 | K741: 13.60 | L741: 14.00 | M741: 21.000 | N741: 13.90 | O741: 13.20 | P741: 13.70 | Q741: 13.450 | R741: 14.10 | S741: 20.725000000000001 | T741: 69.224999999999994 | U741: 0.0 | V741: 69.224999999999994
A742: Cascades | C742: 20 | D742: 20 | E742: 20 | F742: 21 | G742: 21 | H742: 21 | I742: 21 | J742: 19 | K742: 20 | L742: 21 | M742: 19 | N742: 20 | O742: 21 | P742: 21 | Q742: 21 | R742: 20 | S742: 20 | T742: 20 | V742: 20
A743: Jersey | B743: 2 | C743: 13.40 | D743: 13.90 | E743: 13.650 | F743: 14.20 | G743: 14.40 | H743: 14.300 | I743: 27.950 | J743: 14.00 | K743: 13.30 | L743: 14.70 | M743: 21.000 | N743: 13.40 | O743: 13.70 | P743: 13.80 | Q743: 13.750 | R743: 12.70 | S743: 19.925000000000001 | T743: 68.875 | U743: 0.0 | V743: 68.875
A744: Surf | C744: 21 | D744: 21 | E744: 21 | F744: 19 | G744: 19 | H744: 19 | I744: 20 | J744: 20 | K744: 21 | L744: 18 | M744: 19 | N744: 21 | O744: 19 | P744: 20 | Q744: 19 | R744: 21 | S744: 21 | T744: 21 | V744: 21
A745: DCI Open Class
A746: Guardians | B746: 1 | C746: 12.70 | D746: 13.20 | E746: 12.950 | F746: 12.60 | G746: 12.60 | H746: 12.600 | I746: 25.550 | J746: 12.60 | K746: 12.80 | L746: 13.70 | M746: 19.550 | N746: 13.10 | O746: 12.70 | P746: 12.60 | Q746: 12.650 | R746: 12.80 | S746: 19.274999999999999 | T746: 64.375 | U746: 0.0 | V746: 64.375
C747: 1 | D747: 1 | E747: 1 | F747: 1 | G747: 1 | H747: 1 | I747: 1 | J747: 1 | K747: 1 | L747: 1 | M747: 1 | N747: 1 | O747: 1 | P747: 1 | Q747: 1 | R747: 1 | S747: 1 | T747: 1 | V747: 1
A750: 7/22/2024 Mesquite, Texas
C751: General Effect | F751: Visual | J751: Music
C752: 1 | D752: 2 | F752: Proficiency | G752: Analysis | H752: Color Guard | J752: Brass | K752: Analysis | L752: Percussion | N752: Sub | P752: Total
C753: K. Lejeune | D753: G. Miller | E753: Total | F753: D. Henderson | G753: T. Ochran | H753: C. Raichle | I753: Total ÷2 | J753: S. Page | K753: C. Romanowski | L753: J. Wilson | M753: Total ÷2 | N753: Total | O753: Pen | P753: Score
A754: DCI World Class | C754: 20 | D754: 20 | E754: 40 | F754: 20 | G754: 20 | H754: 20 | I754: 30 | J754: 20 | K754: 20 | L754: 20 | M754: 30 | N754: 100 | P754: 100
A755: Carolina | B755: 10 | C755: 18.00 | D755: 18.00 | E755: 36.00 | F755: 18.40 | G755: 18.10 | H755: 18.40 | I755: 27.45 | J755: 17.50 | K755: 18.60 | L755: 18.10 | M755: 27.10 | N755: 90.55 | O755: 0.0 | P755: 90.55
A756: Crown | C756: =RANK(C755,(C$6,C$8,C$10,C$12,C$14,C$16,C$18,C$20,C$22,C$24,C$27,C$29,C$31,C$33,C$35,C$37,C$39,C$41,C$43,C$45,C$47,C$49,C$51,C$53,C$55,C$57,C$59,C$61,C$63,C$65,C$67,C$69,C$71,C$73,C$75,C$77,C$79,C$81,C$83,C$85,C$87,C$89,C$91,C$93,C$95,C$97,C$99,C$101,C$103,C$105,C$107,C$109,C$111,C$113,C$115,C$117,C$119,C$121,C$123,C$125)) -> 1 | D756: =RANK(D755,(D$6,D$8,D$10,D$12,D$14,D$16,D$18,D$20,D$22,D$24,D$27,D$29,D$31,D$33,D$35,D$37,D$39,D$41,D$43,D$45,D$47,D$49,D$51,D$53,D$55,D$57,D$59,D$61,D$63,D$65,D$67,D$69,D$71,D$73,D$75,D$77,D$79,D$81,D$83,D$85,D$87,D$89,D$91,D$93,D$95,D$97,D$99,D$101,D$103,D$105,D$107,D$109,D$111,D$113,D$115,D$117,D$119,D$121,D$123,D$125)) -> 1 | E756: =RANK(E755,(E$6,E$8,E$10,E$12,E$14,E$16,E$18,E$20,E$22,E$24,E$27,E$29,E$31,E$33,E$35,E$37,E$39,E$41,E$43,E$45,E$47,E$49,E$51,E$53,E$55,E$57,E$59,E$61,E$63,E$65,E$67,E$69,E$71,E$73,E$75,E$77,E$79,E$81,E$83,E$85,E$87,E$89,E$91,E$93,E$95,E$97,E$99,E$101,E$103,E$105,E$107,E$109,E$111,E$113,E$115,E$117,E$119,E$121,E$123,E$125)) -> 1 | F756: =RANK(F755,(F$6,F$8,F$10,F$12,F$14,F$16,F$18,F$20,F$22,F$24,F$27,F$29,F$31,F$33,F$35,F$37,F$39,F$41,F$43,F$45,F$47,F$49,F$51,F$53,F$55,F$57,F$59,F$61,F$63,F$65,F$67,F$69,F$71,F$73,F$75,F$77,F$79,F$81,F$83,F$85,F$87,F$89,F$91,F$93,F$95,F$97,F$99,F$101,F$103,F$105,F$107,F$109,F$111,F$113,F$115,F$117,F$119,F$121,F$123,F$125)) -> 1 | G756: =RANK(G755,(G$6,G$8,G$10,G$12,G$14,G$16,G$18,G$20,G$22,G$24,G$27,G$29,G$31,G$33,G$35,G$37,G$39,G$41,G$43,G$45,G$47,G$49,G$51,G$53,G$55,G$57,G$59,G$61,G$63,G$65,G$67,G$69,G$71,G$73,G$75,G$77,G$79,G$81,G$83,G$85,G$87,G$89,G$91,G$93,G$95,G$97,G$99,G$101,G$103,G$105,G$107,G$109,G$111,G$113,G$115,G$117,G$119,G$121,G$123,G$125)) -> 1 | H756: =RANK(H755,(H$6,H$8,H$10,H$12,H$14,H$16,H$18,H$20,H$22,H$24,H$27,H$29,H$31,H$33,H$35,H$37,H$39,H$41,H$43,H$45,H$47,H$49,H$51,H$53,H$55,H$57,H$59,H$61,H$63,H$65,H$67,H$69,H$71,H$73,H$75,H$77,H$79,H$81,H$83,H$85,H$87,H$89,H$91,H$93,H$95,H$97,H$99,H$101,H$103,H$105,H$107,H$109,H$111,H$113,H$115,H$117,H$119,H$121,H$123,H$125)) -> 1 | I756: =RANK(I755,(I$6,I$8,I$10,I$12,I$14,I$16,I$18,I$20,I$22,I$24,I$27,I$29,I$31,I$33,I$35,I$37,I$39,I$41,I$43,I$45,I$47,I$49,I$51,I$53,I$55,I$57,I$59,I$61,I$63,I$65,I$67,I$69,I$71,I$73,I$75,I$77,I$79,I$81,I$83,I$85,I$87,I$89,I$91,I$93,I$95,I$97,I$99,I$101,I$103,I$105,I$107,I$109,I$111,I$113,I$115,I$117,I$119,I$121,I$123,I$125)) -> 1 | J756: =RANK(J755,(J$6,J$8,J$10,J$12,J$14,J$16,J$18,J$20,J$22,J$24,J$27,J$29,J$31,J$33,J$35,J$37,J$39,J$41,J$43,J$45,J$47,J$49,J$51,J$53,J$55,J$57,J$59,J$61,J$63,J$65,J$67,J$69,J$71,J$73,J$75,J$77,J$79,J$81,J$83,J$85,J$87,J$89,J$91,J$93,J$95,J$97,J$99,J$101,J$103,J$105,J$107,J$109,J$111,J$113,J$115,J$117,J$119,J$121,J$123,J$125)) -> 1 | K756: =RANK(K755,(K$6,K$8,K$10,K$12,K$14,K$16,K$18,K$20,K$22,K$24,K$27,K$29,K$31,K$33,K$35,K$37,K$39,K$41,K$43,K$45,K$47,K$49,K$51,K$53,K$55,K$57,K$59,K$61,K$63,K$65,K$67,K$69,K$71,K$73,K$75,K$77,K$79,K$81,K$83,K$85,K$87,K$89,K$91,K$93,K$95,K$97,K$99,K$101,K$103,K$105,K$107,K$109,K$111,K$113,K$115,K$117,K$119,K$121,K$123,K$125)) -> 1 | L756: =RANK(L755,(L$6,L$8,L$10,L$12,L$14,L$16,L$18,L$20,L$22,L$24,L$27,L$29,L$31,L$33,L$35,L$37,L$39,L$41,L$43,L$45,L$47,L$49,L$51,L$53,L$55,L$57,L$59,L$61,L$63,L$65,L$67,L$69,L$71,L$73,L$75,L$77,L$79,L$81,L$83,L$85,L$87,L$89,L$91,L$93,L$95,L$97,L$99,L$101,L$103,L$105,L$107,L$109,L$111,L$113,L$115,L$117,L$119,L$121,L$123,L$125)) -> 1 | M756: =RANK(M755,(M$6,M$8,M$10,M$12,M$14,M$16,M$18,M$20,M$22,M$24,M$27,M$29,M$31,M$33,M$35,M$37,M$39,M$41,M$43,M$45,M$47,M$49,M$51,M$53,M$55,M$57,M$59,M$61,M$63,M$65,M$67,M$69,M$71,M$73,M$75,M$77,M$79,M$81,M$83,M$85,M$87,M$89,M$91,M$93,M$95,M$97,M$99,M$101,M$103,M$105,M$107,M$109,M$111,M$113,M$115,M$117,M$119,M$121,M$123,M$125)) -> 1 | N756: =RANK(N755,(N$6,N$8,N$10,N$12,N$14,N$16,N$18,N$20,N$22,N$24,N$27,N$29,N$31,N$33,N$35,N$37,N$39,N$41,N$43,N$45,N$47,N$49,N$51,N$53,N$55,N$57,N$59,N$61,N$63,N$65,N$67,N$69,N$71,N$73,N$75,N$77,N$79,N$81,N$83,N$85,N$87,N$89,N$91,N$93,N$95,N$97,N$99,N$101,N$103,N$105,N$107,N$109,N$111,N$113,N$115,N$117,N$119,N$121,N$123,N$125)) -> 1 | P756: =RANK(P755,(P$6,P$8,P$10,P$12,P$14,P$16,P$18,P$20,P$22,P$24,P$27,P$29,P$31,P$33,P$35,P$37,P$39,P$41,P$43,P$45,P$47,P$49,P$51,P$53,P$55,P$57,P$59,P$61,P$63,P$65,P$67,P$69,P$71,P$73,P$75,P$77,P$79,P$81,P$83,P$85,P$87,P$89,P$91,P$93,P$95,P$97,P$99,P$101,P$103,P$105,P$107,P$109,P$111,P$113,P$115,P$117,P$119,P$121,P$123,P$125)) -> 1
A757: Mandarins | B757: 9 | C757: 17.60 | D757: 17.90 | E757: 35.50 | F757: 18.30 | G757: 17.60 | H757: 17.50 | I757: 26.70 | J757: 16.60 | K757: 18.10 | L757: 17.20 | M757: 25.95 | N757: 88.15 | O757: 0.0 | P757: 88.15
C758: =RANK(C757,(C$6,C$8,C$10,C$12,C$14,C$16,C$18,C$20,C$22,C$24,C$27,C$29,C$31,C$33,C$35,C$37,C$39,C$41,C$43,C$45,C$47,C$49,C$51,C$53,C$55,C$57,C$59,C$61,C$63,C$65,C$67,C$69,C$71,C$73,C$75,C$77,C$79,C$81,C$83,C$85,C$87,C$89,C$91,C$93,C$95,C$97,C$99,C$101,C$103,C$105,C$107,C$109,C$111,C$113,C$115,C$117,C$119,C$121,C$123,C$125)) -> 2 | D758: =RANK(D757,(D$6,D$8,D$10,D$12,D$14,D$16,D$18,D$20,D$22,D$24,D$27,D$29,D$31,D$33,D$35,D$37,D$39,D$41,D$43,D$45,D$47,D$49,D$51,D$53,D$55,D$57,D$59,D$61,D$63,D$65,D$67,D$69,D$71,D$73,D$75,D$77,D$79,D$81,D$83,D$85,D$87,D$89,D$91,D$93,D$95,D$97,D$99,D$101,D$103,D$105,D$107,D$109,D$111,D$113,D$115,D$117,D$119,D$121,D$123,D$125)) -> 2 | E758: =RANK(E757,(E$6,E$8,E$10,E$12,E$14,E$16,E$18,E$20,E$22,E$24,E$27,E$29,E$31,E$33,E$35,E$37,E$39,E$41,E$43,E$45,E$47,E$49,E$51,E$53,E$55,E$57,E$59,E$61,E$63,E$65,E$67,E$69,E$71,E$73,E$75,E$77,E$79,E$81,E$83,E$85,E$87,E$89,E$91,E$93,E$95,E$97,E$99,E$101,E$103,E$105,E$107,E$109,E$111,E$113,E$115,E$117,E$119,E$121,E$123,E$125)) -> 2 | F758: =RANK(F757,(F$6,F$8,F$10,F$12,F$14,F$16,F$18,F$20,F$22,F$24,F$27,F$29,F$31,F$33,F$35,F$37,F$39,F$41,F$43,F$45,F$47,F$49,F$51,F$53,F$55,F$57,F$59,F$61,F$63,F$65,F$67,F$69,F$71,F$73,F$75,F$77,F$79,F$81,F$83,F$85,F$87,F$89,F$91,F$93,F$95,F$97,F$99,F$101,F$103,F$105,F$107,F$109,F$111,F$113,F$115,F$117,F$119,F$121,F$123,F$125)) -> 2 | G758: =RANK(G757,(G$6,G$8,G$10,G$12,G$14,G$16,G$18,G$20,G$22,G$24,G$27,G$29,G$31,G$33,G$35,G$37,G$39,G$41,G$43,G$45,G$47,G$49,G$51,G$53,G$55,G$57,G$59,G$61,G$63,G$65,G$67,G$69,G$71,G$73,G$75,G$77,G$79,G$81,G$83,G$85,G$87,G$89,G$91,G$93,G$95,G$97,G$99,G$101,G$103,G$105,G$107,G$109,G$111,G$113,G$115,G$117,G$119,G$121,G$123,G$125)) -> 2 | H758: =RANK(H757,(H$6,H$8,H$10,H$12,H$14,H$16,H$18,H$20,H$22,H$24,H$27,H$29,H$31,H$33,H$35,H$37,H$39,H$41,H$43,H$45,H$47,H$49,H$51,H$53,H$55,H$57,H$59,H$61,H$63,H$65,H$67,H$69,H$71,H$73,H$75,H$77,H$79,H$81,H$83,H$85,H$87,H$89,H$91,H$93,H$95,H$97,H$99,H$101,H$103,H$105,H$107,H$109,H$111,H$113,H$115,H$117,H$119,H$121,H$123,H$125)) -> 2 | I758: =RANK(I757,(I$6,I$8,I$10,I$12,I$14,I$16,I$18,I$20,I$22,I$24,I$27,I$29,I$31,I$33,I$35,I$37,I$39,I$41,I$43,I$45,I$47,I$49,I$51,I$53,I$55,I$57,I$59,I$61,I$63,I$65,I$67,I$69,I$71,I$73,I$75,I$77,I$79,I$81,I$83,I$85,I$87,I$89,I$91,I$93,I$95,I$97,I$99,I$101,I$103,I$105,I$107,I$109,I$111,I$113,I$115,I$117,I$119,I$121,I$123,I$125)) -> 2 | J758: =RANK(J757,(J$6,J$8,J$10,J$12,J$14,J$16,J$18,J$20,J$22,J$24,J$27,J$29,J$31,J$33,J$35,J$37,J$39,J$41,J$43,J$45,J$47,J$49,J$51,J$53,J$55,J$57,J$59,J$61,J$63,J$65,J$67,J$69,J$71,J$73,J$75,J$77,J$79,J$81,J$83,J$85,J$87,J$89,J$91,J$93,J$95,J$97,J$99,J$101,J$103,J$105,J$107,J$109,J$111,J$113,J$115,J$117,J$119,J$121,J$123,J$125)) -> 2 | K758: =RANK(K757,(K$6,K$8,K$10,K$12,K$14,K$16,K$18,K$20,K$22,K$24,K$27,K$29,K$31,K$33,K$35,K$37,K$39,K$41,K$43,K$45,K$47,K$49,K$51,K$53,K$55,K$57,K$59,K$61,K$63,K$65,K$67,K$69,K$71,K$73,K$75,K$77,K$79,K$81,K$83,K$85,K$87,K$89,K$91,K$93,K$95,K$97,K$99,K$101,K$103,K$105,K$107,K$109,K$111,K$113,K$115,K$117,K$119,K$121,K$123,K$125)) -> 2 | L758: =RANK(L757,(L$6,L$8,L$10,L$12,L$14,L$16,L$18,L$20,L$22,L$24,L$27,L$29,L$31,L$33,L$35,L$37,L$39,L$41,L$43,L$45,L$47,L$49,L$51,L$53,L$55,L$57,L$59,L$61,L$63,L$65,L$67,L$69,L$71,L$73,L$75,L$77,L$79,L$81,L$83,L$85,L$87,L$89,L$91,L$93,L$95,L$97,L$99,L$101,L$103,L$105,L$107,L$109,L$111,L$113,L$115,L$117,L$119,L$121,L$123,L$125)) -> 4 | M758: =RANK(M757,(M$6,M$8,M$10,M$12,M$14,M$16,M$18,M$20,M$22,M$24,M$27,M$29,M$31,M$33,M$35,M$37,M$39,M$41,M$43,M$45,M$47,M$49,M$51,M$53,M$55,M$57,M$59,M$61,M$63,M$65,M$67,M$69,M$71,M$73,M$75,M$77,M$79,M$81,M$83,M$85,M$87,M$89,M$91,M$93,M$95,M$97,M$99,M$101,M$103,M$105,M$107,M$109,M$111,M$113,M$115,M$117,M$119,M$121,M$123,M$125)) -> 2 | N758: =RANK(N757,(N$6,N$8,N$10,N$12,N$14,N$16,N$18,N$20,N$22,N$24,N$27,N$29,N$31,N$33,N$35,N$37,N$39,N$41,N$43,N$45,N$47,N$49,N$51,N$53,N$55,N$57,N$59,N$61,N$63,N$65,N$67,N$69,N$71,N$73,N$75,N$77,N$79,N$81,N$83,N$85,N$87,N$89,N$91,N$93,N$95,N$97,N$99,N$101,N$103,N$105,N$107,N$109,N$111,N$113,N$115,N$117,N$119,N$121,N$123,N$125)) -> 2 | P758: =RANK(P757,(P$6,P$8,P$10,P$12,P$14,P$16,P$18,P$20,P$22,P$24,P$27,P$29,P$31,P$33,P$35,P$37,P$39,P$41,P$43,P$45,P$47,P$49,P$51,P$53,P$55,P$57,P$59,P$61,P$63,P$65,P$67,P$69,P$71,P$73,P$75,P$77,P$79,P$81,P$83,P$85,P$87,P$89,P$91,P$93,P$95,P$97,P$99,P$101,P$103,P$105,P$107,P$109,P$111,P$113,P$115,P$117,P$119,P$121,P$123,P$125)) -> 2
A759: Cavaliers | B759: 8 | C759: 17.10 | D759: 17.00 | E759: 34.10 | F759: 17.50 | G759: 17.30 | H759: 16.70 | I759: 25.75 | J759: 15.90 | K759: 17.20 | L759: 17.80 | M759: 25.45 | N759: 85.30 | O759: 0.0 | P759: 85.30
C760: =RANK(C759,(C$6,C$8,C$10,C$12,C$14,C$16,C$18,C$20,C$22,C$24,C$27,C$29,C$31,C$33,C$35,C$37,C$39,C$41,C$43,C$45,C$47,C$49,C$51,C$53,C$55,C$57,C$59,C$61,C$63,C$65,C$67,C$69,C$71,C$73,C$75,C$77,C$79,C$81,C$83,C$85,C$87,C$89,C$91,C$93,C$95,C$97,C$99,C$101,C$103,C$105,C$107,C$109,C$111,C$113,C$115,C$117,C$119,C$121,C$123,C$125)) -> 3 | D760: =RANK(D759,(D$6,D$8,D$10,D$12,D$14,D$16,D$18,D$20,D$22,D$24,D$27,D$29,D$31,D$33,D$35,D$37,D$39,D$41,D$43,D$45,D$47,D$49,D$51,D$53,D$55,D$57,D$59,D$61,D$63,D$65,D$67,D$69,D$71,D$73,D$75,D$77,D$79,D$81,D$83,D$85,D$87,D$89,D$91,D$93,D$95,D$97,D$99,D$101,D$103,D$105,D$107,D$109,D$111,D$113,D$115,D$117,D$119,D$121,D$123,D$125)) -> 3 | E760: =RANK(E759,(E$6,E$8,E$10,E$12,E$14,E$16,E$18,E$20,E$22,E$24,E$27,E$29,E$31,E$33,E$35,E$37,E$39,E$41,E$43,E$45,E$47,E$49,E$51,E$53,E$55,E$57,E$59,E$61,E$63,E$65,E$67,E$69,E$71,E$73,E$75,E$77,E$79,E$81,E$83,E$85,E$87,E$89,E$91,E$93,E$95,E$97,E$99,E$101,E$103,E$105,E$107,E$109,E$111,E$113,E$115,E$117,E$119,E$121,E$123,E$125)) -> 3 | F760: =RANK(F759,(F$6,F$8,F$10,F$12,F$14,F$16,F$18,F$20,F$22,F$24,F$27,F$29,F$31,F$33,F$35,F$37,F$39,F$41,F$43,F$45,F$47,F$49,F$51,F$53,F$55,F$57,F$59,F$61,F$63,F$65,F$67,F$69,F$71,F$73,F$75,F$77,F$79,F$81,F$83,F$85,F$87,F$89,F$91,F$93,F$95,F$97,F$99,F$101,F$103,F$105,F$107,F$109,F$111,F$113,F$115,F$117,F$119,F$121,F$123,F$125)) -> 3 | G760: =RANK(G759,(G$6,G$8,G$10,G$12,G$14,G$16,G$18,G$20,G$22,G$24,G$27,G$29,G$31,G$33,G$35,G$37,G$39,G$41,G$43,G$45,G$47,G$49,G$51,G$53,G$55,G$57,G$59,G$61,G$63,G$65,G$67,G$69,G$71,G$73,G$75,G$77,G$79,G$81,G$83,G$85,G$87,G$89,G$91,G$93,G$95,G$97,G$99,G$101,G$103,G$105,G$107,G$109,G$111,G$113,G$115,G$117,G$119,G$121,G$123,G$125)) -> 3 | H760: =RANK(H759,(H$6,H$8,H$10,H$12,H$14,H$16,H$18,H$20,H$22,H$24,H$27,H$29,H$31,H$33,H$35,H$37,H$39,H$41,H$43,H$45,H$47,H$49,H$51,H$53,H$55,H$57,H$59,H$61,H$63,H$65,H$67,H$69,H$71,H$73,H$75,H$77,H$79,H$81,H$83,H$85,H$87,H$89,H$91,H$93,H$95,H$97,H$99,H$101,H$103,H$105,H$107,H$109,H$111,H$113,H$115,H$117,H$119,H$121,H$123,H$125)) -> 4 | I760: =RANK(I759,(I$6,I$8,I$10,I$12,I$14,I$16,I$18,I$20,I$22,I$24,I$27,I$29,I$31,I$33,I$35,I$37,I$39,I$41,I$43,I$45,I$47,I$49,I$51,I$53,I$55,I$57,I$59,I$61,I$63,I$65,I$67,I$69,I$71,I$73,I$75,I$77,I$79,I$81,I$83,I$85,I$87,I$89,I$91,I$93,I$95,I$97,I$99,I$101,I$103,I$105,I$107,I$109,I$111,I$113,I$115,I$117,I$119,I$121,I$123,I$125)) -> 3 | J760: =RANK(J759,(J$6,J$8,J$10,J$12,J$14,J$16,J$18,J$20,J$22,J$24,J$27,J$29,J$31,J$33,J$35,J$37,J$39,J$41,J$43,J$45,J$47,J$49,J$51,J$53,J$55,J$57,J$59,J$61,J$63,J$65,J$67,J$69,J$71,J$73,J$75,J$77,J$79,J$81,J$83,J$85,J$87,J$89,J$91,J$93,J$95,J$97,J$99,J$101,J$103,J$105,J$107,J$109,J$111,J$113,J$115,J$117,J$119,J$121,J$123,J$125)) -> 4 | K760: =RANK(K759,(K$6,K$8,K$10,K$12,K$14,K$16,K$18,K$20,K$22,K$24,K$27,K$29,K$31,K$33,K$35,K$37,K$39,K$41,K$43,K$45,K$47,K$49,K$51,K$53,K$55,K$57,K$59,K$61,K$63,K$65,K$67,K$69,K$71,K$73,K$75,K$77,K$79,K$81,K$83,K$85,K$87,K$89,K$91,K$93,K$95,K$97,K$99,K$101,K$103,K$105,K$107,K$109,K$111,K$113,K$115,K$117,K$119,K$121,K$123,K$125)) -> 3 | L760: =RANK(L759,(L$6,L$8,L$10,L$12,L$14,L$16,L$18,L$20,L$22,L$24,L$27,L$29,L$31,L$33,L$35,L$37,L$39,L$41,L$43,L$45,L$47,L$49,L$51,L$53,L$55,L$57,L$59,L$61,L$63,L$65,L$67,L$69,L$71,L$73,L$75,L$77,L$79,L$81,L$83,L$85,L$87,L$89,L$91,L$93,L$95,L$97,L$99,L$101,L$103,L$105,L$107,L$109,L$111,L$113,L$115,L$117,L$119,L$121,L$123,L$125)) -> 2 | M760: =RANK(M759,(M$6,M$8,M$10,M$12,M$14,M$16,M$18,M$20,M$22,M$24,M$27,M$29,M$31,M$33,M$35,M$37,M$39,M$41,M$43,M$45,M$47,M$49,M$51,M$53,M$55,M$57,M$59,M$61,M$63,M$65,M$67,M$69,M$71,M$73,M$75,M$77,M$79,M$81,M$83,M$85,M$87,M$89,M$91,M$93,M$95,M$97,M$99,M$101,M$103,M$105,M$107,M$109,M$111,M$113,M$115,M$117,M$119,M$121,M$123,M$125)) -> 3 | N760: =RANK(N759,(N$6,N$8,N$10,N$12,N$14,N$16,N$18,N$20,N$22,N$24,N$27,N$29,N$31,N$33,N$35,N$37,N$39,N$41,N$43,N$45,N$47,N$49,N$51,N$53,N$55,N$57,N$59,N$61,N$63,N$65,N$67,N$69,N$71,N$73,N$75,N$77,N$79,N$81,N$83,N$85,N$87,N$89,N$91,N$93,N$95,N$97,N$99,N$101,N$103,N$105,N$107,N$109,N$111,N$113,N$115,N$117,N$119,N$121,N$123,N$125)) -> 3 | P760: =RANK(P759,(P$6,P$8,P$10,P$12,P$14,P$16,P$18,P$20,P$22,P$24,P$27,P$29,P$31,P$33,P$35,P$37,P$39,P$41,P$43,P$45,P$47,P$49,P$51,P$53,P$55,P$57,P$59,P$61,P$63,P$65,P$67,P$69,P$71,P$73,P$75,P$77,P$79,P$81,P$83,P$85,P$87,P$89,P$91,P$93,P$95,P$97,P$99,P$101,P$103,P$105,P$107,P$109,P$111,P$113,P$115,P$117,P$119,P$121,P$123,P$125)) -> 3
A761: Colts | B761: 6 | C761: 16.90 | D761: 16.60 | E761: 33.50 | F761: 16.90 | G761: 16.70 | H761: 16.90 | I761: 25.25 | J761: 16.10 | K761: 16.80 | L761: 17.40 | M761: 25.15 | N761: 83.90 | O761: 0.0 | P761: 83.90
C762: =RANK(C761,(C$6,C$8,C$10,C$12,C$14,C$16,C$18,C$20,C$22,C$24,C$27,C$29,C$31,C$33,C$35,C$37,C$39,C$41,C$43,C$45,C$47,C$49,C$51,C$53,C$55,C$57,C$59,C$61,C$63,C$65,C$67,C$69,C$71,C$73,C$75,C$77,C$79,C$81,C$83,C$85,C$87,C$89,C$91,C$93,C$95,C$97,C$99,C$101,C$103,C$105,C$107,C$109,C$111,C$113,C$115,C$117,C$119,C$121,C$123,C$125)) -> 4 | D762: =RANK(D761,(D$6,D$8,D$10,D$12,D$14,D$16,D$18,D$20,D$22,D$24,D$27,D$29,D$31,D$33,D$35,D$37,D$39,D$41,D$43,D$45,D$47,D$49,D$51,D$53,D$55,D$57,D$59,D$61,D$63,D$65,D$67,D$69,D$71,D$73,D$75,D$77,D$79,D$81,D$83,D$85,D$87,D$89,D$91,D$93,D$95,D$97,D$99,D$101,D$103,D$105,D$107,D$109,D$111,D$113,D$115,D$117,D$119,D$121,D$123,D$125)) -> 4 | E762: =RANK(E761,(E$6,E$8,E$10,E$12,E$14,E$16,E$18,E$20,E$22,E$24,E$27,E$29,E$31,E$33,E$35,E$37,E$39,E$41,E$43,E$45,E$47,E$49,E$51,E$53,E$55,E$57,E$59,E$61,E$63,E$65,E$67,E$69,E$71,E$73,E$75,E$77,E$79,E$81,E$83,E$85,E$87,E$89,E$91,E$93,E$95,E$97,E$99,E$101,E$103,E$105,E$107,E$109,E$111,E$113,E$115,E$117,E$119,E$121,E$123,E$125)) -> 4 | F762: =RANK(F761,(F$6,F$8,F$10,F$12,F$14,F$16,F$18,F$20,F$22,F$24,F$27,F$29,F$31,F$33,F$35,F$37,F$39,F$41,F$43,F$45,F$47,F$49,F$51,F$53,F$55,F$57,F$59,F$61,F$63,F$65,F$67,F$69,F$71,F$73,F$75,F$77,F$79,F$81,F$83,F$85,F$87,F$89,F$91,F$93,F$95,F$97,F$99,F$101,F$103,F$105,F$107,F$109,F$111,F$113,F$115,F$117,F$119,F$121,F$123,F$125)) -> 4 | G762: =RANK(G761,(G$6,G$8,G$10,G$12,G$14,G$16,G$18,G$20,G$22,G$24,G$27,G$29,G$31,G$33,G$35,G$37,G$39,G$41,G$43,G$45,G$47,G$49,G$51,G$53,G$55,G$57,G$59,G$61,G$63,G$65,G$67,G$69,G$71,G$73,G$75,G$77,G$79,G$81,G$83,G$85,G$87,G$89,G$91,G$93,G$95,G$97,G$99,G$101,G$103,G$105,G$107,G$109,G$111,G$113,G$115,G$117,G$119,G$121,G$123,G$125)) -> 4 | H762: =RANK(H761,(H$6,H$8,H$10,H$12,H$14,H$16,H$18,H$20,H$22,H$24,H$27,H$29,H$31,H$33,H$35,H$37,H$39,H$41,H$43,H$45,H$47,H$49,H$51,H$53,H$55,H$57,H$59,H$61,H$63,H$65,H$67,H$69,H$71,H$73,H$75,H$77,H$79,H$81,H$83,H$85,H$87,H$89,H$91,H$93,H$95,H$97,H$99,H$101,H$103,H$105,H$107,H$109,H$111,H$113,H$115,H$117,H$119,H$121,H$123,H$125)) -> 3 | I762: =RANK(I761,(I$6,I$8,I$10,I$12,I$14,I$16,I$18,I$20,I$22,I$24,I$27,I$29,I$31,I$33,I$35,I$37,I$39,I$41,I$43,I$45,I$47,I$49,I$51,I$53,I$55,I$57,I$59,I$61,I$63,I$65,I$67,I$69,I$71,I$73,I$75,I$77,I$79,I$81,I$83,I$85,I$87,I$89,I$91,I$93,I$95,I$97,I$99,I$101,I$103,I$105,I$107,I$109,I$111,I$113,I$115,I$117,I$119,I$121,I$123,I$125)) -> 4 | J762: =RANK(J761,(J$6,J$8,J$10,J$12,J$14,J$16,J$18,J$20,J$22,J$24,J$27,J$29,J$31,J$33,J$35,J$37,J$39,J$41,J$43,J$45,J$47,J$49,J$51,J$53,J$55,J$57,J$59,J$61,J$63,J$65,J$67,J$69,J$71,J$73,J$75,J$77,J$79,J$81,J$83,J$85,J$87,J$89,J$91,J$93,J$95,J$97,J$99,J$101,J$103,J$105,J$107,J$109,J$111,J$113,J$115,J$117,J$119,J$121,J$123,J$125)) -> 3 | K762: =RANK(K761,(K$6,K$8,K$10,K$12,K$14,K$16,K$18,K$20,K$22,K$24,K$27,K$29,K$31,K$33,K$35,K$37,K$39,K$41,K$43,K$45,K$47,K$49,K$51,K$53,K$55,K$57,K$59,K$61,K$63,K$65,K$67,K$69,K$71,K$73,K$75,K$77,K$79,K$81,K$83,K$85,K$87,K$89,K$91,K$93,K$95,K$97,K$99,K$101,K$103,K$105,K$107,K$109,K$111,K$113,K$115,K$117,K$119,K$121,K$123,K$125)) -> 4 | L762: =RANK(L761,(L$6,L$8,L$10,L$12,L$14,L$16,L$18,L$20,L$22,L$24,L$27,L$29,L$31,L$33,L$35,L$37,L$39,L$41,L$43,L$45,L$47,L$49,L$51,L$53,L$55,L$57,L$59,L$61,L$63,L$65,L$67,L$69,L$71,L$73,L$75,L$77,L$79,L$81,L$83,L$85,L$87,L$89,L$91,L$93,L$95,L$97,L$99,L$101,L$103,L$105,L$107,L$109,L$111,L$113,L$115,L$117,L$119,L$121,L$123,L$125)) -> 3 | M762: =RANK(M761,(M$6,M$8,M$10,M$12,M$14,M$16,M$18,M$20,M$22,M$24,M$27,M$29,M$31,M$33,M$35,M$37,M$39,M$41,M$43,M$45,M$47,M$49,M$51,M$53,M$55,M$57,M$59,M$61,M$63,M$65,M$67,M$69,M$71,M$73,M$75,M$77,M$79,M$81,M$83,M$85,M$87,M$89,M$91,M$93,M$95,M$97,M$99,M$101,M$103,M$105,M$107,M$109,M$111,M$113,M$115,M$117,M$119,M$121,M$123,M$125)) -> 4 | N762: =RANK(N761,(N$6,N$8,N$10,N$12,N$14,N$16,N$18,N$20,N$22,N$24,N$27,N$29,N$31,N$33,N$35,N$37,N$39,N$41,N$43,N$45,N$47,N$49,N$51,N$53,N$55,N$57,N$59,N$61,N$63,N$65,N$67,N$69,N$71,N$73,N$75,N$77,N$79,N$81,N$83,N$85,N$87,N$89,N$91,N$93,N$95,N$97,N$99,N$101,N$103,N$105,N$107,N$109,N$111,N$113,N$115,N$117,N$119,N$121,N$123,N$125)) -> 4 | P762: =RANK(P761,(P$6,P$8,P$10,P$12,P$14,P$16,P$18,P$20,P$22,P$24,P$27,P$29,P$31,P$33,P$35,P$37,P$39,P$41,P$43,P$45,P$47,P$49,P$51,P$53,P$55,P$57,P$59,P$61,P$63,P$65,P$67,P$69,P$71,P$73,P$75,P$77,P$79,P$81,P$83,P$85,P$87,P$89,P$91,P$93,P$95,P$97,P$99,P$101,P$103,P$105,P$107,P$109,P$111,P$113,P$115,P$117,P$119,P$121,P$123,P$125)) -> 4
A763: Madison | B763: 7 | C763: 16.70 | D763: 16.40 | E763: 33.10 | F763: 16.40 | G763: 16.30 | H763: 16.10 | I763: 24.40 | J763: 15.60 | K763: 16.10 | L763: 14.90 | M763: 23.30 | N763: 80.80 | O763: 0.0 | P763: 80.80
A764: Scouts | C764: =RANK(C763,(C$6,C$8,C$10,C$12,C$14,C$16,C$18,C$20,C$22,C$24,C$27,C$29,C$31,C$33,C$35,C$37,C$39,C$41,C$43,C$45,C$47,C$49,C$51,C$53,C$55,C$57,C$59,C$61,C$63,C$65,C$67,C$69,C$71,C$73,C$75,C$77,C$79,C$81,C$83,C$85,C$87,C$89,C$91,C$93,C$95,C$97,C$99,C$101,C$103,C$105,C$107,C$109,C$111,C$113,C$115,C$117,C$119,C$121,C$123,C$125)) -> 5 | D764: =RANK(D763,(D$6,D$8,D$10,D$12,D$14,D$16,D$18,D$20,D$22,D$24,D$27,D$29,D$31,D$33,D$35,D$37,D$39,D$41,D$43,D$45,D$47,D$49,D$51,D$53,D$55,D$57,D$59,D$61,D$63,D$65,D$67,D$69,D$71,D$73,D$75,D$77,D$79,D$81,D$83,D$85,D$87,D$89,D$91,D$93,D$95,D$97,D$99,D$101,D$103,D$105,D$107,D$109,D$111,D$113,D$115,D$117,D$119,D$121,D$123,D$125)) -> 5 | E764: =RANK(E763,(E$6,E$8,E$10,E$12,E$14,E$16,E$18,E$20,E$22,E$24,E$27,E$29,E$31,E$33,E$35,E$37,E$39,E$41,E$43,E$45,E$47,E$49,E$51,E$53,E$55,E$57,E$59,E$61,E$63,E$65,E$67,E$69,E$71,E$73,E$75,E$77,E$79,E$81,E$83,E$85,E$87,E$89,E$91,E$93,E$95,E$97,E$99,E$101,E$103,E$105,E$107,E$109,E$111,E$113,E$115,E$117,E$119,E$121,E$123,E$125)) -> 5 | F764: =RANK(F763,(F$6,F$8,F$10,F$12,F$14,F$16,F$18,F$20,F$22,F$24,F$27,F$29,F$31,F$33,F$35,F$37,F$39,F$41,F$43,F$45,F$47,F$49,F$51,F$53,F$55,F$57,F$59,F$61,F$63,F$65,F$67,F$69,F$71,F$73,F$75,F$77,F$79,F$81,F$83,F$85,F$87,F$89,F$91,F$93,F$95,F$97,F$99,F$101,F$103,F$105,F$107,F$109,F$111,F$113,F$115,F$117,F$119,F$121,F$123,F$125)) -> 6 | G764: =RANK(G763,(G$6,G$8,G$10,G$12,G$14,G$16,G$18,G$20,G$22,G$24,G$27,G$29,G$31,G$33,G$35,G$37,G$39,G$41,G$43,G$45,G$47,G$49,G$51,G$53,G$55,G$57,G$59,G$61,G$63,G$65,G$67,G$69,G$71,G$73,G$75,G$77,G$79,G$81,G$83,G$85,G$87,G$89,G$91,G$93,G$95,G$97,G$99,G$101,G$103,G$105,G$107,G$109,G$111,G$113,G$115,G$117,G$119,G$121,G$123,G$125)) -> 6 | H764: =RANK(H763,(H$6,H$8,H$10,H$12,H$14,H$16,H$18,H$20,H$22,H$24,H$27,H$29,H$31,H$33,H$35,H$37,H$39,H$41,H$43,H$45,H$47,H$49,H$51,H$53,H$55,H$57,H$59,H$61,H$63,H$65,H$67,H$69,H$71,H$73,H$75,H$77,H$79,H$81,H$83,H$85,H$87,H$89,H$91,H$93,H$95,H$97,H$99,H$101,H$103,H$105,H$107,H$109,H$111,H$113,H$115,H$117,H$119,H$121,H$123,H$125)) -> 6 | I764: =RANK(I763,(I$6,I$8,I$10,I$12,I$14,I$16,I$18,I$20,I$22,I$24,I$27,I$29,I$31,I$33,I$35,I$37,I$39,I$41,I$43,I$45,I$47,I$49,I$51,I$53,I$55,I$57,I$59,I$61,I$63,I$65,I$67,I$69,I$71,I$73,I$75,I$77,I$79,I$81,I$83,I$85,I$87,I$89,I$91,I$93,I$95,I$97,I$99,I$101,I$103,I$105,I$107,I$109,I$111,I$113,I$115,I$117,I$119,I$121,I$123,I$125)) -> 6 | J764: =RANK(J763,(J$6,J$8,J$10,J$12,J$14,J$16,J$18,J$20,J$22,J$24,J$27,J$29,J$31,J$33,J$35,J$37,J$39,J$41,J$43,J$45,J$47,J$49,J$51,J$53,J$55,J$57,J$59,J$61,J$63,J$65,J$67,J$69,J$71,J$73,J$75,J$77,J$79,J$81,J$83,J$85,J$87,J$89,J$91,J$93,J$95,J$97,J$99,J$101,J$103,J$105,J$107,J$109,J$111,J$113,J$115,J$117,J$119,J$121,J$123,J$125)) -> 5 | K764: =RANK(K763,(K$6,K$8,K$10,K$12,K$14,K$16,K$18,K$20,K$22,K$24,K$27,K$29,K$31,K$33,K$35,K$37,K$39,K$41,K$43,K$45,K$47,K$49,K$51,K$53,K$55,K$57,K$59,K$61,K$63,K$65,K$67,K$69,K$71,K$73,K$75,K$77,K$79,K$81,K$83,K$85,K$87,K$89,K$91,K$93,K$95,K$97,K$99,K$101,K$103,K$105,K$107,K$109,K$111,K$113,K$115,K$117,K$119,K$121,K$123,K$125)) -> 6 | L764: =RANK(L763,(L$6,L$8,L$10,L$12,L$14,L$16,L$18,L$20,L$22,L$24,L$27,L$29,L$31,L$33,L$35,L$37,L$39,L$41,L$43,L$45,L$47,L$49,L$51,L$53,L$55,L$57,L$59,L$61,L$63,L$65,L$67,L$69,L$71,L$73,L$75,L$77,L$79,L$81,L$83,L$85,L$87,L$89,L$91,L$93,L$95,L$97,L$99,L$101,L$103,L$105,L$107,L$109,L$111,L$113,L$115,L$117,L$119,L$121,L$123,L$125)) -> 9 | M764: =RANK(M763,(M$6,M$8,M$10,M$12,M$14,M$16,M$18,M$20,M$22,M$24,M$27,M$29,M$31,M$33,M$35,M$37,M$39,M$41,M$43,M$45,M$47,M$49,M$51,M$53,M$55,M$57,M$59,M$61,M$63,M$65,M$67,M$69,M$71,M$73,M$75,M$77,M$79,M$81,M$83,M$85,M$87,M$89,M$91,M$93,M$95,M$97,M$99,M$101,M$103,M$105,M$107,M$109,M$111,M$113,M$115,M$117,M$119,M$121,M$123,M$125)) -> 7 | N764: =RANK(N763,(N$6,N$8,N$10,N$12,N$14,N$16,N$18,N$20,N$22,N$24,N$27,N$29,N$31,N$33,N$35,N$37,N$39,N$41,N$43,N$45,N$47,N$49,N$51,N$53,N$55,N$57,N$59,N$61,N$63,N$65,N$67,N$69,N$71,N$73,N$75,N$77,N$79,N$81,N$83,N$85,N$87,N$89,N$91,N$93,N$95,N$97,N$99,N$101,N$103,N$105,N$107,N$109,N$111,N$113,N$115,N$117,N$119,N$121,N$123,N$125)) -> 5 | P764: =RANK(P763,(P$6,P$8,P$10,P$12,P$14,P$16,P$18,P$20,P$22,P$24,P$27,P$29,P$31,P$33,P$35,P$37,P$39,P$41,P$43,P$45,P$47,P$49,P$51,P$53,P$55,P$57,P$59,P$61,P$63,P$65,P$67,P$69,P$71,P$73,P$75,P$77,P$79,P$81,P$83,P$85,P$87,P$89,P$91,P$93,P$95,P$97,P$99,P$101,P$103,P$105,P$107,P$109,P$111,P$113,P$115,P$117,P$119,P$121,P$123,P$125)) -> 5
A765: Crossmen | B765: 5 | C765: 16.50 | D765: 16.10 | E765: 32.60 | F765: 16.70 | G765: 16.50 | H765: 16.30 | I765: 24.75 | J765: 15.40 | K765: 16.30 | L765: 15.20 | M765: 23.45 | N765: 80.80 | O765: 0.0 | P765: 80.80
C766: =RANK(C765,(C$6,C$8,C$10,C$12,C$14,C$16,C$18,C$20,C$22,C$24,C$27,C$29,C$31,C$33,C$35,C$37,C$39,C$41,C$43,C$45,C$47,C$49,C$51,C$53,C$55,C$57,C$59,C$61,C$63,C$65,C$67,C$69,C$71,C$73,C$75,C$77,C$79,C$81,C$83,C$85,C$87,C$89,C$91,C$93,C$95,C$97,C$99,C$101,C$103,C$105,C$107,C$109,C$111,C$113,C$115,C$117,C$119,C$121,C$123,C$125)) -> 6 | D766: =RANK(D765,(D$6,D$8,D$10,D$12,D$14,D$16,D$18,D$20,D$22,D$24,D$27,D$29,D$31,D$33,D$35,D$37,D$39,D$41,D$43,D$45,D$47,D$49,D$51,D$53,D$55,D$57,D$59,D$61,D$63,D$65,D$67,D$69,D$71,D$73,D$75,D$77,D$79,D$81,D$83,D$85,D$87,D$89,D$91,D$93,D$95,D$97,D$99,D$101,D$103,D$105,D$107,D$109,D$111,D$113,D$115,D$117,D$119,D$121,D$123,D$125)) -> 6 | E766: =RANK(E765,(E$6,E$8,E$10,E$12,E$14,E$16,E$18,E$20,E$22,E$24,E$27,E$29,E$31,E$33,E$35,E$37,E$39,E$41,E$43,E$45,E$47,E$49,E$51,E$53,E$55,E$57,E$59,E$61,E$63,E$65,E$67,E$69,E$71,E$73,E$75,E$77,E$79,E$81,E$83,E$85,E$87,E$89,E$91,E$93,E$95,E$97,E$99,E$101,E$103,E$105,E$107,E$109,E$111,E$113,E$115,E$117,E$119,E$121,E$123,E$125)) -> 6 | F766: =RANK(F765,(F$6,F$8,F$10,F$12,F$14,F$16,F$18,F$20,F$22,F$24,F$27,F$29,F$31,F$33,F$35,F$37,F$39,F$41,F$43,F$45,F$47,F$49,F$51,F$53,F$55,F$57,F$59,F$61,F$63,F$65,F$67,F$69,F$71,F$73,F$75,F$77,F$79,F$81,F$83,F$85,F$87,F$89,F$91,F$93,F$95,F$97,F$99,F$101,F$103,F$105,F$107,F$109,F$111,F$113,F$115,F$117,F$119,F$121,F$123,F$125)) -> 5 | G766: =RANK(G765,(G$6,G$8,G$10,G$12,G$14,G$16,G$18,G$20,G$22,G$24,G$27,G$29,G$31,G$33,G$35,G$37,G$39,G$41,G$43,G$45,G$47,G$49,G$51,G$53,G$55,G$57,G$59,G$61,G$63,G$65,G$67,G$69,G$71,G$73,G$75,G$77,G$79,G$81,G$83,G$85,G$87,G$89,G$91,G$93,G$95,G$97,G$99,G$101,G$103,G$105,G$107,G$109,G$111,G$113,G$115,G$117,G$119,G$121,G$123,G$125)) -> 5 | H766: =RANK(H765,(H$6,H$8,H$10,H$12,H$14,H$16,H$18,H$20,H$22,H$24,H$27,H$29,H$31,H$33,H$35,H$37,H$39,H$41,H$43,H$45,H$47,H$49,H$51,H$53,H$55,H$57,H$59,H$61,H$63,H$65,H$67,H$69,H$71,H$73,H$75,H$77,H$79,H$81,H$83,H$85,H$87,H$89,H$91,H$93,H$95,H$97,H$99,H$101,H$103,H$105,H$107,H$109,H$111,H$113,H$115,H$117,H$119,H$121,H$123,H$125)) -> 5 | I766: =RANK(I765,(I$6,I$8,I$10,I$12,I$14,I$16,I$18,I$20,I$22,I$24,I$27,I$29,I$31,I$33,I$35,I$37,I$39,I$41,I$43,I$45,I$47,I$49,I$51,I$53,I$55,I$57,I$59,I$61,I$63,I$65,I$67,I$69,I$71,I$73,I$75,I$77,I$79,I$81,I$83,I$85,I$87,I$89,I$91,I$93,I$95,I$97,I$99,I$101,I$103,I$105,I$107,I$109,I$111,I$113,I$115,I$117,I$119,I$121,I$123,I$125)) -> 5 | J766: =RANK(J765,(J$6,J$8,J$10,J$12,J$14,J$16,J$18,J$20,J$22,J$24,J$27,J$29,J$31,J$33,J$35,J$37,J$39,J$41,J$43,J$45,J$47,J$49,J$51,J$53,J$55,J$57,J$59,J$61,J$63,J$65,J$67,J$69,J$71,J$73,J$75,J$77,J$79,J$81,J$83,J$85,J$87,J$89,J$91,J$93,J$95,J$97,J$99,J$101,J$103,J$105,J$107,J$109,J$111,J$113,J$115,J$117,J$119,J$121,J$123,J$125)) -> 6 | K766: =RANK(K765,(K$6,K$8,K$10,K$12,K$14,K$16,K$18,K$20,K$22,K$24,K$27,K$29,K$31,K$33,K$35,K$37,K$39,K$41,K$43,K$45,K$47,K$49,K$51,K$53,K$55,K$57,K$59,K$61,K$63,K$65,K$67,K$69,K$71,K$73,K$75,K$77,K$79,K$81,K$83,K$85,K$87,K$89,K$91,K$93,K$95,K$97,K$99,K$101,K$103,K$105,K$107,K$109,K$111,K$113,K$115,K$117,K$119,K$121,K$123,K$125)) -> 5 | L766: =RANK(L765,(L$6,L$8,L$10,L$12,L$14,L$16,L$18,L$20,L$22,L$24,L$27,L$29,L$31,L$33,L$35,L$37,L$39,L$41,L$43,L$45,L$47,L$49,L$51,L$53,L$55,L$57,L$59,L$61,L$63,L$65,L$67,L$69,L$71,L$73,L$75,L$77,L$79,L$81,L$83,L$85,L$87,L$89,L$91,L$93,L$95,L$97,L$99,L$101,L$103,L$105,L$107,L$109,L$111,L$113,L$115,L$117,L$119,L$121,L$123,L$125)) -> 8 | M766: =RANK(M765,(M$6,M$8,M$10,M$12,M$14,M$16,M$18,M$20,M$22,M$24,M$27,M$29,M$31,M$33,M$35,M$37,M$39,M$41,M$43,M$45,M$47,M$49,M$51,M$53,M$55,M$57,M$59,M$61,M$63,M$65,M$67,M$69,M$71,M$73,M$75,M$77,M$79,M$81,M$83,M$85,M$87,M$89,M$91,M$93,M$95,M$97,M$99,M$101,M$103,M$105,M$107,M$109,M$111,M$113,M$115,M$117,M$119,M$121,M$123,M$125)) -> 6 | N766: =RANK(N765,(N$6,N$8,N$10,N$12,N$14,N$16,N$18,N$20,N$22,N$24,N$27,N$29,N$31,N$33,N$35,N$37,N$39,N$41,N$43,N$45,N$47,N$49,N$51,N$53,N$55,N$57,N$59,N$61,N$63,N$65,N$67,N$69,N$71,N$73,N$75,N$77,N$79,N$81,N$83,N$85,N$87,N$89,N$91,N$93,N$95,N$97,N$99,N$101,N$103,N$105,N$107,N$109,N$111,N$113,N$115,N$117,N$119,N$121,N$123,N$125)) -> 5 | P766: =RANK(P765,(P$6,P$8,P$10,P$12,P$14,P$16,P$18,P$20,P$22,P$24,P$27,P$29,P$31,P$33,P$35,P$37,P$39,P$41,P$43,P$45,P$47,P$49,P$51,P$53,P$55,P$57,P$59,P$61,P$63,P$65,P$67,P$69,P$71,P$73,P$75,P$77,P$79,P$81,P$83,P$85,P$87,P$89,P$91,P$93,P$95,P$97,P$99,P$101,P$103,P$105,P$107,P$109,P$111,P$113,P$115,P$117,P$119,P$121,P$123,P$125)) -> 5
A767: Pacific | B767: 4 | C767: 16.10 | D767: 15.80 | E767: 31.90 | F767: 15.30 | G767: 15.10 | H767: 15.60 | I767: 23.00 | J767: 15.20 | K767: 15.80 | L767: 16.00 | M767: 23.50 | N767: 78.40 | O767: 0.0 | P767: 78.40
A768: Crest | C768: =RANK(C767,(C$6,C$8,C$10,C$12,C$14,C$16,C$18,C$20,C$22,C$24,C$27,C$29,C$31,C$33,C$35,C$37,C$39,C$41,C$43,C$45,C$47,C$49,C$51,C$53,C$55,C$57,C$59,C$61,C$63,C$65,C$67,C$69,C$71,C$73,C$75,C$77,C$79,C$81,C$83,C$85,C$87,C$89,C$91,C$93,C$95,C$97,C$99,C$101,C$103,C$105,C$107,C$109,C$111,C$113,C$115,C$117,C$119,C$121,C$123,C$125)) -> 7 | D768: =RANK(D767,(D$6,D$8,D$10,D$12,D$14,D$16,D$18,D$20,D$22,D$24,D$27,D$29,D$31,D$33,D$35,D$37,D$39,D$41,D$43,D$45,D$47,D$49,D$51,D$53,D$55,D$57,D$59,D$61,D$63,D$65,D$67,D$69,D$71,D$73,D$75,D$77,D$79,D$81,D$83,D$85,D$87,D$89,D$91,D$93,D$95,D$97,D$99,D$101,D$103,D$105,D$107,D$109,D$111,D$113,D$115,D$117,D$119,D$121,D$123,D$125)) -> 7 | E768: =RANK(E767,(E$6,E$8,E$10,E$12,E$14,E$16,E$18,E$20,E$22,E$24,E$27,E$29,E$31,E$33,E$35,E$37,E$39,E$41,E$43,E$45,E$47,E$49,E$51,E$53,E$55,E$57,E$59,E$61,E$63,E$65,E$67,E$69,E$71,E$73,E$75,E$77,E$79,E$81,E$83,E$85,E$87,E$89,E$91,E$93,E$95,E$97,E$99,E$101,E$103,E$105,E$107,E$109,E$111,E$113,E$115,E$117,E$119,E$121,E$123,E$125)) -> 7 | F768: =RANK(F767,(F$6,F$8,F$10,F$12,F$14,F$16,F$18,F$20,F$22,F$24,F$27,F$29,F$31,F$33,F$35,F$37,F$39,F$41,F$43,F$45,F$47,F$49,F$51,F$53,F$55,F$57,F$59,F$61,F$63,F$65,F$67,F$69,F$71,F$73,F$75,F$77,F$79,F$81,F$83,F$85,F$87,F$89,F$91,F$93,F$95,F$97,F$99,F$101,F$103,F$105,F$107,F$109,F$111,F$113,F$115,F$117,F$119,F$121,F$123,F$125)) -> 7 | G768: =RANK(G767,(G$6,G$8,G$10,G$12,G$14,G$16,G$18,G$20,G$22,G$24,G$27,G$29,G$31,G$33,G$35,G$37,G$39,G$41,G$43,G$45,G$47,G$49,G$51,G$53,G$55,G$57,G$59,G$61,G$63,G$65,G$67,G$69,G$71,G$73,G$75,G$77,G$79,G$81,G$83,G$85,G$87,G$89,G$91,G$93,G$95,G$97,G$99,G$101,G$103,G$105,G$107,G$109,G$111,G$113,G$115,G$117,G$119,G$121,G$123,G$125)) -> 8 | H768: =RANK(H767,(H$6,H$8,H$10,H$12,H$14,H$16,H$18,H$20,H$22,H$24,H$27,H$29,H$31,H$33,H$35,H$37,H$39,H$41,H$43,H$45,H$47,H$49,H$51,H$53,H$55,H$57,H$59,H$61,H$63,H$65,H$67,H$69,H$71,H$73,H$75,H$77,H$79,H$81,H$83,H$85,H$87,H$89,H$91,H$93,H$95,H$97,H$99,H$101,H$103,H$105,H$107,H$109,H$111,H$113,H$115,H$117,H$119,H$121,H$123,H$125)) -> 7 | I768: =RANK(I767,(I$6,I$8,I$10,I$12,I$14,I$16,I$18,I$20,I$22,I$24,I$27,I$29,I$31,I$33,I$35,I$37,I$39,I$41,I$43,I$45,I$47,I$49,I$51,I$53,I$55,I$57,I$59,I$61,I$63,I$65,I$67,I$69,I$71,I$73,I$75,I$77,I$79,I$81,I$83,I$85,I$87,I$89,I$91,I$93,I$95,I$97,I$99,I$101,I$103,I$105,I$107,I$109,I$111,I$113,I$115,I$117,I$119,I$121,I$123,I$125)) -> 7 | J768: =RANK(J767,(J$6,J$8,J$10,J$12,J$14,J$16,J$18,J$20,J$22,J$24,J$27,J$29,J$31,J$33,J$35,J$37,J$39,J$41,J$43,J$45,J$47,J$49,J$51,J$53,J$55,J$57,J$59,J$61,J$63,J$65,J$67,J$69,J$71,J$73,J$75,J$77,J$79,J$81,J$83,J$85,J$87,J$89,J$91,J$93,J$95,J$97,J$99,J$101,J$103,J$105,J$107,J$109,J$111,J$113,J$115,J$117,J$119,J$121,J$123,J$125)) -> 7 | K768: =RANK(K767,(K$6,K$8,K$10,K$12,K$14,K$16,K$18,K$20,K$22,K$24,K$27,K$29,K$31,K$33,K$35,K$37,K$39,K$41,K$43,K$45,K$47,K$49,K$51,K$53,K$55,K$57,K$59,K$61,K$63,K$65,K$67,K$69,K$71,K$73,K$75,K$77,K$79,K$81,K$83,K$85,K$87,K$89,K$91,K$93,K$95,K$97,K$99,K$101,K$103,K$105,K$107,K$109,K$111,K$113,K$115,K$117,K$119,K$121,K$123,K$125)) -> 7 | L768: =RANK(L767,(L$6,L$8,L$10,L$12,L$14,L$16,L$18,L$20,L$22,L$24,L$27,L$29,L$31,L$33,L$35,L$37,L$39,L$41,L$43,L$45,L$47,L$49,L$51,L$53,L$55,L$57,L$59,L$61,L$63,L$65,L$67,L$69,L$71,L$73,L$75,L$77,L$79,L$81,L$83,L$85,L$87,L$89,L$91,L$93,L$95,L$97,L$99,L$101,L$103,L$105,L$107,L$109,L$111,L$113,L$115,L$117,L$119,L$121,L$123,L$125)) -> 5 | M768: =RANK(M767,(M$6,M$8,M$10,M$12,M$14,M$16,M$18,M$20,M$22,M$24,M$27,M$29,M$31,M$33,M$35,M$37,M$39,M$41,M$43,M$45,M$47,M$49,M$51,M$53,M$55,M$57,M$59,M$61,M$63,M$65,M$67,M$69,M$71,M$73,M$75,M$77,M$79,M$81,M$83,M$85,M$87,M$89,M$91,M$93,M$95,M$97,M$99,M$101,M$103,M$105,M$107,M$109,M$111,M$113,M$115,M$117,M$119,M$121,M$123,M$125)) -> 5 | N768: =RANK(N767,(N$6,N$8,N$10,N$12,N$14,N$16,N$18,N$20,N$22,N$24,N$27,N$29,N$31,N$33,N$35,N$37,N$39,N$41,N$43,N$45,N$47,N$49,N$51,N$53,N$55,N$57,N$59,N$61,N$63,N$65,N$67,N$69,N$71,N$73,N$75,N$77,N$79,N$81,N$83,N$85,N$87,N$89,N$91,N$93,N$95,N$97,N$99,N$101,N$103,N$105,N$107,N$109,N$111,N$113,N$115,N$117,N$119,N$121,N$123,N$125)) -> 7 | P768: =RANK(P767,(P$6,P$8,P$10,P$12,P$14,P$16,P$18,P$20,P$22,P$24,P$27,P$29,P$31,P$33,P$35,P$37,P$39,P$41,P$43,P$45,P$47,P$49,P$51,P$53,P$55,P$57,P$59,P$61,P$63,P$65,P$67,P$69,P$71,P$73,P$75,P$77,P$79,P$81,P$83,P$85,P$87,P$89,P$91,P$93,P$95,P$97,P$99,P$101,P$103,P$105,P$107,P$109,P$111,P$113,P$115,P$117,P$119,P$121,P$123,P$125)) -> 7
A769: Music | B769: 3 | C769: 15.90 | D769: 15.30 | E769: 31.20 | F769: 15.10 | G769: 14.80 | H769: 14.50 | I769: 22.20 | J769: 14.70 | K769: 14.80 | L769: 15.30 | M769: 22.40 | N769: 75.80 | O769: 0.0 | P769: 75.80
A770: City | C770: =RANK(C769,(C$6,C$8,C$10,C$12,C$14,C$16,C$18,C$20,C$22,C$24,C$27,C$29,C$31,C$33,C$35,C$37,C$39,C$41,C$43,C$45,C$47,C$49,C$51,C$53,C$55,C$57,C$59,C$61,C$63,C$65,C$67,C$69,C$71,C$73,C$75,C$77,C$79,C$81,C$83,C$85,C$87,C$89,C$91,C$93,C$95,C$97,C$99,C$101,C$103,C$105,C$107,C$109,C$111,C$113,C$115,C$117,C$119,C$121,C$123,C$125)) -> 8 | D770: =RANK(D769,(D$6,D$8,D$10,D$12,D$14,D$16,D$18,D$20,D$22,D$24,D$27,D$29,D$31,D$33,D$35,D$37,D$39,D$41,D$43,D$45,D$47,D$49,D$51,D$53,D$55,D$57,D$59,D$61,D$63,D$65,D$67,D$69,D$71,D$73,D$75,D$77,D$79,D$81,D$83,D$85,D$87,D$89,D$91,D$93,D$95,D$97,D$99,D$101,D$103,D$105,D$107,D$109,D$111,D$113,D$115,D$117,D$119,D$121,D$123,D$125)) -> 8 | E770: =RANK(E769,(E$6,E$8,E$10,E$12,E$14,E$16,E$18,E$20,E$22,E$24,E$27,E$29,E$31,E$33,E$35,E$37,E$39,E$41,E$43,E$45,E$47,E$49,E$51,E$53,E$55,E$57,E$59,E$61,E$63,E$65,E$67,E$69,E$71,E$73,E$75,E$77,E$79,E$81,E$83,E$85,E$87,E$89,E$91,E$93,E$95,E$97,E$99,E$101,E$103,E$105,E$107,E$109,E$111,E$113,E$115,E$117,E$119,E$121,E$123,E$125)) -> 8 | F770: =RANK(F769,(F$6,F$8,F$10,F$12,F$14,F$16,F$18,F$20,F$22,F$24,F$27,F$29,F$31,F$33,F$35,F$37,F$39,F$41,F$43,F$45,F$47,F$49,F$51,F$53,F$55,F$57,F$59,F$61,F$63,F$65,F$67,F$69,F$71,F$73,F$75,F$77,F$79,F$81,F$83,F$85,F$87,F$89,F$91,F$93,F$95,F$97,F$99,F$101,F$103,F$105,F$107,F$109,F$111,F$113,F$115,F$117,F$119,F$121,F$123,F$125)) -> 8 | G770: =RANK(G769,(G$6,G$8,G$10,G$12,G$14,G$16,G$18,G$20,G$22,G$24,G$27,G$29,G$31,G$33,G$35,G$37,G$39,G$41,G$43,G$45,G$47,G$49,G$51,G$53,G$55,G$57,G$59,G$61,G$63,G$65,G$67,G$69,G$71,G$73,G$75,G$77,G$79,G$81,G$83,G$85,G$87,G$89,G$91,G$93,G$95,G$97,G$99,G$101,G$103,G$105,G$107,G$109,G$111,G$113,G$115,G$117,G$119,G$121,G$123,G$125)) -> 9 | H770: =RANK(H769,(H$6,H$8,H$10,H$12,H$14,H$16,H$18,H$20,H$22,H$24,H$27,H$29,H$31,H$33,H$35,H$37,H$39,H$41,H$43,H$45,H$47,H$49,H$51,H$53,H$55,H$57,H$59,H$61,H$63,H$65,H$67,H$69,H$71,H$73,H$75,H$77,H$79,H$81,H$83,H$85,H$87,H$89,H$91,H$93,H$95,H$97,H$99,H$101,H$103,H$105,H$107,H$109,H$111,H$113,H$115,H$117,H$119,H$121,H$123,H$125)) -> 9 | I770: =RANK(I769,(I$6,I$8,I$10,I$12,I$14,I$16,I$18,I$20,I$22,I$24,I$27,I$29,I$31,I$33,I$35,I$37,I$39,I$41,I$43,I$45,I$47,I$49,I$51,I$53,I$55,I$57,I$59,I$61,I$63,I$65,I$67,I$69,I$71,I$73,I$75,I$77,I$79,I$81,I$83,I$85,I$87,I$89,I$91,I$93,I$95,I$97,I$99,I$101,I$103,I$105,I$107,I$109,I$111,I$113,I$115,I$117,I$119,I$121,I$123,I$125)) -> 9 | J770: =RANK(J769,(J$6,J$8,J$10,J$12,J$14,J$16,J$18,J$20,J$22,J$24,J$27,J$29,J$31,J$33,J$35,J$37,J$39,J$41,J$43,J$45,J$47,J$49,J$51,J$53,J$55,J$57,J$59,J$61,J$63,J$65,J$67,J$69,J$71,J$73,J$75,J$77,J$79,J$81,J$83,J$85,J$87,J$89,J$91,J$93,J$95,J$97,J$99,J$101,J$103,J$105,J$107,J$109,J$111,J$113,J$115,J$117,J$119,J$121,J$123,J$125)) -> 9 | K770: =RANK(K769,(K$6,K$8,K$10,K$12,K$14,K$16,K$18,K$20,K$22,K$24,K$27,K$29,K$31,K$33,K$35,K$37,K$39,K$41,K$43,K$45,K$47,K$49,K$51,K$53,K$55,K$57,K$59,K$61,K$63,K$65,K$67,K$69,K$71,K$73,K$75,K$77,K$79,K$81,K$83,K$85,K$87,K$89,K$91,K$93,K$95,K$97,K$99,K$101,K$103,K$105,K$107,K$109,K$111,K$113,K$115,K$117,K$119,K$121,K$123,K$125)) -> 9 | L770: =RANK(L769,(L$6,L$8,L$10,L$12,L$14,L$16,L$18,L$20,L$22,L$24,L$27,L$29,L$31,L$33,L$35,L$37,L$39,L$41,L$43,L$45,L$47,L$49,L$51,L$53,L$55,L$57,L$59,L$61,L$63,L$65,L$67,L$69,L$71,L$73,L$75,L$77,L$79,L$81,L$83,L$85,L$87,L$89,L$91,L$93,L$95,L$97,L$99,L$101,L$103,L$105,L$107,L$109,L$111,L$113,L$115,L$117,L$119,L$121,L$123,L$125)) -> 7 | M770: =RANK(M769,(M$6,M$8,M$10,M$12,M$14,M$16,M$18,M$20,M$22,M$24,M$27,M$29,M$31,M$33,M$35,M$37,M$39,M$41,M$43,M$45,M$47,M$49,M$51,M$53,M$55,M$57,M$59,M$61,M$63,M$65,M$67,M$69,M$71,M$73,M$75,M$77,M$79,M$81,M$83,M$85,M$87,M$89,M$91,M$93,M$95,M$97,M$99,M$101,M$103,M$105,M$107,M$109,M$111,M$113,M$115,M$117,M$119,M$121,M$123,M$125)) -> 9 | N770: =RANK(N769,(N$6,N$8,N$10,N$12,N$14,N$16,N$18,N$20,N$22,N$24,N$27,N$29,N$31,N$33,N$35,N$37,N$39,N$41,N$43,N$45,N$47,N$49,N$51,N$53,N$55,N$57,N$59,N$61,N$63,N$65,N$67,N$69,N$71,N$73,N$75,N$77,N$79,N$81,N$83,N$85,N$87,N$89,N$91,N$93,N$95,N$97,N$99,N$101,N$103,N$105,N$107,N$109,N$111,N$113,N$115,N$117,N$119,N$121,N$123,N$125)) -> 8 | P770: =RANK(P769,(P$6,P$8,P$10,P$12,P$14,P$16,P$18,P$20,P$22,P$24,P$27,P$29,P$31,P$33,P$35,P$37,P$39,P$41,P$43,P$45,P$47,P$49,P$51,P$53,P$55,P$57,P$59,P$61,P$63,P$65,P$67,P$69,P$71,P$73,P$75,P$77,P$79,P$81,P$83,P$85,P$87,P$89,P$91,P$93,P$95,P$97,P$99,P$101,P$103,P$105,P$107,P$109,P$111,P$113,P$115,P$117,P$119,P$121,P$123,P$125)) -> 8
A771: Academy | B771: 2 | C771: 15.40 | D771: 14.90 | E771: 30.30 | F771: 15.00 | G771: 15.30 | H771: 14.80 | I771: 22.55 | J771: 15.00 | K771: 15.10 | L771: 15.80 | M771: 22.95 | N771: 75.80 | O771: 0.0 | P771: 75.80
C772: =RANK(C771,(C$6,C$8,C$10,C$12,C$14,C$16,C$18,C$20,C$22,C$24,C$27,C$29,C$31,C$33,C$35,C$37,C$39,C$41,C$43,C$45,C$47,C$49,C$51,C$53,C$55,C$57,C$59,C$61,C$63,C$65,C$67,C$69,C$71,C$73,C$75,C$77,C$79,C$81,C$83,C$85,C$87,C$89,C$91,C$93,C$95,C$97,C$99,C$101,C$103,C$105,C$107,C$109,C$111,C$113,C$115,C$117,C$119,C$121,C$123,C$125)) -> 9 | D772: =RANK(D771,(D$6,D$8,D$10,D$12,D$14,D$16,D$18,D$20,D$22,D$24,D$27,D$29,D$31,D$33,D$35,D$37,D$39,D$41,D$43,D$45,D$47,D$49,D$51,D$53,D$55,D$57,D$59,D$61,D$63,D$65,D$67,D$69,D$71,D$73,D$75,D$77,D$79,D$81,D$83,D$85,D$87,D$89,D$91,D$93,D$95,D$97,D$99,D$101,D$103,D$105,D$107,D$109,D$111,D$113,D$115,D$117,D$119,D$121,D$123,D$125)) -> 9 | E772: =RANK(E771,(E$6,E$8,E$10,E$12,E$14,E$16,E$18,E$20,E$22,E$24,E$27,E$29,E$31,E$33,E$35,E$37,E$39,E$41,E$43,E$45,E$47,E$49,E$51,E$53,E$55,E$57,E$59,E$61,E$63,E$65,E$67,E$69,E$71,E$73,E$75,E$77,E$79,E$81,E$83,E$85,E$87,E$89,E$91,E$93,E$95,E$97,E$99,E$101,E$103,E$105,E$107,E$109,E$111,E$113,E$115,E$117,E$119,E$121,E$123,E$125)) -> 9 | F772: =RANK(F771,(F$6,F$8,F$10,F$12,F$14,F$16,F$18,F$20,F$22,F$24,F$27,F$29,F$31,F$33,F$35,F$37,F$39,F$41,F$43,F$45,F$47,F$49,F$51,F$53,F$55,F$57,F$59,F$61,F$63,F$65,F$67,F$69,F$71,F$73,F$75,F$77,F$79,F$81,F$83,F$85,F$87,F$89,F$91,F$93,F$95,F$97,F$99,F$101,F$103,F$105,F$107,F$109,F$111,F$113,F$115,F$117,F$119,F$121,F$123,F$125)) -> 9 | G772: =RANK(G771,(G$6,G$8,G$10,G$12,G$14,G$16,G$18,G$20,G$22,G$24,G$27,G$29,G$31,G$33,G$35,G$37,G$39,G$41,G$43,G$45,G$47,G$49,G$51,G$53,G$55,G$57,G$59,G$61,G$63,G$65,G$67,G$69,G$71,G$73,G$75,G$77,G$79,G$81,G$83,G$85,G$87,G$89,G$91,G$93,G$95,G$97,G$99,G$101,G$103,G$105,G$107,G$109,G$111,G$113,G$115,G$117,G$119,G$121,G$123,G$125)) -> 7 | H772: =RANK(H771,(H$6,H$8,H$10,H$12,H$14,H$16,H$18,H$20,H$22,H$24,H$27,H$29,H$31,H$33,H$35,H$37,H$39,H$41,H$43,H$45,H$47,H$49,H$51,H$53,H$55,H$57,H$59,H$61,H$63,H$65,H$67,H$69,H$71,H$73,H$75,H$77,H$79,H$81,H$83,H$85,H$87,H$89,H$91,H$93,H$95,H$97,H$99,H$101,H$103,H$105,H$107,H$109,H$111,H$113,H$115,H$117,H$119,H$121,H$123,H$125)) -> 8 | I772: =RANK(I771,(I$6,I$8,I$10,I$12,I$14,I$16,I$18,I$20,I$22,I$24,I$27,I$29,I$31,I$33,I$35,I$37,I$39,I$41,I$43,I$45,I$47,I$49,I$51,I$53,I$55,I$57,I$59,I$61,I$63,I$65,I$67,I$69,I$71,I$73,I$75,I$77,I$79,I$81,I$83,I$85,I$87,I$89,I$91,I$93,I$95,I$97,I$99,I$101,I$103,I$105,I$107,I$109,I$111,I$113,I$115,I$117,I$119,I$121,I$123,I$125)) -> 8 | J772: =RANK(J771,(J$6,J$8,J$10,J$12,J$14,J$16,J$18,J$20,J$22,J$24,J$27,J$29,J$31,J$33,J$35,J$37,J$39,J$41,J$43,J$45,J$47,J$49,J$51,J$53,J$55,J$57,J$59,J$61,J$63,J$65,J$67,J$69,J$71,J$73,J$75,J$77,J$79,J$81,J$83,J$85,J$87,J$89,J$91,J$93,J$95,J$97,J$99,J$101,J$103,J$105,J$107,J$109,J$111,J$113,J$115,J$117,J$119,J$121,J$123,J$125)) -> 8 | K772: =RANK(K771,(K$6,K$8,K$10,K$12,K$14,K$16,K$18,K$20,K$22,K$24,K$27,K$29,K$31,K$33,K$35,K$37,K$39,K$41,K$43,K$45,K$47,K$49,K$51,K$53,K$55,K$57,K$59,K$61,K$63,K$65,K$67,K$69,K$71,K$73,K$75,K$77,K$79,K$81,K$83,K$85,K$87,K$89,K$91,K$93,K$95,K$97,K$99,K$101,K$103,K$105,K$107,K$109,K$111,K$113,K$115,K$117,K$119,K$121,K$123,K$125)) -> 8 | L772: =RANK(L771,(L$6,L$8,L$10,L$12,L$14,L$16,L$18,L$20,L$22,L$24,L$27,L$29,L$31,L$33,L$35,L$37,L$39,L$41,L$43,L$45,L$47,L$49,L$51,L$53,L$55,L$57,L$59,L$61,L$63,L$65,L$67,L$69,L$71,L$73,L$75,L$77,L$79,L$81,L$83,L$85,L$87,L$89,L$91,L$93,L$95,L$97,L$99,L$101,L$103,L$105,L$107,L$109,L$111,L$113,L$115,L$117,L$119,L$121,L$123,L$125)) -> 6 | M772: =RANK(M771,(M$6,M$8,M$10,M$12,M$14,M$16,M$18,M$20,M$22,M$24,M$27,M$29,M$31,M$33,M$35,M$37,M$39,M$41,M$43,M$45,M$47,M$49,M$51,M$53,M$55,M$57,M$59,M$61,M$63,M$65,M$67,M$69,M$71,M$73,M$75,M$77,M$79,M$81,M$83,M$85,M$87,M$89,M$91,M$93,M$95,M$97,M$99,M$101,M$103,M$105,M$107,M$109,M$111,M$113,M$115,M$117,M$119,M$121,M$123,M$125)) -> 8 | N772: =RANK(N771,(N$6,N$8,N$10,N$12,N$14,N$16,N$18,N$20,N$22,N$24,N$27,N$29,N$31,N$33,N$35,N$37,N$39,N$41,N$43,N$45,N$47,N$49,N$51,N$53,N$55,N$57,N$59,N$61,N$63,N$65,N$67,N$69,N$71,N$73,N$75,N$77,N$79,N$81,N$83,N$85,N$87,N$89,N$91,N$93,N$95,N$97,N$99,N$101,N$103,N$105,N$107,N$109,N$111,N$113,N$115,N$117,N$119,N$121,N$123,N$125)) -> 8 | P772: =RANK(P771,(P$6,P$8,P$10,P$12,P$14,P$16,P$18,P$20,P$22,P$24,P$27,P$29,P$31,P$33,P$35,P$37,P$39,P$41,P$43,P$45,P$47,P$49,P$51,P$53,P$55,P$57,P$59,P$61,P$63,P$65,P$67,P$69,P$71,P$73,P$75,P$77,P$79,P$81,P$83,P$85,P$87,P$89,P$91,P$93,P$95,P$97,P$99,P$101,P$103,P$105,P$107,P$109,P$111,P$113,P$115,P$117,P$119,P$121,P$123,P$125)) -> 8
A773: Jersey | B773: 1 | C773: 14.50 | D773: 14.00 | E773: 28.50 | F773: 13.80 | G773: 13.80 | H773: 14.30 | I773: 20.95 | J773: 13.20 | K773: 13.40 | L773: 12.60 | M773: 19.60 | N773: 69.05 | O773: 0.0 | P773: 69.05
A774: Surf | C774: 10 | D774: 10 | E774: 10 | F774: 10 | G774: 10 | H774: 10 | I774: 10 | J774: 10 | K774: 10 | L774: 10 | M774: 10 | N774: 10 | P774: 10
A775: DCI Open Class
A776: Guardians | B776: 1 | C776: 13.50 | D776: 12.50 | E776: 26.00 | F776: 13.30 | G776: 12.70 | H776: 13.50 | I776: 19.75 | J776: 12.20 | K776: 12.40 | L776: 12.90 | M776: 18.75 | N776: 64.50 | O776: 0.0 | P776: 64.50
C777: 1 | D777: 1 | E777: 1 | F777: 1 | G777: 1 | H777: 1 | I777: 1 | J777: 1 | K777: 1 | L777: 1 | M777: 1 | N777: 1 | P777: 1
A780: 7/23/2024 Syracuse, New York
C781: General Effect | F781: Visual | J781: Music
C782: 1 | D782: 2 | F782: Proficiency | G782: Analysis | H782: Color Guard | J782: Brass | K782: Analysis | L782: Percussion | N782: Sub | P782: Total
C783: J. Campbell | D783: S. Halquist | E783: Total | F783: No Judge | G783: B. Kuhn | H783: S. Clark | I783: Total ÷2 | J783: B. Fabrizio | K783: D. Orser | L783: M. Leitzke | M783: Total ÷2 | N783: Total | O783: Pen | P783: Score
A784: DCI Open Class | C784: 20 | D784: 20 | E784: 40 | F784: 20 | G784: 20 | H784: 20 | I784: 30 | J784: 20 | K784: 20 | L784: 20 | M784: 30 | N784: 100 | P784: 100
A785: Spartans | B785: 4 | C785: 15.70 | D785: 16.10 | E785: 31.80 | F785: 15.60 | G785: 15.60 | H785: 15.80 | I785: 23.50 | J785: 15.30 | K785: 16.00 | L785: 13.90 | M785: 22.60 | N785: 77.90 | O785: 0.0 | P785: 77.90
C786: 1 | D786: 1 | E786: 1 | F786: 1 | G786: 1 | H786: 1 | I786: 1 | J786: 1 | K786: 1 | L786: 1 | M786: 1 | N786: 1 | P786: 1
A787: Battalion | B787: 3 | C787: 15.00 | D787: 15.60 | E787: 30.60 | F787: 15.00 | G787: 15.00 | H787: 15.00 | I787: 22.50 | J787: 13.90 | K787: 15.10 | L787: 13.00 | M787: 21.00 | N787: 74.10 | O787: 0.0 | P787: 74.10
C788: 2 | D788: 2 | E788: 2 | F788: 2 | G788: 2 | H788: 2 | I788: 2 | J788: 2 | K788: 2 | L788: 2 | M788: 2 | N788: 2 | P788: 2
A789: 7th | B789: 2 | C789: 12.90 | D789: 12.40 | E789: 25.30 | F789: 13.60 | G789: 13.60 | H789: 13.40 | I789: 20.30 | J789: 12.00 | K789: 12.70 | L789: 12.10 | M789: 18.40 | N789: 64.00 | O789: 0.0 | P789: 64.00
A790: Regiment | C790: 3 | D790: 3 | E790: 3 | F790: 3 | G790: 3 | H790: 3 | I790: 3 | J790: 3 | K790: 3 | L790: 3 | M790: 3 | N790: 3 | P790: 3
A791: Les | B791: 1 | C791: 11.80 | D791: 11.40 | E791: 23.20 | F791: 12.20 | G791: 12.20 | H791: 12.30 | I791: 18.35 | J791: 11.50 | K791: 11.50 | L791: 11.00 | M791: 17.00 | N791: 58.55 | O791: 0.0 | P791: 58.55
A792: Stentors | C792: 4 | D792: 4 | E792: 4 | F792: 4 | G792: 4 | H792: 4 | I792: 4 | J792: 4 | K792: 4 | L792: 4 | M792: 4 | N792: 4 | P792: 4
A793: DCI All Age Open Class
A794: White | B794: 1 | C794: 15.90 | D794: 15.50 | E794: 31.40 | F794: 15.90 | G794: 15.90 | H794: 15.40 | I794: 23.60 | J794: 15.50 | K794: 16.20 | L794: 14.30 | M794: 23.00 | N794: 78.00 | O794: 0.0 | P794: 78.00
A795: Sabers | C795: 1 | D795: 1 | E795: 1 | F795: 1 | G795: 1 | H795: 1 | I795: 1 | J795: 1 | K795: 1 | L795: 1 | M795: 1 | N795: 1 | P795: 1
A798: 7/23/2024 McKinney, Texas
C799: General Effect | F799: Visual | J799: Music
C800: 1 | D800: 2 | F800: Proficiency | G800: Analysis | H800: Color Guard | J800: Brass | K800: Analysis | L800: Percussion | N800: Sub | P800: Total
C801: T. Ochran | D801: G. Miller | E801: Total | F801: K. Lejeune | G801: C. Raichle | H801: D. Henderson | I801: Total ÷2 | J801: S. Page | K801: C. Romanowski | L801: J. Wilson | M801: Total ÷2 | N801: Total | O801: Pen | P801: Score
A802: DCI World Class | C802: 20 | D802: 20 | E802: 40 | F802: 20 | G802: 20 | H802: 20 | I802: 30 | J802: 20 | K802: 20 | L802: 20 | M802: 30 | N802: 100 | P802: 100
A803: Vanguard | B803: 8 | C803: 18.30 | D803: 17.60 | E803: 35.90 | F803: 17.70 | G803: 17.40 | H803: 17.90 | I803: 26.50 | J803: 16.70 | K803: 18.40 | L803: 18.90 | M803: 27.00 | N803: 89.40 | O803: 0.0 | P803: 89.40
C804: 1 | D804: 2 | E804: 1 | F804: 2 | G804: 2 | H804: 1 | I804: 2 | J804: 2 | K804: 1 | L804: 1 | M804: 1 | N804: 1 | P804: 1
A805: Mandarins | B805: 7 | C805: 18.00 | D805: 17.90 | E805: 35.90 | F805: 18.40 | G805: 17.80 | H805: 17.70 | I805: 26.95 | J805: 16.80 | K805: 17.80 | L805: 17.70 | M805: 26.15 | N805: 89.00 | O805: 0.0 | P805: 89.00
C806: 2 | D806: 1 | E806: 1 | F806: 1 | G806: 1 | H806: 2 | I806: 1 | J806: 1 | K806: 2 | L806: 2 | M806: 2 | N806: 2 | P806: 2
A807: Blue | B807: 6 | C807: 17.60 | D807: 17.20 | E807: 34.80 | F807: 17.30 | G807: 16.70 | H807: 17.50 | I807: 25.75 | J807: 16.50 | K807: 17.40 | L807: 16.70 | M807: 25.30 | N807: 85.85 | O807: 0.0 | P807: 85.85
A808: Stars | C808: 3 | D808: 3 | E808: 3 | F808: 3 | G808: 3 | H808: 3 | I808: 3 | J808: 3 | K808: 3 | L808: 5 | M808: 3 | N808: 3 | P808: 3
A809: Troopers | B809: 5 | C809: 16.50 | D809: 16.80 | E809: 33.30 | F809: 16.20 | G809: 16.00 | H809: 16.20 | I809: 24.20 | J809: 16.00 | K809: 16.90 | L809: 17.20 | M809: 25.05 | N809: 82.55 | O809: 0.0 | P809: 82.55
C810: 5 | D810: 4 | E810: 4 | F810: 5 | G810: 4 | H810: 5 | I810: 4 | J810: 4 | K810: 4 | L810: 3 | M810: 4 | N810: 4 | P810: 4
A811: Blue | B811: 4 | C811: 16.70 | D811: 16.20 | E811: 32.90 | F811: 16.50 | G811: 15.60 | H811: 16.30 | I811: 24.20 | J811: 15.50 | K811: 16.00 | L811: 16.90 | M811: 24.20 | N811: 81.30 | O811: 0.0 | P811: 81.30
A812: Knights | C812: 4 | D812: 5 | E812: 5 | F812: 4 | G812: 5 | H812: 4 | I812: 4 | J812: 5 | K812: 5 | L812: 4 | M812: 5 | N812: 5 | P812: 5
A813: Seattle | B813: 3 | C813: 14.00 | D813: 14.40 | E813: 28.40 | F813: 14.70 | G813: 14.00 | H813: 14.10 | I813: 21.40 | J813: 13.10 | K813: 12.90 | L813: 14.80 | M813: 20.40 | N813: 70.20 | O813: 0.0 | P813: 70.20
A814: Cascades | C814: 7 | D814: 6 | E814: 6 | F814: 6 | G814: 7 | H814: 6 | I814: 6 | J814: 8 | K814: 8 | L814: 6 | M814: 7 | N814: 6 | P814: 6
A815: Genesis | B815: 1 | C815: 14.20 | D815: 13.80 | E815: 28.00 | F815: 13.80 | G815: 14.20 | H815: 13.70 | I815: 20.85 | J815: 14.20 | K815: 13.60 | L815: 14.70 | M815: 21.25 | N815: 70.10 | O815: 0.0 | P815: 70.10
C816: 6 | D816: 8 | E816: 7 | F816: 8 | G816: 6 | H816: 8 | I816: 8 | J816: 6 | K816: 6 | L816: 7 | M816: 6 | N816: 7 | P816: 7
A817: Jersey | B817: 2 | C817: 13.80 | D817: 14.20 | E817: 28.00 | F817: 14.30 | G817: 13.80 | H817: 13.90 | I817: 21.00 | J817: 13.60 | K817: 13.20 | L817: 13.20 | M817: 20.00 | N817: 69.00 | O817: 0.0 | P817: 69.00
A818: Surf | C818: 8 | D818: 7 | E818: 7 | F818: 7 | G818: 8 | H818: 7 | I818: 7 | J818: 7 | K818: 7 | L818: 8 | M818: 8 | N818: 8 | P818: 8
A821: 7/24/2024 Monroe, Louisiana
C822: General Effect | F822: Visual | J822: Music
C823: 1 | D823: 2 | F823: Proficiency | G823: Analysis | H823: Color Guard | J823: Brass | K823: Analysis | L823: Percussion | N823: Sub | P823: Total
C824: K. Lejeune | D824: G. Miller | E824: Total | F824: C. Raichle | G824: T. Ochran | H824: D. Henderson | I824: Total ÷2 | J824: M. Brown | K824: J. Denton | L824: C. Romanowski | M824: Total ÷2 | N824: Total | O824: Pen | P824: Score
A825: DCI World Class | C825: 20 | D825: 20 | E825: 40 | F825: 20 | G825: 20 | H825: 20 | I825: 30 | J825: 20 | K825: 20 | L825: 20 | M825: 30 | N825: 100 | P825: 100
A826: Vanguard | B826: 7 | C826: 18.20 | D826: 17.70 | E826: 35.90 | F826: 18.00 | G826: 17.90 | H826: 18.10 | I826: 27.00 | J826: 17.05 | K826: 18.10 | L826: 18.70 | M826: 26.925000000000001 | N826: 89.825000000000003 | O826: 0.0 | P826: 89.825000000000003
C827: 1 | D827: 1 | E827: 1 | F827: 1 | G827: 1 | H827: 1 | I827: 1 | J827: 2 | K827: 1 | L827: 1 | M827: 1 | N827: 1 | P827: 1
A828: Blue | B828: 5 | C828: 17.80 | D828: 17.40 | E828: 35.20 | F828: 17.20 | G828: 17.30 | H828: 17.80 | I828: 26.15 | J828: 17.20 | K828: 17.60 | L828: 17.40 | M828: 26.100 | N828: 87.450 | O828: 0.0 | P828: 87.450
A829: Stars | C829: 2 | D829: 2 | E829: 2 | F829: 3 | G829: 3 | H829: 2 | I829: 2 | J829: 1 | K829: 2 | L829: 3 | M829: 2 | N829: 2 | P829: 2
A830: Cavaliers | B830: 6 | C830: 17.60 | D830: 17.00 | E830: 34.60 | F830: 17.60 | G830: 17.50 | H830: 17.20 | I830: 26.15 | J830: 16.20 | K830: 17.50 | L830: 18.10 | M830: 25.900 | N830: 86.650 | O830: 0.0 | P830: 86.650
C831: 3 | D831: 3 | E831: 3 | F831: 2 | G831: 2 | H831: 3 | I831: 2 | J831: 5 | K831: 3 | L831: 2 | M831: 3 | N831: 3 | P831: 3
A832: Troopers | B832: 4 | C832: 16.80 | D832: 16.60 | E832: 33.40 | F832: 16.60 | G832: 17.00 | H832: 16.30 | I832: 24.95 | J832: 16.80 | K832: 17.20 | L832: 17.30 | M832: 25.650 | N832: 84.000 | O832: 0.0 | P832: 84.000
C833: 4 | D833: 4 | E833: 4 | F833: 4 | G833: 4 | H833: 5 | I833: 4 | J833: 3 | K833: 4 | L833: 4 | M833: 4 | N833: 4 | P833: 4
A834: Blue | B834: 3 | C834: 16.70 | D834: 16.50 | E834: 33.20 | F834: 16.50 | G834: 16.50 | H834: 16.40 | I834: 24.70 | J834: 16.40 | K834: 16.30 | L834: 15.60 | M834: 24.150 | N834: 82.050 | O834: 0.0 | P834: 82.050
A835: Knights | C835: 5 | D835: 5 | E835: 5 | F835: 5 | G835: 5 | H835: 4 | I835: 5 | J835: 4 | K835: 5 | L835: 5 | M835: 5 | N835: 5 | P835: 5
A836: Genesis | B836: 2 | C836: 14.60 | D836: 14.40 | E836: 29.00 | F836: 14.10 | G836: 14.40 | H836: 14.00 | I836: 21.25 | J836: 14.50 | K836: 14.10 | L836: 14.30 | M836: 21.450 | N836: 71.700 | O836: 0.0 | P836: 71.700
C837: 6 | D837: 6 | E837: 6 | F837: 7 | G837: 6 | H837: 7 | I837: 7 | J837: 6 | K837: 6 | L837: 6 | M837: 6 | N837: 6 | P837: 6
A838: Jeresey | B838: 1 | C838: 14.30 | D838: 14.20 | E838: 28.50 | F838: 14.30 | G838: 14.00 | H838: 14.30 | I838: 21.30 | J838: 13.70 | K838: 13.60 | L838: 13.00 | M838: 20.150 | N838: 69.950 | O838: 0.0 | P838: 69.950
A839: Surf | C839: 7 | D839: 7 | E839: 7 | F839: 6 | G839: 7 | H839: 6 | I839: 6 | J839: 7 | K839: 7 | L839: 7 | M839: 7 | N839: 7 | P839: 7
A842: 7/26/2024 Dover, Pennsylvania
C843: General Effect | F843: Visual | J843: Music
C844: 1 | D844: 2 | F844: Proficiency | G844: Analysis | H844: Color Guard | J844: Brass | K844: Analysis | L844: Percussion | N844: Sub | P844: Total
C845: K. Baker | D845: G. Howarth | E845: Total | F845: J. Gilley | G845: T. Slaughter | H845: C. Nelson | I845: Total ÷2 | J845: C. Marra | K845: T. Fox | L845: J. Davila | M845: Total ÷2 | N845: Total | O845: Pen | P845: Score
A846: DCI Open Class | C846: 20 | D846: 20 | E846: 40 | F846: 20 | G846: 20 | H846: 20 | I846: 30 | J846: 20 | K846: 20 | L846: 20 | M846: 30 | N846: 100 | P846: 100
A847: Spartans | B847: 5 | C847: 16.10 | D847: 16.00 | E847: 32.10 | F847: 15.60 | G847: 15.70 | H847: 16.10 | I847: 23.70 | J847: 15.60 | K847: 15.80 | L847: 15.00 | M847: 23.20 | N847: 79.00 | O847: 0.0 | P847: 79.00
C848: 1 | D848: 2 | E848: 1 | F848: 1 | G848: 1 | H848: 1 | I848: 1 | J848: 1 | K848: 1 | L848: 2 | M848: 1 | N848: 1 | P848: 1
A849: Gold | B849: 6 | C849: 15.30 | D849: 16.10 | E849: 31.40 | F849: 14.60 | G849: 15.40 | H849: 15.40 | I849: 22.70 | J849: 15.40 | K849: 15.40 | L849: 15.50 | M849: 23.15 | N849: 77.25 | O849: 0.0 | P849: 77.25
C850: 2 | D850: 1 | E850: 2 | F850: 3 | G850: 2 | H850: 2 | I850: 2 | J850: 2 | K850: 2 | L850: 1 | M850: 2 | N850: 2 | P850: 2
A851: Battalion | B851: 4 | C851: 14.90 | D851: 15.60 | E851: 30.50 | F851: 14.90 | G851: 14.80 | H851: 15.10 | I851: 22.40 | J851: 14.60 | K851: 15.10 | L851: 14.10 | M851: 21.90 | N851: 74.80 | O851: 0.0 | P851: 74.80
C852: 3 | D852: 3 | E852: 3 | F852: 2 | G852: 3 | H852: 3 | I852: 3 | J852: 3 | K852: 3 | L852: 3 | M852: 3 | N852: 3 | P852: 3
A853: Raiders | B853: 1 | C853: 12.50 | D853: 13.40 | E853: 25.90 | F853: 11.70 | G853: 13.10 | H853: 12.50 | I853: 18.65 | J853: 13.90 | K853: 12.80 | L853: 13.10 | M853: 19.90 | N853: 64.45 | O853: 0.0 | P853: 64.45
C854: 5 | D854: 4 | E854: 4 | F854: 6 | G854: 4 | H854: 6 | I854: 5 | J854: 4 | K854: 5 | L854: 4 | M854: 4 | N854: 4 | P854: 4
A855: 7th | B855: 3 | C855: 12.70 | D855: 13.20 | E855: 25.90 | F855: 13.10 | G855: 12.80 | H855: 12.90 | I855: 19.40 | J855: 12.30 | K855: 13.00 | L855: 12.90 | M855: 19.10 | N855: 64.40 | O855: 0.0 | P855: 64.40
A856: Regiment | C856: 4 | D856: 5 | E856: 4 | F856: 4 | G856: 5 | H856: 4 | I856: 4 | J856: 5 | K856: 4 | L856: 5 | M856: 5 | N856: 5 | P856: 5
A857: Les | B857: 2 | C857: 11.80 | D857: 12.50 | E857: 24.30 | F857: 12.40 | G857: 12.20 | H857: 12.70 | I857: 18.65 | J857: 11.60 | K857: 11.40 | L857: 12.50 | M857: 17.75 | N857: 60.70 | O857: 0.0 | P857: 60.70
A858: Stentors | C858: 6 | D858: 6 | E858: 6 | F858: 5 | G858: 6 | H858: 5 | I858: 5 | J858: 6 | K858: 6 | L858: 6 | M858: 6 | N858: 6 | P858: 6
A859: 1
A861: 7/26/2024 Birmingham, Alabama
C862: General Effect | F862: Visual | J862: Music
C863: 1 | D863: 2 | F863: Proficiency | G863: Analysis | H863: Color Guard | J863: Brass | K863: Analysis | L863: Percussion | N863: Sub | P863: Total
C864: D. Deems | D864: C. Phillips | E864: Total | F864: A. Dalton | G864: J. Tate | H864: M. Thompson | I864: Total ÷2 | J864: M. Hoskins | K864: J. Denton | L864: T. Sanders | M864: Total ÷2 | N864: Total | O864: Pen | P864: Score
A865: DCI World Class | C865: 20 | D865: 20 | E865: 40 | F865: 20 | G865: 20 | H865: 20 | I865: 30 | J865: 20 | K865: 20 | L865: 20 | M865: 30 | N865: 100 | P865: 100
A866: Colts | B866: 7 | C866: 17.10 | D866: 17.30 | E866: 34.40 | F866: 16.30 | G866: 17.30 | H866: 17.10 | I866: 25.35 | J866: 16.80 | K866: 17.10 | L866: 17.70 | M866: 25.800 | N866: 85.550 | O866: 0.0 | P866: 85.550
C867: 1 | D867: 1 | E867: 1 | F867: 5 | G867: 1 | H867: 1 | I867: 2 | J867: 2 | K867: 2 | L867: 1 | M867: 2 | N867: 1 | P867: 1
A868: Troopers | B868: 5 | C868: 16.90 | D868: 17.10 | E868: 34.00 | F868: 17.40 | G868: 17.00 | H868: 16.50 | I868: 25.45 | J868: 17.00 | K868: 17.30 | L868: 17.50 | M868: 25.900 | N868: 85.350 | O868: 0.0 | P868: 85.350
C869: 2 | D869: 3 | E869: 2 | F869: 1 | G869: 2 | H869: 3 | I869: 1 | J869: 1 | K869: 1 | L869: 2 | M869: 1 | N869: 2 | P869: 2
A870: Blue | B870: 4 | C870: 16.20 | D870: 16.80 | E870: 33.00 | F870: 16.80 | G870: 16.70 | H870: 16.60 | I870: 25.05 | J870: 16.20 | K870: 16.50 | L870: 16.10 | M870: 24.400 | N870: 82.450 | O870: 0.0 | P870: 82.450
A871: Knights | C871: 4 | D871: 4 | E871: 4 | F871: 4 | G871: 3 | H871: 2 | I871: 3 | J871: 5 | K871: 4 | L871: 4 | M871: 4 | N871: 3 | P871: 3
A872: Madison | B872: 6 | C872: 16.00 | D872: 17.20 | E872: 33.20 | F872: 17.00 | G872: 16.60 | H872: 16.20 | I872: 24.90 | J872: 16.65 | K872: 16.80 | L872: 15.00 | M872: 24.225000000000001 | N872: 82.325000000000003 | O872: 0.0 | P872: 82.325000000000003
A873: Scouts | C873: 6 | D873: 2 | E873: 3 | F873: 2 | G873: 4 | H873: 4 | I873: 4 | J873: 3 | K873: 3 | L873: 6 | M873: 5 | N873: 4 | P873: 4
A874: Spirit of | B874: 2 | C874: 16.10 | D874: 16.10 | E874: 32.20 | F874: 16.90 | G874: 15.90 | H874: 15.80 | I874: 24.30 | J874: 16.50 | K874: 16.00 | L874: 16.50 | M874: 24.500 | N874: 81.000 | O874: 0.0 | P874: 81.000
A875: Atlanta | C875: 5 | D875: 6 | E875: 6 | F875: 3 | G875: 6 | H875: 6 | I875: 6 | J875: 4 | K875: 6 | L875: 3 | M875: 3 | N875: 5 | P875: 5
A876: Crossmen | B876: 3 | C876: 16.40 | D876: 16.20 | E876: 32.60 | F876: 16.20 | G876: 16.50 | H876: 16.00 | I876: 24.35 | J876: 15.90 | K876: 16.30 | L876: 15.30 | M876: 23.750 | N876: 80.700 | O876: 0.0 | P876: 80.700
C877: 3 | D877: 5 | E877: 5 | F877: 6 | G877: 5 | H877: 5 | I877: 5 | J877: 6 | K877: 5 | L877: 5 | M877: 6 | N877: 6 | P877: 6
A878: Jersey | B878: 1 | C878: 14.30 | D878: 14.40 | E878: 28.70 | F878: 14.30 | G878: 14.40 | H878: 15.00 | I878: 21.85 | J878: 13.90 | K878: 13.80 | L878: 14.30 | M878: 21.000 | N878: 71.550 | O878: 0.0 | P878: 71.550
A879: Surf | C879: 7 | D879: 7 | E879: 7 | F879: 7 | G879: 7 | H879: 7 | I879: 7 | J879: 7 | K879: 7 | L879: 7 | M879: 7 | N879: 7 | P879: 7
A880: DCI All Age World Class
A881: Atlanta CV | B881: 1 | C881: 16.50 | D881: 17.00 | E881: 33.50 | F881: 16.50 | G881: 16.20 | H881: 17.00 | I881: 24.85 | J881: 15.80 | K881: 16.30 | L881: 16.40 | M881: 24.250 | N881: 82.600 | O881: 0.0 | P881: 82.600
C882: 1 | D882: 1 | E882: 1 | F882: 1 | G882: 1 | H882: 1 | I882: 1 | J882: 1 | K882: 1 | L882: 1 | M882: 1 | N882: 1 | P882: 1
A885: 7/26/2024 Murfreesboro, Tennessee--DCI Masters
C886: General Effect | F886: Visual | J886: Music
C887: 1 | D887: 2 | F887: Proficiency | G887: Analysis | H887: Color Guard | J887: Brass | K887: Analysis | L887: Percussion | N887: Sub | P887: Total
C888: W. Richart | D888: M. Howard | E888: Total | F888: T. Pierce | G888: J. Sturgeon | H888: T. Wingate | I888: Total ÷2 | J888: B. Huneycutt | K888: N. Jones | L888: M. Davis | M888: Total ÷2 | N888: Total | O888: Pen | P888: Score
A889: DCI World Class | C889: 20 | D889: 20 | E889: 40 | F889: 20 | G889: 20 | H889: 20 | I889: 30 | J889: 20 | K889: 20 | L889: 20 | M889: 30 | N889: 100 | P889: 100
A890: Bluecoats | B890: 8 | C890: 19.00 | D890: 19.00 | E890: 38.00 | F890: 18.90 | G890: 18.90 | H890: 18.60 | I890: 28.20 | J890: 19.00 | K890: 18.90 | L890: 18.60 | M890: 28.25 | N890: 94.45 | O890: 0.0 | P890: 94.45
C891: 1 | D891: 1 | E891: 1 | F891: 1 | G891: 1 | H891: 2 | I891: 1 | J891: 1 | K891: 1 | L891: 2 | M891: 1 | N891: 1 | P891: 1
A892: Boston | B892: 6 | C892: 18.80 | D892: 18.70 | E892: 37.50 | F892: 18.60 | G892: 18.50 | H892: 19.00 | I892: 28.05 | J892: 18.50 | K892: 18.40 | L892: 18.70 | M892: 27.80 | N892: 93.35 | O892: 0.0 | P892: 93.35
A893: Crusaders | C893: 2 | D893: 2 | E893: 2 | F893: 3 | G893: 3 | H893: 1 | I893: 2 | J893: 3 | K893: 4 | L893: 1 | M893: 2 | N893: 2 | P893: 2
A894: Blue | B894: 7 | C894: 18.50 | D894: 18.50 | E894: 37.00 | F894: 18.80 | G894: 18.60 | H894: 18.50 | I894: 27.95 | J894: 18.80 | K894: 18.60 | L894: 18.20 | M894: 27.80 | N894: 92.75 | O894: 0.0 | P894: 92.75
A895: Devils | C895: 3 | D895: 3 | E895: 3 | F895: 2 | G895: 2 | H895: 3 | I895: 3 | J895: 2 | K895: 2 | L895: 3 | M895: 2 | N895: 3 | P895: 3
A896: Phantom | B896: 4 | C896: 18.40 | D896: 18.30 | E896: 36.70 | F896: 18.20 | G896: 18.00 | H896: 17.90 | I896: 27.05 | J896: 17.90 | K896: 18.10 | L896: 17.80 | M896: 26.90 | N896: 90.65 | O896: 0.0 | P896: 90.65
A897: Regiment | C897: 4 | D897: 4 | E897: 4 | F897: 4 | G897: 4 | H897: 5 | I897: 5 | J897: 5 | K897: 5 | L897: 4 | M897: 5 | N897: 4 | P897: 4
A898: Carolina | B898: 5 | C898: 18.20 | D898: 18.10 | E898: 36.30 | F898: 18.00 | G898: 17.90 | H898: 18.30 | I898: 27.10 | J898: 18.10 | K898: 18.50 | L898: 17.60 | M898: 27.10 | N898: 90.50 | O898: 0.0 | P898: 90.50
A899: Crown | C899: 5 | D899: 5 | E899: 5 | F899: 5 | G899: 5 | H899: 4 | I899: 4 | J899: 4 | K899: 3 | L899: 6 | M899: 4 | N899: 5 | P899: 5
A900: Mandarins | B900: 3 | C900: 17.80 | D900: 17.80 | E900: 35.60 | F900: 17.80 | G900: 17.60 | H900: 17.70 | I900: 26.55 | J900: 17.40 | K900: 17.80 | L900: 16.90 | M900: 26.05 | N900: 88.20 | O900: 0.0 | P900: 88.20
C901: 6 | D901: 6 | E901: 6 | F901: 6 | G901: 6 | H901: 6 | I901: 6 | J901: 6 | K901: 6 | L901: 7 | M901: 6 | N901: 6 | P901: 6
A902: Cavaliers | B902: 2 | C902: 17.00 | D902: 17.10 | E902: 34.10 | F902: 17.00 | G902: 16.90 | H902: 17.20 | I902: 25.55 | J902: 16.90 | K902: 17.00 | L902: 17.70 | M902: 25.80 | N902: 85.45 | O902: 0.0 | P902: 85.45
C903: 7 | D903: 7 | E903: 7 | F903: 7 | G903: 7 | H903: 7 | I903: 7 | J903: 7 | K903: 7 | L903: 5 | M903: 7 | N903: 7 | P903: 7
A904: Music | B904: 1 | C904: 16.10 | D904: 15.50 | E904: 31.60 | F904: 15.10 | G904: 15.40 | H904: 15.40 | I904: 22.95 | J904: 15.30 | K904: 16.00 | L904: 15.40 | M904: 23.35 | N904: 77.90 | O904: 0.0 | P904: 77.90
A905: City | C905: 8 | D905: 8 | E905: 8 | F905: 8 | G905: 8 | H905: 8 | I905: 8 | J905: 8 | K905: 8 | L905: 8 | M905: 8 | N905: 8 | P905: 8
A908: 7/27/2024 Sheffield, Pennsylvania
C909: General Effect | F909: Visual | J909: Music
C910: 1 | D910: 2 | F910: Proficiency | G910: Analysis | H910: Color Guard | J910: Brass | K910: Analysis | L910: Percussion | N910: Sub | P910: Total
C911: T. Slaughter | D911: T. Fox | E911: Total | F911: C. Nelson | G911: K. Baker | H911: J. Gilley | I911: Total ÷2 | J911: B. Huneycutt | K911: P. Smith | L911: T. Mengel | M911: Total ÷2 | N911: Total | O911: Pen | P911: Score
A912: DCI Open Class | C912: 20 | D912: 20 | E912: 40 | F912: 20 | G912: 20 | H912: 20 | I912: 30 | J912: 20 | K912: 20 | L912: 20 | M912: 30 | N912: 100 | P912: 100
A913: Spartans | B913: 5 | C913: 15.90 | D913: 15.90 | E913: 31.80 | F913: 16.20 | G913: 16.10 | H913: 16.10 | I913: 24.20 | J913: 16.00 | K913: 16.50 | L913: 15.80 | M913: 24.15 | N913: 80.15 | O913: 0.0 | P913: 80.15
C914: 1 | D914: 1 | E914: 1 | F914: 1 | G914: 1 | H914: 1 | I914: 1 | J914: 1 | K914: 1 | L914: 2 | M914: 1 | N914: 1 | P914: 1
A915: Gold | B915: 6 | C915: 15.60 | D915: 15.40 | E915: 31.00 | F915: 15.60 | G915: 15.50 | H915: 15.20 | I915: 23.15 | J915: 15.70 | K915: 16.00 | L915: 16.20 | M915: 23.95 | N915: 78.10 | O915: 0.0 | P915: 78.10
C916: 2 | D916: 2 | E916: 2 | F916: 2 | G916: 2 | H916: 2 | I916: 2 | J916: 2 | K916: 2 | L916: 1 | M916: 2 | N916: 2 | P916: 2
A917: Battalion | B917: 4 | C917: 15.20 | D917: 14.90 | E917: 30.10 | F917: 15.10 | G917: 15.00 | H917: 14.90 | I917: 22.50 | J917: 15.00 | K917: 15.70 | L917: 15.10 | M917: 22.90 | N917: 75.50 | O917: 0.0 | P917: 75.50
C918: 3 | D918: 3 | E918: 3 | F918: 3 | G918: 3 | H918: 3 | I918: 3 | J918: 3 | K918: 3 | L918: 3 | M918: 3 | N918: 3 | P918: 3
A919: Raiders | B919: 2 | C919: 13.50 | D919: 13.10 | E919: 26.60 | F919: 13.20 | G919: 12.90 | H919: 13.20 | I919: 19.65 | J919: 14.00 | K919: 13.70 | L919: 13.30 | M919: 20.50 | N919: 66.75 | O919: 0.0 | P919: 66.75
C920: 4 | D920: 4 | E920: 4 | F920: 4 | G920: 4 | H920: 4 | I920: 4 | J920: 4 | K920: 5 | L920: 4 | M920: 4 | N920: 4 | P920: 4
A921: 7th | B921: 3 | C921: 13.30 | D921: 12.80 | E921: 26.10 | F921: 13.10 | G921: 12.70 | H921: 13.10 | I921: 19.45 | J921: 13.30 | K921: 13.80 | L921: 13.20 | M921: 20.15 | N921: 65.70 | O921: 0.0 | P921: 65.70
A922: Regiment | C922: 5 | D922: 5 | E922: 5 | F922: 5 | G922: 5 | H922: 5 | I922: 5 | J922: 5 | K922: 4 | L922: 5 | M922: 5 | N922: 5 | P922: 5
A923: Les | B923: 1 | C923: 12.40 | D923: 12.20 | E923: 24.60 | F923: 12.50 | G923: 12.10 | H923: 12.80 | I923: 18.70 | J923: 12.50 | K923: 12.10 | L923: 12.50 | M923: 18.55 | N923: 61.85 | O923: 0.0 | P923: 61.85
A924: Stentors | C924: 6 | D924: 6 | E924: 6 | F924: 6 | G924: 6 | H924: 6 | I924: 6 | J924: 6 | K924: 6 | L924: 6 | M924: 6 | N924: 6 | P924: 6
A925: DCI All Age Open Class
A926: Rogues Hollow | B926: 1 | C926: 15.90 | D926: 15.00 | E926: 30.90 | F926: 16.10 | G926: 16.70 | H926: 15.40 | I926: 24.10 | J926: 16.30 | K926: 16.50 | L926: 15.80 | M926: 24.30 | N926: 79.30 | O926: 0.0 | P926: 79.30
A927: Regiment | C927: 1 | D927: 1 | E927: 1 | F927: 1 | G927: 1 | H927: 1 | I927: 1 | J927: 1 | K927: 1 | L927: 1 | M927: 1 | N927: 1 | P927: 1
A930: 7/27/2024 Mount Olive, New Jersey
C931: General Effect | F931: Visual | J931: Music
C932: 1 | D932: 2 | F932: Proficiency | G932: Analysis | H932: Color Guard | J932: Brass | K932: Analysis | L932: Percussion | N932: Sub | P932: Total
C933: J. Howell | D933: J. Kennedy | E933: Total | F933: M. Thompson | G933: B. Jones | H933: H. Nguyen | I933: Total ÷2 | J933: P. McGarr | K933: D. Thomas | L933: J. Prosperie | M933: Total ÷2 | N933: Total | O933: Pen | P933: Score
A934: DCI All Age World Class | C934: 20 | D934: 20 | E934: 40 | F934: 20 | G934: 20 | H934: 20 | I934: 30 | J934: 20 | K934: 20 | L934: 20 | M934: 30 | N934: 100 | P934: 100
A935: Reading | B935: 1 | C935: 18.60 | D935: 18.50 | E935: 37.10 | F935: 18.10 | G935: 18.60 | H935: 18.40 | I935: 27.55 | J935: 17.60 | K935: 18.50 | L935: 17.20 | M935: 26.65 | N935: 91.30 | O935: 0.0 | P935: 91.30
A936: Buccaneers | C936: 1 | D936: 1 | E936: 1 | F936: 1 | G936: 1 | H936: 1 | I936: 1 | J936: 1 | K936: 1 | L936: 3 | M936: 1 | N936: 1 | P936: 1
A937: Hawthorne | B937: 3 | C937: 18.10 | D937: 18.40 | E937: 36.50 | F937: 17.70 | G937: 18.00 | H937: 17.80 | I937: 26.75 | J937: 17.10 | K937: 18.30 | L937: 17.80 | M937: 26.60 | N937: 89.85 | O937: 0.0 | P937: 89.85
A938: Caballeros | C938: 2 | D938: 2 | E938: 2 | F938: 2 | G938: 3 | H938: 2 | I938: 3 | J938: 2 | K938: 2 | L938: 2 | M938: 2 | N938: 2 | P938: 2
A939: Bushwackers | B939: 4 | C939: 17.90 | D939: 17.00 | E939: 34.90 | F939: 17.50 | G939: 18.50 | H939: 17.70 | I939: 26.85 | J939: 16.10 | K939: 17.80 | L939: 18.30 | M939: 26.10 | N939: 87.85 | O939: 0.0 | P939: 87.85
C940: 3 | D940: 3 | E940: 3 | F940: 3 | G940: 2 | H940: 3 | I940: 2 | J940: 3 | K940: 3 | L940: 1 | M940: 3 | N940: 3 | P940: 3
A941: Connecticut | B941: 2 | C941: 16.50 | D941: 16.70 | E941: 33.20 | F941: 16.20 | G941: 16.40 | H941: 16.30 | I941: 24.45 | J941: 14.90 | K941: 16.80 | L941: 16.70 | M941: 24.20 | N941: 81.85 | O941: 0.0 | P941: 81.85
A942: Hurricanes | C942: 4 | D942: 4 | E942: 4 | F942: 4 | G942: 4 | H942: 4 | I942: 4 | J942: 4 | K942: 4 | L942: 4 | M942: 4 | N942: 4 | P942: 4
A943: DCI All Age Open Class
A944: White | B944: 2 | C944: 16.70 | D944: 16.90 | E944: 33.60 | F944: 16.00 | G944: 16.60 | H944: 16.10 | I944: 24.35 | J944: 16.20 | K944: 16.40 | L944: 16.20 | M944: 24.40 | N944: 82.35 | O944: 0.0 | P944: 82.35
A945: Sabers | C945: 1 | D945: 1 | E945: 1 | F945: 1 | G945: 1 | H945: 1 | I945: 1 | J945: 1 | K945: 1 | L945: 1 | M945: 1 | N945: 1 | P945: 1
A946: Fusion | B946: 1 | C946: 15.70 | D946: 15.20 | E946: 30.90 | F946: 15.00 | G946: 15.60 | H946: 15.70 | I946: 23.15 | J946: 15.10 | K946: 15.30 | L946: 14.40 | M946: 22.40 | N946: 76.45 | O946: 5.0 | P946: 71.45
A947: Core | C947: 2 | D947: 2 | E947: 2 | F947: 2 | G947: 2 | H947: 2 | I947: 2 | J947: 2 | K947: 2 | L947: 2 | M947: 2 | N947: 2 | P947: 2
A948: DCI All Age Class A
A949: Sunrisers | B949: 1 | C949: 14.60 | D949: 14.00 | E949: 28.60 | F949: 14.10 | G949: 14.60 | H949: 14.40 | I949: 21.55 | J949: 13.50 | K949: 15.00 | L949: 12.90 | M949: 20.70 | N949: 70.85 | O949: 0.0 | P949: 70.85
C950: 1 | D950: 1 | E950: 1 | F950: 1 | G950: 1 | H950: 1 | I950: 1 | J950: 1 | K950: 1 | L950: 1 | M950: 1 | N950: 1 | P950: 1
A953: 7/27/2024 Atlanta, Georgia--DCI Southeastern
C954: General Effect | J954: Visual | N954: Music
C955: 1 | D955: 1 | F955: 2 | G955: 2 | J955: Proficiency | K955: Analysis | L955: Color Guard | N955: Brass | O955: Analysis 1 | P955: Analysis 2 | Q955: Analysis | R955: Percussion | T955: Sub | V955: Total
C956: K. Miller | D956: D. Deems | E956: Average | F956: K. Young | G956: D. Davis | H956: Average | I956: Total | J956: C. Moss | K956: T. Wingate | L956: W. Rickart | M956: Total ÷2 | N956: S. Page | O956: C. Romanowski | P956: J. Harper | Q956: Average | R956: J. Brooks | S956: Total ÷2 | T956: Total | U956: Pen | V956: Score
A957: DCI World Class | C957: 20 | D957: 20 | E957: 20 | F957: 20 | G957: 20 | H957: 20 | I957: 40 | J957: 20 | K957: 20 | L957: 20 | M957: 30 | N957: 20 | O957: 20 | P957: 20 | Q957: 20 | R957: 20 | S957: 30 | T957: 100 | V957: 100
A958: Bluecoats | B958: 11 | C958: 19.00 | D958: 19.00 | E958: 19.000 | F958: 19.10 | G958: 18.90 | H958: 19.000 | I958: 38.000 | J958: 18.80 | K958: 19.00 | L958: 18.60 | M958: 28.200 | N958: 18.50 | O958: 19.30 | P958: 19.00 | Q958: 19.150 | R958: 18.80 | S958: 28.225000000000001 | T958: 94.424999999999997 | U958: 0.0 | V958: 94.424999999999997
C959: 1 | D959: 1 | E959: 1 | F959: 1 | G959: 2 | H959: 1 | I959: 1 | J959: 1 | K959: 1 | L959: 4 | M959: 1 | N959: 2 | O959: 1 | P959: 1 | Q959: 1 | R959: 3 | S959: 1 | T959: 1 | V959: 1
A960: Boston | B960: 12 | C960: 18.40 | D960: 18.75 | E960: 18.574999999999999 | F960: 18.90 | G960: 19.00 | H960: 18.950 | I960: 37.524999999999999 | J960: 18.50 | K960: 18.70 | L960: 19.20 | M960: 28.200 | N960: 18.30 | O960: 19.00 | P960: 18.80 | Q960: 18.900 | R960: 19.10 | S960: 28.150 | T960: 93.875 | U960: 0.0 | V960: 93.875
A961: Crusaders | C961: 4 | D961: 2 | E961: 2 | F961: 2 | G961: 1 | H961: 2 | I961: 2 | J961: 2 | K961: 2 | L961: 1 | M961: 1 | N961: 3 | O961: 2 | P961: 2 | Q961: 2 | R961: 1 | S961: 2 | T961: 2 | V961: 2
A962: Blue | B962: 13 | C962: 18.60 | D962: 18.55 | E962: 18.574999999999999 | F962: 18.80 | G962: 18.50 | H962: 18.650 | I962: 37.225000000000001 | J962: 18.40 | K962: 18.60 | L962: 19.00 | M962: 28.000 | N962: 18.70 | O962: 18.90 | P962: 18.40 | Q962: 18.650 | R962: 18.85 | S962: 28.100 | T962: 93.325000000000003 | U962: 0.0 | V962: 93.325000000000003
A963: Devils | C963: 2 | D963: 3 | E963: 2 | F963: 3 | G963: 3 | H963: 3 | I963: 3 | J963: 3 | K963: 3 | L963: 2 | M963: 3 | N963: 1 | O963: 3 | P963: 4 | Q963: 3 | R963: 2 | S963: 3 | T963: 3 | V963: 3
A964: Phantom | B964: 10 | C964: 18.10 | D964: 18.50 | E964: 18.300 | F964: 18.50 | G964: 18.40 | H964: 18.450 | I964: 36.750 | J964: 18.10 | K964: 18.40 | L964: 18.30 | M964: 27.400 | N964: 17.90 | O964: 18.60 | P964: 18.20 | Q964: 18.400 | R964: 18.70 | S964: 27.500 | T964: 91.650 | U964: 0.0 | V964: 91.650
A965: Regiment | C965: 5 | D965: 4 | E965: 5 | F965: 4 | G965: 4 | H965: 4 | I965: 4 | J965: 5 | K965: 4 | L965: 5 | M965: 5 | N965: 5 | O965: 4 | P965: 5 | Q965: 5 | R965: 4 | S965: 4 | T965: 4 | V965: 4
A966: Carolina | B966: 8 | C966: 18.50 | D966: 18.25 | E966: 18.375 | F966: 18.40 | G966: 18.30 | H966: 18.350 | I966: 36.725000000000001 | J966: 18.00 | K966: 18.20 | L966: 18.70 | M966: 27.450 | N966: 18.10 | O966: 18.40 | P966: 18.60 | Q966: 18.500 | R966: 18.20 | S966: 27.400 | T966: 91.575000000000003 | U966: 0.0 | V966: 91.575000000000003
A967: Crown | C967: 3 | D967: 5 | E967: 4 | F967: 5 | G967: 5 | H967: 5 | I967: 5 | J967: 6 | K967: 5 | L967: 3 | M967: 4 | N967: 4 | O967: 5 | P967: 3 | Q967: 4 | R967: 6 | S967: 5 | T967: 5 | V967: 5
A968: Vanguard | B968: 9 | C968: 17.60 | D968: 17.80 | E968: 17.700 | F968: 17.85 | G968: 17.80 | H968: 17.824999999999999 | I968: 35.524999999999999 | J968: 18.20 | K968: 18.10 | L968: 17.60 | M968: 26.950 | N968: 17.30 | O968: 18.20 | P968: 18.00 | Q968: 18.100 | R968: 18.60 | S968: 27.000 | T968: 89.474999999999994 | U968: 0.0 | V968: 89.474999999999994
C969: 7 | D969: 7 | E969: 7 | F969: 6 | G969: 6 | H969: 6 | I969: 6 | J969: 4 | K969: 6 | L969: 8 | M969: 6 | N969: 7 | O969: 6 | P969: 6 | Q969: 6 | R969: 5 | S969: 6 | T969: 6 | V969: 6
A970: Mandarins | B970: 7 | C970: 17.70 | D970: 17.85 | E970: 17.750 | F970: 17.70 | G970: 17.70 | H970: 17.700 | I970: 35.475000000000001 | J970: 17.00 | K970: 17.60 | L970: 17.90 | M970: 26.250 | N970: 17.60 | O970: 17.90 | P970: 17.80 | Q970: 17.850 | R970: 17.40 | S970: 26.425000000000001 | T970: 88.150 | U970: 0.0 | V970: 88.150
C971: 6 | D971: 6 | E971: 6 | F971: 7 | G971: 7 | H971: 7 | I971: 7 | J971: 8 | K971: 7 | L971: 6 | M971: 7 | N971: 6 | O971: 7 | P971: 7 | Q971: 7 | R971: 9 | S971: 7 | T971: 7 | V971: 7
A972: Blue | B972: 6 | C972: 17.20 | D972: 17.30 | E972: 17.250 | F972: 17.50 | G972: 17.40 | H972: 17.450 | I972: 34.700 | J972: 16.90 | K972: 17.50 | L972: 17.80 | M972: 26.100 | N972: 17.00 | O972: 17.20 | P972: 17.50 | Q972: 17.350 | R972: 17.50 | S972: 25.925000000000001 | T972: 86.724999999999994 | U972: 0.0 | V972: 86.724999999999994
A973: Stars | C973: 8 | D973: 9 | E973: 8 | F973: 8 | G973: 8 | H973: 8 | I973: 8 | J973: 9 | K973: 8 | L973: 7 | M973: 8 | N973: 8 | O973: 9 | P973: 8 | Q973: 8 | R973: 8 | S973: 9 | T973: 8 | V973: 8
A974: Colts | B974: 5 | C974: 16.50 | D974: 17.50 | E974: 17.000 | F974: 17.20 | G974: 16.90 | H974: 17.050 | I974: 34.050 | J974: 17.10 | K974: 17.20 | L974: 17.30 | M974: 25.800 | N974: 16.80 | O974: 17.50 | P974: 17.10 | Q974: 17.300 | R974: 17.90 | S974: 26.000 | T974: 85.850 | U974: 0.0 | V974: 85.850
C975: 9 | D975: 8 | E975: 9 | F975: 9 | G975: 9 | H975: 9 | I975: 9 | J975: 7 | K975: 9 | L975: 9 | M975: 9 | N975: 9 | O975: 8 | P975: 9 | Q975: 9 | R975: 7 | S975: 8 | T975: 9 | V975: 9
A976: Crossmen | B976: 4 | C976: 16.20 | D976: 16.50 | E976: 16.350 | F976: 16.40 | G976: 16.10 | H976: 16.250 | I976: 32.600 | J976: 16.30 | K976: 16.50 | L976: 15.80 | M976: 24.300 | N976: 16.40 | O976: 16.90 | P976: 16.40 | Q976: 16.650 | R976: 16.60 | S976: 24.824999999999999 | T976: 81.724999999999994 | U976: 0.0 | V976: 81.724999999999994
C977: 10 | D977: 10 | E977: 10 | F977: 10 | G977: 11 | H977: 10 | I977: 10 | J977: 10 | K977: 10 | L977: 11 | M977: 11 | N977: 10 | O977: 10 | P977: 11 | Q977: 10 | R977: 11 | S977: 10 | T977: 10 | V977: 10
A978: Spirit of | B978: 2 | C978: 15.70 | D978: 16.10 | E978: 15.900 | F978: 16.00 | G978: 16.40 | H978: 16.200 | I978: 32.100 | J978: 16.20 | K978: 16.40 | L978: 16.10 | M978: 24.350 | N978: 16.00 | O978: 16.00 | P978: 15.80 | Q978: 15.900 | R978: 16.80 | S978: 24.350 | T978: 80.800 | U978: 0.0 | V978: 80.800
A979: Atlanta | C979: 12 | D979: 11 | E979: 11 | F979: 11 | G979: 10 | H979: 11 | I979: 11 | J979: 11 | K979: 11 | L979: 10 | M979: 10 | N979: 11 | O979: 12 | P979: 12 | Q979: 12 | R979: 10 | S979: 11 | T979: 11 | V979: 11
A980: Academy | B980: 3 | C980: 15.40 | D980: 15.40 | E980: 15.400 | F980: 15.70 | G980: 15.30 | H980: 15.500 | I980: 30.900 | J980: 15.70 | K980: 15.70 | L980: 15.00 | M980: 23.200 | N980: 15.90 | O980: 16.40 | P980: 16.60 | Q980: 16.500 | R980: 16.30 | S980: 24.350 | T980: 78.450 | U980: 0.0 | V980: 78.450
C981: 12 | D981: 12 | E981: 12 | F981: 12 | G981: 12 | H981: 12 | I981: 12 | J981: 12 | K981: 12 | L981: 12 | M981: 12 | N981: 12 | O981: 11 | P981: 10 | Q981: 11 | R981: 12 | S981: 11 | T981: 12 | V981: 12
A982: Genesis | B982: 1 | C982: 13.10 | D982: 15.30 | E982: 14.200 | F982: 14.60 | G982: 14.40 | H982: 14.500 | I982: 28.700 | J982: 15.40 | K982: 15.00 | L982: 14.50 | M982: 22.450 | N982: 15.00 | O982: 14.90 | P982: 14.30 | Q982: 14.600 | R982: 15.60 | S982: 22.600 | T982: 73.750 | U982: 0.0 | V982: 73.750
C983: 13 | D983: 13 | E983: 13 | F983: 13 | G983: 13 | H983: 13 | I983: 13 | J983: 13 | K983: 13 | L983: 13 | M983: 13 | N983: 13 | O983: 13 | P983: 13 | Q983: 13 | R983: 13 | S983: 13 | T983: 13 | V983: 13
A984: DCI All Age World Class
A985: Atlanta CV | B985: 1 | C985: 16.20 | D985: 17.40 | E985: 16.800 | F985: 16.50 | G985: 16.70 | H985: 16.600 | I985: 33.400 | J985: 16.30 | K985: 16.70 | L985: 17.60 | M985: 25.300 | N985: 16.20 | O985: 15.80 | P985: 16.10 | Q985: 15.950 | R985: 16.00 | S985: 24.074999999999999 | T985: 82.775000000000006 | U985: 0.0 | V985: 82.775000000000006
C986: 1 | D986: 1 | E986: 1 | F986: 1 | G986: 1 | H986: 1 | I986: 1 | J986: 1 | K986: 1 | L986: 1 | M986: 1 | N986: 1 | O986: 1 | P986: 1 | Q986: 1 | R986: 1 | S986: 1 | T986: 1 | V986: 1
A989: 7/28/2024 Orville, Ohio
C990: General Effect | F990: Visual | J990: Music
C991: 1 | D991: 2 | F991: Proficiency | G991: Analysis | H991: Color Guard | J991: Brass | K991: Analysis | L991: Percussion | N991: Sub | P991: Total
C992: J. Gilley | D992: J. Kennedy | E992: Total | F992: T. Slaughter | G992: C. Nelson | H992: K. Baker | I992: Total ÷2 | J992: B. Fabrizio | K992: G. Fugett | L992: J. Davila | M992: Total ÷2 | N992: Total | O992: Pen | P992: Score
A993: DCI Open Class | C993: 20 | D993: 20 | E993: 40 | F993: 20 | G993: 20 | H993: 20 | I993: 30 | J993: 20 | K993: 20 | L993: 20 | M993: 30 | N993: 100 | P993: 100
A994: Spartans | B994: 5 | C994: 16.40 | D994: 15.70 | E994: 32.10 | F994: 16.20 | G994: 16.10 | H994: 16.10 | I994: 24.20 | J994: 16.40 | K994: 16.00 | L994: 15.10 | M994: 23.75 | N994: 80.05 | O994: 0.0 | P994: 80.05
C995: 1 | D995: 1 | E995: 1 | F995: 1 | G995: 1 | H995: 1 | I995: 1 | J995: 1 | K995: 1 | L995: 2 | M995: 1 | N995: 1 | P995: 1
A996: Gold | B996: 4 | C996: 15.70 | D996: 15.50 | E996: 31.20 | F996: 15.80 | G996: 15.60 | H996: 15.40 | I996: 23.40 | J996: 16.10 | K996: 15.10 | L996: 15.50 | M996: 23.35 | N996: 77.95 | O996: 0.0 | P996: 77.95
C997: 2 | D997: 2 | E997: 2 | F997: 2 | G997: 2 | H997: 2 | I997: 2 | J997: 2 | K997: 2 | L997: 1 | M997: 2 | N997: 2 | P997: 2
A998: Raiders | B998: 1 | C998: 13.20 | D998: 14.00 | E998: 27.20 | F998: 13.30 | G998: 13.50 | H998: 13.30 | I998: 20.05 | J998: 14.30 | K998: 13.00 | L998: 13.60 | M998: 20.45 | N998: 67.70 | O998: 0.0 | P998: 67.70
C999: 3 | D999: 3 | E999: 3 | F999: 4 | G999: 4 | H999: 4 | I999: 4 | J999: 3 | K999: 3 | L999: 4 | M999: 3 | N999: 3 | P999: 3
A1000: 7th | B1000: 3 | C1000: 13.00 | D1000: 13.40 | E1000: 26.40 | F1000: 13.60 | G1000: 13.70 | H1000: 13.40 | I1000: 20.35 | J1000: 13.60 | K1000: 12.80 | L1000: 13.70 | M1000: 20.05 | N1000: 66.80 | O1000: 0.0 | P1000: 66.80
A1001: Regiment | C1001: 4 | D1001: 4 | E1001: 4 | F1001: 3 | G1001: 3 | H1001: 3 | I1001: 3 | J1001: 4 | K1001: 4 | L1001: 3 | M1001: 4 | N1001: 4 | P1001: 4
A1002: Les | B1002: 2 | C1002: 12.80 | D1002: 12.90 | E1002: 25.70 | F1002: 12.20 | G1002: 13.10 | H1002: 12.60 | I1002: 18.95 | J1002: 12.70 | K1002: 11.60 | L1002: 12.10 | M1002: 18.20 | N1002: 62.85 | O1002: 0.0 | P1002: 62.85
A1003: Stentors | C1003: 5 | D1003: 5 | E1003: 5 | F1003: 5 | G1003: 5 | H1003: 5 | I1003: 5 | J1003: 5 | K1003: 5 | L1003: 5 | M1003: 5 | N1003: 5 | P1003: 5
A1004: DCI All Age Open Class
A1005: Cincinnati | B1005: 1 | C1005: 17.10 | D1005: 17.00 | E1005: 34.10 | F1005: 16.90 | G1005: 17.20 | H1005: 17.10 | I1005: 25.60 | J1005: 17.00 | K1005: 16.90 | L1005: 17.40 | M1005: 25.65 | N1005: 85.35 | O1005: 0.0 | P1005: 85.35
A1006: Tradition | C1006: 1 | D1006: 1 | E1006: 1 | F1006: 1 | G1006: 1 | H1006: 1 | I1006: 1 | J1006: 1 | K1006: 1 | L1006: 1 | M1006: 1 | N1006: 1 | P1006: 1
A1007: Rogues Hollow | B1007: 2 | C1007: 15.80 | D1007: 15.80 | E1007: 31.60 | F1007: 16.30 | G1007: 16.40 | H1007: 16.10 | I1007: 24.40 | J1007: 16.50 | K1007: 15.70 | L1007: 14.40 | M1007: 23.30 | N1007: 79.30 | O1007: 0.0 | P1007: 79.30
A1008: Regiment | C1008: 2 | D1008: 2 | E1008: 2 | F1008: 2 | G1008: 2 | H1008: 2 | I1008: 2 | J1008: 2 | K1008: 2 | L1008: 2 | M1008: 2 | N1008: 2 | P1008: 2
A1009: DCI All Age Class A
A1010: Columbus | B1010: 1 | C1010: 13.40 | D1010: 13.30 | E1010: 26.70 | F1010: 13.30 | G1010: 14.00 | H1010: 14.40 | I1010: 20.85 | J1010: 13.90 | K1010: 13.60 | L1010: 12.90 | M1010: 20.20 | N1010: 67.75 | O1010: 0.0 | P1010: 67.75
A1011: Saints | C1011: 1 | D1011: 1 | E1011: 1 | F1011: 1 | G1011: 1 | H1011: 1 | I1011: 1 | J1011: 1 | K1011: 1 | L1011: 1 | M1011: 1 | N1011: 1 | P1011: 1
A1014: 7/28/2024 Winston-Salem, North Carolina
C1015: General Effect | J1015: Visual | N1015: Music
C1016: 1 | D1016: 1 | F1016: 2 | G1016: 2 | J1016: Proficiency | K1016: Analysis | L1016: Color Guard | N1016: Brass | O1016: Analysis 1 | P1016: Analysis 2 | Q1016: Analysis | R1016: Percussion | T1016: Sub | V1016: Total
C1017: D. Deems | D1017: K. Miler | E1017: Average | F1017: K. Young | G1017: D. Davis | H1017: Average | I1017: Total | J1017: C. Moss | K1017: T. Wingate | L1017: W. Rickart | M1017: Total ÷2 | N1017: S. Page | O1017: C. Romanowski | P1017: J. Harper | Q1017: Average | R1017: J. Brooks | S1017: Total ÷2 | T1017: Total | U1017: Pen | V1017: Score
A1018: DCI World Class | C1018: 20 | D1018: 20 | E1018: 20 | F1018: 20 | G1018: 20 | H1018: 20 | I1018: 40 | J1018: 20 | K1018: 20 | L1018: 20 | M1018: 30 | N1018: 20 | O1018: 20 | P1018: 20 | Q1018: 20 | R1018: 20 | S1018: 30 | T1018: 100 | V1018: 100
A1019: Bluecoats | B1019: 11 | C1019: 19.10 | D1019: 18.70 | E1019: 18.900 | F1019: 19.00 | G1019: 18.90 | H1019: 18.950 | I1019: 37.850 | J1019: 18.80 | K1019: 19.00 | L1019: 19.00 | M1019: 28.400 | N1019: 18.70 | O1019: 19.30 | P1019: 18.90 | Q1019: 19.100 | R1019: 19.10 | S1019: 28.450 | T1019: 94.700 | U1019: 0.0 | V1019: 94.700
C1020: 1 | D1020: 1 | E1020: 1 | F1020: 1 | G1020: 1 | H1020: 1 | I1020: 1 | J1020: 1 | K1020: 1 | L1020: 1 | M1020: 1 | N1020: 1 | O1020: 1 | P1020: 1 | Q1020: 1 | R1020: 1 | S1020: 1 | T1020: 1 | V1020: 1
A1021: Blue | B1021: 10 | C1021: 18.80 | D1021: 18.20 | E1021: 18.500 | F1021: 18.70 | G1021: 18.60 | H1021: 18.650 | I1021: 37.150 | J1021: 18.40 | K1021: 18.80 | L1021: 18.90 | M1021: 28.050 | N1021: 18.50 | O1021: 19.10 | P1021: 18.80 | Q1021: 18.950 | R1021: 18.95 | S1021: 28.200 | T1021: 93.400 | U1021: 0.0 | V1021: 93.400
A1022: Devils | C1022: 2 | D1022: 3 | E1022: 2 | F1022: 2 | G1022: 2 | H1022: 2 | I1022: 2 | J1022: 2 | K1022: 2 | L1022: 2 | M1022: 2 | N1022: 2 | O1022: 2 | P1022: 2 | Q1022: 2 | R1022: 2 | S1022: 2 | T1022: 2 | V1022: 2
A1023: Carolina | B1023: 12 | C1023: 18.50 | D1023: 18.30 | E1023: 18.400 | F1023: 18.40 | G1023: 18.40 | H1023: 18.400 | I1023: 36.800 | J1023: 18.20 | K1023: 18.30 | L1023: 18.70 | M1023: 27.600 | N1023: 18.30 | O1023: 18.70 | P1023: 18.60 | Q1023: 18.650 | R1023: 18.15 | S1023: 27.550 | T1023: 91.950 | U1023: 0.0 | V1023: 91.950
A1024: Crown | C1024: 3 | D1024: 2 | E1024: 3 | F1024: 3 | G1024: 3 | H1024: 3 | I1024: 3 | J1024: 3 | K1024: 3 | L1024: 3 | M1024: 3 | N1024: 3 | O1024: 3 | P1024: 3 | Q1024: 3 | R1024: 5 | S1024: 3 | T1024: 3 | V1024: 3
A1025: Mandarins | B1025: 8 | C1025: 17.70 | D1025: 17.60 | E1025: 17.650 | F1025: 17.70 | G1025: 17.80 | H1025: 17.750 | I1025: 35.400 | J1025: 17.50 | K1025: 17.70 | L1025: 17.80 | M1025: 26.500 | N1025: 17.70 | O1025: 18.10 | P1025: 17.90 | Q1025: 18.000 | R1025: 18.10 | S1025: 26.900 | T1025: 88.800 | U1025: 0.0 | V1025: 88.800
C1026: 4 | D1026: 4 | E1026: 4 | F1026: 4 | G1026: 4 | H1026: 4 | I1026: 4 | J1026: 4 | K1026: 4 | L1026: 4 | M1026: 4 | N1026: 4 | O1026: 4 | P1026: 4 | Q1026: 4 | R1026: 6 | S1026: 4 | T1026: 4 | V1026: 4
A1027: Troopers | B1027: 7 | C1027: 17.40 | D1027: 17.30 | E1027: 17.350 | F1027: 17.10 | G1027: 17.10 | H1027: 17.100 | I1027: 34.450 | J1027: 16.90 | K1027: 17.10 | L1027: 16.40 | M1027: 25.200 | N1027: 17.30 | O1027: 17.70 | P1027: 17.60 | Q1027: 17.650 | R1027: 18.50 | S1027: 26.725000000000001 | T1027: 86.375 | U1027: 0.0 | V1027: 86.375
C1028: 5 | D1028: 5 | E1028: 5 | F1028: 6 | G1028: 5 | H1028: 5 | I1028: 5 | J1028: 7 | K1028: 5 | L1028: 9 | M1028: 6 | N1028: 5 | O1028: 5 | P1028: 5 | Q1028: 5 | R1028: 3 | S1028: 5 | T1028: 5 | V1028: 5
A1029: Cavaliers | B1029: 9 | C1029: 17.20 | D1029: 16.80 | E1029: 17.000 | F1029: 17.15 | G1029: 16.70 | H1029: 16.925000000000001 | I1029: 33.924999999999997 | J1029: 17.10 | K1029: 17.00 | L1029: 17.40 | M1029: 25.750 | N1029: 17.20 | O1029: 17.30 | P1029: 17.00 | Q1029: 17.150 | R1029: 18.30 | S1029: 26.324999999999999 | T1029: 86.000 | U1029: 0.0 | V1029: 86.000
C1030: 6 | D1030: 6 | E1030: 6 | F1030: 5 | G1030: 7 | H1030: 6 | I1030: 6 | J1030: 5 | K1030: 6 | L1030: 5 | M1030: 5 | N1030: 6 | O1030: 6 | P1030: 7 | Q1030: 6 | R1030: 4 | S1030: 6 | T1030: 6 | V1030: 6
A1031: Madison | B1031: 6 | C1031: 16.90 | D1031: 16.70 | E1031: 16.800 | F1031: 16.80 | G1031: 16.80 | H1031: 16.800 | I1031: 33.600 | J1031: 17.00 | K1031: 16.40 | L1031: 16.70 | M1031: 25.050 | N1031: 16.80 | O1031: 17.00 | P1031: 17.20 | Q1031: 17.100 | R1031: 15.80 | S1031: 24.850 | T1031: 83.500 | U1031: 0.0 | V1031: 83.500
A1032: Scouts | C1032: 7 | D1032: 7 | E1032: 7 | F1032: 7 | G1032: 6 | H1032: 7 | I1032: 7 | J1032: 6 | K1032: 9 | L1032: 7 | M1032: 7 | N1032: 7 | O1032: 7 | P1032: 6 | Q1032: 7 | R1032: 10 | S1032: 8 | T1032: 7 | V1032: 7
A1033: Blue | B1033: 4 | C1033: 16.30 | D1033: 16.00 | E1033: 16.150 | F1033: 16.70 | G1033: 16.30 | H1033: 16.500 | I1033: 32.650 | J1033: 16.60 | K1033: 16.70 | L1033: 16.50 | M1033: 24.900 | N1033: 16.60 | O1033: 16.40 | P1033: 16.40 | Q1033: 16.400 | R1033: 17.10 | S1033: 25.050 | T1033: 82.600 | U1033: 0.0 | V1033: 82.600
A1034: Knights | C1034: 9 | D1034: 9 | E1034: 9 | F1034: 8 | G1034: 8 | H1034: 8 | I1034: 8 | J1034: 8 | K1034: 7 | L1034: 8 | M1034: 9 | N1034: 8 | O1034: 9 | P1034: 8 | Q1034: 8 | R1034: 8 | S1034: 7 | T1034: 8 | V1034: 8
A1035: Pacific | B1035: 5 | C1035: 16.60 | D1035: 16.40 | E1035: 16.500 | F1035: 16.40 | G1035: 15.80 | H1035: 16.100 | I1035: 32.600 | J1035: 16.20 | K1035: 16.50 | L1035: 17.20 | M1035: 24.950 | N1035: 16.00 | O1035: 16.70 | P1035: 15.90 | Q1035: 16.300 | R1035: 17.40 | S1035: 24.850 | T1035: 82.400 | U1035: 0.0 | V1035: 82.400
A1036: Crest | C1036: 8 | D1036: 8 | E1036: 8 | F1036: 9 | G1036: 9 | H1036: 9 | I1036: 9 | J1036: 9 | K1036: 8 | L1036: 6 | M1036: 8 | N1036: 9 | O1036: 8 | P1036: 9 | Q1036: 9 | R1036: 7 | S1036: 8 | T1036: 9 | V1036: 9
A1037: Music | B1037: 3 | C1037: 15.90 | D1037: 15.80 | E1037: 15.850 | F1037: 15.90 | G1037: 15.30 | H1037: 15.600 | I1037: 31.450 | J1037: 15.90 | K1037: 15.90 | L1037: 15.70 | M1037: 23.750 | N1037: 15.90 | O1037: 15.40 | P1037: 15.60 | Q1037: 15.500 | R1037: 16.10 | S1037: 23.750 | T1037: 78.950 | U1037: 4.0 | V1037: 74.950
A1038: City | C1038: 10 | D1038: 10 | E1038: 10 | F1038: 10 | G1038: 10 | H1038: 10 | I1038: 10 | J1038: 10 | K1038: 10 | L1038: 10 | M1038: 10 | N1038: 10 | O1038: 10 | P1038: 10 | Q1038: 10 | R1038: 9 | S1038: 10 | T1038: 10 | V1038: 10
A1039: Seattle | B1039: 2 | C1039: 14.60 | D1039: 15.10 | E1039: 14.850 | F1039: 14.90 | G1039: 14.60 | H1039: 14.750 | I1039: 29.600 | J1039: 15.20 | K1039: 15.10 | L1039: 14.60 | M1039: 22.450 | N1039: 14.60 | O1039: 13.10 | P1039: 13.60 | Q1039: 13.350 | R1039: 14.50 | S1039: 21.225000000000001 | T1039: 73.275000000000006 | U1039: 0.0 | V1039: 73.275000000000006
A1040: Cascades | C1040: 11 | D1040: 11 | E1040: 11 | F1040: 11 | G1040: 11 | H1040: 11 | I1040: 11 | J1040: 11 | K1040: 11 | L1040: 12 | M1040: 11 | N1040: 11 | O1040: 12 | P1040: 12 | Q1040: 12 | R1040: 11 | S1040: 11 | T1040: 11 | V1040: 11
A1041: Jersey | B1041: 1 | C1041: 14.40 | D1041: 14.80 | E1041: 14.600 | F1041: 14.70 | G1041: 14.10 | H1041: 14.400 | I1041: 29.000 | J1041: 14.40 | K1041: 14.80 | L1041: 15.20 | M1041: 22.200 | N1041: 14.30 | O1041: 13.80 | P1041: 14.00 | Q1041: 13.900 | R1041: 13.50 | S1041: 20.850 | T1041: 72.050 | U1041: 0.0 | V1041: 72.050
A1042: Surf | C1042: 12 | D1042: 12 | E1042: 12 | F1042: 12 | G1042: 12 | H1042: 12 | I1042: 12 | J1042: 12 | K1042: 12 | L1042: 11 | M1042: 12 | N1042: 12 | O1042: 11 | P1042: 11 | Q1042: 11 | R1042: 12 | S1042: 12 | T1042: 12 | V1042: 12
A1045: 7/30/2024 Newark, Delaware
C1046: General Effect | F1046: Visual | J1046: Music
C1047: 1 | D1047: 2 | F1047: Proficiency | G1047: Analysis | H1047: Color Guard | J1047: Brass | K1047: Analysis | L1047: Percussion | N1047: Sub | P1047: Total
C1048: W. Rickart | D1048: J. Rhodes | E1048: Total | F1048: J. Sturgeon | G1048: T. Pierce | H1048: M. Thompson | I1048: Total ÷2 | J1048: D. Thomas | K1048: J. Webb | L1048: M. Teal | M1048: Total ÷2 | N1048: Total | O1048: Pen | P1048: Score
A1049: DCI World Class | C1049: 20 | D1049: 20 | E1049: 40 | F1049: 20 | G1049: 20 | H1049: 20 | I1049: 30 | J1049: 20 | K1049: 20 | L1049: 20 | M1049: 30 | N1049: 100 | P1049: 100
A1050: Bluecoats | B1050: 6 | C1050: 19.40 | D1050: 19.00 | E1050: 38.40 | F1050: 18.80 | G1050: 19.00 | H1050: 19.10 | I1050: 28.45 | J1050: 19.30 | K1050: 18.70 | L1050: 18.75 | M1050: 28.375 | N1050: 95.224999999999994 | O1050: 0.0 | P1050: 95.224999999999994
C1051: 1 | D1051: 1 | E1051: 1 | F1051: 1 | G1051: 1 | H1051: 2 | I1051: 1 | J1051: 1 | K1051: 1 | L1051: 2 | M1051: 1 | N1051: 1 | P1051: 1
A1052: Blue | B1052: 7 | C1052: 19.10 | D1052: 18.80 | E1052: 37.90 | F1052: 18.70 | G1052: 18.70 | H1052: 19.20 | I1052: 28.30 | J1052: 19.05 | K1052: 18.40 | L1052: 18.65 | M1052: 28.050 | N1052: 94.250 | O1052: 0.0 | P1052: 94.250
A1053: Devils | C1053: 2 | D1053: 2 | E1053: 2 | F1053: 2 | G1053: 2 | H1053: 1 | I1053: 2 | J1053: 2 | K1053: 2 | L1053: 3 | M1053: 2 | N1053: 2 | P1053: 2
A1054: Vanguard | B1054: 5 | C1054: 18.40 | D1054: 17.80 | E1054: 36.20 | F1054: 17.80 | G1054: 18.40 | H1054: 18.30 | I1054: 27.25 | J1054: 18.50 | K1054: 17.40 | L1054: 18.80 | M1054: 27.350 | N1054: 90.800 | O1054: 0.0 | P1054: 90.800
C1055: 3 | D1055: 3 | E1055: 3 | F1055: 3 | G1055: 3 | H1055: 3 | I1055: 3 | J1055: 3 | K1055: 3 | L1055: 1 | M1055: 3 | N1055: 3 | P1055: 3
A1056: Troopers | B1056: 4 | C1056: 17.30 | D1056: 17.50 | E1056: 34.80 | F1056: 16.90 | G1056: 16.60 | H1056: 16.60 | I1056: 25.05 | J1056: 18.20 | K1056: 17.30 | L1056: 18.10 | M1056: 26.800 | N1056: 86.650 | O1056: 0.0 | P1056: 86.650
C1057: 4 | D1057: 4 | E1057: 4 | F1057: 4 | G1057: 5 | H1057: 4 | I1057: 4 | J1057: 4 | K1057: 4 | L1057: 4 | M1057: 4 | N1057: 4 | P1057: 4
A1058: Blue | B1058: 2 | C1058: 16.50 | D1058: 16.50 | E1058: 33.00 | F1058: 16.50 | G1058: 17.10 | H1058: 16.50 | I1058: 25.05 | J1058: 16.70 | K1058: 16.70 | L1058: 17.30 | M1058: 25.350 | N1058: 83.400 | O1058: 0.0 | P1058: 83.400
A1059: Knights | C1059: 5 | D1059: 6 | E1059: 5 | F1059: 6 | G1059: 4 | H1059: 5 | I1059: 4 | J1059: 5 | K1059: 5 | L1059: 5 | M1059: 5 | N1059: 5 | P1059: 5
A1060: Crossmen | B1060: 3 | C1060: 16.30 | D1060: 16.70 | E1060: 33.00 | F1060: 16.60 | G1060: 16.40 | H1060: 16.40 | I1060: 24.70 | J1060: 16.30 | K1060: 16.00 | L1060: 16.80 | M1060: 24.550 | N1060: 82.250 | O1060: 0.0 | P1060: 82.250
C1061: 6 | D1061: 5 | E1061: 5 | F1061: 5 | G1061: 6 | H1061: 6 | I1061: 6 | J1061: 6 | K1061: 6 | L1061: 6 | M1061: 6 | N1061: 6 | P1061: 6
A1062: Jersey | B1062: 1 | C1062: 15.40 | D1062: 14.30 | E1062: 29.70 | F1062: 14.60 | G1062: 15.20 | H1062: 15.20 | I1062: 22.50 | J1062: 15.00 | K1062: 13.80 | L1062: 13.70 | M1062: 21.250 | N1062: 73.450 | O1062: 0.0 | P1062: 73.450
A1063: Surf | C1063: 7 | D1063: 7 | E1063: 7 | F1063: 7 | G1063: 7 | H1063: 7 | I1063: 7 | J1063: 7 | K1063: 7 | L1063: 7 | M1063: 7 | N1063: 7 | P1063: 7
A1066: 7/30/2024 Salem, Virginia
C1067: General Effect | F1067: Visual | J1067: Music
C1068: 1 | D1068: 2 | F1068: Proficiency | G1068: Analysis | H1068: Color Guard | J1068: Brass | K1068: Analysis | L1068: Percussion | N1068: Sub | P1068: Total
C1069: D. Padilla | D1069: P. Smith | E1069: Total | F1069: M. Turner | G1069: T. Slaughter | H1069: K. Miller | I1069: Total ÷2 | J1069: M. Brown | K1069: G. Fugett | L1069: J. Brooks | M1069: Total ÷2 | N1069: Total | O1069: Pen | P1069: Score
A1070: DCI World Class | C1070: 20 | D1070: 20 | E1070: 40 | F1070: 20 | G1070: 20 | H1070: 20 | I1070: 30 | J1070: 20 | K1070: 20 | L1070: 20 | M1070: 30 | N1070: 100 | P1070: 100
A1071: Carolina | B1071: 6 | C1071: 18.50 | D1071: 18.70 | E1071: 37.20 | F1071: 18.40 | G1071: 18.50 | H1071: 19.00 | I1071: 27.95 | J1071: 18.80 | K1071: 18.40 | L1071: 18.90 | M1071: 28.05 | N1071: 93.20 | O1071: 0.0 | P1071: 93.20
A1072: Crown | C1072: 1 | D1072: 1 | E1072: 1 | F1072: 1 | G1072: 1 | H1072: 1 | I1072: 1 | J1072: 1 | K1072: 1 | L1072: 1 | M1072: 1 | N1072: 1 | P1072: 1
A1073: Colts | B1073: 4 | C1073: 17.30 | D1073: 17.70 | E1073: 35.00 | F1073: 17.00 | G1073: 17.20 | H1073: 17.30 | I1073: 25.75 | J1073: 16.70 | K1073: 17.30 | L1073: 18.30 | M1073: 26.15 | N1073: 86.90 | O1073: 0.0 | P1073: 86.90
C1074: 2 | D1074: 2 | E1074: 2 | F1074: 2 | G1074: 3 | H1074: 3 | I1074: 2 | J1074: 3 | K1074: 2 | L1074: 3 | M1074: 3 | N1074: 2 | P1074: 2
A1075: Cavaliers | B1075: 5 | C1075: 17.20 | D1075: 17.30 | E1075: 34.50 | F1075: 16.70 | G1075: 17.30 | H1075: 17.40 | I1075: 25.70 | J1075: 16.80 | K1075: 17.00 | L1075: 18.70 | M1075: 26.25 | N1075: 86.45 | O1075: 0.0 | P1075: 86.45
C1076: 3 | D1076: 3 | E1076: 3 | F1076: 3 | G1076: 2 | H1076: 2 | I1076: 3 | J1076: 2 | K1076: 3 | L1076: 2 | M1076: 2 | N1076: 3 | P1076: 3
A1077: Pacific | B1077: 3 | C1077: 16.70 | D1077: 16.80 | E1077: 33.50 | F1077: 16.10 | G1077: 16.90 | H1077: 17.10 | I1077: 25.05 | J1077: 16.40 | K1077: 16.80 | L1077: 17.50 | M1077: 25.35 | N1077: 83.90 | O1077: 0.0 | P1077: 83.90
A1078: Crest | C1078: 4 | D1078: 4 | E1078: 4 | F1078: 4 | G1078: 4 | H1078: 4 | I1078: 4 | J1078: 4 | K1078: 4 | L1078: 4 | M1078: 4 | N1078: 4 | P1078: 4
A1079: Academy | B1079: 2 | C1079: 15.80 | D1079: 16.20 | E1079: 32.00 | F1079: 15.50 | G1079: 15.90 | H1079: 15.60 | I1079: 23.50 | J1079: 16.20 | K1079: 16.00 | L1079: 16.50 | M1079: 24.35 | N1079: 79.85 | O1079: 0.0 | P1079: 79.85
C1080: 5 | D1080: 5 | E1080: 5 | F1080: 5 | G1080: 5 | H1080: 5 | I1080: 5 | J1080: 5 | K1080: 5 | L1080: 5 | M1080: 5 | N1080: 4 | P1080: 4
A1081: Seattle | B1081: 1 | C1081: 14.90 | D1081: 15.40 | E1081: 30.30 | F1081: 14.90 | G1081: 15.00 | H1081: 14.80 | I1081: 22.35 | J1081: 14.40 | K1081: 14.50 | L1081: 14.80 | M1081: 21.85 | N1081: 74.50 | O1081: 0.0 | P1081: 74.50
A1082: Cascades | C1082: 6 | D1082: 6 | E1082: 6 | F1082: 6 | G1082: 6 | H1082: 6 | I1082: 6 | J1082: 6 | K1082: 6 | L1082: 6 | M1082: 6 | N1082: 6 | P1082: 6
A1085: 7/30/2024 Centerville, Ohio
C1086: General Effect | F1086: Visual | J1086: Music
C1087: 1 | D1087: 2 | F1087: Proficiency | G1087: Analysis | H1087: Color Guard | J1087: Brass | K1087: Analysis | L1087: Percussion | N1087: Sub | P1087: Total
C1088: J. Orefice | D1088: K. Turner | E1088: Total | F1088: C. Chumley | G1088: C. Dillon | H1088: J. Purcifull | I1088: Total ÷2 | J1088: J. Mills | K1088: B. Fabrizio | L1088: T. Sanders | M1088: Total ÷2 | N1088: Total | O1088: Pen | P1088: Score
A1089: DCI World Class | C1089: 20 | D1089: 20 | E1089: 40 | F1089: 20 | G1089: 20 | H1089: 20 | I1089: 30 | J1089: 20 | K1089: 20 | L1089: 20 | M1089: 30 | N1089: 100 | P1089: 100
A1090: Mandarins | B1090: 5 | C1090: 18.10 | D1090: 17.60 | E1090: 35.70 | F1090: 18.10 | G1090: 17.90 | H1090: 18.10 | I1090: 27.05 | J1090: 18.50 | K1090: 18.10 | L1090: 18.40 | M1090: 27.50 | N1090: 90.25 | O1090: 0.0 | P1090: 90.25
C1091: 1 | D1091: 1 | E1091: 1 | F1091: 1 | G1091: 1 | H1091: 2 | I1091: 1 | J1091: 1 | K1091: 1 | L1091: 1 | M1091: 1 | N1091: 1 | P1091: 1
A1092: Blue | B1092: 4 | C1092: 17.60 | D1092: 17.30 | E1092: 34.90 | F1092: 17.60 | G1092: 17.50 | H1092: 18.30 | I1092: 26.70 | J1092: 18.10 | K1092: 17.70 | L1092: 17.90 | M1092: 26.85 | N1092: 88.45 | O1092: 0.0 | P1092: 88.45
A1093: Stars | C1093: 2 | D1093: 2 | E1093: 2 | F1093: 2 | G1093: 2 | H1093: 1 | I1093: 2 | J1093: 2 | K1093: 2 | L1093: 2 | M1093: 2 | N1093: 2 | P1093: 2
A1094: Madison | B1094: 3 | C1094: 16.90 | D1094: 16.80 | E1094: 33.70 | F1094: 17.20 | G1094: 17.00 | H1094: 17.10 | I1094: 25.65 | J1094: 17.70 | K1094: 17.00 | L1094: 16.50 | M1094: 25.60 | N1094: 84.95 | O1094: 0.0 | P1094: 84.95
A1095: Scouts | C1095: 3 | D1095: 3 | E1095: 3 | F1095: 3 | G1095: 3 | H1095: 3 | I1095: 3 | J1095: 3 | K1095: 3 | L1095: 4 | M1095: 3 | N1095: 3 | P1095: 3
A1096: Music | B1096: 2 | C1096: 16.20 | D1096: 15.90 | E1096: 32.10 | F1096: 16.50 | G1096: 16.30 | H1096: 15.50 | I1096: 24.15 | J1096: 16.80 | K1096: 15.90 | L1096: 16.60 | M1096: 24.65 | N1096: 80.90 | O1096: 0.0 | P1096: 80.90
A1097: City | C1097: 4 | D1097: 4 | E1097: 4 | F1097: 4 | G1097: 4 | H1097: 4 | I1097: 4 | J1097: 4 | K1097: 4 | L1097: 3 | M1097: 4 | N1097: 4 | P1097: 4
A1098: Genesis | B1098: 1 | C1098: 15.20 | D1098: 14.90 | E1098: 30.10 | F1098: 16.10 | G1098: 15.30 | H1098: 14.60 | I1098: 23.00 | J1098: 15.80 | K1098: 15.30 | L1098: 16.10 | M1098: 23.60 | N1098: 76.70 | O1098: 0.0 | P1098: 76.70
C1099: 5 | D1099: 5 | E1099: 5 | F1099: 5 | G1099: 5 | H1099: 5 | I1099: 5 | J1099: 5 | K1099: 5 | L1099: 5 | M1099: 5 | N1099: 5 | P1099: 5
A1100: DCI Open Class
A1101: Raiders | B1101: 1 | C1101: 13.30 | D1101: 13.10 | E1101: 26.40 | F1101: 13.30 | G1101: 14.00 | H1101: 13.80 | I1101: 20.55 | J1101: 15.20 | K1101: 13.30 | L1101: 14.50 | M1101: 21.50 | N1101: 68.45 | O1101: 0.0 | P1101: 68.45
C1102: 1 | D1102: 1 | E1102: 1 | F1102: 2 | G1102: 1 | H1102: 1 | I1102: 1 | J1102: 1 | K1102: 1 | L1102: 1 | M1102: 1 | N1102: 1 | P1102: 1
A1103: 7th | B1103: 2 | C1103: 13.00 | D1103: 12.00 | E1103: 25.00 | F1103: 13.70 | G1103: 13.40 | H1103: 13.70 | I1103: 20.40 | J1103: 14.20 | K1103: 13.00 | L1103: 13.80 | M1103: 20.50 | N1103: 65.90 | O1103: 0.0 | P1103: 65.90
A1104: Regiment | C1104: 2 | D1104: 2 | E1104: 2 | F1104: 1 | G1104: 2 | H1104: 2 | I1104: 2 | J1104: 2 | K1104: 2 | L1104: 2 | M1104: 2 | N1104: 2 | P1104: 2
A1105: DCI All Age Open Class
A1106: Cincinnati | B1106: 1 | C1106: 16.60 | D1106: 16.50 | E1106: 33.10 | F1106: 15.50 | G1106: 17.20 | H1106: 16.80 | I1106: 24.75 | J1106: 17.20 | K1106: 17.20 | L1106: 17.70 | M1106: 26.05 | N1106: 83.90 | O1106: 0.0 | P1106: 83.90
A1107: Tradition | C1107: 1 | D1107: 1 | E1107: 1 | F1107: 1 | G1107: 1 | H1107: 1 | I1107: 1 | J1107: 1 | K1107: 1 | L1107: 1 | M1107: 1 | N1107: 1 | P1107: 1
A1110: 7/31/2024 Champlin, Minnesota
C1111: General Effect | F1111: Visual | J1111: Music
C1112: 1 | D1112: 2 | F1112: Proficiency | G1112: Analysis | H1112: Color Guard | J1112: Brass | K1112: Analysis | L1112: Percussion | N1112: Sub | P1112: Total
C1113: R. Bailey | D1113: A. Cook | E1113: Total | F1113: No Judge | G1113: C. Church | H1113: A. Combites | I1113: Total ÷2 | J1113: C. Armbruster | K1113: P. Haines | L1113: B. Williams | M1113: Total ÷2 | N1113: Total | O1113: Pen | P1113: Score
A1114: DCI Open Class | C1114: 20 | D1114: 20 | E1114: 40 | F1114: 20 | G1114: 20 | H1114: 20 | I1114: 30 | J1114: 20 | K1114: 20 | L1114: 20 | M1114: 30 | N1114: 100 | P1114: 100
A1115: Columbians | B1115: 2 | C1115: 15.50 | D1115: 15.50 | E1115: 31.00 | F1115: 15.50 | G1115: 15.50 | H1115: 14.10 | I1115: 22.55 | J1115: 15.20 | K1115: 15.20 | L1115: 15.60 | M1115: 23.00 | N1115: 76.55 | O1115: 0.0 | P1115: 76.55
C1116: 1 | D1116: 1 | E1116: 1 | F1116: 2 | G1116: 2 | H1116: 2 | I1116: 2 | J1116: 1 | K1116: 1 | L1116: 3 | M1116: 1 | N1116: 1 | P1116: 1
A1117: River City | B1117: 3 | C1117: 15.20 | D1117: 15.00 | E1117: 30.20 | F1117: 15.80 | G1117: 15.80 | H1117: 14.30 | I1117: 22.95 | J1117: 14.90 | K1117: 14.50 | L1117: 16.50 | M1117: 22.95 | N1117: 76.10 | O1117: 0.0 | P1117: 76.10
A1118: Rhythm | C1118: 2 | D1118: 2 | E1118: 2 | F1118: 1 | G1118: 1 | H1118: 1 | I1118: 1 | J1118: 2 | K1118: 2 | L1118: 1 | M1118: 2 | N1118: 2 | P1118: 2
A1119: Colt | B1119: 1 | C1119: 14.80 | D1119: 14.20 | E1119: 29.00 | F1119: 14.60 | G1119: 14.60 | H1119: 13.20 | I1119: 21.20 | J1119: 13.90 | K1119: 13.80 | L1119: 15.90 | M1119: 21.80 | N1119: 72.00 | O1119: 0.0 | P1119: 72.00
A1120: Cadets | C1120: 3 | D1120: 3 | E1120: 3 | F1120: 3 | G1120: 3 | H1120: 3 | I1120: 3 | J1120: 3 | K1120: 3 | L1120: 2 | M1120: 3 | N1120: 3 | P1120: 3
A1121: DCI All Age Class A
A1122: Govenaires | B1122: 1 | C1122: 15.30 | D1122: 15.40 | E1122: 30.70 | F1122: 14.70 | G1122: 14.70 | H1122: 15.50 | I1122: 22.45 | J1122: 15.50 | K1122: 14.90 | L1122: 15.70 | M1122: 23.05 | N1122: 76.20 | O1122: 0.0 | P1122: 76.20
C1123: 1 | D1123: 1 | E1123: 1 | F1123: 1 | G1123: 1 | H1123: 1 | I1123: 1 | J1123: 1 | K1123: 1 | L1123: 1 | M1123: 1 | N1123: 1 | P1123: 1
A1126: 7/31/2024 Huntington, West Virginia
C1127: General Effect | F1127: Visual | J1127: Music
C1128: 1 | D1128: 2 | F1128: Proficiency | G1128: Analysis | H1128: Color Guard | J1128: Brass | K1128: Analysis | L1128: Percussion | N1128: Sub | P1128: Total
C1129: D. Padilla | D1129: J. Rhodes | E1129: Total | F1129: K. Miller | G1129: T. Slaughter | H1129: M. Turner | I1129: Total ÷2 | J1129: M. Brown | K1129: J. Webb | L1129: M. Teal | M1129: Total ÷2 | N1129: Total | O1129: Pen | P1129: Score
A1130: DCI World Class | C1130: 20 | D1130: 20 | E1130: 40 | F1130: 20 | G1130: 20 | H1130: 20 | I1130: 30 | J1130: 20 | K1130: 20 | L1130: 20 | M1130: 30 | N1130: 100 | P1130: 100
A1131: Phantom | B1131: 6 | C1131: 18.40 | D1131: 18.60 | E1131: 37.00 | F1131: 18.30 | G1131: 18.60 | H1131: 17.70 | I1131: 27.30 | J1131: 18.75 | K1131: 18.40 | L1131: 18.80 | M1131: 27.975000000000001 | N1131: 92.275000000000006 | O1131: 0.0 | P1131: 92.275000000000006
A1132: Regiment | C1132: 1 | D1132: 1 | E1132: 1 | F1132: 1 | G1132: 1 | H1132: 2 | I1132: 1 | J1132: 2 | K1132: 1 | L1132: 1 | M1132: 1 | N1132: 1 | P1132: 1
A1133: Mandarins | B1133: 4 | C1133: 18.00 | D1133: 18.20 | E1133: 36.20 | F1133: 18.20 | G1133: 18.10 | H1133: 18.00 | I1133: 27.15 | J1133: 18.40 | K1133: 17.70 | L1133: 18.20 | M1133: 27.150 | N1133: 90.500 | O1133: 0.0 | P1133: 90.500
C1134: 2 | D1134: 2 | E1134: 2 | F1134: 2 | G1134: 2 | H1134: 1 | I1134: 2 | J1134: 3 | K1134: 2 | L1134: 2 | M1134: 2 | N1134: 2 | P1134: 2
A1135: Blue | B1135: 5 | C1135: 17.70 | D1135: 17.70 | E1135: 35.40 | F1135: 17.70 | G1135: 17.60 | H1135: 17.10 | I1135: 26.20 | J1135: 18.85 | K1135: 17.50 | L1135: 17.40 | M1135: 26.875 | N1135: 88.474999999999994 | O1135: 0.0 | P1135: 88.474999999999994
A1136: Stars | C1136: 3 | D1136: 3 | E1136: 3 | F1136: 3 | G1136: 3 | H1136: 3 | I1136: 3 | J1136: 1 | K1136: 3 | L1136: 4 | M1136: 3 | N1136: 3 | P1136: 3
A1137: Madison | B1137: 3 | C1137: 16.90 | D1137: 17.10 | E1137: 34.00 | F1137: 16.60 | G1137: 17.20 | H1137: 16.90 | I1137: 25.35 | J1137: 16.90 | K1137: 16.60 | L1137: 17.10 | M1137: 25.300 | N1137: 84.650 | O1137: 0.0 | P1137: 84.650
A1138: Scouts | C1138: 4 | D1138: 4 | E1138: 4 | F1138: 4 | G1138: 4 | H1138: 4 | I1138: 4 | J1138: 4 | K1138: 4 | L1138: 5 | M1138: 4 | N1138: 4 | P1138: 4
A1139: Spirit of | B1139: 2 | C1139: 16.30 | D1139: 16.30 | E1139: 32.60 | F1139: 15.70 | G1139: 16.50 | H1139: 15.80 | I1139: 24.00 | J1139: 16.20 | K1139: 16.00 | L1139: 17.60 | M1139: 24.900 | N1139: 81.500 | O1139: 0.0 | P1139: 81.500
A1140: Atlanta | C1140: 5 | D1140: 5 | E1140: 5 | F1140: 6 | G1140: 5 | H1140: 5 | I1140: 5 | J1140: 5 | K1140: 5 | L1140: 3 | M1140: 5 | N1140: 5 | P1140: 5
A1141: Genesis | B1141: 1 | C1141: 15.60 | D1141: 15.50 | E1141: 31.10 | F1141: 16.30 | G1141: 15.90 | H1141: 14.00 | I1141: 23.10 | J1141: 14.70 | K1141: 15.20 | L1141: 15.70 | M1141: 22.800 | N1141: 77.000 | O1141: 0.0 | P1141: 77.000
C1142: 6 | D1142: 6 | E1142: 6 | F1142: 5 | G1142: 6 | H1142: 6 | I1142: 6 | J1142: 6 | K1142: 6 | L1142: 6 | M1142: 6 | N1142: 6 | P1142: 6
A1143: DCI Open Class
A1144: Spartans | B1144: 2 | C1144: 15.90 | D1144: 15.10 | E1144: 31.00 | F1144: 16.40 | G1144: 16.20 | H1144: 16.50 | I1144: 24.55 | J1144: 15.00 | K1144: 13.00 | L1144: 16.00 | M1144: 22.000 | N1144: 77.550 | O1144: 0.0 | P1144: 77.550
C1145: 1 | D1145: 1 | E1145: 1 | F1145: 1 | G1145: 1 | H1145: 1 | I1145: 1 | J1145: 1 | K1145: 2 | L1145: 2 | M1145: 2 | N1145: 1 | P1145: 1
A1146: Gold | B1146: 3 | C1146: 15.40 | D1146: 15.00 | E1146: 30.40 | F1146: 15.60 | G1146: 16.00 | H1146: 14.90 | I1146: 23.25 | J1146: 14.90 | K1146: 14.80 | L1146: 16.30 | M1146: 23.000 | N1146: 76.650 | O1146: 0.0 | P1146: 76.650
C1147: 2 | D1147: 2 | E1147: 2 | F1147: 2 | G1147: 2 | H1147: 2 | I1147: 2 | J1147: 2 | K1147: 1 | L1147: 1 | M1147: 1 | N1147: 2 | P1147: 2
A1148: Les | B1148: 1 | C1148: 13.00 | D1148: 12.30 | E1148: 25.30 | F1148: 13.00 | G1148: 12.60 | H1148: 12.50 | I1148: 19.05 | J1148: 13.20 | K1148: 12.20 | L1148: 12.30 | M1148: 18.850 | N1148: 63.200 | O1148: 0.0 | P1148: 63.200
A1149: Stentors | C1149: 3 | D1149: 3 | E1149: 3 | F1149: 3 | G1149: 3 | H1149: 3 | I1149: 3 | J1149: 3 | K1149: 3 | L1149: 3 | M1149: 3 | N1149: 3 | P1149: 3