A1: 8/1/2024 Lawrence, Massachusetts
C2: General Effect | F2: Visual | J2: Music
C3: 1 | D3: 2 | F3: Proficiency | G3: Analysis | H3: Color Guard | J3: Brass | K3: Analysis | L3: Percussion | N3: Sub | P3: Total
C4: D. Torchia | D4: K. Turner | E4: Total | F4: M. Thompson | G4: G. Oliviero | H4: C. Raichle | I4: Total ÷2 | J4: D. Thomas | K4: J. Webb | L4: P. Furnari | M4: Total ÷2 | N4: Total | O4: Pen | P4: Score
A5: DCI World Class | C5: 20 | D5: 20 | E5: 40 | F5: 20 | G5: 20 | H5: 20 | I5: 30 | J5: 20 | K5: 20 | L5: 20 | M5: 30 | N5: 100 | P5: 100
A6: Boston | B6: 5 | C6: 18.80 | D6: 18.80 | E6: 37.60 | F6: 19.00 | G6: 19.20 | H6: 19.30 | I6: 28.75 | J6: 19.30 | K6: 18.60 | L6: 19.30 | M6: 28.60 | N6: 94.95 | O6: 0.0 | P6: 94.95
A7: Crusaders | C7: =RANK(C6,(C$6,C$8,C$10,C$12,C$14,C$16,C$18,C$20,C$22,C$24,C$26,C$28,C$30,C$32,C$34,C$36,C$38,C$40,C$42,C$44,C$46,C$48,C$50,C$52,C$54,C$56,C$58,C$60,C$62,C$64,C$66,C$68,C$70,C$72,C$74,C$76,C$78,C$80,C$82,C$84,C$86,C$88,C$90,C$92,C$94,C$96,C$98,C$100,C$102,C$104,C$106,C$108,C$110,C$112,C$114,C$116,C$118,C$120,C$122,C$124)) -> 5 | D7: =RANK(D6,(D$6,D$8,D$10,D$12,D$14,D$16,D$18,D$20,D$22,D$24,D$26,D$28,D$30,D$32,D$34,D$36,D$38,D$40,D$42,D$44,D$46,D$48,D$50,D$52,D$54,D$56,D$58,D$60,D$62,D$64,D$66,D$68,D$70,D$72,D$74,D$76,D$78,D$80,D$82,D$84,D$86,D$88,D$90,D$92,D$94,D$96,D$98,D$100,D$102,D$104,D$106,D$108,D$110,D$112,D$114,D$116,D$118,D$120,D$122,D$124)) -> 5 | E7: =RANK(E6,(E$6,E$8,E$10,E$12,E$14,E$16,E$18,E$20,E$22,E$24,E$26,E$28,E$30,E$32,E$34,E$36,E$38,E$40,E$42,E$44,E$46,E$48,E$50,E$52,E$54,E$56,E$58,E$60,E$62,E$64,E$66,E$68,E$70,E$72,E$74,E$76,E$78,E$80,E$82,E$84,E$86,E$88,E$90,E$92,E$94,E$96,E$98,E$100,E$102,E$104,E$106,E$108,E$110,E$112,E$114,E$116,E$118,E$120,E$122,E$124)) -> 3 | F7: =RANK(F6,(F$6,F$8,F$10,F$12,F$14,F$16,F$18,F$20,F$22,F$24,F$26,F$28,F$30,F$32,F$34,F$36,F$38,F$40,F$42,F$44,F$46,F$48,F$50,F$52,F$54,F$56,F$58,F$60,F$62,F$64,F$66,F$68,F$70,F$72,F$74,F$76,F$78,F$80,F$82,F$84,F$86,F$88,F$90,F$92,F$94,F$96,F$98,F$100,F$102,F$104,F$106,F$108,F$110,F$112,F$114,F$116,F$118,F$120,F$122,F$124)) -> 4 | G7: =RANK(G6,(G$6,G$8,G$10,G$12,G$14,G$16,G$18,G$20,G$22,G$24,G$26,G$28,G$30,G$32,G$34,G$36,G$38,G$40,G$42,G$44,G$46,G$48,G$50,G$52,G$54,G$56,G$58,G$60,G$62,G$64,G$66,G$68,G$70,G$72,G$74,G$76,G$78,G$80,G$82,G$84,G$86,G$88,G$90,G$92,G$94,G$96,G$98,G$100,G$102,G$104,G$106,G$108,G$110,G$112,G$114,G$116,G$118,G$120,G$122,G$124)) -> 3 | H7: =RANK(H6,(H$6,H$8,H$10,H$12,H$14,H$16,H$18,H$20,H$22,H$24,H$26,H$28,H$30,H$32,H$34,H$36,H$38,H$40,H$42,H$44,H$46,H$48,H$50,H$52,H$54,H$56,H$58,H$60,H$62,H$64,H$66,H$68,H$70,H$72,H$74,H$76,H$78,H$80,H$82,H$84,H$86,H$88,H$90,H$92,H$94,H$96,H$98,H$100,H$102,H$104,H$106,H$108,H$110,H$112,H$114,H$116,H$118,H$120,H$122,H$124)) -> 3 | I7: =RANK(I6,(I$6,I$8,I$10,I$12,I$14,I$16,I$18,I$20,I$22,I$24,I$26,I$28,I$30,I$32,I$34,I$36,I$38,I$40,I$42,I$44,I$46,I$48,I$50,I$52,I$54,I$56,I$58,I$60,I$62,I$64,I$66,I$68,I$70,I$72,I$74,I$76,I$78,I$80,I$82,I$84,I$86,I$88,I$90,I$92,I$94,I$96,I$98,I$100,I$102,I$104,I$106,I$108,I$110,I$112,I$114,I$116,I$118,I$120,I$122,I$124)) -> 13 | J7: =RANK(J6,(J$6,J$8,J$10,J$12,J$14,J$16,J$18,J$20,J$22,J$24,J$26,J$28,J$30,J$32,J$34,J$36,J$38,J$40,J$42,J$44,J$46,J$48,J$50,J$52,J$54,J$56,J$58,J$60,J$62,J$64,J$66,J$68,J$70,J$72,J$74,J$76,J$78,J$80,J$82,J$84,J$86,J$88,J$90,J$92,J$94,J$96,J$98,J$100,J$102,J$104,J$106,J$108,J$110,J$112,J$114,J$116,J$118,J$120,J$122,J$124)) -> 3 | K7: =RANK(K6,(K$6,K$8,K$10,K$12,K$14,K$16,K$18,K$20,K$22,K$24,K$26,K$28,K$30,K$32,K$34,K$36,K$38,K$40,K$42,K$44,K$46,K$48,K$50,K$52,K$54,K$56,K$58,K$60,K$62,K$64,K$66,K$68,K$70,K$72,K$74,K$76,K$78,K$80,K$82,K$84,K$86,K$88,K$90,K$92,K$94,K$96,K$98,K$100,K$102,K$104,K$106,K$108,K$110,K$112,K$114,K$116,K$118,K$120,K$122,K$124)) -> 5 | L7: =RANK(L6,(L$6,L$8,L$10,L$12,L$14,L$16,L$18,L$20,L$22,L$24,L$26,L$28,L$30,L$32,L$34,L$36,L$38,L$40,L$42,L$44,L$46,L$48,L$50,L$52,L$54,L$56,L$58,L$60,L$62,L$64,L$66,L$68,L$70,L$72,L$74,L$76,L$78,L$80,L$82,L$84,L$86,L$88,L$90,L$92,L$94,L$96,L$98,L$100,L$102,L$104,L$106,L$108,L$110,L$112,L$114,L$116,L$118,L$120,L$122,L$124)) -> 3 | M7: =RANK(M6,(M$6,M$8,M$10,M$12,M$14,M$16,M$18,M$20,M$22,M$24,M$26,M$28,M$30,M$32,M$34,M$36,M$38,M$40,M$42,M$44,M$46,M$48,M$50,M$52,M$54,M$56,M$58,M$60,M$62,M$64,M$66,M$68,M$70,M$72,M$74,M$76,M$78,M$80,M$82,M$84,M$86,M$88,M$90,M$92,M$94,M$96,M$98,M$100,M$102,M$104,M$106,M$108,M$110,M$112,M$114,M$116,M$118,M$120,M$122,M$124)) -> 4 | N7: =RANK(N6,(N$6,N$8,N$10,N$12,N$14,N$16,N$18,N$20,N$22,N$24,N$26,N$28,N$30,N$32,N$34,N$36,N$38,N$40,N$42,N$44,N$46,N$48,N$50,N$52,N$54,N$56,N$58,N$60,N$62,N$64,N$66,N$68,N$70,N$72,N$74,N$76,N$78,N$80,N$82,N$84,N$86,N$88,N$90,N$92,N$94,N$96,N$98,N$100,N$102,N$104,N$106,N$108,N$110,N$112,N$114,N$116,N$118,N$120,N$122,N$124)) -> 3 | P7: =RANK(P6,(P$6,P$8,P$10,P$12,P$14,P$16,P$18,P$20,P$22,P$24,P$26,P$28,P$30,P$32,P$34,P$36,P$38,P$40,P$42,P$44,P$46,P$48,P$50,P$52,P$54,P$56,P$58,P$60,P$62,P$64,P$66,P$68,P$70,P$72,P$74,P$76,P$78,P$80,P$82,P$84,P$86,P$88,P$90,P$92,P$94,P$96,P$98,P$100,P$102,P$104,P$106,P$108,P$110,P$112,P$114,P$116,P$118,P$120,P$122,P$124)) -> 3
A8: Carolina | B8: 4 | C8: 18.50 | D8: 18.30 | E8: 36.80 | F8: 18.60 | G8: 18.90 | H8: 18.90 | I8: 28.20 | J8: 19.00 | K8: 18.10 | L8: 18.30 | M8: 27.70 | N8: 92.70 | O8: 0.0 | P8: 92.70
A9: Crown | C9: =RANK(C8,(C$6,C$8,C$10,C$12,C$14,C$16,C$18,C$20,C$22,C$24,C$26,C$28,C$30,C$32,C$34,C$36,C$38,C$40,C$42,C$44,C$46,C$48,C$50,C$52,C$54,C$56,C$58,C$60,C$62,C$64,C$66,C$68,C$70,C$72,C$74,C$76,C$78,C$80,C$82,C$84,C$86,C$88,C$90,C$92,C$94,C$96,C$98,C$100,C$102,C$104,C$106,C$108,C$110,C$112,C$114,C$116,C$118,C$120,C$122,C$124)) -> 6 | D9: =RANK(D8,(D$6,D$8,D$10,D$12,D$14,D$16,D$18,D$20,D$22,D$24,D$26,D$28,D$30,D$32,D$34,D$36,D$38,D$40,D$42,D$44,D$46,D$48,D$50,D$52,D$54,D$56,D$58,D$60,D$62,D$64,D$66,D$68,D$70,D$72,D$74,D$76,D$78,D$80,D$82,D$84,D$86,D$88,D$90,D$92,D$94,D$96,D$98,D$100,D$102,D$104,D$106,D$108,D$110,D$112,D$114,D$116,D$118,D$120,D$122,D$124)) -> 6 | E9: =RANK(E8,(E$6,E$8,E$10,E$12,E$14,E$16,E$18,E$20,E$22,E$24,E$26,E$28,E$30,E$32,E$34,E$36,E$38,E$40,E$42,E$44,E$46,E$48,E$50,E$52,E$54,E$56,E$58,E$60,E$62,E$64,E$66,E$68,E$70,E$72,E$74,E$76,E$78,E$80,E$82,E$84,E$86,E$88,E$90,E$92,E$94,E$96,E$98,E$100,E$102,E$104,E$106,E$108,E$110,E$112,E$114,E$116,E$118,E$120,E$122,E$124)) -> 4 | F9: =RANK(F8,(F$6,F$8,F$10,F$12,F$14,F$16,F$18,F$20,F$22,F$24,F$26,F$28,F$30,F$32,F$34,F$36,F$38,F$40,F$42,F$44,F$46,F$48,F$50,F$52,F$54,F$56,F$58,F$60,F$62,F$64,F$66,F$68,F$70,F$72,F$74,F$76,F$78,F$80,F$82,F$84,F$86,F$88,F$90,F$92,F$94,F$96,F$98,F$100,F$102,F$104,F$106,F$108,F$110,F$112,F$114,F$116,F$118,F$120,F$122,F$124)) -> 6 | G9: =RANK(G8,(G$6,G$8,G$10,G$12,G$14,G$16,G$18,G$20,G$22,G$24,G$26,G$28,G$30,G$32,G$34,G$36,G$38,G$40,G$42,G$44,G$46,G$48,G$50,G$52,G$54,G$56,G$58,G$60,G$62,G$64,G$66,G$68,G$70,G$72,G$74,G$76,G$78,G$80,G$82,G$84,G$86,G$88,G$90,G$92,G$94,G$96,G$98,G$100,G$102,G$104,G$106,G$108,G$110,G$112,G$114,G$116,G$118,G$120,G$122,G$124)) -> 5 | H9: =RANK(H8,(H$6,H$8,H$10,H$12,H$14,H$16,H$18,H$20,H$22,H$24,H$26,H$28,H$30,H$32,H$34,H$36,H$38,H$40,H$42,H$44,H$46,H$48,H$50,H$52,H$54,H$56,H$58,H$60,H$62,H$64,H$66,H$68,H$70,H$72,H$74,H$76,H$78,H$80,H$82,H$84,H$86,H$88,H$90,H$92,H$94,H$96,H$98,H$100,H$102,H$104,H$106,H$108,H$110,H$112,H$114,H$116,H$118,H$120,H$122,H$124)) -> 6 | I9: =RANK(I8,(I$6,I$8,I$10,I$12,I$14,I$16,I$18,I$20,I$22,I$24,I$26,I$28,I$30,I$32,I$34,I$36,I$38,I$40,I$42,I$44,I$46,I$48,I$50,I$52,I$54,I$56,I$58,I$60,I$62,I$64,I$66,I$68,I$70,I$72,I$74,I$76,I$78,I$80,I$82,I$84,I$86,I$88,I$90,I$92,I$94,I$96,I$98,I$100,I$102,I$104,I$106,I$108,I$110,I$112,I$114,I$116,I$118,I$120,I$122,I$124)) -> 14 | J9: =RANK(J8,(J$6,J$8,J$10,J$12,J$14,J$16,J$18,J$20,J$22,J$24,J$26,J$28,J$30,J$32,J$34,J$36,J$38,J$40,J$42,J$44,J$46,J$48,J$50,J$52,J$54,J$56,J$58,J$60,J$62,J$64,J$66,J$68,J$70,J$72,J$74,J$76,J$78,J$80,J$82,J$84,J$86,J$88,J$90,J$92,J$94,J$96,J$98,J$100,J$102,J$104,J$106,J$108,J$110,J$112,J$114,J$116,J$118,J$120,J$122,J$124)) -> 5 | K9: =RANK(K8,(K$6,K$8,K$10,K$12,K$14,K$16,K$18,K$20,K$22,K$24,K$26,K$28,K$30,K$32,K$34,K$36,K$38,K$40,K$42,K$44,K$46,K$48,K$50,K$52,K$54,K$56,K$58,K$60,K$62,K$64,K$66,K$68,K$70,K$72,K$74,K$76,K$78,K$80,K$82,K$84,K$86,K$88,K$90,K$92,K$94,K$96,K$98,K$100,K$102,K$104,K$106,K$108,K$110,K$112,K$114,K$116,K$118,K$120,K$122,K$124)) -> 6 | L9: =RANK(L8,(L$6,L$8,L$10,L$12,L$14,L$16,L$18,L$20,L$22,L$24,L$26,L$28,L$30,L$32,L$34,L$36,L$38,L$40,L$42,L$44,L$46,L$48,L$50,L$52,L$54,L$56,L$58,L$60,L$62,L$64,L$66,L$68,L$70,L$72,L$74,L$76,L$78,L$80,L$82,L$84,L$86,L$88,L$90,L$92,L$94,L$96,L$98,L$100,L$102,L$104,L$106,L$108,L$110,L$112,L$114,L$116,L$118,L$120,L$122,L$124)) -> 7 | M9: =RANK(M8,(M$6,M$8,M$10,M$12,M$14,M$16,M$18,M$20,M$22,M$24,M$26,M$28,M$30,M$32,M$34,M$36,M$38,M$40,M$42,M$44,M$46,M$48,M$50,M$52,M$54,M$56,M$58,M$60,M$62,M$64,M$66,M$68,M$70,M$72,M$74,M$76,M$78,M$80,M$82,M$84,M$86,M$88,M$90,M$92,M$94,M$96,M$98,M$100,M$102,M$104,M$106,M$108,M$110,M$112,M$114,M$116,M$118,M$120,M$122,M$124)) -> 6 | N9: =RANK(N8,(N$6,N$8,N$10,N$12,N$14,N$16,N$18,N$20,N$22,N$24,N$26,N$28,N$30,N$32,N$34,N$36,N$38,N$40,N$42,N$44,N$46,N$48,N$50,N$52,N$54,N$56,N$58,N$60,N$62,N$64,N$66,N$68,N$70,N$72,N$74,N$76,N$78,N$80,N$82,N$84,N$86,N$88,N$90,N$92,N$94,N$96,N$98,N$100,N$102,N$104,N$106,N$108,N$110,N$112,N$114,N$116,N$118,N$120,N$122,N$124)) -> 4 | P9: =RANK(P8,(P$6,P$8,P$10,P$12,P$14,P$16,P$18,P$20,P$22,P$24,P$26,P$28,P$30,P$32,P$34,P$36,P$38,P$40,P$42,P$44,P$46,P$48,P$50,P$52,P$54,P$56,P$58,P$60,P$62,P$64,P$66,P$68,P$70,P$72,P$74,P$76,P$78,P$80,P$82,P$84,P$86,P$88,P$90,P$92,P$94,P$96,P$98,P$100,P$102,P$104,P$106,P$108,P$110,P$112,P$114,P$116,P$118,P$120,P$122,P$124)) -> 4
A10: Vanguard | B10: 3 | C10: 18.10 | D10: 17.80 | E10: 35.90 | F10: 18.50 | G10: 18.40 | H10: 18.30 | I10: 27.60 | J10: 18.30 | K10: 17.80 | L10: 18.90 | M10: 27.50 | N10: 91.00 | O10: 0.0 | P10: 91.00
C11: =RANK(C10,(C$6,C$8,C$10,C$12,C$14,C$16,C$18,C$20,C$22,C$24,C$26,C$28,C$30,C$32,C$34,C$36,C$38,C$40,C$42,C$44,C$46,C$48,C$50,C$52,C$54,C$56,C$58,C$60,C$62,C$64,C$66,C$68,C$70,C$72,C$74,C$76,C$78,C$80,C$82,C$84,C$86,C$88,C$90,C$92,C$94,C$96,C$98,C$100,C$102,C$104,C$106,C$108,C$110,C$112,C$114,C$116,C$118,C$120,C$122,C$124)) -> 7 | D11: =RANK(D10,(D$6,D$8,D$10,D$12,D$14,D$16,D$18,D$20,D$22,D$24,D$26,D$28,D$30,D$32,D$34,D$36,D$38,D$40,D$42,D$44,D$46,D$48,D$50,D$52,D$54,D$56,D$58,D$60,D$62,D$64,D$66,D$68,D$70,D$72,D$74,D$76,D$78,D$80,D$82,D$84,D$86,D$88,D$90,D$92,D$94,D$96,D$98,D$100,D$102,D$104,D$106,D$108,D$110,D$112,D$114,D$116,D$118,D$120,D$122,D$124)) -> 7 | E11: =RANK(E10,(E$6,E$8,E$10,E$12,E$14,E$16,E$18,E$20,E$22,E$24,E$26,E$28,E$30,E$32,E$34,E$36,E$38,E$40,E$42,E$44,E$46,E$48,E$50,E$52,E$54,E$56,E$58,E$60,E$62,E$64,E$66,E$68,E$70,E$72,E$74,E$76,E$78,E$80,E$82,E$84,E$86,E$88,E$90,E$92,E$94,E$96,E$98,E$100,E$102,E$104,E$106,E$108,E$110,E$112,E$114,E$116,E$118,E$120,E$122,E$124)) -> 5 | F11: =RANK(F10,(F$6,F$8,F$10,F$12,F$14,F$16,F$18,F$20,F$22,F$24,F$26,F$28,F$30,F$32,F$34,F$36,F$38,F$40,F$42,F$44,F$46,F$48,F$50,F$52,F$54,F$56,F$58,F$60,F$62,F$64,F$66,F$68,F$70,F$72,F$74,F$76,F$78,F$80,F$82,F$84,F$86,F$88,F$90,F$92,F$94,F$96,F$98,F$100,F$102,F$104,F$106,F$108,F$110,F$112,F$114,F$116,F$118,F$120,F$122,F$124)) -> 7 | G11: =RANK(G10,(G$6,G$8,G$10,G$12,G$14,G$16,G$18,G$20,G$22,G$24,G$26,G$28,G$30,G$32,G$34,G$36,G$38,G$40,G$42,G$44,G$46,G$48,G$50,G$52,G$54,G$56,G$58,G$60,G$62,G$64,G$66,G$68,G$70,G$72,G$74,G$76,G$78,G$80,G$82,G$84,G$86,G$88,G$90,G$92,G$94,G$96,G$98,G$100,G$102,G$104,G$106,G$108,G$110,G$112,G$114,G$116,G$118,G$120,G$122,G$124)) -> 7 | H11: =RANK(H10,(H$6,H$8,H$10,H$12,H$14,H$16,H$18,H$20,H$22,H$24,H$26,H$28,H$30,H$32,H$34,H$36,H$38,H$40,H$42,H$44,H$46,H$48,H$50,H$52,H$54,H$56,H$58,H$60,H$62,H$64,H$66,H$68,H$70,H$72,H$74,H$76,H$78,H$80,H$82,H$84,H$86,H$88,H$90,H$92,H$94,H$96,H$98,H$100,H$102,H$104,H$106,H$108,H$110,H$112,H$114,H$116,H$118,H$120,H$122,H$124)) -> 7 | I11: =RANK(I10,(I$6,I$8,I$10,I$12,I$14,I$16,I$18,I$20,I$22,I$24,I$26,I$28,I$30,I$32,I$34,I$36,I$38,I$40,I$42,I$44,I$46,I$48,I$50,I$52,I$54,I$56,I$58,I$60,I$62,I$64,I$66,I$68,I$70,I$72,I$74,I$76,I$78,I$80,I$82,I$84,I$86,I$88,I$90,I$92,I$94,I$96,I$98,I$100,I$102,I$104,I$106,I$108,I$110,I$112,I$114,I$116,I$118,I$120,I$122,I$124)) -> 15 | J11: =RANK(J10,(J$6,J$8,J$10,J$12,J$14,J$16,J$18,J$20,J$22,J$24,J$26,J$28,J$30,J$32,J$34,J$36,J$38,J$40,J$42,J$44,J$46,J$48,J$50,J$52,J$54,J$56,J$58,J$60,J$62,J$64,J$66,J$68,J$70,J$72,J$74,J$76,J$78,J$80,J$82,J$84,J$86,J$88,J$90,J$92,J$94,J$96,J$98,J$100,J$102,J$104,J$106,J$108,J$110,J$112,J$114,J$116,J$118,J$120,J$122,J$124)) -> 8 | K11: =RANK(K10,(K$6,K$8,K$10,K$12,K$14,K$16,K$18,K$20,K$22,K$24,K$26,K$28,K$30,K$32,K$34,K$36,K$38,K$40,K$42,K$44,K$46,K$48,K$50,K$52,K$54,K$56,K$58,K$60,K$62,K$64,K$66,K$68,K$70,K$72,K$74,K$76,K$78,K$80,K$82,K$84,K$86,K$88,K$90,K$92,K$94,K$96,K$98,K$100,K$102,K$104,K$106,K$108,K$110,K$112,K$114,K$116,K$118,K$120,K$122,K$124)) -> 7 | L11: =RANK(L10,(L$6,L$8,L$10,L$12,L$14,L$16,L$18,L$20,L$22,L$24,L$26,L$28,L$30,L$32,L$34,L$36,L$38,L$40,L$42,L$44,L$46,L$48,L$50,L$52,L$54,L$56,L$58,L$60,L$62,L$64,L$66,L$68,L$70,L$72,L$74,L$76,L$78,L$80,L$82,L$84,L$86,L$88,L$90,L$92,L$94,L$96,L$98,L$100,L$102,L$104,L$106,L$108,L$110,L$112,L$114,L$116,L$118,L$120,L$122,L$124)) -> 6 | M11: =RANK(M10,(M$6,M$8,M$10,M$12,M$14,M$16,M$18,M$20,M$22,M$24,M$26,M$28,M$30,M$32,M$34,M$36,M$38,M$40,M$42,M$44,M$46,M$48,M$50,M$52,M$54,M$56,M$58,M$60,M$62,M$64,M$66,M$68,M$70,M$72,M$74,M$76,M$78,M$80,M$82,M$84,M$86,M$88,M$90,M$92,M$94,M$96,M$98,M$100,M$102,M$104,M$106,M$108,M$110,M$112,M$114,M$116,M$118,M$120,M$122,M$124)) -> 7 | N11: =RANK(N10,(N$6,N$8,N$10,N$12,N$14,N$16,N$18,N$20,N$22,N$24,N$26,N$28,N$30,N$32,N$34,N$36,N$38,N$40,N$42,N$44,N$46,N$48,N$50,N$52,N$54,N$56,N$58,N$60,N$62,N$64,N$66,N$68,N$70,N$72,N$74,N$76,N$78,N$80,N$82,N$84,N$86,N$88,N$90,N$92,N$94,N$96,N$98,N$100,N$102,N$104,N$106,N$108,N$110,N$112,N$114,N$116,N$118,N$120,N$122,N$124)) -> 5 | P11: =RANK(P10,(P$6,P$8,P$10,P$12,P$14,P$16,P$18,P$20,P$22,P$24,P$26,P$28,P$30,P$32,P$34,P$36,P$38,P$40,P$42,P$44,P$46,P$48,P$50,P$52,P$54,P$56,P$58,P$60,P$62,P$64,P$66,P$68,P$70,P$72,P$74,P$76,P$78,P$80,P$82,P$84,P$86,P$88,P$90,P$92,P$94,P$96,P$98,P$100,P$102,P$104,P$106,P$108,P$110,P$112,P$114,P$116,P$118,P$120,P$122,P$124)) -> 5
A12: Cavaliers | B12: 2 | C12: 17.70 | D12: 17.20 | E12: 34.90 | F12: 17.00 | G12: 17.80 | H12: 17.40 | I12: 26.10 | J12: 17.70 | K12: 16.90 | L12: 18.00 | M12: 26.30 | N12: 87.30 | O12: 0.0 | P12: 87.30
C13: =RANK(C12,(C$6,C$8,C$10,C$12,C$14,C$16,C$18,C$20,C$22,C$24,C$26,C$28,C$30,C$32,C$34,C$36,C$38,C$40,C$42,C$44,C$46,C$48,C$50,C$52,C$54,C$56,C$58,C$60,C$62,C$64,C$66,C$68,C$70,C$72,C$74,C$76,C$78,C$80,C$82,C$84,C$86,C$88,C$90,C$92,C$94,C$96,C$98,C$100,C$102,C$104,C$106,C$108,C$110,C$112,C$114,C$116,C$118,C$120,C$122,C$124)) -> 9 | D13: =RANK(D12,(D$6,D$8,D$10,D$12,D$14,D$16,D$18,D$20,D$22,D$24,D$26,D$28,D$30,D$32,D$34,D$36,D$38,D$40,D$42,D$44,D$46,D$48,D$50,D$52,D$54,D$56,D$58,D$60,D$62,D$64,D$66,D$68,D$70,D$72,D$74,D$76,D$78,D$80,D$82,D$84,D$86,D$88,D$90,D$92,D$94,D$96,D$98,D$100,D$102,D$104,D$106,D$108,D$110,D$112,D$114,D$116,D$118,D$120,D$122,D$124)) -> 13 | E13: =RANK(E12,(E$6,E$8,E$10,E$12,E$14,E$16,E$18,E$20,E$22,E$24,E$26,E$28,E$30,E$32,E$34,E$36,E$38,E$40,E$42,E$44,E$46,E$48,E$50,E$52,E$54,E$56,E$58,E$60,E$62,E$64,E$66,E$68,E$70,E$72,E$74,E$76,E$78,E$80,E$82,E$84,E$86,E$88,E$90,E$92,E$94,E$96,E$98,E$100,E$102,E$104,E$106,E$108,E$110,E$112,E$114,E$116,E$118,E$120,E$122,E$124)) -> 7 | F13: =RANK(F12,(F$6,F$8,F$10,F$12,F$14,F$16,F$18,F$20,F$22,F$24,F$26,F$28,F$30,F$32,F$34,F$36,F$38,F$40,F$42,F$44,F$46,F$48,F$50,F$52,F$54,F$56,F$58,F$60,F$62,F$64,F$66,F$68,F$70,F$72,F$74,F$76,F$78,F$80,F$82,F$84,F$86,F$88,F$90,F$92,F$94,F$96,F$98,F$100,F$102,F$104,F$106,F$108,F$110,F$112,F$114,F$116,F$118,F$120,F$122,F$124)) -> 13 | G13: =RANK(G12,(G$6,G$8,G$10,G$12,G$14,G$16,G$18,G$20,G$22,G$24,G$26,G$28,G$30,G$32,G$34,G$36,G$38,G$40,G$42,G$44,G$46,G$48,G$50,G$52,G$54,G$56,G$58,G$60,G$62,G$64,G$66,G$68,G$70,G$72,G$74,G$76,G$78,G$80,G$82,G$84,G$86,G$88,G$90,G$92,G$94,G$96,G$98,G$100,G$102,G$104,G$106,G$108,G$110,G$112,G$114,G$116,G$118,G$120,G$122,G$124)) -> 9 | H13: =RANK(H12,(H$6,H$8,H$10,H$12,H$14,H$16,H$18,H$20,H$22,H$24,H$26,H$28,H$30,H$32,H$34,H$36,H$38,H$40,H$42,H$44,H$46,H$48,H$50,H$52,H$54,H$56,H$58,H$60,H$62,H$64,H$66,H$68,H$70,H$72,H$74,H$76,H$78,H$80,H$82,H$84,H$86,H$88,H$90,H$92,H$94,H$96,H$98,H$100,H$102,H$104,H$106,H$108,H$110,H$112,H$114,H$116,H$118,H$120,H$122,H$124)) -> 10 | I13: =RANK(I12,(I$6,I$8,I$10,I$12,I$14,I$16,I$18,I$20,I$22,I$24,I$26,I$28,I$30,I$32,I$34,I$36,I$38,I$40,I$42,I$44,I$46,I$48,I$50,I$52,I$54,I$56,I$58,I$60,I$62,I$64,I$66,I$68,I$70,I$72,I$74,I$76,I$78,I$80,I$82,I$84,I$86,I$88,I$90,I$92,I$94,I$96,I$98,I$100,I$102,I$104,I$106,I$108,I$110,I$112,I$114,I$116,I$118,I$120,I$122,I$124)) -> 18 | J13: =RANK(J12,(J$6,J$8,J$10,J$12,J$14,J$16,J$18,J$20,J$22,J$24,J$26,J$28,J$30,J$32,J$34,J$36,J$38,J$40,J$42,J$44,J$46,J$48,J$50,J$52,J$54,J$56,J$58,J$60,J$62,J$64,J$66,J$68,J$70,J$72,J$74,J$76,J$78,J$80,J$82,J$84,J$86,J$88,J$90,J$92,J$94,J$96,J$98,J$100,J$102,J$104,J$106,J$108,J$110,J$112,J$114,J$116,J$118,J$120,J$122,J$124)) -> 9 | K13: =RANK(K12,(K$6,K$8,K$10,K$12,K$14,K$16,K$18,K$20,K$22,K$24,K$26,K$28,K$30,K$32,K$34,K$36,K$38,K$40,K$42,K$44,K$46,K$48,K$50,K$52,K$54,K$56,K$58,K$60,K$62,K$64,K$66,K$68,K$70,K$72,K$74,K$76,K$78,K$80,K$82,K$84,K$86,K$88,K$90,K$92,K$94,K$96,K$98,K$100,K$102,K$104,K$106,K$108,K$110,K$112,K$114,K$116,K$118,K$120,K$122,K$124)) -> 14 | L13: =RANK(L12,(L$6,L$8,L$10,L$12,L$14,L$16,L$18,L$20,L$22,L$24,L$26,L$28,L$30,L$32,L$34,L$36,L$38,L$40,L$42,L$44,L$46,L$48,L$50,L$52,L$54,L$56,L$58,L$60,L$62,L$64,L$66,L$68,L$70,L$72,L$74,L$76,L$78,L$80,L$82,L$84,L$86,L$88,L$90,L$92,L$94,L$96,L$98,L$100,L$102,L$104,L$106,L$108,L$110,L$112,L$114,L$116,L$118,L$120,L$122,L$124)) -> 10 | M13: =RANK(M12,(M$6,M$8,M$10,M$12,M$14,M$16,M$18,M$20,M$22,M$24,M$26,M$28,M$30,M$32,M$34,M$36,M$38,M$40,M$42,M$44,M$46,M$48,M$50,M$52,M$54,M$56,M$58,M$60,M$62,M$64,M$66,M$68,M$70,M$72,M$74,M$76,M$78,M$80,M$82,M$84,M$86,M$88,M$90,M$92,M$94,M$96,M$98,M$100,M$102,M$104,M$106,M$108,M$110,M$112,M$114,M$116,M$118,M$120,M$122,M$124)) -> 12 | N13: =RANK(N12,(N$6,N$8,N$10,N$12,N$14,N$16,N$18,N$20,N$22,N$24,N$26,N$28,N$30,N$32,N$34,N$36,N$38,N$40,N$42,N$44,N$46,N$48,N$50,N$52,N$54,N$56,N$58,N$60,N$62,N$64,N$66,N$68,N$70,N$72,N$74,N$76,N$78,N$80,N$82,N$84,N$86,N$88,N$90,N$92,N$94,N$96,N$98,N$100,N$102,N$104,N$106,N$108,N$110,N$112,N$114,N$116,N$118,N$120,N$122,N$124)) -> 8 | P13: =RANK(P12,(P$6,P$8,P$10,P$12,P$14,P$16,P$18,P$20,P$22,P$24,P$26,P$28,P$30,P$32,P$34,P$36,P$38,P$40,P$42,P$44,P$46,P$48,P$50,P$52,P$54,P$56,P$58,P$60,P$62,P$64,P$66,P$68,P$70,P$72,P$74,P$76,P$78,P$80,P$82,P$84,P$86,P$88,P$90,P$92,P$94,P$96,P$98,P$100,P$102,P$104,P$106,P$108,P$110,P$112,P$114,P$116,P$118,P$120,P$122,P$124)) -> 8
A14: Troopers | B14: 1 | C14: 17.30 | D14: 17.30 | E14: 34.60 | F14: 16.90 | G14: 17.10 | H14: 16.40 | I14: 25.20 | J14: 18.70 | K14: 17.20 | L14: 18.20 | M14: 27.05 | N14: 86.85 | O14: 0.0 | P14: 86.85
C15: =RANK(C14,(C$6,C$8,C$10,C$12,C$14,C$16,C$18,C$20,C$22,C$24,C$26,C$28,C$30,C$32,C$34,C$36,C$38,C$40,C$42,C$44,C$46,C$48,C$50,C$52,C$54,C$56,C$58,C$60,C$62,C$64,C$66,C$68,C$70,C$72,C$74,C$76,C$78,C$80,C$82,C$84,C$86,C$88,C$90,C$92,C$94,C$96,C$98,C$100,C$102,C$104,C$106,C$108,C$110,C$112,C$114,C$116,C$118,C$120,C$122,C$124)) -> 13 | D15: =RANK(D14,(D$6,D$8,D$10,D$12,D$14,D$16,D$18,D$20,D$22,D$24,D$26,D$28,D$30,D$32,D$34,D$36,D$38,D$40,D$42,D$44,D$46,D$48,D$50,D$52,D$54,D$56,D$58,D$60,D$62,D$64,D$66,D$68,D$70,D$72,D$74,D$76,D$78,D$80,D$82,D$84,D$86,D$88,D$90,D$92,D$94,D$96,D$98,D$100,D$102,D$104,D$106,D$108,D$110,D$112,D$114,D$116,D$118,D$120,D$122,D$124)) -> 12 | E15: =RANK(E14,(E$6,E$8,E$10,E$12,E$14,E$16,E$18,E$20,E$22,E$24,E$26,E$28,E$30,E$32,E$34,E$36,E$38,E$40,E$42,E$44,E$46,E$48,E$50,E$52,E$54,E$56,E$58,E$60,E$62,E$64,E$66,E$68,E$70,E$72,E$74,E$76,E$78,E$80,E$82,E$84,E$86,E$88,E$90,E$92,E$94,E$96,E$98,E$100,E$102,E$104,E$106,E$108,E$110,E$112,E$114,E$116,E$118,E$120,E$122,E$124)) -> 9 | F15: =RANK(F14,(F$6,F$8,F$10,F$12,F$14,F$16,F$18,F$20,F$22,F$24,F$26,F$28,F$30,F$32,F$34,F$36,F$38,F$40,F$42,F$44,F$46,F$48,F$50,F$52,F$54,F$56,F$58,F$60,F$62,F$64,F$66,F$68,F$70,F$72,F$74,F$76,F$78,F$80,F$82,F$84,F$86,F$88,F$90,F$92,F$94,F$96,F$98,F$100,F$102,F$104,F$106,F$108,F$110,F$112,F$114,F$116,F$118,F$120,F$122,F$124)) -> 14 | G15: =RANK(G14,(G$6,G$8,G$10,G$12,G$14,G$16,G$18,G$20,G$22,G$24,G$26,G$28,G$30,G$32,G$34,G$36,G$38,G$40,G$42,G$44,G$46,G$48,G$50,G$52,G$54,G$56,G$58,G$60,G$62,G$64,G$66,G$68,G$70,G$72,G$74,G$76,G$78,G$80,G$82,G$84,G$86,G$88,G$90,G$92,G$94,G$96,G$98,G$100,G$102,G$104,G$106,G$108,G$110,G$112,G$114,G$116,G$118,G$120,G$122,G$124)) -> 13 | H15: =RANK(H14,(H$6,H$8,H$10,H$12,H$14,H$16,H$18,H$20,H$22,H$24,H$26,H$28,H$30,H$32,H$34,H$36,H$38,H$40,H$42,H$44,H$46,H$48,H$50,H$52,H$54,H$56,H$58,H$60,H$62,H$64,H$66,H$68,H$70,H$72,H$74,H$76,H$78,H$80,H$82,H$84,H$86,H$88,H$90,H$92,H$94,H$96,H$98,H$100,H$102,H$104,H$106,H$108,H$110,H$112,H$114,H$116,H$118,H$120,H$122,H$124)) -> 21 | I15: =RANK(I14,(I$6,I$8,I$10,I$12,I$14,I$16,I$18,I$20,I$22,I$24,I$26,I$28,I$30,I$32,I$34,I$36,I$38,I$40,I$42,I$44,I$46,I$48,I$50,I$52,I$54,I$56,I$58,I$60,I$62,I$64,I$66,I$68,I$70,I$72,I$74,I$76,I$78,I$80,I$82,I$84,I$86,I$88,I$90,I$92,I$94,I$96,I$98,I$100,I$102,I$104,I$106,I$108,I$110,I$112,I$114,I$116,I$118,I$120,I$122,I$124)) -> 19 | J15: =RANK(J14,(J$6,J$8,J$10,J$12,J$14,J$16,J$18,J$20,J$22,J$24,J$26,J$28,J$30,J$32,J$34,J$36,J$38,J$40,J$42,J$44,J$46,J$48,J$50,J$52,J$54,J$56,J$58,J$60,J$62,J$64,J$66,J$68,J$70,J$72,J$74,J$76,J$78,J$80,J$82,J$84,J$86,J$88,J$90,J$92,J$94,J$96,J$98,J$100,J$102,J$104,J$106,J$108,J$110,J$112,J$114,J$116,J$118,J$120,J$122,J$124)) -> 7 | K15: =RANK(K14,(K$6,K$8,K$10,K$12,K$14,K$16,K$18,K$20,K$22,K$24,K$26,K$28,K$30,K$32,K$34,K$36,K$38,K$40,K$42,K$44,K$46,K$48,K$50,K$52,K$54,K$56,K$58,K$60,K$62,K$64,K$66,K$68,K$70,K$72,K$74,K$76,K$78,K$80,K$82,K$84,K$86,K$88,K$90,K$92,K$94,K$96,K$98,K$100,K$102,K$104,K$106,K$108,K$110,K$112,K$114,K$116,K$118,K$120,K$122,K$124)) -> 13 | L15: =RANK(L14,(L$6,L$8,L$10,L$12,L$14,L$16,L$18,L$20,L$22,L$24,L$26,L$28,L$30,L$32,L$34,L$36,L$38,L$40,L$42,L$44,L$46,L$48,L$50,L$52,L$54,L$56,L$58,L$60,L$62,L$64,L$66,L$68,L$70,L$72,L$74,L$76,L$78,L$80,L$82,L$84,L$86,L$88,L$90,L$92,L$94,L$96,L$98,L$100,L$102,L$104,L$106,L$108,L$110,L$112,L$114,L$116,L$118,L$120,L$122,L$124)) -> 8 | M15: =RANK(M14,(M$6,M$8,M$10,M$12,M$14,M$16,M$18,M$20,M$22,M$24,M$26,M$28,M$30,M$32,M$34,M$36,M$38,M$40,M$42,M$44,M$46,M$48,M$50,M$52,M$54,M$56,M$58,M$60,M$62,M$64,M$66,M$68,M$70,M$72,M$74,M$76,M$78,M$80,M$82,M$84,M$86,M$88,M$90,M$92,M$94,M$96,M$98,M$100,M$102,M$104,M$106,M$108,M$110,M$112,M$114,M$116,M$118,M$120,M$122,M$124)) -> 8 | N15: =RANK(N14,(N$6,N$8,N$10,N$12,N$14,N$16,N$18,N$20,N$22,N$24,N$26,N$28,N$30,N$32,N$34,N$36,N$38,N$40,N$42,N$44,N$46,N$48,N$50,N$52,N$54,N$56,N$58,N$60,N$62,N$64,N$66,N$68,N$70,N$72,N$74,N$76,N$78,N$80,N$82,N$84,N$86,N$88,N$90,N$92,N$94,N$96,N$98,N$100,N$102,N$104,N$106,N$108,N$110,N$112,N$114,N$116,N$118,N$120,N$122,N$124)) -> 9 | P15: =RANK(P14,(P$6,P$8,P$10,P$12,P$14,P$16,P$18,P$20,P$22,P$24,P$26,P$28,P$30,P$32,P$34,P$36,P$38,P$40,P$42,P$44,P$46,P$48,P$50,P$52,P$54,P$56,P$58,P$60,P$62,P$64,P$66,P$68,P$70,P$72,P$74,P$76,P$78,P$80,P$82,P$84,P$86,P$88,P$90,P$92,P$94,P$96,P$98,P$100,P$102,P$104,P$106,P$108,P$110,P$112,P$114,P$116,P$118,P$120,P$122,P$124)) -> 9
A18: 8/2/2024 Marion, Iowa
C19: General Effect | F19: Visual | J19: Music
C20: 1 | D20: 2 | F20: Proficiency | G20: Analysis | H20: Color Guard | J20: Brass | K20: Analysis | L20: Percussion | N20: Sub | P20: Total
C21: T. Wemhoff | D21: M. Howard | E21: Total | F21: C. Church | G21: T. Hundall | H21: S. Chumley | I21: Total ÷2 | J21: J. Denton | K21: C. Moss | L21: G. Howarth | M21: Total ÷2 | N21: Total | O21: Pen | P21: Score
A22: DCI Open Class | C22: 20 | D22: 20 | E22: 40 | F22: 20 | G22: 20 | H22: 20 | I22: 30 | J22: 20 | K22: 20 | L22: 20 | M22: 30 | N22: 100 | P22: 100
A23: Battalion | B23: 3 | C23: 15.80 | D23: 15.90 | E23: 31.70 | F23: 16.40 | G23: 15.00 | H23: 15.70 | I23: 23.55 | J23: 15.80 | K23: 15.70 | L23: 15.00 | M23: 23.25 | N23: 78.50 | O23: 0.0 | P23: 78.50
C24: 1 | D24: 1 | E24: 1 | F24: 1 | G24: 3 | H24: 1 | I24: 1 | J24: 1 | K24: 1 | L24: 2 | M24: 1 | N24: 1 | P24: 1
A25: Columbians | B25: 2 | C25: 15.50 | D25: 15.70 | E25: 31.20 | F25: 15.70 | G25: 15.60 | H25: 14.60 | I25: 22.95 | J25: 15.40 | K25: 15.30 | L25: 14.40 | M25: 22.55 | N25: 76.70 | O25: 0.0 | P25: 76.70
C26: 2 | D26: 2 | E26: 2 | F26: 2 | G26: 1 | H26: 2 | I26: 2 | J26: 2 | K26: 2 | L26: 4 | M26: 3 | N26: 2 | P26: 2
A27: River City | B27: 1 | C27: 15.10 | D27: 15.20 | E27: 30.30 | F27: 15.40 | G27: 15.50 | H27: 14.50 | I27: 22.70 | J27: 15.00 | K27: 14.60 | L27: 15.60 | M27: 22.60 | N27: 75.60 | O27: 0.0 | P27: 75.60
A28: Rhythm | C28: 3 | D28: 3 | E28: 3 | F28: 3 | G28: 2 | H28: 3 | I28: 3 | J28: 3 | K28: 3 | L28: 1 | M28: 2 | N28: 3 | P28: 3
A29: Colt | B29: 4 | C29: 14.60 | D29: 14.30 | E29: 28.90 | F29: 15.00 | G29: 14.60 | H29: 14.40 | I29: 22.00 | J29: 14.10 | K29: 13.50 | L29: 14.50 | M29: 21.05 | N29: 71.95 | O29: 0.0 | P29: 71.95
A30: Cadets | C30: 4 | D30: 4 | E30: 4 | F30: 4 | G30: 4 | H30: 4 | I30: 4 | J30: 4 | K30: 4 | L30: 3 | M30: 4 | N30: 4 | P30: 4
A33: 8/2/2024 Allentown, Pennsylvania--DCI East
C34: General Effect | J34: Visual | N34: Music
C35: 1 | D35: 1 | F35: 2 | G35: 2 | J35: Proficiency | K35: Analysis | L35: Color Guard | N35: Brass | O35: Analysis 1 | P35: Analysis 2 | Q35: Analysis | R35: Percussion | T35: Sub | V35: Total
C36: W. Chumley | D36: B. Brahan | E36: Average | F36: W. Dillon | G36: C. Rothe | H36: Average | I36: Total | J36: M. Tarr | K36: J. Sturgeon | L36: R. Solomon | M36: Total ÷2 | N36: M. Hoskins | O36: D. Carbone | P36: D. Davis | Q36: Average | R36: M. Leitzke | S36: Total ÷2 | T36: Total | U36: Pen | V36: Score
A37: DCI World Class | C37: 20 | D37: 20 | E37: 20 | F37: 20 | G37: 20 | H37: 20 | I37: 40 | J37: 20 | K37: 20 | L37: 20 | M37: 30 | N37: 20 | O37: 20 | P37: 20 | Q37: 20 | R37: 20 | S37: 30 | T37: 100 | V37: 100
A38: Bluecoats | B38: 9 | C38: 19.20 | D38: 19.40 | E38: 19.300 | F38: 19.20 | G38: 19.20 | H38: 19.200 | I38: 38.500 | J38: 19.20 | K38: 19.30 | L38: 19.00 | M38: 28.750 | N38: 19.10 | O38: 19.30 | P38: 19.30 | Q38: 19.300 | R38: 18.90 | S38: 28.650 | T38: 95.900 | U38: 0.0 | V38: 95.900
C39: 1 | D39: 1 | E39: 1 | F39: 1 | G39: 1 | H39: 1 | I39: 1 | J39: 1 | K39: 1 | L39: 2 | M39: 1 | N39: 1 | O39: 1 | P39: 1 | Q39: 1 | R39: 1 | S39: 2 | T39: 1 | V39: 1
A40: Blue | B40: 10 | C40: 18.90 | D40: 19.10 | E40: 19.000 | F40: 19.00 | G40: 18.90 | H40: 18.950 | I40: 37.950 | J40: 18.90 | K40: 19.00 | L40: 19.10 | M40: 28.500 | N40: 18.90 | O40: 19.00 | P40: 18.80 | Q40: 18.900 | R40: 18.60 | S40: 28.200 | T40: 94.650 | U40: 0.0 | V40: 94.650
A41: Devils | C41: 2 | D41: 2 | E41: 2 | F41: 2 | G41: 2 | H41: 2 | I41: 2 | J41: 2 | K41: 2 | L41: 1 | M41: 2 | N41: 2 | O41: 2 | P41: 2 | Q41: 2 | R41: 2 | S41: 3 | T41: 2 | V41: 2
A42: Colts | B42: 7 | C42: 17.70 | D42: 17.60 | E42: 17.650 | F42: 17.70 | G42: 17.60 | H42: 17.650 | I42: 35.300 | J42: 17.40 | K42: 17.70 | L42: 17.60 | M42: 26.350 | N42: 17.70 | O42: 17.80 | P42: 17.40 | Q42: 17.600 | R42: 17.40 | S42: 26.350 | T42: 88.000 | U42: 0.0 | V42: 88.000
C43: 3 | D43: 3 | E43: 3 | F43: 3 | G43: 3 | H43: 3 | I43: 3 | J43: 3 | K43: 3 | L43: 3 | M43: 3 | N43: 3 | O43: 3 | P43: 3 | Q43: 3 | R43: 4 | S43: 4 | T43: 3 | V43: 3
A44: Cavaliers | B44: 6 | C44: 17.20 | D44: 17.40 | E44: 17.300 | F44: 17.40 | G44: 17.30 | H44: 17.350 | I44: 34.650 | J44: 17.30 | K44: 17.40 | L44: 17.40 | M44: 26.050 | N44: 17.40 | O44: 17.10 | P44: 16.80 | Q44: 16.950 | R44: 17.60 | S44: 29.975000000000001 | T44: 86.674999999999997 | U44: 0.0 | V44: 86.674999999999997
C45: 4 | D45: 4 | E45: 4 | F45: 4 | G45: 4 | H45: 4 | I45: 4 | J45: 4 | K45: 4 | L45: 4 | M45: 4 | N45: 4 | O45: 5 | P45: 5 | Q45: 5 | R45: 3 | S45: 1 | T45: 4 | V45: 4
A46: Madison | B46: 8 | C46: 16.60 | D46: 17.20 | E46: 16.900 | F46: 17.20 | G46: 17.10 | H46: 17.150 | I46: 34.050 | J46: 16.80 | K46: 17.30 | L46: 17.30 | M46: 25.700 | N46: 17.35 | O46: 16.90 | P46: 17.00 | Q46: 16.950 | R46: 16.00 | S46: 25.150 | T46: 84.900 | U46: 0.0 | V46: 84.900
A47: Scouts | C47: 6 | D47: 5 | E47: 5 | F47: 5 | G47: 5 | H47: 5 | I47: 5 | J47: 5 | K47: 5 | L47: 5 | M47: 5 | N47: 5 | O47: 6 | P47: 4 | Q47: 5 | R47: 8 | S47: 5 | T47: 5 | V47: 5
A48: Pacific | B48: 4 | C48: 16.40 | D48: 17.00 | E48: 16.700 | F48: 16.90 | G48: 16.90 | H48: 16.900 | I48: 33.600 | J48: 16.20 | K48: 16.90 | L48: 17.00 | M48: 25.050 | N48: 16.40 | O48: 16.70 | P48: 16.20 | Q48: 16.450 | R48: 16.40 | S48: 24.625 | T48: 83.275000000000006 | U48: 0.0 | V48: 83.275000000000006
A49: Crest | C49: 7 | D49: 6 | E49: 6 | F49: 6 | G49: 6 | H49: 6 | I49: 6 | J49: 7 | K49: 6 | L49: 6 | M49: 6 | N49: 7 | O49: 7 | P49: 7 | Q49: 7 | R49: 5 | S49: 7 | T49: 6 | V49: 6
A50: Blue | B50: 5 | C50: 16.80 | D50: 16.60 | E50: 16.700 | F50: 16.70 | G50: 16.60 | H50: 16.650 | I50: 33.350 | J50: 16.40 | K50: 16.80 | L50: 16.80 | M50: 25.000 | N50: 16.70 | O50: 17.30 | P50: 16.70 | Q50: 17.000 | R50: 16.10 | S50: 24.900 | T50: 83.250 | U50: 0.0 | V50: 83.250
A51: Knights | C51: 5 | D51: 7 | E51: 6 | F51: 7 | G51: 7 | H51: 7 | I51: 7 | J51: 6 | K51: 7 | L51: 7 | M51: 7 | N51: 6 | O51: 4 | P51: 6 | Q51: 4 | R51: 7 | S51: 6 | T51: 7 | V51: 7
A52: Academy | B52: 3 | C52: 15.80 | D52: 16.00 | E52: 15.900 | F52: 16.10 | G52: 15.90 | H52: 16.000 | I52: 31.900 | J52: 15.80 | K52: 16.40 | L52: 16.00 | M52: 24.100 | N52: 15.80 | O52: 16.40 | P52: 15.60 | Q52: 16.000 | R52: 16.30 | S52: 24.050 | T52: 80.050 | U52: 0.0 | V52: 80.050
C53: 8 | D53: 9 | E53: 9 | F53: 9 | G53: 9 | H53: 9 | I53: 9 | J53: 8 | K53: 8 | L53: 8 | M53: 8 | N53: 9 | O53: 8 | P53: 9 | Q53: 8 | R53: 6 | S53: 8 | T53: 8 | V53: 8
A54: Music | B54: 2 | C54: 15.60 | D54: 16.50 | E54: 16.050 | F54: 16.30 | G54: 16.30 | H54: 16.300 | I54: 32.350 | J54: 15.40 | K54: 16.20 | L54: 15.70 | M54: 23.650 | N54: 16.20 | O54: 15.90 | P54: 15.80 | Q54: 15.850 | R54: 15.40 | S54: 23.725000000000001 | T54: 79.724999999999994 | U54: 0.0 | V54: 79.724999999999994
A55: City | C55: 9 | D55: 8 | E55: 8 | F55: 8 | G55: 8 | H55: 8 | I55: 8 | J55: 9 | K55: 9 | L55: 9 | M55: 9 | N55: 8 | O55: 9 | P55: 8 | Q55: 9 | R55: 9 | S55: 9 | T55: 9 | V55: 9
A56: Genesis | B56: 1 | C56: 15.00 | D56: 15.60 | E56: 15.300 | F56: 15.80 | G56: 15.30 | H56: 15.550 | I56: 30.850 | J56: 15.00 | K56: 15.70 | L56: 15.50 | M56: 23.100 | N56: 15.50 | O56: 15.30 | P56: 15.30 | Q56: 15.300 | R56: 15.00 | S56: 22.900 | T56: 76.850 | U56: 0.0 | V56: 76.850
C57: 10 | D57: 10 | E57: 10 | F57: 10 | G57: 10 | H57: 10 | I57: 10 | J57: 10 | K57: 10 | L57: 10 | M57: 10 | N57: 10 | O57: 10 | P57: 10 | Q57: 10 | R57: 10 | S57: 10 | T57: 10 | V57: 10
A60: 8/3/2024 Mattoon, Illinois
C61: General Effect | F61: Visual | J61: Music
C62: 1 | D62: 2 | F62: Proficiency | G62: Analysis | H62: Color Guard | J62: Brass | K62: Analysis | L62: Percussion | N62: Sub | P62: Total
C63: K. Baker | D63: J. Denton | E63: Total | F63: T. Landess | G63: J. Pursifull | H63: B. Spidel | I63: Total ÷2 | J63: S. Page | K63: A. Cook | L63: M. Davis | M63: Total ÷2 | N63: Total | O63: Pen | P63: Score
A64: DCI Open Class | C64: 20 | D64: 20 | E64: 40 | F64: 20 | G64: 20 | H64: 20 | I64: 30 | J64: 20 | K64: 20 | L64: 20 | M64: 30 | N64: 100 | P64: 100
A65: Battalion | B65: 4 | C65: 15.30 | D65: 16.10 | E65: 31.40 | F65: 16.00 | G65: 15.90 | H65: 15.80 | I65: 23.85 | J65: 15.90 | K65: 16.00 | L65: 14.80 | M65: 23.40 | N65: 78.65 | O65: 0.0 | P65: 78.65
C66: 2 | D66: 1 | E66: 1 | F66: 1 | G66: 1 | H66: 1 | I66: 1 | J66: 1 | K66: 1 | L66: 3 | M66: 1 | N66: 1 | P66: 1
A67: Columbians | B67: 3 | C67: 15.40 | D67: 15.90 | E67: 31.30 | F67: 15.50 | G67: 15.40 | H67: 14.40 | I67: 22.65 | J67: 15.40 | K67: 15.70 | L67: 14.90 | M67: 23.00 | N67: 76.95 | O67: 0.0 | P67: 76.95
C68: 1 | D68: 2 | E68: 2 | F68: 2 | G68: 2 | H68: 4 | I68: 3 | J68: 2 | K68: 2 | L68: 2 | M68: 2 | N68: 2 | P68: 2
A69: River City | B69: 2 | C69: 14.50 | D69: 15.30 | E69: 29.80 | F69: 15.20 | G69: 15.30 | H69: 14.90 | I69: 22.70 | J69: 15.20 | K69: 15.10 | L69: 15.40 | M69: 22.85 | N69: 75.35 | O69: 0.0 | P69: 75.35
A70: Rhythm | C70: 3 | D70: 3 | E70: 3 | F70: 3 | G70: 3 | H70: 2 | I70: 2 | J70: 3 | K70: 3 | L70: 1 | M70: 3 | N70: 3 | P70: 3
A71: Colt | B71: 1 | C71: 14.10 | D71: 14.30 | E71: 28.40 | F71: 14.70 | G71: 14.10 | H71: 14.50 | I71: 21.65 | J71: 14.30 | K71: 14.50 | L71: 14.20 | M71: 21.50 | N71: 71.55 | O71: 0.0 | P71: 71.55
A72: Cadets | C72: 4 | D72: 4 | E72: 4 | F72: 4 | G72: 4 | H72: 3 | I72: 4 | J72: 4 | K72: 4 | L72: 4 | M72: 4 | N72: 4 | P72: 4
A75: 8/3/2024 Evansville, Indiana
C76: General Effect | F76: Visual | J76: Music
C77: 1 | D77: 2 | F77: Proficiency | G77: Analysis | H77: Color Guard | J77: Brass | K77: Analysis | L77: Percussion | N77: Sub | P77: Total
C78: T. Wemhoff | D78: C. Moss | E78: Total | F78: S. Clark | G78: C. Costanza | H78: M. Bowers | I78: Total ÷2 | J78: K. Weirich | K78: T. Fox | L78: G. Howarth | M78: Total ÷2 | N78: Total | O78: Pen | P78: Score
A79: DCI Open Class | C79: 20 | D79: 20 | E79: 40 | F79: 20 | G79: 20 | H79: 20 | I79: 30 | J79: 20 | K79: 20 | L79: 20 | M79: 30 | N79: 100 | P79: 100
A80: Spartans | B80: 5 | C80: 16.20 | D80: 16.80 | E80: 33.00 | F80: 16.80 | G80: 16.00 | H80: 16.70 | I80: 24.75 | J80: 15.30 | K80: 16.30 | L80: 16.30 | M80: 23.95 | N80: 81.70 | O80: 0.0 | P80: 81.70
C81: 1 | D81: 1 | E81: 1 | F81: 1 | G81: 1 | H81: 1 | I81: 1 | J81: 2 | K81: 1 | L81: 2 | M81: 1 | N81: 1 | P81: 1
A82: Gold | B82: 4 | C82: 15.90 | D82: 16.10 | E82: 32.00 | F82: 16.20 | G82: 15.80 | H82: 15.50 | I82: 23.75 | J82: 15.50 | K82: 15.80 | L82: 16.50 | M82: 23.90 | N82: 79.65 | O82: 0.0 | P82: 79.65
C83: 2 | D83: 2 | E83: 2 | F83: 2 | G83: 2 | H83: 2 | I83: 2 | J83: 1 | K83: 2 | L83: 1 | M83: 2 | N83: 2 | P83: 2
A84: Raiders | B84: 1 | C84: 14.90 | D84: 14.50 | E84: 29.40 | F84: 14.20 | G84: 14.00 | H84: 14.00 | I84: 21.10 | J84: 13.50 | K84: 13.30 | L84: 14.90 | M84: 20.85 | N84: 71.35 | O84: 0.0 | P84: 71.35
C85: 3 | D85: 3 | E85: 3 | F85: 4 | G85: 3 | H85: 3 | I85: 3 | J85: 3 | K85: 4 | L85: 3 | M85: 3 | N85: 3 | P85: 3
A86: 7th | B86: 3 | C86: 14.50 | D86: 14.30 | E86: 28.80 | F86: 14.60 | G86: 13.50 | H86: 13.90 | I86: 21.00 | J86: 13.20 | K86: 13.50 | L86: 14.60 | M86: 20.65 | N86: 70.45 | O86: 0.0 | P86: 70.45
A87: Regiment | C87: 4 | D87: 4 | E87: 4 | F87: 3 | G87: 4 | H87: 4 | I87: 4 | J87: 4 | K87: 3 | L87: 4 | M87: 4 | N87: 4 | P87: 4
A88: Les | B88: 2 | C88: 13.80 | D88: 13.60 | E88: 27.40 | F88: 13.60 | G88: 13.00 | H88: 13.00 | I88: 19.80 | J88: 13.00 | K88: 12.30 | L88: 12.60 | M88: 18.95 | N88: 66.15 | O88: 0.0 | P88: 66.15
A89: Stentors | C89: 5 | D89: 5 | E89: 5 | F89: 5 | G89: 5 | H89: 5 | I89: 5 | J89: 5 | K89: 5 | L89: 5 | M89: 5 | N89: 5 | P89: 5
A90: DCI All Age Class A
A91: Columbus | B91: 1 | C91: 13.20 | D91: 13.50 | E91: 26.70 | F91: 13.70 | G91: 12.10 | H91: 14.60 | I91: 20.20 | J91: 13.80 | K91: 13.50 | L91: 13.90 | M91: 20.60 | N91: 67.50 | O91: 0.0 | P91: 67.50
A92: Saints | C92: 1 | D92: 1 | E92: 1 | F92: 1 | G92: 1 | H92: 1 | I92: 1 | J92: 1 | K92: 1 | L92: 1 | M92: 1 | N92: 1 | P92: 1
A95: 8/3/2024 Rochester, New York
C96: General Effect | F96: Visual | J96: Music
C97: 1 | D97: 2 | F97: Proficiency | G97: Analysis | H97: Color Guard | J97: Brass | K97: Analysis | L97: Percussion | N97: Sub | P97: Total
C98: K. Turner | D98: R. Rios | E98: Total | F98: K. Miller | G98: B. Madden | H98: D. Deems | I98: Total ÷2 | J98: S. Halquist | K98: B. Crisp | L98: J. Prosperie | M98: Total ÷2 | N98: Total | O98: Pen | P98: Score
A99: DCI World Class | C99: 20 | D99: 20 | E99: 40 | F99: 20 | G99: 20 | H99: 20 | I99: 30 | J99: 20 | K99: 20 | L99: 20 | M99: 30 | N99: 100 | P99: 100
A100: Colts | B100: 5 | C100: 17.90 | D100: 17.80 | E100: 35.70 | F100: 18.00 | G100: 17.80 | H100: 17.40 | I100: 26.60 | J100: 17.30 | K100: 17.60 | L100: 18.10 | M100: 26.50 | N100: 88.80 | O100: 0.0 | P100: 88.80
C101: 1 | D101: 1 | E101: 1 | F101: 1 | G101: 2 | H101: 2 | I101: 2 | J101: 3 | K101: 1 | L101: 1 | M101: 1 | N101: 1 | P101: 1
A102: Cavaliers | B102: 6 | C102: 17.40 | D102: 17.50 | E102: 34.90 | F102: 17.40 | G102: 18.10 | H102: 17.90 | I102: 26.70 | J102: 17.50 | K102: 17.40 | L102: 17.90 | M102: 26.40 | N102: 88.00 | O102: 0.0 | P102: 88.00
C103: 3 | D103: 2 | E103: 2 | F103: 2 | G103: 1 | H103: 1 | I103: 1 | J103: 2 | K103: 2 | L103: 2 | M103: 2 | N103: 2 | P103: 2
A104: Blue | B104: 4 | C104: 17.60 | D104: 16.90 | E104: 34.50 | F104: 16.60 | G104: 17.10 | H104: 16.60 | I104: 25.15 | J104: 17.70 | K104: 16.90 | L104: 16.80 | M104: 25.70 | N104: 85.35 | O104: 0.0 | P104: 85.35
A105: Knights | C105: 2 | D105: 3 | E105: 3 | F105: 3 | G105: 3 | H105: 3 | I105: 3 | J105: 1 | K105: 3 | L105: 4 | M105: 3 | N105: 3 | P105: 3
A106: Music | B106: 2 | C106: 16.50 | D106: 16.70 | E106: 33.20 | F106: 15.80 | G106: 16.30 | H106: 16.50 | I106: 24.30 | J106: 16.50 | K106: 16.70 | L106: 16.00 | M106: 24.60 | N106: 82.10 | O106: 0.0 | P106: 82.10
A107: City | C107: 4 | D107: 4 | E107: 4 | F107: 5 | G107: 5 | H107: 4 | I107: 5 | J107: 4 | K107: 4 | L107: 5 | M107: 4 | N107: 4 | P107: 4
A108: Academy | B108: 3 | C108: 15.90 | D108: 16.20 | E108: 32.10 | F108: 16.40 | G108: 16.70 | H108: 15.60 | I108: 24.35 | J108: 16.00 | K108: 16.10 | L108: 17.00 | M108: 24.55 | N108: 81.00 | O108: 0.0 | P108: 81.00
C109: 6 | D109: 5 | E109: 5 | F109: 4 | G109: 4 | H109: 5 | I109: 4 | J109: 5 | K109: 6 | L109: 3 | M109: 5 | N109: 5 | P109: 5
A110: Genesis | B110: 1 | C110: 16.10 | D110: 15.70 | E110: 31.80 | F110: 15.50 | G110: 15.80 | H110: 15.50 | I110: 23.40 | J110: 15.60 | K110: 16.20 | L110: 15.30 | M110: 23.55 | N110: 78.75 | O110: 0.0 | P110: 78.75
C111: 5 | D111: 6 | E111: 6 | F111: 6 | G111: 6 | H111: 6 | I111: 6 | J111: 6 | K111: 5 | L111: 6 | M111: 6 | N111: 6 | P111: 6
A112: DCI All Age World Class
A113: Connecticut | B113: 1 | C113: 17.10 | D113: 18.10 | E113: 35.20 | F113: 16.80 | G113: 16.20 | H113: 18.00 | I113: 25.50 | J113: 16.00 | K113: 16.50 | L113: 18.30 | M113: 25.40 | N113: 86.10 | O113: 0.0 | P113: 86.10
A114: Hurricanes | C114: 1 | D114: 1 | E114: 1 | F114: 1 | G114: 1 | H114: 1 | I114: 1 | J114: 1 | K114: 1 | L114: 1 | M114: 1 | N114: 1 | P114: 1
A115: DCI All Age Open Class
A116: White | B116: 2 | C116: 16.80 | D116: 17.10 | E116: 33.90 | F116: 16.90 | G116: 16.30 | H116: 16.80 | I116: 25.00 | J116: 17.20 | K116: 16.80 | L116: 18.00 | M116: 26.00 | N116: 84.90 | O116: 0.0 | P116: 84.90
A117: Sabers | C117: 1 | D117: 1 | E117: 1 | F117: 1 | G117: 2 | H117: 2 | I117: 2 | J117: 1 | K117: 1 | L117: 1 | M117: 1 | N117: 1 | P117: 1
A118: Rogues Hollow | B118: 1 | C118: 16.70 | D118: 16.60 | E118: 33.30 | F118: 16.60 | G118: 16.70 | H118: 16.90 | I118: 25.10 | J118: 16.70 | K118: 16.30 | L118: 16.20 | M118: 24.60 | N118: 83.00 | O118: 0.0 | P118: 83.00
A119: Regiment | C119: 2 | D119: 2 | E119: 2 | F119: 2 | G119: 1 | H119: 1 | I119: 1 | J119: 2 | K119: 2 | L119: 2 | M119: 2 | N119: 2 | P119: 2
A120: DCI All Age Class A
A121: Sunrisers | B121: 1 | C121: 15.70 | D121: 16.20 | E121: 31.90 | F121: 14.80 | G121: 15.90 | H121: 15.90 | I121: 23.30 | J121: 13.90 | K121: 14.70 | L121: 15.50 | M121: 22.05 | N121: 77.25 | O121: 0.0 | P121: 77.25
C122: 1 | D122: 1 | E122: 1 | F122: 2 | G122: 1 | H122: 1 | I122: 1 | J122: 2 | K122: 1 | L122: 1 | M122: 1 | N122: 1 | P122: 1
A123: Skyliners | B123: 2 | C123: 14.90 | D123: 15.20 | E123: 30.10 | F123: 15.10 | G123: 14.50 | H123: 14.70 | I123: 22.15 | J123: 14.30 | K123: 14.00 | L123: 14.80 | M123: 21.55 | N123: 73.80 | O123: 0.0 | P123: 73.80
C124: 2 | D124: 2 | E124: 2 | F124: 1 | G124: 2 | H124: 2 | I124: 2 | J124: 1 | K124: 2 | L124: 2 | M124: 2 | N124: 2 | P124: 2
A127: 8/4/2024 Downingtown, Pennsylvania
C128: General Effect | F128: Visual | J128: Music
C129: 1 | D129: 2 | F129: Proficiency | G129: Analysis | H129: Color Guard | J129: Brass | K129: Analysis | L129: Percussion | N129: Sub | P129: Total
C130: C. Raichle | D130: D. Davis | E130: Total | F130: S. Adamo | G130: P. Madden | H130: T. Wingate | I130: Total ÷2 | J130: B. Crisp | K130: C. Marra | L130: T. Mengel | M130: Total ÷2 | N130: Total | O130: Pen | P130: Score
A131: DCI World Class | C131: 20 | D131: 20 | E131: 40 | F131: 20 | G131: 20 | H131: 20 | I131: 30 | J131: 20 | K131: 20 | L131: 20 | M131: 30 | N131: 100 | P131: 100
A132: Boston | B132: 3 | C132: 18.90 | D132: 19.20 | E132: 38.10 | F132: 19.30 | G132: 19.40 | H132: 19.40 | I132: 29.05 | J132: 18.50 | K132: 19.00 | L132: 19.30 | M132: 28.40 | N132: 95.55 | O132: 0.0 | P132: 95.55
A133: Crusaders | C133: 1 | D133: 1 | E133: 1 | F133: 1 | G133: 1 | H133: 1 | I133: 1 | J133: 1 | K133: 1 | L133: 1 | M133: 1 | N133: 1 | P133: 1
A134: Carolina | B134: 4 | C134: 18.60 | D134: 18.90 | E134: 37.50 | F134: 18.90 | G134: 19.10 | H134: 19.10 | I134: 28.55 | J134: 18.40 | K134: 18.60 | L134: 18.80 | M134: 27.90 | N134: 93.95 | O134: 0.0 | P134: 93.95
A135: Crown | C135: 2 | D135: 2 | E135: 2 | F135: 2 | G135: 2 | H135: 2 | I135: 2 | J135: 2 | K135: 2 | L135: 2 | M135: 2 | N135: 2 | P135: 2
A136: Madison | B136: 2 | C136: 17.30 | D136: 17.30 | E136: 34.60 | F136: 17.00 | G136: 17.50 | H136: 17.20 | I136: 25.85 | J136: 17.30 | K136: 17.20 | L136: 16.00 | M136: 25.25 | N136: 85.70 | O136: 0.0 | P136: 85.70
A137: Scouts | C137: 3 | D137: 3 | E137: 3 | F137: 3 | G137: 3 | H137: 3 | I137: 3 | J137: 3 | K137: 3 | L137: 3 | M137: 3 | N137: 3 | P137: 3
A138: Jersey | B138: 1 | C138: 15.00 | D138: 15.10 | E138: 30.10 | F138: 15.00 | G138: 15.40 | H138: 15.50 | I138: 22.95 | J138: 15.00 | K138: 16.30 | L138: 14.00 | M138: 22.65 | N138: 75.70 | O138: 0.0 | P138: 75.70
A139: Surf | C139: 4 | D139: 4 | E139: 4 | F139: 4 | G139: 4 | H139: 4 | I139: 4 | J139: 4 | K139: 4 | L139: 4 | M139: 4 | N139: 4 | P139: 4
A140: DCI All Age World Class
A141: Reading | B141: 3 | C141: 18.80 | D141: 18.60 | E141: 37.40 | F141: 18.40 | G141: 17.10 | H141: 18.50 | I141: 27.00 | J141: 18.20 | K141: 18.80 | L141: 18.80 | M141: 27.90 | N141: 92.30 | O141: 0.0 | P141: 92.30
A142: Buccaneers | C142: 1 | D142: 1 | E142: 1 | F142: 1 | G142: 1 | H142: 1 | I142: 1 | J142: 1 | K142: 1 | L142: 2 | M142: 1 | N142: 1 | P142: 1
A143: Hawthorne | B143: 2 | C143: 18.40 | D143: 18.20 | E143: 36.60 | F143: 18.10 | G143: 16.50 | H143: 17.70 | I143: 26.15 | J143: 18.00 | K143: 18.40 | L143: 18.60 | M143: 27.50 | N143: 90.25 | O143: 0.0 | P143: 90.25
A144: Caballeros | C144: 2 | D144: 2 | E144: 2 | F144: 2 | G144: 2 | H144: 3 | I144: 2 | J144: 2 | K144: 2 | L144: 3 | M144: 2 | N144: 2 | P144: 2
A145: Bushwackers | B145: 1 | C145: 18.10 | D145: 17.90 | E145: 36.00 | F145: 17.80 | G145: 15.90 | H145: 18.10 | I145: 25.90 | J145: 17.40 | K145: 18.00 | L145: 18.90 | M145: 27.15 | N145: 89.05 | O145: 0.0 | P145: 89.05
C146: 3 | D146: 3 | E146: 3 | F146: 3 | G146: 3 | H146: 2 | I146: 3 | J146: 3 | K146: 3 | L146: 1 | M146: 3 | N146: 3 | P146: 3
A147: DCI All Age Open Class
A148: Fusion | B148: 1 | C148: 15.80 | D148: 16.30 | E148: 32.10 | F148: 15.90 | G148: 14.60 | H148: 16.50 | I148: 23.60 | J148: 15.40 | K148: 15.60 | L148: 15.60 | M148: 23.50 | N148: 79.10 | O148: 0.0 | P148: 79.10
A149: Core | C149: 1 | D149: 1 | E149: 1 | F149: 1 | G149: 1 | H149: 1 | I149: 1 | J149: 1 | K149: 1 | L149: 1 | M149: 1 | N149: 1 | P149: 1
A152: 8/5/2024 Pittsburgh, Pennsylvania
C153: General Effect | F153: Visual | J153: Music
C154: 1 | D154: 2 | F154: Proficiency | G154: Analysis | H154: Color Guard | J154: Brass | K154: Analysis | L154: Percussion | N154: Sub | P154: Total
C155: J. Gilley | D155: C. Marra | E155: Total | F155: S. Clark | G155: S. Adamo | H155: J. Barton | I155: Total ÷2 | J155: P. McGarr | K155: M. Rubino | L155: G. Howarth | M155: Total ÷2 | N155: Total | O155: Pen | P155: Score
A156: DCI World Class | C156: 20 | D156: 20 | E156: 40 | F156: 20 | G156: 20 | H156: 20 | I156: 30 | J156: 20 | K156: 20 | L156: 20 | M156: 30 | N156: 100 | P156: 100
A157: Vanguard | B157: 6 | C157: 18.10 | D157: 18.30 | E157: 36.40 | F157: 19.10 | G157: 18.70 | H157: 18.50 | I157: 28.15 | J157: 18.20 | K157: 18.60 | L157: 19.30 | M157: 28.05 | N157: 92.60 | O157: 0.0 | P157: 92.60
C158: 1 | D158: 1 | E158: 1 | F158: 1 | G158: 1 | H158: 1 | I158: 1 | J158: 1 | K158: 1 | L158: 1 | M158: 1 | N158: 1 | P158: 1
A159: Madison | B159: 5 | C159: 17.10 | D159: 17.80 | E159: 34.90 | F159: 17.40 | G159: 17.60 | H159: 17.70 | I159: 26.35 | J159: 17.40 | K159: 17.00 | L159: 15.90 | M159: 25.15 | N159: 86.40 | O159: 0.0 | P159: 86.40
A160: Scouts | C160: 2 | D160: 2 | E160: 2 | F160: 2 | G160: 2 | H160: 2 | I160: 2 | J160: 2 | K160: 2 | L160: 4 | M160: 2 | N160: 2 | P160: 2
A161: Music | B161: 3 | C161: 16.30 | D161: 16.20 | E161: 32.50 | F161: 16.50 | G161: 16.50 | H161: 16.80 | I161: 24.90 | J161: 16.30 | K161: 16.60 | L161: 16.30 | M161: 24.60 | N161: 82.00 | O161: 0.0 | P161: 82.00
A162: City | C162: 3 | D162: 4 | E162: 3 | F162: 3 | G162: 4 | H162: 3 | I162: 3 | J162: 3 | K162: 3 | L162: 3 | M162: 3 | N162: 3 | P162: 3
A163: Academy | B163: 4 | C163: 15.70 | D163: 16.50 | E163: 32.20 | F163: 16.30 | G163: 16.80 | H163: 15.80 | I163: 24.45 | J163: 16.20 | K163: 16.20 | L163: 16.40 | M163: 24.40 | N163: 81.05 | O163: 0.0 | P163: 81.05
C164: 4 | D164: 3 | E164: 4 | F164: 4 | G164: 3 | H164: 5 | I164: 4 | J164: 4 | K164: 4 | L164: 2 | M164: 4 | N164: 4 | P164: 4
A165: Genesis | B165: 2 | C165: 15.40 | D165: 15.60 | E165: 31.00 | F165: 15.80 | G165: 15.90 | H165: 16.20 | I165: 23.95 | J165: 15.60 | K165: 15.80 | L165: 15.20 | M165: 23.30 | N165: 78.25 | O165: 0.0 | P165: 78.25
C166: 5 | D166: 5 | E166: 5 | F166: 5 | G166: 5 | H166: 4 | I166: 5 | J166: 5 | K166: 5 | L166: 5 | M166: 5 | N166: 5 | P166: 5
A167: Jersey | B167: 1 | C167: 14.50 | D167: 15.20 | E167: 29.70 | F167: 15.10 | G167: 15.50 | H167: 15.70 | I167: 23.15 | J167: 14.90 | K167: 15.40 | L167: 14.70 | M167: 22.50 | N167: 75.35 | O167: 0.0 | P167: 75.35
A168: Surf | C168: 6 | D168: 6 | E168: 6 | F168: 6 | G168: 6 | H168: 6 | I168: 6 | J168: 6 | K168: 6 | L168: 6 | M168: 6 | N168: 6 | P168: 6
A171: 8/5/2024 Canton, Ohio
C172: General Effect | F172: Visual | J172: Music
C173: 1 | D173: 2 | F173: Proficiency | G173: Analysis | H173: Color Guard | J173: Brass | K173: Analysis | L173: Percussion | N173: Sub | P173: Total
C174: K. Miller | D174: K. Turner | E174: Total | F174: R. Solomon | G174: J. Sturgeon | H174: M. Turner | I174: Total ÷2 | J174: A. Cook | K174: J. Webb | L174: J. Davila | M174: Total ÷2 | N174: Total | O174: Pen | P174: Score
A175: DCI World Class | C175: 20 | D175: 20 | E175: 40 | F175: 20 | G175: 20 | H175: 20 | I175: 30 | J175: 20 | K175: 20 | L175: 20 | M175: 30 | N175: 100 | P175: 100
A176: Bluecoats | B176: 9 | C176: 19.20 | D176: 19.30 | E176: 38.50 | F176: 19.40 | G176: 19.40 | H176: 18.60 | I176: 28.70 | J176: 19.00 | K176: 19.10 | L176: 19.50 | M176: 28.800 | N176: 96.000 | O176: 0.0 | P176: 96.000
C177: 1 | D177: 1 | E177: 1 | F177: 1 | G177: 1 | H177: 3 | I177: 1 | J177: 1 | K177: 1 | L177: 1 | M177: 1 | N177: 1 | P177: 1
A178: Boston | B178: 8 | C178: 18.90 | D178: 19.00 | E178: 37.90 | F178: 19.00 | G178: 19.00 | H178: 18.80 | I178: 28.40 | J178: 18.65 | K178: 18.80 | L178: 19.35 | M178: 28.400 | N178: 94.700 | O178: 0.0 | P178: 94.700
A179: Crusaders | C179: 3 | D179: 2 | E179: 2 | F179: 3 | G179: 3 | H179: 1 | I179: 3 | J179: 3 | K179: 2 | L179: 2 | M179: 2 | N179: 2 | P179: 2
A180: Blue | B180: 7 | C180: 18.80 | D180: 18.50 | E180: 37.30 | F180: 19.10 | G180: 19.10 | H180: 18.70 | I180: 28.45 | J180: 18.80 | K180: 18.70 | L180: 19.00 | M180: 28.250 | N180: 94.000 | O180: 0.0 | P180: 94.000
A181: Devils | C181: 4 | D181: 4 | E181: 4 | F181: 2 | G181: 2 | H181: 2 | I181: 2 | J181: 2 | K181: 3 | L181: 3 | M181: 3 | N181: 3 | P181: 3
A182: Phantom | B182: 6 | C182: 19.00 | D182: 18.70 | E182: 37.70 | F182: 18.50 | G182: 18.80 | H182: 18.20 | I182: 27.75 | J182: 18.55 | K182: 18.40 | L182: 18.50 | M182: 27.725000000000001 | N182: 93.174999999999997 | O182: 0.0 | P182: 93.174999999999997
A183: Regiment | C183: 2 | D183: 3 | E183: 3 | F183: 4 | G183: 4 | H183: 4 | I183: 4 | J183: 4 | K183: 4 | L183: 4 | M183: 4 | N183: 4 | P183: 4
A184: Mandarins | B184: 5 | C184: 18.20 | D184: 18.30 | E184: 36.50 | F184: 17.90 | G184: 18.40 | H184: 18.10 | I184: 27.20 | J184: 17.85 | K184: 17.90 | L184: 17.40 | M184: 26.574999999999999 | N184: 90.275000000000006 | O184: 0.0 | P184: 90.275000000000006
C185: 5 | D185: 5 | E185: 5 | F185: 5 | G185: 5 | H185: 5 | I185: 5 | J185: 6 | K185: 5 | L185: 7 | M185: 6 | N185: 5 | P185: 5
A186: Blue | B186: 4 | C186: 17.80 | D186: 17.80 | E186: 35.60 | F186: 17.70 | G186: 17.70 | H186: 17.30 | I186: 26.35 | J186: 17.90 | K186: 17.70 | L186: 17.90 | M186: 26.750 | N186: 88.700 | O186: 0.0 | P186: 88.700
A187: Stars | C187: 6 | D187: 6 | E187: 6 | F187: 6 | G187: 7 | H187: 6 | I187: 6 | J187: 5 | K187: 6 | L187: 6 | M187: 5 | N187: 6 | P187: 6
A188: Colts | B188: 3 | C188: 17.50 | D188: 17.60 | E188: 35.10 | F188: 17.60 | G188: 17.80 | H188: 16.80 | I188: 26.10 | J188: 17.40 | K188: 17.20 | L188: 18.00 | M188: 26.300 | N188: 87.500 | O188: 0.0 | P188: 87.500
C189: 7 | D189: 7 | E189: 7 | F189: 7 | G189: 6 | H189: 7 | I189: 7 | J189: 7 | K189: 7 | L189: 5 | M189: 7 | N189: 7 | P189: 7
A190: Crossmen | B190: 2 | C190: 16.60 | D190: 17.00 | E190: 33.60 | F190: 16.70 | G190: 16.80 | H190: 16.40 | I190: 24.95 | J190: 17.00 | K190: 16.90 | L190: 16.50 | M190: 25.200 | N190: 83.750 | O190: 0.0 | P190: 83.750
C191: 8 | D191: 8 | E191: 8 | F191: 8 | G191: 8 | H191: 8 | I191: 8 | J191: 8 | K191: 8 | L191: 9 | M191: 8 | N191: 8 | P191: 8
A192: Spirit of | B192: 1 | C192: 16.10 | D192: 16.40 | E192: 32.50 | F192: 16.40 | G192: 16.60 | H192: 16.00 | I192: 24.50 | J192: 16.70 | K192: 16.60 | L192: 16.90 | M192: 25.100 | N192: 82.100 | O192: 0.0 | P192: 82.100
A193: Atlanta | C193: 9 | D193: 9 | E193: 9 | F193: 9 | G193: 9 | H193: 9 | I193: 9 | J193: 9 | K193: 9 | L193: 8 | M193: 9 | N193: 9 | P193: 9
A196: 8/5/2024 Marion, Indiana--DCI Open Class World Championship Prelims
C197: General Effect | J197: Visual | N197: Music
C198: 1 | D198: 1 | F198: 2 | G198: 2 | J198: Proficiency | K198: Analysis | L198: Color Guard | N198: Brass | O198: Analysis 1 | P198: Analysis 2 | Q198: Analysis | R198: Percussion | T198: Sub | V198: Total
C199: C. Costanza | D199: T. Wemhoff | E199: Average | F199: C. Moss | G199: N. Jones | H199: Average | I199: Total | J199: J. Orefice | K199: J. Pursifull | L199: H. Nguyen | M199: Total ÷2 | N199: B. Huneycutt | O199: D. Argule | P199: G. Fugett | Q199: Average | R199: P. Furnari | S199: Total ÷2 | T199: Total | U199: Pen | V199: Score
A200: DCI Open Class | C200: 20 | D200: 20 | E200: 20 | F200: 20 | G200: 20 | H200: 20 | I200: 40 | J200: 20 | K200: 20 | L200: 20 | M200: 30 | N200: 20 | O200: 20 | P200: 20 | Q200: 20 | R200: 20 | S200: 30 | T200: 100 | V200: 100
A201: Spartans | B201: 10 | C201: 16.00 | D201: 16.30 | E201: 16.150 | F201: 16.90 | G201: 16.70 | H201: 16.800 | I201: 32.950 | J201: 16.80 | K201: 16.40 | L201: 16.50 | M201: 24.850 | N201: 16.90 | O201: 16.90 | P201: 16.60 | Q201: 16.750 | R201: 16.10 | S201: 24.875 | T201: 82.674999999999997 | U201: 0.0 | V201: 82.674999999999997
C202: 2 | D202: 2 | E202: 2 | F202: 1 | G202: 1 | H202: 1 | I202: 1 | J202: 1 | K202: 1 | L202: 1 | M202: 1 | N202: 1 | O202: 1 | P202: 1 | Q202: 1 | R202: 3 | S202: 1 | T202: 1 | V202: 1
A203: Blue | B203: 1 | C203: 16.20 | D203: 16.60 | E203: 16.400 | F203: 16.60 | G203: 16.20 | H203: 16.400 | I203: 32.800 | J203: 16.30 | K203: 16.20 | L203: 16.10 | M203: 24.300 | N203: 16.70 | O203: 16.60 | P203: 16.10 | Q203: 16.350 | R203: 16.30 | S203: 24.675000000000001 | T203: 81.775000000000006 | U203: 0.0 | V203: 81.775000000000006
A204: Devils B | C204: 1 | D204: 1 | E204: 1 | F204: 2 | G204: 3 | H204: 3 | I204: 2 | J204: 3 | K204: 2 | L204: 3 | M204: 3 | N204: 2 | O204: 2 | P204: 3 | Q204: 2 | R204: 2 | S204: 2 | T204: 2 | V204: 2
A205: Gold | B205: 9 | C205: 15.10 | D205: 16.00 | E205: 15.550 | F205: 16.50 | G205: 16.40 | H205: 16.450 | I205: 32.000 | J205: 16.50 | K205: 16.10 | L205: 16.20 | M205: 24.400 | N205: 16.00 | O205: 15.60 | P205: 16.30 | Q205: 15.950 | R205: 16.50 | S205: 24.225000000000001 | T205: 80.625 | U205: 0.0 | V205: 80.625
C206: 5 | D206: 3 | E206: 4 | F206: 3 | G206: 2 | H206: 2 | I206: 3 | J206: 2 | K206: 3 | L206: 2 | M206: 2 | N206: 4 | O206: 5 | P206: 2 | Q206: 4 | R206: 1 | S206: 3 | T206: 3 | V206: 3
A207: Battalion | B207: 8 | C207: 15.40 | D207: 15.70 | E207: 15.550 | F207: 15.80 | G207: 16.00 | H207: 15.900 | I207: 31.450 | J207: 15.90 | K207: 15.90 | L207: 15.70 | M207: 23.750 | N207: 16.30 | O207: 16.40 | P207: 15.60 | Q207: 16.000 | R207: 15.10 | S207: 23.700 | T207: 78.900 | U207: 0.0 | V207: 78.900
C208: 4 | D208: 5 | E208: 4 | F208: 5 | G208: 4 | H208: 4 | I208: 5 | J208: 4 | K208: 4 | L208: 4 | M208: 4 | N208: 3 | O208: 3 | P208: 4 | Q208: 3 | R208: 6 | S208: 4 | T208: 4 | V208: 4
A209: Columbians | B209: 7 | C209: 15.60 | D209: 15.80 | E209: 15.700 | F209: 15.90 | G209: 15.80 | H209: 15.850 | I209: 31.550 | J209: 15.70 | K209: 15.30 | L209: 15.00 | M209: 23.000 | N209: 15.80 | O209: 16.00 | P209: 15.40 | Q209: 15.700 | R209: 15.50 | S209: 23.500 | T209: 78.050 | U209: 0.0 | V209: 78.050
C210: 3 | D210: 4 | E210: 3 | F210: 4 | G210: 5 | H210: 5 | I210: 4 | J210: 5 | K210: 5 | L210: 6 | M210: 6 | N210: 5 | O210: 4 | P210: 5 | Q210: 5 | R210: 5 | S210: 5 | T210: 5 | V210: 5
A211: River City | B211: 6 | C211: 15.00 | D211: 15.10 | E211: 15.050 | F211: 15.30 | G211: 15.40 | H211: 15.350 | I211: 30.400 | J211: 15.30 | K211: 15.20 | L211: 15.60 | M211: 23.050 | N211: 15.30 | O211: 15.40 | P211: 15.00 | Q211: 15.200 | R211: 15.80 | S211: 23.150 | T211: 76.600 | U211: 0.0 | V211: 76.600
A212: Rhythm | C212: 6 | D212: 6 | E212: 6 | F212: 6 | G212: 6 | H212: 6 | I212: 6 | J212: 6 | K212: 6 | L212: 5 | M212: 5 | N212: 6 | O212: 6 | P212: 6 | Q212: 6 | R212: 4 | S212: 6 | T212: 6 | V212: 6
A213: Raiders | B213: 4 | C213: 14.10 | D213: 14.70 | E213: 14.400 | F213: 14.70 | G213: 15.10 | H213: 14.900 | I213: 29.300 | J213: 14.30 | K213: 14.90 | L213: 14.50 | M213: 21.850 | N213: 14.10 | O213: 14.00 | P213: 14.20 | Q213: 14.100 | R213: 14.70 | S213: 21.450 | T213: 72.600 | U213: 0.0 | V213: 72.600
C214: 7 | D214: 7 | E214: 7 | F214: 7 | G214: 7 | H214: 7 | I214: 7 | J214: 8 | K214: 7 | L214: 9 | M214: 8 | N214: 9 | O214: 8 | P214: 7 | Q214: 8 | R214: 7 | S214: 8 | T214: 7 | V214: 7
A215: Colt | B215: 5 | C215: 14.00 | D215: 14.60 | E215: 14.300 | F215: 14.10 | G215: 14.70 | H215: 14.400 | I215: 28.700 | J215: 14.00 | K215: 14.50 | L215: 14.90 | M215: 21.700 | N215: 14.80 | O215: 14.40 | P215: 14.00 | Q215: 14.200 | R215: 14.50 | S215: 21.750 | T215: 72.150 | U215: 0.0 | V215: 72.150
A216: Cadets | C216: 8 | D216: 8 | E216: 8 | F216: 9 | G216: 8 | H216: 8 | I216: 8 | J216: 9 | K216: 8 | L216: 7 | M216: 9 | N216: 7 | O216: 7 | P216: 8 | Q216: 7 | R216: 8 | S216: 7 | T216: 8 | V216: 8
A217: 7th | B217: 3 | C217: 13.80 | D217: 14.20 | E217: 14.000 | F217: 14.20 | G217: 14.60 | H217: 14.400 | I217: 28.400 | J217: 14.70 | K217: 14.30 | L217: 14.80 | M217: 21.900 | N217: 14.50 | O217: 13.60 | P217: 13.60 | Q217: 13.600 | R217: 14.40 | S217: 21.250 | T217: 71.550 | U217: 0.0 | V217: 71.550
A218: Regiment | C218: 9 | D218: 9 | E218: 9 | F218: 8 | G218: 9 | H218: 8 | I218: 9 | J218: 7 | K218: 9 | L218: 8 | M218: 7 | N218: 8 | O218: 9 | P218: 9 | Q218: 9 | R218: 9 | S218: 9 | T218: 9 | V218: 9
A219: Les | B219: 2 | C219: 13.20 | D219: 13.70 | E219: 13.450 | F219: 13.70 | G219: 14.30 | H219: 14.000 | I219: 27.450 | J219: 13.50 | K219: 13.40 | L219: 13.10 | M219: 20.000 | N219: 13.30 | O219: 12.40 | P219: 12.70 | Q219: 12.550 | R219: 12.30 | S219: 19.074999999999999 | T219: 66.525000000000006 | U219: 0.0 | V219: 66.525000000000006
A220: Stentors | C220: 10 | D220: 10 | E220: 10 | F220: 10 | G220: 10 | H220: 10 | I220: 10 | J220: 10 | K220: 10 | L220: 10 | M220: 10 | N220: 10 | O220: 10 | P220: 10 | Q220: 10 | R220: 10 | S220: 10 | T220: 10 | V220: 10
A223: 8/6/2024 Marion, Indiana--DCI Open Class World Championship Finals
C224: General Effect | J224: Visual | N224: Music
C225: 1 | D225: 1 | F225: 2 | G225: 2 | J225: Proficiency | K225: Analysis | L225: Color Guard | N225: Brass | O225: Analysis 1 | P225: Analysis 2 | Q225: Analysis | R225: Percussion | T225: Sub | V225: Total
C226: B. Brahan | D226: B. Spidel | E226: Average | F226: M. Howard | G226: J. Kennedy | H226: Average | I226: Total | J226: T. Landis | K226: K. Baker | L226: J. Campbell | M226: Total ÷2 | N226: B. Fabrizio | O226: P. Haines | P226: T. Fox | Q226: Average | R226: J. Davila | S226: Total ÷2 | T226: Total | U226: Pen | V226: Score
A227: DCI Open Class | C227: 20 | D227: 20 | E227: 20 | F227: 20 | G227: 20 | H227: 20 | I227: 40 | J227: 20 | K227: 20 | L227: 20 | M227: 30 | N227: 20 | O227: 20 | P227: 20 | Q227: 20 | R227: 20 | S227: 30 | T227: 100 | V227: 100
A228: Spartans | B228: 10 | C228: 16.40 | D228: 16.40 | E228: 16.400 | F228: 16.90 | G228: 16.60 | H228: 16.750 | I228: 33.150 | J228: 16.90 | K228: 16.20 | L228: 16.40 | M228: 24.750 | N228: 17.10 | O228: 16.40 | P228: 16.65 | Q228: 16.524999999999999 | R228: 16.50 | S228: 25.062999999999999 | T228: 82.962999999999994 | U228: 0.0 | V228: 82.962999999999994
C229: 1 | D229: 1 | E229: 1 | F229: 2 | G229: 1 | H229: 1 | I229: 1 | J229: 1 | K229: 1 | L229: 1 | M229: 1 | N229: 1 | O229: 2 | P229: 2 | Q229: 2 | R229: 3 | S229: 2 | T229: 1 | V229: 1
A230: Blue | B230: 9 | C230: 16.30 | D230: 16.20 | E230: 16.250 | F230: 19.70 | G230: 16.30 | H230: 16.500 | I230: 32.750 | J230: 16.70 | K230: 16.00 | L230: 16.30 | M230: 24.500 | N230: 16.80 | O230: 16.60 | P230: 16.70 | Q230: 16.650 | R230: 17.00 | S230: 25.225000000000001 | T230: 82.474999999999994 | U230: 0.0 | V230: 82.474999999999994
A231: Devils B | C231: 2 | D231: 2 | E231: 2 | F231: 1 | G231: 2 | H231: 2 | I231: 2 | J231: 2 | K231: 2 | L231: 2 | M231: 2 | N231: 2 | O231: 1 | P231: 1 | Q231: 1 | R231: 1 | S231: 1 | T231: 2 | V231: 2
A232: Gold | B232: 8 | C232: 16.00 | D232: 15.00 | E232: 15.500 | F232: 16.40 | G232: 16.00 | H232: 16.200 | I232: 31.700 | J232: 16.40 | K232: 15.40 | L232: 15.40 | M232: 23.600 | N232: 16.20 | O232: 16.00 | P232: 16.30 | Q232: 16.150 | R232: 16.65 | S232: 24.500 | T232: 79.800 | U232: 0.0 | V232: 79.800
C233: 3 | D233: 6 | E233: 4 | F233: 3 | G233: 3 | H233: 3 | I233: 3 | J233: 3 | K233: 5 | L233: 5 | M233: 4 | N233: 4 | O233: 3 | P233: 3 | Q233: 3 | R233: 2 | S233: 3 | T233: 3 | V233: 3
A234: Battalion | B234: 7 | C234: 15.80 | D234: 15.10 | E234: 15.450 | F234: 16.00 | G234: 15.60 | H234: 15.800 | I234: 31.250 | J234: 16.20 | K234: 15.60 | L234: 15.70 | M234: 23.750 | N234: 16.40 | O234: 15.55 | P234: 16.20 | Q234: 15.875 | R234: 16.10 | S234: 24.187999999999999 | T234: 79.188000000000002 | U234: 0.0 | V234: 79.188000000000002
C235: 5 | D235: 5 | E235: 5 | F235: 5 | G235: 4 | H235: 4 | I235: 5 | J235: 4 | K235: 3 | L235: 3 | M235: 3 | N235: 3 | O235: 4 | P235: 4 | Q235: 4 | R235: 4 | S235: 4 | T235: 4 | V235: 4
A236: Columbians | B236: 6 | C236: 15.90 | D236: 15.80 | E236: 15.850 | F236: 16.20 | G236: 15.40 | H236: 15.800 | I236: 31.650 | J236: 15.70 | K236: 15.50 | L236: 15.50 | M236: 23.350 | N236: 16.00 | O236: 15.40 | P236: 15.80 | Q236: 15.600 | R236: 15.50 | S236: 23.550 | T236: 78.550 | U236: 0.0 | V236: 78.550
C237: 4 | D237: 4 | E237: 3 | F237: 4 | G237: 5 | H237: 4 | I237: 4 | J237: 5 | K237: 4 | L237: 4 | M237: 5 | N237: 5 | O237: 5 | P237: 5 | Q237: 5 | R237: 6 | S237: 5 | T237: 5 | V237: 5
A238: River City | B238: 5 | C238: 15.60 | D238: 16.20 | E238: 15.400 | F238: 15.40 | G238: 15.30 | H238: 15.350 | I238: 30.750 | J238: 15.50 | K238: 14.90 | L238: 15.20 | M238: 22.800 | N238: 15.50 | O238: 15.10 | P238: 15.00 | Q238: 15.050 | R238: 15.70 | S238: 23.125 | T238: 76.674999999999997 | U238: 0.0 | V238: 76.674999999999997
A239: Rhythm | C239: 6 | D239: 2 | E239: 6 | F239: 6 | G239: 6 | H239: 6 | I239: 6 | J239: 6 | K239: 6 | L239: 6 | M239: 6 | N239: 6 | O239: 6 | P239: 6 | Q239: 6 | R239: 5 | S239: 6 | T239: 6 | V239: 6
A240: Raiders | B240: 4 | C240: 14.80 | D240: 14.10 | E240: 14.450 | F240: 15.00 | G240: 15.10 | H240: 15.050 | I240: 29.500 | J240: 14.90 | K240: 14.50 | L240: 14.60 | M240: 22.000 | N240: 14.60 | O240: 14.40 | P240: 14.30 | Q240: 14.350 | R240: 14.80 | S240: 21.875 | T240: 73.375 | U240: 0.0 | V240: 73.375
C241: 7 | D241: 7 | E241: 7 | F241: 7 | G241: 7 | H241: 7 | I241: 7 | J241: 7 | K241: 7 | L241: 8 | M241: 7 | N241: 9 | O241: 7 | P241: 7 | Q241: 7 | R241: 7 | S241: 7 | T241: 7 | V241: 7
A242: Colt | B242: 3 | C242: 14.60 | D242: 13.90 | E242: 14.250 | F242: 14.50 | G242: 14.20 | H242: 14.350 | I242: 28.600 | J242: 14.60 | K242: 14.30 | L242: 14.80 | M242: 21.850 | N242: 15.00 | O242: 14.00 | P242: 14.00 | Q242: 14.000 | R242: 14.20 | S242: 21.600 | T242: 72.050 | U242: 0.0 | V242: 72.050
A243: Cadets | C243: 8 | D243: 8 | E243: 8 | F243: 9 | G243: 10 | H243: 9 | I243: 8 | J243: 9 | K243: 8 | L243: 7 | M243: 8 | N243: 7 | O243: 8 | P243: 8 | Q243: 8 | R243: 8 | S243: 8 | T243: 8 | V243: 8
A244: 7th | B244: 2 | C244: 14.00 | D244: 13.70 | E244: 13.850 | F244: 14.70 | G244: 14.40 | H244: 14.550 | I244: 28.400 | J244: 14.80 | K244: 14.10 | L244: 14.50 | M244: 21.700 | N244: 14.70 | O244: 13.70 | P244: 13.40 | Q244: 13.550 | R244: 14.00 | S244: 21.125 | T244: 71.224999999999994 | U244: 0.0 | V244: 71.224999999999994
A245: Regiment | C245: 9 | D245: 9 | E245: 9 | F245: 8 | G245: 8 | H245: 8 | I245: 9 | J245: 8 | K245: 9 | L245: 9 | M245: 9 | N245: 8 | O245: 9 | P245: 9 | Q245: 9 | R245: 9 | S245: 9 | T245: 9 | V245: 9
A246: Les | B246: 1 | C246: 13.50 | D246: 13.10 | E246: 13.300 | F246: 14.10 | G246: 14.30 | H246: 14.200 | I246: 27.500 | J246: 13.60 | K246: 13.50 | L246: 13.20 | M246: 20.150 | N246: 13.60 | O246: 12.50 | P246: 12.60 | Q246: 12.550 | R246: 13.00 | S246: 19.574999999999999 | T246: 67.224999999999994 | U246: 0.0 | V246: 67.224999999999994
A247: Stentors | C247: 10 | D247: 10 | E247: 10 | F247: 10 | G247: 9 | H247: 10 | I247: 10 | J247: 10 | K247: 10 | L247: 10 | M247: 10 | N247: 10 | O247: 10 | P247: 10 | Q247: 10 | R247: 10 | S247: 10 | T247: 10 | V247: 10
A250: 8/8/2024 Indianapolis, Indiana--DCI World Class Championship Prelims
C251: General Effect | J251: Visual | N251: Music
C252: 1 | D252: 1 | F252: 2 | G252: 2 | J252: Proficiency | K252: Analysis | L252: Color Guard | N252: Brass | O252: Analysis 1 | P252: Analysis 2 | Q252: Analysis | R252: Percussion | T252: Sub | V252: Total
C253: B. Bahan | D253: K. Miller | E253: Average | F253: G. Fugett | G253: M. Howard | H253: Average | I253: Total | J253: M. Tarr | K253: K. Baker | L253: J. Campbell | M253: Total ÷2 | N253: M. Hoskins | O253: K. Young | P253: C. Romanowski | Q253: Average | R253: P. Fumari | S253: Total ÷2 | T253: Total | U253: Pen | V253: Score
A254: DCI World Class | C254: 20 | D254: 20 | E254: 20 | F254: 20 | G254: 20 | H254: 20 | I254: 40 | J254: 20 | K254: 20 | L254: 20 | M254: 30 | N254: 20 | O254: 20 | P254: 20 | Q254: 20 | R254: 20 | S254: 30 | T254: 100 | V254: 100
A255: Bluecoats | B255: 31 | C255: 19.10 | D255: 19.30 | E255: 19.200 | F255: 19.70 | G255: 19.70 | H255: 19.700 | I255: 38.900 | J255: 19.45 | K255: 19.70 | L255: 19.60 | M255: 29.375 | N255: 19.45 | O255: 19.50 | P255: 19.50 | Q255: 19.500 | R255: 19.55 | S255: 29.250 | T255: 97.525000000000006 | U255: 0.0 | V255: 97.525000000000006
C256: 1 | D256: 1 | E256: 1 | F256: 1 | G256: 1 | H256: 1 | I256: 1 | J256: 2 | K256: 1 | L256: 2 | M256: 1 | N256: 1 | O256: 1 | P256: 1 | Q256: 1 | R256: 2 | S256: 1 | T256: 1 | V256: 1
A257: Boston | B257: 30 | C257: 18.90 | D257: 18.80 | E257: 18.850 | F257: 19.30 | G257: 19.50 | H257: 19.400 | I257: 38.250 | J257: 19.50 | K257: 19.40 | L257: 19.70 | M257: 29.300 | N257: 19.25 | O257: 19.30 | P257: 19.20 | Q257: 19.250 | R257: 19.60 | S257: 29.050 | T257: 96.600 | U257: 0.0 | V257: 96.600
A258: Crusaders | C258: 2 | D258: 4 | E258: 3 | F258: 2 | G258: 2 | H258: 2 | I258: 2 | J258: 1 | K258: 2 | L258: 1 | M258: 2 | N258: 2 | O258: 2 | P258: 2 | Q258: 2 | R258: 1 | S258: 2 | T258: 2 | V258: 2
A259: Blue | B259: 29 | C259: 18.80 | D259: 19.10 | E259: 18.950 | F259: 19.05 | G259: 19.25 | H259: 19.150 | I259: 38.100 | J259: 19.15 | K259: 19.30 | L259: 19.50 | M259: 28.975000000000001 | N259: 19.15 | O259: 19.25 | P259: 19.15 | Q259: 19.200 | R259: 19.25 | S259: 28.800 | T259: 95.875 | U259: 0.0 | V259: 95.875
A260: Devils | C260: 3 | D260: 2 | E260: 2 | F260: 3 | G260: 3 | H260: 3 | I260: 3 | J260: 3 | K260: 3 | L260: 3 | M260: 3 | N260: 3 | O260: 3 | P260: 3 | Q260: 3 | R260: 4 | S260: 3 | T260: 3 | V260: 3
A261: Carolina | B261: 28 | C261: 18.50 | D261: 18.70 | E261: 18.600 | F261: 18.85 | G261: 19.10 | H261: 18.975000000000001 | I261: 37.575000000000003 | J261: 18.65 | K261: 18.90 | L261: 19.20 | M261: 28.375 | N261: 19.00 | O261: 18.85 | P261: 19.00 | Q261: 18.925000000000001 | R261: 18.80 | S261: 28.363 | T261: 94.313000000000002 | U261: 0.0 | V261: 94.313000000000002
A262: Crown | C262: 5 | D262: 5 | E262: 5 | F262: 5 | G262: 5 | H262: 5 | I262: 5 | J262: 5 | K262: 4 | L262: 4 | M262: 4 | N262: 4 | O262: 5 | P262: 4 | Q262: 4 | R262: 6 | S262: 4 | T262: 4 | V262: 4
A263: Phantom | B263: 27 | C263: 18.60 | D263: 19.00 | E263: 18.800 | F263: 19.00 | G263: 19.20 | H263: 19.100 | I263: 37.900 | J263: 18.90 | K263: 18.50 | L263: 18.80 | M263: 28.100 | N263: 18.70 | O263: 19.00 | P263: 18.70 | Q263: 18.850 | R263: 19.00 | S263: 28.274999999999999 | T263: 94.275000000000006 | U263: 0.0 | V263: 94.275000000000006
A264: Regiment | C264: 4 | D264: 3 | E264: 4 | F264: 4 | G264: 4 | H264: 4 | I264: 4 | J264: 4 | K264: 6 | L264: 6 | M264: 5 | N264: 5 | O264: 4 | P264: 5 | Q264: 5 | R264: 5 | S264: 5 | T264: 5 | V264: 5
A265: Vanguard | B265: 26 | C265: 18.30 | D265: 18.00 | E265: 18.150 | F265: 18.60 | G265: 18.70 | H265: 18.650 | I265: 36.800 | J265: 18.50 | K265: 18.80 | L265: 18.90 | M265: 28.100 | N265: 18.30 | O265: 18.60 | P265: 18.40 | Q265: 18.500 | R265: 19.40 | S265: 28.100 | T265: 93.000 | U265: 0.0 | V265: 93.000
C266: 6 | D266: 8 | E266: 6 | F266: 7 | G266: 6 | H266: 6 | I266: 6 | J266: 6 | K266: 5 | L266: 5 | M266: 5 | N266: 6 | O266: 6 | P266: 6 | Q266: 6 | R266: 3 | S266: 6 | T266: 6 | V266: 6
A267: Mandarins | B267: 25 | C267: 17.75 | D267: 18.50 | E267: 18.125 | F267: 18.40 | G267: 18.60 | H267: 18.500 | I267: 36.625 | J267: 18.25 | K267: 18.30 | L267: 18.50 | M267: 27.524999999999999 | N267: 17.90 | O267: 18.30 | P267: 18.30 | Q267: 18.300 | R267: 17.95 | S267: 27.074999999999999 | T267: 91.224999999999994 | U267: 0.0 | V267: 91.224999999999994
C268: 7 | D268: 6 | E268: 7 | F268: 8 | G268: 7 | H268: 7 | I268: 7 | J268: 7 | K268: 7 | L268: 7 | M268: 7 | N268: 8 | O268: 7 | P268: 7 | Q268: 7 | R268: 10 | S268: 8 | T268: 7 | V268: 7
A269: Blue | B269: 24 | C269: 17.70 | D269: 18.10 | E269: 17.900 | F269: 18.70 | G269: 18.20 | H269: 18.450 | I269: 36.350 | J269: 18.20 | K269: 17.80 | L269: 18.20 | M269: 27.100 | N269: 18.10 | O269: 18.20 | P269: 18.20 | Q269: 18.200 | R269: 17.90 | S269: 27.100 | T269: 90.550 | U269: 0.0 | V269: 90.550
A270: Stars | C270: 8 | D270: 7 | E270: 8 | F270: 6 | G270: 8 | H270: 8 | I270: 8 | J270: 8 | K270: 10 | L270: 8 | M270: 8 | N270: 7 | O270: 8 | P270: 8 | Q270: 8 | R270: 11 | S270: 7 | T270: 8 | V270: 8
A271: Colts | B271: 22 | C271: 17.50 | D271: 17.60 | E271: 17.550 | F271: 18.00 | G271: 18.10 | H271: 18.050 | I271: 35.600 | J271: 17.90 | K271: 18.00 | L271: 18.10 | M271: 27.000 | N271: 17.55 | O271: 17.80 | P271: 17.50 | Q271: 17.650 | R271: 18.30 | S271: 26.750 | T271: 89.350 | U271: 0.0 | V271: 89.350
C272: 9 | D272: 9 | E272: 9 | F272: 9 | G272: 9 | H272: 9 | I272: 9 | J272: 9 | K272: 8 | L272: 9 | M272: 9 | N272: 9 | O272: 9 | P272: 11 | Q272: 10 | R272: 9 | S272: 10 | T272: 9 | V272: 9
A273: Cavaliers | B273: 23 | C273: 17.35 | D273: 16.90 | E273: 17.125 | F273: 17.35 | G273: 17.75 | H273: 17.550 | I273: 34.674999999999997 | J273: 17.70 | K273: 17.90 | L273: 18.00 | M273: 26.800 | N273: 17.25 | O273: 17.55 | P273: 17.70 | Q273: 17.625 | R273: 18.60 | S273: 26.738 | T273: 88.212999999999994 | U273: 0.0 | V273: 88.212999999999994
C274: 10 | D274: 12 | E274: 11 | F274: 12 | G274: 11 | H274: 12 | I274: 11 | J274: 10 | K274: 9 | L274: 10 | M274: 10 | N274: 11 | O274: 11 | P274: 10 | Q274: 11 | R274: 8 | S274: 11 | T274: 10 | V274: 10
A275: Troopers | B275: 21 | C275: 17.20 | D275: 17.20 | E275: 17.200 | F275: 17.80 | G275: 17.80 | H275: 17.800 | I275: 35.000 | J275: 17.50 | K275: 17.40 | L275: 17.10 | M275: 26.000 | N275: 17.40 | O275: 17.75 | P275: 17.90 | Q275: 17.824999999999999 | R275: 18.70 | S275: 26.963000000000001 | T275: 87.962999999999994 | U275: 0.0 | V275: 87.962999999999994
C276: 11 | D276: 10 | E276: 10 | F276: 10 | G276: 10 | H276: 10 | I276: 10 | J276: 11 | K276: 11 | L276: 14 | M276: 11 | N276: 10 | O276: 10 | P276: 9 | Q276: 9 | R276: 7 | S276: 9 | T276: 11 | V276: 11
A277: Madison | B277: 20 | C277: 16.95 | D277: 17.10 | E277: 17.024999999999999 | F277: 17.60 | G277: 17.70 | H277: 17.650 | I277: 34.674999999999997 | J277: 17.30 | K277: 17.30 | L277: 17.40 | M277: 26.000 | N277: 17.10 | O277: 17.40 | P277: 17.30 | Q277: 17.350 | R277: 17.35 | S277: 25.900 | T277: 86.575000000000003 | U277: 0.0 | V277: 86.575000000000003
A278: Scouts | C278: 13 | D278: 11 | E278: 12 | F278: 11 | G278: 12 | H278: 11 | I278: 11 | J278: 12 | K278: 12 | L278: 12 | M278: 11 | N278: 12 | O278: 12 | P278: 12 | Q278: 12 | R278: 13 | S278: 12 | T278: 12 | V278: 12
A279: Pacific | B279: 17 | C279: 16.85 | D279: 16.60 | E279: 16.725000000000001 | F279: 17.20 | G279: 17.20 | H279: 17.200 | I279: 33.924999999999997 | J279: 17.00 | K279: 16.80 | L279: 17.60 | M279: 25.700 | N279: 16.55 | O279: 16.85 | P279: 16.70 | Q279: 16.774999999999999 | R279: 17.40 | S279: 25.363 | T279: 84.988 | U279: 0.0 | V279: 84.988
A280: Crest | C280: 14 | D280: 14 | E280: 14 | F280: 13 | G280: 14 | H280: 14 | I280: 13 | J280: 14 | K280: 14 | L280: 11 | M280: 13 | N280: 16 | O280: 15 | P280: 16 | Q280: 16 | R280: 12 | S280: 15 | T280: 13 | V280: 13
A281: Blue | B281: 19 | C281: 17.05 | D281: 16.70 | E281: 16.875 | F281: 16.80 | G281: 17.15 | H281: 16.975000000000001 | I281: 33.850 | J281: 17.05 | K281: 16.90 | L281: 16.90 | M281: 25.425000000000001 | N281: 16.95 | O281: 17.20 | P281: 16.95 | Q281: 17.074999999999999 | R281: 17.05 | S281: 25.538 | T281: 84.813000000000002 | U281: 0.0 | V281: 84.813000000000002
A282: Knights | C282: 12 | D282: 13 | E282: 13 | F282: 15 | G282: 15 | H282: 15 | I282: 14 | J282: 13 | K282: 13 | L282: 15 | M282: 14 | N282: 13 | O282: 13 | P282: 14 | Q282: 13 | R282: 15 | S282: 13 | T282: 14 | V282: 14
A283: Crossmen | B283: 18 | C283: 16.70 | D283: 16.40 | E283: 16.550 | F283: 17.10 | G283: 17.35 | H283: 17.225000000000001 | I283: 33.774999999999999 | J283: 16.70 | K283: 16.70 | L283: 17.20 | M283: 25.300 | N283: 16.75 | O283: 17.00 | P283: 17.10 | Q283: 17.050 | R283: 17.10 | S283: 25.450 | T283: 84.525000000000006 | U283: 0.0 | V283: 84.525000000000006
C284: 15 | D284: 15 | E284: 15 | F284: 14 | G284: 13 | H284: 13 | I284: 15 | J284: 15 | K284: 15 | L284: 13 | M284: 15 | N284: 15 | O284: 14 | P284: 13 | Q284: 14 | R284: 14 | S284: 14 | T284: 15 | V284: 15
A285: Spirit of | B285: 16 | C285: 16.60 | D285: 16.20 | E285: 16.400 | F285: 16.60 | G285: 16.95 | H285: 16.774999999999999 | I285: 33.174999999999997 | J285: 16.40 | K285: 15.90 | L285: 16.80 | M285: 24.550 | N285: 16.80 | O285: 16.80 | P285: 16.80 | Q285: 16.800 | R285: 16.30 | S285: 24.950 | T285: 82.674999999999997 | U285: 0.0 | V285: 82.674999999999997
A286: Atlanta | C286: 16 | D286: 16 | E286: 16 | F286: 17 | G286: 16 | H286: 16 | I286: 16 | J286: 16 | K286: 18 | L286: 16 | M286: 16 | N286: 14 | O286: 16 | P286: 15 | Q286: 15 | R286: 20 | S286: 16 | T286: 16 | V286: 16
A287: Academy | B287: 15 | C287: 16.35 | D287: 16.10 | E287: 16.225000000000001 | F287: 16.10 | G287: 16.75 | H287: 16.425000000000001 | I287: 32.650 | J287: 16.25 | K287: 15.60 | L287: 16.70 | M287: 24.274999999999999 | N287: 16.35 | O287: 16.60 | P287: 16.30 | Q287: 16.450 | R287: 16.90 | S287: 24.850 | T287: 81.775000000000006 | U287: 0.0 | V287: 81.775000000000006
C288: 18 | D288: 17 | E288: 17 | F288: 20 | G288: 17 | H288: 20 | I288: 18 | J288: 17 | K288: 19 | L288: 17 | M288: 18 | N288: 18 | O288: 17 | P288: 18 | Q288: 18 | R288: 16 | S288: 17 | T288: 17 | V288: 17
A289: Music | B289: 14 | C289: 16.50 | D289: 15.90 | E289: 16.200 | F289: 16.70 | G289: 16.50 | H289: 16.600 | I289: 32.800 | J289: 15.90 | K289: 15.50 | L289: 16.60 | M289: 24.000 | N289: 16.40 | O289: 16.40 | P289: 16.60 | Q289: 16.500 | R289: 16.60 | S289: 24.750 | T289: 81.550 | U289: 0.0 | V289: 81.550
A290: City | C290: 17 | D290: 18 | E290: 18 | F290: 16 | G290: 20 | H290: 17 | I290: 17 | J290: 19 | K290: 20 | L290: 18 | M290: 20 | N290: 17 | O290: 18 | P290: 17 | Q290: 17 | R290: 18 | S290: 18 | T290: 18 | V290: 18
A291: Spartans | B291: 10 | C291: 16.10 | D291: 15.60 | E291: 15.850 | F291: 16.55 | G291: 16.60 | H291: 16.574999999999999 | I291: 32.424999999999997 | J291: 16.10 | K291: 16.30 | L291: 16.50 | M291: 24.450 | N291: 16.10 | O291: 16.15 | P291: 15.90 | Q291: 16.024999999999999 | R291: 16.20 | S291: 24.163 | T291: 81.037999999999997 | U291: 0.0 | V291: 81.037999999999997
C292: 20 | D292: 19 | E292: 19 | F292: 18 | G292: 19 | H292: 18 | I292: 19 | J292: 18 | K292: 16 | L292: 19 | M292: 17 | N292: 19 | O292: 19 | P292: 20 | Q292: 20 | R292: 21 | S292: 20 | T292: 19 | V292: 19
A293: Blue | B293: 9 | C293: 15.90 | D293: 15.50 | E293: 15.700 | F293: 16.20 | G293: 16.70 | H293: 16.450 | I293: 32.150 | J293: 15.70 | K293: 16.20 | L293: 16.20 | M293: 24.050 | N293: 15.95 | O293: 16.10 | P293: 16.20 | Q293: 16.150 | R293: 16.70 | S293: 24.400 | T293: 80.600 | U293: 0.0 | V293: 80.600
A294: Devils B | C294: 22 | D294: 20 | E294: 20 | F294: 19 | G294: 18 | H294: 19 | I294: 20 | J294: 20 | K294: 17 | L294: 21 | M294: 19 | N294: 20 | O294: 20 | P294: 19 | Q294: 19 | R294: 17 | S294: 19 | T294: 20 | V294: 20
A295: Genesis | B295: 13 | C295: 16.25 | D295: 15.10 | E295: 15.675000000000001 | F295: 15.70 | G295: 15.95 | H295: 15.824999999999999 | I295: 31.500 | J295: 15.40 | K295: 15.00 | L295: 16.40 | M295: 23.400 | N295: 15.80 | O295: 15.90 | P295: 15.20 | Q295: 15.550 | R295: 15.60 | S295: 23.475000000000001 | T295: 78.375 | U295: 0.0 | V295: 78.375
C296: 19 | D296: 22 | E296: 22 | F296: 22 | G296: 22 | H296: 22 | I296: 21 | J296: 22 | K296: 22 | L296: 20 | M296: 21 | N296: 21 | O296: 21 | P296: 23 | Q296: 22 | R296: 24 | S296: 22 | T296: 21 | V296: 21
A297: Gold | B297: 8 | C297: 15.40 | D297: 14.50 | E297: 14.950 | F297: 15.80 | G297: 16.10 | H297: 15.950 | I297: 30.900 | J297: 15.55 | K297: 15.10 | L297: 15.40 | M297: 23.024999999999999 | N297: 15.30 | O297: 15.70 | P297: 15.30 | Q297: 15.500 | R297: 16.40 | S297: 23.600 | T297: 77.525000000000006 | U297: 0.0 | V297: 77.525000000000006
C298: 24 | D298: 26 | E298: 25 | F298: 21 | G298: 21 | H298: 21 | I298: 23 | J298: 21 | K298: 21 | L298: 24 | M298: 22 | N298: 22 | O298: 22 | P298: 22 | Q298: 23 | R298: 19 | S298: 21 | T298: 22 | V298: 22
A299: Seattle | B299: 12 | C299: 16.00 | D299: 15.40 | E299: 15.700 | F299: 15.25 | G299: 15.60 | H299: 15.425000000000001 | I299: 31.125 | J299: 15.15 | K299: 14.70 | L299: 15.70 | M299: 22.774999999999999 | N299: 15.15 | O299: 15.50 | P299: 15.70 | Q299: 15.600 | R299: 15.90 | S299: 23.324999999999999 | T299: 77.224999999999994 | U299: 0.0 | V299: 77.224999999999994
A300: Cascades | C300: 21 | D300: 21 | E300: 20 | F300: 25 | G300: 25 | H300: 25 | I300: 22 | J300: 23 | K300: 23 | L300: 23 | M300: 23 | N300: 24 | O300: 23 | P300: 21 | Q300: 21 | R300: 22 | S300: 23 | T300: 23 | V300: 23
A301: Jersey | B301: 11 | C301: 15.70 | D301: 15.00 | E301: 15.350 | F301: 15.00 | G301: 15.55 | H301: 15.275 | I301: 30.625 | J301: 14.80 | K301: 14.20 | L301: 15.80 | M301: 22.400 | N301: 15.05 | O301: 15.35 | P301: 15.10 | Q301: 15.225 | R301: 15.30 | S301: 22.788 | T301: 75.813000000000002 | U301: 0.0 | V301: 75.813000000000002
A302: Surf | C302: 23 | D302: 23 | E302: 23 | F302: 26 | G302: 26 | H302: 26 | I302: 24 | J302: 25 | K302: 26 | L302: 22 | M302: 24 | N302: 25 | O302: 24 | P302: 24 | Q302: 24 | R302: 26 | S302: 25 | T302: 24 | V302: 24
A303: Battalion | B303: 7 | C303: 15.00 | D303: 14.30 | E303: 14.650 | F303: 15.40 | G303: 15.90 | H303: 15.650 | I303: 30.300 | J303: 14.90 | K303: 14.50 | L303: 14.90 | M303: 22.150 | N303: 15.20 | O303: 15.30 | P303: 14.50 | Q303: 14.900 | R303: 15.70 | S303: 22.900 | T303: 75.350 | U303: 0.0 | V303: 75.350
C304: 27 | D304: 27 | E304: 27 | F304: 24 | G304: 23 | H304: 23 | I304: 26 | J304: 24 | K304: 25 | L304: 27 | M304: 26 | N304: 23 | O304: 25 | P304: 26 | Q304: 25 | R304: 23 | S304: 24 | T304: 25 | V304: 25
A305: Columbians | B305: 6 | C305: 15.20 | D305: 14.70 | E305: 14.950 | F305: 15.60 | G305: 15.70 | H305: 15.650 | I305: 30.600 | J305: 14.70 | K305: 14.60 | L305: 15.10 | M305: 22.200 | N305: 14.80 | O305: 15.00 | P305: 14.80 | Q305: 14.900 | R305: 15.10 | S305: 22.400 | T305: 75.200 | U305: 0.0 | V305: 75.200
C306: 26 | D306: 25 | E306: 25 | F306: 23 | G306: 24 | H306: 23 | I306: 25 | J306: 26 | K306: 24 | L306: 25 | M306: 25 | N306: 26 | O306: 26 | P306: 25 | Q306: 25 | R306: 27 | S306: 26 | T306: 26 | V306: 26
A307: River City | B307: 5 | C307: 15.30 | D307: 14.80 | E307: 15.050 | F307: 14.90 | G307: 15.10 | H307: 15.000 | I307: 30.050 | J307: 14.30 | K307: 14.10 | L307: 15.00 | M307: 21.700 | N307: 14.60 | O307: 14.70 | P307: 14.40 | Q307: 14.550 | R307: 15.50 | S307: 22.324999999999999 | T307: 74.075000000000003 | U307: 0.0 | V307: 74.075000000000003
A308: Rhythm | C308: 25 | D308: 24 | E308: 24 | F308: 27 | G308: 27 | H308: 27 | I308: 27 | J308: 28 | K308: 27 | L308: 26 | M308: 27 | N308: 27 | O308: 27 | P308: 27 | Q308: 27 | R308: 25 | S308: 27 | T308: 27 | V308: 27
A309: Raiders | B309: 4 | C309: 14.20 | D309: 14.00 | E309: 14.100 | F309: 14.30 | G309: 14.70 | H309: 14.500 | I309: 28.600 | J309: 14.00 | K309: 13.70 | L309: 14.40 | M309: 21.050 | N309: 14.40 | O309: 14.30 | P309: 14.10 | Q309: 14.200 | R309: 14.70 | S309: 21.650 | T309: 71.300 | U309: 0.0 | V309: 71.300
C310: 28 | D310: 28 | E310: 28 | F310: 28 | G310: 28 | H310: 28 | I310: 28 | J310: 29 | K310: 28 | L310: 29 | M310: 29 | N310: 28 | O310: 28 | P310: 28 | Q310: 28 | R310: 29 | S310: 28 | T310: 28 | V310: 28
A311: Colt | B311: 3 | C311: 13.90 | D311: 13.50 | E311: 13.700 | F311: 14.00 | G311: 14.40 | H311: 14.200 | I311: 27.900 | J311: 14.40 | K311: 13.60 | L311: 14.60 | M311: 21.300 | N311: 14.00 | O311: 13.80 | P311: 13.80 | Q311: 13.800 | R311: 14.80 | S311: 21.300 | T311: 70.500 | U311: 0.0 | V311: 70.500
A312: Cadets | C312: 29 | D312: 29 | E312: 29 | F312: 29 | G312: 29 | H312: 29 | I312: 29 | J312: 27 | K312: 29 | L312: 28 | M312: 28 | N312: 29 | O312: 29 | P312: 29 | Q312: 29 | R312: 28 | S312: 29 | T312: 29 | V312: 29
A313: 7th | B313: 2 | C313: 13.70 | D313: 13.30 | E313: 13.500 | F313: 13.60 | G313: 14.30 | H313: 13.950 | I313: 27.450 | J313: 13.50 | K313: 13.50 | L313: 14.20 | M313: 20.600 | N313: 13.60 | O313: 13.60 | P313: 13.40 | Q313: 13.500 | R313: 14.40 | S313: 20.750 | T313: 68.800 | U313: 0.0 | V313: 68.800
A314: Regiment | C314: 30 | D314: 31 | E314: 30 | F314: 30 | G314: 30 | H314: 30 | I314: 30 | J314: 30 | K314: 30 | L314: 30 | M314: 30 | N314: 30 | O314: 30 | P314: 30 | Q314: 30 | R314: 30 | S314: 30 | T314: 30 | V314: 30
A315: Les | B315: 1 | C315: 13.20 | D315: 13.40 | E315: 13.300 | F315: 12.90 | G315: 13.90 | H315: 13.400 | I315: 26.700 | J315: 13.40 | K315: 13.10 | L315: 13.50 | M315: 20.000 | N315: 12.80 | O315: 12.80 | P315: 12.70 | Q315: 12.750 | R315: 13.20 | S315: 19.375 | T315: 66.075000000000003 | U315: 0.0 | V315: 66.075000000000003
A316: Stentors | C316: 31 | D316: 30 | E316: 31 | F316: 31 | G316: 31 | H316: 31 | I316: 31 | J316: 31 | K316: 31 | L316: 31 | M316: 31 | N316: 31 | O316: 31 | P316: 31 | Q316: 31 | R316: 31 | S316: 31 | T316: 31 | V316: 31
A319: 8/9/2024 Indianapolis, Indiana--DCI World Class Championship Semi-Finals
C320: General Effect | J320: Visual | N320: Music
C321: 1 | D321: 1 | F321: 2 | G321: 2 | J321: Proficiency | K321: Analysis | L321: Color Guard | N321: Brass | O321: Analysis 1 | P321: Analysis 2 | Q321: Analysis | R321: Percussion | T321: Sub | V321: Total
C322: G. Llacer | D322: D. Deems | E322: Average | F322: G. Miller | G322: C. Rothe | H322: Average | I322: Total | J322: M. Turner | K322: J. Sturgeon | L322: W. Rickart | M322: Total ÷2 | N322: S. Page | O322: M. Griffin | P322: J. Harper | Q322: Average | R322: M. Teal | S322: Total ÷2 | T322: Total | U322: Pen | V322: Score
A323: DCI World Class | C323: 20 | D323: 20 | E323: 20 | F323: 20 | G323: 20 | H323: 20 | I323: 40 | J323: 20 | K323: 20 | L323: 20 | M323: 30 | N323: 20 | O323: 20 | P323: 20 | Q323: 20 | R323: 20 | S323: 30 | T323: 100 | V323: 100
A324: Bluecoats | B324: 25 | C324: 19.60 | D324: 19.75 | E324: 19.675000000000001 | F324: 19.70 | G324: 19.80 | H324: 19.750 | I324: 39.424999999999997 | J324: 19.25 | K324: 19.70 | L324: 19.50 | M324: 29.225000000000001 | N324: 19.50 | O324: 19.70 | P324: 19.50 | Q324: 19.600 | R324: 19.45 | S324: 29.274999999999999 | T324: 97.924999999999997 | U324: 0.0 | V324: 97.924999999999997
C325: 1 | D325: 1 | E325: 1 | F325: 1 | G325: 1 | H325: 1 | I325: 1 | J325: 2 | K325: 1 | L325: 2 | M325: 1 | N325: 1 | O325: 1 | P325: 1 | Q325: 1 | R325: 4 | S325: 1 | T325: 1 | V325: 1
A326: Boston | B326: 24 | C326: 19.30 | D326: 19.45 | E326: 19.375 | F326: 19.50 | G326: 19.60 | H326: 19.550 | I326: 38.924999999999997 | J326: 18.90 | K326: 19.20 | L326: 19.80 | M326: 28.950 | N326: 19.20 | O326: 19.50 | P326: 19.30 | Q326: 19.400 | R326: 19.65 | S326: 29.125 | T326: 97.000 | U326: 0.0 | V326: 97.000
A327: Crusaders | C327: 2 | D327: 2 | E327: 2 | F327: 2 | G327: 2 | H327: 2 | I327: 2 | J327: 4 | K327: 3 | L327: 1 | M327: 3 | N327: 4 | O327: 2 | P327: 2 | Q327: 2 | R327: 2 | S327: 2 | T327: 2 | V327: 2
A328: Blue | B328: 23 | C328: 19.00 | D328: 19.35 | E328: 19.175000000000001 | F328: 19.05 | G328: 19.35 | H328: 19.200 | I328: 38.375 | J328: 19.40 | K328: 19.40 | L328: 19.40 | M328: 29.100 | N328: 19.45 | O328: 19.20 | P328: 19.20 | Q328: 19.200 | R328: 19.50 | S328: 29.074999999999999 | T328: 96.550 | U328: 0.0 | V328: 96.550
A329: Devils | C329: 3 | D329: 3 | E329: 3 | F329: 4 | G329: 3 | H329: 4 | I329: 3 | J329: 1 | K329: 2 | L329: 3 | M329: 2 | N329: 2 | O329: 3 | P329: 3 | Q329: 3 | R329: 3 | S329: 3 | T329: 3 | V329: 3
A330: Phantom | B330: 21 | C330: 18.90 | D330: 19.30 | E330: 19.100 | F330: 19.20 | G330: 19.30 | H330: 19.250 | I330: 38.350 | J330: 19.10 | K330: 19.00 | L330: 18.60 | M330: 28.350 | N330: 19.00 | O330: 19.00 | P330: 18.90 | Q330: 18.950 | R330: 19.30 | S330: 28.625 | T330: 95.325000000000003 | U330: 0.0 | V330: 95.325000000000003
A331: Regiment | C331: 4 | D331: 4 | E331: 4 | F331: 3 | G331: 4 | H331: 3 | I331: 4 | J331: 3 | K331: 4 | L331: 7 | M331: 4 | N331: 5 | O331: 5 | P331: 5 | Q331: 5 | R331: 5 | S331: 5 | T331: 4 | V331: 4
A332: Carolina | B332: 22 | C332: 18.80 | D332: 19.10 | E332: 18.950 | F332: 18.90 | G332: 19.00 | H332: 18.950 | I332: 37.900 | J332: 18.35 | K332: 18.80 | L332: 19.00 | M332: 28.074999999999999 | N332: 19.30 | O332: 19.10 | P332: 19.00 | Q332: 19.050 | R332: 19.20 | S332: 28.774999999999999 | T332: 94.750 | U332: 0.0 | V332: 94.750
A333: Crown | C333: 5 | D333: 5 | E333: 5 | F333: 5 | G333: 5 | H333: 5 | I333: 5 | J333: 6 | K333: 5 | L333: 4 | M333: 5 | N333: 3 | O333: 4 | P333: 4 | Q333: 4 | R333: 6 | S333: 4 | T333: 5 | V333: 5
A334: Vanguard | B334: 20 | C334: 18.40 | D334: 18.80 | E334: 18.600 | F334: 18.25 | G334: 18.80 | H334: 18.524999999999999 | I334: 37.125 | J334: 18.10 | K334: 18.70 | L334: 18.70 | M334: 27.750 | N334: 18.70 | O334: 18.65 | P334: 18.80 | Q334: 18.725000000000001 | R334: 19.75 | S334: 28.588000000000001 | T334: 93.462999999999994 | U334: 0.0 | V334: 93.462999999999994
C335: 6 | D335: 6 | E335: 6 | F335: 8 | G335: 6 | H335: 7 | I335: 6 | J335: 7 | K335: 6 | L335: 6 | M335: 6 | N335: 6 | O335: 7 | P335: 6 | Q335: 6 | R335: 1 | S335: 6 | T335: 6 | V335: 6
A336: Mandarins | B336: 19 | C336: 18.30 | D336: 18.65 | E336: 18.475000000000001 | F336: 18.70 | G336: 18.60 | H336: 18.650 | I336: 37.125 | J336: 18.40 | K336: 18.40 | L336: 18.40 | M336: 27.600 | N336: 18.50 | O336: 18.70 | P336: 18.40 | Q336: 18.550 | R336: 18.55 | S336: 27.800 | T336: 92.525000000000006 | U336: 0.0 | V336: 92.525000000000006
C337: 7 | D337: 7 | E337: 7 | F337: 6 | G337: 7 | H337: 6 | I337: 6 | J337: 5 | K337: 7 | L337: 8 | M337: 7 | N337: 7 | O337: 6 | P337: 7 | Q337: 7 | R337: 9 | S337: 7 | T337: 7 | V337: 7
A338: Blue | B338: 18 | C338: 18.20 | D338: 18.40 | E338: 18.300 | F338: 18.40 | G338: 18.40 | H338: 18.400 | I338: 36.700 | J338: 17.95 | K338: 18.05 | L338: 18.80 | M338: 27.400 | N338: 18.30 | O338: 18.30 | P338: 18.10 | Q338: 18.200 | R338: 18.30 | S338: 27.400 | T338: 91.500 | U338: 0.0 | V338: 91.500
A339: Stars | C339: 8 | D339: 8 | E339: 8 | F339: 7 | G339: 8 | H339: 8 | I339: 8 | J339: 8 | K339: 8 | L339: 5 | M339: 8 | N339: 8 | O339: 8 | P339: 8 | Q339: 8 | R339: 11 | S339: 8 | T339: 8 | V339: 8
A340: Colts | B340: 17 | C340: 17.80 | D340: 18.05 | E340: 17.925000000000001 | F340: 17.90 | G340: 18.25 | H340: 18.074999999999999 | I340: 36.000 | J340: 17.70 | K340: 18.00 | L340: 18.00 | M340: 26.850 | N340: 18.10 | O340: 18.20 | P340: 17.90 | Q340: 18.050 | R340: 18.50 | S340: 27.324999999999999 | T340: 90.174999999999997 | U340: 0.0 | V340: 90.174999999999997
C341: 9 | D341: 9 | E341: 9 | F341: 9 | G341: 9 | H341: 9 | I341: 9 | J341: 9 | K341: 9 | L341: 9 | M341: 9 | N341: 9 | O341: 9 | P341: 9 | Q341: 9 | R341: 10 | S341: 10 | T341: 9 | V341: 9
A342: Troopers | B342: 15 | C342: 17.50 | D342: 17.90 | E342: 17.700 | F342: 17.65 | G342: 18.10 | H342: 17.875 | I342: 35.575000000000003 | J342: 17.20 | K342: 17.45 | L342: 17.00 | M342: 25.824999999999999 | N342: 18.00 | O342: 17.70 | P342: 17.70 | Q342: 17.700 | R342: 19.10 | S342: 27.400 | T342: 88.800 | U342: 0.0 | V342: 88.800
C343: 11 | D343: 10 | E343: 10 | F343: 10 | G343: 10 | H343: 10 | I343: 10 | J343: 11 | K343: 12 | L343: 15 | M343: 12 | N343: 10 | O343: 11 | P343: 10 | Q343: 11 | R343: 7 | S343: 8 | T343: 10 | V343: 10
A344: Cavaliers | B344: 16 | C344: 17.30 | D344: 17.50 | E344: 17.400 | F344: 17.55 | G344: 17.85 | H344: 17.700 | I344: 35.100 | J344: 17.10 | K344: 17.60 | L344: 17.60 | M344: 26.150 | N344: 17.90 | O344: 18.10 | P344: 17.60 | Q344: 17.850 | R344: 18.80 | S344: 27.274999999999999 | T344: 88.525000000000006 | U344: 0.0 | V344: 88.525000000000006
C345: 12 | D345: 12 | E345: 12 | F345: 12 | G345: 11 | H345: 11 | I345: 12 | J345: 12 | K345: 11 | L345: 12 | M345: 11 | N345: 11 | O345: 10 | P345: 11 | Q345: 10 | R345: 8 | S345: 11 | T345: 11 | V345: 11
A346: Madison | B346: 14 | C346: 17.60 | D346: 17.60 | E346: 17.600 | F346: 17.60 | G346: 17.80 | H346: 17.700 | I346: 35.300 | J346: 17.50 | K346: 17.70 | L346: 17.70 | M346: 26.450 | N346: 17.50 | O346: 17.60 | P346: 17.50 | Q346: 17.550 | R346: 17.60 | S346: 26.324999999999999 | T346: 88.075000000000003 | U346: 0.0 | V346: 88.075000000000003
A347: Scouts | C347: 10 | D347: 11 | E347: 11 | F347: 11 | G347: 12 | H347: 11 | I347: 11 | J347: 10 | K347: 10 | L347: 11 | M347: 10 | N347: 12 | O347: 12 | P347: 12 | Q347: 12 | R347: 13 | S347: 12 | T347: 12 | V347: 12
A348: Pacific | B348: 13 | C348: 17.10 | D348: 17.40 | E348: 17.250 | F348: 17.30 | G348: 17.60 | H348: 17.450 | I348: 34.700 | J348: 16.40 | K348: 17.25 | L348: 17.90 | M348: 25.774999999999999 | N348: 17.10 | O348: 17.50 | P348: 16.90 | Q348: 17.200 | R348: 17.45 | S348: 25.875 | T348: 86.350 | U348: 0.0 | V348: 86.350
A349: Crest | C349: 14 | D349: 13 | E349: 13 | F349: 13 | G349: 13 | H349: 13 | I349: 13 | J349: 16 | K349: 13 | L349: 10 | M349: 13 | N349: 14 | O349: 13 | P349: 14 | Q349: 13 | R349: 15 | S349: 13 | T349: 13 | V349: 13
A350: Blue | B350: 12 | C350: 17.20 | D350: 17.05 | E350: 17.125 | F350: 16.95 | G350: 17.20 | H350: 17.074999999999999 | I350: 34.200 | J350: 16.80 | K350: 17.10 | L350: 17.30 | M350: 25.600 | N350: 16.90 | O350: 17.20 | P350: 17.10 | Q350: 17.150 | R350: 17.55 | S350: 25.800 | T350: 85.600 | U350: 0.0 | V350: 85.600
A351: Knights | C351: 13 | D351: 14 | E351: 14 | F351: 15 | G351: 15 | H351: 15 | I351: 14 | J351: 14 | K351: 15 | L351: 13 | M351: 14 | N351: 15 | O351: 14 | P351: 13 | Q351: 14 | R351: 14 | S351: 14 | T351: 14 | V351: 14
A352: Crossmen | B352: 11 | C352: 16.90 | D352: 16.95 | E352: 16.925000000000001 | F352: 17.00 | G352: 17.30 | H352: 17.150 | I352: 34.075000000000003 | J352: 16.30 | K352: 17.20 | L352: 17.10 | M352: 25.300 | N352: 17.30 | O352: 16.70 | P352: 16.70 | Q352: 16.700 | R352: 17.00 | S352: 25.500 | T352: 84.875 | U352: 0.0 | V352: 84.875
C353: 15 | D353: 15 | E353: 15 | F353: 14 | G353: 14 | H353: 14 | I353: 15 | J353: 17 | K353: 14 | L353: 14 | M353: 15 | N353: 13 | O353: 16 | P353: 16 | Q353: 16 | R353: 18 | S353: 16 | T353: 15 | V353: 15
A354: Spirit of | B354: 10 | C354: 16.80 | D354: 16.90 | E354: 16.850 | F354: 16.70 | G354: 16.90 | H354: 16.800 | I354: 33.650 | J354: 15.70 | K354: 16.65 | L354: 16.90 | M354: 24.625 | N354: 16.50 | O354: 17.00 | P354: 16.80 | Q354: 16.900 | R354: 17.80 | S354: 25.600 | T354: 83.875 | U354: 0.0 | V354: 83.875
A355: Atlanta | C355: 16 | D355: 16 | E355: 16 | F355: 16 | G355: 16 | H355: 16 | I355: 16 | J355: 19 | K355: 17 | L355: 16 | M355: 17 | N355: 17 | O355: 15 | P355: 15 | Q355: 15 | R355: 12 | S355: 15 | T355: 16 | V355: 16
A356: Music | B356: 8 | C356: 16.70 | D356: 16.70 | E356: 16.700 | F356: 16.55 | G356: 16.70 | H356: 16.625 | I356: 33.325000000000003 | J356: 15.50 | K356: 16.45 | L356: 16.30 | M356: 24.125 | N356: 16.60 | O356: 16.50 | P356: 16.40 | Q356: 16.450 | R356: 17.30 | S356: 25.175000000000001 | T356: 82.625 | U356: 0.0 | V356: 82.625
A357: City | C357: 17 | D357: 17 | E357: 17 | F357: 17 | G357: 17 | H357: 17 | I357: 17 | J357: 20 | K357: 19 | L357: 19 | M357: 20 | N357: 16 | O357: 18 | P357: 18 | Q357: 18 | R357: 16 | S357: 17 | T357: 17 | V357: 17
A358: Academy | B358: 9 | C358: 16.00 | D358: 16.20 | E358: 16.100 | F358: 16.50 | G358: 16.45 | H358: 16.475000000000001 | I358: 32.575000000000003 | J358: 16.50 | K358: 16.10 | L358: 16.50 | M358: 24.550 | N358: 16.40 | O358: 16.60 | P358: 16.60 | Q358: 16.600 | R358: 17.10 | S358: 25.050 | T358: 82.174999999999997 | U358: 0.0 | V358: 82.174999999999997
C359: 20 | D359: 19 | E359: 19 | F359: 18 | G359: 19 | H359: 18 | I359: 18 | J359: 15 | K359: 20 | L359: 17 | M359: 18 | N359: 18 | O359: 17 | P359: 17 | Q359: 17 | R359: 17 | S359: 18 | T359: 18 | V359: 18
A360: Spartans | B360: 7 | C360: 16.40 | D360: 16.30 | E360: 16.350 | F360: 15.75 | G360: 16.50 | H360: 16.125 | I360: 32.475000000000001 | J360: 17.00 | K360: 16.70 | L360: 16.20 | M360: 24.950 | N360: 15.30 | O360: 16.00 | P360: 16.00 | Q360: 16.000 | R360: 16.90 | S360: 24.100 | T360: 81.525000000000006 | U360: 0.0 | V360: 81.525000000000006
C361: 18 | D361: 18 | E361: 18 | F361: 21 | G361: 18 | H361: 20 | I361: 19 | J361: 13 | K361: 16 | L361: 20 | M361: 16 | N361: 21 | O361: 20 | P361: 20 | Q361: 20 | R361: 19 | S361: 20 | T361: 19 | V361: 19
A362: Blue | B362: 6 | C362: 16.10 | D362: 16.00 | E362: 16.050 | F362: 16.30 | G362: 16.10 | H362: 16.200 | I362: 32.250 | J362: 15.90 | K362: 16.60 | L362: 16.40 | M362: 24.450 | N362: 15.90 | O362: 16.10 | P362: 16.20 | Q362: 16.150 | R362: 16.70 | S362: 24.375 | T362: 81.075000000000003 | U362: 0.0 | V362: 81.075000000000003
A363: Devils B | C363: 19 | D363: 20 | E363: 20 | F363: 19 | G363: 20 | H363: 19 | I363: 20 | J363: 18 | K363: 18 | L363: 18 | M363: 19 | N363: 19 | O363: 19 | P363: 19 | Q363: 19 | R363: 20 | S363: 19 | T363: 20 | V363: 20
A364: Gold | B364: 4 | C364: 14.70 | D364: 15.60 | E364: 15.150 | F364: 16.00 | G364: 15.70 | H364: 15.850 | I364: 31.000 | J364: 15.35 | K364: 15.40 | L364: 15.80 | M364: 23.274999999999999 | N364: 15.10 | O364: 15.40 | P364: 15.90 | Q364: 15.650 | R364: 16.30 | S364: 23.524999999999999 | T364: 77.800 | U364: 0.0 | V364: 77.800
C365: 24 | D365: 22 | E365: 22 | F365: 20 | G365: 21 | H365: 21 | I365: 22 | J365: 21 | K365: 23 | L365: 21 | M365: 21 | N365: 22 | O365: 22 | P365: 21 | Q365: 22 | R365: 21 | S365: 21 | T365: 21 | V365: 21
A366: Genesis | B366: 5 | C366: 15.50 | D366: 15.70 | E366: 15.600 | F366: 15.50 | G366: 15.60 | H366: 15.550 | I366: 31.150 | J366: 14.90 | K366: 15.70 | L366: 15.50 | M366: 23.050 | N366: 15.60 | O366: 15.60 | P366: 15.80 | Q366: 15.700 | R366: 15.40 | S366: 23.350 | T366: 77.550 | U366: 0.0 | V366: 77.550
C367: 21 | D367: 21 | E367: 21 | F367: 23 | G367: 22 | H367: 22 | I367: 21 | J367: 23 | K367: 21 | L367: 22 | M367: 22 | N367: 20 | O367: 21 | P367: 22 | Q367: 21 | R367: 22 | S367: 22 | T367: 22 | V367: 22
A368: Seattle | B368: 3 | C368: 15.20 | D368: 15.00 | E368: 15.100 | F368: 15.70 | G368: 15.30 | H368: 15.500 | I368: 30.600 | J368: 15.20 | K368: 15.50 | L368: 15.20 | M368: 22.950 | N368: 14.80 | O368: 15.00 | P368: 15.30 | Q368: 15.150 | R368: 15.10 | S368: 22.524999999999999 | T368: 76.075000000000003 | U368: 0.0 | V368: 76.075000000000003
A369: Cascades | C369: 22 | D369: 24 | E369: 23 | F369: 22 | G369: 23 | H369: 23 | I369: 23 | J369: 22 | K369: 22 | L369: 23 | M369: 23 | N369: 23 | O369: 23 | P369: 25 | Q369: 24 | R369: 23 | S369: 23 | T369: 23 | V369: 23
A370: Jersey | B370: 2 | C370: 14.90 | D370: 14.80 | E370: 14.850 | F370: 15.20 | G370: 14.90 | H370: 15.050 | I370: 29.900 | J370: 14.80 | K370: 14.90 | L370: 15.10 | M370: 22.400 | N370: 14.70 | O370: 14.50 | P370: 15.40 | Q370: 14.950 | R370: 14.60 | S370: 22.125 | T370: 74.424999999999997 | U370: 0.0 | V370: 74.424999999999997
A371: Surf | C371: 23 | D371: 25 | E371: 24 | F371: 24 | G371: 25 | H371: 25 | I371: 24 | J371: 24 | K371: 24 | L371: 24 | M371: 24 | N371: 24 | O371: 25 | P371: 24 | Q371: 25 | R371: 25 | S371: 25 | T371: 24 | V371: 24
A372: Battalion | B372: 1 | C372: 14.50 | D372: 15.10 | E372: 14.800 | F372: 15.00 | G372: 15.20 | H372: 15.100 | I372: 29.900 | J372: 14.70 | K372: 14.70 | L372: 14.90 | M372: 22.150 | N372: 14.60 | O372: 14.90 | P372: 15.60 | Q372: 15.250 | R372: 14.90 | S372: 22.375 | T372: 74.424999999999997 | U372: 0.0 | V372: 74.424999999999997
C373: 25 | D373: 23 | E373: 25 | F373: 25 | G373: 24 | H373: 24 | I373: 24 | J373: 25 | K373: 25 | L373: 25 | M373: 25 | N373: 25 | O373: 24 | P373: 23 | Q373: 23 | R373: 24 | S373: 24 | T373: 24 | V373: 24
A376: 8/10/2024 Indianapolis, Indiana--DCI World Class Championship Finals
C377: General Effect | J377: Visual | N377: Music
C378: 1 | D378: 1 | F378: 2 | G378: 2 | J378: Proficiency | K378: Analysis | L378: Color Guard | N378: Brass | O378: Analysis 1 | P378: Analysis 2 | Q378: Analysis | R378: Percussion | T378: Sub | V378: Total
C379: D. Padilla | D379: W. Chumley | E379: Average | F379: J. Rhodes | G379: W. Dillon | H379: Average | I379: Total | J379: C. Moss | K379: T. Wingate | L379: R. Solomon | M379: Total ÷2 | N379: B. Crisp | O379: D. Carbone | P379: D. Davis | Q379: Average | R379: M. Leitzke | S379: Total ÷2 | T379: Total | U379: Pen | V379: Score
A380: DCI World Class | C380: 20 | D380: 20 | E380: 20 | F380: 20 | G380: 20 | H380: 20 | I380: 40 | J380: 20 | K380: 20 | L380: 20 | M380: 30 | N380: 20 | O380: 20 | P380: 20 | Q380: 20 | R380: 20 | S380: 30 | T380: 100 | V380: 100
A381: Bluecoats | B381: 12 | C381: 19.80 | D381: 20.00 | E381: 19.900 | F381: 19.80 | G381: 19.70 | H381: 19.750 | I381: 39.650 | J381: 19.80 | K381: 20.00 | L381: 19.50 | M381: 29.650 | N381: 19.60 | O381: 19.90 | P381: 19.80 | Q381: 19.850 | R381: 19.45 | S381: 29.450 | T381: 98.750 | U381: 0.0 | V381: 98.750
C382: 1 | D382: 1 | E382: 1 | F382: 1 | G382: 1 | H382: 1 | I382: 1 | J382: 1 | K382: 1 | L382: 2 | M382: 1 | N382: 1 | O382: 1 | P382: 1 | Q382: 1 | R382: 2 | S382: 1 | T382: 1 | V382: 1
A383: Boston | B383: 11 | C383: 19.40 | D383: 19.70 | E383: 19.550 | F383: 19.45 | G383: 19.50 | H383: 19.475000000000001 | I383: 39.024999999999999 | J383: 19.40 | K383: 19.60 | L383: 19.80 | M383: 29.400 | N383: 19.15 | O383: 19.60 | P383: 19.35 | Q383: 19.475000000000001 | R383: 19.35 | S383: 28.988 | T383: 97.412999999999997 | U383: 0.0 | V383: 97.412999999999997
A384: Crusaders | C384: 3 | D384: 2 | E384: 2 | F384: 2 | G384: 2 | H384: 2 | I384: 2 | J384: 3 | K384: 2 | L384: 1 | M384: 2 | N384: 4 | O384: 2 | P384: 3 | Q384: 2 | R384: 3 | S384: 2 | T384: 2 | V384: 2
A385: Blue | B385: 10 | C385: 19.50 | D385: 19.60 | E385: 19.550 | F385: 19.40 | G385: 19.20 | H385: 19.300 | I385: 38.850 | J385: 19.60 | K385: 19.50 | L385: 19.45 | M385: 29.274999999999999 | N385: 19.40 | O385: 19.40 | P385: 19.30 | Q385: 19.350 | R385: 19.15 | S385: 28.950 | T385: 97.075000000000003 | U385: 0.0 | V385: 97.075000000000003
A386: Devils | C386: 2 | D386: 3 | E386: 2 | F386: 3 | G386: 4 | H386: 3 | I386: 3 | J386: 2 | K386: 3 | L386: 3 | M386: 3 | N386: 3 | O386: 3 | P386: 4 | Q386: 3 | R386: 4 | S386: 3 | T386: 3 | V386: 3
A387: Phantom | B387: 9 | C387: 19.30 | D387: 19.30 | E387: 19.300 | F387: 18.90 | G387: 19.40 | H387: 19.150 | I387: 38.450 | J387: 18.80 | K387: 19.00 | L387: 18.90 | M387: 28.350 | N387: 18.90 | O387: 19.00 | P387: 18.90 | Q387: 18.950 | R387: 19.00 | S387: 28.425000000000001 | T387: 95.224999999999994 | U387: 0.0 | V387: 95.224999999999994
A388: Regiment | C388: 4 | D388: 4 | E388: 4 | F388: 5 | G388: 3 | H388: 4 | I388: 4 | J388: 5 | K388: 4 | L388: 5 | M388: 5 | N388: 5 | O388: 5 | P388: 5 | Q388: 5 | R388: 5 | S388: 5 | T388: 4 | V388: 4
A389: Carolina | B389: 8 | C389: 18.90 | D389: 18.90 | E389: 18.900 | F389: 18.95 | G389: 19.15 | H389: 19.050 | I389: 37.950 | J389: 19.00 | K389: 18.80 | L389: 19.20 | M389: 28.500 | N389: 19.45 | O389: 19.10 | P389: 19.40 | Q389: 19.250 | R389: 18.45 | S389: 28.574999999999999 | T389: 95.025000000000006 | U389: 0.0 | V389: 95.025000000000006
A390: Crown | C390: 5 | D390: 5 | E390: 5 | F390: 4 | G390: 5 | H390: 5 | I390: 5 | J390: 4 | K390: 5 | L390: 4 | M390: 4 | N390: 2 | O390: 4 | P390: 2 | Q390: 4 | R390: 6 | S390: 4 | T390: 5 | V390: 5
A391: Vanguard | B391: 7 | C391: 18.70 | D391: 18.80 | E391: 18.750 | F391: 18.75 | G391: 18.95 | H391: 18.850 | I391: 37.600 | J391: 18.40 | K391: 18.70 | L391: 18.70 | M391: 27.900 | N391: 18.70 | O391: 18.70 | P391: 18.60 | Q391: 18.650 | R391: 19.50 | S391: 28.425000000000001 | T391: 93.924999999999997 | U391: 0.0 | V391: 93.924999999999997
C392: 7 | D392: 6 | E392: 6 | F392: 6 | G392: 6 | H392: 6 | I392: 6 | J392: 7 | K392: 6 | L392: 7 | M392: 6 | N392: 6 | O392: 6 | P392: 6 | Q392: 6 | R392: 1 | S392: 5 | T392: 6 | V392: 6
A393: Mandarins | B393: 6 | C393: 18.80 | D393: 18.60 | E393: 18.700 | F393: 18.60 | G393: 18.70 | H393: 18.650 | I393: 37.350 | J393: 18.50 | K393: 18.20 | L393: 18.30 | M393: 27.500 | N393: 18.30 | O393: 18.30 | P393: 18.30 | Q393: 18.300 | R393: 18.00 | S393: 27.300 | T393: 92.150 | U393: 0.0 | V393: 92.150
C394: 6 | D394: 7 | E394: 7 | F394: 7 | G394: 7 | H394: 7 | I394: 7 | J394: 6 | K394: 8 | L394: 8 | M394: 7 | N394: 8 | O394: 8 | P394: 7 | Q394: 8 | R394: 9 | S394: 7 | T394: 7 | V394: 7
A395: Blue | B395: 5 | C395: 18.40 | D395: 18.20 | E395: 18.300 | F395: 18.45 | G395: 18.60 | H395: 18.524999999999999 | I395: 36.825000000000003 | J395: 17.90 | K395: 18.30 | L395: 18.80 | M395: 27.500 | N395: 18.50 | O395: 18.50 | P395: 18.20 | Q395: 18.350 | R395: 17.70 | S395: 27.274999999999999 | T395: 91.600 | U395: 0.0 | V395: 91.600
A396: Stars | C396: 8 | D396: 8 | E396: 8 | F396: 8 | G396: 8 | H396: 8 | I396: 8 | J396: 8 | K396: 7 | L396: 6 | M396: 7 | N396: 7 | O396: 7 | P396: 8 | Q396: 7 | R396: 11 | S396: 8 | T396: 8 | V396: 8
A397: Colts | B397: 4 | C397: 18.00 | D397: 17.90 | E397: 17.950 | F397: 18.15 | G397: 18.20 | H397: 18.175000000000001 | I397: 36.125 | J397: 17.70 | K397: 17.90 | L397: 18.20 | M397: 26.900 | N397: 17.70 | O397: 18.10 | P397: 17.90 | Q397: 18.000 | R397: 17.80 | S397: 26.750 | T397: 89.775000000000006 | U397: 0.0 | V397: 89.775000000000006
C398: 9 | D398: 9 | E398: 9 | F398: 9 | G398: 9 | H398: 9 | I398: 9 | J398: 9 | K398: 9 | L398: 9 | M398: 9 | N398: 11 | O398: 9 | P398: 9 | Q398: 9 | R398: 10 | S398: 10 | T398: 9 | V398: 9
A399: Troopers | B399: 3 | C399: 17.90 | D399: 17.70 | E399: 17.800 | F399: 18.10 | G399: 17.90 | H399: 18.000 | I399: 35.800 | J399: 17.40 | K399: 17.50 | L399: 17.30 | M399: 26.100 | N399: 18.10 | O399: 17.90 | P399: 17.70 | Q399: 17.800 | R399: 18.20 | S399: 27.050 | T399: 88.950 | U399: 0.0 | V399: 88.950
C400: 10 | D400: 10 | E400: 10 | F400: 10 | G400: 10 | H400: 10 | I400: 10 | J400: 10 | K400: 10 | L400: 12 | M400: 10 | N400: 9 | O400: 10 | P400: 10 | Q400: 10 | R400: 8 | S400: 9 | T400: 10 | V400: 10
A401: Cavaliers | B401: 2 | C401: 17.70 | D401: 17.20 | E401: 17.450 | F401: 17.30 | G401: 17.30 | H401: 17.300 | I401: 34.750 | J401: 17.20 | K401: 17.30 | L401: 17.60 | M401: 26.050 | N401: 17.80 | O401: 17.40 | P401: 17.20 | Q401: 17.300 | R401: 18.30 | S401: 26.700 | T401: 87.500 | U401: 0.0 | V401: 87.500
C402: 11 | D402: 12 | E402: 12 | F402: 12 | G402: 12 | H402: 12 | I402: 12 | J402: 11 | K402: 12 | L402: 11 | M402: 12 | N402: 10 | O402: 12 | P402: 12 | Q402: 12 | R402: 7 | S402: 11 | T402: 11 | V402: 11
A403: Madison | B403: 1 | C403: 17.60 | D403: 17.40 | E403: 17.500 | F403: 17.60 | G403: 17.50 | H403: 17.550 | I403: 35.050 | J403: 17.10 | K403: 17.40 | L403: 17.70 | M403: 26.100 | N403: 17.40 | O403: 17.50 | P403: 17.30 | Q403: 17.400 | R403: 17.00 | S403: 25.900 | T403: 87.050 | U403: 0.0 | V403: 87.050
A404: Scouts | C404: 12 | D404: 11 | E404: 11 | F404: 11 | G404: 11 | H404: 11 | I404: 11 | J404: 12 | K404: 11 | L404: 10 | M404: 10 | N404: 12 | O404: 11 | P404: 11 | Q404: 11 | R404: 12 | S404: 12 | T404: 12 | V404: 12
A407: 8/10/2024 Indianapolis, Indiana--DCI All Age World Championship Finals
C408: General Effect | J408: Visual | N408: Music
C409: 1 | D409: 1 | F409: 2 | G409: 2 | J409: Proficiency | K409: Analysis | L409: Color Guard | N409: Brass | O409: Analysis 1 | P409: Analysis 2 | Q409: Analysis | R409: Percussion | T409: Sub | V409: Total
C410: J. Gilley | D410: C. Raichle | E410: Average | F410: K. Turner | G410: D. Orser | H410: Average | I410: Total | J410: M. Thompson | K410: S. Adamo | L410: H. Hguyen | M410: Total ÷2 | N410: S. Halquist | O410: D. Thomas | P410: T. Fox | Q410: Average | R410: T. Mengel | S410: Total ÷2 | T410: Total | U410: Pen | V410: Score
A411: DCI All Age World Class | C411: 20 | D411: 20 | E411: 20 | F411: 20 | G411: 20 | H411: 20 | I411: 40 | J411: 20 | K411: 20 | L411: 20 | M411: 30 | N411: 20 | O411: 20 | P411: 20 | Q411: 20 | R411: 20 | S411: 30 | T411: 100 | V411: 100
A412: Reading | B412: 5 | C412: 19.60 | D412: 19.30 | E412: 19.450 | F412: 18.80 | G412: 19.50 | H412: 19.150 | I412: 38.600 | J412: 18.90 | K412: 19.20 | L412: 18.80 | M412: 28.450 | N412: 19.10 | O412: 19.30 | P412: 19.00 | Q412: 19.150 | R412: 19.50 | S412: 28.875 | T412: 95.924999999999997 | U412: 0.0 | V412: 95.924999999999997
A413: Buccaneers | C413: 1 | D413: 1 | E413: 1 | F413: 1 | G413: 1 | H413: 1 | I413: 1 | J413: 1 | K413: 1 | L413: 1 | M413: 1 | N413: 1 | O413: 1 | P413: 1 | Q413: 1 | R413: 1 | S413: 1 | T413: 1 | V413: 1
A414: Hawthorne | B414: 4 | C414: 19.40 | D414: 18.70 | E414: 19.050 | F414: 18.50 | G414: 19.00 | H414: 18.750 | I414: 37.800 | J414: 18.60 | K414: 18.95 | L414: 18.30 | M414: 27.925000000000001 | N414: 18.50 | O414: 18.80 | P414: 18.40 | Q414: 18.600 | R414: 19.10 | S414: 28.100 | T414: 93.825000000000003 | U414: 0.0 | V414: 93.825000000000003
A415: Caballeros | C415: 2 | D415: 3 | E415: 2 | F415: 2 | G415: 2 | H415: 2 | I415: 2 | J415: 2 | K415: 2 | L415: 2 | M415: 2 | N415: 3 | O415: 2 | P415: 3 | Q415: 2 | R415: 3 | S415: 3 | T415: 2 | V415: 2
A416: Bushwackers | B416: 3 | C416: 18.40 | D416: 19.00 | E416: 18.700 | F416: 17.80 | G416: 18.70 | H416: 18.250 | I416: 36.950 | J416: 18.30 | K416: 18.40 | L416: 18.20 | M416: 27.450 | N416: 18.60 | O416: 18.30 | P416: 18.60 | Q416: 18.450 | R416: 19.40 | S416: 28.225000000000001 | T416: 92.625 | U416: 0.0 | V416: 92.625
C417: 4 | D417: 2 | E417: 3 | F417: 5 | G417: 3 | H417: 3 | I417: 3 | J417: 3 | K417: 3 | L417: 3 | M417: 3 | N417: 2 | O417: 3 | P417: 2 | Q417: 3 | R417: 2 | S417: 2 | T417: 3 | V417: 3
A418: Atlanta CV | B418: 1 | C418: 18.70 | D418: 18.60 | E418: 18.650 | F418: 18.30 | G418: 18.20 | H418: 18.250 | I418: 36.900 | J418: 17.60 | K418: 17.50 | L418: 17.90 | M418: 26.500 | N418: 17.50 | O418: 17.50 | P418: 18.20 | Q418: 17.850 | R418: 17.00 | S418: 26.175000000000001 | T418: 89.575000000000003 | U418: 0.0 | V418: 89.575000000000003
C419: 3 | D419: 4 | E419: 4 | F419: 3 | G419: 4 | H419: 3 | I419: 4 | J419: 4 | K419: 4 | L419: 4 | M419: 4 | N419: 4 | O419: 4 | P419: 4 | Q419: 4 | R419: 5 | S419: 4 | T419: 4 | V419: 4
A420: Connecticut | B420: 2 | C420: 17.80 | D420: 18.00 | E420: 17.900 | F420: 17.90 | G420: 17.20 | H420: 17.550 | I420: 35.450 | J420: 17.20 | K420: 17.00 | L420: 16.90 | M420: 25.550 | N420: 16.30 | O420: 17.30 | P420: 17.10 | Q420: 17.200 | R420: 18.10 | S420: 25.800 | T420: 86.800 | U420: 0.0 | V420: 86.800
A421: Hurricanes | C421: 5 | D421: 5 | E421: 5 | F421: 4 | G421: 5 | H421: 5 | I421: 5 | J421: 5 | K421: 5 | L421: 5 | M421: 5 | N421: 5 | O421: 5 | P421: 5 | Q421: 5 | R421: 4 | S421: 5 | T421: 5 | V421: 5
A422: DCI All Age Open Class
A423: Cincinnati | B423: 4 | C423: 18.10 | D423: 16.40 | E423: 17.250 | F423: 16.90 | G423: 17.80 | H423: 17.350 | I423: 34.600 | J423: 17.30 | K423: 17.90 | L423: 17.40 | M423: 26.300 | N423: 16.30 | O423: 17.30 | P423: 17.10 | Q423: 17.200 | R423: 18.10 | S423: 25.800 | T423: 86.800 | U423: 0.0 | V423: 86.800
A424: Tradition | C424: 1 | D424: 4 | E424: 1 | F424: 3 | G424: 1 | H424: 2 | I424: 2 | J424: 1 | K424: 1 | L424: 1 | M424: 1 | N424: 2 | O424: 2 | P424: 3 | Q424: 2 | R424: 2 | S424: 2 | T424: 1 | V424: 1
A425: White | B425: 3 | C425: 17.10 | D425: 17.20 | E425: 17.150 | F425: 17.60 | G425: 17.50 | H425: 17.550 | I425: 34.700 | J425: 16.30 | K425: 17.20 | L425: 17.00 | M425: 25.250 | N425: 17.70 | O425: 17.70 | P425: 17.60 | Q425: 17.650 | R425: 18.30 | S425: 26.824999999999999 | T425: 86.775000000000006 | U425: 0.0 | V425: 86.775000000000006
A426: Sabers | C426: 2 | D426: 2 | E426: 3 | F426: 1 | G426: 2 | H426: 1 | I426: 1 | J426: 2 | K426: 2 | L426: 2 | M426: 2 | N426: 1 | O426: 1 | P426: 1 | Q426: 1 | R426: 1 | S426: 1 | T426: 2 | V426: 2
A427: Rogues Hollow | B427: 2 | C427: 16.60 | D427: 16.80 | E427: 16.700 | F427: 17.00 | G427: 17.00 | H427: 17.000 | I427: 33.700 | J427: 16.10 | K427: 16.95 | L427: 16.30 | M427: 24.675000000000001 | N427: 15.90 | O427: 17.00 | P427: 17.20 | Q427: 17.100 | R427: 16.30 | S427: 24.650 | T427: 83.025000000000006 | U427: 0.0 | V427: 83.025000000000006
A428: Regiment | C428: 4 | D428: 3 | E428: 4 | F428: 2 | G428: 3 | H428: 3 | I428: 3 | J428: 3 | K428: 3 | L428: 4 | M428: 3 | N428: 3 | O428: 3 | P428: 2 | Q428: 3 | R428: 4 | S428: 3 | T428: 3 | V428: 3
A429: Fusion | B429: 1 | C429: 16.90 | D429: 17.50 | E429: 17.200 | F429: 16.30 | G429: 16.60 | H429: 16.450 | I429: 33.650 | J429: 15.60 | K429: 16.50 | L429: 16.40 | M429: 24.250 | N429: 14.90 | O429: 16.20 | P429: 16.70 | Q429: 16.450 | R429: 17.10 | S429: 24.225000000000001 | T429: 82.125 | U429: 0.0 | V429: 82.125
A430: Core | C430: 3 | D430: 1 | E430: 2 | F430: 4 | G430: 4 | H430: 4 | I430: 4 | J430: 4 | K430: 4 | L430: 3 | M430: 4 | N430: 4 | O430: 4 | P430: 4 | Q430: 4 | R430: 3 | S430: 4 | T430: 4 | V430: 4
A431: DCI All Age Class A
A432: Govenaires | B432: 3 | C432: 17.40 | D432: 17.80 | E432: 17.600 | F432: 16.20 | G432: 15.70 | H432: 15.950 | I432: 33.550 | J432: 15.30 | K432: 16.00 | L432: 16.50 | M432: 23.900 | N432: 15.10 | O432: 15.60 | P432: 15.70 | Q432: 16.650 | R432: 15.90 | S432: 23.324999999999999 | T432: 80.775000000000006 | U432: 0.0 | V432: 80.775000000000006
C433: 1 | D433: 1 | E433: 1 | F433: 2 | G433: 2 | H433: 2 | I433: 1 | J433: 1 | K433: 1 | L433: 1 | M433: 1 | N433: 1 | O433: 2 | P433: 2 | Q433: 1 | R433: 1 | S433: 1 | T433: 1 | V433: 1
A434: Sunrisers | B434: 4 | C434: 16.50 | D434: 16.60 | E434: 16.550 | F434: 16.50 | G434: 16.00 | H434: 16.250 | I434: 32.800 | J434: 15.10 | K434: 15.90 | L434: 15.50 | M434: 23.250 | N434: 14.70 | O434: 16.00 | P434: 15.90 | Q434: 15.950 | R434: 15.60 | S434: 23.125 | T434: 79.174999999999997 | U434: 0.0 | V434: 79.174999999999997
C435: 2 | D435: 2 | E435: 2 | F435: 1 | G435: 1 | H435: 1 | I435: 2 | J435: 2 | K435: 2 | L435: 3 | M435: 2 | N435: 2 | O435: 1 | P435: 1 | Q435: 2 | R435: 2 | S435: 2 | T435: 2 | V435: 2
A436: Skyliners | B436: 2 | C436: 16.40 | D436: 16.50 | E436: 16.450 | F436: 15.50 | G436: 15.40 | H436: 15.450 | I436: 31.900 | J436: 14.60 | K436: 15.10 | L436: 15.70 | M436: 22.700 | N436: 14.50 | O436: 14.70 | P436: 14.70 | Q436: 14.700 | R436: 15.10 | S436: 22.150 | T436: 76.750 | U436: 0.0 | V436: 76.750
C437: 3 | D437: 3 | E437: 3 | F437: 3 | G437: 3 | H437: 3 | I437: 3 | J437: 3 | K437: 3 | L437: 2 | M437: 3 | N437: 3 | O437: 3 | P437: 3 | Q437: 3 | R437: 3 | S437: 3 | T437: 3 | V437: 3
A438: Columbus | B438: 1 | C438: 14.50 | D438: 15.00 | E438: 14.750 | F438: 14.90 | G438: 14.10 | H438: 14.500 | I438: 29.250 | J438: 14.10 | K438: 14.20 | L438: 14.20 | M438: 21.250 | N438: 13.50 | O438: 14.00 | P438: 14.20 | Q438: 14.100 | R438: 14.40 | S438: 21.000 | T438: 71.500 | U438: 0.0 | V438: 71.500
A439: Saints | C439: 4 | D439: 4 | E439: 4 | F439: 4 | G439: 4 | H439: 4 | I439: 4 | J439: 4 | K439: 4 | L439: 4 | M439: 4 | N439: 4 | O439: 4 | P439: 4 | Q439: 4 | R439: 4 | S439: 4 | T439: 4 | V439: 4