A1: 6/26/2024 Rockford, Michigan
C2: General Effect | F2: Visual | J2: Music
C3: 1 | D3: 2 | F3: Proficiency | G3: Analysis | H3: Color Guard | J3: Brass | K3: Analysis | L3: Percussion | N3: Sub | P3: Total
C4: M. Tarr | D4: K. Weirich | E4: Total | F4: J. Orefice | G4: B. Kuhn | H4: D. Deems | I4: Total ÷2 | J4: P. McGarr | K4: A. Cook | L4: M. Leitzke | M4: Total ÷2 | N4: Total | O4: Pen | P4: Score
A5: DCI World Class | C5: 20 | D5: 20 | E5: 40 | F5: 20 | G5: 20 | H5: 20 | I5: 30 | J5: 20 | K5: 20 | L5: 20 | M5: 30 | N5: 100 | P5: 100
A6: Boston | B6: 5 | C6: 15.40 | D6: 14.40 | E6: 29.80 | F6: 14.50 | G6: 14.30 | H6: 14.50 | I6: 21.65 | J6: 14.30 | K6: 14.70 | L6: 14.10 | M6: 21.55 | N6: 73.00 | O6: 0.0 | P6: 73.00
A7: Crusaders | C7: =RANK(C6,(C$6,C$8,C$10,C$12,C$14,C$16,C$18,C$20,C$22,C$24,C$26,C$28,C$30,C$32,C$34,C$36,C$38,C$40,C$42,C$44,C$46,C$48,C$50,C$52,C$54,C$56,C$58,C$60,C$62,C$64,C$66,C$68,C$70,C$72,C$74,C$76,C$78,C$80,C$82,C$84,C$86,C$88,C$90,C$92,C$94,C$96,C$98,C$100,C$102,C$104,C$106,C$108,C$110,C$112,C$114,C$116,C$118,C$120,C$122,C$124)) -> 1 | D7: =RANK(D6,(D$6,D$8,D$10,D$12,D$14,D$16,D$18,D$20,D$22,D$24,D$26,D$28,D$30,D$32,D$34,D$36,D$38,D$40,D$42,D$44,D$46,D$48,D$50,D$52,D$54,D$56,D$58,D$60,D$62,D$64,D$66,D$68,D$70,D$72,D$74,D$76,D$78,D$80,D$82,D$84,D$86,D$88,D$90,D$92,D$94,D$96,D$98,D$100,D$102,D$104,D$106,D$108,D$110,D$112,D$114,D$116,D$118,D$120,D$122,D$124)) -> 1 | E7: =RANK(E6,(E$6,E$8,E$10,E$12,E$14,E$16,E$18,E$20,E$22,E$24,E$26,E$28,E$30,E$32,E$34,E$36,E$38,E$40,E$42,E$44,E$46,E$48,E$50,E$52,E$54,E$56,E$58,E$60,E$62,E$64,E$66,E$68,E$70,E$72,E$74,E$76,E$78,E$80,E$82,E$84,E$86,E$88,E$90,E$92,E$94,E$96,E$98,E$100,E$102,E$104,E$106,E$108,E$110,E$112,E$114,E$116,E$118,E$120,E$122,E$124)) -> 1 | F7: =RANK(F6,(F$6,F$8,F$10,F$12,F$14,F$16,F$18,F$20,F$22,F$24,F$26,F$28,F$30,F$32,F$34,F$36,F$38,F$40,F$42,F$44,F$46,F$48,F$50,F$52,F$54,F$56,F$58,F$60,F$62,F$64,F$66,F$68,F$70,F$72,F$74,F$76,F$78,F$80,F$82,F$84,F$86,F$88,F$90,F$92,F$94,F$96,F$98,F$100,F$102,F$104,F$106,F$108,F$110,F$112,F$114,F$116,F$118,F$120,F$122,F$124)) -> 1 | G7: =RANK(G6,(G$6,G$8,G$10,G$12,G$14,G$16,G$18,G$20,G$22,G$24,G$26,G$28,G$30,G$32,G$34,G$36,G$38,G$40,G$42,G$44,G$46,G$48,G$50,G$52,G$54,G$56,G$58,G$60,G$62,G$64,G$66,G$68,G$70,G$72,G$74,G$76,G$78,G$80,G$82,G$84,G$86,G$88,G$90,G$92,G$94,G$96,G$98,G$100,G$102,G$104,G$106,G$108,G$110,G$112,G$114,G$116,G$118,G$120,G$122,G$124)) -> 1 | H7: =RANK(H6,(H$6,H$8,H$10,H$12,H$14,H$16,H$18,H$20,H$22,H$24,H$26,H$28,H$30,H$32,H$34,H$36,H$38,H$40,H$42,H$44,H$46,H$48,H$50,H$52,H$54,H$56,H$58,H$60,H$62,H$64,H$66,H$68,H$70,H$72,H$74,H$76,H$78,H$80,H$82,H$84,H$86,H$88,H$90,H$92,H$94,H$96,H$98,H$100,H$102,H$104,H$106,H$108,H$110,H$112,H$114,H$116,H$118,H$120,H$122,H$124)) -> 1 | I7: =RANK(I6,(I$6,I$8,I$10,I$12,I$14,I$16,I$18,I$20,I$22,I$24,I$26,I$28,I$30,I$32,I$34,I$36,I$38,I$40,I$42,I$44,I$46,I$48,I$50,I$52,I$54,I$56,I$58,I$60,I$62,I$64,I$66,I$68,I$70,I$72,I$74,I$76,I$78,I$80,I$82,I$84,I$86,I$88,I$90,I$92,I$94,I$96,I$98,I$100,I$102,I$104,I$106,I$108,I$110,I$112,I$114,I$116,I$118,I$120,I$122,I$124)) -> 1 | J7: =RANK(J6,(J$6,J$8,J$10,J$12,J$14,J$16,J$18,J$20,J$22,J$24,J$26,J$28,J$30,J$32,J$34,J$36,J$38,J$40,J$42,J$44,J$46,J$48,J$50,J$52,J$54,J$56,J$58,J$60,J$62,J$64,J$66,J$68,J$70,J$72,J$74,J$76,J$78,J$80,J$82,J$84,J$86,J$88,J$90,J$92,J$94,J$96,J$98,J$100,J$102,J$104,J$106,J$108,J$110,J$112,J$114,J$116,J$118,J$120,J$122,J$124)) -> 1 | K7: =RANK(K6,(K$6,K$8,K$10,K$12,K$14,K$16,K$18,K$20,K$22,K$24,K$26,K$28,K$30,K$32,K$34,K$36,K$38,K$40,K$42,K$44,K$46,K$48,K$50,K$52,K$54,K$56,K$58,K$60,K$62,K$64,K$66,K$68,K$70,K$72,K$74,K$76,K$78,K$80,K$82,K$84,K$86,K$88,K$90,K$92,K$94,K$96,K$98,K$100,K$102,K$104,K$106,K$108,K$110,K$112,K$114,K$116,K$118,K$120,K$122,K$124)) -> 1 | L7: =RANK(L6,(L$6,L$8,L$10,L$12,L$14,L$16,L$18,L$20,L$22,L$24,L$26,L$28,L$30,L$32,L$34,L$36,L$38,L$40,L$42,L$44,L$46,L$48,L$50,L$52,L$54,L$56,L$58,L$60,L$62,L$64,L$66,L$68,L$70,L$72,L$74,L$76,L$78,L$80,L$82,L$84,L$86,L$88,L$90,L$92,L$94,L$96,L$98,L$100,L$102,L$104,L$106,L$108,L$110,L$112,L$114,L$116,L$118,L$120,L$122,L$124)) -> 1 | M7: =RANK(M6,(M$6,M$8,M$10,M$12,M$14,M$16,M$18,M$20,M$22,M$24,M$26,M$28,M$30,M$32,M$34,M$36,M$38,M$40,M$42,M$44,M$46,M$48,M$50,M$52,M$54,M$56,M$58,M$60,M$62,M$64,M$66,M$68,M$70,M$72,M$74,M$76,M$78,M$80,M$82,M$84,M$86,M$88,M$90,M$92,M$94,M$96,M$98,M$100,M$102,M$104,M$106,M$108,M$110,M$112,M$114,M$116,M$118,M$120,M$122,M$124)) -> 1 | N7: =RANK(N6,(N$6,N$8,N$10,N$12,N$14,N$16,N$18,N$20,N$22,N$24,N$26,N$28,N$30,N$32,N$34,N$36,N$38,N$40,N$42,N$44,N$46,N$48,N$50,N$52,N$54,N$56,N$58,N$60,N$62,N$64,N$66,N$68,N$70,N$72,N$74,N$76,N$78,N$80,N$82,N$84,N$86,N$88,N$90,N$92,N$94,N$96,N$98,N$100,N$102,N$104,N$106,N$108,N$110,N$112,N$114,N$116,N$118,N$120,N$122,N$124)) -> 1 | P7: =RANK(P6,(P$6,P$8,P$10,P$12,P$14,P$16,P$18,P$20,P$22,P$24,P$26,P$28,P$30,P$32,P$34,P$36,P$38,P$40,P$42,P$44,P$46,P$48,P$50,P$52,P$54,P$56,P$58,P$60,P$62,P$64,P$66,P$68,P$70,P$72,P$74,P$76,P$78,P$80,P$82,P$84,P$86,P$88,P$90,P$92,P$94,P$96,P$98,P$100,P$102,P$104,P$106,P$108,P$110,P$112,P$114,P$116,P$118,P$120,P$122,P$124)) -> 1
A8: Phantom | B8: 2 | C8: 14.80 | D8: 14.20 | E8: 29.00 | F8: 14.00 | G8: 13.60 | H8: 13.60 | I8: 20.60 | J8: 13.80 | K8: 14.20 | L8: 13.10 | M8: 20.55 | N8: 70.15 | O8: 0.0 | P8: 70.15
A9: Regiment | C9: =RANK(C8,(C$6,C$8,C$10,C$12,C$14,C$16,C$18,C$20,C$22,C$24,C$26,C$28,C$30,C$32,C$34,C$36,C$38,C$40,C$42,C$44,C$46,C$48,C$50,C$52,C$54,C$56,C$58,C$60,C$62,C$64,C$66,C$68,C$70,C$72,C$74,C$76,C$78,C$80,C$82,C$84,C$86,C$88,C$90,C$92,C$94,C$96,C$98,C$100,C$102,C$104,C$106,C$108,C$110,C$112,C$114,C$116,C$118,C$120,C$122,C$124)) -> 2 | D9: =RANK(D8,(D$6,D$8,D$10,D$12,D$14,D$16,D$18,D$20,D$22,D$24,D$26,D$28,D$30,D$32,D$34,D$36,D$38,D$40,D$42,D$44,D$46,D$48,D$50,D$52,D$54,D$56,D$58,D$60,D$62,D$64,D$66,D$68,D$70,D$72,D$74,D$76,D$78,D$80,D$82,D$84,D$86,D$88,D$90,D$92,D$94,D$96,D$98,D$100,D$102,D$104,D$106,D$108,D$110,D$112,D$114,D$116,D$118,D$120,D$122,D$124)) -> 2 | E9: =RANK(E8,(E$6,E$8,E$10,E$12,E$14,E$16,E$18,E$20,E$22,E$24,E$26,E$28,E$30,E$32,E$34,E$36,E$38,E$40,E$42,E$44,E$46,E$48,E$50,E$52,E$54,E$56,E$58,E$60,E$62,E$64,E$66,E$68,E$70,E$72,E$74,E$76,E$78,E$80,E$82,E$84,E$86,E$88,E$90,E$92,E$94,E$96,E$98,E$100,E$102,E$104,E$106,E$108,E$110,E$112,E$114,E$116,E$118,E$120,E$122,E$124)) -> 2 | F9: =RANK(F8,(F$6,F$8,F$10,F$12,F$14,F$16,F$18,F$20,F$22,F$24,F$26,F$28,F$30,F$32,F$34,F$36,F$38,F$40,F$42,F$44,F$46,F$48,F$50,F$52,F$54,F$56,F$58,F$60,F$62,F$64,F$66,F$68,F$70,F$72,F$74,F$76,F$78,F$80,F$82,F$84,F$86,F$88,F$90,F$92,F$94,F$96,F$98,F$100,F$102,F$104,F$106,F$108,F$110,F$112,F$114,F$116,F$118,F$120,F$122,F$124)) -> 2 | G9: =RANK(G8,(G$6,G$8,G$10,G$12,G$14,G$16,G$18,G$20,G$22,G$24,G$26,G$28,G$30,G$32,G$34,G$36,G$38,G$40,G$42,G$44,G$46,G$48,G$50,G$52,G$54,G$56,G$58,G$60,G$62,G$64,G$66,G$68,G$70,G$72,G$74,G$76,G$78,G$80,G$82,G$84,G$86,G$88,G$90,G$92,G$94,G$96,G$98,G$100,G$102,G$104,G$106,G$108,G$110,G$112,G$114,G$116,G$118,G$120,G$122,G$124)) -> 2 | H9: =RANK(H8,(H$6,H$8,H$10,H$12,H$14,H$16,H$18,H$20,H$22,H$24,H$26,H$28,H$30,H$32,H$34,H$36,H$38,H$40,H$42,H$44,H$46,H$48,H$50,H$52,H$54,H$56,H$58,H$60,H$62,H$64,H$66,H$68,H$70,H$72,H$74,H$76,H$78,H$80,H$82,H$84,H$86,H$88,H$90,H$92,H$94,H$96,H$98,H$100,H$102,H$104,H$106,H$108,H$110,H$112,H$114,H$116,H$118,H$120,H$122,H$124)) -> 2 | I9: =RANK(I8,(I$6,I$8,I$10,I$12,I$14,I$16,I$18,I$20,I$22,I$24,I$26,I$28,I$30,I$32,I$34,I$36,I$38,I$40,I$42,I$44,I$46,I$48,I$50,I$52,I$54,I$56,I$58,I$60,I$62,I$64,I$66,I$68,I$70,I$72,I$74,I$76,I$78,I$80,I$82,I$84,I$86,I$88,I$90,I$92,I$94,I$96,I$98,I$100,I$102,I$104,I$106,I$108,I$110,I$112,I$114,I$116,I$118,I$120,I$122,I$124)) -> 2 | J9: =RANK(J8,(J$6,J$8,J$10,J$12,J$14,J$16,J$18,J$20,J$22,J$24,J$26,J$28,J$30,J$32,J$34,J$36,J$38,J$40,J$42,J$44,J$46,J$48,J$50,J$52,J$54,J$56,J$58,J$60,J$62,J$64,J$66,J$68,J$70,J$72,J$74,J$76,J$78,J$80,J$82,J$84,J$86,J$88,J$90,J$92,J$94,J$96,J$98,J$100,J$102,J$104,J$106,J$108,J$110,J$112,J$114,J$116,J$118,J$120,J$122,J$124)) -> 2 | K9: =RANK(K8,(K$6,K$8,K$10,K$12,K$14,K$16,K$18,K$20,K$22,K$24,K$26,K$28,K$30,K$32,K$34,K$36,K$38,K$40,K$42,K$44,K$46,K$48,K$50,K$52,K$54,K$56,K$58,K$60,K$62,K$64,K$66,K$68,K$70,K$72,K$74,K$76,K$78,K$80,K$82,K$84,K$86,K$88,K$90,K$92,K$94,K$96,K$98,K$100,K$102,K$104,K$106,K$108,K$110,K$112,K$114,K$116,K$118,K$120,K$122,K$124)) -> 2 | L9: =RANK(L8,(L$6,L$8,L$10,L$12,L$14,L$16,L$18,L$20,L$22,L$24,L$26,L$28,L$30,L$32,L$34,L$36,L$38,L$40,L$42,L$44,L$46,L$48,L$50,L$52,L$54,L$56,L$58,L$60,L$62,L$64,L$66,L$68,L$70,L$72,L$74,L$76,L$78,L$80,L$82,L$84,L$86,L$88,L$90,L$92,L$94,L$96,L$98,L$100,L$102,L$104,L$106,L$108,L$110,L$112,L$114,L$116,L$118,L$120,L$122,L$124)) -> 3 | M9: =RANK(M8,(M$6,M$8,M$10,M$12,M$14,M$16,M$18,M$20,M$22,M$24,M$26,M$28,M$30,M$32,M$34,M$36,M$38,M$40,M$42,M$44,M$46,M$48,M$50,M$52,M$54,M$56,M$58,M$60,M$62,M$64,M$66,M$68,M$70,M$72,M$74,M$76,M$78,M$80,M$82,M$84,M$86,M$88,M$90,M$92,M$94,M$96,M$98,M$100,M$102,M$104,M$106,M$108,M$110,M$112,M$114,M$116,M$118,M$120,M$122,M$124)) -> 3 | N9: =RANK(N8,(N$6,N$8,N$10,N$12,N$14,N$16,N$18,N$20,N$22,N$24,N$26,N$28,N$30,N$32,N$34,N$36,N$38,N$40,N$42,N$44,N$46,N$48,N$50,N$52,N$54,N$56,N$58,N$60,N$62,N$64,N$66,N$68,N$70,N$72,N$74,N$76,N$78,N$80,N$82,N$84,N$86,N$88,N$90,N$92,N$94,N$96,N$98,N$100,N$102,N$104,N$106,N$108,N$110,N$112,N$114,N$116,N$118,N$120,N$122,N$124)) -> 2 | P9: =RANK(P8,(P$6,P$8,P$10,P$12,P$14,P$16,P$18,P$20,P$22,P$24,P$26,P$28,P$30,P$32,P$34,P$36,P$38,P$40,P$42,P$44,P$46,P$48,P$50,P$52,P$54,P$56,P$58,P$60,P$62,P$64,P$66,P$68,P$70,P$72,P$74,P$76,P$78,P$80,P$82,P$84,P$86,P$88,P$90,P$92,P$94,P$96,P$98,P$100,P$102,P$104,P$106,P$108,P$110,P$112,P$114,P$116,P$118,P$120,P$122,P$124)) -> 2
A10: Cavaliers | B10: 4 | C10: 13.70 | D10: 13.90 | E10: 27.60 | F10: 13.80 | G10: 13.30 | H10: 12.90 | I10: 20.00 | J10: 13.40 | K10: 14.10 | L10: 13.80 | M10: 20.65 | N10: 68.25 | O10: 0.0 | P10: 68.25
C11: =RANK(C10,(C$6,C$8,C$10,C$12,C$14,C$16,C$18,C$20,C$22,C$24,C$26,C$28,C$30,C$32,C$34,C$36,C$38,C$40,C$42,C$44,C$46,C$48,C$50,C$52,C$54,C$56,C$58,C$60,C$62,C$64,C$66,C$68,C$70,C$72,C$74,C$76,C$78,C$80,C$82,C$84,C$86,C$88,C$90,C$92,C$94,C$96,C$98,C$100,C$102,C$104,C$106,C$108,C$110,C$112,C$114,C$116,C$118,C$120,C$122,C$124)) -> 5 | D11: =RANK(D10,(D$6,D$8,D$10,D$12,D$14,D$16,D$18,D$20,D$22,D$24,D$26,D$28,D$30,D$32,D$34,D$36,D$38,D$40,D$42,D$44,D$46,D$48,D$50,D$52,D$54,D$56,D$58,D$60,D$62,D$64,D$66,D$68,D$70,D$72,D$74,D$76,D$78,D$80,D$82,D$84,D$86,D$88,D$90,D$92,D$94,D$96,D$98,D$100,D$102,D$104,D$106,D$108,D$110,D$112,D$114,D$116,D$118,D$120,D$122,D$124)) -> 3 | E11: =RANK(E10,(E$6,E$8,E$10,E$12,E$14,E$16,E$18,E$20,E$22,E$24,E$26,E$28,E$30,E$32,E$34,E$36,E$38,E$40,E$42,E$44,E$46,E$48,E$50,E$52,E$54,E$56,E$58,E$60,E$62,E$64,E$66,E$68,E$70,E$72,E$74,E$76,E$78,E$80,E$82,E$84,E$86,E$88,E$90,E$92,E$94,E$96,E$98,E$100,E$102,E$104,E$106,E$108,E$110,E$112,E$114,E$116,E$118,E$120,E$122,E$124)) -> 3 | F11: =RANK(F10,(F$6,F$8,F$10,F$12,F$14,F$16,F$18,F$20,F$22,F$24,F$26,F$28,F$30,F$32,F$34,F$36,F$38,F$40,F$42,F$44,F$46,F$48,F$50,F$52,F$54,F$56,F$58,F$60,F$62,F$64,F$66,F$68,F$70,F$72,F$74,F$76,F$78,F$80,F$82,F$84,F$86,F$88,F$90,F$92,F$94,F$96,F$98,F$100,F$102,F$104,F$106,F$108,F$110,F$112,F$114,F$116,F$118,F$120,F$122,F$124)) -> 3 | G11: =RANK(G10,(G$6,G$8,G$10,G$12,G$14,G$16,G$18,G$20,G$22,G$24,G$26,G$28,G$30,G$32,G$34,G$36,G$38,G$40,G$42,G$44,G$46,G$48,G$50,G$52,G$54,G$56,G$58,G$60,G$62,G$64,G$66,G$68,G$70,G$72,G$74,G$76,G$78,G$80,G$82,G$84,G$86,G$88,G$90,G$92,G$94,G$96,G$98,G$100,G$102,G$104,G$106,G$108,G$110,G$112,G$114,G$116,G$118,G$120,G$122,G$124)) -> 3 | H11: =RANK(H10,(H$6,H$8,H$10,H$12,H$14,H$16,H$18,H$20,H$22,H$24,H$26,H$28,H$30,H$32,H$34,H$36,H$38,H$40,H$42,H$44,H$46,H$48,H$50,H$52,H$54,H$56,H$58,H$60,H$62,H$64,H$66,H$68,H$70,H$72,H$74,H$76,H$78,H$80,H$82,H$84,H$86,H$88,H$90,H$92,H$94,H$96,H$98,H$100,H$102,H$104,H$106,H$108,H$110,H$112,H$114,H$116,H$118,H$120,H$122,H$124)) -> 4 | I11: =RANK(I10,(I$6,I$8,I$10,I$12,I$14,I$16,I$18,I$20,I$22,I$24,I$26,I$28,I$30,I$32,I$34,I$36,I$38,I$40,I$42,I$44,I$46,I$48,I$50,I$52,I$54,I$56,I$58,I$60,I$62,I$64,I$66,I$68,I$70,I$72,I$74,I$76,I$78,I$80,I$82,I$84,I$86,I$88,I$90,I$92,I$94,I$96,I$98,I$100,I$102,I$104,I$106,I$108,I$110,I$112,I$114,I$116,I$118,I$120,I$122,I$124)) -> 3 | J11: =RANK(J10,(J$6,J$8,J$10,J$12,J$14,J$16,J$18,J$20,J$22,J$24,J$26,J$28,J$30,J$32,J$34,J$36,J$38,J$40,J$42,J$44,J$46,J$48,J$50,J$52,J$54,J$56,J$58,J$60,J$62,J$64,J$66,J$68,J$70,J$72,J$74,J$76,J$78,J$80,J$82,J$84,J$86,J$88,J$90,J$92,J$94,J$96,J$98,J$100,J$102,J$104,J$106,J$108,J$110,J$112,J$114,J$116,J$118,J$120,J$122,J$124)) -> 3 | K11: =RANK(K10,(K$6,K$8,K$10,K$12,K$14,K$16,K$18,K$20,K$22,K$24,K$26,K$28,K$30,K$32,K$34,K$36,K$38,K$40,K$42,K$44,K$46,K$48,K$50,K$52,K$54,K$56,K$58,K$60,K$62,K$64,K$66,K$68,K$70,K$72,K$74,K$76,K$78,K$80,K$82,K$84,K$86,K$88,K$90,K$92,K$94,K$96,K$98,K$100,K$102,K$104,K$106,K$108,K$110,K$112,K$114,K$116,K$118,K$120,K$122,K$124)) -> 3 | L11: =RANK(L10,(L$6,L$8,L$10,L$12,L$14,L$16,L$18,L$20,L$22,L$24,L$26,L$28,L$30,L$32,L$34,L$36,L$38,L$40,L$42,L$44,L$46,L$48,L$50,L$52,L$54,L$56,L$58,L$60,L$62,L$64,L$66,L$68,L$70,L$72,L$74,L$76,L$78,L$80,L$82,L$84,L$86,L$88,L$90,L$92,L$94,L$96,L$98,L$100,L$102,L$104,L$106,L$108,L$110,L$112,L$114,L$116,L$118,L$120,L$122,L$124)) -> 2 | M11: =RANK(M10,(M$6,M$8,M$10,M$12,M$14,M$16,M$18,M$20,M$22,M$24,M$26,M$28,M$30,M$32,M$34,M$36,M$38,M$40,M$42,M$44,M$46,M$48,M$50,M$52,M$54,M$56,M$58,M$60,M$62,M$64,M$66,M$68,M$70,M$72,M$74,M$76,M$78,M$80,M$82,M$84,M$86,M$88,M$90,M$92,M$94,M$96,M$98,M$100,M$102,M$104,M$106,M$108,M$110,M$112,M$114,M$116,M$118,M$120,M$122,M$124)) -> 2 | N11: =RANK(N10,(N$6,N$8,N$10,N$12,N$14,N$16,N$18,N$20,N$22,N$24,N$26,N$28,N$30,N$32,N$34,N$36,N$38,N$40,N$42,N$44,N$46,N$48,N$50,N$52,N$54,N$56,N$58,N$60,N$62,N$64,N$66,N$68,N$70,N$72,N$74,N$76,N$78,N$80,N$82,N$84,N$86,N$88,N$90,N$92,N$94,N$96,N$98,N$100,N$102,N$104,N$106,N$108,N$110,N$112,N$114,N$116,N$118,N$120,N$122,N$124)) -> 3 | P11: =RANK(P10,(P$6,P$8,P$10,P$12,P$14,P$16,P$18,P$20,P$22,P$24,P$26,P$28,P$30,P$32,P$34,P$36,P$38,P$40,P$42,P$44,P$46,P$48,P$50,P$52,P$54,P$56,P$58,P$60,P$62,P$64,P$66,P$68,P$70,P$72,P$74,P$76,P$78,P$80,P$82,P$84,P$86,P$88,P$90,P$92,P$94,P$96,P$98,P$100,P$102,P$104,P$106,P$108,P$110,P$112,P$114,P$116,P$118,P$120,P$122,P$124)) -> 3
A12: Blue | B12: 1 | C12: 14.10 | D12: 13.30 | E12: 27.40 | F12: 13.30 | G12: 12.80 | H12: 13.40 | I12: 19.75 | J12: 12.90 | K12: 13.60 | L12: 12.50 | M12: 19.50 | N12: 66.65 | O12: 0.0 | P12: 66.65
A13: Stars | C13: =RANK(C12,(C$6,C$8,C$10,C$12,C$14,C$16,C$18,C$20,C$22,C$24,C$26,C$28,C$30,C$32,C$34,C$36,C$38,C$40,C$42,C$44,C$46,C$48,C$50,C$52,C$54,C$56,C$58,C$60,C$62,C$64,C$66,C$68,C$70,C$72,C$74,C$76,C$78,C$80,C$82,C$84,C$86,C$88,C$90,C$92,C$94,C$96,C$98,C$100,C$102,C$104,C$106,C$108,C$110,C$112,C$114,C$116,C$118,C$120,C$122,C$124)) -> 3 | D13: =RANK(D12,(D$6,D$8,D$10,D$12,D$14,D$16,D$18,D$20,D$22,D$24,D$26,D$28,D$30,D$32,D$34,D$36,D$38,D$40,D$42,D$44,D$46,D$48,D$50,D$52,D$54,D$56,D$58,D$60,D$62,D$64,D$66,D$68,D$70,D$72,D$74,D$76,D$78,D$80,D$82,D$84,D$86,D$88,D$90,D$92,D$94,D$96,D$98,D$100,D$102,D$104,D$106,D$108,D$110,D$112,D$114,D$116,D$118,D$120,D$122,D$124)) -> 4 | E13: =RANK(E12,(E$6,E$8,E$10,E$12,E$14,E$16,E$18,E$20,E$22,E$24,E$26,E$28,E$30,E$32,E$34,E$36,E$38,E$40,E$42,E$44,E$46,E$48,E$50,E$52,E$54,E$56,E$58,E$60,E$62,E$64,E$66,E$68,E$70,E$72,E$74,E$76,E$78,E$80,E$82,E$84,E$86,E$88,E$90,E$92,E$94,E$96,E$98,E$100,E$102,E$104,E$106,E$108,E$110,E$112,E$114,E$116,E$118,E$120,E$122,E$124)) -> 4 | F13: =RANK(F12,(F$6,F$8,F$10,F$12,F$14,F$16,F$18,F$20,F$22,F$24,F$26,F$28,F$30,F$32,F$34,F$36,F$38,F$40,F$42,F$44,F$46,F$48,F$50,F$52,F$54,F$56,F$58,F$60,F$62,F$64,F$66,F$68,F$70,F$72,F$74,F$76,F$78,F$80,F$82,F$84,F$86,F$88,F$90,F$92,F$94,F$96,F$98,F$100,F$102,F$104,F$106,F$108,F$110,F$112,F$114,F$116,F$118,F$120,F$122,F$124)) -> 5 | G13: =RANK(G12,(G$6,G$8,G$10,G$12,G$14,G$16,G$18,G$20,G$22,G$24,G$26,G$28,G$30,G$32,G$34,G$36,G$38,G$40,G$42,G$44,G$46,G$48,G$50,G$52,G$54,G$56,G$58,G$60,G$62,G$64,G$66,G$68,G$70,G$72,G$74,G$76,G$78,G$80,G$82,G$84,G$86,G$88,G$90,G$92,G$94,G$96,G$98,G$100,G$102,G$104,G$106,G$108,G$110,G$112,G$114,G$116,G$118,G$120,G$122,G$124)) -> 4 | H13: =RANK(H12,(H$6,H$8,H$10,H$12,H$14,H$16,H$18,H$20,H$22,H$24,H$26,H$28,H$30,H$32,H$34,H$36,H$38,H$40,H$42,H$44,H$46,H$48,H$50,H$52,H$54,H$56,H$58,H$60,H$62,H$64,H$66,H$68,H$70,H$72,H$74,H$76,H$78,H$80,H$82,H$84,H$86,H$88,H$90,H$92,H$94,H$96,H$98,H$100,H$102,H$104,H$106,H$108,H$110,H$112,H$114,H$116,H$118,H$120,H$122,H$124)) -> 3 | I13: =RANK(I12,(I$6,I$8,I$10,I$12,I$14,I$16,I$18,I$20,I$22,I$24,I$26,I$28,I$30,I$32,I$34,I$36,I$38,I$40,I$42,I$44,I$46,I$48,I$50,I$52,I$54,I$56,I$58,I$60,I$62,I$64,I$66,I$68,I$70,I$72,I$74,I$76,I$78,I$80,I$82,I$84,I$86,I$88,I$90,I$92,I$94,I$96,I$98,I$100,I$102,I$104,I$106,I$108,I$110,I$112,I$114,I$116,I$118,I$120,I$122,I$124)) -> 4 | J13: =RANK(J12,(J$6,J$8,J$10,J$12,J$14,J$16,J$18,J$20,J$22,J$24,J$26,J$28,J$30,J$32,J$34,J$36,J$38,J$40,J$42,J$44,J$46,J$48,J$50,J$52,J$54,J$56,J$58,J$60,J$62,J$64,J$66,J$68,J$70,J$72,J$74,J$76,J$78,J$80,J$82,J$84,J$86,J$88,J$90,J$92,J$94,J$96,J$98,J$100,J$102,J$104,J$106,J$108,J$110,J$112,J$114,J$116,J$118,J$120,J$122,J$124)) -> 4 | K13: =RANK(K12,(K$6,K$8,K$10,K$12,K$14,K$16,K$18,K$20,K$22,K$24,K$26,K$28,K$30,K$32,K$34,K$36,K$38,K$40,K$42,K$44,K$46,K$48,K$50,K$52,K$54,K$56,K$58,K$60,K$62,K$64,K$66,K$68,K$70,K$72,K$74,K$76,K$78,K$80,K$82,K$84,K$86,K$88,K$90,K$92,K$94,K$96,K$98,K$100,K$102,K$104,K$106,K$108,K$110,K$112,K$114,K$116,K$118,K$120,K$122,K$124)) -> 4 | L13: =RANK(L12,(L$6,L$8,L$10,L$12,L$14,L$16,L$18,L$20,L$22,L$24,L$26,L$28,L$30,L$32,L$34,L$36,L$38,L$40,L$42,L$44,L$46,L$48,L$50,L$52,L$54,L$56,L$58,L$60,L$62,L$64,L$66,L$68,L$70,L$72,L$74,L$76,L$78,L$80,L$82,L$84,L$86,L$88,L$90,L$92,L$94,L$96,L$98,L$100,L$102,L$104,L$106,L$108,L$110,L$112,L$114,L$116,L$118,L$120,L$122,L$124)) -> 4 | M13: =RANK(M12,(M$6,M$8,M$10,M$12,M$14,M$16,M$18,M$20,M$22,M$24,M$26,M$28,M$30,M$32,M$34,M$36,M$38,M$40,M$42,M$44,M$46,M$48,M$50,M$52,M$54,M$56,M$58,M$60,M$62,M$64,M$66,M$68,M$70,M$72,M$74,M$76,M$78,M$80,M$82,M$84,M$86,M$88,M$90,M$92,M$94,M$96,M$98,M$100,M$102,M$104,M$106,M$108,M$110,M$112,M$114,M$116,M$118,M$120,M$122,M$124)) -> 4 | N13: =RANK(N12,(N$6,N$8,N$10,N$12,N$14,N$16,N$18,N$20,N$22,N$24,N$26,N$28,N$30,N$32,N$34,N$36,N$38,N$40,N$42,N$44,N$46,N$48,N$50,N$52,N$54,N$56,N$58,N$60,N$62,N$64,N$66,N$68,N$70,N$72,N$74,N$76,N$78,N$80,N$82,N$84,N$86,N$88,N$90,N$92,N$94,N$96,N$98,N$100,N$102,N$104,N$106,N$108,N$110,N$112,N$114,N$116,N$118,N$120,N$122,N$124)) -> 4 | P13: =RANK(P12,(P$6,P$8,P$10,P$12,P$14,P$16,P$18,P$20,P$22,P$24,P$26,P$28,P$30,P$32,P$34,P$36,P$38,P$40,P$42,P$44,P$46,P$48,P$50,P$52,P$54,P$56,P$58,P$60,P$62,P$64,P$66,P$68,P$70,P$72,P$74,P$76,P$78,P$80,P$82,P$84,P$86,P$88,P$90,P$92,P$94,P$96,P$98,P$100,P$102,P$104,P$106,P$108,P$110,P$112,P$114,P$116,P$118,P$120,P$122,P$124)) -> 4
A14: Colts | B14: 3 | C14: 13.80 | D14: 13.00 | E14: 26.80 | F14: 13.40 | G14: 12.60 | H14: 12.80 | I14: 19.40 | J14: 12.70 | K14: 13.30 | L14: 12.40 | M14: 19.20 | N14: 65.40 | O14: 0.0 | P14: 65.40
C15: =RANK(C14,(C$6,C$8,C$10,C$12,C$14,C$16,C$18,C$20,C$22,C$24,C$26,C$28,C$30,C$32,C$34,C$36,C$38,C$40,C$42,C$44,C$46,C$48,C$50,C$52,C$54,C$56,C$58,C$60,C$62,C$64,C$66,C$68,C$70,C$72,C$74,C$76,C$78,C$80,C$82,C$84,C$86,C$88,C$90,C$92,C$94,C$96,C$98,C$100,C$102,C$104,C$106,C$108,C$110,C$112,C$114,C$116,C$118,C$120,C$122,C$124)) -> 4 | D15: =RANK(D14,(D$6,D$8,D$10,D$12,D$14,D$16,D$18,D$20,D$22,D$24,D$26,D$28,D$30,D$32,D$34,D$36,D$38,D$40,D$42,D$44,D$46,D$48,D$50,D$52,D$54,D$56,D$58,D$60,D$62,D$64,D$66,D$68,D$70,D$72,D$74,D$76,D$78,D$80,D$82,D$84,D$86,D$88,D$90,D$92,D$94,D$96,D$98,D$100,D$102,D$104,D$106,D$108,D$110,D$112,D$114,D$116,D$118,D$120,D$122,D$124)) -> 5 | E15: =RANK(E14,(E$6,E$8,E$10,E$12,E$14,E$16,E$18,E$20,E$22,E$24,E$26,E$28,E$30,E$32,E$34,E$36,E$38,E$40,E$42,E$44,E$46,E$48,E$50,E$52,E$54,E$56,E$58,E$60,E$62,E$64,E$66,E$68,E$70,E$72,E$74,E$76,E$78,E$80,E$82,E$84,E$86,E$88,E$90,E$92,E$94,E$96,E$98,E$100,E$102,E$104,E$106,E$108,E$110,E$112,E$114,E$116,E$118,E$120,E$122,E$124)) -> 5 | F15: =RANK(F14,(F$6,F$8,F$10,F$12,F$14,F$16,F$18,F$20,F$22,F$24,F$26,F$28,F$30,F$32,F$34,F$36,F$38,F$40,F$42,F$44,F$46,F$48,F$50,F$52,F$54,F$56,F$58,F$60,F$62,F$64,F$66,F$68,F$70,F$72,F$74,F$76,F$78,F$80,F$82,F$84,F$86,F$88,F$90,F$92,F$94,F$96,F$98,F$100,F$102,F$104,F$106,F$108,F$110,F$112,F$114,F$116,F$118,F$120,F$122,F$124)) -> 4 | G15: =RANK(G14,(G$6,G$8,G$10,G$12,G$14,G$16,G$18,G$20,G$22,G$24,G$26,G$28,G$30,G$32,G$34,G$36,G$38,G$40,G$42,G$44,G$46,G$48,G$50,G$52,G$54,G$56,G$58,G$60,G$62,G$64,G$66,G$68,G$70,G$72,G$74,G$76,G$78,G$80,G$82,G$84,G$86,G$88,G$90,G$92,G$94,G$96,G$98,G$100,G$102,G$104,G$106,G$108,G$110,G$112,G$114,G$116,G$118,G$120,G$122,G$124)) -> 5 | H15: =RANK(H14,(H$6,H$8,H$10,H$12,H$14,H$16,H$18,H$20,H$22,H$24,H$26,H$28,H$30,H$32,H$34,H$36,H$38,H$40,H$42,H$44,H$46,H$48,H$50,H$52,H$54,H$56,H$58,H$60,H$62,H$64,H$66,H$68,H$70,H$72,H$74,H$76,H$78,H$80,H$82,H$84,H$86,H$88,H$90,H$92,H$94,H$96,H$98,H$100,H$102,H$104,H$106,H$108,H$110,H$112,H$114,H$116,H$118,H$120,H$122,H$124)) -> 5 | I15: =RANK(I14,(I$6,I$8,I$10,I$12,I$14,I$16,I$18,I$20,I$22,I$24,I$26,I$28,I$30,I$32,I$34,I$36,I$38,I$40,I$42,I$44,I$46,I$48,I$50,I$52,I$54,I$56,I$58,I$60,I$62,I$64,I$66,I$68,I$70,I$72,I$74,I$76,I$78,I$80,I$82,I$84,I$86,I$88,I$90,I$92,I$94,I$96,I$98,I$100,I$102,I$104,I$106,I$108,I$110,I$112,I$114,I$116,I$118,I$120,I$122,I$124)) -> 5 | J15: =RANK(J14,(J$6,J$8,J$10,J$12,J$14,J$16,J$18,J$20,J$22,J$24,J$26,J$28,J$30,J$32,J$34,J$36,J$38,J$40,J$42,J$44,J$46,J$48,J$50,J$52,J$54,J$56,J$58,J$60,J$62,J$64,J$66,J$68,J$70,J$72,J$74,J$76,J$78,J$80,J$82,J$84,J$86,J$88,J$90,J$92,J$94,J$96,J$98,J$100,J$102,J$104,J$106,J$108,J$110,J$112,J$114,J$116,J$118,J$120,J$122,J$124)) -> 5 | K15: =RANK(K14,(K$6,K$8,K$10,K$12,K$14,K$16,K$18,K$20,K$22,K$24,K$26,K$28,K$30,K$32,K$34,K$36,K$38,K$40,K$42,K$44,K$46,K$48,K$50,K$52,K$54,K$56,K$58,K$60,K$62,K$64,K$66,K$68,K$70,K$72,K$74,K$76,K$78,K$80,K$82,K$84,K$86,K$88,K$90,K$92,K$94,K$96,K$98,K$100,K$102,K$104,K$106,K$108,K$110,K$112,K$114,K$116,K$118,K$120,K$122,K$124)) -> 5 | L15: =RANK(L14,(L$6,L$8,L$10,L$12,L$14,L$16,L$18,L$20,L$22,L$24,L$26,L$28,L$30,L$32,L$34,L$36,L$38,L$40,L$42,L$44,L$46,L$48,L$50,L$52,L$54,L$56,L$58,L$60,L$62,L$64,L$66,L$68,L$70,L$72,L$74,L$76,L$78,L$80,L$82,L$84,L$86,L$88,L$90,L$92,L$94,L$96,L$98,L$100,L$102,L$104,L$106,L$108,L$110,L$112,L$114,L$116,L$118,L$120,L$122,L$124)) -> 5 | M15: =RANK(M14,(M$6,M$8,M$10,M$12,M$14,M$16,M$18,M$20,M$22,M$24,M$26,M$28,M$30,M$32,M$34,M$36,M$38,M$40,M$42,M$44,M$46,M$48,M$50,M$52,M$54,M$56,M$58,M$60,M$62,M$64,M$66,M$68,M$70,M$72,M$74,M$76,M$78,M$80,M$82,M$84,M$86,M$88,M$90,M$92,M$94,M$96,M$98,M$100,M$102,M$104,M$106,M$108,M$110,M$112,M$114,M$116,M$118,M$120,M$122,M$124)) -> 5 | N15: =RANK(N14,(N$6,N$8,N$10,N$12,N$14,N$16,N$18,N$20,N$22,N$24,N$26,N$28,N$30,N$32,N$34,N$36,N$38,N$40,N$42,N$44,N$46,N$48,N$50,N$52,N$54,N$56,N$58,N$60,N$62,N$64,N$66,N$68,N$70,N$72,N$74,N$76,N$78,N$80,N$82,N$84,N$86,N$88,N$90,N$92,N$94,N$96,N$98,N$100,N$102,N$104,N$106,N$108,N$110,N$112,N$114,N$116,N$118,N$120,N$122,N$124)) -> 5 | P15: =RANK(P14,(P$6,P$8,P$10,P$12,P$14,P$16,P$18,P$20,P$22,P$24,P$26,P$28,P$30,P$32,P$34,P$36,P$38,P$40,P$42,P$44,P$46,P$48,P$50,P$52,P$54,P$56,P$58,P$60,P$62,P$64,P$66,P$68,P$70,P$72,P$74,P$76,P$78,P$80,P$82,P$84,P$86,P$88,P$90,P$92,P$94,P$96,P$98,P$100,P$102,P$104,P$106,P$108,P$110,P$112,P$114,P$116,P$118,P$120,P$122,P$124)) -> 5
A18: 6/28/2024 Muncie, Indiana
C19: General Effect | F19: Visual | J19: Music
C20: 1 | D20: 2 | F20: Proficiency | G20: Analysis | H20: Color Guard | J20: Brass | K20: Analysis | L20: Percussion | N20: Sub | P20: Total
C21: B. Spidel | D21: N. Jones | E21: Total | F21: D. Deems | G21: M. Tarr | H21: T. Landess | I21: Total ÷2 | J21: B. Crisp | K21: J. Loyde | L21: J. Davila | M21: Total ÷2 | N21: Total | O21: Pen | P21: Score
A22: DCI World Class | C22: 20 | D22: 20 | E22: 40 | F22: 20 | G22: 20 | H22: 20 | I22: 30 | J22: 20 | K22: 20 | L22: 20 | M22: 30 | N22: 100 | P22: 100
A23: Carolina | B23: 6 | C23: 14.90 | D23: 15.40 | E23: 30.30 | F23: 15.20 | G23: 15.00 | H23: 14.60 | I23: 22.40 | J23: 15.10 | K23: 15.10 | L23: 14.20 | M23: 22.20 | N23: 74.90 | O23: 0.0 | P23: 74.90
A24: Crown | C24: =RANK(C23,(C$6,C$8,C$10,C$12,C$14,C$16,C$18,C$20,C$22,C$24,C$26,C$28,C$30,C$32,C$34,C$36,C$38,C$40,C$42,C$44,C$46,C$48,C$50,C$52,C$54,C$56,C$58,C$60,C$62,C$64,C$66,C$68,C$70,C$72,C$74,C$76,C$78,C$80,C$82,C$84,C$86,C$88,C$90,C$92,C$94,C$96,C$98,C$100,C$102,C$104,C$106,C$108,C$110,C$112,C$114,C$116,C$118,C$120,C$122,C$124)) -> 2 | D24: =RANK(D23,(D$6,D$8,D$10,D$12,D$14,D$16,D$18,D$20,D$22,D$24,D$26,D$28,D$30,D$32,D$34,D$36,D$38,D$40,D$42,D$44,D$46,D$48,D$50,D$52,D$54,D$56,D$58,D$60,D$62,D$64,D$66,D$68,D$70,D$72,D$74,D$76,D$78,D$80,D$82,D$84,D$86,D$88,D$90,D$92,D$94,D$96,D$98,D$100,D$102,D$104,D$106,D$108,D$110,D$112,D$114,D$116,D$118,D$120,D$122,D$124)) -> 1 | E24: =RANK(E23,(E$6,E$8,E$10,E$12,E$14,E$16,E$18,E$20,E$22,E$24,E$26,E$28,E$30,E$32,E$34,E$36,E$38,E$40,E$42,E$44,E$46,E$48,E$50,E$52,E$54,E$56,E$58,E$60,E$62,E$64,E$66,E$68,E$70,E$72,E$74,E$76,E$78,E$80,E$82,E$84,E$86,E$88,E$90,E$92,E$94,E$96,E$98,E$100,E$102,E$104,E$106,E$108,E$110,E$112,E$114,E$116,E$118,E$120,E$122,E$124)) -> 1 | F24: =RANK(F23,(F$6,F$8,F$10,F$12,F$14,F$16,F$18,F$20,F$22,F$24,F$26,F$28,F$30,F$32,F$34,F$36,F$38,F$40,F$42,F$44,F$46,F$48,F$50,F$52,F$54,F$56,F$58,F$60,F$62,F$64,F$66,F$68,F$70,F$72,F$74,F$76,F$78,F$80,F$82,F$84,F$86,F$88,F$90,F$92,F$94,F$96,F$98,F$100,F$102,F$104,F$106,F$108,F$110,F$112,F$114,F$116,F$118,F$120,F$122,F$124)) -> 1 | G24: =RANK(G23,(G$6,G$8,G$10,G$12,G$14,G$16,G$18,G$20,G$22,G$24,G$26,G$28,G$30,G$32,G$34,G$36,G$38,G$40,G$42,G$44,G$46,G$48,G$50,G$52,G$54,G$56,G$58,G$60,G$62,G$64,G$66,G$68,G$70,G$72,G$74,G$76,G$78,G$80,G$82,G$84,G$86,G$88,G$90,G$92,G$94,G$96,G$98,G$100,G$102,G$104,G$106,G$108,G$110,G$112,G$114,G$116,G$118,G$120,G$122,G$124)) -> 2 | H24: =RANK(H23,(H$6,H$8,H$10,H$12,H$14,H$16,H$18,H$20,H$22,H$24,H$26,H$28,H$30,H$32,H$34,H$36,H$38,H$40,H$42,H$44,H$46,H$48,H$50,H$52,H$54,H$56,H$58,H$60,H$62,H$64,H$66,H$68,H$70,H$72,H$74,H$76,H$78,H$80,H$82,H$84,H$86,H$88,H$90,H$92,H$94,H$96,H$98,H$100,H$102,H$104,H$106,H$108,H$110,H$112,H$114,H$116,H$118,H$120,H$122,H$124)) -> 2 | I24: =RANK(I23,(I$6,I$8,I$10,I$12,I$14,I$16,I$18,I$20,I$22,I$24,I$26,I$28,I$30,I$32,I$34,I$36,I$38,I$40,I$42,I$44,I$46,I$48,I$50,I$52,I$54,I$56,I$58,I$60,I$62,I$64,I$66,I$68,I$70,I$72,I$74,I$76,I$78,I$80,I$82,I$84,I$86,I$88,I$90,I$92,I$94,I$96,I$98,I$100,I$102,I$104,I$106,I$108,I$110,I$112,I$114,I$116,I$118,I$120,I$122,I$124)) -> 1 | J24: =RANK(J23,(J$6,J$8,J$10,J$12,J$14,J$16,J$18,J$20,J$22,J$24,J$26,J$28,J$30,J$32,J$34,J$36,J$38,J$40,J$42,J$44,J$46,J$48,J$50,J$52,J$54,J$56,J$58,J$60,J$62,J$64,J$66,J$68,J$70,J$72,J$74,J$76,J$78,J$80,J$82,J$84,J$86,J$88,J$90,J$92,J$94,J$96,J$98,J$100,J$102,J$104,J$106,J$108,J$110,J$112,J$114,J$116,J$118,J$120,J$122,J$124)) -> 1 | K24: =RANK(K23,(K$6,K$8,K$10,K$12,K$14,K$16,K$18,K$20,K$22,K$24,K$26,K$28,K$30,K$32,K$34,K$36,K$38,K$40,K$42,K$44,K$46,K$48,K$50,K$52,K$54,K$56,K$58,K$60,K$62,K$64,K$66,K$68,K$70,K$72,K$74,K$76,K$78,K$80,K$82,K$84,K$86,K$88,K$90,K$92,K$94,K$96,K$98,K$100,K$102,K$104,K$106,K$108,K$110,K$112,K$114,K$116,K$118,K$120,K$122,K$124)) -> 1 | L24: =RANK(L23,(L$6,L$8,L$10,L$12,L$14,L$16,L$18,L$20,L$22,L$24,L$26,L$28,L$30,L$32,L$34,L$36,L$38,L$40,L$42,L$44,L$46,L$48,L$50,L$52,L$54,L$56,L$58,L$60,L$62,L$64,L$66,L$68,L$70,L$72,L$74,L$76,L$78,L$80,L$82,L$84,L$86,L$88,L$90,L$92,L$94,L$96,L$98,L$100,L$102,L$104,L$106,L$108,L$110,L$112,L$114,L$116,L$118,L$120,L$122,L$124)) -> 3 | M24: =RANK(M23,(M$6,M$8,M$10,M$12,M$14,M$16,M$18,M$20,M$22,M$24,M$26,M$28,M$30,M$32,M$34,M$36,M$38,M$40,M$42,M$44,M$46,M$48,M$50,M$52,M$54,M$56,M$58,M$60,M$62,M$64,M$66,M$68,M$70,M$72,M$74,M$76,M$78,M$80,M$82,M$84,M$86,M$88,M$90,M$92,M$94,M$96,M$98,M$100,M$102,M$104,M$106,M$108,M$110,M$112,M$114,M$116,M$118,M$120,M$122,M$124)) -> 2 | N24: =RANK(N23,(N$6,N$8,N$10,N$12,N$14,N$16,N$18,N$20,N$22,N$24,N$26,N$28,N$30,N$32,N$34,N$36,N$38,N$40,N$42,N$44,N$46,N$48,N$50,N$52,N$54,N$56,N$58,N$60,N$62,N$64,N$66,N$68,N$70,N$72,N$74,N$76,N$78,N$80,N$82,N$84,N$86,N$88,N$90,N$92,N$94,N$96,N$98,N$100,N$102,N$104,N$106,N$108,N$110,N$112,N$114,N$116,N$118,N$120,N$122,N$124)) -> 1 | P24: =RANK(P23,(P$6,P$8,P$10,P$12,P$14,P$16,P$18,P$20,P$22,P$24,P$26,P$28,P$30,P$32,P$34,P$36,P$38,P$40,P$42,P$44,P$46,P$48,P$50,P$52,P$54,P$56,P$58,P$60,P$62,P$64,P$66,P$68,P$70,P$72,P$74,P$76,P$78,P$80,P$82,P$84,P$86,P$88,P$90,P$92,P$94,P$96,P$98,P$100,P$102,P$104,P$106,P$108,P$110,P$112,P$114,P$116,P$118,P$120,P$122,P$124)) -> 1
A25: Boston | B25: 5 | C25: 15.00 | D25: 15.00 | E25: 30.00 | F25: 14.70 | G25: 15.20 | H25: 14.90 | I25: 22.40 | J25: 14.80 | K25: 14.80 | L25: 15.00 | M25: 22.30 | N25: 74.70 | O25: 0.0 | P25: 74.70
A26: Crusaders | C26: =RANK(C25,(C$6,C$8,C$10,C$12,C$14,C$16,C$18,C$20,C$22,C$24,C$26,C$28,C$30,C$32,C$34,C$36,C$38,C$40,C$42,C$44,C$46,C$48,C$50,C$52,C$54,C$56,C$58,C$60,C$62,C$64,C$66,C$68,C$70,C$72,C$74,C$76,C$78,C$80,C$82,C$84,C$86,C$88,C$90,C$92,C$94,C$96,C$98,C$100,C$102,C$104,C$106,C$108,C$110,C$112,C$114,C$116,C$118,C$120,C$122,C$124)) -> 1 | D26: =RANK(D25,(D$6,D$8,D$10,D$12,D$14,D$16,D$18,D$20,D$22,D$24,D$26,D$28,D$30,D$32,D$34,D$36,D$38,D$40,D$42,D$44,D$46,D$48,D$50,D$52,D$54,D$56,D$58,D$60,D$62,D$64,D$66,D$68,D$70,D$72,D$74,D$76,D$78,D$80,D$82,D$84,D$86,D$88,D$90,D$92,D$94,D$96,D$98,D$100,D$102,D$104,D$106,D$108,D$110,D$112,D$114,D$116,D$118,D$120,D$122,D$124)) -> 2 | E26: =RANK(E25,(E$6,E$8,E$10,E$12,E$14,E$16,E$18,E$20,E$22,E$24,E$26,E$28,E$30,E$32,E$34,E$36,E$38,E$40,E$42,E$44,E$46,E$48,E$50,E$52,E$54,E$56,E$58,E$60,E$62,E$64,E$66,E$68,E$70,E$72,E$74,E$76,E$78,E$80,E$82,E$84,E$86,E$88,E$90,E$92,E$94,E$96,E$98,E$100,E$102,E$104,E$106,E$108,E$110,E$112,E$114,E$116,E$118,E$120,E$122,E$124)) -> 2 | F26: =RANK(F25,(F$6,F$8,F$10,F$12,F$14,F$16,F$18,F$20,F$22,F$24,F$26,F$28,F$30,F$32,F$34,F$36,F$38,F$40,F$42,F$44,F$46,F$48,F$50,F$52,F$54,F$56,F$58,F$60,F$62,F$64,F$66,F$68,F$70,F$72,F$74,F$76,F$78,F$80,F$82,F$84,F$86,F$88,F$90,F$92,F$94,F$96,F$98,F$100,F$102,F$104,F$106,F$108,F$110,F$112,F$114,F$116,F$118,F$120,F$122,F$124)) -> 2 | G26: =RANK(G25,(G$6,G$8,G$10,G$12,G$14,G$16,G$18,G$20,G$22,G$24,G$26,G$28,G$30,G$32,G$34,G$36,G$38,G$40,G$42,G$44,G$46,G$48,G$50,G$52,G$54,G$56,G$58,G$60,G$62,G$64,G$66,G$68,G$70,G$72,G$74,G$76,G$78,G$80,G$82,G$84,G$86,G$88,G$90,G$92,G$94,G$96,G$98,G$100,G$102,G$104,G$106,G$108,G$110,G$112,G$114,G$116,G$118,G$120,G$122,G$124)) -> 1 | H26: =RANK(H25,(H$6,H$8,H$10,H$12,H$14,H$16,H$18,H$20,H$22,H$24,H$26,H$28,H$30,H$32,H$34,H$36,H$38,H$40,H$42,H$44,H$46,H$48,H$50,H$52,H$54,H$56,H$58,H$60,H$62,H$64,H$66,H$68,H$70,H$72,H$74,H$76,H$78,H$80,H$82,H$84,H$86,H$88,H$90,H$92,H$94,H$96,H$98,H$100,H$102,H$104,H$106,H$108,H$110,H$112,H$114,H$116,H$118,H$120,H$122,H$124)) -> 1 | I26: =RANK(I25,(I$6,I$8,I$10,I$12,I$14,I$16,I$18,I$20,I$22,I$24,I$26,I$28,I$30,I$32,I$34,I$36,I$38,I$40,I$42,I$44,I$46,I$48,I$50,I$52,I$54,I$56,I$58,I$60,I$62,I$64,I$66,I$68,I$70,I$72,I$74,I$76,I$78,I$80,I$82,I$84,I$86,I$88,I$90,I$92,I$94,I$96,I$98,I$100,I$102,I$104,I$106,I$108,I$110,I$112,I$114,I$116,I$118,I$120,I$122,I$124)) -> 1 | J26: =RANK(J25,(J$6,J$8,J$10,J$12,J$14,J$16,J$18,J$20,J$22,J$24,J$26,J$28,J$30,J$32,J$34,J$36,J$38,J$40,J$42,J$44,J$46,J$48,J$50,J$52,J$54,J$56,J$58,J$60,J$62,J$64,J$66,J$68,J$70,J$72,J$74,J$76,J$78,J$80,J$82,J$84,J$86,J$88,J$90,J$92,J$94,J$96,J$98,J$100,J$102,J$104,J$106,J$108,J$110,J$112,J$114,J$116,J$118,J$120,J$122,J$124)) -> 2 | K26: =RANK(K25,(K$6,K$8,K$10,K$12,K$14,K$16,K$18,K$20,K$22,K$24,K$26,K$28,K$30,K$32,K$34,K$36,K$38,K$40,K$42,K$44,K$46,K$48,K$50,K$52,K$54,K$56,K$58,K$60,K$62,K$64,K$66,K$68,K$70,K$72,K$74,K$76,K$78,K$80,K$82,K$84,K$86,K$88,K$90,K$92,K$94,K$96,K$98,K$100,K$102,K$104,K$106,K$108,K$110,K$112,K$114,K$116,K$118,K$120,K$122,K$124)) -> 2 | L26: =RANK(L25,(L$6,L$8,L$10,L$12,L$14,L$16,L$18,L$20,L$22,L$24,L$26,L$28,L$30,L$32,L$34,L$36,L$38,L$40,L$42,L$44,L$46,L$48,L$50,L$52,L$54,L$56,L$58,L$60,L$62,L$64,L$66,L$68,L$70,L$72,L$74,L$76,L$78,L$80,L$82,L$84,L$86,L$88,L$90,L$92,L$94,L$96,L$98,L$100,L$102,L$104,L$106,L$108,L$110,L$112,L$114,L$116,L$118,L$120,L$122,L$124)) -> 1 | M26: =RANK(M25,(M$6,M$8,M$10,M$12,M$14,M$16,M$18,M$20,M$22,M$24,M$26,M$28,M$30,M$32,M$34,M$36,M$38,M$40,M$42,M$44,M$46,M$48,M$50,M$52,M$54,M$56,M$58,M$60,M$62,M$64,M$66,M$68,M$70,M$72,M$74,M$76,M$78,M$80,M$82,M$84,M$86,M$88,M$90,M$92,M$94,M$96,M$98,M$100,M$102,M$104,M$106,M$108,M$110,M$112,M$114,M$116,M$118,M$120,M$122,M$124)) -> 1 | N26: =RANK(N25,(N$6,N$8,N$10,N$12,N$14,N$16,N$18,N$20,N$22,N$24,N$26,N$28,N$30,N$32,N$34,N$36,N$38,N$40,N$42,N$44,N$46,N$48,N$50,N$52,N$54,N$56,N$58,N$60,N$62,N$64,N$66,N$68,N$70,N$72,N$74,N$76,N$78,N$80,N$82,N$84,N$86,N$88,N$90,N$92,N$94,N$96,N$98,N$100,N$102,N$104,N$106,N$108,N$110,N$112,N$114,N$116,N$118,N$120,N$122,N$124)) -> 2 | P26: =RANK(P25,(P$6,P$8,P$10,P$12,P$14,P$16,P$18,P$20,P$22,P$24,P$26,P$28,P$30,P$32,P$34,P$36,P$38,P$40,P$42,P$44,P$46,P$48,P$50,P$52,P$54,P$56,P$58,P$60,P$62,P$64,P$66,P$68,P$70,P$72,P$74,P$76,P$78,P$80,P$82,P$84,P$86,P$88,P$90,P$92,P$94,P$96,P$98,P$100,P$102,P$104,P$106,P$108,P$110,P$112,P$114,P$116,P$118,P$120,P$122,P$124)) -> 2
A27: Phantom | B27: 3 | C27: 14.50 | D27: 14.70 | E27: 29.20 | F27: 14.50 | G27: 14.20 | H27: 13.80 | I27: 21.25 | J27: 14.40 | K27: 14.70 | L27: 14.30 | M27: 21.70 | N27: 72.15 | O27: 0.0 | P27: 72.15
A28: Regiment | C28: =RANK(C27,(C$6,C$8,C$10,C$12,C$14,C$16,C$18,C$20,C$22,C$24,C$26,C$28,C$30,C$32,C$34,C$36,C$38,C$40,C$42,C$44,C$46,C$48,C$50,C$52,C$54,C$56,C$58,C$60,C$62,C$64,C$66,C$68,C$70,C$72,C$74,C$76,C$78,C$80,C$82,C$84,C$86,C$88,C$90,C$92,C$94,C$96,C$98,C$100,C$102,C$104,C$106,C$108,C$110,C$112,C$114,C$116,C$118,C$120,C$122,C$124)) -> 3 | D28: =RANK(D27,(D$6,D$8,D$10,D$12,D$14,D$16,D$18,D$20,D$22,D$24,D$26,D$28,D$30,D$32,D$34,D$36,D$38,D$40,D$42,D$44,D$46,D$48,D$50,D$52,D$54,D$56,D$58,D$60,D$62,D$64,D$66,D$68,D$70,D$72,D$74,D$76,D$78,D$80,D$82,D$84,D$86,D$88,D$90,D$92,D$94,D$96,D$98,D$100,D$102,D$104,D$106,D$108,D$110,D$112,D$114,D$116,D$118,D$120,D$122,D$124)) -> 3 | E28: =RANK(E27,(E$6,E$8,E$10,E$12,E$14,E$16,E$18,E$20,E$22,E$24,E$26,E$28,E$30,E$32,E$34,E$36,E$38,E$40,E$42,E$44,E$46,E$48,E$50,E$52,E$54,E$56,E$58,E$60,E$62,E$64,E$66,E$68,E$70,E$72,E$74,E$76,E$78,E$80,E$82,E$84,E$86,E$88,E$90,E$92,E$94,E$96,E$98,E$100,E$102,E$104,E$106,E$108,E$110,E$112,E$114,E$116,E$118,E$120,E$122,E$124)) -> 3 | F28: =RANK(F27,(F$6,F$8,F$10,F$12,F$14,F$16,F$18,F$20,F$22,F$24,F$26,F$28,F$30,F$32,F$34,F$36,F$38,F$40,F$42,F$44,F$46,F$48,F$50,F$52,F$54,F$56,F$58,F$60,F$62,F$64,F$66,F$68,F$70,F$72,F$74,F$76,F$78,F$80,F$82,F$84,F$86,F$88,F$90,F$92,F$94,F$96,F$98,F$100,F$102,F$104,F$106,F$108,F$110,F$112,F$114,F$116,F$118,F$120,F$122,F$124)) -> 3 | G28: =RANK(G27,(G$6,G$8,G$10,G$12,G$14,G$16,G$18,G$20,G$22,G$24,G$26,G$28,G$30,G$32,G$34,G$36,G$38,G$40,G$42,G$44,G$46,G$48,G$50,G$52,G$54,G$56,G$58,G$60,G$62,G$64,G$66,G$68,G$70,G$72,G$74,G$76,G$78,G$80,G$82,G$84,G$86,G$88,G$90,G$92,G$94,G$96,G$98,G$100,G$102,G$104,G$106,G$108,G$110,G$112,G$114,G$116,G$118,G$120,G$122,G$124)) -> 3 | H28: =RANK(H27,(H$6,H$8,H$10,H$12,H$14,H$16,H$18,H$20,H$22,H$24,H$26,H$28,H$30,H$32,H$34,H$36,H$38,H$40,H$42,H$44,H$46,H$48,H$50,H$52,H$54,H$56,H$58,H$60,H$62,H$64,H$66,H$68,H$70,H$72,H$74,H$76,H$78,H$80,H$82,H$84,H$86,H$88,H$90,H$92,H$94,H$96,H$98,H$100,H$102,H$104,H$106,H$108,H$110,H$112,H$114,H$116,H$118,H$120,H$122,H$124)) -> 3 | I28: =RANK(I27,(I$6,I$8,I$10,I$12,I$14,I$16,I$18,I$20,I$22,I$24,I$26,I$28,I$30,I$32,I$34,I$36,I$38,I$40,I$42,I$44,I$46,I$48,I$50,I$52,I$54,I$56,I$58,I$60,I$62,I$64,I$66,I$68,I$70,I$72,I$74,I$76,I$78,I$80,I$82,I$84,I$86,I$88,I$90,I$92,I$94,I$96,I$98,I$100,I$102,I$104,I$106,I$108,I$110,I$112,I$114,I$116,I$118,I$120,I$122,I$124)) -> 3 | J28: =RANK(J27,(J$6,J$8,J$10,J$12,J$14,J$16,J$18,J$20,J$22,J$24,J$26,J$28,J$30,J$32,J$34,J$36,J$38,J$40,J$42,J$44,J$46,J$48,J$50,J$52,J$54,J$56,J$58,J$60,J$62,J$64,J$66,J$68,J$70,J$72,J$74,J$76,J$78,J$80,J$82,J$84,J$86,J$88,J$90,J$92,J$94,J$96,J$98,J$100,J$102,J$104,J$106,J$108,J$110,J$112,J$114,J$116,J$118,J$120,J$122,J$124)) -> 3 | K28: =RANK(K27,(K$6,K$8,K$10,K$12,K$14,K$16,K$18,K$20,K$22,K$24,K$26,K$28,K$30,K$32,K$34,K$36,K$38,K$40,K$42,K$44,K$46,K$48,K$50,K$52,K$54,K$56,K$58,K$60,K$62,K$64,K$66,K$68,K$70,K$72,K$74,K$76,K$78,K$80,K$82,K$84,K$86,K$88,K$90,K$92,K$94,K$96,K$98,K$100,K$102,K$104,K$106,K$108,K$110,K$112,K$114,K$116,K$118,K$120,K$122,K$124)) -> 3 | L28: =RANK(L27,(L$6,L$8,L$10,L$12,L$14,L$16,L$18,L$20,L$22,L$24,L$26,L$28,L$30,L$32,L$34,L$36,L$38,L$40,L$42,L$44,L$46,L$48,L$50,L$52,L$54,L$56,L$58,L$60,L$62,L$64,L$66,L$68,L$70,L$72,L$74,L$76,L$78,L$80,L$82,L$84,L$86,L$88,L$90,L$92,L$94,L$96,L$98,L$100,L$102,L$104,L$106,L$108,L$110,L$112,L$114,L$116,L$118,L$120,L$122,L$124)) -> 2 | M28: =RANK(M27,(M$6,M$8,M$10,M$12,M$14,M$16,M$18,M$20,M$22,M$24,M$26,M$28,M$30,M$32,M$34,M$36,M$38,M$40,M$42,M$44,M$46,M$48,M$50,M$52,M$54,M$56,M$58,M$60,M$62,M$64,M$66,M$68,M$70,M$72,M$74,M$76,M$78,M$80,M$82,M$84,M$86,M$88,M$90,M$92,M$94,M$96,M$98,M$100,M$102,M$104,M$106,M$108,M$110,M$112,M$114,M$116,M$118,M$120,M$122,M$124)) -> 3 | N28: =RANK(N27,(N$6,N$8,N$10,N$12,N$14,N$16,N$18,N$20,N$22,N$24,N$26,N$28,N$30,N$32,N$34,N$36,N$38,N$40,N$42,N$44,N$46,N$48,N$50,N$52,N$54,N$56,N$58,N$60,N$62,N$64,N$66,N$68,N$70,N$72,N$74,N$76,N$78,N$80,N$82,N$84,N$86,N$88,N$90,N$92,N$94,N$96,N$98,N$100,N$102,N$104,N$106,N$108,N$110,N$112,N$114,N$116,N$118,N$120,N$122,N$124)) -> 3 | P28: =RANK(P27,(P$6,P$8,P$10,P$12,P$14,P$16,P$18,P$20,P$22,P$24,P$26,P$28,P$30,P$32,P$34,P$36,P$38,P$40,P$42,P$44,P$46,P$48,P$50,P$52,P$54,P$56,P$58,P$60,P$62,P$64,P$66,P$68,P$70,P$72,P$74,P$76,P$78,P$80,P$82,P$84,P$86,P$88,P$90,P$92,P$94,P$96,P$98,P$100,P$102,P$104,P$106,P$108,P$110,P$112,P$114,P$116,P$118,P$120,P$122,P$124)) -> 3
A29: Cavaliers | B29: 2 | C29: 13.70 | D29: 14.10 | E29: 27.80 | F29: 14.00 | G29: 13.40 | H29: 13.10 | I29: 20.25 | J29: 13.70 | K29: 14.30 | L29: 14.10 | M29: 21.05 | N29: 69.10 | O29: 0.0 | P29: 69.10
C30: =RANK(C29,(C$6,C$8,C$10,C$12,C$14,C$16,C$18,C$20,C$22,C$24,C$26,C$28,C$30,C$32,C$34,C$36,C$38,C$40,C$42,C$44,C$46,C$48,C$50,C$52,C$54,C$56,C$58,C$60,C$62,C$64,C$66,C$68,C$70,C$72,C$74,C$76,C$78,C$80,C$82,C$84,C$86,C$88,C$90,C$92,C$94,C$96,C$98,C$100,C$102,C$104,C$106,C$108,C$110,C$112,C$114,C$116,C$118,C$120,C$122,C$124)) -> 4 | D30: =RANK(D29,(D$6,D$8,D$10,D$12,D$14,D$16,D$18,D$20,D$22,D$24,D$26,D$28,D$30,D$32,D$34,D$36,D$38,D$40,D$42,D$44,D$46,D$48,D$50,D$52,D$54,D$56,D$58,D$60,D$62,D$64,D$66,D$68,D$70,D$72,D$74,D$76,D$78,D$80,D$82,D$84,D$86,D$88,D$90,D$92,D$94,D$96,D$98,D$100,D$102,D$104,D$106,D$108,D$110,D$112,D$114,D$116,D$118,D$120,D$122,D$124)) -> 4 | E30: =RANK(E29,(E$6,E$8,E$10,E$12,E$14,E$16,E$18,E$20,E$22,E$24,E$26,E$28,E$30,E$32,E$34,E$36,E$38,E$40,E$42,E$44,E$46,E$48,E$50,E$52,E$54,E$56,E$58,E$60,E$62,E$64,E$66,E$68,E$70,E$72,E$74,E$76,E$78,E$80,E$82,E$84,E$86,E$88,E$90,E$92,E$94,E$96,E$98,E$100,E$102,E$104,E$106,E$108,E$110,E$112,E$114,E$116,E$118,E$120,E$122,E$124)) -> 4 | F30: =RANK(F29,(F$6,F$8,F$10,F$12,F$14,F$16,F$18,F$20,F$22,F$24,F$26,F$28,F$30,F$32,F$34,F$36,F$38,F$40,F$42,F$44,F$46,F$48,F$50,F$52,F$54,F$56,F$58,F$60,F$62,F$64,F$66,F$68,F$70,F$72,F$74,F$76,F$78,F$80,F$82,F$84,F$86,F$88,F$90,F$92,F$94,F$96,F$98,F$100,F$102,F$104,F$106,F$108,F$110,F$112,F$114,F$116,F$118,F$120,F$122,F$124)) -> 4 | G30: =RANK(G29,(G$6,G$8,G$10,G$12,G$14,G$16,G$18,G$20,G$22,G$24,G$26,G$28,G$30,G$32,G$34,G$36,G$38,G$40,G$42,G$44,G$46,G$48,G$50,G$52,G$54,G$56,G$58,G$60,G$62,G$64,G$66,G$68,G$70,G$72,G$74,G$76,G$78,G$80,G$82,G$84,G$86,G$88,G$90,G$92,G$94,G$96,G$98,G$100,G$102,G$104,G$106,G$108,G$110,G$112,G$114,G$116,G$118,G$120,G$122,G$124)) -> 4 | H30: =RANK(H29,(H$6,H$8,H$10,H$12,H$14,H$16,H$18,H$20,H$22,H$24,H$26,H$28,H$30,H$32,H$34,H$36,H$38,H$40,H$42,H$44,H$46,H$48,H$50,H$52,H$54,H$56,H$58,H$60,H$62,H$64,H$66,H$68,H$70,H$72,H$74,H$76,H$78,H$80,H$82,H$84,H$86,H$88,H$90,H$92,H$94,H$96,H$98,H$100,H$102,H$104,H$106,H$108,H$110,H$112,H$114,H$116,H$118,H$120,H$122,H$124)) -> 5 | I30: =RANK(I29,(I$6,I$8,I$10,I$12,I$14,I$16,I$18,I$20,I$22,I$24,I$26,I$28,I$30,I$32,I$34,I$36,I$38,I$40,I$42,I$44,I$46,I$48,I$50,I$52,I$54,I$56,I$58,I$60,I$62,I$64,I$66,I$68,I$70,I$72,I$74,I$76,I$78,I$80,I$82,I$84,I$86,I$88,I$90,I$92,I$94,I$96,I$98,I$100,I$102,I$104,I$106,I$108,I$110,I$112,I$114,I$116,I$118,I$120,I$122,I$124)) -> 4 | J30: =RANK(J29,(J$6,J$8,J$10,J$12,J$14,J$16,J$18,J$20,J$22,J$24,J$26,J$28,J$30,J$32,J$34,J$36,J$38,J$40,J$42,J$44,J$46,J$48,J$50,J$52,J$54,J$56,J$58,J$60,J$62,J$64,J$66,J$68,J$70,J$72,J$74,J$76,J$78,J$80,J$82,J$84,J$86,J$88,J$90,J$92,J$94,J$96,J$98,J$100,J$102,J$104,J$106,J$108,J$110,J$112,J$114,J$116,J$118,J$120,J$122,J$124)) -> 4 | K30: =RANK(K29,(K$6,K$8,K$10,K$12,K$14,K$16,K$18,K$20,K$22,K$24,K$26,K$28,K$30,K$32,K$34,K$36,K$38,K$40,K$42,K$44,K$46,K$48,K$50,K$52,K$54,K$56,K$58,K$60,K$62,K$64,K$66,K$68,K$70,K$72,K$74,K$76,K$78,K$80,K$82,K$84,K$86,K$88,K$90,K$92,K$94,K$96,K$98,K$100,K$102,K$104,K$106,K$108,K$110,K$112,K$114,K$116,K$118,K$120,K$122,K$124)) -> 4 | L30: =RANK(L29,(L$6,L$8,L$10,L$12,L$14,L$16,L$18,L$20,L$22,L$24,L$26,L$28,L$30,L$32,L$34,L$36,L$38,L$40,L$42,L$44,L$46,L$48,L$50,L$52,L$54,L$56,L$58,L$60,L$62,L$64,L$66,L$68,L$70,L$72,L$74,L$76,L$78,L$80,L$82,L$84,L$86,L$88,L$90,L$92,L$94,L$96,L$98,L$100,L$102,L$104,L$106,L$108,L$110,L$112,L$114,L$116,L$118,L$120,L$122,L$124)) -> 4 | M30: =RANK(M29,(M$6,M$8,M$10,M$12,M$14,M$16,M$18,M$20,M$22,M$24,M$26,M$28,M$30,M$32,M$34,M$36,M$38,M$40,M$42,M$44,M$46,M$48,M$50,M$52,M$54,M$56,M$58,M$60,M$62,M$64,M$66,M$68,M$70,M$72,M$74,M$76,M$78,M$80,M$82,M$84,M$86,M$88,M$90,M$92,M$94,M$96,M$98,M$100,M$102,M$104,M$106,M$108,M$110,M$112,M$114,M$116,M$118,M$120,M$122,M$124)) -> 4 | N30: =RANK(N29,(N$6,N$8,N$10,N$12,N$14,N$16,N$18,N$20,N$22,N$24,N$26,N$28,N$30,N$32,N$34,N$36,N$38,N$40,N$42,N$44,N$46,N$48,N$50,N$52,N$54,N$56,N$58,N$60,N$62,N$64,N$66,N$68,N$70,N$72,N$74,N$76,N$78,N$80,N$82,N$84,N$86,N$88,N$90,N$92,N$94,N$96,N$98,N$100,N$102,N$104,N$106,N$108,N$110,N$112,N$114,N$116,N$118,N$120,N$122,N$124)) -> 4 | P30: =RANK(P29,(P$6,P$8,P$10,P$12,P$14,P$16,P$18,P$20,P$22,P$24,P$26,P$28,P$30,P$32,P$34,P$36,P$38,P$40,P$42,P$44,P$46,P$48,P$50,P$52,P$54,P$56,P$58,P$60,P$62,P$64,P$66,P$68,P$70,P$72,P$74,P$76,P$78,P$80,P$82,P$84,P$86,P$88,P$90,P$92,P$94,P$96,P$98,P$100,P$102,P$104,P$106,P$108,P$110,P$112,P$114,P$116,P$118,P$120,P$122,P$124)) -> 4
A31: Blue | B31: 1 | C31: 13.40 | D31: 13.80 | E31: 27.20 | F31: 13.20 | G31: 13.30 | H31: 13.50 | I31: 20.00 | J31: 13.30 | K31: 13.80 | L31: 12.90 | M31: 20.00 | N31: 67.20 | O31: 0.0 | P31: 67.20
A32: Stars | C32: =RANK(C31,(C$6,C$8,C$10,C$12,C$14,C$16,C$18,C$20,C$22,C$24,C$26,C$28,C$30,C$32,C$34,C$36,C$38,C$40,C$42,C$44,C$46,C$48,C$50,C$52,C$54,C$56,C$58,C$60,C$62,C$64,C$66,C$68,C$70,C$72,C$74,C$76,C$78,C$80,C$82,C$84,C$86,C$88,C$90,C$92,C$94,C$96,C$98,C$100,C$102,C$104,C$106,C$108,C$110,C$112,C$114,C$116,C$118,C$120,C$122,C$124)) -> 6 | D32: =RANK(D31,(D$6,D$8,D$10,D$12,D$14,D$16,D$18,D$20,D$22,D$24,D$26,D$28,D$30,D$32,D$34,D$36,D$38,D$40,D$42,D$44,D$46,D$48,D$50,D$52,D$54,D$56,D$58,D$60,D$62,D$64,D$66,D$68,D$70,D$72,D$74,D$76,D$78,D$80,D$82,D$84,D$86,D$88,D$90,D$92,D$94,D$96,D$98,D$100,D$102,D$104,D$106,D$108,D$110,D$112,D$114,D$116,D$118,D$120,D$122,D$124)) -> 5 | E32: =RANK(E31,(E$6,E$8,E$10,E$12,E$14,E$16,E$18,E$20,E$22,E$24,E$26,E$28,E$30,E$32,E$34,E$36,E$38,E$40,E$42,E$44,E$46,E$48,E$50,E$52,E$54,E$56,E$58,E$60,E$62,E$64,E$66,E$68,E$70,E$72,E$74,E$76,E$78,E$80,E$82,E$84,E$86,E$88,E$90,E$92,E$94,E$96,E$98,E$100,E$102,E$104,E$106,E$108,E$110,E$112,E$114,E$116,E$118,E$120,E$122,E$124)) -> 5 | F32: =RANK(F31,(F$6,F$8,F$10,F$12,F$14,F$16,F$18,F$20,F$22,F$24,F$26,F$28,F$30,F$32,F$34,F$36,F$38,F$40,F$42,F$44,F$46,F$48,F$50,F$52,F$54,F$56,F$58,F$60,F$62,F$64,F$66,F$68,F$70,F$72,F$74,F$76,F$78,F$80,F$82,F$84,F$86,F$88,F$90,F$92,F$94,F$96,F$98,F$100,F$102,F$104,F$106,F$108,F$110,F$112,F$114,F$116,F$118,F$120,F$122,F$124)) -> 6 | G32: =RANK(G31,(G$6,G$8,G$10,G$12,G$14,G$16,G$18,G$20,G$22,G$24,G$26,G$28,G$30,G$32,G$34,G$36,G$38,G$40,G$42,G$44,G$46,G$48,G$50,G$52,G$54,G$56,G$58,G$60,G$62,G$64,G$66,G$68,G$70,G$72,G$74,G$76,G$78,G$80,G$82,G$84,G$86,G$88,G$90,G$92,G$94,G$96,G$98,G$100,G$102,G$104,G$106,G$108,G$110,G$112,G$114,G$116,G$118,G$120,G$122,G$124)) -> 5 | H32: =RANK(H31,(H$6,H$8,H$10,H$12,H$14,H$16,H$18,H$20,H$22,H$24,H$26,H$28,H$30,H$32,H$34,H$36,H$38,H$40,H$42,H$44,H$46,H$48,H$50,H$52,H$54,H$56,H$58,H$60,H$62,H$64,H$66,H$68,H$70,H$72,H$74,H$76,H$78,H$80,H$82,H$84,H$86,H$88,H$90,H$92,H$94,H$96,H$98,H$100,H$102,H$104,H$106,H$108,H$110,H$112,H$114,H$116,H$118,H$120,H$122,H$124)) -> 4 | I32: =RANK(I31,(I$6,I$8,I$10,I$12,I$14,I$16,I$18,I$20,I$22,I$24,I$26,I$28,I$30,I$32,I$34,I$36,I$38,I$40,I$42,I$44,I$46,I$48,I$50,I$52,I$54,I$56,I$58,I$60,I$62,I$64,I$66,I$68,I$70,I$72,I$74,I$76,I$78,I$80,I$82,I$84,I$86,I$88,I$90,I$92,I$94,I$96,I$98,I$100,I$102,I$104,I$106,I$108,I$110,I$112,I$114,I$116,I$118,I$120,I$122,I$124)) -> 5 | J32: =RANK(J31,(J$6,J$8,J$10,J$12,J$14,J$16,J$18,J$20,J$22,J$24,J$26,J$28,J$30,J$32,J$34,J$36,J$38,J$40,J$42,J$44,J$46,J$48,J$50,J$52,J$54,J$56,J$58,J$60,J$62,J$64,J$66,J$68,J$70,J$72,J$74,J$76,J$78,J$80,J$82,J$84,J$86,J$88,J$90,J$92,J$94,J$96,J$98,J$100,J$102,J$104,J$106,J$108,J$110,J$112,J$114,J$116,J$118,J$120,J$122,J$124)) -> 6 | K32: =RANK(K31,(K$6,K$8,K$10,K$12,K$14,K$16,K$18,K$20,K$22,K$24,K$26,K$28,K$30,K$32,K$34,K$36,K$38,K$40,K$42,K$44,K$46,K$48,K$50,K$52,K$54,K$56,K$58,K$60,K$62,K$64,K$66,K$68,K$70,K$72,K$74,K$76,K$78,K$80,K$82,K$84,K$86,K$88,K$90,K$92,K$94,K$96,K$98,K$100,K$102,K$104,K$106,K$108,K$110,K$112,K$114,K$116,K$118,K$120,K$122,K$124)) -> 5 | L32: =RANK(L31,(L$6,L$8,L$10,L$12,L$14,L$16,L$18,L$20,L$22,L$24,L$26,L$28,L$30,L$32,L$34,L$36,L$38,L$40,L$42,L$44,L$46,L$48,L$50,L$52,L$54,L$56,L$58,L$60,L$62,L$64,L$66,L$68,L$70,L$72,L$74,L$76,L$78,L$80,L$82,L$84,L$86,L$88,L$90,L$92,L$94,L$96,L$98,L$100,L$102,L$104,L$106,L$108,L$110,L$112,L$114,L$116,L$118,L$120,L$122,L$124)) -> 6 | M32: =RANK(M31,(M$6,M$8,M$10,M$12,M$14,M$16,M$18,M$20,M$22,M$24,M$26,M$28,M$30,M$32,M$34,M$36,M$38,M$40,M$42,M$44,M$46,M$48,M$50,M$52,M$54,M$56,M$58,M$60,M$62,M$64,M$66,M$68,M$70,M$72,M$74,M$76,M$78,M$80,M$82,M$84,M$86,M$88,M$90,M$92,M$94,M$96,M$98,M$100,M$102,M$104,M$106,M$108,M$110,M$112,M$114,M$116,M$118,M$120,M$122,M$124)) -> 6 | N32: =RANK(N31,(N$6,N$8,N$10,N$12,N$14,N$16,N$18,N$20,N$22,N$24,N$26,N$28,N$30,N$32,N$34,N$36,N$38,N$40,N$42,N$44,N$46,N$48,N$50,N$52,N$54,N$56,N$58,N$60,N$62,N$64,N$66,N$68,N$70,N$72,N$74,N$76,N$78,N$80,N$82,N$84,N$86,N$88,N$90,N$92,N$94,N$96,N$98,N$100,N$102,N$104,N$106,N$108,N$110,N$112,N$114,N$116,N$118,N$120,N$122,N$124)) -> 5 | P32: =RANK(P31,(P$6,P$8,P$10,P$12,P$14,P$16,P$18,P$20,P$22,P$24,P$26,P$28,P$30,P$32,P$34,P$36,P$38,P$40,P$42,P$44,P$46,P$48,P$50,P$52,P$54,P$56,P$58,P$60,P$62,P$64,P$66,P$68,P$70,P$72,P$74,P$76,P$78,P$80,P$82,P$84,P$86,P$88,P$90,P$92,P$94,P$96,P$98,P$100,P$102,P$104,P$106,P$108,P$110,P$112,P$114,P$116,P$118,P$120,P$122,P$124)) -> 5
A33: Colts | B33: 4 | C33: 13.50 | D33: 13.60 | E33: 27.10 | F33: 13.40 | G33: 13.00 | H33: 12.90 | I33: 19.65 | J33: 13.40 | K33: 13.60 | L33: 13.70 | M33: 20.35 | N33: 67.10 | O33: 0.0 | P33: 67.10
C34: =RANK(C33,(C$6,C$8,C$10,C$12,C$14,C$16,C$18,C$20,C$22,C$24,C$26,C$28,C$30,C$32,C$34,C$36,C$38,C$40,C$42,C$44,C$46,C$48,C$50,C$52,C$54,C$56,C$58,C$60,C$62,C$64,C$66,C$68,C$70,C$72,C$74,C$76,C$78,C$80,C$82,C$84,C$86,C$88,C$90,C$92,C$94,C$96,C$98,C$100,C$102,C$104,C$106,C$108,C$110,C$112,C$114,C$116,C$118,C$120,C$122,C$124)) -> 5 | D34: =RANK(D33,(D$6,D$8,D$10,D$12,D$14,D$16,D$18,D$20,D$22,D$24,D$26,D$28,D$30,D$32,D$34,D$36,D$38,D$40,D$42,D$44,D$46,D$48,D$50,D$52,D$54,D$56,D$58,D$60,D$62,D$64,D$66,D$68,D$70,D$72,D$74,D$76,D$78,D$80,D$82,D$84,D$86,D$88,D$90,D$92,D$94,D$96,D$98,D$100,D$102,D$104,D$106,D$108,D$110,D$112,D$114,D$116,D$118,D$120,D$122,D$124)) -> 6 | E34: =RANK(E33,(E$6,E$8,E$10,E$12,E$14,E$16,E$18,E$20,E$22,E$24,E$26,E$28,E$30,E$32,E$34,E$36,E$38,E$40,E$42,E$44,E$46,E$48,E$50,E$52,E$54,E$56,E$58,E$60,E$62,E$64,E$66,E$68,E$70,E$72,E$74,E$76,E$78,E$80,E$82,E$84,E$86,E$88,E$90,E$92,E$94,E$96,E$98,E$100,E$102,E$104,E$106,E$108,E$110,E$112,E$114,E$116,E$118,E$120,E$122,E$124)) -> 6 | F34: =RANK(F33,(F$6,F$8,F$10,F$12,F$14,F$16,F$18,F$20,F$22,F$24,F$26,F$28,F$30,F$32,F$34,F$36,F$38,F$40,F$42,F$44,F$46,F$48,F$50,F$52,F$54,F$56,F$58,F$60,F$62,F$64,F$66,F$68,F$70,F$72,F$74,F$76,F$78,F$80,F$82,F$84,F$86,F$88,F$90,F$92,F$94,F$96,F$98,F$100,F$102,F$104,F$106,F$108,F$110,F$112,F$114,F$116,F$118,F$120,F$122,F$124)) -> 5 | G34: =RANK(G33,(G$6,G$8,G$10,G$12,G$14,G$16,G$18,G$20,G$22,G$24,G$26,G$28,G$30,G$32,G$34,G$36,G$38,G$40,G$42,G$44,G$46,G$48,G$50,G$52,G$54,G$56,G$58,G$60,G$62,G$64,G$66,G$68,G$70,G$72,G$74,G$76,G$78,G$80,G$82,G$84,G$86,G$88,G$90,G$92,G$94,G$96,G$98,G$100,G$102,G$104,G$106,G$108,G$110,G$112,G$114,G$116,G$118,G$120,G$122,G$124)) -> 6 | H34: =RANK(H33,(H$6,H$8,H$10,H$12,H$14,H$16,H$18,H$20,H$22,H$24,H$26,H$28,H$30,H$32,H$34,H$36,H$38,H$40,H$42,H$44,H$46,H$48,H$50,H$52,H$54,H$56,H$58,H$60,H$62,H$64,H$66,H$68,H$70,H$72,H$74,H$76,H$78,H$80,H$82,H$84,H$86,H$88,H$90,H$92,H$94,H$96,H$98,H$100,H$102,H$104,H$106,H$108,H$110,H$112,H$114,H$116,H$118,H$120,H$122,H$124)) -> 6 | I34: =RANK(I33,(I$6,I$8,I$10,I$12,I$14,I$16,I$18,I$20,I$22,I$24,I$26,I$28,I$30,I$32,I$34,I$36,I$38,I$40,I$42,I$44,I$46,I$48,I$50,I$52,I$54,I$56,I$58,I$60,I$62,I$64,I$66,I$68,I$70,I$72,I$74,I$76,I$78,I$80,I$82,I$84,I$86,I$88,I$90,I$92,I$94,I$96,I$98,I$100,I$102,I$104,I$106,I$108,I$110,I$112,I$114,I$116,I$118,I$120,I$122,I$124)) -> 6 | J34: =RANK(J33,(J$6,J$8,J$10,J$12,J$14,J$16,J$18,J$20,J$22,J$24,J$26,J$28,J$30,J$32,J$34,J$36,J$38,J$40,J$42,J$44,J$46,J$48,J$50,J$52,J$54,J$56,J$58,J$60,J$62,J$64,J$66,J$68,J$70,J$72,J$74,J$76,J$78,J$80,J$82,J$84,J$86,J$88,J$90,J$92,J$94,J$96,J$98,J$100,J$102,J$104,J$106,J$108,J$110,J$112,J$114,J$116,J$118,J$120,J$122,J$124)) -> 5 | K34: =RANK(K33,(K$6,K$8,K$10,K$12,K$14,K$16,K$18,K$20,K$22,K$24,K$26,K$28,K$30,K$32,K$34,K$36,K$38,K$40,K$42,K$44,K$46,K$48,K$50,K$52,K$54,K$56,K$58,K$60,K$62,K$64,K$66,K$68,K$70,K$72,K$74,K$76,K$78,K$80,K$82,K$84,K$86,K$88,K$90,K$92,K$94,K$96,K$98,K$100,K$102,K$104,K$106,K$108,K$110,K$112,K$114,K$116,K$118,K$120,K$122,K$124)) -> 6 | L34: =RANK(L33,(L$6,L$8,L$10,L$12,L$14,L$16,L$18,L$20,L$22,L$24,L$26,L$28,L$30,L$32,L$34,L$36,L$38,L$40,L$42,L$44,L$46,L$48,L$50,L$52,L$54,L$56,L$58,L$60,L$62,L$64,L$66,L$68,L$70,L$72,L$74,L$76,L$78,L$80,L$82,L$84,L$86,L$88,L$90,L$92,L$94,L$96,L$98,L$100,L$102,L$104,L$106,L$108,L$110,L$112,L$114,L$116,L$118,L$120,L$122,L$124)) -> 5 | M34: =RANK(M33,(M$6,M$8,M$10,M$12,M$14,M$16,M$18,M$20,M$22,M$24,M$26,M$28,M$30,M$32,M$34,M$36,M$38,M$40,M$42,M$44,M$46,M$48,M$50,M$52,M$54,M$56,M$58,M$60,M$62,M$64,M$66,M$68,M$70,M$72,M$74,M$76,M$78,M$80,M$82,M$84,M$86,M$88,M$90,M$92,M$94,M$96,M$98,M$100,M$102,M$104,M$106,M$108,M$110,M$112,M$114,M$116,M$118,M$120,M$122,M$124)) -> 5 | N34: =RANK(N33,(N$6,N$8,N$10,N$12,N$14,N$16,N$18,N$20,N$22,N$24,N$26,N$28,N$30,N$32,N$34,N$36,N$38,N$40,N$42,N$44,N$46,N$48,N$50,N$52,N$54,N$56,N$58,N$60,N$62,N$64,N$66,N$68,N$70,N$72,N$74,N$76,N$78,N$80,N$82,N$84,N$86,N$88,N$90,N$92,N$94,N$96,N$98,N$100,N$102,N$104,N$106,N$108,N$110,N$112,N$114,N$116,N$118,N$120,N$122,N$124)) -> 6 | P34: =RANK(P33,(P$6,P$8,P$10,P$12,P$14,P$16,P$18,P$20,P$22,P$24,P$26,P$28,P$30,P$32,P$34,P$36,P$38,P$40,P$42,P$44,P$46,P$48,P$50,P$52,P$54,P$56,P$58,P$60,P$62,P$64,P$66,P$68,P$70,P$72,P$74,P$76,P$78,P$80,P$82,P$84,P$86,P$88,P$90,P$92,P$94,P$96,P$98,P$100,P$102,P$104,P$106,P$108,P$110,P$112,P$114,P$116,P$118,P$120,P$122,P$124)) -> 6
A37: 6/28/2024 Walnut, California
C38: General Effect | F38: Visual | J38: Music
C39: 1 | D39: 2 | F39: Proficiency | G39: Analysis | H39: Color Guard | J39: Brass | K39: Analysis | L39: Percussion | N39: Sub | P39: Total
C40: D. Padilla | D40: C. Rothe | E40: Total | F40: R. Solomon | G40: C. Costanza | H40: G. Llacer | I40: Total ÷2 | J40: P. Haines | K40: W. Dillon | L40: C. Romanowski | M40: Total ÷2 | N40: Total | O40: Pen | P40: Score
A41: DCI World Class | C41: 20 | D41: 20 | E41: 40 | F41: 20 | G41: 20 | H41: 20 | I41: 30 | J41: 20 | K41: 20 | L41: 20 | M41: 30 | N41: 100 | P41: 100
A42: Blue | B42: 3 | C42: 15.50 | D42: 15.50 | E42: 31.00 | F42: 15.10 | G42: 15.20 | H42: 15.20 | I42: 22.75 | J42: 15.10 | K42: 15.20 | L42: 15.40 | M42: 22.85 | N42: 76.60 | O42: 0.0 | P42: 76.60
A43: Devils | C43: 1 | D43: 1 | E43: 1 | F43: 1 | G43: 1 | H43: 1 | I43: 1 | J43: 1 | K43: 1 | L43: 1 | M43: 1 | N43: 1 | P43: 1
A44: Vanguard | B44: 1 | C44: 14.40 | D44: 15.00 | E44: 29.40 | F44: 14.50 | G44: 14.20 | H44: 14.10 | I44: 21.40 | J44: 14.60 | K44: 13.80 | L44: 15.30 | M44: 21.85 | N44: 72.65 | O44: 0.0 | P44: 72.65
C45: 3 | D45: 2 | E45: 2 | F45: 2 | G45: 3 | H45: 3 | I45: 3 | J45: 2 | K45: 2 | L45: 2 | M45: 2 | N45: 2 | P45: 2
A46: Mandarins | B46: 2 | C46: 14.80 | D46: 14.50 | E46: 29.30 | F46: 14.10 | G46: 14.40 | H46: 14.40 | I46: 21.45 | J46: 14.20 | K46: 13.40 | L46: 14.20 | M46: 20.90 | N46: 71.65 | O46: 0.0 | P46: 71.65
C47: 2 | D47: 3 | E47: 3 | F47: 3 | G47: 2 | H47: 2 | I47: 2 | J47: 3 | K47: 3 | L47: 3 | M47: 3 | N47: 3 | P47: 3
A48: Pacific | B48: 4 | C48: 13.00 | D48: 13.00 | E48: 26.00 | F48: 12.40 | G48: 12.50 | H48: 12.80 | I48: 18.85 | J48: 12.70 | K48: 12.70 | L48: 13.50 | M48: 19.45 | N48: 64.30 | O48: 0.0 | P48: 64.30
A49: Crest | C49: 4 | D49: 4 | E49: 4 | F49: 4 | G49: 5 | H49: 4 | I49: 4 | J49: 4 | K49: 4 | L49: 4 | M49: 4 | N49: 4 | P49: 4
A50: DCI Open Class
A51: Blue | B51: 3 | C51: 12.40 | D51: 12.30 | E51: 24.70 | F51: 12.20 | G51: 12.80 | H51: 11.80 | I51: 18.40 | J51: 12.40 | K51: 12.50 | L51: 12.80 | M51: 18.85 | N51: 61.95 | O51: 0.0 | P51: 61.95
A52: Devils B | C52: 1 | D52: 1 | E52: 1 | F52: 1 | G52: 1 | H52: 1 | I52: 1 | J52: 1 | K52: 1 | L52: 1 | M52: 1 | N52: 1 | P52: 1
A53: Gold | B53: 4 | C53: 12.10 | D53: 11.80 | E53: 23.90 | F53: 11.40 | G53: 11.10 | H53: 11.40 | I53: 16.95 | J53: 11.90 | K53: 12.20 | L53: 12.20 | M53: 18.15 | N53: 59.00 | O53: 0.0 | P53: 59.00
C54: 2 | D54: 2 | E54: 2 | F54: 2 | G54: 2 | H54: 2 | I54: 2 | J54: 2 | K54: 2 | L54: 2 | M54: 2 | N54: 2 | P54: 2
A55: Impulse | B55: 2 | C55: 11.00 | D55: 10.50 | E55: 21.50 | F55: 10.20 | G55: 9.80 | H55: 10.70 | I55: 15.35 | J55: 10.30 | K55: 9.80 | L55: 10.20 | M55: 15.15 | N55: 52.00 | O55: 0.0 | P55: 52.00
C56: 3 | D56: 3 | E56: 3 | F56: 3 | G56: 3 | H56: 3 | I56: 3 | J56: 3 | K56: 3 | L56: 4 | M56: 4 | N56: 3 | P56: 3
A57: Vessel | B57: 1 | C57: 10.30 | D57: 9.90 | E57: 20.20 | F57: 9.70 | G57: 9.50 | H57: 9.50 | I57: 14.35 | J57: 9.70 | K57: 9.40 | L57: 11.50 | M57: 15.30 | N57: 49.85 | O57: 0.0 | P57: 49.85
C58: 4 | D58: 4 | E58: 4 | F58: 4 | G58: 4 | H58: 4 | I58: 4 | J58: 4 | K58: 4 | L58: 3 | M58: 3 | N58: 4 | P58: 4
A59: Blue | B59: 5 | C59: 10.00 | D59: 9.60 | E59: 19.60 | F59: 9.00 | G59: 8.60 | H59: 9.30 | I59: 13.45 | J59: 9.10 | K59: 8.80 | L59: 9.40 | M59: 13.65 | N59: 46.70 | O59: 0.0 | P59: 46.70
A60: Devils C | C60: 5 | D60: 5 | E60: 5 | F60: 5 | G60: 5 | H60: 5 | I60: 5 | J60: 5 | K60: 5 | L60: 5 | M60: 5 | N60: 5 | P60: 5
A63: 6/29/2024 Shelton, Connecticut
C64: General Effect | F64: Visual | J64: Music
C65: 1 | D65: 2 | F65: Proficiency | G65: Analysis | H65: Color Guard | J65: Brass | K65: Analysis | L65: Percussion | N65: Sub | P65: Total
C66: C. Raichle | D66: D. Orser | E66: Total | F66: S. Adamo | G66: M. Thomson | H66: H. Nguyen | I66: Total ÷2 | J66: B. Fabrizio | K66: C. Poole | L66: P. Furnari | M66: Total ÷2 | N66: Total | O66: Pen | P66: Score
A67: DCI Open Class | C67: 20 | D67: 20 | E67: 40 | F67: 20 | G67: 20 | H67: 20 | I67: 30 | J67: 20 | K67: 20 | L67: 20 | M67: 30 | N67: 100 | P67: 100
A68: Spartans | B68: 2 | C68: 12.60 | D68: 12.50 | E68: 25.10 | F68: 10.10 | G68: 13.20 | H68: 11.80 | I68: 17.55 | J68: 10.40 | K68: 12.80 | L68: 12.30 | M68: 17.75 | N68: 60.40 | O68: 0.0 | P68: 60.40
C69: 1 | D69: 1 | E69: 1 | F69: 1 | G69: 1 | H69: 1 | I69: 1 | J69: 1 | K69: 1 | L69: 1 | M69: 1 | N69: 1 | P69: 1
A70: 7th | B70: 1 | C70: 11.10 | D70: 11.20 | E70: 22.30 | F70: 8.80 | G70: 12.40 | H70: 10.90 | I70: 16.05 | J70: 8.90 | K70: 11.10 | L70: 10.00 | M70: 15.00 | N70: 53.35 | O70: 0.0 | P70: 53.35
A71: Regiment | C71: 2 | D71: 2 | E71: 2 | F71: 2 | G71: 2 | H71: 2 | I71: 2 | J71: 2 | K71: 2 | L71: 2 | M71: 2 | N71: 2 | P71: 2
A72: DCI All Age World Class
A73: Reading | B73: 3 | C73: 15.50 | D73: 15.50 | E73: 31.00 | F73: 15.50 | G73: 14.10 | H73: 14.90 | I73: 22.25 | J73: 15.70 | K73: 16.20 | L73: 15.50 | M73: 23.70 | N73: 76.95 | O73: 0.0 | P73: 76.95
A74: Buccaneers | C74: 1 | D74: 1 | E74: 1 | F74: 1 | G74: 1 | H74: 1 | I74: 1 | J74: 1 | K74: 1 | L74: 2 | M74: 1 | N74: 1 | P74: 1
A75: Bushwackers | B75: 1 | C75: 14.80 | D75: 14.70 | E75: 29.50 | F75: 15.10 | G75: 13.80 | H75: 14.60 | I75: 21.75 | J75: 15.30 | K75: 15.50 | L75: 15.60 | M75: 23.20 | N75: 74.45 | O75: 0.0 | P75: 74.45
C76: 3 | D76: 3 | E76: 3 | F76: 2 | G76: 2 | H76: 2 | I76: 2 | J76: 2 | K76: 3 | L76: 1 | M76: 2 | N76: 2 | P76: 2
A77: Hawthorne | B77: 2 | C77: 15.20 | D77: 15.10 | E77: 30.30 | F77: 14.70 | G77: 13.60 | H77: 14.30 | I77: 21.30 | J77: 14.90 | K77: 15.80 | L77: 14.70 | M77: 22.70 | N77: 74.30 | O77: 0.0 | P77: 74.30
A78: Caballeros | C78: 2 | D78: 2 | E78: 2 | F78: 3 | G78: 3 | H78: 3 | I78: 3 | J78: 3 | K78: 2 | L78: 3 | M78: 3 | N78: 3 | P78: 3
A79: Connecticut | B79: 4 | C79: 13.70 | D79: 14.00 | E79: 27.70 | F79: 13.10 | G79: 13.00 | H79: 13.70 | I79: 19.90 | J79: 13.00 | K79: 14.50 | L79: 13.50 | M79: 20.50 | N79: 68.10 | O79: 0.0 | P79: 68.10
A80: Hurricnaes | C80: 4 | D80: 4 | E80: 4 | F80: 4 | G80: 4 | H80: 4 | I80: 4 | J80: 4 | K80: 4 | L80: 4 | M80: 4 | N80: 4 | P80: 4
A81: DCI All Age Open Class
A82: Fusion | B82: 1 | C82: 13.00 | D82: 13.40 | E82: 26.40 | F82: 13.40 | G82: 12.80 | H82: 13.40 | I82: 19.80 | J82: 13.50 | K82: 13.30 | L82: 13.40 | M82: 20.10 | N82: 66.30 | O82: 0.0 | P82: 66.30
A83: Core | C83: 1 | D83: 1 | E83: 1 | F83: 1 | G83: 1 | H83: 1 | I83: 1 | J83: 1 | K83: 1 | L83: 1 | M83: 1 | N83: 1 | P83: 1
A84: DCI All Age Class A
A85: Sunrisers | B85: 1 | C85: 13.30 | D85: 12.70 | E85: 26.00 | F85: 12.80 | G85: 12.70 | H85: 12.90 | I85: 19.20 | J85: 12.50 | K85: 13.10 | L85: 12.40 | M85: 19.00 | N85: 64.20 | O85: 0.0 | P85: 64.20
C86: 1 | D86: 1 | E86: 1 | F86: 1 | G86: 1 | H86: 1 | I86: 1 | J86: 1 | K86: 1 | L86: 1 | M86: 1 | N86: 1 | P86: 1
A89: 6/29/2024 Madison, Wisconsin
C90: General Effect | F90: Visual | J90: Music
C91: 1 | D91: 2 | F91: Proficiency | G91: Analysis | H91: Color Guard | J91: Brass | K91: Analysis | L91: Percussion | N91: Sub | P91: Total
C92: D. Torchia | D92: B. Dacy | E92: Total | F92: J. Orefice | G92: B. Kuhn | H92: T. Hundall | I92: Total ÷2 | J92: C. Armbruster | K92: C. Rapacki | L92: J. Davila | M92: Total ÷2 | N92: Total | O92: Pen | P92: Score
A93: DCI World Class | C93: 20 | D93: 20 | E93: 40 | F93: 20 | G93: 20 | H93: 20 | I93: 30 | J93: 20 | K93: 20 | L93: 20 | M93: 30 | N93: 100 | P93: 100
A94: Blue | B94: 1 | C94: 13.80 | D94: 13.40 | E94: 27.20 | F94: 13.80 | G94: 1.30 | H94: 13.70 | I94: 20.40 | J94: 13.70 | K94: 13.70 | L94: 13.40 | M94: 20.40 | N94: 68.00 | O94: 0.0 | P94: 68.00
A95: Stars | C95: 1 | D95: 3 | E95: 1 | F95: 1 | G95: 5 | H95: 1 | I95: 1 | J95: 2 | K95: 1 | L95: 2 | M95: 1 | N95: 1 | P95: 1
A96: Colts | B96: 2 | C96: 13.50 | D96: 13.60 | E96: 27.10 | F96: 13.50 | G96: 13.40 | H96: 13.50 | I96: 20.20 | J96: 13.80 | K96: 13.10 | L96: 13.70 | M96: 20.30 | N96: 67.60 | O96: 0.0 | P96: 67.60
C97: 2 | D97: 2 | E97: 2 | F97: 2 | G97: 1 | H97: 2 | I97: 2 | J97: 1 | K97: 2 | L97: 1 | M97: 2 | N97: 2 | P97: 2
A98: Madison | B98: 3 | C98: 13.20 | D98: 13.80 | E98: 27.00 | F98: 13.30 | G98: 12.80 | H98: 12.80 | I98: 19.45 | J98: 13.00 | K98: 12.60 | L98: 13.20 | M98: 19.40 | N98: 65.85 | O98: 0.0 | P98: 65.85
A99: Scouts | C99: 3 | D99: 1 | E99: 3 | F99: 3 | G99: 3 | H99: 3 | I99: 3 | J99: 3 | K99: 3 | L99: 3 | M99: 3 | N99: 3 | P99: 3
A100: DCI Open Class
A101: Colt | B101: 1 | C101: 10.50 | D101: 11.00 | E101: 21.50 | F101: 11.60 | G101: 10.90 | H101: 10.60 | I101: 16.55 | J101: 11.30 | K101: 10.90 | L101: 11.60 | M101: 16.90 | N101: 54.95 | O101: 0.0 | P101: 54.95
A102: Cadets | C102: 1 | D102: 1 | E102: 1 | F102: 1 | G102: 1 | H102: 1 | I102: 1 | J102: 1 | K102: 1 | L102: 1 | M102: 1 | N102: 1 | P102: 1
A103: DCI All Age Class A
A104: Govenaires | B104: 1 | C104: 13.50 | D104: 13.20 | E104: 26.70 | F104: 13.30 | G104: 13.10 | H104: 13.20 | I104: 19.80 | J104: 13.00 | K104: 13.00 | L104: 13.00 | M104: 19.50 | N104: 66.00 | O104: 0.0 | P104: 66.00
C105: 1 | D105: 1 | E105: 1 | F105: 1 | G105: 1 | H105: 1 | I105: 1 | J105: 1 | K105: 1 | L105: 1 | M105: 1 | N105: 1 | P105: 1
A108: 6/29/2024 Walnut, California
C109: General Effect | F109: Visual | J109: Music
C110: 1 | D110: 2 | F110: Proficiency | G110: Analysis | H110: Color Guard | J110: Brass | K110: Analysis | L110: Percussion | N110: Sub | P110: Total
C111: C. Costanza | D111: W. Dillon | E111: Total | F111: G. Llacer | G111: D. Padilla | H111: R. Solomon | I111: Total ÷2 | J111: B. Crisp | K111: C. Romanowski | L111: C. Rothe | M111: Total ÷2 | N111: Total | O111: Pen | P111: Score
A112: DCI World Class | C112: 20 | D112: 20 | E112: 40 | F112: 20 | G112: 20 | H112: 20 | I112: 30 | J112: 20 | K112: 20 | L112: 20 | M112: 30 | N112: 100 | P112: 100
A113: Blue | B113: 4 | C113: 15.40 | D113: 15.70 | E113: 31.10 | F113: 15.40 | G113: 15.30 | H113: 15.30 | I113: 23.00 | J113: 15.30 | K113: 15.30 | L113: 15.40 | M113: 23.00 | N113: 77.10 | O113: 0.0 | P113: 77.10
A114: Devils | C114: 1 | D114: 1 | E114: 1 | F114: 1 | G114: 1 | H114: 1 | I114: 1 | J114: 1 | K114: 1 | L114: 1 | M114: 1 | N114: 1 | P114: 1
A115: Vanguard | B115: 1 | C115: 14.10 | D115: 14.20 | E115: 28.30 | F115: 14.60 | G115: 14.70 | H115: 14.50 | I115: 21.90 | J115: 14.40 | K115: 14.60 | L115: 15.30 | M115: 22.15 | N115: 72.35 | O115: 0.0 | P115: 72.35
C116: 3 | D116: 2 | E116: 2 | F116: 2 | G116: 3 | H116: 3 | I116: 2 | J116: 3 | K116: 2 | L116: 2 | M116: 2 | N116: 2 | P116: 2
A117: Mandarins | B117: 2 | C117: 14.30 | D117: 13.70 | E117: 28.00 | F117: 14.30 | G117: 14.90 | H117: 14.60 | I117: 21.90 | J117: 14.60 | K117: 13.80 | L117: 14.30 | M117: 21.35 | N117: 71.25 | O117: 0.0 | P117: 71.25
C118: 2 | D118: 3 | E118: 3 | F118: 3 | G118: 2 | H118: 2 | I118: 2 | J118: 2 | K118: 3 | L118: 3 | M118: 3 | N118: 3 | P118: 3
A119: Pacific | B119: 3 | C119: 11.30 | D119: 12.40 | E119: 23.70 | F119: 13.00 | G119: 13.00 | H119: 12.70 | I119: 19.35 | J119: 12.80 | K119: 12.80 | L119: 13.70 | M119: 19.65 | N119: 62.70 | O119: 0.0 | P119: 62.70
A120: Crest | C120: 4 | D120: 4 | E120: 4 | F120: 4 | G120: 4 | H120: 4 | I120: 4 | J120: 4 | K120: 4 | L120: 4 | M120: 4 | N120: 4 | P120: 4
A121: DCI Open Class
A122: Blue | B122: 4 | C122: 13.00 | D122: 12.70 | E122: 25.70 | F122: 12.50 | G122: 12.70 | H122: 12.30 | I122: 18.75 | J122: 12.50 | K122: 13.00 | L122: 13.00 | M122: 19.25 | N122: 63.70 | O122: 0.0 | P122: 63.70
A123: Devils B | C123: 1 | D123: 1 | E123: 1 | F123: 1 | G123: 1 | H123: 1 | I123: 1 | J123: 1 | K123: 1 | L123: 1 | M123: 1 | N123: 1 | P123: 1
A124: Gold | B124: 5 | C124: 11.00 | D124: 12.50 | E124: 23.50 | F124: 11.80 | G124: 11.70 | H124: 11.70 | I124: 17.60 | J124: 12.10 | K124: 12.20 | L124: 12.40 | M124: 18.35 | N124: 59.45 | O124: 0.0 | P124: 59.45
C125: 2 | D125: 2 | E125: 2 | F125: 2 | G125: 2 | H125: 2 | I125: 2 | J125: 2 | K125: 2 | L125: 2 | M125: 2 | N125: 2 | P125: 2
A126: Vessel | B126: 2 | C126: 9.40 | D126: 9.80 | E126: 19.20 | F126: 10.00 | G126: 9.80 | H126: 10.00 | I126: 14.90 | J126: 9.80 | K126: 10.60 | L126: 11.40 | M126: 15.90 | N126: 50.00 | O126: 0.0 | P126: 50.00
C127: 3 | D127: 3 | E127: 3 | F127: 4 | G127: 4 | H127: 4 | I127: 4 | J127: 4 | K127: 3 | L127: 3 | M127: 3 | N127: 3 | P127: 3
A128: Impulse | B128: 1 | C128: 9.20 | D128: 9.30 | E128: 18.50 | F128: 10.30 | G128: 10.40 | H128: 10.50 | I128: 15.60 | J128: 10.60 | K128: 9.20 | L128: 10.30 | M128: 15.05 | N128: 49.15 | O128: 0.0 | P128: 49.15
C129: 4 | D129: 4 | E129: 4 | F129: 3 | G129: 3 | H129: 3 | I129: 3 | J129: 3 | K129: 4 | L129: 4 | M129: 4 | N129: 4 | P129: 4
A130: Blue | B130: 3 | C130: 8.90 | D130: 9.10 | E130: 18.00 | F130: 9.40 | G130: 9.10 | H130: 9.50 | I130: 14.00 | J130: 9.10 | K130: 9.00 | L130: 9.50 | M130: 13.80 | N130: 45.80 | O130: 0.0 | P130: 0.00
A131: Devils C | C131: 5 | D131: 5 | E131: 5 | F131: 5 | G131: 5 | H131: 5 | I131: 5 | J131: 5 | K131: 5 | L131: 5 | M131: 5 | N131: 5 | P131: 5
A134: 6/30/2024 Lisle, Illinois
C135: General Effect | F135: Visual | J135: Music
C136: 1 | D136: 2 | F136: Proficiency | G136: Analysis | H136: Color Guard | J136: Brass | K136: Analysis | L136: Percussion | N136: Sub | P136: Total
C137: B. Kuhn | D137: J. Kennedy | E137: Total | F137: J. Orefice | G137: D. Torchia | H137: T. Hudnall | I137: Total ÷2 | J137: B. Dacy | K137: K. Young | L137: B. Williams | M137: Total ÷2 | N137: Total | O137: Pen | P137: Score
A138: DCI World Class | C138: 20 | D138: 20 | E138: 40 | F138: 20 | G138: 20 | H138: 20 | I138: 30 | J138: 20 | K138: 20 | L138: 20 | M138: 30 | N138: 100 | P138: 100
A139: Carolina | B139: 6 | C139: 15.90 | D139: 15.60 | E139: 31.50 | F139: 15.60 | G139: 14.80 | H139: 15.20 | I139: 22.80 | J139: 15.00 | K139: 15.20 | L139: 15.40 | M139: 22.80 | N139: 77.10 | O139: 0.0 | P139: 77.10
A140: Crown | C140: 1 | D140: 1 | E140: 1 | F140: 1 | G140: 2 | H140: 2 | I140: 2 | J140: 1 | K140: 1 | L140: 2 | M140: 1 | N140: 1 | P140: 1
A141: Boston | B141: 5 | C141: 15.60 | D141: 15.30 | E141: 30.90 | F141: 15.40 | G141: 15.00 | H141: 15.60 | I141: 23.00 | J141: 14.70 | K141: 15.00 | L141: 15.70 | M141: 22.70 | N141: 76.60 | O141: 0.0 | P141: 76.60
A142: Crusaders | C142: 2 | D142: 2 | E142: 2 | F142: 2 | G142: 1 | H142: 1 | I142: 1 | J142: 2 | K142: 2 | L142: 1 | M142: 2 | N142: 2 | P142: 2
A143: Phantom | B143: 4 | C143: 15.00 | D143: 14.70 | E143: 29.70 | F143: 15.00 | G143: 14.50 | H143: 14.60 | I143: 22.05 | J143: 14.50 | K143: 14.60 | L143: 15.00 | M143: 22.05 | N143: 73.80 | O143: 0.0 | P143: 73.80
A144: Regiment | C144: 3 | D144: 3 | E144: 3 | F144: 3 | G144: 3 | H144: 3 | I144: 3 | J144: 3 | K144: 3 | L144: 3 | M144: 3 | N144: 3 | P144: 3
A145: Cavaliers | B145: 7 | C145: 14.60 | D145: 14.40 | E145: 29.00 | F145: 14.60 | G145: 13.60 | H145: 14.20 | I145: 21.20 | J145: 14.30 | K145: 14.10 | L145: 14.90 | M145: 21.65 | N145: 71.80 | O145: 0.0 | P145: 71.85
C146: 4 | D146: 5 | E146: 4 | F146: 4 | G146: 6 | H146: 6 | I146: 5 | J146: 4 | K146: 4 | L146: 4 | M146: 4 | N146: 4 | P146: 4
A147: Colts | B147: 3 | C147: 14.00 | D147: 14.50 | E147: 28.50 | F147: 14.10 | G147: 13.80 | H147: 14.30 | I147: 21.10 | J147: 14.00 | K147: 13.50 | L147: 14.70 | M147: 21.10 | N147: 70.70 | O147: 0.0 | P147: 70.70
C148: 6 | D148: 4 | E148: 5 | F148: 6 | G148: 5 | H148: 5 | I148: 6 | J148: 5 | K148: 6 | L148: 5 | M148: 5 | N148: 5 | P148: 5
A149: Blue | B149: 2 | C149: 14.10 | D149: 14.20 | E149: 28.30 | F149: 14.20 | G149: 14.00 | H149: 14.50 | I149: 21.35 | J149: 13.70 | K149: 13.70 | L149: 14.10 | M149: 20.75 | N149: 70.40 | O149: 0.0 | P149: 70.40
A150: Stars | C150: 5 | D150: 6 | E150: 6 | F150: 5 | G150: 4 | H150: 4 | I150: 4 | J150: 6 | K150: 5 | L150: 6 | M150: 6 | N150: 6 | P150: 6
A151: Madison | B151: 1 | C151: 13.50 | D151: 13.70 | E151: 27.20 | F151: 13.60 | G151: 13.30 | H151: 13.20 | I151: 20.05 | J151: 13.50 | K151: 13.20 | L151: 13.60 | M151: 20.15 | N151: 67.40 | O151: 0.0 | P151: 67.40
A152: Scouts | C152: 7 | D152: 7 | E152: 7 | F152: 7 | G152: 7 | H152: 7 | I152: 7 | J152: 7 | K152: 7 | L152: 7 | M152: 7 | N152: 7 | P152: 7
A153: DCI Open Class
A154: Colt | B154: 1 | C154: 10.80 | D154: 12.00 | E154: 22.80 | F154: 11.30 | G154: 11.70 | H154: 11.40 | I154: 17.20 | J154: 11.50 | K154: 11.20 | L154: 12.20 | M154: 17.45 | N154: 57.45 | O154: 0.0 | P154: 57.45
A155: Cadets | C155: 1 | D155: 1 | E155: 1 | F155: 1 | G155: 1 | H155: 1 | I155: 1 | J155: 1 | K155: 1 | L155: 1 | M155: 1 | N155: 1 | P155: 1
A158: 6/30/2024 San Bernardino, California
C159: General Effect | F159: Visual | J159: Music
C160: 1 | D160: 2 | F160: Proficiency | G160: Analysis | H160: Color Guard | J160: Brass | K160: Analysis | L160: Percussion | N160: Sub | P160: Total
C161: R. Solomon | D161: G. Fugett | E161: Total | F161: G. Llacers | G161: C. Nelson | H161: D. Padilla | I161: Total ÷2 | J161: W. Dillon | K161: B. Crisp | L161: C. Rothe | M161: Total ÷2 | N161: Total | O161: Pen | P161: Score
A162: DCI World Class | C162: 20 | D162: 20 | E162: 40 | F162: 20 | G162: 20 | H162: 20 | I162: 30 | J162: 20 | K162: 20 | L162: 20 | M162: 30 | N162: 100 | P162: 100
A163: Blue | B163: 4 | C163: 15.50 | D163: 15.10 | E163: 30.60 | F163: 15.50 | G163: 15.70 | H163: 15.40 | I163: 23.30 | J163: 15.80 | K163: 15.40 | L163: 15.60 | M163: 23.40 | N163: 77.30 | O163: 0.0 | P163: 77.30
A164: Devils | C164: 1 | D164: 1 | E164: 1 | F164: 1 | G164: 1 | H164: 1 | I164: 1 | J164: 1 | K164: 1 | L164: 1 | M164: 1 | N164: 1 | P164: 1
A165: Vanguard | B165: 1 | C165: 14.70 | D165: 14.30 | E165: 29.00 | F165: 14.70 | G165: 14.80 | H165: 14.80 | I165: 22.15 | J165: 14.60 | K165: 14.70 | L165: 15.50 | M165: 22.40 | N165: 73.55 | O165: 0.0 | P165: 73.55
C166: 3 | D166: 3 | E166: 3 | F166: 2 | G166: 3 | H166: 2 | I166: 2 | J166: 2 | K166: 2 | L166: 2 | M166: 2 | N166: 2 | P166: 2
A167: Mandarins | B167: 3 | C167: 14.80 | D167: 14.40 | E167: 29.20 | F167: 14.60 | G167: 15.10 | H167: 14.60 | I167: 22.15 | J167: 14.30 | K167: 14.40 | L167: 14.50 | M167: 21.60 | N167: 72.95 | O167: 0.0 | P167: 72.95
C168: 2 | D168: 2 | E168: 2 | F168: 3 | G168: 2 | H168: 3 | I168: 2 | J168: 3 | K168: 3 | L168: 3 | M168: 3 | N168: 3 | P168: 3
A169: Pacific | B169: 2 | C169: 12.70 | D169: 12.20 | E169: 24.90 | F169: 13.20 | G169: 12.70 | H169: 12.90 | I169: 19.40 | J169: 13.10 | K169: 12.60 | L169: 13.70 | M169: 19.70 | N169: 64.00 | O169: 0.0 | P169: 64.00
A170: Crest | C170: 4 | D170: 4 | E170: 4 | F170: 4 | G170: 4 | H170: 4 | I170: 4 | J170: 4 | K170: 4 | L170: 4 | M170: 4 | N170: 4 | P170: 4
A171: DCI Open Class
A172: Blue | B172: 4 | C172: 12.60 | D172: 12.70 | E172: 25.30 | F172: 12.90 | G172: 13.00 | H172: 12.50 | I172: 19.20 | J172: 12.60 | K172: 13.20 | L172: 12.90 | M172: 19.35 | N172: 63.85 | O172: 0.0 | P172: 63.85
A173: Devils B | C173: 1 | D173: 1 | E173: 1 | F173: 1 | G173: 1 | H173: 1 | I173: 1 | J173: 1 | K173: 1 | L173: 1 | M173: 1 | N173: 1 | P173: 1
A174: Gold | B174: 5 | C174: 11.90 | D174: 11.90 | E174: 23.80 | F174: 11.90 | G174: 11.90 | H174: 12.00 | I174: 17.90 | J174: 12.40 | K174: 12.20 | L174: 12.50 | M174: 18.55 | N174: 60.25 | O174: 0.0 | P174: 60.25
C175: 2 | D175: 2 | E175: 2 | F175: 2 | G175: 2 | H175: 2 | I175: 2 | J175: 2 | K175: 2 | L175: 2 | M175: 2 | N175: 2 | P175: 2
A176: Impulse | B176: 2 | C176: 10.60 | D176: 9.80 | E176: 20.40 | F176: 10.60 | G176: 10.20 | H176: 10.90 | I176: 15.85 | J176: 10.30 | K176: 9.50 | L176: 10.20 | M176: 15.00 | N176: 51.25 | O176: 0.0 | P176: 51.25
C177: 3 | D177: 4 | E177: 3 | F177: 3 | G177: 3 | H177: 3 | I177: 3 | J177: 3 | K177: 4 | L177: 4 | M177: 4 | N177: 3 | P177: 3
A178: Vessel | B178: 1 | C178: 10.10 | D178: 10.20 | E178: 20.30 | F178: 10.40 | G178: 9.90 | H178: 10.10 | I178: 15.20 | J178: 9.50 | K178: 10.30 | L178: 11.30 | M178: 15.55 | N178: 51.05 | O178: 0.0 | P178: 51.05
C179: 4 | D179: 3 | E179: 4 | F179: 4 | G179: 4 | H179: 4 | I179: 4 | J179: 4 | K179: 3 | L179: 3 | M179: 3 | N179: 4 | P179: 4
A180: Blue | B180: 3 | C180: 9.30 | D180: 9.20 | E180: 18.50 | F180: 9.60 | G180: 9.30 | H180: 9.70 | I180: 14.30 | J180: 9.20 | K180: 9.00 | L180: 9.60 | M180: 13.90 | N180: 46.70 | O180: 0.0 | P180: 46.70
A181: Devils C | C181: 5 | D181: 5 | E181: 5 | F181: 5 | G181: 5 | H181: 5 | I181: 5 | J181: 5 | K181: 5 | L181: 5 | M181: 5 | N181: 5 | P181: 5